record_id,keyword,category,question,question_type,difficulty_level,answer_outline,tags,estimated_read_time,target_audience,related_topics,question_length,word_count,created_date,language,source_template,engagement_score,complexity_score,popularity_score
34300957,brand management,marketing,How do you develop an effective brand management strategy?,optimization,Expert,"[""Overview of brand management"", ""Step-by-step implementation"", ""Best practices and tips"", ""Common challenges and solutions"", ""Tools and resources needed"", ""Conclusion and next steps""]","[""digital"", ""marketing"", ""management"", ""advertising"", ""optimization"", ""brand""]",6,Marketing Directors & CMOs,"[""content marketing"", ""social media"", ""digital marketing""]",58,9,2025-10-25 21:44:28,en,How do you develop an effective {keyword} strategy?,0.79,1.0,0.74
34300958,content marketing,marketing,How do you track and analyze content marketing performance?,optimization,Beginner,"[""Overview of content marketing"", ""Step-by-step implementation"", ""Best practices and tips"", ""Common challenges and solutions"", ""Tools and resources needed"", ""Conclusion and next steps""]","[""content"", ""promotion"", ""marketing"", ""branding"", ""optimization""]",6,Marketing Students & Interns,"[""social media"", ""brand management"", ""digital marketing""]",59,9,2025-10-25 21:44:28,en,How do you track and analyze {keyword} performance?,0.76,0.4981078870603115,0.66
34300959,data science,it,What design patterns work best with data science?,analysis,Beginner,"[""Introduction to data science"", ""Key points and analysis"", ""Practical examples"", ""Expert insights"", ""Action items"", ""Conclusion""]","[""software"", ""analysis"", ""it"", ""programming"", ""science"", ""data""]",4,Students & Entry-level Developers,"[""machine learning"", ""cybersecurity"", ""web development"", ""cloud computing""]",49,8,2025-10-25 21:44:28,en,What design patterns work best with {keyword}?,0.93,0.4045511829418743,0.88
34300960,social media,marketing,What KPIs are most important for social media?,troubleshooting,Expert,"[""Introduction to social media"", ""Key points and analysis"", ""Practical examples"", ""Expert insights"", ""Action items"", ""Conclusion""]","[""media"", ""troubleshooting"", ""marketing"", ""digital"", ""social"", ""advertising""]",4,Marketing Directors & CMOs,"[""digital marketing"", ""content marketing"", ""brand management""]",46,8,2025-10-25 21:44:28,en,What KPIs are most important for {keyword}?,0.83,1.0,0.37
34300961,portfolio management,economics,How do you analyze market trends in portfolio management?,comparison,Advanced,"[""Overview of portfolio management"", ""Step-by-step implementation"", ""Best practices and tips"", ""Common challenges and solutions"", ""Tools and resources needed"", ""Conclusion and next steps""]","[""finance"", ""portfolio"", ""comparison"", ""management"", ""business"", ""economics""]",6,Professional Investors & Advisors,"[""investment planning"", ""financial modeling"", ""market analysis""]",57,9,2025-10-25 21:44:28,en,How do you analyze market trends in {keyword}?,0.87,0.9600150638019,0.86
34300962,social media,marketing,How do you personalize social media for different segments?,optimization,Advanced,"[""Overview of social media"", ""Step-by-step implementation"", ""Best practices and tips"", ""Common challenges and solutions"", ""Tools and resources needed"", ""Conclusion and next steps""]","[""media"", ""marketing"", ""digital"", ""social"", ""advertising"", ""optimization""]",6,Marketing Managers & Strategists,"[""digital marketing"", ""brand management"", ""content marketing""]",59,9,2025-10-25 21:44:28,en,How do you personalize {keyword} for different segments?,0.83,0.9065087386471525,0.59
34300963,portfolio management,economics,What indicators predict portfolio management market movements?,analysis,Expert,"[""Introduction to portfolio management"", ""Key points and analysis"", ""Practical examples"", ""Expert insights"", ""Action items"", ""Conclusion""]","[""finance"", ""analysis"", ""portfolio"", ""management"", ""market"", ""economics""]",4,Portfolio Managers & Financial Experts,"[""market analysis"", ""investment planning"", ""financial modeling""]",62,7,2025-10-25 21:44:28,en,What indicators predict {keyword} market movements?,0.91,1.0,0.68
34300964,content marketing,marketing,How do you track and analyze content marketing performance?,evaluation,Advanced,"[""Overview of content marketing"", ""Step-by-step implementation"", ""Best practices and tips"", ""Common challenges and solutions"", ""Tools and resources needed"", ""Conclusion and next steps""]","[""content"", ""promotion"", ""marketing"", ""advertising"", ""evaluation""]",6,Marketing Managers & Strategists,"[""digital marketing"", ""brand management"", ""social media""]",59,9,2025-10-25 21:44:28,en,How do you track and analyze {keyword} performance?,0.69,0.9789031930931471,0.78
34300965,market analysis,economics,How do you adjust your market analysis strategy during volatility?,best_practice,Intermediate,"[""Overview of market analysis"", ""Step-by-step implementation"", ""Best practices and tips"", ""Common challenges and solutions"", ""Tools and resources needed"", ""Conclusion and next steps""]","[""investment"", ""analysis"", ""best_practice"", ""market"", ""business"", ""economics""]",6,Individual Investors & Analysts,"[""portfolio management"", ""financial modeling"", ""investment planning""]",66,10,2025-10-25 21:44:28,en,How do you adjust your {keyword} strategy during volatility?,0.69,0.6502037177583226,0.39
34300966,market analysis,economics,How do you benchmark market analysis against alternatives?,troubleshooting,Intermediate,"[""Overview of market analysis"", ""Step-by-step implementation"", ""Best practices and tips"", ""Common challenges and solutions"", ""Tools and resources needed"", ""Conclusion and next steps""]","[""investment"", ""finance"", ""analysis"", ""troubleshooting"", ""market"", ""economics""]",6,Individual Investors & Analysts,"[""portfolio management"", ""financial modeling"", ""investment planning""]",58,8,2025-10-25 21:44:28,en,How do you benchmark {keyword} against alternatives?,0.92,0.6265617189664028,0.37
34300967,portfolio management,economics,What tools help analyze portfolio management data?,implementation,Expert,"[""Introduction to portfolio management"", ""Key points and analysis"", ""Practical examples"", ""Expert insights"", ""Action items"", ""Conclusion""]","[""implementation"", ""portfolio"", ""management"", ""market"", ""business"", ""economics""]",4,Portfolio Managers & Financial Experts,"[""investment planning"", ""market analysis"", ""financial modeling""]",50,7,2025-10-25 21:44:28,en,What tools help analyze {keyword} data?,0.73,1.0,0.34
34300968,portfolio management,economics,How do economic conditions affect portfolio management performance?,troubleshooting,Advanced,"[""Introduction to portfolio management"", ""Key points and analysis"", ""Practical examples"", ""Expert insights"", ""Action items"", ""Conclusion""]","[""investment"", ""portfolio"", ""troubleshooting"", ""management"", ""business"", ""economics""]",4,Professional Investors & Advisors,"[""investment planning"", ""market analysis"", ""financial modeling""]",67,8,2025-10-25 21:44:28,en,How do economic conditions affect {keyword} performance?,0.91,0.8281031822895818,0.44
34300969,financial modeling,economics,How do you measure financial modeling performance?,evaluation,Beginner,"[""Overview of financial modeling"", ""Step-by-step implementation"", ""Best practices and tips"", ""Common challenges and solutions"", ""Tools and resources needed"", ""Conclusion and next steps""]","[""finance"", ""modeling"", ""financial"", ""evaluation"", ""business"", ""economics""]",6,Students & New Investors,"[""market analysis"", ""investment planning"", ""portfolio management""]",50,7,2025-10-25 21:44:28,en,How do you measure {keyword} performance?,0.83,0.46044175999184966,0.66
34300970,machine learning,it,What are the best practices for machine learning development?,optimization,Advanced,"[""Introduction to machine learning"", ""Key concepts and definitions"", ""Main categories or types"", ""Examples and case studies"", ""Benefits and advantages"", ""Summary and recommendations""]","[""development"", ""it"", ""programming"", ""learning"", ""optimization"", ""machine""]",6,Senior Developers & Tech Leads,"[""cybersecurity"", ""cloud computing"", ""data science"", ""web development""]",61,9,2025-10-25 21:44:28,en,What are the best practices for {keyword} development?,0.76,0.8757791277576735,0.38
34300971,data science,it,How do you design a scalable data science solution?,implementation,Beginner,"[""Overview of data science"", ""Step-by-step implementation"", ""Best practices and tips"", ""Common challenges and solutions"", ""Tools and resources needed"", ""Conclusion and next steps""]","[""technology"", ""software"", ""it"", ""implementation"", ""science"", ""data""]",6,Students & Entry-level Developers,"[""cybersecurity"", ""cloud computing"", ""web development"", ""machine learning""]",51,9,2025-10-25 21:44:28,en,How do you design a scalable {keyword} solution?,0.81,0.4347522358435109,0.69
34300972,portfolio management,economics,How do you measure portfolio management performance?,implementation,Beginner,"[""Overview of portfolio management"", ""Step-by-step implementation"", ""Best practices and tips"", ""Common challenges and solutions"", ""Tools and resources needed"", ""Conclusion and next steps""]","[""implementation"", ""portfolio"", ""management"", ""market"", ""business"", ""economics""]",6,Students & New Investors,"[""market analysis"", ""investment planning"", ""financial modeling""]",52,7,2025-10-25 21:44:28,en,How do you measure {keyword} performance?,0.76,0.4086169966037242,0.51
34300973,digital marketing,marketing,How do you personalize digital marketing for different segments?,strategy,Expert,"[""Overview of digital marketing"", ""Step-by-step implementation"", ""Best practices and tips"", ""Common challenges and solutions"", ""Tools and resources needed"", ""Conclusion and next steps""]","[""marketing"", ""strategy"", ""promotion"", ""digital""]",6,Marketing Directors & CMOs,"[""brand management"", ""content marketing"", ""social media""]",64,9,2025-10-25 21:44:28,en,How do you personalize {keyword} for different segments?,0.76,1.0,0.74
34300974,brand management,marketing,What emerging platforms support brand management?,implementation,Intermediate,"[""Introduction to brand management"", ""Key points and analysis"", ""Practical examples"", ""Expert insights"", ""Action items"", ""Conclusion""]","[""implementation"", ""marketing"", ""digital"", ""management"", ""branding"", ""brand""]",4,Marketing Coordinators & Specialists,"[""social media"", ""content marketing"", ""digital marketing""]",49,6,2025-10-25 21:44:28,en,What emerging platforms support {keyword}?,0.78,0.6205291422375678,0.54
34300975,machine learning,it,What design patterns work best with machine learning?,comparison,Intermediate,"[""Introduction to machine learning"", ""Key points and analysis"", ""Practical examples"", ""Expert insights"", ""Action items"", ""Conclusion""]","[""software"", ""it"", ""comparison"", ""programming"", ""learning"", ""machine""]",4,Junior to Mid-level Developers,"[""data science"", ""web development"", ""cybersecurity"", ""cloud computing""]",53,8,2025-10-25 21:44:28,en,What design patterns work best with {keyword}?,0.89,0.638421504605546,0.35
34300976,cloud computing,it,How can cloud computing improve system performance and scalability?,planning,Advanced,"[""Introduction to cloud computing"", ""Key points and analysis"", ""Practical examples"", ""Expert insights"", ""Action items"", ""Conclusion""]","[""computing"", ""planning"", ""development"", ""it"", ""software"", ""cloud""]",4,Senior Developers & Tech Leads,"[""data science"", ""machine learning"", ""cybersecurity"", ""web development""]",67,9,2025-10-25 21:44:28,en,How can {keyword} improve system performance and scalability?,0.62,0.8881965766593082,0.59
34300977,investment planning,economics,How do you hedge against investment planning market downturns?,planning,Expert,"[""Overview of investment planning"", ""Step-by-step implementation"", ""Best practices and tips"", ""Common challenges and solutions"", ""Tools and resources needed"", ""Conclusion and next steps""]","[""investment"", ""planning"", ""finance"", ""market"", ""economics""]",6,Portfolio Managers & Financial Experts,"[""financial modeling"", ""portfolio management"", ""market analysis""]",62,9,2025-10-25 21:44:28,en,How do you hedge against {keyword} market downturns?,0.79,1.0,0.58
34300978,market analysis,economics,What tools help analyze market analysis data?,optimization,Expert,"[""Introduction to market analysis"", ""Key points and analysis"", ""Practical examples"", ""Expert insights"", ""Action items"", ""Conclusion""]","[""investment"", ""analysis"", ""business"", ""market"", ""optimization"", ""economics""]",4,Portfolio Managers & Financial Experts,"[""financial modeling"", ""investment planning"", ""portfolio management""]",45,7,2025-10-25 21:44:28,en,What tools help analyze {keyword} data?,0.88,1.0,0.83
34300979,data science,it,What ROI can be expected from data science implementation?,evaluation,Intermediate,"[""Introduction to data science"", ""Key points and analysis"", ""Practical examples"", ""Expert insights"", ""Action items"", ""Conclusion""]","[""software"", ""it"", ""programming"", ""science"", ""evaluation"", ""data""]",4,Junior to Mid-level Developers,"[""cloud computing"", ""cybersecurity"", ""web development"", ""machine learning""]",58,9,2025-10-25 21:44:28,en,What ROI can be expected from {keyword} implementation?,0.74,0.6237201026687358,0.63
34300980,data science,it,How do you choose the right technology stack for data science?,implementation,Advanced,"[""Overview of data science"", ""Step-by-step implementation"", ""Best practices and tips"", ""Common challenges and solutions"", ""Tools and resources needed"", ""Conclusion and next steps""]","[""technology"", ""development"", ""it"", ""implementation"", ""science"", ""data""]",6,Senior Developers & Tech Leads,"[""cybersecurity"", ""machine learning"", ""web development"", ""cloud computing""]",62,11,2025-10-25 21:44:28,en,How do you choose the right technology stack for {keyword}?,0.82,0.8861252381258443,0.62
34300981,cybersecurity,it,How do you convince stakeholders to invest in cybersecurity?,comparison,Intermediate,"[""Overview of cybersecurity"", ""Step-by-step implementation"", ""Best practices and tips"", ""Common challenges and solutions"", ""Tools and resources needed"", ""Conclusion and next steps""]","[""development"", ""it"", ""comparison"", ""cybersecurity"", ""technology""]",5,Junior to Mid-level Developers,"[""machine learning"", ""data science"", ""cloud computing"", ""web development""]",60,9,2025-10-25 21:44:28,en,How do you convince stakeholders to invest in {keyword}?,0.94,0.6575603155083137,0.84
34300982,data science,it,What design patterns work best with data science?,strategy,Expert,"[""Introduction to data science"", ""Key points and analysis"", ""Practical examples"", ""Expert insights"", ""Action items"", ""Conclusion""]","[""technology"", ""software"", ""it"", ""science"", ""strategy"", ""data""]",4,Architects & Technical Directors,"[""web development"", ""machine learning"", ""cloud computing"", ""cybersecurity""]",49,8,2025-10-25 21:44:28,en,What design patterns work best with {keyword}?,0.74,1.0,0.48
34300983,digital marketing,marketing,How do you reach new customers through digital marketing?,implementation,Beginner,"[""Overview of digital marketing"", ""Step-by-step implementation"", ""Best practices and tips"", ""Common challenges and solutions"", ""Tools and resources needed"", ""Conclusion and next steps""]","[""implementation"", ""marketing"", ""branding"", ""digital""]",6,Marketing Students & Interns,"[""social media"", ""brand management"", ""content marketing""]",57,9,2025-10-25 21:44:28,en,How do you reach new customers through {keyword}?,0.79,0.33937172731297716,0.67
34300984,digital marketing,marketing,How do you innovate within digital marketing?,strategy,Expert,"[""Overview of digital marketing"", ""Step-by-step implementation"", ""Best practices and tips"", ""Common challenges and solutions"", ""Tools and resources needed"", ""Conclusion and next steps""]","[""marketing"", ""strategy"", ""advertising"", ""digital""]",6,Marketing Directors & CMOs,"[""brand management"", ""social media"", ""content marketing""]",45,7,2025-10-25 21:44:28,en,How do you innovate within {keyword}?,0.61,1.0,0.39
34300985,data science,it,What certifications are valuable for data science professionals?,how_to,Advanced,"[""Introduction to data science"", ""Key points and analysis"", ""Practical examples"", ""Expert insights"", ""Action items"", ""Conclusion""]","[""how_to"", ""development"", ""it"", ""programming"", ""science"", ""data""]",4,Senior Developers & Tech Leads,"[""web development"", ""machine learning"", ""cloud computing"", ""cybersecurity""]",64,8,2025-10-25 21:44:28,en,What certifications are valuable for {keyword} professionals?,0.77,0.9825881943257538,0.51
34300986,financial modeling,economics,How do you report on financial modeling performance to stakeholders?,best_practice,Beginner,"[""Overview of financial modeling"", ""Step-by-step implementation"", ""Best practices and tips"", ""Common challenges and solutions"", ""Tools and resources needed"", ""Conclusion and next steps""]","[""finance"", ""best_practice"", ""modeling"", ""financial"", ""market"", ""economics""]",6,Students & New Investors,"[""portfolio management"", ""investment planning"", ""market analysis""]",68,10,2025-10-25 21:44:28,en,How do you report on {keyword} performance to stakeholders?,0.92,0.38221075323475046,0.6
34300987,financial modeling,economics,How do you analyze market trends in financial modeling?,analysis,Advanced,"[""Overview of financial modeling"", ""Step-by-step implementation"", ""Best practices and tips"", ""Common challenges and solutions"", ""Tools and resources needed"", ""Conclusion and next steps""]","[""investment"", ""analysis"", ""modeling"", ""financial"", ""business"", ""economics""]",6,Professional Investors & Advisors,"[""portfolio management"", ""investment planning"", ""market analysis""]",55,9,2025-10-25 21:44:28,en,How do you analyze market trends in {keyword}?,0.92,0.8905761064791218,0.54
34300988,web development,it,How do you integrate web development with existing systems?,planning,Expert,"[""Overview of web development"", ""Step-by-step implementation"", ""Best practices and tips"", ""Common challenges and solutions"", ""Tools and resources needed"", ""Conclusion and next steps""]","[""planning"", ""development"", ""it"", ""software"", ""programming"", ""web""]",6,Architects & Technical Directors,"[""machine learning"", ""cybersecurity"", ""cloud computing"", ""data science""]",59,9,2025-10-25 21:44:28,en,How do you integrate {keyword} with existing systems?,0.94,1.0,0.6
34300989,brand management,marketing,What content types work best for brand management?,strategy,Intermediate,"[""Introduction to brand management"", ""Key points and analysis"", ""Practical examples"", ""Expert insights"", ""Action items"", ""Conclusion""]","[""promotion"", ""marketing"", ""management"", ""advertising"", ""strategy"", ""brand""]",4,Marketing Coordinators & Specialists,"[""social media"", ""content marketing"", ""digital marketing""]",50,8,2025-10-25 21:44:28,en,What content types work best for {keyword}?,0.85,0.7754007248768805,0.57
34300990,brand management,marketing,How do you optimize brand management for mobile users?,how_to,Advanced,"[""Overview of brand management"", ""Step-by-step implementation"", ""Best practices and tips"", ""Common challenges and solutions"", ""Tools and resources needed"", ""Conclusion and next steps""]","[""how_to"", ""digital"", ""marketing"", ""management"", ""branding"", ""brand""]",6,Marketing Managers & Strategists,"[""digital marketing"", ""content marketing"", ""social media""]",54,9,2025-10-25 21:44:28,en,How do you optimize {keyword} for mobile users?,0.87,0.906706629518721,0.5
34300991,cloud computing,it,How do you design a scalable cloud computing solution?,analysis,Intermediate,"[""Overview of cloud computing"", ""Step-by-step implementation"", ""Best practices and tips"", ""Common challenges and solutions"", ""Tools and resources needed"", ""Conclusion and next steps""]","[""computing"", ""software"", ""analysis"", ""it"", ""cloud"", ""technology""]",6,Junior to Mid-level Developers,"[""cybersecurity"", ""data science"", ""web development"", ""machine learning""]",54,9,2025-10-25 21:44:28,en,How do you design a scalable {keyword} solution?,0.85,0.6888455172684195,0.45
34300992,cybersecurity,it,Which frameworks support cybersecurity implementation?,optimization,Advanced,"[""Introduction to cybersecurity"", ""Key points and analysis"", ""Practical examples"", ""Expert insights"", ""Action items"", ""Conclusion""]","[""software"", ""it"", ""programming"", ""optimization"", ""cybersecurity""]",4,Senior Developers & Tech Leads,"[""data science"", ""cloud computing"", ""machine learning"", ""web development""]",54,5,2025-10-25 21:44:28,en,Which frameworks support {keyword} implementation?,0.69,0.8903111969356947,0.74
34300993,brand management,marketing,How do you identify the right audience for brand management?,troubleshooting,Beginner,"[""Overview of brand management"", ""Step-by-step implementation"", ""Best practices and tips"", ""Common challenges and solutions"", ""Tools and resources needed"", ""Conclusion and next steps""]","[""troubleshooting"", ""digital"", ""marketing"", ""management"", ""advertising"", ""brand""]",6,Marketing Students & Interns,"[""digital marketing"", ""content marketing"", ""social media""]",60,10,2025-10-25 21:44:28,en,How do you identify the right audience for {keyword}?,0.65,0.48007553959836957,0.77
34300994,investment planning,economics,What are the regulatory considerations for investment planning?,optimization,Expert,"[""Introduction to investment planning"", ""Key concepts and definitions"", ""Main categories or types"", ""Examples and case studies"", ""Benefits and advantages"", ""Summary and recommendations""]","[""investment"", ""planning"", ""finance"", ""business"", ""optimization"", ""economics""]",6,Portfolio Managers & Financial Experts,"[""financial modeling"", ""market analysis"", ""portfolio management""]",63,8,2025-10-25 21:44:28,en,What are the regulatory considerations for {keyword}?,0.83,1.0,0.4
34300995,market analysis,economics,What metrics are most important for market analysis?,comparison,Beginner,"[""Introduction to market analysis"", ""Key points and analysis"", ""Practical examples"", ""Expert insights"", ""Action items"", ""Conclusion""]","[""investment"", ""analysis"", ""comparison"", ""market"", ""business"", ""economics""]",4,Students & New Investors,"[""portfolio management"", ""financial modeling"", ""investment planning""]",52,8,2025-10-25 21:44:28,en,What metrics are most important for {keyword}?,0.82,0.39938045872588024,0.47
34300996,investment planning,economics,What metrics are most important for investment planning?,troubleshooting,Advanced,"[""Introduction to investment planning"", ""Key points and analysis"", ""Practical examples"", ""Expert insights"", ""Action items"", ""Conclusion""]","[""investment"", ""planning"", ""troubleshooting"", ""business"", ""economics""]",4,Professional Investors & Advisors,"[""market analysis"", ""financial modeling"", ""portfolio management""]",56,8,2025-10-25 21:44:28,en,What metrics are most important for {keyword}?,0.75,0.9460348364522603,0.66
34300997,cybersecurity,it,What are the best practices for cybersecurity development?,implementation,Beginner,"[""Introduction to cybersecurity"", ""Key concepts and definitions"", ""Main categories or types"", ""Examples and case studies"", ""Benefits and advantages"", ""Summary and recommendations""]","[""software"", ""development"", ""it"", ""implementation"", ""cybersecurity""]",5,Students & Entry-level Developers,"[""machine learning"", ""data science"", ""cloud computing"", ""web development""]",58,8,2025-10-25 21:44:28,en,What are the best practices for {keyword} development?,0.66,0.4490023284843608,0.54
34300998,cybersecurity,it,What are the cost considerations for cybersecurity?,planning,Expert,"[""Introduction to cybersecurity"", ""Key concepts and definitions"", ""Main categories or types"", ""Examples and case studies"", ""Benefits and advantages"", ""Summary and recommendations""]","[""software"", ""planning"", ""it"", ""programming"", ""cybersecurity""]",5,Architects & Technical Directors,"[""web development"", ""machine learning"", ""data science"", ""cloud computing""]",51,7,2025-10-25 21:44:28,en,What are the cost considerations for {keyword}?,0.64,1.0,0.51
34300999,machine learning,it,What security considerations should be taken when using machine learning?,planning,Advanced,"[""Introduction to machine learning"", ""Key points and analysis"", ""Practical examples"", ""Expert insights"", ""Action items"", ""Conclusion""]","[""software"", ""planning"", ""it"", ""learning"", ""machine"", ""technology""]",4,Senior Developers & Tech Leads,"[""cybersecurity"", ""web development"", ""data science"", ""cloud computing""]",73,10,2025-10-25 21:44:28,en,What security considerations should be taken when using {keyword}?,0.89,0.9406977117116138,0.32
