record_id,keyword,category,question,question_type,difficulty_level,answer_outline,tags,estimated_read_time,target_audience,related_topics,question_length,word_count,created_date,language,source_template,engagement_score,complexity_score,popularity_score
34700350,financial modeling,economics,How do economic conditions affect financial modeling performance?,implementation,Expert,"[""Introduction to financial modeling"", ""Key points and analysis"", ""Practical examples"", ""Expert insights"", ""Action items"", ""Conclusion""]","[""investment"", ""implementation"", ""modeling"", ""financial"", ""market"", ""economics""]",4,Portfolio Managers & Financial Experts,"[""investment planning"", ""portfolio management"", ""market analysis""]",65,8,2025-10-25 21:45:02,en,How do economic conditions affect {keyword} performance?,0.81,1.0,0.83
34700351,social media,marketing,What emerging platforms support social media?,troubleshooting,Expert,"[""Introduction to social media"", ""Key points and analysis"", ""Practical examples"", ""Expert insights"", ""Action items"", ""Conclusion""]","[""media"", ""troubleshooting"", ""digital"", ""marketing"", ""social"", ""advertising""]",4,Marketing Directors & CMOs,"[""digital marketing"", ""content marketing"", ""brand management""]",45,6,2025-10-25 21:45:02,en,What emerging platforms support {keyword}?,0.84,1.0,0.43
34700352,portfolio management,economics,How do you measure portfolio management performance?,comparison,Expert,"[""Overview of portfolio management"", ""Step-by-step implementation"", ""Best practices and tips"", ""Common challenges and solutions"", ""Tools and resources needed"", ""Conclusion and next steps""]","[""finance"", ""portfolio"", ""comparison"", ""management"", ""market"", ""economics""]",6,Portfolio Managers & Financial Experts,"[""investment planning"", ""market analysis"", ""financial modeling""]",52,7,2025-10-25 21:45:02,en,How do you measure {keyword} performance?,0.95,1.0,0.48
34700353,cloud computing,it,How do you convince stakeholders to invest in cloud computing?,comparison,Intermediate,"[""Overview of cloud computing"", ""Step-by-step implementation"", ""Best practices and tips"", ""Common challenges and solutions"", ""Tools and resources needed"", ""Conclusion and next steps""]","[""computing"", ""development"", ""it"", ""comparison"", ""programming"", ""cloud""]",6,Junior to Mid-level Developers,"[""data science"", ""machine learning"", ""web development"", ""cybersecurity""]",62,10,2025-10-25 21:45:02,en,How do you convince stakeholders to invest in {keyword}?,0.63,0.6910592899825044,0.77
34700354,social media,marketing,What budget should be allocated to social media?,how_to,Intermediate,"[""Introduction to social media"", ""Key points and analysis"", ""Practical examples"", ""Expert insights"", ""Action items"", ""Conclusion""]","[""how_to"", ""media"", ""promotion"", ""digital"", ""marketing"", ""social""]",4,Marketing Coordinators & Specialists,"[""digital marketing"", ""content marketing"", ""brand management""]",48,8,2025-10-25 21:45:02,en,What budget should be allocated to {keyword}?,0.65,0.6194540109039445,0.65
34700355,web development,it,How do you design a scalable web development solution?,troubleshooting,Expert,"[""Overview of web development"", ""Step-by-step implementation"", ""Best practices and tips"", ""Common challenges and solutions"", ""Tools and resources needed"", ""Conclusion and next steps""]","[""technology"", ""development"", ""it"", ""programming"", ""troubleshooting"", ""web""]",6,Architects & Technical Directors,"[""data science"", ""machine learning"", ""cloud computing"", ""cybersecurity""]",54,9,2025-10-25 21:45:02,en,How do you design a scalable {keyword} solution?,0.77,1.0,0.41
34700356,machine learning,it,What security considerations should be taken when using machine learning?,analysis,Beginner,"[""Introduction to machine learning"", ""Key points and analysis"", ""Practical examples"", ""Expert insights"", ""Action items"", ""Conclusion""]","[""analysis"", ""it"", ""development"", ""learning"", ""machine"", ""technology""]",4,Students & Entry-level Developers,"[""cybersecurity"", ""data science"", ""cloud computing"", ""web development""]",73,10,2025-10-25 21:45:02,en,What security considerations should be taken when using {keyword}?,0.69,0.35677165008831624,0.67
34700357,market analysis,economics,How do you assess and manage market analysis risks?,how_to,Advanced,"[""Overview of market analysis"", ""Step-by-step implementation"", ""Best practices and tips"", ""Common challenges and solutions"", ""Tools and resources needed"", ""Conclusion and next steps""]","[""how_to"", ""analysis"", ""market"", ""business"", ""economics""]",6,Professional Investors & Advisors,"[""portfolio management"", ""investment planning"", ""financial modeling""]",51,9,2025-10-25 21:45:02,en,How do you assess and manage {keyword} risks?,0.89,0.824446593168335,0.31
34700358,content marketing,marketing,How do you identify the right audience for content marketing?,strategy,Expert,"[""Overview of content marketing"", ""Step-by-step implementation"", ""Best practices and tips"", ""Common challenges and solutions"", ""Tools and resources needed"", ""Conclusion and next steps""]","[""content"", ""marketing"", ""advertising"", ""branding"", ""strategy""]",6,Marketing Directors & CMOs,"[""digital marketing"", ""social media"", ""brand management""]",61,10,2025-10-25 21:45:02,en,How do you identify the right audience for {keyword}?,0.64,1.0,0.43
34700359,cybersecurity,it,What certifications are valuable for cybersecurity professionals?,comparison,Advanced,"[""Introduction to cybersecurity"", ""Key points and analysis"", ""Practical examples"", ""Expert insights"", ""Action items"", ""Conclusion""]","[""software"", ""it"", ""comparison"", ""cybersecurity"", ""technology""]",4,Senior Developers & Tech Leads,"[""machine learning"", ""web development"", ""cloud computing"", ""data science""]",65,7,2025-10-25 21:45:02,en,What certifications are valuable for {keyword} professionals?,0.61,0.883709451400049,0.66
34700360,social media,marketing,How do you measure the ROI of social media campaigns?,optimization,Expert,"[""Overview of social media"", ""Step-by-step implementation"", ""Best practices and tips"", ""Common challenges and solutions"", ""Tools and resources needed"", ""Conclusion and next steps""]","[""media"", ""promotion"", ""digital"", ""marketing"", ""social"", ""optimization""]",6,Marketing Directors & CMOs,"[""content marketing"", ""brand management"", ""digital marketing""]",53,10,2025-10-25 21:45:02,en,How do you measure the ROI of {keyword} campaigns?,0.8,1.0,0.63
34700361,data science,it,How can data science improve system performance and scalability?,planning,Intermediate,"[""Introduction to data science"", ""Key points and analysis"", ""Practical examples"", ""Expert insights"", ""Action items"", ""Conclusion""]","[""software"", ""planning"", ""it"", ""programming"", ""science"", ""data""]",4,Junior to Mid-level Developers,"[""cloud computing"", ""web development"", ""cybersecurity"", ""machine learning""]",64,9,2025-10-25 21:45:02,en,How can {keyword} improve system performance and scalability?,0.82,0.7422841673667587,0.78
34700362,investment planning,economics,How do economic conditions affect investment planning performance?,strategy,Advanced,"[""Introduction to investment planning"", ""Key points and analysis"", ""Practical examples"", ""Expert insights"", ""Action items"", ""Conclusion""]","[""investment"", ""planning"", ""finance"", ""business"", ""strategy"", ""economics""]",4,Professional Investors & Advisors,"[""market analysis"", ""portfolio management"", ""financial modeling""]",66,8,2025-10-25 21:45:02,en,How do economic conditions affect {keyword} performance?,0.84,0.8701689342545941,0.31
34700363,portfolio management,economics,How do you assess and manage portfolio management risks?,analysis,Expert,"[""Overview of portfolio management"", ""Step-by-step implementation"", ""Best practices and tips"", ""Common challenges and solutions"", ""Tools and resources needed"", ""Conclusion and next steps""]","[""analysis"", ""portfolio"", ""management"", ""market"", ""business"", ""economics""]",6,Portfolio Managers & Financial Experts,"[""market analysis"", ""investment planning"", ""financial modeling""]",56,9,2025-10-25 21:45:02,en,How do you assess and manage {keyword} risks?,0.84,1.0,0.68
34700364,content marketing,marketing,What does the future hold for content marketing?,implementation,Advanced,"[""Introduction to content marketing"", ""Key points and analysis"", ""Practical examples"", ""Expert insights"", ""Action items"", ""Conclusion""]","[""content"", ""implementation"", ""marketing"", ""digital"", ""branding""]",4,Marketing Managers & Strategists,"[""brand management"", ""social media"", ""digital marketing""]",48,8,2025-10-25 21:45:02,en,What does the future hold for {keyword}?,0.79,0.9174794531610307,0.66
34700365,portfolio management,economics,What timeline is realistic for portfolio management returns?,comparison,Advanced,"[""Introduction to portfolio management"", ""Key points and analysis"", ""Practical examples"", ""Expert insights"", ""Action items"", ""Conclusion""]","[""finance"", ""portfolio"", ""comparison"", ""management"", ""business"", ""economics""]",4,Professional Investors & Advisors,"[""financial modeling"", ""market analysis"", ""investment planning""]",60,8,2025-10-25 21:45:02,en,What timeline is realistic for {keyword} returns?,0.79,0.80758046481933,0.47
34700366,cybersecurity,it,What tools are essential for cybersecurity development?,troubleshooting,Intermediate,"[""Introduction to cybersecurity"", ""Key points and analysis"", ""Practical examples"", ""Expert insights"", ""Action items"", ""Conclusion""]","[""software"", ""it"", ""programming"", ""troubleshooting"", ""cybersecurity""]",4,Junior to Mid-level Developers,"[""cloud computing"", ""data science"", ""web development"", ""machine learning""]",55,7,2025-10-25 21:45:02,en,What tools are essential for {keyword} development?,0.74,0.6844713277835731,0.4
34700367,web development,it,How does web development impact business operations?,planning,Advanced,"[""Introduction to web development"", ""Key points and analysis"", ""Practical examples"", ""Expert insights"", ""Action items"", ""Conclusion""]","[""technology"", ""planning"", ""development"", ""it"", ""programming"", ""web""]",4,Senior Developers & Tech Leads,"[""cybersecurity"", ""cloud computing"", ""machine learning"", ""data science""]",52,7,2025-10-25 21:45:02,en,How does {keyword} impact business operations?,0.78,0.935006039975545,0.83
34700368,cybersecurity,it,What career opportunities exist in cybersecurity?,evaluation,Intermediate,"[""Introduction to cybersecurity"", ""Key points and analysis"", ""Practical examples"", ""Expert insights"", ""Action items"", ""Conclusion""]","[""software"", ""development"", ""it"", ""evaluation"", ""cybersecurity""]",4,Junior to Mid-level Developers,"[""machine learning"", ""cloud computing"", ""web development"", ""data science""]",49,6,2025-10-25 21:45:02,en,What career opportunities exist in {keyword}?,0.67,0.7841351644559565,0.45
34700369,financial modeling,economics,How does global economics impact financial modeling?,how_to,Advanced,"[""Introduction to financial modeling"", ""Key points and analysis"", ""Practical examples"", ""Expert insights"", ""Action items"", ""Conclusion""]","[""investment"", ""how_to"", ""modeling"", ""financial"", ""business"", ""economics""]",4,Professional Investors & Advisors,"[""investment planning"", ""market analysis"", ""portfolio management""]",52,7,2025-10-25 21:45:02,en,How does global economics impact {keyword}?,0.77,0.8714428157297974,0.77
34700370,financial modeling,economics,What timeline is realistic for financial modeling returns?,optimization,Advanced,"[""Introduction to financial modeling"", ""Key points and analysis"", ""Practical examples"", ""Expert insights"", ""Action items"", ""Conclusion""]","[""modeling"", ""financial"", ""business"", ""market"", ""optimization"", ""economics""]",4,Professional Investors & Advisors,"[""investment planning"", ""market analysis"", ""portfolio management""]",58,8,2025-10-25 21:45:02,en,What timeline is realistic for {keyword} returns?,0.73,0.9306251993556719,0.58
34700371,data science,it,What security considerations should be taken when using data science?,planning,Intermediate,"[""Introduction to data science"", ""Key points and analysis"", ""Practical examples"", ""Expert insights"", ""Action items"", ""Conclusion""]","[""technology"", ""planning"", ""it"", ""programming"", ""science"", ""data""]",4,Junior to Mid-level Developers,"[""cloud computing"", ""cybersecurity"", ""machine learning"", ""web development""]",69,10,2025-10-25 21:45:02,en,What security considerations should be taken when using {keyword}?,0.82,0.7702601537658174,0.42
34700372,digital marketing,marketing,What budget should be allocated to digital marketing?,best_practice,Expert,"[""Introduction to digital marketing"", ""Key points and analysis"", ""Practical examples"", ""Expert insights"", ""Action items"", ""Conclusion""]","[""marketing"", ""advertising"", ""best_practice"", ""digital""]",4,Marketing Directors & CMOs,"[""social media"", ""brand management"", ""content marketing""]",53,8,2025-10-25 21:45:02,en,What budget should be allocated to {keyword}?,0.92,1.0,0.63
34700373,machine learning,it,What are the key components of a machine learning implementation?,best_practice,Advanced,"[""Introduction to machine learning"", ""Key concepts and definitions"", ""Main categories or types"", ""Examples and case studies"", ""Benefits and advantages"", ""Summary and recommendations""]","[""development"", ""it"", ""programming"", ""best_practice"", ""learning"", ""machine""]",6,Senior Developers & Tech Leads,"[""cloud computing"", ""web development"", ""data science"", ""cybersecurity""]",65,10,2025-10-25 21:45:02,en,What are the key components of a {keyword} implementation?,0.83,0.9850323718032585,0.87
34700374,web development,it,What is the recommended architecture for web development systems?,analysis,Intermediate,"[""Introduction to web development"", ""Key points and analysis"", ""Practical examples"", ""Expert insights"", ""Action items"", ""Conclusion""]","[""software"", ""development"", ""analysis"", ""it"", ""programming"", ""web""]",4,Junior to Mid-level Developers,"[""data science"", ""machine learning"", ""cloud computing"", ""cybersecurity""]",65,9,2025-10-25 21:45:02,en,What is the recommended architecture for {keyword} systems?,0.66,0.7139214545112512,0.48
34700375,financial modeling,economics,How do economic conditions affect financial modeling performance?,optimization,Intermediate,"[""Introduction to financial modeling"", ""Key points and analysis"", ""Practical examples"", ""Expert insights"", ""Action items"", ""Conclusion""]","[""finance"", ""modeling"", ""financial"", ""business"", ""optimization"", ""economics""]",4,Individual Investors & Analysts,"[""portfolio management"", ""market analysis"", ""investment planning""]",65,8,2025-10-25 21:45:02,en,How do economic conditions affect {keyword} performance?,0.7,0.6406591715628924,0.35
34700376,digital marketing,marketing,How do you personalize digital marketing for different segments?,strategy,Beginner,"[""Overview of digital marketing"", ""Step-by-step implementation"", ""Best practices and tips"", ""Common challenges and solutions"", ""Tools and resources needed"", ""Conclusion and next steps""]","[""marketing"", ""strategy"", ""advertising"", ""digital""]",6,Marketing Students & Interns,"[""content marketing"", ""brand management"", ""social media""]",64,9,2025-10-25 21:45:02,en,How do you personalize {keyword} for different segments?,0.77,0.4724011455349254,0.49
34700377,machine learning,it,What ROI can be expected from machine learning implementation?,comparison,Beginner,"[""Introduction to machine learning"", ""Key points and analysis"", ""Practical examples"", ""Expert insights"", ""Action items"", ""Conclusion""]","[""development"", ""it"", ""comparison"", ""learning"", ""machine"", ""technology""]",4,Students & Entry-level Developers,"[""cloud computing"", ""cybersecurity"", ""web development"", ""data science""]",62,9,2025-10-25 21:45:02,en,What ROI can be expected from {keyword} implementation?,0.92,0.3724256000900713,0.44
34700378,financial modeling,economics,What exit strategies should be considered for financial modeling?,troubleshooting,Beginner,"[""Introduction to financial modeling"", ""Key points and analysis"", ""Practical examples"", ""Expert insights"", ""Action items"", ""Conclusion""]","[""finance"", ""troubleshooting"", ""modeling"", ""financial"", ""business"", ""economics""]",4,Students & New Investors,"[""market analysis"", ""investment planning"", ""portfolio management""]",65,9,2025-10-25 21:45:02,en,What exit strategies should be considered for {keyword}?,0.8,0.36698461074093075,0.86
34700379,brand management,marketing,What messaging works best in brand management campaigns?,analysis,Beginner,"[""Introduction to brand management"", ""Key points and analysis"", ""Practical examples"", ""Expert insights"", ""Action items"", ""Conclusion""]","[""analysis"", ""marketing"", ""management"", ""advertising"", ""branding"", ""brand""]",4,Marketing Students & Interns,"[""social media"", ""digital marketing"", ""content marketing""]",56,8,2025-10-25 21:45:02,en,What messaging works best in {keyword} campaigns?,0.88,0.4287220576813796,0.4
34700380,social media,marketing,How do you innovate within social media?,comparison,Advanced,"[""Overview of social media"", ""Step-by-step implementation"", ""Best practices and tips"", ""Common challenges and solutions"", ""Tools and resources needed"", ""Conclusion and next steps""]","[""media"", ""promotion"", ""comparison"", ""marketing"", ""social"", ""advertising""]",6,Marketing Managers & Strategists,"[""digital marketing"", ""content marketing"", ""brand management""]",40,7,2025-10-25 21:45:02,en,How do you innovate within {keyword}?,0.78,0.9150794675320078,0.43
34700381,cybersecurity,it,What design patterns work best with cybersecurity?,implementation,Expert,"[""Introduction to cybersecurity"", ""Key points and analysis"", ""Practical examples"", ""Expert insights"", ""Action items"", ""Conclusion""]","[""development"", ""it"", ""implementation"", ""programming"", ""cybersecurity""]",4,Architects & Technical Directors,"[""data science"", ""cloud computing"", ""web development"", ""machine learning""]",50,7,2025-10-25 21:45:02,en,What design patterns work best with {keyword}?,0.67,1.0,0.89
34700382,content marketing,marketing,How do you reach new customers through content marketing?,strategy,Expert,"[""Overview of content marketing"", ""Step-by-step implementation"", ""Best practices and tips"", ""Common challenges and solutions"", ""Tools and resources needed"", ""Conclusion and next steps""]","[""content"", ""marketing"", ""advertising"", ""branding"", ""strategy""]",6,Marketing Directors & CMOs,"[""brand management"", ""digital marketing"", ""social media""]",57,9,2025-10-25 21:45:02,en,How do you reach new customers through {keyword}?,0.78,1.0,0.73
34700383,cybersecurity,it,How do you troubleshoot common issues with cybersecurity?,troubleshooting,Beginner,"[""Overview of cybersecurity"", ""Step-by-step implementation"", ""Best practices and tips"", ""Common challenges and solutions"", ""Tools and resources needed"", ""Conclusion and next steps""]","[""software"", ""it"", ""programming"", ""troubleshooting"", ""cybersecurity""]",5,Students & Entry-level Developers,"[""machine learning"", ""cloud computing"", ""web development"", ""data science""]",57,8,2025-10-25 21:45:02,en,How do you troubleshoot common issues with {keyword}?,0.81,0.32374211815634524,0.39
34700384,data science,it,Which frameworks support data science implementation?,analysis,Intermediate,"[""Introduction to data science"", ""Key points and analysis"", ""Practical examples"", ""Expert insights"", ""Action items"", ""Conclusion""]","[""technology"", ""analysis"", ""it"", ""programming"", ""science"", ""data""]",4,Junior to Mid-level Developers,"[""cybersecurity"", ""machine learning"", ""cloud computing"", ""web development""]",53,6,2025-10-25 21:45:02,en,Which frameworks support {keyword} implementation?,0.64,0.6716099447662982,0.57
34700385,market analysis,economics,What timeline is realistic for market analysis returns?,planning,Advanced,"[""Introduction to market analysis"", ""Key points and analysis"", ""Practical examples"", ""Expert insights"", ""Action items"", ""Conclusion""]","[""investment"", ""planning"", ""analysis"", ""market"", ""economics""]",4,Professional Investors & Advisors,"[""portfolio management"", ""investment planning"", ""financial modeling""]",55,8,2025-10-25 21:45:02,en,What timeline is realistic for {keyword} returns?,0.63,0.9290304056872397,0.34
34700386,social media,marketing,How do you attribute success to social media efforts?,implementation,Advanced,"[""Overview of social media"", ""Step-by-step implementation"", ""Best practices and tips"", ""Common challenges and solutions"", ""Tools and resources needed"", ""Conclusion and next steps""]","[""media"", ""implementation"", ""promotion"", ""marketing"", ""digital"", ""social""]",6,Marketing Managers & Strategists,"[""brand management"", ""content marketing"", ""digital marketing""]",53,9,2025-10-25 21:45:02,en,How do you attribute success to {keyword} efforts?,0.88,0.8811710723877936,0.57
34700387,digital marketing,marketing,How do you attribute success to digital marketing efforts?,planning,Intermediate,"[""Overview of digital marketing"", ""Step-by-step implementation"", ""Best practices and tips"", ""Common challenges and solutions"", ""Tools and resources needed"", ""Conclusion and next steps""]","[""planning"", ""marketing"", ""digital"", ""advertising"", ""branding""]",6,Marketing Coordinators & Specialists,"[""brand management"", ""content marketing"", ""social media""]",58,9,2025-10-25 21:45:02,en,How do you attribute success to {keyword} efforts?,0.62,0.6662366358830456,0.85
34700388,brand management,marketing,What emerging platforms support brand management?,implementation,Advanced,"[""Introduction to brand management"", ""Key points and analysis"", ""Practical examples"", ""Expert insights"", ""Action items"", ""Conclusion""]","[""implementation"", ""promotion"", ""marketing"", ""management"", ""advertising"", ""brand""]",4,Marketing Managers & Strategists,"[""content marketing"", ""social media"", ""digital marketing""]",49,6,2025-10-25 21:45:02,en,What emerging platforms support {keyword}?,0.93,0.9774604436776738,0.57
34700389,portfolio management,economics,How do economic conditions affect portfolio management performance?,optimization,Intermediate,"[""Introduction to portfolio management"", ""Key points and analysis"", ""Practical examples"", ""Expert insights"", ""Action items"", ""Conclusion""]","[""finance"", ""portfolio"", ""management"", ""business"", ""optimization"", ""economics""]",4,Individual Investors & Analysts,"[""market analysis"", ""financial modeling"", ""investment planning""]",67,8,2025-10-25 21:45:02,en,How do economic conditions affect {keyword} performance?,0.84,0.6781834000624405,0.76
34700390,content marketing,marketing,What A/B tests should you run for content marketing?,optimization,Advanced,"[""Introduction to content marketing"", ""Key points and analysis"", ""Practical examples"", ""Expert insights"", ""Action items"", ""Conclusion""]","[""content"", ""marketing"", ""digital"", ""advertising"", ""optimization""]",4,Marketing Managers & Strategists,"[""social media"", ""brand management"", ""digital marketing""]",52,9,2025-10-25 21:45:02,en,What A/B tests should you run for {keyword}?,0.69,0.8039503272605331,0.47
34700391,financial modeling,economics,What are the regulatory considerations for financial modeling?,strategy,Advanced,"[""Introduction to financial modeling"", ""Key concepts and definitions"", ""Main categories or types"", ""Examples and case studies"", ""Benefits and advantages"", ""Summary and recommendations""]","[""investment"", ""finance"", ""modeling"", ""financial"", ""strategy"", ""economics""]",6,Professional Investors & Advisors,"[""investment planning"", ""portfolio management"", ""market analysis""]",62,8,2025-10-25 21:45:02,en,What are the regulatory considerations for {keyword}?,0.82,0.8560961725874369,0.63
34700392,financial modeling,economics,How does global economics impact financial modeling?,optimization,Advanced,"[""Introduction to financial modeling"", ""Key points and analysis"", ""Practical examples"", ""Expert insights"", ""Action items"", ""Conclusion""]","[""modeling"", ""financial"", ""business"", ""market"", ""optimization"", ""economics""]",4,Professional Investors & Advisors,"[""investment planning"", ""portfolio management"", ""market analysis""]",52,7,2025-10-25 21:45:02,en,How does global economics impact {keyword}?,0.73,0.979054976052116,0.52
34700393,financial modeling,economics,How do you adjust your financial modeling strategy during volatility?,strategy,Expert,"[""Overview of financial modeling"", ""Step-by-step implementation"", ""Best practices and tips"", ""Common challenges and solutions"", ""Tools and resources needed"", ""Conclusion and next steps""]","[""modeling"", ""financial"", ""business"", ""market"", ""strategy"", ""economics""]",6,Portfolio Managers & Financial Experts,"[""portfolio management"", ""investment planning"", ""market analysis""]",69,10,2025-10-25 21:45:02,en,How do you adjust your {keyword} strategy during volatility?,0.71,1.0,0.75
