record_id,keyword,category,question,question_type,difficulty_level,answer_outline,tags,estimated_read_time,target_audience,related_topics,question_length,word_count,created_date,language,source_template,engagement_score,complexity_score,popularity_score
40700347,cybersecurity,it,What tools are essential for cybersecurity development?,implementation,Intermediate,"[""Introduction to cybersecurity"", ""Key points and analysis"", ""Practical examples"", ""Expert insights"", ""Action items"", ""Conclusion""]","[""software"", ""development"", ""it"", ""implementation"", ""cybersecurity""]",4,Junior to Mid-level Developers,"[""web development"", ""machine learning"", ""cloud computing"", ""data science""]",55,7,2025-10-25 21:53:21,en,What tools are essential for {keyword} development?,0.7,0.6191489402716659,0.62
40700348,content marketing,marketing,What timing strategies work for content marketing?,how_to,Advanced,"[""Introduction to content marketing"", ""Key points and analysis"", ""Practical examples"", ""Expert insights"", ""Action items"", ""Conclusion""]","[""how_to"", ""content"", ""promotion"", ""marketing"", ""branding""]",4,Marketing Managers & Strategists,"[""social media"", ""digital marketing"", ""brand management""]",50,7,2025-10-25 21:53:21,en,What timing strategies work for {keyword}?,0.64,0.876051629116262,0.38
40700349,social media,marketing,What tools are essential for social media analytics?,how_to,Beginner,"[""Introduction to social media"", ""Key points and analysis"", ""Practical examples"", ""Expert insights"", ""Action items"", ""Conclusion""]","[""how_to"", ""media"", ""marketing"", ""digital"", ""social"", ""branding""]",4,Marketing Students & Interns,"[""content marketing"", ""digital marketing"", ""brand management""]",52,8,2025-10-25 21:53:21,en,What tools are essential for {keyword} analytics?,0.87,0.3675889273552024,0.45
40700350,digital marketing,marketing,What are the latest trends in digital marketing?,how_to,Beginner,"[""Introduction to digital marketing"", ""Key concepts and definitions"", ""Main categories or types"", ""Examples and case studies"", ""Benefits and advantages"", ""Summary and recommendations""]","[""how_to"", ""marketing"", ""digital"", ""advertising"", ""branding""]",6,Marketing Students & Interns,"[""brand management"", ""social media"", ""content marketing""]",48,8,2025-10-25 21:53:21,en,What are the latest trends in {keyword}?,0.94,0.44310568611197265,0.6
40700351,brand management,marketing,What messaging works best in brand management campaigns?,evaluation,Advanced,"[""Introduction to brand management"", ""Key points and analysis"", ""Practical examples"", ""Expert insights"", ""Action items"", ""Conclusion""]","[""promotion"", ""marketing"", ""management"", ""branding"", ""evaluation"", ""brand""]",4,Marketing Managers & Strategists,"[""content marketing"", ""digital marketing"", ""social media""]",56,8,2025-10-25 21:53:21,en,What messaging works best in {keyword} campaigns?,0.86,0.9097790800636455,0.52
40700352,content marketing,marketing,What does the future hold for content marketing?,strategy,Expert,"[""Introduction to content marketing"", ""Key points and analysis"", ""Practical examples"", ""Expert insights"", ""Action items"", ""Conclusion""]","[""content"", ""promotion"", ""marketing"", ""digital"", ""strategy""]",4,Marketing Directors & CMOs,"[""social media"", ""digital marketing"", ""brand management""]",48,8,2025-10-25 21:53:21,en,What does the future hold for {keyword}?,0.8,1.0,0.64
40700353,web development,it,How does web development impact business operations?,evaluation,Intermediate,"[""Introduction to web development"", ""Key points and analysis"", ""Practical examples"", ""Expert insights"", ""Action items"", ""Conclusion""]","[""software"", ""development"", ""web"", ""it"", ""evaluation"", ""technology""]",4,Junior to Mid-level Developers,"[""data science"", ""cybersecurity"", ""cloud computing"", ""machine learning""]",52,7,2025-10-25 21:53:21,en,How does {keyword} impact business operations?,0.64,0.6714843103916313,0.72
40700354,content marketing,marketing,How do you measure the ROI of content marketing campaigns?,evaluation,Expert,"[""Overview of content marketing"", ""Step-by-step implementation"", ""Best practices and tips"", ""Common challenges and solutions"", ""Tools and resources needed"", ""Conclusion and next steps""]","[""content"", ""promotion"", ""marketing"", ""digital"", ""evaluation""]",6,Marketing Directors & CMOs,"[""social media"", ""digital marketing"", ""brand management""]",58,10,2025-10-25 21:53:21,en,How do you measure the ROI of {keyword} campaigns?,0.8,1.0,0.6
40700355,brand management,marketing,How do you identify the right audience for brand management?,implementation,Intermediate,"[""Overview of brand management"", ""Step-by-step implementation"", ""Best practices and tips"", ""Common challenges and solutions"", ""Tools and resources needed"", ""Conclusion and next steps""]","[""implementation"", ""marketing"", ""digital"", ""management"", ""advertising"", ""brand""]",6,Marketing Coordinators & Specialists,"[""digital marketing"", ""content marketing"", ""social media""]",60,10,2025-10-25 21:53:21,en,How do you identify the right audience for {keyword}?,0.81,0.6743140317034462,0.49
40700356,data science,it,How do you convince stakeholders to invest in data science?,troubleshooting,Advanced,"[""Overview of data science"", ""Step-by-step implementation"", ""Best practices and tips"", ""Common challenges and solutions"", ""Tools and resources needed"", ""Conclusion and next steps""]","[""technology"", ""it"", ""programming"", ""troubleshooting"", ""science"", ""data""]",6,Senior Developers & Tech Leads,"[""cybersecurity"", ""machine learning"", ""web development"", ""cloud computing""]",59,10,2025-10-25 21:53:21,en,How do you convince stakeholders to invest in {keyword}?,0.73,0.9951224266119487,0.78
40700357,content marketing,marketing,What A/B tests should you run for content marketing?,best_practice,Intermediate,"[""Introduction to content marketing"", ""Key points and analysis"", ""Practical examples"", ""Expert insights"", ""Action items"", ""Conclusion""]","[""content"", ""promotion"", ""best_practice"", ""marketing"", ""digital""]",4,Marketing Coordinators & Specialists,"[""social media"", ""brand management"", ""digital marketing""]",52,9,2025-10-25 21:53:21,en,What A/B tests should you run for {keyword}?,0.88,0.7924914268818091,0.83
40700358,data science,it,How do you troubleshoot common issues with data science?,planning,Beginner,"[""Overview of data science"", ""Step-by-step implementation"", ""Best practices and tips"", ""Common challenges and solutions"", ""Tools and resources needed"", ""Conclusion and next steps""]","[""technology"", ""planning"", ""development"", ""it"", ""science"", ""data""]",6,Students & Entry-level Developers,"[""machine learning"", ""cloud computing"", ""web development"", ""cybersecurity""]",56,9,2025-10-25 21:53:21,en,How do you troubleshoot common issues with {keyword}?,0.86,0.3429936443574748,0.64
40700359,cloud computing,it,How do you optimize cloud computing for different platforms?,planning,Expert,"[""Overview of cloud computing"", ""Step-by-step implementation"", ""Best practices and tips"", ""Common challenges and solutions"", ""Tools and resources needed"", ""Conclusion and next steps""]","[""computing"", ""planning"", ""development"", ""it"", ""software"", ""cloud""]",6,Architects & Technical Directors,"[""cybersecurity"", ""data science"", ""web development"", ""machine learning""]",60,9,2025-10-25 21:53:21,en,How do you optimize {keyword} for different platforms?,0.84,1.0,0.42
40700360,brand management,marketing,How do you innovate within brand management?,best_practice,Expert,"[""Overview of brand management"", ""Step-by-step implementation"", ""Best practices and tips"", ""Common challenges and solutions"", ""Tools and resources needed"", ""Conclusion and next steps""]","[""promotion"", ""best_practice"", ""marketing"", ""management"", ""digital"", ""brand""]",6,Marketing Directors & CMOs,"[""content marketing"", ""digital marketing"", ""social media""]",44,7,2025-10-25 21:53:21,en,How do you innovate within {keyword}?,0.84,1.0,0.66
40700361,portfolio management,economics,What tools help analyze portfolio management data?,strategy,Beginner,"[""Introduction to portfolio management"", ""Key points and analysis"", ""Practical examples"", ""Expert insights"", ""Action items"", ""Conclusion""]","[""finance"", ""portfolio"", ""management"", ""business"", ""strategy"", ""economics""]",4,Students & New Investors,"[""market analysis"", ""financial modeling"", ""investment planning""]",50,7,2025-10-25 21:53:21,en,What tools help analyze {keyword} data?,0.86,0.49281506423532095,0.56
40700362,digital marketing,marketing,How do you improve digital marketing conversion rates?,how_to,Advanced,"[""Overview of digital marketing"", ""Step-by-step implementation"", ""Best practices and tips"", ""Common challenges and solutions"", ""Tools and resources needed"", ""Conclusion and next steps""]","[""how_to"", ""promotion"", ""marketing"", ""digital"", ""branding""]",6,Marketing Managers & Strategists,"[""content marketing"", ""social media"", ""brand management""]",54,8,2025-10-25 21:53:21,en,How do you improve {keyword} conversion rates?,0.82,0.8413148356217892,0.57
40700363,data science,it,How do you troubleshoot common issues with data science?,troubleshooting,Advanced,"[""Overview of data science"", ""Step-by-step implementation"", ""Best practices and tips"", ""Common challenges and solutions"", ""Tools and resources needed"", ""Conclusion and next steps""]","[""development"", ""it"", ""programming"", ""troubleshooting"", ""science"", ""data""]",6,Senior Developers & Tech Leads,"[""cloud computing"", ""machine learning"", ""cybersecurity"", ""web development""]",56,9,2025-10-25 21:53:21,en,How do you troubleshoot common issues with {keyword}?,0.7,0.8074490364207452,0.77
40700364,digital marketing,marketing,What demographics respond best to digital marketing?,implementation,Intermediate,"[""Introduction to digital marketing"", ""Key points and analysis"", ""Practical examples"", ""Expert insights"", ""Action items"", ""Conclusion""]","[""implementation"", ""marketing"", ""digital"", ""advertising"", ""branding""]",4,Marketing Coordinators & Specialists,"[""brand management"", ""content marketing"", ""social media""]",52,7,2025-10-25 21:53:21,en,What demographics respond best to {keyword}?,0.91,0.7814907182085573,0.72
40700365,cloud computing,it,How do you integrate cloud computing with existing systems?,optimization,Intermediate,"[""Overview of cloud computing"", ""Step-by-step implementation"", ""Best practices and tips"", ""Common challenges and solutions"", ""Tools and resources needed"", ""Conclusion and next steps""]","[""computing"", ""cloud"", ""development"", ""it"", ""programming"", ""optimization""]",6,Junior to Mid-level Developers,"[""data science"", ""cybersecurity"", ""web development"", ""machine learning""]",59,9,2025-10-25 21:53:21,en,How do you integrate {keyword} with existing systems?,0.66,0.7284169392186609,0.79
40700366,web development,it,How do you get started with web development as a beginner?,optimization,Intermediate,"[""Overview of web development"", ""Step-by-step implementation"", ""Best practices and tips"", ""Common challenges and solutions"", ""Tools and resources needed"", ""Conclusion and next steps""]","[""technology"", ""development"", ""it"", ""programming"", ""optimization"", ""web""]",6,Junior to Mid-level Developers,"[""data science"", ""machine learning"", ""cybersecurity"", ""cloud computing""]",58,11,2025-10-25 21:53:21,en,How do you get started with {keyword} as a beginner?,0.67,0.6932565238211397,0.48
40700367,market analysis,economics,What exit strategies should be considered for market analysis?,best_practice,Intermediate,"[""Introduction to market analysis"", ""Key points and analysis"", ""Practical examples"", ""Expert insights"", ""Action items"", ""Conclusion""]","[""investment"", ""analysis"", ""best_practice"", ""market"", ""economics""]",4,Individual Investors & Analysts,"[""financial modeling"", ""portfolio management"", ""investment planning""]",62,9,2025-10-25 21:53:21,en,What exit strategies should be considered for {keyword}?,0.74,0.6685138437999644,0.34
40700368,portfolio management,economics,What are the regulatory considerations for portfolio management?,evaluation,Expert,"[""Introduction to portfolio management"", ""Key concepts and definitions"", ""Main categories or types"", ""Examples and case studies"", ""Benefits and advantages"", ""Summary and recommendations""]","[""portfolio"", ""management"", ""evaluation"", ""market"", ""business"", ""economics""]",6,Portfolio Managers & Financial Experts,"[""market analysis"", ""financial modeling"", ""investment planning""]",64,8,2025-10-25 21:53:21,en,What are the regulatory considerations for {keyword}?,0.66,1.0,0.55
40700369,data science,it,What is the recommended architecture for data science systems?,implementation,Advanced,"[""Introduction to data science"", ""Key points and analysis"", ""Practical examples"", ""Expert insights"", ""Action items"", ""Conclusion""]","[""software"", ""it"", ""implementation"", ""programming"", ""science"", ""data""]",4,Senior Developers & Tech Leads,"[""web development"", ""cybersecurity"", ""machine learning"", ""cloud computing""]",62,9,2025-10-25 21:53:21,en,What is the recommended architecture for {keyword} systems?,0.61,0.9901571417911678,0.51
40700370,web development,it,How do you get started with web development as a beginner?,best_practice,Expert,"[""Overview of web development"", ""Step-by-step implementation"", ""Best practices and tips"", ""Common challenges and solutions"", ""Tools and resources needed"", ""Conclusion and next steps""]","[""development"", ""it"", ""programming"", ""best_practice"", ""web""]",6,Architects & Technical Directors,"[""machine learning"", ""cybersecurity"", ""data science"", ""cloud computing""]",58,11,2025-10-25 21:53:21,en,How do you get started with {keyword} as a beginner?,0.77,1.0,0.61
40700371,web development,it,What certifications are valuable for web development professionals?,implementation,Beginner,"[""Introduction to web development"", ""Key points and analysis"", ""Practical examples"", ""Expert insights"", ""Action items"", ""Conclusion""]","[""development"", ""web"", ""implementation"", ""it"", ""technology""]",4,Students & Entry-level Developers,"[""data science"", ""cloud computing"", ""cybersecurity"", ""machine learning""]",67,8,2025-10-25 21:53:21,en,What certifications are valuable for {keyword} professionals?,0.62,0.49636456756669556,0.62
40700372,financial modeling,economics,How do you create a long-term plan for financial modeling?,best_practice,Expert,"[""Overview of financial modeling"", ""Step-by-step implementation"", ""Best practices and tips"", ""Common challenges and solutions"", ""Tools and resources needed"", ""Conclusion and next steps""]","[""finance"", ""best_practice"", ""modeling"", ""financial"", ""business"", ""economics""]",6,Portfolio Managers & Financial Experts,"[""market analysis"", ""portfolio management"", ""investment planning""]",58,10,2025-10-25 21:53:21,en,How do you create a long-term plan for {keyword}?,0.89,1.0,0.59
40700373,financial modeling,economics,How do you diversify your portfolio using financial modeling?,comparison,Advanced,"[""Overview of financial modeling"", ""Step-by-step implementation"", ""Best practices and tips"", ""Common challenges and solutions"", ""Tools and resources needed"", ""Conclusion and next steps""]","[""investment"", ""comparison"", ""modeling"", ""financial"", ""business"", ""economics""]",6,Professional Investors & Advisors,"[""portfolio management"", ""investment planning"", ""market analysis""]",61,9,2025-10-25 21:53:21,en,How do you diversify your portfolio using {keyword}?,0.68,0.9817514566267596,0.71
40700374,content marketing,marketing,What A/B tests should you run for content marketing?,strategy,Intermediate,"[""Introduction to content marketing"", ""Key points and analysis"", ""Practical examples"", ""Expert insights"", ""Action items"", ""Conclusion""]","[""content"", ""promotion"", ""marketing"", ""branding"", ""strategy""]",4,Marketing Coordinators & Specialists,"[""brand management"", ""digital marketing"", ""social media""]",52,9,2025-10-25 21:53:21,en,What A/B tests should you run for {keyword}?,0.83,0.7941031070377126,0.36
40700375,machine learning,it,How do you stay updated with machine learning developments?,planning,Beginner,"[""Overview of machine learning"", ""Step-by-step implementation"", ""Best practices and tips"", ""Common challenges and solutions"", ""Tools and resources needed"", ""Conclusion and next steps""]","[""software"", ""planning"", ""it"", ""learning"", ""machine"", ""technology""]",6,Students & Entry-level Developers,"[""web development"", ""cybersecurity"", ""data science"", ""cloud computing""]",59,9,2025-10-25 21:53:21,en,How do you stay updated with {keyword} developments?,0.9,0.4076680746286563,0.81
40700376,market analysis,economics,What insurance options are available for market analysis?,planning,Intermediate,"[""Introduction to market analysis"", ""Key points and analysis"", ""Practical examples"", ""Expert insights"", ""Action items"", ""Conclusion""]","[""planning"", ""analysis"", ""market"", ""business"", ""economics""]",4,Individual Investors & Analysts,"[""investment planning"", ""portfolio management"", ""financial modeling""]",57,8,2025-10-25 21:53:21,en,What insurance options are available for {keyword}?,0.88,0.79208308969577,0.51
40700377,content marketing,marketing,What budget should be allocated to content marketing?,implementation,Beginner,"[""Introduction to content marketing"", ""Key points and analysis"", ""Practical examples"", ""Expert insights"", ""Action items"", ""Conclusion""]","[""content"", ""implementation"", ""marketing"", ""digital"", ""advertising""]",4,Marketing Students & Interns,"[""brand management"", ""digital marketing"", ""social media""]",53,8,2025-10-25 21:53:21,en,What budget should be allocated to {keyword}?,0.73,0.4919812412047575,0.63
40700378,financial modeling,economics,What insurance options are available for financial modeling?,implementation,Expert,"[""Introduction to financial modeling"", ""Key points and analysis"", ""Practical examples"", ""Expert insights"", ""Action items"", ""Conclusion""]","[""investment"", ""implementation"", ""modeling"", ""financial"", ""market"", ""economics""]",4,Portfolio Managers & Financial Experts,"[""market analysis"", ""portfolio management"", ""investment planning""]",60,8,2025-10-25 21:53:21,en,What insurance options are available for {keyword}?,0.74,1.0,0.33
40700379,digital marketing,marketing,What content types work best for digital marketing?,comparison,Expert,"[""Introduction to digital marketing"", ""Key points and analysis"", ""Practical examples"", ""Expert insights"", ""Action items"", ""Conclusion""]","[""branding"", ""marketing"", ""comparison"", ""digital""]",4,Marketing Directors & CMOs,"[""social media"", ""content marketing"", ""brand management""]",51,8,2025-10-25 21:53:21,en,What content types work best for {keyword}?,0.68,1.0,0.33
40700380,data science,it,What skills are needed to master data science?,analysis,Expert,"[""Introduction to data science"", ""Key points and analysis"", ""Practical examples"", ""Expert insights"", ""Action items"", ""Conclusion""]","[""technology"", ""software"", ""analysis"", ""it"", ""science"", ""data""]",4,Architects & Technical Directors,"[""cloud computing"", ""machine learning"", ""cybersecurity"", ""web development""]",46,8,2025-10-25 21:53:21,en,What skills are needed to master {keyword}?,0.72,1.0,0.45
40700381,brand management,marketing,What channels are most effective for brand management?,analysis,Intermediate,"[""Introduction to brand management"", ""Key points and analysis"", ""Practical examples"", ""Expert insights"", ""Action items"", ""Conclusion""]","[""analysis"", ""promotion"", ""digital"", ""marketing"", ""management"", ""brand""]",4,Marketing Coordinators & Specialists,"[""content marketing"", ""digital marketing"", ""social media""]",54,8,2025-10-25 21:53:21,en,What channels are most effective for {keyword}?,0.71,0.6658458953017672,0.53
40700382,brand management,marketing,How do you create a brand management roadmap?,analysis,Intermediate,"[""Overview of brand management"", ""Step-by-step implementation"", ""Best practices and tips"", ""Common challenges and solutions"", ""Tools and resources needed"", ""Conclusion and next steps""]","[""analysis"", ""marketing"", ""management"", ""advertising"", ""branding"", ""brand""]",6,Marketing Coordinators & Specialists,"[""digital marketing"", ""content marketing"", ""social media""]",45,8,2025-10-25 21:53:21,en,How do you create a {keyword} roadmap?,0.84,0.6807236172018005,0.48
40700383,cloud computing,it,What security considerations should be taken when using cloud computing?,best_practice,Expert,"[""Introduction to cloud computing"", ""Key points and analysis"", ""Practical examples"", ""Expert insights"", ""Action items"", ""Conclusion""]","[""computing"", ""it"", ""programming"", ""best_practice"", ""cloud"", ""technology""]",4,Architects & Technical Directors,"[""cybersecurity"", ""web development"", ""data science"", ""machine learning""]",72,10,2025-10-25 21:53:21,en,What security considerations should be taken when using {keyword}?,0.77,1.0,0.82
40700384,cybersecurity,it,How does cybersecurity impact business operations?,comparison,Expert,"[""Introduction to cybersecurity"", ""Key points and analysis"", ""Practical examples"", ""Expert insights"", ""Action items"", ""Conclusion""]","[""software"", ""development"", ""it"", ""comparison"", ""cybersecurity""]",4,Architects & Technical Directors,"[""machine learning"", ""cloud computing"", ""web development"", ""data science""]",50,6,2025-10-25 21:53:21,en,How does {keyword} impact business operations?,0.84,1.0,0.86
40700385,digital marketing,marketing,What KPIs are most important for digital marketing?,implementation,Beginner,"[""Introduction to digital marketing"", ""Key points and analysis"", ""Practical examples"", ""Expert insights"", ""Action items"", ""Conclusion""]","[""implementation"", ""marketing"", ""promotion"", ""digital""]",4,Marketing Students & Interns,"[""brand management"", ""social media"", ""content marketing""]",51,8,2025-10-25 21:53:21,en,What KPIs are most important for {keyword}?,0.87,0.3494709947964932,0.72
40700386,social media,marketing,What messaging works best in social media campaigns?,best_practice,Intermediate,"[""Introduction to social media"", ""Key points and analysis"", ""Practical examples"", ""Expert insights"", ""Action items"", ""Conclusion""]","[""media"", ""best_practice"", ""marketing"", ""social"", ""advertising"", ""branding""]",4,Marketing Coordinators & Specialists,"[""content marketing"", ""brand management"", ""digital marketing""]",52,8,2025-10-25 21:53:21,en,What messaging works best in {keyword} campaigns?,0.92,0.6003099331948106,0.33
40700387,digital marketing,marketing,What does the future hold for digital marketing?,best_practice,Advanced,"[""Introduction to digital marketing"", ""Key points and analysis"", ""Practical examples"", ""Expert insights"", ""Action items"", ""Conclusion""]","[""marketing"", ""promotion"", ""best_practice"", ""digital""]",4,Marketing Managers & Strategists,"[""brand management"", ""content marketing"", ""social media""]",48,8,2025-10-25 21:53:21,en,What does the future hold for {keyword}?,0.91,0.838138521153648,0.36
40700388,content marketing,marketing,What emerging platforms support content marketing?,evaluation,Intermediate,"[""Introduction to content marketing"", ""Key points and analysis"", ""Practical examples"", ""Expert insights"", ""Action items"", ""Conclusion""]","[""content"", ""marketing"", ""advertising"", ""branding"", ""evaluation""]",4,Marketing Coordinators & Specialists,"[""brand management"", ""digital marketing"", ""social media""]",50,6,2025-10-25 21:53:21,en,What emerging platforms support {keyword}?,0.77,0.7747401101883158,0.46
40700389,content marketing,marketing,How do you measure the ROI of content marketing campaigns?,how_to,Beginner,"[""Overview of content marketing"", ""Step-by-step implementation"", ""Best practices and tips"", ""Common challenges and solutions"", ""Tools and resources needed"", ""Conclusion and next steps""]","[""how_to"", ""content"", ""marketing"", ""digital"", ""advertising""]",6,Marketing Students & Interns,"[""social media"", ""brand management"", ""digital marketing""]",58,10,2025-10-25 21:53:21,en,How do you measure the ROI of {keyword} campaigns?,0.93,0.4200539420535358,0.85
40700390,brand management,marketing,What budget should be allocated to brand management?,optimization,Intermediate,"[""Introduction to brand management"", ""Key points and analysis"", ""Practical examples"", ""Expert insights"", ""Action items"", ""Conclusion""]","[""promotion"", ""marketing"", ""management"", ""branding"", ""optimization"", ""brand""]",4,Marketing Coordinators & Specialists,"[""digital marketing"", ""content marketing"", ""social media""]",52,8,2025-10-25 21:53:21,en,What budget should be allocated to {keyword}?,0.7,0.6920069299359631,0.6
