record_id,keyword,category,question,question_type,difficulty_level,answer_outline,tags,estimated_read_time,target_audience,related_topics,question_length,word_count,created_date,language,source_template,engagement_score,complexity_score,popularity_score
249,content marketing,marketing,How do you attribute success to content marketing efforts?,implementation,Expert,"[""Overview of content marketing"", ""Step-by-step implementation"", ""Best practices and tips"", ""Common challenges and solutions"", ""Tools and resources needed"", ""Conclusion and next steps""]","[""marketing"", ""promotion"", ""advertising"", ""content"", ""implementation""]",6,Marketing Directors & CMOs,"[""social media"", ""digital marketing"", ""brand management""]",58,9,2025-10-25 19:28:21,en,How do you attribute success to {keyword} efforts?,0.61,1.0,0.77
253,brand management,marketing,How is AI changing brand management approaches?,strategy,Intermediate,"[""Introduction to brand management"", ""Key points and analysis"", ""Practical examples"", ""Expert insights"", ""Action items"", ""Conclusion""]","[""marketing"", ""management"", ""strategy"", ""branding"", ""digital"", ""brand""]",4,Marketing Coordinators & Specialists,"[""digital marketing"", ""content marketing"", ""social media""]",47,7,2025-10-25 19:28:21,en,How is AI changing {keyword} approaches?,0.94,0.6841267999836439,0.74
257,brand management,marketing,What does the future hold for brand management?,evaluation,Intermediate,"[""Introduction to brand management"", ""Key points and analysis"", ""Practical examples"", ""Expert insights"", ""Action items"", ""Conclusion""]","[""marketing"", ""evaluation"", ""management"", ""digital"", ""advertising"", ""brand""]",4,Marketing Coordinators & Specialists,"[""content marketing"", ""social media"", ""digital marketing""]",47,8,2025-10-25 19:28:21,en,What does the future hold for {keyword}?,0.65,0.6660185621943631,0.42
259,brand management,marketing,What emerging platforms support brand management?,comparison,Expert,"[""Introduction to brand management"", ""Key points and analysis"", ""Practical examples"", ""Expert insights"", ""Action items"", ""Conclusion""]","[""marketing"", ""management"", ""branding"", ""advertising"", ""brand"", ""comparison""]",4,Marketing Directors & CMOs,"[""social media"", ""digital marketing"", ""content marketing""]",49,6,2025-10-25 19:28:21,en,What emerging platforms support {keyword}?,0.67,1.0,0.89
265,brand management,marketing,What channels are most effective for brand management?,implementation,Beginner,"[""Introduction to brand management"", ""Key points and analysis"", ""Practical examples"", ""Expert insights"", ""Action items"", ""Conclusion""]","[""marketing"", ""management"", ""digital"", ""promotion"", ""brand"", ""implementation""]",4,Marketing Students & Interns,"[""social media"", ""digital marketing"", ""content marketing""]",54,8,2025-10-25 19:28:21,en,What channels are most effective for {keyword}?,0.89,0.4318429080560607,0.59
266,social media,marketing,How do you develop an effective social media strategy?,evaluation,Advanced,"[""Overview of social media"", ""Step-by-step implementation"", ""Best practices and tips"", ""Common challenges and solutions"", ""Tools and resources needed"", ""Conclusion and next steps""]","[""marketing"", ""social"", ""evaluation"", ""promotion"", ""media"", ""advertising""]",6,Marketing Managers & Strategists,"[""content marketing"", ""digital marketing"", ""brand management""]",54,9,2025-10-25 19:28:21,en,How do you develop an effective {keyword} strategy?,0.86,0.852589319274355,0.5
271,social media,marketing,What content types work best for social media?,strategy,Beginner,"[""Introduction to social media"", ""Key points and analysis"", ""Practical examples"", ""Expert insights"", ""Action items"", ""Conclusion""]","[""marketing"", ""social"", ""strategy"", ""branding"", ""promotion"", ""media""]",4,Marketing Students & Interns,"[""digital marketing"", ""content marketing"", ""brand management""]",46,8,2025-10-25 19:28:21,en,What content types work best for {keyword}?,0.87,0.4545399255869126,0.39
280,social media,marketing,What are the latest trends in social media?,implementation,Intermediate,"[""Introduction to social media"", ""Key concepts and definitions"", ""Main categories or types"", ""Examples and case studies"", ""Benefits and advantages"", ""Summary and recommendations""]","[""marketing"", ""social"", ""branding"", ""media"", ""advertising"", ""implementation""]",6,Marketing Coordinators & Specialists,"[""content marketing"", ""brand management"", ""digital marketing""]",43,8,2025-10-25 19:28:21,en,What are the latest trends in {keyword}?,0.92,0.7623969381705085,0.85
281,brand management,marketing,How do you track and analyze brand management performance?,implementation,Advanced,"[""Overview of brand management"", ""Step-by-step implementation"", ""Best practices and tips"", ""Common challenges and solutions"", ""Tools and resources needed"", ""Conclusion and next steps""]","[""marketing"", ""management"", ""branding"", ""digital"", ""brand"", ""implementation""]",6,Marketing Managers & Strategists,"[""social media"", ""digital marketing"", ""content marketing""]",58,9,2025-10-25 19:28:21,en,How do you track and analyze {keyword} performance?,0.62,0.922886976543447,0.57
286,social media,marketing,How do you attribute success to social media efforts?,how_to,Beginner,"[""Overview of social media"", ""Step-by-step implementation"", ""Best practices and tips"", ""Common challenges and solutions"", ""Tools and resources needed"", ""Conclusion and next steps""]","[""marketing"", ""social"", ""branding"", ""digital"", ""media"", ""how_to""]",6,Marketing Students & Interns,"[""content marketing"", ""digital marketing"", ""brand management""]",53,9,2025-10-25 19:28:21,en,How do you attribute success to {keyword} efforts?,0.6,0.3808255281661375,0.73
288,digital marketing,marketing,What messaging works best in digital marketing campaigns?,comparison,Beginner,"[""Introduction to digital marketing"", ""Key points and analysis"", ""Practical examples"", ""Expert insights"", ""Action items"", ""Conclusion""]","[""marketing"", ""digital"", ""advertising"", ""comparison""]",4,Marketing Students & Interns,"[""social media"", ""content marketing"", ""brand management""]",57,8,2025-10-25 19:28:21,en,What messaging works best in {keyword} campaigns?,0.65,0.4896202493368627,0.6
293,social media,marketing,How do you attribute success to social media efforts?,best_practice,Expert,"[""Overview of social media"", ""Step-by-step implementation"", ""Best practices and tips"", ""Common challenges and solutions"", ""Tools and resources needed"", ""Conclusion and next steps""]","[""marketing"", ""best_practice"", ""social"", ""digital"", ""promotion"", ""media""]",6,Marketing Directors & CMOs,"[""content marketing"", ""digital marketing"", ""brand management""]",53,9,2025-10-25 19:28:21,en,How do you attribute success to {keyword} efforts?,0.67,1.0,0.49
294,content marketing,marketing,How do you attribute success to content marketing efforts?,comparison,Advanced,"[""Overview of content marketing"", ""Step-by-step implementation"", ""Best practices and tips"", ""Common challenges and solutions"", ""Tools and resources needed"", ""Conclusion and next steps""]","[""marketing"", ""branding"", ""advertising"", ""content"", ""comparison""]",6,Marketing Managers & Strategists,"[""brand management"", ""social media"", ""digital marketing""]",58,9,2025-10-25 19:28:21,en,How do you attribute success to {keyword} efforts?,0.75,0.9553068044157448,0.79
295,digital marketing,marketing,What content types work best for digital marketing?,analysis,Intermediate,"[""Introduction to digital marketing"", ""Key points and analysis"", ""Practical examples"", ""Expert insights"", ""Action items"", ""Conclusion""]","[""marketing"", ""analysis"", ""branding"", ""digital""]",4,Marketing Coordinators & Specialists,"[""brand management"", ""social media"", ""content marketing""]",51,8,2025-10-25 19:28:21,en,What content types work best for {keyword}?,0.83,0.7062328807880307,0.82
297,content marketing,marketing,How do you attribute success to content marketing efforts?,how_to,Advanced,"[""Overview of content marketing"", ""Step-by-step implementation"", ""Best practices and tips"", ""Common challenges and solutions"", ""Tools and resources needed"", ""Conclusion and next steps""]","[""marketing"", ""digital"", ""promotion"", ""content"", ""how_to""]",6,Marketing Managers & Strategists,"[""social media"", ""digital marketing"", ""brand management""]",58,9,2025-10-25 19:28:21,en,How do you attribute success to {keyword} efforts?,0.67,0.8123914263911913,0.72
303,content marketing,marketing,How do you track and analyze content marketing performance?,comparison,Beginner,"[""Overview of content marketing"", ""Step-by-step implementation"", ""Best practices and tips"", ""Common challenges and solutions"", ""Tools and resources needed"", ""Conclusion and next steps""]","[""marketing"", ""branding"", ""digital"", ""content"", ""comparison""]",6,Marketing Students & Interns,"[""brand management"", ""social media"", ""digital marketing""]",59,9,2025-10-25 19:28:21,en,How do you track and analyze {keyword} performance?,0.94,0.4042263926652437,0.9
305,digital marketing,marketing,How do you develop an effective digital marketing strategy?,analysis,Advanced,"[""Overview of digital marketing"", ""Step-by-step implementation"", ""Best practices and tips"", ""Common challenges and solutions"", ""Tools and resources needed"", ""Conclusion and next steps""]","[""marketing"", ""analysis"", ""branding"", ""digital""]",6,Marketing Managers & Strategists,"[""content marketing"", ""social media"", ""brand management""]",59,9,2025-10-25 19:28:21,en,How do you develop an effective {keyword} strategy?,0.65,0.9118035023270306,0.4
306,digital marketing,marketing,How do you improve digital marketing conversion rates?,best_practice,Expert,"[""Overview of digital marketing"", ""Step-by-step implementation"", ""Best practices and tips"", ""Common challenges and solutions"", ""Tools and resources needed"", ""Conclusion and next steps""]","[""marketing"", ""digital"", ""best_practice"", ""advertising""]",6,Marketing Directors & CMOs,"[""social media"", ""brand management"", ""content marketing""]",54,8,2025-10-25 19:28:21,en,How do you improve {keyword} conversion rates?,0.82,1.0,0.61
308,digital marketing,marketing,How do you attribute success to digital marketing efforts?,comparison,Advanced,"[""Overview of digital marketing"", ""Step-by-step implementation"", ""Best practices and tips"", ""Common challenges and solutions"", ""Tools and resources needed"", ""Conclusion and next steps""]","[""marketing"", ""branding"", ""digital"", ""promotion"", ""comparison""]",6,Marketing Managers & Strategists,"[""content marketing"", ""social media"", ""brand management""]",58,9,2025-10-25 19:28:21,en,How do you attribute success to {keyword} efforts?,0.65,0.9066160284684438,0.54
309,brand management,marketing,What timing strategies work for brand management?,comparison,Beginner,"[""Introduction to brand management"", ""Key points and analysis"", ""Practical examples"", ""Expert insights"", ""Action items"", ""Conclusion""]","[""marketing"", ""management"", ""promotion"", ""digital"", ""brand"", ""comparison""]",4,Marketing Students & Interns,"[""social media"", ""content marketing"", ""digital marketing""]",49,7,2025-10-25 19:28:21,en,What timing strategies work for {keyword}?,0.87,0.3468949573472583,0.66
310,brand management,marketing,How do you attribute success to brand management efforts?,implementation,Beginner,"[""Overview of brand management"", ""Step-by-step implementation"", ""Best practices and tips"", ""Common challenges and solutions"", ""Tools and resources needed"", ""Conclusion and next steps""]","[""marketing"", ""management"", ""promotion"", ""advertising"", ""brand"", ""implementation""]",6,Marketing Students & Interns,"[""content marketing"", ""social media"", ""digital marketing""]",57,9,2025-10-25 19:28:21,en,How do you attribute success to {keyword} efforts?,0.92,0.4568862384164208,0.84
312,content marketing,marketing,What budget should be allocated to content marketing?,planning,Advanced,"[""Introduction to content marketing"", ""Key points and analysis"", ""Practical examples"", ""Expert insights"", ""Action items"", ""Conclusion""]","[""marketing"", ""branding"", ""digital"", ""planning"", ""content""]",4,Marketing Managers & Strategists,"[""brand management"", ""social media"", ""digital marketing""]",53,8,2025-10-25 19:28:21,en,What budget should be allocated to {keyword}?,0.61,0.8479739934501306,0.36
314,content marketing,marketing,How do you reach new customers through content marketing?,planning,Expert,"[""Overview of content marketing"", ""Step-by-step implementation"", ""Best practices and tips"", ""Common challenges and solutions"", ""Tools and resources needed"", ""Conclusion and next steps""]","[""marketing"", ""digital"", ""planning"", ""advertising"", ""content""]",6,Marketing Directors & CMOs,"[""social media"", ""brand management"", ""digital marketing""]",57,9,2025-10-25 19:28:21,en,How do you reach new customers through {keyword}?,0.62,1.0,0.58
315,digital marketing,marketing,How is AI changing digital marketing approaches?,analysis,Beginner,"[""Introduction to digital marketing"", ""Key points and analysis"", ""Practical examples"", ""Expert insights"", ""Action items"", ""Conclusion""]","[""marketing"", ""analysis"", ""digital"", ""advertising""]",4,Marketing Students & Interns,"[""social media"", ""content marketing"", ""brand management""]",48,7,2025-10-25 19:28:21,en,How is AI changing {keyword} approaches?,0.79,0.4848720238254825,0.39
317,brand management,marketing,How is AI changing brand management approaches?,comparison,Advanced,"[""Introduction to brand management"", ""Key points and analysis"", ""Practical examples"", ""Expert insights"", ""Action items"", ""Conclusion""]","[""marketing"", ""management"", ""branding"", ""advertising"", ""brand"", ""comparison""]",4,Marketing Managers & Strategists,"[""social media"", ""digital marketing"", ""content marketing""]",47,7,2025-10-25 19:28:21,en,How is AI changing {keyword} approaches?,0.87,0.9126836434235494,0.53
318,social media,marketing,How do you measure the ROI of social media campaigns?,implementation,Beginner,"[""Overview of social media"", ""Step-by-step implementation"", ""Best practices and tips"", ""Common challenges and solutions"", ""Tools and resources needed"", ""Conclusion and next steps""]","[""marketing"", ""social"", ""digital"", ""promotion"", ""media"", ""implementation""]",6,Marketing Students & Interns,"[""digital marketing"", ""brand management"", ""content marketing""]",53,10,2025-10-25 19:28:21,en,How do you measure the ROI of {keyword} campaigns?,0.68,0.4555381411543299,0.67
321,digital marketing,marketing,What are the latest trends in digital marketing?,troubleshooting,Intermediate,"[""Introduction to digital marketing"", ""Key concepts and definitions"", ""Main categories or types"", ""Examples and case studies"", ""Benefits and advantages"", ""Summary and recommendations""]","[""marketing"", ""digital"", ""troubleshooting"", ""branding""]",6,Marketing Coordinators & Specialists,"[""brand management"", ""social media"", ""content marketing""]",48,8,2025-10-25 19:28:21,en,What are the latest trends in {keyword}?,0.63,0.7937253360706806,0.34
323,digital marketing,marketing,How do you attribute success to digital marketing efforts?,evaluation,Expert,"[""Overview of digital marketing"", ""Step-by-step implementation"", ""Best practices and tips"", ""Common challenges and solutions"", ""Tools and resources needed"", ""Conclusion and next steps""]","[""marketing"", ""digital"", ""advertising"", ""evaluation""]",6,Marketing Directors & CMOs,"[""content marketing"", ""social media"", ""brand management""]",58,9,2025-10-25 19:28:21,en,How do you attribute success to {keyword} efforts?,0.67,1.0,0.89
324,social media,marketing,What messaging works best in social media campaigns?,optimization,Expert,"[""Introduction to social media"", ""Key points and analysis"", ""Practical examples"", ""Expert insights"", ""Action items"", ""Conclusion""]","[""marketing"", ""social"", ""promotion"", ""media"", ""advertising"", ""optimization""]",4,Marketing Directors & CMOs,"[""digital marketing"", ""content marketing"", ""brand management""]",52,8,2025-10-25 19:28:21,en,What messaging works best in {keyword} campaigns?,0.81,1.0,0.74
327,content marketing,marketing,What timing strategies work for content marketing?,strategy,Advanced,"[""Introduction to content marketing"", ""Key points and analysis"", ""Practical examples"", ""Expert insights"", ""Action items"", ""Conclusion""]","[""marketing"", ""strategy"", ""promotion"", ""advertising"", ""content""]",4,Marketing Managers & Strategists,"[""social media"", ""brand management"", ""digital marketing""]",50,7,2025-10-25 19:28:21,en,What timing strategies work for {keyword}?,0.72,0.823975084400729,0.36
328,social media,marketing,What demographics respond best to social media?,strategy,Advanced,"[""Introduction to social media"", ""Key points and analysis"", ""Practical examples"", ""Expert insights"", ""Action items"", ""Conclusion""]","[""marketing"", ""social"", ""strategy"", ""promotion"", ""media"", ""advertising""]",4,Marketing Managers & Strategists,"[""brand management"", ""content marketing"", ""digital marketing""]",47,7,2025-10-25 19:28:21,en,What demographics respond best to {keyword}?,0.78,0.9865755052195404,0.88
329,social media,marketing,What does the future hold for social media?,optimization,Intermediate,"[""Introduction to social media"", ""Key points and analysis"", ""Practical examples"", ""Expert insights"", ""Action items"", ""Conclusion""]","[""marketing"", ""social"", ""promotion"", ""media"", ""advertising"", ""optimization""]",4,Marketing Coordinators & Specialists,"[""brand management"", ""digital marketing"", ""content marketing""]",43,8,2025-10-25 19:28:21,en,What does the future hold for {keyword}?,0.66,0.6759913390463852,0.86
337,content marketing,marketing,How do you track and analyze content marketing performance?,analysis,Beginner,"[""Overview of content marketing"", ""Step-by-step implementation"", ""Best practices and tips"", ""Common challenges and solutions"", ""Tools and resources needed"", ""Conclusion and next steps""]","[""marketing"", ""branding"", ""digital"", ""analysis"", ""content""]",6,Marketing Students & Interns,"[""digital marketing"", ""social media"", ""brand management""]",59,9,2025-10-25 19:28:21,en,How do you track and analyze {keyword} performance?,0.62,0.3371375855237615,0.68
341,content marketing,marketing,How do you identify the right audience for content marketing?,implementation,Beginner,"[""Overview of content marketing"", ""Step-by-step implementation"", ""Best practices and tips"", ""Common challenges and solutions"", ""Tools and resources needed"", ""Conclusion and next steps""]","[""marketing"", ""digital"", ""advertising"", ""content"", ""implementation""]",6,Marketing Students & Interns,"[""social media"", ""digital marketing"", ""brand management""]",61,10,2025-10-25 19:28:21,en,How do you identify the right audience for {keyword}?,0.92,0.4548546974277316,0.86
342,brand management,marketing,How do you create a brand management roadmap?,how_to,Advanced,"[""Overview of brand management"", ""Step-by-step implementation"", ""Best practices and tips"", ""Common challenges and solutions"", ""Tools and resources needed"", ""Conclusion and next steps""]","[""marketing"", ""management"", ""branding"", ""promotion"", ""brand"", ""how_to""]",6,Marketing Managers & Strategists,"[""social media"", ""digital marketing"", ""content marketing""]",45,8,2025-10-25 19:28:21,en,How do you create a {keyword} roadmap?,0.72,0.8473150352954848,0.69
345,social media,marketing,How do you improve social media conversion rates?,evaluation,Beginner,"[""Overview of social media"", ""Step-by-step implementation"", ""Best practices and tips"", ""Common challenges and solutions"", ""Tools and resources needed"", ""Conclusion and next steps""]","[""marketing"", ""social"", ""evaluation"", ""digital"", ""media"", ""advertising""]",6,Marketing Students & Interns,"[""content marketing"", ""brand management"", ""digital marketing""]",49,8,2025-10-25 19:28:21,en,How do you improve {keyword} conversion rates?,0.78,0.4778128297713277,0.67
350,social media,marketing,What are the latest trends in social media?,how_to,Expert,"[""Introduction to social media"", ""Key concepts and definitions"", ""Main categories or types"", ""Examples and case studies"", ""Benefits and advantages"", ""Summary and recommendations""]","[""marketing"", ""social"", ""promotion"", ""media"", ""advertising"", ""how_to""]",6,Marketing Directors & CMOs,"[""digital marketing"", ""brand management"", ""content marketing""]",43,8,2025-10-25 19:28:21,en,What are the latest trends in {keyword}?,0.94,1.0,0.74
354,social media,marketing,How do you reach new customers through social media?,implementation,Advanced,"[""Overview of social media"", ""Step-by-step implementation"", ""Best practices and tips"", ""Common challenges and solutions"", ""Tools and resources needed"", ""Conclusion and next steps""]","[""marketing"", ""social"", ""digital"", ""media"", ""advertising"", ""implementation""]",6,Marketing Managers & Strategists,"[""digital marketing"", ""brand management"", ""content marketing""]",52,9,2025-10-25 19:28:21,en,How do you reach new customers through {keyword}?,0.6,0.908083562054468,0.43
355,social media,marketing,How do you reach new customers through social media?,planning,Advanced,"[""Overview of social media"", ""Step-by-step implementation"", ""Best practices and tips"", ""Common challenges and solutions"", ""Tools and resources needed"", ""Conclusion and next steps""]","[""marketing"", ""social"", ""digital"", ""media"", ""planning"", ""advertising""]",6,Marketing Managers & Strategists,"[""brand management"", ""digital marketing"", ""content marketing""]",52,9,2025-10-25 19:28:21,en,How do you reach new customers through {keyword}?,0.69,0.920807247855701,0.59
371,brand management,marketing,How do you track and analyze brand management performance?,optimization,Beginner,"[""Overview of brand management"", ""Step-by-step implementation"", ""Best practices and tips"", ""Common challenges and solutions"", ""Tools and resources needed"", ""Conclusion and next steps""]","[""marketing"", ""management"", ""promotion"", ""advertising"", ""brand"", ""optimization""]",6,Marketing Students & Interns,"[""social media"", ""digital marketing"", ""content marketing""]",58,9,2025-10-25 19:28:21,en,How do you track and analyze {keyword} performance?,0.89,0.3696500482105908,0.82
377,content marketing,marketing,What KPIs are most important for content marketing?,troubleshooting,Beginner,"[""Introduction to content marketing"", ""Key points and analysis"", ""Practical examples"", ""Expert insights"", ""Action items"", ""Conclusion""]","[""marketing"", ""branding"", ""troubleshooting"", ""promotion"", ""content""]",4,Marketing Students & Interns,"[""social media"", ""brand management"", ""digital marketing""]",51,8,2025-10-25 19:28:21,en,What KPIs are most important for {keyword}?,0.87,0.4142561977832297,0.48
378,social media,marketing,What demographics respond best to social media?,evaluation,Beginner,"[""Introduction to social media"", ""Key points and analysis"", ""Practical examples"", ""Expert insights"", ""Action items"", ""Conclusion""]","[""marketing"", ""social"", ""evaluation"", ""digital"", ""media"", ""advertising""]",4,Marketing Students & Interns,"[""content marketing"", ""brand management"", ""digital marketing""]",47,7,2025-10-25 19:28:21,en,What demographics respond best to {keyword}?,0.67,0.3413237975183961,0.45
382,brand management,marketing,How do you measure the ROI of brand management campaigns?,analysis,Advanced,"[""Overview of brand management"", ""Step-by-step implementation"", ""Best practices and tips"", ""Common challenges and solutions"", ""Tools and resources needed"", ""Conclusion and next steps""]","[""marketing"", ""management"", ""branding"", ""digital"", ""analysis"", ""brand""]",6,Marketing Managers & Strategists,"[""social media"", ""digital marketing"", ""content marketing""]",57,10,2025-10-25 19:28:21,en,How do you measure the ROI of {keyword} campaigns?,0.88,0.9923924169076874,0.76
387,content marketing,marketing,How do you create a content marketing roadmap?,strategy,Expert,"[""Overview of content marketing"", ""Step-by-step implementation"", ""Best practices and tips"", ""Common challenges and solutions"", ""Tools and resources needed"", ""Conclusion and next steps""]","[""marketing"", ""strategy"", ""branding"", ""promotion"", ""content""]",6,Marketing Directors & CMOs,"[""digital marketing"", ""social media"", ""brand management""]",46,8,2025-10-25 19:28:21,en,How do you create a {keyword} roadmap?,0.72,1.0,0.61
388,digital marketing,marketing,What emerging platforms support digital marketing?,troubleshooting,Beginner,"[""Introduction to digital marketing"", ""Key points and analysis"", ""Practical examples"", ""Expert insights"", ""Action items"", ""Conclusion""]","[""marketing"", ""digital"", ""troubleshooting"", ""promotion""]",4,Marketing Students & Interns,"[""brand management"", ""content marketing"", ""social media""]",50,6,2025-10-25 19:28:21,en,What emerging platforms support {keyword}?,0.71,0.450320538882676,0.79
