record_id,keyword,category,question,question_type,difficulty_level,answer_outline,tags,estimated_read_time,target_audience,related_topics,question_length,word_count,created_date,language,source_template,engagement_score,complexity_score,popularity_score
28800001,digital marketing,marketing,How do you attribute success to digital marketing efforts?,comparison,Advanced,"[""Overview of digital marketing"", ""Step-by-step implementation"", ""Best practices and tips"", ""Common challenges and solutions"", ""Tools and resources needed"", ""Conclusion and next steps""]","[""promotion"", ""comparison"", ""marketing"", ""digital"", ""advertising""]",6,Marketing Managers & Strategists,"[""brand management"", ""social media"", ""content marketing""]",58,9,2025-10-25 21:36:49,en,How do you attribute success to {keyword} efforts?,0.74,0.976791011742215,0.6
28800002,content marketing,marketing,What KPIs are most important for content marketing?,best_practice,Intermediate,"[""Introduction to content marketing"", ""Key points and analysis"", ""Practical examples"", ""Expert insights"", ""Action items"", ""Conclusion""]","[""content"", ""best_practice"", ""marketing"", ""digital"", ""branding""]",4,Marketing Coordinators & Specialists,"[""social media"", ""digital marketing"", ""brand management""]",51,8,2025-10-25 21:36:49,en,What KPIs are most important for {keyword}?,0.61,0.6598660448112904,0.52
28800003,digital marketing,marketing,How do you improve digital marketing conversion rates?,optimization,Beginner,"[""Overview of digital marketing"", ""Step-by-step implementation"", ""Best practices and tips"", ""Common challenges and solutions"", ""Tools and resources needed"", ""Conclusion and next steps""]","[""marketing"", ""optimization"", ""advertising"", ""digital""]",6,Marketing Students & Interns,"[""content marketing"", ""brand management"", ""social media""]",54,8,2025-10-25 21:36:49,en,How do you improve {keyword} conversion rates?,0.94,0.4171349720919964,0.75
28800004,brand management,marketing,How do you personalize brand management for different segments?,best_practice,Advanced,"[""Overview of brand management"", ""Step-by-step implementation"", ""Best practices and tips"", ""Common challenges and solutions"", ""Tools and resources needed"", ""Conclusion and next steps""]","[""promotion"", ""best_practice"", ""marketing"", ""management"", ""branding"", ""brand""]",6,Marketing Managers & Strategists,"[""content marketing"", ""social media"", ""digital marketing""]",63,9,2025-10-25 21:36:49,en,How do you personalize {keyword} for different segments?,0.71,0.9510041489397317,0.56
28800005,portfolio management,economics,How do you identify opportunities in portfolio management markets?,optimization,Advanced,"[""Overview of portfolio management"", ""Step-by-step implementation"", ""Best practices and tips"", ""Common challenges and solutions"", ""Tools and resources needed"", ""Conclusion and next steps""]","[""investment"", ""portfolio"", ""management"", ""business"", ""optimization"", ""economics""]",6,Professional Investors & Advisors,"[""market analysis"", ""investment planning"", ""financial modeling""]",66,9,2025-10-25 21:36:49,en,How do you identify opportunities in {keyword} markets?,0.62,0.9800202810397324,0.51
28800006,data science,it,What career opportunities exist in data science?,evaluation,Advanced,"[""Introduction to data science"", ""Key points and analysis"", ""Practical examples"", ""Expert insights"", ""Action items"", ""Conclusion""]","[""technology"", ""software"", ""it"", ""science"", ""evaluation"", ""data""]",4,Senior Developers & Tech Leads,"[""machine learning"", ""web development"", ""cybersecurity"", ""cloud computing""]",48,7,2025-10-25 21:36:49,en,What career opportunities exist in {keyword}?,0.64,0.8772987091464162,0.3
28800007,portfolio management,economics,How do you adjust your portfolio management strategy during volatility?,how_to,Advanced,"[""Overview of portfolio management"", ""Step-by-step implementation"", ""Best practices and tips"", ""Common challenges and solutions"", ""Tools and resources needed"", ""Conclusion and next steps""]","[""investment"", ""how_to"", ""finance"", ""portfolio"", ""management"", ""economics""]",6,Professional Investors & Advisors,"[""investment planning"", ""financial modeling"", ""market analysis""]",71,10,2025-10-25 21:36:49,en,How do you adjust your {keyword} strategy during volatility?,0.66,0.8812125648777185,0.79
28800008,portfolio management,economics,How do you adjust your portfolio management strategy during volatility?,strategy,Beginner,"[""Overview of portfolio management"", ""Step-by-step implementation"", ""Best practices and tips"", ""Common challenges and solutions"", ""Tools and resources needed"", ""Conclusion and next steps""]","[""finance"", ""portfolio"", ""management"", ""business"", ""strategy"", ""economics""]",6,Students & New Investors,"[""investment planning"", ""financial modeling"", ""market analysis""]",71,10,2025-10-25 21:36:49,en,How do you adjust your {keyword} strategy during volatility?,0.88,0.49957920952089796,0.68
28800009,cybersecurity,it,What are the key components of a cybersecurity implementation?,comparison,Beginner,"[""Introduction to cybersecurity"", ""Key concepts and definitions"", ""Main categories or types"", ""Examples and case studies"", ""Benefits and advantages"", ""Summary and recommendations""]","[""development"", ""it"", ""comparison"", ""cybersecurity"", ""technology""]",5,Students & Entry-level Developers,"[""machine learning"", ""cloud computing"", ""web development"", ""data science""]",62,9,2025-10-25 21:36:49,en,What are the key components of a {keyword} implementation?,0.82,0.3651125493864179,0.86
28800010,machine learning,it,How do you get started with machine learning as a beginner?,best_practice,Expert,"[""Overview of machine learning"", ""Step-by-step implementation"", ""Best practices and tips"", ""Common challenges and solutions"", ""Tools and resources needed"", ""Conclusion and next steps""]","[""it"", ""best_practice"", ""programming"", ""learning"", ""machine"", ""technology""]",6,Architects & Technical Directors,"[""cloud computing"", ""cybersecurity"", ""data science"", ""web development""]",59,11,2025-10-25 21:36:49,en,How do you get started with {keyword} as a beginner?,0.81,1.0,0.58
28800011,market analysis,economics,How do you analyze market trends in market analysis?,optimization,Intermediate,"[""Overview of market analysis"", ""Step-by-step implementation"", ""Best practices and tips"", ""Common challenges and solutions"", ""Tools and resources needed"", ""Conclusion and next steps""]","[""finance"", ""analysis"", ""business"", ""market"", ""optimization"", ""economics""]",6,Individual Investors & Analysts,"[""financial modeling"", ""portfolio management"", ""investment planning""]",52,9,2025-10-25 21:36:49,en,How do you analyze market trends in {keyword}?,0.76,0.754613821863259,0.89
28800012,web development,it,What is the recommended architecture for web development systems?,evaluation,Intermediate,"[""Introduction to web development"", ""Key points and analysis"", ""Practical examples"", ""Expert insights"", ""Action items"", ""Conclusion""]","[""development"", ""web"", ""it"", ""evaluation"", ""technology""]",4,Junior to Mid-level Developers,"[""cybersecurity"", ""machine learning"", ""cloud computing"", ""data science""]",65,9,2025-10-25 21:36:49,en,What is the recommended architecture for {keyword} systems?,0.7,0.7663898566480696,0.77
28800013,investment planning,economics,What are the regulatory considerations for investment planning?,comparison,Intermediate,"[""Introduction to investment planning"", ""Key concepts and definitions"", ""Main categories or types"", ""Examples and case studies"", ""Benefits and advantages"", ""Summary and recommendations""]","[""investment"", ""planning"", ""finance"", ""comparison"", ""economics""]",6,Individual Investors & Analysts,"[""market analysis"", ""financial modeling"", ""portfolio management""]",63,8,2025-10-25 21:36:49,en,What are the regulatory considerations for {keyword}?,0.67,0.649800441251064,0.41
28800014,market analysis,economics,How do you adjust your market analysis strategy during volatility?,strategy,Intermediate,"[""Overview of market analysis"", ""Step-by-step implementation"", ""Best practices and tips"", ""Common challenges and solutions"", ""Tools and resources needed"", ""Conclusion and next steps""]","[""analysis"", ""business"", ""market"", ""strategy"", ""economics""]",6,Individual Investors & Analysts,"[""financial modeling"", ""portfolio management"", ""investment planning""]",66,10,2025-10-25 21:36:49,en,How do you adjust your {keyword} strategy during volatility?,0.63,0.7356778378371702,0.79
28800015,web development,it,How do you optimize web development for different platforms?,comparison,Expert,"[""Overview of web development"", ""Step-by-step implementation"", ""Best practices and tips"", ""Common challenges and solutions"", ""Tools and resources needed"", ""Conclusion and next steps""]","[""software"", ""development"", ""it"", ""comparison"", ""programming"", ""web""]",6,Architects & Technical Directors,"[""cybersecurity"", ""machine learning"", ""data science"", ""cloud computing""]",60,9,2025-10-25 21:36:49,en,How do you optimize {keyword} for different platforms?,0.88,1.0,0.89
28800016,content marketing,marketing,How do you create a content marketing roadmap?,how_to,Expert,"[""Overview of content marketing"", ""Step-by-step implementation"", ""Best practices and tips"", ""Common challenges and solutions"", ""Tools and resources needed"", ""Conclusion and next steps""]","[""how_to"", ""content"", ""marketing"", ""digital"", ""advertising""]",6,Marketing Directors & CMOs,"[""digital marketing"", ""brand management"", ""social media""]",46,8,2025-10-25 21:36:49,en,How do you create a {keyword} roadmap?,0.71,1.0,0.42
28800017,social media,marketing,What messaging works best in social media campaigns?,comparison,Advanced,"[""Introduction to social media"", ""Key points and analysis"", ""Practical examples"", ""Expert insights"", ""Action items"", ""Conclusion""]","[""media"", ""comparison"", ""digital"", ""marketing"", ""social"", ""branding""]",4,Marketing Managers & Strategists,"[""brand management"", ""digital marketing"", ""content marketing""]",52,8,2025-10-25 21:36:49,en,What messaging works best in {keyword} campaigns?,0.7,0.8112081484750597,0.73
28800018,financial modeling,economics,How do you report on financial modeling performance to stakeholders?,comparison,Expert,"[""Overview of financial modeling"", ""Step-by-step implementation"", ""Best practices and tips"", ""Common challenges and solutions"", ""Tools and resources needed"", ""Conclusion and next steps""]","[""investment"", ""comparison"", ""modeling"", ""financial"", ""business"", ""economics""]",6,Portfolio Managers & Financial Experts,"[""investment planning"", ""market analysis"", ""portfolio management""]",68,10,2025-10-25 21:36:49,en,How do you report on {keyword} performance to stakeholders?,0.76,1.0,0.82
28800019,portfolio management,economics,How do you assess and manage portfolio management risks?,implementation,Advanced,"[""Overview of portfolio management"", ""Step-by-step implementation"", ""Best practices and tips"", ""Common challenges and solutions"", ""Tools and resources needed"", ""Conclusion and next steps""]","[""finance"", ""implementation"", ""portfolio"", ""management"", ""business"", ""economics""]",6,Professional Investors & Advisors,"[""financial modeling"", ""market analysis"", ""investment planning""]",56,9,2025-10-25 21:36:49,en,How do you assess and manage {keyword} risks?,0.68,0.959779333729068,0.33
28800020,social media,marketing,What KPIs are most important for social media?,planning,Beginner,"[""Introduction to social media"", ""Key points and analysis"", ""Practical examples"", ""Expert insights"", ""Action items"", ""Conclusion""]","[""planning"", ""media"", ""promotion"", ""marketing"", ""social"", ""branding""]",4,Marketing Students & Interns,"[""digital marketing"", ""content marketing"", ""brand management""]",46,8,2025-10-25 21:36:49,en,What KPIs are most important for {keyword}?,0.61,0.40260162152747314,0.39
28800021,brand management,marketing,How do you automate brand management processes?,implementation,Beginner,"[""Overview of brand management"", ""Step-by-step implementation"", ""Best practices and tips"", ""Common challenges and solutions"", ""Tools and resources needed"", ""Conclusion and next steps""]","[""implementation"", ""promotion"", ""marketing"", ""management"", ""digital"", ""brand""]",6,Marketing Students & Interns,"[""digital marketing"", ""content marketing"", ""social media""]",47,7,2025-10-25 21:36:49,en,How do you automate {keyword} processes?,0.84,0.3461016453334118,0.5
28800022,investment planning,economics,How do you diversify your portfolio using investment planning?,optimization,Expert,"[""Overview of investment planning"", ""Step-by-step implementation"", ""Best practices and tips"", ""Common challenges and solutions"", ""Tools and resources needed"", ""Conclusion and next steps""]","[""investment"", ""planning"", ""business"", ""optimization"", ""economics""]",6,Portfolio Managers & Financial Experts,"[""market analysis"", ""financial modeling"", ""portfolio management""]",62,9,2025-10-25 21:36:49,en,How do you diversify your portfolio using {keyword}?,0.71,1.0,0.83
28800023,content marketing,marketing,How do you identify the right audience for content marketing?,optimization,Expert,"[""Overview of content marketing"", ""Step-by-step implementation"", ""Best practices and tips"", ""Common challenges and solutions"", ""Tools and resources needed"", ""Conclusion and next steps""]","[""content"", ""marketing"", ""digital"", ""advertising"", ""optimization""]",6,Marketing Directors & CMOs,"[""digital marketing"", ""brand management"", ""social media""]",61,10,2025-10-25 21:36:49,en,How do you identify the right audience for {keyword}?,0.67,1.0,0.82
28800024,content marketing,marketing,How do you develop an effective content marketing strategy?,implementation,Beginner,"[""Overview of content marketing"", ""Step-by-step implementation"", ""Best practices and tips"", ""Common challenges and solutions"", ""Tools and resources needed"", ""Conclusion and next steps""]","[""content"", ""implementation"", ""marketing"", ""digital"", ""branding""]",6,Marketing Students & Interns,"[""digital marketing"", ""social media"", ""brand management""]",59,9,2025-10-25 21:36:49,en,How do you develop an effective {keyword} strategy?,0.77,0.3096605233572943,0.47
28800025,data science,it,How do you design a scalable data science solution?,optimization,Intermediate,"[""Overview of data science"", ""Step-by-step implementation"", ""Best practices and tips"", ""Common challenges and solutions"", ""Tools and resources needed"", ""Conclusion and next steps""]","[""software"", ""development"", ""it"", ""science"", ""optimization"", ""data""]",6,Junior to Mid-level Developers,"[""cloud computing"", ""web development"", ""cybersecurity"", ""machine learning""]",51,9,2025-10-25 21:36:49,en,How do you design a scalable {keyword} solution?,0.94,0.7197750919928253,0.88
28800026,portfolio management,economics,What indicators predict portfolio management market movements?,best_practice,Expert,"[""Introduction to portfolio management"", ""Key points and analysis"", ""Practical examples"", ""Expert insights"", ""Action items"", ""Conclusion""]","[""investment"", ""portfolio"", ""best_practice"", ""management"", ""market"", ""economics""]",4,Portfolio Managers & Financial Experts,"[""investment planning"", ""financial modeling"", ""market analysis""]",62,7,2025-10-25 21:36:49,en,What indicators predict {keyword} market movements?,0.74,1.0,0.71
28800027,market analysis,economics,What factors should be considered when evaluating market analysis?,how_to,Intermediate,"[""Introduction to market analysis"", ""Key points and analysis"", ""Practical examples"", ""Expert insights"", ""Action items"", ""Conclusion""]","[""investment"", ""how_to"", ""analysis"", ""market"", ""business"", ""economics""]",4,Individual Investors & Analysts,"[""portfolio management"", ""financial modeling"", ""investment planning""]",66,9,2025-10-25 21:36:49,en,What factors should be considered when evaluating {keyword}?,0.66,0.6409343285510435,0.47
28800028,web development,it,What career opportunities exist in web development?,evaluation,Intermediate,"[""Introduction to web development"", ""Key points and analysis"", ""Practical examples"", ""Expert insights"", ""Action items"", ""Conclusion""]","[""development"", ""web"", ""it"", ""programming"", ""evaluation"", ""technology""]",4,Junior to Mid-level Developers,"[""data science"", ""cloud computing"", ""machine learning"", ""cybersecurity""]",51,7,2025-10-25 21:36:49,en,What career opportunities exist in {keyword}?,0.64,0.6781623017551094,0.46
28800029,content marketing,marketing,What channels are most effective for content marketing?,planning,Intermediate,"[""Introduction to content marketing"", ""Key points and analysis"", ""Practical examples"", ""Expert insights"", ""Action items"", ""Conclusion""]","[""planning"", ""content"", ""marketing"", ""digital"", ""advertising""]",4,Marketing Coordinators & Specialists,"[""digital marketing"", ""social media"", ""brand management""]",55,8,2025-10-25 21:36:49,en,What channels are most effective for {keyword}?,0.81,0.62245549844579,0.62
28800030,content marketing,marketing,How do you reach new customers through content marketing?,how_to,Advanced,"[""Overview of content marketing"", ""Step-by-step implementation"", ""Best practices and tips"", ""Common challenges and solutions"", ""Tools and resources needed"", ""Conclusion and next steps""]","[""how_to"", ""content"", ""promotion"", ""marketing"", ""advertising""]",6,Marketing Managers & Strategists,"[""digital marketing"", ""brand management"", ""social media""]",57,9,2025-10-25 21:36:49,en,How do you reach new customers through {keyword}?,0.85,0.8109704240766383,0.67
28800031,financial modeling,economics,How do you assess and manage financial modeling risks?,implementation,Intermediate,"[""Overview of financial modeling"", ""Step-by-step implementation"", ""Best practices and tips"", ""Common challenges and solutions"", ""Tools and resources needed"", ""Conclusion and next steps""]","[""investment"", ""implementation"", ""modeling"", ""financial"", ""market"", ""economics""]",6,Individual Investors & Analysts,"[""investment planning"", ""market analysis"", ""portfolio management""]",54,9,2025-10-25 21:36:49,en,How do you assess and manage {keyword} risks?,0.94,0.6658750162901247,0.75
28800032,cybersecurity,it,What skills are needed to master cybersecurity?,optimization,Beginner,"[""Introduction to cybersecurity"", ""Key points and analysis"", ""Practical examples"", ""Expert insights"", ""Action items"", ""Conclusion""]","[""development"", ""it"", ""programming"", ""optimization"", ""cybersecurity""]",4,Students & Entry-level Developers,"[""cloud computing"", ""web development"", ""machine learning"", ""data science""]",47,7,2025-10-25 21:36:49,en,What skills are needed to master {keyword}?,0.87,0.43649695296781377,0.6
28800033,investment planning,economics,What metrics are most important for investment planning?,how_to,Beginner,"[""Introduction to investment planning"", ""Key points and analysis"", ""Practical examples"", ""Expert insights"", ""Action items"", ""Conclusion""]","[""investment"", ""how_to"", ""planning"", ""finance"", ""market"", ""economics""]",4,Students & New Investors,"[""portfolio management"", ""financial modeling"", ""market analysis""]",56,8,2025-10-25 21:36:49,en,What metrics are most important for {keyword}?,0.67,0.34014765538589864,0.56
28800034,social media,marketing,How do you track and analyze social media performance?,best_practice,Intermediate,"[""Overview of social media"", ""Step-by-step implementation"", ""Best practices and tips"", ""Common challenges and solutions"", ""Tools and resources needed"", ""Conclusion and next steps""]","[""media"", ""best_practice"", ""digital"", ""marketing"", ""social"", ""branding""]",6,Marketing Coordinators & Specialists,"[""content marketing"", ""brand management"", ""digital marketing""]",54,9,2025-10-25 21:36:49,en,How do you track and analyze {keyword} performance?,0.8,0.7033878060498844,0.62
28800035,social media,marketing,What tools are essential for social media analytics?,best_practice,Advanced,"[""Introduction to social media"", ""Key points and analysis"", ""Practical examples"", ""Expert insights"", ""Action items"", ""Conclusion""]","[""media"", ""best_practice"", ""marketing"", ""social"", ""advertising"", ""branding""]",4,Marketing Managers & Strategists,"[""content marketing"", ""brand management"", ""digital marketing""]",52,8,2025-10-25 21:36:49,en,What tools are essential for {keyword} analytics?,0.84,0.9160817117185721,0.44
28800036,cloud computing,it,What tools are essential for cloud computing development?,optimization,Intermediate,"[""Introduction to cloud computing"", ""Key points and analysis"", ""Practical examples"", ""Expert insights"", ""Action items"", ""Conclusion""]","[""computing"", ""cloud"", ""development"", ""it"", ""programming"", ""optimization""]",4,Junior to Mid-level Developers,"[""web development"", ""cybersecurity"", ""machine learning"", ""data science""]",57,8,2025-10-25 21:36:49,en,What tools are essential for {keyword} development?,0.93,0.7775470827915016,0.45
28800037,market analysis,economics,What indicators predict market analysis market movements?,comparison,Advanced,"[""Introduction to market analysis"", ""Key points and analysis"", ""Practical examples"", ""Expert insights"", ""Action items"", ""Conclusion""]","[""investment"", ""analysis"", ""comparison"", ""market"", ""economics""]",4,Professional Investors & Advisors,"[""investment planning"", ""portfolio management"", ""financial modeling""]",57,7,2025-10-25 21:36:49,en,What indicators predict {keyword} market movements?,0.94,0.9935243401543491,0.89
28800038,portfolio management,economics,What tools help analyze portfolio management data?,strategy,Beginner,"[""Introduction to portfolio management"", ""Key points and analysis"", ""Practical examples"", ""Expert insights"", ""Action items"", ""Conclusion""]","[""investment"", ""portfolio"", ""management"", ""market"", ""strategy"", ""economics""]",4,Students & New Investors,"[""financial modeling"", ""market analysis"", ""investment planning""]",50,7,2025-10-25 21:36:49,en,What tools help analyze {keyword} data?,0.82,0.35114427980489415,0.37
28800039,brand management,marketing,What demographics respond best to brand management?,best_practice,Beginner,"[""Introduction to brand management"", ""Key points and analysis"", ""Practical examples"", ""Expert insights"", ""Action items"", ""Conclusion""]","[""best_practice"", ""marketing"", ""management"", ""advertising"", ""branding"", ""brand""]",4,Marketing Students & Interns,"[""content marketing"", ""digital marketing"", ""social media""]",51,7,2025-10-25 21:36:49,en,What demographics respond best to {keyword}?,0.91,0.3798529349654484,0.88
28800040,content marketing,marketing,How do you reach new customers through content marketing?,implementation,Intermediate,"[""Overview of content marketing"", ""Step-by-step implementation"", ""Best practices and tips"", ""Common challenges and solutions"", ""Tools and resources needed"", ""Conclusion and next steps""]","[""content"", ""implementation"", ""marketing"", ""advertising"", ""branding""]",6,Marketing Coordinators & Specialists,"[""brand management"", ""social media"", ""digital marketing""]",57,9,2025-10-25 21:36:49,en,How do you reach new customers through {keyword}?,0.68,0.6458469613390827,0.52
28800041,machine learning,it,What career opportunities exist in machine learning?,optimization,Advanced,"[""Introduction to machine learning"", ""Key points and analysis"", ""Practical examples"", ""Expert insights"", ""Action items"", ""Conclusion""]","[""software"", ""it"", ""programming"", ""learning"", ""optimization"", ""machine""]",4,Senior Developers & Tech Leads,"[""cloud computing"", ""cybersecurity"", ""data science"", ""web development""]",52,7,2025-10-25 21:36:49,en,What career opportunities exist in {keyword}?,0.72,0.893386152716542,0.85
28800042,financial modeling,economics,How do you measure financial modeling performance?,how_to,Beginner,"[""Overview of financial modeling"", ""Step-by-step implementation"", ""Best practices and tips"", ""Common challenges and solutions"", ""Tools and resources needed"", ""Conclusion and next steps""]","[""how_to"", ""modeling"", ""financial"", ""market"", ""business"", ""economics""]",6,Students & New Investors,"[""investment planning"", ""portfolio management"", ""market analysis""]",50,7,2025-10-25 21:36:49,en,How do you measure {keyword} performance?,0.72,0.37521141099051913,0.56
28800043,cybersecurity,it,What design patterns work best with cybersecurity?,strategy,Beginner,"[""Introduction to cybersecurity"", ""Key points and analysis"", ""Practical examples"", ""Expert insights"", ""Action items"", ""Conclusion""]","[""software"", ""development"", ""it"", ""strategy"", ""cybersecurity""]",4,Students & Entry-level Developers,"[""machine learning"", ""data science"", ""cloud computing"", ""web development""]",50,7,2025-10-25 21:36:49,en,What design patterns work best with {keyword}?,0.61,0.4090877387646047,0.84
