record_id,keyword,category,question,question_type,difficulty_level,answer_outline,tags,estimated_read_time,target_audience,related_topics,question_length,word_count,created_date,language,source_template,engagement_score,complexity_score,popularity_score
36800349,machine learning,it,What tools are essential for machine learning development?,strategy,Advanced,"[""Introduction to machine learning"", ""Key points and analysis"", ""Practical examples"", ""Expert insights"", ""Action items"", ""Conclusion""]","[""software"", ""it"", ""learning"", ""strategy"", ""machine"", ""technology""]",4,Senior Developers & Tech Leads,"[""cybersecurity"", ""data science"", ""cloud computing"", ""web development""]",58,8,2025-10-25 21:47:59,en,What tools are essential for {keyword} development?,0.9,0.8475775586286785,0.47
36800350,content marketing,marketing,What timing strategies work for content marketing?,how_to,Beginner,"[""Introduction to content marketing"", ""Key points and analysis"", ""Practical examples"", ""Expert insights"", ""Action items"", ""Conclusion""]","[""how_to"", ""content"", ""promotion"", ""marketing"", ""advertising""]",4,Marketing Students & Interns,"[""digital marketing"", ""social media"", ""brand management""]",50,7,2025-10-25 21:47:59,en,What timing strategies work for {keyword}?,0.63,0.4723746069032333,0.54
36800351,market analysis,economics,What tools help analyze market analysis data?,implementation,Beginner,"[""Introduction to market analysis"", ""Key points and analysis"", ""Practical examples"", ""Expert insights"", ""Action items"", ""Conclusion""]","[""analysis"", ""finance"", ""implementation"", ""market"", ""business"", ""economics""]",4,Students & New Investors,"[""investment planning"", ""financial modeling"", ""portfolio management""]",45,7,2025-10-25 21:47:59,en,What tools help analyze {keyword} data?,0.73,0.3986880437907902,0.88
36800352,social media,marketing,What timing strategies work for social media?,comparison,Intermediate,"[""Introduction to social media"", ""Key points and analysis"", ""Practical examples"", ""Expert insights"", ""Action items"", ""Conclusion""]","[""media"", ""comparison"", ""digital"", ""marketing"", ""social"", ""advertising""]",4,Marketing Coordinators & Specialists,"[""brand management"", ""content marketing"", ""digital marketing""]",45,7,2025-10-25 21:47:59,en,What timing strategies work for {keyword}?,0.69,0.6675213855433227,0.37
36800353,brand management,marketing,What timing strategies work for brand management?,strategy,Intermediate,"[""Introduction to brand management"", ""Key points and analysis"", ""Practical examples"", ""Expert insights"", ""Action items"", ""Conclusion""]","[""marketing"", ""management"", ""digital"", ""branding"", ""strategy"", ""brand""]",4,Marketing Coordinators & Specialists,"[""digital marketing"", ""social media"", ""content marketing""]",49,7,2025-10-25 21:47:59,en,What timing strategies work for {keyword}?,0.81,0.6998157498147297,0.77
36800354,web development,it,What tools are essential for web development development?,planning,Intermediate,"[""Introduction to web development"", ""Key points and analysis"", ""Practical examples"", ""Expert insights"", ""Action items"", ""Conclusion""]","[""planning"", ""development"", ""it"", ""programming"", ""web""]",4,Junior to Mid-level Developers,"[""cloud computing"", ""data science"", ""machine learning"", ""cybersecurity""]",57,8,2025-10-25 21:47:59,en,What tools are essential for {keyword} development?,0.62,0.676402322582803,0.53
36800355,brand management,marketing,What tools are essential for brand management analytics?,strategy,Advanced,"[""Introduction to brand management"", ""Key points and analysis"", ""Practical examples"", ""Expert insights"", ""Action items"", ""Conclusion""]","[""promotion"", ""digital"", ""marketing"", ""management"", ""strategy"", ""brand""]",4,Marketing Managers & Strategists,"[""digital marketing"", ""content marketing"", ""social media""]",56,8,2025-10-25 21:47:59,en,What tools are essential for {keyword} analytics?,0.7,0.9457175534005281,0.49
36800356,content marketing,marketing,What channels are most effective for content marketing?,how_to,Beginner,"[""Introduction to content marketing"", ""Key points and analysis"", ""Practical examples"", ""Expert insights"", ""Action items"", ""Conclusion""]","[""how_to"", ""content"", ""marketing"", ""advertising"", ""branding""]",4,Marketing Students & Interns,"[""brand management"", ""digital marketing"", ""social media""]",55,8,2025-10-25 21:47:59,en,What channels are most effective for {keyword}?,0.82,0.4416418911193191,0.58
36800357,brand management,marketing,How do you develop an effective brand management strategy?,evaluation,Intermediate,"[""Overview of brand management"", ""Step-by-step implementation"", ""Best practices and tips"", ""Common challenges and solutions"", ""Tools and resources needed"", ""Conclusion and next steps""]","[""marketing"", ""management"", ""advertising"", ""branding"", ""evaluation"", ""brand""]",6,Marketing Coordinators & Specialists,"[""digital marketing"", ""social media"", ""content marketing""]",58,9,2025-10-25 21:47:59,en,How do you develop an effective {keyword} strategy?,0.78,0.6460633601263376,0.46
36800358,digital marketing,marketing,How do you measure the ROI of digital marketing campaigns?,planning,Beginner,"[""Overview of digital marketing"", ""Step-by-step implementation"", ""Best practices and tips"", ""Common challenges and solutions"", ""Tools and resources needed"", ""Conclusion and next steps""]","[""marketing"", ""advertising"", ""planning"", ""digital""]",6,Marketing Students & Interns,"[""brand management"", ""social media"", ""content marketing""]",58,10,2025-10-25 21:47:59,en,How do you measure the ROI of {keyword} campaigns?,0.76,0.33031088213476933,0.57
36800359,social media,marketing,How do you reach new customers through social media?,best_practice,Intermediate,"[""Overview of social media"", ""Step-by-step implementation"", ""Best practices and tips"", ""Common challenges and solutions"", ""Tools and resources needed"", ""Conclusion and next steps""]","[""media"", ""promotion"", ""best_practice"", ""marketing"", ""social"", ""advertising""]",6,Marketing Coordinators & Specialists,"[""content marketing"", ""brand management"", ""digital marketing""]",52,9,2025-10-25 21:47:59,en,How do you reach new customers through {keyword}?,0.83,0.7812191478960887,0.86
36800360,investment planning,economics,How do you protect your investment planning investments?,implementation,Expert,"[""Overview of investment planning"", ""Step-by-step implementation"", ""Best practices and tips"", ""Common challenges and solutions"", ""Tools and resources needed"", ""Conclusion and next steps""]","[""investment"", ""planning"", ""finance"", ""implementation"", ""economics""]",6,Portfolio Managers & Financial Experts,"[""financial modeling"", ""portfolio management"", ""market analysis""]",56,8,2025-10-25 21:47:59,en,How do you protect your {keyword} investments?,0.67,1.0,0.39
36800361,investment planning,economics,What are the risks associated with investment planning?,evaluation,Intermediate,"[""Introduction to investment planning"", ""Key concepts and definitions"", ""Main categories or types"", ""Examples and case studies"", ""Benefits and advantages"", ""Summary and recommendations""]","[""investment"", ""planning"", ""finance"", ""evaluation"", ""economics""]",6,Individual Investors & Analysts,"[""financial modeling"", ""market analysis"", ""portfolio management""]",55,8,2025-10-25 21:47:59,en,What are the risks associated with {keyword}?,0.63,0.7210275032914345,0.78
36800362,investment planning,economics,What tools help analyze investment planning data?,implementation,Advanced,"[""Introduction to investment planning"", ""Key points and analysis"", ""Practical examples"", ""Expert insights"", ""Action items"", ""Conclusion""]","[""investment"", ""planning"", ""finance"", ""implementation"", ""business"", ""economics""]",4,Professional Investors & Advisors,"[""financial modeling"", ""portfolio management"", ""market analysis""]",49,7,2025-10-25 21:47:59,en,What tools help analyze {keyword} data?,0.78,0.9857077635659445,0.33
36800363,digital marketing,marketing,How do you create a digital marketing roadmap?,analysis,Advanced,"[""Overview of digital marketing"", ""Step-by-step implementation"", ""Best practices and tips"", ""Common challenges and solutions"", ""Tools and resources needed"", ""Conclusion and next steps""]","[""marketing"", ""advertising"", ""analysis"", ""digital""]",6,Marketing Managers & Strategists,"[""social media"", ""brand management"", ""content marketing""]",46,8,2025-10-25 21:47:59,en,How do you create a {keyword} roadmap?,0.62,0.8770776860531737,0.67
36800364,content marketing,marketing,What budget should be allocated to content marketing?,optimization,Intermediate,"[""Introduction to content marketing"", ""Key points and analysis"", ""Practical examples"", ""Expert insights"", ""Action items"", ""Conclusion""]","[""content"", ""promotion"", ""marketing"", ""branding"", ""optimization""]",4,Marketing Coordinators & Specialists,"[""digital marketing"", ""social media"", ""brand management""]",53,8,2025-10-25 21:47:59,en,What budget should be allocated to {keyword}?,0.64,0.6638835562278611,0.8
36800365,market analysis,economics,What insurance options are available for market analysis?,best_practice,Beginner,"[""Introduction to market analysis"", ""Key points and analysis"", ""Practical examples"", ""Expert insights"", ""Action items"", ""Conclusion""]","[""finance"", ""analysis"", ""best_practice"", ""market"", ""business"", ""economics""]",4,Students & New Investors,"[""financial modeling"", ""investment planning"", ""portfolio management""]",57,8,2025-10-25 21:47:59,en,What insurance options are available for {keyword}?,0.93,0.3912064754058128,0.57
36800366,market analysis,economics,What are the risks associated with market analysis?,implementation,Advanced,"[""Introduction to market analysis"", ""Key concepts and definitions"", ""Main categories or types"", ""Examples and case studies"", ""Benefits and advantages"", ""Summary and recommendations""]","[""analysis"", ""implementation"", ""market"", ""business"", ""economics""]",6,Professional Investors & Advisors,"[""investment planning"", ""financial modeling"", ""portfolio management""]",51,8,2025-10-25 21:47:59,en,What are the risks associated with {keyword}?,0.65,0.9093512198701265,0.37
36800367,investment planning,economics,How do you analyze market trends in investment planning?,evaluation,Expert,"[""Overview of investment planning"", ""Step-by-step implementation"", ""Best practices and tips"", ""Common challenges and solutions"", ""Tools and resources needed"", ""Conclusion and next steps""]","[""investment"", ""planning"", ""evaluation"", ""market"", ""economics""]",6,Portfolio Managers & Financial Experts,"[""portfolio management"", ""market analysis"", ""financial modeling""]",56,9,2025-10-25 21:47:59,en,How do you analyze market trends in {keyword}?,0.76,1.0,0.6
36800368,brand management,marketing,How do you track and analyze brand management performance?,evaluation,Advanced,"[""Overview of brand management"", ""Step-by-step implementation"", ""Best practices and tips"", ""Common challenges and solutions"", ""Tools and resources needed"", ""Conclusion and next steps""]","[""marketing"", ""management"", ""advertising"", ""digital"", ""evaluation"", ""brand""]",6,Marketing Managers & Strategists,"[""digital marketing"", ""social media"", ""content marketing""]",58,9,2025-10-25 21:47:59,en,How do you track and analyze {keyword} performance?,0.77,0.8599720124729677,0.82
36800369,cybersecurity,it,What certifications are valuable for cybersecurity professionals?,analysis,Expert,"[""Introduction to cybersecurity"", ""Key points and analysis"", ""Practical examples"", ""Expert insights"", ""Action items"", ""Conclusion""]","[""software"", ""analysis"", ""it"", ""cybersecurity"", ""technology""]",4,Architects & Technical Directors,"[""data science"", ""cloud computing"", ""web development"", ""machine learning""]",65,7,2025-10-25 21:47:59,en,What certifications are valuable for {keyword} professionals?,0.93,1.0,0.63
36800370,financial modeling,economics,What tools help analyze financial modeling data?,best_practice,Advanced,"[""Introduction to financial modeling"", ""Key points and analysis"", ""Practical examples"", ""Expert insights"", ""Action items"", ""Conclusion""]","[""best_practice"", ""modeling"", ""financial"", ""market"", ""business"", ""economics""]",4,Professional Investors & Advisors,"[""portfolio management"", ""market analysis"", ""investment planning""]",48,7,2025-10-25 21:47:59,en,What tools help analyze {keyword} data?,0.7,0.89944735950846,0.64
36800371,content marketing,marketing,What demographics respond best to content marketing?,analysis,Beginner,"[""Introduction to content marketing"", ""Key points and analysis"", ""Practical examples"", ""Expert insights"", ""Action items"", ""Conclusion""]","[""content"", ""analysis"", ""marketing"", ""digital"", ""branding""]",4,Marketing Students & Interns,"[""digital marketing"", ""social media"", ""brand management""]",52,7,2025-10-25 21:47:59,en,What demographics respond best to {keyword}?,0.62,0.41040291840569504,0.39
36800372,content marketing,marketing,What budget should be allocated to content marketing?,implementation,Intermediate,"[""Introduction to content marketing"", ""Key points and analysis"", ""Practical examples"", ""Expert insights"", ""Action items"", ""Conclusion""]","[""content"", ""implementation"", ""promotion"", ""marketing"", ""advertising""]",4,Marketing Coordinators & Specialists,"[""social media"", ""digital marketing"", ""brand management""]",53,8,2025-10-25 21:47:59,en,What budget should be allocated to {keyword}?,0.64,0.7830751097925606,0.62
36800373,social media,marketing,What tools are essential for social media analytics?,comparison,Intermediate,"[""Introduction to social media"", ""Key points and analysis"", ""Practical examples"", ""Expert insights"", ""Action items"", ""Conclusion""]","[""media"", ""promotion"", ""comparison"", ""marketing"", ""social"", ""advertising""]",4,Marketing Coordinators & Specialists,"[""content marketing"", ""brand management"", ""digital marketing""]",52,8,2025-10-25 21:47:59,en,What tools are essential for {keyword} analytics?,0.69,0.7311326291442601,0.78
36800374,social media,marketing,What are the latest trends in social media?,best_practice,Beginner,"[""Introduction to social media"", ""Key concepts and definitions"", ""Main categories or types"", ""Examples and case studies"", ""Benefits and advantages"", ""Summary and recommendations""]","[""media"", ""best_practice"", ""marketing"", ""digital"", ""social"", ""advertising""]",6,Marketing Students & Interns,"[""digital marketing"", ""brand management"", ""content marketing""]",43,8,2025-10-25 21:47:59,en,What are the latest trends in {keyword}?,0.88,0.4682719314989746,0.8
36800375,social media,marketing,How do you innovate within social media?,best_practice,Advanced,"[""Overview of social media"", ""Step-by-step implementation"", ""Best practices and tips"", ""Common challenges and solutions"", ""Tools and resources needed"", ""Conclusion and next steps""]","[""media"", ""best_practice"", ""marketing"", ""digital"", ""social"", ""advertising""]",6,Marketing Managers & Strategists,"[""digital marketing"", ""content marketing"", ""brand management""]",40,7,2025-10-25 21:47:59,en,How do you innovate within {keyword}?,0.69,0.9709134578774947,0.6
36800376,portfolio management,economics,What are the regulatory considerations for portfolio management?,troubleshooting,Advanced,"[""Introduction to portfolio management"", ""Key concepts and definitions"", ""Main categories or types"", ""Examples and case studies"", ""Benefits and advantages"", ""Summary and recommendations""]","[""investment"", ""portfolio"", ""troubleshooting"", ""management"", ""market"", ""economics""]",6,Professional Investors & Advisors,"[""financial modeling"", ""investment planning"", ""market analysis""]",64,8,2025-10-25 21:47:59,en,What are the regulatory considerations for {keyword}?,0.93,0.9972388859798238,0.48
36800377,portfolio management,economics,How do you report on portfolio management performance to stakeholders?,optimization,Advanced,"[""Overview of portfolio management"", ""Step-by-step implementation"", ""Best practices and tips"", ""Common challenges and solutions"", ""Tools and resources needed"", ""Conclusion and next steps""]","[""finance"", ""portfolio"", ""management"", ""business"", ""optimization"", ""economics""]",6,Professional Investors & Advisors,"[""market analysis"", ""financial modeling"", ""investment planning""]",70,10,2025-10-25 21:47:59,en,How do you report on {keyword} performance to stakeholders?,0.88,0.8192178011863115,0.7
36800378,social media,marketing,What are the latest trends in social media?,planning,Advanced,"[""Introduction to social media"", ""Key concepts and definitions"", ""Main categories or types"", ""Examples and case studies"", ""Benefits and advantages"", ""Summary and recommendations""]","[""planning"", ""media"", ""marketing"", ""digital"", ""social"", ""advertising""]",6,Marketing Managers & Strategists,"[""digital marketing"", ""content marketing"", ""brand management""]",43,8,2025-10-25 21:47:59,en,What are the latest trends in {keyword}?,0.89,0.8334817285459396,0.42
36800379,brand management,marketing,What budget should be allocated to brand management?,planning,Expert,"[""Introduction to brand management"", ""Key points and analysis"", ""Practical examples"", ""Expert insights"", ""Action items"", ""Conclusion""]","[""planning"", ""promotion"", ""marketing"", ""management"", ""branding"", ""brand""]",4,Marketing Directors & CMOs,"[""social media"", ""content marketing"", ""digital marketing""]",52,8,2025-10-25 21:47:59,en,What budget should be allocated to {keyword}?,0.69,1.0,0.37
36800380,machine learning,it,What ROI can be expected from machine learning implementation?,troubleshooting,Beginner,"[""Introduction to machine learning"", ""Key points and analysis"", ""Practical examples"", ""Expert insights"", ""Action items"", ""Conclusion""]","[""development"", ""it"", ""programming"", ""troubleshooting"", ""learning"", ""machine""]",4,Students & Entry-level Developers,"[""data science"", ""cybersecurity"", ""cloud computing"", ""web development""]",62,9,2025-10-25 21:47:59,en,What ROI can be expected from {keyword} implementation?,0.7,0.40938708578374494,0.86
36800381,cybersecurity,it,What ROI can be expected from cybersecurity implementation?,troubleshooting,Advanced,"[""Introduction to cybersecurity"", ""Key points and analysis"", ""Practical examples"", ""Expert insights"", ""Action items"", ""Conclusion""]","[""software"", ""it"", ""programming"", ""troubleshooting"", ""cybersecurity""]",4,Senior Developers & Tech Leads,"[""cloud computing"", ""web development"", ""machine learning"", ""data science""]",59,8,2025-10-25 21:47:59,en,What ROI can be expected from {keyword} implementation?,0.68,0.9228054427288512,0.56
36800382,cybersecurity,it,What certifications are valuable for cybersecurity professionals?,analysis,Advanced,"[""Introduction to cybersecurity"", ""Key points and analysis"", ""Practical examples"", ""Expert insights"", ""Action items"", ""Conclusion""]","[""analysis"", ""it"", ""programming"", ""cybersecurity"", ""technology""]",4,Senior Developers & Tech Leads,"[""cloud computing"", ""machine learning"", ""data science"", ""web development""]",65,7,2025-10-25 21:47:59,en,What certifications are valuable for {keyword} professionals?,0.79,0.8649673868300608,0.89
36800383,machine learning,it,How does machine learning impact business operations?,evaluation,Beginner,"[""Introduction to machine learning"", ""Key points and analysis"", ""Practical examples"", ""Expert insights"", ""Action items"", ""Conclusion""]","[""development"", ""it"", ""learning"", ""evaluation"", ""machine"", ""technology""]",4,Students & Entry-level Developers,"[""data science"", ""web development"", ""cybersecurity"", ""cloud computing""]",53,7,2025-10-25 21:47:59,en,How does {keyword} impact business operations?,0.91,0.38031502448900834,0.89
36800384,machine learning,it,What career opportunities exist in machine learning?,comparison,Beginner,"[""Introduction to machine learning"", ""Key points and analysis"", ""Practical examples"", ""Expert insights"", ""Action items"", ""Conclusion""]","[""development"", ""it"", ""comparison"", ""programming"", ""learning"", ""machine""]",4,Students & Entry-level Developers,"[""data science"", ""web development"", ""cloud computing"", ""cybersecurity""]",52,7,2025-10-25 21:47:59,en,What career opportunities exist in {keyword}?,0.66,0.3500621084045099,0.81
36800385,portfolio management,economics,What tools help analyze portfolio management data?,analysis,Intermediate,"[""Introduction to portfolio management"", ""Key points and analysis"", ""Practical examples"", ""Expert insights"", ""Action items"", ""Conclusion""]","[""investment"", ""analysis"", ""portfolio"", ""management"", ""market"", ""economics""]",4,Individual Investors & Analysts,"[""investment planning"", ""financial modeling"", ""market analysis""]",50,7,2025-10-25 21:47:59,en,What tools help analyze {keyword} data?,0.77,0.7370614759155278,0.31
36800386,content marketing,marketing,What KPIs are most important for content marketing?,analysis,Beginner,"[""Introduction to content marketing"", ""Key points and analysis"", ""Practical examples"", ""Expert insights"", ""Action items"", ""Conclusion""]","[""content"", ""analysis"", ""marketing"", ""digital"", ""advertising""]",4,Marketing Students & Interns,"[""digital marketing"", ""social media"", ""brand management""]",51,8,2025-10-25 21:47:59,en,What KPIs are most important for {keyword}?,0.63,0.32082170297725254,0.75
36800387,content marketing,marketing,What channels are most effective for content marketing?,planning,Advanced,"[""Introduction to content marketing"", ""Key points and analysis"", ""Practical examples"", ""Expert insights"", ""Action items"", ""Conclusion""]","[""planning"", ""content"", ""promotion"", ""marketing"", ""digital""]",4,Marketing Managers & Strategists,"[""brand management"", ""digital marketing"", ""social media""]",55,8,2025-10-25 21:47:59,en,What channels are most effective for {keyword}?,0.76,0.800752498447832,0.55
36800388,market analysis,economics,How do you create a long-term plan for market analysis?,planning,Expert,"[""Overview of market analysis"", ""Step-by-step implementation"", ""Best practices and tips"", ""Common challenges and solutions"", ""Tools and resources needed"", ""Conclusion and next steps""]","[""planning"", ""analysis"", ""market"", ""business"", ""economics""]",6,Portfolio Managers & Financial Experts,"[""investment planning"", ""financial modeling"", ""portfolio management""]",55,10,2025-10-25 21:47:59,en,How do you create a long-term plan for {keyword}?,0.86,1.0,0.3
36800389,social media,marketing,What messaging works best in social media campaigns?,implementation,Advanced,"[""Introduction to social media"", ""Key points and analysis"", ""Practical examples"", ""Expert insights"", ""Action items"", ""Conclusion""]","[""media"", ""implementation"", ""promotion"", ""marketing"", ""social"", ""branding""]",4,Marketing Managers & Strategists,"[""digital marketing"", ""content marketing"", ""brand management""]",52,8,2025-10-25 21:47:59,en,What messaging works best in {keyword} campaigns?,0.9,0.8460523786325684,0.37
36800390,digital marketing,marketing,How do you reach new customers through digital marketing?,implementation,Intermediate,"[""Overview of digital marketing"", ""Step-by-step implementation"", ""Best practices and tips"", ""Common challenges and solutions"", ""Tools and resources needed"", ""Conclusion and next steps""]","[""implementation"", ""marketing"", ""advertising"", ""digital""]",6,Marketing Coordinators & Specialists,"[""social media"", ""brand management"", ""content marketing""]",57,9,2025-10-25 21:47:59,en,How do you reach new customers through {keyword}?,0.9,0.6929958658840853,0.35
36800391,web development,it,What security considerations should be taken when using web development?,how_to,Intermediate,"[""Introduction to web development"", ""Key points and analysis"", ""Practical examples"", ""Expert insights"", ""Action items"", ""Conclusion""]","[""how_to"", ""software"", ""development"", ""it"", ""programming"", ""web""]",4,Junior to Mid-level Developers,"[""cybersecurity"", ""data science"", ""machine learning"", ""cloud computing""]",72,10,2025-10-25 21:47:59,en,What security considerations should be taken when using {keyword}?,0.75,0.6349630051697447,0.74
36800392,investment planning,economics,How do you measure investment planning performance?,best_practice,Beginner,"[""Overview of investment planning"", ""Step-by-step implementation"", ""Best practices and tips"", ""Common challenges and solutions"", ""Tools and resources needed"", ""Conclusion and next steps""]","[""investment"", ""planning"", ""best_practice"", ""market"", ""economics""]",6,Students & New Investors,"[""portfolio management"", ""market analysis"", ""financial modeling""]",51,7,2025-10-25 21:47:59,en,How do you measure {keyword} performance?,0.68,0.4694873486964066,0.41
