record_id,keyword,category,question,question_type,difficulty_level,answer_outline,tags,estimated_read_time,target_audience,related_topics,question_length,word_count,created_date,language,source_template,engagement_score,complexity_score,popularity_score
38600653,portfolio management,economics,What metrics are most important for portfolio management?,evaluation,Expert,"[""Introduction to portfolio management"", ""Key points and analysis"", ""Practical examples"", ""Expert insights"", ""Action items"", ""Conclusion""]","[""portfolio"", ""management"", ""evaluation"", ""market"", ""business"", ""economics""]",4,Portfolio Managers & Financial Experts,"[""financial modeling"", ""market analysis"", ""investment planning""]",57,8,2025-10-25 21:50:23,en,What metrics are most important for {keyword}?,0.86,1.0,0.84
38600654,web development,it,What is the recommended architecture for web development systems?,implementation,Expert,"[""Introduction to web development"", ""Key points and analysis"", ""Practical examples"", ""Expert insights"", ""Action items"", ""Conclusion""]","[""software"", ""development"", ""it"", ""implementation"", ""web""]",4,Architects & Technical Directors,"[""data science"", ""cybersecurity"", ""machine learning"", ""cloud computing""]",65,9,2025-10-25 21:50:23,en,What is the recommended architecture for {keyword} systems?,0.72,1.0,0.85
38600655,financial modeling,economics,What indicators predict financial modeling market movements?,strategy,Advanced,"[""Introduction to financial modeling"", ""Key points and analysis"", ""Practical examples"", ""Expert insights"", ""Action items"", ""Conclusion""]","[""investment"", ""modeling"", ""financial"", ""business"", ""strategy"", ""economics""]",4,Professional Investors & Advisors,"[""investment planning"", ""portfolio management"", ""market analysis""]",60,7,2025-10-25 21:50:23,en,What indicators predict {keyword} market movements?,0.72,0.9918120851698364,0.54
38600656,digital marketing,marketing,What KPIs are most important for digital marketing?,evaluation,Advanced,"[""Introduction to digital marketing"", ""Key points and analysis"", ""Practical examples"", ""Expert insights"", ""Action items"", ""Conclusion""]","[""promotion"", ""marketing"", ""digital"", ""branding"", ""evaluation""]",4,Marketing Managers & Strategists,"[""social media"", ""brand management"", ""content marketing""]",51,8,2025-10-25 21:50:23,en,What KPIs are most important for {keyword}?,0.91,0.9938054820494007,0.51
38600657,machine learning,it,How do you optimize machine learning for different platforms?,comparison,Advanced,"[""Overview of machine learning"", ""Step-by-step implementation"", ""Best practices and tips"", ""Common challenges and solutions"", ""Tools and resources needed"", ""Conclusion and next steps""]","[""development"", ""it"", ""comparison"", ""programming"", ""learning"", ""machine""]",6,Senior Developers & Tech Leads,"[""cloud computing"", ""data science"", ""web development"", ""cybersecurity""]",61,9,2025-10-25 21:50:23,en,How do you optimize {keyword} for different platforms?,0.73,0.9595193584245459,0.72
38600658,financial modeling,economics,What tools help analyze financial modeling data?,troubleshooting,Advanced,"[""Introduction to financial modeling"", ""Key points and analysis"", ""Practical examples"", ""Expert insights"", ""Action items"", ""Conclusion""]","[""troubleshooting"", ""modeling"", ""financial"", ""market"", ""business"", ""economics""]",4,Professional Investors & Advisors,"[""market analysis"", ""investment planning"", ""portfolio management""]",48,7,2025-10-25 21:50:23,en,What tools help analyze {keyword} data?,0.74,0.9883949280670523,0.83
38600659,cloud computing,it,How do you integrate cloud computing with existing systems?,implementation,Expert,"[""Overview of cloud computing"", ""Step-by-step implementation"", ""Best practices and tips"", ""Common challenges and solutions"", ""Tools and resources needed"", ""Conclusion and next steps""]","[""computing"", ""software"", ""it"", ""implementation"", ""programming"", ""cloud""]",6,Architects & Technical Directors,"[""cybersecurity"", ""machine learning"", ""data science"", ""web development""]",59,9,2025-10-25 21:50:23,en,How do you integrate {keyword} with existing systems?,0.64,1.0,0.85
38600660,content marketing,marketing,How do you track and analyze content marketing performance?,strategy,Beginner,"[""Overview of content marketing"", ""Step-by-step implementation"", ""Best practices and tips"", ""Common challenges and solutions"", ""Tools and resources needed"", ""Conclusion and next steps""]","[""content"", ""marketing"", ""advertising"", ""branding"", ""strategy""]",6,Marketing Students & Interns,"[""digital marketing"", ""brand management"", ""social media""]",59,9,2025-10-25 21:50:23,en,How do you track and analyze {keyword} performance?,0.74,0.3674226487275691,0.53
38600661,brand management,marketing,How do you reach new customers through brand management?,implementation,Intermediate,"[""Overview of brand management"", ""Step-by-step implementation"", ""Best practices and tips"", ""Common challenges and solutions"", ""Tools and resources needed"", ""Conclusion and next steps""]","[""implementation"", ""marketing"", ""management"", ""advertising"", ""digital"", ""brand""]",6,Marketing Coordinators & Specialists,"[""content marketing"", ""social media"", ""digital marketing""]",56,9,2025-10-25 21:50:23,en,How do you reach new customers through {keyword}?,0.62,0.6169431784625219,0.85
38600662,content marketing,marketing,What A/B tests should you run for content marketing?,analysis,Beginner,"[""Introduction to content marketing"", ""Key points and analysis"", ""Practical examples"", ""Expert insights"", ""Action items"", ""Conclusion""]","[""content"", ""analysis"", ""marketing"", ""advertising"", ""branding""]",4,Marketing Students & Interns,"[""digital marketing"", ""social media"", ""brand management""]",52,9,2025-10-25 21:50:23,en,What A/B tests should you run for {keyword}?,0.93,0.3790271416191542,0.83
38600663,market analysis,economics,How do you benchmark market analysis against alternatives?,troubleshooting,Intermediate,"[""Overview of market analysis"", ""Step-by-step implementation"", ""Best practices and tips"", ""Common challenges and solutions"", ""Tools and resources needed"", ""Conclusion and next steps""]","[""investment"", ""analysis"", ""finance"", ""troubleshooting"", ""market"", ""economics""]",6,Individual Investors & Analysts,"[""portfolio management"", ""financial modeling"", ""investment planning""]",58,8,2025-10-25 21:50:23,en,How do you benchmark {keyword} against alternatives?,0.74,0.6169756777832685,0.8
38600664,data science,it,How do you optimize data science for different platforms?,strategy,Expert,"[""Overview of data science"", ""Step-by-step implementation"", ""Best practices and tips"", ""Common challenges and solutions"", ""Tools and resources needed"", ""Conclusion and next steps""]","[""technology"", ""development"", ""it"", ""science"", ""strategy"", ""data""]",6,Architects & Technical Directors,"[""web development"", ""machine learning"", ""cybersecurity"", ""cloud computing""]",57,9,2025-10-25 21:50:23,en,How do you optimize {keyword} for different platforms?,0.72,1.0,0.52
38600665,investment planning,economics,What exit strategies should be considered for investment planning?,implementation,Expert,"[""Introduction to investment planning"", ""Key points and analysis"", ""Practical examples"", ""Expert insights"", ""Action items"", ""Conclusion""]","[""investment"", ""planning"", ""implementation"", ""market"", ""business"", ""economics""]",4,Portfolio Managers & Financial Experts,"[""financial modeling"", ""market analysis"", ""portfolio management""]",66,9,2025-10-25 21:50:23,en,What exit strategies should be considered for {keyword}?,0.76,1.0,0.36
38600666,web development,it,How does web development impact business operations?,analysis,Expert,"[""Introduction to web development"", ""Key points and analysis"", ""Practical examples"", ""Expert insights"", ""Action items"", ""Conclusion""]","[""development"", ""analysis"", ""it"", ""programming"", ""web""]",4,Architects & Technical Directors,"[""cloud computing"", ""data science"", ""cybersecurity"", ""machine learning""]",52,7,2025-10-25 21:50:23,en,How does {keyword} impact business operations?,0.71,1.0,0.75
38600667,social media,marketing,What are the latest trends in social media?,best_practice,Expert,"[""Introduction to social media"", ""Key concepts and definitions"", ""Main categories or types"", ""Examples and case studies"", ""Benefits and advantages"", ""Summary and recommendations""]","[""media"", ""best_practice"", ""marketing"", ""digital"", ""social"", ""branding""]",6,Marketing Directors & CMOs,"[""digital marketing"", ""brand management"", ""content marketing""]",43,8,2025-10-25 21:50:23,en,What are the latest trends in {keyword}?,0.67,1.0,0.74
38600668,brand management,marketing,What tools are essential for brand management analytics?,planning,Expert,"[""Introduction to brand management"", ""Key points and analysis"", ""Practical examples"", ""Expert insights"", ""Action items"", ""Conclusion""]","[""planning"", ""marketing"", ""management"", ""advertising"", ""digital"", ""brand""]",4,Marketing Directors & CMOs,"[""social media"", ""content marketing"", ""digital marketing""]",56,8,2025-10-25 21:50:23,en,What tools are essential for {keyword} analytics?,0.84,1.0,0.7
38600669,market analysis,economics,How do you assess and manage market analysis risks?,planning,Expert,"[""Overview of market analysis"", ""Step-by-step implementation"", ""Best practices and tips"", ""Common challenges and solutions"", ""Tools and resources needed"", ""Conclusion and next steps""]","[""investment"", ""planning"", ""analysis"", ""finance"", ""market"", ""economics""]",6,Portfolio Managers & Financial Experts,"[""investment planning"", ""financial modeling"", ""portfolio management""]",51,9,2025-10-25 21:50:23,en,How do you assess and manage {keyword} risks?,0.69,1.0,0.35
38600670,machine learning,it,What are the latest trends in machine learning technology?,implementation,Advanced,"[""Introduction to machine learning"", ""Key concepts and definitions"", ""Main categories or types"", ""Examples and case studies"", ""Benefits and advantages"", ""Summary and recommendations""]","[""software"", ""it"", ""implementation"", ""programming"", ""learning"", ""machine""]",6,Senior Developers & Tech Leads,"[""data science"", ""web development"", ""cybersecurity"", ""cloud computing""]",58,9,2025-10-25 21:50:23,en,What are the latest trends in {keyword} technology?,0.83,0.883454521906505,0.86
38600671,cloud computing,it,How do you troubleshoot common issues with cloud computing?,how_to,Expert,"[""Overview of cloud computing"", ""Step-by-step implementation"", ""Best practices and tips"", ""Common challenges and solutions"", ""Tools and resources needed"", ""Conclusion and next steps""]","[""computing"", ""how_to"", ""software"", ""development"", ""it"", ""cloud""]",6,Architects & Technical Directors,"[""machine learning"", ""web development"", ""cybersecurity"", ""data science""]",59,9,2025-10-25 21:50:23,en,How do you troubleshoot common issues with {keyword}?,0.62,1.0,0.47
38600672,market analysis,economics,What are the risks associated with market analysis?,how_to,Advanced,"[""Introduction to market analysis"", ""Key concepts and definitions"", ""Main categories or types"", ""Examples and case studies"", ""Benefits and advantages"", ""Summary and recommendations""]","[""how_to"", ""analysis"", ""finance"", ""market"", ""business"", ""economics""]",6,Professional Investors & Advisors,"[""financial modeling"", ""investment planning"", ""portfolio management""]",51,8,2025-10-25 21:50:23,en,What are the risks associated with {keyword}?,0.81,0.951956706980789,0.76
38600673,market analysis,economics,What are the risks associated with market analysis?,strategy,Expert,"[""Introduction to market analysis"", ""Key concepts and definitions"", ""Main categories or types"", ""Examples and case studies"", ""Benefits and advantages"", ""Summary and recommendations""]","[""investment"", ""analysis"", ""business"", ""market"", ""strategy"", ""economics""]",6,Portfolio Managers & Financial Experts,"[""investment planning"", ""portfolio management"", ""financial modeling""]",51,8,2025-10-25 21:50:23,en,What are the risks associated with {keyword}?,0.81,1.0,0.61
38600674,web development,it,How do you get started with web development as a beginner?,planning,Intermediate,"[""Overview of web development"", ""Step-by-step implementation"", ""Best practices and tips"", ""Common challenges and solutions"", ""Tools and resources needed"", ""Conclusion and next steps""]","[""software"", ""planning"", ""development"", ""it"", ""web""]",6,Junior to Mid-level Developers,"[""machine learning"", ""cloud computing"", ""cybersecurity"", ""data science""]",58,11,2025-10-25 21:50:23,en,How do you get started with {keyword} as a beginner?,0.88,0.7327296297598113,0.33
38600675,digital marketing,marketing,How do you optimize digital marketing for mobile users?,implementation,Advanced,"[""Overview of digital marketing"", ""Step-by-step implementation"", ""Best practices and tips"", ""Common challenges and solutions"", ""Tools and resources needed"", ""Conclusion and next steps""]","[""implementation"", ""promotion"", ""marketing"", ""digital"", ""branding""]",6,Marketing Managers & Strategists,"[""content marketing"", ""social media"", ""brand management""]",55,9,2025-10-25 21:50:23,en,How do you optimize {keyword} for mobile users?,0.81,0.9126907750960824,0.49
38600676,market analysis,economics,What is the optimal allocation for market analysis in a portfolio?,evaluation,Advanced,"[""Introduction to market analysis"", ""Key points and analysis"", ""Practical examples"", ""Expert insights"", ""Action items"", ""Conclusion""]","[""finance"", ""analysis"", ""evaluation"", ""market"", ""economics""]",4,Professional Investors & Advisors,"[""investment planning"", ""financial modeling"", ""portfolio management""]",66,11,2025-10-25 21:50:23,en,What is the optimal allocation for {keyword} in a portfolio?,0.66,0.9258631702005123,0.74
38600677,financial modeling,economics,How do you assess and manage financial modeling risks?,how_to,Advanced,"[""Overview of financial modeling"", ""Step-by-step implementation"", ""Best practices and tips"", ""Common challenges and solutions"", ""Tools and resources needed"", ""Conclusion and next steps""]","[""investment"", ""how_to"", ""finance"", ""modeling"", ""financial"", ""economics""]",6,Professional Investors & Advisors,"[""investment planning"", ""portfolio management"", ""market analysis""]",54,9,2025-10-25 21:50:23,en,How do you assess and manage {keyword} risks?,0.74,0.9364101908297293,0.31
38600678,data science,it,What skills are needed to master data science?,how_to,Advanced,"[""Introduction to data science"", ""Key points and analysis"", ""Practical examples"", ""Expert insights"", ""Action items"", ""Conclusion""]","[""how_to"", ""technology"", ""it"", ""programming"", ""science"", ""data""]",4,Senior Developers & Tech Leads,"[""cybersecurity"", ""machine learning"", ""web development"", ""cloud computing""]",46,8,2025-10-25 21:50:23,en,What skills are needed to master {keyword}?,0.88,0.8316698620281255,0.76
38600679,web development,it,How do you get started with web development as a beginner?,troubleshooting,Intermediate,"[""Overview of web development"", ""Step-by-step implementation"", ""Best practices and tips"", ""Common challenges and solutions"", ""Tools and resources needed"", ""Conclusion and next steps""]","[""development"", ""web"", ""it"", ""programming"", ""troubleshooting"", ""technology""]",6,Junior to Mid-level Developers,"[""machine learning"", ""data science"", ""cybersecurity"", ""cloud computing""]",58,11,2025-10-25 21:50:23,en,How do you get started with {keyword} as a beginner?,0.93,0.6756436304297397,0.57
38600680,social media,marketing,How do you attribute success to social media efforts?,strategy,Beginner,"[""Overview of social media"", ""Step-by-step implementation"", ""Best practices and tips"", ""Common challenges and solutions"", ""Tools and resources needed"", ""Conclusion and next steps""]","[""media"", ""digital"", ""marketing"", ""social"", ""advertising"", ""strategy""]",6,Marketing Students & Interns,"[""content marketing"", ""brand management"", ""digital marketing""]",53,9,2025-10-25 21:50:23,en,How do you attribute success to {keyword} efforts?,0.89,0.43705726549271845,0.67
38600681,investment planning,economics,What insurance options are available for investment planning?,analysis,Advanced,"[""Introduction to investment planning"", ""Key points and analysis"", ""Practical examples"", ""Expert insights"", ""Action items"", ""Conclusion""]","[""investment"", ""planning"", ""analysis"", ""market"", ""economics""]",4,Professional Investors & Advisors,"[""market analysis"", ""financial modeling"", ""portfolio management""]",61,8,2025-10-25 21:50:23,en,What insurance options are available for {keyword}?,0.61,0.8669155345154186,0.35
38600682,market analysis,economics,How do you identify opportunities in market analysis markets?,comparison,Advanced,"[""Overview of market analysis"", ""Step-by-step implementation"", ""Best practices and tips"", ""Common challenges and solutions"", ""Tools and resources needed"", ""Conclusion and next steps""]","[""investment"", ""analysis"", ""comparison"", ""market"", ""economics""]",6,Professional Investors & Advisors,"[""financial modeling"", ""investment planning"", ""portfolio management""]",61,9,2025-10-25 21:50:23,en,How do you identify opportunities in {keyword} markets?,0.85,0.8308384039221925,0.45
38600683,market analysis,economics,How do you assess and manage market analysis risks?,planning,Expert,"[""Overview of market analysis"", ""Step-by-step implementation"", ""Best practices and tips"", ""Common challenges and solutions"", ""Tools and resources needed"", ""Conclusion and next steps""]","[""planning"", ""finance"", ""analysis"", ""market"", ""business"", ""economics""]",6,Portfolio Managers & Financial Experts,"[""portfolio management"", ""financial modeling"", ""investment planning""]",51,9,2025-10-25 21:50:23,en,How do you assess and manage {keyword} risks?,0.89,1.0,0.31
38600684,digital marketing,marketing,How is AI changing digital marketing approaches?,evaluation,Advanced,"[""Introduction to digital marketing"", ""Key points and analysis"", ""Practical examples"", ""Expert insights"", ""Action items"", ""Conclusion""]","[""promotion"", ""marketing"", ""digital"", ""advertising"", ""evaluation""]",4,Marketing Managers & Strategists,"[""social media"", ""content marketing"", ""brand management""]",48,7,2025-10-25 21:50:23,en,How is AI changing {keyword} approaches?,0.84,0.8262164984444449,0.45
38600685,social media,marketing,How do you personalize social media for different segments?,strategy,Beginner,"[""Overview of social media"", ""Step-by-step implementation"", ""Best practices and tips"", ""Common challenges and solutions"", ""Tools and resources needed"", ""Conclusion and next steps""]","[""media"", ""marketing"", ""social"", ""advertising"", ""branding"", ""strategy""]",6,Marketing Students & Interns,"[""content marketing"", ""digital marketing"", ""brand management""]",59,9,2025-10-25 21:50:23,en,How do you personalize {keyword} for different segments?,0.78,0.35187488775811215,0.39
38600686,financial modeling,economics,What insurance options are available for financial modeling?,strategy,Expert,"[""Introduction to financial modeling"", ""Key points and analysis"", ""Practical examples"", ""Expert insights"", ""Action items"", ""Conclusion""]","[""investment"", ""modeling"", ""financial"", ""market"", ""strategy"", ""economics""]",4,Portfolio Managers & Financial Experts,"[""portfolio management"", ""market analysis"", ""investment planning""]",60,8,2025-10-25 21:50:23,en,What insurance options are available for {keyword}?,0.75,1.0,0.82
38600687,social media,marketing,How do you identify the right audience for social media?,evaluation,Intermediate,"[""Overview of social media"", ""Step-by-step implementation"", ""Best practices and tips"", ""Common challenges and solutions"", ""Tools and resources needed"", ""Conclusion and next steps""]","[""media"", ""marketing"", ""digital"", ""social"", ""advertising"", ""evaluation""]",6,Marketing Coordinators & Specialists,"[""content marketing"", ""brand management"", ""digital marketing""]",56,10,2025-10-25 21:50:23,en,How do you identify the right audience for {keyword}?,0.65,0.6233489448416671,0.87
38600688,content marketing,marketing,How do you improve content marketing conversion rates?,implementation,Expert,"[""Overview of content marketing"", ""Step-by-step implementation"", ""Best practices and tips"", ""Common challenges and solutions"", ""Tools and resources needed"", ""Conclusion and next steps""]","[""content"", ""implementation"", ""promotion"", ""marketing"", ""branding""]",6,Marketing Directors & CMOs,"[""social media"", ""digital marketing"", ""brand management""]",54,8,2025-10-25 21:50:23,en,How do you improve {keyword} conversion rates?,0.9,1.0,0.89
38600689,cybersecurity,it,How do you measure the success of cybersecurity projects?,analysis,Beginner,"[""Overview of cybersecurity"", ""Step-by-step implementation"", ""Best practices and tips"", ""Common challenges and solutions"", ""Tools and resources needed"", ""Conclusion and next steps""]","[""development"", ""analysis"", ""it"", ""programming"", ""cybersecurity""]",5,Students & Entry-level Developers,"[""web development"", ""data science"", ""cloud computing"", ""machine learning""]",57,9,2025-10-25 21:50:23,en,How do you measure the success of {keyword} projects?,0.88,0.4372878618266869,0.47
38600690,content marketing,marketing,How do you identify the right audience for content marketing?,evaluation,Intermediate,"[""Overview of content marketing"", ""Step-by-step implementation"", ""Best practices and tips"", ""Common challenges and solutions"", ""Tools and resources needed"", ""Conclusion and next steps""]","[""content"", ""promotion"", ""marketing"", ""digital"", ""evaluation""]",6,Marketing Coordinators & Specialists,"[""digital marketing"", ""social media"", ""brand management""]",61,10,2025-10-25 21:50:23,en,How do you identify the right audience for {keyword}?,0.75,0.7695193479786936,0.84
38600691,data science,it,What ROI can be expected from data science implementation?,implementation,Beginner,"[""Introduction to data science"", ""Key points and analysis"", ""Practical examples"", ""Expert insights"", ""Action items"", ""Conclusion""]","[""technology"", ""development"", ""it"", ""implementation"", ""science"", ""data""]",4,Students & Entry-level Developers,"[""cloud computing"", ""machine learning"", ""cybersecurity"", ""web development""]",58,9,2025-10-25 21:50:23,en,What ROI can be expected from {keyword} implementation?,0.72,0.4682909638862134,0.39
38600692,social media,marketing,How do you innovate within social media?,troubleshooting,Advanced,"[""Overview of social media"", ""Step-by-step implementation"", ""Best practices and tips"", ""Common challenges and solutions"", ""Tools and resources needed"", ""Conclusion and next steps""]","[""media"", ""promotion"", ""troubleshooting"", ""digital"", ""marketing"", ""social""]",6,Marketing Managers & Strategists,"[""digital marketing"", ""content marketing"", ""brand management""]",40,7,2025-10-25 21:50:23,en,How do you innovate within {keyword}?,0.8,0.8980465003253588,0.33
38600693,financial modeling,economics,What strategies work best for financial modeling investment?,troubleshooting,Expert,"[""Introduction to financial modeling"", ""Key points and analysis"", ""Practical examples"", ""Expert insights"", ""Action items"", ""Conclusion""]","[""investment"", ""troubleshooting"", ""modeling"", ""financial"", ""market"", ""economics""]",4,Portfolio Managers & Financial Experts,"[""portfolio management"", ""investment planning"", ""market analysis""]",60,8,2025-10-25 21:50:23,en,What strategies work best for {keyword} investment?,0.82,1.0,0.64
38600694,brand management,marketing,How do you automate brand management processes?,optimization,Advanced,"[""Overview of brand management"", ""Step-by-step implementation"", ""Best practices and tips"", ""Common challenges and solutions"", ""Tools and resources needed"", ""Conclusion and next steps""]","[""promotion"", ""marketing"", ""management"", ""digital"", ""optimization"", ""brand""]",6,Marketing Managers & Strategists,"[""social media"", ""digital marketing"", ""content marketing""]",47,7,2025-10-25 21:50:23,en,How do you automate {keyword} processes?,0.77,0.8502295978163081,0.32
38600695,cybersecurity,it,What career opportunities exist in cybersecurity?,how_to,Advanced,"[""Introduction to cybersecurity"", ""Key points and analysis"", ""Practical examples"", ""Expert insights"", ""Action items"", ""Conclusion""]","[""how_to"", ""software"", ""development"", ""it"", ""cybersecurity""]",4,Senior Developers & Tech Leads,"[""cloud computing"", ""machine learning"", ""web development"", ""data science""]",49,6,2025-10-25 21:50:23,en,What career opportunities exist in {keyword}?,0.62,0.8666789459084943,0.58
