record_id,keyword,category,question,question_type,difficulty_level,answer_outline,tags,estimated_read_time,target_audience,related_topics,question_length,word_count,created_date,language,source_template,engagement_score,complexity_score,popularity_score
36500001,portfolio management,economics,How do you report on portfolio management performance to stakeholders?,troubleshooting,Intermediate,"[""Overview of portfolio management"", ""Step-by-step implementation"", ""Best practices and tips"", ""Common challenges and solutions"", ""Tools and resources needed"", ""Conclusion and next steps""]","[""finance"", ""portfolio"", ""troubleshooting"", ""management"", ""business"", ""economics""]",6,Individual Investors & Analysts,"[""market analysis"", ""investment planning"", ""financial modeling""]",70,10,2025-10-25 21:47:36,en,How do you report on {keyword} performance to stakeholders?,0.84,0.7803686626852943,0.34
36500002,machine learning,it,How do you optimize machine learning for different platforms?,strategy,Advanced,"[""Overview of machine learning"", ""Step-by-step implementation"", ""Best practices and tips"", ""Common challenges and solutions"", ""Tools and resources needed"", ""Conclusion and next steps""]","[""development"", ""it"", ""programming"", ""learning"", ""strategy"", ""machine""]",6,Senior Developers & Tech Leads,"[""data science"", ""web development"", ""cybersecurity"", ""cloud computing""]",61,9,2025-10-25 21:47:36,en,How do you optimize {keyword} for different platforms?,0.91,0.9413973778765323,0.34
36500003,financial modeling,economics,How do you measure financial modeling performance?,analysis,Advanced,"[""Overview of financial modeling"", ""Step-by-step implementation"", ""Best practices and tips"", ""Common challenges and solutions"", ""Tools and resources needed"", ""Conclusion and next steps""]","[""analysis"", ""finance"", ""modeling"", ""financial"", ""business"", ""economics""]",6,Professional Investors & Advisors,"[""investment planning"", ""portfolio management"", ""market analysis""]",50,7,2025-10-25 21:47:36,en,How do you measure {keyword} performance?,0.91,0.9276940020221305,0.41
36500004,financial modeling,economics,How do you create a long-term plan for financial modeling?,analysis,Expert,"[""Overview of financial modeling"", ""Step-by-step implementation"", ""Best practices and tips"", ""Common challenges and solutions"", ""Tools and resources needed"", ""Conclusion and next steps""]","[""finance"", ""analysis"", ""modeling"", ""financial"", ""market"", ""economics""]",6,Portfolio Managers & Financial Experts,"[""market analysis"", ""investment planning"", ""portfolio management""]",58,10,2025-10-25 21:47:36,en,How do you create a long-term plan for {keyword}?,0.86,1.0,0.73
36500005,content marketing,marketing,What does the future hold for content marketing?,implementation,Advanced,"[""Introduction to content marketing"", ""Key points and analysis"", ""Practical examples"", ""Expert insights"", ""Action items"", ""Conclusion""]","[""content"", ""implementation"", ""promotion"", ""marketing"", ""advertising""]",4,Marketing Managers & Strategists,"[""brand management"", ""digital marketing"", ""social media""]",48,8,2025-10-25 21:47:36,en,What does the future hold for {keyword}?,0.79,0.983828779389335,0.73
36500006,brand management,marketing,How do you attribute success to brand management efforts?,comparison,Advanced,"[""Overview of brand management"", ""Step-by-step implementation"", ""Best practices and tips"", ""Common challenges and solutions"", ""Tools and resources needed"", ""Conclusion and next steps""]","[""comparison"", ""marketing"", ""management"", ""advertising"", ""digital"", ""brand""]",6,Marketing Managers & Strategists,"[""content marketing"", ""social media"", ""digital marketing""]",57,9,2025-10-25 21:47:36,en,How do you attribute success to {keyword} efforts?,0.63,0.9314413940689932,0.61
36500007,cloud computing,it,How do you integrate cloud computing with existing systems?,implementation,Expert,"[""Overview of cloud computing"", ""Step-by-step implementation"", ""Best practices and tips"", ""Common challenges and solutions"", ""Tools and resources needed"", ""Conclusion and next steps""]","[""computing"", ""software"", ""it"", ""implementation"", ""cloud"", ""technology""]",6,Architects & Technical Directors,"[""data science"", ""cybersecurity"", ""machine learning"", ""web development""]",59,9,2025-10-25 21:47:36,en,How do you integrate {keyword} with existing systems?,0.74,1.0,0.8
36500008,cybersecurity,it,How can cybersecurity improve system performance and scalability?,how_to,Intermediate,"[""Introduction to cybersecurity"", ""Key points and analysis"", ""Practical examples"", ""Expert insights"", ""Action items"", ""Conclusion""]","[""how_to"", ""software"", ""it"", ""programming"", ""cybersecurity""]",4,Junior to Mid-level Developers,"[""web development"", ""data science"", ""machine learning"", ""cloud computing""]",65,8,2025-10-25 21:47:36,en,How can {keyword} improve system performance and scalability?,0.92,0.6583431500088393,0.65
36500009,brand management,marketing,What timing strategies work for brand management?,evaluation,Beginner,"[""Introduction to brand management"", ""Key points and analysis"", ""Practical examples"", ""Expert insights"", ""Action items"", ""Conclusion""]","[""marketing"", ""management"", ""digital"", ""branding"", ""evaluation"", ""brand""]",4,Marketing Students & Interns,"[""content marketing"", ""social media"", ""digital marketing""]",49,7,2025-10-25 21:47:36,en,What timing strategies work for {keyword}?,0.83,0.42645131963129246,0.64
36500010,cloud computing,it,What certifications are valuable for cloud computing professionals?,planning,Advanced,"[""Introduction to cloud computing"", ""Key points and analysis"", ""Practical examples"", ""Expert insights"", ""Action items"", ""Conclusion""]","[""computing"", ""planning"", ""it"", ""programming"", ""cloud"", ""technology""]",4,Senior Developers & Tech Leads,"[""web development"", ""data science"", ""machine learning"", ""cybersecurity""]",67,8,2025-10-25 21:47:36,en,What certifications are valuable for {keyword} professionals?,0.78,0.9729224298839974,0.42
36500011,market analysis,economics,What are the seasonal patterns in market analysis?,optimization,Expert,"[""Introduction to market analysis"", ""Key concepts and definitions"", ""Main categories or types"", ""Examples and case studies"", ""Benefits and advantages"", ""Summary and recommendations""]","[""finance"", ""analysis"", ""market"", ""optimization"", ""economics""]",6,Portfolio Managers & Financial Experts,"[""portfolio management"", ""investment planning"", ""financial modeling""]",50,8,2025-10-25 21:47:36,en,What are the seasonal patterns in {keyword}?,0.9,1.0,0.77
36500012,cloud computing,it,What are the best practices for cloud computing development?,implementation,Intermediate,"[""Introduction to cloud computing"", ""Key concepts and definitions"", ""Main categories or types"", ""Examples and case studies"", ""Benefits and advantages"", ""Summary and recommendations""]","[""computing"", ""development"", ""it"", ""implementation"", ""cloud"", ""technology""]",6,Junior to Mid-level Developers,"[""cybersecurity"", ""data science"", ""machine learning"", ""web development""]",60,9,2025-10-25 21:47:36,en,What are the best practices for {keyword} development?,0.94,0.6299808779857445,0.38
36500013,portfolio management,economics,What tools help analyze portfolio management data?,best_practice,Advanced,"[""Introduction to portfolio management"", ""Key points and analysis"", ""Practical examples"", ""Expert insights"", ""Action items"", ""Conclusion""]","[""finance"", ""portfolio"", ""best_practice"", ""management"", ""market"", ""economics""]",4,Professional Investors & Advisors,"[""market analysis"", ""investment planning"", ""financial modeling""]",50,7,2025-10-25 21:47:36,en,What tools help analyze {keyword} data?,0.87,0.9502388804926476,0.35
36500014,cybersecurity,it,How do you optimize cybersecurity for different platforms?,comparison,Advanced,"[""Overview of cybersecurity"", ""Step-by-step implementation"", ""Best practices and tips"", ""Common challenges and solutions"", ""Tools and resources needed"", ""Conclusion and next steps""]","[""development"", ""it"", ""comparison"", ""cybersecurity"", ""technology""]",5,Senior Developers & Tech Leads,"[""machine learning"", ""web development"", ""data science"", ""cloud computing""]",58,8,2025-10-25 21:47:36,en,How do you optimize {keyword} for different platforms?,0.86,0.8672923717690924,0.51
36500015,web development,it,How do you optimize web development for different platforms?,strategy,Beginner,"[""Overview of web development"", ""Step-by-step implementation"", ""Best practices and tips"", ""Common challenges and solutions"", ""Tools and resources needed"", ""Conclusion and next steps""]","[""development"", ""web"", ""it"", ""strategy"", ""technology""]",6,Students & Entry-level Developers,"[""data science"", ""cybersecurity"", ""cloud computing"", ""machine learning""]",60,9,2025-10-25 21:47:36,en,How do you optimize {keyword} for different platforms?,0.91,0.4979407684172765,0.56
36500016,data science,it,What is the recommended architecture for data science systems?,planning,Intermediate,"[""Introduction to data science"", ""Key points and analysis"", ""Practical examples"", ""Expert insights"", ""Action items"", ""Conclusion""]","[""planning"", ""development"", ""it"", ""programming"", ""science"", ""data""]",4,Junior to Mid-level Developers,"[""cloud computing"", ""cybersecurity"", ""web development"", ""machine learning""]",62,9,2025-10-25 21:47:36,en,What is the recommended architecture for {keyword} systems?,0.63,0.6013978851260777,0.42
36500017,portfolio management,economics,What indicators predict portfolio management market movements?,best_practice,Intermediate,"[""Introduction to portfolio management"", ""Key points and analysis"", ""Practical examples"", ""Expert insights"", ""Action items"", ""Conclusion""]","[""investment"", ""portfolio"", ""best_practice"", ""management"", ""business"", ""economics""]",4,Individual Investors & Analysts,"[""investment planning"", ""market analysis"", ""financial modeling""]",62,7,2025-10-25 21:47:36,en,What indicators predict {keyword} market movements?,0.95,0.7220125796586606,0.33
36500018,social media,marketing,How do you develop an effective social media strategy?,implementation,Expert,"[""Overview of social media"", ""Step-by-step implementation"", ""Best practices and tips"", ""Common challenges and solutions"", ""Tools and resources needed"", ""Conclusion and next steps""]","[""media"", ""implementation"", ""marketing"", ""digital"", ""social"", ""advertising""]",6,Marketing Directors & CMOs,"[""content marketing"", ""digital marketing"", ""brand management""]",54,9,2025-10-25 21:47:36,en,How do you develop an effective {keyword} strategy?,0.6,1.0,0.37
36500019,web development,it,What is the recommended architecture for web development systems?,evaluation,Intermediate,"[""Introduction to web development"", ""Key points and analysis"", ""Practical examples"", ""Expert insights"", ""Action items"", ""Conclusion""]","[""development"", ""it"", ""programming"", ""evaluation"", ""web""]",4,Junior to Mid-level Developers,"[""machine learning"", ""cloud computing"", ""cybersecurity"", ""data science""]",65,9,2025-10-25 21:47:36,en,What is the recommended architecture for {keyword} systems?,0.61,0.7876527092730667,0.31
36500020,machine learning,it,What are the cost considerations for machine learning?,how_to,Beginner,"[""Introduction to machine learning"", ""Key concepts and definitions"", ""Main categories or types"", ""Examples and case studies"", ""Benefits and advantages"", ""Summary and recommendations""]","[""how_to"", ""software"", ""development"", ""it"", ""learning"", ""machine""]",6,Students & Entry-level Developers,"[""web development"", ""cybersecurity"", ""data science"", ""cloud computing""]",54,8,2025-10-25 21:47:36,en,What are the cost considerations for {keyword}?,0.61,0.387043357808494,0.48
36500021,cybersecurity,it,How can cybersecurity improve system performance and scalability?,strategy,Advanced,"[""Introduction to cybersecurity"", ""Key points and analysis"", ""Practical examples"", ""Expert insights"", ""Action items"", ""Conclusion""]","[""software"", ""it"", ""strategy"", ""cybersecurity"", ""technology""]",4,Senior Developers & Tech Leads,"[""machine learning"", ""web development"", ""data science"", ""cloud computing""]",65,8,2025-10-25 21:47:36,en,How can {keyword} improve system performance and scalability?,0.86,0.966926275333633,0.63
36500022,portfolio management,economics,How do you report on portfolio management performance to stakeholders?,strategy,Expert,"[""Overview of portfolio management"", ""Step-by-step implementation"", ""Best practices and tips"", ""Common challenges and solutions"", ""Tools and resources needed"", ""Conclusion and next steps""]","[""portfolio"", ""management"", ""business"", ""market"", ""strategy"", ""economics""]",6,Portfolio Managers & Financial Experts,"[""financial modeling"", ""market analysis"", ""investment planning""]",70,10,2025-10-25 21:47:36,en,How do you report on {keyword} performance to stakeholders?,0.78,1.0,0.37
36500023,data science,it,What tools are essential for data science development?,troubleshooting,Intermediate,"[""Introduction to data science"", ""Key points and analysis"", ""Practical examples"", ""Expert insights"", ""Action items"", ""Conclusion""]","[""technology"", ""development"", ""it"", ""troubleshooting"", ""science"", ""data""]",4,Junior to Mid-level Developers,"[""machine learning"", ""cloud computing"", ""cybersecurity"", ""web development""]",54,8,2025-10-25 21:47:36,en,What tools are essential for {keyword} development?,0.73,0.7172616725350914,0.37
36500024,machine learning,it,How do you design a scalable machine learning solution?,troubleshooting,Advanced,"[""Overview of machine learning"", ""Step-by-step implementation"", ""Best practices and tips"", ""Common challenges and solutions"", ""Tools and resources needed"", ""Conclusion and next steps""]","[""software"", ""it"", ""troubleshooting"", ""learning"", ""machine"", ""technology""]",6,Senior Developers & Tech Leads,"[""data science"", ""web development"", ""cloud computing"", ""cybersecurity""]",55,9,2025-10-25 21:47:36,en,How do you design a scalable {keyword} solution?,0.95,0.8522020924384578,0.89
36500025,portfolio management,economics,How do you identify opportunities in portfolio management markets?,troubleshooting,Advanced,"[""Overview of portfolio management"", ""Step-by-step implementation"", ""Best practices and tips"", ""Common challenges and solutions"", ""Tools and resources needed"", ""Conclusion and next steps""]","[""investment"", ""portfolio"", ""troubleshooting"", ""management"", ""market"", ""economics""]",6,Professional Investors & Advisors,"[""market analysis"", ""investment planning"", ""financial modeling""]",66,9,2025-10-25 21:47:36,en,How do you identify opportunities in {keyword} markets?,0.72,0.9253852148810404,0.35
36500026,cloud computing,it,What certifications are valuable for cloud computing professionals?,planning,Intermediate,"[""Introduction to cloud computing"", ""Key points and analysis"", ""Practical examples"", ""Expert insights"", ""Action items"", ""Conclusion""]","[""computing"", ""planning"", ""software"", ""it"", ""cloud"", ""technology""]",4,Junior to Mid-level Developers,"[""cybersecurity"", ""web development"", ""machine learning"", ""data science""]",67,8,2025-10-25 21:47:36,en,What certifications are valuable for {keyword} professionals?,0.91,0.6768040309560338,0.53
36500027,portfolio management,economics,What timeline is realistic for portfolio management returns?,evaluation,Beginner,"[""Introduction to portfolio management"", ""Key points and analysis"", ""Practical examples"", ""Expert insights"", ""Action items"", ""Conclusion""]","[""investment"", ""portfolio"", ""management"", ""evaluation"", ""business"", ""economics""]",4,Students & New Investors,"[""market analysis"", ""financial modeling"", ""investment planning""]",60,8,2025-10-25 21:47:36,en,What timeline is realistic for {keyword} returns?,0.76,0.4412790637481534,0.78
36500028,financial modeling,economics,What tools help analyze financial modeling data?,how_to,Advanced,"[""Introduction to financial modeling"", ""Key points and analysis"", ""Practical examples"", ""Expert insights"", ""Action items"", ""Conclusion""]","[""investment"", ""how_to"", ""modeling"", ""financial"", ""business"", ""economics""]",4,Professional Investors & Advisors,"[""portfolio management"", ""investment planning"", ""market analysis""]",48,7,2025-10-25 21:47:36,en,What tools help analyze {keyword} data?,0.74,0.9037895217215652,0.67
36500029,portfolio management,economics,How does global economics impact portfolio management?,planning,Beginner,"[""Introduction to portfolio management"", ""Key points and analysis"", ""Practical examples"", ""Expert insights"", ""Action items"", ""Conclusion""]","[""planning"", ""finance"", ""portfolio"", ""management"", ""business"", ""economics""]",4,Students & New Investors,"[""financial modeling"", ""investment planning"", ""market analysis""]",54,7,2025-10-25 21:47:36,en,How does global economics impact {keyword}?,0.71,0.4685664055937755,0.6
36500030,data science,it,What career opportunities exist in data science?,best_practice,Expert,"[""Introduction to data science"", ""Key points and analysis"", ""Practical examples"", ""Expert insights"", ""Action items"", ""Conclusion""]","[""software"", ""development"", ""it"", ""best_practice"", ""science"", ""data""]",4,Architects & Technical Directors,"[""machine learning"", ""cloud computing"", ""cybersecurity"", ""web development""]",48,7,2025-10-25 21:47:36,en,What career opportunities exist in {keyword}?,0.86,1.0,0.66
36500031,machine learning,it,What are the best practices for machine learning development?,evaluation,Expert,"[""Introduction to machine learning"", ""Key concepts and definitions"", ""Main categories or types"", ""Examples and case studies"", ""Benefits and advantages"", ""Summary and recommendations""]","[""software"", ""it"", ""programming"", ""learning"", ""evaluation"", ""machine""]",6,Architects & Technical Directors,"[""cybersecurity"", ""web development"", ""data science"", ""cloud computing""]",61,9,2025-10-25 21:47:36,en,What are the best practices for {keyword} development?,0.66,1.0,0.89
36500032,market analysis,economics,What are the risks associated with market analysis?,comparison,Intermediate,"[""Introduction to market analysis"", ""Key concepts and definitions"", ""Main categories or types"", ""Examples and case studies"", ""Benefits and advantages"", ""Summary and recommendations""]","[""analysis"", ""comparison"", ""market"", ""business"", ""economics""]",6,Individual Investors & Analysts,"[""portfolio management"", ""investment planning"", ""financial modeling""]",51,8,2025-10-25 21:47:36,en,What are the risks associated with {keyword}?,0.81,0.7003146347502623,0.68
36500033,content marketing,marketing,How do you improve content marketing conversion rates?,optimization,Advanced,"[""Overview of content marketing"", ""Step-by-step implementation"", ""Best practices and tips"", ""Common challenges and solutions"", ""Tools and resources needed"", ""Conclusion and next steps""]","[""content"", ""promotion"", ""marketing"", ""digital"", ""optimization""]",6,Marketing Managers & Strategists,"[""social media"", ""brand management"", ""digital marketing""]",54,8,2025-10-25 21:47:36,en,How do you improve {keyword} conversion rates?,0.88,0.9555076010624062,0.63
36500034,content marketing,marketing,How is AI changing content marketing approaches?,evaluation,Beginner,"[""Introduction to content marketing"", ""Key points and analysis"", ""Practical examples"", ""Expert insights"", ""Action items"", ""Conclusion""]","[""content"", ""marketing"", ""digital"", ""advertising"", ""evaluation""]",4,Marketing Students & Interns,"[""digital marketing"", ""social media"", ""brand management""]",48,7,2025-10-25 21:47:36,en,How is AI changing {keyword} approaches?,0.72,0.4007413402309489,0.83
36500035,digital marketing,marketing,How is AI changing digital marketing approaches?,evaluation,Intermediate,"[""Introduction to digital marketing"", ""Key points and analysis"", ""Practical examples"", ""Expert insights"", ""Action items"", ""Conclusion""]","[""marketing"", ""digital"", ""advertising"", ""branding"", ""evaluation""]",4,Marketing Coordinators & Specialists,"[""social media"", ""content marketing"", ""brand management""]",48,7,2025-10-25 21:47:36,en,How is AI changing {keyword} approaches?,0.73,0.7879962695068273,0.61
36500036,cybersecurity,it,Which frameworks support cybersecurity implementation?,implementation,Expert,"[""Introduction to cybersecurity"", ""Key points and analysis"", ""Practical examples"", ""Expert insights"", ""Action items"", ""Conclusion""]","[""it"", ""implementation"", ""programming"", ""cybersecurity"", ""technology""]",4,Architects & Technical Directors,"[""cloud computing"", ""data science"", ""web development"", ""machine learning""]",54,5,2025-10-25 21:47:36,en,Which frameworks support {keyword} implementation?,0.83,1.0,0.81
36500037,content marketing,marketing,How do you optimize content marketing for mobile users?,analysis,Expert,"[""Overview of content marketing"", ""Step-by-step implementation"", ""Best practices and tips"", ""Common challenges and solutions"", ""Tools and resources needed"", ""Conclusion and next steps""]","[""content"", ""analysis"", ""marketing"", ""digital"", ""advertising""]",6,Marketing Directors & CMOs,"[""social media"", ""digital marketing"", ""brand management""]",55,9,2025-10-25 21:47:36,en,How do you optimize {keyword} for mobile users?,0.83,1.0,0.87
36500038,investment planning,economics,How do economic conditions affect investment planning performance?,planning,Intermediate,"[""Introduction to investment planning"", ""Key points and analysis"", ""Practical examples"", ""Expert insights"", ""Action items"", ""Conclusion""]","[""investment"", ""economics"", ""planning"", ""finance""]",4,Individual Investors & Analysts,"[""market analysis"", ""financial modeling"", ""portfolio management""]",66,8,2025-10-25 21:47:36,en,How do economic conditions affect {keyword} performance?,0.67,0.6033824197154691,0.52
36500039,market analysis,economics,What timeline is realistic for market analysis returns?,how_to,Beginner,"[""Introduction to market analysis"", ""Key points and analysis"", ""Practical examples"", ""Expert insights"", ""Action items"", ""Conclusion""]","[""how_to"", ""finance"", ""analysis"", ""market"", ""business"", ""economics""]",4,Students & New Investors,"[""financial modeling"", ""investment planning"", ""portfolio management""]",55,8,2025-10-25 21:47:36,en,What timeline is realistic for {keyword} returns?,0.91,0.3515410359876216,0.81
36500040,market analysis,economics,How do you benchmark market analysis against alternatives?,analysis,Expert,"[""Overview of market analysis"", ""Step-by-step implementation"", ""Best practices and tips"", ""Common challenges and solutions"", ""Tools and resources needed"", ""Conclusion and next steps""]","[""market"", ""investment"", ""economics"", ""analysis""]",6,Portfolio Managers & Financial Experts,"[""financial modeling"", ""investment planning"", ""portfolio management""]",58,8,2025-10-25 21:47:36,en,How do you benchmark {keyword} against alternatives?,0.87,1.0,0.62
36500041,social media,marketing,How do you attribute success to social media efforts?,analysis,Intermediate,"[""Overview of social media"", ""Step-by-step implementation"", ""Best practices and tips"", ""Common challenges and solutions"", ""Tools and resources needed"", ""Conclusion and next steps""]","[""analysis"", ""media"", ""promotion"", ""marketing"", ""digital"", ""social""]",6,Marketing Coordinators & Specialists,"[""content marketing"", ""digital marketing"", ""brand management""]",53,9,2025-10-25 21:47:36,en,How do you attribute success to {keyword} efforts?,0.62,0.6166945623096494,0.51
36500042,data science,it,What tools are essential for data science development?,implementation,Beginner,"[""Introduction to data science"", ""Key points and analysis"", ""Practical examples"", ""Expert insights"", ""Action items"", ""Conclusion""]","[""technology"", ""software"", ""it"", ""implementation"", ""science"", ""data""]",4,Students & Entry-level Developers,"[""cloud computing"", ""machine learning"", ""web development"", ""cybersecurity""]",54,8,2025-10-25 21:47:36,en,What tools are essential for {keyword} development?,0.93,0.4521598588205491,0.58
36500043,machine learning,it,What career opportunities exist in machine learning?,evaluation,Expert,"[""Introduction to machine learning"", ""Key points and analysis"", ""Practical examples"", ""Expert insights"", ""Action items"", ""Conclusion""]","[""software"", ""development"", ""it"", ""learning"", ""evaluation"", ""machine""]",4,Architects & Technical Directors,"[""web development"", ""cybersecurity"", ""cloud computing"", ""data science""]",52,7,2025-10-25 21:47:36,en,What career opportunities exist in {keyword}?,0.78,1.0,0.31
36500044,cybersecurity,it,How do you convince stakeholders to invest in cybersecurity?,planning,Intermediate,"[""Overview of cybersecurity"", ""Step-by-step implementation"", ""Best practices and tips"", ""Common challenges and solutions"", ""Tools and resources needed"", ""Conclusion and next steps""]","[""software"", ""planning"", ""it"", ""cybersecurity"", ""technology""]",5,Junior to Mid-level Developers,"[""data science"", ""web development"", ""cloud computing"", ""machine learning""]",60,9,2025-10-25 21:47:36,en,How do you convince stakeholders to invest in {keyword}?,0.88,0.6764674695388592,0.63
