record_id,keyword,category,question,question_type,difficulty_level,answer_outline,tags,estimated_read_time,target_audience,related_topics,question_length,word_count,created_date,language,source_template,engagement_score,complexity_score,popularity_score
36500351,cybersecurity,it,How does cybersecurity impact business operations?,strategy,Beginner,"[""Introduction to cybersecurity"", ""Key points and analysis"", ""Practical examples"", ""Expert insights"", ""Action items"", ""Conclusion""]","[""development"", ""it"", ""strategy"", ""cybersecurity"", ""technology""]",4,Students & Entry-level Developers,"[""machine learning"", ""cloud computing"", ""web development"", ""data science""]",50,6,2025-10-25 21:47:36,en,How does {keyword} impact business operations?,0.84,0.4707127979239485,0.78
36500352,investment planning,economics,How do you protect your investment planning investments?,evaluation,Intermediate,"[""Overview of investment planning"", ""Step-by-step implementation"", ""Best practices and tips"", ""Common challenges and solutions"", ""Tools and resources needed"", ""Conclusion and next steps""]","[""investment"", ""planning"", ""finance"", ""evaluation"", ""economics""]",6,Individual Investors & Analysts,"[""market analysis"", ""financial modeling"", ""portfolio management""]",56,8,2025-10-25 21:47:36,en,How do you protect your {keyword} investments?,0.61,0.6010819919077286,0.39
36500353,data science,it,What are the latest trends in data science technology?,evaluation,Expert,"[""Introduction to data science"", ""Key concepts and definitions"", ""Main categories or types"", ""Examples and case studies"", ""Benefits and advantages"", ""Summary and recommendations""]","[""technology"", ""development"", ""it"", ""science"", ""evaluation"", ""data""]",6,Architects & Technical Directors,"[""cybersecurity"", ""web development"", ""machine learning"", ""cloud computing""]",54,9,2025-10-25 21:47:36,en,What are the latest trends in {keyword} technology?,0.87,1.0,0.69
36500354,web development,it,How do you troubleshoot common issues with web development?,planning,Intermediate,"[""Overview of web development"", ""Step-by-step implementation"", ""Best practices and tips"", ""Common challenges and solutions"", ""Tools and resources needed"", ""Conclusion and next steps""]","[""planning"", ""development"", ""it"", ""programming"", ""web""]",6,Junior to Mid-level Developers,"[""cloud computing"", ""machine learning"", ""cybersecurity"", ""data science""]",59,9,2025-10-25 21:47:36,en,How do you troubleshoot common issues with {keyword}?,0.78,0.7005942946969059,0.83
36500355,cloud computing,it,What are the latest trends in cloud computing technology?,comparison,Beginner,"[""Introduction to cloud computing"", ""Key concepts and definitions"", ""Main categories or types"", ""Examples and case studies"", ""Benefits and advantages"", ""Summary and recommendations""]","[""computing"", ""development"", ""it"", ""comparison"", ""cloud"", ""technology""]",6,Students & Entry-level Developers,"[""machine learning"", ""data science"", ""web development"", ""cybersecurity""]",57,9,2025-10-25 21:47:36,en,What are the latest trends in {keyword} technology?,0.78,0.30695531912114826,0.45
36500356,machine learning,it,How do you troubleshoot common issues with machine learning?,best_practice,Advanced,"[""Overview of machine learning"", ""Step-by-step implementation"", ""Best practices and tips"", ""Common challenges and solutions"", ""Tools and resources needed"", ""Conclusion and next steps""]","[""it"", ""programming"", ""best_practice"", ""learning"", ""machine"", ""technology""]",6,Senior Developers & Tech Leads,"[""cloud computing"", ""data science"", ""web development"", ""cybersecurity""]",60,9,2025-10-25 21:47:36,en,How do you troubleshoot common issues with {keyword}?,0.72,0.9675688519275208,0.52
36500357,web development,it,How do you optimize web development for different platforms?,evaluation,Expert,"[""Overview of web development"", ""Step-by-step implementation"", ""Best practices and tips"", ""Common challenges and solutions"", ""Tools and resources needed"", ""Conclusion and next steps""]","[""development"", ""it"", ""programming"", ""evaluation"", ""web""]",6,Architects & Technical Directors,"[""data science"", ""cybersecurity"", ""machine learning"", ""cloud computing""]",60,9,2025-10-25 21:47:36,en,How do you optimize {keyword} for different platforms?,0.8,1.0,0.3
36500358,content marketing,marketing,How do you identify the right audience for content marketing?,troubleshooting,Expert,"[""Overview of content marketing"", ""Step-by-step implementation"", ""Best practices and tips"", ""Common challenges and solutions"", ""Tools and resources needed"", ""Conclusion and next steps""]","[""content"", ""promotion"", ""troubleshooting"", ""marketing"", ""branding""]",6,Marketing Directors & CMOs,"[""digital marketing"", ""social media"", ""brand management""]",61,10,2025-10-25 21:47:36,en,How do you identify the right audience for {keyword}?,0.66,1.0,0.37
36500359,cybersecurity,it,What ROI can be expected from cybersecurity implementation?,implementation,Expert,"[""Introduction to cybersecurity"", ""Key points and analysis"", ""Practical examples"", ""Expert insights"", ""Action items"", ""Conclusion""]","[""development"", ""it"", ""implementation"", ""cybersecurity"", ""technology""]",4,Architects & Technical Directors,"[""machine learning"", ""cloud computing"", ""data science"", ""web development""]",59,8,2025-10-25 21:47:36,en,What ROI can be expected from {keyword} implementation?,0.94,1.0,0.48
36500360,content marketing,marketing,What channels are most effective for content marketing?,how_to,Advanced,"[""Introduction to content marketing"", ""Key points and analysis"", ""Practical examples"", ""Expert insights"", ""Action items"", ""Conclusion""]","[""how_to"", ""content"", ""promotion"", ""marketing"", ""branding""]",4,Marketing Managers & Strategists,"[""social media"", ""brand management"", ""digital marketing""]",55,8,2025-10-25 21:47:36,en,What channels are most effective for {keyword}?,0.68,0.8210109920742026,0.87
36500361,market analysis,economics,What insurance options are available for market analysis?,evaluation,Beginner,"[""Introduction to market analysis"", ""Key points and analysis"", ""Practical examples"", ""Expert insights"", ""Action items"", ""Conclusion""]","[""investment"", ""analysis"", ""finance"", ""evaluation"", ""market"", ""economics""]",4,Students & New Investors,"[""investment planning"", ""portfolio management"", ""financial modeling""]",57,8,2025-10-25 21:47:36,en,What insurance options are available for {keyword}?,0.62,0.46213415084656007,0.75
36500362,web development,it,How do you get started with web development as a beginner?,optimization,Beginner,"[""Overview of web development"", ""Step-by-step implementation"", ""Best practices and tips"", ""Common challenges and solutions"", ""Tools and resources needed"", ""Conclusion and next steps""]","[""development"", ""web"", ""it"", ""optimization"", ""technology""]",6,Students & Entry-level Developers,"[""cybersecurity"", ""machine learning"", ""cloud computing"", ""data science""]",58,11,2025-10-25 21:47:36,en,How do you get started with {keyword} as a beginner?,0.91,0.36149397757316504,0.6
36500363,investment planning,economics,What timeline is realistic for investment planning returns?,evaluation,Expert,"[""Introduction to investment planning"", ""Key points and analysis"", ""Practical examples"", ""Expert insights"", ""Action items"", ""Conclusion""]","[""investment"", ""planning"", ""finance"", ""evaluation"", ""business"", ""economics""]",4,Portfolio Managers & Financial Experts,"[""financial modeling"", ""portfolio management"", ""market analysis""]",59,8,2025-10-25 21:47:36,en,What timeline is realistic for {keyword} returns?,0.91,1.0,0.67
36500364,portfolio management,economics,What tools help analyze portfolio management data?,strategy,Advanced,"[""Introduction to portfolio management"", ""Key points and analysis"", ""Practical examples"", ""Expert insights"", ""Action items"", ""Conclusion""]","[""finance"", ""portfolio"", ""management"", ""business"", ""strategy"", ""economics""]",4,Professional Investors & Advisors,"[""investment planning"", ""financial modeling"", ""market analysis""]",50,7,2025-10-25 21:47:36,en,What tools help analyze {keyword} data?,0.7,0.907641271578669,0.67
36500365,cloud computing,it,How do you optimize cloud computing for different platforms?,planning,Expert,"[""Overview of cloud computing"", ""Step-by-step implementation"", ""Best practices and tips"", ""Common challenges and solutions"", ""Tools and resources needed"", ""Conclusion and next steps""]","[""computing"", ""software"", ""planning"", ""it"", ""cloud"", ""technology""]",6,Architects & Technical Directors,"[""web development"", ""data science"", ""cybersecurity"", ""machine learning""]",60,9,2025-10-25 21:47:36,en,How do you optimize {keyword} for different platforms?,0.9,1.0,0.52
36500366,content marketing,marketing,How do you identify the right audience for content marketing?,comparison,Expert,"[""Overview of content marketing"", ""Step-by-step implementation"", ""Best practices and tips"", ""Common challenges and solutions"", ""Tools and resources needed"", ""Conclusion and next steps""]","[""content"", ""promotion"", ""comparison"", ""marketing"", ""advertising""]",6,Marketing Directors & CMOs,"[""digital marketing"", ""brand management"", ""social media""]",61,10,2025-10-25 21:47:36,en,How do you identify the right audience for {keyword}?,0.79,1.0,0.67
36500367,content marketing,marketing,What messaging works best in content marketing campaigns?,troubleshooting,Advanced,"[""Introduction to content marketing"", ""Key points and analysis"", ""Practical examples"", ""Expert insights"", ""Action items"", ""Conclusion""]","[""content"", ""promotion"", ""troubleshooting"", ""marketing"", ""digital""]",4,Marketing Managers & Strategists,"[""brand management"", ""digital marketing"", ""social media""]",57,8,2025-10-25 21:47:36,en,What messaging works best in {keyword} campaigns?,0.89,0.9718361992809116,0.69
36500368,data science,it,What are the key components of a data science implementation?,comparison,Intermediate,"[""Introduction to data science"", ""Key concepts and definitions"", ""Main categories or types"", ""Examples and case studies"", ""Benefits and advantages"", ""Summary and recommendations""]","[""software"", ""development"", ""it"", ""comparison"", ""science"", ""data""]",6,Junior to Mid-level Developers,"[""cloud computing"", ""web development"", ""machine learning"", ""cybersecurity""]",61,10,2025-10-25 21:47:36,en,What are the key components of a {keyword} implementation?,0.82,0.7919052077143409,0.4
36500369,digital marketing,marketing,What demographics respond best to digital marketing?,planning,Advanced,"[""Introduction to digital marketing"", ""Key points and analysis"", ""Practical examples"", ""Expert insights"", ""Action items"", ""Conclusion""]","[""planning"", ""promotion"", ""marketing"", ""digital"", ""advertising""]",4,Marketing Managers & Strategists,"[""content marketing"", ""social media"", ""brand management""]",52,7,2025-10-25 21:47:36,en,What demographics respond best to {keyword}?,0.62,0.9419785000551515,0.84
36500370,market analysis,economics,How do you adjust your market analysis strategy during volatility?,strategy,Expert,"[""Overview of market analysis"", ""Step-by-step implementation"", ""Best practices and tips"", ""Common challenges and solutions"", ""Tools and resources needed"", ""Conclusion and next steps""]","[""analysis"", ""business"", ""market"", ""strategy"", ""economics""]",6,Portfolio Managers & Financial Experts,"[""financial modeling"", ""portfolio management"", ""investment planning""]",66,10,2025-10-25 21:47:36,en,How do you adjust your {keyword} strategy during volatility?,0.71,1.0,0.55
36500371,brand management,marketing,How do you measure the ROI of brand management campaigns?,implementation,Beginner,"[""Overview of brand management"", ""Step-by-step implementation"", ""Best practices and tips"", ""Common challenges and solutions"", ""Tools and resources needed"", ""Conclusion and next steps""]","[""implementation"", ""marketing"", ""management"", ""advertising"", ""branding"", ""brand""]",6,Marketing Students & Interns,"[""content marketing"", ""social media"", ""digital marketing""]",57,10,2025-10-25 21:47:36,en,How do you measure the ROI of {keyword} campaigns?,0.79,0.3198254062557111,0.39
36500372,digital marketing,marketing,What content types work best for digital marketing?,implementation,Expert,"[""Introduction to digital marketing"", ""Key points and analysis"", ""Practical examples"", ""Expert insights"", ""Action items"", ""Conclusion""]","[""implementation"", ""marketing"", ""digital"", ""advertising"", ""branding""]",4,Marketing Directors & CMOs,"[""content marketing"", ""brand management"", ""social media""]",51,8,2025-10-25 21:47:36,en,What content types work best for {keyword}?,0.62,1.0,0.85
36500373,content marketing,marketing,What A/B tests should you run for content marketing?,strategy,Beginner,"[""Introduction to content marketing"", ""Key points and analysis"", ""Practical examples"", ""Expert insights"", ""Action items"", ""Conclusion""]","[""content"", ""promotion"", ""digital"", ""marketing"", ""strategy""]",4,Marketing Students & Interns,"[""brand management"", ""digital marketing"", ""social media""]",52,9,2025-10-25 21:47:36,en,What A/B tests should you run for {keyword}?,0.9,0.4031217023028597,0.66
36500374,digital marketing,marketing,How do you automate digital marketing processes?,comparison,Expert,"[""Overview of digital marketing"", ""Step-by-step implementation"", ""Best practices and tips"", ""Common challenges and solutions"", ""Tools and resources needed"", ""Conclusion and next steps""]","[""promotion"", ""comparison"", ""marketing"", ""digital"", ""advertising""]",6,Marketing Directors & CMOs,"[""content marketing"", ""social media"", ""brand management""]",48,7,2025-10-25 21:47:36,en,How do you automate {keyword} processes?,0.64,1.0,0.52
36500375,digital marketing,marketing,How do you create a digital marketing roadmap?,implementation,Expert,"[""Overview of digital marketing"", ""Step-by-step implementation"", ""Best practices and tips"", ""Common challenges and solutions"", ""Tools and resources needed"", ""Conclusion and next steps""]","[""implementation"", ""marketing"", ""branding"", ""digital""]",6,Marketing Directors & CMOs,"[""social media"", ""content marketing"", ""brand management""]",46,8,2025-10-25 21:47:36,en,How do you create a {keyword} roadmap?,0.71,1.0,0.38
36500376,data science,it,What is the recommended architecture for data science systems?,comparison,Intermediate,"[""Introduction to data science"", ""Key points and analysis"", ""Practical examples"", ""Expert insights"", ""Action items"", ""Conclusion""]","[""development"", ""it"", ""comparison"", ""programming"", ""science"", ""data""]",4,Junior to Mid-level Developers,"[""cloud computing"", ""machine learning"", ""cybersecurity"", ""web development""]",62,9,2025-10-25 21:47:36,en,What is the recommended architecture for {keyword} systems?,0.82,0.6135911449405217,0.76
36500377,investment planning,economics,How do you benchmark investment planning against alternatives?,best_practice,Beginner,"[""Overview of investment planning"", ""Step-by-step implementation"", ""Best practices and tips"", ""Common challenges and solutions"", ""Tools and resources needed"", ""Conclusion and next steps""]","[""investment"", ""planning"", ""best_practice"", ""business"", ""economics""]",6,Students & New Investors,"[""portfolio management"", ""financial modeling"", ""market analysis""]",62,8,2025-10-25 21:47:36,en,How do you benchmark {keyword} against alternatives?,0.9,0.4555236688080706,0.39
36500378,investment planning,economics,How do you measure investment planning performance?,strategy,Beginner,"[""Overview of investment planning"", ""Step-by-step implementation"", ""Best practices and tips"", ""Common challenges and solutions"", ""Tools and resources needed"", ""Conclusion and next steps""]","[""investment"", ""planning"", ""business"", ""strategy"", ""economics""]",6,Students & New Investors,"[""financial modeling"", ""portfolio management"", ""market analysis""]",51,7,2025-10-25 21:47:36,en,How do you measure {keyword} performance?,0.8,0.3048151088809076,0.39
36500379,social media,marketing,How do you reach new customers through social media?,troubleshooting,Advanced,"[""Overview of social media"", ""Step-by-step implementation"", ""Best practices and tips"", ""Common challenges and solutions"", ""Tools and resources needed"", ""Conclusion and next steps""]","[""media"", ""promotion"", ""troubleshooting"", ""marketing"", ""social"", ""advertising""]",6,Marketing Managers & Strategists,"[""digital marketing"", ""content marketing"", ""brand management""]",52,9,2025-10-25 21:47:36,en,How do you reach new customers through {keyword}?,0.8,0.9505831614192504,0.71
36500380,data science,it,What is the recommended architecture for data science systems?,evaluation,Beginner,"[""Introduction to data science"", ""Key points and analysis"", ""Practical examples"", ""Expert insights"", ""Action items"", ""Conclusion""]","[""technology"", ""development"", ""it"", ""science"", ""evaluation"", ""data""]",4,Students & Entry-level Developers,"[""web development"", ""machine learning"", ""cloud computing"", ""cybersecurity""]",62,9,2025-10-25 21:47:36,en,What is the recommended architecture for {keyword} systems?,0.91,0.4871952461735855,0.44
36500381,portfolio management,economics,What metrics are most important for portfolio management?,best_practice,Expert,"[""Introduction to portfolio management"", ""Key points and analysis"", ""Practical examples"", ""Expert insights"", ""Action items"", ""Conclusion""]","[""investment"", ""portfolio"", ""best_practice"", ""management"", ""market"", ""economics""]",4,Portfolio Managers & Financial Experts,"[""investment planning"", ""market analysis"", ""financial modeling""]",57,8,2025-10-25 21:47:36,en,What metrics are most important for {keyword}?,0.85,1.0,0.68
36500382,web development,it,How do you stay updated with web development developments?,troubleshooting,Expert,"[""Overview of web development"", ""Step-by-step implementation"", ""Best practices and tips"", ""Common challenges and solutions"", ""Tools and resources needed"", ""Conclusion and next steps""]","[""development"", ""it"", ""programming"", ""troubleshooting"", ""web""]",6,Architects & Technical Directors,"[""machine learning"", ""cybersecurity"", ""cloud computing"", ""data science""]",58,9,2025-10-25 21:47:36,en,How do you stay updated with {keyword} developments?,0.79,1.0,0.53
36500383,content marketing,marketing,What content types work best for content marketing?,comparison,Expert,"[""Introduction to content marketing"", ""Key points and analysis"", ""Practical examples"", ""Expert insights"", ""Action items"", ""Conclusion""]","[""content"", ""comparison"", ""marketing"", ""advertising"", ""branding""]",4,Marketing Directors & CMOs,"[""digital marketing"", ""social media"", ""brand management""]",51,8,2025-10-25 21:47:36,en,What content types work best for {keyword}?,0.89,1.0,0.81
36500384,financial modeling,economics,How do you identify opportunities in financial modeling markets?,best_practice,Beginner,"[""Overview of financial modeling"", ""Step-by-step implementation"", ""Best practices and tips"", ""Common challenges and solutions"", ""Tools and resources needed"", ""Conclusion and next steps""]","[""investment"", ""finance"", ""best_practice"", ""modeling"", ""financial"", ""economics""]",6,Students & New Investors,"[""investment planning"", ""market analysis"", ""portfolio management""]",64,9,2025-10-25 21:47:36,en,How do you identify opportunities in {keyword} markets?,0.92,0.41415470323124476,0.74
36500385,brand management,marketing,How is AI changing brand management approaches?,implementation,Expert,"[""Introduction to brand management"", ""Key points and analysis"", ""Practical examples"", ""Expert insights"", ""Action items"", ""Conclusion""]","[""implementation"", ""promotion"", ""marketing"", ""management"", ""advertising"", ""brand""]",4,Marketing Directors & CMOs,"[""social media"", ""content marketing"", ""digital marketing""]",47,7,2025-10-25 21:47:36,en,How is AI changing {keyword} approaches?,0.73,1.0,0.8
36500386,cybersecurity,it,What are the key components of a cybersecurity implementation?,how_to,Expert,"[""Introduction to cybersecurity"", ""Key concepts and definitions"", ""Main categories or types"", ""Examples and case studies"", ""Benefits and advantages"", ""Summary and recommendations""]","[""how_to"", ""software"", ""development"", ""it"", ""cybersecurity""]",5,Architects & Technical Directors,"[""machine learning"", ""web development"", ""data science"", ""cloud computing""]",62,9,2025-10-25 21:47:36,en,What are the key components of a {keyword} implementation?,0.61,1.0,0.33
36500387,data science,it,What are the best practices for data science development?,optimization,Expert,"[""Introduction to data science"", ""Key concepts and definitions"", ""Main categories or types"", ""Examples and case studies"", ""Benefits and advantages"", ""Summary and recommendations""]","[""technology"", ""software"", ""it"", ""science"", ""optimization"", ""data""]",6,Architects & Technical Directors,"[""web development"", ""machine learning"", ""cloud computing"", ""cybersecurity""]",57,9,2025-10-25 21:47:36,en,What are the best practices for {keyword} development?,0.94,1.0,0.69
36500388,digital marketing,marketing,How do you reach new customers through digital marketing?,troubleshooting,Expert,"[""Overview of digital marketing"", ""Step-by-step implementation"", ""Best practices and tips"", ""Common challenges and solutions"", ""Tools and resources needed"", ""Conclusion and next steps""]","[""promotion"", ""troubleshooting"", ""marketing"", ""digital"", ""branding""]",6,Marketing Directors & CMOs,"[""brand management"", ""social media"", ""content marketing""]",57,9,2025-10-25 21:47:36,en,How do you reach new customers through {keyword}?,0.88,1.0,0.57
36500389,content marketing,marketing,What KPIs are most important for content marketing?,strategy,Expert,"[""Introduction to content marketing"", ""Key points and analysis"", ""Practical examples"", ""Expert insights"", ""Action items"", ""Conclusion""]","[""content"", ""promotion"", ""marketing"", ""branding"", ""strategy""]",4,Marketing Directors & CMOs,"[""brand management"", ""social media"", ""digital marketing""]",51,8,2025-10-25 21:47:36,en,What KPIs are most important for {keyword}?,0.95,1.0,0.31
36500390,social media,marketing,What are the latest trends in social media?,evaluation,Intermediate,"[""Introduction to social media"", ""Key concepts and definitions"", ""Main categories or types"", ""Examples and case studies"", ""Benefits and advantages"", ""Summary and recommendations""]","[""media"", ""marketing"", ""social"", ""advertising"", ""branding"", ""evaluation""]",6,Marketing Coordinators & Specialists,"[""brand management"", ""digital marketing"", ""content marketing""]",43,8,2025-10-25 21:47:36,en,What are the latest trends in {keyword}?,0.63,0.6289643436923951,0.68
36500391,portfolio management,economics,How do you diversify your portfolio using portfolio management?,evaluation,Beginner,"[""Overview of portfolio management"", ""Step-by-step implementation"", ""Best practices and tips"", ""Common challenges and solutions"", ""Tools and resources needed"", ""Conclusion and next steps""]","[""portfolio"", ""management"", ""evaluation"", ""market"", ""business"", ""economics""]",6,Students & New Investors,"[""investment planning"", ""financial modeling"", ""market analysis""]",63,9,2025-10-25 21:47:36,en,How do you diversify your portfolio using {keyword}?,0.61,0.4696895823505836,0.81
36500392,financial modeling,economics,What is the optimal allocation for financial modeling in a portfolio?,troubleshooting,Beginner,"[""Introduction to financial modeling"", ""Key points and analysis"", ""Practical examples"", ""Expert insights"", ""Action items"", ""Conclusion""]","[""investment"", ""finance"", ""troubleshooting"", ""modeling"", ""financial"", ""economics""]",4,Students & New Investors,"[""portfolio management"", ""market analysis"", ""investment planning""]",69,11,2025-10-25 21:47:36,en,What is the optimal allocation for {keyword} in a portfolio?,0.75,0.41392841884914705,0.72
36500393,cloud computing,it,What career opportunities exist in cloud computing?,how_to,Advanced,"[""Introduction to cloud computing"", ""Key points and analysis"", ""Practical examples"", ""Expert insights"", ""Action items"", ""Conclusion""]","[""computing"", ""how_to"", ""it"", ""programming"", ""cloud"", ""technology""]",4,Senior Developers & Tech Leads,"[""data science"", ""cybersecurity"", ""machine learning"", ""web development""]",51,7,2025-10-25 21:47:36,en,What career opportunities exist in {keyword}?,0.76,0.9179073744681159,0.36
36500394,social media,marketing,How do you develop an effective social media strategy?,strategy,Expert,"[""Overview of social media"", ""Step-by-step implementation"", ""Best practices and tips"", ""Common challenges and solutions"", ""Tools and resources needed"", ""Conclusion and next steps""]","[""media"", ""digital"", ""marketing"", ""social"", ""branding"", ""strategy""]",6,Marketing Directors & CMOs,"[""content marketing"", ""brand management"", ""digital marketing""]",54,9,2025-10-25 21:47:36,en,How do you develop an effective {keyword} strategy?,0.62,1.0,0.67
