record_id,keyword,category,question,question_type,difficulty_level,answer_outline,tags,estimated_read_time,target_audience,related_topics,question_length,word_count,created_date,language,source_template,engagement_score,complexity_score,popularity_score
34300349,digital marketing,marketing,How do you develop an effective digital marketing strategy?,strategy,Expert,"[""Overview of digital marketing"", ""Step-by-step implementation"", ""Best practices and tips"", ""Common challenges and solutions"", ""Tools and resources needed"", ""Conclusion and next steps""]","[""marketing"", ""strategy"", ""promotion"", ""digital""]",6,Marketing Directors & CMOs,"[""social media"", ""content marketing"", ""brand management""]",59,9,2025-10-25 21:44:28,en,How do you develop an effective {keyword} strategy?,0.92,1.0,0.66
34300350,content marketing,marketing,What emerging platforms support content marketing?,comparison,Expert,"[""Introduction to content marketing"", ""Key points and analysis"", ""Practical examples"", ""Expert insights"", ""Action items"", ""Conclusion""]","[""content"", ""comparison"", ""marketing"", ""advertising"", ""branding""]",4,Marketing Directors & CMOs,"[""digital marketing"", ""brand management"", ""social media""]",50,6,2025-10-25 21:44:28,en,What emerging platforms support {keyword}?,0.73,1.0,0.37
34300351,cloud computing,it,How do you get started with cloud computing as a beginner?,strategy,Intermediate,"[""Overview of cloud computing"", ""Step-by-step implementation"", ""Best practices and tips"", ""Common challenges and solutions"", ""Tools and resources needed"", ""Conclusion and next steps""]","[""computing"", ""cloud"", ""development"", ""it"", ""software"", ""strategy""]",6,Junior to Mid-level Developers,"[""machine learning"", ""web development"", ""cybersecurity"", ""data science""]",58,11,2025-10-25 21:44:28,en,How do you get started with {keyword} as a beginner?,0.77,0.6107079901455538,0.66
34300352,cloud computing,it,What are the best practices for cloud computing development?,best_practice,Advanced,"[""Introduction to cloud computing"", ""Key concepts and definitions"", ""Main categories or types"", ""Examples and case studies"", ""Benefits and advantages"", ""Summary and recommendations""]","[""computing"", ""software"", ""development"", ""it"", ""best_practice"", ""cloud""]",6,Senior Developers & Tech Leads,"[""web development"", ""machine learning"", ""cybersecurity"", ""data science""]",60,9,2025-10-25 21:44:28,en,What are the best practices for {keyword} development?,0.67,0.8805257305894688,0.54
34300353,brand management,marketing,What channels are most effective for brand management?,comparison,Advanced,"[""Introduction to brand management"", ""Key points and analysis"", ""Practical examples"", ""Expert insights"", ""Action items"", ""Conclusion""]","[""promotion"", ""comparison"", ""marketing"", ""management"", ""digital"", ""brand""]",4,Marketing Managers & Strategists,"[""digital marketing"", ""content marketing"", ""social media""]",54,8,2025-10-25 21:44:28,en,What channels are most effective for {keyword}?,0.69,0.9327463623496075,0.46
34300354,portfolio management,economics,What are the risks associated with portfolio management?,troubleshooting,Advanced,"[""Introduction to portfolio management"", ""Key concepts and definitions"", ""Main categories or types"", ""Examples and case studies"", ""Benefits and advantages"", ""Summary and recommendations""]","[""portfolio"", ""troubleshooting"", ""management"", ""market"", ""business"", ""economics""]",6,Professional Investors & Advisors,"[""investment planning"", ""financial modeling"", ""market analysis""]",56,8,2025-10-25 21:44:28,en,What are the risks associated with {keyword}?,0.85,0.8683001998927246,0.42
34300355,portfolio management,economics,How do you report on portfolio management performance to stakeholders?,troubleshooting,Advanced,"[""Overview of portfolio management"", ""Step-by-step implementation"", ""Best practices and tips"", ""Common challenges and solutions"", ""Tools and resources needed"", ""Conclusion and next steps""]","[""investment"", ""finance"", ""portfolio"", ""troubleshooting"", ""management"", ""economics""]",6,Professional Investors & Advisors,"[""financial modeling"", ""market analysis"", ""investment planning""]",70,10,2025-10-25 21:44:28,en,How do you report on {keyword} performance to stakeholders?,0.61,0.8213171218817386,0.37
34300356,machine learning,it,What is the recommended architecture for machine learning systems?,planning,Advanced,"[""Introduction to machine learning"", ""Key points and analysis"", ""Practical examples"", ""Expert insights"", ""Action items"", ""Conclusion""]","[""planning"", ""development"", ""it"", ""software"", ""learning"", ""machine""]",4,Senior Developers & Tech Leads,"[""cybersecurity"", ""web development"", ""data science"", ""cloud computing""]",66,9,2025-10-25 21:44:28,en,What is the recommended architecture for {keyword} systems?,0.94,0.8681379540003973,0.61
34300357,machine learning,it,How does machine learning impact business operations?,troubleshooting,Beginner,"[""Introduction to machine learning"", ""Key points and analysis"", ""Practical examples"", ""Expert insights"", ""Action items"", ""Conclusion""]","[""development"", ""it"", ""programming"", ""troubleshooting"", ""learning"", ""machine""]",4,Students & Entry-level Developers,"[""web development"", ""cybersecurity"", ""cloud computing"", ""data science""]",53,7,2025-10-25 21:44:28,en,How does {keyword} impact business operations?,0.88,0.45351464738357083,0.77
34300358,web development,it,What are the key components of a web development implementation?,comparison,Expert,"[""Introduction to web development"", ""Key concepts and definitions"", ""Main categories or types"", ""Examples and case studies"", ""Benefits and advantages"", ""Summary and recommendations""]","[""software"", ""development"", ""it"", ""comparison"", ""programming"", ""web""]",6,Architects & Technical Directors,"[""cloud computing"", ""data science"", ""machine learning"", ""cybersecurity""]",64,10,2025-10-25 21:44:28,en,What are the key components of a {keyword} implementation?,0.82,1.0,0.42
34300359,content marketing,marketing,What channels are most effective for content marketing?,evaluation,Intermediate,"[""Introduction to content marketing"", ""Key points and analysis"", ""Practical examples"", ""Expert insights"", ""Action items"", ""Conclusion""]","[""content"", ""marketing"", ""digital"", ""branding"", ""evaluation""]",4,Marketing Coordinators & Specialists,"[""digital marketing"", ""social media"", ""brand management""]",55,8,2025-10-25 21:44:28,en,What channels are most effective for {keyword}?,0.65,0.7266311231129673,0.62
34300360,market analysis,economics,What are the regulatory considerations for market analysis?,how_to,Beginner,"[""Introduction to market analysis"", ""Key concepts and definitions"", ""Main categories or types"", ""Examples and case studies"", ""Benefits and advantages"", ""Summary and recommendations""]","[""how_to"", ""finance"", ""analysis"", ""market"", ""economics""]",6,Students & New Investors,"[""investment planning"", ""portfolio management"", ""financial modeling""]",59,8,2025-10-25 21:44:28,en,What are the regulatory considerations for {keyword}?,0.78,0.3045959834679606,0.45
34300361,brand management,marketing,What tools are essential for brand management analytics?,analysis,Advanced,"[""Introduction to brand management"", ""Key points and analysis"", ""Practical examples"", ""Expert insights"", ""Action items"", ""Conclusion""]","[""analysis"", ""promotion"", ""marketing"", ""management"", ""branding"", ""brand""]",4,Marketing Managers & Strategists,"[""social media"", ""content marketing"", ""digital marketing""]",56,8,2025-10-25 21:44:28,en,What tools are essential for {keyword} analytics?,0.79,0.8530901070679469,0.86
34300362,market analysis,economics,How do you hedge against market analysis market downturns?,how_to,Expert,"[""Overview of market analysis"", ""Step-by-step implementation"", ""Best practices and tips"", ""Common challenges and solutions"", ""Tools and resources needed"", ""Conclusion and next steps""]","[""investment"", ""how_to"", ""finance"", ""analysis"", ""market"", ""economics""]",6,Portfolio Managers & Financial Experts,"[""financial modeling"", ""investment planning"", ""portfolio management""]",58,9,2025-10-25 21:44:28,en,How do you hedge against {keyword} market downturns?,0.78,1.0,0.59
34300363,data science,it,How do you design a scalable data science solution?,best_practice,Expert,"[""Overview of data science"", ""Step-by-step implementation"", ""Best practices and tips"", ""Common challenges and solutions"", ""Tools and resources needed"", ""Conclusion and next steps""]","[""technology"", ""development"", ""it"", ""best_practice"", ""science"", ""data""]",6,Architects & Technical Directors,"[""machine learning"", ""cybersecurity"", ""web development"", ""cloud computing""]",51,9,2025-10-25 21:44:28,en,How do you design a scalable {keyword} solution?,0.78,1.0,0.76
34300364,investment planning,economics,What is the optimal allocation for investment planning in a portfolio?,how_to,Advanced,"[""Introduction to investment planning"", ""Key points and analysis"", ""Practical examples"", ""Expert insights"", ""Action items"", ""Conclusion""]","[""investment"", ""how_to"", ""planning"", ""finance"", ""economics""]",4,Professional Investors & Advisors,"[""portfolio management"", ""financial modeling"", ""market analysis""]",70,11,2025-10-25 21:44:28,en,What is the optimal allocation for {keyword} in a portfolio?,0.87,0.995113689403517,0.62
34300365,brand management,marketing,What content types work best for brand management?,comparison,Advanced,"[""Introduction to brand management"", ""Key points and analysis"", ""Practical examples"", ""Expert insights"", ""Action items"", ""Conclusion""]","[""comparison"", ""digital"", ""marketing"", ""management"", ""branding"", ""brand""]",4,Marketing Managers & Strategists,"[""content marketing"", ""digital marketing"", ""social media""]",50,8,2025-10-25 21:44:28,en,What content types work best for {keyword}?,0.73,0.8284964706836535,0.78
34300366,social media,marketing,What channels are most effective for social media?,optimization,Expert,"[""Introduction to social media"", ""Key points and analysis"", ""Practical examples"", ""Expert insights"", ""Action items"", ""Conclusion""]","[""media"", ""marketing"", ""social"", ""advertising"", ""branding"", ""optimization""]",4,Marketing Directors & CMOs,"[""digital marketing"", ""content marketing"", ""brand management""]",50,8,2025-10-25 21:44:28,en,What channels are most effective for {keyword}?,0.88,1.0,0.67
34300367,cloud computing,it,What certifications are valuable for cloud computing professionals?,comparison,Intermediate,"[""Introduction to cloud computing"", ""Key points and analysis"", ""Practical examples"", ""Expert insights"", ""Action items"", ""Conclusion""]","[""computing"", ""software"", ""it"", ""comparison"", ""programming"", ""cloud""]",4,Junior to Mid-level Developers,"[""machine learning"", ""cybersecurity"", ""data science"", ""web development""]",67,8,2025-10-25 21:44:28,en,What certifications are valuable for {keyword} professionals?,0.64,0.6962308820892805,0.51
34300368,content marketing,marketing,How do you personalize content marketing for different segments?,best_practice,Beginner,"[""Overview of content marketing"", ""Step-by-step implementation"", ""Best practices and tips"", ""Common challenges and solutions"", ""Tools and resources needed"", ""Conclusion and next steps""]","[""content"", ""best_practice"", ""marketing"", ""digital"", ""advertising""]",6,Marketing Students & Interns,"[""social media"", ""digital marketing"", ""brand management""]",64,9,2025-10-25 21:44:28,en,How do you personalize {keyword} for different segments?,0.86,0.4131611266074088,0.79
34300369,cloud computing,it,What design patterns work best with cloud computing?,troubleshooting,Beginner,"[""Introduction to cloud computing"", ""Key points and analysis"", ""Practical examples"", ""Expert insights"", ""Action items"", ""Conclusion""]","[""computing"", ""development"", ""it"", ""programming"", ""troubleshooting"", ""cloud""]",4,Students & Entry-level Developers,"[""cybersecurity"", ""web development"", ""data science"", ""machine learning""]",52,8,2025-10-25 21:44:28,en,What design patterns work best with {keyword}?,0.93,0.3233758814579793,0.57
34300370,web development,it,How do you measure the success of web development projects?,strategy,Beginner,"[""Overview of web development"", ""Step-by-step implementation"", ""Best practices and tips"", ""Common challenges and solutions"", ""Tools and resources needed"", ""Conclusion and next steps""]","[""technology"", ""development"", ""it"", ""programming"", ""strategy"", ""web""]",6,Students & Entry-level Developers,"[""machine learning"", ""cloud computing"", ""data science"", ""cybersecurity""]",59,10,2025-10-25 21:44:28,en,How do you measure the success of {keyword} projects?,0.93,0.49343268970673715,0.62
34300371,cloud computing,it,How does cloud computing impact business operations?,planning,Intermediate,"[""Introduction to cloud computing"", ""Key points and analysis"", ""Practical examples"", ""Expert insights"", ""Action items"", ""Conclusion""]","[""computing"", ""planning"", ""software"", ""it"", ""cloud"", ""technology""]",4,Junior to Mid-level Developers,"[""data science"", ""web development"", ""cybersecurity"", ""machine learning""]",52,7,2025-10-25 21:44:28,en,How does {keyword} impact business operations?,0.6,0.6389967242005156,0.63
34300372,cloud computing,it,How does cloud computing impact business operations?,strategy,Intermediate,"[""Introduction to cloud computing"", ""Key points and analysis"", ""Practical examples"", ""Expert insights"", ""Action items"", ""Conclusion""]","[""computing"", ""cloud"", ""development"", ""it"", ""strategy"", ""technology""]",4,Junior to Mid-level Developers,"[""data science"", ""cybersecurity"", ""machine learning"", ""web development""]",52,7,2025-10-25 21:44:28,en,How does {keyword} impact business operations?,0.8,0.6809337263837444,0.72
34300373,investment planning,economics,How do you adjust your investment planning strategy during volatility?,evaluation,Advanced,"[""Overview of investment planning"", ""Step-by-step implementation"", ""Best practices and tips"", ""Common challenges and solutions"", ""Tools and resources needed"", ""Conclusion and next steps""]","[""investment"", ""planning"", ""evaluation"", ""market"", ""economics""]",6,Professional Investors & Advisors,"[""financial modeling"", ""market analysis"", ""portfolio management""]",70,10,2025-10-25 21:44:28,en,How do you adjust your {keyword} strategy during volatility?,0.74,0.944389675951611,0.54
34300374,machine learning,it,How do you choose the right technology stack for machine learning?,optimization,Expert,"[""Overview of machine learning"", ""Step-by-step implementation"", ""Best practices and tips"", ""Common challenges and solutions"", ""Tools and resources needed"", ""Conclusion and next steps""]","[""software"", ""it"", ""programming"", ""learning"", ""optimization"", ""machine""]",6,Architects & Technical Directors,"[""cloud computing"", ""cybersecurity"", ""data science"", ""web development""]",66,11,2025-10-25 21:44:28,en,How do you choose the right technology stack for {keyword}?,0.91,1.0,0.51
34300375,digital marketing,marketing,What budget should be allocated to digital marketing?,implementation,Intermediate,"[""Introduction to digital marketing"", ""Key points and analysis"", ""Practical examples"", ""Expert insights"", ""Action items"", ""Conclusion""]","[""implementation"", ""marketing"", ""advertising"", ""digital""]",4,Marketing Coordinators & Specialists,"[""content marketing"", ""brand management"", ""social media""]",53,8,2025-10-25 21:44:28,en,What budget should be allocated to {keyword}?,0.84,0.7510320590506888,0.45
34300376,investment planning,economics,What tools help analyze investment planning data?,best_practice,Beginner,"[""Introduction to investment planning"", ""Key points and analysis"", ""Practical examples"", ""Expert insights"", ""Action items"", ""Conclusion""]","[""investment"", ""planning"", ""best_practice"", ""market"", ""economics""]",4,Students & New Investors,"[""market analysis"", ""portfolio management"", ""financial modeling""]",49,7,2025-10-25 21:44:28,en,What tools help analyze {keyword} data?,0.75,0.3197216483245159,0.37
34300377,financial modeling,economics,What are the regulatory considerations for financial modeling?,strategy,Advanced,"[""Introduction to financial modeling"", ""Key concepts and definitions"", ""Main categories or types"", ""Examples and case studies"", ""Benefits and advantages"", ""Summary and recommendations""]","[""investment"", ""modeling"", ""financial"", ""market"", ""strategy"", ""economics""]",6,Professional Investors & Advisors,"[""investment planning"", ""portfolio management"", ""market analysis""]",62,8,2025-10-25 21:44:28,en,What are the regulatory considerations for {keyword}?,0.6,0.9297608898597096,0.89
34300378,market analysis,economics,What are the risks associated with market analysis?,strategy,Expert,"[""Introduction to market analysis"", ""Key concepts and definitions"", ""Main categories or types"", ""Examples and case studies"", ""Benefits and advantages"", ""Summary and recommendations""]","[""finance"", ""analysis"", ""market"", ""strategy"", ""economics""]",6,Portfolio Managers & Financial Experts,"[""financial modeling"", ""investment planning"", ""portfolio management""]",51,8,2025-10-25 21:44:28,en,What are the risks associated with {keyword}?,0.87,1.0,0.36
34300379,digital marketing,marketing,How do you reach new customers through digital marketing?,comparison,Beginner,"[""Overview of digital marketing"", ""Step-by-step implementation"", ""Best practices and tips"", ""Common challenges and solutions"", ""Tools and resources needed"", ""Conclusion and next steps""]","[""comparison"", ""marketing"", ""digital"", ""advertising"", ""branding""]",6,Marketing Students & Interns,"[""brand management"", ""content marketing"", ""social media""]",57,9,2025-10-25 21:44:28,en,How do you reach new customers through {keyword}?,0.65,0.3721725057442872,0.54
34300380,market analysis,economics,How do you assess and manage market analysis risks?,comparison,Beginner,"[""Overview of market analysis"", ""Step-by-step implementation"", ""Best practices and tips"", ""Common challenges and solutions"", ""Tools and resources needed"", ""Conclusion and next steps""]","[""investment"", ""analysis"", ""finance"", ""comparison"", ""market"", ""economics""]",6,Students & New Investors,"[""financial modeling"", ""investment planning"", ""portfolio management""]",51,9,2025-10-25 21:44:28,en,How do you assess and manage {keyword} risks?,0.7,0.37577536909094206,0.87
34300381,content marketing,marketing,What A/B tests should you run for content marketing?,comparison,Intermediate,"[""Introduction to content marketing"", ""Key points and analysis"", ""Practical examples"", ""Expert insights"", ""Action items"", ""Conclusion""]","[""content"", ""comparison"", ""marketing"", ""digital"", ""branding""]",4,Marketing Coordinators & Specialists,"[""brand management"", ""digital marketing"", ""social media""]",52,9,2025-10-25 21:44:28,en,What A/B tests should you run for {keyword}?,0.73,0.6507116178803215,0.53
34300382,cybersecurity,it,Which frameworks support cybersecurity implementation?,troubleshooting,Beginner,"[""Introduction to cybersecurity"", ""Key points and analysis"", ""Practical examples"", ""Expert insights"", ""Action items"", ""Conclusion""]","[""software"", ""development"", ""it"", ""troubleshooting"", ""cybersecurity""]",4,Students & Entry-level Developers,"[""cloud computing"", ""web development"", ""data science"", ""machine learning""]",54,5,2025-10-25 21:44:28,en,Which frameworks support {keyword} implementation?,0.8,0.39568545351111417,0.57
34300383,content marketing,marketing,How do you track and analyze content marketing performance?,how_to,Beginner,"[""Overview of content marketing"", ""Step-by-step implementation"", ""Best practices and tips"", ""Common challenges and solutions"", ""Tools and resources needed"", ""Conclusion and next steps""]","[""how_to"", ""content"", ""promotion"", ""marketing"", ""branding""]",6,Marketing Students & Interns,"[""digital marketing"", ""social media"", ""brand management""]",59,9,2025-10-25 21:44:28,en,How do you track and analyze {keyword} performance?,0.62,0.3670833459130302,0.55
34300384,financial modeling,economics,What factors should be considered when evaluating financial modeling?,how_to,Beginner,"[""Introduction to financial modeling"", ""Key points and analysis"", ""Practical examples"", ""Expert insights"", ""Action items"", ""Conclusion""]","[""how_to"", ""modeling"", ""financial"", ""market"", ""business"", ""economics""]",4,Students & New Investors,"[""investment planning"", ""portfolio management"", ""market analysis""]",69,9,2025-10-25 21:44:28,en,What factors should be considered when evaluating {keyword}?,0.78,0.40853728960035474,0.55
34300385,digital marketing,marketing,What KPIs are most important for digital marketing?,implementation,Beginner,"[""Introduction to digital marketing"", ""Key points and analysis"", ""Practical examples"", ""Expert insights"", ""Action items"", ""Conclusion""]","[""implementation"", ""marketing"", ""digital"", ""advertising"", ""branding""]",4,Marketing Students & Interns,"[""brand management"", ""social media"", ""content marketing""]",51,8,2025-10-25 21:44:28,en,What KPIs are most important for {keyword}?,0.8,0.3262676550660347,0.87
34300386,digital marketing,marketing,How do you optimize digital marketing for mobile users?,optimization,Intermediate,"[""Overview of digital marketing"", ""Step-by-step implementation"", ""Best practices and tips"", ""Common challenges and solutions"", ""Tools and resources needed"", ""Conclusion and next steps""]","[""marketing"", ""optimization"", ""advertising"", ""digital""]",6,Marketing Coordinators & Specialists,"[""brand management"", ""content marketing"", ""social media""]",55,9,2025-10-25 21:44:28,en,How do you optimize {keyword} for mobile users?,0.68,0.6240762804692218,0.77
34300387,data science,it,What ROI can be expected from data science implementation?,optimization,Advanced,"[""Introduction to data science"", ""Key points and analysis"", ""Practical examples"", ""Expert insights"", ""Action items"", ""Conclusion""]","[""software"", ""it"", ""programming"", ""science"", ""optimization"", ""data""]",4,Senior Developers & Tech Leads,"[""cybersecurity"", ""web development"", ""machine learning"", ""cloud computing""]",58,9,2025-10-25 21:44:28,en,What ROI can be expected from {keyword} implementation?,0.82,0.9124664114765161,0.81
34300388,investment planning,economics,What are the seasonal patterns in investment planning?,optimization,Beginner,"[""Introduction to investment planning"", ""Key concepts and definitions"", ""Main categories or types"", ""Examples and case studies"", ""Benefits and advantages"", ""Summary and recommendations""]","[""investment"", ""planning"", ""market"", ""optimization"", ""economics""]",6,Students & New Investors,"[""market analysis"", ""portfolio management"", ""financial modeling""]",54,8,2025-10-25 21:44:28,en,What are the seasonal patterns in {keyword}?,0.92,0.383449279152408,0.79
34300389,investment planning,economics,How do economic conditions affect investment planning performance?,troubleshooting,Expert,"[""Introduction to investment planning"", ""Key points and analysis"", ""Practical examples"", ""Expert insights"", ""Action items"", ""Conclusion""]","[""investment"", ""planning"", ""troubleshooting"", ""market"", ""economics""]",4,Portfolio Managers & Financial Experts,"[""financial modeling"", ""market analysis"", ""portfolio management""]",66,8,2025-10-25 21:44:28,en,How do economic conditions affect {keyword} performance?,0.73,1.0,0.45
34300390,financial modeling,economics,What are the seasonal patterns in financial modeling?,best_practice,Advanced,"[""Introduction to financial modeling"", ""Key concepts and definitions"", ""Main categories or types"", ""Examples and case studies"", ""Benefits and advantages"", ""Summary and recommendations""]","[""investment"", ""best_practice"", ""modeling"", ""financial"", ""market"", ""economics""]",6,Professional Investors & Advisors,"[""investment planning"", ""portfolio management"", ""market analysis""]",53,8,2025-10-25 21:44:28,en,What are the seasonal patterns in {keyword}?,0.82,0.9242313666158997,0.39
34300391,brand management,marketing,How do you reach new customers through brand management?,comparison,Intermediate,"[""Overview of brand management"", ""Step-by-step implementation"", ""Best practices and tips"", ""Common challenges and solutions"", ""Tools and resources needed"", ""Conclusion and next steps""]","[""promotion"", ""comparison"", ""marketing"", ""management"", ""branding"", ""brand""]",6,Marketing Coordinators & Specialists,"[""digital marketing"", ""content marketing"", ""social media""]",56,9,2025-10-25 21:44:28,en,How do you reach new customers through {keyword}?,0.63,0.7878264469719831,0.8
34300392,digital marketing,marketing,How do you personalize digital marketing for different segments?,strategy,Expert,"[""Overview of digital marketing"", ""Step-by-step implementation"", ""Best practices and tips"", ""Common challenges and solutions"", ""Tools and resources needed"", ""Conclusion and next steps""]","[""promotion"", ""marketing"", ""digital"", ""branding"", ""strategy""]",6,Marketing Directors & CMOs,"[""brand management"", ""social media"", ""content marketing""]",64,9,2025-10-25 21:44:28,en,How do you personalize {keyword} for different segments?,0.79,1.0,0.61
