record_id,keyword,category,question,question_type,difficulty_level,answer_outline,tags,estimated_read_time,target_audience,related_topics,question_length,word_count,created_date,language,source_template,engagement_score,complexity_score,popularity_score
30300959,data science,it,What tools are essential for data science development?,comparison,Expert,"[""Introduction to data science"", ""Key points and analysis"", ""Practical examples"", ""Expert insights"", ""Action items"", ""Conclusion""]","[""technology"", ""it"", ""comparison"", ""programming"", ""science"", ""data""]",4,Architects & Technical Directors,"[""cloud computing"", ""machine learning"", ""cybersecurity"", ""web development""]",54,8,2025-10-25 21:38:46,en,What tools are essential for {keyword} development?,0.92,1.0,0.39
30300960,brand management,marketing,What content types work best for brand management?,optimization,Beginner,"[""Introduction to brand management"", ""Key points and analysis"", ""Practical examples"", ""Expert insights"", ""Action items"", ""Conclusion""]","[""marketing"", ""management"", ""digital"", ""branding"", ""optimization"", ""brand""]",4,Marketing Students & Interns,"[""social media"", ""digital marketing"", ""content marketing""]",50,8,2025-10-25 21:38:46,en,What content types work best for {keyword}?,0.8,0.3109705500914453,0.5
30300961,web development,it,How can web development improve system performance and scalability?,evaluation,Expert,"[""Introduction to web development"", ""Key points and analysis"", ""Practical examples"", ""Expert insights"", ""Action items"", ""Conclusion""]","[""development"", ""web"", ""it"", ""evaluation"", ""technology""]",4,Architects & Technical Directors,"[""machine learning"", ""data science"", ""cloud computing"", ""cybersecurity""]",67,9,2025-10-25 21:38:46,en,How can {keyword} improve system performance and scalability?,0.93,1.0,0.37
30300962,data science,it,How do you troubleshoot common issues with data science?,best_practice,Beginner,"[""Overview of data science"", ""Step-by-step implementation"", ""Best practices and tips"", ""Common challenges and solutions"", ""Tools and resources needed"", ""Conclusion and next steps""]","[""software"", ""it"", ""best_practice"", ""programming"", ""science"", ""data""]",6,Students & Entry-level Developers,"[""machine learning"", ""cloud computing"", ""web development"", ""cybersecurity""]",56,9,2025-10-25 21:38:46,en,How do you troubleshoot common issues with {keyword}?,0.75,0.3340677389947557,0.72
30300963,content marketing,marketing,What channels are most effective for content marketing?,how_to,Advanced,"[""Introduction to content marketing"", ""Key points and analysis"", ""Practical examples"", ""Expert insights"", ""Action items"", ""Conclusion""]","[""how_to"", ""content"", ""promotion"", ""marketing"", ""advertising""]",4,Marketing Managers & Strategists,"[""digital marketing"", ""social media"", ""brand management""]",55,8,2025-10-25 21:38:46,en,What channels are most effective for {keyword}?,0.72,0.8955092621813963,0.54
30300964,content marketing,marketing,What budget should be allocated to content marketing?,planning,Expert,"[""Introduction to content marketing"", ""Key points and analysis"", ""Practical examples"", ""Expert insights"", ""Action items"", ""Conclusion""]","[""planning"", ""content"", ""marketing"", ""digital"", ""advertising""]",4,Marketing Directors & CMOs,"[""digital marketing"", ""brand management"", ""social media""]",53,8,2025-10-25 21:38:46,en,What budget should be allocated to {keyword}?,0.94,1.0,0.31
30300965,market analysis,economics,How do you hedge against market analysis market downturns?,best_practice,Beginner,"[""Overview of market analysis"", ""Step-by-step implementation"", ""Best practices and tips"", ""Common challenges and solutions"", ""Tools and resources needed"", ""Conclusion and next steps""]","[""investment"", ""finance"", ""analysis"", ""best_practice"", ""market"", ""economics""]",6,Students & New Investors,"[""investment planning"", ""financial modeling"", ""portfolio management""]",58,9,2025-10-25 21:38:46,en,How do you hedge against {keyword} market downturns?,0.87,0.35485922533324576,0.39
30300966,cybersecurity,it,What are the cost considerations for cybersecurity?,best_practice,Expert,"[""Introduction to cybersecurity"", ""Key concepts and definitions"", ""Main categories or types"", ""Examples and case studies"", ""Benefits and advantages"", ""Summary and recommendations""]","[""software"", ""it"", ""best_practice"", ""cybersecurity"", ""technology""]",5,Architects & Technical Directors,"[""web development"", ""data science"", ""machine learning"", ""cloud computing""]",51,7,2025-10-25 21:38:46,en,What are the cost considerations for {keyword}?,0.8,1.0,0.53
30300967,investment planning,economics,How do you analyze market trends in investment planning?,strategy,Beginner,"[""Overview of investment planning"", ""Step-by-step implementation"", ""Best practices and tips"", ""Common challenges and solutions"", ""Tools and resources needed"", ""Conclusion and next steps""]","[""investment"", ""planning"", ""finance"", ""business"", ""strategy"", ""economics""]",6,Students & New Investors,"[""portfolio management"", ""market analysis"", ""financial modeling""]",56,9,2025-10-25 21:38:46,en,How do you analyze market trends in {keyword}?,0.92,0.4851049103343436,0.53
30300968,cybersecurity,it,What certifications are valuable for cybersecurity professionals?,comparison,Expert,"[""Introduction to cybersecurity"", ""Key points and analysis"", ""Practical examples"", ""Expert insights"", ""Action items"", ""Conclusion""]","[""software"", ""it"", ""comparison"", ""programming"", ""cybersecurity""]",4,Architects & Technical Directors,"[""cloud computing"", ""data science"", ""machine learning"", ""web development""]",65,7,2025-10-25 21:38:46,en,What certifications are valuable for {keyword} professionals?,0.8,1.0,0.57
30300969,web development,it,How do you get started with web development as a beginner?,analysis,Beginner,"[""Overview of web development"", ""Step-by-step implementation"", ""Best practices and tips"", ""Common challenges and solutions"", ""Tools and resources needed"", ""Conclusion and next steps""]","[""software"", ""development"", ""analysis"", ""it"", ""web""]",6,Students & Entry-level Developers,"[""data science"", ""machine learning"", ""cybersecurity"", ""cloud computing""]",58,11,2025-10-25 21:38:46,en,How do you get started with {keyword} as a beginner?,0.72,0.42221521082774743,0.48
30300970,content marketing,marketing,What does the future hold for content marketing?,analysis,Intermediate,"[""Introduction to content marketing"", ""Key points and analysis"", ""Practical examples"", ""Expert insights"", ""Action items"", ""Conclusion""]","[""content"", ""analysis"", ""promotion"", ""marketing"", ""digital""]",4,Marketing Coordinators & Specialists,"[""social media"", ""brand management"", ""digital marketing""]",48,8,2025-10-25 21:38:46,en,What does the future hold for {keyword}?,0.81,0.7425917978242794,0.89
30300971,machine learning,it,What career opportunities exist in machine learning?,best_practice,Intermediate,"[""Introduction to machine learning"", ""Key points and analysis"", ""Practical examples"", ""Expert insights"", ""Action items"", ""Conclusion""]","[""software"", ""it"", ""best_practice"", ""learning"", ""machine"", ""technology""]",4,Junior to Mid-level Developers,"[""data science"", ""cloud computing"", ""cybersecurity"", ""web development""]",52,7,2025-10-25 21:38:46,en,What career opportunities exist in {keyword}?,0.72,0.7408158803772522,0.51
30300972,investment planning,economics,How do you create a long-term plan for investment planning?,evaluation,Advanced,"[""Overview of investment planning"", ""Step-by-step implementation"", ""Best practices and tips"", ""Common challenges and solutions"", ""Tools and resources needed"", ""Conclusion and next steps""]","[""investment"", ""planning"", ""finance"", ""evaluation"", ""business"", ""economics""]",6,Professional Investors & Advisors,"[""financial modeling"", ""market analysis"", ""portfolio management""]",59,10,2025-10-25 21:38:46,en,How do you create a long-term plan for {keyword}?,0.71,0.8571985343760689,0.71
30300973,cloud computing,it,How do you measure the success of cloud computing projects?,troubleshooting,Expert,"[""Overview of cloud computing"", ""Step-by-step implementation"", ""Best practices and tips"", ""Common challenges and solutions"", ""Tools and resources needed"", ""Conclusion and next steps""]","[""computing"", ""it"", ""programming"", ""troubleshooting"", ""cloud"", ""technology""]",6,Architects & Technical Directors,"[""machine learning"", ""web development"", ""data science"", ""cybersecurity""]",59,10,2025-10-25 21:38:46,en,How do you measure the success of {keyword} projects?,0.68,1.0,0.89
30300974,web development,it,What is the recommended architecture for web development systems?,troubleshooting,Beginner,"[""Introduction to web development"", ""Key points and analysis"", ""Practical examples"", ""Expert insights"", ""Action items"", ""Conclusion""]","[""development"", ""web"", ""it"", ""troubleshooting"", ""technology""]",4,Students & Entry-level Developers,"[""data science"", ""cybersecurity"", ""cloud computing"", ""machine learning""]",65,9,2025-10-25 21:38:46,en,What is the recommended architecture for {keyword} systems?,0.91,0.4551705735103793,0.86
30300975,brand management,marketing,How do you develop an effective brand management strategy?,strategy,Advanced,"[""Overview of brand management"", ""Step-by-step implementation"", ""Best practices and tips"", ""Common challenges and solutions"", ""Tools and resources needed"", ""Conclusion and next steps""]","[""promotion"", ""marketing"", ""management"", ""digital"", ""strategy"", ""brand""]",6,Marketing Managers & Strategists,"[""content marketing"", ""digital marketing"", ""social media""]",58,9,2025-10-25 21:38:46,en,How do you develop an effective {keyword} strategy?,0.77,0.8731714011631408,0.78
30300976,cybersecurity,it,What certifications are valuable for cybersecurity professionals?,troubleshooting,Advanced,"[""Introduction to cybersecurity"", ""Key points and analysis"", ""Practical examples"", ""Expert insights"", ""Action items"", ""Conclusion""]","[""software"", ""it"", ""programming"", ""troubleshooting"", ""cybersecurity""]",4,Senior Developers & Tech Leads,"[""web development"", ""data science"", ""cloud computing"", ""machine learning""]",65,7,2025-10-25 21:38:46,en,What certifications are valuable for {keyword} professionals?,0.61,0.9694468058259136,0.86
30300977,market analysis,economics,What factors should be considered when evaluating market analysis?,analysis,Advanced,"[""Introduction to market analysis"", ""Key points and analysis"", ""Practical examples"", ""Expert insights"", ""Action items"", ""Conclusion""]","[""market"", ""investment"", ""economics"", ""analysis""]",4,Professional Investors & Advisors,"[""investment planning"", ""financial modeling"", ""portfolio management""]",66,9,2025-10-25 21:38:46,en,What factors should be considered when evaluating {keyword}?,0.85,0.8548003085897793,0.59
30300978,content marketing,marketing,How do you track and analyze content marketing performance?,implementation,Intermediate,"[""Overview of content marketing"", ""Step-by-step implementation"", ""Best practices and tips"", ""Common challenges and solutions"", ""Tools and resources needed"", ""Conclusion and next steps""]","[""content"", ""implementation"", ""marketing"", ""advertising"", ""branding""]",6,Marketing Coordinators & Specialists,"[""digital marketing"", ""brand management"", ""social media""]",59,9,2025-10-25 21:38:46,en,How do you track and analyze {keyword} performance?,0.86,0.7153167085088176,0.79
30300979,financial modeling,economics,What strategies work best for financial modeling investment?,how_to,Intermediate,"[""Introduction to financial modeling"", ""Key points and analysis"", ""Practical examples"", ""Expert insights"", ""Action items"", ""Conclusion""]","[""how_to"", ""finance"", ""modeling"", ""financial"", ""market"", ""economics""]",4,Individual Investors & Analysts,"[""portfolio management"", ""market analysis"", ""investment planning""]",60,8,2025-10-25 21:38:46,en,What strategies work best for {keyword} investment?,0.69,0.6089304520312182,0.8
30300980,portfolio management,economics,How do you create a long-term plan for portfolio management?,evaluation,Advanced,"[""Overview of portfolio management"", ""Step-by-step implementation"", ""Best practices and tips"", ""Common challenges and solutions"", ""Tools and resources needed"", ""Conclusion and next steps""]","[""portfolio"", ""management"", ""evaluation"", ""market"", ""business"", ""economics""]",6,Professional Investors & Advisors,"[""financial modeling"", ""investment planning"", ""market analysis""]",60,10,2025-10-25 21:38:46,en,How do you create a long-term plan for {keyword}?,0.92,0.8177948180881213,0.83
30300981,market analysis,economics,What are the seasonal patterns in market analysis?,evaluation,Expert,"[""Introduction to market analysis"", ""Key concepts and definitions"", ""Main categories or types"", ""Examples and case studies"", ""Benefits and advantages"", ""Summary and recommendations""]","[""investment"", ""analysis"", ""evaluation"", ""market"", ""business"", ""economics""]",6,Portfolio Managers & Financial Experts,"[""financial modeling"", ""portfolio management"", ""investment planning""]",50,8,2025-10-25 21:38:46,en,What are the seasonal patterns in {keyword}?,0.68,1.0,0.77
30300982,portfolio management,economics,What strategies work best for portfolio management investment?,implementation,Intermediate,"[""Introduction to portfolio management"", ""Key points and analysis"", ""Practical examples"", ""Expert insights"", ""Action items"", ""Conclusion""]","[""finance"", ""implementation"", ""portfolio"", ""management"", ""business"", ""economics""]",4,Individual Investors & Analysts,"[""financial modeling"", ""market analysis"", ""investment planning""]",62,8,2025-10-25 21:38:46,en,What strategies work best for {keyword} investment?,0.75,0.762250757909693,0.44
30300983,web development,it,How do you integrate web development with existing systems?,implementation,Expert,"[""Overview of web development"", ""Step-by-step implementation"", ""Best practices and tips"", ""Common challenges and solutions"", ""Tools and resources needed"", ""Conclusion and next steps""]","[""software"", ""development"", ""it"", ""implementation"", ""programming"", ""web""]",6,Architects & Technical Directors,"[""machine learning"", ""cybersecurity"", ""cloud computing"", ""data science""]",59,9,2025-10-25 21:38:46,en,How do you integrate {keyword} with existing systems?,0.71,1.0,0.89
30300984,portfolio management,economics,How do you measure portfolio management performance?,analysis,Intermediate,"[""Overview of portfolio management"", ""Step-by-step implementation"", ""Best practices and tips"", ""Common challenges and solutions"", ""Tools and resources needed"", ""Conclusion and next steps""]","[""finance"", ""analysis"", ""portfolio"", ""management"", ""market"", ""economics""]",6,Individual Investors & Analysts,"[""investment planning"", ""financial modeling"", ""market analysis""]",52,7,2025-10-25 21:38:46,en,How do you measure {keyword} performance?,0.61,0.7444209324804416,0.6
30300985,investment planning,economics,How do you hedge against investment planning market downturns?,planning,Advanced,"[""Overview of investment planning"", ""Step-by-step implementation"", ""Best practices and tips"", ""Common challenges and solutions"", ""Tools and resources needed"", ""Conclusion and next steps""]","[""investment"", ""planning"", ""finance"", ""business"", ""economics""]",6,Professional Investors & Advisors,"[""portfolio management"", ""financial modeling"", ""market analysis""]",62,9,2025-10-25 21:38:46,en,How do you hedge against {keyword} market downturns?,0.82,0.9131790412807518,0.87
30300986,brand management,marketing,How do you measure the ROI of brand management campaigns?,troubleshooting,Advanced,"[""Overview of brand management"", ""Step-by-step implementation"", ""Best practices and tips"", ""Common challenges and solutions"", ""Tools and resources needed"", ""Conclusion and next steps""]","[""promotion"", ""troubleshooting"", ""marketing"", ""management"", ""branding"", ""brand""]",6,Marketing Managers & Strategists,"[""digital marketing"", ""social media"", ""content marketing""]",57,10,2025-10-25 21:38:46,en,How do you measure the ROI of {keyword} campaigns?,0.92,0.8437136116032967,0.51
30300987,cybersecurity,it,How do you optimize cybersecurity for different platforms?,planning,Expert,"[""Overview of cybersecurity"", ""Step-by-step implementation"", ""Best practices and tips"", ""Common challenges and solutions"", ""Tools and resources needed"", ""Conclusion and next steps""]","[""software"", ""planning"", ""development"", ""it"", ""cybersecurity""]",5,Architects & Technical Directors,"[""data science"", ""cloud computing"", ""web development"", ""machine learning""]",58,8,2025-10-25 21:38:46,en,How do you optimize {keyword} for different platforms?,0.94,1.0,0.51
30300988,financial modeling,economics,How do you protect your financial modeling investments?,optimization,Beginner,"[""Overview of financial modeling"", ""Step-by-step implementation"", ""Best practices and tips"", ""Common challenges and solutions"", ""Tools and resources needed"", ""Conclusion and next steps""]","[""modeling"", ""financial"", ""business"", ""market"", ""optimization"", ""economics""]",6,Students & New Investors,"[""portfolio management"", ""market analysis"", ""investment planning""]",55,8,2025-10-25 21:38:46,en,How do you protect your {keyword} investments?,0.62,0.46120269433965455,0.87
30300989,financial modeling,economics,How do you analyze market trends in financial modeling?,evaluation,Intermediate,"[""Overview of financial modeling"", ""Step-by-step implementation"", ""Best practices and tips"", ""Common challenges and solutions"", ""Tools and resources needed"", ""Conclusion and next steps""]","[""investment"", ""modeling"", ""financial"", ""evaluation"", ""business"", ""economics""]",6,Individual Investors & Analysts,"[""investment planning"", ""market analysis"", ""portfolio management""]",55,9,2025-10-25 21:38:46,en,How do you analyze market trends in {keyword}?,0.68,0.6581965102895029,0.31
30300990,investment planning,economics,How do you analyze market trends in investment planning?,comparison,Intermediate,"[""Overview of investment planning"", ""Step-by-step implementation"", ""Best practices and tips"", ""Common challenges and solutions"", ""Tools and resources needed"", ""Conclusion and next steps""]","[""investment"", ""planning"", ""comparison"", ""business"", ""economics""]",6,Individual Investors & Analysts,"[""financial modeling"", ""market analysis"", ""portfolio management""]",56,9,2025-10-25 21:38:46,en,How do you analyze market trends in {keyword}?,0.68,0.7053740017971502,0.33
30300991,social media,marketing,How do you personalize social media for different segments?,implementation,Intermediate,"[""Overview of social media"", ""Step-by-step implementation"", ""Best practices and tips"", ""Common challenges and solutions"", ""Tools and resources needed"", ""Conclusion and next steps""]","[""media"", ""implementation"", ""marketing"", ""digital"", ""social"", ""advertising""]",6,Marketing Coordinators & Specialists,"[""digital marketing"", ""brand management"", ""content marketing""]",59,9,2025-10-25 21:38:46,en,How do you personalize {keyword} for different segments?,0.63,0.6403168856771256,0.59
30300992,brand management,marketing,How do you attribute success to brand management efforts?,implementation,Advanced,"[""Overview of brand management"", ""Step-by-step implementation"", ""Best practices and tips"", ""Common challenges and solutions"", ""Tools and resources needed"", ""Conclusion and next steps""]","[""implementation"", ""marketing"", ""management"", ""digital"", ""branding"", ""brand""]",6,Marketing Managers & Strategists,"[""digital marketing"", ""content marketing"", ""social media""]",57,9,2025-10-25 21:38:46,en,How do you attribute success to {keyword} efforts?,0.85,0.883847493946612,0.41
30300993,market analysis,economics,What insurance options are available for market analysis?,best_practice,Intermediate,"[""Introduction to market analysis"", ""Key points and analysis"", ""Practical examples"", ""Expert insights"", ""Action items"", ""Conclusion""]","[""finance"", ""analysis"", ""best_practice"", ""market"", ""economics""]",4,Individual Investors & Analysts,"[""investment planning"", ""portfolio management"", ""financial modeling""]",57,8,2025-10-25 21:38:46,en,What insurance options are available for {keyword}?,0.72,0.7998345080501448,0.43
30300994,content marketing,marketing,How do you innovate within content marketing?,best_practice,Advanced,"[""Overview of content marketing"", ""Step-by-step implementation"", ""Best practices and tips"", ""Common challenges and solutions"", ""Tools and resources needed"", ""Conclusion and next steps""]","[""content"", ""best_practice"", ""marketing"", ""digital"", ""advertising""]",6,Marketing Managers & Strategists,"[""social media"", ""brand management"", ""digital marketing""]",45,7,2025-10-25 21:38:46,en,How do you innovate within {keyword}?,0.65,0.9964910551865074,0.89
30300995,investment planning,economics,How do economic conditions affect investment planning performance?,strategy,Beginner,"[""Introduction to investment planning"", ""Key points and analysis"", ""Practical examples"", ""Expert insights"", ""Action items"", ""Conclusion""]","[""investment"", ""planning"", ""finance"", ""market"", ""strategy"", ""economics""]",4,Students & New Investors,"[""portfolio management"", ""financial modeling"", ""market analysis""]",66,8,2025-10-25 21:38:46,en,How do economic conditions affect {keyword} performance?,0.71,0.4124284947581748,0.49
30300996,social media,marketing,How do you improve social media conversion rates?,implementation,Expert,"[""Overview of social media"", ""Step-by-step implementation"", ""Best practices and tips"", ""Common challenges and solutions"", ""Tools and resources needed"", ""Conclusion and next steps""]","[""media"", ""implementation"", ""marketing"", ""digital"", ""social"", ""branding""]",6,Marketing Directors & CMOs,"[""content marketing"", ""brand management"", ""digital marketing""]",49,8,2025-10-25 21:38:46,en,How do you improve {keyword} conversion rates?,0.94,1.0,0.59
30300997,content marketing,marketing,What emerging platforms support content marketing?,best_practice,Intermediate,"[""Introduction to content marketing"", ""Key points and analysis"", ""Practical examples"", ""Expert insights"", ""Action items"", ""Conclusion""]","[""content"", ""promotion"", ""best_practice"", ""marketing"", ""advertising""]",4,Marketing Coordinators & Specialists,"[""digital marketing"", ""social media"", ""brand management""]",50,6,2025-10-25 21:38:46,en,What emerging platforms support {keyword}?,0.78,0.7251285582185087,0.47
30300998,portfolio management,economics,What factors should be considered when evaluating portfolio management?,strategy,Advanced,"[""Introduction to portfolio management"", ""Key points and analysis"", ""Practical examples"", ""Expert insights"", ""Action items"", ""Conclusion""]","[""portfolio"", ""management"", ""business"", ""market"", ""strategy"", ""economics""]",4,Professional Investors & Advisors,"[""market analysis"", ""financial modeling"", ""investment planning""]",71,9,2025-10-25 21:38:46,en,What factors should be considered when evaluating {keyword}?,0.65,0.8085177344497173,0.67
30300999,cybersecurity,it,What security considerations should be taken when using cybersecurity?,analysis,Intermediate,"[""Introduction to cybersecurity"", ""Key points and analysis"", ""Practical examples"", ""Expert insights"", ""Action items"", ""Conclusion""]","[""software"", ""development"", ""analysis"", ""it"", ""cybersecurity""]",4,Junior to Mid-level Developers,"[""cloud computing"", ""machine learning"", ""web development"", ""data science""]",70,9,2025-10-25 21:38:46,en,What security considerations should be taken when using {keyword}?,0.76,0.6580025416698412,0.73
30301000,brand management,marketing,What timing strategies work for brand management?,optimization,Advanced,"[""Introduction to brand management"", ""Key points and analysis"", ""Practical examples"", ""Expert insights"", ""Action items"", ""Conclusion""]","[""marketing"", ""management"", ""advertising"", ""branding"", ""optimization"", ""brand""]",4,Marketing Managers & Strategists,"[""social media"", ""digital marketing"", ""content marketing""]",49,7,2025-10-25 21:38:46,en,What timing strategies work for {keyword}?,0.84,0.9271297254376606,0.58
30301001,financial modeling,economics,What are the regulatory considerations for financial modeling?,implementation,Beginner,"[""Introduction to financial modeling"", ""Key concepts and definitions"", ""Main categories or types"", ""Examples and case studies"", ""Benefits and advantages"", ""Summary and recommendations""]","[""investment"", ""implementation"", ""modeling"", ""financial"", ""business"", ""economics""]",6,Students & New Investors,"[""market analysis"", ""investment planning"", ""portfolio management""]",62,8,2025-10-25 21:38:46,en,What are the regulatory considerations for {keyword}?,0.62,0.40514087077488675,0.76
