record_id,keyword,category,question,question_type,difficulty_level,answer_outline,tags,estimated_read_time,target_audience,related_topics,question_length,word_count,created_date,language,source_template,engagement_score,complexity_score,popularity_score
46800001,data science,it,How do you optimize data science for different platforms?,optimization,Advanced,"[""Overview of data science"", ""Step-by-step implementation"", ""Best practices and tips"", ""Common challenges and solutions"", ""Tools and resources needed"", ""Conclusion and next steps""]","[""technology"", ""software"", ""it"", ""science"", ""optimization"", ""data""]",6,Senior Developers & Tech Leads,"[""cybersecurity"", ""web development"", ""machine learning"", ""cloud computing""]",57,9,2025-10-25 22:01:45,en,How do you optimize {keyword} for different platforms?,0.81,0.8256993450300092,0.75
46800002,social media,marketing,What tools are essential for social media analytics?,planning,Advanced,"[""Introduction to social media"", ""Key points and analysis"", ""Practical examples"", ""Expert insights"", ""Action items"", ""Conclusion""]","[""planning"", ""media"", ""promotion"", ""marketing"", ""social"", ""advertising""]",4,Marketing Managers & Strategists,"[""digital marketing"", ""content marketing"", ""brand management""]",52,8,2025-10-25 22:01:45,en,What tools are essential for {keyword} analytics?,0.95,0.871885921277721,0.66
46800003,machine learning,it,What are the best practices for machine learning development?,strategy,Advanced,"[""Introduction to machine learning"", ""Key concepts and definitions"", ""Main categories or types"", ""Examples and case studies"", ""Benefits and advantages"", ""Summary and recommendations""]","[""software"", ""it"", ""learning"", ""strategy"", ""machine"", ""technology""]",6,Senior Developers & Tech Leads,"[""data science"", ""web development"", ""cybersecurity"", ""cloud computing""]",61,9,2025-10-25 22:01:45,en,What are the best practices for {keyword} development?,0.83,0.8300362597475412,0.5
46800004,market analysis,economics,What indicators predict market analysis market movements?,optimization,Advanced,"[""Introduction to market analysis"", ""Key points and analysis"", ""Practical examples"", ""Expert insights"", ""Action items"", ""Conclusion""]","[""analysis"", ""finance"", ""business"", ""market"", ""optimization"", ""economics""]",4,Professional Investors & Advisors,"[""financial modeling"", ""portfolio management"", ""investment planning""]",57,7,2025-10-25 22:01:45,en,What indicators predict {keyword} market movements?,0.79,0.8670830827841535,0.89
46800005,machine learning,it,How do you design a scalable machine learning solution?,evaluation,Expert,"[""Overview of machine learning"", ""Step-by-step implementation"", ""Best practices and tips"", ""Common challenges and solutions"", ""Tools and resources needed"", ""Conclusion and next steps""]","[""software"", ""it"", ""learning"", ""evaluation"", ""machine"", ""technology""]",6,Architects & Technical Directors,"[""cloud computing"", ""web development"", ""cybersecurity"", ""data science""]",55,9,2025-10-25 22:01:45,en,How do you design a scalable {keyword} solution?,0.71,1.0,0.86
46800006,cybersecurity,it,What are the latest trends in cybersecurity technology?,planning,Beginner,"[""Introduction to cybersecurity"", ""Key concepts and definitions"", ""Main categories or types"", ""Examples and case studies"", ""Benefits and advantages"", ""Summary and recommendations""]","[""planning"", ""it"", ""programming"", ""cybersecurity"", ""technology""]",5,Students & Entry-level Developers,"[""cloud computing"", ""data science"", ""web development"", ""machine learning""]",55,8,2025-10-25 22:01:45,en,What are the latest trends in {keyword} technology?,0.8,0.4569849304518829,0.82
46800007,brand management,marketing,What budget should be allocated to brand management?,evaluation,Beginner,"[""Introduction to brand management"", ""Key points and analysis"", ""Practical examples"", ""Expert insights"", ""Action items"", ""Conclusion""]","[""promotion"", ""marketing"", ""management"", ""digital"", ""evaluation"", ""brand""]",4,Marketing Students & Interns,"[""social media"", ""content marketing"", ""digital marketing""]",52,8,2025-10-25 22:01:45,en,What budget should be allocated to {keyword}?,0.68,0.44102002788019196,0.68
46800008,social media,marketing,What channels are most effective for social media?,optimization,Expert,"[""Introduction to social media"", ""Key points and analysis"", ""Practical examples"", ""Expert insights"", ""Action items"", ""Conclusion""]","[""media"", ""promotion"", ""marketing"", ""social"", ""branding"", ""optimization""]",4,Marketing Directors & CMOs,"[""brand management"", ""digital marketing"", ""content marketing""]",50,8,2025-10-25 22:01:45,en,What channels are most effective for {keyword}?,0.82,1.0,0.6
46800009,cloud computing,it,How do you stay updated with cloud computing developments?,optimization,Intermediate,"[""Overview of cloud computing"", ""Step-by-step implementation"", ""Best practices and tips"", ""Common challenges and solutions"", ""Tools and resources needed"", ""Conclusion and next steps""]","[""computing"", ""cloud"", ""it"", ""programming"", ""optimization"", ""technology""]",6,Junior to Mid-level Developers,"[""machine learning"", ""cybersecurity"", ""data science"", ""web development""]",58,9,2025-10-25 22:01:45,en,How do you stay updated with {keyword} developments?,0.76,0.7150092447415803,0.65
46800010,cybersecurity,it,How do you convince stakeholders to invest in cybersecurity?,planning,Expert,"[""Overview of cybersecurity"", ""Step-by-step implementation"", ""Best practices and tips"", ""Common challenges and solutions"", ""Tools and resources needed"", ""Conclusion and next steps""]","[""software"", ""planning"", ""it"", ""programming"", ""cybersecurity""]",5,Architects & Technical Directors,"[""web development"", ""data science"", ""machine learning"", ""cloud computing""]",60,9,2025-10-25 22:01:45,en,How do you convince stakeholders to invest in {keyword}?,0.73,1.0,0.64
46800011,social media,marketing,What KPIs are most important for social media?,troubleshooting,Expert,"[""Introduction to social media"", ""Key points and analysis"", ""Practical examples"", ""Expert insights"", ""Action items"", ""Conclusion""]","[""media"", ""promotion"", ""troubleshooting"", ""digital"", ""marketing"", ""social""]",4,Marketing Directors & CMOs,"[""digital marketing"", ""brand management"", ""content marketing""]",46,8,2025-10-25 22:01:45,en,What KPIs are most important for {keyword}?,0.68,1.0,0.88
46800012,market analysis,economics,What are the risks associated with market analysis?,strategy,Expert,"[""Introduction to market analysis"", ""Key concepts and definitions"", ""Main categories or types"", ""Examples and case studies"", ""Benefits and advantages"", ""Summary and recommendations""]","[""finance"", ""analysis"", ""business"", ""market"", ""strategy"", ""economics""]",6,Portfolio Managers & Financial Experts,"[""financial modeling"", ""portfolio management"", ""investment planning""]",51,8,2025-10-25 22:01:45,en,What are the risks associated with {keyword}?,0.85,1.0,0.32
46800013,social media,marketing,What budget should be allocated to social media?,how_to,Beginner,"[""Introduction to social media"", ""Key points and analysis"", ""Practical examples"", ""Expert insights"", ""Action items"", ""Conclusion""]","[""how_to"", ""media"", ""promotion"", ""marketing"", ""social"", ""advertising""]",4,Marketing Students & Interns,"[""content marketing"", ""brand management"", ""digital marketing""]",48,8,2025-10-25 22:01:45,en,What budget should be allocated to {keyword}?,0.88,0.30715973172560807,0.63
46800014,cybersecurity,it,What is the recommended architecture for cybersecurity systems?,optimization,Advanced,"[""Introduction to cybersecurity"", ""Key points and analysis"", ""Practical examples"", ""Expert insights"", ""Action items"", ""Conclusion""]","[""software"", ""development"", ""it"", ""optimization"", ""cybersecurity""]",4,Senior Developers & Tech Leads,"[""web development"", ""data science"", ""cloud computing"", ""machine learning""]",63,8,2025-10-25 22:01:45,en,What is the recommended architecture for {keyword} systems?,0.77,0.9761063611826266,0.41
46800015,digital marketing,marketing,How do you measure the ROI of digital marketing campaigns?,implementation,Advanced,"[""Overview of digital marketing"", ""Step-by-step implementation"", ""Best practices and tips"", ""Common challenges and solutions"", ""Tools and resources needed"", ""Conclusion and next steps""]","[""implementation"", ""marketing"", ""promotion"", ""digital""]",6,Marketing Managers & Strategists,"[""content marketing"", ""social media"", ""brand management""]",58,10,2025-10-25 22:01:45,en,How do you measure the ROI of {keyword} campaigns?,0.7,0.834896286215487,0.31
46800016,content marketing,marketing,How do you measure the ROI of content marketing campaigns?,analysis,Advanced,"[""Overview of content marketing"", ""Step-by-step implementation"", ""Best practices and tips"", ""Common challenges and solutions"", ""Tools and resources needed"", ""Conclusion and next steps""]","[""content"", ""analysis"", ""marketing"", ""digital"", ""advertising""]",6,Marketing Managers & Strategists,"[""social media"", ""digital marketing"", ""brand management""]",58,10,2025-10-25 22:01:45,en,How do you measure the ROI of {keyword} campaigns?,0.88,0.8006990109484323,0.6
46800017,social media,marketing,How do you track and analyze social media performance?,evaluation,Expert,"[""Overview of social media"", ""Step-by-step implementation"", ""Best practices and tips"", ""Common challenges and solutions"", ""Tools and resources needed"", ""Conclusion and next steps""]","[""media"", ""marketing"", ""social"", ""advertising"", ""branding"", ""evaluation""]",6,Marketing Directors & CMOs,"[""content marketing"", ""digital marketing"", ""brand management""]",54,9,2025-10-25 22:01:45,en,How do you track and analyze {keyword} performance?,0.63,1.0,0.64
46800018,web development,it,What skills are needed to master web development?,troubleshooting,Expert,"[""Introduction to web development"", ""Key points and analysis"", ""Practical examples"", ""Expert insights"", ""Action items"", ""Conclusion""]","[""technology"", ""development"", ""it"", ""programming"", ""troubleshooting"", ""web""]",4,Architects & Technical Directors,"[""machine learning"", ""data science"", ""cybersecurity"", ""cloud computing""]",49,8,2025-10-25 22:01:45,en,What skills are needed to master {keyword}?,0.8,1.0,0.83
46800019,cloud computing,it,What ROI can be expected from cloud computing implementation?,troubleshooting,Intermediate,"[""Introduction to cloud computing"", ""Key points and analysis"", ""Practical examples"", ""Expert insights"", ""Action items"", ""Conclusion""]","[""computing"", ""software"", ""it"", ""programming"", ""troubleshooting"", ""cloud""]",4,Junior to Mid-level Developers,"[""data science"", ""machine learning"", ""cybersecurity"", ""web development""]",61,9,2025-10-25 22:01:45,en,What ROI can be expected from {keyword} implementation?,0.78,0.6269839768104593,0.51
46800020,content marketing,marketing,What KPIs are most important for content marketing?,strategy,Expert,"[""Introduction to content marketing"", ""Key points and analysis"", ""Practical examples"", ""Expert insights"", ""Action items"", ""Conclusion""]","[""content"", ""promotion"", ""marketing"", ""branding"", ""strategy""]",4,Marketing Directors & CMOs,"[""brand management"", ""social media"", ""digital marketing""]",51,8,2025-10-25 22:01:45,en,What KPIs are most important for {keyword}?,0.79,1.0,0.35
46800021,machine learning,it,What career opportunities exist in machine learning?,implementation,Expert,"[""Introduction to machine learning"", ""Key points and analysis"", ""Practical examples"", ""Expert insights"", ""Action items"", ""Conclusion""]","[""software"", ""it"", ""implementation"", ""learning"", ""machine"", ""technology""]",4,Architects & Technical Directors,"[""cloud computing"", ""data science"", ""cybersecurity"", ""web development""]",52,7,2025-10-25 22:01:45,en,What career opportunities exist in {keyword}?,0.81,1.0,0.31
46800022,portfolio management,economics,How do you identify opportunities in portfolio management markets?,best_practice,Expert,"[""Overview of portfolio management"", ""Step-by-step implementation"", ""Best practices and tips"", ""Common challenges and solutions"", ""Tools and resources needed"", ""Conclusion and next steps""]","[""investment"", ""portfolio"", ""best_practice"", ""management"", ""market"", ""economics""]",6,Portfolio Managers & Financial Experts,"[""financial modeling"", ""market analysis"", ""investment planning""]",66,9,2025-10-25 22:01:45,en,How do you identify opportunities in {keyword} markets?,0.77,1.0,0.31
46800023,financial modeling,economics,How do you diversify your portfolio using financial modeling?,troubleshooting,Expert,"[""Overview of financial modeling"", ""Step-by-step implementation"", ""Best practices and tips"", ""Common challenges and solutions"", ""Tools and resources needed"", ""Conclusion and next steps""]","[""investment"", ""finance"", ""troubleshooting"", ""modeling"", ""financial"", ""economics""]",6,Portfolio Managers & Financial Experts,"[""market analysis"", ""portfolio management"", ""investment planning""]",61,9,2025-10-25 22:01:45,en,How do you diversify your portfolio using {keyword}?,0.84,1.0,0.31
46800024,machine learning,it,What security considerations should be taken when using machine learning?,evaluation,Advanced,"[""Introduction to machine learning"", ""Key points and analysis"", ""Practical examples"", ""Expert insights"", ""Action items"", ""Conclusion""]","[""development"", ""it"", ""learning"", ""evaluation"", ""machine"", ""technology""]",4,Senior Developers & Tech Leads,"[""web development"", ""data science"", ""cloud computing"", ""cybersecurity""]",73,10,2025-10-25 22:01:45,en,What security considerations should be taken when using {keyword}?,0.9,0.9448261063421658,0.6
46800025,financial modeling,economics,What strategies work best for financial modeling investment?,troubleshooting,Intermediate,"[""Introduction to financial modeling"", ""Key points and analysis"", ""Practical examples"", ""Expert insights"", ""Action items"", ""Conclusion""]","[""finance"", ""troubleshooting"", ""modeling"", ""financial"", ""market"", ""economics""]",4,Individual Investors & Analysts,"[""market analysis"", ""portfolio management"", ""investment planning""]",60,8,2025-10-25 22:01:45,en,What strategies work best for {keyword} investment?,0.82,0.7583040393456981,0.32
46800026,social media,marketing,What KPIs are most important for social media?,strategy,Beginner,"[""Introduction to social media"", ""Key points and analysis"", ""Practical examples"", ""Expert insights"", ""Action items"", ""Conclusion""]","[""media"", ""promotion"", ""marketing"", ""digital"", ""social"", ""strategy""]",4,Marketing Students & Interns,"[""content marketing"", ""brand management"", ""digital marketing""]",46,8,2025-10-25 22:01:45,en,What KPIs are most important for {keyword}?,0.78,0.4139744306987626,0.42
46800027,content marketing,marketing,How is AI changing content marketing approaches?,comparison,Intermediate,"[""Introduction to content marketing"", ""Key points and analysis"", ""Practical examples"", ""Expert insights"", ""Action items"", ""Conclusion""]","[""content"", ""promotion"", ""comparison"", ""marketing"", ""digital""]",4,Marketing Coordinators & Specialists,"[""social media"", ""digital marketing"", ""brand management""]",48,7,2025-10-25 22:01:45,en,How is AI changing {keyword} approaches?,0.62,0.7013693316990257,0.81
46800028,digital marketing,marketing,How do you optimize digital marketing for mobile users?,troubleshooting,Expert,"[""Overview of digital marketing"", ""Step-by-step implementation"", ""Best practices and tips"", ""Common challenges and solutions"", ""Tools and resources needed"", ""Conclusion and next steps""]","[""marketing"", ""advertising"", ""troubleshooting"", ""digital""]",6,Marketing Directors & CMOs,"[""content marketing"", ""social media"", ""brand management""]",55,9,2025-10-25 22:01:45,en,How do you optimize {keyword} for mobile users?,0.68,1.0,0.51
46800029,machine learning,it,What skills are needed to master machine learning?,troubleshooting,Advanced,"[""Introduction to machine learning"", ""Key points and analysis"", ""Practical examples"", ""Expert insights"", ""Action items"", ""Conclusion""]","[""development"", ""it"", ""troubleshooting"", ""learning"", ""machine"", ""technology""]",4,Senior Developers & Tech Leads,"[""cloud computing"", ""web development"", ""cybersecurity"", ""data science""]",50,8,2025-10-25 22:01:45,en,What skills are needed to master {keyword}?,0.7,0.818949119955417,0.62
46800030,portfolio management,economics,How do you create a long-term plan for portfolio management?,troubleshooting,Advanced,"[""Overview of portfolio management"", ""Step-by-step implementation"", ""Best practices and tips"", ""Common challenges and solutions"", ""Tools and resources needed"", ""Conclusion and next steps""]","[""investment"", ""finance"", ""portfolio"", ""troubleshooting"", ""management"", ""economics""]",6,Professional Investors & Advisors,"[""financial modeling"", ""market analysis"", ""investment planning""]",60,10,2025-10-25 22:01:45,en,How do you create a long-term plan for {keyword}?,0.89,0.8668541396559322,0.47
46800031,machine learning,it,What are the latest trends in machine learning technology?,strategy,Beginner,"[""Introduction to machine learning"", ""Key concepts and definitions"", ""Main categories or types"", ""Examples and case studies"", ""Benefits and advantages"", ""Summary and recommendations""]","[""software"", ""it"", ""learning"", ""strategy"", ""machine"", ""technology""]",6,Students & Entry-level Developers,"[""web development"", ""data science"", ""cloud computing"", ""cybersecurity""]",58,9,2025-10-25 22:01:45,en,What are the latest trends in {keyword} technology?,0.86,0.30154315536750936,0.49
46800032,portfolio management,economics,How do you hedge against portfolio management market downturns?,implementation,Intermediate,"[""Overview of portfolio management"", ""Step-by-step implementation"", ""Best practices and tips"", ""Common challenges and solutions"", ""Tools and resources needed"", ""Conclusion and next steps""]","[""investment"", ""implementation"", ""portfolio"", ""management"", ""market"", ""economics""]",6,Individual Investors & Analysts,"[""investment planning"", ""financial modeling"", ""market analysis""]",63,9,2025-10-25 22:01:45,en,How do you hedge against {keyword} market downturns?,0.76,0.7069460160187616,0.89
46800033,digital marketing,marketing,What KPIs are most important for digital marketing?,implementation,Expert,"[""Introduction to digital marketing"", ""Key points and analysis"", ""Practical examples"", ""Expert insights"", ""Action items"", ""Conclusion""]","[""implementation"", ""marketing"", ""branding"", ""digital""]",4,Marketing Directors & CMOs,"[""brand management"", ""social media"", ""content marketing""]",51,8,2025-10-25 22:01:45,en,What KPIs are most important for {keyword}?,0.69,1.0,0.78
46800034,machine learning,it,What tools are essential for machine learning development?,troubleshooting,Advanced,"[""Introduction to machine learning"", ""Key points and analysis"", ""Practical examples"", ""Expert insights"", ""Action items"", ""Conclusion""]","[""development"", ""it"", ""troubleshooting"", ""learning"", ""machine"", ""technology""]",4,Senior Developers & Tech Leads,"[""cloud computing"", ""cybersecurity"", ""web development"", ""data science""]",58,8,2025-10-25 22:01:45,en,What tools are essential for {keyword} development?,0.63,0.878511072153866,0.73
46800035,digital marketing,marketing,What timing strategies work for digital marketing?,analysis,Expert,"[""Introduction to digital marketing"", ""Key points and analysis"", ""Practical examples"", ""Expert insights"", ""Action items"", ""Conclusion""]","[""analysis"", ""promotion"", ""marketing"", ""digital"", ""advertising""]",4,Marketing Directors & CMOs,"[""brand management"", ""social media"", ""content marketing""]",50,7,2025-10-25 22:01:45,en,What timing strategies work for {keyword}?,0.91,1.0,0.5
46800036,brand management,marketing,How do you personalize brand management for different segments?,evaluation,Intermediate,"[""Overview of brand management"", ""Step-by-step implementation"", ""Best practices and tips"", ""Common challenges and solutions"", ""Tools and resources needed"", ""Conclusion and next steps""]","[""marketing"", ""digital"", ""management"", ""branding"", ""evaluation"", ""brand""]",6,Marketing Coordinators & Specialists,"[""content marketing"", ""social media"", ""digital marketing""]",63,9,2025-10-25 22:01:45,en,How do you personalize {keyword} for different segments?,0.92,0.7308420215387006,0.63
46800037,cloud computing,it,How do you troubleshoot common issues with cloud computing?,planning,Advanced,"[""Overview of cloud computing"", ""Step-by-step implementation"", ""Best practices and tips"", ""Common challenges and solutions"", ""Tools and resources needed"", ""Conclusion and next steps""]","[""computing"", ""planning"", ""software"", ""it"", ""programming"", ""cloud""]",6,Senior Developers & Tech Leads,"[""cybersecurity"", ""web development"", ""machine learning"", ""data science""]",59,9,2025-10-25 22:01:45,en,How do you troubleshoot common issues with {keyword}?,0.61,0.8439733650314223,0.75
46800038,cloud computing,it,How do you convince stakeholders to invest in cloud computing?,evaluation,Beginner,"[""Overview of cloud computing"", ""Step-by-step implementation"", ""Best practices and tips"", ""Common challenges and solutions"", ""Tools and resources needed"", ""Conclusion and next steps""]","[""computing"", ""it"", ""programming"", ""evaluation"", ""cloud"", ""technology""]",6,Students & Entry-level Developers,"[""web development"", ""machine learning"", ""data science"", ""cybersecurity""]",62,10,2025-10-25 22:01:45,en,How do you convince stakeholders to invest in {keyword}?,0.76,0.42497651656015256,0.42
46800039,portfolio management,economics,How do you create a long-term plan for portfolio management?,best_practice,Intermediate,"[""Overview of portfolio management"", ""Step-by-step implementation"", ""Best practices and tips"", ""Common challenges and solutions"", ""Tools and resources needed"", ""Conclusion and next steps""]","[""finance"", ""portfolio"", ""best_practice"", ""management"", ""business"", ""economics""]",6,Individual Investors & Analysts,"[""financial modeling"", ""investment planning"", ""market analysis""]",60,10,2025-10-25 22:01:45,en,How do you create a long-term plan for {keyword}?,0.64,0.6969753236162091,0.42
46800040,content marketing,marketing,How do you identify the right audience for content marketing?,analysis,Intermediate,"[""Overview of content marketing"", ""Step-by-step implementation"", ""Best practices and tips"", ""Common challenges and solutions"", ""Tools and resources needed"", ""Conclusion and next steps""]","[""content"", ""analysis"", ""marketing"", ""digital"", ""advertising""]",6,Marketing Coordinators & Specialists,"[""brand management"", ""social media"", ""digital marketing""]",61,10,2025-10-25 22:01:45,en,How do you identify the right audience for {keyword}?,0.69,0.7430247336741116,0.51
46800041,social media,marketing,How do you innovate within social media?,how_to,Expert,"[""Overview of social media"", ""Step-by-step implementation"", ""Best practices and tips"", ""Common challenges and solutions"", ""Tools and resources needed"", ""Conclusion and next steps""]","[""how_to"", ""media"", ""promotion"", ""digital"", ""marketing"", ""social""]",6,Marketing Directors & CMOs,"[""digital marketing"", ""content marketing"", ""brand management""]",40,7,2025-10-25 22:01:45,en,How do you innovate within {keyword}?,0.61,1.0,0.89
46800042,financial modeling,economics,How do you benchmark financial modeling against alternatives?,troubleshooting,Advanced,"[""Overview of financial modeling"", ""Step-by-step implementation"", ""Best practices and tips"", ""Common challenges and solutions"", ""Tools and resources needed"", ""Conclusion and next steps""]","[""finance"", ""troubleshooting"", ""modeling"", ""financial"", ""business"", ""economics""]",6,Professional Investors & Advisors,"[""market analysis"", ""portfolio management"", ""investment planning""]",61,8,2025-10-25 22:01:45,en,How do you benchmark {keyword} against alternatives?,0.7,0.8163427810988115,0.52
46800043,cloud computing,it,What security considerations should be taken when using cloud computing?,evaluation,Intermediate,"[""Introduction to cloud computing"", ""Key points and analysis"", ""Practical examples"", ""Expert insights"", ""Action items"", ""Conclusion""]","[""computing"", ""software"", ""it"", ""programming"", ""evaluation"", ""cloud""]",4,Junior to Mid-level Developers,"[""machine learning"", ""cybersecurity"", ""data science"", ""web development""]",72,10,2025-10-25 22:01:45,en,What security considerations should be taken when using {keyword}?,0.82,0.7665802182051511,0.49
46800044,cloud computing,it,How do you design a scalable cloud computing solution?,strategy,Intermediate,"[""Overview of cloud computing"", ""Step-by-step implementation"", ""Best practices and tips"", ""Common challenges and solutions"", ""Tools and resources needed"", ""Conclusion and next steps""]","[""computing"", ""cloud"", ""development"", ""it"", ""programming"", ""strategy""]",6,Junior to Mid-level Developers,"[""machine learning"", ""web development"", ""data science"", ""cybersecurity""]",54,9,2025-10-25 22:01:45,en,How do you design a scalable {keyword} solution?,0.94,0.7856205955012433,0.49
