record_id,keyword,category,question,question_type,difficulty_level,answer_outline,tags,estimated_read_time,target_audience,related_topics,question_length,word_count,created_date,language,source_template,engagement_score,complexity_score,popularity_score
2,digital marketing,marketing,What emerging platforms support digital marketing?,optimization,Beginner,"[""Introduction to digital marketing"", ""Key points and analysis"", ""Practical examples"", ""Expert insights"", ""Action items"", ""Conclusion""]","[""marketing"", ""digital"", ""advertising"", ""optimization""]",4,Marketing Students & Interns,"[""content marketing"", ""social media"", ""brand management""]",50,6,2025-10-25 19:28:21,en,What emerging platforms support {keyword}?,0.84,0.4069373222555209,0.75
5,brand management,marketing,What are the latest trends in brand management?,implementation,Expert,"[""Introduction to brand management"", ""Key concepts and definitions"", ""Main categories or types"", ""Examples and case studies"", ""Benefits and advantages"", ""Summary and recommendations""]","[""marketing"", ""management"", ""branding"", ""promotion"", ""brand"", ""implementation""]",6,Marketing Directors & CMOs,"[""digital marketing"", ""social media"", ""content marketing""]",47,8,2025-10-25 19:28:21,en,What are the latest trends in {keyword}?,0.78,1.0,0.53
6,content marketing,marketing,How do you improve content marketing conversion rates?,best_practice,Expert,"[""Overview of content marketing"", ""Step-by-step implementation"", ""Best practices and tips"", ""Common challenges and solutions"", ""Tools and resources needed"", ""Conclusion and next steps""]","[""marketing"", ""best_practice"", ""promotion"", ""advertising"", ""content""]",6,Marketing Directors & CMOs,"[""social media"", ""brand management"", ""digital marketing""]",54,8,2025-10-25 19:28:21,en,How do you improve {keyword} conversion rates?,0.86,1.0,0.74
8,content marketing,marketing,How do you measure the ROI of content marketing campaigns?,evaluation,Advanced,"[""Overview of content marketing"", ""Step-by-step implementation"", ""Best practices and tips"", ""Common challenges and solutions"", ""Tools and resources needed"", ""Conclusion and next steps""]","[""marketing"", ""evaluation"", ""promotion"", ""digital"", ""content""]",6,Marketing Managers & Strategists,"[""digital marketing"", ""social media"", ""brand management""]",58,10,2025-10-25 19:28:21,en,How do you measure the ROI of {keyword} campaigns?,0.94,0.8957817270992835,0.76
9,social media,marketing,How do you improve social media conversion rates?,evaluation,Expert,"[""Overview of social media"", ""Step-by-step implementation"", ""Best practices and tips"", ""Common challenges and solutions"", ""Tools and resources needed"", ""Conclusion and next steps""]","[""marketing"", ""social"", ""evaluation"", ""branding"", ""media"", ""advertising""]",6,Marketing Directors & CMOs,"[""brand management"", ""digital marketing"", ""content marketing""]",49,8,2025-10-25 19:28:21,en,How do you improve {keyword} conversion rates?,0.73,1.0,0.79
12,digital marketing,marketing,What budget should be allocated to digital marketing?,optimization,Expert,"[""Introduction to digital marketing"", ""Key points and analysis"", ""Practical examples"", ""Expert insights"", ""Action items"", ""Conclusion""]","[""marketing"", ""digital"", ""optimization"", ""promotion""]",4,Marketing Directors & CMOs,"[""content marketing"", ""brand management"", ""social media""]",53,8,2025-10-25 19:28:21,en,What budget should be allocated to {keyword}?,0.74,1.0,0.48
13,social media,marketing,What demographics respond best to social media?,how_to,Beginner,"[""Introduction to social media"", ""Key points and analysis"", ""Practical examples"", ""Expert insights"", ""Action items"", ""Conclusion""]","[""marketing"", ""social"", ""branding"", ""media"", ""advertising"", ""how_to""]",4,Marketing Students & Interns,"[""content marketing"", ""brand management"", ""digital marketing""]",47,7,2025-10-25 19:28:21,en,What demographics respond best to {keyword}?,0.68,0.452602381330768,0.4
14,content marketing,marketing,How do you innovate within content marketing?,how_to,Intermediate,"[""Overview of content marketing"", ""Step-by-step implementation"", ""Best practices and tips"", ""Common challenges and solutions"", ""Tools and resources needed"", ""Conclusion and next steps""]","[""marketing"", ""promotion"", ""advertising"", ""content"", ""how_to""]",6,Marketing Coordinators & Specialists,"[""brand management"", ""digital marketing"", ""social media""]",45,7,2025-10-25 19:28:21,en,How do you innovate within {keyword}?,0.67,0.7629303968609117,0.34
16,social media,marketing,How do you innovate within social media?,how_to,Expert,"[""Overview of social media"", ""Step-by-step implementation"", ""Best practices and tips"", ""Common challenges and solutions"", ""Tools and resources needed"", ""Conclusion and next steps""]","[""marketing"", ""social"", ""digital"", ""media"", ""advertising"", ""how_to""]",6,Marketing Directors & CMOs,"[""digital marketing"", ""content marketing"", ""brand management""]",40,7,2025-10-25 19:28:21,en,How do you innovate within {keyword}?,0.62,1.0,0.69
17,brand management,marketing,What channels are most effective for brand management?,troubleshooting,Expert,"[""Introduction to brand management"", ""Key points and analysis"", ""Practical examples"", ""Expert insights"", ""Action items"", ""Conclusion""]","[""marketing"", ""management"", ""branding"", ""troubleshooting"", ""advertising"", ""brand""]",4,Marketing Directors & CMOs,"[""social media"", ""content marketing"", ""digital marketing""]",54,8,2025-10-25 19:28:21,en,What channels are most effective for {keyword}?,0.75,1.0,0.42
18,social media,marketing,How do you optimize social media for mobile users?,how_to,Advanced,"[""Overview of social media"", ""Step-by-step implementation"", ""Best practices and tips"", ""Common challenges and solutions"", ""Tools and resources needed"", ""Conclusion and next steps""]","[""marketing"", ""social"", ""digital"", ""media"", ""advertising"", ""how_to""]",6,Marketing Managers & Strategists,"[""brand management"", ""content marketing"", ""digital marketing""]",50,9,2025-10-25 19:28:21,en,How do you optimize {keyword} for mobile users?,0.67,0.9182284836666204,0.8
20,brand management,marketing,What A/B tests should you run for brand management?,strategy,Intermediate,"[""Introduction to brand management"", ""Key points and analysis"", ""Practical examples"", ""Expert insights"", ""Action items"", ""Conclusion""]","[""marketing"", ""management"", ""strategy"", ""promotion"", ""advertising"", ""brand""]",4,Marketing Coordinators & Specialists,"[""content marketing"", ""social media"", ""digital marketing""]",51,9,2025-10-25 19:28:21,en,What A/B tests should you run for {keyword}?,0.88,0.7138991489052849,0.8
22,content marketing,marketing,How do you reach new customers through content marketing?,strategy,Beginner,"[""Overview of content marketing"", ""Step-by-step implementation"", ""Best practices and tips"", ""Common challenges and solutions"", ""Tools and resources needed"", ""Conclusion and next steps""]","[""marketing"", ""strategy"", ""branding"", ""advertising"", ""content""]",6,Marketing Students & Interns,"[""brand management"", ""social media"", ""digital marketing""]",57,9,2025-10-25 19:28:21,en,How do you reach new customers through {keyword}?,0.81,0.3145037667169174,0.42
23,digital marketing,marketing,How do you identify the right audience for digital marketing?,troubleshooting,Advanced,"[""Overview of digital marketing"", ""Step-by-step implementation"", ""Best practices and tips"", ""Common challenges and solutions"", ""Tools and resources needed"", ""Conclusion and next steps""]","[""marketing"", ""digital"", ""troubleshooting"", ""promotion"", ""advertising""]",6,Marketing Managers & Strategists,"[""content marketing"", ""brand management"", ""social media""]",61,10,2025-10-25 19:28:21,en,How do you identify the right audience for {keyword}?,0.84,0.8361412433446074,0.49
24,social media,marketing,What budget should be allocated to social media?,strategy,Beginner,"[""Introduction to social media"", ""Key points and analysis"", ""Practical examples"", ""Expert insights"", ""Action items"", ""Conclusion""]","[""marketing"", ""social"", ""strategy"", ""digital"", ""media"", ""advertising""]",4,Marketing Students & Interns,"[""digital marketing"", ""content marketing"", ""brand management""]",48,8,2025-10-25 19:28:21,en,What budget should be allocated to {keyword}?,0.84,0.3737569158529941,0.33
26,content marketing,marketing,How do you create a content marketing roadmap?,strategy,Expert,"[""Overview of content marketing"", ""Step-by-step implementation"", ""Best practices and tips"", ""Common challenges and solutions"", ""Tools and resources needed"", ""Conclusion and next steps""]","[""marketing"", ""strategy"", ""promotion"", ""advertising"", ""content""]",6,Marketing Directors & CMOs,"[""social media"", ""brand management"", ""digital marketing""]",46,8,2025-10-25 19:28:21,en,How do you create a {keyword} roadmap?,0.87,1.0,0.69
29,social media,marketing,What timing strategies work for social media?,how_to,Intermediate,"[""Introduction to social media"", ""Key points and analysis"", ""Practical examples"", ""Expert insights"", ""Action items"", ""Conclusion""]","[""marketing"", ""social"", ""branding"", ""media"", ""advertising"", ""how_to""]",4,Marketing Coordinators & Specialists,"[""digital marketing"", ""content marketing"", ""brand management""]",45,7,2025-10-25 19:28:21,en,What timing strategies work for {keyword}?,0.8,0.7330606836020725,0.39
30,social media,marketing,How do you attribute success to social media efforts?,troubleshooting,Intermediate,"[""Overview of social media"", ""Step-by-step implementation"", ""Best practices and tips"", ""Common challenges and solutions"", ""Tools and resources needed"", ""Conclusion and next steps""]","[""marketing"", ""social"", ""troubleshooting"", ""digital"", ""media"", ""advertising""]",6,Marketing Coordinators & Specialists,"[""brand management"", ""digital marketing"", ""content marketing""]",53,9,2025-10-25 19:28:21,en,How do you attribute success to {keyword} efforts?,0.81,0.719085285888082,0.85
32,social media,marketing,How do you develop an effective social media strategy?,comparison,Expert,"[""Overview of social media"", ""Step-by-step implementation"", ""Best practices and tips"", ""Common challenges and solutions"", ""Tools and resources needed"", ""Conclusion and next steps""]","[""marketing"", ""social"", ""branding"", ""digital"", ""media"", ""comparison""]",6,Marketing Directors & CMOs,"[""digital marketing"", ""content marketing"", ""brand management""]",54,9,2025-10-25 19:28:21,en,How do you develop an effective {keyword} strategy?,0.95,1.0,0.58
36,brand management,marketing,How do you innovate within brand management?,implementation,Advanced,"[""Overview of brand management"", ""Step-by-step implementation"", ""Best practices and tips"", ""Common challenges and solutions"", ""Tools and resources needed"", ""Conclusion and next steps""]","[""marketing"", ""management"", ""branding"", ""digital"", ""brand"", ""implementation""]",6,Marketing Managers & Strategists,"[""social media"", ""content marketing"", ""digital marketing""]",44,7,2025-10-25 19:28:21,en,How do you innovate within {keyword}?,0.8,0.8762092777319794,0.48
42,social media,marketing,What channels are most effective for social media?,analysis,Advanced,"[""Introduction to social media"", ""Key points and analysis"", ""Practical examples"", ""Expert insights"", ""Action items"", ""Conclusion""]","[""marketing"", ""social"", ""branding"", ""media"", ""analysis"", ""advertising""]",4,Marketing Managers & Strategists,"[""digital marketing"", ""brand management"", ""content marketing""]",50,8,2025-10-25 19:28:21,en,What channels are most effective for {keyword}?,0.93,0.9132617550052248,0.67
43,brand management,marketing,How do you automate brand management processes?,analysis,Beginner,"[""Overview of brand management"", ""Step-by-step implementation"", ""Best practices and tips"", ""Common challenges and solutions"", ""Tools and resources needed"", ""Conclusion and next steps""]","[""marketing"", ""management"", ""promotion"", ""analysis"", ""advertising"", ""brand""]",6,Marketing Students & Interns,"[""content marketing"", ""digital marketing"", ""social media""]",47,7,2025-10-25 19:28:21,en,How do you automate {keyword} processes?,0.64,0.4581584263182743,0.89
44,content marketing,marketing,How do you measure the ROI of content marketing campaigns?,strategy,Expert,"[""Overview of content marketing"", ""Step-by-step implementation"", ""Best practices and tips"", ""Common challenges and solutions"", ""Tools and resources needed"", ""Conclusion and next steps""]","[""marketing"", ""strategy"", ""digital"", ""advertising"", ""content""]",6,Marketing Directors & CMOs,"[""digital marketing"", ""social media"", ""brand management""]",58,10,2025-10-25 19:28:21,en,How do you measure the ROI of {keyword} campaigns?,0.73,1.0,0.46
46,brand management,marketing,How do you reach new customers through brand management?,analysis,Expert,"[""Overview of brand management"", ""Step-by-step implementation"", ""Best practices and tips"", ""Common challenges and solutions"", ""Tools and resources needed"", ""Conclusion and next steps""]","[""marketing"", ""management"", ""digital"", ""analysis"", ""advertising"", ""brand""]",6,Marketing Directors & CMOs,"[""content marketing"", ""digital marketing"", ""social media""]",56,9,2025-10-25 19:28:21,en,How do you reach new customers through {keyword}?,0.85,1.0,0.75
50,digital marketing,marketing,What KPIs are most important for digital marketing?,troubleshooting,Beginner,"[""Introduction to digital marketing"", ""Key points and analysis"", ""Practical examples"", ""Expert insights"", ""Action items"", ""Conclusion""]","[""marketing"", ""branding"", ""digital"", ""troubleshooting"", ""advertising""]",4,Marketing Students & Interns,"[""brand management"", ""social media"", ""content marketing""]",51,8,2025-10-25 19:28:21,en,What KPIs are most important for {keyword}?,0.67,0.4573619720269276,0.65
55,content marketing,marketing,How do you attribute success to content marketing efforts?,optimization,Expert,"[""Overview of content marketing"", ""Step-by-step implementation"", ""Best practices and tips"", ""Common challenges and solutions"", ""Tools and resources needed"", ""Conclusion and next steps""]","[""marketing"", ""digital"", ""advertising"", ""content"", ""optimization""]",6,Marketing Directors & CMOs,"[""digital marketing"", ""brand management"", ""social media""]",58,9,2025-10-25 19:28:21,en,How do you attribute success to {keyword} efforts?,0.8,1.0,0.87
62,social media,marketing,What are the latest trends in social media?,analysis,Intermediate,"[""Introduction to social media"", ""Key concepts and definitions"", ""Main categories or types"", ""Examples and case studies"", ""Benefits and advantages"", ""Summary and recommendations""]","[""marketing"", ""social"", ""branding"", ""media"", ""analysis"", ""advertising""]",6,Marketing Coordinators & Specialists,"[""content marketing"", ""digital marketing"", ""brand management""]",43,8,2025-10-25 19:28:21,en,What are the latest trends in {keyword}?,0.66,0.6241279422894478,0.48
64,social media,marketing,What are the latest trends in social media?,planning,Intermediate,"[""Introduction to social media"", ""Key concepts and definitions"", ""Main categories or types"", ""Examples and case studies"", ""Benefits and advantages"", ""Summary and recommendations""]","[""marketing"", ""social"", ""digital"", ""media"", ""planning"", ""advertising""]",6,Marketing Coordinators & Specialists,"[""digital marketing"", ""content marketing"", ""brand management""]",43,8,2025-10-25 19:28:21,en,What are the latest trends in {keyword}?,0.82,0.78862493066822,0.82
65,digital marketing,marketing,What channels are most effective for digital marketing?,troubleshooting,Advanced,"[""Introduction to digital marketing"", ""Key points and analysis"", ""Practical examples"", ""Expert insights"", ""Action items"", ""Conclusion""]","[""marketing"", ""branding"", ""digital"", ""troubleshooting"", ""advertising""]",4,Marketing Managers & Strategists,"[""brand management"", ""content marketing"", ""social media""]",55,8,2025-10-25 19:28:21,en,What channels are most effective for {keyword}?,0.92,0.9270658539733424,0.41
77,digital marketing,marketing,How do you innovate within digital marketing?,planning,Advanced,"[""Overview of digital marketing"", ""Step-by-step implementation"", ""Best practices and tips"", ""Common challenges and solutions"", ""Tools and resources needed"", ""Conclusion and next steps""]","[""marketing"", ""digital"", ""promotion"", ""planning"", ""advertising""]",6,Marketing Managers & Strategists,"[""brand management"", ""social media"", ""content marketing""]",45,7,2025-10-25 19:28:21,en,How do you innovate within {keyword}?,0.64,0.9605918059778252,0.31
80,social media,marketing,What emerging platforms support social media?,how_to,Advanced,"[""Introduction to social media"", ""Key points and analysis"", ""Practical examples"", ""Expert insights"", ""Action items"", ""Conclusion""]","[""marketing"", ""social"", ""branding"", ""promotion"", ""media"", ""how_to""]",4,Marketing Managers & Strategists,"[""digital marketing"", ""brand management"", ""content marketing""]",45,6,2025-10-25 19:28:21,en,What emerging platforms support {keyword}?,0.89,0.9206252746871764,0.36
81,content marketing,marketing,What timing strategies work for content marketing?,implementation,Intermediate,"[""Introduction to content marketing"", ""Key points and analysis"", ""Practical examples"", ""Expert insights"", ""Action items"", ""Conclusion""]","[""marketing"", ""promotion"", ""advertising"", ""content"", ""implementation""]",4,Marketing Coordinators & Specialists,"[""digital marketing"", ""social media"", ""brand management""]",50,7,2025-10-25 19:28:21,en,What timing strategies work for {keyword}?,0.69,0.7962531452193636,0.43
82,content marketing,marketing,What timing strategies work for content marketing?,planning,Expert,"[""Introduction to content marketing"", ""Key points and analysis"", ""Practical examples"", ""Expert insights"", ""Action items"", ""Conclusion""]","[""marketing"", ""promotion"", ""planning"", ""advertising"", ""content""]",4,Marketing Directors & CMOs,"[""brand management"", ""digital marketing"", ""social media""]",50,7,2025-10-25 19:28:21,en,What timing strategies work for {keyword}?,0.78,1.0,0.76
86,content marketing,marketing,How do you develop an effective content marketing strategy?,planning,Advanced,"[""Overview of content marketing"", ""Step-by-step implementation"", ""Best practices and tips"", ""Common challenges and solutions"", ""Tools and resources needed"", ""Conclusion and next steps""]","[""marketing"", ""branding"", ""promotion"", ""planning"", ""content""]",6,Marketing Managers & Strategists,"[""social media"", ""brand management"", ""digital marketing""]",59,9,2025-10-25 19:28:21,en,How do you develop an effective {keyword} strategy?,0.9,0.9236457809254296,0.33
94,social media,marketing,What content types work best for social media?,how_to,Intermediate,"[""Introduction to social media"", ""Key points and analysis"", ""Practical examples"", ""Expert insights"", ""Action items"", ""Conclusion""]","[""marketing"", ""social"", ""branding"", ""digital"", ""media"", ""how_to""]",4,Marketing Coordinators & Specialists,"[""brand management"", ""digital marketing"", ""content marketing""]",46,8,2025-10-25 19:28:21,en,What content types work best for {keyword}?,0.93,0.7924681014512714,0.49
97,brand management,marketing,What tools are essential for brand management analytics?,evaluation,Beginner,"[""Introduction to brand management"", ""Key points and analysis"", ""Practical examples"", ""Expert insights"", ""Action items"", ""Conclusion""]","[""marketing"", ""evaluation"", ""management"", ""promotion"", ""advertising"", ""brand""]",4,Marketing Students & Interns,"[""content marketing"", ""social media"", ""digital marketing""]",56,8,2025-10-25 19:28:21,en,What tools are essential for {keyword} analytics?,0.71,0.3892818369967639,0.77
104,social media,marketing,How do you attribute success to social media efforts?,troubleshooting,Expert,"[""Overview of social media"", ""Step-by-step implementation"", ""Best practices and tips"", ""Common challenges and solutions"", ""Tools and resources needed"", ""Conclusion and next steps""]","[""marketing"", ""social"", ""digital"", ""troubleshooting"", ""promotion"", ""media""]",6,Marketing Directors & CMOs,"[""brand management"", ""content marketing"", ""digital marketing""]",53,9,2025-10-25 19:28:21,en,How do you attribute success to {keyword} efforts?,0.87,1.0,0.47
105,content marketing,marketing,How do you create a content marketing roadmap?,implementation,Expert,"[""Overview of content marketing"", ""Step-by-step implementation"", ""Best practices and tips"", ""Common challenges and solutions"", ""Tools and resources needed"", ""Conclusion and next steps""]","[""marketing"", ""promotion"", ""advertising"", ""content"", ""implementation""]",6,Marketing Directors & CMOs,"[""brand management"", ""social media"", ""digital marketing""]",46,8,2025-10-25 19:28:21,en,How do you create a {keyword} roadmap?,0.89,1.0,0.74
108,social media,marketing,What does the future hold for social media?,comparison,Expert,"[""Introduction to social media"", ""Key points and analysis"", ""Practical examples"", ""Expert insights"", ""Action items"", ""Conclusion""]","[""marketing"", ""social"", ""promotion"", ""media"", ""advertising"", ""comparison""]",4,Marketing Directors & CMOs,"[""content marketing"", ""digital marketing"", ""brand management""]",43,8,2025-10-25 19:28:21,en,What does the future hold for {keyword}?,0.69,1.0,0.6
109,social media,marketing,How do you create a social media roadmap?,best_practice,Expert,"[""Overview of social media"", ""Step-by-step implementation"", ""Best practices and tips"", ""Common challenges and solutions"", ""Tools and resources needed"", ""Conclusion and next steps""]","[""marketing"", ""best_practice"", ""social"", ""promotion"", ""media"", ""advertising""]",6,Marketing Directors & CMOs,"[""digital marketing"", ""content marketing"", ""brand management""]",41,8,2025-10-25 19:28:21,en,How do you create a {keyword} roadmap?,0.76,1.0,0.65
112,social media,marketing,What messaging works best in social media campaigns?,comparison,Intermediate,"[""Introduction to social media"", ""Key points and analysis"", ""Practical examples"", ""Expert insights"", ""Action items"", ""Conclusion""]","[""marketing"", ""social"", ""digital"", ""promotion"", ""media"", ""comparison""]",4,Marketing Coordinators & Specialists,"[""digital marketing"", ""content marketing"", ""brand management""]",52,8,2025-10-25 19:28:21,en,What messaging works best in {keyword} campaigns?,0.76,0.764831265963536,0.65
115,brand management,marketing,How do you improve brand management conversion rates?,planning,Intermediate,"[""Overview of brand management"", ""Step-by-step implementation"", ""Best practices and tips"", ""Common challenges and solutions"", ""Tools and resources needed"", ""Conclusion and next steps""]","[""marketing"", ""management"", ""branding"", ""promotion"", ""planning"", ""brand""]",6,Marketing Coordinators & Specialists,"[""digital marketing"", ""social media"", ""content marketing""]",53,8,2025-10-25 19:28:21,en,How do you improve {keyword} conversion rates?,0.72,0.6172696149925324,0.45
120,social media,marketing,How do you identify the right audience for social media?,analysis,Beginner,"[""Overview of social media"", ""Step-by-step implementation"", ""Best practices and tips"", ""Common challenges and solutions"", ""Tools and resources needed"", ""Conclusion and next steps""]","[""marketing"", ""social"", ""branding"", ""digital"", ""media"", ""analysis""]",6,Marketing Students & Interns,"[""brand management"", ""content marketing"", ""digital marketing""]",56,10,2025-10-25 19:28:21,en,How do you identify the right audience for {keyword}?,0.75,0.4746519438515653,0.34
122,digital marketing,marketing,How is AI changing digital marketing approaches?,evaluation,Advanced,"[""Introduction to digital marketing"", ""Key points and analysis"", ""Practical examples"", ""Expert insights"", ""Action items"", ""Conclusion""]","[""marketing"", ""evaluation"", ""branding"", ""digital"", ""advertising""]",4,Marketing Managers & Strategists,"[""content marketing"", ""social media"", ""brand management""]",48,7,2025-10-25 19:28:21,en,How is AI changing {keyword} approaches?,0.71,0.9365295234874382,0.74
124,digital marketing,marketing,What content types work best for digital marketing?,optimization,Beginner,"[""Introduction to digital marketing"", ""Key points and analysis"", ""Practical examples"", ""Expert insights"", ""Action items"", ""Conclusion""]","[""marketing"", ""branding"", ""digital"", ""promotion"", ""optimization""]",4,Marketing Students & Interns,"[""social media"", ""content marketing"", ""brand management""]",51,8,2025-10-25 19:28:21,en,What content types work best for {keyword}?,0.72,0.3430207949014032,0.75
125,digital marketing,marketing,How do you attribute success to digital marketing efforts?,optimization,Beginner,"[""Overview of digital marketing"", ""Step-by-step implementation"", ""Best practices and tips"", ""Common challenges and solutions"", ""Tools and resources needed"", ""Conclusion and next steps""]","[""marketing"", ""branding"", ""digital"", ""promotion"", ""optimization""]",6,Marketing Students & Interns,"[""content marketing"", ""brand management"", ""social media""]",58,9,2025-10-25 19:28:21,en,How do you attribute success to {keyword} efforts?,0.88,0.4557155955046956,0.67
