record_id,keyword,category,question,question_type,difficulty_level,answer_outline,tags,estimated_read_time,target_audience,related_topics,question_length,word_count,created_date,language,source_template,engagement_score,complexity_score,popularity_score
34000657,data science,it,How do you design a scalable data science solution?,optimization,Expert,"[""Overview of data science"", ""Step-by-step implementation"", ""Best practices and tips"", ""Common challenges and solutions"", ""Tools and resources needed"", ""Conclusion and next steps""]","[""technology"", ""software"", ""it"", ""science"", ""optimization"", ""data""]",6,Architects & Technical Directors,"[""cloud computing"", ""web development"", ""machine learning"", ""cybersecurity""]",51,9,2025-10-25 21:44:02,en,How do you design a scalable {keyword} solution?,0.89,1.0,0.58
34000658,social media,marketing,How do you track and analyze social media performance?,troubleshooting,Beginner,"[""Overview of social media"", ""Step-by-step implementation"", ""Best practices and tips"", ""Common challenges and solutions"", ""Tools and resources needed"", ""Conclusion and next steps""]","[""media"", ""promotion"", ""troubleshooting"", ""marketing"", ""social"", ""branding""]",6,Marketing Students & Interns,"[""brand management"", ""digital marketing"", ""content marketing""]",54,9,2025-10-25 21:44:02,en,How do you track and analyze {keyword} performance?,0.89,0.34793012604630114,0.51
34000659,cybersecurity,it,How do you choose the right technology stack for cybersecurity?,analysis,Beginner,"[""Overview of cybersecurity"", ""Step-by-step implementation"", ""Best practices and tips"", ""Common challenges and solutions"", ""Tools and resources needed"", ""Conclusion and next steps""]","[""software"", ""development"", ""analysis"", ""it"", ""cybersecurity""]",5,Students & Entry-level Developers,"[""data science"", ""web development"", ""cloud computing"", ""machine learning""]",63,10,2025-10-25 21:44:02,en,How do you choose the right technology stack for {keyword}?,0.61,0.3018408930640648,0.56
34000660,financial modeling,economics,How do you assess and manage financial modeling risks?,evaluation,Advanced,"[""Overview of financial modeling"", ""Step-by-step implementation"", ""Best practices and tips"", ""Common challenges and solutions"", ""Tools and resources needed"", ""Conclusion and next steps""]","[""investment"", ""modeling"", ""financial"", ""evaluation"", ""business"", ""economics""]",6,Professional Investors & Advisors,"[""market analysis"", ""investment planning"", ""portfolio management""]",54,9,2025-10-25 21:44:02,en,How do you assess and manage {keyword} risks?,0.7,0.801005368796723,0.69
34000661,digital marketing,marketing,How do you create a digital marketing roadmap?,how_to,Intermediate,"[""Overview of digital marketing"", ""Step-by-step implementation"", ""Best practices and tips"", ""Common challenges and solutions"", ""Tools and resources needed"", ""Conclusion and next steps""]","[""how_to"", ""promotion"", ""marketing"", ""digital"", ""branding""]",6,Marketing Coordinators & Specialists,"[""content marketing"", ""brand management"", ""social media""]",46,8,2025-10-25 21:44:02,en,How do you create a {keyword} roadmap?,0.62,0.6025718106731972,0.86
34000662,portfolio management,economics,What timeline is realistic for portfolio management returns?,troubleshooting,Expert,"[""Introduction to portfolio management"", ""Key points and analysis"", ""Practical examples"", ""Expert insights"", ""Action items"", ""Conclusion""]","[""investment"", ""portfolio"", ""troubleshooting"", ""management"", ""business"", ""economics""]",4,Portfolio Managers & Financial Experts,"[""investment planning"", ""market analysis"", ""financial modeling""]",60,8,2025-10-25 21:44:02,en,What timeline is realistic for {keyword} returns?,0.7,1.0,0.72
34000663,portfolio management,economics,How do you protect your portfolio management investments?,implementation,Advanced,"[""Overview of portfolio management"", ""Step-by-step implementation"", ""Best practices and tips"", ""Common challenges and solutions"", ""Tools and resources needed"", ""Conclusion and next steps""]","[""finance"", ""implementation"", ""portfolio"", ""management"", ""business"", ""economics""]",6,Professional Investors & Advisors,"[""financial modeling"", ""investment planning"", ""market analysis""]",57,8,2025-10-25 21:44:02,en,How do you protect your {keyword} investments?,0.91,0.825408078602675,0.53
34000664,content marketing,marketing,How do you track and analyze content marketing performance?,implementation,Expert,"[""Overview of content marketing"", ""Step-by-step implementation"", ""Best practices and tips"", ""Common challenges and solutions"", ""Tools and resources needed"", ""Conclusion and next steps""]","[""content"", ""implementation"", ""marketing"", ""advertising"", ""branding""]",6,Marketing Directors & CMOs,"[""digital marketing"", ""social media"", ""brand management""]",59,9,2025-10-25 21:44:02,en,How do you track and analyze {keyword} performance?,0.82,1.0,0.37
34000665,market analysis,economics,How do you assess and manage market analysis risks?,strategy,Intermediate,"[""Overview of market analysis"", ""Step-by-step implementation"", ""Best practices and tips"", ""Common challenges and solutions"", ""Tools and resources needed"", ""Conclusion and next steps""]","[""investment"", ""analysis"", ""business"", ""market"", ""strategy"", ""economics""]",6,Individual Investors & Analysts,"[""portfolio management"", ""financial modeling"", ""investment planning""]",51,9,2025-10-25 21:44:02,en,How do you assess and manage {keyword} risks?,0.91,0.7483622400823287,0.67
34000666,machine learning,it,How do you integrate machine learning with existing systems?,evaluation,Beginner,"[""Overview of machine learning"", ""Step-by-step implementation"", ""Best practices and tips"", ""Common challenges and solutions"", ""Tools and resources needed"", ""Conclusion and next steps""]","[""software"", ""development"", ""it"", ""learning"", ""evaluation"", ""machine""]",6,Students & Entry-level Developers,"[""web development"", ""cybersecurity"", ""cloud computing"", ""data science""]",60,9,2025-10-25 21:44:02,en,How do you integrate {keyword} with existing systems?,0.91,0.3243155485589747,0.74
34000667,portfolio management,economics,How do you measure portfolio management performance?,evaluation,Expert,"[""Overview of portfolio management"", ""Step-by-step implementation"", ""Best practices and tips"", ""Common challenges and solutions"", ""Tools and resources needed"", ""Conclusion and next steps""]","[""portfolio"", ""management"", ""evaluation"", ""market"", ""business"", ""economics""]",6,Portfolio Managers & Financial Experts,"[""investment planning"", ""market analysis"", ""financial modeling""]",52,7,2025-10-25 21:44:02,en,How do you measure {keyword} performance?,0.77,1.0,0.9
34000668,content marketing,marketing,How do you personalize content marketing for different segments?,best_practice,Intermediate,"[""Overview of content marketing"", ""Step-by-step implementation"", ""Best practices and tips"", ""Common challenges and solutions"", ""Tools and resources needed"", ""Conclusion and next steps""]","[""content"", ""promotion"", ""best_practice"", ""marketing"", ""advertising""]",6,Marketing Coordinators & Specialists,"[""brand management"", ""digital marketing"", ""social media""]",64,9,2025-10-25 21:44:02,en,How do you personalize {keyword} for different segments?,0.68,0.7794001404717023,0.54
34000669,content marketing,marketing,How do you develop an effective content marketing strategy?,evaluation,Expert,"[""Overview of content marketing"", ""Step-by-step implementation"", ""Best practices and tips"", ""Common challenges and solutions"", ""Tools and resources needed"", ""Conclusion and next steps""]","[""content"", ""marketing"", ""digital"", ""branding"", ""evaluation""]",6,Marketing Directors & CMOs,"[""social media"", ""brand management"", ""digital marketing""]",59,9,2025-10-25 21:44:02,en,How do you develop an effective {keyword} strategy?,0.72,1.0,0.34
34000670,financial modeling,economics,What metrics are most important for financial modeling?,troubleshooting,Beginner,"[""Introduction to financial modeling"", ""Key points and analysis"", ""Practical examples"", ""Expert insights"", ""Action items"", ""Conclusion""]","[""investment"", ""finance"", ""troubleshooting"", ""modeling"", ""financial"", ""economics""]",4,Students & New Investors,"[""investment planning"", ""market analysis"", ""portfolio management""]",55,8,2025-10-25 21:44:02,en,What metrics are most important for {keyword}?,0.67,0.4394012894135453,0.32
34000671,portfolio management,economics,How do economic conditions affect portfolio management performance?,implementation,Beginner,"[""Introduction to portfolio management"", ""Key points and analysis"", ""Practical examples"", ""Expert insights"", ""Action items"", ""Conclusion""]","[""finance"", ""implementation"", ""portfolio"", ""management"", ""market"", ""economics""]",4,Students & New Investors,"[""market analysis"", ""investment planning"", ""financial modeling""]",67,8,2025-10-25 21:44:02,en,How do economic conditions affect {keyword} performance?,0.94,0.30711223725888354,0.31
34000672,cybersecurity,it,What is the recommended architecture for cybersecurity systems?,best_practice,Beginner,"[""Introduction to cybersecurity"", ""Key points and analysis"", ""Practical examples"", ""Expert insights"", ""Action items"", ""Conclusion""]","[""software"", ""development"", ""it"", ""best_practice"", ""cybersecurity""]",4,Students & Entry-level Developers,"[""web development"", ""machine learning"", ""data science"", ""cloud computing""]",63,8,2025-10-25 21:44:02,en,What is the recommended architecture for {keyword} systems?,0.82,0.37435038793551634,0.56
34000673,social media,marketing,How do you create a social media roadmap?,analysis,Advanced,"[""Overview of social media"", ""Step-by-step implementation"", ""Best practices and tips"", ""Common challenges and solutions"", ""Tools and resources needed"", ""Conclusion and next steps""]","[""analysis"", ""media"", ""marketing"", ""digital"", ""social"", ""branding""]",6,Marketing Managers & Strategists,"[""brand management"", ""content marketing"", ""digital marketing""]",41,8,2025-10-25 21:44:02,en,How do you create a {keyword} roadmap?,0.76,0.8321135889716134,0.58
34000674,content marketing,marketing,How do you improve content marketing conversion rates?,evaluation,Expert,"[""Overview of content marketing"", ""Step-by-step implementation"", ""Best practices and tips"", ""Common challenges and solutions"", ""Tools and resources needed"", ""Conclusion and next steps""]","[""content"", ""marketing"", ""digital"", ""advertising"", ""evaluation""]",6,Marketing Directors & CMOs,"[""brand management"", ""digital marketing"", ""social media""]",54,8,2025-10-25 21:44:02,en,How do you improve {keyword} conversion rates?,0.93,1.0,0.35
34000675,web development,it,What skills are needed to master web development?,analysis,Intermediate,"[""Introduction to web development"", ""Key points and analysis"", ""Practical examples"", ""Expert insights"", ""Action items"", ""Conclusion""]","[""development"", ""analysis"", ""it"", ""programming"", ""web""]",4,Junior to Mid-level Developers,"[""data science"", ""cloud computing"", ""machine learning"", ""cybersecurity""]",49,8,2025-10-25 21:44:02,en,What skills are needed to master {keyword}?,0.89,0.6356391300146418,0.56
34000676,investment planning,economics,What factors should be considered when evaluating investment planning?,implementation,Beginner,"[""Introduction to investment planning"", ""Key points and analysis"", ""Practical examples"", ""Expert insights"", ""Action items"", ""Conclusion""]","[""investment"", ""planning"", ""finance"", ""implementation"", ""economics""]",4,Students & New Investors,"[""market analysis"", ""portfolio management"", ""financial modeling""]",70,9,2025-10-25 21:44:02,en,What factors should be considered when evaluating {keyword}?,0.78,0.3789054065007603,0.33
34000677,social media,marketing,How is AI changing social media approaches?,troubleshooting,Expert,"[""Introduction to social media"", ""Key points and analysis"", ""Practical examples"", ""Expert insights"", ""Action items"", ""Conclusion""]","[""media"", ""troubleshooting"", ""digital"", ""marketing"", ""social"", ""advertising""]",4,Marketing Directors & CMOs,"[""digital marketing"", ""brand management"", ""content marketing""]",43,7,2025-10-25 21:44:02,en,How is AI changing {keyword} approaches?,0.84,1.0,0.73
34000678,content marketing,marketing,What messaging works best in content marketing campaigns?,how_to,Expert,"[""Introduction to content marketing"", ""Key points and analysis"", ""Practical examples"", ""Expert insights"", ""Action items"", ""Conclusion""]","[""how_to"", ""content"", ""promotion"", ""marketing"", ""branding""]",4,Marketing Directors & CMOs,"[""brand management"", ""digital marketing"", ""social media""]",57,8,2025-10-25 21:44:02,en,What messaging works best in {keyword} campaigns?,0.91,1.0,0.64
34000679,investment planning,economics,What factors should be considered when evaluating investment planning?,troubleshooting,Intermediate,"[""Introduction to investment planning"", ""Key points and analysis"", ""Practical examples"", ""Expert insights"", ""Action items"", ""Conclusion""]","[""investment"", ""planning"", ""troubleshooting"", ""business"", ""economics""]",4,Individual Investors & Analysts,"[""portfolio management"", ""market analysis"", ""financial modeling""]",70,9,2025-10-25 21:44:02,en,What factors should be considered when evaluating {keyword}?,0.68,0.666550509705321,0.6
34000680,financial modeling,economics,What are the regulatory considerations for financial modeling?,planning,Advanced,"[""Introduction to financial modeling"", ""Key concepts and definitions"", ""Main categories or types"", ""Examples and case studies"", ""Benefits and advantages"", ""Summary and recommendations""]","[""planning"", ""modeling"", ""financial"", ""market"", ""business"", ""economics""]",6,Professional Investors & Advisors,"[""market analysis"", ""portfolio management"", ""investment planning""]",62,8,2025-10-25 21:44:02,en,What are the regulatory considerations for {keyword}?,0.9,0.8012247961018538,0.69
34000681,digital marketing,marketing,How do you develop an effective digital marketing strategy?,how_to,Beginner,"[""Overview of digital marketing"", ""Step-by-step implementation"", ""Best practices and tips"", ""Common challenges and solutions"", ""Tools and resources needed"", ""Conclusion and next steps""]","[""branding"", ""marketing"", ""how_to"", ""digital""]",6,Marketing Students & Interns,"[""brand management"", ""social media"", ""content marketing""]",59,9,2025-10-25 21:44:02,en,How do you develop an effective {keyword} strategy?,0.64,0.45904774438974993,0.31
34000682,portfolio management,economics,How do you hedge against portfolio management market downturns?,optimization,Advanced,"[""Overview of portfolio management"", ""Step-by-step implementation"", ""Best practices and tips"", ""Common challenges and solutions"", ""Tools and resources needed"", ""Conclusion and next steps""]","[""finance"", ""portfolio"", ""management"", ""business"", ""optimization"", ""economics""]",6,Professional Investors & Advisors,"[""investment planning"", ""market analysis"", ""financial modeling""]",63,9,2025-10-25 21:44:02,en,How do you hedge against {keyword} market downturns?,0.89,0.9368415149573714,0.43
34000683,social media,marketing,How do you measure the ROI of social media campaigns?,best_practice,Beginner,"[""Overview of social media"", ""Step-by-step implementation"", ""Best practices and tips"", ""Common challenges and solutions"", ""Tools and resources needed"", ""Conclusion and next steps""]","[""media"", ""best_practice"", ""marketing"", ""digital"", ""social"", ""branding""]",6,Marketing Students & Interns,"[""brand management"", ""content marketing"", ""digital marketing""]",53,10,2025-10-25 21:44:02,en,How do you measure the ROI of {keyword} campaigns?,0.84,0.3564443586666623,0.48
34000684,market analysis,economics,How do you report on market analysis performance to stakeholders?,best_practice,Intermediate,"[""Overview of market analysis"", ""Step-by-step implementation"", ""Best practices and tips"", ""Common challenges and solutions"", ""Tools and resources needed"", ""Conclusion and next steps""]","[""analysis"", ""best_practice"", ""market"", ""business"", ""economics""]",6,Individual Investors & Analysts,"[""financial modeling"", ""investment planning"", ""portfolio management""]",65,10,2025-10-25 21:44:02,en,How do you report on {keyword} performance to stakeholders?,0.9,0.6091591340794298,0.49
34000685,market analysis,economics,How do you benchmark market analysis against alternatives?,comparison,Expert,"[""Overview of market analysis"", ""Step-by-step implementation"", ""Best practices and tips"", ""Common challenges and solutions"", ""Tools and resources needed"", ""Conclusion and next steps""]","[""finance"", ""analysis"", ""comparison"", ""market"", ""economics""]",6,Portfolio Managers & Financial Experts,"[""portfolio management"", ""investment planning"", ""financial modeling""]",58,8,2025-10-25 21:44:02,en,How do you benchmark {keyword} against alternatives?,0.65,1.0,0.51
34000686,digital marketing,marketing,How is AI changing digital marketing approaches?,optimization,Beginner,"[""Introduction to digital marketing"", ""Key points and analysis"", ""Practical examples"", ""Expert insights"", ""Action items"", ""Conclusion""]","[""marketing"", ""optimization"", ""advertising"", ""digital""]",4,Marketing Students & Interns,"[""content marketing"", ""brand management"", ""social media""]",48,7,2025-10-25 21:44:02,en,How is AI changing {keyword} approaches?,0.87,0.4806712538254687,0.4
34000687,market analysis,economics,How do you create a long-term plan for market analysis?,implementation,Beginner,"[""Overview of market analysis"", ""Step-by-step implementation"", ""Best practices and tips"", ""Common challenges and solutions"", ""Tools and resources needed"", ""Conclusion and next steps""]","[""investment"", ""analysis"", ""finance"", ""implementation"", ""market"", ""economics""]",6,Students & New Investors,"[""investment planning"", ""portfolio management"", ""financial modeling""]",55,10,2025-10-25 21:44:02,en,How do you create a long-term plan for {keyword}?,0.86,0.3062794612057135,0.69
34000688,market analysis,economics,How do you adjust your market analysis strategy during volatility?,planning,Expert,"[""Overview of market analysis"", ""Step-by-step implementation"", ""Best practices and tips"", ""Common challenges and solutions"", ""Tools and resources needed"", ""Conclusion and next steps""]","[""planning"", ""analysis"", ""finance"", ""market"", ""business"", ""economics""]",6,Portfolio Managers & Financial Experts,"[""financial modeling"", ""portfolio management"", ""investment planning""]",66,10,2025-10-25 21:44:02,en,How do you adjust your {keyword} strategy during volatility?,0.84,1.0,0.61
34000689,portfolio management,economics,What are the seasonal patterns in portfolio management?,best_practice,Advanced,"[""Introduction to portfolio management"", ""Key concepts and definitions"", ""Main categories or types"", ""Examples and case studies"", ""Benefits and advantages"", ""Summary and recommendations""]","[""investment"", ""portfolio"", ""best_practice"", ""management"", ""market"", ""economics""]",6,Professional Investors & Advisors,"[""market analysis"", ""investment planning"", ""financial modeling""]",55,8,2025-10-25 21:44:02,en,What are the seasonal patterns in {keyword}?,0.81,0.9404048866333783,0.73
34000690,data science,it,What are the best practices for data science development?,troubleshooting,Beginner,"[""Introduction to data science"", ""Key concepts and definitions"", ""Main categories or types"", ""Examples and case studies"", ""Benefits and advantages"", ""Summary and recommendations""]","[""development"", ""it"", ""programming"", ""troubleshooting"", ""science"", ""data""]",6,Students & Entry-level Developers,"[""web development"", ""cybersecurity"", ""machine learning"", ""cloud computing""]",57,9,2025-10-25 21:44:02,en,What are the best practices for {keyword} development?,0.93,0.4095981510232791,0.4
34000691,financial modeling,economics,What are the risks associated with financial modeling?,strategy,Beginner,"[""Introduction to financial modeling"", ""Key concepts and definitions"", ""Main categories or types"", ""Examples and case studies"", ""Benefits and advantages"", ""Summary and recommendations""]","[""investment"", ""finance"", ""modeling"", ""financial"", ""strategy"", ""economics""]",6,Students & New Investors,"[""portfolio management"", ""market analysis"", ""investment planning""]",54,8,2025-10-25 21:44:02,en,What are the risks associated with {keyword}?,0.65,0.30684056160546674,0.3
34000692,investment planning,economics,How do you report on investment planning performance to stakeholders?,how_to,Beginner,"[""Overview of investment planning"", ""Step-by-step implementation"", ""Best practices and tips"", ""Common challenges and solutions"", ""Tools and resources needed"", ""Conclusion and next steps""]","[""investment"", ""how_to"", ""planning"", ""finance"", ""business"", ""economics""]",6,Students & New Investors,"[""portfolio management"", ""financial modeling"", ""market analysis""]",69,10,2025-10-25 21:44:02,en,How do you report on {keyword} performance to stakeholders?,0.71,0.47286894410082025,0.86
34000693,cloud computing,it,How do you choose the right technology stack for cloud computing?,analysis,Expert,"[""Overview of cloud computing"", ""Step-by-step implementation"", ""Best practices and tips"", ""Common challenges and solutions"", ""Tools and resources needed"", ""Conclusion and next steps""]","[""computing"", ""software"", ""analysis"", ""it"", ""programming"", ""cloud""]",6,Architects & Technical Directors,"[""machine learning"", ""cybersecurity"", ""data science"", ""web development""]",65,11,2025-10-25 21:44:02,en,How do you choose the right technology stack for {keyword}?,0.66,1.0,0.82
34000694,machine learning,it,What career opportunities exist in machine learning?,troubleshooting,Beginner,"[""Introduction to machine learning"", ""Key points and analysis"", ""Practical examples"", ""Expert insights"", ""Action items"", ""Conclusion""]","[""software"", ""development"", ""it"", ""troubleshooting"", ""learning"", ""machine""]",4,Students & Entry-level Developers,"[""data science"", ""cybersecurity"", ""web development"", ""cloud computing""]",52,7,2025-10-25 21:44:02,en,What career opportunities exist in {keyword}?,0.85,0.43921960003177024,0.39
34000695,content marketing,marketing,What budget should be allocated to content marketing?,implementation,Advanced,"[""Introduction to content marketing"", ""Key points and analysis"", ""Practical examples"", ""Expert insights"", ""Action items"", ""Conclusion""]","[""content"", ""implementation"", ""marketing"", ""digital"", ""advertising""]",4,Marketing Managers & Strategists,"[""social media"", ""digital marketing"", ""brand management""]",53,8,2025-10-25 21:44:02,en,What budget should be allocated to {keyword}?,0.89,0.987392828867364,0.69
34000696,brand management,marketing,How do you personalize brand management for different segments?,evaluation,Advanced,"[""Overview of brand management"", ""Step-by-step implementation"", ""Best practices and tips"", ""Common challenges and solutions"", ""Tools and resources needed"", ""Conclusion and next steps""]","[""promotion"", ""marketing"", ""management"", ""advertising"", ""evaluation"", ""brand""]",6,Marketing Managers & Strategists,"[""content marketing"", ""digital marketing"", ""social media""]",63,9,2025-10-25 21:44:02,en,How do you personalize {keyword} for different segments?,0.64,0.9393341993743765,0.6
34000697,data science,it,Which frameworks support data science implementation?,optimization,Intermediate,"[""Introduction to data science"", ""Key points and analysis"", ""Practical examples"", ""Expert insights"", ""Action items"", ""Conclusion""]","[""technology"", ""software"", ""it"", ""science"", ""optimization"", ""data""]",4,Junior to Mid-level Developers,"[""machine learning"", ""web development"", ""cybersecurity"", ""cloud computing""]",53,6,2025-10-25 21:44:02,en,Which frameworks support {keyword} implementation?,0.93,0.7692446084994708,0.83
34000698,cloud computing,it,How do you convince stakeholders to invest in cloud computing?,analysis,Beginner,"[""Overview of cloud computing"", ""Step-by-step implementation"", ""Best practices and tips"", ""Common challenges and solutions"", ""Tools and resources needed"", ""Conclusion and next steps""]","[""computing"", ""software"", ""development"", ""analysis"", ""it"", ""cloud""]",6,Students & Entry-level Developers,"[""machine learning"", ""data science"", ""web development"", ""cybersecurity""]",62,10,2025-10-25 21:44:02,en,How do you convince stakeholders to invest in {keyword}?,0.74,0.4577408168145151,0.48
34000699,web development,it,What certifications are valuable for web development professionals?,implementation,Expert,"[""Introduction to web development"", ""Key points and analysis"", ""Practical examples"", ""Expert insights"", ""Action items"", ""Conclusion""]","[""software"", ""development"", ""it"", ""implementation"", ""web""]",4,Architects & Technical Directors,"[""cybersecurity"", ""cloud computing"", ""machine learning"", ""data science""]",67,8,2025-10-25 21:44:02,en,What certifications are valuable for {keyword} professionals?,0.88,1.0,0.75
