record_id,keyword,category,question,question_type,difficulty_level,answer_outline,tags,estimated_read_time,target_audience,related_topics,question_length,word_count,created_date,language,source_template,engagement_score,complexity_score,popularity_score
40700958,machine learning,it,What certifications are valuable for machine learning professionals?,planning,Intermediate,"[""Introduction to machine learning"", ""Key points and analysis"", ""Practical examples"", ""Expert insights"", ""Action items"", ""Conclusion""]","[""planning"", ""development"", ""it"", ""learning"", ""machine"", ""technology""]",4,Junior to Mid-level Developers,"[""cloud computing"", ""cybersecurity"", ""data science"", ""web development""]",68,8,2025-10-25 21:53:21,en,What certifications are valuable for {keyword} professionals?,0.63,0.6063457058874159,0.77
40700959,machine learning,it,What certifications are valuable for machine learning professionals?,implementation,Intermediate,"[""Introduction to machine learning"", ""Key points and analysis"", ""Practical examples"", ""Expert insights"", ""Action items"", ""Conclusion""]","[""it"", ""implementation"", ""programming"", ""learning"", ""machine"", ""technology""]",4,Junior to Mid-level Developers,"[""cybersecurity"", ""cloud computing"", ""web development"", ""data science""]",68,8,2025-10-25 21:53:21,en,What certifications are valuable for {keyword} professionals?,0.66,0.6081182754710421,0.77
40700960,cloud computing,it,What are the cost considerations for cloud computing?,analysis,Intermediate,"[""Introduction to cloud computing"", ""Key concepts and definitions"", ""Main categories or types"", ""Examples and case studies"", ""Benefits and advantages"", ""Summary and recommendations""]","[""computing"", ""software"", ""analysis"", ""it"", ""development"", ""cloud""]",6,Junior to Mid-level Developers,"[""cybersecurity"", ""web development"", ""data science"", ""machine learning""]",53,8,2025-10-25 21:53:21,en,What are the cost considerations for {keyword}?,0.6,0.7803709804169906,0.44
40700961,market analysis,economics,What factors should be considered when evaluating market analysis?,planning,Beginner,"[""Introduction to market analysis"", ""Key points and analysis"", ""Practical examples"", ""Expert insights"", ""Action items"", ""Conclusion""]","[""planning"", ""analysis"", ""finance"", ""market"", ""business"", ""economics""]",4,Students & New Investors,"[""portfolio management"", ""investment planning"", ""financial modeling""]",66,9,2025-10-25 21:53:21,en,What factors should be considered when evaluating {keyword}?,0.66,0.37816473848939575,0.56
40700962,web development,it,How do you optimize web development for different platforms?,comparison,Beginner,"[""Overview of web development"", ""Step-by-step implementation"", ""Best practices and tips"", ""Common challenges and solutions"", ""Tools and resources needed"", ""Conclusion and next steps""]","[""development"", ""it"", ""comparison"", ""programming"", ""web""]",6,Students & Entry-level Developers,"[""cloud computing"", ""machine learning"", ""data science"", ""cybersecurity""]",60,9,2025-10-25 21:53:21,en,How do you optimize {keyword} for different platforms?,0.88,0.38452352755540986,0.34
40700963,data science,it,How do you get started with data science as a beginner?,planning,Expert,"[""Overview of data science"", ""Step-by-step implementation"", ""Best practices and tips"", ""Common challenges and solutions"", ""Tools and resources needed"", ""Conclusion and next steps""]","[""planning"", ""software"", ""it"", ""programming"", ""science"", ""data""]",6,Architects & Technical Directors,"[""web development"", ""machine learning"", ""cloud computing"", ""cybersecurity""]",55,11,2025-10-25 21:53:21,en,How do you get started with {keyword} as a beginner?,0.78,1.0,0.61
40700964,digital marketing,marketing,What channels are most effective for digital marketing?,how_to,Intermediate,"[""Introduction to digital marketing"", ""Key points and analysis"", ""Practical examples"", ""Expert insights"", ""Action items"", ""Conclusion""]","[""how_to"", ""promotion"", ""marketing"", ""digital"", ""branding""]",4,Marketing Coordinators & Specialists,"[""content marketing"", ""social media"", ""brand management""]",55,8,2025-10-25 21:53:21,en,What channels are most effective for {keyword}?,0.64,0.7537626573318215,0.38
40700965,cybersecurity,it,What security considerations should be taken when using cybersecurity?,analysis,Beginner,"[""Introduction to cybersecurity"", ""Key points and analysis"", ""Practical examples"", ""Expert insights"", ""Action items"", ""Conclusion""]","[""development"", ""analysis"", ""it"", ""cybersecurity"", ""technology""]",4,Students & Entry-level Developers,"[""data science"", ""machine learning"", ""cloud computing"", ""web development""]",70,9,2025-10-25 21:53:21,en,What security considerations should be taken when using {keyword}?,0.61,0.485353984718341,0.4
40700966,financial modeling,economics,How do you protect your financial modeling investments?,how_to,Expert,"[""Overview of financial modeling"", ""Step-by-step implementation"", ""Best practices and tips"", ""Common challenges and solutions"", ""Tools and resources needed"", ""Conclusion and next steps""]","[""investment"", ""how_to"", ""modeling"", ""financial"", ""business"", ""economics""]",6,Portfolio Managers & Financial Experts,"[""market analysis"", ""investment planning"", ""portfolio management""]",55,8,2025-10-25 21:53:21,en,How do you protect your {keyword} investments?,0.85,1.0,0.38
40700967,web development,it,What design patterns work best with web development?,analysis,Intermediate,"[""Introduction to web development"", ""Key points and analysis"", ""Practical examples"", ""Expert insights"", ""Action items"", ""Conclusion""]","[""software"", ""development"", ""analysis"", ""it"", ""programming"", ""web""]",4,Junior to Mid-level Developers,"[""machine learning"", ""cloud computing"", ""cybersecurity"", ""data science""]",52,8,2025-10-25 21:53:21,en,What design patterns work best with {keyword}?,0.61,0.7030420501704072,0.54
40700968,brand management,marketing,How do you improve brand management conversion rates?,optimization,Advanced,"[""Overview of brand management"", ""Step-by-step implementation"", ""Best practices and tips"", ""Common challenges and solutions"", ""Tools and resources needed"", ""Conclusion and next steps""]","[""marketing"", ""management"", ""advertising"", ""digital"", ""optimization"", ""brand""]",6,Marketing Managers & Strategists,"[""digital marketing"", ""content marketing"", ""social media""]",53,8,2025-10-25 21:53:21,en,How do you improve {keyword} conversion rates?,0.83,0.9481413655396165,0.85
40700969,data science,it,How do you design a scalable data science solution?,implementation,Intermediate,"[""Overview of data science"", ""Step-by-step implementation"", ""Best practices and tips"", ""Common challenges and solutions"", ""Tools and resources needed"", ""Conclusion and next steps""]","[""technology"", ""it"", ""implementation"", ""programming"", ""science"", ""data""]",6,Junior to Mid-level Developers,"[""machine learning"", ""cloud computing"", ""cybersecurity"", ""web development""]",51,9,2025-10-25 21:53:21,en,How do you design a scalable {keyword} solution?,0.66,0.7721939351074655,0.58
40700970,market analysis,economics,How do you protect your market analysis investments?,optimization,Intermediate,"[""Overview of market analysis"", ""Step-by-step implementation"", ""Best practices and tips"", ""Common challenges and solutions"", ""Tools and resources needed"", ""Conclusion and next steps""]","[""investment"", ""analysis"", ""business"", ""market"", ""optimization"", ""economics""]",6,Individual Investors & Analysts,"[""portfolio management"", ""financial modeling"", ""investment planning""]",52,8,2025-10-25 21:53:21,en,How do you protect your {keyword} investments?,0.94,0.6146861794513444,0.5
40700971,investment planning,economics,How do you diversify your portfolio using investment planning?,evaluation,Advanced,"[""Overview of investment planning"", ""Step-by-step implementation"", ""Best practices and tips"", ""Common challenges and solutions"", ""Tools and resources needed"", ""Conclusion and next steps""]","[""investment"", ""planning"", ""finance"", ""evaluation"", ""business"", ""economics""]",6,Professional Investors & Advisors,"[""portfolio management"", ""financial modeling"", ""market analysis""]",62,9,2025-10-25 21:53:21,en,How do you diversify your portfolio using {keyword}?,0.61,0.9334396211593528,0.84
40700972,social media,marketing,How do you optimize social media for mobile users?,comparison,Intermediate,"[""Overview of social media"", ""Step-by-step implementation"", ""Best practices and tips"", ""Common challenges and solutions"", ""Tools and resources needed"", ""Conclusion and next steps""]","[""media"", ""promotion"", ""comparison"", ""marketing"", ""digital"", ""social""]",6,Marketing Coordinators & Specialists,"[""content marketing"", ""brand management"", ""digital marketing""]",50,9,2025-10-25 21:53:21,en,How do you optimize {keyword} for mobile users?,0.63,0.6256353112445183,0.44
40700973,financial modeling,economics,What metrics are most important for financial modeling?,optimization,Advanced,"[""Introduction to financial modeling"", ""Key points and analysis"", ""Practical examples"", ""Expert insights"", ""Action items"", ""Conclusion""]","[""modeling"", ""financial"", ""business"", ""market"", ""optimization"", ""economics""]",4,Professional Investors & Advisors,"[""market analysis"", ""portfolio management"", ""investment planning""]",55,8,2025-10-25 21:53:21,en,What metrics are most important for {keyword}?,0.89,0.9737729417473501,0.78
40700974,social media,marketing,How do you innovate within social media?,troubleshooting,Intermediate,"[""Overview of social media"", ""Step-by-step implementation"", ""Best practices and tips"", ""Common challenges and solutions"", ""Tools and resources needed"", ""Conclusion and next steps""]","[""media"", ""troubleshooting"", ""marketing"", ""social"", ""advertising"", ""branding""]",6,Marketing Coordinators & Specialists,"[""brand management"", ""content marketing"", ""digital marketing""]",40,7,2025-10-25 21:53:21,en,How do you innovate within {keyword}?,0.75,0.6854915184862285,0.66
40700975,data science,it,How do you convince stakeholders to invest in data science?,best_practice,Intermediate,"[""Overview of data science"", ""Step-by-step implementation"", ""Best practices and tips"", ""Common challenges and solutions"", ""Tools and resources needed"", ""Conclusion and next steps""]","[""software"", ""it"", ""best_practice"", ""programming"", ""science"", ""data""]",6,Junior to Mid-level Developers,"[""machine learning"", ""cloud computing"", ""cybersecurity"", ""web development""]",59,10,2025-10-25 21:53:21,en,How do you convince stakeholders to invest in {keyword}?,0.61,0.7346315803519294,0.55
40700976,portfolio management,economics,What tools help analyze portfolio management data?,implementation,Beginner,"[""Introduction to portfolio management"", ""Key points and analysis"", ""Practical examples"", ""Expert insights"", ""Action items"", ""Conclusion""]","[""investment"", ""finance"", ""implementation"", ""portfolio"", ""management"", ""economics""]",4,Students & New Investors,"[""investment planning"", ""market analysis"", ""financial modeling""]",50,7,2025-10-25 21:53:21,en,What tools help analyze {keyword} data?,0.81,0.42610301953721963,0.49
40700977,financial modeling,economics,How do you analyze market trends in financial modeling?,analysis,Expert,"[""Overview of financial modeling"", ""Step-by-step implementation"", ""Best practices and tips"", ""Common challenges and solutions"", ""Tools and resources needed"", ""Conclusion and next steps""]","[""analysis"", ""finance"", ""modeling"", ""financial"", ""market"", ""economics""]",6,Portfolio Managers & Financial Experts,"[""market analysis"", ""investment planning"", ""portfolio management""]",55,9,2025-10-25 21:53:21,en,How do you analyze market trends in {keyword}?,0.63,1.0,0.57
40700978,cybersecurity,it,How do you choose the right technology stack for cybersecurity?,optimization,Expert,"[""Overview of cybersecurity"", ""Step-by-step implementation"", ""Best practices and tips"", ""Common challenges and solutions"", ""Tools and resources needed"", ""Conclusion and next steps""]","[""software"", ""it"", ""programming"", ""optimization"", ""cybersecurity""]",5,Architects & Technical Directors,"[""cloud computing"", ""web development"", ""machine learning"", ""data science""]",63,10,2025-10-25 21:53:21,en,How do you choose the right technology stack for {keyword}?,0.91,1.0,0.48
40700979,cloud computing,it,How do you design a scalable cloud computing solution?,troubleshooting,Advanced,"[""Overview of cloud computing"", ""Step-by-step implementation"", ""Best practices and tips"", ""Common challenges and solutions"", ""Tools and resources needed"", ""Conclusion and next steps""]","[""computing"", ""software"", ""development"", ""it"", ""troubleshooting"", ""cloud""]",6,Senior Developers & Tech Leads,"[""data science"", ""web development"", ""machine learning"", ""cybersecurity""]",54,9,2025-10-25 21:53:21,en,How do you design a scalable {keyword} solution?,0.78,0.8376065384288087,0.51
40700980,social media,marketing,What budget should be allocated to social media?,evaluation,Expert,"[""Introduction to social media"", ""Key points and analysis"", ""Practical examples"", ""Expert insights"", ""Action items"", ""Conclusion""]","[""media"", ""marketing"", ""social"", ""advertising"", ""branding"", ""evaluation""]",4,Marketing Directors & CMOs,"[""content marketing"", ""digital marketing"", ""brand management""]",48,8,2025-10-25 21:53:21,en,What budget should be allocated to {keyword}?,0.83,1.0,0.42
40700981,machine learning,it,What are the cost considerations for machine learning?,how_to,Advanced,"[""Introduction to machine learning"", ""Key concepts and definitions"", ""Main categories or types"", ""Examples and case studies"", ""Benefits and advantages"", ""Summary and recommendations""]","[""how_to"", ""software"", ""it"", ""programming"", ""learning"", ""machine""]",6,Senior Developers & Tech Leads,"[""cybersecurity"", ""web development"", ""cloud computing"", ""data science""]",54,8,2025-10-25 21:53:21,en,What are the cost considerations for {keyword}?,0.75,0.9734582246136043,0.32
40700982,brand management,marketing,How do you create a brand management roadmap?,analysis,Beginner,"[""Overview of brand management"", ""Step-by-step implementation"", ""Best practices and tips"", ""Common challenges and solutions"", ""Tools and resources needed"", ""Conclusion and next steps""]","[""analysis"", ""promotion"", ""marketing"", ""management"", ""digital"", ""brand""]",6,Marketing Students & Interns,"[""content marketing"", ""digital marketing"", ""social media""]",45,8,2025-10-25 21:53:21,en,How do you create a {keyword} roadmap?,0.71,0.3418644924521519,0.56
40700983,digital marketing,marketing,How do you automate digital marketing processes?,strategy,Expert,"[""Overview of digital marketing"", ""Step-by-step implementation"", ""Best practices and tips"", ""Common challenges and solutions"", ""Tools and resources needed"", ""Conclusion and next steps""]","[""promotion"", ""marketing"", ""digital"", ""advertising"", ""strategy""]",6,Marketing Directors & CMOs,"[""content marketing"", ""brand management"", ""social media""]",48,7,2025-10-25 21:53:21,en,How do you automate {keyword} processes?,0.81,1.0,0.83
40700984,brand management,marketing,What timing strategies work for brand management?,how_to,Beginner,"[""Introduction to brand management"", ""Key points and analysis"", ""Practical examples"", ""Expert insights"", ""Action items"", ""Conclusion""]","[""how_to"", ""promotion"", ""marketing"", ""management"", ""digital"", ""brand""]",4,Marketing Students & Interns,"[""social media"", ""content marketing"", ""digital marketing""]",49,7,2025-10-25 21:53:21,en,What timing strategies work for {keyword}?,0.7,0.31389308547918326,0.69
40700985,cloud computing,it,What are the key components of a cloud computing implementation?,best_practice,Expert,"[""Introduction to cloud computing"", ""Key concepts and definitions"", ""Main categories or types"", ""Examples and case studies"", ""Benefits and advantages"", ""Summary and recommendations""]","[""computing"", ""development"", ""it"", ""programming"", ""best_practice"", ""cloud""]",6,Architects & Technical Directors,"[""data science"", ""web development"", ""machine learning"", ""cybersecurity""]",64,10,2025-10-25 21:53:21,en,What are the key components of a {keyword} implementation?,0.64,1.0,0.68
40700986,machine learning,it,How does machine learning impact business operations?,analysis,Expert,"[""Introduction to machine learning"", ""Key points and analysis"", ""Practical examples"", ""Expert insights"", ""Action items"", ""Conclusion""]","[""software"", ""analysis"", ""it"", ""learning"", ""machine"", ""technology""]",4,Architects & Technical Directors,"[""data science"", ""cloud computing"", ""web development"", ""cybersecurity""]",53,7,2025-10-25 21:53:21,en,How does {keyword} impact business operations?,0.72,1.0,0.79
40700987,brand management,marketing,What demographics respond best to brand management?,best_practice,Expert,"[""Introduction to brand management"", ""Key points and analysis"", ""Practical examples"", ""Expert insights"", ""Action items"", ""Conclusion""]","[""best_practice"", ""marketing"", ""management"", ""digital"", ""branding"", ""brand""]",4,Marketing Directors & CMOs,"[""content marketing"", ""social media"", ""digital marketing""]",51,7,2025-10-25 21:53:21,en,What demographics respond best to {keyword}?,0.89,1.0,0.85
40700988,market analysis,economics,What metrics are most important for market analysis?,analysis,Expert,"[""Introduction to market analysis"", ""Key points and analysis"", ""Practical examples"", ""Expert insights"", ""Action items"", ""Conclusion""]","[""market"", ""business"", ""economics"", ""analysis""]",4,Portfolio Managers & Financial Experts,"[""portfolio management"", ""investment planning"", ""financial modeling""]",52,8,2025-10-25 21:53:21,en,What metrics are most important for {keyword}?,0.73,1.0,0.67
40700989,social media,marketing,How do you measure the ROI of social media campaigns?,optimization,Beginner,"[""Overview of social media"", ""Step-by-step implementation"", ""Best practices and tips"", ""Common challenges and solutions"", ""Tools and resources needed"", ""Conclusion and next steps""]","[""media"", ""marketing"", ""digital"", ""social"", ""branding"", ""optimization""]",6,Marketing Students & Interns,"[""brand management"", ""content marketing"", ""digital marketing""]",53,10,2025-10-25 21:53:21,en,How do you measure the ROI of {keyword} campaigns?,0.72,0.3375716913860174,0.36
40700990,cybersecurity,it,What tools are essential for cybersecurity development?,planning,Intermediate,"[""Introduction to cybersecurity"", ""Key points and analysis"", ""Practical examples"", ""Expert insights"", ""Action items"", ""Conclusion""]","[""planning"", ""it"", ""programming"", ""cybersecurity"", ""technology""]",4,Junior to Mid-level Developers,"[""machine learning"", ""web development"", ""data science"", ""cloud computing""]",55,7,2025-10-25 21:53:21,en,What tools are essential for {keyword} development?,0.8,0.7073751934632274,0.46
40700991,financial modeling,economics,How do you benchmark financial modeling against alternatives?,troubleshooting,Beginner,"[""Overview of financial modeling"", ""Step-by-step implementation"", ""Best practices and tips"", ""Common challenges and solutions"", ""Tools and resources needed"", ""Conclusion and next steps""]","[""finance"", ""troubleshooting"", ""modeling"", ""financial"", ""business"", ""economics""]",6,Students & New Investors,"[""portfolio management"", ""market analysis"", ""investment planning""]",61,8,2025-10-25 21:53:21,en,How do you benchmark {keyword} against alternatives?,0.78,0.43284488883451555,0.49
40700992,social media,marketing,How do you automate social media processes?,comparison,Intermediate,"[""Overview of social media"", ""Step-by-step implementation"", ""Best practices and tips"", ""Common challenges and solutions"", ""Tools and resources needed"", ""Conclusion and next steps""]","[""media"", ""promotion"", ""comparison"", ""digital"", ""marketing"", ""social""]",6,Marketing Coordinators & Specialists,"[""brand management"", ""content marketing"", ""digital marketing""]",43,7,2025-10-25 21:53:21,en,How do you automate {keyword} processes?,0.78,0.6482142906536329,0.79
40700993,content marketing,marketing,What content types work best for content marketing?,analysis,Intermediate,"[""Introduction to content marketing"", ""Key points and analysis"", ""Practical examples"", ""Expert insights"", ""Action items"", ""Conclusion""]","[""content"", ""analysis"", ""marketing"", ""advertising"", ""branding""]",4,Marketing Coordinators & Specialists,"[""social media"", ""brand management"", ""digital marketing""]",51,8,2025-10-25 21:53:21,en,What content types work best for {keyword}?,0.87,0.7728078177718879,0.8
40700994,financial modeling,economics,What indicators predict financial modeling market movements?,analysis,Intermediate,"[""Introduction to financial modeling"", ""Key points and analysis"", ""Practical examples"", ""Expert insights"", ""Action items"", ""Conclusion""]","[""analysis"", ""modeling"", ""financial"", ""market"", ""business"", ""economics""]",4,Individual Investors & Analysts,"[""investment planning"", ""market analysis"", ""portfolio management""]",60,7,2025-10-25 21:53:21,en,What indicators predict {keyword} market movements?,0.85,0.7045719037082067,0.51
40700995,social media,marketing,What demographics respond best to social media?,optimization,Expert,"[""Introduction to social media"", ""Key points and analysis"", ""Practical examples"", ""Expert insights"", ""Action items"", ""Conclusion""]","[""media"", ""promotion"", ""marketing"", ""social"", ""advertising"", ""optimization""]",4,Marketing Directors & CMOs,"[""content marketing"", ""digital marketing"", ""brand management""]",47,7,2025-10-25 21:53:21,en,What demographics respond best to {keyword}?,0.83,1.0,0.59
40700996,machine learning,it,How do you integrate machine learning with existing systems?,optimization,Intermediate,"[""Overview of machine learning"", ""Step-by-step implementation"", ""Best practices and tips"", ""Common challenges and solutions"", ""Tools and resources needed"", ""Conclusion and next steps""]","[""software"", ""it"", ""programming"", ""learning"", ""optimization"", ""machine""]",6,Junior to Mid-level Developers,"[""web development"", ""cybersecurity"", ""data science"", ""cloud computing""]",60,9,2025-10-25 21:53:21,en,How do you integrate {keyword} with existing systems?,0.75,0.7697032817088749,0.53
40700997,social media,marketing,How do you optimize social media for mobile users?,implementation,Expert,"[""Overview of social media"", ""Step-by-step implementation"", ""Best practices and tips"", ""Common challenges and solutions"", ""Tools and resources needed"", ""Conclusion and next steps""]","[""media"", ""implementation"", ""marketing"", ""digital"", ""social"", ""advertising""]",6,Marketing Directors & CMOs,"[""brand management"", ""content marketing"", ""digital marketing""]",50,9,2025-10-25 21:53:21,en,How do you optimize {keyword} for mobile users?,0.76,1.0,0.85
40700998,social media,marketing,What budget should be allocated to social media?,comparison,Beginner,"[""Introduction to social media"", ""Key points and analysis"", ""Practical examples"", ""Expert insights"", ""Action items"", ""Conclusion""]","[""media"", ""promotion"", ""comparison"", ""marketing"", ""social"", ""advertising""]",4,Marketing Students & Interns,"[""content marketing"", ""brand management"", ""digital marketing""]",48,8,2025-10-25 21:53:21,en,What budget should be allocated to {keyword}?,0.71,0.35457659353828125,0.34
40700999,data science,it,How do you troubleshoot common issues with data science?,troubleshooting,Expert,"[""Overview of data science"", ""Step-by-step implementation"", ""Best practices and tips"", ""Common challenges and solutions"", ""Tools and resources needed"", ""Conclusion and next steps""]","[""software"", ""development"", ""it"", ""troubleshooting"", ""science"", ""data""]",6,Architects & Technical Directors,"[""cloud computing"", ""web development"", ""cybersecurity"", ""machine learning""]",56,9,2025-10-25 21:53:21,en,How do you troubleshoot common issues with {keyword}?,0.76,1.0,0.52
40701000,web development,it,How do you design a scalable web development solution?,analysis,Intermediate,"[""Overview of web development"", ""Step-by-step implementation"", ""Best practices and tips"", ""Common challenges and solutions"", ""Tools and resources needed"", ""Conclusion and next steps""]","[""software"", ""development"", ""analysis"", ""it"", ""web""]",6,Junior to Mid-level Developers,"[""cloud computing"", ""data science"", ""machine learning"", ""cybersecurity""]",54,9,2025-10-25 21:53:21,en,How do you design a scalable {keyword} solution?,0.8,0.6913179566633825,0.61
40701001,digital marketing,marketing,How do you measure the ROI of digital marketing campaigns?,optimization,Intermediate,"[""Overview of digital marketing"", ""Step-by-step implementation"", ""Best practices and tips"", ""Common challenges and solutions"", ""Tools and resources needed"", ""Conclusion and next steps""]","[""promotion"", ""marketing"", ""digital"", ""advertising"", ""optimization""]",6,Marketing Coordinators & Specialists,"[""content marketing"", ""social media"", ""brand management""]",58,10,2025-10-25 21:53:21,en,How do you measure the ROI of {keyword} campaigns?,0.93,0.7612541729892042,0.74
