record_id,keyword,category,question,question_type,difficulty_level,answer_outline,tags,estimated_read_time,target_audience,related_topics,question_length,word_count,created_date,language,source_template,engagement_score,complexity_score,popularity_score
38000001,data science,it,How does data science impact business operations?,implementation,Advanced,"[""Introduction to data science"", ""Key points and analysis"", ""Practical examples"", ""Expert insights"", ""Action items"", ""Conclusion""]","[""technology"", ""development"", ""it"", ""implementation"", ""science"", ""data""]",4,Senior Developers & Tech Leads,"[""web development"", ""cloud computing"", ""cybersecurity"", ""machine learning""]",49,7,2025-10-25 21:49:34,en,How does {keyword} impact business operations?,0.94,0.9343215383583265,0.37
38000002,cloud computing,it,How do you troubleshoot common issues with cloud computing?,comparison,Beginner,"[""Overview of cloud computing"", ""Step-by-step implementation"", ""Best practices and tips"", ""Common challenges and solutions"", ""Tools and resources needed"", ""Conclusion and next steps""]","[""computing"", ""software"", ""it"", ""comparison"", ""cloud"", ""technology""]",6,Students & Entry-level Developers,"[""web development"", ""data science"", ""machine learning"", ""cybersecurity""]",59,9,2025-10-25 21:49:34,en,How do you troubleshoot common issues with {keyword}?,0.83,0.3079692625162767,0.74
38000003,portfolio management,economics,What are the seasonal patterns in portfolio management?,planning,Advanced,"[""Introduction to portfolio management"", ""Key concepts and definitions"", ""Main categories or types"", ""Examples and case studies"", ""Benefits and advantages"", ""Summary and recommendations""]","[""planning"", ""finance"", ""portfolio"", ""management"", ""market"", ""economics""]",6,Professional Investors & Advisors,"[""investment planning"", ""financial modeling"", ""market analysis""]",55,8,2025-10-25 21:49:34,en,What are the seasonal patterns in {keyword}?,0.88,0.8925044999619449,0.43
38000004,data science,it,How do you convince stakeholders to invest in data science?,comparison,Beginner,"[""Overview of data science"", ""Step-by-step implementation"", ""Best practices and tips"", ""Common challenges and solutions"", ""Tools and resources needed"", ""Conclusion and next steps""]","[""technology"", ""development"", ""it"", ""comparison"", ""science"", ""data""]",6,Students & Entry-level Developers,"[""machine learning"", ""web development"", ""cloud computing"", ""cybersecurity""]",59,10,2025-10-25 21:49:34,en,How do you convince stakeholders to invest in {keyword}?,0.61,0.32620968884824875,0.88
38000005,data science,it,What skills are needed to master data science?,comparison,Intermediate,"[""Introduction to data science"", ""Key points and analysis"", ""Practical examples"", ""Expert insights"", ""Action items"", ""Conclusion""]","[""technology"", ""development"", ""it"", ""comparison"", ""science"", ""data""]",4,Junior to Mid-level Developers,"[""cybersecurity"", ""machine learning"", ""web development"", ""cloud computing""]",46,8,2025-10-25 21:49:34,en,What skills are needed to master {keyword}?,0.9,0.6567964138478929,0.88
38000006,market analysis,economics,How do you identify opportunities in market analysis markets?,evaluation,Intermediate,"[""Overview of market analysis"", ""Step-by-step implementation"", ""Best practices and tips"", ""Common challenges and solutions"", ""Tools and resources needed"", ""Conclusion and next steps""]","[""investment"", ""analysis"", ""evaluation"", ""market"", ""business"", ""economics""]",6,Individual Investors & Analysts,"[""investment planning"", ""financial modeling"", ""portfolio management""]",61,9,2025-10-25 21:49:34,en,How do you identify opportunities in {keyword} markets?,0.71,0.7589795869246874,0.73
38000007,investment planning,economics,How does global economics impact investment planning?,strategy,Advanced,"[""Introduction to investment planning"", ""Key points and analysis"", ""Practical examples"", ""Expert insights"", ""Action items"", ""Conclusion""]","[""investment"", ""planning"", ""finance"", ""business"", ""strategy"", ""economics""]",4,Professional Investors & Advisors,"[""portfolio management"", ""financial modeling"", ""market analysis""]",53,7,2025-10-25 21:49:34,en,How does global economics impact {keyword}?,0.84,0.9021937237396724,0.74
38000008,digital marketing,marketing,How do you improve digital marketing conversion rates?,troubleshooting,Beginner,"[""Overview of digital marketing"", ""Step-by-step implementation"", ""Best practices and tips"", ""Common challenges and solutions"", ""Tools and resources needed"", ""Conclusion and next steps""]","[""promotion"", ""troubleshooting"", ""marketing"", ""digital"", ""branding""]",6,Marketing Students & Interns,"[""brand management"", ""social media"", ""content marketing""]",54,8,2025-10-25 21:49:34,en,How do you improve {keyword} conversion rates?,0.68,0.4637067541481086,0.42
38000009,digital marketing,marketing,How is AI changing digital marketing approaches?,evaluation,Expert,"[""Introduction to digital marketing"", ""Key points and analysis"", ""Practical examples"", ""Expert insights"", ""Action items"", ""Conclusion""]","[""evaluation"", ""marketing"", ""advertising"", ""digital""]",4,Marketing Directors & CMOs,"[""social media"", ""content marketing"", ""brand management""]",48,7,2025-10-25 21:49:34,en,How is AI changing {keyword} approaches?,0.95,1.0,0.82
38000010,cybersecurity,it,How do you get started with cybersecurity as a beginner?,how_to,Advanced,"[""Overview of cybersecurity"", ""Step-by-step implementation"", ""Best practices and tips"", ""Common challenges and solutions"", ""Tools and resources needed"", ""Conclusion and next steps""]","[""how_to"", ""software"", ""it"", ""cybersecurity"", ""technology""]",5,Senior Developers & Tech Leads,"[""machine learning"", ""data science"", ""web development"", ""cloud computing""]",56,10,2025-10-25 21:49:34,en,How do you get started with {keyword} as a beginner?,0.65,0.9534488605469379,0.46
38000011,cloud computing,it,What career opportunities exist in cloud computing?,comparison,Expert,"[""Introduction to cloud computing"", ""Key points and analysis"", ""Practical examples"", ""Expert insights"", ""Action items"", ""Conclusion""]","[""computing"", ""it"", ""comparison"", ""programming"", ""cloud"", ""technology""]",4,Architects & Technical Directors,"[""web development"", ""machine learning"", ""cybersecurity"", ""data science""]",51,7,2025-10-25 21:49:34,en,What career opportunities exist in {keyword}?,0.77,1.0,0.73
38000012,digital marketing,marketing,What does the future hold for digital marketing?,comparison,Expert,"[""Introduction to digital marketing"", ""Key points and analysis"", ""Practical examples"", ""Expert insights"", ""Action items"", ""Conclusion""]","[""comparison"", ""marketing"", ""digital"", ""advertising"", ""branding""]",4,Marketing Directors & CMOs,"[""brand management"", ""social media"", ""content marketing""]",48,8,2025-10-25 21:49:34,en,What does the future hold for {keyword}?,0.88,1.0,0.55
38000013,brand management,marketing,How do you reach new customers through brand management?,evaluation,Advanced,"[""Overview of brand management"", ""Step-by-step implementation"", ""Best practices and tips"", ""Common challenges and solutions"", ""Tools and resources needed"", ""Conclusion and next steps""]","[""promotion"", ""marketing"", ""management"", ""digital"", ""evaluation"", ""brand""]",6,Marketing Managers & Strategists,"[""social media"", ""content marketing"", ""digital marketing""]",56,9,2025-10-25 21:49:34,en,How do you reach new customers through {keyword}?,0.64,0.8556242968826107,0.64
38000014,investment planning,economics,What is the optimal allocation for investment planning in a portfolio?,best_practice,Beginner,"[""Introduction to investment planning"", ""Key points and analysis"", ""Practical examples"", ""Expert insights"", ""Action items"", ""Conclusion""]","[""investment"", ""planning"", ""best_practice"", ""market"", ""business"", ""economics""]",4,Students & New Investors,"[""market analysis"", ""portfolio management"", ""financial modeling""]",70,11,2025-10-25 21:49:34,en,What is the optimal allocation for {keyword} in a portfolio?,0.73,0.38810974565645356,0.4
38000015,cloud computing,it,What is the recommended architecture for cloud computing systems?,strategy,Beginner,"[""Introduction to cloud computing"", ""Key points and analysis"", ""Practical examples"", ""Expert insights"", ""Action items"", ""Conclusion""]","[""computing"", ""software"", ""cloud"", ""it"", ""programming"", ""strategy""]",4,Students & Entry-level Developers,"[""cybersecurity"", ""web development"", ""machine learning"", ""data science""]",65,9,2025-10-25 21:49:34,en,What is the recommended architecture for {keyword} systems?,0.65,0.4804088701123399,0.6
38000016,social media,marketing,What A/B tests should you run for social media?,comparison,Advanced,"[""Introduction to social media"", ""Key points and analysis"", ""Practical examples"", ""Expert insights"", ""Action items"", ""Conclusion""]","[""media"", ""comparison"", ""marketing"", ""digital"", ""social"", ""advertising""]",4,Marketing Managers & Strategists,"[""brand management"", ""digital marketing"", ""content marketing""]",47,9,2025-10-25 21:49:34,en,What A/B tests should you run for {keyword}?,0.94,0.9478113294109406,0.64
38000017,machine learning,it,How do you get started with machine learning as a beginner?,implementation,Advanced,"[""Overview of machine learning"", ""Step-by-step implementation"", ""Best practices and tips"", ""Common challenges and solutions"", ""Tools and resources needed"", ""Conclusion and next steps""]","[""software"", ""development"", ""it"", ""implementation"", ""learning"", ""machine""]",6,Senior Developers & Tech Leads,"[""data science"", ""web development"", ""cloud computing"", ""cybersecurity""]",59,11,2025-10-25 21:49:34,en,How do you get started with {keyword} as a beginner?,0.82,0.8211048024538354,0.87
38000018,market analysis,economics,What metrics are most important for market analysis?,evaluation,Intermediate,"[""Introduction to market analysis"", ""Key points and analysis"", ""Practical examples"", ""Expert insights"", ""Action items"", ""Conclusion""]","[""investment"", ""analysis"", ""evaluation"", ""market"", ""economics""]",4,Individual Investors & Analysts,"[""portfolio management"", ""financial modeling"", ""investment planning""]",52,8,2025-10-25 21:49:34,en,What metrics are most important for {keyword}?,0.79,0.6763853916587736,0.66
38000019,financial modeling,economics,How do you analyze market trends in financial modeling?,analysis,Advanced,"[""Overview of financial modeling"", ""Step-by-step implementation"", ""Best practices and tips"", ""Common challenges and solutions"", ""Tools and resources needed"", ""Conclusion and next steps""]","[""investment"", ""analysis"", ""finance"", ""modeling"", ""financial"", ""economics""]",6,Professional Investors & Advisors,"[""portfolio management"", ""investment planning"", ""market analysis""]",55,9,2025-10-25 21:49:34,en,How do you analyze market trends in {keyword}?,0.64,0.8140325431599493,0.68
38000020,machine learning,it,How do you design a scalable machine learning solution?,how_to,Intermediate,"[""Overview of machine learning"", ""Step-by-step implementation"", ""Best practices and tips"", ""Common challenges and solutions"", ""Tools and resources needed"", ""Conclusion and next steps""]","[""how_to"", ""development"", ""it"", ""programming"", ""learning"", ""machine""]",6,Junior to Mid-level Developers,"[""cybersecurity"", ""data science"", ""web development"", ""cloud computing""]",55,9,2025-10-25 21:49:34,en,How do you design a scalable {keyword} solution?,0.91,0.7481866274572564,0.43
38000021,market analysis,economics,What exit strategies should be considered for market analysis?,implementation,Expert,"[""Introduction to market analysis"", ""Key points and analysis"", ""Practical examples"", ""Expert insights"", ""Action items"", ""Conclusion""]","[""investment"", ""finance"", ""analysis"", ""implementation"", ""market"", ""economics""]",4,Portfolio Managers & Financial Experts,"[""financial modeling"", ""investment planning"", ""portfolio management""]",62,9,2025-10-25 21:49:34,en,What exit strategies should be considered for {keyword}?,0.68,1.0,0.45
38000022,digital marketing,marketing,How do you personalize digital marketing for different segments?,implementation,Intermediate,"[""Overview of digital marketing"", ""Step-by-step implementation"", ""Best practices and tips"", ""Common challenges and solutions"", ""Tools and resources needed"", ""Conclusion and next steps""]","[""implementation"", ""promotion"", ""marketing"", ""digital"", ""advertising""]",6,Marketing Coordinators & Specialists,"[""social media"", ""brand management"", ""content marketing""]",64,9,2025-10-25 21:49:34,en,How do you personalize {keyword} for different segments?,0.95,0.7561620416082381,0.71
38000023,content marketing,marketing,What A/B tests should you run for content marketing?,strategy,Expert,"[""Introduction to content marketing"", ""Key points and analysis"", ""Practical examples"", ""Expert insights"", ""Action items"", ""Conclusion""]","[""content"", ""promotion"", ""marketing"", ""advertising"", ""strategy""]",4,Marketing Directors & CMOs,"[""digital marketing"", ""social media"", ""brand management""]",52,9,2025-10-25 21:49:34,en,What A/B tests should you run for {keyword}?,0.94,1.0,0.55
38000024,web development,it,How do you choose the right technology stack for web development?,implementation,Expert,"[""Overview of web development"", ""Step-by-step implementation"", ""Best practices and tips"", ""Common challenges and solutions"", ""Tools and resources needed"", ""Conclusion and next steps""]","[""development"", ""it"", ""implementation"", ""programming"", ""web""]",6,Architects & Technical Directors,"[""machine learning"", ""cloud computing"", ""data science"", ""cybersecurity""]",65,11,2025-10-25 21:49:34,en,How do you choose the right technology stack for {keyword}?,0.69,1.0,0.43
38000025,brand management,marketing,How do you automate brand management processes?,implementation,Intermediate,"[""Overview of brand management"", ""Step-by-step implementation"", ""Best practices and tips"", ""Common challenges and solutions"", ""Tools and resources needed"", ""Conclusion and next steps""]","[""implementation"", ""marketing"", ""digital"", ""management"", ""advertising"", ""brand""]",6,Marketing Coordinators & Specialists,"[""social media"", ""digital marketing"", ""content marketing""]",47,7,2025-10-25 21:49:34,en,How do you automate {keyword} processes?,0.73,0.7213074941147802,0.65
38000026,investment planning,economics,How do you diversify your portfolio using investment planning?,analysis,Intermediate,"[""Overview of investment planning"", ""Step-by-step implementation"", ""Best practices and tips"", ""Common challenges and solutions"", ""Tools and resources needed"", ""Conclusion and next steps""]","[""investment"", ""planning"", ""finance"", ""analysis"", ""market"", ""economics""]",6,Individual Investors & Analysts,"[""market analysis"", ""financial modeling"", ""portfolio management""]",62,9,2025-10-25 21:49:34,en,How do you diversify your portfolio using {keyword}?,0.9,0.7761491113370257,0.8
38000027,machine learning,it,How do you measure the success of machine learning projects?,evaluation,Advanced,"[""Overview of machine learning"", ""Step-by-step implementation"", ""Best practices and tips"", ""Common challenges and solutions"", ""Tools and resources needed"", ""Conclusion and next steps""]","[""development"", ""it"", ""learning"", ""evaluation"", ""machine"", ""technology""]",6,Senior Developers & Tech Leads,"[""data science"", ""cloud computing"", ""web development"", ""cybersecurity""]",60,10,2025-10-25 21:49:34,en,How do you measure the success of {keyword} projects?,0.73,0.8019428055965236,0.37
38000028,cloud computing,it,How do you optimize cloud computing for different platforms?,strategy,Advanced,"[""Overview of cloud computing"", ""Step-by-step implementation"", ""Best practices and tips"", ""Common challenges and solutions"", ""Tools and resources needed"", ""Conclusion and next steps""]","[""computing"", ""cloud"", ""software"", ""it"", ""strategy"", ""technology""]",6,Senior Developers & Tech Leads,"[""data science"", ""web development"", ""machine learning"", ""cybersecurity""]",60,9,2025-10-25 21:49:34,en,How do you optimize {keyword} for different platforms?,0.83,0.8809314017763953,0.45
38000029,data science,it,How do you stay updated with data science developments?,troubleshooting,Beginner,"[""Overview of data science"", ""Step-by-step implementation"", ""Best practices and tips"", ""Common challenges and solutions"", ""Tools and resources needed"", ""Conclusion and next steps""]","[""software"", ""development"", ""it"", ""troubleshooting"", ""science"", ""data""]",6,Students & Entry-level Developers,"[""web development"", ""cybersecurity"", ""machine learning"", ""cloud computing""]",55,9,2025-10-25 21:49:34,en,How do you stay updated with {keyword} developments?,0.82,0.38117965849701374,0.74
38000030,social media,marketing,What tools are essential for social media analytics?,how_to,Beginner,"[""Introduction to social media"", ""Key points and analysis"", ""Practical examples"", ""Expert insights"", ""Action items"", ""Conclusion""]","[""how_to"", ""media"", ""marketing"", ""digital"", ""social"", ""branding""]",4,Marketing Students & Interns,"[""content marketing"", ""digital marketing"", ""brand management""]",52,8,2025-10-25 21:49:34,en,What tools are essential for {keyword} analytics?,0.77,0.4636472965086176,0.85
38000031,social media,marketing,How do you improve social media conversion rates?,evaluation,Intermediate,"[""Overview of social media"", ""Step-by-step implementation"", ""Best practices and tips"", ""Common challenges and solutions"", ""Tools and resources needed"", ""Conclusion and next steps""]","[""media"", ""marketing"", ""digital"", ""social"", ""branding"", ""evaluation""]",6,Marketing Coordinators & Specialists,"[""digital marketing"", ""brand management"", ""content marketing""]",49,8,2025-10-25 21:49:34,en,How do you improve {keyword} conversion rates?,0.9,0.6781688840556718,0.67
38000032,social media,marketing,How is AI changing social media approaches?,analysis,Intermediate,"[""Introduction to social media"", ""Key points and analysis"", ""Practical examples"", ""Expert insights"", ""Action items"", ""Conclusion""]","[""analysis"", ""media"", ""promotion"", ""marketing"", ""digital"", ""social""]",4,Marketing Coordinators & Specialists,"[""brand management"", ""content marketing"", ""digital marketing""]",43,7,2025-10-25 21:49:34,en,How is AI changing {keyword} approaches?,0.71,0.7454147831783331,0.74
38000033,portfolio management,economics,What are the regulatory considerations for portfolio management?,analysis,Intermediate,"[""Introduction to portfolio management"", ""Key concepts and definitions"", ""Main categories or types"", ""Examples and case studies"", ""Benefits and advantages"", ""Summary and recommendations""]","[""investment"", ""analysis"", ""portfolio"", ""management"", ""business"", ""economics""]",6,Individual Investors & Analysts,"[""market analysis"", ""investment planning"", ""financial modeling""]",64,8,2025-10-25 21:49:34,en,What are the regulatory considerations for {keyword}?,0.66,0.6240064561246194,0.42
38000034,web development,it,Which frameworks support web development implementation?,comparison,Advanced,"[""Introduction to web development"", ""Key points and analysis"", ""Practical examples"", ""Expert insights"", ""Action items"", ""Conclusion""]","[""development"", ""it"", ""comparison"", ""programming"", ""web""]",4,Senior Developers & Tech Leads,"[""machine learning"", ""cloud computing"", ""data science"", ""cybersecurity""]",56,6,2025-10-25 21:49:34,en,Which frameworks support {keyword} implementation?,0.71,0.8802997245912877,0.52
38000035,data science,it,What are the best practices for data science development?,evaluation,Beginner,"[""Introduction to data science"", ""Key concepts and definitions"", ""Main categories or types"", ""Examples and case studies"", ""Benefits and advantages"", ""Summary and recommendations""]","[""technology"", ""it"", ""programming"", ""science"", ""evaluation"", ""data""]",6,Students & Entry-level Developers,"[""cybersecurity"", ""web development"", ""cloud computing"", ""machine learning""]",57,9,2025-10-25 21:49:34,en,What are the best practices for {keyword} development?,0.95,0.45240790899693006,0.54
38000036,data science,it,How do you troubleshoot common issues with data science?,troubleshooting,Intermediate,"[""Overview of data science"", ""Step-by-step implementation"", ""Best practices and tips"", ""Common challenges and solutions"", ""Tools and resources needed"", ""Conclusion and next steps""]","[""technology"", ""software"", ""it"", ""troubleshooting"", ""science"", ""data""]",6,Junior to Mid-level Developers,"[""machine learning"", ""cybersecurity"", ""web development"", ""cloud computing""]",56,9,2025-10-25 21:49:34,en,How do you troubleshoot common issues with {keyword}?,0.86,0.7336570980038137,0.42
38000037,financial modeling,economics,What is the optimal allocation for financial modeling in a portfolio?,how_to,Intermediate,"[""Introduction to financial modeling"", ""Key points and analysis"", ""Practical examples"", ""Expert insights"", ""Action items"", ""Conclusion""]","[""how_to"", ""finance"", ""modeling"", ""financial"", ""market"", ""economics""]",4,Individual Investors & Analysts,"[""market analysis"", ""portfolio management"", ""investment planning""]",69,11,2025-10-25 21:49:34,en,What is the optimal allocation for {keyword} in a portfolio?,0.91,0.7660414877719836,0.69
38000038,digital marketing,marketing,What content types work best for digital marketing?,implementation,Expert,"[""Introduction to digital marketing"", ""Key points and analysis"", ""Practical examples"", ""Expert insights"", ""Action items"", ""Conclusion""]","[""implementation"", ""promotion"", ""marketing"", ""digital"", ""advertising""]",4,Marketing Directors & CMOs,"[""social media"", ""brand management"", ""content marketing""]",51,8,2025-10-25 21:49:34,en,What content types work best for {keyword}?,0.62,1.0,0.38
38000039,market analysis,economics,What factors should be considered when evaluating market analysis?,optimization,Intermediate,"[""Introduction to market analysis"", ""Key points and analysis"", ""Practical examples"", ""Expert insights"", ""Action items"", ""Conclusion""]","[""analysis"", ""business"", ""market"", ""optimization"", ""economics""]",4,Individual Investors & Analysts,"[""investment planning"", ""financial modeling"", ""portfolio management""]",66,9,2025-10-25 21:49:34,en,What factors should be considered when evaluating {keyword}?,0.64,0.6650144150171066,0.65
38000040,social media,marketing,How is AI changing social media approaches?,troubleshooting,Advanced,"[""Introduction to social media"", ""Key points and analysis"", ""Practical examples"", ""Expert insights"", ""Action items"", ""Conclusion""]","[""media"", ""promotion"", ""troubleshooting"", ""marketing"", ""digital"", ""social""]",4,Marketing Managers & Strategists,"[""digital marketing"", ""brand management"", ""content marketing""]",43,7,2025-10-25 21:49:34,en,How is AI changing {keyword} approaches?,0.68,0.974979078400753,0.37
38000041,financial modeling,economics,What are the regulatory considerations for financial modeling?,troubleshooting,Intermediate,"[""Introduction to financial modeling"", ""Key concepts and definitions"", ""Main categories or types"", ""Examples and case studies"", ""Benefits and advantages"", ""Summary and recommendations""]","[""investment"", ""finance"", ""troubleshooting"", ""modeling"", ""financial"", ""economics""]",6,Individual Investors & Analysts,"[""investment planning"", ""market analysis"", ""portfolio management""]",62,8,2025-10-25 21:49:34,en,What are the regulatory considerations for {keyword}?,0.95,0.7477029768494432,0.66
38000042,brand management,marketing,How do you reach new customers through brand management?,optimization,Intermediate,"[""Overview of brand management"", ""Step-by-step implementation"", ""Best practices and tips"", ""Common challenges and solutions"", ""Tools and resources needed"", ""Conclusion and next steps""]","[""promotion"", ""marketing"", ""management"", ""branding"", ""optimization"", ""brand""]",6,Marketing Coordinators & Specialists,"[""social media"", ""digital marketing"", ""content marketing""]",56,9,2025-10-25 21:49:34,en,How do you reach new customers through {keyword}?,0.62,0.6168390586813833,0.36
38000043,portfolio management,economics,How do you analyze market trends in portfolio management?,planning,Intermediate,"[""Overview of portfolio management"", ""Step-by-step implementation"", ""Best practices and tips"", ""Common challenges and solutions"", ""Tools and resources needed"", ""Conclusion and next steps""]","[""planning"", ""finance"", ""portfolio"", ""management"", ""business"", ""economics""]",6,Individual Investors & Analysts,"[""market analysis"", ""financial modeling"", ""investment planning""]",57,9,2025-10-25 21:49:34,en,How do you analyze market trends in {keyword}?,0.67,0.7668822686785465,0.41
