record_id,keyword,category,question,question_type,difficulty_level,answer_outline,tags,estimated_read_time,target_audience,related_topics,question_length,word_count,created_date,language,source_template,engagement_score,complexity_score,popularity_score
38600958,social media,marketing,How do you optimize social media for mobile users?,how_to,Beginner,"[""Overview of social media"", ""Step-by-step implementation"", ""Best practices and tips"", ""Common challenges and solutions"", ""Tools and resources needed"", ""Conclusion and next steps""]","[""how_to"", ""media"", ""promotion"", ""marketing"", ""social"", ""branding""]",6,Marketing Students & Interns,"[""digital marketing"", ""brand management"", ""content marketing""]",50,9,2025-10-25 21:50:23,en,How do you optimize {keyword} for mobile users?,0.62,0.43757552974633673,0.41
38600959,data science,it,How do you implement data science in a production environment?,comparison,Intermediate,"[""Overview of data science"", ""Step-by-step implementation"", ""Best practices and tips"", ""Common challenges and solutions"", ""Tools and resources needed"", ""Conclusion and next steps""]","[""development"", ""it"", ""comparison"", ""programming"", ""science"", ""data""]",6,Junior to Mid-level Developers,"[""machine learning"", ""cybersecurity"", ""cloud computing"", ""web development""]",62,10,2025-10-25 21:50:23,en,How do you implement {keyword} in a production environment?,0.74,0.6765327516949562,0.68
38600960,content marketing,marketing,How do you improve content marketing conversion rates?,analysis,Intermediate,"[""Overview of content marketing"", ""Step-by-step implementation"", ""Best practices and tips"", ""Common challenges and solutions"", ""Tools and resources needed"", ""Conclusion and next steps""]","[""content"", ""analysis"", ""promotion"", ""marketing"", ""advertising""]",6,Marketing Coordinators & Specialists,"[""social media"", ""digital marketing"", ""brand management""]",54,8,2025-10-25 21:50:23,en,How do you improve {keyword} conversion rates?,0.72,0.6885343232961754,0.9
38600961,investment planning,economics,How do you benchmark investment planning against alternatives?,evaluation,Intermediate,"[""Overview of investment planning"", ""Step-by-step implementation"", ""Best practices and tips"", ""Common challenges and solutions"", ""Tools and resources needed"", ""Conclusion and next steps""]","[""investment"", ""planning"", ""evaluation"", ""market"", ""business"", ""economics""]",6,Individual Investors & Analysts,"[""financial modeling"", ""portfolio management"", ""market analysis""]",62,8,2025-10-25 21:50:23,en,How do you benchmark {keyword} against alternatives?,0.84,0.7390784448607478,0.64
38600962,financial modeling,economics,How do you benchmark financial modeling against alternatives?,troubleshooting,Expert,"[""Overview of financial modeling"", ""Step-by-step implementation"", ""Best practices and tips"", ""Common challenges and solutions"", ""Tools and resources needed"", ""Conclusion and next steps""]","[""troubleshooting"", ""modeling"", ""financial"", ""market"", ""business"", ""economics""]",6,Portfolio Managers & Financial Experts,"[""portfolio management"", ""investment planning"", ""market analysis""]",61,8,2025-10-25 21:50:23,en,How do you benchmark {keyword} against alternatives?,0.81,1.0,0.47
38600963,web development,it,What tools are essential for web development development?,planning,Beginner,"[""Introduction to web development"", ""Key points and analysis"", ""Practical examples"", ""Expert insights"", ""Action items"", ""Conclusion""]","[""planning"", ""development"", ""web"", ""it"", ""programming"", ""technology""]",4,Students & Entry-level Developers,"[""machine learning"", ""cybersecurity"", ""cloud computing"", ""data science""]",57,8,2025-10-25 21:50:23,en,What tools are essential for {keyword} development?,0.89,0.3243526692266899,0.8
38600964,market analysis,economics,What exit strategies should be considered for market analysis?,optimization,Advanced,"[""Introduction to market analysis"", ""Key points and analysis"", ""Practical examples"", ""Expert insights"", ""Action items"", ""Conclusion""]","[""investment"", ""analysis"", ""business"", ""market"", ""optimization"", ""economics""]",4,Professional Investors & Advisors,"[""financial modeling"", ""investment planning"", ""portfolio management""]",62,9,2025-10-25 21:50:23,en,What exit strategies should be considered for {keyword}?,0.71,0.8894478412888301,0.31
38600965,cloud computing,it,What is the recommended architecture for cloud computing systems?,analysis,Intermediate,"[""Introduction to cloud computing"", ""Key points and analysis"", ""Practical examples"", ""Expert insights"", ""Action items"", ""Conclusion""]","[""computing"", ""software"", ""analysis"", ""it"", ""cloud"", ""technology""]",4,Junior to Mid-level Developers,"[""machine learning"", ""web development"", ""cybersecurity"", ""data science""]",65,9,2025-10-25 21:50:23,en,What is the recommended architecture for {keyword} systems?,0.77,0.6257740618589659,0.84
38600966,brand management,marketing,How do you measure the ROI of brand management campaigns?,comparison,Intermediate,"[""Overview of brand management"", ""Step-by-step implementation"", ""Best practices and tips"", ""Common challenges and solutions"", ""Tools and resources needed"", ""Conclusion and next steps""]","[""promotion"", ""comparison"", ""marketing"", ""management"", ""advertising"", ""brand""]",6,Marketing Coordinators & Specialists,"[""social media"", ""digital marketing"", ""content marketing""]",57,10,2025-10-25 21:50:23,en,How do you measure the ROI of {keyword} campaigns?,0.7,0.6208029790536191,0.31
38600967,social media,marketing,How do you attribute success to social media efforts?,implementation,Expert,"[""Overview of social media"", ""Step-by-step implementation"", ""Best practices and tips"", ""Common challenges and solutions"", ""Tools and resources needed"", ""Conclusion and next steps""]","[""media"", ""implementation"", ""marketing"", ""social"", ""advertising"", ""branding""]",6,Marketing Directors & CMOs,"[""digital marketing"", ""content marketing"", ""brand management""]",53,9,2025-10-25 21:50:23,en,How do you attribute success to {keyword} efforts?,0.86,1.0,0.84
38600968,machine learning,it,How does machine learning impact business operations?,strategy,Beginner,"[""Introduction to machine learning"", ""Key points and analysis"", ""Practical examples"", ""Expert insights"", ""Action items"", ""Conclusion""]","[""software"", ""it"", ""programming"", ""learning"", ""strategy"", ""machine""]",4,Students & Entry-level Developers,"[""web development"", ""data science"", ""cloud computing"", ""cybersecurity""]",53,7,2025-10-25 21:50:23,en,How does {keyword} impact business operations?,0.92,0.41572593510622496,0.77
38600969,brand management,marketing,How do you optimize brand management for mobile users?,troubleshooting,Expert,"[""Overview of brand management"", ""Step-by-step implementation"", ""Best practices and tips"", ""Common challenges and solutions"", ""Tools and resources needed"", ""Conclusion and next steps""]","[""troubleshooting"", ""marketing"", ""management"", ""advertising"", ""branding"", ""brand""]",6,Marketing Directors & CMOs,"[""social media"", ""content marketing"", ""digital marketing""]",54,9,2025-10-25 21:50:23,en,How do you optimize {keyword} for mobile users?,0.66,1.0,0.34
38600970,portfolio management,economics,What are the seasonal patterns in portfolio management?,evaluation,Expert,"[""Introduction to portfolio management"", ""Key concepts and definitions"", ""Main categories or types"", ""Examples and case studies"", ""Benefits and advantages"", ""Summary and recommendations""]","[""finance"", ""portfolio"", ""management"", ""evaluation"", ""market"", ""economics""]",6,Portfolio Managers & Financial Experts,"[""market analysis"", ""investment planning"", ""financial modeling""]",55,8,2025-10-25 21:50:23,en,What are the seasonal patterns in {keyword}?,0.68,1.0,0.48
38600971,financial modeling,economics,How do you diversify your portfolio using financial modeling?,evaluation,Expert,"[""Overview of financial modeling"", ""Step-by-step implementation"", ""Best practices and tips"", ""Common challenges and solutions"", ""Tools and resources needed"", ""Conclusion and next steps""]","[""investment"", ""modeling"", ""financial"", ""evaluation"", ""business"", ""economics""]",6,Portfolio Managers & Financial Experts,"[""market analysis"", ""investment planning"", ""portfolio management""]",61,9,2025-10-25 21:50:23,en,How do you diversify your portfolio using {keyword}?,0.9,1.0,0.56
38600972,market analysis,economics,What insurance options are available for market analysis?,best_practice,Beginner,"[""Introduction to market analysis"", ""Key points and analysis"", ""Practical examples"", ""Expert insights"", ""Action items"", ""Conclusion""]","[""analysis"", ""finance"", ""best_practice"", ""market"", ""business"", ""economics""]",4,Students & New Investors,"[""investment planning"", ""financial modeling"", ""portfolio management""]",57,8,2025-10-25 21:50:23,en,What insurance options are available for {keyword}?,0.67,0.4612316573208518,0.78
38600973,cloud computing,it,How do you convince stakeholders to invest in cloud computing?,best_practice,Expert,"[""Overview of cloud computing"", ""Step-by-step implementation"", ""Best practices and tips"", ""Common challenges and solutions"", ""Tools and resources needed"", ""Conclusion and next steps""]","[""computing"", ""development"", ""it"", ""best_practice"", ""cloud"", ""technology""]",6,Architects & Technical Directors,"[""data science"", ""web development"", ""machine learning"", ""cybersecurity""]",62,10,2025-10-25 21:50:23,en,How do you convince stakeholders to invest in {keyword}?,0.84,1.0,0.82
38600974,portfolio management,economics,How do you assess and manage portfolio management risks?,how_to,Beginner,"[""Overview of portfolio management"", ""Step-by-step implementation"", ""Best practices and tips"", ""Common challenges and solutions"", ""Tools and resources needed"", ""Conclusion and next steps""]","[""how_to"", ""finance"", ""portfolio"", ""management"", ""market"", ""economics""]",6,Students & New Investors,"[""market analysis"", ""financial modeling"", ""investment planning""]",56,9,2025-10-25 21:50:23,en,How do you assess and manage {keyword} risks?,0.72,0.3276061737681483,0.38
38600975,social media,marketing,How do you measure the ROI of social media campaigns?,implementation,Advanced,"[""Overview of social media"", ""Step-by-step implementation"", ""Best practices and tips"", ""Common challenges and solutions"", ""Tools and resources needed"", ""Conclusion and next steps""]","[""media"", ""implementation"", ""marketing"", ""digital"", ""social"", ""branding""]",6,Marketing Managers & Strategists,"[""brand management"", ""digital marketing"", ""content marketing""]",53,10,2025-10-25 21:50:23,en,How do you measure the ROI of {keyword} campaigns?,0.85,0.9679486164079948,0.77
38600976,digital marketing,marketing,How do you attribute success to digital marketing efforts?,how_to,Advanced,"[""Overview of digital marketing"", ""Step-by-step implementation"", ""Best practices and tips"", ""Common challenges and solutions"", ""Tools and resources needed"", ""Conclusion and next steps""]","[""marketing"", ""promotion"", ""how_to"", ""digital""]",6,Marketing Managers & Strategists,"[""social media"", ""brand management"", ""content marketing""]",58,9,2025-10-25 21:50:23,en,How do you attribute success to {keyword} efforts?,0.84,0.9306206772382155,0.78
38600977,cybersecurity,it,What are the key components of a cybersecurity implementation?,comparison,Advanced,"[""Introduction to cybersecurity"", ""Key concepts and definitions"", ""Main categories or types"", ""Examples and case studies"", ""Benefits and advantages"", ""Summary and recommendations""]","[""software"", ""it"", ""comparison"", ""cybersecurity"", ""technology""]",5,Senior Developers & Tech Leads,"[""web development"", ""cloud computing"", ""machine learning"", ""data science""]",62,9,2025-10-25 21:50:23,en,What are the key components of a {keyword} implementation?,0.63,0.8310356862152494,0.39
38600978,machine learning,it,What skills are needed to master machine learning?,strategy,Beginner,"[""Introduction to machine learning"", ""Key points and analysis"", ""Practical examples"", ""Expert insights"", ""Action items"", ""Conclusion""]","[""development"", ""it"", ""programming"", ""learning"", ""strategy"", ""machine""]",4,Students & Entry-level Developers,"[""cybersecurity"", ""data science"", ""web development"", ""cloud computing""]",50,8,2025-10-25 21:50:23,en,What skills are needed to master {keyword}?,0.78,0.3707909297769025,0.62
38600979,web development,it,What is the recommended architecture for web development systems?,optimization,Intermediate,"[""Introduction to web development"", ""Key points and analysis"", ""Practical examples"", ""Expert insights"", ""Action items"", ""Conclusion""]","[""development"", ""it"", ""programming"", ""optimization"", ""web""]",4,Junior to Mid-level Developers,"[""data science"", ""cloud computing"", ""machine learning"", ""cybersecurity""]",65,9,2025-10-25 21:50:23,en,What is the recommended architecture for {keyword} systems?,0.85,0.7261663912806557,0.71
38600980,digital marketing,marketing,How do you automate digital marketing processes?,analysis,Intermediate,"[""Overview of digital marketing"", ""Step-by-step implementation"", ""Best practices and tips"", ""Common challenges and solutions"", ""Tools and resources needed"", ""Conclusion and next steps""]","[""analysis"", ""marketing"", ""digital"", ""advertising"", ""branding""]",6,Marketing Coordinators & Specialists,"[""social media"", ""brand management"", ""content marketing""]",48,7,2025-10-25 21:50:23,en,How do you automate {keyword} processes?,0.79,0.6113100769144069,0.67
38600981,brand management,marketing,How do you develop an effective brand management strategy?,analysis,Expert,"[""Overview of brand management"", ""Step-by-step implementation"", ""Best practices and tips"", ""Common challenges and solutions"", ""Tools and resources needed"", ""Conclusion and next steps""]","[""analysis"", ""promotion"", ""marketing"", ""management"", ""branding"", ""brand""]",6,Marketing Directors & CMOs,"[""content marketing"", ""digital marketing"", ""social media""]",58,9,2025-10-25 21:50:23,en,How do you develop an effective {keyword} strategy?,0.93,1.0,0.34
38600982,brand management,marketing,How do you automate brand management processes?,strategy,Beginner,"[""Overview of brand management"", ""Step-by-step implementation"", ""Best practices and tips"", ""Common challenges and solutions"", ""Tools and resources needed"", ""Conclusion and next steps""]","[""promotion"", ""marketing"", ""management"", ""advertising"", ""strategy"", ""brand""]",6,Marketing Students & Interns,"[""content marketing"", ""digital marketing"", ""social media""]",47,7,2025-10-25 21:50:23,en,How do you automate {keyword} processes?,0.93,0.3706254672726841,0.37
38600983,brand management,marketing,What emerging platforms support brand management?,planning,Advanced,"[""Introduction to brand management"", ""Key points and analysis"", ""Practical examples"", ""Expert insights"", ""Action items"", ""Conclusion""]","[""planning"", ""marketing"", ""management"", ""advertising"", ""branding"", ""brand""]",4,Marketing Managers & Strategists,"[""content marketing"", ""digital marketing"", ""social media""]",49,6,2025-10-25 21:50:23,en,What emerging platforms support {keyword}?,0.63,0.8594665773957889,0.43
38600984,cybersecurity,it,What security considerations should be taken when using cybersecurity?,optimization,Expert,"[""Introduction to cybersecurity"", ""Key points and analysis"", ""Practical examples"", ""Expert insights"", ""Action items"", ""Conclusion""]","[""software"", ""it"", ""optimization"", ""cybersecurity"", ""technology""]",4,Architects & Technical Directors,"[""web development"", ""data science"", ""cloud computing"", ""machine learning""]",70,9,2025-10-25 21:50:23,en,What security considerations should be taken when using {keyword}?,0.68,1.0,0.78
38600985,data science,it,How do you design a scalable data science solution?,analysis,Intermediate,"[""Overview of data science"", ""Step-by-step implementation"", ""Best practices and tips"", ""Common challenges and solutions"", ""Tools and resources needed"", ""Conclusion and next steps""]","[""software"", ""development"", ""analysis"", ""it"", ""science"", ""data""]",6,Junior to Mid-level Developers,"[""cybersecurity"", ""web development"", ""cloud computing"", ""machine learning""]",51,9,2025-10-25 21:50:23,en,How do you design a scalable {keyword} solution?,0.85,0.6874459049556821,0.83
38600986,cybersecurity,it,How can cybersecurity improve system performance and scalability?,evaluation,Advanced,"[""Introduction to cybersecurity"", ""Key points and analysis"", ""Practical examples"", ""Expert insights"", ""Action items"", ""Conclusion""]","[""it"", ""programming"", ""evaluation"", ""cybersecurity"", ""technology""]",4,Senior Developers & Tech Leads,"[""machine learning"", ""data science"", ""cloud computing"", ""web development""]",65,8,2025-10-25 21:50:23,en,How can {keyword} improve system performance and scalability?,0.92,0.8051332429177714,0.3
38600987,portfolio management,economics,How do you hedge against portfolio management market downturns?,strategy,Beginner,"[""Overview of portfolio management"", ""Step-by-step implementation"", ""Best practices and tips"", ""Common challenges and solutions"", ""Tools and resources needed"", ""Conclusion and next steps""]","[""finance"", ""portfolio"", ""management"", ""market"", ""strategy"", ""economics""]",6,Students & New Investors,"[""financial modeling"", ""market analysis"", ""investment planning""]",63,9,2025-10-25 21:50:23,en,How do you hedge against {keyword} market downturns?,0.61,0.4028493577441629,0.83
38600988,content marketing,marketing,How do you track and analyze content marketing performance?,planning,Advanced,"[""Overview of content marketing"", ""Step-by-step implementation"", ""Best practices and tips"", ""Common challenges and solutions"", ""Tools and resources needed"", ""Conclusion and next steps""]","[""planning"", ""content"", ""marketing"", ""digital"", ""advertising""]",6,Marketing Managers & Strategists,"[""digital marketing"", ""brand management"", ""social media""]",59,9,2025-10-25 21:50:23,en,How do you track and analyze {keyword} performance?,0.84,0.9397936202805972,0.42
38600989,social media,marketing,How do you optimize social media for mobile users?,evaluation,Advanced,"[""Overview of social media"", ""Step-by-step implementation"", ""Best practices and tips"", ""Common challenges and solutions"", ""Tools and resources needed"", ""Conclusion and next steps""]","[""media"", ""promotion"", ""marketing"", ""social"", ""branding"", ""evaluation""]",6,Marketing Managers & Strategists,"[""content marketing"", ""brand management"", ""digital marketing""]",50,9,2025-10-25 21:50:23,en,How do you optimize {keyword} for mobile users?,0.68,0.9052389522821749,0.64
38600990,data science,it,What are the latest trends in data science technology?,how_to,Advanced,"[""Introduction to data science"", ""Key concepts and definitions"", ""Main categories or types"", ""Examples and case studies"", ""Benefits and advantages"", ""Summary and recommendations""]","[""how_to"", ""software"", ""it"", ""programming"", ""science"", ""data""]",6,Senior Developers & Tech Leads,"[""web development"", ""cybersecurity"", ""cloud computing"", ""machine learning""]",54,9,2025-10-25 21:50:23,en,What are the latest trends in {keyword} technology?,0.95,0.8374922347947091,0.4
38600991,data science,it,How do you optimize data science for different platforms?,planning,Advanced,"[""Overview of data science"", ""Step-by-step implementation"", ""Best practices and tips"", ""Common challenges and solutions"", ""Tools and resources needed"", ""Conclusion and next steps""]","[""technology"", ""software"", ""planning"", ""it"", ""science"", ""data""]",6,Senior Developers & Tech Leads,"[""web development"", ""cloud computing"", ""machine learning"", ""cybersecurity""]",57,9,2025-10-25 21:50:23,en,How do you optimize {keyword} for different platforms?,0.91,0.975698448879184,0.53
38600992,financial modeling,economics,What timeline is realistic for financial modeling returns?,strategy,Advanced,"[""Introduction to financial modeling"", ""Key points and analysis"", ""Practical examples"", ""Expert insights"", ""Action items"", ""Conclusion""]","[""investment"", ""modeling"", ""financial"", ""business"", ""strategy"", ""economics""]",4,Professional Investors & Advisors,"[""portfolio management"", ""investment planning"", ""market analysis""]",58,8,2025-10-25 21:50:23,en,What timeline is realistic for {keyword} returns?,0.69,0.8817785536075541,0.52
38600993,financial modeling,economics,How do you report on financial modeling performance to stakeholders?,comparison,Expert,"[""Overview of financial modeling"", ""Step-by-step implementation"", ""Best practices and tips"", ""Common challenges and solutions"", ""Tools and resources needed"", ""Conclusion and next steps""]","[""comparison"", ""modeling"", ""financial"", ""market"", ""business"", ""economics""]",6,Portfolio Managers & Financial Experts,"[""market analysis"", ""investment planning"", ""portfolio management""]",68,10,2025-10-25 21:50:23,en,How do you report on {keyword} performance to stakeholders?,0.85,1.0,0.79
38600994,financial modeling,economics,How do you benchmark financial modeling against alternatives?,implementation,Advanced,"[""Overview of financial modeling"", ""Step-by-step implementation"", ""Best practices and tips"", ""Common challenges and solutions"", ""Tools and resources needed"", ""Conclusion and next steps""]","[""finance"", ""implementation"", ""modeling"", ""financial"", ""market"", ""economics""]",6,Professional Investors & Advisors,"[""portfolio management"", ""market analysis"", ""investment planning""]",61,8,2025-10-25 21:50:23,en,How do you benchmark {keyword} against alternatives?,0.62,0.8394852308240583,0.87
38600995,financial modeling,economics,What metrics are most important for financial modeling?,planning,Beginner,"[""Introduction to financial modeling"", ""Key points and analysis"", ""Practical examples"", ""Expert insights"", ""Action items"", ""Conclusion""]","[""investment"", ""planning"", ""finance"", ""modeling"", ""financial"", ""economics""]",4,Students & New Investors,"[""market analysis"", ""investment planning"", ""portfolio management""]",55,8,2025-10-25 21:50:23,en,What metrics are most important for {keyword}?,0.91,0.34060446645094716,0.74
38600996,investment planning,economics,How do economic conditions affect investment planning performance?,how_to,Expert,"[""Introduction to investment planning"", ""Key points and analysis"", ""Practical examples"", ""Expert insights"", ""Action items"", ""Conclusion""]","[""investment"", ""how_to"", ""planning"", ""finance"", ""market"", ""economics""]",4,Portfolio Managers & Financial Experts,"[""market analysis"", ""portfolio management"", ""financial modeling""]",66,8,2025-10-25 21:50:23,en,How do economic conditions affect {keyword} performance?,0.94,1.0,0.86
38600997,data science,it,What certifications are valuable for data science professionals?,optimization,Intermediate,"[""Introduction to data science"", ""Key points and analysis"", ""Practical examples"", ""Expert insights"", ""Action items"", ""Conclusion""]","[""technology"", ""development"", ""it"", ""science"", ""optimization"", ""data""]",4,Junior to Mid-level Developers,"[""cybersecurity"", ""cloud computing"", ""machine learning"", ""web development""]",64,8,2025-10-25 21:50:23,en,What certifications are valuable for {keyword} professionals?,0.89,0.6633935296353245,0.77
38600998,digital marketing,marketing,How do you improve digital marketing conversion rates?,analysis,Advanced,"[""Overview of digital marketing"", ""Step-by-step implementation"", ""Best practices and tips"", ""Common challenges and solutions"", ""Tools and resources needed"", ""Conclusion and next steps""]","[""branding"", ""marketing"", ""analysis"", ""digital""]",6,Marketing Managers & Strategists,"[""social media"", ""content marketing"", ""brand management""]",54,8,2025-10-25 21:50:23,en,How do you improve {keyword} conversion rates?,0.7,0.8372826214118365,0.47
38600999,data science,it,What are the latest trends in data science technology?,implementation,Advanced,"[""Introduction to data science"", ""Key concepts and definitions"", ""Main categories or types"", ""Examples and case studies"", ""Benefits and advantages"", ""Summary and recommendations""]","[""technology"", ""it"", ""implementation"", ""programming"", ""science"", ""data""]",6,Senior Developers & Tech Leads,"[""cybersecurity"", ""cloud computing"", ""machine learning"", ""web development""]",54,9,2025-10-25 21:50:23,en,What are the latest trends in {keyword} technology?,0.88,0.8745452835813665,0.64
38601000,financial modeling,economics,What are the seasonal patterns in financial modeling?,analysis,Expert,"[""Introduction to financial modeling"", ""Key concepts and definitions"", ""Main categories or types"", ""Examples and case studies"", ""Benefits and advantages"", ""Summary and recommendations""]","[""investment"", ""analysis"", ""finance"", ""modeling"", ""financial"", ""economics""]",6,Portfolio Managers & Financial Experts,"[""investment planning"", ""market analysis"", ""portfolio management""]",53,8,2025-10-25 21:50:23,en,What are the seasonal patterns in {keyword}?,0.68,1.0,0.71
