record_id,keyword,category,question,question_type,difficulty_level,answer_outline,tags,estimated_read_time,target_audience,related_topics,question_length,word_count,created_date,language,source_template,engagement_score,complexity_score,popularity_score
44600952,data science,it,What ROI can be expected from data science implementation?,best_practice,Beginner,"[""Introduction to data science"", ""Key points and analysis"", ""Practical examples"", ""Expert insights"", ""Action items"", ""Conclusion""]","[""technology"", ""development"", ""it"", ""best_practice"", ""science"", ""data""]",4,Students & Entry-level Developers,"[""cloud computing"", ""cybersecurity"", ""machine learning"", ""web development""]",58,9,2025-10-25 21:58:42,en,What ROI can be expected from {keyword} implementation?,0.72,0.38039894029817517,0.67
44600953,social media,marketing,What tools are essential for social media analytics?,planning,Expert,"[""Introduction to social media"", ""Key points and analysis"", ""Practical examples"", ""Expert insights"", ""Action items"", ""Conclusion""]","[""planning"", ""media"", ""marketing"", ""digital"", ""social"", ""advertising""]",4,Marketing Directors & CMOs,"[""content marketing"", ""digital marketing"", ""brand management""]",52,8,2025-10-25 21:58:42,en,What tools are essential for {keyword} analytics?,0.72,1.0,0.78
44600954,content marketing,marketing,What timing strategies work for content marketing?,best_practice,Beginner,"[""Introduction to content marketing"", ""Key points and analysis"", ""Practical examples"", ""Expert insights"", ""Action items"", ""Conclusion""]","[""content"", ""promotion"", ""best_practice"", ""marketing"", ""digital""]",4,Marketing Students & Interns,"[""digital marketing"", ""social media"", ""brand management""]",50,7,2025-10-25 21:58:42,en,What timing strategies work for {keyword}?,0.73,0.4401180093755386,0.57
44600955,web development,it,What certifications are valuable for web development professionals?,how_to,Intermediate,"[""Introduction to web development"", ""Key points and analysis"", ""Practical examples"", ""Expert insights"", ""Action items"", ""Conclusion""]","[""how_to"", ""software"", ""development"", ""it"", ""web""]",4,Junior to Mid-level Developers,"[""data science"", ""cloud computing"", ""machine learning"", ""cybersecurity""]",67,8,2025-10-25 21:58:42,en,What certifications are valuable for {keyword} professionals?,0.74,0.6310876320566885,0.9
44600956,cloud computing,it,How do you integrate cloud computing with existing systems?,optimization,Intermediate,"[""Overview of cloud computing"", ""Step-by-step implementation"", ""Best practices and tips"", ""Common challenges and solutions"", ""Tools and resources needed"", ""Conclusion and next steps""]","[""computing"", ""cloud"", ""development"", ""it"", ""software"", ""optimization""]",6,Junior to Mid-level Developers,"[""cybersecurity"", ""web development"", ""machine learning"", ""data science""]",59,9,2025-10-25 21:58:42,en,How do you integrate {keyword} with existing systems?,0.81,0.7150091666246825,0.48
44600957,market analysis,economics,How do you diversify your portfolio using market analysis?,implementation,Advanced,"[""Overview of market analysis"", ""Step-by-step implementation"", ""Best practices and tips"", ""Common challenges and solutions"", ""Tools and resources needed"", ""Conclusion and next steps""]","[""investment"", ""analysis"", ""implementation"", ""market"", ""business"", ""economics""]",6,Professional Investors & Advisors,"[""financial modeling"", ""investment planning"", ""portfolio management""]",58,9,2025-10-25 21:58:42,en,How do you diversify your portfolio using {keyword}?,0.76,0.8007173985038598,0.6
44600958,social media,marketing,How do you automate social media processes?,planning,Beginner,"[""Overview of social media"", ""Step-by-step implementation"", ""Best practices and tips"", ""Common challenges and solutions"", ""Tools and resources needed"", ""Conclusion and next steps""]","[""planning"", ""media"", ""promotion"", ""marketing"", ""social"", ""advertising""]",6,Marketing Students & Interns,"[""content marketing"", ""brand management"", ""digital marketing""]",43,7,2025-10-25 21:58:42,en,How do you automate {keyword} processes?,0.84,0.4450278600535863,0.36
44600959,brand management,marketing,What messaging works best in brand management campaigns?,how_to,Intermediate,"[""Introduction to brand management"", ""Key points and analysis"", ""Practical examples"", ""Expert insights"", ""Action items"", ""Conclusion""]","[""how_to"", ""promotion"", ""marketing"", ""management"", ""branding"", ""brand""]",4,Marketing Coordinators & Specialists,"[""content marketing"", ""social media"", ""digital marketing""]",56,8,2025-10-25 21:58:42,en,What messaging works best in {keyword} campaigns?,0.9,0.7049777798259622,0.51
44600960,brand management,marketing,What demographics respond best to brand management?,troubleshooting,Expert,"[""Introduction to brand management"", ""Key points and analysis"", ""Practical examples"", ""Expert insights"", ""Action items"", ""Conclusion""]","[""promotion"", ""troubleshooting"", ""marketing"", ""management"", ""digital"", ""brand""]",4,Marketing Directors & CMOs,"[""social media"", ""digital marketing"", ""content marketing""]",51,7,2025-10-25 21:58:42,en,What demographics respond best to {keyword}?,0.72,1.0,0.68
44600961,portfolio management,economics,How do you benchmark portfolio management against alternatives?,implementation,Beginner,"[""Overview of portfolio management"", ""Step-by-step implementation"", ""Best practices and tips"", ""Common challenges and solutions"", ""Tools and resources needed"", ""Conclusion and next steps""]","[""investment"", ""implementation"", ""portfolio"", ""management"", ""market"", ""economics""]",6,Students & New Investors,"[""market analysis"", ""investment planning"", ""financial modeling""]",63,8,2025-10-25 21:58:42,en,How do you benchmark {keyword} against alternatives?,0.92,0.3045352000595762,0.57
44600962,machine learning,it,What are the best practices for machine learning development?,how_to,Beginner,"[""Introduction to machine learning"", ""Key concepts and definitions"", ""Main categories or types"", ""Examples and case studies"", ""Benefits and advantages"", ""Summary and recommendations""]","[""how_to"", ""software"", ""it"", ""learning"", ""machine"", ""technology""]",6,Students & Entry-level Developers,"[""data science"", ""cybersecurity"", ""web development"", ""cloud computing""]",61,9,2025-10-25 21:58:42,en,What are the best practices for {keyword} development?,0.75,0.372843599389435,0.44
44600963,portfolio management,economics,How do economic conditions affect portfolio management performance?,best_practice,Advanced,"[""Introduction to portfolio management"", ""Key points and analysis"", ""Practical examples"", ""Expert insights"", ""Action items"", ""Conclusion""]","[""investment"", ""portfolio"", ""best_practice"", ""management"", ""market"", ""economics""]",4,Professional Investors & Advisors,"[""financial modeling"", ""investment planning"", ""market analysis""]",67,8,2025-10-25 21:58:42,en,How do economic conditions affect {keyword} performance?,0.64,0.8070468410944995,0.74
44600964,data science,it,What are the best practices for data science development?,comparison,Beginner,"[""Introduction to data science"", ""Key concepts and definitions"", ""Main categories or types"", ""Examples and case studies"", ""Benefits and advantages"", ""Summary and recommendations""]","[""software"", ""development"", ""it"", ""comparison"", ""science"", ""data""]",6,Students & Entry-level Developers,"[""web development"", ""machine learning"", ""cybersecurity"", ""cloud computing""]",57,9,2025-10-25 21:58:42,en,What are the best practices for {keyword} development?,0.84,0.4214180098618468,0.73
44600965,market analysis,economics,What are the risks associated with market analysis?,optimization,Beginner,"[""Introduction to market analysis"", ""Key concepts and definitions"", ""Main categories or types"", ""Examples and case studies"", ""Benefits and advantages"", ""Summary and recommendations""]","[""finance"", ""analysis"", ""market"", ""optimization"", ""economics""]",6,Students & New Investors,"[""investment planning"", ""portfolio management"", ""financial modeling""]",51,8,2025-10-25 21:58:42,en,What are the risks associated with {keyword}?,0.65,0.3294188338978386,0.38
44600966,data science,it,How do you measure the success of data science projects?,comparison,Beginner,"[""Overview of data science"", ""Step-by-step implementation"", ""Best practices and tips"", ""Common challenges and solutions"", ""Tools and resources needed"", ""Conclusion and next steps""]","[""technology"", ""it"", ""comparison"", ""programming"", ""science"", ""data""]",6,Students & Entry-level Developers,"[""cybersecurity"", ""machine learning"", ""cloud computing"", ""web development""]",56,10,2025-10-25 21:58:42,en,How do you measure the success of {keyword} projects?,0.66,0.33258044550027477,0.71
44600967,brand management,marketing,How do you automate brand management processes?,analysis,Beginner,"[""Overview of brand management"", ""Step-by-step implementation"", ""Best practices and tips"", ""Common challenges and solutions"", ""Tools and resources needed"", ""Conclusion and next steps""]","[""analysis"", ""promotion"", ""marketing"", ""management"", ""branding"", ""brand""]",6,Marketing Students & Interns,"[""content marketing"", ""digital marketing"", ""social media""]",47,7,2025-10-25 21:58:42,en,How do you automate {keyword} processes?,0.74,0.4674122192380711,0.8
44600968,cloud computing,it,How do you design a scalable cloud computing solution?,optimization,Expert,"[""Overview of cloud computing"", ""Step-by-step implementation"", ""Best practices and tips"", ""Common challenges and solutions"", ""Tools and resources needed"", ""Conclusion and next steps""]","[""computing"", ""cloud"", ""software"", ""it"", ""optimization"", ""technology""]",6,Architects & Technical Directors,"[""cybersecurity"", ""web development"", ""data science"", ""machine learning""]",54,9,2025-10-25 21:58:42,en,How do you design a scalable {keyword} solution?,0.71,1.0,0.5
44600969,investment planning,economics,How do you assess and manage investment planning risks?,how_to,Expert,"[""Overview of investment planning"", ""Step-by-step implementation"", ""Best practices and tips"", ""Common challenges and solutions"", ""Tools and resources needed"", ""Conclusion and next steps""]","[""investment"", ""how_to"", ""planning"", ""finance"", ""business"", ""economics""]",6,Portfolio Managers & Financial Experts,"[""financial modeling"", ""market analysis"", ""portfolio management""]",55,9,2025-10-25 21:58:42,en,How do you assess and manage {keyword} risks?,0.94,1.0,0.81
44600970,content marketing,marketing,What emerging platforms support content marketing?,implementation,Expert,"[""Introduction to content marketing"", ""Key points and analysis"", ""Practical examples"", ""Expert insights"", ""Action items"", ""Conclusion""]","[""content"", ""implementation"", ""promotion"", ""marketing"", ""digital""]",4,Marketing Directors & CMOs,"[""brand management"", ""digital marketing"", ""social media""]",50,6,2025-10-25 21:58:42,en,What emerging platforms support {keyword}?,0.73,1.0,0.58
44600971,digital marketing,marketing,How do you identify the right audience for digital marketing?,best_practice,Expert,"[""Overview of digital marketing"", ""Step-by-step implementation"", ""Best practices and tips"", ""Common challenges and solutions"", ""Tools and resources needed"", ""Conclusion and next steps""]","[""promotion"", ""best_practice"", ""marketing"", ""digital"", ""branding""]",6,Marketing Directors & CMOs,"[""social media"", ""content marketing"", ""brand management""]",61,10,2025-10-25 21:58:42,en,How do you identify the right audience for {keyword}?,0.92,1.0,0.67
44600972,market analysis,economics,How do you measure market analysis performance?,best_practice,Expert,"[""Overview of market analysis"", ""Step-by-step implementation"", ""Best practices and tips"", ""Common challenges and solutions"", ""Tools and resources needed"", ""Conclusion and next steps""]","[""finance"", ""analysis"", ""best_practice"", ""market"", ""business"", ""economics""]",6,Portfolio Managers & Financial Experts,"[""investment planning"", ""financial modeling"", ""portfolio management""]",47,7,2025-10-25 21:58:42,en,How do you measure {keyword} performance?,0.91,1.0,0.38
44600973,investment planning,economics,How do you protect your investment planning investments?,best_practice,Advanced,"[""Overview of investment planning"", ""Step-by-step implementation"", ""Best practices and tips"", ""Common challenges and solutions"", ""Tools and resources needed"", ""Conclusion and next steps""]","[""investment"", ""planning"", ""finance"", ""best_practice"", ""economics""]",6,Professional Investors & Advisors,"[""market analysis"", ""portfolio management"", ""financial modeling""]",56,8,2025-10-25 21:58:42,en,How do you protect your {keyword} investments?,0.61,0.9153749511588193,0.74
44600974,social media,marketing,What KPIs are most important for social media?,optimization,Advanced,"[""Introduction to social media"", ""Key points and analysis"", ""Practical examples"", ""Expert insights"", ""Action items"", ""Conclusion""]","[""media"", ""promotion"", ""marketing"", ""digital"", ""social"", ""optimization""]",4,Marketing Managers & Strategists,"[""brand management"", ""content marketing"", ""digital marketing""]",46,8,2025-10-25 21:58:42,en,What KPIs are most important for {keyword}?,0.84,0.8242817674411441,0.77
44600975,web development,it,How do you troubleshoot common issues with web development?,planning,Expert,"[""Overview of web development"", ""Step-by-step implementation"", ""Best practices and tips"", ""Common challenges and solutions"", ""Tools and resources needed"", ""Conclusion and next steps""]","[""software"", ""planning"", ""development"", ""it"", ""web""]",6,Architects & Technical Directors,"[""data science"", ""machine learning"", ""cloud computing"", ""cybersecurity""]",59,9,2025-10-25 21:58:42,en,How do you troubleshoot common issues with {keyword}?,0.88,1.0,0.31
44600976,machine learning,it,What are the key components of a machine learning implementation?,analysis,Beginner,"[""Introduction to machine learning"", ""Key concepts and definitions"", ""Main categories or types"", ""Examples and case studies"", ""Benefits and advantages"", ""Summary and recommendations""]","[""analysis"", ""it"", ""development"", ""programming"", ""learning"", ""machine""]",6,Students & Entry-level Developers,"[""data science"", ""web development"", ""cloud computing"", ""cybersecurity""]",65,10,2025-10-25 21:58:42,en,What are the key components of a {keyword} implementation?,0.92,0.49429879520362974,0.46
44600977,brand management,marketing,What does the future hold for brand management?,best_practice,Intermediate,"[""Introduction to brand management"", ""Key points and analysis"", ""Practical examples"", ""Expert insights"", ""Action items"", ""Conclusion""]","[""best_practice"", ""digital"", ""marketing"", ""management"", ""advertising"", ""brand""]",4,Marketing Coordinators & Specialists,"[""digital marketing"", ""social media"", ""content marketing""]",47,8,2025-10-25 21:58:42,en,What does the future hold for {keyword}?,0.89,0.6227057475785787,0.88
44600978,portfolio management,economics,How do economic conditions affect portfolio management performance?,comparison,Intermediate,"[""Introduction to portfolio management"", ""Key points and analysis"", ""Practical examples"", ""Expert insights"", ""Action items"", ""Conclusion""]","[""finance"", ""portfolio"", ""comparison"", ""management"", ""business"", ""economics""]",4,Individual Investors & Analysts,"[""investment planning"", ""market analysis"", ""financial modeling""]",67,8,2025-10-25 21:58:42,en,How do economic conditions affect {keyword} performance?,0.9,0.6428277692143997,0.64
44600979,market analysis,economics,What is the optimal allocation for market analysis in a portfolio?,implementation,Advanced,"[""Introduction to market analysis"", ""Key points and analysis"", ""Practical examples"", ""Expert insights"", ""Action items"", ""Conclusion""]","[""investment"", ""analysis"", ""finance"", ""implementation"", ""market"", ""economics""]",4,Professional Investors & Advisors,"[""investment planning"", ""financial modeling"", ""portfolio management""]",66,11,2025-10-25 21:58:42,en,What is the optimal allocation for {keyword} in a portfolio?,0.68,0.9731287344559466,0.79
44600980,portfolio management,economics,How do you diversify your portfolio using portfolio management?,evaluation,Beginner,"[""Overview of portfolio management"", ""Step-by-step implementation"", ""Best practices and tips"", ""Common challenges and solutions"", ""Tools and resources needed"", ""Conclusion and next steps""]","[""finance"", ""portfolio"", ""management"", ""evaluation"", ""market"", ""economics""]",6,Students & New Investors,"[""financial modeling"", ""investment planning"", ""market analysis""]",63,9,2025-10-25 21:58:42,en,How do you diversify your portfolio using {keyword}?,0.88,0.43785377390960967,0.53
44600981,cloud computing,it,How do you implement cloud computing in a production environment?,implementation,Intermediate,"[""Overview of cloud computing"", ""Step-by-step implementation"", ""Best practices and tips"", ""Common challenges and solutions"", ""Tools and resources needed"", ""Conclusion and next steps""]","[""computing"", ""development"", ""it"", ""implementation"", ""cloud"", ""technology""]",6,Junior to Mid-level Developers,"[""web development"", ""data science"", ""machine learning"", ""cybersecurity""]",65,10,2025-10-25 21:58:42,en,How do you implement {keyword} in a production environment?,0.86,0.7048131059735474,0.63
44600982,cloud computing,it,How do you convince stakeholders to invest in cloud computing?,optimization,Beginner,"[""Overview of cloud computing"", ""Step-by-step implementation"", ""Best practices and tips"", ""Common challenges and solutions"", ""Tools and resources needed"", ""Conclusion and next steps""]","[""computing"", ""cloud"", ""it"", ""programming"", ""optimization"", ""technology""]",6,Students & Entry-level Developers,"[""data science"", ""machine learning"", ""web development"", ""cybersecurity""]",62,10,2025-10-25 21:58:42,en,How do you convince stakeholders to invest in {keyword}?,0.92,0.47275371312797154,0.43
44600983,financial modeling,economics,How do you benchmark financial modeling against alternatives?,how_to,Intermediate,"[""Overview of financial modeling"", ""Step-by-step implementation"", ""Best practices and tips"", ""Common challenges and solutions"", ""Tools and resources needed"", ""Conclusion and next steps""]","[""investment"", ""how_to"", ""modeling"", ""financial"", ""market"", ""economics""]",6,Individual Investors & Analysts,"[""market analysis"", ""investment planning"", ""portfolio management""]",61,8,2025-10-25 21:58:42,en,How do you benchmark {keyword} against alternatives?,0.61,0.7507046373104505,0.88
44600984,machine learning,it,What are the key components of a machine learning implementation?,best_practice,Expert,"[""Introduction to machine learning"", ""Key concepts and definitions"", ""Main categories or types"", ""Examples and case studies"", ""Benefits and advantages"", ""Summary and recommendations""]","[""software"", ""development"", ""it"", ""best_practice"", ""learning"", ""machine""]",6,Architects & Technical Directors,"[""web development"", ""cloud computing"", ""data science"", ""cybersecurity""]",65,10,2025-10-25 21:58:42,en,What are the key components of a {keyword} implementation?,0.71,1.0,0.36
44600985,market analysis,economics,How do economic conditions affect market analysis performance?,strategy,Beginner,"[""Introduction to market analysis"", ""Key points and analysis"", ""Practical examples"", ""Expert insights"", ""Action items"", ""Conclusion""]","[""finance"", ""analysis"", ""business"", ""market"", ""strategy"", ""economics""]",4,Students & New Investors,"[""investment planning"", ""portfolio management"", ""financial modeling""]",62,8,2025-10-25 21:58:42,en,How do economic conditions affect {keyword} performance?,0.62,0.45400563327415866,0.72
44600986,market analysis,economics,What insurance options are available for market analysis?,best_practice,Expert,"[""Introduction to market analysis"", ""Key points and analysis"", ""Practical examples"", ""Expert insights"", ""Action items"", ""Conclusion""]","[""finance"", ""analysis"", ""best_practice"", ""market"", ""business"", ""economics""]",4,Portfolio Managers & Financial Experts,"[""portfolio management"", ""investment planning"", ""financial modeling""]",57,8,2025-10-25 21:58:42,en,What insurance options are available for {keyword}?,0.75,1.0,0.57
44600987,brand management,marketing,How do you innovate within brand management?,implementation,Expert,"[""Overview of brand management"", ""Step-by-step implementation"", ""Best practices and tips"", ""Common challenges and solutions"", ""Tools and resources needed"", ""Conclusion and next steps""]","[""implementation"", ""promotion"", ""marketing"", ""management"", ""digital"", ""brand""]",6,Marketing Directors & CMOs,"[""content marketing"", ""digital marketing"", ""social media""]",44,7,2025-10-25 21:58:42,en,How do you innovate within {keyword}?,0.62,1.0,0.57
44600988,financial modeling,economics,How do you report on financial modeling performance to stakeholders?,implementation,Intermediate,"[""Overview of financial modeling"", ""Step-by-step implementation"", ""Best practices and tips"", ""Common challenges and solutions"", ""Tools and resources needed"", ""Conclusion and next steps""]","[""investment"", ""implementation"", ""modeling"", ""financial"", ""business"", ""economics""]",6,Individual Investors & Analysts,"[""portfolio management"", ""investment planning"", ""market analysis""]",68,10,2025-10-25 21:58:42,en,How do you report on {keyword} performance to stakeholders?,0.89,0.7814135859805075,0.4
44600989,social media,marketing,How do you create a social media roadmap?,planning,Beginner,"[""Overview of social media"", ""Step-by-step implementation"", ""Best practices and tips"", ""Common challenges and solutions"", ""Tools and resources needed"", ""Conclusion and next steps""]","[""planning"", ""media"", ""marketing"", ""social"", ""advertising"", ""branding""]",6,Marketing Students & Interns,"[""digital marketing"", ""brand management"", ""content marketing""]",41,8,2025-10-25 21:58:42,en,How do you create a {keyword} roadmap?,0.67,0.33330473944461936,0.85
44600990,market analysis,economics,How do you measure market analysis performance?,evaluation,Beginner,"[""Overview of market analysis"", ""Step-by-step implementation"", ""Best practices and tips"", ""Common challenges and solutions"", ""Tools and resources needed"", ""Conclusion and next steps""]","[""investment"", ""analysis"", ""evaluation"", ""market"", ""business"", ""economics""]",6,Students & New Investors,"[""portfolio management"", ""investment planning"", ""financial modeling""]",47,7,2025-10-25 21:58:42,en,How do you measure {keyword} performance?,0.91,0.30774573386107545,0.55
44600991,digital marketing,marketing,How do you measure the ROI of digital marketing campaigns?,troubleshooting,Beginner,"[""Overview of digital marketing"", ""Step-by-step implementation"", ""Best practices and tips"", ""Common challenges and solutions"", ""Tools and resources needed"", ""Conclusion and next steps""]","[""promotion"", ""troubleshooting"", ""marketing"", ""digital"", ""advertising""]",6,Marketing Students & Interns,"[""brand management"", ""content marketing"", ""social media""]",58,10,2025-10-25 21:58:42,en,How do you measure the ROI of {keyword} campaigns?,0.7,0.4364347132159606,0.82
44600992,cloud computing,it,What certifications are valuable for cloud computing professionals?,best_practice,Expert,"[""Introduction to cloud computing"", ""Key points and analysis"", ""Practical examples"", ""Expert insights"", ""Action items"", ""Conclusion""]","[""computing"", ""development"", ""it"", ""best_practice"", ""cloud"", ""technology""]",4,Architects & Technical Directors,"[""data science"", ""cybersecurity"", ""web development"", ""machine learning""]",67,8,2025-10-25 21:58:42,en,What certifications are valuable for {keyword} professionals?,0.63,1.0,0.53
44600993,content marketing,marketing,How do you attribute success to content marketing efforts?,optimization,Intermediate,"[""Overview of content marketing"", ""Step-by-step implementation"", ""Best practices and tips"", ""Common challenges and solutions"", ""Tools and resources needed"", ""Conclusion and next steps""]","[""content"", ""promotion"", ""marketing"", ""advertising"", ""optimization""]",6,Marketing Coordinators & Specialists,"[""brand management"", ""social media"", ""digital marketing""]",58,9,2025-10-25 21:58:42,en,How do you attribute success to {keyword} efforts?,0.66,0.6612050265779824,0.84
44600994,financial modeling,economics,What tools help analyze financial modeling data?,analysis,Advanced,"[""Introduction to financial modeling"", ""Key points and analysis"", ""Practical examples"", ""Expert insights"", ""Action items"", ""Conclusion""]","[""analysis"", ""modeling"", ""financial"", ""market"", ""business"", ""economics""]",4,Professional Investors & Advisors,"[""portfolio management"", ""investment planning"", ""market analysis""]",48,7,2025-10-25 21:58:42,en,What tools help analyze {keyword} data?,0.88,0.9100535325907214,0.56
