record_id,keyword,category,question,question_type,difficulty_level,answer_outline,tags,estimated_read_time,target_audience,related_topics,question_length,word_count,created_date,language,source_template,engagement_score,complexity_score,popularity_score
38600348,data science,it,How can data science improve system performance and scalability?,evaluation,Beginner,"[""Introduction to data science"", ""Key points and analysis"", ""Practical examples"", ""Expert insights"", ""Action items"", ""Conclusion""]","[""software"", ""development"", ""it"", ""science"", ""evaluation"", ""data""]",4,Students & Entry-level Developers,"[""web development"", ""cloud computing"", ""cybersecurity"", ""machine learning""]",64,9,2025-10-25 21:50:23,en,How can {keyword} improve system performance and scalability?,0.86,0.3204523169793493,0.78
38600349,web development,it,How do you design a scalable web development solution?,best_practice,Beginner,"[""Overview of web development"", ""Step-by-step implementation"", ""Best practices and tips"", ""Common challenges and solutions"", ""Tools and resources needed"", ""Conclusion and next steps""]","[""technology"", ""development"", ""it"", ""best_practice"", ""web""]",6,Students & Entry-level Developers,"[""cloud computing"", ""cybersecurity"", ""data science"", ""machine learning""]",54,9,2025-10-25 21:50:23,en,How do you design a scalable {keyword} solution?,0.92,0.3510739930728044,0.63
38600350,market analysis,economics,What strategies work best for market analysis investment?,troubleshooting,Expert,"[""Introduction to market analysis"", ""Key points and analysis"", ""Practical examples"", ""Expert insights"", ""Action items"", ""Conclusion""]","[""finance"", ""analysis"", ""troubleshooting"", ""market"", ""business"", ""economics""]",4,Portfolio Managers & Financial Experts,"[""investment planning"", ""portfolio management"", ""financial modeling""]",57,8,2025-10-25 21:50:23,en,What strategies work best for {keyword} investment?,0.72,1.0,0.63
38600351,financial modeling,economics,How do you measure financial modeling performance?,planning,Intermediate,"[""Overview of financial modeling"", ""Step-by-step implementation"", ""Best practices and tips"", ""Common challenges and solutions"", ""Tools and resources needed"", ""Conclusion and next steps""]","[""planning"", ""finance"", ""modeling"", ""financial"", ""market"", ""economics""]",6,Individual Investors & Analysts,"[""portfolio management"", ""market analysis"", ""investment planning""]",50,7,2025-10-25 21:50:23,en,How do you measure {keyword} performance?,0.76,0.7494345680101978,0.82
38600352,cybersecurity,it,How do you measure the success of cybersecurity projects?,analysis,Advanced,"[""Overview of cybersecurity"", ""Step-by-step implementation"", ""Best practices and tips"", ""Common challenges and solutions"", ""Tools and resources needed"", ""Conclusion and next steps""]","[""development"", ""analysis"", ""it"", ""programming"", ""cybersecurity""]",5,Senior Developers & Tech Leads,"[""data science"", ""cloud computing"", ""machine learning"", ""web development""]",57,9,2025-10-25 21:50:23,en,How do you measure the success of {keyword} projects?,0.77,0.8625100413081279,0.88
38600353,portfolio management,economics,What strategies work best for portfolio management investment?,optimization,Beginner,"[""Introduction to portfolio management"", ""Key points and analysis"", ""Practical examples"", ""Expert insights"", ""Action items"", ""Conclusion""]","[""portfolio"", ""management"", ""business"", ""market"", ""optimization"", ""economics""]",4,Students & New Investors,"[""investment planning"", ""financial modeling"", ""market analysis""]",62,8,2025-10-25 21:50:23,en,What strategies work best for {keyword} investment?,0.93,0.42678356666171874,0.77
38600354,digital marketing,marketing,What A/B tests should you run for digital marketing?,implementation,Expert,"[""Introduction to digital marketing"", ""Key points and analysis"", ""Practical examples"", ""Expert insights"", ""Action items"", ""Conclusion""]","[""implementation"", ""promotion"", ""marketing"", ""digital"", ""advertising""]",4,Marketing Directors & CMOs,"[""social media"", ""brand management"", ""content marketing""]",52,9,2025-10-25 21:50:23,en,What A/B tests should you run for {keyword}?,0.84,1.0,0.75
38600355,cybersecurity,it,What design patterns work best with cybersecurity?,how_to,Intermediate,"[""Introduction to cybersecurity"", ""Key points and analysis"", ""Practical examples"", ""Expert insights"", ""Action items"", ""Conclusion""]","[""how_to"", ""development"", ""it"", ""programming"", ""cybersecurity""]",4,Junior to Mid-level Developers,"[""data science"", ""machine learning"", ""web development"", ""cloud computing""]",50,7,2025-10-25 21:50:23,en,What design patterns work best with {keyword}?,0.61,0.6419180777278133,0.73
38600356,cybersecurity,it,What career opportunities exist in cybersecurity?,troubleshooting,Beginner,"[""Introduction to cybersecurity"", ""Key points and analysis"", ""Practical examples"", ""Expert insights"", ""Action items"", ""Conclusion""]","[""software"", ""it"", ""programming"", ""troubleshooting"", ""cybersecurity""]",4,Students & Entry-level Developers,"[""web development"", ""cloud computing"", ""machine learning"", ""data science""]",49,6,2025-10-25 21:50:23,en,What career opportunities exist in {keyword}?,0.66,0.36029554121886387,0.64
38600357,portfolio management,economics,How do you report on portfolio management performance to stakeholders?,strategy,Expert,"[""Overview of portfolio management"", ""Step-by-step implementation"", ""Best practices and tips"", ""Common challenges and solutions"", ""Tools and resources needed"", ""Conclusion and next steps""]","[""investment"", ""finance"", ""portfolio"", ""management"", ""strategy"", ""economics""]",6,Portfolio Managers & Financial Experts,"[""market analysis"", ""financial modeling"", ""investment planning""]",70,10,2025-10-25 21:50:23,en,How do you report on {keyword} performance to stakeholders?,0.8,1.0,0.71
38600358,market analysis,economics,How do you analyze market trends in market analysis?,implementation,Advanced,"[""Overview of market analysis"", ""Step-by-step implementation"", ""Best practices and tips"", ""Common challenges and solutions"", ""Tools and resources needed"", ""Conclusion and next steps""]","[""investment"", ""finance"", ""analysis"", ""implementation"", ""market"", ""economics""]",6,Professional Investors & Advisors,"[""investment planning"", ""portfolio management"", ""financial modeling""]",52,9,2025-10-25 21:50:23,en,How do you analyze market trends in {keyword}?,0.76,0.8053675285896587,0.81
38600359,data science,it,How do you measure the success of data science projects?,best_practice,Expert,"[""Overview of data science"", ""Step-by-step implementation"", ""Best practices and tips"", ""Common challenges and solutions"", ""Tools and resources needed"", ""Conclusion and next steps""]","[""software"", ""it"", ""best_practice"", ""programming"", ""science"", ""data""]",6,Architects & Technical Directors,"[""machine learning"", ""web development"", ""cybersecurity"", ""cloud computing""]",56,10,2025-10-25 21:50:23,en,How do you measure the success of {keyword} projects?,0.86,1.0,0.35
38600360,social media,marketing,How do you personalize social media for different segments?,planning,Intermediate,"[""Overview of social media"", ""Step-by-step implementation"", ""Best practices and tips"", ""Common challenges and solutions"", ""Tools and resources needed"", ""Conclusion and next steps""]","[""planning"", ""media"", ""marketing"", ""social"", ""advertising"", ""branding""]",6,Marketing Coordinators & Specialists,"[""brand management"", ""digital marketing"", ""content marketing""]",59,9,2025-10-25 21:50:23,en,How do you personalize {keyword} for different segments?,0.89,0.6845469100551859,0.87
38600361,web development,it,How do you stay updated with web development developments?,comparison,Intermediate,"[""Overview of web development"", ""Step-by-step implementation"", ""Best practices and tips"", ""Common challenges and solutions"", ""Tools and resources needed"", ""Conclusion and next steps""]","[""development"", ""it"", ""comparison"", ""programming"", ""web""]",6,Junior to Mid-level Developers,"[""machine learning"", ""data science"", ""cloud computing"", ""cybersecurity""]",58,9,2025-10-25 21:50:23,en,How do you stay updated with {keyword} developments?,0.77,0.6209248137783443,0.4
38600362,market analysis,economics,What metrics are most important for market analysis?,strategy,Expert,"[""Introduction to market analysis"", ""Key points and analysis"", ""Practical examples"", ""Expert insights"", ""Action items"", ""Conclusion""]","[""investment"", ""analysis"", ""business"", ""market"", ""strategy"", ""economics""]",4,Portfolio Managers & Financial Experts,"[""investment planning"", ""financial modeling"", ""portfolio management""]",52,8,2025-10-25 21:50:23,en,What metrics are most important for {keyword}?,0.74,1.0,0.57
38600363,brand management,marketing,How do you optimize brand management for mobile users?,implementation,Expert,"[""Overview of brand management"", ""Step-by-step implementation"", ""Best practices and tips"", ""Common challenges and solutions"", ""Tools and resources needed"", ""Conclusion and next steps""]","[""implementation"", ""marketing"", ""management"", ""advertising"", ""digital"", ""brand""]",6,Marketing Directors & CMOs,"[""content marketing"", ""social media"", ""digital marketing""]",54,9,2025-10-25 21:50:23,en,How do you optimize {keyword} for mobile users?,0.8,1.0,0.37
38600364,cybersecurity,it,What is the recommended architecture for cybersecurity systems?,best_practice,Intermediate,"[""Introduction to cybersecurity"", ""Key points and analysis"", ""Practical examples"", ""Expert insights"", ""Action items"", ""Conclusion""]","[""software"", ""it"", ""best_practice"", ""cybersecurity"", ""technology""]",4,Junior to Mid-level Developers,"[""machine learning"", ""web development"", ""data science"", ""cloud computing""]",63,8,2025-10-25 21:50:23,en,What is the recommended architecture for {keyword} systems?,0.81,0.6287139079783124,0.37
38600365,content marketing,marketing,What budget should be allocated to content marketing?,comparison,Expert,"[""Introduction to content marketing"", ""Key points and analysis"", ""Practical examples"", ""Expert insights"", ""Action items"", ""Conclusion""]","[""content"", ""promotion"", ""comparison"", ""marketing"", ""digital""]",4,Marketing Directors & CMOs,"[""digital marketing"", ""brand management"", ""social media""]",53,8,2025-10-25 21:50:23,en,What budget should be allocated to {keyword}?,0.7,1.0,0.76
38600366,content marketing,marketing,How do you personalize content marketing for different segments?,best_practice,Expert,"[""Overview of content marketing"", ""Step-by-step implementation"", ""Best practices and tips"", ""Common challenges and solutions"", ""Tools and resources needed"", ""Conclusion and next steps""]","[""content"", ""best_practice"", ""digital"", ""marketing"", ""branding""]",6,Marketing Directors & CMOs,"[""brand management"", ""digital marketing"", ""social media""]",64,9,2025-10-25 21:50:23,en,How do you personalize {keyword} for different segments?,0.91,1.0,0.68
38600367,social media,marketing,What content types work best for social media?,comparison,Intermediate,"[""Introduction to social media"", ""Key points and analysis"", ""Practical examples"", ""Expert insights"", ""Action items"", ""Conclusion""]","[""media"", ""comparison"", ""marketing"", ""social"", ""advertising"", ""branding""]",4,Marketing Coordinators & Specialists,"[""content marketing"", ""digital marketing"", ""brand management""]",46,8,2025-10-25 21:50:23,en,What content types work best for {keyword}?,0.81,0.7816706547602889,0.42
38600368,financial modeling,economics,What are the regulatory considerations for financial modeling?,evaluation,Expert,"[""Introduction to financial modeling"", ""Key concepts and definitions"", ""Main categories or types"", ""Examples and case studies"", ""Benefits and advantages"", ""Summary and recommendations""]","[""investment"", ""modeling"", ""financial"", ""evaluation"", ""market"", ""economics""]",6,Portfolio Managers & Financial Experts,"[""market analysis"", ""portfolio management"", ""investment planning""]",62,8,2025-10-25 21:50:23,en,What are the regulatory considerations for {keyword}?,0.64,1.0,0.64
38600369,market analysis,economics,What tools help analyze market analysis data?,best_practice,Intermediate,"[""Introduction to market analysis"", ""Key points and analysis"", ""Practical examples"", ""Expert insights"", ""Action items"", ""Conclusion""]","[""investment"", ""analysis"", ""finance"", ""best_practice"", ""market"", ""economics""]",4,Individual Investors & Analysts,"[""financial modeling"", ""investment planning"", ""portfolio management""]",45,7,2025-10-25 21:50:23,en,What tools help analyze {keyword} data?,0.85,0.6667157813530867,0.5
38600370,social media,marketing,What channels are most effective for social media?,implementation,Advanced,"[""Introduction to social media"", ""Key points and analysis"", ""Practical examples"", ""Expert insights"", ""Action items"", ""Conclusion""]","[""media"", ""implementation"", ""marketing"", ""digital"", ""social"", ""branding""]",4,Marketing Managers & Strategists,"[""brand management"", ""content marketing"", ""digital marketing""]",50,8,2025-10-25 21:50:23,en,What channels are most effective for {keyword}?,0.63,0.9270753969845014,0.4
38600371,financial modeling,economics,How do you create a long-term plan for financial modeling?,evaluation,Beginner,"[""Overview of financial modeling"", ""Step-by-step implementation"", ""Best practices and tips"", ""Common challenges and solutions"", ""Tools and resources needed"", ""Conclusion and next steps""]","[""modeling"", ""financial"", ""evaluation"", ""market"", ""business"", ""economics""]",6,Students & New Investors,"[""investment planning"", ""market analysis"", ""portfolio management""]",58,10,2025-10-25 21:50:23,en,How do you create a long-term plan for {keyword}?,0.74,0.32623084576820627,0.39
38600372,content marketing,marketing,What emerging platforms support content marketing?,troubleshooting,Beginner,"[""Introduction to content marketing"", ""Key points and analysis"", ""Practical examples"", ""Expert insights"", ""Action items"", ""Conclusion""]","[""content"", ""promotion"", ""troubleshooting"", ""marketing"", ""branding""]",4,Marketing Students & Interns,"[""social media"", ""digital marketing"", ""brand management""]",50,6,2025-10-25 21:50:23,en,What emerging platforms support {keyword}?,0.6,0.300519035451958,0.58
38600373,content marketing,marketing,What tools are essential for content marketing analytics?,troubleshooting,Intermediate,"[""Introduction to content marketing"", ""Key points and analysis"", ""Practical examples"", ""Expert insights"", ""Action items"", ""Conclusion""]","[""content"", ""promotion"", ""troubleshooting"", ""marketing"", ""branding""]",4,Marketing Coordinators & Specialists,"[""digital marketing"", ""social media"", ""brand management""]",57,8,2025-10-25 21:50:23,en,What tools are essential for {keyword} analytics?,0.7,0.713988046110773,0.64
38600374,machine learning,it,What are the cost considerations for machine learning?,best_practice,Advanced,"[""Introduction to machine learning"", ""Key concepts and definitions"", ""Main categories or types"", ""Examples and case studies"", ""Benefits and advantages"", ""Summary and recommendations""]","[""software"", ""development"", ""it"", ""best_practice"", ""learning"", ""machine""]",6,Senior Developers & Tech Leads,"[""web development"", ""cybersecurity"", ""cloud computing"", ""data science""]",54,8,2025-10-25 21:50:23,en,What are the cost considerations for {keyword}?,0.86,0.8476500725482908,0.32
38600375,cybersecurity,it,What skills are needed to master cybersecurity?,analysis,Expert,"[""Introduction to cybersecurity"", ""Key points and analysis"", ""Practical examples"", ""Expert insights"", ""Action items"", ""Conclusion""]","[""software"", ""analysis"", ""it"", ""programming"", ""cybersecurity""]",4,Architects & Technical Directors,"[""cloud computing"", ""data science"", ""machine learning"", ""web development""]",47,7,2025-10-25 21:50:23,en,What skills are needed to master {keyword}?,0.74,1.0,0.6
38600376,social media,marketing,How do you automate social media processes?,how_to,Expert,"[""Overview of social media"", ""Step-by-step implementation"", ""Best practices and tips"", ""Common challenges and solutions"", ""Tools and resources needed"", ""Conclusion and next steps""]","[""how_to"", ""media"", ""marketing"", ""social"", ""advertising"", ""branding""]",6,Marketing Directors & CMOs,"[""brand management"", ""content marketing"", ""digital marketing""]",43,7,2025-10-25 21:50:23,en,How do you automate {keyword} processes?,0.89,1.0,0.57
38600377,investment planning,economics,What insurance options are available for investment planning?,how_to,Expert,"[""Introduction to investment planning"", ""Key points and analysis"", ""Practical examples"", ""Expert insights"", ""Action items"", ""Conclusion""]","[""investment"", ""how_to"", ""planning"", ""finance"", ""economics""]",4,Portfolio Managers & Financial Experts,"[""financial modeling"", ""market analysis"", ""portfolio management""]",61,8,2025-10-25 21:50:23,en,What insurance options are available for {keyword}?,0.91,1.0,0.86
38600378,digital marketing,marketing,How do you develop an effective digital marketing strategy?,best_practice,Intermediate,"[""Overview of digital marketing"", ""Step-by-step implementation"", ""Best practices and tips"", ""Common challenges and solutions"", ""Tools and resources needed"", ""Conclusion and next steps""]","[""marketing"", ""advertising"", ""best_practice"", ""digital""]",6,Marketing Coordinators & Specialists,"[""social media"", ""content marketing"", ""brand management""]",59,9,2025-10-25 21:50:23,en,How do you develop an effective {keyword} strategy?,0.75,0.6658294586012765,0.56
38600379,cybersecurity,it,Which frameworks support cybersecurity implementation?,evaluation,Intermediate,"[""Introduction to cybersecurity"", ""Key points and analysis"", ""Practical examples"", ""Expert insights"", ""Action items"", ""Conclusion""]","[""development"", ""it"", ""evaluation"", ""cybersecurity"", ""technology""]",4,Junior to Mid-level Developers,"[""data science"", ""web development"", ""machine learning"", ""cloud computing""]",54,5,2025-10-25 21:50:23,en,Which frameworks support {keyword} implementation?,0.87,0.6249185475032304,0.43
38600380,digital marketing,marketing,What A/B tests should you run for digital marketing?,how_to,Expert,"[""Introduction to digital marketing"", ""Key points and analysis"", ""Practical examples"", ""Expert insights"", ""Action items"", ""Conclusion""]","[""how_to"", ""promotion"", ""marketing"", ""digital"", ""branding""]",4,Marketing Directors & CMOs,"[""brand management"", ""social media"", ""content marketing""]",52,9,2025-10-25 21:50:23,en,What A/B tests should you run for {keyword}?,0.71,1.0,0.63
38600381,web development,it,What is the recommended architecture for web development systems?,optimization,Advanced,"[""Introduction to web development"", ""Key points and analysis"", ""Practical examples"", ""Expert insights"", ""Action items"", ""Conclusion""]","[""software"", ""development"", ""it"", ""programming"", ""optimization"", ""web""]",4,Senior Developers & Tech Leads,"[""cybersecurity"", ""cloud computing"", ""data science"", ""machine learning""]",65,9,2025-10-25 21:50:23,en,What is the recommended architecture for {keyword} systems?,0.82,0.8712444521397446,0.32
38600382,financial modeling,economics,How do you adjust your financial modeling strategy during volatility?,implementation,Advanced,"[""Overview of financial modeling"", ""Step-by-step implementation"", ""Best practices and tips"", ""Common challenges and solutions"", ""Tools and resources needed"", ""Conclusion and next steps""]","[""investment"", ""finance"", ""implementation"", ""modeling"", ""financial"", ""economics""]",6,Professional Investors & Advisors,"[""investment planning"", ""market analysis"", ""portfolio management""]",69,10,2025-10-25 21:50:23,en,How do you adjust your {keyword} strategy during volatility?,0.76,0.8001394002543436,0.7
38600383,cloud computing,it,How do you implement cloud computing in a production environment?,strategy,Advanced,"[""Overview of cloud computing"", ""Step-by-step implementation"", ""Best practices and tips"", ""Common challenges and solutions"", ""Tools and resources needed"", ""Conclusion and next steps""]","[""computing"", ""cloud"", ""development"", ""it"", ""programming"", ""strategy""]",6,Senior Developers & Tech Leads,"[""cybersecurity"", ""machine learning"", ""web development"", ""data science""]",65,10,2025-10-25 21:50:23,en,How do you implement {keyword} in a production environment?,0.6,0.9929149156715142,0.83
38600384,brand management,marketing,What budget should be allocated to brand management?,analysis,Beginner,"[""Introduction to brand management"", ""Key points and analysis"", ""Practical examples"", ""Expert insights"", ""Action items"", ""Conclusion""]","[""analysis"", ""promotion"", ""digital"", ""marketing"", ""management"", ""brand""]",4,Marketing Students & Interns,"[""social media"", ""content marketing"", ""digital marketing""]",52,8,2025-10-25 21:50:23,en,What budget should be allocated to {keyword}?,0.68,0.4769356904238977,0.69
38600385,brand management,marketing,How is AI changing brand management approaches?,strategy,Advanced,"[""Introduction to brand management"", ""Key points and analysis"", ""Practical examples"", ""Expert insights"", ""Action items"", ""Conclusion""]","[""marketing"", ""management"", ""advertising"", ""branding"", ""strategy"", ""brand""]",4,Marketing Managers & Strategists,"[""social media"", ""content marketing"", ""digital marketing""]",47,7,2025-10-25 21:50:23,en,How is AI changing {keyword} approaches?,0.93,0.8951765748802387,0.5
38600386,financial modeling,economics,What timeline is realistic for financial modeling returns?,strategy,Beginner,"[""Introduction to financial modeling"", ""Key points and analysis"", ""Practical examples"", ""Expert insights"", ""Action items"", ""Conclusion""]","[""finance"", ""modeling"", ""financial"", ""market"", ""strategy"", ""economics""]",4,Students & New Investors,"[""portfolio management"", ""market analysis"", ""investment planning""]",58,8,2025-10-25 21:50:23,en,What timeline is realistic for {keyword} returns?,0.8,0.39992189900842673,0.64
38600387,digital marketing,marketing,What are the latest trends in digital marketing?,how_to,Beginner,"[""Introduction to digital marketing"", ""Key concepts and definitions"", ""Main categories or types"", ""Examples and case studies"", ""Benefits and advantages"", ""Summary and recommendations""]","[""marketing"", ""how_to"", ""advertising"", ""digital""]",6,Marketing Students & Interns,"[""social media"", ""content marketing"", ""brand management""]",48,8,2025-10-25 21:50:23,en,What are the latest trends in {keyword}?,0.66,0.3283885534316679,0.42
38600388,data science,it,Which frameworks support data science implementation?,analysis,Beginner,"[""Introduction to data science"", ""Key points and analysis"", ""Practical examples"", ""Expert insights"", ""Action items"", ""Conclusion""]","[""software"", ""analysis"", ""it"", ""programming"", ""science"", ""data""]",4,Students & Entry-level Developers,"[""machine learning"", ""web development"", ""cybersecurity"", ""cloud computing""]",53,6,2025-10-25 21:50:23,en,Which frameworks support {keyword} implementation?,0.64,0.36063559111327775,0.78
38600389,cloud computing,it,What ROI can be expected from cloud computing implementation?,evaluation,Advanced,"[""Introduction to cloud computing"", ""Key points and analysis"", ""Practical examples"", ""Expert insights"", ""Action items"", ""Conclusion""]","[""computing"", ""development"", ""it"", ""programming"", ""evaluation"", ""cloud""]",4,Senior Developers & Tech Leads,"[""data science"", ""machine learning"", ""cybersecurity"", ""web development""]",61,9,2025-10-25 21:50:23,en,What ROI can be expected from {keyword} implementation?,0.94,0.9441776314353862,0.61
38600390,financial modeling,economics,What exit strategies should be considered for financial modeling?,optimization,Beginner,"[""Introduction to financial modeling"", ""Key points and analysis"", ""Practical examples"", ""Expert insights"", ""Action items"", ""Conclusion""]","[""investment"", ""modeling"", ""financial"", ""business"", ""optimization"", ""economics""]",4,Students & New Investors,"[""portfolio management"", ""market analysis"", ""investment planning""]",65,9,2025-10-25 21:50:23,en,What exit strategies should be considered for {keyword}?,0.64,0.4593864450815716,0.71
38600391,investment planning,economics,How do you hedge against investment planning market downturns?,best_practice,Expert,"[""Overview of investment planning"", ""Step-by-step implementation"", ""Best practices and tips"", ""Common challenges and solutions"", ""Tools and resources needed"", ""Conclusion and next steps""]","[""investment"", ""planning"", ""finance"", ""best_practice"", ""economics""]",6,Portfolio Managers & Financial Experts,"[""financial modeling"", ""market analysis"", ""portfolio management""]",62,9,2025-10-25 21:50:23,en,How do you hedge against {keyword} market downturns?,0.61,1.0,0.38
