record_id,keyword,category,question,question_type,difficulty_level,answer_outline,tags,estimated_read_time,target_audience,related_topics,question_length,word_count,created_date,language,source_template,engagement_score,complexity_score,popularity_score
35100961,brand management,marketing,How do you optimize brand management for mobile users?,strategy,Beginner,"[""Overview of brand management"", ""Step-by-step implementation"", ""Best practices and tips"", ""Common challenges and solutions"", ""Tools and resources needed"", ""Conclusion and next steps""]","[""marketing"", ""management"", ""digital"", ""branding"", ""strategy"", ""brand""]",6,Marketing Students & Interns,"[""social media"", ""digital marketing"", ""content marketing""]",54,9,2025-10-25 21:45:37,en,How do you optimize {keyword} for mobile users?,0.81,0.32928467549324636,0.47
35100962,digital marketing,marketing,What messaging works best in digital marketing campaigns?,evaluation,Advanced,"[""Introduction to digital marketing"", ""Key points and analysis"", ""Practical examples"", ""Expert insights"", ""Action items"", ""Conclusion""]","[""marketing"", ""digital"", ""advertising"", ""branding"", ""evaluation""]",4,Marketing Managers & Strategists,"[""brand management"", ""social media"", ""content marketing""]",57,8,2025-10-25 21:45:37,en,What messaging works best in {keyword} campaigns?,0.88,0.8830772013172177,0.39
35100963,machine learning,it,What are the latest trends in machine learning technology?,how_to,Intermediate,"[""Introduction to machine learning"", ""Key concepts and definitions"", ""Main categories or types"", ""Examples and case studies"", ""Benefits and advantages"", ""Summary and recommendations""]","[""how_to"", ""software"", ""it"", ""programming"", ""learning"", ""machine""]",6,Junior to Mid-level Developers,"[""data science"", ""web development"", ""cybersecurity"", ""cloud computing""]",58,9,2025-10-25 21:45:37,en,What are the latest trends in {keyword} technology?,0.94,0.7098610387505694,0.72
35100964,web development,it,What is the recommended architecture for web development systems?,how_to,Beginner,"[""Introduction to web development"", ""Key points and analysis"", ""Practical examples"", ""Expert insights"", ""Action items"", ""Conclusion""]","[""how_to"", ""software"", ""development"", ""web"", ""it"", ""technology""]",4,Students & Entry-level Developers,"[""cybersecurity"", ""data science"", ""machine learning"", ""cloud computing""]",65,9,2025-10-25 21:45:37,en,What is the recommended architecture for {keyword} systems?,0.86,0.37694587811918573,0.55
35100965,portfolio management,economics,How do you assess and manage portfolio management risks?,analysis,Intermediate,"[""Overview of portfolio management"", ""Step-by-step implementation"", ""Best practices and tips"", ""Common challenges and solutions"", ""Tools and resources needed"", ""Conclusion and next steps""]","[""investment"", ""analysis"", ""portfolio"", ""management"", ""business"", ""economics""]",6,Individual Investors & Analysts,"[""market analysis"", ""investment planning"", ""financial modeling""]",56,9,2025-10-25 21:45:37,en,How do you assess and manage {keyword} risks?,0.87,0.7852003056534061,0.48
35100966,digital marketing,marketing,How do you measure the ROI of digital marketing campaigns?,strategy,Beginner,"[""Overview of digital marketing"", ""Step-by-step implementation"", ""Best practices and tips"", ""Common challenges and solutions"", ""Tools and resources needed"", ""Conclusion and next steps""]","[""marketing"", ""strategy"", ""promotion"", ""digital""]",6,Marketing Students & Interns,"[""content marketing"", ""brand management"", ""social media""]",58,10,2025-10-25 21:45:37,en,How do you measure the ROI of {keyword} campaigns?,0.95,0.3031392921054899,0.84
35100967,financial modeling,economics,How do you assess and manage financial modeling risks?,strategy,Expert,"[""Overview of financial modeling"", ""Step-by-step implementation"", ""Best practices and tips"", ""Common challenges and solutions"", ""Tools and resources needed"", ""Conclusion and next steps""]","[""investment"", ""finance"", ""modeling"", ""financial"", ""strategy"", ""economics""]",6,Portfolio Managers & Financial Experts,"[""portfolio management"", ""market analysis"", ""investment planning""]",54,9,2025-10-25 21:45:37,en,How do you assess and manage {keyword} risks?,0.94,1.0,0.6
35100968,portfolio management,economics,How does global economics impact portfolio management?,best_practice,Intermediate,"[""Introduction to portfolio management"", ""Key points and analysis"", ""Practical examples"", ""Expert insights"", ""Action items"", ""Conclusion""]","[""investment"", ""portfolio"", ""best_practice"", ""management"", ""business"", ""economics""]",4,Individual Investors & Analysts,"[""investment planning"", ""market analysis"", ""financial modeling""]",54,7,2025-10-25 21:45:37,en,How does global economics impact {keyword}?,0.94,0.7604333045443771,0.65
35100969,content marketing,marketing,How do you create a content marketing roadmap?,planning,Advanced,"[""Overview of content marketing"", ""Step-by-step implementation"", ""Best practices and tips"", ""Common challenges and solutions"", ""Tools and resources needed"", ""Conclusion and next steps""]","[""planning"", ""content"", ""promotion"", ""marketing"", ""branding""]",6,Marketing Managers & Strategists,"[""brand management"", ""social media"", ""digital marketing""]",46,8,2025-10-25 21:45:37,en,How do you create a {keyword} roadmap?,0.82,0.8208817821408751,0.7
35100970,content marketing,marketing,How do you optimize content marketing for mobile users?,strategy,Beginner,"[""Overview of content marketing"", ""Step-by-step implementation"", ""Best practices and tips"", ""Common challenges and solutions"", ""Tools and resources needed"", ""Conclusion and next steps""]","[""content"", ""digital"", ""marketing"", ""branding"", ""strategy""]",6,Marketing Students & Interns,"[""social media"", ""digital marketing"", ""brand management""]",55,9,2025-10-25 21:45:37,en,How do you optimize {keyword} for mobile users?,0.67,0.37732424614713195,0.73
35100971,investment planning,economics,How do you report on investment planning performance to stakeholders?,troubleshooting,Expert,"[""Overview of investment planning"", ""Step-by-step implementation"", ""Best practices and tips"", ""Common challenges and solutions"", ""Tools and resources needed"", ""Conclusion and next steps""]","[""investment"", ""planning"", ""finance"", ""troubleshooting"", ""business"", ""economics""]",6,Portfolio Managers & Financial Experts,"[""financial modeling"", ""portfolio management"", ""market analysis""]",69,10,2025-10-25 21:45:37,en,How do you report on {keyword} performance to stakeholders?,0.8,1.0,0.33
35100972,data science,it,What tools are essential for data science development?,how_to,Advanced,"[""Introduction to data science"", ""Key points and analysis"", ""Practical examples"", ""Expert insights"", ""Action items"", ""Conclusion""]","[""how_to"", ""technology"", ""software"", ""it"", ""science"", ""data""]",4,Senior Developers & Tech Leads,"[""machine learning"", ""cloud computing"", ""web development"", ""cybersecurity""]",54,8,2025-10-25 21:45:37,en,What tools are essential for {keyword} development?,0.81,0.8776019944008694,0.44
35100973,digital marketing,marketing,How do you develop an effective digital marketing strategy?,planning,Beginner,"[""Overview of digital marketing"", ""Step-by-step implementation"", ""Best practices and tips"", ""Common challenges and solutions"", ""Tools and resources needed"", ""Conclusion and next steps""]","[""planning"", ""promotion"", ""marketing"", ""digital"", ""advertising""]",6,Marketing Students & Interns,"[""social media"", ""content marketing"", ""brand management""]",59,9,2025-10-25 21:45:37,en,How do you develop an effective {keyword} strategy?,0.72,0.3376863379983028,0.83
35100974,data science,it,What certifications are valuable for data science professionals?,how_to,Intermediate,"[""Introduction to data science"", ""Key points and analysis"", ""Practical examples"", ""Expert insights"", ""Action items"", ""Conclusion""]","[""how_to"", ""technology"", ""development"", ""it"", ""science"", ""data""]",4,Junior to Mid-level Developers,"[""machine learning"", ""cybersecurity"", ""web development"", ""cloud computing""]",64,8,2025-10-25 21:45:37,en,What certifications are valuable for {keyword} professionals?,0.76,0.7636425286660775,0.62
35100975,machine learning,it,What ROI can be expected from machine learning implementation?,strategy,Expert,"[""Introduction to machine learning"", ""Key points and analysis"", ""Practical examples"", ""Expert insights"", ""Action items"", ""Conclusion""]","[""software"", ""it"", ""programming"", ""learning"", ""strategy"", ""machine""]",4,Architects & Technical Directors,"[""web development"", ""cloud computing"", ""data science"", ""cybersecurity""]",62,9,2025-10-25 21:45:37,en,What ROI can be expected from {keyword} implementation?,0.74,1.0,0.61
35100976,portfolio management,economics,How do you create a long-term plan for portfolio management?,comparison,Intermediate,"[""Overview of portfolio management"", ""Step-by-step implementation"", ""Best practices and tips"", ""Common challenges and solutions"", ""Tools and resources needed"", ""Conclusion and next steps""]","[""portfolio"", ""comparison"", ""management"", ""market"", ""business"", ""economics""]",6,Individual Investors & Analysts,"[""investment planning"", ""financial modeling"", ""market analysis""]",60,10,2025-10-25 21:45:37,en,How do you create a long-term plan for {keyword}?,0.71,0.6492752250762593,0.74
35100977,investment planning,economics,What metrics are most important for investment planning?,how_to,Beginner,"[""Introduction to investment planning"", ""Key points and analysis"", ""Practical examples"", ""Expert insights"", ""Action items"", ""Conclusion""]","[""investment"", ""how_to"", ""planning"", ""market"", ""economics""]",4,Students & New Investors,"[""portfolio management"", ""market analysis"", ""financial modeling""]",56,8,2025-10-25 21:45:37,en,What metrics are most important for {keyword}?,0.64,0.4670049348690667,0.82
35100978,financial modeling,economics,What metrics are most important for financial modeling?,comparison,Expert,"[""Introduction to financial modeling"", ""Key points and analysis"", ""Practical examples"", ""Expert insights"", ""Action items"", ""Conclusion""]","[""comparison"", ""modeling"", ""financial"", ""market"", ""business"", ""economics""]",4,Portfolio Managers & Financial Experts,"[""investment planning"", ""market analysis"", ""portfolio management""]",55,8,2025-10-25 21:45:37,en,What metrics are most important for {keyword}?,0.63,1.0,0.42
35100979,social media,marketing,What are the latest trends in social media?,best_practice,Expert,"[""Introduction to social media"", ""Key concepts and definitions"", ""Main categories or types"", ""Examples and case studies"", ""Benefits and advantages"", ""Summary and recommendations""]","[""media"", ""promotion"", ""best_practice"", ""marketing"", ""digital"", ""social""]",6,Marketing Directors & CMOs,"[""brand management"", ""content marketing"", ""digital marketing""]",43,8,2025-10-25 21:45:37,en,What are the latest trends in {keyword}?,0.88,1.0,0.65
35100980,investment planning,economics,What exit strategies should be considered for investment planning?,troubleshooting,Expert,"[""Introduction to investment planning"", ""Key points and analysis"", ""Practical examples"", ""Expert insights"", ""Action items"", ""Conclusion""]","[""investment"", ""planning"", ""finance"", ""troubleshooting"", ""business"", ""economics""]",4,Portfolio Managers & Financial Experts,"[""financial modeling"", ""portfolio management"", ""market analysis""]",66,9,2025-10-25 21:45:37,en,What exit strategies should be considered for {keyword}?,0.95,1.0,0.52
35100981,investment planning,economics,How do you identify opportunities in investment planning markets?,analysis,Expert,"[""Overview of investment planning"", ""Step-by-step implementation"", ""Best practices and tips"", ""Common challenges and solutions"", ""Tools and resources needed"", ""Conclusion and next steps""]","[""investment"", ""planning"", ""analysis"", ""market"", ""economics""]",6,Portfolio Managers & Financial Experts,"[""portfolio management"", ""financial modeling"", ""market analysis""]",65,9,2025-10-25 21:45:37,en,How do you identify opportunities in {keyword} markets?,0.67,1.0,0.72
35100982,machine learning,it,What is the recommended architecture for machine learning systems?,planning,Intermediate,"[""Introduction to machine learning"", ""Key points and analysis"", ""Practical examples"", ""Expert insights"", ""Action items"", ""Conclusion""]","[""planning"", ""development"", ""it"", ""software"", ""learning"", ""machine""]",4,Junior to Mid-level Developers,"[""cloud computing"", ""cybersecurity"", ""data science"", ""web development""]",66,9,2025-10-25 21:45:37,en,What is the recommended architecture for {keyword} systems?,0.84,0.7647515557382578,0.48
35100983,data science,it,How do you troubleshoot common issues with data science?,how_to,Advanced,"[""Overview of data science"", ""Step-by-step implementation"", ""Best practices and tips"", ""Common challenges and solutions"", ""Tools and resources needed"", ""Conclusion and next steps""]","[""how_to"", ""technology"", ""it"", ""programming"", ""science"", ""data""]",6,Senior Developers & Tech Leads,"[""cloud computing"", ""cybersecurity"", ""web development"", ""machine learning""]",56,9,2025-10-25 21:45:37,en,How do you troubleshoot common issues with {keyword}?,0.8,0.8350867688417487,0.32
35100984,financial modeling,economics,How do you benchmark financial modeling against alternatives?,implementation,Beginner,"[""Overview of financial modeling"", ""Step-by-step implementation"", ""Best practices and tips"", ""Common challenges and solutions"", ""Tools and resources needed"", ""Conclusion and next steps""]","[""investment"", ""implementation"", ""modeling"", ""financial"", ""market"", ""economics""]",6,Students & New Investors,"[""portfolio management"", ""investment planning"", ""market analysis""]",61,8,2025-10-25 21:45:37,en,How do you benchmark {keyword} against alternatives?,0.94,0.3716432872734539,0.51
35100985,portfolio management,economics,What are the risks associated with portfolio management?,optimization,Intermediate,"[""Introduction to portfolio management"", ""Key concepts and definitions"", ""Main categories or types"", ""Examples and case studies"", ""Benefits and advantages"", ""Summary and recommendations""]","[""finance"", ""portfolio"", ""management"", ""market"", ""optimization"", ""economics""]",6,Individual Investors & Analysts,"[""financial modeling"", ""market analysis"", ""investment planning""]",56,8,2025-10-25 21:45:37,en,What are the risks associated with {keyword}?,0.78,0.6242950871229312,0.66
35100986,web development,it,What certifications are valuable for web development professionals?,best_practice,Intermediate,"[""Introduction to web development"", ""Key points and analysis"", ""Practical examples"", ""Expert insights"", ""Action items"", ""Conclusion""]","[""software"", ""development"", ""it"", ""best_practice"", ""web""]",4,Junior to Mid-level Developers,"[""data science"", ""machine learning"", ""cloud computing"", ""cybersecurity""]",67,8,2025-10-25 21:45:37,en,What certifications are valuable for {keyword} professionals?,0.85,0.6054296206988687,0.76
35100987,social media,marketing,How do you reach new customers through social media?,planning,Intermediate,"[""Overview of social media"", ""Step-by-step implementation"", ""Best practices and tips"", ""Common challenges and solutions"", ""Tools and resources needed"", ""Conclusion and next steps""]","[""planning"", ""media"", ""promotion"", ""digital"", ""marketing"", ""social""]",6,Marketing Coordinators & Specialists,"[""brand management"", ""digital marketing"", ""content marketing""]",52,9,2025-10-25 21:45:37,en,How do you reach new customers through {keyword}?,0.95,0.7070547911423949,0.81
35100988,investment planning,economics,What are the risks associated with investment planning?,evaluation,Expert,"[""Introduction to investment planning"", ""Key concepts and definitions"", ""Main categories or types"", ""Examples and case studies"", ""Benefits and advantages"", ""Summary and recommendations""]","[""investment"", ""planning"", ""finance"", ""evaluation"", ""economics""]",6,Portfolio Managers & Financial Experts,"[""portfolio management"", ""market analysis"", ""financial modeling""]",55,8,2025-10-25 21:45:37,en,What are the risks associated with {keyword}?,0.68,1.0,0.66
35100989,social media,marketing,How do you personalize social media for different segments?,optimization,Advanced,"[""Overview of social media"", ""Step-by-step implementation"", ""Best practices and tips"", ""Common challenges and solutions"", ""Tools and resources needed"", ""Conclusion and next steps""]","[""media"", ""marketing"", ""digital"", ""social"", ""branding"", ""optimization""]",6,Marketing Managers & Strategists,"[""brand management"", ""digital marketing"", ""content marketing""]",59,9,2025-10-25 21:45:37,en,How do you personalize {keyword} for different segments?,0.77,0.9521761518116234,0.58
35100990,content marketing,marketing,How do you reach new customers through content marketing?,implementation,Intermediate,"[""Overview of content marketing"", ""Step-by-step implementation"", ""Best practices and tips"", ""Common challenges and solutions"", ""Tools and resources needed"", ""Conclusion and next steps""]","[""content"", ""implementation"", ""marketing"", ""digital"", ""branding""]",6,Marketing Coordinators & Specialists,"[""social media"", ""brand management"", ""digital marketing""]",57,9,2025-10-25 21:45:37,en,How do you reach new customers through {keyword}?,0.7,0.6240580518684689,0.72
35100991,financial modeling,economics,What insurance options are available for financial modeling?,how_to,Intermediate,"[""Introduction to financial modeling"", ""Key points and analysis"", ""Practical examples"", ""Expert insights"", ""Action items"", ""Conclusion""]","[""investment"", ""how_to"", ""modeling"", ""financial"", ""business"", ""economics""]",4,Individual Investors & Analysts,"[""market analysis"", ""portfolio management"", ""investment planning""]",60,8,2025-10-25 21:45:37,en,What insurance options are available for {keyword}?,0.95,0.6739218425930323,0.67
35100992,market analysis,economics,What insurance options are available for market analysis?,strategy,Beginner,"[""Introduction to market analysis"", ""Key points and analysis"", ""Practical examples"", ""Expert insights"", ""Action items"", ""Conclusion""]","[""investment"", ""analysis"", ""finance"", ""market"", ""strategy"", ""economics""]",4,Students & New Investors,"[""investment planning"", ""portfolio management"", ""financial modeling""]",57,8,2025-10-25 21:45:37,en,What insurance options are available for {keyword}?,0.91,0.327308332123907,0.61
35100993,cloud computing,it,How do you stay updated with cloud computing developments?,optimization,Intermediate,"[""Overview of cloud computing"", ""Step-by-step implementation"", ""Best practices and tips"", ""Common challenges and solutions"", ""Tools and resources needed"", ""Conclusion and next steps""]","[""computing"", ""cloud"", ""development"", ""it"", ""optimization"", ""technology""]",6,Junior to Mid-level Developers,"[""cybersecurity"", ""data science"", ""web development"", ""machine learning""]",58,9,2025-10-25 21:45:37,en,How do you stay updated with {keyword} developments?,0.92,0.7866495605359615,0.35
35100994,investment planning,economics,What is the optimal allocation for investment planning in a portfolio?,implementation,Advanced,"[""Introduction to investment planning"", ""Key points and analysis"", ""Practical examples"", ""Expert insights"", ""Action items"", ""Conclusion""]","[""investment"", ""planning"", ""finance"", ""implementation"", ""economics""]",4,Professional Investors & Advisors,"[""financial modeling"", ""market analysis"", ""portfolio management""]",70,11,2025-10-25 21:45:37,en,What is the optimal allocation for {keyword} in a portfolio?,0.83,0.8482899545833107,0.47
35100995,cloud computing,it,What is the recommended architecture for cloud computing systems?,planning,Beginner,"[""Introduction to cloud computing"", ""Key points and analysis"", ""Practical examples"", ""Expert insights"", ""Action items"", ""Conclusion""]","[""computing"", ""planning"", ""development"", ""it"", ""cloud"", ""technology""]",4,Students & Entry-level Developers,"[""machine learning"", ""web development"", ""cybersecurity"", ""data science""]",65,9,2025-10-25 21:45:37,en,What is the recommended architecture for {keyword} systems?,0.75,0.39089663888313153,0.46
35100996,social media,marketing,What timing strategies work for social media?,implementation,Beginner,"[""Introduction to social media"", ""Key points and analysis"", ""Practical examples"", ""Expert insights"", ""Action items"", ""Conclusion""]","[""media"", ""implementation"", ""promotion"", ""marketing"", ""digital"", ""social""]",4,Marketing Students & Interns,"[""digital marketing"", ""content marketing"", ""brand management""]",45,7,2025-10-25 21:45:37,en,What timing strategies work for {keyword}?,0.87,0.4509249387056722,0.73
35100997,brand management,marketing,What content types work best for brand management?,planning,Expert,"[""Introduction to brand management"", ""Key points and analysis"", ""Practical examples"", ""Expert insights"", ""Action items"", ""Conclusion""]","[""planning"", ""marketing"", ""management"", ""advertising"", ""branding"", ""brand""]",4,Marketing Directors & CMOs,"[""content marketing"", ""social media"", ""digital marketing""]",50,8,2025-10-25 21:45:37,en,What content types work best for {keyword}?,0.83,1.0,0.35
35100998,investment planning,economics,What are the risks associated with investment planning?,analysis,Advanced,"[""Introduction to investment planning"", ""Key concepts and definitions"", ""Main categories or types"", ""Examples and case studies"", ""Benefits and advantages"", ""Summary and recommendations""]","[""investment"", ""planning"", ""finance"", ""analysis"", ""business"", ""economics""]",6,Professional Investors & Advisors,"[""portfolio management"", ""financial modeling"", ""market analysis""]",55,8,2025-10-25 21:45:37,en,What are the risks associated with {keyword}?,0.64,0.8755054772273958,0.33
35100999,portfolio management,economics,What tools help analyze portfolio management data?,how_to,Advanced,"[""Introduction to portfolio management"", ""Key points and analysis"", ""Practical examples"", ""Expert insights"", ""Action items"", ""Conclusion""]","[""investment"", ""how_to"", ""portfolio"", ""management"", ""market"", ""economics""]",4,Professional Investors & Advisors,"[""financial modeling"", ""investment planning"", ""market analysis""]",50,7,2025-10-25 21:45:37,en,What tools help analyze {keyword} data?,0.91,0.9057225165397327,0.57
35101000,data science,it,Which frameworks support data science implementation?,comparison,Beginner,"[""Introduction to data science"", ""Key points and analysis"", ""Practical examples"", ""Expert insights"", ""Action items"", ""Conclusion""]","[""software"", ""it"", ""comparison"", ""programming"", ""science"", ""data""]",4,Students & Entry-level Developers,"[""cybersecurity"", ""cloud computing"", ""machine learning"", ""web development""]",53,6,2025-10-25 21:45:37,en,Which frameworks support {keyword} implementation?,0.71,0.4554512001721928,0.4
35101001,cloud computing,it,Which frameworks support cloud computing implementation?,best_practice,Advanced,"[""Introduction to cloud computing"", ""Key points and analysis"", ""Practical examples"", ""Expert insights"", ""Action items"", ""Conclusion""]","[""computing"", ""development"", ""it"", ""best_practice"", ""cloud"", ""technology""]",4,Senior Developers & Tech Leads,"[""cybersecurity"", ""data science"", ""machine learning"", ""web development""]",56,6,2025-10-25 21:45:37,en,Which frameworks support {keyword} implementation?,0.66,0.8886965764131531,0.33
35101002,portfolio management,economics,How do you measure portfolio management performance?,strategy,Advanced,"[""Overview of portfolio management"", ""Step-by-step implementation"", ""Best practices and tips"", ""Common challenges and solutions"", ""Tools and resources needed"", ""Conclusion and next steps""]","[""finance"", ""portfolio"", ""management"", ""business"", ""strategy"", ""economics""]",6,Professional Investors & Advisors,"[""investment planning"", ""financial modeling"", ""market analysis""]",52,7,2025-10-25 21:45:37,en,How do you measure {keyword} performance?,0.71,0.8951321726394136,0.84
35101003,brand management,marketing,What tools are essential for brand management analytics?,strategy,Expert,"[""Introduction to brand management"", ""Key points and analysis"", ""Practical examples"", ""Expert insights"", ""Action items"", ""Conclusion""]","[""promotion"", ""marketing"", ""management"", ""branding"", ""strategy"", ""brand""]",4,Marketing Directors & CMOs,"[""content marketing"", ""social media"", ""digital marketing""]",56,8,2025-10-25 21:45:37,en,What tools are essential for {keyword} analytics?,0.86,1.0,0.62
