record_id,keyword,category,question,question_type,difficulty_level,answer_outline,tags,estimated_read_time,target_audience,related_topics,question_length,word_count,created_date,language,source_template,engagement_score,complexity_score,popularity_score
38000348,financial modeling,economics,How do you create a long-term plan for financial modeling?,analysis,Intermediate,"[""Overview of financial modeling"", ""Step-by-step implementation"", ""Best practices and tips"", ""Common challenges and solutions"", ""Tools and resources needed"", ""Conclusion and next steps""]","[""finance"", ""analysis"", ""modeling"", ""financial"", ""business"", ""economics""]",6,Individual Investors & Analysts,"[""portfolio management"", ""market analysis"", ""investment planning""]",58,10,2025-10-25 21:49:34,en,How do you create a long-term plan for {keyword}?,0.64,0.6335868174242562,0.35
38000349,cloud computing,it,How do you design a scalable cloud computing solution?,implementation,Beginner,"[""Overview of cloud computing"", ""Step-by-step implementation"", ""Best practices and tips"", ""Common challenges and solutions"", ""Tools and resources needed"", ""Conclusion and next steps""]","[""computing"", ""development"", ""it"", ""implementation"", ""cloud"", ""technology""]",6,Students & Entry-level Developers,"[""data science"", ""web development"", ""machine learning"", ""cybersecurity""]",54,9,2025-10-25 21:49:34,en,How do you design a scalable {keyword} solution?,0.67,0.3150008665588293,0.33
38000350,data science,it,How do you stay updated with data science developments?,evaluation,Beginner,"[""Overview of data science"", ""Step-by-step implementation"", ""Best practices and tips"", ""Common challenges and solutions"", ""Tools and resources needed"", ""Conclusion and next steps""]","[""technology"", ""it"", ""programming"", ""science"", ""evaluation"", ""data""]",6,Students & Entry-level Developers,"[""cybersecurity"", ""machine learning"", ""web development"", ""cloud computing""]",55,9,2025-10-25 21:49:34,en,How do you stay updated with {keyword} developments?,0.62,0.3241830868830155,0.49
38000351,market analysis,economics,How do you protect your market analysis investments?,comparison,Advanced,"[""Overview of market analysis"", ""Step-by-step implementation"", ""Best practices and tips"", ""Common challenges and solutions"", ""Tools and resources needed"", ""Conclusion and next steps""]","[""analysis"", ""finance"", ""comparison"", ""market"", ""business"", ""economics""]",6,Professional Investors & Advisors,"[""portfolio management"", ""financial modeling"", ""investment planning""]",52,8,2025-10-25 21:49:34,en,How do you protect your {keyword} investments?,0.93,0.923358479818816,0.68
38000352,brand management,marketing,What budget should be allocated to brand management?,evaluation,Advanced,"[""Introduction to brand management"", ""Key points and analysis"", ""Practical examples"", ""Expert insights"", ""Action items"", ""Conclusion""]","[""promotion"", ""marketing"", ""management"", ""branding"", ""evaluation"", ""brand""]",4,Marketing Managers & Strategists,"[""content marketing"", ""social media"", ""digital marketing""]",52,8,2025-10-25 21:49:34,en,What budget should be allocated to {keyword}?,0.87,0.8929465606468688,0.79
38000353,financial modeling,economics,How do you diversify your portfolio using financial modeling?,implementation,Intermediate,"[""Overview of financial modeling"", ""Step-by-step implementation"", ""Best practices and tips"", ""Common challenges and solutions"", ""Tools and resources needed"", ""Conclusion and next steps""]","[""investment"", ""finance"", ""implementation"", ""modeling"", ""financial"", ""economics""]",6,Individual Investors & Analysts,"[""portfolio management"", ""investment planning"", ""market analysis""]",61,9,2025-10-25 21:49:34,en,How do you diversify your portfolio using {keyword}?,0.7,0.6483371276934394,0.54
38000354,content marketing,marketing,What budget should be allocated to content marketing?,optimization,Intermediate,"[""Introduction to content marketing"", ""Key points and analysis"", ""Practical examples"", ""Expert insights"", ""Action items"", ""Conclusion""]","[""content"", ""marketing"", ""advertising"", ""branding"", ""optimization""]",4,Marketing Coordinators & Specialists,"[""brand management"", ""social media"", ""digital marketing""]",53,8,2025-10-25 21:49:34,en,What budget should be allocated to {keyword}?,0.75,0.7377151190684906,0.6
38000355,data science,it,How do you get started with data science as a beginner?,planning,Beginner,"[""Overview of data science"", ""Step-by-step implementation"", ""Best practices and tips"", ""Common challenges and solutions"", ""Tools and resources needed"", ""Conclusion and next steps""]","[""planning"", ""software"", ""it"", ""programming"", ""science"", ""data""]",6,Students & Entry-level Developers,"[""machine learning"", ""web development"", ""cloud computing"", ""cybersecurity""]",55,11,2025-10-25 21:49:34,en,How do you get started with {keyword} as a beginner?,0.85,0.37904188988795495,0.4
38000356,social media,marketing,How do you track and analyze social media performance?,comparison,Intermediate,"[""Overview of social media"", ""Step-by-step implementation"", ""Best practices and tips"", ""Common challenges and solutions"", ""Tools and resources needed"", ""Conclusion and next steps""]","[""media"", ""promotion"", ""comparison"", ""marketing"", ""digital"", ""social""]",6,Marketing Coordinators & Specialists,"[""content marketing"", ""brand management"", ""digital marketing""]",54,9,2025-10-25 21:49:34,en,How do you track and analyze {keyword} performance?,0.75,0.6286506704909391,0.73
38000357,cloud computing,it,How do you stay updated with cloud computing developments?,implementation,Intermediate,"[""Overview of cloud computing"", ""Step-by-step implementation"", ""Best practices and tips"", ""Common challenges and solutions"", ""Tools and resources needed"", ""Conclusion and next steps""]","[""computing"", ""software"", ""development"", ""it"", ""implementation"", ""cloud""]",6,Junior to Mid-level Developers,"[""web development"", ""cybersecurity"", ""data science"", ""machine learning""]",58,9,2025-10-25 21:49:34,en,How do you stay updated with {keyword} developments?,0.62,0.7363645735622266,0.7
38000358,market analysis,economics,What insurance options are available for market analysis?,analysis,Beginner,"[""Introduction to market analysis"", ""Key points and analysis"", ""Practical examples"", ""Expert insights"", ""Action items"", ""Conclusion""]","[""market"", ""business"", ""economics"", ""analysis""]",4,Students & New Investors,"[""financial modeling"", ""investment planning"", ""portfolio management""]",57,8,2025-10-25 21:49:34,en,What insurance options are available for {keyword}?,0.67,0.32113244540572006,0.71
38000359,social media,marketing,What KPIs are most important for social media?,best_practice,Beginner,"[""Introduction to social media"", ""Key points and analysis"", ""Practical examples"", ""Expert insights"", ""Action items"", ""Conclusion""]","[""media"", ""best_practice"", ""digital"", ""marketing"", ""social"", ""advertising""]",4,Marketing Students & Interns,"[""digital marketing"", ""content marketing"", ""brand management""]",46,8,2025-10-25 21:49:34,en,What KPIs are most important for {keyword}?,0.7,0.456314316739319,0.44
38000360,financial modeling,economics,How do you protect your financial modeling investments?,analysis,Intermediate,"[""Overview of financial modeling"", ""Step-by-step implementation"", ""Best practices and tips"", ""Common challenges and solutions"", ""Tools and resources needed"", ""Conclusion and next steps""]","[""investment"", ""analysis"", ""modeling"", ""financial"", ""business"", ""economics""]",6,Individual Investors & Analysts,"[""investment planning"", ""portfolio management"", ""market analysis""]",55,8,2025-10-25 21:49:34,en,How do you protect your {keyword} investments?,0.92,0.7281122204165007,0.47
38000361,cloud computing,it,What security considerations should be taken when using cloud computing?,planning,Expert,"[""Introduction to cloud computing"", ""Key points and analysis"", ""Practical examples"", ""Expert insights"", ""Action items"", ""Conclusion""]","[""computing"", ""planning"", ""software"", ""it"", ""cloud"", ""technology""]",4,Architects & Technical Directors,"[""web development"", ""machine learning"", ""data science"", ""cybersecurity""]",72,10,2025-10-25 21:49:34,en,What security considerations should be taken when using {keyword}?,0.89,1.0,0.83
38000362,financial modeling,economics,What tools help analyze financial modeling data?,strategy,Advanced,"[""Introduction to financial modeling"", ""Key points and analysis"", ""Practical examples"", ""Expert insights"", ""Action items"", ""Conclusion""]","[""finance"", ""modeling"", ""financial"", ""business"", ""strategy"", ""economics""]",4,Professional Investors & Advisors,"[""market analysis"", ""portfolio management"", ""investment planning""]",48,7,2025-10-25 21:49:34,en,What tools help analyze {keyword} data?,0.72,0.9766613669313734,0.39
38000363,portfolio management,economics,What strategies work best for portfolio management investment?,analysis,Intermediate,"[""Introduction to portfolio management"", ""Key points and analysis"", ""Practical examples"", ""Expert insights"", ""Action items"", ""Conclusion""]","[""investment"", ""analysis"", ""portfolio"", ""management"", ""market"", ""economics""]",4,Individual Investors & Analysts,"[""market analysis"", ""investment planning"", ""financial modeling""]",62,8,2025-10-25 21:49:34,en,What strategies work best for {keyword} investment?,0.74,0.6528545806223951,0.66
38000364,web development,it,How do you choose the right technology stack for web development?,strategy,Beginner,"[""Overview of web development"", ""Step-by-step implementation"", ""Best practices and tips"", ""Common challenges and solutions"", ""Tools and resources needed"", ""Conclusion and next steps""]","[""development"", ""it"", ""programming"", ""strategy"", ""web""]",6,Students & Entry-level Developers,"[""data science"", ""cloud computing"", ""machine learning"", ""cybersecurity""]",65,11,2025-10-25 21:49:34,en,How do you choose the right technology stack for {keyword}?,0.63,0.4390953972617335,0.8
38000365,content marketing,marketing,What are the latest trends in content marketing?,how_to,Intermediate,"[""Introduction to content marketing"", ""Key concepts and definitions"", ""Main categories or types"", ""Examples and case studies"", ""Benefits and advantages"", ""Summary and recommendations""]","[""how_to"", ""content"", ""marketing"", ""digital"", ""branding""]",6,Marketing Coordinators & Specialists,"[""social media"", ""brand management"", ""digital marketing""]",48,8,2025-10-25 21:49:34,en,What are the latest trends in {keyword}?,0.89,0.722601166876359,0.5
38000366,content marketing,marketing,How do you identify the right audience for content marketing?,optimization,Beginner,"[""Overview of content marketing"", ""Step-by-step implementation"", ""Best practices and tips"", ""Common challenges and solutions"", ""Tools and resources needed"", ""Conclusion and next steps""]","[""content"", ""marketing"", ""advertising"", ""branding"", ""optimization""]",6,Marketing Students & Interns,"[""social media"", ""brand management"", ""digital marketing""]",61,10,2025-10-25 21:49:34,en,How do you identify the right audience for {keyword}?,0.73,0.33911526959682026,0.78
38000367,cloud computing,it,Which frameworks support cloud computing implementation?,comparison,Beginner,"[""Introduction to cloud computing"", ""Key points and analysis"", ""Practical examples"", ""Expert insights"", ""Action items"", ""Conclusion""]","[""computing"", ""software"", ""it"", ""comparison"", ""programming"", ""cloud""]",4,Students & Entry-level Developers,"[""web development"", ""machine learning"", ""data science"", ""cybersecurity""]",56,6,2025-10-25 21:49:34,en,Which frameworks support {keyword} implementation?,0.8,0.32363160047672695,0.38
38000368,social media,marketing,How do you attribute success to social media efforts?,strategy,Expert,"[""Overview of social media"", ""Step-by-step implementation"", ""Best practices and tips"", ""Common challenges and solutions"", ""Tools and resources needed"", ""Conclusion and next steps""]","[""media"", ""marketing"", ""social"", ""advertising"", ""branding"", ""strategy""]",6,Marketing Directors & CMOs,"[""brand management"", ""digital marketing"", ""content marketing""]",53,9,2025-10-25 21:49:34,en,How do you attribute success to {keyword} efforts?,0.81,1.0,0.37
38000369,social media,marketing,What messaging works best in social media campaigns?,optimization,Expert,"[""Introduction to social media"", ""Key points and analysis"", ""Practical examples"", ""Expert insights"", ""Action items"", ""Conclusion""]","[""media"", ""promotion"", ""marketing"", ""digital"", ""social"", ""optimization""]",4,Marketing Directors & CMOs,"[""brand management"", ""content marketing"", ""digital marketing""]",52,8,2025-10-25 21:49:34,en,What messaging works best in {keyword} campaigns?,0.64,1.0,0.69
38000370,market analysis,economics,How do you protect your market analysis investments?,comparison,Intermediate,"[""Overview of market analysis"", ""Step-by-step implementation"", ""Best practices and tips"", ""Common challenges and solutions"", ""Tools and resources needed"", ""Conclusion and next steps""]","[""investment"", ""analysis"", ""comparison"", ""market"", ""economics""]",6,Individual Investors & Analysts,"[""portfolio management"", ""investment planning"", ""financial modeling""]",52,8,2025-10-25 21:49:34,en,How do you protect your {keyword} investments?,0.73,0.6065002719189522,0.33
38000371,portfolio management,economics,How do you diversify your portfolio using portfolio management?,analysis,Advanced,"[""Overview of portfolio management"", ""Step-by-step implementation"", ""Best practices and tips"", ""Common challenges and solutions"", ""Tools and resources needed"", ""Conclusion and next steps""]","[""investment"", ""analysis"", ""portfolio"", ""management"", ""business"", ""economics""]",6,Professional Investors & Advisors,"[""financial modeling"", ""market analysis"", ""investment planning""]",63,9,2025-10-25 21:49:34,en,How do you diversify your portfolio using {keyword}?,0.61,0.8401777520868238,0.4
38000372,portfolio management,economics,How does global economics impact portfolio management?,evaluation,Beginner,"[""Introduction to portfolio management"", ""Key points and analysis"", ""Practical examples"", ""Expert insights"", ""Action items"", ""Conclusion""]","[""finance"", ""portfolio"", ""management"", ""evaluation"", ""business"", ""economics""]",4,Students & New Investors,"[""investment planning"", ""financial modeling"", ""market analysis""]",54,7,2025-10-25 21:49:34,en,How does global economics impact {keyword}?,0.7,0.35989543726007067,0.54
38000373,social media,marketing,What are the latest trends in social media?,planning,Intermediate,"[""Introduction to social media"", ""Key concepts and definitions"", ""Main categories or types"", ""Examples and case studies"", ""Benefits and advantages"", ""Summary and recommendations""]","[""planning"", ""media"", ""digital"", ""marketing"", ""social"", ""advertising""]",6,Marketing Coordinators & Specialists,"[""brand management"", ""content marketing"", ""digital marketing""]",43,8,2025-10-25 21:49:34,en,What are the latest trends in {keyword}?,0.64,0.7831806171738958,0.39
38000374,content marketing,marketing,What are the latest trends in content marketing?,implementation,Beginner,"[""Introduction to content marketing"", ""Key concepts and definitions"", ""Main categories or types"", ""Examples and case studies"", ""Benefits and advantages"", ""Summary and recommendations""]","[""content"", ""implementation"", ""marketing"", ""advertising"", ""branding""]",6,Marketing Students & Interns,"[""brand management"", ""digital marketing"", ""social media""]",48,8,2025-10-25 21:49:34,en,What are the latest trends in {keyword}?,0.83,0.4919562170829738,0.67
38000375,financial modeling,economics,How do you diversify your portfolio using financial modeling?,planning,Expert,"[""Overview of financial modeling"", ""Step-by-step implementation"", ""Best practices and tips"", ""Common challenges and solutions"", ""Tools and resources needed"", ""Conclusion and next steps""]","[""planning"", ""finance"", ""modeling"", ""financial"", ""business"", ""economics""]",6,Portfolio Managers & Financial Experts,"[""market analysis"", ""portfolio management"", ""investment planning""]",61,9,2025-10-25 21:49:34,en,How do you diversify your portfolio using {keyword}?,0.89,1.0,0.8
38000376,financial modeling,economics,What are the seasonal patterns in financial modeling?,evaluation,Intermediate,"[""Introduction to financial modeling"", ""Key concepts and definitions"", ""Main categories or types"", ""Examples and case studies"", ""Benefits and advantages"", ""Summary and recommendations""]","[""finance"", ""modeling"", ""financial"", ""evaluation"", ""market"", ""economics""]",6,Individual Investors & Analysts,"[""investment planning"", ""portfolio management"", ""market analysis""]",53,8,2025-10-25 21:49:34,en,What are the seasonal patterns in {keyword}?,0.66,0.7586411929723786,0.63
38000377,investment planning,economics,What are the risks associated with investment planning?,comparison,Expert,"[""Introduction to investment planning"", ""Key concepts and definitions"", ""Main categories or types"", ""Examples and case studies"", ""Benefits and advantages"", ""Summary and recommendations""]","[""investment"", ""planning"", ""comparison"", ""business"", ""economics""]",6,Portfolio Managers & Financial Experts,"[""financial modeling"", ""portfolio management"", ""market analysis""]",55,8,2025-10-25 21:49:34,en,What are the risks associated with {keyword}?,0.77,1.0,0.63
38000378,cybersecurity,it,What is the recommended architecture for cybersecurity systems?,how_to,Advanced,"[""Introduction to cybersecurity"", ""Key points and analysis"", ""Practical examples"", ""Expert insights"", ""Action items"", ""Conclusion""]","[""how_to"", ""software"", ""it"", ""cybersecurity"", ""technology""]",4,Senior Developers & Tech Leads,"[""cloud computing"", ""machine learning"", ""web development"", ""data science""]",63,8,2025-10-25 21:49:34,en,What is the recommended architecture for {keyword} systems?,0.73,0.9240072874008584,0.89
38000379,portfolio management,economics,How do economic conditions affect portfolio management performance?,best_practice,Intermediate,"[""Introduction to portfolio management"", ""Key points and analysis"", ""Practical examples"", ""Expert insights"", ""Action items"", ""Conclusion""]","[""investment"", ""portfolio"", ""best_practice"", ""management"", ""market"", ""economics""]",4,Individual Investors & Analysts,"[""market analysis"", ""investment planning"", ""financial modeling""]",67,8,2025-10-25 21:49:34,en,How do economic conditions affect {keyword} performance?,0.83,0.6209125794319169,0.72
38000380,market analysis,economics,How do you adjust your market analysis strategy during volatility?,best_practice,Expert,"[""Overview of market analysis"", ""Step-by-step implementation"", ""Best practices and tips"", ""Common challenges and solutions"", ""Tools and resources needed"", ""Conclusion and next steps""]","[""finance"", ""analysis"", ""best_practice"", ""market"", ""business"", ""economics""]",6,Portfolio Managers & Financial Experts,"[""investment planning"", ""financial modeling"", ""portfolio management""]",66,10,2025-10-25 21:49:34,en,How do you adjust your {keyword} strategy during volatility?,0.68,1.0,0.69
38000381,content marketing,marketing,What messaging works best in content marketing campaigns?,comparison,Beginner,"[""Introduction to content marketing"", ""Key points and analysis"", ""Practical examples"", ""Expert insights"", ""Action items"", ""Conclusion""]","[""content"", ""comparison"", ""marketing"", ""digital"", ""advertising""]",4,Marketing Students & Interns,"[""social media"", ""digital marketing"", ""brand management""]",57,8,2025-10-25 21:49:34,en,What messaging works best in {keyword} campaigns?,0.84,0.3838374302497879,0.35
38000382,machine learning,it,What is the recommended architecture for machine learning systems?,evaluation,Advanced,"[""Introduction to machine learning"", ""Key points and analysis"", ""Practical examples"", ""Expert insights"", ""Action items"", ""Conclusion""]","[""it"", ""programming"", ""learning"", ""evaluation"", ""machine"", ""technology""]",4,Senior Developers & Tech Leads,"[""web development"", ""cloud computing"", ""data science"", ""cybersecurity""]",66,9,2025-10-25 21:49:34,en,What is the recommended architecture for {keyword} systems?,0.6,0.828785438204529,0.72
38000383,brand management,marketing,What tools are essential for brand management analytics?,optimization,Beginner,"[""Introduction to brand management"", ""Key points and analysis"", ""Practical examples"", ""Expert insights"", ""Action items"", ""Conclusion""]","[""digital"", ""marketing"", ""management"", ""branding"", ""optimization"", ""brand""]",4,Marketing Students & Interns,"[""social media"", ""content marketing"", ""digital marketing""]",56,8,2025-10-25 21:49:34,en,What tools are essential for {keyword} analytics?,0.64,0.3925155952010418,0.39
38000384,market analysis,economics,What are the risks associated with market analysis?,comparison,Intermediate,"[""Introduction to market analysis"", ""Key concepts and definitions"", ""Main categories or types"", ""Examples and case studies"", ""Benefits and advantages"", ""Summary and recommendations""]","[""investment"", ""analysis"", ""comparison"", ""market"", ""economics""]",6,Individual Investors & Analysts,"[""investment planning"", ""portfolio management"", ""financial modeling""]",51,8,2025-10-25 21:49:34,en,What are the risks associated with {keyword}?,0.94,0.7831432762571591,0.71
38000385,financial modeling,economics,How do you report on financial modeling performance to stakeholders?,troubleshooting,Beginner,"[""Overview of financial modeling"", ""Step-by-step implementation"", ""Best practices and tips"", ""Common challenges and solutions"", ""Tools and resources needed"", ""Conclusion and next steps""]","[""troubleshooting"", ""modeling"", ""financial"", ""market"", ""business"", ""economics""]",6,Students & New Investors,"[""investment planning"", ""portfolio management"", ""market analysis""]",68,10,2025-10-25 21:49:34,en,How do you report on {keyword} performance to stakeholders?,0.81,0.32920988139185864,0.81
38000386,social media,marketing,How is AI changing social media approaches?,strategy,Intermediate,"[""Introduction to social media"", ""Key points and analysis"", ""Practical examples"", ""Expert insights"", ""Action items"", ""Conclusion""]","[""media"", ""promotion"", ""marketing"", ""social"", ""advertising"", ""strategy""]",4,Marketing Coordinators & Specialists,"[""content marketing"", ""digital marketing"", ""brand management""]",43,7,2025-10-25 21:49:34,en,How is AI changing {keyword} approaches?,0.75,0.7433371799394781,0.57
38000387,portfolio management,economics,How do you adjust your portfolio management strategy during volatility?,evaluation,Advanced,"[""Overview of portfolio management"", ""Step-by-step implementation"", ""Best practices and tips"", ""Common challenges and solutions"", ""Tools and resources needed"", ""Conclusion and next steps""]","[""finance"", ""portfolio"", ""management"", ""evaluation"", ""business"", ""economics""]",6,Professional Investors & Advisors,"[""market analysis"", ""financial modeling"", ""investment planning""]",71,10,2025-10-25 21:49:34,en,How do you adjust your {keyword} strategy during volatility?,0.85,0.9318462774190754,0.82
38000388,digital marketing,marketing,How do you automate digital marketing processes?,analysis,Advanced,"[""Overview of digital marketing"", ""Step-by-step implementation"", ""Best practices and tips"", ""Common challenges and solutions"", ""Tools and resources needed"", ""Conclusion and next steps""]","[""analysis"", ""marketing"", ""digital"", ""advertising"", ""branding""]",6,Marketing Managers & Strategists,"[""brand management"", ""content marketing"", ""social media""]",48,7,2025-10-25 21:49:34,en,How do you automate {keyword} processes?,0.71,0.9064173936780593,0.75
38000389,digital marketing,marketing,What content types work best for digital marketing?,best_practice,Expert,"[""Introduction to digital marketing"", ""Key points and analysis"", ""Practical examples"", ""Expert insights"", ""Action items"", ""Conclusion""]","[""marketing"", ""promotion"", ""best_practice"", ""digital""]",4,Marketing Directors & CMOs,"[""social media"", ""content marketing"", ""brand management""]",51,8,2025-10-25 21:49:34,en,What content types work best for {keyword}?,0.61,1.0,0.7
38000390,content marketing,marketing,What budget should be allocated to content marketing?,comparison,Expert,"[""Introduction to content marketing"", ""Key points and analysis"", ""Practical examples"", ""Expert insights"", ""Action items"", ""Conclusion""]","[""content"", ""comparison"", ""marketing"", ""digital"", ""advertising""]",4,Marketing Directors & CMOs,"[""social media"", ""digital marketing"", ""brand management""]",53,8,2025-10-25 21:49:34,en,What budget should be allocated to {keyword}?,0.73,1.0,0.59
