record_id,keyword,category,question,question_type,difficulty_level,answer_outline,tags,estimated_read_time,target_audience,related_topics,question_length,word_count,created_date,language,source_template,engagement_score,complexity_score,popularity_score
46800962,cybersecurity,it,What are the best practices for cybersecurity development?,strategy,Intermediate,"[""Introduction to cybersecurity"", ""Key concepts and definitions"", ""Main categories or types"", ""Examples and case studies"", ""Benefits and advantages"", ""Summary and recommendations""]","[""software"", ""development"", ""it"", ""strategy"", ""cybersecurity""]",5,Junior to Mid-level Developers,"[""machine learning"", ""web development"", ""data science"", ""cloud computing""]",58,8,2025-10-25 22:01:45,en,What are the best practices for {keyword} development?,0.92,0.7110631923922486,0.74
46800963,financial modeling,economics,What insurance options are available for financial modeling?,comparison,Expert,"[""Introduction to financial modeling"", ""Key points and analysis"", ""Practical examples"", ""Expert insights"", ""Action items"", ""Conclusion""]","[""investment"", ""finance"", ""comparison"", ""modeling"", ""financial"", ""economics""]",4,Portfolio Managers & Financial Experts,"[""portfolio management"", ""investment planning"", ""market analysis""]",60,8,2025-10-25 22:01:45,en,What insurance options are available for {keyword}?,0.84,1.0,0.74
46800964,financial modeling,economics,How do you benchmark financial modeling against alternatives?,strategy,Advanced,"[""Overview of financial modeling"", ""Step-by-step implementation"", ""Best practices and tips"", ""Common challenges and solutions"", ""Tools and resources needed"", ""Conclusion and next steps""]","[""finance"", ""modeling"", ""financial"", ""business"", ""strategy"", ""economics""]",6,Professional Investors & Advisors,"[""market analysis"", ""investment planning"", ""portfolio management""]",61,8,2025-10-25 22:01:45,en,How do you benchmark {keyword} against alternatives?,0.68,0.8558347884808757,0.6
46800965,market analysis,economics,How do you create a long-term plan for market analysis?,how_to,Intermediate,"[""Overview of market analysis"", ""Step-by-step implementation"", ""Best practices and tips"", ""Common challenges and solutions"", ""Tools and resources needed"", ""Conclusion and next steps""]","[""investment"", ""how_to"", ""analysis"", ""market"", ""economics""]",6,Individual Investors & Analysts,"[""financial modeling"", ""portfolio management"", ""investment planning""]",55,10,2025-10-25 22:01:45,en,How do you create a long-term plan for {keyword}?,0.7,0.7660427833344425,0.42
46800966,cybersecurity,it,How do you optimize cybersecurity for different platforms?,planning,Intermediate,"[""Overview of cybersecurity"", ""Step-by-step implementation"", ""Best practices and tips"", ""Common challenges and solutions"", ""Tools and resources needed"", ""Conclusion and next steps""]","[""software"", ""planning"", ""it"", ""programming"", ""cybersecurity""]",5,Junior to Mid-level Developers,"[""web development"", ""cloud computing"", ""data science"", ""machine learning""]",58,8,2025-10-25 22:01:45,en,How do you optimize {keyword} for different platforms?,0.88,0.7559774546317569,0.82
46800967,cloud computing,it,How do you convince stakeholders to invest in cloud computing?,best_practice,Beginner,"[""Overview of cloud computing"", ""Step-by-step implementation"", ""Best practices and tips"", ""Common challenges and solutions"", ""Tools and resources needed"", ""Conclusion and next steps""]","[""computing"", ""development"", ""it"", ""programming"", ""best_practice"", ""cloud""]",6,Students & Entry-level Developers,"[""cybersecurity"", ""web development"", ""data science"", ""machine learning""]",62,10,2025-10-25 22:01:45,en,How do you convince stakeholders to invest in {keyword}?,0.79,0.48677110801711665,0.53
46800968,investment planning,economics,How do you measure investment planning performance?,implementation,Advanced,"[""Overview of investment planning"", ""Step-by-step implementation"", ""Best practices and tips"", ""Common challenges and solutions"", ""Tools and resources needed"", ""Conclusion and next steps""]","[""investment"", ""planning"", ""finance"", ""implementation"", ""economics""]",6,Professional Investors & Advisors,"[""portfolio management"", ""financial modeling"", ""market analysis""]",51,7,2025-10-25 22:01:45,en,How do you measure {keyword} performance?,0.64,0.9284932116798146,0.34
46800969,investment planning,economics,What indicators predict investment planning market movements?,implementation,Advanced,"[""Introduction to investment planning"", ""Key points and analysis"", ""Practical examples"", ""Expert insights"", ""Action items"", ""Conclusion""]","[""investment"", ""planning"", ""implementation"", ""market"", ""economics""]",4,Professional Investors & Advisors,"[""portfolio management"", ""financial modeling"", ""market analysis""]",61,7,2025-10-25 22:01:45,en,What indicators predict {keyword} market movements?,0.84,0.8412347390867786,0.72
46800970,financial modeling,economics,How do you create a long-term plan for financial modeling?,implementation,Beginner,"[""Overview of financial modeling"", ""Step-by-step implementation"", ""Best practices and tips"", ""Common challenges and solutions"", ""Tools and resources needed"", ""Conclusion and next steps""]","[""investment"", ""implementation"", ""modeling"", ""financial"", ""business"", ""economics""]",6,Students & New Investors,"[""market analysis"", ""portfolio management"", ""investment planning""]",58,10,2025-10-25 22:01:45,en,How do you create a long-term plan for {keyword}?,0.65,0.32297561489461024,0.48
46800971,portfolio management,economics,What timeline is realistic for portfolio management returns?,analysis,Advanced,"[""Introduction to portfolio management"", ""Key points and analysis"", ""Practical examples"", ""Expert insights"", ""Action items"", ""Conclusion""]","[""analysis"", ""finance"", ""portfolio"", ""management"", ""business"", ""economics""]",4,Professional Investors & Advisors,"[""financial modeling"", ""investment planning"", ""market analysis""]",60,8,2025-10-25 22:01:45,en,What timeline is realistic for {keyword} returns?,0.93,0.9094680855556705,0.77
46800972,portfolio management,economics,What tools help analyze portfolio management data?,planning,Advanced,"[""Introduction to portfolio management"", ""Key points and analysis"", ""Practical examples"", ""Expert insights"", ""Action items"", ""Conclusion""]","[""investment"", ""planning"", ""portfolio"", ""management"", ""market"", ""economics""]",4,Professional Investors & Advisors,"[""financial modeling"", ""market analysis"", ""investment planning""]",50,7,2025-10-25 22:01:45,en,What tools help analyze {keyword} data?,0.76,0.9129051830317422,0.55
46800973,cloud computing,it,What career opportunities exist in cloud computing?,evaluation,Advanced,"[""Introduction to cloud computing"", ""Key points and analysis"", ""Practical examples"", ""Expert insights"", ""Action items"", ""Conclusion""]","[""computing"", ""software"", ""it"", ""evaluation"", ""cloud"", ""technology""]",4,Senior Developers & Tech Leads,"[""data science"", ""cybersecurity"", ""web development"", ""machine learning""]",51,7,2025-10-25 22:01:45,en,What career opportunities exist in {keyword}?,0.61,0.9051158997634452,0.66
46800974,brand management,marketing,How do you develop an effective brand management strategy?,troubleshooting,Beginner,"[""Overview of brand management"", ""Step-by-step implementation"", ""Best practices and tips"", ""Common challenges and solutions"", ""Tools and resources needed"", ""Conclusion and next steps""]","[""promotion"", ""troubleshooting"", ""digital"", ""marketing"", ""management"", ""brand""]",6,Marketing Students & Interns,"[""social media"", ""digital marketing"", ""content marketing""]",58,9,2025-10-25 22:01:45,en,How do you develop an effective {keyword} strategy?,0.75,0.43224834031004344,0.69
46800975,brand management,marketing,What content types work best for brand management?,best_practice,Intermediate,"[""Introduction to brand management"", ""Key points and analysis"", ""Practical examples"", ""Expert insights"", ""Action items"", ""Conclusion""]","[""promotion"", ""best_practice"", ""marketing"", ""management"", ""digital"", ""brand""]",4,Marketing Coordinators & Specialists,"[""digital marketing"", ""social media"", ""content marketing""]",50,8,2025-10-25 22:01:45,en,What content types work best for {keyword}?,0.67,0.7991061392582701,0.35
46800976,market analysis,economics,How do economic conditions affect market analysis performance?,comparison,Advanced,"[""Introduction to market analysis"", ""Key points and analysis"", ""Practical examples"", ""Expert insights"", ""Action items"", ""Conclusion""]","[""investment"", ""analysis"", ""comparison"", ""market"", ""business"", ""economics""]",4,Professional Investors & Advisors,"[""investment planning"", ""portfolio management"", ""financial modeling""]",62,8,2025-10-25 22:01:45,en,How do economic conditions affect {keyword} performance?,0.79,0.9313458436028316,0.69
46800977,cloud computing,it,How do you measure the success of cloud computing projects?,troubleshooting,Beginner,"[""Overview of cloud computing"", ""Step-by-step implementation"", ""Best practices and tips"", ""Common challenges and solutions"", ""Tools and resources needed"", ""Conclusion and next steps""]","[""computing"", ""software"", ""it"", ""programming"", ""troubleshooting"", ""cloud""]",6,Students & Entry-level Developers,"[""machine learning"", ""cybersecurity"", ""web development"", ""data science""]",59,10,2025-10-25 22:01:45,en,How do you measure the success of {keyword} projects?,0.87,0.4625363997868176,0.71
46800978,investment planning,economics,What indicators predict investment planning market movements?,evaluation,Intermediate,"[""Introduction to investment planning"", ""Key points and analysis"", ""Practical examples"", ""Expert insights"", ""Action items"", ""Conclusion""]","[""investment"", ""planning"", ""finance"", ""evaluation"", ""market"", ""economics""]",4,Individual Investors & Analysts,"[""portfolio management"", ""market analysis"", ""financial modeling""]",61,7,2025-10-25 22:01:45,en,What indicators predict {keyword} market movements?,0.83,0.781219118023382,0.62
46800979,brand management,marketing,How do you automate brand management processes?,troubleshooting,Beginner,"[""Overview of brand management"", ""Step-by-step implementation"", ""Best practices and tips"", ""Common challenges and solutions"", ""Tools and resources needed"", ""Conclusion and next steps""]","[""troubleshooting"", ""marketing"", ""management"", ""advertising"", ""branding"", ""brand""]",6,Marketing Students & Interns,"[""content marketing"", ""digital marketing"", ""social media""]",47,7,2025-10-25 22:01:45,en,How do you automate {keyword} processes?,0.77,0.31311781152109297,0.53
46800980,social media,marketing,How do you track and analyze social media performance?,how_to,Expert,"[""Overview of social media"", ""Step-by-step implementation"", ""Best practices and tips"", ""Common challenges and solutions"", ""Tools and resources needed"", ""Conclusion and next steps""]","[""how_to"", ""media"", ""promotion"", ""marketing"", ""social"", ""branding""]",6,Marketing Directors & CMOs,"[""brand management"", ""content marketing"", ""digital marketing""]",54,9,2025-10-25 22:01:45,en,How do you track and analyze {keyword} performance?,0.86,1.0,0.38
46800981,cybersecurity,it,How do you get started with cybersecurity as a beginner?,planning,Expert,"[""Overview of cybersecurity"", ""Step-by-step implementation"", ""Best practices and tips"", ""Common challenges and solutions"", ""Tools and resources needed"", ""Conclusion and next steps""]","[""planning"", ""development"", ""it"", ""cybersecurity"", ""technology""]",5,Architects & Technical Directors,"[""machine learning"", ""cloud computing"", ""data science"", ""web development""]",56,10,2025-10-25 22:01:45,en,How do you get started with {keyword} as a beginner?,0.77,1.0,0.42
46800982,brand management,marketing,What timing strategies work for brand management?,best_practice,Beginner,"[""Introduction to brand management"", ""Key points and analysis"", ""Practical examples"", ""Expert insights"", ""Action items"", ""Conclusion""]","[""best_practice"", ""digital"", ""marketing"", ""management"", ""advertising"", ""brand""]",4,Marketing Students & Interns,"[""social media"", ""digital marketing"", ""content marketing""]",49,7,2025-10-25 22:01:45,en,What timing strategies work for {keyword}?,0.75,0.447050654594836,0.37
46800983,digital marketing,marketing,How do you innovate within digital marketing?,best_practice,Advanced,"[""Overview of digital marketing"", ""Step-by-step implementation"", ""Best practices and tips"", ""Common challenges and solutions"", ""Tools and resources needed"", ""Conclusion and next steps""]","[""best_practice"", ""marketing"", ""digital"", ""advertising"", ""branding""]",6,Marketing Managers & Strategists,"[""brand management"", ""content marketing"", ""social media""]",45,7,2025-10-25 22:01:45,en,How do you innovate within {keyword}?,0.63,0.8625510634987419,0.76
46800984,market analysis,economics,How do you protect your market analysis investments?,optimization,Beginner,"[""Overview of market analysis"", ""Step-by-step implementation"", ""Best practices and tips"", ""Common challenges and solutions"", ""Tools and resources needed"", ""Conclusion and next steps""]","[""finance"", ""analysis"", ""business"", ""market"", ""optimization"", ""economics""]",6,Students & New Investors,"[""financial modeling"", ""portfolio management"", ""investment planning""]",52,8,2025-10-25 22:01:45,en,How do you protect your {keyword} investments?,0.63,0.3141219979489372,0.55
46800985,portfolio management,economics,What tools help analyze portfolio management data?,how_to,Beginner,"[""Introduction to portfolio management"", ""Key points and analysis"", ""Practical examples"", ""Expert insights"", ""Action items"", ""Conclusion""]","[""how_to"", ""finance"", ""portfolio"", ""management"", ""market"", ""economics""]",4,Students & New Investors,"[""market analysis"", ""investment planning"", ""financial modeling""]",50,7,2025-10-25 22:01:45,en,What tools help analyze {keyword} data?,0.68,0.44209198682062945,0.77
46800986,cloud computing,it,What tools are essential for cloud computing development?,analysis,Intermediate,"[""Introduction to cloud computing"", ""Key points and analysis"", ""Practical examples"", ""Expert insights"", ""Action items"", ""Conclusion""]","[""computing"", ""analysis"", ""it"", ""programming"", ""cloud"", ""technology""]",4,Junior to Mid-level Developers,"[""data science"", ""web development"", ""machine learning"", ""cybersecurity""]",57,8,2025-10-25 22:01:45,en,What tools are essential for {keyword} development?,0.91,0.7943470859629865,0.63
46800987,web development,it,How can web development improve system performance and scalability?,optimization,Advanced,"[""Introduction to web development"", ""Key points and analysis"", ""Practical examples"", ""Expert insights"", ""Action items"", ""Conclusion""]","[""software"", ""development"", ""it"", ""optimization"", ""web""]",4,Senior Developers & Tech Leads,"[""machine learning"", ""cloud computing"", ""data science"", ""cybersecurity""]",67,9,2025-10-25 22:01:45,en,How can {keyword} improve system performance and scalability?,0.84,0.9693492763771292,0.89
46800988,machine learning,it,How can machine learning improve system performance and scalability?,how_to,Expert,"[""Introduction to machine learning"", ""Key points and analysis"", ""Practical examples"", ""Expert insights"", ""Action items"", ""Conclusion""]","[""how_to"", ""development"", ""it"", ""programming"", ""learning"", ""machine""]",4,Architects & Technical Directors,"[""cybersecurity"", ""cloud computing"", ""web development"", ""data science""]",68,9,2025-10-25 22:01:45,en,How can {keyword} improve system performance and scalability?,0.64,1.0,0.8
46800989,portfolio management,economics,How do you create a long-term plan for portfolio management?,how_to,Intermediate,"[""Overview of portfolio management"", ""Step-by-step implementation"", ""Best practices and tips"", ""Common challenges and solutions"", ""Tools and resources needed"", ""Conclusion and next steps""]","[""investment"", ""how_to"", ""portfolio"", ""management"", ""market"", ""economics""]",6,Individual Investors & Analysts,"[""financial modeling"", ""investment planning"", ""market analysis""]",60,10,2025-10-25 22:01:45,en,How do you create a long-term plan for {keyword}?,0.88,0.766701378365464,0.55
46800990,cloud computing,it,How do you optimize cloud computing for different platforms?,strategy,Beginner,"[""Overview of cloud computing"", ""Step-by-step implementation"", ""Best practices and tips"", ""Common challenges and solutions"", ""Tools and resources needed"", ""Conclusion and next steps""]","[""computing"", ""software"", ""cloud"", ""it"", ""strategy"", ""technology""]",6,Students & Entry-level Developers,"[""data science"", ""machine learning"", ""web development"", ""cybersecurity""]",60,9,2025-10-25 22:01:45,en,How do you optimize {keyword} for different platforms?,0.76,0.38187862444426984,0.61
46800991,investment planning,economics,How does global economics impact investment planning?,how_to,Beginner,"[""Introduction to investment planning"", ""Key points and analysis"", ""Practical examples"", ""Expert insights"", ""Action items"", ""Conclusion""]","[""investment"", ""how_to"", ""planning"", ""market"", ""business"", ""economics""]",4,Students & New Investors,"[""financial modeling"", ""market analysis"", ""portfolio management""]",53,7,2025-10-25 22:01:45,en,How does global economics impact {keyword}?,0.88,0.4917783551357692,0.62
46800992,digital marketing,marketing,How do you develop an effective digital marketing strategy?,best_practice,Advanced,"[""Overview of digital marketing"", ""Step-by-step implementation"", ""Best practices and tips"", ""Common challenges and solutions"", ""Tools and resources needed"", ""Conclusion and next steps""]","[""best_practice"", ""marketing"", ""digital"", ""advertising"", ""branding""]",6,Marketing Managers & Strategists,"[""content marketing"", ""brand management"", ""social media""]",59,9,2025-10-25 22:01:45,en,How do you develop an effective {keyword} strategy?,0.93,0.9195198887561309,0.58
46800993,digital marketing,marketing,How do you automate digital marketing processes?,best_practice,Advanced,"[""Overview of digital marketing"", ""Step-by-step implementation"", ""Best practices and tips"", ""Common challenges and solutions"", ""Tools and resources needed"", ""Conclusion and next steps""]","[""promotion"", ""best_practice"", ""marketing"", ""digital"", ""branding""]",6,Marketing Managers & Strategists,"[""content marketing"", ""brand management"", ""social media""]",48,7,2025-10-25 22:01:45,en,How do you automate {keyword} processes?,0.69,0.9455399895762948,0.72
46800994,brand management,marketing,How do you develop an effective brand management strategy?,strategy,Expert,"[""Overview of brand management"", ""Step-by-step implementation"", ""Best practices and tips"", ""Common challenges and solutions"", ""Tools and resources needed"", ""Conclusion and next steps""]","[""marketing"", ""management"", ""advertising"", ""branding"", ""strategy"", ""brand""]",6,Marketing Directors & CMOs,"[""content marketing"", ""digital marketing"", ""social media""]",58,9,2025-10-25 22:01:45,en,How do you develop an effective {keyword} strategy?,0.9,1.0,0.68
46800995,market analysis,economics,What exit strategies should be considered for market analysis?,analysis,Beginner,"[""Introduction to market analysis"", ""Key points and analysis"", ""Practical examples"", ""Expert insights"", ""Action items"", ""Conclusion""]","[""finance"", ""analysis"", ""market"", ""business"", ""economics""]",4,Students & New Investors,"[""investment planning"", ""financial modeling"", ""portfolio management""]",62,9,2025-10-25 22:01:45,en,What exit strategies should be considered for {keyword}?,0.94,0.38385863566899775,0.88
46800996,brand management,marketing,What tools are essential for brand management analytics?,strategy,Advanced,"[""Introduction to brand management"", ""Key points and analysis"", ""Practical examples"", ""Expert insights"", ""Action items"", ""Conclusion""]","[""marketing"", ""management"", ""advertising"", ""branding"", ""strategy"", ""brand""]",4,Marketing Managers & Strategists,"[""social media"", ""digital marketing"", ""content marketing""]",56,8,2025-10-25 22:01:45,en,What tools are essential for {keyword} analytics?,0.86,0.8281573864957446,0.72
46800997,content marketing,marketing,How is AI changing content marketing approaches?,optimization,Expert,"[""Introduction to content marketing"", ""Key points and analysis"", ""Practical examples"", ""Expert insights"", ""Action items"", ""Conclusion""]","[""content"", ""marketing"", ""advertising"", ""branding"", ""optimization""]",4,Marketing Directors & CMOs,"[""digital marketing"", ""social media"", ""brand management""]",48,7,2025-10-25 22:01:45,en,How is AI changing {keyword} approaches?,0.77,1.0,0.65
46800998,social media,marketing,How do you optimize social media for mobile users?,how_to,Advanced,"[""Overview of social media"", ""Step-by-step implementation"", ""Best practices and tips"", ""Common challenges and solutions"", ""Tools and resources needed"", ""Conclusion and next steps""]","[""how_to"", ""media"", ""digital"", ""marketing"", ""social"", ""branding""]",6,Marketing Managers & Strategists,"[""digital marketing"", ""brand management"", ""content marketing""]",50,9,2025-10-25 22:01:45,en,How do you optimize {keyword} for mobile users?,0.92,0.8718021303775765,0.76
46800999,cloud computing,it,What are the key components of a cloud computing implementation?,best_practice,Advanced,"[""Introduction to cloud computing"", ""Key concepts and definitions"", ""Main categories or types"", ""Examples and case studies"", ""Benefits and advantages"", ""Summary and recommendations""]","[""computing"", ""software"", ""development"", ""it"", ""best_practice"", ""cloud""]",6,Senior Developers & Tech Leads,"[""web development"", ""cybersecurity"", ""data science"", ""machine learning""]",64,10,2025-10-25 22:01:45,en,What are the key components of a {keyword} implementation?,0.73,0.9541391037657435,0.58
46801000,social media,marketing,How do you develop an effective social media strategy?,implementation,Advanced,"[""Overview of social media"", ""Step-by-step implementation"", ""Best practices and tips"", ""Common challenges and solutions"", ""Tools and resources needed"", ""Conclusion and next steps""]","[""media"", ""implementation"", ""promotion"", ""marketing"", ""digital"", ""social""]",6,Marketing Managers & Strategists,"[""digital marketing"", ""content marketing"", ""brand management""]",54,9,2025-10-25 22:01:45,en,How do you develop an effective {keyword} strategy?,0.81,0.8079962399406542,0.85
46801001,cybersecurity,it,What are the latest trends in cybersecurity technology?,optimization,Advanced,"[""Introduction to cybersecurity"", ""Key concepts and definitions"", ""Main categories or types"", ""Examples and case studies"", ""Benefits and advantages"", ""Summary and recommendations""]","[""development"", ""it"", ""programming"", ""optimization"", ""cybersecurity""]",5,Senior Developers & Tech Leads,"[""data science"", ""machine learning"", ""cloud computing"", ""web development""]",55,8,2025-10-25 22:01:45,en,What are the latest trends in {keyword} technology?,0.84,0.8732338551503667,0.44
46801002,investment planning,economics,What strategies work best for investment planning investment?,implementation,Beginner,"[""Introduction to investment planning"", ""Key points and analysis"", ""Practical examples"", ""Expert insights"", ""Action items"", ""Conclusion""]","[""investment"", ""planning"", ""finance"", ""implementation"", ""economics""]",4,Students & New Investors,"[""portfolio management"", ""financial modeling"", ""market analysis""]",61,8,2025-10-25 22:01:45,en,What strategies work best for {keyword} investment?,0.83,0.3394674908091873,0.6
46801003,market analysis,economics,What timeline is realistic for market analysis returns?,strategy,Intermediate,"[""Introduction to market analysis"", ""Key points and analysis"", ""Practical examples"", ""Expert insights"", ""Action items"", ""Conclusion""]","[""analysis"", ""business"", ""market"", ""strategy"", ""economics""]",4,Individual Investors & Analysts,"[""portfolio management"", ""financial modeling"", ""investment planning""]",55,8,2025-10-25 22:01:45,en,What timeline is realistic for {keyword} returns?,0.89,0.785669025254922,0.51
46801004,investment planning,economics,What are the risks associated with investment planning?,troubleshooting,Expert,"[""Introduction to investment planning"", ""Key concepts and definitions"", ""Main categories or types"", ""Examples and case studies"", ""Benefits and advantages"", ""Summary and recommendations""]","[""investment"", ""planning"", ""troubleshooting"", ""business"", ""economics""]",6,Portfolio Managers & Financial Experts,"[""financial modeling"", ""portfolio management"", ""market analysis""]",55,8,2025-10-25 22:01:45,en,What are the risks associated with {keyword}?,0.63,1.0,0.73
