record_id,keyword,category,question,question_type,difficulty_level,answer_outline,tags,estimated_read_time,target_audience,related_topics,question_length,word_count,created_date,language,source_template,engagement_score,complexity_score,popularity_score
35100655,digital marketing,marketing,How do you reach new customers through digital marketing?,how_to,Advanced,"[""Overview of digital marketing"", ""Step-by-step implementation"", ""Best practices and tips"", ""Common challenges and solutions"", ""Tools and resources needed"", ""Conclusion and next steps""]","[""branding"", ""marketing"", ""how_to"", ""digital""]",6,Marketing Managers & Strategists,"[""brand management"", ""social media"", ""content marketing""]",57,9,2025-10-25 21:45:37,en,How do you reach new customers through {keyword}?,0.82,0.9735049090294231,0.43
35100656,digital marketing,marketing,How do you create a digital marketing roadmap?,planning,Advanced,"[""Overview of digital marketing"", ""Step-by-step implementation"", ""Best practices and tips"", ""Common challenges and solutions"", ""Tools and resources needed"", ""Conclusion and next steps""]","[""marketing"", ""promotion"", ""planning"", ""digital""]",6,Marketing Managers & Strategists,"[""content marketing"", ""social media"", ""brand management""]",46,8,2025-10-25 21:45:37,en,How do you create a {keyword} roadmap?,0.93,0.9468813549969672,0.59
35100657,portfolio management,economics,What factors should be considered when evaluating portfolio management?,how_to,Intermediate,"[""Introduction to portfolio management"", ""Key points and analysis"", ""Practical examples"", ""Expert insights"", ""Action items"", ""Conclusion""]","[""how_to"", ""finance"", ""portfolio"", ""management"", ""business"", ""economics""]",4,Individual Investors & Analysts,"[""financial modeling"", ""market analysis"", ""investment planning""]",71,9,2025-10-25 21:45:37,en,What factors should be considered when evaluating {keyword}?,0.7,0.7284829531117427,0.67
35100658,investment planning,economics,What are the risks associated with investment planning?,evaluation,Advanced,"[""Introduction to investment planning"", ""Key concepts and definitions"", ""Main categories or types"", ""Examples and case studies"", ""Benefits and advantages"", ""Summary and recommendations""]","[""investment"", ""planning"", ""evaluation"", ""market"", ""economics""]",6,Professional Investors & Advisors,"[""financial modeling"", ""portfolio management"", ""market analysis""]",55,8,2025-10-25 21:45:37,en,What are the risks associated with {keyword}?,0.88,0.8992601126155518,0.45
35100659,social media,marketing,How do you identify the right audience for social media?,how_to,Beginner,"[""Overview of social media"", ""Step-by-step implementation"", ""Best practices and tips"", ""Common challenges and solutions"", ""Tools and resources needed"", ""Conclusion and next steps""]","[""how_to"", ""media"", ""marketing"", ""social"", ""advertising"", ""branding""]",6,Marketing Students & Interns,"[""digital marketing"", ""content marketing"", ""brand management""]",56,10,2025-10-25 21:45:37,en,How do you identify the right audience for {keyword}?,0.91,0.48109263510858824,0.48
35100660,machine learning,it,How do you integrate machine learning with existing systems?,planning,Advanced,"[""Overview of machine learning"", ""Step-by-step implementation"", ""Best practices and tips"", ""Common challenges and solutions"", ""Tools and resources needed"", ""Conclusion and next steps""]","[""planning"", ""development"", ""it"", ""learning"", ""machine"", ""technology""]",6,Senior Developers & Tech Leads,"[""web development"", ""cloud computing"", ""cybersecurity"", ""data science""]",60,9,2025-10-25 21:45:37,en,How do you integrate {keyword} with existing systems?,0.8,0.9463953455164207,0.38
35100661,market analysis,economics,How do you measure market analysis performance?,comparison,Intermediate,"[""Overview of market analysis"", ""Step-by-step implementation"", ""Best practices and tips"", ""Common challenges and solutions"", ""Tools and resources needed"", ""Conclusion and next steps""]","[""investment"", ""analysis"", ""comparison"", ""market"", ""business"", ""economics""]",6,Individual Investors & Analysts,"[""financial modeling"", ""portfolio management"", ""investment planning""]",47,7,2025-10-25 21:45:37,en,How do you measure {keyword} performance?,0.61,0.6787853331411668,0.68
35100662,data science,it,What skills are needed to master data science?,best_practice,Expert,"[""Introduction to data science"", ""Key points and analysis"", ""Practical examples"", ""Expert insights"", ""Action items"", ""Conclusion""]","[""software"", ""development"", ""it"", ""best_practice"", ""science"", ""data""]",4,Architects & Technical Directors,"[""web development"", ""cloud computing"", ""machine learning"", ""cybersecurity""]",46,8,2025-10-25 21:45:37,en,What skills are needed to master {keyword}?,0.84,1.0,0.39
35100663,content marketing,marketing,What does the future hold for content marketing?,analysis,Advanced,"[""Introduction to content marketing"", ""Key points and analysis"", ""Practical examples"", ""Expert insights"", ""Action items"", ""Conclusion""]","[""content"", ""analysis"", ""promotion"", ""marketing"", ""digital""]",4,Marketing Managers & Strategists,"[""digital marketing"", ""social media"", ""brand management""]",48,8,2025-10-25 21:45:37,en,What does the future hold for {keyword}?,0.67,0.9614489223661201,0.55
35100664,social media,marketing,How do you reach new customers through social media?,strategy,Intermediate,"[""Overview of social media"", ""Step-by-step implementation"", ""Best practices and tips"", ""Common challenges and solutions"", ""Tools and resources needed"", ""Conclusion and next steps""]","[""media"", ""digital"", ""marketing"", ""social"", ""advertising"", ""strategy""]",6,Marketing Coordinators & Specialists,"[""digital marketing"", ""brand management"", ""content marketing""]",52,9,2025-10-25 21:45:37,en,How do you reach new customers through {keyword}?,0.78,0.7715613416046474,0.61
35100665,cloud computing,it,What certifications are valuable for cloud computing professionals?,best_practice,Intermediate,"[""Introduction to cloud computing"", ""Key points and analysis"", ""Practical examples"", ""Expert insights"", ""Action items"", ""Conclusion""]","[""computing"", ""it"", ""best_practice"", ""programming"", ""cloud"", ""technology""]",4,Junior to Mid-level Developers,"[""machine learning"", ""web development"", ""data science"", ""cybersecurity""]",67,8,2025-10-25 21:45:37,en,What certifications are valuable for {keyword} professionals?,0.81,0.7768902033431538,0.65
35100666,data science,it,What skills are needed to master data science?,strategy,Beginner,"[""Introduction to data science"", ""Key points and analysis"", ""Practical examples"", ""Expert insights"", ""Action items"", ""Conclusion""]","[""software"", ""development"", ""it"", ""science"", ""strategy"", ""data""]",4,Students & Entry-level Developers,"[""machine learning"", ""cloud computing"", ""cybersecurity"", ""web development""]",46,8,2025-10-25 21:45:37,en,What skills are needed to master {keyword}?,0.87,0.38855760209701656,0.56
35100667,investment planning,economics,What is the optimal allocation for investment planning in a portfolio?,optimization,Advanced,"[""Introduction to investment planning"", ""Key points and analysis"", ""Practical examples"", ""Expert insights"", ""Action items"", ""Conclusion""]","[""investment"", ""planning"", ""business"", ""market"", ""optimization"", ""economics""]",4,Professional Investors & Advisors,"[""portfolio management"", ""financial modeling"", ""market analysis""]",70,11,2025-10-25 21:45:37,en,What is the optimal allocation for {keyword} in a portfolio?,0.64,0.9083835023433945,0.82
35100668,social media,marketing,How do you create a social media roadmap?,analysis,Intermediate,"[""Overview of social media"", ""Step-by-step implementation"", ""Best practices and tips"", ""Common challenges and solutions"", ""Tools and resources needed"", ""Conclusion and next steps""]","[""analysis"", ""media"", ""marketing"", ""digital"", ""social"", ""branding""]",6,Marketing Coordinators & Specialists,"[""content marketing"", ""digital marketing"", ""brand management""]",41,8,2025-10-25 21:45:37,en,How do you create a {keyword} roadmap?,0.68,0.6266999752655119,0.87
35100669,investment planning,economics,What insurance options are available for investment planning?,implementation,Expert,"[""Introduction to investment planning"", ""Key points and analysis"", ""Practical examples"", ""Expert insights"", ""Action items"", ""Conclusion""]","[""investment"", ""planning"", ""implementation"", ""business"", ""economics""]",4,Portfolio Managers & Financial Experts,"[""financial modeling"", ""portfolio management"", ""market analysis""]",61,8,2025-10-25 21:45:37,en,What insurance options are available for {keyword}?,0.81,1.0,0.34
35100670,portfolio management,economics,How do you assess and manage portfolio management risks?,evaluation,Intermediate,"[""Overview of portfolio management"", ""Step-by-step implementation"", ""Best practices and tips"", ""Common challenges and solutions"", ""Tools and resources needed"", ""Conclusion and next steps""]","[""investment"", ""portfolio"", ""management"", ""evaluation"", ""market"", ""economics""]",6,Individual Investors & Analysts,"[""market analysis"", ""financial modeling"", ""investment planning""]",56,9,2025-10-25 21:45:37,en,How do you assess and manage {keyword} risks?,0.68,0.7268569590515066,0.52
35100671,market analysis,economics,How do you assess and manage market analysis risks?,implementation,Intermediate,"[""Overview of market analysis"", ""Step-by-step implementation"", ""Best practices and tips"", ""Common challenges and solutions"", ""Tools and resources needed"", ""Conclusion and next steps""]","[""finance"", ""analysis"", ""implementation"", ""market"", ""economics""]",6,Individual Investors & Analysts,"[""investment planning"", ""financial modeling"", ""portfolio management""]",51,9,2025-10-25 21:45:37,en,How do you assess and manage {keyword} risks?,0.73,0.6980879589264342,0.55
35100672,content marketing,marketing,How do you track and analyze content marketing performance?,evaluation,Advanced,"[""Overview of content marketing"", ""Step-by-step implementation"", ""Best practices and tips"", ""Common challenges and solutions"", ""Tools and resources needed"", ""Conclusion and next steps""]","[""content"", ""promotion"", ""marketing"", ""branding"", ""evaluation""]",6,Marketing Managers & Strategists,"[""social media"", ""digital marketing"", ""brand management""]",59,9,2025-10-25 21:45:37,en,How do you track and analyze {keyword} performance?,0.72,0.8735224633867654,0.67
35100673,market analysis,economics,What tools help analyze market analysis data?,how_to,Expert,"[""Introduction to market analysis"", ""Key points and analysis"", ""Practical examples"", ""Expert insights"", ""Action items"", ""Conclusion""]","[""investment"", ""how_to"", ""finance"", ""analysis"", ""market"", ""economics""]",4,Portfolio Managers & Financial Experts,"[""financial modeling"", ""investment planning"", ""portfolio management""]",45,7,2025-10-25 21:45:37,en,What tools help analyze {keyword} data?,0.77,1.0,0.74
35100674,financial modeling,economics,How do you assess and manage financial modeling risks?,comparison,Advanced,"[""Overview of financial modeling"", ""Step-by-step implementation"", ""Best practices and tips"", ""Common challenges and solutions"", ""Tools and resources needed"", ""Conclusion and next steps""]","[""investment"", ""finance"", ""comparison"", ""modeling"", ""financial"", ""economics""]",6,Professional Investors & Advisors,"[""investment planning"", ""portfolio management"", ""market analysis""]",54,9,2025-10-25 21:45:37,en,How do you assess and manage {keyword} risks?,0.93,0.9188633312246701,0.62
35100675,investment planning,economics,How does global economics impact investment planning?,implementation,Advanced,"[""Introduction to investment planning"", ""Key points and analysis"", ""Practical examples"", ""Expert insights"", ""Action items"", ""Conclusion""]","[""investment"", ""planning"", ""implementation"", ""business"", ""economics""]",4,Professional Investors & Advisors,"[""financial modeling"", ""portfolio management"", ""market analysis""]",53,7,2025-10-25 21:45:37,en,How does global economics impact {keyword}?,0.9,0.9483452069188237,0.61
35100676,social media,marketing,What does the future hold for social media?,how_to,Beginner,"[""Introduction to social media"", ""Key points and analysis"", ""Practical examples"", ""Expert insights"", ""Action items"", ""Conclusion""]","[""how_to"", ""media"", ""promotion"", ""marketing"", ""digital"", ""social""]",4,Marketing Students & Interns,"[""brand management"", ""content marketing"", ""digital marketing""]",43,8,2025-10-25 21:45:37,en,What does the future hold for {keyword}?,0.66,0.40694094044553203,0.54
35100677,brand management,marketing,How do you track and analyze brand management performance?,comparison,Expert,"[""Overview of brand management"", ""Step-by-step implementation"", ""Best practices and tips"", ""Common challenges and solutions"", ""Tools and resources needed"", ""Conclusion and next steps""]","[""comparison"", ""digital"", ""marketing"", ""management"", ""branding"", ""brand""]",6,Marketing Directors & CMOs,"[""social media"", ""content marketing"", ""digital marketing""]",58,9,2025-10-25 21:45:37,en,How do you track and analyze {keyword} performance?,0.84,1.0,0.54
35100678,social media,marketing,What KPIs are most important for social media?,how_to,Intermediate,"[""Introduction to social media"", ""Key points and analysis"", ""Practical examples"", ""Expert insights"", ""Action items"", ""Conclusion""]","[""how_to"", ""media"", ""promotion"", ""digital"", ""marketing"", ""social""]",4,Marketing Coordinators & Specialists,"[""content marketing"", ""brand management"", ""digital marketing""]",46,8,2025-10-25 21:45:37,en,What KPIs are most important for {keyword}?,0.67,0.6140908709667268,0.39
35100679,portfolio management,economics,How do you analyze market trends in portfolio management?,strategy,Advanced,"[""Overview of portfolio management"", ""Step-by-step implementation"", ""Best practices and tips"", ""Common challenges and solutions"", ""Tools and resources needed"", ""Conclusion and next steps""]","[""investment"", ""portfolio"", ""management"", ""business"", ""strategy"", ""economics""]",6,Professional Investors & Advisors,"[""market analysis"", ""financial modeling"", ""investment planning""]",57,9,2025-10-25 21:45:37,en,How do you analyze market trends in {keyword}?,0.78,0.858161988542606,0.33
35100680,market analysis,economics,What factors should be considered when evaluating market analysis?,planning,Intermediate,"[""Introduction to market analysis"", ""Key points and analysis"", ""Practical examples"", ""Expert insights"", ""Action items"", ""Conclusion""]","[""planning"", ""finance"", ""analysis"", ""market"", ""business"", ""economics""]",4,Individual Investors & Analysts,"[""investment planning"", ""portfolio management"", ""financial modeling""]",66,9,2025-10-25 21:45:37,en,What factors should be considered when evaluating {keyword}?,0.75,0.6432973203503879,0.82
35100681,portfolio management,economics,What insurance options are available for portfolio management?,comparison,Beginner,"[""Introduction to portfolio management"", ""Key points and analysis"", ""Practical examples"", ""Expert insights"", ""Action items"", ""Conclusion""]","[""investment"", ""portfolio"", ""comparison"", ""management"", ""market"", ""economics""]",4,Students & New Investors,"[""market analysis"", ""investment planning"", ""financial modeling""]",62,8,2025-10-25 21:45:37,en,What insurance options are available for {keyword}?,0.84,0.35034840787790533,0.6
35100682,market analysis,economics,What are the risks associated with market analysis?,analysis,Advanced,"[""Introduction to market analysis"", ""Key concepts and definitions"", ""Main categories or types"", ""Examples and case studies"", ""Benefits and advantages"", ""Summary and recommendations""]","[""finance"", ""analysis"", ""market"", ""business"", ""economics""]",6,Professional Investors & Advisors,"[""financial modeling"", ""portfolio management"", ""investment planning""]",51,8,2025-10-25 21:45:37,en,What are the risks associated with {keyword}?,0.65,0.8096123876520276,0.65
35100683,market analysis,economics,How do you measure market analysis performance?,troubleshooting,Expert,"[""Overview of market analysis"", ""Step-by-step implementation"", ""Best practices and tips"", ""Common challenges and solutions"", ""Tools and resources needed"", ""Conclusion and next steps""]","[""finance"", ""analysis"", ""troubleshooting"", ""market"", ""economics""]",6,Portfolio Managers & Financial Experts,"[""portfolio management"", ""financial modeling"", ""investment planning""]",47,7,2025-10-25 21:45:37,en,How do you measure {keyword} performance?,0.8,1.0,0.56
35100684,data science,it,What tools are essential for data science development?,comparison,Expert,"[""Introduction to data science"", ""Key points and analysis"", ""Practical examples"", ""Expert insights"", ""Action items"", ""Conclusion""]","[""software"", ""development"", ""it"", ""comparison"", ""science"", ""data""]",4,Architects & Technical Directors,"[""cybersecurity"", ""machine learning"", ""web development"", ""cloud computing""]",54,8,2025-10-25 21:45:37,en,What tools are essential for {keyword} development?,0.88,1.0,0.36
35100685,financial modeling,economics,What factors should be considered when evaluating financial modeling?,optimization,Beginner,"[""Introduction to financial modeling"", ""Key points and analysis"", ""Practical examples"", ""Expert insights"", ""Action items"", ""Conclusion""]","[""investment"", ""finance"", ""modeling"", ""financial"", ""optimization"", ""economics""]",4,Students & New Investors,"[""market analysis"", ""investment planning"", ""portfolio management""]",69,9,2025-10-25 21:45:37,en,What factors should be considered when evaluating {keyword}?,0.94,0.38006093477553715,0.74
35100686,market analysis,economics,What indicators predict market analysis market movements?,evaluation,Expert,"[""Introduction to market analysis"", ""Key points and analysis"", ""Practical examples"", ""Expert insights"", ""Action items"", ""Conclusion""]","[""investment"", ""finance"", ""analysis"", ""evaluation"", ""market"", ""economics""]",4,Portfolio Managers & Financial Experts,"[""portfolio management"", ""investment planning"", ""financial modeling""]",57,7,2025-10-25 21:45:37,en,What indicators predict {keyword} market movements?,0.62,1.0,0.56
35100687,brand management,marketing,How do you develop an effective brand management strategy?,planning,Intermediate,"[""Overview of brand management"", ""Step-by-step implementation"", ""Best practices and tips"", ""Common challenges and solutions"", ""Tools and resources needed"", ""Conclusion and next steps""]","[""planning"", ""marketing"", ""management"", ""advertising"", ""branding"", ""brand""]",6,Marketing Coordinators & Specialists,"[""content marketing"", ""digital marketing"", ""social media""]",58,9,2025-10-25 21:45:37,en,How do you develop an effective {keyword} strategy?,0.61,0.6244104126309066,0.75
35100688,financial modeling,economics,How do you measure financial modeling performance?,evaluation,Beginner,"[""Overview of financial modeling"", ""Step-by-step implementation"", ""Best practices and tips"", ""Common challenges and solutions"", ""Tools and resources needed"", ""Conclusion and next steps""]","[""finance"", ""modeling"", ""financial"", ""evaluation"", ""market"", ""economics""]",6,Students & New Investors,"[""market analysis"", ""investment planning"", ""portfolio management""]",50,7,2025-10-25 21:45:37,en,How do you measure {keyword} performance?,0.81,0.4817767726105877,0.65
35100689,brand management,marketing,What channels are most effective for brand management?,strategy,Expert,"[""Introduction to brand management"", ""Key points and analysis"", ""Practical examples"", ""Expert insights"", ""Action items"", ""Conclusion""]","[""digital"", ""marketing"", ""management"", ""advertising"", ""strategy"", ""brand""]",4,Marketing Directors & CMOs,"[""content marketing"", ""digital marketing"", ""social media""]",54,8,2025-10-25 21:45:37,en,What channels are most effective for {keyword}?,0.88,1.0,0.48
35100690,portfolio management,economics,How do you measure portfolio management performance?,planning,Advanced,"[""Overview of portfolio management"", ""Step-by-step implementation"", ""Best practices and tips"", ""Common challenges and solutions"", ""Tools and resources needed"", ""Conclusion and next steps""]","[""investment"", ""planning"", ""finance"", ""portfolio"", ""management"", ""economics""]",6,Professional Investors & Advisors,"[""investment planning"", ""market analysis"", ""financial modeling""]",52,7,2025-10-25 21:45:37,en,How do you measure {keyword} performance?,0.82,0.9779799537031318,0.71
35100691,social media,marketing,What timing strategies work for social media?,comparison,Expert,"[""Introduction to social media"", ""Key points and analysis"", ""Practical examples"", ""Expert insights"", ""Action items"", ""Conclusion""]","[""media"", ""comparison"", ""digital"", ""marketing"", ""social"", ""branding""]",4,Marketing Directors & CMOs,"[""content marketing"", ""brand management"", ""digital marketing""]",45,7,2025-10-25 21:45:37,en,What timing strategies work for {keyword}?,0.9,1.0,0.81
35100692,brand management,marketing,How do you develop an effective brand management strategy?,strategy,Advanced,"[""Overview of brand management"", ""Step-by-step implementation"", ""Best practices and tips"", ""Common challenges and solutions"", ""Tools and resources needed"", ""Conclusion and next steps""]","[""marketing"", ""management"", ""advertising"", ""branding"", ""strategy"", ""brand""]",6,Marketing Managers & Strategists,"[""digital marketing"", ""content marketing"", ""social media""]",58,9,2025-10-25 21:45:37,en,How do you develop an effective {keyword} strategy?,0.8,0.9981065499638445,0.8
35100693,content marketing,marketing,How do you attribute success to content marketing efforts?,analysis,Expert,"[""Overview of content marketing"", ""Step-by-step implementation"", ""Best practices and tips"", ""Common challenges and solutions"", ""Tools and resources needed"", ""Conclusion and next steps""]","[""content"", ""analysis"", ""marketing"", ""digital"", ""branding""]",6,Marketing Directors & CMOs,"[""social media"", ""digital marketing"", ""brand management""]",58,9,2025-10-25 21:45:37,en,How do you attribute success to {keyword} efforts?,0.61,1.0,0.57
35100694,cloud computing,it,What are the key components of a cloud computing implementation?,optimization,Expert,"[""Introduction to cloud computing"", ""Key concepts and definitions"", ""Main categories or types"", ""Examples and case studies"", ""Benefits and advantages"", ""Summary and recommendations""]","[""computing"", ""cloud"", ""development"", ""it"", ""optimization"", ""technology""]",6,Architects & Technical Directors,"[""machine learning"", ""data science"", ""cybersecurity"", ""web development""]",64,10,2025-10-25 21:45:37,en,What are the key components of a {keyword} implementation?,0.91,1.0,0.36
35100695,cybersecurity,it,What ROI can be expected from cybersecurity implementation?,planning,Beginner,"[""Introduction to cybersecurity"", ""Key points and analysis"", ""Practical examples"", ""Expert insights"", ""Action items"", ""Conclusion""]","[""planning"", ""it"", ""programming"", ""cybersecurity"", ""technology""]",4,Students & Entry-level Developers,"[""cloud computing"", ""web development"", ""data science"", ""machine learning""]",59,8,2025-10-25 21:45:37,en,What ROI can be expected from {keyword} implementation?,0.61,0.409225167935162,0.79
35100696,cybersecurity,it,How can cybersecurity improve system performance and scalability?,best_practice,Intermediate,"[""Introduction to cybersecurity"", ""Key points and analysis"", ""Practical examples"", ""Expert insights"", ""Action items"", ""Conclusion""]","[""it"", ""programming"", ""best_practice"", ""cybersecurity"", ""technology""]",4,Junior to Mid-level Developers,"[""data science"", ""cloud computing"", ""machine learning"", ""web development""]",65,8,2025-10-25 21:45:37,en,How can {keyword} improve system performance and scalability?,0.72,0.6224521307273156,0.9
35100697,cybersecurity,it,How can cybersecurity improve system performance and scalability?,optimization,Beginner,"[""Introduction to cybersecurity"", ""Key points and analysis"", ""Practical examples"", ""Expert insights"", ""Action items"", ""Conclusion""]","[""development"", ""it"", ""programming"", ""optimization"", ""cybersecurity""]",4,Students & Entry-level Developers,"[""cloud computing"", ""web development"", ""machine learning"", ""data science""]",65,8,2025-10-25 21:45:37,en,How can {keyword} improve system performance and scalability?,0.72,0.3537529047371179,0.64
35100698,market analysis,economics,How do you hedge against market analysis market downturns?,planning,Advanced,"[""Overview of market analysis"", ""Step-by-step implementation"", ""Best practices and tips"", ""Common challenges and solutions"", ""Tools and resources needed"", ""Conclusion and next steps""]","[""investment"", ""planning"", ""analysis"", ""finance"", ""market"", ""economics""]",6,Professional Investors & Advisors,"[""investment planning"", ""portfolio management"", ""financial modeling""]",58,9,2025-10-25 21:45:37,en,How do you hedge against {keyword} market downturns?,0.72,0.9105063129868567,0.84
