record_id,keyword,category,question,question_type,difficulty_level,answer_outline,tags,estimated_read_time,target_audience,related_topics,question_length,word_count,created_date,language,source_template,engagement_score,complexity_score,popularity_score
35100350,machine learning,it,What is the recommended architecture for machine learning systems?,strategy,Advanced,"[""Introduction to machine learning"", ""Key points and analysis"", ""Practical examples"", ""Expert insights"", ""Action items"", ""Conclusion""]","[""development"", ""it"", ""programming"", ""learning"", ""strategy"", ""machine""]",4,Senior Developers & Tech Leads,"[""data science"", ""cloud computing"", ""cybersecurity"", ""web development""]",66,9,2025-10-25 21:45:37,en,What is the recommended architecture for {keyword} systems?,0.69,0.8281533657528549,0.56
35100351,cloud computing,it,What career opportunities exist in cloud computing?,how_to,Intermediate,"[""Introduction to cloud computing"", ""Key points and analysis"", ""Practical examples"", ""Expert insights"", ""Action items"", ""Conclusion""]","[""computing"", ""how_to"", ""software"", ""it"", ""programming"", ""cloud""]",4,Junior to Mid-level Developers,"[""cybersecurity"", ""data science"", ""web development"", ""machine learning""]",51,7,2025-10-25 21:45:37,en,What career opportunities exist in {keyword}?,0.9,0.6731338728273523,0.88
35100352,web development,it,What are the best practices for web development development?,analysis,Expert,"[""Introduction to web development"", ""Key concepts and definitions"", ""Main categories or types"", ""Examples and case studies"", ""Benefits and advantages"", ""Summary and recommendations""]","[""software"", ""development"", ""analysis"", ""it"", ""programming"", ""web""]",6,Architects & Technical Directors,"[""data science"", ""cybersecurity"", ""machine learning"", ""cloud computing""]",60,9,2025-10-25 21:45:37,en,What are the best practices for {keyword} development?,0.77,1.0,0.61
35100353,digital marketing,marketing,How do you attribute success to digital marketing efforts?,comparison,Expert,"[""Overview of digital marketing"", ""Step-by-step implementation"", ""Best practices and tips"", ""Common challenges and solutions"", ""Tools and resources needed"", ""Conclusion and next steps""]","[""marketing"", ""promotion"", ""comparison"", ""digital""]",6,Marketing Directors & CMOs,"[""social media"", ""brand management"", ""content marketing""]",58,9,2025-10-25 21:45:37,en,How do you attribute success to {keyword} efforts?,0.66,1.0,0.53
35100354,content marketing,marketing,What tools are essential for content marketing analytics?,troubleshooting,Expert,"[""Introduction to content marketing"", ""Key points and analysis"", ""Practical examples"", ""Expert insights"", ""Action items"", ""Conclusion""]","[""content"", ""troubleshooting"", ""marketing"", ""digital"", ""branding""]",4,Marketing Directors & CMOs,"[""brand management"", ""social media"", ""digital marketing""]",57,8,2025-10-25 21:45:37,en,What tools are essential for {keyword} analytics?,0.82,1.0,0.55
35100355,web development,it,How do you optimize web development for different platforms?,evaluation,Expert,"[""Overview of web development"", ""Step-by-step implementation"", ""Best practices and tips"", ""Common challenges and solutions"", ""Tools and resources needed"", ""Conclusion and next steps""]","[""development"", ""web"", ""it"", ""programming"", ""evaluation"", ""technology""]",6,Architects & Technical Directors,"[""cybersecurity"", ""machine learning"", ""cloud computing"", ""data science""]",60,9,2025-10-25 21:45:37,en,How do you optimize {keyword} for different platforms?,0.71,1.0,0.67
35100356,cloud computing,it,Which frameworks support cloud computing implementation?,optimization,Intermediate,"[""Introduction to cloud computing"", ""Key points and analysis"", ""Practical examples"", ""Expert insights"", ""Action items"", ""Conclusion""]","[""computing"", ""software"", ""cloud"", ""it"", ""programming"", ""optimization""]",4,Junior to Mid-level Developers,"[""cybersecurity"", ""web development"", ""data science"", ""machine learning""]",56,6,2025-10-25 21:45:37,en,Which frameworks support {keyword} implementation?,0.65,0.698387980429115,0.53
35100357,portfolio management,economics,How do you benchmark portfolio management against alternatives?,implementation,Expert,"[""Overview of portfolio management"", ""Step-by-step implementation"", ""Best practices and tips"", ""Common challenges and solutions"", ""Tools and resources needed"", ""Conclusion and next steps""]","[""investment"", ""implementation"", ""portfolio"", ""management"", ""business"", ""economics""]",6,Portfolio Managers & Financial Experts,"[""market analysis"", ""financial modeling"", ""investment planning""]",63,8,2025-10-25 21:45:37,en,How do you benchmark {keyword} against alternatives?,0.79,1.0,0.72
35100358,portfolio management,economics,How do you hedge against portfolio management market downturns?,how_to,Intermediate,"[""Overview of portfolio management"", ""Step-by-step implementation"", ""Best practices and tips"", ""Common challenges and solutions"", ""Tools and resources needed"", ""Conclusion and next steps""]","[""investment"", ""how_to"", ""portfolio"", ""management"", ""business"", ""economics""]",6,Individual Investors & Analysts,"[""financial modeling"", ""investment planning"", ""market analysis""]",63,9,2025-10-25 21:45:37,en,How do you hedge against {keyword} market downturns?,0.75,0.7374081631825606,0.47
35100359,content marketing,marketing,What tools are essential for content marketing analytics?,evaluation,Intermediate,"[""Introduction to content marketing"", ""Key points and analysis"", ""Practical examples"", ""Expert insights"", ""Action items"", ""Conclusion""]","[""content"", ""marketing"", ""digital"", ""branding"", ""evaluation""]",4,Marketing Coordinators & Specialists,"[""social media"", ""brand management"", ""digital marketing""]",57,8,2025-10-25 21:45:37,en,What tools are essential for {keyword} analytics?,0.71,0.65261547694884,0.87
35100360,web development,it,How do you get started with web development as a beginner?,analysis,Advanced,"[""Overview of web development"", ""Step-by-step implementation"", ""Best practices and tips"", ""Common challenges and solutions"", ""Tools and resources needed"", ""Conclusion and next steps""]","[""development"", ""analysis"", ""it"", ""programming"", ""web""]",6,Senior Developers & Tech Leads,"[""cybersecurity"", ""cloud computing"", ""data science"", ""machine learning""]",58,11,2025-10-25 21:45:37,en,How do you get started with {keyword} as a beginner?,0.6,0.9425493178703609,0.83
35100361,cloud computing,it,What ROI can be expected from cloud computing implementation?,best_practice,Beginner,"[""Introduction to cloud computing"", ""Key points and analysis"", ""Practical examples"", ""Expert insights"", ""Action items"", ""Conclusion""]","[""computing"", ""development"", ""it"", ""best_practice"", ""cloud"", ""technology""]",4,Students & Entry-level Developers,"[""machine learning"", ""data science"", ""web development"", ""cybersecurity""]",61,9,2025-10-25 21:45:37,en,What ROI can be expected from {keyword} implementation?,0.86,0.41033502585324877,0.57
35100362,content marketing,marketing,How do you attribute success to content marketing efforts?,troubleshooting,Expert,"[""Overview of content marketing"", ""Step-by-step implementation"", ""Best practices and tips"", ""Common challenges and solutions"", ""Tools and resources needed"", ""Conclusion and next steps""]","[""content"", ""promotion"", ""troubleshooting"", ""marketing"", ""branding""]",6,Marketing Directors & CMOs,"[""brand management"", ""digital marketing"", ""social media""]",58,9,2025-10-25 21:45:37,en,How do you attribute success to {keyword} efforts?,0.95,1.0,0.77
35100363,cybersecurity,it,What tools are essential for cybersecurity development?,best_practice,Beginner,"[""Introduction to cybersecurity"", ""Key points and analysis"", ""Practical examples"", ""Expert insights"", ""Action items"", ""Conclusion""]","[""software"", ""development"", ""it"", ""best_practice"", ""cybersecurity""]",4,Students & Entry-level Developers,"[""data science"", ""machine learning"", ""cloud computing"", ""web development""]",55,7,2025-10-25 21:45:37,en,What tools are essential for {keyword} development?,0.69,0.31189662088974685,0.72
35100364,data science,it,Which frameworks support data science implementation?,how_to,Beginner,"[""Introduction to data science"", ""Key points and analysis"", ""Practical examples"", ""Expert insights"", ""Action items"", ""Conclusion""]","[""how_to"", ""software"", ""development"", ""it"", ""science"", ""data""]",4,Students & Entry-level Developers,"[""cybersecurity"", ""web development"", ""machine learning"", ""cloud computing""]",53,6,2025-10-25 21:45:37,en,Which frameworks support {keyword} implementation?,0.62,0.35292009653797835,0.81
35100365,data science,it,Which frameworks support data science implementation?,how_to,Expert,"[""Introduction to data science"", ""Key points and analysis"", ""Practical examples"", ""Expert insights"", ""Action items"", ""Conclusion""]","[""how_to"", ""development"", ""it"", ""programming"", ""science"", ""data""]",4,Architects & Technical Directors,"[""web development"", ""cybersecurity"", ""cloud computing"", ""machine learning""]",53,6,2025-10-25 21:45:37,en,Which frameworks support {keyword} implementation?,0.75,1.0,0.34
35100366,financial modeling,economics,What are the risks associated with financial modeling?,best_practice,Expert,"[""Introduction to financial modeling"", ""Key concepts and definitions"", ""Main categories or types"", ""Examples and case studies"", ""Benefits and advantages"", ""Summary and recommendations""]","[""finance"", ""best_practice"", ""modeling"", ""financial"", ""business"", ""economics""]",6,Portfolio Managers & Financial Experts,"[""portfolio management"", ""investment planning"", ""market analysis""]",54,8,2025-10-25 21:45:37,en,What are the risks associated with {keyword}?,0.9,1.0,0.89
35100367,content marketing,marketing,What A/B tests should you run for content marketing?,best_practice,Beginner,"[""Introduction to content marketing"", ""Key points and analysis"", ""Practical examples"", ""Expert insights"", ""Action items"", ""Conclusion""]","[""content"", ""promotion"", ""best_practice"", ""marketing"", ""branding""]",4,Marketing Students & Interns,"[""brand management"", ""digital marketing"", ""social media""]",52,9,2025-10-25 21:45:37,en,What A/B tests should you run for {keyword}?,0.92,0.35122755628499386,0.83
35100368,cybersecurity,it,What security considerations should be taken when using cybersecurity?,strategy,Beginner,"[""Introduction to cybersecurity"", ""Key points and analysis"", ""Practical examples"", ""Expert insights"", ""Action items"", ""Conclusion""]","[""software"", ""development"", ""it"", ""strategy"", ""cybersecurity""]",4,Students & Entry-level Developers,"[""cloud computing"", ""web development"", ""machine learning"", ""data science""]",70,9,2025-10-25 21:45:37,en,What security considerations should be taken when using {keyword}?,0.78,0.3473604929552885,0.57
35100369,portfolio management,economics,How do you adjust your portfolio management strategy during volatility?,implementation,Expert,"[""Overview of portfolio management"", ""Step-by-step implementation"", ""Best practices and tips"", ""Common challenges and solutions"", ""Tools and resources needed"", ""Conclusion and next steps""]","[""investment"", ""implementation"", ""portfolio"", ""management"", ""market"", ""economics""]",6,Portfolio Managers & Financial Experts,"[""financial modeling"", ""market analysis"", ""investment planning""]",71,10,2025-10-25 21:45:37,en,How do you adjust your {keyword} strategy during volatility?,0.82,1.0,0.56
35100370,digital marketing,marketing,What messaging works best in digital marketing campaigns?,troubleshooting,Advanced,"[""Introduction to digital marketing"", ""Key points and analysis"", ""Practical examples"", ""Expert insights"", ""Action items"", ""Conclusion""]","[""marketing"", ""advertising"", ""troubleshooting"", ""digital""]",4,Marketing Managers & Strategists,"[""content marketing"", ""brand management"", ""social media""]",57,8,2025-10-25 21:45:37,en,What messaging works best in {keyword} campaigns?,0.65,0.9733300878300817,0.71
35100371,portfolio management,economics,How do you hedge against portfolio management market downturns?,evaluation,Intermediate,"[""Overview of portfolio management"", ""Step-by-step implementation"", ""Best practices and tips"", ""Common challenges and solutions"", ""Tools and resources needed"", ""Conclusion and next steps""]","[""finance"", ""portfolio"", ""management"", ""evaluation"", ""market"", ""economics""]",6,Individual Investors & Analysts,"[""market analysis"", ""financial modeling"", ""investment planning""]",63,9,2025-10-25 21:45:37,en,How do you hedge against {keyword} market downturns?,0.73,0.6265129567798018,0.78
35100372,financial modeling,economics,How do economic conditions affect financial modeling performance?,how_to,Advanced,"[""Introduction to financial modeling"", ""Key points and analysis"", ""Practical examples"", ""Expert insights"", ""Action items"", ""Conclusion""]","[""how_to"", ""modeling"", ""financial"", ""market"", ""business"", ""economics""]",4,Professional Investors & Advisors,"[""market analysis"", ""investment planning"", ""portfolio management""]",65,8,2025-10-25 21:45:37,en,How do economic conditions affect {keyword} performance?,0.7,0.9252158200559077,0.85
35100373,cybersecurity,it,How do you get started with cybersecurity as a beginner?,analysis,Intermediate,"[""Overview of cybersecurity"", ""Step-by-step implementation"", ""Best practices and tips"", ""Common challenges and solutions"", ""Tools and resources needed"", ""Conclusion and next steps""]","[""development"", ""analysis"", ""it"", ""programming"", ""cybersecurity""]",5,Junior to Mid-level Developers,"[""web development"", ""cloud computing"", ""data science"", ""machine learning""]",56,10,2025-10-25 21:45:37,en,How do you get started with {keyword} as a beginner?,0.78,0.6686963370403655,0.85
35100374,financial modeling,economics,How do you report on financial modeling performance to stakeholders?,how_to,Intermediate,"[""Overview of financial modeling"", ""Step-by-step implementation"", ""Best practices and tips"", ""Common challenges and solutions"", ""Tools and resources needed"", ""Conclusion and next steps""]","[""investment"", ""how_to"", ""modeling"", ""financial"", ""market"", ""economics""]",6,Individual Investors & Analysts,"[""investment planning"", ""portfolio management"", ""market analysis""]",68,10,2025-10-25 21:45:37,en,How do you report on {keyword} performance to stakeholders?,0.85,0.6664280845009336,0.65
35100375,content marketing,marketing,How do you automate content marketing processes?,implementation,Intermediate,"[""Overview of content marketing"", ""Step-by-step implementation"", ""Best practices and tips"", ""Common challenges and solutions"", ""Tools and resources needed"", ""Conclusion and next steps""]","[""content"", ""implementation"", ""promotion"", ""marketing"", ""advertising""]",6,Marketing Coordinators & Specialists,"[""brand management"", ""social media"", ""digital marketing""]",48,7,2025-10-25 21:45:37,en,How do you automate {keyword} processes?,0.83,0.6047556672912255,0.71
35100376,social media,marketing,How do you develop an effective social media strategy?,comparison,Intermediate,"[""Overview of social media"", ""Step-by-step implementation"", ""Best practices and tips"", ""Common challenges and solutions"", ""Tools and resources needed"", ""Conclusion and next steps""]","[""media"", ""promotion"", ""comparison"", ""marketing"", ""social"", ""branding""]",6,Marketing Coordinators & Specialists,"[""digital marketing"", ""content marketing"", ""brand management""]",54,9,2025-10-25 21:45:37,en,How do you develop an effective {keyword} strategy?,0.69,0.661202871689193,0.44
35100377,investment planning,economics,What timeline is realistic for investment planning returns?,best_practice,Intermediate,"[""Introduction to investment planning"", ""Key points and analysis"", ""Practical examples"", ""Expert insights"", ""Action items"", ""Conclusion""]","[""investment"", ""planning"", ""best_practice"", ""market"", ""business"", ""economics""]",4,Individual Investors & Analysts,"[""market analysis"", ""financial modeling"", ""portfolio management""]",59,8,2025-10-25 21:45:37,en,What timeline is realistic for {keyword} returns?,0.75,0.6556422590365087,0.84
35100378,data science,it,How do you integrate data science with existing systems?,how_to,Expert,"[""Overview of data science"", ""Step-by-step implementation"", ""Best practices and tips"", ""Common challenges and solutions"", ""Tools and resources needed"", ""Conclusion and next steps""]","[""how_to"", ""software"", ""it"", ""programming"", ""science"", ""data""]",6,Architects & Technical Directors,"[""machine learning"", ""web development"", ""cloud computing"", ""cybersecurity""]",56,9,2025-10-25 21:45:37,en,How do you integrate {keyword} with existing systems?,0.66,1.0,0.84
35100379,data science,it,What tools are essential for data science development?,strategy,Expert,"[""Introduction to data science"", ""Key points and analysis"", ""Practical examples"", ""Expert insights"", ""Action items"", ""Conclusion""]","[""development"", ""it"", ""programming"", ""science"", ""strategy"", ""data""]",4,Architects & Technical Directors,"[""machine learning"", ""cloud computing"", ""web development"", ""cybersecurity""]",54,8,2025-10-25 21:45:37,en,What tools are essential for {keyword} development?,0.9,1.0,0.46
35100380,content marketing,marketing,How do you attribute success to content marketing efforts?,planning,Beginner,"[""Overview of content marketing"", ""Step-by-step implementation"", ""Best practices and tips"", ""Common challenges and solutions"", ""Tools and resources needed"", ""Conclusion and next steps""]","[""planning"", ""content"", ""digital"", ""marketing"", ""branding""]",6,Marketing Students & Interns,"[""brand management"", ""digital marketing"", ""social media""]",58,9,2025-10-25 21:45:37,en,How do you attribute success to {keyword} efforts?,0.63,0.45817992008700736,0.55
35100381,content marketing,marketing,What tools are essential for content marketing analytics?,implementation,Beginner,"[""Introduction to content marketing"", ""Key points and analysis"", ""Practical examples"", ""Expert insights"", ""Action items"", ""Conclusion""]","[""content"", ""implementation"", ""promotion"", ""marketing"", ""advertising""]",4,Marketing Students & Interns,"[""brand management"", ""digital marketing"", ""social media""]",57,8,2025-10-25 21:45:37,en,What tools are essential for {keyword} analytics?,0.77,0.3535322005710967,0.4
35100382,content marketing,marketing,How do you develop an effective content marketing strategy?,best_practice,Expert,"[""Overview of content marketing"", ""Step-by-step implementation"", ""Best practices and tips"", ""Common challenges and solutions"", ""Tools and resources needed"", ""Conclusion and next steps""]","[""content"", ""promotion"", ""best_practice"", ""marketing"", ""advertising""]",6,Marketing Directors & CMOs,"[""digital marketing"", ""brand management"", ""social media""]",59,9,2025-10-25 21:45:37,en,How do you develop an effective {keyword} strategy?,0.88,1.0,0.48
35100383,investment planning,economics,How do you analyze market trends in investment planning?,troubleshooting,Beginner,"[""Overview of investment planning"", ""Step-by-step implementation"", ""Best practices and tips"", ""Common challenges and solutions"", ""Tools and resources needed"", ""Conclusion and next steps""]","[""investment"", ""planning"", ""finance"", ""troubleshooting"", ""market"", ""economics""]",6,Students & New Investors,"[""financial modeling"", ""market analysis"", ""portfolio management""]",56,9,2025-10-25 21:45:37,en,How do you analyze market trends in {keyword}?,0.93,0.3691265538087304,0.74
35100384,content marketing,marketing,How do you develop an effective content marketing strategy?,optimization,Advanced,"[""Overview of content marketing"", ""Step-by-step implementation"", ""Best practices and tips"", ""Common challenges and solutions"", ""Tools and resources needed"", ""Conclusion and next steps""]","[""content"", ""promotion"", ""marketing"", ""advertising"", ""optimization""]",6,Marketing Managers & Strategists,"[""digital marketing"", ""social media"", ""brand management""]",59,9,2025-10-25 21:45:37,en,How do you develop an effective {keyword} strategy?,0.75,0.8379266055519549,0.6
35100385,investment planning,economics,What are the seasonal patterns in investment planning?,how_to,Advanced,"[""Introduction to investment planning"", ""Key concepts and definitions"", ""Main categories or types"", ""Examples and case studies"", ""Benefits and advantages"", ""Summary and recommendations""]","[""investment"", ""how_to"", ""planning"", ""finance"", ""economics""]",6,Professional Investors & Advisors,"[""market analysis"", ""financial modeling"", ""portfolio management""]",54,8,2025-10-25 21:45:37,en,What are the seasonal patterns in {keyword}?,0.8,0.9518930212864352,0.47
35100386,web development,it,What are the best practices for web development development?,comparison,Intermediate,"[""Introduction to web development"", ""Key concepts and definitions"", ""Main categories or types"", ""Examples and case studies"", ""Benefits and advantages"", ""Summary and recommendations""]","[""software"", ""development"", ""it"", ""comparison"", ""web""]",6,Junior to Mid-level Developers,"[""machine learning"", ""cybersecurity"", ""cloud computing"", ""data science""]",60,9,2025-10-25 21:45:37,en,What are the best practices for {keyword} development?,0.63,0.6971677404507555,0.65
35100387,digital marketing,marketing,What does the future hold for digital marketing?,optimization,Advanced,"[""Introduction to digital marketing"", ""Key points and analysis"", ""Practical examples"", ""Expert insights"", ""Action items"", ""Conclusion""]","[""branding"", ""marketing"", ""optimization"", ""digital""]",4,Marketing Managers & Strategists,"[""content marketing"", ""social media"", ""brand management""]",48,8,2025-10-25 21:45:37,en,What does the future hold for {keyword}?,0.8,0.932770285574055,0.53
35100388,cybersecurity,it,What security considerations should be taken when using cybersecurity?,comparison,Expert,"[""Introduction to cybersecurity"", ""Key points and analysis"", ""Practical examples"", ""Expert insights"", ""Action items"", ""Conclusion""]","[""it"", ""comparison"", ""programming"", ""cybersecurity"", ""technology""]",4,Architects & Technical Directors,"[""cloud computing"", ""web development"", ""data science"", ""machine learning""]",70,9,2025-10-25 21:45:37,en,What security considerations should be taken when using {keyword}?,0.76,1.0,0.89
35100389,investment planning,economics,How do you report on investment planning performance to stakeholders?,planning,Expert,"[""Overview of investment planning"", ""Step-by-step implementation"", ""Best practices and tips"", ""Common challenges and solutions"", ""Tools and resources needed"", ""Conclusion and next steps""]","[""investment"", ""planning"", ""finance"", ""market"", ""economics""]",6,Portfolio Managers & Financial Experts,"[""market analysis"", ""financial modeling"", ""portfolio management""]",69,10,2025-10-25 21:45:37,en,How do you report on {keyword} performance to stakeholders?,0.87,1.0,0.8
35100390,social media,marketing,What KPIs are most important for social media?,analysis,Advanced,"[""Introduction to social media"", ""Key points and analysis"", ""Practical examples"", ""Expert insights"", ""Action items"", ""Conclusion""]","[""analysis"", ""media"", ""marketing"", ""digital"", ""social"", ""branding""]",4,Marketing Managers & Strategists,"[""brand management"", ""content marketing"", ""digital marketing""]",46,8,2025-10-25 21:45:37,en,What KPIs are most important for {keyword}?,0.92,0.867206014652641,0.43
35100391,market analysis,economics,How do you analyze market trends in market analysis?,planning,Expert,"[""Overview of market analysis"", ""Step-by-step implementation"", ""Best practices and tips"", ""Common challenges and solutions"", ""Tools and resources needed"", ""Conclusion and next steps""]","[""planning"", ""analysis"", ""finance"", ""market"", ""business"", ""economics""]",6,Portfolio Managers & Financial Experts,"[""investment planning"", ""financial modeling"", ""portfolio management""]",52,9,2025-10-25 21:45:37,en,How do you analyze market trends in {keyword}?,0.61,1.0,0.39
35100392,financial modeling,economics,How do you hedge against financial modeling market downturns?,strategy,Expert,"[""Overview of financial modeling"", ""Step-by-step implementation"", ""Best practices and tips"", ""Common challenges and solutions"", ""Tools and resources needed"", ""Conclusion and next steps""]","[""investment"", ""modeling"", ""financial"", ""business"", ""strategy"", ""economics""]",6,Portfolio Managers & Financial Experts,"[""market analysis"", ""investment planning"", ""portfolio management""]",61,9,2025-10-25 21:45:37,en,How do you hedge against {keyword} market downturns?,0.92,1.0,0.84
35100393,financial modeling,economics,What indicators predict financial modeling market movements?,planning,Beginner,"[""Introduction to financial modeling"", ""Key points and analysis"", ""Practical examples"", ""Expert insights"", ""Action items"", ""Conclusion""]","[""planning"", ""finance"", ""modeling"", ""financial"", ""market"", ""economics""]",4,Students & New Investors,"[""market analysis"", ""portfolio management"", ""investment planning""]",60,7,2025-10-25 21:45:37,en,What indicators predict {keyword} market movements?,0.88,0.38068063633036264,0.66
