record_id,keyword,category,question,question_type,difficulty_level,answer_outline,tags,estimated_read_time,target_audience,related_topics,question_length,word_count,created_date,language,source_template,engagement_score,complexity_score,popularity_score
44600347,digital marketing,marketing,What channels are most effective for digital marketing?,analysis,Expert,"[""Introduction to digital marketing"", ""Key points and analysis"", ""Practical examples"", ""Expert insights"", ""Action items"", ""Conclusion""]","[""analysis"", ""promotion"", ""marketing"", ""digital"", ""advertising""]",4,Marketing Directors & CMOs,"[""brand management"", ""content marketing"", ""social media""]",55,8,2025-10-25 21:58:42,en,What channels are most effective for {keyword}?,0.94,1.0,0.55
44600348,content marketing,marketing,How do you develop an effective content marketing strategy?,how_to,Intermediate,"[""Overview of content marketing"", ""Step-by-step implementation"", ""Best practices and tips"", ""Common challenges and solutions"", ""Tools and resources needed"", ""Conclusion and next steps""]","[""how_to"", ""content"", ""marketing"", ""digital"", ""advertising""]",6,Marketing Coordinators & Specialists,"[""digital marketing"", ""social media"", ""brand management""]",59,9,2025-10-25 21:58:42,en,How do you develop an effective {keyword} strategy?,0.62,0.6010745106707669,0.65
44600349,brand management,marketing,What messaging works best in brand management campaigns?,evaluation,Intermediate,"[""Introduction to brand management"", ""Key points and analysis"", ""Practical examples"", ""Expert insights"", ""Action items"", ""Conclusion""]","[""promotion"", ""marketing"", ""management"", ""digital"", ""evaluation"", ""brand""]",4,Marketing Coordinators & Specialists,"[""digital marketing"", ""content marketing"", ""social media""]",56,8,2025-10-25 21:58:42,en,What messaging works best in {keyword} campaigns?,0.85,0.7877201145114889,0.41
44600350,portfolio management,economics,What are the risks associated with portfolio management?,strategy,Advanced,"[""Introduction to portfolio management"", ""Key concepts and definitions"", ""Main categories or types"", ""Examples and case studies"", ""Benefits and advantages"", ""Summary and recommendations""]","[""investment"", ""portfolio"", ""management"", ""business"", ""strategy"", ""economics""]",6,Professional Investors & Advisors,"[""market analysis"", ""financial modeling"", ""investment planning""]",56,8,2025-10-25 21:58:42,en,What are the risks associated with {keyword}?,0.94,0.9490001367519124,0.47
44600351,digital marketing,marketing,How do you track and analyze digital marketing performance?,comparison,Intermediate,"[""Overview of digital marketing"", ""Step-by-step implementation"", ""Best practices and tips"", ""Common challenges and solutions"", ""Tools and resources needed"", ""Conclusion and next steps""]","[""marketing"", ""promotion"", ""comparison"", ""digital""]",6,Marketing Coordinators & Specialists,"[""content marketing"", ""brand management"", ""social media""]",59,9,2025-10-25 21:58:42,en,How do you track and analyze {keyword} performance?,0.62,0.7485464549992313,0.76
44600352,cybersecurity,it,How do you integrate cybersecurity with existing systems?,best_practice,Beginner,"[""Overview of cybersecurity"", ""Step-by-step implementation"", ""Best practices and tips"", ""Common challenges and solutions"", ""Tools and resources needed"", ""Conclusion and next steps""]","[""software"", ""it"", ""best_practice"", ""cybersecurity"", ""technology""]",5,Students & Entry-level Developers,"[""web development"", ""data science"", ""cloud computing"", ""machine learning""]",57,8,2025-10-25 21:58:42,en,How do you integrate {keyword} with existing systems?,0.67,0.42350402733400677,0.35
44600353,social media,marketing,What tools are essential for social media analytics?,implementation,Beginner,"[""Introduction to social media"", ""Key points and analysis"", ""Practical examples"", ""Expert insights"", ""Action items"", ""Conclusion""]","[""media"", ""implementation"", ""marketing"", ""social"", ""advertising"", ""branding""]",4,Marketing Students & Interns,"[""content marketing"", ""digital marketing"", ""brand management""]",52,8,2025-10-25 21:58:42,en,What tools are essential for {keyword} analytics?,0.77,0.448342960826257,0.71
44600354,social media,marketing,How do you reach new customers through social media?,troubleshooting,Intermediate,"[""Overview of social media"", ""Step-by-step implementation"", ""Best practices and tips"", ""Common challenges and solutions"", ""Tools and resources needed"", ""Conclusion and next steps""]","[""media"", ""promotion"", ""troubleshooting"", ""marketing"", ""digital"", ""social""]",6,Marketing Coordinators & Specialists,"[""brand management"", ""content marketing"", ""digital marketing""]",52,9,2025-10-25 21:58:42,en,How do you reach new customers through {keyword}?,0.83,0.6361910375757834,0.62
44600355,social media,marketing,How is AI changing social media approaches?,implementation,Beginner,"[""Introduction to social media"", ""Key points and analysis"", ""Practical examples"", ""Expert insights"", ""Action items"", ""Conclusion""]","[""media"", ""implementation"", ""promotion"", ""marketing"", ""social"", ""advertising""]",4,Marketing Students & Interns,"[""digital marketing"", ""content marketing"", ""brand management""]",43,7,2025-10-25 21:58:42,en,How is AI changing {keyword} approaches?,0.8,0.43135920997071064,0.54
44600356,web development,it,What are the cost considerations for web development?,optimization,Expert,"[""Introduction to web development"", ""Key concepts and definitions"", ""Main categories or types"", ""Examples and case studies"", ""Benefits and advantages"", ""Summary and recommendations""]","[""software"", ""development"", ""it"", ""programming"", ""optimization"", ""web""]",6,Architects & Technical Directors,"[""cybersecurity"", ""machine learning"", ""data science"", ""cloud computing""]",53,8,2025-10-25 21:58:42,en,What are the cost considerations for {keyword}?,0.82,1.0,0.32
44600357,cloud computing,it,How do you troubleshoot common issues with cloud computing?,evaluation,Beginner,"[""Overview of cloud computing"", ""Step-by-step implementation"", ""Best practices and tips"", ""Common challenges and solutions"", ""Tools and resources needed"", ""Conclusion and next steps""]","[""computing"", ""development"", ""it"", ""programming"", ""evaluation"", ""cloud""]",6,Students & Entry-level Developers,"[""data science"", ""web development"", ""cybersecurity"", ""machine learning""]",59,9,2025-10-25 21:58:42,en,How do you troubleshoot common issues with {keyword}?,0.62,0.4913694290856473,0.81
44600358,machine learning,it,How do you stay updated with machine learning developments?,best_practice,Advanced,"[""Overview of machine learning"", ""Step-by-step implementation"", ""Best practices and tips"", ""Common challenges and solutions"", ""Tools and resources needed"", ""Conclusion and next steps""]","[""software"", ""development"", ""it"", ""best_practice"", ""learning"", ""machine""]",6,Senior Developers & Tech Leads,"[""cloud computing"", ""data science"", ""cybersecurity"", ""web development""]",59,9,2025-10-25 21:58:42,en,How do you stay updated with {keyword} developments?,0.79,0.8453040951414708,0.74
44600359,digital marketing,marketing,What demographics respond best to digital marketing?,evaluation,Beginner,"[""Introduction to digital marketing"", ""Key points and analysis"", ""Practical examples"", ""Expert insights"", ""Action items"", ""Conclusion""]","[""promotion"", ""marketing"", ""digital"", ""branding"", ""evaluation""]",4,Marketing Students & Interns,"[""content marketing"", ""brand management"", ""social media""]",52,7,2025-10-25 21:58:42,en,What demographics respond best to {keyword}?,0.91,0.358961445384964,0.81
44600360,social media,marketing,How do you personalize social media for different segments?,best_practice,Intermediate,"[""Overview of social media"", ""Step-by-step implementation"", ""Best practices and tips"", ""Common challenges and solutions"", ""Tools and resources needed"", ""Conclusion and next steps""]","[""media"", ""promotion"", ""best_practice"", ""marketing"", ""social"", ""branding""]",6,Marketing Coordinators & Specialists,"[""brand management"", ""content marketing"", ""digital marketing""]",59,9,2025-10-25 21:58:42,en,How do you personalize {keyword} for different segments?,0.91,0.7130190643089075,0.49
44600361,web development,it,What are the best practices for web development development?,evaluation,Beginner,"[""Introduction to web development"", ""Key concepts and definitions"", ""Main categories or types"", ""Examples and case studies"", ""Benefits and advantages"", ""Summary and recommendations""]","[""software"", ""development"", ""web"", ""it"", ""evaluation"", ""technology""]",6,Students & Entry-level Developers,"[""machine learning"", ""cloud computing"", ""cybersecurity"", ""data science""]",60,9,2025-10-25 21:58:42,en,What are the best practices for {keyword} development?,0.8,0.4553752062664869,0.8
44600362,web development,it,How do you optimize web development for different platforms?,best_practice,Beginner,"[""Overview of web development"", ""Step-by-step implementation"", ""Best practices and tips"", ""Common challenges and solutions"", ""Tools and resources needed"", ""Conclusion and next steps""]","[""technology"", ""development"", ""it"", ""best_practice"", ""programming"", ""web""]",6,Students & Entry-level Developers,"[""machine learning"", ""data science"", ""cybersecurity"", ""cloud computing""]",60,9,2025-10-25 21:58:42,en,How do you optimize {keyword} for different platforms?,0.65,0.36946844537454604,0.55
44600363,financial modeling,economics,How do you adjust your financial modeling strategy during volatility?,troubleshooting,Beginner,"[""Overview of financial modeling"", ""Step-by-step implementation"", ""Best practices and tips"", ""Common challenges and solutions"", ""Tools and resources needed"", ""Conclusion and next steps""]","[""investment"", ""finance"", ""troubleshooting"", ""modeling"", ""financial"", ""economics""]",6,Students & New Investors,"[""investment planning"", ""portfolio management"", ""market analysis""]",69,10,2025-10-25 21:58:42,en,How do you adjust your {keyword} strategy during volatility?,0.66,0.4896762412988185,0.58
44600364,cybersecurity,it,What is the recommended architecture for cybersecurity systems?,best_practice,Advanced,"[""Introduction to cybersecurity"", ""Key points and analysis"", ""Practical examples"", ""Expert insights"", ""Action items"", ""Conclusion""]","[""software"", ""it"", ""best_practice"", ""cybersecurity"", ""technology""]",4,Senior Developers & Tech Leads,"[""machine learning"", ""cloud computing"", ""data science"", ""web development""]",63,8,2025-10-25 21:58:42,en,What is the recommended architecture for {keyword} systems?,0.67,0.8676414037763075,0.6
44600365,investment planning,economics,How does global economics impact investment planning?,optimization,Expert,"[""Introduction to investment planning"", ""Key points and analysis"", ""Practical examples"", ""Expert insights"", ""Action items"", ""Conclusion""]","[""investment"", ""planning"", ""market"", ""optimization"", ""economics""]",4,Portfolio Managers & Financial Experts,"[""financial modeling"", ""market analysis"", ""portfolio management""]",53,7,2025-10-25 21:58:42,en,How does global economics impact {keyword}?,0.86,1.0,0.68
44600366,content marketing,marketing,What A/B tests should you run for content marketing?,strategy,Intermediate,"[""Introduction to content marketing"", ""Key points and analysis"", ""Practical examples"", ""Expert insights"", ""Action items"", ""Conclusion""]","[""content"", ""marketing"", ""digital"", ""branding"", ""strategy""]",4,Marketing Coordinators & Specialists,"[""digital marketing"", ""social media"", ""brand management""]",52,9,2025-10-25 21:58:42,en,What A/B tests should you run for {keyword}?,0.86,0.7138617826540797,0.75
44600367,social media,marketing,What messaging works best in social media campaigns?,planning,Expert,"[""Introduction to social media"", ""Key points and analysis"", ""Practical examples"", ""Expert insights"", ""Action items"", ""Conclusion""]","[""planning"", ""media"", ""promotion"", ""marketing"", ""social"", ""advertising""]",4,Marketing Directors & CMOs,"[""content marketing"", ""brand management"", ""digital marketing""]",52,8,2025-10-25 21:58:42,en,What messaging works best in {keyword} campaigns?,0.87,1.0,0.43
44600368,cloud computing,it,What are the key components of a cloud computing implementation?,analysis,Beginner,"[""Introduction to cloud computing"", ""Key concepts and definitions"", ""Main categories or types"", ""Examples and case studies"", ""Benefits and advantages"", ""Summary and recommendations""]","[""computing"", ""development"", ""analysis"", ""it"", ""cloud"", ""technology""]",6,Students & Entry-level Developers,"[""web development"", ""machine learning"", ""data science"", ""cybersecurity""]",64,10,2025-10-25 21:58:42,en,What are the key components of a {keyword} implementation?,0.74,0.45475637774519406,0.74
44600369,cybersecurity,it,How can cybersecurity improve system performance and scalability?,how_to,Advanced,"[""Introduction to cybersecurity"", ""Key points and analysis"", ""Practical examples"", ""Expert insights"", ""Action items"", ""Conclusion""]","[""how_to"", ""development"", ""it"", ""cybersecurity"", ""technology""]",4,Senior Developers & Tech Leads,"[""cloud computing"", ""web development"", ""machine learning"", ""data science""]",65,8,2025-10-25 21:58:42,en,How can {keyword} improve system performance and scalability?,0.82,0.8339526437112155,0.69
44600370,brand management,marketing,What emerging platforms support brand management?,how_to,Intermediate,"[""Introduction to brand management"", ""Key points and analysis"", ""Practical examples"", ""Expert insights"", ""Action items"", ""Conclusion""]","[""how_to"", ""marketing"", ""management"", ""digital"", ""branding"", ""brand""]",4,Marketing Coordinators & Specialists,"[""social media"", ""content marketing"", ""digital marketing""]",49,6,2025-10-25 21:58:42,en,What emerging platforms support {keyword}?,0.7,0.6762225602163118,0.45
44600371,cloud computing,it,How do you integrate cloud computing with existing systems?,troubleshooting,Beginner,"[""Overview of cloud computing"", ""Step-by-step implementation"", ""Best practices and tips"", ""Common challenges and solutions"", ""Tools and resources needed"", ""Conclusion and next steps""]","[""computing"", ""software"", ""it"", ""programming"", ""troubleshooting"", ""cloud""]",6,Students & Entry-level Developers,"[""data science"", ""web development"", ""cybersecurity"", ""machine learning""]",59,9,2025-10-25 21:58:42,en,How do you integrate {keyword} with existing systems?,0.84,0.3200293798601727,0.81
44600372,digital marketing,marketing,How do you create a digital marketing roadmap?,how_to,Advanced,"[""Overview of digital marketing"", ""Step-by-step implementation"", ""Best practices and tips"", ""Common challenges and solutions"", ""Tools and resources needed"", ""Conclusion and next steps""]","[""branding"", ""marketing"", ""how_to"", ""digital""]",6,Marketing Managers & Strategists,"[""social media"", ""brand management"", ""content marketing""]",46,8,2025-10-25 21:58:42,en,How do you create a {keyword} roadmap?,0.78,0.8252849215074155,0.74
44600373,market analysis,economics,What are the regulatory considerations for market analysis?,how_to,Beginner,"[""Introduction to market analysis"", ""Key concepts and definitions"", ""Main categories or types"", ""Examples and case studies"", ""Benefits and advantages"", ""Summary and recommendations""]","[""investment"", ""how_to"", ""analysis"", ""finance"", ""market"", ""economics""]",6,Students & New Investors,"[""investment planning"", ""portfolio management"", ""financial modeling""]",59,8,2025-10-25 21:58:42,en,What are the regulatory considerations for {keyword}?,0.76,0.46139146158333477,0.35
44600374,brand management,marketing,What content types work best for brand management?,how_to,Beginner,"[""Introduction to brand management"", ""Key points and analysis"", ""Practical examples"", ""Expert insights"", ""Action items"", ""Conclusion""]","[""how_to"", ""promotion"", ""digital"", ""marketing"", ""management"", ""brand""]",4,Marketing Students & Interns,"[""digital marketing"", ""content marketing"", ""social media""]",50,8,2025-10-25 21:58:42,en,What content types work best for {keyword}?,0.82,0.3840418120460609,0.38
44600375,cloud computing,it,How do you get started with cloud computing as a beginner?,how_to,Expert,"[""Overview of cloud computing"", ""Step-by-step implementation"", ""Best practices and tips"", ""Common challenges and solutions"", ""Tools and resources needed"", ""Conclusion and next steps""]","[""computing"", ""how_to"", ""software"", ""development"", ""it"", ""cloud""]",6,Architects & Technical Directors,"[""cybersecurity"", ""machine learning"", ""web development"", ""data science""]",58,11,2025-10-25 21:58:42,en,How do you get started with {keyword} as a beginner?,0.65,1.0,0.84
44600376,content marketing,marketing,How do you create a content marketing roadmap?,strategy,Expert,"[""Overview of content marketing"", ""Step-by-step implementation"", ""Best practices and tips"", ""Common challenges and solutions"", ""Tools and resources needed"", ""Conclusion and next steps""]","[""content"", ""promotion"", ""marketing"", ""branding"", ""strategy""]",6,Marketing Directors & CMOs,"[""social media"", ""brand management"", ""digital marketing""]",46,8,2025-10-25 21:58:42,en,How do you create a {keyword} roadmap?,0.78,1.0,0.63
44600377,social media,marketing,How do you improve social media conversion rates?,best_practice,Advanced,"[""Overview of social media"", ""Step-by-step implementation"", ""Best practices and tips"", ""Common challenges and solutions"", ""Tools and resources needed"", ""Conclusion and next steps""]","[""media"", ""best_practice"", ""marketing"", ""digital"", ""social"", ""branding""]",6,Marketing Managers & Strategists,"[""brand management"", ""digital marketing"", ""content marketing""]",49,8,2025-10-25 21:58:42,en,How do you improve {keyword} conversion rates?,0.86,0.9797492621938627,0.41
44600378,cloud computing,it,What ROI can be expected from cloud computing implementation?,how_to,Beginner,"[""Introduction to cloud computing"", ""Key points and analysis"", ""Practical examples"", ""Expert insights"", ""Action items"", ""Conclusion""]","[""computing"", ""how_to"", ""software"", ""it"", ""programming"", ""cloud""]",4,Students & Entry-level Developers,"[""web development"", ""machine learning"", ""cybersecurity"", ""data science""]",61,9,2025-10-25 21:58:42,en,What ROI can be expected from {keyword} implementation?,0.65,0.3020009397636662,0.33
44600379,cloud computing,it,How do you stay updated with cloud computing developments?,how_to,Beginner,"[""Overview of cloud computing"", ""Step-by-step implementation"", ""Best practices and tips"", ""Common challenges and solutions"", ""Tools and resources needed"", ""Conclusion and next steps""]","[""computing"", ""how_to"", ""software"", ""development"", ""it"", ""cloud""]",6,Students & Entry-level Developers,"[""data science"", ""machine learning"", ""cybersecurity"", ""web development""]",58,9,2025-10-25 21:58:42,en,How do you stay updated with {keyword} developments?,0.93,0.4859891306455386,0.56
44600380,cloud computing,it,What are the best practices for cloud computing development?,best_practice,Advanced,"[""Introduction to cloud computing"", ""Key concepts and definitions"", ""Main categories or types"", ""Examples and case studies"", ""Benefits and advantages"", ""Summary and recommendations""]","[""computing"", ""software"", ""development"", ""it"", ""best_practice"", ""cloud""]",6,Senior Developers & Tech Leads,"[""web development"", ""machine learning"", ""cybersecurity"", ""data science""]",60,9,2025-10-25 21:58:42,en,What are the best practices for {keyword} development?,0.71,0.9593959168748253,0.72
44600381,brand management,marketing,How do you personalize brand management for different segments?,troubleshooting,Beginner,"[""Overview of brand management"", ""Step-by-step implementation"", ""Best practices and tips"", ""Common challenges and solutions"", ""Tools and resources needed"", ""Conclusion and next steps""]","[""troubleshooting"", ""digital"", ""marketing"", ""management"", ""branding"", ""brand""]",6,Marketing Students & Interns,"[""social media"", ""content marketing"", ""digital marketing""]",63,9,2025-10-25 21:58:42,en,How do you personalize {keyword} for different segments?,0.8,0.41791319624722667,0.65
44600382,financial modeling,economics,What are the regulatory considerations for financial modeling?,strategy,Intermediate,"[""Introduction to financial modeling"", ""Key concepts and definitions"", ""Main categories or types"", ""Examples and case studies"", ""Benefits and advantages"", ""Summary and recommendations""]","[""investment"", ""finance"", ""modeling"", ""financial"", ""strategy"", ""economics""]",6,Individual Investors & Analysts,"[""market analysis"", ""investment planning"", ""portfolio management""]",62,8,2025-10-25 21:58:42,en,What are the regulatory considerations for {keyword}?,0.75,0.7415186076243064,0.71
44600383,digital marketing,marketing,What tools are essential for digital marketing analytics?,best_practice,Beginner,"[""Introduction to digital marketing"", ""Key points and analysis"", ""Practical examples"", ""Expert insights"", ""Action items"", ""Conclusion""]","[""promotion"", ""best_practice"", ""marketing"", ""digital"", ""branding""]",4,Marketing Students & Interns,"[""brand management"", ""content marketing"", ""social media""]",57,8,2025-10-25 21:58:42,en,What tools are essential for {keyword} analytics?,0.82,0.4834439185116751,0.83
44600384,social media,marketing,How do you develop an effective social media strategy?,planning,Beginner,"[""Overview of social media"", ""Step-by-step implementation"", ""Best practices and tips"", ""Common challenges and solutions"", ""Tools and resources needed"", ""Conclusion and next steps""]","[""planning"", ""media"", ""marketing"", ""social"", ""advertising"", ""branding""]",6,Marketing Students & Interns,"[""brand management"", ""content marketing"", ""digital marketing""]",54,9,2025-10-25 21:58:42,en,How do you develop an effective {keyword} strategy?,0.82,0.4369400867437572,0.68
44600385,brand management,marketing,How do you personalize brand management for different segments?,best_practice,Advanced,"[""Overview of brand management"", ""Step-by-step implementation"", ""Best practices and tips"", ""Common challenges and solutions"", ""Tools and resources needed"", ""Conclusion and next steps""]","[""promotion"", ""best_practice"", ""marketing"", ""management"", ""advertising"", ""brand""]",6,Marketing Managers & Strategists,"[""content marketing"", ""social media"", ""digital marketing""]",63,9,2025-10-25 21:58:42,en,How do you personalize {keyword} for different segments?,0.85,0.9600400044634356,0.86
44600386,social media,marketing,How do you automate social media processes?,optimization,Beginner,"[""Overview of social media"", ""Step-by-step implementation"", ""Best practices and tips"", ""Common challenges and solutions"", ""Tools and resources needed"", ""Conclusion and next steps""]","[""media"", ""marketing"", ""digital"", ""social"", ""branding"", ""optimization""]",6,Marketing Students & Interns,"[""content marketing"", ""digital marketing"", ""brand management""]",43,7,2025-10-25 21:58:42,en,How do you automate {keyword} processes?,0.79,0.4498896357752531,0.46
44600387,cloud computing,it,What are the key components of a cloud computing implementation?,how_to,Expert,"[""Introduction to cloud computing"", ""Key concepts and definitions"", ""Main categories or types"", ""Examples and case studies"", ""Benefits and advantages"", ""Summary and recommendations""]","[""computing"", ""how_to"", ""it"", ""programming"", ""cloud"", ""technology""]",6,Architects & Technical Directors,"[""machine learning"", ""cybersecurity"", ""web development"", ""data science""]",64,10,2025-10-25 21:58:42,en,What are the key components of a {keyword} implementation?,0.83,1.0,0.49
44600388,machine learning,it,How do you convince stakeholders to invest in machine learning?,implementation,Advanced,"[""Overview of machine learning"", ""Step-by-step implementation"", ""Best practices and tips"", ""Common challenges and solutions"", ""Tools and resources needed"", ""Conclusion and next steps""]","[""software"", ""development"", ""it"", ""implementation"", ""learning"", ""machine""]",6,Senior Developers & Tech Leads,"[""data science"", ""web development"", ""cybersecurity"", ""cloud computing""]",63,10,2025-10-25 21:58:42,en,How do you convince stakeholders to invest in {keyword}?,0.95,0.8489080254512894,0.33
44600389,web development,it,How do you convince stakeholders to invest in web development?,best_practice,Beginner,"[""Overview of web development"", ""Step-by-step implementation"", ""Best practices and tips"", ""Common challenges and solutions"", ""Tools and resources needed"", ""Conclusion and next steps""]","[""development"", ""it"", ""programming"", ""best_practice"", ""web""]",6,Students & Entry-level Developers,"[""data science"", ""cloud computing"", ""cybersecurity"", ""machine learning""]",62,10,2025-10-25 21:58:42,en,How do you convince stakeholders to invest in {keyword}?,0.73,0.44504055601225173,0.44
