record_id,keyword,category,question,question_type,difficulty_level,answer_outline,tags,estimated_read_time,target_audience,related_topics,question_length,word_count,created_date,language,source_template,engagement_score,complexity_score,popularity_score
41200652,market analysis,economics,What exit strategies should be considered for market analysis?,best_practice,Intermediate,"[""Introduction to market analysis"", ""Key points and analysis"", ""Practical examples"", ""Expert insights"", ""Action items"", ""Conclusion""]","[""investment"", ""analysis"", ""best_practice"", ""market"", ""economics""]",4,Individual Investors & Analysts,"[""portfolio management"", ""investment planning"", ""financial modeling""]",62,9,2025-10-25 21:54:03,en,What exit strategies should be considered for {keyword}?,0.69,0.6135367026894794,0.41
41200653,cybersecurity,it,How can cybersecurity improve system performance and scalability?,comparison,Advanced,"[""Introduction to cybersecurity"", ""Key points and analysis"", ""Practical examples"", ""Expert insights"", ""Action items"", ""Conclusion""]","[""software"", ""development"", ""it"", ""comparison"", ""cybersecurity""]",4,Senior Developers & Tech Leads,"[""web development"", ""machine learning"", ""cloud computing"", ""data science""]",65,8,2025-10-25 21:54:03,en,How can {keyword} improve system performance and scalability?,0.62,0.9131825672532873,0.34
41200654,cybersecurity,it,What is the recommended architecture for cybersecurity systems?,planning,Intermediate,"[""Introduction to cybersecurity"", ""Key points and analysis"", ""Practical examples"", ""Expert insights"", ""Action items"", ""Conclusion""]","[""planning"", ""it"", ""programming"", ""cybersecurity"", ""technology""]",4,Junior to Mid-level Developers,"[""data science"", ""machine learning"", ""cloud computing"", ""web development""]",63,8,2025-10-25 21:54:03,en,What is the recommended architecture for {keyword} systems?,0.87,0.6965939146337338,0.49
41200655,market analysis,economics,How does global economics impact market analysis?,planning,Expert,"[""Introduction to market analysis"", ""Key points and analysis"", ""Practical examples"", ""Expert insights"", ""Action items"", ""Conclusion""]","[""investment"", ""planning"", ""analysis"", ""market"", ""economics""]",4,Portfolio Managers & Financial Experts,"[""portfolio management"", ""investment planning"", ""financial modeling""]",49,7,2025-10-25 21:54:03,en,How does global economics impact {keyword}?,0.86,1.0,0.66
41200656,portfolio management,economics,How do you measure portfolio management performance?,best_practice,Expert,"[""Overview of portfolio management"", ""Step-by-step implementation"", ""Best practices and tips"", ""Common challenges and solutions"", ""Tools and resources needed"", ""Conclusion and next steps""]","[""investment"", ""portfolio"", ""best_practice"", ""management"", ""market"", ""economics""]",6,Portfolio Managers & Financial Experts,"[""investment planning"", ""market analysis"", ""financial modeling""]",52,7,2025-10-25 21:54:03,en,How do you measure {keyword} performance?,0.74,1.0,0.61
41200657,portfolio management,economics,How do you diversify your portfolio using portfolio management?,analysis,Intermediate,"[""Overview of portfolio management"", ""Step-by-step implementation"", ""Best practices and tips"", ""Common challenges and solutions"", ""Tools and resources needed"", ""Conclusion and next steps""]","[""investment"", ""finance"", ""analysis"", ""portfolio"", ""management"", ""economics""]",6,Individual Investors & Analysts,"[""investment planning"", ""financial modeling"", ""market analysis""]",63,9,2025-10-25 21:54:03,en,How do you diversify your portfolio using {keyword}?,0.94,0.6564044511296435,0.35
41200658,data science,it,How do you integrate data science with existing systems?,best_practice,Advanced,"[""Overview of data science"", ""Step-by-step implementation"", ""Best practices and tips"", ""Common challenges and solutions"", ""Tools and resources needed"", ""Conclusion and next steps""]","[""software"", ""it"", ""best_practice"", ""programming"", ""science"", ""data""]",6,Senior Developers & Tech Leads,"[""cybersecurity"", ""web development"", ""cloud computing"", ""machine learning""]",56,9,2025-10-25 21:54:03,en,How do you integrate {keyword} with existing systems?,0.71,0.9695259415497304,0.7
41200659,financial modeling,economics,How do you protect your financial modeling investments?,strategy,Intermediate,"[""Overview of financial modeling"", ""Step-by-step implementation"", ""Best practices and tips"", ""Common challenges and solutions"", ""Tools and resources needed"", ""Conclusion and next steps""]","[""finance"", ""modeling"", ""financial"", ""business"", ""strategy"", ""economics""]",6,Individual Investors & Analysts,"[""investment planning"", ""market analysis"", ""portfolio management""]",55,8,2025-10-25 21:54:03,en,How do you protect your {keyword} investments?,0.67,0.6322920481122889,0.69
41200660,cloud computing,it,What tools are essential for cloud computing development?,optimization,Advanced,"[""Introduction to cloud computing"", ""Key points and analysis"", ""Practical examples"", ""Expert insights"", ""Action items"", ""Conclusion""]","[""computing"", ""cloud"", ""software"", ""it"", ""programming"", ""optimization""]",4,Senior Developers & Tech Leads,"[""machine learning"", ""web development"", ""cybersecurity"", ""data science""]",57,8,2025-10-25 21:54:03,en,What tools are essential for {keyword} development?,0.64,0.8757692510754618,0.42
41200661,content marketing,marketing,What does the future hold for content marketing?,planning,Expert,"[""Introduction to content marketing"", ""Key points and analysis"", ""Practical examples"", ""Expert insights"", ""Action items"", ""Conclusion""]","[""planning"", ""content"", ""marketing"", ""advertising"", ""branding""]",4,Marketing Directors & CMOs,"[""social media"", ""digital marketing"", ""brand management""]",48,8,2025-10-25 21:54:03,en,What does the future hold for {keyword}?,0.88,1.0,0.53
41200662,machine learning,it,What tools are essential for machine learning development?,optimization,Beginner,"[""Introduction to machine learning"", ""Key points and analysis"", ""Practical examples"", ""Expert insights"", ""Action items"", ""Conclusion""]","[""software"", ""development"", ""it"", ""learning"", ""optimization"", ""machine""]",4,Students & Entry-level Developers,"[""cloud computing"", ""cybersecurity"", ""data science"", ""web development""]",58,8,2025-10-25 21:54:03,en,What tools are essential for {keyword} development?,0.64,0.305762121261233,0.31
41200663,portfolio management,economics,How do you benchmark portfolio management against alternatives?,comparison,Advanced,"[""Overview of portfolio management"", ""Step-by-step implementation"", ""Best practices and tips"", ""Common challenges and solutions"", ""Tools and resources needed"", ""Conclusion and next steps""]","[""portfolio"", ""comparison"", ""management"", ""market"", ""business"", ""economics""]",6,Professional Investors & Advisors,"[""financial modeling"", ""investment planning"", ""market analysis""]",63,8,2025-10-25 21:54:03,en,How do you benchmark {keyword} against alternatives?,0.77,0.8964540579311874,0.48
41200664,market analysis,economics,How do you adjust your market analysis strategy during volatility?,comparison,Expert,"[""Overview of market analysis"", ""Step-by-step implementation"", ""Best practices and tips"", ""Common challenges and solutions"", ""Tools and resources needed"", ""Conclusion and next steps""]","[""finance"", ""analysis"", ""comparison"", ""market"", ""economics""]",6,Portfolio Managers & Financial Experts,"[""investment planning"", ""portfolio management"", ""financial modeling""]",66,10,2025-10-25 21:54:03,en,How do you adjust your {keyword} strategy during volatility?,0.86,1.0,0.66
41200665,social media,marketing,How do you personalize social media for different segments?,optimization,Intermediate,"[""Overview of social media"", ""Step-by-step implementation"", ""Best practices and tips"", ""Common challenges and solutions"", ""Tools and resources needed"", ""Conclusion and next steps""]","[""media"", ""marketing"", ""digital"", ""social"", ""advertising"", ""optimization""]",6,Marketing Coordinators & Specialists,"[""brand management"", ""digital marketing"", ""content marketing""]",59,9,2025-10-25 21:54:03,en,How do you personalize {keyword} for different segments?,0.68,0.7909997533219055,0.7
41200666,brand management,marketing,How do you measure the ROI of brand management campaigns?,optimization,Advanced,"[""Overview of brand management"", ""Step-by-step implementation"", ""Best practices and tips"", ""Common challenges and solutions"", ""Tools and resources needed"", ""Conclusion and next steps""]","[""promotion"", ""marketing"", ""management"", ""digital"", ""optimization"", ""brand""]",6,Marketing Managers & Strategists,"[""social media"", ""content marketing"", ""digital marketing""]",57,10,2025-10-25 21:54:03,en,How do you measure the ROI of {keyword} campaigns?,0.86,0.8129807268171738,0.51
41200667,portfolio management,economics,What are the risks associated with portfolio management?,how_to,Beginner,"[""Introduction to portfolio management"", ""Key concepts and definitions"", ""Main categories or types"", ""Examples and case studies"", ""Benefits and advantages"", ""Summary and recommendations""]","[""how_to"", ""finance"", ""portfolio"", ""management"", ""market"", ""economics""]",6,Students & New Investors,"[""financial modeling"", ""market analysis"", ""investment planning""]",56,8,2025-10-25 21:54:03,en,What are the risks associated with {keyword}?,0.68,0.480927084707973,0.41
41200668,investment planning,economics,What is the optimal allocation for investment planning in a portfolio?,evaluation,Beginner,"[""Introduction to investment planning"", ""Key points and analysis"", ""Practical examples"", ""Expert insights"", ""Action items"", ""Conclusion""]","[""investment"", ""planning"", ""finance"", ""evaluation"", ""market"", ""economics""]",4,Students & New Investors,"[""market analysis"", ""portfolio management"", ""financial modeling""]",70,11,2025-10-25 21:54:03,en,What is the optimal allocation for {keyword} in a portfolio?,0.89,0.42039073093769475,0.53
41200669,cloud computing,it,What design patterns work best with cloud computing?,evaluation,Expert,"[""Introduction to cloud computing"", ""Key points and analysis"", ""Practical examples"", ""Expert insights"", ""Action items"", ""Conclusion""]","[""computing"", ""software"", ""it"", ""evaluation"", ""cloud"", ""technology""]",4,Architects & Technical Directors,"[""web development"", ""data science"", ""machine learning"", ""cybersecurity""]",52,8,2025-10-25 21:54:03,en,What design patterns work best with {keyword}?,0.65,1.0,0.83
41200670,brand management,marketing,What budget should be allocated to brand management?,implementation,Intermediate,"[""Introduction to brand management"", ""Key points and analysis"", ""Practical examples"", ""Expert insights"", ""Action items"", ""Conclusion""]","[""implementation"", ""marketing"", ""management"", ""advertising"", ""branding"", ""brand""]",4,Marketing Coordinators & Specialists,"[""content marketing"", ""social media"", ""digital marketing""]",52,8,2025-10-25 21:54:03,en,What budget should be allocated to {keyword}?,0.65,0.6347153851125942,0.47
41200671,financial modeling,economics,How do you assess and manage financial modeling risks?,troubleshooting,Intermediate,"[""Overview of financial modeling"", ""Step-by-step implementation"", ""Best practices and tips"", ""Common challenges and solutions"", ""Tools and resources needed"", ""Conclusion and next steps""]","[""finance"", ""troubleshooting"", ""modeling"", ""financial"", ""business"", ""economics""]",6,Individual Investors & Analysts,"[""portfolio management"", ""market analysis"", ""investment planning""]",54,9,2025-10-25 21:54:03,en,How do you assess and manage {keyword} risks?,0.64,0.7419691228653843,0.48
41200672,brand management,marketing,How do you measure the ROI of brand management campaigns?,troubleshooting,Intermediate,"[""Overview of brand management"", ""Step-by-step implementation"", ""Best practices and tips"", ""Common challenges and solutions"", ""Tools and resources needed"", ""Conclusion and next steps""]","[""troubleshooting"", ""digital"", ""marketing"", ""management"", ""branding"", ""brand""]",6,Marketing Coordinators & Specialists,"[""digital marketing"", ""social media"", ""content marketing""]",57,10,2025-10-25 21:54:03,en,How do you measure the ROI of {keyword} campaigns?,0.88,0.6856474393885462,0.81
41200673,investment planning,economics,How do you assess and manage investment planning risks?,how_to,Expert,"[""Overview of investment planning"", ""Step-by-step implementation"", ""Best practices and tips"", ""Common challenges and solutions"", ""Tools and resources needed"", ""Conclusion and next steps""]","[""investment"", ""how_to"", ""planning"", ""market"", ""business"", ""economics""]",6,Portfolio Managers & Financial Experts,"[""market analysis"", ""financial modeling"", ""portfolio management""]",55,9,2025-10-25 21:54:03,en,How do you assess and manage {keyword} risks?,0.81,1.0,0.46
41200674,machine learning,it,How do you integrate machine learning with existing systems?,implementation,Expert,"[""Overview of machine learning"", ""Step-by-step implementation"", ""Best practices and tips"", ""Common challenges and solutions"", ""Tools and resources needed"", ""Conclusion and next steps""]","[""development"", ""it"", ""implementation"", ""programming"", ""learning"", ""machine""]",6,Architects & Technical Directors,"[""cloud computing"", ""data science"", ""cybersecurity"", ""web development""]",60,9,2025-10-25 21:54:03,en,How do you integrate {keyword} with existing systems?,0.89,1.0,0.33
41200675,machine learning,it,How do you convince stakeholders to invest in machine learning?,optimization,Expert,"[""Overview of machine learning"", ""Step-by-step implementation"", ""Best practices and tips"", ""Common challenges and solutions"", ""Tools and resources needed"", ""Conclusion and next steps""]","[""it"", ""programming"", ""learning"", ""optimization"", ""machine"", ""technology""]",6,Architects & Technical Directors,"[""web development"", ""cloud computing"", ""data science"", ""cybersecurity""]",63,10,2025-10-25 21:54:03,en,How do you convince stakeholders to invest in {keyword}?,0.66,1.0,0.49
41200676,financial modeling,economics,What insurance options are available for financial modeling?,strategy,Beginner,"[""Introduction to financial modeling"", ""Key points and analysis"", ""Practical examples"", ""Expert insights"", ""Action items"", ""Conclusion""]","[""investment"", ""finance"", ""modeling"", ""financial"", ""strategy"", ""economics""]",4,Students & New Investors,"[""portfolio management"", ""market analysis"", ""investment planning""]",60,8,2025-10-25 21:54:03,en,What insurance options are available for {keyword}?,0.73,0.43391856668801404,0.37
41200677,portfolio management,economics,How do you benchmark portfolio management against alternatives?,planning,Expert,"[""Overview of portfolio management"", ""Step-by-step implementation"", ""Best practices and tips"", ""Common challenges and solutions"", ""Tools and resources needed"", ""Conclusion and next steps""]","[""planning"", ""finance"", ""portfolio"", ""management"", ""business"", ""economics""]",6,Portfolio Managers & Financial Experts,"[""market analysis"", ""financial modeling"", ""investment planning""]",63,8,2025-10-25 21:54:03,en,How do you benchmark {keyword} against alternatives?,0.75,1.0,0.46
41200678,market analysis,economics,What indicators predict market analysis market movements?,best_practice,Expert,"[""Introduction to market analysis"", ""Key points and analysis"", ""Practical examples"", ""Expert insights"", ""Action items"", ""Conclusion""]","[""analysis"", ""best_practice"", ""market"", ""business"", ""economics""]",4,Portfolio Managers & Financial Experts,"[""investment planning"", ""portfolio management"", ""financial modeling""]",57,7,2025-10-25 21:54:03,en,What indicators predict {keyword} market movements?,0.8,1.0,0.84
41200679,social media,marketing,What tools are essential for social media analytics?,best_practice,Advanced,"[""Introduction to social media"", ""Key points and analysis"", ""Practical examples"", ""Expert insights"", ""Action items"", ""Conclusion""]","[""media"", ""best_practice"", ""digital"", ""marketing"", ""social"", ""branding""]",4,Marketing Managers & Strategists,"[""brand management"", ""content marketing"", ""digital marketing""]",52,8,2025-10-25 21:54:03,en,What tools are essential for {keyword} analytics?,0.72,0.8689967818997999,0.31
41200680,cloud computing,it,How does cloud computing impact business operations?,planning,Advanced,"[""Introduction to cloud computing"", ""Key points and analysis"", ""Practical examples"", ""Expert insights"", ""Action items"", ""Conclusion""]","[""computing"", ""planning"", ""software"", ""it"", ""cloud"", ""technology""]",4,Senior Developers & Tech Leads,"[""data science"", ""cybersecurity"", ""web development"", ""machine learning""]",52,7,2025-10-25 21:54:03,en,How does {keyword} impact business operations?,0.86,0.9204941980514534,0.88
41200681,web development,it,What tools are essential for web development development?,optimization,Beginner,"[""Introduction to web development"", ""Key points and analysis"", ""Practical examples"", ""Expert insights"", ""Action items"", ""Conclusion""]","[""software"", ""development"", ""it"", ""programming"", ""optimization"", ""web""]",4,Students & Entry-level Developers,"[""cybersecurity"", ""cloud computing"", ""data science"", ""machine learning""]",57,8,2025-10-25 21:54:03,en,What tools are essential for {keyword} development?,0.7,0.3320787946321133,0.5
41200682,investment planning,economics,How do you identify opportunities in investment planning markets?,analysis,Beginner,"[""Overview of investment planning"", ""Step-by-step implementation"", ""Best practices and tips"", ""Common challenges and solutions"", ""Tools and resources needed"", ""Conclusion and next steps""]","[""investment"", ""planning"", ""analysis"", ""business"", ""economics""]",6,Students & New Investors,"[""financial modeling"", ""market analysis"", ""portfolio management""]",65,9,2025-10-25 21:54:03,en,How do you identify opportunities in {keyword} markets?,0.73,0.4980552749639572,0.45
41200683,brand management,marketing,What messaging works best in brand management campaigns?,how_to,Advanced,"[""Introduction to brand management"", ""Key points and analysis"", ""Practical examples"", ""Expert insights"", ""Action items"", ""Conclusion""]","[""how_to"", ""promotion"", ""marketing"", ""management"", ""branding"", ""brand""]",4,Marketing Managers & Strategists,"[""social media"", ""content marketing"", ""digital marketing""]",56,8,2025-10-25 21:54:03,en,What messaging works best in {keyword} campaigns?,0.8,0.9312528136316027,0.76
41200684,digital marketing,marketing,How do you innovate within digital marketing?,analysis,Advanced,"[""Overview of digital marketing"", ""Step-by-step implementation"", ""Best practices and tips"", ""Common challenges and solutions"", ""Tools and resources needed"", ""Conclusion and next steps""]","[""analysis"", ""promotion"", ""marketing"", ""digital"", ""branding""]",6,Marketing Managers & Strategists,"[""social media"", ""brand management"", ""content marketing""]",45,7,2025-10-25 21:54:03,en,How do you innovate within {keyword}?,0.88,0.9835579544967981,0.58
41200685,web development,it,What are the latest trends in web development technology?,optimization,Expert,"[""Introduction to web development"", ""Key concepts and definitions"", ""Main categories or types"", ""Examples and case studies"", ""Benefits and advantages"", ""Summary and recommendations""]","[""software"", ""development"", ""it"", ""optimization"", ""web""]",6,Architects & Technical Directors,"[""data science"", ""machine learning"", ""cloud computing"", ""cybersecurity""]",57,9,2025-10-25 21:54:03,en,What are the latest trends in {keyword} technology?,0.78,1.0,0.57
41200686,financial modeling,economics,What are the seasonal patterns in financial modeling?,planning,Beginner,"[""Introduction to financial modeling"", ""Key concepts and definitions"", ""Main categories or types"", ""Examples and case studies"", ""Benefits and advantages"", ""Summary and recommendations""]","[""investment"", ""planning"", ""finance"", ""modeling"", ""financial"", ""economics""]",6,Students & New Investors,"[""portfolio management"", ""market analysis"", ""investment planning""]",53,8,2025-10-25 21:54:03,en,What are the seasonal patterns in {keyword}?,0.9,0.42914857687364916,0.86
41200687,cloud computing,it,What certifications are valuable for cloud computing professionals?,planning,Expert,"[""Introduction to cloud computing"", ""Key points and analysis"", ""Practical examples"", ""Expert insights"", ""Action items"", ""Conclusion""]","[""computing"", ""planning"", ""development"", ""it"", ""software"", ""cloud""]",4,Architects & Technical Directors,"[""machine learning"", ""web development"", ""cybersecurity"", ""data science""]",67,8,2025-10-25 21:54:03,en,What certifications are valuable for {keyword} professionals?,0.63,1.0,0.64
41200688,portfolio management,economics,How do you benchmark portfolio management against alternatives?,best_practice,Expert,"[""Overview of portfolio management"", ""Step-by-step implementation"", ""Best practices and tips"", ""Common challenges and solutions"", ""Tools and resources needed"", ""Conclusion and next steps""]","[""investment"", ""portfolio"", ""best_practice"", ""management"", ""business"", ""economics""]",6,Portfolio Managers & Financial Experts,"[""market analysis"", ""investment planning"", ""financial modeling""]",63,8,2025-10-25 21:54:03,en,How do you benchmark {keyword} against alternatives?,0.75,1.0,0.82
41200689,data science,it,How do you stay updated with data science developments?,optimization,Intermediate,"[""Overview of data science"", ""Step-by-step implementation"", ""Best practices and tips"", ""Common challenges and solutions"", ""Tools and resources needed"", ""Conclusion and next steps""]","[""technology"", ""it"", ""programming"", ""science"", ""optimization"", ""data""]",6,Junior to Mid-level Developers,"[""machine learning"", ""cloud computing"", ""cybersecurity"", ""web development""]",55,9,2025-10-25 21:54:03,en,How do you stay updated with {keyword} developments?,0.72,0.7504864411447115,0.34
41200690,web development,it,What security considerations should be taken when using web development?,implementation,Advanced,"[""Introduction to web development"", ""Key points and analysis"", ""Practical examples"", ""Expert insights"", ""Action items"", ""Conclusion""]","[""development"", ""it"", ""implementation"", ""programming"", ""web""]",4,Senior Developers & Tech Leads,"[""machine learning"", ""data science"", ""cybersecurity"", ""cloud computing""]",72,10,2025-10-25 21:54:03,en,What security considerations should be taken when using {keyword}?,0.76,0.8735939725602622,0.42
41200691,market analysis,economics,What insurance options are available for market analysis?,strategy,Beginner,"[""Introduction to market analysis"", ""Key points and analysis"", ""Practical examples"", ""Expert insights"", ""Action items"", ""Conclusion""]","[""analysis"", ""finance"", ""business"", ""market"", ""strategy"", ""economics""]",4,Students & New Investors,"[""investment planning"", ""portfolio management"", ""financial modeling""]",57,8,2025-10-25 21:54:03,en,What insurance options are available for {keyword}?,0.61,0.4254816127535256,0.63
41200692,digital marketing,marketing,How do you automate digital marketing processes?,planning,Intermediate,"[""Overview of digital marketing"", ""Step-by-step implementation"", ""Best practices and tips"", ""Common challenges and solutions"", ""Tools and resources needed"", ""Conclusion and next steps""]","[""planning"", ""marketing"", ""digital"", ""advertising"", ""branding""]",6,Marketing Coordinators & Specialists,"[""brand management"", ""content marketing"", ""social media""]",48,7,2025-10-25 21:54:03,en,How do you automate {keyword} processes?,0.65,0.7757309656411988,0.53
41200693,social media,marketing,What A/B tests should you run for social media?,troubleshooting,Intermediate,"[""Introduction to social media"", ""Key points and analysis"", ""Practical examples"", ""Expert insights"", ""Action items"", ""Conclusion""]","[""media"", ""promotion"", ""troubleshooting"", ""marketing"", ""social"", ""advertising""]",4,Marketing Coordinators & Specialists,"[""brand management"", ""content marketing"", ""digital marketing""]",47,9,2025-10-25 21:54:03,en,What A/B tests should you run for {keyword}?,0.94,0.6471813844515701,0.78
41200694,brand management,marketing,What A/B tests should you run for brand management?,planning,Expert,"[""Introduction to brand management"", ""Key points and analysis"", ""Practical examples"", ""Expert insights"", ""Action items"", ""Conclusion""]","[""planning"", ""promotion"", ""marketing"", ""management"", ""advertising"", ""brand""]",4,Marketing Directors & CMOs,"[""social media"", ""digital marketing"", ""content marketing""]",51,9,2025-10-25 21:54:03,en,What A/B tests should you run for {keyword}?,0.83,1.0,0.84
