record_id,keyword,category,question,question_type,difficulty_level,answer_outline,tags,estimated_read_time,target_audience,related_topics,question_length,word_count,created_date,language,source_template,engagement_score,complexity_score,popularity_score
42300001,cloud computing,it,What is the recommended architecture for cloud computing systems?,evaluation,Intermediate,"[""Introduction to cloud computing"", ""Key points and analysis"", ""Practical examples"", ""Expert insights"", ""Action items"", ""Conclusion""]","[""computing"", ""development"", ""it"", ""programming"", ""evaluation"", ""cloud""]",4,Junior to Mid-level Developers,"[""data science"", ""web development"", ""cybersecurity"", ""machine learning""]",65,9,2025-10-25 21:55:30,en,What is the recommended architecture for {keyword} systems?,0.69,0.7645293344588712,0.62
42300002,brand management,marketing,How do you automate brand management processes?,implementation,Advanced,"[""Overview of brand management"", ""Step-by-step implementation"", ""Best practices and tips"", ""Common challenges and solutions"", ""Tools and resources needed"", ""Conclusion and next steps""]","[""implementation"", ""promotion"", ""marketing"", ""management"", ""branding"", ""brand""]",6,Marketing Managers & Strategists,"[""social media"", ""content marketing"", ""digital marketing""]",47,7,2025-10-25 21:55:30,en,How do you automate {keyword} processes?,0.61,0.9194777586034915,0.49
42300003,investment planning,economics,How do you assess and manage investment planning risks?,optimization,Intermediate,"[""Overview of investment planning"", ""Step-by-step implementation"", ""Best practices and tips"", ""Common challenges and solutions"", ""Tools and resources needed"", ""Conclusion and next steps""]","[""investment"", ""planning"", ""finance"", ""market"", ""optimization"", ""economics""]",6,Individual Investors & Analysts,"[""financial modeling"", ""portfolio management"", ""market analysis""]",55,9,2025-10-25 21:55:30,en,How do you assess and manage {keyword} risks?,0.7,0.7785840666460843,0.84
42300004,cybersecurity,it,How do you convince stakeholders to invest in cybersecurity?,strategy,Expert,"[""Overview of cybersecurity"", ""Step-by-step implementation"", ""Best practices and tips"", ""Common challenges and solutions"", ""Tools and resources needed"", ""Conclusion and next steps""]","[""software"", ""it"", ""strategy"", ""cybersecurity"", ""technology""]",5,Architects & Technical Directors,"[""web development"", ""cloud computing"", ""data science"", ""machine learning""]",60,9,2025-10-25 21:55:30,en,How do you convince stakeholders to invest in {keyword}?,0.63,1.0,0.39
42300005,investment planning,economics,How do you diversify your portfolio using investment planning?,best_practice,Advanced,"[""Overview of investment planning"", ""Step-by-step implementation"", ""Best practices and tips"", ""Common challenges and solutions"", ""Tools and resources needed"", ""Conclusion and next steps""]","[""investment"", ""planning"", ""finance"", ""best_practice"", ""market"", ""economics""]",6,Professional Investors & Advisors,"[""financial modeling"", ""market analysis"", ""portfolio management""]",62,9,2025-10-25 21:55:30,en,How do you diversify your portfolio using {keyword}?,0.84,0.9369542349570157,0.38
42300006,social media,marketing,What KPIs are most important for social media?,implementation,Expert,"[""Introduction to social media"", ""Key points and analysis"", ""Practical examples"", ""Expert insights"", ""Action items"", ""Conclusion""]","[""media"", ""implementation"", ""marketing"", ""digital"", ""social"", ""branding""]",4,Marketing Directors & CMOs,"[""brand management"", ""content marketing"", ""digital marketing""]",46,8,2025-10-25 21:55:30,en,What KPIs are most important for {keyword}?,0.68,1.0,0.78
42300007,web development,it,How do you stay updated with web development developments?,how_to,Expert,"[""Overview of web development"", ""Step-by-step implementation"", ""Best practices and tips"", ""Common challenges and solutions"", ""Tools and resources needed"", ""Conclusion and next steps""]","[""how_to"", ""software"", ""development"", ""it"", ""programming"", ""web""]",6,Architects & Technical Directors,"[""cybersecurity"", ""data science"", ""machine learning"", ""cloud computing""]",58,9,2025-10-25 21:55:30,en,How do you stay updated with {keyword} developments?,0.79,1.0,0.67
42300008,cloud computing,it,Which frameworks support cloud computing implementation?,troubleshooting,Intermediate,"[""Introduction to cloud computing"", ""Key points and analysis"", ""Practical examples"", ""Expert insights"", ""Action items"", ""Conclusion""]","[""computing"", ""software"", ""it"", ""programming"", ""troubleshooting"", ""cloud""]",4,Junior to Mid-level Developers,"[""web development"", ""machine learning"", ""data science"", ""cybersecurity""]",56,6,2025-10-25 21:55:30,en,Which frameworks support {keyword} implementation?,0.72,0.6954182172734807,0.66
42300009,investment planning,economics,How do you create a long-term plan for investment planning?,analysis,Expert,"[""Overview of investment planning"", ""Step-by-step implementation"", ""Best practices and tips"", ""Common challenges and solutions"", ""Tools and resources needed"", ""Conclusion and next steps""]","[""investment"", ""planning"", ""analysis"", ""market"", ""business"", ""economics""]",6,Portfolio Managers & Financial Experts,"[""portfolio management"", ""market analysis"", ""financial modeling""]",59,10,2025-10-25 21:55:30,en,How do you create a long-term plan for {keyword}?,0.79,1.0,0.38
42300010,portfolio management,economics,What are the seasonal patterns in portfolio management?,optimization,Expert,"[""Introduction to portfolio management"", ""Key concepts and definitions"", ""Main categories or types"", ""Examples and case studies"", ""Benefits and advantages"", ""Summary and recommendations""]","[""investment"", ""finance"", ""portfolio"", ""management"", ""optimization"", ""economics""]",6,Portfolio Managers & Financial Experts,"[""market analysis"", ""investment planning"", ""financial modeling""]",55,8,2025-10-25 21:55:30,en,What are the seasonal patterns in {keyword}?,0.79,1.0,0.45
42300011,market analysis,economics,How do you measure market analysis performance?,how_to,Beginner,"[""Overview of market analysis"", ""Step-by-step implementation"", ""Best practices and tips"", ""Common challenges and solutions"", ""Tools and resources needed"", ""Conclusion and next steps""]","[""how_to"", ""analysis"", ""market"", ""business"", ""economics""]",6,Students & New Investors,"[""portfolio management"", ""investment planning"", ""financial modeling""]",47,7,2025-10-25 21:55:30,en,How do you measure {keyword} performance?,0.77,0.32221774129464986,0.88
42300012,content marketing,marketing,What content types work best for content marketing?,optimization,Intermediate,"[""Introduction to content marketing"", ""Key points and analysis"", ""Practical examples"", ""Expert insights"", ""Action items"", ""Conclusion""]","[""content"", ""marketing"", ""advertising"", ""branding"", ""optimization""]",4,Marketing Coordinators & Specialists,"[""social media"", ""digital marketing"", ""brand management""]",51,8,2025-10-25 21:55:30,en,What content types work best for {keyword}?,0.8,0.7110323464604377,0.56
42300013,cybersecurity,it,What ROI can be expected from cybersecurity implementation?,strategy,Intermediate,"[""Introduction to cybersecurity"", ""Key points and analysis"", ""Practical examples"", ""Expert insights"", ""Action items"", ""Conclusion""]","[""development"", ""it"", ""programming"", ""strategy"", ""cybersecurity""]",4,Junior to Mid-level Developers,"[""cloud computing"", ""web development"", ""data science"", ""machine learning""]",59,8,2025-10-25 21:55:30,en,What ROI can be expected from {keyword} implementation?,0.84,0.6749013673875605,0.75
42300014,digital marketing,marketing,What content types work best for digital marketing?,how_to,Beginner,"[""Introduction to digital marketing"", ""Key points and analysis"", ""Practical examples"", ""Expert insights"", ""Action items"", ""Conclusion""]","[""how_to"", ""promotion"", ""marketing"", ""digital"", ""advertising""]",4,Marketing Students & Interns,"[""brand management"", ""content marketing"", ""social media""]",51,8,2025-10-25 21:55:30,en,What content types work best for {keyword}?,0.94,0.4254021444122562,0.81
42300015,investment planning,economics,How do you benchmark investment planning against alternatives?,strategy,Beginner,"[""Overview of investment planning"", ""Step-by-step implementation"", ""Best practices and tips"", ""Common challenges and solutions"", ""Tools and resources needed"", ""Conclusion and next steps""]","[""investment"", ""planning"", ""finance"", ""business"", ""strategy"", ""economics""]",6,Students & New Investors,"[""portfolio management"", ""market analysis"", ""financial modeling""]",62,8,2025-10-25 21:55:30,en,How do you benchmark {keyword} against alternatives?,0.7,0.49304936853457565,0.78
42300016,investment planning,economics,What insurance options are available for investment planning?,evaluation,Expert,"[""Introduction to investment planning"", ""Key points and analysis"", ""Practical examples"", ""Expert insights"", ""Action items"", ""Conclusion""]","[""investment"", ""planning"", ""finance"", ""evaluation"", ""market"", ""economics""]",4,Portfolio Managers & Financial Experts,"[""market analysis"", ""financial modeling"", ""portfolio management""]",61,8,2025-10-25 21:55:30,en,What insurance options are available for {keyword}?,0.83,1.0,0.64
42300017,content marketing,marketing,What tools are essential for content marketing analytics?,planning,Advanced,"[""Introduction to content marketing"", ""Key points and analysis"", ""Practical examples"", ""Expert insights"", ""Action items"", ""Conclusion""]","[""planning"", ""content"", ""promotion"", ""marketing"", ""digital""]",4,Marketing Managers & Strategists,"[""social media"", ""digital marketing"", ""brand management""]",57,8,2025-10-25 21:55:30,en,What tools are essential for {keyword} analytics?,0.74,0.8295635008169839,0.86
42300018,social media,marketing,What KPIs are most important for social media?,how_to,Intermediate,"[""Introduction to social media"", ""Key points and analysis"", ""Practical examples"", ""Expert insights"", ""Action items"", ""Conclusion""]","[""how_to"", ""media"", ""marketing"", ""social"", ""advertising"", ""branding""]",4,Marketing Coordinators & Specialists,"[""content marketing"", ""digital marketing"", ""brand management""]",46,8,2025-10-25 21:55:30,en,What KPIs are most important for {keyword}?,0.73,0.7698990415880967,0.45
42300019,digital marketing,marketing,What tools are essential for digital marketing analytics?,planning,Advanced,"[""Introduction to digital marketing"", ""Key points and analysis"", ""Practical examples"", ""Expert insights"", ""Action items"", ""Conclusion""]","[""marketing"", ""promotion"", ""planning"", ""digital""]",4,Marketing Managers & Strategists,"[""content marketing"", ""brand management"", ""social media""]",57,8,2025-10-25 21:55:30,en,What tools are essential for {keyword} analytics?,0.76,0.908128136670787,0.38
42300020,data science,it,How do you get started with data science as a beginner?,implementation,Advanced,"[""Overview of data science"", ""Step-by-step implementation"", ""Best practices and tips"", ""Common challenges and solutions"", ""Tools and resources needed"", ""Conclusion and next steps""]","[""software"", ""it"", ""implementation"", ""programming"", ""science"", ""data""]",6,Senior Developers & Tech Leads,"[""machine learning"", ""cybersecurity"", ""cloud computing"", ""web development""]",55,11,2025-10-25 21:55:30,en,How do you get started with {keyword} as a beginner?,0.8,0.8516169990791734,0.79
42300021,financial modeling,economics,How do you report on financial modeling performance to stakeholders?,analysis,Expert,"[""Overview of financial modeling"", ""Step-by-step implementation"", ""Best practices and tips"", ""Common challenges and solutions"", ""Tools and resources needed"", ""Conclusion and next steps""]","[""analysis"", ""modeling"", ""financial"", ""market"", ""business"", ""economics""]",6,Portfolio Managers & Financial Experts,"[""portfolio management"", ""investment planning"", ""market analysis""]",68,10,2025-10-25 21:55:30,en,How do you report on {keyword} performance to stakeholders?,0.86,1.0,0.75
42300022,brand management,marketing,What does the future hold for brand management?,analysis,Expert,"[""Introduction to brand management"", ""Key points and analysis"", ""Practical examples"", ""Expert insights"", ""Action items"", ""Conclusion""]","[""analysis"", ""marketing"", ""management"", ""advertising"", ""digital"", ""brand""]",4,Marketing Directors & CMOs,"[""social media"", ""digital marketing"", ""content marketing""]",47,8,2025-10-25 21:55:30,en,What does the future hold for {keyword}?,0.73,1.0,0.8
42300023,market analysis,economics,What timeline is realistic for market analysis returns?,comparison,Expert,"[""Introduction to market analysis"", ""Key points and analysis"", ""Practical examples"", ""Expert insights"", ""Action items"", ""Conclusion""]","[""finance"", ""analysis"", ""comparison"", ""market"", ""economics""]",4,Portfolio Managers & Financial Experts,"[""investment planning"", ""portfolio management"", ""financial modeling""]",55,8,2025-10-25 21:55:30,en,What timeline is realistic for {keyword} returns?,0.88,1.0,0.6
42300024,cybersecurity,it,How does cybersecurity impact business operations?,implementation,Advanced,"[""Introduction to cybersecurity"", ""Key points and analysis"", ""Practical examples"", ""Expert insights"", ""Action items"", ""Conclusion""]","[""development"", ""it"", ""implementation"", ""cybersecurity"", ""technology""]",4,Senior Developers & Tech Leads,"[""cloud computing"", ""data science"", ""machine learning"", ""web development""]",50,6,2025-10-25 21:55:30,en,How does {keyword} impact business operations?,0.68,0.9067311551548077,0.45
42300025,market analysis,economics,How do you report on market analysis performance to stakeholders?,troubleshooting,Advanced,"[""Overview of market analysis"", ""Step-by-step implementation"", ""Best practices and tips"", ""Common challenges and solutions"", ""Tools and resources needed"", ""Conclusion and next steps""]","[""investment"", ""analysis"", ""finance"", ""troubleshooting"", ""market"", ""economics""]",6,Professional Investors & Advisors,"[""financial modeling"", ""investment planning"", ""portfolio management""]",65,10,2025-10-25 21:55:30,en,How do you report on {keyword} performance to stakeholders?,0.93,0.9231606443350424,0.7
42300026,portfolio management,economics,How do you adjust your portfolio management strategy during volatility?,best_practice,Expert,"[""Overview of portfolio management"", ""Step-by-step implementation"", ""Best practices and tips"", ""Common challenges and solutions"", ""Tools and resources needed"", ""Conclusion and next steps""]","[""investment"", ""portfolio"", ""best_practice"", ""management"", ""business"", ""economics""]",6,Portfolio Managers & Financial Experts,"[""market analysis"", ""investment planning"", ""financial modeling""]",71,10,2025-10-25 21:55:30,en,How do you adjust your {keyword} strategy during volatility?,0.64,1.0,0.65
42300027,data science,it,What are the best practices for data science development?,comparison,Expert,"[""Introduction to data science"", ""Key concepts and definitions"", ""Main categories or types"", ""Examples and case studies"", ""Benefits and advantages"", ""Summary and recommendations""]","[""software"", ""development"", ""it"", ""comparison"", ""science"", ""data""]",6,Architects & Technical Directors,"[""cybersecurity"", ""machine learning"", ""web development"", ""cloud computing""]",57,9,2025-10-25 21:55:30,en,What are the best practices for {keyword} development?,0.92,1.0,0.34
42300028,web development,it,What ROI can be expected from web development implementation?,troubleshooting,Intermediate,"[""Introduction to web development"", ""Key points and analysis"", ""Practical examples"", ""Expert insights"", ""Action items"", ""Conclusion""]","[""software"", ""development"", ""it"", ""troubleshooting"", ""web""]",4,Junior to Mid-level Developers,"[""cloud computing"", ""machine learning"", ""data science"", ""cybersecurity""]",61,9,2025-10-25 21:55:30,en,What ROI can be expected from {keyword} implementation?,0.8,0.6693687018296434,0.57
42300029,financial modeling,economics,What are the risks associated with financial modeling?,strategy,Advanced,"[""Introduction to financial modeling"", ""Key concepts and definitions"", ""Main categories or types"", ""Examples and case studies"", ""Benefits and advantages"", ""Summary and recommendations""]","[""investment"", ""modeling"", ""financial"", ""business"", ""strategy"", ""economics""]",6,Professional Investors & Advisors,"[""portfolio management"", ""investment planning"", ""market analysis""]",54,8,2025-10-25 21:55:30,en,What are the risks associated with {keyword}?,0.7,0.8069543621754461,0.71
42300030,portfolio management,economics,How do you identify opportunities in portfolio management markets?,how_to,Expert,"[""Overview of portfolio management"", ""Step-by-step implementation"", ""Best practices and tips"", ""Common challenges and solutions"", ""Tools and resources needed"", ""Conclusion and next steps""]","[""how_to"", ""finance"", ""portfolio"", ""management"", ""business"", ""economics""]",6,Portfolio Managers & Financial Experts,"[""financial modeling"", ""market analysis"", ""investment planning""]",66,9,2025-10-25 21:55:30,en,How do you identify opportunities in {keyword} markets?,0.67,1.0,0.61
42300031,machine learning,it,What tools are essential for machine learning development?,strategy,Beginner,"[""Introduction to machine learning"", ""Key points and analysis"", ""Practical examples"", ""Expert insights"", ""Action items"", ""Conclusion""]","[""development"", ""it"", ""learning"", ""strategy"", ""machine"", ""technology""]",4,Students & Entry-level Developers,"[""cybersecurity"", ""data science"", ""web development"", ""cloud computing""]",58,8,2025-10-25 21:55:30,en,What tools are essential for {keyword} development?,0.86,0.4110710101482313,0.3
42300032,market analysis,economics,How does global economics impact market analysis?,strategy,Expert,"[""Introduction to market analysis"", ""Key points and analysis"", ""Practical examples"", ""Expert insights"", ""Action items"", ""Conclusion""]","[""finance"", ""analysis"", ""business"", ""market"", ""strategy"", ""economics""]",4,Portfolio Managers & Financial Experts,"[""investment planning"", ""financial modeling"", ""portfolio management""]",49,7,2025-10-25 21:55:30,en,How does global economics impact {keyword}?,0.69,1.0,0.83
42300033,cybersecurity,it,What is the recommended architecture for cybersecurity systems?,optimization,Beginner,"[""Introduction to cybersecurity"", ""Key points and analysis"", ""Practical examples"", ""Expert insights"", ""Action items"", ""Conclusion""]","[""software"", ""it"", ""optimization"", ""cybersecurity"", ""technology""]",4,Students & Entry-level Developers,"[""data science"", ""machine learning"", ""web development"", ""cloud computing""]",63,8,2025-10-25 21:55:30,en,What is the recommended architecture for {keyword} systems?,0.66,0.4047135134201702,0.82
42300034,social media,marketing,How do you improve social media conversion rates?,optimization,Expert,"[""Overview of social media"", ""Step-by-step implementation"", ""Best practices and tips"", ""Common challenges and solutions"", ""Tools and resources needed"", ""Conclusion and next steps""]","[""media"", ""promotion"", ""marketing"", ""social"", ""branding"", ""optimization""]",6,Marketing Directors & CMOs,"[""digital marketing"", ""content marketing"", ""brand management""]",49,8,2025-10-25 21:55:30,en,How do you improve {keyword} conversion rates?,0.62,1.0,0.62
42300035,financial modeling,economics,What are the regulatory considerations for financial modeling?,strategy,Beginner,"[""Introduction to financial modeling"", ""Key concepts and definitions"", ""Main categories or types"", ""Examples and case studies"", ""Benefits and advantages"", ""Summary and recommendations""]","[""modeling"", ""financial"", ""business"", ""market"", ""strategy"", ""economics""]",6,Students & New Investors,"[""portfolio management"", ""market analysis"", ""investment planning""]",62,8,2025-10-25 21:55:30,en,What are the regulatory considerations for {keyword}?,0.79,0.31968746210454446,0.87
42300036,cloud computing,it,Which frameworks support cloud computing implementation?,optimization,Beginner,"[""Introduction to cloud computing"", ""Key points and analysis"", ""Practical examples"", ""Expert insights"", ""Action items"", ""Conclusion""]","[""computing"", ""software"", ""cloud"", ""it"", ""optimization"", ""technology""]",4,Students & Entry-level Developers,"[""data science"", ""machine learning"", ""cybersecurity"", ""web development""]",56,6,2025-10-25 21:55:30,en,Which frameworks support {keyword} implementation?,0.78,0.30066196999386396,0.79
42300037,brand management,marketing,How do you reach new customers through brand management?,evaluation,Advanced,"[""Overview of brand management"", ""Step-by-step implementation"", ""Best practices and tips"", ""Common challenges and solutions"", ""Tools and resources needed"", ""Conclusion and next steps""]","[""promotion"", ""marketing"", ""management"", ""advertising"", ""evaluation"", ""brand""]",6,Marketing Managers & Strategists,"[""digital marketing"", ""social media"", ""content marketing""]",56,9,2025-10-25 21:55:30,en,How do you reach new customers through {keyword}?,0.86,0.9317965766572838,0.72
42300038,data science,it,How do you design a scalable data science solution?,evaluation,Advanced,"[""Overview of data science"", ""Step-by-step implementation"", ""Best practices and tips"", ""Common challenges and solutions"", ""Tools and resources needed"", ""Conclusion and next steps""]","[""development"", ""it"", ""programming"", ""science"", ""evaluation"", ""data""]",6,Senior Developers & Tech Leads,"[""cloud computing"", ""machine learning"", ""web development"", ""cybersecurity""]",51,9,2025-10-25 21:55:30,en,How do you design a scalable {keyword} solution?,0.82,0.9935158860180773,0.63
42300039,content marketing,marketing,What does the future hold for content marketing?,comparison,Advanced,"[""Introduction to content marketing"", ""Key points and analysis"", ""Practical examples"", ""Expert insights"", ""Action items"", ""Conclusion""]","[""content"", ""comparison"", ""marketing"", ""digital"", ""branding""]",4,Marketing Managers & Strategists,"[""social media"", ""digital marketing"", ""brand management""]",48,8,2025-10-25 21:55:30,en,What does the future hold for {keyword}?,0.65,0.8929125589444779,0.5
42300040,financial modeling,economics,What are the seasonal patterns in financial modeling?,best_practice,Advanced,"[""Introduction to financial modeling"", ""Key concepts and definitions"", ""Main categories or types"", ""Examples and case studies"", ""Benefits and advantages"", ""Summary and recommendations""]","[""finance"", ""best_practice"", ""modeling"", ""financial"", ""market"", ""economics""]",6,Professional Investors & Advisors,"[""market analysis"", ""portfolio management"", ""investment planning""]",53,8,2025-10-25 21:55:30,en,What are the seasonal patterns in {keyword}?,0.78,0.9753289192478789,0.53
42300041,market analysis,economics,How do economic conditions affect market analysis performance?,comparison,Intermediate,"[""Introduction to market analysis"", ""Key points and analysis"", ""Practical examples"", ""Expert insights"", ""Action items"", ""Conclusion""]","[""investment"", ""analysis"", ""finance"", ""comparison"", ""market"", ""economics""]",4,Individual Investors & Analysts,"[""portfolio management"", ""financial modeling"", ""investment planning""]",62,8,2025-10-25 21:55:30,en,How do economic conditions affect {keyword} performance?,0.91,0.6727937254113912,0.44
42300042,investment planning,economics,How do you assess and manage investment planning risks?,implementation,Advanced,"[""Overview of investment planning"", ""Step-by-step implementation"", ""Best practices and tips"", ""Common challenges and solutions"", ""Tools and resources needed"", ""Conclusion and next steps""]","[""investment"", ""planning"", ""finance"", ""implementation"", ""economics""]",6,Professional Investors & Advisors,"[""financial modeling"", ""market analysis"", ""portfolio management""]",55,9,2025-10-25 21:55:30,en,How do you assess and manage {keyword} risks?,0.81,0.8238664927997075,0.69
42300043,cybersecurity,it,How do you stay updated with cybersecurity developments?,best_practice,Expert,"[""Overview of cybersecurity"", ""Step-by-step implementation"", ""Best practices and tips"", ""Common challenges and solutions"", ""Tools and resources needed"", ""Conclusion and next steps""]","[""development"", ""it"", ""best_practice"", ""cybersecurity"", ""technology""]",5,Architects & Technical Directors,"[""cloud computing"", ""machine learning"", ""data science"", ""web development""]",56,8,2025-10-25 21:55:30,en,How do you stay updated with {keyword} developments?,0.92,1.0,0.74
42300044,social media,marketing,How do you identify the right audience for social media?,strategy,Beginner,"[""Overview of social media"", ""Step-by-step implementation"", ""Best practices and tips"", ""Common challenges and solutions"", ""Tools and resources needed"", ""Conclusion and next steps""]","[""media"", ""promotion"", ""marketing"", ""digital"", ""social"", ""strategy""]",6,Marketing Students & Interns,"[""brand management"", ""digital marketing"", ""content marketing""]",56,10,2025-10-25 21:55:30,en,How do you identify the right audience for {keyword}?,0.8,0.3809191751509693,0.72
