record_id,keyword,category,question,question_type,difficulty_level,answer_outline,tags,estimated_read_time,target_audience,related_topics,question_length,word_count,created_date,language,source_template,engagement_score,complexity_score,popularity_score
48500654,social media,marketing,What A/B tests should you run for social media?,comparison,Intermediate,"[""Introduction to social media"", ""Key points and analysis"", ""Practical examples"", ""Expert insights"", ""Action items"", ""Conclusion""]","[""media"", ""comparison"", ""digital"", ""marketing"", ""social"", ""advertising""]",4,Marketing Coordinators & Specialists,"[""digital marketing"", ""brand management"", ""content marketing""]",47,9,2025-10-25 22:04:17,en,What A/B tests should you run for {keyword}?,0.65,0.7585256202857142,0.53
48500655,content marketing,marketing,What demographics respond best to content marketing?,analysis,Beginner,"[""Introduction to content marketing"", ""Key points and analysis"", ""Practical examples"", ""Expert insights"", ""Action items"", ""Conclusion""]","[""content"", ""analysis"", ""promotion"", ""marketing"", ""advertising""]",4,Marketing Students & Interns,"[""social media"", ""brand management"", ""digital marketing""]",52,7,2025-10-25 22:04:17,en,What demographics respond best to {keyword}?,0.94,0.39475260954355335,0.87
48500656,portfolio management,economics,What insurance options are available for portfolio management?,comparison,Beginner,"[""Introduction to portfolio management"", ""Key points and analysis"", ""Practical examples"", ""Expert insights"", ""Action items"", ""Conclusion""]","[""investment"", ""finance"", ""portfolio"", ""comparison"", ""management"", ""economics""]",4,Students & New Investors,"[""investment planning"", ""market analysis"", ""financial modeling""]",62,8,2025-10-25 22:04:17,en,What insurance options are available for {keyword}?,0.76,0.4922832364282297,0.4
48500657,brand management,marketing,What messaging works best in brand management campaigns?,evaluation,Advanced,"[""Introduction to brand management"", ""Key points and analysis"", ""Practical examples"", ""Expert insights"", ""Action items"", ""Conclusion""]","[""marketing"", ""management"", ""advertising"", ""branding"", ""evaluation"", ""brand""]",4,Marketing Managers & Strategists,"[""digital marketing"", ""social media"", ""content marketing""]",56,8,2025-10-25 22:04:17,en,What messaging works best in {keyword} campaigns?,0.94,0.8202087529235564,0.52
48500658,data science,it,What certifications are valuable for data science professionals?,comparison,Intermediate,"[""Introduction to data science"", ""Key points and analysis"", ""Practical examples"", ""Expert insights"", ""Action items"", ""Conclusion""]","[""technology"", ""software"", ""it"", ""comparison"", ""science"", ""data""]",4,Junior to Mid-level Developers,"[""cybersecurity"", ""machine learning"", ""cloud computing"", ""web development""]",64,8,2025-10-25 22:04:17,en,What certifications are valuable for {keyword} professionals?,0.7,0.6240568248574835,0.76
48500659,content marketing,marketing,How do you optimize content marketing for mobile users?,optimization,Intermediate,"[""Overview of content marketing"", ""Step-by-step implementation"", ""Best practices and tips"", ""Common challenges and solutions"", ""Tools and resources needed"", ""Conclusion and next steps""]","[""content"", ""promotion"", ""marketing"", ""advertising"", ""optimization""]",6,Marketing Coordinators & Specialists,"[""digital marketing"", ""brand management"", ""social media""]",55,9,2025-10-25 22:04:17,en,How do you optimize {keyword} for mobile users?,0.88,0.6833056864878685,0.81
48500660,content marketing,marketing,How do you reach new customers through content marketing?,strategy,Expert,"[""Overview of content marketing"", ""Step-by-step implementation"", ""Best practices and tips"", ""Common challenges and solutions"", ""Tools and resources needed"", ""Conclusion and next steps""]","[""content"", ""promotion"", ""marketing"", ""digital"", ""strategy""]",6,Marketing Directors & CMOs,"[""digital marketing"", ""brand management"", ""social media""]",57,9,2025-10-25 22:04:17,en,How do you reach new customers through {keyword}?,0.68,1.0,0.42
48500661,portfolio management,economics,How does global economics impact portfolio management?,implementation,Expert,"[""Introduction to portfolio management"", ""Key points and analysis"", ""Practical examples"", ""Expert insights"", ""Action items"", ""Conclusion""]","[""investment"", ""implementation"", ""portfolio"", ""management"", ""business"", ""economics""]",4,Portfolio Managers & Financial Experts,"[""financial modeling"", ""market analysis"", ""investment planning""]",54,7,2025-10-25 22:04:17,en,How does global economics impact {keyword}?,0.65,1.0,0.67
48500662,investment planning,economics,How do you report on investment planning performance to stakeholders?,analysis,Beginner,"[""Overview of investment planning"", ""Step-by-step implementation"", ""Best practices and tips"", ""Common challenges and solutions"", ""Tools and resources needed"", ""Conclusion and next steps""]","[""investment"", ""planning"", ""finance"", ""analysis"", ""market"", ""economics""]",6,Students & New Investors,"[""financial modeling"", ""portfolio management"", ""market analysis""]",69,10,2025-10-25 22:04:17,en,How do you report on {keyword} performance to stakeholders?,0.77,0.48760040958600254,0.34
48500663,market analysis,economics,How does global economics impact market analysis?,analysis,Intermediate,"[""Introduction to market analysis"", ""Key points and analysis"", ""Practical examples"", ""Expert insights"", ""Action items"", ""Conclusion""]","[""investment"", ""finance"", ""analysis"", ""market"", ""economics""]",4,Individual Investors & Analysts,"[""investment planning"", ""financial modeling"", ""portfolio management""]",49,7,2025-10-25 22:04:17,en,How does global economics impact {keyword}?,0.91,0.7222910337990791,0.42
48500664,portfolio management,economics,How do you identify opportunities in portfolio management markets?,planning,Intermediate,"[""Overview of portfolio management"", ""Step-by-step implementation"", ""Best practices and tips"", ""Common challenges and solutions"", ""Tools and resources needed"", ""Conclusion and next steps""]","[""planning"", ""finance"", ""portfolio"", ""management"", ""market"", ""economics""]",6,Individual Investors & Analysts,"[""market analysis"", ""financial modeling"", ""investment planning""]",66,9,2025-10-25 22:04:17,en,How do you identify opportunities in {keyword} markets?,0.85,0.6843698701968501,0.5
48500665,market analysis,economics,How do you identify opportunities in market analysis markets?,best_practice,Intermediate,"[""Overview of market analysis"", ""Step-by-step implementation"", ""Best practices and tips"", ""Common challenges and solutions"", ""Tools and resources needed"", ""Conclusion and next steps""]","[""investment"", ""analysis"", ""best_practice"", ""market"", ""business"", ""economics""]",6,Individual Investors & Analysts,"[""investment planning"", ""portfolio management"", ""financial modeling""]",61,9,2025-10-25 22:04:17,en,How do you identify opportunities in {keyword} markets?,0.82,0.62341765140541,0.49
48500666,machine learning,it,How do you optimize machine learning for different platforms?,comparison,Expert,"[""Overview of machine learning"", ""Step-by-step implementation"", ""Best practices and tips"", ""Common challenges and solutions"", ""Tools and resources needed"", ""Conclusion and next steps""]","[""software"", ""it"", ""comparison"", ""programming"", ""learning"", ""machine""]",6,Architects & Technical Directors,"[""web development"", ""cybersecurity"", ""cloud computing"", ""data science""]",61,9,2025-10-25 22:04:17,en,How do you optimize {keyword} for different platforms?,0.71,1.0,0.72
48500667,financial modeling,economics,How do you assess and manage financial modeling risks?,planning,Advanced,"[""Overview of financial modeling"", ""Step-by-step implementation"", ""Best practices and tips"", ""Common challenges and solutions"", ""Tools and resources needed"", ""Conclusion and next steps""]","[""investment"", ""planning"", ""finance"", ""modeling"", ""financial"", ""economics""]",6,Professional Investors & Advisors,"[""investment planning"", ""portfolio management"", ""market analysis""]",54,9,2025-10-25 22:04:17,en,How do you assess and manage {keyword} risks?,0.94,0.8403427557371783,0.81
48500668,cybersecurity,it,How do you optimize cybersecurity for different platforms?,how_to,Beginner,"[""Overview of cybersecurity"", ""Step-by-step implementation"", ""Best practices and tips"", ""Common challenges and solutions"", ""Tools and resources needed"", ""Conclusion and next steps""]","[""how_to"", ""software"", ""development"", ""it"", ""cybersecurity""]",5,Students & Entry-level Developers,"[""cloud computing"", ""machine learning"", ""data science"", ""web development""]",58,8,2025-10-25 22:04:17,en,How do you optimize {keyword} for different platforms?,0.9,0.4907855603991965,0.55
48500669,financial modeling,economics,How does global economics impact financial modeling?,evaluation,Expert,"[""Introduction to financial modeling"", ""Key points and analysis"", ""Practical examples"", ""Expert insights"", ""Action items"", ""Conclusion""]","[""modeling"", ""financial"", ""evaluation"", ""market"", ""business"", ""economics""]",4,Portfolio Managers & Financial Experts,"[""market analysis"", ""portfolio management"", ""investment planning""]",52,7,2025-10-25 22:04:17,en,How does global economics impact {keyword}?,0.75,1.0,0.79
48500670,brand management,marketing,How do you develop an effective brand management strategy?,evaluation,Beginner,"[""Overview of brand management"", ""Step-by-step implementation"", ""Best practices and tips"", ""Common challenges and solutions"", ""Tools and resources needed"", ""Conclusion and next steps""]","[""promotion"", ""marketing"", ""digital"", ""management"", ""evaluation"", ""brand""]",6,Marketing Students & Interns,"[""digital marketing"", ""social media"", ""content marketing""]",58,9,2025-10-25 22:04:17,en,How do you develop an effective {keyword} strategy?,0.65,0.4029015244677042,0.78
48500671,digital marketing,marketing,What demographics respond best to digital marketing?,optimization,Expert,"[""Introduction to digital marketing"", ""Key points and analysis"", ""Practical examples"", ""Expert insights"", ""Action items"", ""Conclusion""]","[""branding"", ""marketing"", ""optimization"", ""digital""]",4,Marketing Directors & CMOs,"[""social media"", ""brand management"", ""content marketing""]",52,7,2025-10-25 22:04:17,en,What demographics respond best to {keyword}?,0.82,1.0,0.72
48500672,brand management,marketing,How do you develop an effective brand management strategy?,optimization,Expert,"[""Overview of brand management"", ""Step-by-step implementation"", ""Best practices and tips"", ""Common challenges and solutions"", ""Tools and resources needed"", ""Conclusion and next steps""]","[""promotion"", ""marketing"", ""management"", ""branding"", ""optimization"", ""brand""]",6,Marketing Directors & CMOs,"[""digital marketing"", ""content marketing"", ""social media""]",58,9,2025-10-25 22:04:17,en,How do you develop an effective {keyword} strategy?,0.67,1.0,0.63
48500673,cloud computing,it,What is the recommended architecture for cloud computing systems?,how_to,Expert,"[""Introduction to cloud computing"", ""Key points and analysis"", ""Practical examples"", ""Expert insights"", ""Action items"", ""Conclusion""]","[""computing"", ""how_to"", ""development"", ""it"", ""cloud"", ""technology""]",4,Architects & Technical Directors,"[""cybersecurity"", ""web development"", ""machine learning"", ""data science""]",65,9,2025-10-25 22:04:17,en,What is the recommended architecture for {keyword} systems?,0.73,1.0,0.75
48500674,market analysis,economics,How do you create a long-term plan for market analysis?,optimization,Expert,"[""Overview of market analysis"", ""Step-by-step implementation"", ""Best practices and tips"", ""Common challenges and solutions"", ""Tools and resources needed"", ""Conclusion and next steps""]","[""investment"", ""analysis"", ""business"", ""market"", ""optimization"", ""economics""]",6,Portfolio Managers & Financial Experts,"[""investment planning"", ""portfolio management"", ""financial modeling""]",55,10,2025-10-25 22:04:17,en,How do you create a long-term plan for {keyword}?,0.87,1.0,0.7
48500675,investment planning,economics,What is the optimal allocation for investment planning in a portfolio?,planning,Advanced,"[""Introduction to investment planning"", ""Key points and analysis"", ""Practical examples"", ""Expert insights"", ""Action items"", ""Conclusion""]","[""investment"", ""planning"", ""finance"", ""business"", ""economics""]",4,Professional Investors & Advisors,"[""market analysis"", ""portfolio management"", ""financial modeling""]",70,11,2025-10-25 22:04:17,en,What is the optimal allocation for {keyword} in a portfolio?,0.84,0.9124137448825377,0.45
48500676,data science,it,How do you integrate data science with existing systems?,analysis,Intermediate,"[""Overview of data science"", ""Step-by-step implementation"", ""Best practices and tips"", ""Common challenges and solutions"", ""Tools and resources needed"", ""Conclusion and next steps""]","[""technology"", ""analysis"", ""it"", ""programming"", ""science"", ""data""]",6,Junior to Mid-level Developers,"[""web development"", ""cybersecurity"", ""machine learning"", ""cloud computing""]",56,9,2025-10-25 22:04:17,en,How do you integrate {keyword} with existing systems?,0.77,0.7841552906914807,0.69
48500677,cybersecurity,it,How do you design a scalable cybersecurity solution?,implementation,Advanced,"[""Overview of cybersecurity"", ""Step-by-step implementation"", ""Best practices and tips"", ""Common challenges and solutions"", ""Tools and resources needed"", ""Conclusion and next steps""]","[""software"", ""it"", ""implementation"", ""cybersecurity"", ""technology""]",5,Senior Developers & Tech Leads,"[""cloud computing"", ""machine learning"", ""data science"", ""web development""]",52,8,2025-10-25 22:04:17,en,How do you design a scalable {keyword} solution?,0.93,0.8004520730002807,0.49
48500678,web development,it,How do you convince stakeholders to invest in web development?,evaluation,Intermediate,"[""Overview of web development"", ""Step-by-step implementation"", ""Best practices and tips"", ""Common challenges and solutions"", ""Tools and resources needed"", ""Conclusion and next steps""]","[""software"", ""development"", ""it"", ""evaluation"", ""web""]",6,Junior to Mid-level Developers,"[""machine learning"", ""cloud computing"", ""data science"", ""cybersecurity""]",62,10,2025-10-25 22:04:17,en,How do you convince stakeholders to invest in {keyword}?,0.82,0.6092809337292633,0.62
48500679,brand management,marketing,How is AI changing brand management approaches?,optimization,Expert,"[""Introduction to brand management"", ""Key points and analysis"", ""Practical examples"", ""Expert insights"", ""Action items"", ""Conclusion""]","[""promotion"", ""marketing"", ""management"", ""branding"", ""optimization"", ""brand""]",4,Marketing Directors & CMOs,"[""social media"", ""content marketing"", ""digital marketing""]",47,7,2025-10-25 22:04:17,en,How is AI changing {keyword} approaches?,0.64,1.0,0.69
48500680,machine learning,it,What are the key components of a machine learning implementation?,planning,Intermediate,"[""Introduction to machine learning"", ""Key concepts and definitions"", ""Main categories or types"", ""Examples and case studies"", ""Benefits and advantages"", ""Summary and recommendations""]","[""planning"", ""development"", ""it"", ""learning"", ""machine"", ""technology""]",6,Junior to Mid-level Developers,"[""cybersecurity"", ""web development"", ""data science"", ""cloud computing""]",65,10,2025-10-25 22:04:17,en,What are the key components of a {keyword} implementation?,0.9,0.7536544132313641,0.69
48500681,investment planning,economics,What indicators predict investment planning market movements?,how_to,Expert,"[""Introduction to investment planning"", ""Key points and analysis"", ""Practical examples"", ""Expert insights"", ""Action items"", ""Conclusion""]","[""investment"", ""how_to"", ""planning"", ""finance"", ""business"", ""economics""]",4,Portfolio Managers & Financial Experts,"[""portfolio management"", ""financial modeling"", ""market analysis""]",61,7,2025-10-25 22:04:17,en,What indicators predict {keyword} market movements?,0.68,1.0,0.87
48500682,brand management,marketing,How do you automate brand management processes?,implementation,Intermediate,"[""Overview of brand management"", ""Step-by-step implementation"", ""Best practices and tips"", ""Common challenges and solutions"", ""Tools and resources needed"", ""Conclusion and next steps""]","[""implementation"", ""marketing"", ""management"", ""digital"", ""branding"", ""brand""]",6,Marketing Coordinators & Specialists,"[""social media"", ""content marketing"", ""digital marketing""]",47,7,2025-10-25 22:04:17,en,How do you automate {keyword} processes?,0.87,0.6755634421937886,0.34
48500683,web development,it,What security considerations should be taken when using web development?,analysis,Advanced,"[""Introduction to web development"", ""Key points and analysis"", ""Practical examples"", ""Expert insights"", ""Action items"", ""Conclusion""]","[""software"", ""development"", ""analysis"", ""it"", ""programming"", ""web""]",4,Senior Developers & Tech Leads,"[""cybersecurity"", ""cloud computing"", ""machine learning"", ""data science""]",72,10,2025-10-25 22:04:17,en,What security considerations should be taken when using {keyword}?,0.77,0.8317005865286679,0.31
48500684,financial modeling,economics,How do economic conditions affect financial modeling performance?,troubleshooting,Intermediate,"[""Introduction to financial modeling"", ""Key points and analysis"", ""Practical examples"", ""Expert insights"", ""Action items"", ""Conclusion""]","[""finance"", ""troubleshooting"", ""modeling"", ""financial"", ""market"", ""economics""]",4,Individual Investors & Analysts,"[""investment planning"", ""market analysis"", ""portfolio management""]",65,8,2025-10-25 22:04:17,en,How do economic conditions affect {keyword} performance?,0.66,0.6376127675203788,0.83
48500685,machine learning,it,What are the best practices for machine learning development?,evaluation,Intermediate,"[""Introduction to machine learning"", ""Key concepts and definitions"", ""Main categories or types"", ""Examples and case studies"", ""Benefits and advantages"", ""Summary and recommendations""]","[""software"", ""development"", ""it"", ""learning"", ""evaluation"", ""machine""]",6,Junior to Mid-level Developers,"[""cybersecurity"", ""web development"", ""cloud computing"", ""data science""]",61,9,2025-10-25 22:04:17,en,What are the best practices for {keyword} development?,0.81,0.6372912068761901,0.74
48500686,machine learning,it,What are the best practices for machine learning development?,comparison,Beginner,"[""Introduction to machine learning"", ""Key concepts and definitions"", ""Main categories or types"", ""Examples and case studies"", ""Benefits and advantages"", ""Summary and recommendations""]","[""software"", ""development"", ""it"", ""comparison"", ""learning"", ""machine""]",6,Students & Entry-level Developers,"[""web development"", ""cybersecurity"", ""data science"", ""cloud computing""]",61,9,2025-10-25 22:04:17,en,What are the best practices for {keyword} development?,0.73,0.4034832624632344,0.86
48500687,digital marketing,marketing,How do you develop an effective digital marketing strategy?,evaluation,Intermediate,"[""Overview of digital marketing"", ""Step-by-step implementation"", ""Best practices and tips"", ""Common challenges and solutions"", ""Tools and resources needed"", ""Conclusion and next steps""]","[""marketing"", ""digital"", ""advertising"", ""branding"", ""evaluation""]",6,Marketing Coordinators & Specialists,"[""content marketing"", ""brand management"", ""social media""]",59,9,2025-10-25 22:04:17,en,How do you develop an effective {keyword} strategy?,0.94,0.6279703518339841,0.51
48500688,cloud computing,it,How do you design a scalable cloud computing solution?,how_to,Expert,"[""Overview of cloud computing"", ""Step-by-step implementation"", ""Best practices and tips"", ""Common challenges and solutions"", ""Tools and resources needed"", ""Conclusion and next steps""]","[""computing"", ""how_to"", ""software"", ""it"", ""programming"", ""cloud""]",6,Architects & Technical Directors,"[""cybersecurity"", ""data science"", ""web development"", ""machine learning""]",54,9,2025-10-25 22:04:17,en,How do you design a scalable {keyword} solution?,0.88,1.0,0.56
48500689,brand management,marketing,What content types work best for brand management?,troubleshooting,Advanced,"[""Introduction to brand management"", ""Key points and analysis"", ""Practical examples"", ""Expert insights"", ""Action items"", ""Conclusion""]","[""promotion"", ""troubleshooting"", ""marketing"", ""management"", ""digital"", ""brand""]",4,Marketing Managers & Strategists,"[""social media"", ""content marketing"", ""digital marketing""]",50,8,2025-10-25 22:04:17,en,What content types work best for {keyword}?,0.64,0.9544903019286286,0.85
48500690,investment planning,economics,What tools help analyze investment planning data?,planning,Expert,"[""Introduction to investment planning"", ""Key points and analysis"", ""Practical examples"", ""Expert insights"", ""Action items"", ""Conclusion""]","[""investment"", ""economics"", ""planning"", ""business""]",4,Portfolio Managers & Financial Experts,"[""portfolio management"", ""financial modeling"", ""market analysis""]",49,7,2025-10-25 22:04:17,en,What tools help analyze {keyword} data?,0.73,1.0,0.77
48500691,content marketing,marketing,How do you develop an effective content marketing strategy?,comparison,Expert,"[""Overview of content marketing"", ""Step-by-step implementation"", ""Best practices and tips"", ""Common challenges and solutions"", ""Tools and resources needed"", ""Conclusion and next steps""]","[""content"", ""comparison"", ""marketing"", ""advertising"", ""branding""]",6,Marketing Directors & CMOs,"[""social media"", ""brand management"", ""digital marketing""]",59,9,2025-10-25 22:04:17,en,How do you develop an effective {keyword} strategy?,0.85,1.0,0.87
48500692,cloud computing,it,How do you stay updated with cloud computing developments?,how_to,Beginner,"[""Overview of cloud computing"", ""Step-by-step implementation"", ""Best practices and tips"", ""Common challenges and solutions"", ""Tools and resources needed"", ""Conclusion and next steps""]","[""computing"", ""how_to"", ""it"", ""programming"", ""cloud"", ""technology""]",6,Students & Entry-level Developers,"[""machine learning"", ""data science"", ""cybersecurity"", ""web development""]",58,9,2025-10-25 22:04:17,en,How do you stay updated with {keyword} developments?,0.73,0.3420427261088307,0.51
48500693,web development,it,How do you optimize web development for different platforms?,comparison,Beginner,"[""Overview of web development"", ""Step-by-step implementation"", ""Best practices and tips"", ""Common challenges and solutions"", ""Tools and resources needed"", ""Conclusion and next steps""]","[""development"", ""web"", ""it"", ""comparison"", ""programming"", ""technology""]",6,Students & Entry-level Developers,"[""cybersecurity"", ""data science"", ""cloud computing"", ""machine learning""]",60,9,2025-10-25 22:04:17,en,How do you optimize {keyword} for different platforms?,0.83,0.4799713594727967,0.51
48500694,digital marketing,marketing,What KPIs are most important for digital marketing?,planning,Intermediate,"[""Introduction to digital marketing"", ""Key points and analysis"", ""Practical examples"", ""Expert insights"", ""Action items"", ""Conclusion""]","[""planning"", ""marketing"", ""digital"", ""advertising"", ""branding""]",4,Marketing Coordinators & Specialists,"[""content marketing"", ""social media"", ""brand management""]",51,8,2025-10-25 22:04:17,en,What KPIs are most important for {keyword}?,0.74,0.6660794866164274,0.43
48500695,social media,marketing,How do you reach new customers through social media?,strategy,Expert,"[""Overview of social media"", ""Step-by-step implementation"", ""Best practices and tips"", ""Common challenges and solutions"", ""Tools and resources needed"", ""Conclusion and next steps""]","[""media"", ""digital"", ""marketing"", ""social"", ""advertising"", ""strategy""]",6,Marketing Directors & CMOs,"[""content marketing"", ""digital marketing"", ""brand management""]",52,9,2025-10-25 22:04:17,en,How do you reach new customers through {keyword}?,0.84,1.0,0.87
48500696,social media,marketing,What emerging platforms support social media?,analysis,Expert,"[""Introduction to social media"", ""Key points and analysis"", ""Practical examples"", ""Expert insights"", ""Action items"", ""Conclusion""]","[""analysis"", ""media"", ""marketing"", ""social"", ""advertising"", ""branding""]",4,Marketing Directors & CMOs,"[""brand management"", ""digital marketing"", ""content marketing""]",45,6,2025-10-25 22:04:17,en,What emerging platforms support {keyword}?,0.71,1.0,0.86
48500697,cybersecurity,it,How can cybersecurity improve system performance and scalability?,evaluation,Beginner,"[""Introduction to cybersecurity"", ""Key points and analysis"", ""Practical examples"", ""Expert insights"", ""Action items"", ""Conclusion""]","[""software"", ""it"", ""evaluation"", ""cybersecurity"", ""technology""]",4,Students & Entry-level Developers,"[""cloud computing"", ""data science"", ""web development"", ""machine learning""]",65,8,2025-10-25 22:04:17,en,How can {keyword} improve system performance and scalability?,0.75,0.48032174371619907,0.49
