record_id,keyword,category,question,question_type,difficulty_level,answer_outline,tags,estimated_read_time,target_audience,related_topics,question_length,word_count,created_date,language,source_template,engagement_score,complexity_score,popularity_score
28800651,portfolio management,economics,How does global economics impact portfolio management?,evaluation,Beginner,"[""Introduction to portfolio management"", ""Key points and analysis"", ""Practical examples"", ""Expert insights"", ""Action items"", ""Conclusion""]","[""investment"", ""portfolio"", ""management"", ""evaluation"", ""market"", ""economics""]",4,Students & New Investors,"[""financial modeling"", ""market analysis"", ""investment planning""]",54,7,2025-10-25 21:36:49,en,How does global economics impact {keyword}?,0.64,0.44956599518054685,0.88
28800652,web development,it,What is the recommended architecture for web development systems?,implementation,Intermediate,"[""Introduction to web development"", ""Key points and analysis"", ""Practical examples"", ""Expert insights"", ""Action items"", ""Conclusion""]","[""development"", ""it"", ""implementation"", ""programming"", ""web""]",4,Junior to Mid-level Developers,"[""cybersecurity"", ""machine learning"", ""data science"", ""cloud computing""]",65,9,2025-10-25 21:36:49,en,What is the recommended architecture for {keyword} systems?,0.93,0.7377521522232298,0.57
28800653,social media,marketing,What channels are most effective for social media?,analysis,Beginner,"[""Introduction to social media"", ""Key points and analysis"", ""Practical examples"", ""Expert insights"", ""Action items"", ""Conclusion""]","[""analysis"", ""media"", ""digital"", ""marketing"", ""social"", ""advertising""]",4,Marketing Students & Interns,"[""brand management"", ""digital marketing"", ""content marketing""]",50,8,2025-10-25 21:36:49,en,What channels are most effective for {keyword}?,0.84,0.4471262128867043,0.64
28800654,investment planning,economics,What metrics are most important for investment planning?,evaluation,Beginner,"[""Introduction to investment planning"", ""Key points and analysis"", ""Practical examples"", ""Expert insights"", ""Action items"", ""Conclusion""]","[""investment"", ""planning"", ""finance"", ""evaluation"", ""economics""]",4,Students & New Investors,"[""market analysis"", ""financial modeling"", ""portfolio management""]",56,8,2025-10-25 21:36:49,en,What metrics are most important for {keyword}?,0.77,0.34060482103300527,0.54
28800655,data science,it,How do you optimize data science for different platforms?,planning,Intermediate,"[""Overview of data science"", ""Step-by-step implementation"", ""Best practices and tips"", ""Common challenges and solutions"", ""Tools and resources needed"", ""Conclusion and next steps""]","[""planning"", ""development"", ""it"", ""programming"", ""science"", ""data""]",6,Junior to Mid-level Developers,"[""web development"", ""cybersecurity"", ""cloud computing"", ""machine learning""]",57,9,2025-10-25 21:36:49,en,How do you optimize {keyword} for different platforms?,0.78,0.6087085944535349,0.65
28800656,social media,marketing,What budget should be allocated to social media?,comparison,Beginner,"[""Introduction to social media"", ""Key points and analysis"", ""Practical examples"", ""Expert insights"", ""Action items"", ""Conclusion""]","[""media"", ""comparison"", ""digital"", ""marketing"", ""social"", ""advertising""]",4,Marketing Students & Interns,"[""content marketing"", ""digital marketing"", ""brand management""]",48,8,2025-10-25 21:36:49,en,What budget should be allocated to {keyword}?,0.79,0.379490960410304,0.71
28800657,brand management,marketing,What demographics respond best to brand management?,comparison,Advanced,"[""Introduction to brand management"", ""Key points and analysis"", ""Practical examples"", ""Expert insights"", ""Action items"", ""Conclusion""]","[""promotion"", ""comparison"", ""marketing"", ""management"", ""digital"", ""brand""]",4,Marketing Managers & Strategists,"[""content marketing"", ""social media"", ""digital marketing""]",51,7,2025-10-25 21:36:49,en,What demographics respond best to {keyword}?,0.83,0.9630985082113921,0.89
28800658,portfolio management,economics,What strategies work best for portfolio management investment?,strategy,Advanced,"[""Introduction to portfolio management"", ""Key points and analysis"", ""Practical examples"", ""Expert insights"", ""Action items"", ""Conclusion""]","[""portfolio"", ""management"", ""business"", ""market"", ""strategy"", ""economics""]",4,Professional Investors & Advisors,"[""investment planning"", ""financial modeling"", ""market analysis""]",62,8,2025-10-25 21:36:49,en,What strategies work best for {keyword} investment?,0.94,0.8941486133189006,0.46
28800659,financial modeling,economics,How do you assess and manage financial modeling risks?,strategy,Beginner,"[""Overview of financial modeling"", ""Step-by-step implementation"", ""Best practices and tips"", ""Common challenges and solutions"", ""Tools and resources needed"", ""Conclusion and next steps""]","[""modeling"", ""financial"", ""business"", ""market"", ""strategy"", ""economics""]",6,Students & New Investors,"[""market analysis"", ""portfolio management"", ""investment planning""]",54,9,2025-10-25 21:36:49,en,How do you assess and manage {keyword} risks?,0.86,0.45778737653904683,0.69
28800660,financial modeling,economics,How do you protect your financial modeling investments?,implementation,Advanced,"[""Overview of financial modeling"", ""Step-by-step implementation"", ""Best practices and tips"", ""Common challenges and solutions"", ""Tools and resources needed"", ""Conclusion and next steps""]","[""implementation"", ""modeling"", ""financial"", ""market"", ""business"", ""economics""]",6,Professional Investors & Advisors,"[""market analysis"", ""portfolio management"", ""investment planning""]",55,8,2025-10-25 21:36:49,en,How do you protect your {keyword} investments?,0.77,0.9374881545814733,0.38
28800661,content marketing,marketing,What are the latest trends in content marketing?,planning,Intermediate,"[""Introduction to content marketing"", ""Key concepts and definitions"", ""Main categories or types"", ""Examples and case studies"", ""Benefits and advantages"", ""Summary and recommendations""]","[""planning"", ""content"", ""marketing"", ""digital"", ""advertising""]",6,Marketing Coordinators & Specialists,"[""brand management"", ""digital marketing"", ""social media""]",48,8,2025-10-25 21:36:49,en,What are the latest trends in {keyword}?,0.92,0.6120100165725303,0.74
28800662,cloud computing,it,How do you convince stakeholders to invest in cloud computing?,how_to,Beginner,"[""Overview of cloud computing"", ""Step-by-step implementation"", ""Best practices and tips"", ""Common challenges and solutions"", ""Tools and resources needed"", ""Conclusion and next steps""]","[""computing"", ""how_to"", ""software"", ""development"", ""it"", ""cloud""]",6,Students & Entry-level Developers,"[""cybersecurity"", ""web development"", ""machine learning"", ""data science""]",62,10,2025-10-25 21:36:49,en,How do you convince stakeholders to invest in {keyword}?,0.71,0.4922783105842773,0.39
28800663,market analysis,economics,How do you assess and manage market analysis risks?,troubleshooting,Beginner,"[""Overview of market analysis"", ""Step-by-step implementation"", ""Best practices and tips"", ""Common challenges and solutions"", ""Tools and resources needed"", ""Conclusion and next steps""]","[""analysis"", ""finance"", ""troubleshooting"", ""market"", ""business"", ""economics""]",6,Students & New Investors,"[""portfolio management"", ""investment planning"", ""financial modeling""]",51,9,2025-10-25 21:36:49,en,How do you assess and manage {keyword} risks?,0.81,0.4520962222279642,0.61
28800664,investment planning,economics,How do you assess and manage investment planning risks?,analysis,Expert,"[""Overview of investment planning"", ""Step-by-step implementation"", ""Best practices and tips"", ""Common challenges and solutions"", ""Tools and resources needed"", ""Conclusion and next steps""]","[""investment"", ""planning"", ""finance"", ""analysis"", ""economics""]",6,Portfolio Managers & Financial Experts,"[""market analysis"", ""financial modeling"", ""portfolio management""]",55,9,2025-10-25 21:36:49,en,How do you assess and manage {keyword} risks?,0.87,1.0,0.49
28800665,machine learning,it,What is the recommended architecture for machine learning systems?,implementation,Expert,"[""Introduction to machine learning"", ""Key points and analysis"", ""Practical examples"", ""Expert insights"", ""Action items"", ""Conclusion""]","[""development"", ""it"", ""implementation"", ""programming"", ""learning"", ""machine""]",4,Architects & Technical Directors,"[""cybersecurity"", ""data science"", ""web development"", ""cloud computing""]",66,9,2025-10-25 21:36:49,en,What is the recommended architecture for {keyword} systems?,0.79,1.0,0.7
28800666,financial modeling,economics,How do you benchmark financial modeling against alternatives?,optimization,Expert,"[""Overview of financial modeling"", ""Step-by-step implementation"", ""Best practices and tips"", ""Common challenges and solutions"", ""Tools and resources needed"", ""Conclusion and next steps""]","[""finance"", ""modeling"", ""financial"", ""market"", ""optimization"", ""economics""]",6,Portfolio Managers & Financial Experts,"[""portfolio management"", ""investment planning"", ""market analysis""]",61,8,2025-10-25 21:36:49,en,How do you benchmark {keyword} against alternatives?,0.77,1.0,0.32
28800667,data science,it,How can data science improve system performance and scalability?,planning,Beginner,"[""Introduction to data science"", ""Key points and analysis"", ""Practical examples"", ""Expert insights"", ""Action items"", ""Conclusion""]","[""planning"", ""development"", ""it"", ""programming"", ""science"", ""data""]",4,Students & Entry-level Developers,"[""cybersecurity"", ""web development"", ""machine learning"", ""cloud computing""]",64,9,2025-10-25 21:36:49,en,How can {keyword} improve system performance and scalability?,0.83,0.3711030981237691,0.85
28800668,digital marketing,marketing,How do you measure the ROI of digital marketing campaigns?,planning,Intermediate,"[""Overview of digital marketing"", ""Step-by-step implementation"", ""Best practices and tips"", ""Common challenges and solutions"", ""Tools and resources needed"", ""Conclusion and next steps""]","[""marketing"", ""advertising"", ""planning"", ""digital""]",6,Marketing Coordinators & Specialists,"[""social media"", ""brand management"", ""content marketing""]",58,10,2025-10-25 21:36:49,en,How do you measure the ROI of {keyword} campaigns?,0.74,0.7472749489500133,0.9
28800669,brand management,marketing,What does the future hold for brand management?,analysis,Expert,"[""Introduction to brand management"", ""Key points and analysis"", ""Practical examples"", ""Expert insights"", ""Action items"", ""Conclusion""]","[""analysis"", ""marketing"", ""management"", ""advertising"", ""digital"", ""brand""]",4,Marketing Directors & CMOs,"[""content marketing"", ""digital marketing"", ""social media""]",47,8,2025-10-25 21:36:49,en,What does the future hold for {keyword}?,0.93,1.0,0.71
28800670,machine learning,it,How do you integrate machine learning with existing systems?,best_practice,Advanced,"[""Overview of machine learning"", ""Step-by-step implementation"", ""Best practices and tips"", ""Common challenges and solutions"", ""Tools and resources needed"", ""Conclusion and next steps""]","[""development"", ""it"", ""best_practice"", ""programming"", ""learning"", ""machine""]",6,Senior Developers & Tech Leads,"[""cybersecurity"", ""cloud computing"", ""web development"", ""data science""]",60,9,2025-10-25 21:36:49,en,How do you integrate {keyword} with existing systems?,0.88,0.8465674619123127,0.36
28800671,brand management,marketing,How do you attribute success to brand management efforts?,optimization,Advanced,"[""Overview of brand management"", ""Step-by-step implementation"", ""Best practices and tips"", ""Common challenges and solutions"", ""Tools and resources needed"", ""Conclusion and next steps""]","[""marketing"", ""management"", ""advertising"", ""branding"", ""optimization"", ""brand""]",6,Marketing Managers & Strategists,"[""digital marketing"", ""content marketing"", ""social media""]",57,9,2025-10-25 21:36:49,en,How do you attribute success to {keyword} efforts?,0.69,0.87302352689195,0.51
28800672,digital marketing,marketing,How is AI changing digital marketing approaches?,implementation,Beginner,"[""Introduction to digital marketing"", ""Key points and analysis"", ""Practical examples"", ""Expert insights"", ""Action items"", ""Conclusion""]","[""implementation"", ""marketing"", ""advertising"", ""digital""]",4,Marketing Students & Interns,"[""content marketing"", ""social media"", ""brand management""]",48,7,2025-10-25 21:36:49,en,How is AI changing {keyword} approaches?,0.94,0.31245069831924066,0.68
28800673,portfolio management,economics,What are the seasonal patterns in portfolio management?,comparison,Advanced,"[""Introduction to portfolio management"", ""Key concepts and definitions"", ""Main categories or types"", ""Examples and case studies"", ""Benefits and advantages"", ""Summary and recommendations""]","[""finance"", ""portfolio"", ""comparison"", ""management"", ""business"", ""economics""]",6,Professional Investors & Advisors,"[""financial modeling"", ""investment planning"", ""market analysis""]",55,8,2025-10-25 21:36:49,en,What are the seasonal patterns in {keyword}?,0.62,0.9294162834970273,0.67
28800674,cloud computing,it,How do you measure the success of cloud computing projects?,analysis,Advanced,"[""Overview of cloud computing"", ""Step-by-step implementation"", ""Best practices and tips"", ""Common challenges and solutions"", ""Tools and resources needed"", ""Conclusion and next steps""]","[""computing"", ""development"", ""analysis"", ""it"", ""programming"", ""cloud""]",6,Senior Developers & Tech Leads,"[""data science"", ""machine learning"", ""web development"", ""cybersecurity""]",59,10,2025-10-25 21:36:49,en,How do you measure the success of {keyword} projects?,0.95,0.8351815161166075,0.84
28800675,machine learning,it,How can machine learning improve system performance and scalability?,planning,Expert,"[""Introduction to machine learning"", ""Key points and analysis"", ""Practical examples"", ""Expert insights"", ""Action items"", ""Conclusion""]","[""planning"", ""development"", ""it"", ""software"", ""learning"", ""machine""]",4,Architects & Technical Directors,"[""cloud computing"", ""web development"", ""data science"", ""cybersecurity""]",68,9,2025-10-25 21:36:49,en,How can {keyword} improve system performance and scalability?,0.88,1.0,0.75
28800676,cloud computing,it,How do you implement cloud computing in a production environment?,optimization,Intermediate,"[""Overview of cloud computing"", ""Step-by-step implementation"", ""Best practices and tips"", ""Common challenges and solutions"", ""Tools and resources needed"", ""Conclusion and next steps""]","[""computing"", ""cloud"", ""development"", ""it"", ""software"", ""optimization""]",6,Junior to Mid-level Developers,"[""web development"", ""machine learning"", ""cybersecurity"", ""data science""]",65,10,2025-10-25 21:36:49,en,How do you implement {keyword} in a production environment?,0.76,0.6119663895129774,0.41
28800677,machine learning,it,How do you troubleshoot common issues with machine learning?,troubleshooting,Beginner,"[""Overview of machine learning"", ""Step-by-step implementation"", ""Best practices and tips"", ""Common challenges and solutions"", ""Tools and resources needed"", ""Conclusion and next steps""]","[""software"", ""it"", ""programming"", ""troubleshooting"", ""learning"", ""machine""]",6,Students & Entry-level Developers,"[""data science"", ""cybersecurity"", ""web development"", ""cloud computing""]",60,9,2025-10-25 21:36:49,en,How do you troubleshoot common issues with {keyword}?,0.64,0.4580459251547486,0.83
28800678,brand management,marketing,How do you personalize brand management for different segments?,planning,Beginner,"[""Overview of brand management"", ""Step-by-step implementation"", ""Best practices and tips"", ""Common challenges and solutions"", ""Tools and resources needed"", ""Conclusion and next steps""]","[""planning"", ""promotion"", ""marketing"", ""management"", ""advertising"", ""brand""]",6,Marketing Students & Interns,"[""digital marketing"", ""social media"", ""content marketing""]",63,9,2025-10-25 21:36:49,en,How do you personalize {keyword} for different segments?,0.78,0.41232348617123427,0.42
28800679,data science,it,How do you convince stakeholders to invest in data science?,troubleshooting,Expert,"[""Overview of data science"", ""Step-by-step implementation"", ""Best practices and tips"", ""Common challenges and solutions"", ""Tools and resources needed"", ""Conclusion and next steps""]","[""development"", ""it"", ""programming"", ""troubleshooting"", ""science"", ""data""]",6,Architects & Technical Directors,"[""cloud computing"", ""cybersecurity"", ""web development"", ""machine learning""]",59,10,2025-10-25 21:36:49,en,How do you convince stakeholders to invest in {keyword}?,0.65,1.0,0.36
28800680,social media,marketing,How do you identify the right audience for social media?,evaluation,Advanced,"[""Overview of social media"", ""Step-by-step implementation"", ""Best practices and tips"", ""Common challenges and solutions"", ""Tools and resources needed"", ""Conclusion and next steps""]","[""media"", ""promotion"", ""marketing"", ""digital"", ""social"", ""evaluation""]",6,Marketing Managers & Strategists,"[""digital marketing"", ""content marketing"", ""brand management""]",56,10,2025-10-25 21:36:49,en,How do you identify the right audience for {keyword}?,0.68,0.9093053598152205,0.38
28800681,brand management,marketing,How do you track and analyze brand management performance?,how_to,Expert,"[""Overview of brand management"", ""Step-by-step implementation"", ""Best practices and tips"", ""Common challenges and solutions"", ""Tools and resources needed"", ""Conclusion and next steps""]","[""how_to"", ""marketing"", ""management"", ""advertising"", ""branding"", ""brand""]",6,Marketing Directors & CMOs,"[""digital marketing"", ""social media"", ""content marketing""]",58,9,2025-10-25 21:36:49,en,How do you track and analyze {keyword} performance?,0.62,1.0,0.41
28800682,financial modeling,economics,What timeline is realistic for financial modeling returns?,evaluation,Intermediate,"[""Introduction to financial modeling"", ""Key points and analysis"", ""Practical examples"", ""Expert insights"", ""Action items"", ""Conclusion""]","[""finance"", ""modeling"", ""financial"", ""evaluation"", ""market"", ""economics""]",4,Individual Investors & Analysts,"[""portfolio management"", ""market analysis"", ""investment planning""]",58,8,2025-10-25 21:36:49,en,What timeline is realistic for {keyword} returns?,0.84,0.7082969323579859,0.86
28800683,investment planning,economics,What timeline is realistic for investment planning returns?,best_practice,Advanced,"[""Introduction to investment planning"", ""Key points and analysis"", ""Practical examples"", ""Expert insights"", ""Action items"", ""Conclusion""]","[""investment"", ""planning"", ""finance"", ""best_practice"", ""market"", ""economics""]",4,Professional Investors & Advisors,"[""financial modeling"", ""market analysis"", ""portfolio management""]",59,8,2025-10-25 21:36:49,en,What timeline is realistic for {keyword} returns?,0.88,0.8936790365978335,0.45
28800684,market analysis,economics,How do you analyze market trends in market analysis?,planning,Intermediate,"[""Overview of market analysis"", ""Step-by-step implementation"", ""Best practices and tips"", ""Common challenges and solutions"", ""Tools and resources needed"", ""Conclusion and next steps""]","[""investment"", ""planning"", ""analysis"", ""market"", ""economics""]",6,Individual Investors & Analysts,"[""financial modeling"", ""portfolio management"", ""investment planning""]",52,9,2025-10-25 21:36:49,en,How do you analyze market trends in {keyword}?,0.79,0.7443019786958768,0.53
28800685,data science,it,How do you convince stakeholders to invest in data science?,how_to,Intermediate,"[""Overview of data science"", ""Step-by-step implementation"", ""Best practices and tips"", ""Common challenges and solutions"", ""Tools and resources needed"", ""Conclusion and next steps""]","[""how_to"", ""technology"", ""software"", ""it"", ""science"", ""data""]",6,Junior to Mid-level Developers,"[""web development"", ""cloud computing"", ""cybersecurity"", ""machine learning""]",59,10,2025-10-25 21:36:49,en,How do you convince stakeholders to invest in {keyword}?,0.84,0.7466354649350918,0.8
28800686,market analysis,economics,How do you report on market analysis performance to stakeholders?,optimization,Intermediate,"[""Overview of market analysis"", ""Step-by-step implementation"", ""Best practices and tips"", ""Common challenges and solutions"", ""Tools and resources needed"", ""Conclusion and next steps""]","[""investment"", ""analysis"", ""market"", ""optimization"", ""economics""]",6,Individual Investors & Analysts,"[""financial modeling"", ""investment planning"", ""portfolio management""]",65,10,2025-10-25 21:36:49,en,How do you report on {keyword} performance to stakeholders?,0.6,0.7888914860232494,0.37
28800687,portfolio management,economics,What are the risks associated with portfolio management?,troubleshooting,Intermediate,"[""Introduction to portfolio management"", ""Key concepts and definitions"", ""Main categories or types"", ""Examples and case studies"", ""Benefits and advantages"", ""Summary and recommendations""]","[""finance"", ""portfolio"", ""troubleshooting"", ""management"", ""business"", ""economics""]",6,Individual Investors & Analysts,"[""financial modeling"", ""investment planning"", ""market analysis""]",56,8,2025-10-25 21:36:49,en,What are the risks associated with {keyword}?,0.93,0.6686866552292029,0.83
28800688,cloud computing,it,What are the key components of a cloud computing implementation?,best_practice,Beginner,"[""Introduction to cloud computing"", ""Key concepts and definitions"", ""Main categories or types"", ""Examples and case studies"", ""Benefits and advantages"", ""Summary and recommendations""]","[""computing"", ""software"", ""it"", ""programming"", ""best_practice"", ""cloud""]",6,Students & Entry-level Developers,"[""cybersecurity"", ""data science"", ""web development"", ""machine learning""]",64,10,2025-10-25 21:36:49,en,What are the key components of a {keyword} implementation?,0.93,0.45010862740775237,0.84
28800689,portfolio management,economics,How do you measure portfolio management performance?,best_practice,Intermediate,"[""Overview of portfolio management"", ""Step-by-step implementation"", ""Best practices and tips"", ""Common challenges and solutions"", ""Tools and resources needed"", ""Conclusion and next steps""]","[""finance"", ""portfolio"", ""best_practice"", ""management"", ""market"", ""economics""]",6,Individual Investors & Analysts,"[""investment planning"", ""financial modeling"", ""market analysis""]",52,7,2025-10-25 21:36:49,en,How do you measure {keyword} performance?,0.92,0.6385159225862218,0.31
28800690,cloud computing,it,What are the latest trends in cloud computing technology?,implementation,Expert,"[""Introduction to cloud computing"", ""Key concepts and definitions"", ""Main categories or types"", ""Examples and case studies"", ""Benefits and advantages"", ""Summary and recommendations""]","[""computing"", ""software"", ""it"", ""implementation"", ""cloud"", ""technology""]",6,Architects & Technical Directors,"[""cybersecurity"", ""machine learning"", ""web development"", ""data science""]",57,9,2025-10-25 21:36:49,en,What are the latest trends in {keyword} technology?,0.76,1.0,0.88
28800691,financial modeling,economics,How do you create a long-term plan for financial modeling?,planning,Expert,"[""Overview of financial modeling"", ""Step-by-step implementation"", ""Best practices and tips"", ""Common challenges and solutions"", ""Tools and resources needed"", ""Conclusion and next steps""]","[""investment"", ""planning"", ""finance"", ""modeling"", ""financial"", ""economics""]",6,Portfolio Managers & Financial Experts,"[""market analysis"", ""investment planning"", ""portfolio management""]",58,10,2025-10-25 21:36:49,en,How do you create a long-term plan for {keyword}?,0.89,1.0,0.37
28800692,investment planning,economics,What indicators predict investment planning market movements?,comparison,Expert,"[""Introduction to investment planning"", ""Key points and analysis"", ""Practical examples"", ""Expert insights"", ""Action items"", ""Conclusion""]","[""investment"", ""planning"", ""finance"", ""comparison"", ""economics""]",4,Portfolio Managers & Financial Experts,"[""portfolio management"", ""market analysis"", ""financial modeling""]",61,7,2025-10-25 21:36:49,en,What indicators predict {keyword} market movements?,0.72,1.0,0.61
28800693,cybersecurity,it,How does cybersecurity impact business operations?,evaluation,Expert,"[""Introduction to cybersecurity"", ""Key points and analysis"", ""Practical examples"", ""Expert insights"", ""Action items"", ""Conclusion""]","[""development"", ""it"", ""programming"", ""evaluation"", ""cybersecurity""]",4,Architects & Technical Directors,"[""machine learning"", ""cloud computing"", ""data science"", ""web development""]",50,6,2025-10-25 21:36:49,en,How does {keyword} impact business operations?,0.89,1.0,0.79
