record_id,keyword,category,question,question_type,difficulty_level,answer_outline,tags,estimated_read_time,target_audience,related_topics,question_length,word_count,created_date,language,source_template,engagement_score,complexity_score,popularity_score
41200349,cybersecurity,it,How do you implement cybersecurity in a production environment?,optimization,Advanced,"[""Overview of cybersecurity"", ""Step-by-step implementation"", ""Best practices and tips"", ""Common challenges and solutions"", ""Tools and resources needed"", ""Conclusion and next steps""]","[""it"", ""programming"", ""optimization"", ""cybersecurity"", ""technology""]",5,Senior Developers & Tech Leads,"[""web development"", ""machine learning"", ""cloud computing"", ""data science""]",63,9,2025-10-25 21:54:03,en,How do you implement {keyword} in a production environment?,0.63,0.8359484709636238,0.45
41200350,financial modeling,economics,How do you identify opportunities in financial modeling markets?,troubleshooting,Intermediate,"[""Overview of financial modeling"", ""Step-by-step implementation"", ""Best practices and tips"", ""Common challenges and solutions"", ""Tools and resources needed"", ""Conclusion and next steps""]","[""investment"", ""troubleshooting"", ""modeling"", ""financial"", ""market"", ""economics""]",6,Individual Investors & Analysts,"[""investment planning"", ""market analysis"", ""portfolio management""]",64,9,2025-10-25 21:54:03,en,How do you identify opportunities in {keyword} markets?,0.89,0.7337482057576796,0.73
41200351,data science,it,What are the best practices for data science development?,troubleshooting,Intermediate,"[""Introduction to data science"", ""Key concepts and definitions"", ""Main categories or types"", ""Examples and case studies"", ""Benefits and advantages"", ""Summary and recommendations""]","[""software"", ""it"", ""programming"", ""troubleshooting"", ""science"", ""data""]",6,Junior to Mid-level Developers,"[""cloud computing"", ""machine learning"", ""web development"", ""cybersecurity""]",57,9,2025-10-25 21:54:03,en,What are the best practices for {keyword} development?,0.63,0.7287485255033915,0.49
41200352,cybersecurity,it,How do you integrate cybersecurity with existing systems?,best_practice,Expert,"[""Overview of cybersecurity"", ""Step-by-step implementation"", ""Best practices and tips"", ""Common challenges and solutions"", ""Tools and resources needed"", ""Conclusion and next steps""]","[""software"", ""it"", ""best_practice"", ""cybersecurity"", ""technology""]",5,Architects & Technical Directors,"[""data science"", ""machine learning"", ""web development"", ""cloud computing""]",57,8,2025-10-25 21:54:03,en,How do you integrate {keyword} with existing systems?,0.85,1.0,0.86
41200353,financial modeling,economics,How do you analyze market trends in financial modeling?,evaluation,Beginner,"[""Overview of financial modeling"", ""Step-by-step implementation"", ""Best practices and tips"", ""Common challenges and solutions"", ""Tools and resources needed"", ""Conclusion and next steps""]","[""modeling"", ""financial"", ""evaluation"", ""market"", ""business"", ""economics""]",6,Students & New Investors,"[""portfolio management"", ""market analysis"", ""investment planning""]",55,9,2025-10-25 21:54:03,en,How do you analyze market trends in {keyword}?,0.62,0.4874939122632037,0.86
41200354,investment planning,economics,How does global economics impact investment planning?,strategy,Expert,"[""Introduction to investment planning"", ""Key points and analysis"", ""Practical examples"", ""Expert insights"", ""Action items"", ""Conclusion""]","[""investment"", ""planning"", ""business"", ""strategy"", ""economics""]",4,Portfolio Managers & Financial Experts,"[""market analysis"", ""financial modeling"", ""portfolio management""]",53,7,2025-10-25 21:54:03,en,How does global economics impact {keyword}?,0.8,1.0,0.37
41200355,social media,marketing,How do you develop an effective social media strategy?,comparison,Intermediate,"[""Overview of social media"", ""Step-by-step implementation"", ""Best practices and tips"", ""Common challenges and solutions"", ""Tools and resources needed"", ""Conclusion and next steps""]","[""media"", ""comparison"", ""marketing"", ""digital"", ""social"", ""advertising""]",6,Marketing Coordinators & Specialists,"[""content marketing"", ""digital marketing"", ""brand management""]",54,9,2025-10-25 21:54:03,en,How do you develop an effective {keyword} strategy?,0.78,0.6883302472889439,0.39
41200356,investment planning,economics,How do you benchmark investment planning against alternatives?,how_to,Advanced,"[""Overview of investment planning"", ""Step-by-step implementation"", ""Best practices and tips"", ""Common challenges and solutions"", ""Tools and resources needed"", ""Conclusion and next steps""]","[""investment"", ""how_to"", ""planning"", ""market"", ""business"", ""economics""]",6,Professional Investors & Advisors,"[""portfolio management"", ""market analysis"", ""financial modeling""]",62,8,2025-10-25 21:54:03,en,How do you benchmark {keyword} against alternatives?,0.83,0.8820484256276269,0.38
41200357,cloud computing,it,How do you design a scalable cloud computing solution?,analysis,Advanced,"[""Overview of cloud computing"", ""Step-by-step implementation"", ""Best practices and tips"", ""Common challenges and solutions"", ""Tools and resources needed"", ""Conclusion and next steps""]","[""computing"", ""development"", ""analysis"", ""it"", ""programming"", ""cloud""]",6,Senior Developers & Tech Leads,"[""data science"", ""web development"", ""cybersecurity"", ""machine learning""]",54,9,2025-10-25 21:54:03,en,How do you design a scalable {keyword} solution?,0.75,0.9078406267792466,0.8
41200358,machine learning,it,What ROI can be expected from machine learning implementation?,troubleshooting,Advanced,"[""Introduction to machine learning"", ""Key points and analysis"", ""Practical examples"", ""Expert insights"", ""Action items"", ""Conclusion""]","[""software"", ""it"", ""troubleshooting"", ""learning"", ""machine"", ""technology""]",4,Senior Developers & Tech Leads,"[""data science"", ""cloud computing"", ""cybersecurity"", ""web development""]",62,9,2025-10-25 21:54:03,en,What ROI can be expected from {keyword} implementation?,0.93,0.8107571191891649,0.59
41200359,cloud computing,it,What certifications are valuable for cloud computing professionals?,evaluation,Beginner,"[""Introduction to cloud computing"", ""Key points and analysis"", ""Practical examples"", ""Expert insights"", ""Action items"", ""Conclusion""]","[""computing"", ""it"", ""programming"", ""evaluation"", ""cloud"", ""technology""]",4,Students & Entry-level Developers,"[""data science"", ""machine learning"", ""web development"", ""cybersecurity""]",67,8,2025-10-25 21:54:03,en,What certifications are valuable for {keyword} professionals?,0.7,0.4153497953230918,0.43
41200360,financial modeling,economics,What tools help analyze financial modeling data?,how_to,Expert,"[""Introduction to financial modeling"", ""Key points and analysis"", ""Practical examples"", ""Expert insights"", ""Action items"", ""Conclusion""]","[""how_to"", ""modeling"", ""financial"", ""market"", ""business"", ""economics""]",4,Portfolio Managers & Financial Experts,"[""market analysis"", ""portfolio management"", ""investment planning""]",48,7,2025-10-25 21:54:03,en,What tools help analyze {keyword} data?,0.74,1.0,0.59
41200361,data science,it,What are the best practices for data science development?,planning,Advanced,"[""Introduction to data science"", ""Key concepts and definitions"", ""Main categories or types"", ""Examples and case studies"", ""Benefits and advantages"", ""Summary and recommendations""]","[""technology"", ""planning"", ""it"", ""programming"", ""science"", ""data""]",6,Senior Developers & Tech Leads,"[""web development"", ""machine learning"", ""cybersecurity"", ""cloud computing""]",57,9,2025-10-25 21:54:03,en,What are the best practices for {keyword} development?,0.84,0.8624584063550512,0.65
41200362,financial modeling,economics,How do you diversify your portfolio using financial modeling?,evaluation,Intermediate,"[""Overview of financial modeling"", ""Step-by-step implementation"", ""Best practices and tips"", ""Common challenges and solutions"", ""Tools and resources needed"", ""Conclusion and next steps""]","[""modeling"", ""financial"", ""evaluation"", ""market"", ""business"", ""economics""]",6,Individual Investors & Analysts,"[""market analysis"", ""portfolio management"", ""investment planning""]",61,9,2025-10-25 21:54:03,en,How do you diversify your portfolio using {keyword}?,0.69,0.7111402304980761,0.4
41200363,digital marketing,marketing,How do you innovate within digital marketing?,planning,Beginner,"[""Overview of digital marketing"", ""Step-by-step implementation"", ""Best practices and tips"", ""Common challenges and solutions"", ""Tools and resources needed"", ""Conclusion and next steps""]","[""marketing"", ""advertising"", ""planning"", ""digital""]",6,Marketing Students & Interns,"[""social media"", ""content marketing"", ""brand management""]",45,7,2025-10-25 21:54:03,en,How do you innovate within {keyword}?,0.92,0.43808091174162134,0.42
41200364,market analysis,economics,What are the seasonal patterns in market analysis?,evaluation,Expert,"[""Introduction to market analysis"", ""Key concepts and definitions"", ""Main categories or types"", ""Examples and case studies"", ""Benefits and advantages"", ""Summary and recommendations""]","[""analysis"", ""evaluation"", ""market"", ""business"", ""economics""]",6,Portfolio Managers & Financial Experts,"[""investment planning"", ""portfolio management"", ""financial modeling""]",50,8,2025-10-25 21:54:03,en,What are the seasonal patterns in {keyword}?,0.88,1.0,0.49
41200365,social media,marketing,How do you track and analyze social media performance?,planning,Intermediate,"[""Overview of social media"", ""Step-by-step implementation"", ""Best practices and tips"", ""Common challenges and solutions"", ""Tools and resources needed"", ""Conclusion and next steps""]","[""planning"", ""media"", ""promotion"", ""marketing"", ""social"", ""advertising""]",6,Marketing Coordinators & Specialists,"[""digital marketing"", ""content marketing"", ""brand management""]",54,9,2025-10-25 21:54:03,en,How do you track and analyze {keyword} performance?,0.77,0.6169003103313281,0.73
41200366,content marketing,marketing,What emerging platforms support content marketing?,optimization,Intermediate,"[""Introduction to content marketing"", ""Key points and analysis"", ""Practical examples"", ""Expert insights"", ""Action items"", ""Conclusion""]","[""content"", ""promotion"", ""marketing"", ""branding"", ""optimization""]",4,Marketing Coordinators & Specialists,"[""digital marketing"", ""social media"", ""brand management""]",50,6,2025-10-25 21:54:03,en,What emerging platforms support {keyword}?,0.69,0.7505499143044871,0.37
41200367,data science,it,How do you choose the right technology stack for data science?,implementation,Expert,"[""Overview of data science"", ""Step-by-step implementation"", ""Best practices and tips"", ""Common challenges and solutions"", ""Tools and resources needed"", ""Conclusion and next steps""]","[""software"", ""development"", ""it"", ""implementation"", ""science"", ""data""]",6,Architects & Technical Directors,"[""machine learning"", ""cybersecurity"", ""cloud computing"", ""web development""]",62,11,2025-10-25 21:54:03,en,How do you choose the right technology stack for {keyword}?,0.85,1.0,0.65
41200368,web development,it,How do you troubleshoot common issues with web development?,troubleshooting,Beginner,"[""Overview of web development"", ""Step-by-step implementation"", ""Best practices and tips"", ""Common challenges and solutions"", ""Tools and resources needed"", ""Conclusion and next steps""]","[""development"", ""it"", ""programming"", ""troubleshooting"", ""web""]",6,Students & Entry-level Developers,"[""machine learning"", ""data science"", ""cloud computing"", ""cybersecurity""]",59,9,2025-10-25 21:54:03,en,How do you troubleshoot common issues with {keyword}?,0.69,0.4444514036205211,0.66
41200369,cybersecurity,it,How do you design a scalable cybersecurity solution?,optimization,Expert,"[""Overview of cybersecurity"", ""Step-by-step implementation"", ""Best practices and tips"", ""Common challenges and solutions"", ""Tools and resources needed"", ""Conclusion and next steps""]","[""it"", ""programming"", ""optimization"", ""cybersecurity"", ""technology""]",5,Architects & Technical Directors,"[""machine learning"", ""cloud computing"", ""web development"", ""data science""]",52,8,2025-10-25 21:54:03,en,How do you design a scalable {keyword} solution?,0.85,1.0,0.59
41200370,digital marketing,marketing,How do you attribute success to digital marketing efforts?,implementation,Beginner,"[""Overview of digital marketing"", ""Step-by-step implementation"", ""Best practices and tips"", ""Common challenges and solutions"", ""Tools and resources needed"", ""Conclusion and next steps""]","[""implementation"", ""marketing"", ""branding"", ""digital""]",6,Marketing Students & Interns,"[""social media"", ""brand management"", ""content marketing""]",58,9,2025-10-25 21:54:03,en,How do you attribute success to {keyword} efforts?,0.76,0.3585114360555469,0.81
41200371,brand management,marketing,What KPIs are most important for brand management?,evaluation,Intermediate,"[""Introduction to brand management"", ""Key points and analysis"", ""Practical examples"", ""Expert insights"", ""Action items"", ""Conclusion""]","[""promotion"", ""marketing"", ""management"", ""digital"", ""evaluation"", ""brand""]",4,Marketing Coordinators & Specialists,"[""digital marketing"", ""social media"", ""content marketing""]",50,8,2025-10-25 21:54:03,en,What KPIs are most important for {keyword}?,0.78,0.7531594241356595,0.68
41200372,brand management,marketing,What emerging platforms support brand management?,troubleshooting,Expert,"[""Introduction to brand management"", ""Key points and analysis"", ""Practical examples"", ""Expert insights"", ""Action items"", ""Conclusion""]","[""promotion"", ""troubleshooting"", ""marketing"", ""management"", ""advertising"", ""brand""]",4,Marketing Directors & CMOs,"[""social media"", ""content marketing"", ""digital marketing""]",49,6,2025-10-25 21:54:03,en,What emerging platforms support {keyword}?,0.72,1.0,0.68
41200373,content marketing,marketing,What demographics respond best to content marketing?,analysis,Beginner,"[""Introduction to content marketing"", ""Key points and analysis"", ""Practical examples"", ""Expert insights"", ""Action items"", ""Conclusion""]","[""content"", ""analysis"", ""marketing"", ""digital"", ""branding""]",4,Marketing Students & Interns,"[""social media"", ""digital marketing"", ""brand management""]",52,7,2025-10-25 21:54:03,en,What demographics respond best to {keyword}?,0.72,0.37820638125869704,0.66
41200374,digital marketing,marketing,How do you personalize digital marketing for different segments?,optimization,Beginner,"[""Overview of digital marketing"", ""Step-by-step implementation"", ""Best practices and tips"", ""Common challenges and solutions"", ""Tools and resources needed"", ""Conclusion and next steps""]","[""branding"", ""marketing"", ""optimization"", ""digital""]",6,Marketing Students & Interns,"[""social media"", ""brand management"", ""content marketing""]",64,9,2025-10-25 21:54:03,en,How do you personalize {keyword} for different segments?,0.88,0.4583047263183264,0.57
41200375,market analysis,economics,What are the seasonal patterns in market analysis?,analysis,Expert,"[""Introduction to market analysis"", ""Key concepts and definitions"", ""Main categories or types"", ""Examples and case studies"", ""Benefits and advantages"", ""Summary and recommendations""]","[""investment"", ""analysis"", ""market"", ""business"", ""economics""]",6,Portfolio Managers & Financial Experts,"[""financial modeling"", ""portfolio management"", ""investment planning""]",50,8,2025-10-25 21:54:03,en,What are the seasonal patterns in {keyword}?,0.95,1.0,0.52
41200376,social media,marketing,How do you automate social media processes?,how_to,Expert,"[""Overview of social media"", ""Step-by-step implementation"", ""Best practices and tips"", ""Common challenges and solutions"", ""Tools and resources needed"", ""Conclusion and next steps""]","[""how_to"", ""media"", ""marketing"", ""digital"", ""social"", ""advertising""]",6,Marketing Directors & CMOs,"[""digital marketing"", ""content marketing"", ""brand management""]",43,7,2025-10-25 21:54:03,en,How do you automate {keyword} processes?,0.81,1.0,0.48
41200377,machine learning,it,How do you integrate machine learning with existing systems?,analysis,Expert,"[""Overview of machine learning"", ""Step-by-step implementation"", ""Best practices and tips"", ""Common challenges and solutions"", ""Tools and resources needed"", ""Conclusion and next steps""]","[""analysis"", ""it"", ""development"", ""learning"", ""machine"", ""technology""]",6,Architects & Technical Directors,"[""web development"", ""cloud computing"", ""data science"", ""cybersecurity""]",60,9,2025-10-25 21:54:03,en,How do you integrate {keyword} with existing systems?,0.69,1.0,0.42
41200378,market analysis,economics,What exit strategies should be considered for market analysis?,evaluation,Intermediate,"[""Introduction to market analysis"", ""Key points and analysis"", ""Practical examples"", ""Expert insights"", ""Action items"", ""Conclusion""]","[""finance"", ""analysis"", ""evaluation"", ""market"", ""economics""]",4,Individual Investors & Analysts,"[""financial modeling"", ""portfolio management"", ""investment planning""]",62,9,2025-10-25 21:54:03,en,What exit strategies should be considered for {keyword}?,0.87,0.6648077579467627,0.89
41200379,market analysis,economics,How do you protect your market analysis investments?,troubleshooting,Intermediate,"[""Overview of market analysis"", ""Step-by-step implementation"", ""Best practices and tips"", ""Common challenges and solutions"", ""Tools and resources needed"", ""Conclusion and next steps""]","[""investment"", ""analysis"", ""finance"", ""troubleshooting"", ""market"", ""economics""]",6,Individual Investors & Analysts,"[""financial modeling"", ""portfolio management"", ""investment planning""]",52,8,2025-10-25 21:54:03,en,How do you protect your {keyword} investments?,0.83,0.6252802904688907,0.63
41200380,web development,it,How do you troubleshoot common issues with web development?,best_practice,Beginner,"[""Overview of web development"", ""Step-by-step implementation"", ""Best practices and tips"", ""Common challenges and solutions"", ""Tools and resources needed"", ""Conclusion and next steps""]","[""development"", ""it"", ""programming"", ""best_practice"", ""web""]",6,Students & Entry-level Developers,"[""cloud computing"", ""machine learning"", ""cybersecurity"", ""data science""]",59,9,2025-10-25 21:54:03,en,How do you troubleshoot common issues with {keyword}?,0.8,0.4249897596059782,0.4
41200381,financial modeling,economics,How do you report on financial modeling performance to stakeholders?,comparison,Intermediate,"[""Overview of financial modeling"", ""Step-by-step implementation"", ""Best practices and tips"", ""Common challenges and solutions"", ""Tools and resources needed"", ""Conclusion and next steps""]","[""comparison"", ""modeling"", ""financial"", ""market"", ""business"", ""economics""]",6,Individual Investors & Analysts,"[""investment planning"", ""market analysis"", ""portfolio management""]",68,10,2025-10-25 21:54:03,en,How do you report on {keyword} performance to stakeholders?,0.68,0.6046574978898682,0.37
41200382,brand management,marketing,How do you improve brand management conversion rates?,planning,Expert,"[""Overview of brand management"", ""Step-by-step implementation"", ""Best practices and tips"", ""Common challenges and solutions"", ""Tools and resources needed"", ""Conclusion and next steps""]","[""planning"", ""promotion"", ""marketing"", ""management"", ""advertising"", ""brand""]",6,Marketing Directors & CMOs,"[""social media"", ""digital marketing"", ""content marketing""]",53,8,2025-10-25 21:54:03,en,How do you improve {keyword} conversion rates?,0.75,1.0,0.82
41200383,machine learning,it,What skills are needed to master machine learning?,implementation,Intermediate,"[""Introduction to machine learning"", ""Key points and analysis"", ""Practical examples"", ""Expert insights"", ""Action items"", ""Conclusion""]","[""software"", ""it"", ""implementation"", ""learning"", ""machine"", ""technology""]",4,Junior to Mid-level Developers,"[""cloud computing"", ""web development"", ""data science"", ""cybersecurity""]",50,8,2025-10-25 21:54:03,en,What skills are needed to master {keyword}?,0.86,0.72215371255057,0.31
41200384,investment planning,economics,How does global economics impact investment planning?,planning,Expert,"[""Introduction to investment planning"", ""Key points and analysis"", ""Practical examples"", ""Expert insights"", ""Action items"", ""Conclusion""]","[""investment"", ""planning"", ""finance"", ""market"", ""economics""]",4,Portfolio Managers & Financial Experts,"[""financial modeling"", ""portfolio management"", ""market analysis""]",53,7,2025-10-25 21:54:03,en,How does global economics impact {keyword}?,0.7,1.0,0.43
41200385,cybersecurity,it,What skills are needed to master cybersecurity?,evaluation,Advanced,"[""Introduction to cybersecurity"", ""Key points and analysis"", ""Practical examples"", ""Expert insights"", ""Action items"", ""Conclusion""]","[""software"", ""development"", ""it"", ""evaluation"", ""cybersecurity""]",4,Senior Developers & Tech Leads,"[""cloud computing"", ""web development"", ""data science"", ""machine learning""]",47,7,2025-10-25 21:54:03,en,What skills are needed to master {keyword}?,0.7,0.9884019467115699,0.41
41200386,web development,it,Which frameworks support web development implementation?,how_to,Intermediate,"[""Introduction to web development"", ""Key points and analysis"", ""Practical examples"", ""Expert insights"", ""Action items"", ""Conclusion""]","[""how_to"", ""software"", ""development"", ""it"", ""programming"", ""web""]",4,Junior to Mid-level Developers,"[""data science"", ""cybersecurity"", ""machine learning"", ""cloud computing""]",56,6,2025-10-25 21:54:03,en,Which frameworks support {keyword} implementation?,0.65,0.7759864856544243,0.55
41200387,cybersecurity,it,How does cybersecurity impact business operations?,planning,Beginner,"[""Introduction to cybersecurity"", ""Key points and analysis"", ""Practical examples"", ""Expert insights"", ""Action items"", ""Conclusion""]","[""software"", ""planning"", ""development"", ""it"", ""cybersecurity""]",4,Students & Entry-level Developers,"[""data science"", ""web development"", ""machine learning"", ""cloud computing""]",50,6,2025-10-25 21:54:03,en,How does {keyword} impact business operations?,0.89,0.34821470482747996,0.51
41200388,content marketing,marketing,How do you optimize content marketing for mobile users?,evaluation,Beginner,"[""Overview of content marketing"", ""Step-by-step implementation"", ""Best practices and tips"", ""Common challenges and solutions"", ""Tools and resources needed"", ""Conclusion and next steps""]","[""content"", ""marketing"", ""digital"", ""advertising"", ""evaluation""]",6,Marketing Students & Interns,"[""social media"", ""brand management"", ""digital marketing""]",55,9,2025-10-25 21:54:03,en,How do you optimize {keyword} for mobile users?,0.91,0.4802777643841093,0.82
41200389,market analysis,economics,How does global economics impact market analysis?,troubleshooting,Intermediate,"[""Introduction to market analysis"", ""Key points and analysis"", ""Practical examples"", ""Expert insights"", ""Action items"", ""Conclusion""]","[""investment"", ""analysis"", ""troubleshooting"", ""market"", ""economics""]",4,Individual Investors & Analysts,"[""portfolio management"", ""investment planning"", ""financial modeling""]",49,7,2025-10-25 21:54:03,en,How does global economics impact {keyword}?,0.72,0.6921914910563975,0.39
41200390,cloud computing,it,What certifications are valuable for cloud computing professionals?,implementation,Intermediate,"[""Introduction to cloud computing"", ""Key points and analysis"", ""Practical examples"", ""Expert insights"", ""Action items"", ""Conclusion""]","[""computing"", ""software"", ""it"", ""implementation"", ""programming"", ""cloud""]",4,Junior to Mid-level Developers,"[""data science"", ""machine learning"", ""cybersecurity"", ""web development""]",67,8,2025-10-25 21:54:03,en,What certifications are valuable for {keyword} professionals?,0.76,0.6423926963985249,0.3
41200391,investment planning,economics,How do you diversify your portfolio using investment planning?,optimization,Intermediate,"[""Overview of investment planning"", ""Step-by-step implementation"", ""Best practices and tips"", ""Common challenges and solutions"", ""Tools and resources needed"", ""Conclusion and next steps""]","[""investment"", ""planning"", ""business"", ""market"", ""optimization"", ""economics""]",6,Individual Investors & Analysts,"[""market analysis"", ""financial modeling"", ""portfolio management""]",62,9,2025-10-25 21:54:03,en,How do you diversify your portfolio using {keyword}?,0.9,0.7620420279578928,0.53
