record_id,keyword,category,question,question_type,difficulty_level,answer_outline,tags,estimated_read_time,target_audience,related_topics,question_length,word_count,created_date,language,source_template,engagement_score,complexity_score,popularity_score
30300001,market analysis,economics,How do you analyze market trends in market analysis?,optimization,Intermediate,"[""Overview of market analysis"", ""Step-by-step implementation"", ""Best practices and tips"", ""Common challenges and solutions"", ""Tools and resources needed"", ""Conclusion and next steps""]","[""analysis"", ""business"", ""market"", ""optimization"", ""economics""]",6,Individual Investors & Analysts,"[""portfolio management"", ""investment planning"", ""financial modeling""]",52,9,2025-10-25 21:38:46,en,How do you analyze market trends in {keyword}?,0.68,0.6639388050265598,0.57
30300002,investment planning,economics,What indicators predict investment planning market movements?,how_to,Advanced,"[""Introduction to investment planning"", ""Key points and analysis"", ""Practical examples"", ""Expert insights"", ""Action items"", ""Conclusion""]","[""investment"", ""how_to"", ""planning"", ""finance"", ""market"", ""economics""]",4,Professional Investors & Advisors,"[""market analysis"", ""financial modeling"", ""portfolio management""]",61,7,2025-10-25 21:38:46,en,What indicators predict {keyword} market movements?,0.85,0.881008330473526,0.89
30300003,machine learning,it,What career opportunities exist in machine learning?,planning,Advanced,"[""Introduction to machine learning"", ""Key points and analysis"", ""Practical examples"", ""Expert insights"", ""Action items"", ""Conclusion""]","[""software"", ""planning"", ""it"", ""learning"", ""machine"", ""technology""]",4,Senior Developers & Tech Leads,"[""cybersecurity"", ""data science"", ""cloud computing"", ""web development""]",52,7,2025-10-25 21:38:46,en,What career opportunities exist in {keyword}?,0.63,0.9042645626466668,0.65
30300004,digital marketing,marketing,What channels are most effective for digital marketing?,troubleshooting,Expert,"[""Introduction to digital marketing"", ""Key points and analysis"", ""Practical examples"", ""Expert insights"", ""Action items"", ""Conclusion""]","[""promotion"", ""troubleshooting"", ""marketing"", ""digital"", ""branding""]",4,Marketing Directors & CMOs,"[""brand management"", ""content marketing"", ""social media""]",55,8,2025-10-25 21:38:46,en,What channels are most effective for {keyword}?,0.81,1.0,0.86
30300005,web development,it,What certifications are valuable for web development professionals?,troubleshooting,Beginner,"[""Introduction to web development"", ""Key points and analysis"", ""Practical examples"", ""Expert insights"", ""Action items"", ""Conclusion""]","[""software"", ""development"", ""it"", ""programming"", ""troubleshooting"", ""web""]",4,Students & Entry-level Developers,"[""cloud computing"", ""data science"", ""machine learning"", ""cybersecurity""]",67,8,2025-10-25 21:38:46,en,What certifications are valuable for {keyword} professionals?,0.9,0.44663687608481384,0.52
30300006,financial modeling,economics,What indicators predict financial modeling market movements?,analysis,Intermediate,"[""Introduction to financial modeling"", ""Key points and analysis"", ""Practical examples"", ""Expert insights"", ""Action items"", ""Conclusion""]","[""investment"", ""analysis"", ""modeling"", ""financial"", ""market"", ""economics""]",4,Individual Investors & Analysts,"[""market analysis"", ""investment planning"", ""portfolio management""]",60,7,2025-10-25 21:38:46,en,What indicators predict {keyword} market movements?,0.85,0.7535521235111777,0.5
30300007,content marketing,marketing,How do you automate content marketing processes?,troubleshooting,Beginner,"[""Overview of content marketing"", ""Step-by-step implementation"", ""Best practices and tips"", ""Common challenges and solutions"", ""Tools and resources needed"", ""Conclusion and next steps""]","[""content"", ""promotion"", ""troubleshooting"", ""marketing"", ""advertising""]",6,Marketing Students & Interns,"[""digital marketing"", ""social media"", ""brand management""]",48,7,2025-10-25 21:38:46,en,How do you automate {keyword} processes?,0.63,0.4941298470895501,0.64
30300008,social media,marketing,How do you develop an effective social media strategy?,troubleshooting,Beginner,"[""Overview of social media"", ""Step-by-step implementation"", ""Best practices and tips"", ""Common challenges and solutions"", ""Tools and resources needed"", ""Conclusion and next steps""]","[""media"", ""promotion"", ""troubleshooting"", ""marketing"", ""social"", ""advertising""]",6,Marketing Students & Interns,"[""content marketing"", ""digital marketing"", ""brand management""]",54,9,2025-10-25 21:38:46,en,How do you develop an effective {keyword} strategy?,0.89,0.3300632940725864,0.42
30300009,brand management,marketing,What budget should be allocated to brand management?,implementation,Advanced,"[""Introduction to brand management"", ""Key points and analysis"", ""Practical examples"", ""Expert insights"", ""Action items"", ""Conclusion""]","[""implementation"", ""promotion"", ""marketing"", ""management"", ""branding"", ""brand""]",4,Marketing Managers & Strategists,"[""content marketing"", ""social media"", ""digital marketing""]",52,8,2025-10-25 21:38:46,en,What budget should be allocated to {keyword}?,0.6,0.9105253280913226,0.32
30300010,brand management,marketing,How is AI changing brand management approaches?,evaluation,Advanced,"[""Introduction to brand management"", ""Key points and analysis"", ""Practical examples"", ""Expert insights"", ""Action items"", ""Conclusion""]","[""promotion"", ""marketing"", ""management"", ""branding"", ""evaluation"", ""brand""]",4,Marketing Managers & Strategists,"[""content marketing"", ""digital marketing"", ""social media""]",47,7,2025-10-25 21:38:46,en,How is AI changing {keyword} approaches?,0.73,0.9259779943349664,0.74
30300011,social media,marketing,How do you personalize social media for different segments?,optimization,Expert,"[""Overview of social media"", ""Step-by-step implementation"", ""Best practices and tips"", ""Common challenges and solutions"", ""Tools and resources needed"", ""Conclusion and next steps""]","[""media"", ""promotion"", ""digital"", ""marketing"", ""social"", ""optimization""]",6,Marketing Directors & CMOs,"[""content marketing"", ""brand management"", ""digital marketing""]",59,9,2025-10-25 21:38:46,en,How do you personalize {keyword} for different segments?,0.87,1.0,0.76
30300012,market analysis,economics,How do you hedge against market analysis market downturns?,best_practice,Expert,"[""Overview of market analysis"", ""Step-by-step implementation"", ""Best practices and tips"", ""Common challenges and solutions"", ""Tools and resources needed"", ""Conclusion and next steps""]","[""finance"", ""analysis"", ""best_practice"", ""market"", ""business"", ""economics""]",6,Portfolio Managers & Financial Experts,"[""investment planning"", ""financial modeling"", ""portfolio management""]",58,9,2025-10-25 21:38:46,en,How do you hedge against {keyword} market downturns?,0.79,1.0,0.81
30300013,market analysis,economics,How do you adjust your market analysis strategy during volatility?,strategy,Advanced,"[""Overview of market analysis"", ""Step-by-step implementation"", ""Best practices and tips"", ""Common challenges and solutions"", ""Tools and resources needed"", ""Conclusion and next steps""]","[""investment"", ""analysis"", ""market"", ""strategy"", ""economics""]",6,Professional Investors & Advisors,"[""portfolio management"", ""investment planning"", ""financial modeling""]",66,10,2025-10-25 21:38:46,en,How do you adjust your {keyword} strategy during volatility?,0.69,0.9079085668846187,0.34
30300014,web development,it,How can web development improve system performance and scalability?,evaluation,Intermediate,"[""Introduction to web development"", ""Key points and analysis"", ""Practical examples"", ""Expert insights"", ""Action items"", ""Conclusion""]","[""development"", ""web"", ""it"", ""evaluation"", ""technology""]",4,Junior to Mid-level Developers,"[""machine learning"", ""data science"", ""cloud computing"", ""cybersecurity""]",67,9,2025-10-25 21:38:46,en,How can {keyword} improve system performance and scalability?,0.75,0.7816267348547243,0.78
30300015,content marketing,marketing,What are the latest trends in content marketing?,comparison,Intermediate,"[""Introduction to content marketing"", ""Key concepts and definitions"", ""Main categories or types"", ""Examples and case studies"", ""Benefits and advantages"", ""Summary and recommendations""]","[""content"", ""promotion"", ""comparison"", ""marketing"", ""advertising""]",6,Marketing Coordinators & Specialists,"[""digital marketing"", ""social media"", ""brand management""]",48,8,2025-10-25 21:38:46,en,What are the latest trends in {keyword}?,0.91,0.6409248288047015,0.52
30300016,brand management,marketing,How do you innovate within brand management?,strategy,Intermediate,"[""Overview of brand management"", ""Step-by-step implementation"", ""Best practices and tips"", ""Common challenges and solutions"", ""Tools and resources needed"", ""Conclusion and next steps""]","[""promotion"", ""digital"", ""marketing"", ""management"", ""strategy"", ""brand""]",6,Marketing Coordinators & Specialists,"[""social media"", ""content marketing"", ""digital marketing""]",44,7,2025-10-25 21:38:46,en,How do you innovate within {keyword}?,0.82,0.6135995771059416,0.75
30300017,web development,it,What certifications are valuable for web development professionals?,analysis,Intermediate,"[""Introduction to web development"", ""Key points and analysis"", ""Practical examples"", ""Expert insights"", ""Action items"", ""Conclusion""]","[""development"", ""analysis"", ""it"", ""programming"", ""web""]",4,Junior to Mid-level Developers,"[""cybersecurity"", ""data science"", ""machine learning"", ""cloud computing""]",67,8,2025-10-25 21:38:46,en,What certifications are valuable for {keyword} professionals?,0.74,0.6331728529610348,0.53
30300018,portfolio management,economics,What strategies work best for portfolio management investment?,implementation,Beginner,"[""Introduction to portfolio management"", ""Key points and analysis"", ""Practical examples"", ""Expert insights"", ""Action items"", ""Conclusion""]","[""finance"", ""implementation"", ""portfolio"", ""management"", ""market"", ""economics""]",4,Students & New Investors,"[""investment planning"", ""market analysis"", ""financial modeling""]",62,8,2025-10-25 21:38:46,en,What strategies work best for {keyword} investment?,0.93,0.41241761793813386,0.55
30300019,machine learning,it,What are the latest trends in machine learning technology?,best_practice,Advanced,"[""Introduction to machine learning"", ""Key concepts and definitions"", ""Main categories or types"", ""Examples and case studies"", ""Benefits and advantages"", ""Summary and recommendations""]","[""software"", ""it"", ""best_practice"", ""learning"", ""machine"", ""technology""]",6,Senior Developers & Tech Leads,"[""web development"", ""cybersecurity"", ""data science"", ""cloud computing""]",58,9,2025-10-25 21:38:46,en,What are the latest trends in {keyword} technology?,0.64,0.8396167882342865,0.74
30300020,content marketing,marketing,How is AI changing content marketing approaches?,comparison,Beginner,"[""Introduction to content marketing"", ""Key points and analysis"", ""Practical examples"", ""Expert insights"", ""Action items"", ""Conclusion""]","[""content"", ""promotion"", ""comparison"", ""marketing"", ""branding""]",4,Marketing Students & Interns,"[""digital marketing"", ""social media"", ""brand management""]",48,7,2025-10-25 21:38:46,en,How is AI changing {keyword} approaches?,0.86,0.3714443690960568,0.51
30300021,portfolio management,economics,How do you benchmark portfolio management against alternatives?,optimization,Advanced,"[""Overview of portfolio management"", ""Step-by-step implementation"", ""Best practices and tips"", ""Common challenges and solutions"", ""Tools and resources needed"", ""Conclusion and next steps""]","[""investment"", ""portfolio"", ""management"", ""market"", ""optimization"", ""economics""]",6,Professional Investors & Advisors,"[""market analysis"", ""financial modeling"", ""investment planning""]",63,8,2025-10-25 21:38:46,en,How do you benchmark {keyword} against alternatives?,0.89,0.8509882916176755,0.81
30300022,financial modeling,economics,How do economic conditions affect financial modeling performance?,strategy,Advanced,"[""Introduction to financial modeling"", ""Key points and analysis"", ""Practical examples"", ""Expert insights"", ""Action items"", ""Conclusion""]","[""modeling"", ""financial"", ""business"", ""market"", ""strategy"", ""economics""]",4,Professional Investors & Advisors,"[""market analysis"", ""portfolio management"", ""investment planning""]",65,8,2025-10-25 21:38:46,en,How do economic conditions affect {keyword} performance?,0.9,0.8754108049438281,0.64
30300023,portfolio management,economics,What tools help analyze portfolio management data?,planning,Advanced,"[""Introduction to portfolio management"", ""Key points and analysis"", ""Practical examples"", ""Expert insights"", ""Action items"", ""Conclusion""]","[""planning"", ""finance"", ""portfolio"", ""management"", ""business"", ""economics""]",4,Professional Investors & Advisors,"[""market analysis"", ""investment planning"", ""financial modeling""]",50,7,2025-10-25 21:38:46,en,What tools help analyze {keyword} data?,0.65,0.9536557182442664,0.6
30300024,content marketing,marketing,How do you innovate within content marketing?,strategy,Expert,"[""Overview of content marketing"", ""Step-by-step implementation"", ""Best practices and tips"", ""Common challenges and solutions"", ""Tools and resources needed"", ""Conclusion and next steps""]","[""content"", ""marketing"", ""digital"", ""advertising"", ""strategy""]",6,Marketing Directors & CMOs,"[""social media"", ""digital marketing"", ""brand management""]",45,7,2025-10-25 21:38:46,en,How do you innovate within {keyword}?,0.85,1.0,0.89
30300025,cloud computing,it,How do you integrate cloud computing with existing systems?,optimization,Beginner,"[""Overview of cloud computing"", ""Step-by-step implementation"", ""Best practices and tips"", ""Common challenges and solutions"", ""Tools and resources needed"", ""Conclusion and next steps""]","[""computing"", ""cloud"", ""development"", ""it"", ""software"", ""optimization""]",6,Students & Entry-level Developers,"[""machine learning"", ""data science"", ""web development"", ""cybersecurity""]",59,9,2025-10-25 21:38:46,en,How do you integrate {keyword} with existing systems?,0.66,0.37139474426812114,0.32
30300026,cloud computing,it,What is the recommended architecture for cloud computing systems?,strategy,Beginner,"[""Introduction to cloud computing"", ""Key points and analysis"", ""Practical examples"", ""Expert insights"", ""Action items"", ""Conclusion""]","[""computing"", ""cloud"", ""development"", ""it"", ""programming"", ""strategy""]",4,Students & Entry-level Developers,"[""machine learning"", ""web development"", ""data science"", ""cybersecurity""]",65,9,2025-10-25 21:38:46,en,What is the recommended architecture for {keyword} systems?,0.76,0.4164914860986146,0.38
30300027,financial modeling,economics,How do you create a long-term plan for financial modeling?,evaluation,Advanced,"[""Overview of financial modeling"", ""Step-by-step implementation"", ""Best practices and tips"", ""Common challenges and solutions"", ""Tools and resources needed"", ""Conclusion and next steps""]","[""modeling"", ""financial"", ""evaluation"", ""market"", ""business"", ""economics""]",6,Professional Investors & Advisors,"[""portfolio management"", ""investment planning"", ""market analysis""]",58,10,2025-10-25 21:38:46,en,How do you create a long-term plan for {keyword}?,0.72,0.9104009012209002,0.49
30300028,content marketing,marketing,How do you reach new customers through content marketing?,troubleshooting,Expert,"[""Overview of content marketing"", ""Step-by-step implementation"", ""Best practices and tips"", ""Common challenges and solutions"", ""Tools and resources needed"", ""Conclusion and next steps""]","[""content"", ""troubleshooting"", ""marketing"", ""advertising"", ""branding""]",6,Marketing Directors & CMOs,"[""social media"", ""digital marketing"", ""brand management""]",57,9,2025-10-25 21:38:46,en,How do you reach new customers through {keyword}?,0.6,1.0,0.42
30300029,social media,marketing,How do you measure the ROI of social media campaigns?,strategy,Intermediate,"[""Overview of social media"", ""Step-by-step implementation"", ""Best practices and tips"", ""Common challenges and solutions"", ""Tools and resources needed"", ""Conclusion and next steps""]","[""media"", ""promotion"", ""marketing"", ""digital"", ""social"", ""strategy""]",6,Marketing Coordinators & Specialists,"[""digital marketing"", ""content marketing"", ""brand management""]",53,10,2025-10-25 21:38:46,en,How do you measure the ROI of {keyword} campaigns?,0.71,0.7466652811075266,0.59
30300030,market analysis,economics,What timeline is realistic for market analysis returns?,evaluation,Beginner,"[""Introduction to market analysis"", ""Key points and analysis"", ""Practical examples"", ""Expert insights"", ""Action items"", ""Conclusion""]","[""finance"", ""analysis"", ""evaluation"", ""market"", ""economics""]",4,Students & New Investors,"[""financial modeling"", ""portfolio management"", ""investment planning""]",55,8,2025-10-25 21:38:46,en,What timeline is realistic for {keyword} returns?,0.78,0.4014796668764647,0.69
30300031,data science,it,How do you integrate data science with existing systems?,evaluation,Expert,"[""Overview of data science"", ""Step-by-step implementation"", ""Best practices and tips"", ""Common challenges and solutions"", ""Tools and resources needed"", ""Conclusion and next steps""]","[""software"", ""development"", ""it"", ""science"", ""evaluation"", ""data""]",6,Architects & Technical Directors,"[""cybersecurity"", ""web development"", ""cloud computing"", ""machine learning""]",56,9,2025-10-25 21:38:46,en,How do you integrate {keyword} with existing systems?,0.78,1.0,0.83
30300032,digital marketing,marketing,How do you measure the ROI of digital marketing campaigns?,evaluation,Intermediate,"[""Overview of digital marketing"", ""Step-by-step implementation"", ""Best practices and tips"", ""Common challenges and solutions"", ""Tools and resources needed"", ""Conclusion and next steps""]","[""evaluation"", ""marketing"", ""promotion"", ""digital""]",6,Marketing Coordinators & Specialists,"[""brand management"", ""content marketing"", ""social media""]",58,10,2025-10-25 21:38:46,en,How do you measure the ROI of {keyword} campaigns?,0.77,0.7405137475153967,0.48
30300033,financial modeling,economics,How do you report on financial modeling performance to stakeholders?,planning,Advanced,"[""Overview of financial modeling"", ""Step-by-step implementation"", ""Best practices and tips"", ""Common challenges and solutions"", ""Tools and resources needed"", ""Conclusion and next steps""]","[""investment"", ""planning"", ""finance"", ""modeling"", ""financial"", ""economics""]",6,Professional Investors & Advisors,"[""investment planning"", ""portfolio management"", ""market analysis""]",68,10,2025-10-25 21:38:46,en,How do you report on {keyword} performance to stakeholders?,0.93,0.8168157755881854,0.75
30300034,web development,it,What ROI can be expected from web development implementation?,implementation,Advanced,"[""Introduction to web development"", ""Key points and analysis"", ""Practical examples"", ""Expert insights"", ""Action items"", ""Conclusion""]","[""software"", ""development"", ""it"", ""implementation"", ""programming"", ""web""]",4,Senior Developers & Tech Leads,"[""cybersecurity"", ""cloud computing"", ""machine learning"", ""data science""]",61,9,2025-10-25 21:38:46,en,What ROI can be expected from {keyword} implementation?,0.61,0.8353930731476207,0.81
30300035,brand management,marketing,How do you reach new customers through brand management?,strategy,Expert,"[""Overview of brand management"", ""Step-by-step implementation"", ""Best practices and tips"", ""Common challenges and solutions"", ""Tools and resources needed"", ""Conclusion and next steps""]","[""promotion"", ""marketing"", ""management"", ""branding"", ""strategy"", ""brand""]",6,Marketing Directors & CMOs,"[""digital marketing"", ""content marketing"", ""social media""]",56,9,2025-10-25 21:38:46,en,How do you reach new customers through {keyword}?,0.89,1.0,0.43
30300036,machine learning,it,What design patterns work best with machine learning?,comparison,Beginner,"[""Introduction to machine learning"", ""Key points and analysis"", ""Practical examples"", ""Expert insights"", ""Action items"", ""Conclusion""]","[""software"", ""it"", ""comparison"", ""learning"", ""machine"", ""technology""]",4,Students & Entry-level Developers,"[""data science"", ""web development"", ""cloud computing"", ""cybersecurity""]",53,8,2025-10-25 21:38:46,en,What design patterns work best with {keyword}?,0.66,0.4821879695489266,0.36
30300037,financial modeling,economics,What are the risks associated with financial modeling?,comparison,Advanced,"[""Introduction to financial modeling"", ""Key concepts and definitions"", ""Main categories or types"", ""Examples and case studies"", ""Benefits and advantages"", ""Summary and recommendations""]","[""finance"", ""comparison"", ""modeling"", ""financial"", ""market"", ""economics""]",6,Professional Investors & Advisors,"[""market analysis"", ""investment planning"", ""portfolio management""]",54,8,2025-10-25 21:38:46,en,What are the risks associated with {keyword}?,0.95,0.962796868911968,0.47
30300038,machine learning,it,Which frameworks support machine learning implementation?,implementation,Beginner,"[""Introduction to machine learning"", ""Key points and analysis"", ""Practical examples"", ""Expert insights"", ""Action items"", ""Conclusion""]","[""development"", ""it"", ""implementation"", ""learning"", ""machine"", ""technology""]",4,Students & Entry-level Developers,"[""cybersecurity"", ""data science"", ""cloud computing"", ""web development""]",57,6,2025-10-25 21:38:46,en,Which frameworks support {keyword} implementation?,0.9,0.40801802583476915,0.5
30300039,brand management,marketing,What messaging works best in brand management campaigns?,strategy,Expert,"[""Introduction to brand management"", ""Key points and analysis"", ""Practical examples"", ""Expert insights"", ""Action items"", ""Conclusion""]","[""marketing"", ""management"", ""advertising"", ""branding"", ""strategy"", ""brand""]",4,Marketing Directors & CMOs,"[""social media"", ""content marketing"", ""digital marketing""]",56,8,2025-10-25 21:38:46,en,What messaging works best in {keyword} campaigns?,0.88,1.0,0.7
30300040,market analysis,economics,What is the optimal allocation for market analysis in a portfolio?,analysis,Intermediate,"[""Introduction to market analysis"", ""Key points and analysis"", ""Practical examples"", ""Expert insights"", ""Action items"", ""Conclusion""]","[""investment"", ""finance"", ""analysis"", ""market"", ""economics""]",4,Individual Investors & Analysts,"[""portfolio management"", ""financial modeling"", ""investment planning""]",66,11,2025-10-25 21:38:46,en,What is the optimal allocation for {keyword} in a portfolio?,0.63,0.7946741829030848,0.63
30300041,investment planning,economics,What are the risks associated with investment planning?,optimization,Expert,"[""Introduction to investment planning"", ""Key concepts and definitions"", ""Main categories or types"", ""Examples and case studies"", ""Benefits and advantages"", ""Summary and recommendations""]","[""investment"", ""planning"", ""market"", ""optimization"", ""economics""]",6,Portfolio Managers & Financial Experts,"[""market analysis"", ""portfolio management"", ""financial modeling""]",55,8,2025-10-25 21:38:46,en,What are the risks associated with {keyword}?,0.88,1.0,0.57
30300042,social media,marketing,What timing strategies work for social media?,comparison,Beginner,"[""Introduction to social media"", ""Key points and analysis"", ""Practical examples"", ""Expert insights"", ""Action items"", ""Conclusion""]","[""media"", ""promotion"", ""comparison"", ""marketing"", ""social"", ""advertising""]",4,Marketing Students & Interns,"[""digital marketing"", ""brand management"", ""content marketing""]",45,7,2025-10-25 21:38:46,en,What timing strategies work for {keyword}?,0.8,0.36694166339654255,0.56
30300043,data science,it,How do you design a scalable data science solution?,troubleshooting,Intermediate,"[""Overview of data science"", ""Step-by-step implementation"", ""Best practices and tips"", ""Common challenges and solutions"", ""Tools and resources needed"", ""Conclusion and next steps""]","[""technology"", ""it"", ""programming"", ""troubleshooting"", ""science"", ""data""]",6,Junior to Mid-level Developers,"[""cybersecurity"", ""cloud computing"", ""web development"", ""machine learning""]",51,9,2025-10-25 21:38:46,en,How do you design a scalable {keyword} solution?,0.81,0.7318497726440771,0.84
30300044,investment planning,economics,What insurance options are available for investment planning?,evaluation,Expert,"[""Introduction to investment planning"", ""Key points and analysis"", ""Practical examples"", ""Expert insights"", ""Action items"", ""Conclusion""]","[""investment"", ""planning"", ""finance"", ""evaluation"", ""economics""]",4,Portfolio Managers & Financial Experts,"[""market analysis"", ""financial modeling"", ""portfolio management""]",61,8,2025-10-25 21:38:46,en,What insurance options are available for {keyword}?,0.7,1.0,0.63
