record_id,keyword,category,question,question_type,difficulty_level,answer_outline,tags,estimated_read_time,target_audience,related_topics,question_length,word_count,created_date,language,source_template,engagement_score,complexity_score,popularity_score
44600001,market analysis,economics,How do economic conditions affect market analysis performance?,analysis,Intermediate,"[""Introduction to market analysis"", ""Key points and analysis"", ""Practical examples"", ""Expert insights"", ""Action items"", ""Conclusion""]","[""investment"", ""finance"", ""analysis"", ""market"", ""economics""]",4,Individual Investors & Analysts,"[""investment planning"", ""financial modeling"", ""portfolio management""]",62,8,2025-10-25 21:58:42,en,How do economic conditions affect {keyword} performance?,0.87,0.6729340001915964,0.46
44600002,content marketing,marketing,What are the latest trends in content marketing?,planning,Advanced,"[""Introduction to content marketing"", ""Key concepts and definitions"", ""Main categories or types"", ""Examples and case studies"", ""Benefits and advantages"", ""Summary and recommendations""]","[""planning"", ""content"", ""digital"", ""marketing"", ""branding""]",6,Marketing Managers & Strategists,"[""social media"", ""brand management"", ""digital marketing""]",48,8,2025-10-25 21:58:42,en,What are the latest trends in {keyword}?,0.75,0.9524016170601891,0.38
44600003,machine learning,it,How do you choose the right technology stack for machine learning?,planning,Expert,"[""Overview of machine learning"", ""Step-by-step implementation"", ""Best practices and tips"", ""Common challenges and solutions"", ""Tools and resources needed"", ""Conclusion and next steps""]","[""planning"", ""development"", ""it"", ""learning"", ""machine"", ""technology""]",6,Architects & Technical Directors,"[""data science"", ""cloud computing"", ""web development"", ""cybersecurity""]",66,11,2025-10-25 21:58:42,en,How do you choose the right technology stack for {keyword}?,0.9,1.0,0.6
44600004,market analysis,economics,How do you hedge against market analysis market downturns?,best_practice,Beginner,"[""Overview of market analysis"", ""Step-by-step implementation"", ""Best practices and tips"", ""Common challenges and solutions"", ""Tools and resources needed"", ""Conclusion and next steps""]","[""finance"", ""analysis"", ""best_practice"", ""market"", ""economics""]",6,Students & New Investors,"[""financial modeling"", ""investment planning"", ""portfolio management""]",58,9,2025-10-25 21:58:42,en,How do you hedge against {keyword} market downturns?,0.85,0.42887086837021027,0.49
44600005,web development,it,What ROI can be expected from web development implementation?,best_practice,Expert,"[""Introduction to web development"", ""Key points and analysis"", ""Practical examples"", ""Expert insights"", ""Action items"", ""Conclusion""]","[""technology"", ""development"", ""it"", ""best_practice"", ""web""]",4,Architects & Technical Directors,"[""data science"", ""cloud computing"", ""cybersecurity"", ""machine learning""]",61,9,2025-10-25 21:58:42,en,What ROI can be expected from {keyword} implementation?,0.69,1.0,0.41
44600006,web development,it,How do you optimize web development for different platforms?,analysis,Beginner,"[""Overview of web development"", ""Step-by-step implementation"", ""Best practices and tips"", ""Common challenges and solutions"", ""Tools and resources needed"", ""Conclusion and next steps""]","[""development"", ""analysis"", ""it"", ""programming"", ""web""]",6,Students & Entry-level Developers,"[""cloud computing"", ""machine learning"", ""cybersecurity"", ""data science""]",60,9,2025-10-25 21:58:42,en,How do you optimize {keyword} for different platforms?,0.92,0.349643356203041,0.38
44600007,brand management,marketing,What emerging platforms support brand management?,evaluation,Beginner,"[""Introduction to brand management"", ""Key points and analysis"", ""Practical examples"", ""Expert insights"", ""Action items"", ""Conclusion""]","[""marketing"", ""management"", ""advertising"", ""digital"", ""evaluation"", ""brand""]",4,Marketing Students & Interns,"[""social media"", ""content marketing"", ""digital marketing""]",49,6,2025-10-25 21:58:42,en,What emerging platforms support {keyword}?,0.88,0.3191719510199412,0.46
44600008,data science,it,What security considerations should be taken when using data science?,strategy,Intermediate,"[""Introduction to data science"", ""Key points and analysis"", ""Practical examples"", ""Expert insights"", ""Action items"", ""Conclusion""]","[""development"", ""it"", ""programming"", ""science"", ""strategy"", ""data""]",4,Junior to Mid-level Developers,"[""cloud computing"", ""cybersecurity"", ""machine learning"", ""web development""]",69,10,2025-10-25 21:58:42,en,What security considerations should be taken when using {keyword}?,0.8,0.6664355280963548,0.56
44600009,machine learning,it,What certifications are valuable for machine learning professionals?,analysis,Beginner,"[""Introduction to machine learning"", ""Key points and analysis"", ""Practical examples"", ""Expert insights"", ""Action items"", ""Conclusion""]","[""software"", ""analysis"", ""it"", ""development"", ""learning"", ""machine""]",4,Students & Entry-level Developers,"[""data science"", ""cloud computing"", ""cybersecurity"", ""web development""]",68,8,2025-10-25 21:58:42,en,What certifications are valuable for {keyword} professionals?,0.61,0.4189583895737669,0.44
44600010,brand management,marketing,What are the latest trends in brand management?,best_practice,Beginner,"[""Introduction to brand management"", ""Key concepts and definitions"", ""Main categories or types"", ""Examples and case studies"", ""Benefits and advantages"", ""Summary and recommendations""]","[""promotion"", ""best_practice"", ""marketing"", ""management"", ""branding"", ""brand""]",6,Marketing Students & Interns,"[""social media"", ""digital marketing"", ""content marketing""]",47,8,2025-10-25 21:58:42,en,What are the latest trends in {keyword}?,0.77,0.41627284266863024,0.39
44600011,brand management,marketing,What content types work best for brand management?,planning,Intermediate,"[""Introduction to brand management"", ""Key points and analysis"", ""Practical examples"", ""Expert insights"", ""Action items"", ""Conclusion""]","[""planning"", ""promotion"", ""marketing"", ""management"", ""digital"", ""brand""]",4,Marketing Coordinators & Specialists,"[""digital marketing"", ""content marketing"", ""social media""]",50,8,2025-10-25 21:58:42,en,What content types work best for {keyword}?,0.61,0.6399929343157734,0.63
44600012,financial modeling,economics,How do you identify opportunities in financial modeling markets?,implementation,Expert,"[""Overview of financial modeling"", ""Step-by-step implementation"", ""Best practices and tips"", ""Common challenges and solutions"", ""Tools and resources needed"", ""Conclusion and next steps""]","[""investment"", ""implementation"", ""modeling"", ""financial"", ""business"", ""economics""]",6,Portfolio Managers & Financial Experts,"[""portfolio management"", ""market analysis"", ""investment planning""]",64,9,2025-10-25 21:58:42,en,How do you identify opportunities in {keyword} markets?,0.84,1.0,0.37
44600013,social media,marketing,What KPIs are most important for social media?,evaluation,Intermediate,"[""Introduction to social media"", ""Key points and analysis"", ""Practical examples"", ""Expert insights"", ""Action items"", ""Conclusion""]","[""media"", ""promotion"", ""marketing"", ""digital"", ""social"", ""evaluation""]",4,Marketing Coordinators & Specialists,"[""brand management"", ""digital marketing"", ""content marketing""]",46,8,2025-10-25 21:58:42,en,What KPIs are most important for {keyword}?,0.66,0.7574537795316075,0.73
44600014,web development,it,What are the latest trends in web development technology?,troubleshooting,Expert,"[""Introduction to web development"", ""Key concepts and definitions"", ""Main categories or types"", ""Examples and case studies"", ""Benefits and advantages"", ""Summary and recommendations""]","[""software"", ""development"", ""web"", ""it"", ""troubleshooting"", ""technology""]",6,Architects & Technical Directors,"[""data science"", ""machine learning"", ""cloud computing"", ""cybersecurity""]",57,9,2025-10-25 21:58:42,en,What are the latest trends in {keyword} technology?,0.68,1.0,0.38
44600015,web development,it,How do you convince stakeholders to invest in web development?,evaluation,Advanced,"[""Overview of web development"", ""Step-by-step implementation"", ""Best practices and tips"", ""Common challenges and solutions"", ""Tools and resources needed"", ""Conclusion and next steps""]","[""development"", ""web"", ""it"", ""evaluation"", ""technology""]",6,Senior Developers & Tech Leads,"[""data science"", ""machine learning"", ""cloud computing"", ""cybersecurity""]",62,10,2025-10-25 21:58:42,en,How do you convince stakeholders to invest in {keyword}?,0.85,0.8588752436410582,0.8
44600016,brand management,marketing,How do you optimize brand management for mobile users?,evaluation,Expert,"[""Overview of brand management"", ""Step-by-step implementation"", ""Best practices and tips"", ""Common challenges and solutions"", ""Tools and resources needed"", ""Conclusion and next steps""]","[""promotion"", ""marketing"", ""management"", ""branding"", ""evaluation"", ""brand""]",6,Marketing Directors & CMOs,"[""social media"", ""content marketing"", ""digital marketing""]",54,9,2025-10-25 21:58:42,en,How do you optimize {keyword} for mobile users?,0.61,1.0,0.71
44600017,machine learning,it,How does machine learning impact business operations?,evaluation,Beginner,"[""Introduction to machine learning"", ""Key points and analysis"", ""Practical examples"", ""Expert insights"", ""Action items"", ""Conclusion""]","[""it"", ""programming"", ""learning"", ""evaluation"", ""machine"", ""technology""]",4,Students & Entry-level Developers,"[""data science"", ""cybersecurity"", ""web development"", ""cloud computing""]",53,7,2025-10-25 21:58:42,en,How does {keyword} impact business operations?,0.93,0.43750817265933767,0.59
44600018,social media,marketing,What demographics respond best to social media?,comparison,Advanced,"[""Introduction to social media"", ""Key points and analysis"", ""Practical examples"", ""Expert insights"", ""Action items"", ""Conclusion""]","[""media"", ""promotion"", ""comparison"", ""marketing"", ""social"", ""advertising""]",4,Marketing Managers & Strategists,"[""brand management"", ""content marketing"", ""digital marketing""]",47,7,2025-10-25 21:58:42,en,What demographics respond best to {keyword}?,0.89,0.8699778867348634,0.33
44600019,portfolio management,economics,What are the regulatory considerations for portfolio management?,implementation,Intermediate,"[""Introduction to portfolio management"", ""Key concepts and definitions"", ""Main categories or types"", ""Examples and case studies"", ""Benefits and advantages"", ""Summary and recommendations""]","[""investment"", ""implementation"", ""portfolio"", ""management"", ""market"", ""economics""]",6,Individual Investors & Analysts,"[""financial modeling"", ""investment planning"", ""market analysis""]",64,8,2025-10-25 21:58:42,en,What are the regulatory considerations for {keyword}?,0.9,0.7194706534333754,0.49
44600020,brand management,marketing,What tools are essential for brand management analytics?,how_to,Beginner,"[""Introduction to brand management"", ""Key points and analysis"", ""Practical examples"", ""Expert insights"", ""Action items"", ""Conclusion""]","[""how_to"", ""marketing"", ""management"", ""advertising"", ""branding"", ""brand""]",4,Marketing Students & Interns,"[""social media"", ""digital marketing"", ""content marketing""]",56,8,2025-10-25 21:58:42,en,What tools are essential for {keyword} analytics?,0.74,0.3700026542969747,0.73
44600021,web development,it,What tools are essential for web development development?,best_practice,Intermediate,"[""Introduction to web development"", ""Key points and analysis"", ""Practical examples"", ""Expert insights"", ""Action items"", ""Conclusion""]","[""technology"", ""development"", ""it"", ""best_practice"", ""web""]",4,Junior to Mid-level Developers,"[""data science"", ""machine learning"", ""cloud computing"", ""cybersecurity""]",57,8,2025-10-25 21:58:42,en,What tools are essential for {keyword} development?,0.92,0.6391659696176382,0.42
44600022,market analysis,economics,How do you adjust your market analysis strategy during volatility?,strategy,Beginner,"[""Overview of market analysis"", ""Step-by-step implementation"", ""Best practices and tips"", ""Common challenges and solutions"", ""Tools and resources needed"", ""Conclusion and next steps""]","[""analysis"", ""finance"", ""business"", ""market"", ""strategy"", ""economics""]",6,Students & New Investors,"[""portfolio management"", ""financial modeling"", ""investment planning""]",66,10,2025-10-25 21:58:42,en,How do you adjust your {keyword} strategy during volatility?,0.71,0.3167124644082448,0.7
44600023,cloud computing,it,What certifications are valuable for cloud computing professionals?,how_to,Advanced,"[""Introduction to cloud computing"", ""Key points and analysis"", ""Practical examples"", ""Expert insights"", ""Action items"", ""Conclusion""]","[""computing"", ""how_to"", ""software"", ""it"", ""cloud"", ""technology""]",4,Senior Developers & Tech Leads,"[""machine learning"", ""web development"", ""cybersecurity"", ""data science""]",67,8,2025-10-25 21:58:42,en,What certifications are valuable for {keyword} professionals?,0.77,0.9596828108516606,0.66
44600024,market analysis,economics,How do you diversify your portfolio using market analysis?,optimization,Expert,"[""Overview of market analysis"", ""Step-by-step implementation"", ""Best practices and tips"", ""Common challenges and solutions"", ""Tools and resources needed"", ""Conclusion and next steps""]","[""analysis"", ""business"", ""market"", ""optimization"", ""economics""]",6,Portfolio Managers & Financial Experts,"[""investment planning"", ""portfolio management"", ""financial modeling""]",58,9,2025-10-25 21:58:42,en,How do you diversify your portfolio using {keyword}?,0.81,1.0,0.37
44600025,investment planning,economics,What are the regulatory considerations for investment planning?,analysis,Advanced,"[""Introduction to investment planning"", ""Key concepts and definitions"", ""Main categories or types"", ""Examples and case studies"", ""Benefits and advantages"", ""Summary and recommendations""]","[""investment"", ""planning"", ""analysis"", ""market"", ""business"", ""economics""]",6,Professional Investors & Advisors,"[""portfolio management"", ""financial modeling"", ""market analysis""]",63,8,2025-10-25 21:58:42,en,What are the regulatory considerations for {keyword}?,0.78,0.8786353725620463,0.45
44600026,digital marketing,marketing,How do you create a digital marketing roadmap?,evaluation,Advanced,"[""Overview of digital marketing"", ""Step-by-step implementation"", ""Best practices and tips"", ""Common challenges and solutions"", ""Tools and resources needed"", ""Conclusion and next steps""]","[""promotion"", ""marketing"", ""digital"", ""branding"", ""evaluation""]",6,Marketing Managers & Strategists,"[""brand management"", ""content marketing"", ""social media""]",46,8,2025-10-25 21:58:42,en,How do you create a {keyword} roadmap?,0.61,0.9080863600333912,0.55
44600027,market analysis,economics,What factors should be considered when evaluating market analysis?,how_to,Advanced,"[""Introduction to market analysis"", ""Key points and analysis"", ""Practical examples"", ""Expert insights"", ""Action items"", ""Conclusion""]","[""how_to"", ""analysis"", ""market"", ""business"", ""economics""]",4,Professional Investors & Advisors,"[""financial modeling"", ""investment planning"", ""portfolio management""]",66,9,2025-10-25 21:58:42,en,What factors should be considered when evaluating {keyword}?,0.75,0.9661155401524668,0.31
44600028,digital marketing,marketing,How do you track and analyze digital marketing performance?,implementation,Expert,"[""Overview of digital marketing"", ""Step-by-step implementation"", ""Best practices and tips"", ""Common challenges and solutions"", ""Tools and resources needed"", ""Conclusion and next steps""]","[""implementation"", ""promotion"", ""marketing"", ""digital"", ""advertising""]",6,Marketing Directors & CMOs,"[""brand management"", ""social media"", ""content marketing""]",59,9,2025-10-25 21:58:42,en,How do you track and analyze {keyword} performance?,0.64,1.0,0.46
44600029,investment planning,economics,How do you diversify your portfolio using investment planning?,planning,Expert,"[""Overview of investment planning"", ""Step-by-step implementation"", ""Best practices and tips"", ""Common challenges and solutions"", ""Tools and resources needed"", ""Conclusion and next steps""]","[""investment"", ""economics"", ""planning"", ""business""]",6,Portfolio Managers & Financial Experts,"[""market analysis"", ""financial modeling"", ""portfolio management""]",62,9,2025-10-25 21:58:42,en,How do you diversify your portfolio using {keyword}?,0.77,1.0,0.61
44600030,investment planning,economics,How do you benchmark investment planning against alternatives?,how_to,Beginner,"[""Overview of investment planning"", ""Step-by-step implementation"", ""Best practices and tips"", ""Common challenges and solutions"", ""Tools and resources needed"", ""Conclusion and next steps""]","[""investment"", ""how_to"", ""planning"", ""finance"", ""business"", ""economics""]",6,Students & New Investors,"[""market analysis"", ""portfolio management"", ""financial modeling""]",62,8,2025-10-25 21:58:42,en,How do you benchmark {keyword} against alternatives?,0.74,0.3258118848417376,0.37
44600031,portfolio management,economics,What timeline is realistic for portfolio management returns?,how_to,Beginner,"[""Introduction to portfolio management"", ""Key points and analysis"", ""Practical examples"", ""Expert insights"", ""Action items"", ""Conclusion""]","[""how_to"", ""portfolio"", ""management"", ""market"", ""business"", ""economics""]",4,Students & New Investors,"[""investment planning"", ""financial modeling"", ""market analysis""]",60,8,2025-10-25 21:58:42,en,What timeline is realistic for {keyword} returns?,0.75,0.3089678274144019,0.43
44600032,data science,it,How does data science impact business operations?,how_to,Expert,"[""Introduction to data science"", ""Key points and analysis"", ""Practical examples"", ""Expert insights"", ""Action items"", ""Conclusion""]","[""how_to"", ""technology"", ""it"", ""programming"", ""science"", ""data""]",4,Architects & Technical Directors,"[""web development"", ""machine learning"", ""cloud computing"", ""cybersecurity""]",49,7,2025-10-25 21:58:42,en,How does {keyword} impact business operations?,0.65,1.0,0.79
44600033,social media,marketing,How do you improve social media conversion rates?,troubleshooting,Advanced,"[""Overview of social media"", ""Step-by-step implementation"", ""Best practices and tips"", ""Common challenges and solutions"", ""Tools and resources needed"", ""Conclusion and next steps""]","[""media"", ""troubleshooting"", ""digital"", ""marketing"", ""social"", ""branding""]",6,Marketing Managers & Strategists,"[""brand management"", ""content marketing"", ""digital marketing""]",49,8,2025-10-25 21:58:42,en,How do you improve {keyword} conversion rates?,0.89,0.9752069827609152,0.66
44600034,investment planning,economics,How do you adjust your investment planning strategy during volatility?,best_practice,Beginner,"[""Overview of investment planning"", ""Step-by-step implementation"", ""Best practices and tips"", ""Common challenges and solutions"", ""Tools and resources needed"", ""Conclusion and next steps""]","[""investment"", ""planning"", ""best_practice"", ""market"", ""economics""]",6,Students & New Investors,"[""market analysis"", ""portfolio management"", ""financial modeling""]",70,10,2025-10-25 21:58:42,en,How do you adjust your {keyword} strategy during volatility?,0.95,0.45648383274679494,0.9
44600035,market analysis,economics,How do you protect your market analysis investments?,analysis,Expert,"[""Overview of market analysis"", ""Step-by-step implementation"", ""Best practices and tips"", ""Common challenges and solutions"", ""Tools and resources needed"", ""Conclusion and next steps""]","[""investment"", ""analysis"", ""market"", ""business"", ""economics""]",6,Portfolio Managers & Financial Experts,"[""portfolio management"", ""financial modeling"", ""investment planning""]",52,8,2025-10-25 21:58:42,en,How do you protect your {keyword} investments?,0.91,1.0,0.9
44600036,brand management,marketing,How do you track and analyze brand management performance?,best_practice,Beginner,"[""Overview of brand management"", ""Step-by-step implementation"", ""Best practices and tips"", ""Common challenges and solutions"", ""Tools and resources needed"", ""Conclusion and next steps""]","[""promotion"", ""best_practice"", ""marketing"", ""management"", ""branding"", ""brand""]",6,Marketing Students & Interns,"[""content marketing"", ""social media"", ""digital marketing""]",58,9,2025-10-25 21:58:42,en,How do you track and analyze {keyword} performance?,0.68,0.48084578070532064,0.33
44600037,market analysis,economics,What timeline is realistic for market analysis returns?,comparison,Advanced,"[""Introduction to market analysis"", ""Key points and analysis"", ""Practical examples"", ""Expert insights"", ""Action items"", ""Conclusion""]","[""finance"", ""analysis"", ""comparison"", ""market"", ""economics""]",4,Professional Investors & Advisors,"[""portfolio management"", ""financial modeling"", ""investment planning""]",55,8,2025-10-25 21:58:42,en,What timeline is realistic for {keyword} returns?,0.68,0.8585940433808967,0.69
44600038,financial modeling,economics,How do you report on financial modeling performance to stakeholders?,best_practice,Beginner,"[""Overview of financial modeling"", ""Step-by-step implementation"", ""Best practices and tips"", ""Common challenges and solutions"", ""Tools and resources needed"", ""Conclusion and next steps""]","[""finance"", ""best_practice"", ""modeling"", ""financial"", ""business"", ""economics""]",6,Students & New Investors,"[""investment planning"", ""market analysis"", ""portfolio management""]",68,10,2025-10-25 21:58:42,en,How do you report on {keyword} performance to stakeholders?,0.86,0.355513439585726,0.35
44600039,social media,marketing,How do you create a social media roadmap?,analysis,Expert,"[""Overview of social media"", ""Step-by-step implementation"", ""Best practices and tips"", ""Common challenges and solutions"", ""Tools and resources needed"", ""Conclusion and next steps""]","[""analysis"", ""media"", ""promotion"", ""marketing"", ""social"", ""advertising""]",6,Marketing Directors & CMOs,"[""content marketing"", ""digital marketing"", ""brand management""]",41,8,2025-10-25 21:58:42,en,How do you create a {keyword} roadmap?,0.71,1.0,0.85
44600040,portfolio management,economics,What is the optimal allocation for portfolio management in a portfolio?,best_practice,Intermediate,"[""Introduction to portfolio management"", ""Key points and analysis"", ""Practical examples"", ""Expert insights"", ""Action items"", ""Conclusion""]","[""finance"", ""portfolio"", ""best_practice"", ""management"", ""business"", ""economics""]",4,Individual Investors & Analysts,"[""market analysis"", ""investment planning"", ""financial modeling""]",71,11,2025-10-25 21:58:42,en,What is the optimal allocation for {keyword} in a portfolio?,0.84,0.647178184297496,0.39
44600041,data science,it,What are the best practices for data science development?,planning,Intermediate,"[""Introduction to data science"", ""Key concepts and definitions"", ""Main categories or types"", ""Examples and case studies"", ""Benefits and advantages"", ""Summary and recommendations""]","[""software"", ""planning"", ""it"", ""programming"", ""science"", ""data""]",6,Junior to Mid-level Developers,"[""machine learning"", ""cloud computing"", ""web development"", ""cybersecurity""]",57,9,2025-10-25 21:58:42,en,What are the best practices for {keyword} development?,0.84,0.754395799184173,0.44
44600042,financial modeling,economics,What are the risks associated with financial modeling?,how_to,Beginner,"[""Introduction to financial modeling"", ""Key concepts and definitions"", ""Main categories or types"", ""Examples and case studies"", ""Benefits and advantages"", ""Summary and recommendations""]","[""how_to"", ""finance"", ""modeling"", ""financial"", ""business"", ""economics""]",6,Students & New Investors,"[""portfolio management"", ""market analysis"", ""investment planning""]",54,8,2025-10-25 21:58:42,en,What are the risks associated with {keyword}?,0.81,0.411202368100717,0.38
44600043,brand management,marketing,How do you attribute success to brand management efforts?,strategy,Beginner,"[""Overview of brand management"", ""Step-by-step implementation"", ""Best practices and tips"", ""Common challenges and solutions"", ""Tools and resources needed"", ""Conclusion and next steps""]","[""marketing"", ""management"", ""advertising"", ""digital"", ""strategy"", ""brand""]",6,Marketing Students & Interns,"[""digital marketing"", ""content marketing"", ""social media""]",57,9,2025-10-25 21:58:42,en,How do you attribute success to {keyword} efforts?,0.94,0.35977264757527005,0.76
