record_id,keyword,category,question,question_type,difficulty_level,answer_outline,tags,estimated_read_time,target_audience,related_topics,question_length,word_count,created_date,language,source_template,engagement_score,complexity_score,popularity_score
34000959,portfolio management,economics,How do you benchmark portfolio management against alternatives?,analysis,Intermediate,"[""Overview of portfolio management"", ""Step-by-step implementation"", ""Best practices and tips"", ""Common challenges and solutions"", ""Tools and resources needed"", ""Conclusion and next steps""]","[""investment"", ""analysis"", ""portfolio"", ""management"", ""market"", ""economics""]",6,Individual Investors & Analysts,"[""market analysis"", ""financial modeling"", ""investment planning""]",63,8,2025-10-25 21:44:02,en,How do you benchmark {keyword} against alternatives?,0.75,0.6547463612171751,0.57
34000960,machine learning,it,How can machine learning improve system performance and scalability?,implementation,Expert,"[""Introduction to machine learning"", ""Key points and analysis"", ""Practical examples"", ""Expert insights"", ""Action items"", ""Conclusion""]","[""software"", ""development"", ""it"", ""implementation"", ""learning"", ""machine""]",4,Architects & Technical Directors,"[""cybersecurity"", ""cloud computing"", ""web development"", ""data science""]",68,9,2025-10-25 21:44:02,en,How can {keyword} improve system performance and scalability?,0.86,1.0,0.84
34000961,data science,it,What certifications are valuable for data science professionals?,comparison,Intermediate,"[""Introduction to data science"", ""Key points and analysis"", ""Practical examples"", ""Expert insights"", ""Action items"", ""Conclusion""]","[""development"", ""it"", ""comparison"", ""programming"", ""science"", ""data""]",4,Junior to Mid-level Developers,"[""cybersecurity"", ""web development"", ""machine learning"", ""cloud computing""]",64,8,2025-10-25 21:44:02,en,What certifications are valuable for {keyword} professionals?,0.83,0.7584695388657497,0.83
34000962,cybersecurity,it,What tools are essential for cybersecurity development?,evaluation,Expert,"[""Introduction to cybersecurity"", ""Key points and analysis"", ""Practical examples"", ""Expert insights"", ""Action items"", ""Conclusion""]","[""development"", ""it"", ""evaluation"", ""cybersecurity"", ""technology""]",4,Architects & Technical Directors,"[""machine learning"", ""cloud computing"", ""data science"", ""web development""]",55,7,2025-10-25 21:44:02,en,What tools are essential for {keyword} development?,0.83,1.0,0.32
34000963,web development,it,What career opportunities exist in web development?,strategy,Beginner,"[""Introduction to web development"", ""Key points and analysis"", ""Practical examples"", ""Expert insights"", ""Action items"", ""Conclusion""]","[""software"", ""development"", ""it"", ""programming"", ""strategy"", ""web""]",4,Students & Entry-level Developers,"[""machine learning"", ""cloud computing"", ""data science"", ""cybersecurity""]",51,7,2025-10-25 21:44:02,en,What career opportunities exist in {keyword}?,0.91,0.44613616988009186,0.32
34000964,market analysis,economics,How do you protect your market analysis investments?,comparison,Advanced,"[""Overview of market analysis"", ""Step-by-step implementation"", ""Best practices and tips"", ""Common challenges and solutions"", ""Tools and resources needed"", ""Conclusion and next steps""]","[""investment"", ""analysis"", ""comparison"", ""market"", ""economics""]",6,Professional Investors & Advisors,"[""investment planning"", ""portfolio management"", ""financial modeling""]",52,8,2025-10-25 21:44:02,en,How do you protect your {keyword} investments?,0.82,0.8521146899500637,0.63
34000965,portfolio management,economics,How do you identify opportunities in portfolio management markets?,troubleshooting,Intermediate,"[""Overview of portfolio management"", ""Step-by-step implementation"", ""Best practices and tips"", ""Common challenges and solutions"", ""Tools and resources needed"", ""Conclusion and next steps""]","[""investment"", ""portfolio"", ""troubleshooting"", ""management"", ""market"", ""economics""]",6,Individual Investors & Analysts,"[""investment planning"", ""financial modeling"", ""market analysis""]",66,9,2025-10-25 21:44:02,en,How do you identify opportunities in {keyword} markets?,0.75,0.6377125920954516,0.39
34000966,digital marketing,marketing,How do you create a digital marketing roadmap?,implementation,Expert,"[""Overview of digital marketing"", ""Step-by-step implementation"", ""Best practices and tips"", ""Common challenges and solutions"", ""Tools and resources needed"", ""Conclusion and next steps""]","[""implementation"", ""marketing"", ""digital"", ""advertising"", ""branding""]",6,Marketing Directors & CMOs,"[""content marketing"", ""social media"", ""brand management""]",46,8,2025-10-25 21:44:02,en,How do you create a {keyword} roadmap?,0.69,1.0,0.32
34000967,cloud computing,it,How do you optimize cloud computing for different platforms?,how_to,Beginner,"[""Overview of cloud computing"", ""Step-by-step implementation"", ""Best practices and tips"", ""Common challenges and solutions"", ""Tools and resources needed"", ""Conclusion and next steps""]","[""computing"", ""how_to"", ""software"", ""development"", ""it"", ""cloud""]",6,Students & Entry-level Developers,"[""cybersecurity"", ""web development"", ""machine learning"", ""data science""]",60,9,2025-10-25 21:44:02,en,How do you optimize {keyword} for different platforms?,0.78,0.3584748034746142,0.63
34000968,brand management,marketing,What tools are essential for brand management analytics?,implementation,Beginner,"[""Introduction to brand management"", ""Key points and analysis"", ""Practical examples"", ""Expert insights"", ""Action items"", ""Conclusion""]","[""implementation"", ""promotion"", ""marketing"", ""management"", ""advertising"", ""brand""]",4,Marketing Students & Interns,"[""digital marketing"", ""social media"", ""content marketing""]",56,8,2025-10-25 21:44:02,en,What tools are essential for {keyword} analytics?,0.72,0.4179823812129635,0.72
34000969,cloud computing,it,How do you implement cloud computing in a production environment?,best_practice,Advanced,"[""Overview of cloud computing"", ""Step-by-step implementation"", ""Best practices and tips"", ""Common challenges and solutions"", ""Tools and resources needed"", ""Conclusion and next steps""]","[""computing"", ""it"", ""programming"", ""best_practice"", ""cloud"", ""technology""]",6,Senior Developers & Tech Leads,"[""cybersecurity"", ""machine learning"", ""data science"", ""web development""]",65,10,2025-10-25 21:44:02,en,How do you implement {keyword} in a production environment?,0.86,0.8427287956554684,0.73
34000970,market analysis,economics,How do you create a long-term plan for market analysis?,troubleshooting,Expert,"[""Overview of market analysis"", ""Step-by-step implementation"", ""Best practices and tips"", ""Common challenges and solutions"", ""Tools and resources needed"", ""Conclusion and next steps""]","[""analysis"", ""finance"", ""troubleshooting"", ""market"", ""business"", ""economics""]",6,Portfolio Managers & Financial Experts,"[""investment planning"", ""portfolio management"", ""financial modeling""]",55,10,2025-10-25 21:44:02,en,How do you create a long-term plan for {keyword}?,0.63,1.0,0.62
34000971,social media,marketing,What timing strategies work for social media?,comparison,Advanced,"[""Introduction to social media"", ""Key points and analysis"", ""Practical examples"", ""Expert insights"", ""Action items"", ""Conclusion""]","[""media"", ""comparison"", ""marketing"", ""digital"", ""social"", ""branding""]",4,Marketing Managers & Strategists,"[""content marketing"", ""digital marketing"", ""brand management""]",45,7,2025-10-25 21:44:02,en,What timing strategies work for {keyword}?,0.68,0.9767814989875225,0.3
34000972,data science,it,What are the key components of a data science implementation?,planning,Advanced,"[""Introduction to data science"", ""Key concepts and definitions"", ""Main categories or types"", ""Examples and case studies"", ""Benefits and advantages"", ""Summary and recommendations""]","[""technology"", ""software"", ""planning"", ""it"", ""science"", ""data""]",6,Senior Developers & Tech Leads,"[""web development"", ""cybersecurity"", ""machine learning"", ""cloud computing""]",61,10,2025-10-25 21:44:02,en,What are the key components of a {keyword} implementation?,0.9,0.8500472944685958,0.64
34000973,market analysis,economics,How does global economics impact market analysis?,optimization,Advanced,"[""Introduction to market analysis"", ""Key points and analysis"", ""Practical examples"", ""Expert insights"", ""Action items"", ""Conclusion""]","[""finance"", ""analysis"", ""market"", ""optimization"", ""economics""]",4,Professional Investors & Advisors,"[""financial modeling"", ""investment planning"", ""portfolio management""]",49,7,2025-10-25 21:44:02,en,How does global economics impact {keyword}?,0.76,0.9560118882742117,0.39
34000974,portfolio management,economics,How do you protect your portfolio management investments?,evaluation,Expert,"[""Overview of portfolio management"", ""Step-by-step implementation"", ""Best practices and tips"", ""Common challenges and solutions"", ""Tools and resources needed"", ""Conclusion and next steps""]","[""portfolio"", ""management"", ""evaluation"", ""market"", ""business"", ""economics""]",6,Portfolio Managers & Financial Experts,"[""investment planning"", ""financial modeling"", ""market analysis""]",57,8,2025-10-25 21:44:02,en,How do you protect your {keyword} investments?,0.75,1.0,0.61
34000975,web development,it,What ROI can be expected from web development implementation?,evaluation,Beginner,"[""Introduction to web development"", ""Key points and analysis"", ""Practical examples"", ""Expert insights"", ""Action items"", ""Conclusion""]","[""technology"", ""software"", ""development"", ""it"", ""evaluation"", ""web""]",4,Students & Entry-level Developers,"[""machine learning"", ""cybersecurity"", ""data science"", ""cloud computing""]",61,9,2025-10-25 21:44:02,en,What ROI can be expected from {keyword} implementation?,0.73,0.3783967537977052,0.84
34000976,portfolio management,economics,What insurance options are available for portfolio management?,best_practice,Beginner,"[""Introduction to portfolio management"", ""Key points and analysis"", ""Practical examples"", ""Expert insights"", ""Action items"", ""Conclusion""]","[""investment"", ""finance"", ""portfolio"", ""best_practice"", ""management"", ""economics""]",4,Students & New Investors,"[""market analysis"", ""financial modeling"", ""investment planning""]",62,8,2025-10-25 21:44:02,en,What insurance options are available for {keyword}?,0.79,0.484928695714544,0.7
34000977,social media,marketing,What channels are most effective for social media?,planning,Advanced,"[""Introduction to social media"", ""Key points and analysis"", ""Practical examples"", ""Expert insights"", ""Action items"", ""Conclusion""]","[""planning"", ""media"", ""marketing"", ""digital"", ""social"", ""advertising""]",4,Marketing Managers & Strategists,"[""digital marketing"", ""content marketing"", ""brand management""]",50,8,2025-10-25 21:44:02,en,What channels are most effective for {keyword}?,0.75,0.9540053542310065,0.79
34000978,content marketing,marketing,What demographics respond best to content marketing?,strategy,Intermediate,"[""Introduction to content marketing"", ""Key points and analysis"", ""Practical examples"", ""Expert insights"", ""Action items"", ""Conclusion""]","[""content"", ""promotion"", ""marketing"", ""advertising"", ""strategy""]",4,Marketing Coordinators & Specialists,"[""digital marketing"", ""brand management"", ""social media""]",52,7,2025-10-25 21:44:02,en,What demographics respond best to {keyword}?,0.67,0.6569024495111349,0.65
34000979,web development,it,How can web development improve system performance and scalability?,strategy,Expert,"[""Introduction to web development"", ""Key points and analysis"", ""Practical examples"", ""Expert insights"", ""Action items"", ""Conclusion""]","[""technology"", ""software"", ""development"", ""it"", ""strategy"", ""web""]",4,Architects & Technical Directors,"[""cloud computing"", ""machine learning"", ""cybersecurity"", ""data science""]",67,9,2025-10-25 21:44:02,en,How can {keyword} improve system performance and scalability?,0.66,1.0,0.66
34000980,portfolio management,economics,What indicators predict portfolio management market movements?,analysis,Intermediate,"[""Introduction to portfolio management"", ""Key points and analysis"", ""Practical examples"", ""Expert insights"", ""Action items"", ""Conclusion""]","[""investment"", ""finance"", ""analysis"", ""portfolio"", ""management"", ""economics""]",4,Individual Investors & Analysts,"[""market analysis"", ""financial modeling"", ""investment planning""]",62,7,2025-10-25 21:44:02,en,What indicators predict {keyword} market movements?,0.85,0.6100796241065036,0.69
34000981,investment planning,economics,What timeline is realistic for investment planning returns?,troubleshooting,Advanced,"[""Introduction to investment planning"", ""Key points and analysis"", ""Practical examples"", ""Expert insights"", ""Action items"", ""Conclusion""]","[""investment"", ""planning"", ""finance"", ""troubleshooting"", ""economics""]",4,Professional Investors & Advisors,"[""portfolio management"", ""market analysis"", ""financial modeling""]",59,8,2025-10-25 21:44:02,en,What timeline is realistic for {keyword} returns?,0.94,0.8238195413502041,0.61
34000982,financial modeling,economics,How do you protect your financial modeling investments?,analysis,Intermediate,"[""Overview of financial modeling"", ""Step-by-step implementation"", ""Best practices and tips"", ""Common challenges and solutions"", ""Tools and resources needed"", ""Conclusion and next steps""]","[""analysis"", ""modeling"", ""financial"", ""market"", ""business"", ""economics""]",6,Individual Investors & Analysts,"[""investment planning"", ""portfolio management"", ""market analysis""]",55,8,2025-10-25 21:44:02,en,How do you protect your {keyword} investments?,0.87,0.6219090856765498,0.35
34000983,social media,marketing,What tools are essential for social media analytics?,analysis,Advanced,"[""Introduction to social media"", ""Key points and analysis"", ""Practical examples"", ""Expert insights"", ""Action items"", ""Conclusion""]","[""analysis"", ""media"", ""promotion"", ""marketing"", ""digital"", ""social""]",4,Marketing Managers & Strategists,"[""brand management"", ""content marketing"", ""digital marketing""]",52,8,2025-10-25 21:44:02,en,What tools are essential for {keyword} analytics?,0.86,0.9729511539289011,0.74
34000984,brand management,marketing,What are the latest trends in brand management?,comparison,Intermediate,"[""Introduction to brand management"", ""Key concepts and definitions"", ""Main categories or types"", ""Examples and case studies"", ""Benefits and advantages"", ""Summary and recommendations""]","[""promotion"", ""comparison"", ""marketing"", ""management"", ""branding"", ""brand""]",6,Marketing Coordinators & Specialists,"[""content marketing"", ""social media"", ""digital marketing""]",47,8,2025-10-25 21:44:02,en,What are the latest trends in {keyword}?,0.64,0.7475531024151685,0.44
34000985,market analysis,economics,What tools help analyze market analysis data?,strategy,Advanced,"[""Introduction to market analysis"", ""Key points and analysis"", ""Practical examples"", ""Expert insights"", ""Action items"", ""Conclusion""]","[""analysis"", ""business"", ""market"", ""strategy"", ""economics""]",4,Professional Investors & Advisors,"[""investment planning"", ""portfolio management"", ""financial modeling""]",45,7,2025-10-25 21:44:02,en,What tools help analyze {keyword} data?,0.73,0.844787117420436,0.37
34000986,cloud computing,it,How does cloud computing impact business operations?,how_to,Expert,"[""Introduction to cloud computing"", ""Key points and analysis"", ""Practical examples"", ""Expert insights"", ""Action items"", ""Conclusion""]","[""computing"", ""how_to"", ""software"", ""it"", ""cloud"", ""technology""]",4,Architects & Technical Directors,"[""cybersecurity"", ""data science"", ""web development"", ""machine learning""]",52,7,2025-10-25 21:44:02,en,How does {keyword} impact business operations?,0.74,1.0,0.8
34000987,brand management,marketing,How do you develop an effective brand management strategy?,implementation,Expert,"[""Overview of brand management"", ""Step-by-step implementation"", ""Best practices and tips"", ""Common challenges and solutions"", ""Tools and resources needed"", ""Conclusion and next steps""]","[""implementation"", ""marketing"", ""management"", ""advertising"", ""digital"", ""brand""]",6,Marketing Directors & CMOs,"[""social media"", ""content marketing"", ""digital marketing""]",58,9,2025-10-25 21:44:02,en,How do you develop an effective {keyword} strategy?,0.74,1.0,0.72
34000988,machine learning,it,What tools are essential for machine learning development?,how_to,Advanced,"[""Introduction to machine learning"", ""Key points and analysis"", ""Practical examples"", ""Expert insights"", ""Action items"", ""Conclusion""]","[""how_to"", ""software"", ""it"", ""programming"", ""learning"", ""machine""]",4,Senior Developers & Tech Leads,"[""cybersecurity"", ""web development"", ""data science"", ""cloud computing""]",58,8,2025-10-25 21:44:02,en,What tools are essential for {keyword} development?,0.63,0.8828351677492046,0.63
34000989,machine learning,it,How do you stay updated with machine learning developments?,planning,Expert,"[""Overview of machine learning"", ""Step-by-step implementation"", ""Best practices and tips"", ""Common challenges and solutions"", ""Tools and resources needed"", ""Conclusion and next steps""]","[""planning"", ""development"", ""it"", ""learning"", ""machine"", ""technology""]",6,Architects & Technical Directors,"[""data science"", ""cybersecurity"", ""cloud computing"", ""web development""]",59,9,2025-10-25 21:44:02,en,How do you stay updated with {keyword} developments?,0.65,1.0,0.35
34000990,cybersecurity,it,What ROI can be expected from cybersecurity implementation?,analysis,Intermediate,"[""Introduction to cybersecurity"", ""Key points and analysis"", ""Practical examples"", ""Expert insights"", ""Action items"", ""Conclusion""]","[""analysis"", ""it"", ""programming"", ""cybersecurity"", ""technology""]",4,Junior to Mid-level Developers,"[""web development"", ""data science"", ""cloud computing"", ""machine learning""]",59,8,2025-10-25 21:44:02,en,What ROI can be expected from {keyword} implementation?,0.79,0.6658591664908576,0.81
34000991,financial modeling,economics,How do you adjust your financial modeling strategy during volatility?,optimization,Intermediate,"[""Overview of financial modeling"", ""Step-by-step implementation"", ""Best practices and tips"", ""Common challenges and solutions"", ""Tools and resources needed"", ""Conclusion and next steps""]","[""investment"", ""modeling"", ""financial"", ""business"", ""optimization"", ""economics""]",6,Individual Investors & Analysts,"[""investment planning"", ""portfolio management"", ""market analysis""]",69,10,2025-10-25 21:44:02,en,How do you adjust your {keyword} strategy during volatility?,0.81,0.7441865760575317,0.45
34000992,financial modeling,economics,What insurance options are available for financial modeling?,implementation,Expert,"[""Introduction to financial modeling"", ""Key points and analysis"", ""Practical examples"", ""Expert insights"", ""Action items"", ""Conclusion""]","[""investment"", ""implementation"", ""modeling"", ""financial"", ""market"", ""economics""]",4,Portfolio Managers & Financial Experts,"[""market analysis"", ""investment planning"", ""portfolio management""]",60,8,2025-10-25 21:44:02,en,What insurance options are available for {keyword}?,0.81,1.0,0.44
34000993,content marketing,marketing,What KPIs are most important for content marketing?,evaluation,Beginner,"[""Introduction to content marketing"", ""Key points and analysis"", ""Practical examples"", ""Expert insights"", ""Action items"", ""Conclusion""]","[""content"", ""promotion"", ""marketing"", ""digital"", ""evaluation""]",4,Marketing Students & Interns,"[""brand management"", ""digital marketing"", ""social media""]",51,8,2025-10-25 21:44:02,en,What KPIs are most important for {keyword}?,0.91,0.3092067618316916,0.75
34000994,machine learning,it,What ROI can be expected from machine learning implementation?,evaluation,Advanced,"[""Introduction to machine learning"", ""Key points and analysis"", ""Practical examples"", ""Expert insights"", ""Action items"", ""Conclusion""]","[""software"", ""it"", ""learning"", ""evaluation"", ""machine"", ""technology""]",4,Senior Developers & Tech Leads,"[""web development"", ""data science"", ""cybersecurity"", ""cloud computing""]",62,9,2025-10-25 21:44:02,en,What ROI can be expected from {keyword} implementation?,0.85,0.9329169593146291,0.44
34000995,financial modeling,economics,What are the regulatory considerations for financial modeling?,analysis,Intermediate,"[""Introduction to financial modeling"", ""Key concepts and definitions"", ""Main categories or types"", ""Examples and case studies"", ""Benefits and advantages"", ""Summary and recommendations""]","[""investment"", ""analysis"", ""modeling"", ""financial"", ""market"", ""economics""]",6,Individual Investors & Analysts,"[""portfolio management"", ""investment planning"", ""market analysis""]",62,8,2025-10-25 21:44:02,en,What are the regulatory considerations for {keyword}?,0.87,0.6444765468357839,0.85
34000996,cybersecurity,it,How do you measure the success of cybersecurity projects?,comparison,Expert,"[""Overview of cybersecurity"", ""Step-by-step implementation"", ""Best practices and tips"", ""Common challenges and solutions"", ""Tools and resources needed"", ""Conclusion and next steps""]","[""it"", ""comparison"", ""programming"", ""cybersecurity"", ""technology""]",5,Architects & Technical Directors,"[""web development"", ""machine learning"", ""cloud computing"", ""data science""]",57,9,2025-10-25 21:44:02,en,How do you measure the success of {keyword} projects?,0.76,1.0,0.64
34000997,cybersecurity,it,How do you optimize cybersecurity for different platforms?,how_to,Beginner,"[""Overview of cybersecurity"", ""Step-by-step implementation"", ""Best practices and tips"", ""Common challenges and solutions"", ""Tools and resources needed"", ""Conclusion and next steps""]","[""how_to"", ""software"", ""it"", ""cybersecurity"", ""technology""]",5,Students & Entry-level Developers,"[""web development"", ""machine learning"", ""data science"", ""cloud computing""]",58,8,2025-10-25 21:44:02,en,How do you optimize {keyword} for different platforms?,0.88,0.43303416199437117,0.61
34000998,digital marketing,marketing,What content types work best for digital marketing?,troubleshooting,Expert,"[""Introduction to digital marketing"", ""Key points and analysis"", ""Practical examples"", ""Expert insights"", ""Action items"", ""Conclusion""]","[""marketing"", ""promotion"", ""troubleshooting"", ""digital""]",4,Marketing Directors & CMOs,"[""content marketing"", ""social media"", ""brand management""]",51,8,2025-10-25 21:44:02,en,What content types work best for {keyword}?,0.9,1.0,0.46
34000999,content marketing,marketing,How do you develop an effective content marketing strategy?,comparison,Advanced,"[""Overview of content marketing"", ""Step-by-step implementation"", ""Best practices and tips"", ""Common challenges and solutions"", ""Tools and resources needed"", ""Conclusion and next steps""]","[""content"", ""promotion"", ""comparison"", ""marketing"", ""branding""]",6,Marketing Managers & Strategists,"[""brand management"", ""digital marketing"", ""social media""]",59,9,2025-10-25 21:44:02,en,How do you develop an effective {keyword} strategy?,0.71,0.8119351821470252,0.7
34001000,portfolio management,economics,What factors should be considered when evaluating portfolio management?,troubleshooting,Beginner,"[""Introduction to portfolio management"", ""Key points and analysis"", ""Practical examples"", ""Expert insights"", ""Action items"", ""Conclusion""]","[""finance"", ""portfolio"", ""troubleshooting"", ""management"", ""business"", ""economics""]",4,Students & New Investors,"[""market analysis"", ""investment planning"", ""financial modeling""]",71,9,2025-10-25 21:44:02,en,What factors should be considered when evaluating {keyword}?,0.92,0.4293539216088409,0.86
34001001,data science,it,What is the recommended architecture for data science systems?,strategy,Beginner,"[""Introduction to data science"", ""Key points and analysis"", ""Practical examples"", ""Expert insights"", ""Action items"", ""Conclusion""]","[""technology"", ""development"", ""it"", ""science"", ""strategy"", ""data""]",4,Students & Entry-level Developers,"[""cloud computing"", ""cybersecurity"", ""web development"", ""machine learning""]",62,9,2025-10-25 21:44:02,en,What is the recommended architecture for {keyword} systems?,0.82,0.34274818072957003,0.4
34001002,data science,it,How does data science impact business operations?,how_to,Expert,"[""Introduction to data science"", ""Key points and analysis"", ""Practical examples"", ""Expert insights"", ""Action items"", ""Conclusion""]","[""how_to"", ""technology"", ""software"", ""it"", ""science"", ""data""]",4,Architects & Technical Directors,"[""web development"", ""cloud computing"", ""machine learning"", ""cybersecurity""]",49,7,2025-10-25 21:44:02,en,How does {keyword} impact business operations?,0.63,1.0,0.31
