record_id,keyword,category,question,question_type,difficulty_level,answer_outline,tags,estimated_read_time,target_audience,related_topics,question_length,word_count,created_date,language,source_template,engagement_score,complexity_score,popularity_score
36500657,machine learning,it,What security considerations should be taken when using machine learning?,how_to,Intermediate,"[""Introduction to machine learning"", ""Key points and analysis"", ""Practical examples"", ""Expert insights"", ""Action items"", ""Conclusion""]","[""how_to"", ""software"", ""development"", ""it"", ""learning"", ""machine""]",4,Junior to Mid-level Developers,"[""data science"", ""cloud computing"", ""cybersecurity"", ""web development""]",73,10,2025-10-25 21:47:36,en,What security considerations should be taken when using {keyword}?,0.84,0.7618904172426906,0.8
36500658,content marketing,marketing,How do you optimize content marketing for mobile users?,implementation,Expert,"[""Overview of content marketing"", ""Step-by-step implementation"", ""Best practices and tips"", ""Common challenges and solutions"", ""Tools and resources needed"", ""Conclusion and next steps""]","[""content"", ""implementation"", ""promotion"", ""marketing"", ""branding""]",6,Marketing Directors & CMOs,"[""social media"", ""digital marketing"", ""brand management""]",55,9,2025-10-25 21:47:36,en,How do you optimize {keyword} for mobile users?,0.66,1.0,0.31
36500659,cybersecurity,it,How do you integrate cybersecurity with existing systems?,planning,Advanced,"[""Overview of cybersecurity"", ""Step-by-step implementation"", ""Best practices and tips"", ""Common challenges and solutions"", ""Tools and resources needed"", ""Conclusion and next steps""]","[""software"", ""planning"", ""development"", ""it"", ""cybersecurity""]",5,Senior Developers & Tech Leads,"[""web development"", ""cloud computing"", ""data science"", ""machine learning""]",57,8,2025-10-25 21:47:36,en,How do you integrate {keyword} with existing systems?,0.91,0.886091140655053,0.55
36500660,digital marketing,marketing,What tools are essential for digital marketing analytics?,comparison,Beginner,"[""Introduction to digital marketing"", ""Key points and analysis"", ""Practical examples"", ""Expert insights"", ""Action items"", ""Conclusion""]","[""comparison"", ""marketing"", ""digital"", ""advertising"", ""branding""]",4,Marketing Students & Interns,"[""content marketing"", ""brand management"", ""social media""]",57,8,2025-10-25 21:47:36,en,What tools are essential for {keyword} analytics?,0.8,0.36857015840126195,0.6
36500661,market analysis,economics,What metrics are most important for market analysis?,analysis,Intermediate,"[""Introduction to market analysis"", ""Key points and analysis"", ""Practical examples"", ""Expert insights"", ""Action items"", ""Conclusion""]","[""market"", ""business"", ""economics"", ""analysis""]",4,Individual Investors & Analysts,"[""investment planning"", ""financial modeling"", ""portfolio management""]",52,8,2025-10-25 21:47:36,en,What metrics are most important for {keyword}?,0.87,0.6285393214456194,0.7
36500662,web development,it,How do you integrate web development with existing systems?,strategy,Intermediate,"[""Overview of web development"", ""Step-by-step implementation"", ""Best practices and tips"", ""Common challenges and solutions"", ""Tools and resources needed"", ""Conclusion and next steps""]","[""software"", ""development"", ""it"", ""strategy"", ""web""]",6,Junior to Mid-level Developers,"[""machine learning"", ""cloud computing"", ""data science"", ""cybersecurity""]",59,9,2025-10-25 21:47:36,en,How do you integrate {keyword} with existing systems?,0.91,0.7422387083669952,0.5
36500663,web development,it,How can web development improve system performance and scalability?,implementation,Expert,"[""Introduction to web development"", ""Key points and analysis"", ""Practical examples"", ""Expert insights"", ""Action items"", ""Conclusion""]","[""software"", ""development"", ""it"", ""implementation"", ""web""]",4,Architects & Technical Directors,"[""cybersecurity"", ""data science"", ""machine learning"", ""cloud computing""]",67,9,2025-10-25 21:47:36,en,How can {keyword} improve system performance and scalability?,0.75,1.0,0.36
36500664,data science,it,What security considerations should be taken when using data science?,planning,Expert,"[""Introduction to data science"", ""Key points and analysis"", ""Practical examples"", ""Expert insights"", ""Action items"", ""Conclusion""]","[""technology"", ""software"", ""planning"", ""it"", ""science"", ""data""]",4,Architects & Technical Directors,"[""cloud computing"", ""cybersecurity"", ""machine learning"", ""web development""]",69,10,2025-10-25 21:47:36,en,What security considerations should be taken when using {keyword}?,0.77,1.0,0.37
36500665,brand management,marketing,How do you attribute success to brand management efforts?,analysis,Intermediate,"[""Overview of brand management"", ""Step-by-step implementation"", ""Best practices and tips"", ""Common challenges and solutions"", ""Tools and resources needed"", ""Conclusion and next steps""]","[""analysis"", ""digital"", ""marketing"", ""management"", ""advertising"", ""brand""]",6,Marketing Coordinators & Specialists,"[""digital marketing"", ""social media"", ""content marketing""]",57,9,2025-10-25 21:47:36,en,How do you attribute success to {keyword} efforts?,0.91,0.7635577183956448,0.63
36500666,digital marketing,marketing,How do you innovate within digital marketing?,planning,Advanced,"[""Overview of digital marketing"", ""Step-by-step implementation"", ""Best practices and tips"", ""Common challenges and solutions"", ""Tools and resources needed"", ""Conclusion and next steps""]","[""planning"", ""promotion"", ""marketing"", ""digital"", ""branding""]",6,Marketing Managers & Strategists,"[""brand management"", ""social media"", ""content marketing""]",45,7,2025-10-25 21:47:36,en,How do you innovate within {keyword}?,0.6,0.8919840804995479,0.85
36500667,cloud computing,it,What are the key components of a cloud computing implementation?,strategy,Beginner,"[""Introduction to cloud computing"", ""Key concepts and definitions"", ""Main categories or types"", ""Examples and case studies"", ""Benefits and advantages"", ""Summary and recommendations""]","[""computing"", ""software"", ""cloud"", ""it"", ""strategy"", ""technology""]",6,Students & Entry-level Developers,"[""machine learning"", ""web development"", ""cybersecurity"", ""data science""]",64,10,2025-10-25 21:47:36,en,What are the key components of a {keyword} implementation?,0.79,0.3094425273705611,0.33
36500668,digital marketing,marketing,How do you reach new customers through digital marketing?,analysis,Expert,"[""Overview of digital marketing"", ""Step-by-step implementation"", ""Best practices and tips"", ""Common challenges and solutions"", ""Tools and resources needed"", ""Conclusion and next steps""]","[""branding"", ""marketing"", ""analysis"", ""digital""]",6,Marketing Directors & CMOs,"[""social media"", ""brand management"", ""content marketing""]",57,9,2025-10-25 21:47:36,en,How do you reach new customers through {keyword}?,0.72,1.0,0.35
36500669,digital marketing,marketing,What does the future hold for digital marketing?,optimization,Intermediate,"[""Introduction to digital marketing"", ""Key points and analysis"", ""Practical examples"", ""Expert insights"", ""Action items"", ""Conclusion""]","[""marketing"", ""digital"", ""advertising"", ""branding"", ""optimization""]",4,Marketing Coordinators & Specialists,"[""content marketing"", ""brand management"", ""social media""]",48,8,2025-10-25 21:47:36,en,What does the future hold for {keyword}?,0.81,0.702143806622192,0.5
36500670,machine learning,it,How do you implement machine learning in a production environment?,implementation,Beginner,"[""Overview of machine learning"", ""Step-by-step implementation"", ""Best practices and tips"", ""Common challenges and solutions"", ""Tools and resources needed"", ""Conclusion and next steps""]","[""software"", ""development"", ""it"", ""implementation"", ""learning"", ""machine""]",6,Students & Entry-level Developers,"[""data science"", ""cybersecurity"", ""cloud computing"", ""web development""]",66,10,2025-10-25 21:47:36,en,How do you implement {keyword} in a production environment?,0.8,0.4415101488289255,0.76
36500671,investment planning,economics,What are the risks associated with investment planning?,planning,Beginner,"[""Introduction to investment planning"", ""Key concepts and definitions"", ""Main categories or types"", ""Examples and case studies"", ""Benefits and advantages"", ""Summary and recommendations""]","[""investment"", ""economics"", ""planning"", ""business""]",6,Students & New Investors,"[""financial modeling"", ""market analysis"", ""portfolio management""]",55,8,2025-10-25 21:47:36,en,What are the risks associated with {keyword}?,0.72,0.4743242991453491,0.55
36500672,brand management,marketing,What timing strategies work for brand management?,analysis,Beginner,"[""Introduction to brand management"", ""Key points and analysis"", ""Practical examples"", ""Expert insights"", ""Action items"", ""Conclusion""]","[""analysis"", ""marketing"", ""management"", ""digital"", ""branding"", ""brand""]",4,Marketing Students & Interns,"[""content marketing"", ""social media"", ""digital marketing""]",49,7,2025-10-25 21:47:36,en,What timing strategies work for {keyword}?,0.89,0.4020390245544291,0.81
36500673,cybersecurity,it,What are the best practices for cybersecurity development?,evaluation,Beginner,"[""Introduction to cybersecurity"", ""Key concepts and definitions"", ""Main categories or types"", ""Examples and case studies"", ""Benefits and advantages"", ""Summary and recommendations""]","[""software"", ""it"", ""evaluation"", ""cybersecurity"", ""technology""]",5,Students & Entry-level Developers,"[""cloud computing"", ""web development"", ""machine learning"", ""data science""]",58,8,2025-10-25 21:47:36,en,What are the best practices for {keyword} development?,0.94,0.3390354595906878,0.31
36500674,machine learning,it,What are the key components of a machine learning implementation?,how_to,Expert,"[""Introduction to machine learning"", ""Key concepts and definitions"", ""Main categories or types"", ""Examples and case studies"", ""Benefits and advantages"", ""Summary and recommendations""]","[""how_to"", ""development"", ""it"", ""programming"", ""learning"", ""machine""]",6,Architects & Technical Directors,"[""web development"", ""cybersecurity"", ""data science"", ""cloud computing""]",65,10,2025-10-25 21:47:36,en,What are the key components of a {keyword} implementation?,0.87,1.0,0.74
36500675,digital marketing,marketing,What content types work best for digital marketing?,strategy,Beginner,"[""Introduction to digital marketing"", ""Key points and analysis"", ""Practical examples"", ""Expert insights"", ""Action items"", ""Conclusion""]","[""promotion"", ""marketing"", ""digital"", ""branding"", ""strategy""]",4,Marketing Students & Interns,"[""content marketing"", ""brand management"", ""social media""]",51,8,2025-10-25 21:47:36,en,What content types work best for {keyword}?,0.75,0.4868477610943508,0.81
36500676,machine learning,it,How do you measure the success of machine learning projects?,strategy,Advanced,"[""Overview of machine learning"", ""Step-by-step implementation"", ""Best practices and tips"", ""Common challenges and solutions"", ""Tools and resources needed"", ""Conclusion and next steps""]","[""development"", ""it"", ""learning"", ""strategy"", ""machine"", ""technology""]",6,Senior Developers & Tech Leads,"[""web development"", ""cybersecurity"", ""data science"", ""cloud computing""]",60,10,2025-10-25 21:47:36,en,How do you measure the success of {keyword} projects?,0.83,0.9687190129609908,0.68
36500677,cybersecurity,it,How does cybersecurity impact business operations?,optimization,Beginner,"[""Introduction to cybersecurity"", ""Key points and analysis"", ""Practical examples"", ""Expert insights"", ""Action items"", ""Conclusion""]","[""it"", ""programming"", ""optimization"", ""cybersecurity"", ""technology""]",4,Students & Entry-level Developers,"[""machine learning"", ""data science"", ""cloud computing"", ""web development""]",50,6,2025-10-25 21:47:36,en,How does {keyword} impact business operations?,0.61,0.439276774036979,0.48
36500678,investment planning,economics,What are the risks associated with investment planning?,troubleshooting,Expert,"[""Introduction to investment planning"", ""Key concepts and definitions"", ""Main categories or types"", ""Examples and case studies"", ""Benefits and advantages"", ""Summary and recommendations""]","[""investment"", ""planning"", ""troubleshooting"", ""business"", ""economics""]",6,Portfolio Managers & Financial Experts,"[""portfolio management"", ""financial modeling"", ""market analysis""]",55,8,2025-10-25 21:47:36,en,What are the risks associated with {keyword}?,0.8,1.0,0.43
36500679,investment planning,economics,How do you measure investment planning performance?,best_practice,Expert,"[""Overview of investment planning"", ""Step-by-step implementation"", ""Best practices and tips"", ""Common challenges and solutions"", ""Tools and resources needed"", ""Conclusion and next steps""]","[""investment"", ""planning"", ""best_practice"", ""business"", ""economics""]",6,Portfolio Managers & Financial Experts,"[""financial modeling"", ""portfolio management"", ""market analysis""]",51,7,2025-10-25 21:47:36,en,How do you measure {keyword} performance?,0.93,1.0,0.88
36500680,portfolio management,economics,How do you assess and manage portfolio management risks?,evaluation,Expert,"[""Overview of portfolio management"", ""Step-by-step implementation"", ""Best practices and tips"", ""Common challenges and solutions"", ""Tools and resources needed"", ""Conclusion and next steps""]","[""finance"", ""portfolio"", ""management"", ""evaluation"", ""market"", ""economics""]",6,Portfolio Managers & Financial Experts,"[""investment planning"", ""financial modeling"", ""market analysis""]",56,9,2025-10-25 21:47:36,en,How do you assess and manage {keyword} risks?,0.68,1.0,0.32
36500681,social media,marketing,What are the latest trends in social media?,evaluation,Beginner,"[""Introduction to social media"", ""Key concepts and definitions"", ""Main categories or types"", ""Examples and case studies"", ""Benefits and advantages"", ""Summary and recommendations""]","[""media"", ""promotion"", ""marketing"", ""social"", ""advertising"", ""evaluation""]",6,Marketing Students & Interns,"[""digital marketing"", ""brand management"", ""content marketing""]",43,8,2025-10-25 21:47:36,en,What are the latest trends in {keyword}?,0.89,0.3600226509376566,0.34
36500682,investment planning,economics,What timeline is realistic for investment planning returns?,comparison,Intermediate,"[""Introduction to investment planning"", ""Key points and analysis"", ""Practical examples"", ""Expert insights"", ""Action items"", ""Conclusion""]","[""investment"", ""planning"", ""finance"", ""comparison"", ""market"", ""economics""]",4,Individual Investors & Analysts,"[""market analysis"", ""portfolio management"", ""financial modeling""]",59,8,2025-10-25 21:47:36,en,What timeline is realistic for {keyword} returns?,0.78,0.6342173075374397,0.72
36500683,financial modeling,economics,How do you assess and manage financial modeling risks?,optimization,Advanced,"[""Overview of financial modeling"", ""Step-by-step implementation"", ""Best practices and tips"", ""Common challenges and solutions"", ""Tools and resources needed"", ""Conclusion and next steps""]","[""finance"", ""modeling"", ""financial"", ""business"", ""optimization"", ""economics""]",6,Professional Investors & Advisors,"[""portfolio management"", ""market analysis"", ""investment planning""]",54,9,2025-10-25 21:47:36,en,How do you assess and manage {keyword} risks?,0.92,0.9757721081656509,0.43
36500684,data science,it,What ROI can be expected from data science implementation?,how_to,Expert,"[""Introduction to data science"", ""Key points and analysis"", ""Practical examples"", ""Expert insights"", ""Action items"", ""Conclusion""]","[""how_to"", ""development"", ""it"", ""programming"", ""science"", ""data""]",4,Architects & Technical Directors,"[""machine learning"", ""cybersecurity"", ""cloud computing"", ""web development""]",58,9,2025-10-25 21:47:36,en,What ROI can be expected from {keyword} implementation?,0.66,1.0,0.45
36500685,cybersecurity,it,How do you measure the success of cybersecurity projects?,troubleshooting,Advanced,"[""Overview of cybersecurity"", ""Step-by-step implementation"", ""Best practices and tips"", ""Common challenges and solutions"", ""Tools and resources needed"", ""Conclusion and next steps""]","[""software"", ""it"", ""troubleshooting"", ""cybersecurity"", ""technology""]",5,Senior Developers & Tech Leads,"[""machine learning"", ""data science"", ""cloud computing"", ""web development""]",57,9,2025-10-25 21:47:36,en,How do you measure the success of {keyword} projects?,0.83,0.9203813318819034,0.8
36500686,machine learning,it,How do you implement machine learning in a production environment?,planning,Expert,"[""Overview of machine learning"", ""Step-by-step implementation"", ""Best practices and tips"", ""Common challenges and solutions"", ""Tools and resources needed"", ""Conclusion and next steps""]","[""planning"", ""development"", ""it"", ""programming"", ""learning"", ""machine""]",6,Architects & Technical Directors,"[""data science"", ""cloud computing"", ""cybersecurity"", ""web development""]",66,10,2025-10-25 21:47:36,en,How do you implement {keyword} in a production environment?,0.72,1.0,0.44
36500687,machine learning,it,What are the cost considerations for machine learning?,planning,Intermediate,"[""Introduction to machine learning"", ""Key concepts and definitions"", ""Main categories or types"", ""Examples and case studies"", ""Benefits and advantages"", ""Summary and recommendations""]","[""planning"", ""it"", ""programming"", ""learning"", ""machine"", ""technology""]",6,Junior to Mid-level Developers,"[""cloud computing"", ""data science"", ""cybersecurity"", ""web development""]",54,8,2025-10-25 21:47:36,en,What are the cost considerations for {keyword}?,0.74,0.6571441511437353,0.76
36500688,portfolio management,economics,How do you benchmark portfolio management against alternatives?,analysis,Intermediate,"[""Overview of portfolio management"", ""Step-by-step implementation"", ""Best practices and tips"", ""Common challenges and solutions"", ""Tools and resources needed"", ""Conclusion and next steps""]","[""investment"", ""analysis"", ""portfolio"", ""management"", ""market"", ""economics""]",6,Individual Investors & Analysts,"[""investment planning"", ""market analysis"", ""financial modeling""]",63,8,2025-10-25 21:47:36,en,How do you benchmark {keyword} against alternatives?,0.73,0.7165333418530485,0.44
36500689,data science,it,What are the best practices for data science development?,implementation,Advanced,"[""Introduction to data science"", ""Key concepts and definitions"", ""Main categories or types"", ""Examples and case studies"", ""Benefits and advantages"", ""Summary and recommendations""]","[""software"", ""development"", ""it"", ""implementation"", ""science"", ""data""]",6,Senior Developers & Tech Leads,"[""cloud computing"", ""cybersecurity"", ""web development"", ""machine learning""]",57,9,2025-10-25 21:47:36,en,What are the best practices for {keyword} development?,0.63,0.8641524335151788,0.61
36500690,cybersecurity,it,How do you integrate cybersecurity with existing systems?,implementation,Intermediate,"[""Overview of cybersecurity"", ""Step-by-step implementation"", ""Best practices and tips"", ""Common challenges and solutions"", ""Tools and resources needed"", ""Conclusion and next steps""]","[""software"", ""it"", ""implementation"", ""programming"", ""cybersecurity""]",5,Junior to Mid-level Developers,"[""cloud computing"", ""web development"", ""machine learning"", ""data science""]",57,8,2025-10-25 21:47:36,en,How do you integrate {keyword} with existing systems?,0.79,0.772175910808576,0.35
36500691,data science,it,What are the latest trends in data science technology?,strategy,Intermediate,"[""Introduction to data science"", ""Key concepts and definitions"", ""Main categories or types"", ""Examples and case studies"", ""Benefits and advantages"", ""Summary and recommendations""]","[""technology"", ""it"", ""programming"", ""science"", ""strategy"", ""data""]",6,Junior to Mid-level Developers,"[""machine learning"", ""cloud computing"", ""web development"", ""cybersecurity""]",54,9,2025-10-25 21:47:36,en,What are the latest trends in {keyword} technology?,0.92,0.634723789332249,0.89
36500692,market analysis,economics,How do you report on market analysis performance to stakeholders?,implementation,Advanced,"[""Overview of market analysis"", ""Step-by-step implementation"", ""Best practices and tips"", ""Common challenges and solutions"", ""Tools and resources needed"", ""Conclusion and next steps""]","[""finance"", ""analysis"", ""implementation"", ""market"", ""economics""]",6,Professional Investors & Advisors,"[""portfolio management"", ""investment planning"", ""financial modeling""]",65,10,2025-10-25 21:47:36,en,How do you report on {keyword} performance to stakeholders?,0.78,0.956771812681533,0.78
36500693,digital marketing,marketing,What budget should be allocated to digital marketing?,implementation,Advanced,"[""Introduction to digital marketing"", ""Key points and analysis"", ""Practical examples"", ""Expert insights"", ""Action items"", ""Conclusion""]","[""implementation"", ""promotion"", ""marketing"", ""digital"", ""branding""]",4,Marketing Managers & Strategists,"[""content marketing"", ""brand management"", ""social media""]",53,8,2025-10-25 21:47:36,en,What budget should be allocated to {keyword}?,0.79,0.9678764101291074,0.58
36500694,market analysis,economics,How do economic conditions affect market analysis performance?,comparison,Expert,"[""Introduction to market analysis"", ""Key points and analysis"", ""Practical examples"", ""Expert insights"", ""Action items"", ""Conclusion""]","[""finance"", ""analysis"", ""comparison"", ""market"", ""economics""]",4,Portfolio Managers & Financial Experts,"[""investment planning"", ""portfolio management"", ""financial modeling""]",62,8,2025-10-25 21:47:36,en,How do economic conditions affect {keyword} performance?,0.84,1.0,0.77
36500695,market analysis,economics,What exit strategies should be considered for market analysis?,how_to,Beginner,"[""Introduction to market analysis"", ""Key points and analysis"", ""Practical examples"", ""Expert insights"", ""Action items"", ""Conclusion""]","[""how_to"", ""analysis"", ""market"", ""business"", ""economics""]",4,Students & New Investors,"[""portfolio management"", ""financial modeling"", ""investment planning""]",62,9,2025-10-25 21:47:36,en,What exit strategies should be considered for {keyword}?,0.76,0.45425277699399547,0.78
36500696,cybersecurity,it,How do you measure the success of cybersecurity projects?,optimization,Expert,"[""Overview of cybersecurity"", ""Step-by-step implementation"", ""Best practices and tips"", ""Common challenges and solutions"", ""Tools and resources needed"", ""Conclusion and next steps""]","[""software"", ""it"", ""programming"", ""optimization"", ""cybersecurity""]",5,Architects & Technical Directors,"[""machine learning"", ""cloud computing"", ""web development"", ""data science""]",57,9,2025-10-25 21:47:36,en,How do you measure the success of {keyword} projects?,0.83,1.0,0.4
36500697,portfolio management,economics,How do you adjust your portfolio management strategy during volatility?,how_to,Intermediate,"[""Overview of portfolio management"", ""Step-by-step implementation"", ""Best practices and tips"", ""Common challenges and solutions"", ""Tools and resources needed"", ""Conclusion and next steps""]","[""investment"", ""how_to"", ""finance"", ""portfolio"", ""management"", ""economics""]",6,Individual Investors & Analysts,"[""market analysis"", ""investment planning"", ""financial modeling""]",71,10,2025-10-25 21:47:36,en,How do you adjust your {keyword} strategy during volatility?,0.74,0.734868575603428,0.46
36500698,social media,marketing,What messaging works best in social media campaigns?,implementation,Advanced,"[""Introduction to social media"", ""Key points and analysis"", ""Practical examples"", ""Expert insights"", ""Action items"", ""Conclusion""]","[""media"", ""implementation"", ""marketing"", ""social"", ""advertising"", ""branding""]",4,Marketing Managers & Strategists,"[""content marketing"", ""digital marketing"", ""brand management""]",52,8,2025-10-25 21:47:36,en,What messaging works best in {keyword} campaigns?,0.68,0.948315279315775,0.6
36500699,financial modeling,economics,What insurance options are available for financial modeling?,how_to,Advanced,"[""Introduction to financial modeling"", ""Key points and analysis"", ""Practical examples"", ""Expert insights"", ""Action items"", ""Conclusion""]","[""how_to"", ""finance"", ""modeling"", ""financial"", ""business"", ""economics""]",4,Professional Investors & Advisors,"[""market analysis"", ""investment planning"", ""portfolio management""]",60,8,2025-10-25 21:47:36,en,What insurance options are available for {keyword}?,0.61,0.8348021289744572,0.37
