record_id,keyword,category,question,question_type,difficulty_level,answer_outline,tags,estimated_read_time,target_audience,related_topics,question_length,word_count,created_date,language,source_template,engagement_score,complexity_score,popularity_score
48500960,content marketing,marketing,How is AI changing content marketing approaches?,how_to,Intermediate,"[""Introduction to content marketing"", ""Key points and analysis"", ""Practical examples"", ""Expert insights"", ""Action items"", ""Conclusion""]","[""how_to"", ""content"", ""marketing"", ""digital"", ""advertising""]",4,Marketing Coordinators & Specialists,"[""social media"", ""digital marketing"", ""brand management""]",48,7,2025-10-25 22:04:17,en,How is AI changing {keyword} approaches?,0.63,0.6008124086841915,0.63
48500961,web development,it,What security considerations should be taken when using web development?,strategy,Beginner,"[""Introduction to web development"", ""Key points and analysis"", ""Practical examples"", ""Expert insights"", ""Action items"", ""Conclusion""]","[""technology"", ""development"", ""it"", ""programming"", ""strategy"", ""web""]",4,Students & Entry-level Developers,"[""data science"", ""cloud computing"", ""machine learning"", ""cybersecurity""]",72,10,2025-10-25 22:04:17,en,What security considerations should be taken when using {keyword}?,0.86,0.42807568431248477,0.88
48500962,investment planning,economics,How do you identify opportunities in investment planning markets?,implementation,Intermediate,"[""Overview of investment planning"", ""Step-by-step implementation"", ""Best practices and tips"", ""Common challenges and solutions"", ""Tools and resources needed"", ""Conclusion and next steps""]","[""investment"", ""planning"", ""implementation"", ""market"", ""business"", ""economics""]",6,Individual Investors & Analysts,"[""portfolio management"", ""financial modeling"", ""market analysis""]",65,9,2025-10-25 22:04:17,en,How do you identify opportunities in {keyword} markets?,0.81,0.7853445960345324,0.77
48500963,data science,it,Which frameworks support data science implementation?,analysis,Expert,"[""Introduction to data science"", ""Key points and analysis"", ""Practical examples"", ""Expert insights"", ""Action items"", ""Conclusion""]","[""software"", ""analysis"", ""it"", ""programming"", ""science"", ""data""]",4,Architects & Technical Directors,"[""web development"", ""cloud computing"", ""cybersecurity"", ""machine learning""]",53,6,2025-10-25 22:04:17,en,Which frameworks support {keyword} implementation?,0.84,1.0,0.6
48500964,social media,marketing,What does the future hold for social media?,planning,Advanced,"[""Introduction to social media"", ""Key points and analysis"", ""Practical examples"", ""Expert insights"", ""Action items"", ""Conclusion""]","[""planning"", ""media"", ""promotion"", ""marketing"", ""social"", ""advertising""]",4,Marketing Managers & Strategists,"[""content marketing"", ""brand management"", ""digital marketing""]",43,8,2025-10-25 22:04:17,en,What does the future hold for {keyword}?,0.7,0.8041364045420369,0.36
48500965,brand management,marketing,What A/B tests should you run for brand management?,strategy,Expert,"[""Introduction to brand management"", ""Key points and analysis"", ""Practical examples"", ""Expert insights"", ""Action items"", ""Conclusion""]","[""promotion"", ""marketing"", ""management"", ""digital"", ""strategy"", ""brand""]",4,Marketing Directors & CMOs,"[""social media"", ""content marketing"", ""digital marketing""]",51,9,2025-10-25 22:04:17,en,What A/B tests should you run for {keyword}?,0.83,1.0,0.34
48500966,brand management,marketing,What demographics respond best to brand management?,implementation,Intermediate,"[""Introduction to brand management"", ""Key points and analysis"", ""Practical examples"", ""Expert insights"", ""Action items"", ""Conclusion""]","[""implementation"", ""marketing"", ""management"", ""advertising"", ""digital"", ""brand""]",4,Marketing Coordinators & Specialists,"[""content marketing"", ""social media"", ""digital marketing""]",51,7,2025-10-25 22:04:17,en,What demographics respond best to {keyword}?,0.78,0.6092141519903056,0.72
48500967,portfolio management,economics,What are the risks associated with portfolio management?,evaluation,Expert,"[""Introduction to portfolio management"", ""Key concepts and definitions"", ""Main categories or types"", ""Examples and case studies"", ""Benefits and advantages"", ""Summary and recommendations""]","[""portfolio"", ""management"", ""evaluation"", ""market"", ""business"", ""economics""]",6,Portfolio Managers & Financial Experts,"[""financial modeling"", ""investment planning"", ""market analysis""]",56,8,2025-10-25 22:04:17,en,What are the risks associated with {keyword}?,0.7,1.0,0.61
48500968,machine learning,it,What design patterns work best with machine learning?,analysis,Advanced,"[""Introduction to machine learning"", ""Key points and analysis"", ""Practical examples"", ""Expert insights"", ""Action items"", ""Conclusion""]","[""development"", ""analysis"", ""it"", ""programming"", ""learning"", ""machine""]",4,Senior Developers & Tech Leads,"[""data science"", ""cybersecurity"", ""cloud computing"", ""web development""]",53,8,2025-10-25 22:04:17,en,What design patterns work best with {keyword}?,0.62,0.8766343017462402,0.36
48500969,market analysis,economics,How do you analyze market trends in market analysis?,how_to,Beginner,"[""Overview of market analysis"", ""Step-by-step implementation"", ""Best practices and tips"", ""Common challenges and solutions"", ""Tools and resources needed"", ""Conclusion and next steps""]","[""how_to"", ""analysis"", ""market"", ""business"", ""economics""]",6,Students & New Investors,"[""financial modeling"", ""portfolio management"", ""investment planning""]",52,9,2025-10-25 22:04:17,en,How do you analyze market trends in {keyword}?,0.87,0.34340693137224093,0.54
48500970,content marketing,marketing,What tools are essential for content marketing analytics?,best_practice,Beginner,"[""Introduction to content marketing"", ""Key points and analysis"", ""Practical examples"", ""Expert insights"", ""Action items"", ""Conclusion""]","[""content"", ""promotion"", ""best_practice"", ""marketing"", ""digital""]",4,Marketing Students & Interns,"[""digital marketing"", ""social media"", ""brand management""]",57,8,2025-10-25 22:04:17,en,What tools are essential for {keyword} analytics?,0.89,0.4175683157318307,0.37
48500971,web development,it,What skills are needed to master web development?,comparison,Intermediate,"[""Introduction to web development"", ""Key points and analysis"", ""Practical examples"", ""Expert insights"", ""Action items"", ""Conclusion""]","[""software"", ""development"", ""it"", ""comparison"", ""programming"", ""web""]",4,Junior to Mid-level Developers,"[""data science"", ""cloud computing"", ""machine learning"", ""cybersecurity""]",49,8,2025-10-25 22:04:17,en,What skills are needed to master {keyword}?,0.75,0.6681368158827041,0.76
48500972,cybersecurity,it,What certifications are valuable for cybersecurity professionals?,analysis,Intermediate,"[""Introduction to cybersecurity"", ""Key points and analysis"", ""Practical examples"", ""Expert insights"", ""Action items"", ""Conclusion""]","[""analysis"", ""it"", ""programming"", ""cybersecurity"", ""technology""]",4,Junior to Mid-level Developers,"[""machine learning"", ""cloud computing"", ""web development"", ""data science""]",65,7,2025-10-25 22:04:17,en,What certifications are valuable for {keyword} professionals?,0.66,0.6275919272068685,0.55
48500973,machine learning,it,What are the best practices for machine learning development?,evaluation,Expert,"[""Introduction to machine learning"", ""Key concepts and definitions"", ""Main categories or types"", ""Examples and case studies"", ""Benefits and advantages"", ""Summary and recommendations""]","[""development"", ""it"", ""programming"", ""learning"", ""evaluation"", ""machine""]",6,Architects & Technical Directors,"[""cybersecurity"", ""data science"", ""web development"", ""cloud computing""]",61,9,2025-10-25 22:04:17,en,What are the best practices for {keyword} development?,0.73,1.0,0.47
48500974,content marketing,marketing,How do you reach new customers through content marketing?,best_practice,Intermediate,"[""Overview of content marketing"", ""Step-by-step implementation"", ""Best practices and tips"", ""Common challenges and solutions"", ""Tools and resources needed"", ""Conclusion and next steps""]","[""content"", ""promotion"", ""best_practice"", ""marketing"", ""advertising""]",6,Marketing Coordinators & Specialists,"[""social media"", ""digital marketing"", ""brand management""]",57,9,2025-10-25 22:04:17,en,How do you reach new customers through {keyword}?,0.6,0.6296742908654304,0.35
48500975,digital marketing,marketing,What does the future hold for digital marketing?,analysis,Beginner,"[""Introduction to digital marketing"", ""Key points and analysis"", ""Practical examples"", ""Expert insights"", ""Action items"", ""Conclusion""]","[""marketing"", ""promotion"", ""analysis"", ""digital""]",4,Marketing Students & Interns,"[""content marketing"", ""social media"", ""brand management""]",48,8,2025-10-25 22:04:17,en,What does the future hold for {keyword}?,0.88,0.37568549119462635,0.71
48500976,portfolio management,economics,How do you report on portfolio management performance to stakeholders?,troubleshooting,Beginner,"[""Overview of portfolio management"", ""Step-by-step implementation"", ""Best practices and tips"", ""Common challenges and solutions"", ""Tools and resources needed"", ""Conclusion and next steps""]","[""investment"", ""finance"", ""portfolio"", ""troubleshooting"", ""management"", ""economics""]",6,Students & New Investors,"[""investment planning"", ""market analysis"", ""financial modeling""]",70,10,2025-10-25 22:04:17,en,How do you report on {keyword} performance to stakeholders?,0.67,0.3702277713628898,0.32
48500977,content marketing,marketing,How do you innovate within content marketing?,optimization,Beginner,"[""Overview of content marketing"", ""Step-by-step implementation"", ""Best practices and tips"", ""Common challenges and solutions"", ""Tools and resources needed"", ""Conclusion and next steps""]","[""content"", ""marketing"", ""digital"", ""advertising"", ""optimization""]",6,Marketing Students & Interns,"[""digital marketing"", ""brand management"", ""social media""]",45,7,2025-10-25 22:04:17,en,How do you innovate within {keyword}?,0.63,0.4576769058313529,0.36
48500978,cybersecurity,it,How do you troubleshoot common issues with cybersecurity?,analysis,Advanced,"[""Overview of cybersecurity"", ""Step-by-step implementation"", ""Best practices and tips"", ""Common challenges and solutions"", ""Tools and resources needed"", ""Conclusion and next steps""]","[""software"", ""analysis"", ""it"", ""programming"", ""cybersecurity""]",5,Senior Developers & Tech Leads,"[""web development"", ""data science"", ""cloud computing"", ""machine learning""]",57,8,2025-10-25 22:04:17,en,How do you troubleshoot common issues with {keyword}?,0.84,0.960557829213478,0.45
48500979,social media,marketing,How do you improve social media conversion rates?,strategy,Expert,"[""Overview of social media"", ""Step-by-step implementation"", ""Best practices and tips"", ""Common challenges and solutions"", ""Tools and resources needed"", ""Conclusion and next steps""]","[""media"", ""promotion"", ""marketing"", ""social"", ""branding"", ""strategy""]",6,Marketing Directors & CMOs,"[""brand management"", ""content marketing"", ""digital marketing""]",49,8,2025-10-25 22:04:17,en,How do you improve {keyword} conversion rates?,0.64,1.0,0.66
48500980,brand management,marketing,How do you improve brand management conversion rates?,evaluation,Expert,"[""Overview of brand management"", ""Step-by-step implementation"", ""Best practices and tips"", ""Common challenges and solutions"", ""Tools and resources needed"", ""Conclusion and next steps""]","[""marketing"", ""management"", ""advertising"", ""branding"", ""evaluation"", ""brand""]",6,Marketing Directors & CMOs,"[""social media"", ""content marketing"", ""digital marketing""]",53,8,2025-10-25 22:04:17,en,How do you improve {keyword} conversion rates?,0.6,1.0,0.58
48500981,machine learning,it,What is the recommended architecture for machine learning systems?,analysis,Intermediate,"[""Introduction to machine learning"", ""Key points and analysis"", ""Practical examples"", ""Expert insights"", ""Action items"", ""Conclusion""]","[""analysis"", ""it"", ""development"", ""learning"", ""machine"", ""technology""]",4,Junior to Mid-level Developers,"[""cloud computing"", ""web development"", ""cybersecurity"", ""data science""]",66,9,2025-10-25 22:04:17,en,What is the recommended architecture for {keyword} systems?,0.77,0.7415167422060404,0.89
48500982,data science,it,How do you convince stakeholders to invest in data science?,best_practice,Beginner,"[""Overview of data science"", ""Step-by-step implementation"", ""Best practices and tips"", ""Common challenges and solutions"", ""Tools and resources needed"", ""Conclusion and next steps""]","[""technology"", ""development"", ""it"", ""best_practice"", ""science"", ""data""]",6,Students & Entry-level Developers,"[""cloud computing"", ""web development"", ""cybersecurity"", ""machine learning""]",59,10,2025-10-25 22:04:17,en,How do you convince stakeholders to invest in {keyword}?,0.67,0.4922341779545575,0.82
48500983,social media,marketing,What tools are essential for social media analytics?,optimization,Advanced,"[""Introduction to social media"", ""Key points and analysis"", ""Practical examples"", ""Expert insights"", ""Action items"", ""Conclusion""]","[""media"", ""digital"", ""marketing"", ""social"", ""advertising"", ""optimization""]",4,Marketing Managers & Strategists,"[""content marketing"", ""brand management"", ""digital marketing""]",52,8,2025-10-25 22:04:17,en,What tools are essential for {keyword} analytics?,0.83,0.8458068242341521,0.67
48500984,brand management,marketing,How do you optimize brand management for mobile users?,analysis,Advanced,"[""Overview of brand management"", ""Step-by-step implementation"", ""Best practices and tips"", ""Common challenges and solutions"", ""Tools and resources needed"", ""Conclusion and next steps""]","[""analysis"", ""digital"", ""marketing"", ""management"", ""branding"", ""brand""]",6,Marketing Managers & Strategists,"[""digital marketing"", ""social media"", ""content marketing""]",54,9,2025-10-25 22:04:17,en,How do you optimize {keyword} for mobile users?,0.91,0.8911281032615185,0.48
48500985,machine learning,it,How can machine learning improve system performance and scalability?,planning,Expert,"[""Introduction to machine learning"", ""Key points and analysis"", ""Practical examples"", ""Expert insights"", ""Action items"", ""Conclusion""]","[""planning"", ""development"", ""it"", ""programming"", ""learning"", ""machine""]",4,Architects & Technical Directors,"[""web development"", ""data science"", ""cybersecurity"", ""cloud computing""]",68,9,2025-10-25 22:04:17,en,How can {keyword} improve system performance and scalability?,0.86,1.0,0.36
48500986,brand management,marketing,How do you measure the ROI of brand management campaigns?,how_to,Advanced,"[""Overview of brand management"", ""Step-by-step implementation"", ""Best practices and tips"", ""Common challenges and solutions"", ""Tools and resources needed"", ""Conclusion and next steps""]","[""how_to"", ""marketing"", ""management"", ""advertising"", ""branding"", ""brand""]",6,Marketing Managers & Strategists,"[""digital marketing"", ""content marketing"", ""social media""]",57,10,2025-10-25 22:04:17,en,How do you measure the ROI of {keyword} campaigns?,0.88,0.826249821629485,0.63
48500987,investment planning,economics,What metrics are most important for investment planning?,how_to,Intermediate,"[""Introduction to investment planning"", ""Key points and analysis"", ""Practical examples"", ""Expert insights"", ""Action items"", ""Conclusion""]","[""investment"", ""how_to"", ""planning"", ""business"", ""economics""]",4,Individual Investors & Analysts,"[""portfolio management"", ""market analysis"", ""financial modeling""]",56,8,2025-10-25 22:04:17,en,What metrics are most important for {keyword}?,0.72,0.7407535115214143,0.87
48500988,social media,marketing,What messaging works best in social media campaigns?,planning,Advanced,"[""Introduction to social media"", ""Key points and analysis"", ""Practical examples"", ""Expert insights"", ""Action items"", ""Conclusion""]","[""planning"", ""media"", ""marketing"", ""digital"", ""social"", ""branding""]",4,Marketing Managers & Strategists,"[""content marketing"", ""brand management"", ""digital marketing""]",52,8,2025-10-25 22:04:17,en,What messaging works best in {keyword} campaigns?,0.83,0.8765090203713635,0.7
48500989,digital marketing,marketing,How do you measure the ROI of digital marketing campaigns?,strategy,Beginner,"[""Overview of digital marketing"", ""Step-by-step implementation"", ""Best practices and tips"", ""Common challenges and solutions"", ""Tools and resources needed"", ""Conclusion and next steps""]","[""marketing"", ""digital"", ""advertising"", ""branding"", ""strategy""]",6,Marketing Students & Interns,"[""social media"", ""brand management"", ""content marketing""]",58,10,2025-10-25 22:04:17,en,How do you measure the ROI of {keyword} campaigns?,0.77,0.40392151662533143,0.88
48500990,market analysis,economics,How do you report on market analysis performance to stakeholders?,optimization,Intermediate,"[""Overview of market analysis"", ""Step-by-step implementation"", ""Best practices and tips"", ""Common challenges and solutions"", ""Tools and resources needed"", ""Conclusion and next steps""]","[""investment"", ""analysis"", ""business"", ""market"", ""optimization"", ""economics""]",6,Individual Investors & Analysts,"[""financial modeling"", ""investment planning"", ""portfolio management""]",65,10,2025-10-25 22:04:17,en,How do you report on {keyword} performance to stakeholders?,0.88,0.7464824163681472,0.61
48500991,investment planning,economics,What are the risks associated with investment planning?,how_to,Beginner,"[""Introduction to investment planning"", ""Key concepts and definitions"", ""Main categories or types"", ""Examples and case studies"", ""Benefits and advantages"", ""Summary and recommendations""]","[""investment"", ""how_to"", ""planning"", ""finance"", ""economics""]",6,Students & New Investors,"[""market analysis"", ""portfolio management"", ""financial modeling""]",55,8,2025-10-25 22:04:17,en,What are the risks associated with {keyword}?,0.65,0.30820424034409555,0.56
48500992,financial modeling,economics,What are the seasonal patterns in financial modeling?,evaluation,Advanced,"[""Introduction to financial modeling"", ""Key concepts and definitions"", ""Main categories or types"", ""Examples and case studies"", ""Benefits and advantages"", ""Summary and recommendations""]","[""investment"", ""modeling"", ""financial"", ""evaluation"", ""market"", ""economics""]",6,Professional Investors & Advisors,"[""market analysis"", ""portfolio management"", ""investment planning""]",53,8,2025-10-25 22:04:17,en,What are the seasonal patterns in {keyword}?,0.89,0.9389592669422193,0.47
48500993,cybersecurity,it,How do you optimize cybersecurity for different platforms?,troubleshooting,Beginner,"[""Overview of cybersecurity"", ""Step-by-step implementation"", ""Best practices and tips"", ""Common challenges and solutions"", ""Tools and resources needed"", ""Conclusion and next steps""]","[""development"", ""it"", ""troubleshooting"", ""cybersecurity"", ""technology""]",5,Students & Entry-level Developers,"[""data science"", ""cloud computing"", ""machine learning"", ""web development""]",58,8,2025-10-25 22:04:17,en,How do you optimize {keyword} for different platforms?,0.84,0.41721671009984207,0.85
48500994,investment planning,economics,How does global economics impact investment planning?,planning,Advanced,"[""Introduction to investment planning"", ""Key points and analysis"", ""Practical examples"", ""Expert insights"", ""Action items"", ""Conclusion""]","[""investment"", ""planning"", ""finance"", ""business"", ""economics""]",4,Professional Investors & Advisors,"[""market analysis"", ""financial modeling"", ""portfolio management""]",53,7,2025-10-25 22:04:17,en,How does global economics impact {keyword}?,0.73,0.8457893228607078,0.69
48500995,web development,it,How do you convince stakeholders to invest in web development?,best_practice,Beginner,"[""Overview of web development"", ""Step-by-step implementation"", ""Best practices and tips"", ""Common challenges and solutions"", ""Tools and resources needed"", ""Conclusion and next steps""]","[""software"", ""development"", ""it"", ""best_practice"", ""web""]",6,Students & Entry-level Developers,"[""machine learning"", ""cybersecurity"", ""data science"", ""cloud computing""]",62,10,2025-10-25 22:04:17,en,How do you convince stakeholders to invest in {keyword}?,0.71,0.43181761169483635,0.36
48500996,market analysis,economics,How does global economics impact market analysis?,evaluation,Advanced,"[""Introduction to market analysis"", ""Key points and analysis"", ""Practical examples"", ""Expert insights"", ""Action items"", ""Conclusion""]","[""investment"", ""analysis"", ""evaluation"", ""market"", ""economics""]",4,Professional Investors & Advisors,"[""financial modeling"", ""portfolio management"", ""investment planning""]",49,7,2025-10-25 22:04:17,en,How does global economics impact {keyword}?,0.92,0.9107686115196008,0.47
48500997,machine learning,it,How do you troubleshoot common issues with machine learning?,troubleshooting,Beginner,"[""Overview of machine learning"", ""Step-by-step implementation"", ""Best practices and tips"", ""Common challenges and solutions"", ""Tools and resources needed"", ""Conclusion and next steps""]","[""software"", ""it"", ""troubleshooting"", ""learning"", ""machine"", ""technology""]",6,Students & Entry-level Developers,"[""data science"", ""web development"", ""cloud computing"", ""cybersecurity""]",60,9,2025-10-25 22:04:17,en,How do you troubleshoot common issues with {keyword}?,0.8,0.46350839182777415,0.35
48500998,social media,marketing,How do you innovate within social media?,strategy,Expert,"[""Overview of social media"", ""Step-by-step implementation"", ""Best practices and tips"", ""Common challenges and solutions"", ""Tools and resources needed"", ""Conclusion and next steps""]","[""media"", ""promotion"", ""marketing"", ""social"", ""branding"", ""strategy""]",6,Marketing Directors & CMOs,"[""brand management"", ""digital marketing"", ""content marketing""]",40,7,2025-10-25 22:04:17,en,How do you innovate within {keyword}?,0.86,1.0,0.87
48500999,social media,marketing,How do you improve social media conversion rates?,optimization,Beginner,"[""Overview of social media"", ""Step-by-step implementation"", ""Best practices and tips"", ""Common challenges and solutions"", ""Tools and resources needed"", ""Conclusion and next steps""]","[""media"", ""promotion"", ""marketing"", ""digital"", ""social"", ""optimization""]",6,Marketing Students & Interns,"[""brand management"", ""digital marketing"", ""content marketing""]",49,8,2025-10-25 22:04:17,en,How do you improve {keyword} conversion rates?,0.95,0.44983709509762854,0.76
48501000,data science,it,How do you measure the success of data science projects?,how_to,Beginner,"[""Overview of data science"", ""Step-by-step implementation"", ""Best practices and tips"", ""Common challenges and solutions"", ""Tools and resources needed"", ""Conclusion and next steps""]","[""how_to"", ""software"", ""development"", ""it"", ""science"", ""data""]",6,Students & Entry-level Developers,"[""cybersecurity"", ""machine learning"", ""web development"", ""cloud computing""]",56,10,2025-10-25 22:04:17,en,How do you measure the success of {keyword} projects?,0.72,0.4109948967131122,0.32
48501001,investment planning,economics,What is the optimal allocation for investment planning in a portfolio?,planning,Expert,"[""Introduction to investment planning"", ""Key points and analysis"", ""Practical examples"", ""Expert insights"", ""Action items"", ""Conclusion""]","[""investment"", ""planning"", ""finance"", ""business"", ""economics""]",4,Portfolio Managers & Financial Experts,"[""portfolio management"", ""market analysis"", ""financial modeling""]",70,11,2025-10-25 22:04:17,en,What is the optimal allocation for {keyword} in a portfolio?,0.81,1.0,0.9
48501002,content marketing,marketing,What does the future hold for content marketing?,analysis,Advanced,"[""Introduction to content marketing"", ""Key points and analysis"", ""Practical examples"", ""Expert insights"", ""Action items"", ""Conclusion""]","[""content"", ""analysis"", ""marketing"", ""digital"", ""branding""]",4,Marketing Managers & Strategists,"[""social media"", ""digital marketing"", ""brand management""]",48,8,2025-10-25 22:04:17,en,What does the future hold for {keyword}?,0.86,0.8491356176445015,0.64
48501003,machine learning,it,How do you implement machine learning in a production environment?,strategy,Expert,"[""Overview of machine learning"", ""Step-by-step implementation"", ""Best practices and tips"", ""Common challenges and solutions"", ""Tools and resources needed"", ""Conclusion and next steps""]","[""software"", ""it"", ""learning"", ""strategy"", ""machine"", ""technology""]",6,Architects & Technical Directors,"[""data science"", ""web development"", ""cybersecurity"", ""cloud computing""]",66,10,2025-10-25 22:04:17,en,How do you implement {keyword} in a production environment?,0.9,1.0,0.58
