record_id,keyword,category,question,question_type,difficulty_level,answer_outline,tags,estimated_read_time,target_audience,related_topics,question_length,word_count,created_date,language,source_template,engagement_score,complexity_score,popularity_score
41200958,web development,it,What certifications are valuable for web development professionals?,implementation,Advanced,"[""Introduction to web development"", ""Key points and analysis"", ""Practical examples"", ""Expert insights"", ""Action items"", ""Conclusion""]","[""development"", ""it"", ""implementation"", ""programming"", ""web""]",4,Senior Developers & Tech Leads,"[""data science"", ""cloud computing"", ""machine learning"", ""cybersecurity""]",67,8,2025-10-25 21:54:03,en,What certifications are valuable for {keyword} professionals?,0.64,0.9845825124640758,0.53
41200959,cloud computing,it,Which frameworks support cloud computing implementation?,optimization,Beginner,"[""Introduction to cloud computing"", ""Key points and analysis"", ""Practical examples"", ""Expert insights"", ""Action items"", ""Conclusion""]","[""computing"", ""cloud"", ""software"", ""it"", ""programming"", ""optimization""]",4,Students & Entry-level Developers,"[""cybersecurity"", ""machine learning"", ""data science"", ""web development""]",56,6,2025-10-25 21:54:03,en,Which frameworks support {keyword} implementation?,0.94,0.3613168413147539,0.56
41200960,cybersecurity,it,How do you choose the right technology stack for cybersecurity?,planning,Beginner,"[""Overview of cybersecurity"", ""Step-by-step implementation"", ""Best practices and tips"", ""Common challenges and solutions"", ""Tools and resources needed"", ""Conclusion and next steps""]","[""software"", ""planning"", ""it"", ""cybersecurity"", ""technology""]",5,Students & Entry-level Developers,"[""machine learning"", ""web development"", ""data science"", ""cloud computing""]",63,10,2025-10-25 21:54:03,en,How do you choose the right technology stack for {keyword}?,0.79,0.3280033033667054,0.73
41200961,investment planning,economics,How do you diversify your portfolio using investment planning?,evaluation,Beginner,"[""Overview of investment planning"", ""Step-by-step implementation"", ""Best practices and tips"", ""Common challenges and solutions"", ""Tools and resources needed"", ""Conclusion and next steps""]","[""investment"", ""planning"", ""finance"", ""evaluation"", ""economics""]",6,Students & New Investors,"[""portfolio management"", ""market analysis"", ""financial modeling""]",62,9,2025-10-25 21:54:03,en,How do you diversify your portfolio using {keyword}?,0.84,0.3072912879874227,0.67
41200962,machine learning,it,What security considerations should be taken when using machine learning?,planning,Intermediate,"[""Introduction to machine learning"", ""Key points and analysis"", ""Practical examples"", ""Expert insights"", ""Action items"", ""Conclusion""]","[""planning"", ""software"", ""it"", ""learning"", ""machine"", ""technology""]",4,Junior to Mid-level Developers,"[""data science"", ""cloud computing"", ""cybersecurity"", ""web development""]",73,10,2025-10-25 21:54:03,en,What security considerations should be taken when using {keyword}?,0.85,0.6185291117154215,0.81
41200963,cloud computing,it,What are the cost considerations for cloud computing?,analysis,Expert,"[""Introduction to cloud computing"", ""Key concepts and definitions"", ""Main categories or types"", ""Examples and case studies"", ""Benefits and advantages"", ""Summary and recommendations""]","[""computing"", ""software"", ""analysis"", ""it"", ""programming"", ""cloud""]",6,Architects & Technical Directors,"[""cybersecurity"", ""machine learning"", ""web development"", ""data science""]",53,8,2025-10-25 21:54:03,en,What are the cost considerations for {keyword}?,0.83,1.0,0.72
41200964,digital marketing,marketing,How do you develop an effective digital marketing strategy?,evaluation,Expert,"[""Overview of digital marketing"", ""Step-by-step implementation"", ""Best practices and tips"", ""Common challenges and solutions"", ""Tools and resources needed"", ""Conclusion and next steps""]","[""evaluation"", ""marketing"", ""advertising"", ""digital""]",6,Marketing Directors & CMOs,"[""brand management"", ""social media"", ""content marketing""]",59,9,2025-10-25 21:54:03,en,How do you develop an effective {keyword} strategy?,0.74,1.0,0.57
41200965,investment planning,economics,What is the optimal allocation for investment planning in a portfolio?,implementation,Advanced,"[""Introduction to investment planning"", ""Key points and analysis"", ""Practical examples"", ""Expert insights"", ""Action items"", ""Conclusion""]","[""investment"", ""planning"", ""implementation"", ""market"", ""business"", ""economics""]",4,Professional Investors & Advisors,"[""market analysis"", ""portfolio management"", ""financial modeling""]",70,11,2025-10-25 21:54:03,en,What is the optimal allocation for {keyword} in a portfolio?,0.85,0.9759896080019812,0.69
41200966,digital marketing,marketing,How is AI changing digital marketing approaches?,how_to,Advanced,"[""Introduction to digital marketing"", ""Key points and analysis"", ""Practical examples"", ""Expert insights"", ""Action items"", ""Conclusion""]","[""how_to"", ""marketing"", ""digital"", ""advertising"", ""branding""]",4,Marketing Managers & Strategists,"[""brand management"", ""content marketing"", ""social media""]",48,7,2025-10-25 21:54:03,en,How is AI changing {keyword} approaches?,0.7,0.8569283418332181,0.31
41200967,portfolio management,economics,What insurance options are available for portfolio management?,analysis,Beginner,"[""Introduction to portfolio management"", ""Key points and analysis"", ""Practical examples"", ""Expert insights"", ""Action items"", ""Conclusion""]","[""investment"", ""finance"", ""analysis"", ""portfolio"", ""management"", ""economics""]",4,Students & New Investors,"[""investment planning"", ""market analysis"", ""financial modeling""]",62,8,2025-10-25 21:54:03,en,What insurance options are available for {keyword}?,0.75,0.4380055794057104,0.8
41200968,portfolio management,economics,How do you benchmark portfolio management against alternatives?,best_practice,Advanced,"[""Overview of portfolio management"", ""Step-by-step implementation"", ""Best practices and tips"", ""Common challenges and solutions"", ""Tools and resources needed"", ""Conclusion and next steps""]","[""finance"", ""portfolio"", ""best_practice"", ""management"", ""market"", ""economics""]",6,Professional Investors & Advisors,"[""investment planning"", ""financial modeling"", ""market analysis""]",63,8,2025-10-25 21:54:03,en,How do you benchmark {keyword} against alternatives?,0.64,0.8865769709985988,0.46
41200969,cloud computing,it,What are the latest trends in cloud computing technology?,analysis,Expert,"[""Introduction to cloud computing"", ""Key concepts and definitions"", ""Main categories or types"", ""Examples and case studies"", ""Benefits and advantages"", ""Summary and recommendations""]","[""computing"", ""analysis"", ""it"", ""programming"", ""cloud"", ""technology""]",6,Architects & Technical Directors,"[""web development"", ""cybersecurity"", ""data science"", ""machine learning""]",57,9,2025-10-25 21:54:03,en,What are the latest trends in {keyword} technology?,0.66,1.0,0.87
41200970,social media,marketing,How is AI changing social media approaches?,comparison,Beginner,"[""Introduction to social media"", ""Key points and analysis"", ""Practical examples"", ""Expert insights"", ""Action items"", ""Conclusion""]","[""media"", ""promotion"", ""comparison"", ""marketing"", ""social"", ""advertising""]",4,Marketing Students & Interns,"[""digital marketing"", ""brand management"", ""content marketing""]",43,7,2025-10-25 21:54:03,en,How is AI changing {keyword} approaches?,0.68,0.42543636202377394,0.43
41200971,cybersecurity,it,What are the key components of a cybersecurity implementation?,strategy,Expert,"[""Introduction to cybersecurity"", ""Key concepts and definitions"", ""Main categories or types"", ""Examples and case studies"", ""Benefits and advantages"", ""Summary and recommendations""]","[""software"", ""it"", ""strategy"", ""cybersecurity"", ""technology""]",5,Architects & Technical Directors,"[""cloud computing"", ""machine learning"", ""web development"", ""data science""]",62,9,2025-10-25 21:54:03,en,What are the key components of a {keyword} implementation?,0.76,1.0,0.71
41200972,cloud computing,it,What are the key components of a cloud computing implementation?,troubleshooting,Beginner,"[""Introduction to cloud computing"", ""Key concepts and definitions"", ""Main categories or types"", ""Examples and case studies"", ""Benefits and advantages"", ""Summary and recommendations""]","[""computing"", ""software"", ""development"", ""it"", ""troubleshooting"", ""cloud""]",6,Students & Entry-level Developers,"[""cybersecurity"", ""data science"", ""machine learning"", ""web development""]",64,10,2025-10-25 21:54:03,en,What are the key components of a {keyword} implementation?,0.77,0.35868323738401986,0.67
41200973,social media,marketing,What A/B tests should you run for social media?,planning,Expert,"[""Introduction to social media"", ""Key points and analysis"", ""Practical examples"", ""Expert insights"", ""Action items"", ""Conclusion""]","[""planning"", ""media"", ""marketing"", ""digital"", ""social"", ""advertising""]",4,Marketing Directors & CMOs,"[""brand management"", ""digital marketing"", ""content marketing""]",47,9,2025-10-25 21:54:03,en,What A/B tests should you run for {keyword}?,0.95,1.0,0.75
41200974,investment planning,economics,What insurance options are available for investment planning?,comparison,Intermediate,"[""Introduction to investment planning"", ""Key points and analysis"", ""Practical examples"", ""Expert insights"", ""Action items"", ""Conclusion""]","[""investment"", ""planning"", ""comparison"", ""market"", ""economics""]",4,Individual Investors & Analysts,"[""financial modeling"", ""market analysis"", ""portfolio management""]",61,8,2025-10-25 21:54:03,en,What insurance options are available for {keyword}?,0.83,0.6855850716246826,0.4
41200975,cloud computing,it,What certifications are valuable for cloud computing professionals?,troubleshooting,Intermediate,"[""Introduction to cloud computing"", ""Key points and analysis"", ""Practical examples"", ""Expert insights"", ""Action items"", ""Conclusion""]","[""computing"", ""software"", ""development"", ""it"", ""troubleshooting"", ""cloud""]",4,Junior to Mid-level Developers,"[""machine learning"", ""cybersecurity"", ""web development"", ""data science""]",67,8,2025-10-25 21:54:03,en,What certifications are valuable for {keyword} professionals?,0.9,0.7018948538427847,0.63
41200976,financial modeling,economics,What insurance options are available for financial modeling?,implementation,Intermediate,"[""Introduction to financial modeling"", ""Key points and analysis"", ""Practical examples"", ""Expert insights"", ""Action items"", ""Conclusion""]","[""investment"", ""implementation"", ""modeling"", ""financial"", ""business"", ""economics""]",4,Individual Investors & Analysts,"[""investment planning"", ""portfolio management"", ""market analysis""]",60,8,2025-10-25 21:54:03,en,What insurance options are available for {keyword}?,0.79,0.7564645877620542,0.75
41200977,digital marketing,marketing,What tools are essential for digital marketing analytics?,optimization,Intermediate,"[""Introduction to digital marketing"", ""Key points and analysis"", ""Practical examples"", ""Expert insights"", ""Action items"", ""Conclusion""]","[""marketing"", ""optimization"", ""promotion"", ""digital""]",4,Marketing Coordinators & Specialists,"[""content marketing"", ""brand management"", ""social media""]",57,8,2025-10-25 21:54:03,en,What tools are essential for {keyword} analytics?,0.61,0.7185021568119465,0.67
41200978,social media,marketing,What tools are essential for social media analytics?,optimization,Beginner,"[""Introduction to social media"", ""Key points and analysis"", ""Practical examples"", ""Expert insights"", ""Action items"", ""Conclusion""]","[""media"", ""promotion"", ""marketing"", ""social"", ""advertising"", ""optimization""]",4,Marketing Students & Interns,"[""digital marketing"", ""content marketing"", ""brand management""]",52,8,2025-10-25 21:54:03,en,What tools are essential for {keyword} analytics?,0.61,0.31304655236064194,0.87
41200979,content marketing,marketing,How do you track and analyze content marketing performance?,strategy,Advanced,"[""Overview of content marketing"", ""Step-by-step implementation"", ""Best practices and tips"", ""Common challenges and solutions"", ""Tools and resources needed"", ""Conclusion and next steps""]","[""content"", ""marketing"", ""digital"", ""advertising"", ""strategy""]",6,Marketing Managers & Strategists,"[""brand management"", ""digital marketing"", ""social media""]",59,9,2025-10-25 21:54:03,en,How do you track and analyze {keyword} performance?,0.8,0.8509357528799593,0.58
41200980,investment planning,economics,How do you identify opportunities in investment planning markets?,strategy,Advanced,"[""Overview of investment planning"", ""Step-by-step implementation"", ""Best practices and tips"", ""Common challenges and solutions"", ""Tools and resources needed"", ""Conclusion and next steps""]","[""investment"", ""planning"", ""business"", ""strategy"", ""economics""]",6,Professional Investors & Advisors,"[""market analysis"", ""financial modeling"", ""portfolio management""]",65,9,2025-10-25 21:54:03,en,How do you identify opportunities in {keyword} markets?,0.69,0.8039099841410229,0.41
41200981,brand management,marketing,How do you develop an effective brand management strategy?,troubleshooting,Advanced,"[""Overview of brand management"", ""Step-by-step implementation"", ""Best practices and tips"", ""Common challenges and solutions"", ""Tools and resources needed"", ""Conclusion and next steps""]","[""promotion"", ""troubleshooting"", ""marketing"", ""management"", ""advertising"", ""brand""]",6,Marketing Managers & Strategists,"[""digital marketing"", ""content marketing"", ""social media""]",58,9,2025-10-25 21:54:03,en,How do you develop an effective {keyword} strategy?,0.62,0.8969056720551519,0.78
41200982,data science,it,How do you optimize data science for different platforms?,best_practice,Intermediate,"[""Overview of data science"", ""Step-by-step implementation"", ""Best practices and tips"", ""Common challenges and solutions"", ""Tools and resources needed"", ""Conclusion and next steps""]","[""technology"", ""development"", ""it"", ""best_practice"", ""science"", ""data""]",6,Junior to Mid-level Developers,"[""web development"", ""cloud computing"", ""cybersecurity"", ""machine learning""]",57,9,2025-10-25 21:54:03,en,How do you optimize {keyword} for different platforms?,0.86,0.6070054565322431,0.32
41200983,cybersecurity,it,How do you integrate cybersecurity with existing systems?,best_practice,Intermediate,"[""Overview of cybersecurity"", ""Step-by-step implementation"", ""Best practices and tips"", ""Common challenges and solutions"", ""Tools and resources needed"", ""Conclusion and next steps""]","[""it"", ""programming"", ""best_practice"", ""cybersecurity"", ""technology""]",5,Junior to Mid-level Developers,"[""machine learning"", ""data science"", ""cloud computing"", ""web development""]",57,8,2025-10-25 21:54:03,en,How do you integrate {keyword} with existing systems?,0.9,0.6709970668137674,0.71
41200984,cloud computing,it,How does cloud computing impact business operations?,how_to,Expert,"[""Introduction to cloud computing"", ""Key points and analysis"", ""Practical examples"", ""Expert insights"", ""Action items"", ""Conclusion""]","[""computing"", ""how_to"", ""development"", ""it"", ""programming"", ""cloud""]",4,Architects & Technical Directors,"[""cybersecurity"", ""data science"", ""web development"", ""machine learning""]",52,7,2025-10-25 21:54:03,en,How does {keyword} impact business operations?,0.83,1.0,0.46
41200985,market analysis,economics,How do you analyze market trends in market analysis?,strategy,Beginner,"[""Overview of market analysis"", ""Step-by-step implementation"", ""Best practices and tips"", ""Common challenges and solutions"", ""Tools and resources needed"", ""Conclusion and next steps""]","[""investment"", ""finance"", ""analysis"", ""market"", ""strategy"", ""economics""]",6,Students & New Investors,"[""financial modeling"", ""portfolio management"", ""investment planning""]",52,9,2025-10-25 21:54:03,en,How do you analyze market trends in {keyword}?,0.72,0.4848839659566201,0.59
41200986,social media,marketing,How do you create a social media roadmap?,best_practice,Intermediate,"[""Overview of social media"", ""Step-by-step implementation"", ""Best practices and tips"", ""Common challenges and solutions"", ""Tools and resources needed"", ""Conclusion and next steps""]","[""media"", ""best_practice"", ""marketing"", ""social"", ""advertising"", ""branding""]",6,Marketing Coordinators & Specialists,"[""brand management"", ""digital marketing"", ""content marketing""]",41,8,2025-10-25 21:54:03,en,How do you create a {keyword} roadmap?,0.71,0.7039960412344255,0.47
41200987,investment planning,economics,How do you analyze market trends in investment planning?,evaluation,Intermediate,"[""Overview of investment planning"", ""Step-by-step implementation"", ""Best practices and tips"", ""Common challenges and solutions"", ""Tools and resources needed"", ""Conclusion and next steps""]","[""investment"", ""planning"", ""finance"", ""evaluation"", ""economics""]",6,Individual Investors & Analysts,"[""market analysis"", ""financial modeling"", ""portfolio management""]",56,9,2025-10-25 21:54:03,en,How do you analyze market trends in {keyword}?,0.61,0.6354651139775879,0.44
41200988,social media,marketing,What does the future hold for social media?,strategy,Expert,"[""Introduction to social media"", ""Key points and analysis"", ""Practical examples"", ""Expert insights"", ""Action items"", ""Conclusion""]","[""media"", ""promotion"", ""marketing"", ""social"", ""branding"", ""strategy""]",4,Marketing Directors & CMOs,"[""digital marketing"", ""brand management"", ""content marketing""]",43,8,2025-10-25 21:54:03,en,What does the future hold for {keyword}?,0.94,1.0,0.83
41200989,digital marketing,marketing,How do you develop an effective digital marketing strategy?,optimization,Beginner,"[""Overview of digital marketing"", ""Step-by-step implementation"", ""Best practices and tips"", ""Common challenges and solutions"", ""Tools and resources needed"", ""Conclusion and next steps""]","[""branding"", ""marketing"", ""optimization"", ""digital""]",6,Marketing Students & Interns,"[""brand management"", ""social media"", ""content marketing""]",59,9,2025-10-25 21:54:03,en,How do you develop an effective {keyword} strategy?,0.67,0.37103337246325774,0.5
41200990,social media,marketing,How do you improve social media conversion rates?,strategy,Advanced,"[""Overview of social media"", ""Step-by-step implementation"", ""Best practices and tips"", ""Common challenges and solutions"", ""Tools and resources needed"", ""Conclusion and next steps""]","[""media"", ""marketing"", ""social"", ""advertising"", ""branding"", ""strategy""]",6,Marketing Managers & Strategists,"[""brand management"", ""digital marketing"", ""content marketing""]",49,8,2025-10-25 21:54:03,en,How do you improve {keyword} conversion rates?,0.78,0.8719883694529497,0.56
41200991,social media,marketing,How do you develop an effective social media strategy?,how_to,Advanced,"[""Overview of social media"", ""Step-by-step implementation"", ""Best practices and tips"", ""Common challenges and solutions"", ""Tools and resources needed"", ""Conclusion and next steps""]","[""how_to"", ""media"", ""marketing"", ""digital"", ""social"", ""advertising""]",6,Marketing Managers & Strategists,"[""digital marketing"", ""brand management"", ""content marketing""]",54,9,2025-10-25 21:54:03,en,How do you develop an effective {keyword} strategy?,0.87,0.9738447816208451,0.72
41200992,portfolio management,economics,What factors should be considered when evaluating portfolio management?,optimization,Advanced,"[""Introduction to portfolio management"", ""Key points and analysis"", ""Practical examples"", ""Expert insights"", ""Action items"", ""Conclusion""]","[""portfolio"", ""management"", ""business"", ""market"", ""optimization"", ""economics""]",4,Professional Investors & Advisors,"[""financial modeling"", ""market analysis"", ""investment planning""]",71,9,2025-10-25 21:54:03,en,What factors should be considered when evaluating {keyword}?,0.79,0.8519789757966395,0.8
41200993,machine learning,it,How do you design a scalable machine learning solution?,best_practice,Beginner,"[""Overview of machine learning"", ""Step-by-step implementation"", ""Best practices and tips"", ""Common challenges and solutions"", ""Tools and resources needed"", ""Conclusion and next steps""]","[""software"", ""it"", ""best_practice"", ""programming"", ""learning"", ""machine""]",6,Students & Entry-level Developers,"[""cybersecurity"", ""cloud computing"", ""web development"", ""data science""]",55,9,2025-10-25 21:54:03,en,How do you design a scalable {keyword} solution?,0.91,0.4676490100306705,0.67
41200994,machine learning,it,How do you stay updated with machine learning developments?,implementation,Expert,"[""Overview of machine learning"", ""Step-by-step implementation"", ""Best practices and tips"", ""Common challenges and solutions"", ""Tools and resources needed"", ""Conclusion and next steps""]","[""development"", ""it"", ""implementation"", ""learning"", ""machine"", ""technology""]",6,Architects & Technical Directors,"[""cybersecurity"", ""web development"", ""data science"", ""cloud computing""]",59,9,2025-10-25 21:54:03,en,How do you stay updated with {keyword} developments?,0.86,1.0,0.51
41200995,machine learning,it,How do you integrate machine learning with existing systems?,optimization,Intermediate,"[""Overview of machine learning"", ""Step-by-step implementation"", ""Best practices and tips"", ""Common challenges and solutions"", ""Tools and resources needed"", ""Conclusion and next steps""]","[""it"", ""programming"", ""learning"", ""optimization"", ""machine"", ""technology""]",6,Junior to Mid-level Developers,"[""data science"", ""cloud computing"", ""web development"", ""cybersecurity""]",60,9,2025-10-25 21:54:03,en,How do you integrate {keyword} with existing systems?,0.91,0.7462168939590028,0.81
41200996,content marketing,marketing,What tools are essential for content marketing analytics?,planning,Intermediate,"[""Introduction to content marketing"", ""Key points and analysis"", ""Practical examples"", ""Expert insights"", ""Action items"", ""Conclusion""]","[""planning"", ""content"", ""promotion"", ""marketing"", ""branding""]",4,Marketing Coordinators & Specialists,"[""digital marketing"", ""social media"", ""brand management""]",57,8,2025-10-25 21:54:03,en,What tools are essential for {keyword} analytics?,0.93,0.6335388118280466,0.39
41200997,portfolio management,economics,How do you hedge against portfolio management market downturns?,strategy,Advanced,"[""Overview of portfolio management"", ""Step-by-step implementation"", ""Best practices and tips"", ""Common challenges and solutions"", ""Tools and resources needed"", ""Conclusion and next steps""]","[""investment"", ""portfolio"", ""management"", ""business"", ""strategy"", ""economics""]",6,Professional Investors & Advisors,"[""financial modeling"", ""investment planning"", ""market analysis""]",63,9,2025-10-25 21:54:03,en,How do you hedge against {keyword} market downturns?,0.83,0.8351209384439553,0.71
41200998,market analysis,economics,How do you report on market analysis performance to stakeholders?,implementation,Expert,"[""Overview of market analysis"", ""Step-by-step implementation"", ""Best practices and tips"", ""Common challenges and solutions"", ""Tools and resources needed"", ""Conclusion and next steps""]","[""investment"", ""analysis"", ""implementation"", ""market"", ""economics""]",6,Portfolio Managers & Financial Experts,"[""financial modeling"", ""investment planning"", ""portfolio management""]",65,10,2025-10-25 21:54:03,en,How do you report on {keyword} performance to stakeholders?,0.81,1.0,0.59
41200999,brand management,marketing,What messaging works best in brand management campaigns?,strategy,Beginner,"[""Introduction to brand management"", ""Key points and analysis"", ""Practical examples"", ""Expert insights"", ""Action items"", ""Conclusion""]","[""promotion"", ""marketing"", ""management"", ""branding"", ""strategy"", ""brand""]",4,Marketing Students & Interns,"[""digital marketing"", ""social media"", ""content marketing""]",56,8,2025-10-25 21:54:03,en,What messaging works best in {keyword} campaigns?,0.85,0.38745006170343715,0.52
41201000,investment planning,economics,How do you report on investment planning performance to stakeholders?,strategy,Advanced,"[""Overview of investment planning"", ""Step-by-step implementation"", ""Best practices and tips"", ""Common challenges and solutions"", ""Tools and resources needed"", ""Conclusion and next steps""]","[""investment"", ""planning"", ""business"", ""market"", ""strategy"", ""economics""]",6,Professional Investors & Advisors,"[""financial modeling"", ""portfolio management"", ""market analysis""]",69,10,2025-10-25 21:54:03,en,How do you report on {keyword} performance to stakeholders?,0.71,0.8144440861291076,0.41
