record_id,keyword,category,question,question_type,difficulty_level,answer_outline,tags,estimated_read_time,target_audience,related_topics,question_length,word_count,created_date,language,source_template,engagement_score,complexity_score,popularity_score
34300001,market analysis,economics,How do you create a long-term plan for market analysis?,optimization,Beginner,"[""Overview of market analysis"", ""Step-by-step implementation"", ""Best practices and tips"", ""Common challenges and solutions"", ""Tools and resources needed"", ""Conclusion and next steps""]","[""analysis"", ""finance"", ""business"", ""market"", ""optimization"", ""economics""]",6,Students & New Investors,"[""investment planning"", ""financial modeling"", ""portfolio management""]",55,10,2025-10-25 21:44:28,en,How do you create a long-term plan for {keyword}?,0.69,0.37783630254433564,0.48
34300002,cybersecurity,it,Which frameworks support cybersecurity implementation?,comparison,Beginner,"[""Introduction to cybersecurity"", ""Key points and analysis"", ""Practical examples"", ""Expert insights"", ""Action items"", ""Conclusion""]","[""development"", ""it"", ""comparison"", ""programming"", ""cybersecurity""]",4,Students & Entry-level Developers,"[""web development"", ""machine learning"", ""cloud computing"", ""data science""]",54,5,2025-10-25 21:44:28,en,Which frameworks support {keyword} implementation?,0.78,0.42582673011804234,0.84
34300003,brand management,marketing,How do you attribute success to brand management efforts?,evaluation,Expert,"[""Overview of brand management"", ""Step-by-step implementation"", ""Best practices and tips"", ""Common challenges and solutions"", ""Tools and resources needed"", ""Conclusion and next steps""]","[""marketing"", ""management"", ""digital"", ""branding"", ""evaluation"", ""brand""]",6,Marketing Directors & CMOs,"[""digital marketing"", ""content marketing"", ""social media""]",57,9,2025-10-25 21:44:28,en,How do you attribute success to {keyword} efforts?,0.95,1.0,0.77
34300004,portfolio management,economics,How do you benchmark portfolio management against alternatives?,comparison,Expert,"[""Overview of portfolio management"", ""Step-by-step implementation"", ""Best practices and tips"", ""Common challenges and solutions"", ""Tools and resources needed"", ""Conclusion and next steps""]","[""finance"", ""portfolio"", ""comparison"", ""management"", ""business"", ""economics""]",6,Portfolio Managers & Financial Experts,"[""investment planning"", ""market analysis"", ""financial modeling""]",63,8,2025-10-25 21:44:28,en,How do you benchmark {keyword} against alternatives?,0.77,1.0,0.52
34300005,financial modeling,economics,How do you analyze market trends in financial modeling?,optimization,Intermediate,"[""Overview of financial modeling"", ""Step-by-step implementation"", ""Best practices and tips"", ""Common challenges and solutions"", ""Tools and resources needed"", ""Conclusion and next steps""]","[""investment"", ""modeling"", ""financial"", ""business"", ""optimization"", ""economics""]",6,Individual Investors & Analysts,"[""investment planning"", ""portfolio management"", ""market analysis""]",55,9,2025-10-25 21:44:28,en,How do you analyze market trends in {keyword}?,0.63,0.6677206580450372,0.59
34300006,brand management,marketing,What does the future hold for brand management?,optimization,Advanced,"[""Introduction to brand management"", ""Key points and analysis"", ""Practical examples"", ""Expert insights"", ""Action items"", ""Conclusion""]","[""promotion"", ""marketing"", ""management"", ""advertising"", ""optimization"", ""brand""]",4,Marketing Managers & Strategists,"[""social media"", ""content marketing"", ""digital marketing""]",47,8,2025-10-25 21:44:28,en,What does the future hold for {keyword}?,0.76,0.9369796681315778,0.43
34300007,web development,it,What are the best practices for web development development?,optimization,Expert,"[""Introduction to web development"", ""Key concepts and definitions"", ""Main categories or types"", ""Examples and case studies"", ""Benefits and advantages"", ""Summary and recommendations""]","[""technology"", ""software"", ""development"", ""it"", ""optimization"", ""web""]",6,Architects & Technical Directors,"[""cloud computing"", ""machine learning"", ""cybersecurity"", ""data science""]",60,9,2025-10-25 21:44:28,en,What are the best practices for {keyword} development?,0.66,1.0,0.56
34300008,investment planning,economics,How do you protect your investment planning investments?,troubleshooting,Advanced,"[""Overview of investment planning"", ""Step-by-step implementation"", ""Best practices and tips"", ""Common challenges and solutions"", ""Tools and resources needed"", ""Conclusion and next steps""]","[""investment"", ""planning"", ""finance"", ""troubleshooting"", ""economics""]",6,Professional Investors & Advisors,"[""financial modeling"", ""portfolio management"", ""market analysis""]",56,8,2025-10-25 21:44:28,en,How do you protect your {keyword} investments?,0.84,0.9253650918185643,0.4
34300009,investment planning,economics,How do economic conditions affect investment planning performance?,planning,Advanced,"[""Introduction to investment planning"", ""Key points and analysis"", ""Practical examples"", ""Expert insights"", ""Action items"", ""Conclusion""]","[""investment"", ""economics"", ""planning"", ""business""]",4,Professional Investors & Advisors,"[""financial modeling"", ""market analysis"", ""portfolio management""]",66,8,2025-10-25 21:44:28,en,How do economic conditions affect {keyword} performance?,0.69,0.9292412979392048,0.64
34300010,machine learning,it,How do you integrate machine learning with existing systems?,how_to,Advanced,"[""Overview of machine learning"", ""Step-by-step implementation"", ""Best practices and tips"", ""Common challenges and solutions"", ""Tools and resources needed"", ""Conclusion and next steps""]","[""how_to"", ""software"", ""it"", ""learning"", ""machine"", ""technology""]",6,Senior Developers & Tech Leads,"[""cybersecurity"", ""data science"", ""cloud computing"", ""web development""]",60,9,2025-10-25 21:44:28,en,How do you integrate {keyword} with existing systems?,0.71,0.8439776428616093,0.77
34300011,social media,marketing,How do you develop an effective social media strategy?,optimization,Beginner,"[""Overview of social media"", ""Step-by-step implementation"", ""Best practices and tips"", ""Common challenges and solutions"", ""Tools and resources needed"", ""Conclusion and next steps""]","[""media"", ""promotion"", ""marketing"", ""social"", ""advertising"", ""optimization""]",6,Marketing Students & Interns,"[""content marketing"", ""digital marketing"", ""brand management""]",54,9,2025-10-25 21:44:28,en,How do you develop an effective {keyword} strategy?,0.81,0.3494367271589116,0.56
34300012,content marketing,marketing,What emerging platforms support content marketing?,optimization,Expert,"[""Introduction to content marketing"", ""Key points and analysis"", ""Practical examples"", ""Expert insights"", ""Action items"", ""Conclusion""]","[""content"", ""promotion"", ""marketing"", ""digital"", ""optimization""]",4,Marketing Directors & CMOs,"[""brand management"", ""digital marketing"", ""social media""]",50,6,2025-10-25 21:44:28,en,What emerging platforms support {keyword}?,0.88,1.0,0.65
34300013,market analysis,economics,How do you create a long-term plan for market analysis?,comparison,Expert,"[""Overview of market analysis"", ""Step-by-step implementation"", ""Best practices and tips"", ""Common challenges and solutions"", ""Tools and resources needed"", ""Conclusion and next steps""]","[""investment"", ""analysis"", ""finance"", ""comparison"", ""market"", ""economics""]",6,Portfolio Managers & Financial Experts,"[""portfolio management"", ""financial modeling"", ""investment planning""]",55,10,2025-10-25 21:44:28,en,How do you create a long-term plan for {keyword}?,0.6,1.0,0.87
34300014,market analysis,economics,What factors should be considered when evaluating market analysis?,strategy,Advanced,"[""Introduction to market analysis"", ""Key points and analysis"", ""Practical examples"", ""Expert insights"", ""Action items"", ""Conclusion""]","[""finance"", ""analysis"", ""market"", ""strategy"", ""economics""]",4,Professional Investors & Advisors,"[""financial modeling"", ""portfolio management"", ""investment planning""]",66,9,2025-10-25 21:44:28,en,What factors should be considered when evaluating {keyword}?,0.94,0.8264914570420145,0.5
34300015,brand management,marketing,How do you reach new customers through brand management?,strategy,Beginner,"[""Overview of brand management"", ""Step-by-step implementation"", ""Best practices and tips"", ""Common challenges and solutions"", ""Tools and resources needed"", ""Conclusion and next steps""]","[""digital"", ""marketing"", ""management"", ""advertising"", ""strategy"", ""brand""]",6,Marketing Students & Interns,"[""content marketing"", ""social media"", ""digital marketing""]",56,9,2025-10-25 21:44:28,en,How do you reach new customers through {keyword}?,0.78,0.3391831337182,0.58
34300016,cybersecurity,it,How do you convince stakeholders to invest in cybersecurity?,evaluation,Advanced,"[""Overview of cybersecurity"", ""Step-by-step implementation"", ""Best practices and tips"", ""Common challenges and solutions"", ""Tools and resources needed"", ""Conclusion and next steps""]","[""development"", ""it"", ""evaluation"", ""cybersecurity"", ""technology""]",5,Senior Developers & Tech Leads,"[""cloud computing"", ""web development"", ""data science"", ""machine learning""]",60,9,2025-10-25 21:44:28,en,How do you convince stakeholders to invest in {keyword}?,0.89,0.8974590468916332,0.67
34300017,brand management,marketing,What messaging works best in brand management campaigns?,how_to,Advanced,"[""Introduction to brand management"", ""Key points and analysis"", ""Practical examples"", ""Expert insights"", ""Action items"", ""Conclusion""]","[""how_to"", ""promotion"", ""marketing"", ""management"", ""branding"", ""brand""]",4,Marketing Managers & Strategists,"[""digital marketing"", ""social media"", ""content marketing""]",56,8,2025-10-25 21:44:28,en,What messaging works best in {keyword} campaigns?,0.63,0.8166311947117787,0.33
34300018,digital marketing,marketing,What budget should be allocated to digital marketing?,best_practice,Advanced,"[""Introduction to digital marketing"", ""Key points and analysis"", ""Practical examples"", ""Expert insights"", ""Action items"", ""Conclusion""]","[""promotion"", ""best_practice"", ""marketing"", ""digital"", ""advertising""]",4,Marketing Managers & Strategists,"[""social media"", ""brand management"", ""content marketing""]",53,8,2025-10-25 21:44:28,en,What budget should be allocated to {keyword}?,0.8,0.8602970239727381,0.64
34300019,social media,marketing,What channels are most effective for social media?,troubleshooting,Beginner,"[""Introduction to social media"", ""Key points and analysis"", ""Practical examples"", ""Expert insights"", ""Action items"", ""Conclusion""]","[""media"", ""promotion"", ""troubleshooting"", ""digital"", ""marketing"", ""social""]",4,Marketing Students & Interns,"[""content marketing"", ""brand management"", ""digital marketing""]",50,8,2025-10-25 21:44:28,en,What channels are most effective for {keyword}?,0.73,0.4277628637191211,0.73
34300020,market analysis,economics,How do you identify opportunities in market analysis markets?,optimization,Intermediate,"[""Overview of market analysis"", ""Step-by-step implementation"", ""Best practices and tips"", ""Common challenges and solutions"", ""Tools and resources needed"", ""Conclusion and next steps""]","[""finance"", ""analysis"", ""market"", ""optimization"", ""economics""]",6,Individual Investors & Analysts,"[""financial modeling"", ""portfolio management"", ""investment planning""]",61,9,2025-10-25 21:44:28,en,How do you identify opportunities in {keyword} markets?,0.74,0.7079470690891657,0.58
34300021,cloud computing,it,How do you choose the right technology stack for cloud computing?,best_practice,Intermediate,"[""Overview of cloud computing"", ""Step-by-step implementation"", ""Best practices and tips"", ""Common challenges and solutions"", ""Tools and resources needed"", ""Conclusion and next steps""]","[""computing"", ""development"", ""it"", ""best_practice"", ""programming"", ""cloud""]",6,Junior to Mid-level Developers,"[""web development"", ""data science"", ""cybersecurity"", ""machine learning""]",65,11,2025-10-25 21:44:28,en,How do you choose the right technology stack for {keyword}?,0.88,0.6017922332345399,0.52
34300022,machine learning,it,Which frameworks support machine learning implementation?,how_to,Advanced,"[""Introduction to machine learning"", ""Key points and analysis"", ""Practical examples"", ""Expert insights"", ""Action items"", ""Conclusion""]","[""how_to"", ""development"", ""it"", ""programming"", ""learning"", ""machine""]",4,Senior Developers & Tech Leads,"[""cybersecurity"", ""data science"", ""cloud computing"", ""web development""]",57,6,2025-10-25 21:44:28,en,Which frameworks support {keyword} implementation?,0.94,0.8218463440837751,0.77
34300023,social media,marketing,What KPIs are most important for social media?,troubleshooting,Beginner,"[""Introduction to social media"", ""Key points and analysis"", ""Practical examples"", ""Expert insights"", ""Action items"", ""Conclusion""]","[""media"", ""promotion"", ""troubleshooting"", ""marketing"", ""social"", ""branding""]",4,Marketing Students & Interns,"[""brand management"", ""digital marketing"", ""content marketing""]",46,8,2025-10-25 21:44:28,en,What KPIs are most important for {keyword}?,0.78,0.4420905919779715,0.38
34300024,machine learning,it,What ROI can be expected from machine learning implementation?,strategy,Advanced,"[""Introduction to machine learning"", ""Key points and analysis"", ""Practical examples"", ""Expert insights"", ""Action items"", ""Conclusion""]","[""software"", ""it"", ""learning"", ""strategy"", ""machine"", ""technology""]",4,Senior Developers & Tech Leads,"[""cloud computing"", ""cybersecurity"", ""web development"", ""data science""]",62,9,2025-10-25 21:44:28,en,What ROI can be expected from {keyword} implementation?,0.6,0.8863800675600004,0.64
34300025,web development,it,What are the cost considerations for web development?,analysis,Expert,"[""Introduction to web development"", ""Key concepts and definitions"", ""Main categories or types"", ""Examples and case studies"", ""Benefits and advantages"", ""Summary and recommendations""]","[""software"", ""development"", ""analysis"", ""it"", ""programming"", ""web""]",6,Architects & Technical Directors,"[""data science"", ""cybersecurity"", ""cloud computing"", ""machine learning""]",53,8,2025-10-25 21:44:28,en,What are the cost considerations for {keyword}?,0.74,1.0,0.37
34300026,digital marketing,marketing,How do you measure the ROI of digital marketing campaigns?,comparison,Expert,"[""Overview of digital marketing"", ""Step-by-step implementation"", ""Best practices and tips"", ""Common challenges and solutions"", ""Tools and resources needed"", ""Conclusion and next steps""]","[""promotion"", ""comparison"", ""marketing"", ""digital"", ""branding""]",6,Marketing Directors & CMOs,"[""brand management"", ""social media"", ""content marketing""]",58,10,2025-10-25 21:44:28,en,How do you measure the ROI of {keyword} campaigns?,0.81,1.0,0.7
34300027,web development,it,How do you get started with web development as a beginner?,strategy,Expert,"[""Overview of web development"", ""Step-by-step implementation"", ""Best practices and tips"", ""Common challenges and solutions"", ""Tools and resources needed"", ""Conclusion and next steps""]","[""software"", ""development"", ""it"", ""programming"", ""strategy"", ""web""]",6,Architects & Technical Directors,"[""cybersecurity"", ""cloud computing"", ""machine learning"", ""data science""]",58,11,2025-10-25 21:44:28,en,How do you get started with {keyword} as a beginner?,0.69,1.0,0.86
34300028,digital marketing,marketing,What does the future hold for digital marketing?,strategy,Beginner,"[""Introduction to digital marketing"", ""Key points and analysis"", ""Practical examples"", ""Expert insights"", ""Action items"", ""Conclusion""]","[""marketing"", ""strategy"", ""advertising"", ""digital""]",4,Marketing Students & Interns,"[""social media"", ""brand management"", ""content marketing""]",48,8,2025-10-25 21:44:28,en,What does the future hold for {keyword}?,0.8,0.49467757409326313,0.5
34300029,social media,marketing,What are the latest trends in social media?,comparison,Expert,"[""Introduction to social media"", ""Key concepts and definitions"", ""Main categories or types"", ""Examples and case studies"", ""Benefits and advantages"", ""Summary and recommendations""]","[""media"", ""promotion"", ""comparison"", ""marketing"", ""social"", ""advertising""]",6,Marketing Directors & CMOs,"[""brand management"", ""digital marketing"", ""content marketing""]",43,8,2025-10-25 21:44:28,en,What are the latest trends in {keyword}?,0.7,1.0,0.38
34300030,data science,it,How do you design a scalable data science solution?,strategy,Beginner,"[""Overview of data science"", ""Step-by-step implementation"", ""Best practices and tips"", ""Common challenges and solutions"", ""Tools and resources needed"", ""Conclusion and next steps""]","[""software"", ""development"", ""it"", ""science"", ""strategy"", ""data""]",6,Students & Entry-level Developers,"[""machine learning"", ""cybersecurity"", ""cloud computing"", ""web development""]",51,9,2025-10-25 21:44:28,en,How do you design a scalable {keyword} solution?,0.72,0.37637798341452505,0.6
34300031,machine learning,it,How do you integrate machine learning with existing systems?,planning,Expert,"[""Overview of machine learning"", ""Step-by-step implementation"", ""Best practices and tips"", ""Common challenges and solutions"", ""Tools and resources needed"", ""Conclusion and next steps""]","[""planning"", ""development"", ""it"", ""learning"", ""machine"", ""technology""]",6,Architects & Technical Directors,"[""data science"", ""web development"", ""cybersecurity"", ""cloud computing""]",60,9,2025-10-25 21:44:28,en,How do you integrate {keyword} with existing systems?,0.76,1.0,0.7
34300032,portfolio management,economics,What timeline is realistic for portfolio management returns?,troubleshooting,Advanced,"[""Introduction to portfolio management"", ""Key points and analysis"", ""Practical examples"", ""Expert insights"", ""Action items"", ""Conclusion""]","[""portfolio"", ""troubleshooting"", ""management"", ""market"", ""business"", ""economics""]",4,Professional Investors & Advisors,"[""market analysis"", ""financial modeling"", ""investment planning""]",60,8,2025-10-25 21:44:28,en,What timeline is realistic for {keyword} returns?,0.82,0.9724349006979245,0.47
34300033,investment planning,economics,How do you hedge against investment planning market downturns?,planning,Intermediate,"[""Overview of investment planning"", ""Step-by-step implementation"", ""Best practices and tips"", ""Common challenges and solutions"", ""Tools and resources needed"", ""Conclusion and next steps""]","[""investment"", ""planning"", ""finance"", ""market"", ""economics""]",6,Individual Investors & Analysts,"[""financial modeling"", ""market analysis"", ""portfolio management""]",62,9,2025-10-25 21:44:28,en,How do you hedge against {keyword} market downturns?,0.81,0.7192218381527921,0.88
34300034,investment planning,economics,What tools help analyze investment planning data?,strategy,Beginner,"[""Introduction to investment planning"", ""Key points and analysis"", ""Practical examples"", ""Expert insights"", ""Action items"", ""Conclusion""]","[""investment"", ""planning"", ""finance"", ""market"", ""strategy"", ""economics""]",4,Students & New Investors,"[""financial modeling"", ""portfolio management"", ""market analysis""]",49,7,2025-10-25 21:44:28,en,What tools help analyze {keyword} data?,0.66,0.42848593654473327,0.32
34300035,social media,marketing,How do you personalize social media for different segments?,best_practice,Expert,"[""Overview of social media"", ""Step-by-step implementation"", ""Best practices and tips"", ""Common challenges and solutions"", ""Tools and resources needed"", ""Conclusion and next steps""]","[""media"", ""promotion"", ""best_practice"", ""digital"", ""marketing"", ""social""]",6,Marketing Directors & CMOs,"[""content marketing"", ""brand management"", ""digital marketing""]",59,9,2025-10-25 21:44:28,en,How do you personalize {keyword} for different segments?,0.87,1.0,0.34
34300036,investment planning,economics,What insurance options are available for investment planning?,comparison,Beginner,"[""Introduction to investment planning"", ""Key points and analysis"", ""Practical examples"", ""Expert insights"", ""Action items"", ""Conclusion""]","[""investment"", ""planning"", ""comparison"", ""business"", ""economics""]",4,Students & New Investors,"[""market analysis"", ""portfolio management"", ""financial modeling""]",61,8,2025-10-25 21:44:28,en,What insurance options are available for {keyword}?,0.93,0.4080325417462555,0.85
34300037,portfolio management,economics,How do you adjust your portfolio management strategy during volatility?,implementation,Intermediate,"[""Overview of portfolio management"", ""Step-by-step implementation"", ""Best practices and tips"", ""Common challenges and solutions"", ""Tools and resources needed"", ""Conclusion and next steps""]","[""finance"", ""implementation"", ""portfolio"", ""management"", ""market"", ""economics""]",6,Individual Investors & Analysts,"[""financial modeling"", ""market analysis"", ""investment planning""]",71,10,2025-10-25 21:44:28,en,How do you adjust your {keyword} strategy during volatility?,0.75,0.7251471736791777,0.5
34300038,social media,marketing,What are the latest trends in social media?,strategy,Intermediate,"[""Introduction to social media"", ""Key concepts and definitions"", ""Main categories or types"", ""Examples and case studies"", ""Benefits and advantages"", ""Summary and recommendations""]","[""media"", ""promotion"", ""marketing"", ""social"", ""branding"", ""strategy""]",6,Marketing Coordinators & Specialists,"[""brand management"", ""content marketing"", ""digital marketing""]",43,8,2025-10-25 21:44:28,en,What are the latest trends in {keyword}?,0.81,0.6797307884279543,0.37
34300039,social media,marketing,How do you personalize social media for different segments?,planning,Expert,"[""Overview of social media"", ""Step-by-step implementation"", ""Best practices and tips"", ""Common challenges and solutions"", ""Tools and resources needed"", ""Conclusion and next steps""]","[""planning"", ""media"", ""marketing"", ""social"", ""advertising"", ""branding""]",6,Marketing Directors & CMOs,"[""brand management"", ""digital marketing"", ""content marketing""]",59,9,2025-10-25 21:44:28,en,How do you personalize {keyword} for different segments?,0.86,1.0,0.61
34300040,content marketing,marketing,What timing strategies work for content marketing?,troubleshooting,Intermediate,"[""Introduction to content marketing"", ""Key points and analysis"", ""Practical examples"", ""Expert insights"", ""Action items"", ""Conclusion""]","[""content"", ""promotion"", ""troubleshooting"", ""marketing"", ""digital""]",4,Marketing Coordinators & Specialists,"[""social media"", ""brand management"", ""digital marketing""]",50,7,2025-10-25 21:44:28,en,What timing strategies work for {keyword}?,0.87,0.657378591067987,0.5
34300041,data science,it,How do you optimize data science for different platforms?,evaluation,Expert,"[""Overview of data science"", ""Step-by-step implementation"", ""Best practices and tips"", ""Common challenges and solutions"", ""Tools and resources needed"", ""Conclusion and next steps""]","[""development"", ""it"", ""programming"", ""science"", ""evaluation"", ""data""]",6,Architects & Technical Directors,"[""machine learning"", ""web development"", ""cybersecurity"", ""cloud computing""]",57,9,2025-10-25 21:44:28,en,How do you optimize {keyword} for different platforms?,0.72,1.0,0.46
34300042,portfolio management,economics,What strategies work best for portfolio management investment?,planning,Intermediate,"[""Introduction to portfolio management"", ""Key points and analysis"", ""Practical examples"", ""Expert insights"", ""Action items"", ""Conclusion""]","[""investment"", ""planning"", ""portfolio"", ""management"", ""market"", ""economics""]",4,Individual Investors & Analysts,"[""market analysis"", ""financial modeling"", ""investment planning""]",62,8,2025-10-25 21:44:28,en,What strategies work best for {keyword} investment?,0.83,0.7593617482989996,0.39
34300043,investment planning,economics,How do you protect your investment planning investments?,troubleshooting,Intermediate,"[""Overview of investment planning"", ""Step-by-step implementation"", ""Best practices and tips"", ""Common challenges and solutions"", ""Tools and resources needed"", ""Conclusion and next steps""]","[""investment"", ""planning"", ""finance"", ""troubleshooting"", ""business"", ""economics""]",6,Individual Investors & Analysts,"[""market analysis"", ""portfolio management"", ""financial modeling""]",56,8,2025-10-25 21:44:28,en,How do you protect your {keyword} investments?,0.89,0.6642622042773847,0.82
