record_id,keyword,category,question,question_type,difficulty_level,answer_outline,tags,estimated_read_time,target_audience,related_topics,question_length,word_count,created_date,language,source_template,engagement_score,complexity_score,popularity_score
36800952,cloud computing,it,How do you design a scalable cloud computing solution?,strategy,Beginner,"[""Overview of cloud computing"", ""Step-by-step implementation"", ""Best practices and tips"", ""Common challenges and solutions"", ""Tools and resources needed"", ""Conclusion and next steps""]","[""computing"", ""software"", ""cloud"", ""it"", ""development"", ""strategy""]",6,Students & Entry-level Developers,"[""machine learning"", ""web development"", ""data science"", ""cybersecurity""]",54,9,2025-10-25 21:47:59,en,How do you design a scalable {keyword} solution?,0.61,0.377226038988766,0.3
36800953,cloud computing,it,What career opportunities exist in cloud computing?,evaluation,Advanced,"[""Introduction to cloud computing"", ""Key points and analysis"", ""Practical examples"", ""Expert insights"", ""Action items"", ""Conclusion""]","[""computing"", ""it"", ""programming"", ""evaluation"", ""cloud"", ""technology""]",4,Senior Developers & Tech Leads,"[""machine learning"", ""cybersecurity"", ""data science"", ""web development""]",51,7,2025-10-25 21:47:59,en,What career opportunities exist in {keyword}?,0.81,0.9654294700089208,0.44
36800954,financial modeling,economics,What exit strategies should be considered for financial modeling?,troubleshooting,Intermediate,"[""Introduction to financial modeling"", ""Key points and analysis"", ""Practical examples"", ""Expert insights"", ""Action items"", ""Conclusion""]","[""investment"", ""troubleshooting"", ""modeling"", ""financial"", ""market"", ""economics""]",4,Individual Investors & Analysts,"[""market analysis"", ""investment planning"", ""portfolio management""]",65,9,2025-10-25 21:47:59,en,What exit strategies should be considered for {keyword}?,0.84,0.7774531186913631,0.35
36800955,web development,it,How do you troubleshoot common issues with web development?,strategy,Beginner,"[""Overview of web development"", ""Step-by-step implementation"", ""Best practices and tips"", ""Common challenges and solutions"", ""Tools and resources needed"", ""Conclusion and next steps""]","[""technology"", ""development"", ""it"", ""programming"", ""strategy"", ""web""]",6,Students & Entry-level Developers,"[""cloud computing"", ""machine learning"", ""cybersecurity"", ""data science""]",59,9,2025-10-25 21:47:59,en,How do you troubleshoot common issues with {keyword}?,0.73,0.4027722513093268,0.59
36800956,machine learning,it,How do you measure the success of machine learning projects?,planning,Expert,"[""Overview of machine learning"", ""Step-by-step implementation"", ""Best practices and tips"", ""Common challenges and solutions"", ""Tools and resources needed"", ""Conclusion and next steps""]","[""software"", ""planning"", ""it"", ""learning"", ""machine"", ""technology""]",6,Architects & Technical Directors,"[""data science"", ""cybersecurity"", ""web development"", ""cloud computing""]",60,10,2025-10-25 21:47:59,en,How do you measure the success of {keyword} projects?,0.65,1.0,0.73
36800957,brand management,marketing,What timing strategies work for brand management?,planning,Intermediate,"[""Introduction to brand management"", ""Key points and analysis"", ""Practical examples"", ""Expert insights"", ""Action items"", ""Conclusion""]","[""planning"", ""marketing"", ""management"", ""advertising"", ""branding"", ""brand""]",4,Marketing Coordinators & Specialists,"[""digital marketing"", ""content marketing"", ""social media""]",49,7,2025-10-25 21:47:59,en,What timing strategies work for {keyword}?,0.86,0.763761167265017,0.53
36800958,social media,marketing,How do you attribute success to social media efforts?,planning,Expert,"[""Overview of social media"", ""Step-by-step implementation"", ""Best practices and tips"", ""Common challenges and solutions"", ""Tools and resources needed"", ""Conclusion and next steps""]","[""planning"", ""media"", ""promotion"", ""marketing"", ""social"", ""advertising""]",6,Marketing Directors & CMOs,"[""content marketing"", ""brand management"", ""digital marketing""]",53,9,2025-10-25 21:47:59,en,How do you attribute success to {keyword} efforts?,0.75,1.0,0.84
36800959,content marketing,marketing,How do you personalize content marketing for different segments?,planning,Beginner,"[""Overview of content marketing"", ""Step-by-step implementation"", ""Best practices and tips"", ""Common challenges and solutions"", ""Tools and resources needed"", ""Conclusion and next steps""]","[""planning"", ""content"", ""marketing"", ""digital"", ""branding""]",6,Marketing Students & Interns,"[""brand management"", ""social media"", ""digital marketing""]",64,9,2025-10-25 21:47:59,en,How do you personalize {keyword} for different segments?,0.69,0.3603977597410487,0.55
36800960,digital marketing,marketing,How do you personalize digital marketing for different segments?,best_practice,Intermediate,"[""Overview of digital marketing"", ""Step-by-step implementation"", ""Best practices and tips"", ""Common challenges and solutions"", ""Tools and resources needed"", ""Conclusion and next steps""]","[""branding"", ""marketing"", ""best_practice"", ""digital""]",6,Marketing Coordinators & Specialists,"[""content marketing"", ""brand management"", ""social media""]",64,9,2025-10-25 21:47:59,en,How do you personalize {keyword} for different segments?,0.66,0.629756505596599,0.85
36800961,financial modeling,economics,What insurance options are available for financial modeling?,evaluation,Advanced,"[""Introduction to financial modeling"", ""Key points and analysis"", ""Practical examples"", ""Expert insights"", ""Action items"", ""Conclusion""]","[""finance"", ""modeling"", ""financial"", ""evaluation"", ""business"", ""economics""]",4,Professional Investors & Advisors,"[""market analysis"", ""portfolio management"", ""investment planning""]",60,8,2025-10-25 21:47:59,en,What insurance options are available for {keyword}?,0.75,0.948151267060888,0.78
36800962,market analysis,economics,How do you identify opportunities in market analysis markets?,comparison,Expert,"[""Overview of market analysis"", ""Step-by-step implementation"", ""Best practices and tips"", ""Common challenges and solutions"", ""Tools and resources needed"", ""Conclusion and next steps""]","[""analysis"", ""comparison"", ""market"", ""business"", ""economics""]",6,Portfolio Managers & Financial Experts,"[""portfolio management"", ""investment planning"", ""financial modeling""]",61,9,2025-10-25 21:47:59,en,How do you identify opportunities in {keyword} markets?,0.68,1.0,0.79
36800963,machine learning,it,How can machine learning improve system performance and scalability?,troubleshooting,Expert,"[""Introduction to machine learning"", ""Key points and analysis"", ""Practical examples"", ""Expert insights"", ""Action items"", ""Conclusion""]","[""it"", ""programming"", ""troubleshooting"", ""learning"", ""machine"", ""technology""]",4,Architects & Technical Directors,"[""cybersecurity"", ""web development"", ""cloud computing"", ""data science""]",68,9,2025-10-25 21:47:59,en,How can {keyword} improve system performance and scalability?,0.92,1.0,0.45
36800964,cloud computing,it,What are the key components of a cloud computing implementation?,implementation,Expert,"[""Introduction to cloud computing"", ""Key concepts and definitions"", ""Main categories or types"", ""Examples and case studies"", ""Benefits and advantages"", ""Summary and recommendations""]","[""computing"", ""software"", ""it"", ""implementation"", ""programming"", ""cloud""]",6,Architects & Technical Directors,"[""machine learning"", ""web development"", ""cybersecurity"", ""data science""]",64,10,2025-10-25 21:47:59,en,What are the key components of a {keyword} implementation?,0.87,1.0,0.8
36800965,investment planning,economics,What strategies work best for investment planning investment?,best_practice,Advanced,"[""Introduction to investment planning"", ""Key points and analysis"", ""Practical examples"", ""Expert insights"", ""Action items"", ""Conclusion""]","[""investment"", ""planning"", ""best_practice"", ""market"", ""business"", ""economics""]",4,Professional Investors & Advisors,"[""financial modeling"", ""portfolio management"", ""market analysis""]",61,8,2025-10-25 21:47:59,en,What strategies work best for {keyword} investment?,0.73,0.9055083907921215,0.45
36800966,portfolio management,economics,What exit strategies should be considered for portfolio management?,evaluation,Advanced,"[""Introduction to portfolio management"", ""Key points and analysis"", ""Practical examples"", ""Expert insights"", ""Action items"", ""Conclusion""]","[""investment"", ""finance"", ""portfolio"", ""management"", ""evaluation"", ""economics""]",4,Professional Investors & Advisors,"[""investment planning"", ""financial modeling"", ""market analysis""]",67,9,2025-10-25 21:47:59,en,What exit strategies should be considered for {keyword}?,0.79,0.8142828949608543,0.38
36800967,brand management,marketing,What content types work best for brand management?,comparison,Beginner,"[""Introduction to brand management"", ""Key points and analysis"", ""Practical examples"", ""Expert insights"", ""Action items"", ""Conclusion""]","[""promotion"", ""comparison"", ""marketing"", ""management"", ""advertising"", ""brand""]",4,Marketing Students & Interns,"[""digital marketing"", ""content marketing"", ""social media""]",50,8,2025-10-25 21:47:59,en,What content types work best for {keyword}?,0.69,0.3614594993335188,0.55
36800968,cloud computing,it,What are the latest trends in cloud computing technology?,planning,Intermediate,"[""Introduction to cloud computing"", ""Key concepts and definitions"", ""Main categories or types"", ""Examples and case studies"", ""Benefits and advantages"", ""Summary and recommendations""]","[""computing"", ""planning"", ""it"", ""programming"", ""cloud"", ""technology""]",6,Junior to Mid-level Developers,"[""web development"", ""machine learning"", ""cybersecurity"", ""data science""]",57,9,2025-10-25 21:47:59,en,What are the latest trends in {keyword} technology?,0.85,0.6590505030937868,0.86
36800969,financial modeling,economics,What tools help analyze financial modeling data?,how_to,Beginner,"[""Introduction to financial modeling"", ""Key points and analysis"", ""Practical examples"", ""Expert insights"", ""Action items"", ""Conclusion""]","[""investment"", ""how_to"", ""finance"", ""modeling"", ""financial"", ""economics""]",4,Students & New Investors,"[""investment planning"", ""portfolio management"", ""market analysis""]",48,7,2025-10-25 21:47:59,en,What tools help analyze {keyword} data?,0.81,0.46745238985781457,0.68
36800970,brand management,marketing,What channels are most effective for brand management?,best_practice,Intermediate,"[""Introduction to brand management"", ""Key points and analysis"", ""Practical examples"", ""Expert insights"", ""Action items"", ""Conclusion""]","[""best_practice"", ""marketing"", ""management"", ""advertising"", ""digital"", ""brand""]",4,Marketing Coordinators & Specialists,"[""content marketing"", ""social media"", ""digital marketing""]",54,8,2025-10-25 21:47:59,en,What channels are most effective for {keyword}?,0.65,0.7681417804244937,0.85
36800971,cybersecurity,it,How do you choose the right technology stack for cybersecurity?,comparison,Advanced,"[""Overview of cybersecurity"", ""Step-by-step implementation"", ""Best practices and tips"", ""Common challenges and solutions"", ""Tools and resources needed"", ""Conclusion and next steps""]","[""software"", ""it"", ""comparison"", ""programming"", ""cybersecurity""]",5,Senior Developers & Tech Leads,"[""machine learning"", ""web development"", ""data science"", ""cloud computing""]",63,10,2025-10-25 21:47:59,en,How do you choose the right technology stack for {keyword}?,0.8,0.9463017459750809,0.45
36800972,brand management,marketing,What emerging platforms support brand management?,planning,Intermediate,"[""Introduction to brand management"", ""Key points and analysis"", ""Practical examples"", ""Expert insights"", ""Action items"", ""Conclusion""]","[""planning"", ""marketing"", ""management"", ""digital"", ""branding"", ""brand""]",4,Marketing Coordinators & Specialists,"[""social media"", ""content marketing"", ""digital marketing""]",49,6,2025-10-25 21:47:59,en,What emerging platforms support {keyword}?,0.85,0.6161572984949684,0.63
36800973,web development,it,How do you integrate web development with existing systems?,evaluation,Advanced,"[""Overview of web development"", ""Step-by-step implementation"", ""Best practices and tips"", ""Common challenges and solutions"", ""Tools and resources needed"", ""Conclusion and next steps""]","[""development"", ""it"", ""programming"", ""evaluation"", ""web""]",6,Senior Developers & Tech Leads,"[""cybersecurity"", ""machine learning"", ""data science"", ""cloud computing""]",59,9,2025-10-25 21:47:59,en,How do you integrate {keyword} with existing systems?,0.83,0.969747391318827,0.88
36800974,cybersecurity,it,How do you implement cybersecurity in a production environment?,evaluation,Advanced,"[""Overview of cybersecurity"", ""Step-by-step implementation"", ""Best practices and tips"", ""Common challenges and solutions"", ""Tools and resources needed"", ""Conclusion and next steps""]","[""development"", ""it"", ""programming"", ""evaluation"", ""cybersecurity""]",5,Senior Developers & Tech Leads,"[""cloud computing"", ""machine learning"", ""data science"", ""web development""]",63,9,2025-10-25 21:47:59,en,How do you implement {keyword} in a production environment?,0.69,0.9466510295043237,0.31
36800975,market analysis,economics,What metrics are most important for market analysis?,optimization,Advanced,"[""Introduction to market analysis"", ""Key points and analysis"", ""Practical examples"", ""Expert insights"", ""Action items"", ""Conclusion""]","[""analysis"", ""business"", ""market"", ""optimization"", ""economics""]",4,Professional Investors & Advisors,"[""portfolio management"", ""financial modeling"", ""investment planning""]",52,8,2025-10-25 21:47:59,en,What metrics are most important for {keyword}?,0.9,0.8351237305613408,0.5
36800976,digital marketing,marketing,How do you create a digital marketing roadmap?,comparison,Beginner,"[""Overview of digital marketing"", ""Step-by-step implementation"", ""Best practices and tips"", ""Common challenges and solutions"", ""Tools and resources needed"", ""Conclusion and next steps""]","[""branding"", ""marketing"", ""comparison"", ""digital""]",6,Marketing Students & Interns,"[""brand management"", ""social media"", ""content marketing""]",46,8,2025-10-25 21:47:59,en,How do you create a {keyword} roadmap?,0.8,0.4595442563338741,0.79
36800977,digital marketing,marketing,What messaging works best in digital marketing campaigns?,evaluation,Expert,"[""Introduction to digital marketing"", ""Key points and analysis"", ""Practical examples"", ""Expert insights"", ""Action items"", ""Conclusion""]","[""promotion"", ""marketing"", ""digital"", ""advertising"", ""evaluation""]",4,Marketing Directors & CMOs,"[""brand management"", ""social media"", ""content marketing""]",57,8,2025-10-25 21:47:59,en,What messaging works best in {keyword} campaigns?,0.89,1.0,0.49
36800978,market analysis,economics,How do you diversify your portfolio using market analysis?,strategy,Expert,"[""Overview of market analysis"", ""Step-by-step implementation"", ""Best practices and tips"", ""Common challenges and solutions"", ""Tools and resources needed"", ""Conclusion and next steps""]","[""investment"", ""analysis"", ""business"", ""market"", ""strategy"", ""economics""]",6,Portfolio Managers & Financial Experts,"[""portfolio management"", ""financial modeling"", ""investment planning""]",58,9,2025-10-25 21:47:59,en,How do you diversify your portfolio using {keyword}?,0.61,1.0,0.89
36800979,investment planning,economics,How do you report on investment planning performance to stakeholders?,evaluation,Advanced,"[""Overview of investment planning"", ""Step-by-step implementation"", ""Best practices and tips"", ""Common challenges and solutions"", ""Tools and resources needed"", ""Conclusion and next steps""]","[""investment"", ""planning"", ""evaluation"", ""market"", ""economics""]",6,Professional Investors & Advisors,"[""market analysis"", ""financial modeling"", ""portfolio management""]",69,10,2025-10-25 21:47:59,en,How do you report on {keyword} performance to stakeholders?,0.8,0.9048091817643017,0.56
36800980,financial modeling,economics,How do you adjust your financial modeling strategy during volatility?,comparison,Beginner,"[""Overview of financial modeling"", ""Step-by-step implementation"", ""Best practices and tips"", ""Common challenges and solutions"", ""Tools and resources needed"", ""Conclusion and next steps""]","[""comparison"", ""modeling"", ""financial"", ""market"", ""business"", ""economics""]",6,Students & New Investors,"[""investment planning"", ""market analysis"", ""portfolio management""]",69,10,2025-10-25 21:47:59,en,How do you adjust your {keyword} strategy during volatility?,0.78,0.48294112503051334,0.61
36800981,social media,marketing,How do you identify the right audience for social media?,analysis,Advanced,"[""Overview of social media"", ""Step-by-step implementation"", ""Best practices and tips"", ""Common challenges and solutions"", ""Tools and resources needed"", ""Conclusion and next steps""]","[""analysis"", ""media"", ""digital"", ""marketing"", ""social"", ""branding""]",6,Marketing Managers & Strategists,"[""brand management"", ""digital marketing"", ""content marketing""]",56,10,2025-10-25 21:47:59,en,How do you identify the right audience for {keyword}?,0.9,0.8314175591716433,0.63
36800982,market analysis,economics,How do you hedge against market analysis market downturns?,strategy,Expert,"[""Overview of market analysis"", ""Step-by-step implementation"", ""Best practices and tips"", ""Common challenges and solutions"", ""Tools and resources needed"", ""Conclusion and next steps""]","[""finance"", ""analysis"", ""market"", ""strategy"", ""economics""]",6,Portfolio Managers & Financial Experts,"[""investment planning"", ""portfolio management"", ""financial modeling""]",58,9,2025-10-25 21:47:59,en,How do you hedge against {keyword} market downturns?,0.9,1.0,0.46
36800983,social media,marketing,What messaging works best in social media campaigns?,evaluation,Expert,"[""Introduction to social media"", ""Key points and analysis"", ""Practical examples"", ""Expert insights"", ""Action items"", ""Conclusion""]","[""media"", ""marketing"", ""social"", ""advertising"", ""branding"", ""evaluation""]",4,Marketing Directors & CMOs,"[""content marketing"", ""brand management"", ""digital marketing""]",52,8,2025-10-25 21:47:59,en,What messaging works best in {keyword} campaigns?,0.89,1.0,0.55
36800984,digital marketing,marketing,How do you identify the right audience for digital marketing?,analysis,Beginner,"[""Overview of digital marketing"", ""Step-by-step implementation"", ""Best practices and tips"", ""Common challenges and solutions"", ""Tools and resources needed"", ""Conclusion and next steps""]","[""analysis"", ""promotion"", ""marketing"", ""digital"", ""branding""]",6,Marketing Students & Interns,"[""content marketing"", ""social media"", ""brand management""]",61,10,2025-10-25 21:47:59,en,How do you identify the right audience for {keyword}?,0.9,0.41929999594513656,0.78
36800985,market analysis,economics,How do you create a long-term plan for market analysis?,how_to,Beginner,"[""Overview of market analysis"", ""Step-by-step implementation"", ""Best practices and tips"", ""Common challenges and solutions"", ""Tools and resources needed"", ""Conclusion and next steps""]","[""investment"", ""how_to"", ""analysis"", ""market"", ""business"", ""economics""]",6,Students & New Investors,"[""investment planning"", ""financial modeling"", ""portfolio management""]",55,10,2025-10-25 21:47:59,en,How do you create a long-term plan for {keyword}?,0.77,0.440110411482805,0.72
36800986,machine learning,it,Which frameworks support machine learning implementation?,implementation,Intermediate,"[""Introduction to machine learning"", ""Key points and analysis"", ""Practical examples"", ""Expert insights"", ""Action items"", ""Conclusion""]","[""development"", ""it"", ""implementation"", ""learning"", ""machine"", ""technology""]",4,Junior to Mid-level Developers,"[""cloud computing"", ""web development"", ""data science"", ""cybersecurity""]",57,6,2025-10-25 21:47:59,en,Which frameworks support {keyword} implementation?,0.64,0.6090296506069106,0.59
36800987,machine learning,it,How do you optimize machine learning for different platforms?,troubleshooting,Expert,"[""Overview of machine learning"", ""Step-by-step implementation"", ""Best practices and tips"", ""Common challenges and solutions"", ""Tools and resources needed"", ""Conclusion and next steps""]","[""development"", ""it"", ""troubleshooting"", ""learning"", ""machine"", ""technology""]",6,Architects & Technical Directors,"[""data science"", ""web development"", ""cloud computing"", ""cybersecurity""]",61,9,2025-10-25 21:47:59,en,How do you optimize {keyword} for different platforms?,0.93,1.0,0.67
36800988,content marketing,marketing,What channels are most effective for content marketing?,implementation,Advanced,"[""Introduction to content marketing"", ""Key points and analysis"", ""Practical examples"", ""Expert insights"", ""Action items"", ""Conclusion""]","[""content"", ""implementation"", ""marketing"", ""digital"", ""branding""]",4,Marketing Managers & Strategists,"[""digital marketing"", ""social media"", ""brand management""]",55,8,2025-10-25 21:47:59,en,What channels are most effective for {keyword}?,0.7,0.965167888735241,0.72
36800989,content marketing,marketing,What messaging works best in content marketing campaigns?,planning,Expert,"[""Introduction to content marketing"", ""Key points and analysis"", ""Practical examples"", ""Expert insights"", ""Action items"", ""Conclusion""]","[""planning"", ""content"", ""marketing"", ""digital"", ""advertising""]",4,Marketing Directors & CMOs,"[""digital marketing"", ""brand management"", ""social media""]",57,8,2025-10-25 21:47:59,en,What messaging works best in {keyword} campaigns?,0.83,1.0,0.86
36800990,financial modeling,economics,How do you analyze market trends in financial modeling?,planning,Advanced,"[""Overview of financial modeling"", ""Step-by-step implementation"", ""Best practices and tips"", ""Common challenges and solutions"", ""Tools and resources needed"", ""Conclusion and next steps""]","[""planning"", ""finance"", ""modeling"", ""financial"", ""market"", ""economics""]",6,Professional Investors & Advisors,"[""market analysis"", ""investment planning"", ""portfolio management""]",55,9,2025-10-25 21:47:59,en,How do you analyze market trends in {keyword}?,0.72,0.997862493001465,0.62
36800991,brand management,marketing,How do you identify the right audience for brand management?,implementation,Beginner,"[""Overview of brand management"", ""Step-by-step implementation"", ""Best practices and tips"", ""Common challenges and solutions"", ""Tools and resources needed"", ""Conclusion and next steps""]","[""implementation"", ""promotion"", ""marketing"", ""management"", ""digital"", ""brand""]",6,Marketing Students & Interns,"[""content marketing"", ""digital marketing"", ""social media""]",60,10,2025-10-25 21:47:59,en,How do you identify the right audience for {keyword}?,0.63,0.3081452075954809,0.7
36800992,brand management,marketing,How do you develop an effective brand management strategy?,planning,Expert,"[""Overview of brand management"", ""Step-by-step implementation"", ""Best practices and tips"", ""Common challenges and solutions"", ""Tools and resources needed"", ""Conclusion and next steps""]","[""planning"", ""promotion"", ""marketing"", ""management"", ""advertising"", ""brand""]",6,Marketing Directors & CMOs,"[""content marketing"", ""social media"", ""digital marketing""]",58,9,2025-10-25 21:47:59,en,How do you develop an effective {keyword} strategy?,0.81,1.0,0.34
36800993,financial modeling,economics,What insurance options are available for financial modeling?,implementation,Beginner,"[""Introduction to financial modeling"", ""Key points and analysis"", ""Practical examples"", ""Expert insights"", ""Action items"", ""Conclusion""]","[""finance"", ""implementation"", ""modeling"", ""financial"", ""market"", ""economics""]",4,Students & New Investors,"[""investment planning"", ""market analysis"", ""portfolio management""]",60,8,2025-10-25 21:47:59,en,What insurance options are available for {keyword}?,0.89,0.37137277849775574,0.84
36800994,digital marketing,marketing,What A/B tests should you run for digital marketing?,implementation,Beginner,"[""Introduction to digital marketing"", ""Key points and analysis"", ""Practical examples"", ""Expert insights"", ""Action items"", ""Conclusion""]","[""implementation"", ""marketing"", ""branding"", ""digital""]",4,Marketing Students & Interns,"[""brand management"", ""social media"", ""content marketing""]",52,9,2025-10-25 21:47:59,en,What A/B tests should you run for {keyword}?,0.62,0.4502043192582844,0.31
36800995,social media,marketing,What KPIs are most important for social media?,strategy,Intermediate,"[""Introduction to social media"", ""Key points and analysis"", ""Practical examples"", ""Expert insights"", ""Action items"", ""Conclusion""]","[""media"", ""promotion"", ""digital"", ""marketing"", ""social"", ""strategy""]",4,Marketing Coordinators & Specialists,"[""content marketing"", ""digital marketing"", ""brand management""]",46,8,2025-10-25 21:47:59,en,What KPIs are most important for {keyword}?,0.63,0.621820264044231,0.87
