record_id,keyword,category,question,question_type,difficulty_level,answer_outline,tags,estimated_read_time,target_audience,related_topics,question_length,word_count,created_date,language,source_template,engagement_score,complexity_score,popularity_score
36500962,data science,it,Which frameworks support data science implementation?,how_to,Expert,"[""Introduction to data science"", ""Key points and analysis"", ""Practical examples"", ""Expert insights"", ""Action items"", ""Conclusion""]","[""how_to"", ""technology"", ""development"", ""it"", ""science"", ""data""]",4,Architects & Technical Directors,"[""cybersecurity"", ""machine learning"", ""cloud computing"", ""web development""]",53,6,2025-10-25 21:47:36,en,Which frameworks support {keyword} implementation?,0.86,1.0,0.3
36500963,brand management,marketing,What content types work best for brand management?,planning,Beginner,"[""Introduction to brand management"", ""Key points and analysis"", ""Practical examples"", ""Expert insights"", ""Action items"", ""Conclusion""]","[""planning"", ""digital"", ""marketing"", ""management"", ""branding"", ""brand""]",4,Marketing Students & Interns,"[""digital marketing"", ""content marketing"", ""social media""]",50,8,2025-10-25 21:47:36,en,What content types work best for {keyword}?,0.78,0.393947249478947,0.47
36500964,digital marketing,marketing,How do you attribute success to digital marketing efforts?,planning,Expert,"[""Overview of digital marketing"", ""Step-by-step implementation"", ""Best practices and tips"", ""Common challenges and solutions"", ""Tools and resources needed"", ""Conclusion and next steps""]","[""planning"", ""promotion"", ""marketing"", ""digital"", ""branding""]",6,Marketing Directors & CMOs,"[""brand management"", ""social media"", ""content marketing""]",58,9,2025-10-25 21:47:36,en,How do you attribute success to {keyword} efforts?,0.76,1.0,0.73
36500965,content marketing,marketing,What KPIs are most important for content marketing?,best_practice,Beginner,"[""Introduction to content marketing"", ""Key points and analysis"", ""Practical examples"", ""Expert insights"", ""Action items"", ""Conclusion""]","[""content"", ""promotion"", ""best_practice"", ""marketing"", ""branding""]",4,Marketing Students & Interns,"[""social media"", ""digital marketing"", ""brand management""]",51,8,2025-10-25 21:47:36,en,What KPIs are most important for {keyword}?,0.68,0.4421775543251426,0.79
36500966,cybersecurity,it,What are the cost considerations for cybersecurity?,strategy,Intermediate,"[""Introduction to cybersecurity"", ""Key concepts and definitions"", ""Main categories or types"", ""Examples and case studies"", ""Benefits and advantages"", ""Summary and recommendations""]","[""software"", ""it"", ""strategy"", ""cybersecurity"", ""technology""]",5,Junior to Mid-level Developers,"[""data science"", ""web development"", ""machine learning"", ""cloud computing""]",51,7,2025-10-25 21:47:36,en,What are the cost considerations for {keyword}?,0.77,0.6462678107908333,0.7
36500967,digital marketing,marketing,What are the latest trends in digital marketing?,strategy,Beginner,"[""Introduction to digital marketing"", ""Key concepts and definitions"", ""Main categories or types"", ""Examples and case studies"", ""Benefits and advantages"", ""Summary and recommendations""]","[""marketing"", ""strategy"", ""promotion"", ""digital""]",6,Marketing Students & Interns,"[""brand management"", ""content marketing"", ""social media""]",48,8,2025-10-25 21:47:36,en,What are the latest trends in {keyword}?,0.7,0.3666370569687277,0.57
36500968,market analysis,economics,What are the risks associated with market analysis?,troubleshooting,Expert,"[""Introduction to market analysis"", ""Key concepts and definitions"", ""Main categories or types"", ""Examples and case studies"", ""Benefits and advantages"", ""Summary and recommendations""]","[""analysis"", ""troubleshooting"", ""market"", ""business"", ""economics""]",6,Portfolio Managers & Financial Experts,"[""financial modeling"", ""investment planning"", ""portfolio management""]",51,8,2025-10-25 21:47:36,en,What are the risks associated with {keyword}?,0.92,1.0,0.3
36500969,cybersecurity,it,What certifications are valuable for cybersecurity professionals?,analysis,Beginner,"[""Introduction to cybersecurity"", ""Key points and analysis"", ""Practical examples"", ""Expert insights"", ""Action items"", ""Conclusion""]","[""analysis"", ""it"", ""programming"", ""cybersecurity"", ""technology""]",4,Students & Entry-level Developers,"[""machine learning"", ""web development"", ""cloud computing"", ""data science""]",65,7,2025-10-25 21:47:36,en,What certifications are valuable for {keyword} professionals?,0.68,0.47199697834960413,0.82
36500970,cybersecurity,it,What ROI can be expected from cybersecurity implementation?,evaluation,Expert,"[""Introduction to cybersecurity"", ""Key points and analysis"", ""Practical examples"", ""Expert insights"", ""Action items"", ""Conclusion""]","[""it"", ""programming"", ""evaluation"", ""cybersecurity"", ""technology""]",4,Architects & Technical Directors,"[""data science"", ""cloud computing"", ""machine learning"", ""web development""]",59,8,2025-10-25 21:47:36,en,What ROI can be expected from {keyword} implementation?,0.87,1.0,0.56
36500971,social media,marketing,What demographics respond best to social media?,implementation,Expert,"[""Introduction to social media"", ""Key points and analysis"", ""Practical examples"", ""Expert insights"", ""Action items"", ""Conclusion""]","[""media"", ""implementation"", ""promotion"", ""marketing"", ""social"", ""advertising""]",4,Marketing Directors & CMOs,"[""content marketing"", ""brand management"", ""digital marketing""]",47,7,2025-10-25 21:47:36,en,What demographics respond best to {keyword}?,0.84,1.0,0.5
36500972,brand management,marketing,What timing strategies work for brand management?,strategy,Advanced,"[""Introduction to brand management"", ""Key points and analysis"", ""Practical examples"", ""Expert insights"", ""Action items"", ""Conclusion""]","[""promotion"", ""marketing"", ""management"", ""branding"", ""strategy"", ""brand""]",4,Marketing Managers & Strategists,"[""content marketing"", ""social media"", ""digital marketing""]",49,7,2025-10-25 21:47:36,en,What timing strategies work for {keyword}?,0.69,0.8148092808321189,0.86
36500973,market analysis,economics,What insurance options are available for market analysis?,strategy,Beginner,"[""Introduction to market analysis"", ""Key points and analysis"", ""Practical examples"", ""Expert insights"", ""Action items"", ""Conclusion""]","[""analysis"", ""business"", ""market"", ""strategy"", ""economics""]",4,Students & New Investors,"[""portfolio management"", ""investment planning"", ""financial modeling""]",57,8,2025-10-25 21:47:36,en,What insurance options are available for {keyword}?,0.8,0.38678740416501106,0.87
36500974,digital marketing,marketing,What timing strategies work for digital marketing?,troubleshooting,Intermediate,"[""Introduction to digital marketing"", ""Key points and analysis"", ""Practical examples"", ""Expert insights"", ""Action items"", ""Conclusion""]","[""promotion"", ""troubleshooting"", ""marketing"", ""digital"", ""advertising""]",4,Marketing Coordinators & Specialists,"[""brand management"", ""content marketing"", ""social media""]",50,7,2025-10-25 21:47:36,en,What timing strategies work for {keyword}?,0.66,0.7574734566319921,0.76
36500975,content marketing,marketing,How do you measure the ROI of content marketing campaigns?,troubleshooting,Intermediate,"[""Overview of content marketing"", ""Step-by-step implementation"", ""Best practices and tips"", ""Common challenges and solutions"", ""Tools and resources needed"", ""Conclusion and next steps""]","[""content"", ""promotion"", ""troubleshooting"", ""marketing"", ""advertising""]",6,Marketing Coordinators & Specialists,"[""social media"", ""brand management"", ""digital marketing""]",58,10,2025-10-25 21:47:36,en,How do you measure the ROI of {keyword} campaigns?,0.69,0.7723704120048345,0.79
36500976,financial modeling,economics,What indicators predict financial modeling market movements?,strategy,Advanced,"[""Introduction to financial modeling"", ""Key points and analysis"", ""Practical examples"", ""Expert insights"", ""Action items"", ""Conclusion""]","[""investment"", ""finance"", ""modeling"", ""financial"", ""strategy"", ""economics""]",4,Professional Investors & Advisors,"[""portfolio management"", ""market analysis"", ""investment planning""]",60,7,2025-10-25 21:47:36,en,What indicators predict {keyword} market movements?,0.67,0.8878281065049204,0.36
36500977,investment planning,economics,How do you adjust your investment planning strategy during volatility?,comparison,Intermediate,"[""Overview of investment planning"", ""Step-by-step implementation"", ""Best practices and tips"", ""Common challenges and solutions"", ""Tools and resources needed"", ""Conclusion and next steps""]","[""investment"", ""planning"", ""finance"", ""comparison"", ""business"", ""economics""]",6,Individual Investors & Analysts,"[""financial modeling"", ""portfolio management"", ""market analysis""]",70,10,2025-10-25 21:47:36,en,How do you adjust your {keyword} strategy during volatility?,0.92,0.6128665402947433,0.68
36500978,web development,it,What career opportunities exist in web development?,implementation,Intermediate,"[""Introduction to web development"", ""Key points and analysis"", ""Practical examples"", ""Expert insights"", ""Action items"", ""Conclusion""]","[""technology"", ""development"", ""it"", ""implementation"", ""programming"", ""web""]",4,Junior to Mid-level Developers,"[""cloud computing"", ""data science"", ""cybersecurity"", ""machine learning""]",51,7,2025-10-25 21:47:36,en,What career opportunities exist in {keyword}?,0.77,0.7726427665266066,0.64
36500979,social media,marketing,What tools are essential for social media analytics?,how_to,Beginner,"[""Introduction to social media"", ""Key points and analysis"", ""Practical examples"", ""Expert insights"", ""Action items"", ""Conclusion""]","[""how_to"", ""media"", ""promotion"", ""marketing"", ""social"", ""branding""]",4,Marketing Students & Interns,"[""digital marketing"", ""brand management"", ""content marketing""]",52,8,2025-10-25 21:47:36,en,What tools are essential for {keyword} analytics?,0.94,0.42510846423379606,0.66
36500980,brand management,marketing,What timing strategies work for brand management?,comparison,Advanced,"[""Introduction to brand management"", ""Key points and analysis"", ""Practical examples"", ""Expert insights"", ""Action items"", ""Conclusion""]","[""promotion"", ""comparison"", ""marketing"", ""management"", ""branding"", ""brand""]",4,Marketing Managers & Strategists,"[""social media"", ""digital marketing"", ""content marketing""]",49,7,2025-10-25 21:47:36,en,What timing strategies work for {keyword}?,0.82,0.8710131467896737,0.4
36500981,portfolio management,economics,How do you measure portfolio management performance?,how_to,Beginner,"[""Overview of portfolio management"", ""Step-by-step implementation"", ""Best practices and tips"", ""Common challenges and solutions"", ""Tools and resources needed"", ""Conclusion and next steps""]","[""how_to"", ""finance"", ""portfolio"", ""management"", ""market"", ""economics""]",6,Students & New Investors,"[""market analysis"", ""investment planning"", ""financial modeling""]",52,7,2025-10-25 21:47:36,en,How do you measure {keyword} performance?,0.86,0.32236285290784567,0.35
36500982,investment planning,economics,How do you protect your investment planning investments?,best_practice,Advanced,"[""Overview of investment planning"", ""Step-by-step implementation"", ""Best practices and tips"", ""Common challenges and solutions"", ""Tools and resources needed"", ""Conclusion and next steps""]","[""investment"", ""planning"", ""finance"", ""best_practice"", ""economics""]",6,Professional Investors & Advisors,"[""financial modeling"", ""market analysis"", ""portfolio management""]",56,8,2025-10-25 21:47:36,en,How do you protect your {keyword} investments?,0.74,0.8554193626552901,0.42
36500983,machine learning,it,What skills are needed to master machine learning?,implementation,Intermediate,"[""Introduction to machine learning"", ""Key points and analysis"", ""Practical examples"", ""Expert insights"", ""Action items"", ""Conclusion""]","[""development"", ""it"", ""implementation"", ""programming"", ""learning"", ""machine""]",4,Junior to Mid-level Developers,"[""cloud computing"", ""cybersecurity"", ""web development"", ""data science""]",50,8,2025-10-25 21:47:36,en,What skills are needed to master {keyword}?,0.95,0.7299419289463001,0.9
36500984,content marketing,marketing,What KPIs are most important for content marketing?,troubleshooting,Intermediate,"[""Introduction to content marketing"", ""Key points and analysis"", ""Practical examples"", ""Expert insights"", ""Action items"", ""Conclusion""]","[""content"", ""troubleshooting"", ""marketing"", ""advertising"", ""branding""]",4,Marketing Coordinators & Specialists,"[""digital marketing"", ""social media"", ""brand management""]",51,8,2025-10-25 21:47:36,en,What KPIs are most important for {keyword}?,0.9,0.6491472752937403,0.85
36500985,portfolio management,economics,How do you measure portfolio management performance?,optimization,Intermediate,"[""Overview of portfolio management"", ""Step-by-step implementation"", ""Best practices and tips"", ""Common challenges and solutions"", ""Tools and resources needed"", ""Conclusion and next steps""]","[""finance"", ""portfolio"", ""management"", ""market"", ""optimization"", ""economics""]",6,Individual Investors & Analysts,"[""market analysis"", ""financial modeling"", ""investment planning""]",52,7,2025-10-25 21:47:36,en,How do you measure {keyword} performance?,0.92,0.6587670490172991,0.79
36500986,machine learning,it,How do you stay updated with machine learning developments?,troubleshooting,Advanced,"[""Overview of machine learning"", ""Step-by-step implementation"", ""Best practices and tips"", ""Common challenges and solutions"", ""Tools and resources needed"", ""Conclusion and next steps""]","[""it"", ""programming"", ""troubleshooting"", ""learning"", ""machine"", ""technology""]",6,Senior Developers & Tech Leads,"[""web development"", ""data science"", ""cybersecurity"", ""cloud computing""]",59,9,2025-10-25 21:47:36,en,How do you stay updated with {keyword} developments?,0.82,0.9379542591838677,0.66
36500987,web development,it,What ROI can be expected from web development implementation?,evaluation,Beginner,"[""Introduction to web development"", ""Key points and analysis"", ""Practical examples"", ""Expert insights"", ""Action items"", ""Conclusion""]","[""software"", ""development"", ""it"", ""evaluation"", ""web""]",4,Students & Entry-level Developers,"[""data science"", ""machine learning"", ""cloud computing"", ""cybersecurity""]",61,9,2025-10-25 21:47:36,en,What ROI can be expected from {keyword} implementation?,0.67,0.49100379564304586,0.88
36500988,brand management,marketing,What messaging works best in brand management campaigns?,how_to,Intermediate,"[""Introduction to brand management"", ""Key points and analysis"", ""Practical examples"", ""Expert insights"", ""Action items"", ""Conclusion""]","[""how_to"", ""promotion"", ""marketing"", ""management"", ""advertising"", ""brand""]",4,Marketing Coordinators & Specialists,"[""digital marketing"", ""social media"", ""content marketing""]",56,8,2025-10-25 21:47:36,en,What messaging works best in {keyword} campaigns?,0.93,0.6770628819461256,0.53
36500989,social media,marketing,What A/B tests should you run for social media?,optimization,Expert,"[""Introduction to social media"", ""Key points and analysis"", ""Practical examples"", ""Expert insights"", ""Action items"", ""Conclusion""]","[""media"", ""marketing"", ""social"", ""advertising"", ""branding"", ""optimization""]",4,Marketing Directors & CMOs,"[""brand management"", ""content marketing"", ""digital marketing""]",47,9,2025-10-25 21:47:36,en,What A/B tests should you run for {keyword}?,0.75,1.0,0.45
36500990,cloud computing,it,What security considerations should be taken when using cloud computing?,how_to,Advanced,"[""Introduction to cloud computing"", ""Key points and analysis"", ""Practical examples"", ""Expert insights"", ""Action items"", ""Conclusion""]","[""computing"", ""how_to"", ""software"", ""development"", ""it"", ""cloud""]",4,Senior Developers & Tech Leads,"[""web development"", ""cybersecurity"", ""machine learning"", ""data science""]",72,10,2025-10-25 21:47:36,en,What security considerations should be taken when using {keyword}?,0.67,0.9921534613818989,0.66
36500991,investment planning,economics,How do you measure investment planning performance?,optimization,Intermediate,"[""Overview of investment planning"", ""Step-by-step implementation"", ""Best practices and tips"", ""Common challenges and solutions"", ""Tools and resources needed"", ""Conclusion and next steps""]","[""investment"", ""planning"", ""finance"", ""business"", ""optimization"", ""economics""]",6,Individual Investors & Analysts,"[""financial modeling"", ""portfolio management"", ""market analysis""]",51,7,2025-10-25 21:47:36,en,How do you measure {keyword} performance?,0.72,0.6186281085965674,0.34
36500992,brand management,marketing,How do you track and analyze brand management performance?,optimization,Intermediate,"[""Overview of brand management"", ""Step-by-step implementation"", ""Best practices and tips"", ""Common challenges and solutions"", ""Tools and resources needed"", ""Conclusion and next steps""]","[""marketing"", ""management"", ""advertising"", ""branding"", ""optimization"", ""brand""]",6,Marketing Coordinators & Specialists,"[""content marketing"", ""social media"", ""digital marketing""]",58,9,2025-10-25 21:47:36,en,How do you track and analyze {keyword} performance?,0.7,0.6875702632338319,0.57
36500993,brand management,marketing,How do you improve brand management conversion rates?,implementation,Advanced,"[""Overview of brand management"", ""Step-by-step implementation"", ""Best practices and tips"", ""Common challenges and solutions"", ""Tools and resources needed"", ""Conclusion and next steps""]","[""implementation"", ""marketing"", ""digital"", ""management"", ""branding"", ""brand""]",6,Marketing Managers & Strategists,"[""digital marketing"", ""content marketing"", ""social media""]",53,8,2025-10-25 21:47:36,en,How do you improve {keyword} conversion rates?,0.8,0.9737205991067612,0.5
36500994,portfolio management,economics,What indicators predict portfolio management market movements?,strategy,Intermediate,"[""Introduction to portfolio management"", ""Key points and analysis"", ""Practical examples"", ""Expert insights"", ""Action items"", ""Conclusion""]","[""investment"", ""portfolio"", ""management"", ""business"", ""strategy"", ""economics""]",4,Individual Investors & Analysts,"[""investment planning"", ""financial modeling"", ""market analysis""]",62,7,2025-10-25 21:47:36,en,What indicators predict {keyword} market movements?,0.75,0.7344863532159969,0.67
36500995,content marketing,marketing,How do you develop an effective content marketing strategy?,strategy,Intermediate,"[""Overview of content marketing"", ""Step-by-step implementation"", ""Best practices and tips"", ""Common challenges and solutions"", ""Tools and resources needed"", ""Conclusion and next steps""]","[""content"", ""marketing"", ""advertising"", ""branding"", ""strategy""]",6,Marketing Coordinators & Specialists,"[""brand management"", ""digital marketing"", ""social media""]",59,9,2025-10-25 21:47:36,en,How do you develop an effective {keyword} strategy?,0.92,0.6626123719298574,0.32
36500996,social media,marketing,What tools are essential for social media analytics?,best_practice,Intermediate,"[""Introduction to social media"", ""Key points and analysis"", ""Practical examples"", ""Expert insights"", ""Action items"", ""Conclusion""]","[""media"", ""promotion"", ""best_practice"", ""digital"", ""marketing"", ""social""]",4,Marketing Coordinators & Specialists,"[""content marketing"", ""digital marketing"", ""brand management""]",52,8,2025-10-25 21:47:36,en,What tools are essential for {keyword} analytics?,0.72,0.7628021079719428,0.42
36500997,web development,it,What are the cost considerations for web development?,comparison,Beginner,"[""Introduction to web development"", ""Key concepts and definitions"", ""Main categories or types"", ""Examples and case studies"", ""Benefits and advantages"", ""Summary and recommendations""]","[""software"", ""development"", ""it"", ""comparison"", ""programming"", ""web""]",6,Students & Entry-level Developers,"[""cloud computing"", ""machine learning"", ""data science"", ""cybersecurity""]",53,8,2025-10-25 21:47:36,en,What are the cost considerations for {keyword}?,0.6,0.420088095993172,0.32
36500998,investment planning,economics,What timeline is realistic for investment planning returns?,optimization,Advanced,"[""Introduction to investment planning"", ""Key points and analysis"", ""Practical examples"", ""Expert insights"", ""Action items"", ""Conclusion""]","[""investment"", ""planning"", ""finance"", ""optimization"", ""economics""]",4,Professional Investors & Advisors,"[""market analysis"", ""financial modeling"", ""portfolio management""]",59,8,2025-10-25 21:47:36,en,What timeline is realistic for {keyword} returns?,0.74,0.9462930257567592,0.81
36500999,market analysis,economics,What factors should be considered when evaluating market analysis?,planning,Intermediate,"[""Introduction to market analysis"", ""Key points and analysis"", ""Practical examples"", ""Expert insights"", ""Action items"", ""Conclusion""]","[""investment"", ""planning"", ""finance"", ""analysis"", ""market"", ""economics""]",4,Individual Investors & Analysts,"[""financial modeling"", ""portfolio management"", ""investment planning""]",66,9,2025-10-25 21:47:36,en,What factors should be considered when evaluating {keyword}?,0.88,0.655942599086876,0.33
36501000,portfolio management,economics,How do you protect your portfolio management investments?,implementation,Expert,"[""Overview of portfolio management"", ""Step-by-step implementation"", ""Best practices and tips"", ""Common challenges and solutions"", ""Tools and resources needed"", ""Conclusion and next steps""]","[""investment"", ""finance"", ""implementation"", ""portfolio"", ""management"", ""economics""]",6,Portfolio Managers & Financial Experts,"[""investment planning"", ""financial modeling"", ""market analysis""]",57,8,2025-10-25 21:47:36,en,How do you protect your {keyword} investments?,0.61,1.0,0.82
36501001,financial modeling,economics,How do you adjust your financial modeling strategy during volatility?,evaluation,Advanced,"[""Overview of financial modeling"", ""Step-by-step implementation"", ""Best practices and tips"", ""Common challenges and solutions"", ""Tools and resources needed"", ""Conclusion and next steps""]","[""modeling"", ""financial"", ""evaluation"", ""market"", ""business"", ""economics""]",6,Professional Investors & Advisors,"[""investment planning"", ""portfolio management"", ""market analysis""]",69,10,2025-10-25 21:47:36,en,How do you adjust your {keyword} strategy during volatility?,0.91,0.8118557507061231,0.89
36501002,market analysis,economics,What tools help analyze market analysis data?,comparison,Beginner,"[""Introduction to market analysis"", ""Key points and analysis"", ""Practical examples"", ""Expert insights"", ""Action items"", ""Conclusion""]","[""analysis"", ""comparison"", ""market"", ""business"", ""economics""]",4,Students & New Investors,"[""investment planning"", ""financial modeling"", ""portfolio management""]",45,7,2025-10-25 21:47:36,en,What tools help analyze {keyword} data?,0.85,0.3059330616591075,0.54
36501003,data science,it,What are the best practices for data science development?,evaluation,Beginner,"[""Introduction to data science"", ""Key concepts and definitions"", ""Main categories or types"", ""Examples and case studies"", ""Benefits and advantages"", ""Summary and recommendations""]","[""technology"", ""software"", ""it"", ""science"", ""evaluation"", ""data""]",6,Students & Entry-level Developers,"[""web development"", ""machine learning"", ""cloud computing"", ""cybersecurity""]",57,9,2025-10-25 21:47:36,en,What are the best practices for {keyword} development?,0.66,0.465254150343456,0.81
36501004,digital marketing,marketing,What timing strategies work for digital marketing?,strategy,Intermediate,"[""Introduction to digital marketing"", ""Key points and analysis"", ""Practical examples"", ""Expert insights"", ""Action items"", ""Conclusion""]","[""promotion"", ""marketing"", ""digital"", ""branding"", ""strategy""]",4,Marketing Coordinators & Specialists,"[""brand management"", ""content marketing"", ""social media""]",50,7,2025-10-25 21:47:36,en,What timing strategies work for {keyword}?,0.82,0.6785482721794316,0.33
36501005,social media,marketing,What KPIs are most important for social media?,optimization,Advanced,"[""Introduction to social media"", ""Key points and analysis"", ""Practical examples"", ""Expert insights"", ""Action items"", ""Conclusion""]","[""media"", ""promotion"", ""marketing"", ""social"", ""branding"", ""optimization""]",4,Marketing Managers & Strategists,"[""brand management"", ""digital marketing"", ""content marketing""]",46,8,2025-10-25 21:47:36,en,What KPIs are most important for {keyword}?,0.66,0.9543937378258254,0.37
