record_id,keyword,category,question,question_type,difficulty_level,answer_outline,tags,estimated_read_time,target_audience,related_topics,question_length,word_count,created_date,language,source_template,engagement_score,complexity_score,popularity_score
34700956,social media,marketing,How do you improve social media conversion rates?,troubleshooting,Beginner,"[""Overview of social media"", ""Step-by-step implementation"", ""Best practices and tips"", ""Common challenges and solutions"", ""Tools and resources needed"", ""Conclusion and next steps""]","[""media"", ""promotion"", ""troubleshooting"", ""marketing"", ""social"", ""advertising""]",6,Marketing Students & Interns,"[""digital marketing"", ""content marketing"", ""brand management""]",49,8,2025-10-25 21:45:02,en,How do you improve {keyword} conversion rates?,0.77,0.4719608203586835,0.46
34700957,brand management,marketing,How do you automate brand management processes?,troubleshooting,Intermediate,"[""Overview of brand management"", ""Step-by-step implementation"", ""Best practices and tips"", ""Common challenges and solutions"", ""Tools and resources needed"", ""Conclusion and next steps""]","[""troubleshooting"", ""marketing"", ""management"", ""advertising"", ""branding"", ""brand""]",6,Marketing Coordinators & Specialists,"[""digital marketing"", ""content marketing"", ""social media""]",47,7,2025-10-25 21:45:02,en,How do you automate {keyword} processes?,0.69,0.6571706120968098,0.78
34700958,content marketing,marketing,How do you measure the ROI of content marketing campaigns?,planning,Beginner,"[""Overview of content marketing"", ""Step-by-step implementation"", ""Best practices and tips"", ""Common challenges and solutions"", ""Tools and resources needed"", ""Conclusion and next steps""]","[""planning"", ""content"", ""marketing"", ""digital"", ""branding""]",6,Marketing Students & Interns,"[""social media"", ""brand management"", ""digital marketing""]",58,10,2025-10-25 21:45:02,en,How do you measure the ROI of {keyword} campaigns?,0.86,0.3249376014364884,0.44
34700959,market analysis,economics,How do you identify opportunities in market analysis markets?,troubleshooting,Beginner,"[""Overview of market analysis"", ""Step-by-step implementation"", ""Best practices and tips"", ""Common challenges and solutions"", ""Tools and resources needed"", ""Conclusion and next steps""]","[""analysis"", ""finance"", ""troubleshooting"", ""market"", ""business"", ""economics""]",6,Students & New Investors,"[""financial modeling"", ""portfolio management"", ""investment planning""]",61,9,2025-10-25 21:45:02,en,How do you identify opportunities in {keyword} markets?,0.67,0.45877141391040727,0.8
34700960,content marketing,marketing,What messaging works best in content marketing campaigns?,how_to,Beginner,"[""Introduction to content marketing"", ""Key points and analysis"", ""Practical examples"", ""Expert insights"", ""Action items"", ""Conclusion""]","[""how_to"", ""content"", ""marketing"", ""digital"", ""advertising""]",4,Marketing Students & Interns,"[""digital marketing"", ""social media"", ""brand management""]",57,8,2025-10-25 21:45:02,en,What messaging works best in {keyword} campaigns?,0.93,0.3501899378473369,0.45
34700961,digital marketing,marketing,What KPIs are most important for digital marketing?,analysis,Advanced,"[""Introduction to digital marketing"", ""Key points and analysis"", ""Practical examples"", ""Expert insights"", ""Action items"", ""Conclusion""]","[""analysis"", ""promotion"", ""marketing"", ""digital"", ""branding""]",4,Marketing Managers & Strategists,"[""brand management"", ""content marketing"", ""social media""]",51,8,2025-10-25 21:45:02,en,What KPIs are most important for {keyword}?,0.95,0.8340900412807957,0.77
34700962,digital marketing,marketing,How do you reach new customers through digital marketing?,strategy,Expert,"[""Overview of digital marketing"", ""Step-by-step implementation"", ""Best practices and tips"", ""Common challenges and solutions"", ""Tools and resources needed"", ""Conclusion and next steps""]","[""promotion"", ""marketing"", ""digital"", ""branding"", ""strategy""]",6,Marketing Directors & CMOs,"[""content marketing"", ""social media"", ""brand management""]",57,9,2025-10-25 21:45:02,en,How do you reach new customers through {keyword}?,0.68,1.0,0.74
34700963,machine learning,it,How do you implement machine learning in a production environment?,how_to,Advanced,"[""Overview of machine learning"", ""Step-by-step implementation"", ""Best practices and tips"", ""Common challenges and solutions"", ""Tools and resources needed"", ""Conclusion and next steps""]","[""how_to"", ""software"", ""development"", ""it"", ""learning"", ""machine""]",6,Senior Developers & Tech Leads,"[""cybersecurity"", ""cloud computing"", ""data science"", ""web development""]",66,10,2025-10-25 21:45:02,en,How do you implement {keyword} in a production environment?,0.89,0.9372777687257388,0.34
34700964,market analysis,economics,What timeline is realistic for market analysis returns?,best_practice,Intermediate,"[""Introduction to market analysis"", ""Key points and analysis"", ""Practical examples"", ""Expert insights"", ""Action items"", ""Conclusion""]","[""finance"", ""analysis"", ""best_practice"", ""market"", ""business"", ""economics""]",4,Individual Investors & Analysts,"[""portfolio management"", ""financial modeling"", ""investment planning""]",55,8,2025-10-25 21:45:02,en,What timeline is realistic for {keyword} returns?,0.78,0.7537815431428361,0.81
34700965,brand management,marketing,How do you attribute success to brand management efforts?,implementation,Beginner,"[""Overview of brand management"", ""Step-by-step implementation"", ""Best practices and tips"", ""Common challenges and solutions"", ""Tools and resources needed"", ""Conclusion and next steps""]","[""implementation"", ""marketing"", ""management"", ""advertising"", ""branding"", ""brand""]",6,Marketing Students & Interns,"[""digital marketing"", ""content marketing"", ""social media""]",57,9,2025-10-25 21:45:02,en,How do you attribute success to {keyword} efforts?,0.61,0.47788947510010427,0.85
34700966,cloud computing,it,What are the key components of a cloud computing implementation?,strategy,Expert,"[""Introduction to cloud computing"", ""Key concepts and definitions"", ""Main categories or types"", ""Examples and case studies"", ""Benefits and advantages"", ""Summary and recommendations""]","[""computing"", ""cloud"", ""development"", ""it"", ""programming"", ""strategy""]",6,Architects & Technical Directors,"[""machine learning"", ""cybersecurity"", ""web development"", ""data science""]",64,10,2025-10-25 21:45:02,en,What are the key components of a {keyword} implementation?,0.66,1.0,0.69
34700967,cloud computing,it,What career opportunities exist in cloud computing?,best_practice,Beginner,"[""Introduction to cloud computing"", ""Key points and analysis"", ""Practical examples"", ""Expert insights"", ""Action items"", ""Conclusion""]","[""computing"", ""software"", ""development"", ""it"", ""best_practice"", ""cloud""]",4,Students & Entry-level Developers,"[""cybersecurity"", ""web development"", ""machine learning"", ""data science""]",51,7,2025-10-25 21:45:02,en,What career opportunities exist in {keyword}?,0.61,0.46601938211228344,0.68
34700968,cybersecurity,it,What security considerations should be taken when using cybersecurity?,evaluation,Expert,"[""Introduction to cybersecurity"", ""Key points and analysis"", ""Practical examples"", ""Expert insights"", ""Action items"", ""Conclusion""]","[""software"", ""it"", ""evaluation"", ""cybersecurity"", ""technology""]",4,Architects & Technical Directors,"[""cloud computing"", ""web development"", ""data science"", ""machine learning""]",70,9,2025-10-25 21:45:02,en,What security considerations should be taken when using {keyword}?,0.85,1.0,0.33
34700969,financial modeling,economics,How do you report on financial modeling performance to stakeholders?,implementation,Beginner,"[""Overview of financial modeling"", ""Step-by-step implementation"", ""Best practices and tips"", ""Common challenges and solutions"", ""Tools and resources needed"", ""Conclusion and next steps""]","[""finance"", ""implementation"", ""modeling"", ""financial"", ""market"", ""economics""]",6,Students & New Investors,"[""investment planning"", ""portfolio management"", ""market analysis""]",68,10,2025-10-25 21:45:02,en,How do you report on {keyword} performance to stakeholders?,0.86,0.425461762125304,0.6
34700970,cybersecurity,it,What design patterns work best with cybersecurity?,optimization,Expert,"[""Introduction to cybersecurity"", ""Key points and analysis"", ""Practical examples"", ""Expert insights"", ""Action items"", ""Conclusion""]","[""it"", ""programming"", ""optimization"", ""cybersecurity"", ""technology""]",4,Architects & Technical Directors,"[""machine learning"", ""web development"", ""data science"", ""cloud computing""]",50,7,2025-10-25 21:45:02,en,What design patterns work best with {keyword}?,0.61,1.0,0.88
34700971,web development,it,How do you implement web development in a production environment?,implementation,Advanced,"[""Overview of web development"", ""Step-by-step implementation"", ""Best practices and tips"", ""Common challenges and solutions"", ""Tools and resources needed"", ""Conclusion and next steps""]","[""software"", ""development"", ""it"", ""implementation"", ""programming"", ""web""]",6,Senior Developers & Tech Leads,"[""data science"", ""cybersecurity"", ""cloud computing"", ""machine learning""]",65,10,2025-10-25 21:45:02,en,How do you implement {keyword} in a production environment?,0.88,0.9512144798651234,0.64
34700972,financial modeling,economics,What are the risks associated with financial modeling?,best_practice,Expert,"[""Introduction to financial modeling"", ""Key concepts and definitions"", ""Main categories or types"", ""Examples and case studies"", ""Benefits and advantages"", ""Summary and recommendations""]","[""best_practice"", ""modeling"", ""financial"", ""market"", ""business"", ""economics""]",6,Portfolio Managers & Financial Experts,"[""portfolio management"", ""investment planning"", ""market analysis""]",54,8,2025-10-25 21:45:02,en,What are the risks associated with {keyword}?,0.63,1.0,0.34
34700973,machine learning,it,What are the key components of a machine learning implementation?,planning,Advanced,"[""Introduction to machine learning"", ""Key concepts and definitions"", ""Main categories or types"", ""Examples and case studies"", ""Benefits and advantages"", ""Summary and recommendations""]","[""planning"", ""software"", ""it"", ""learning"", ""machine"", ""technology""]",6,Senior Developers & Tech Leads,"[""data science"", ""cybersecurity"", ""web development"", ""cloud computing""]",65,10,2025-10-25 21:45:02,en,What are the key components of a {keyword} implementation?,0.78,0.8742658215236284,0.86
34700974,data science,it,What ROI can be expected from data science implementation?,planning,Advanced,"[""Introduction to data science"", ""Key points and analysis"", ""Practical examples"", ""Expert insights"", ""Action items"", ""Conclusion""]","[""technology"", ""planning"", ""software"", ""it"", ""science"", ""data""]",4,Senior Developers & Tech Leads,"[""web development"", ""cybersecurity"", ""cloud computing"", ""machine learning""]",58,9,2025-10-25 21:45:02,en,What ROI can be expected from {keyword} implementation?,0.77,0.88517220191356,0.44
34700975,content marketing,marketing,What A/B tests should you run for content marketing?,evaluation,Expert,"[""Introduction to content marketing"", ""Key points and analysis"", ""Practical examples"", ""Expert insights"", ""Action items"", ""Conclusion""]","[""content"", ""marketing"", ""advertising"", ""branding"", ""evaluation""]",4,Marketing Directors & CMOs,"[""digital marketing"", ""brand management"", ""social media""]",52,9,2025-10-25 21:45:02,en,What A/B tests should you run for {keyword}?,0.94,1.0,0.49
34700976,content marketing,marketing,How do you automate content marketing processes?,planning,Beginner,"[""Overview of content marketing"", ""Step-by-step implementation"", ""Best practices and tips"", ""Common challenges and solutions"", ""Tools and resources needed"", ""Conclusion and next steps""]","[""planning"", ""content"", ""promotion"", ""marketing"", ""digital""]",6,Marketing Students & Interns,"[""brand management"", ""social media"", ""digital marketing""]",48,7,2025-10-25 21:45:02,en,How do you automate {keyword} processes?,0.9,0.46202899568913425,0.41
34700977,content marketing,marketing,How do you automate content marketing processes?,implementation,Advanced,"[""Overview of content marketing"", ""Step-by-step implementation"", ""Best practices and tips"", ""Common challenges and solutions"", ""Tools and resources needed"", ""Conclusion and next steps""]","[""content"", ""implementation"", ""marketing"", ""digital"", ""advertising""]",6,Marketing Managers & Strategists,"[""brand management"", ""digital marketing"", ""social media""]",48,7,2025-10-25 21:45:02,en,How do you automate {keyword} processes?,0.81,0.9434768368851565,0.83
34700978,investment planning,economics,What strategies work best for investment planning investment?,troubleshooting,Advanced,"[""Introduction to investment planning"", ""Key points and analysis"", ""Practical examples"", ""Expert insights"", ""Action items"", ""Conclusion""]","[""investment"", ""planning"", ""finance"", ""troubleshooting"", ""economics""]",4,Professional Investors & Advisors,"[""market analysis"", ""financial modeling"", ""portfolio management""]",61,8,2025-10-25 21:45:02,en,What strategies work best for {keyword} investment?,0.73,0.9980098635641533,0.58
34700979,portfolio management,economics,What exit strategies should be considered for portfolio management?,troubleshooting,Intermediate,"[""Introduction to portfolio management"", ""Key points and analysis"", ""Practical examples"", ""Expert insights"", ""Action items"", ""Conclusion""]","[""investment"", ""portfolio"", ""troubleshooting"", ""management"", ""business"", ""economics""]",4,Individual Investors & Analysts,"[""investment planning"", ""financial modeling"", ""market analysis""]",67,9,2025-10-25 21:45:02,en,What exit strategies should be considered for {keyword}?,0.61,0.7089666705237035,0.63
34700980,investment planning,economics,How do you measure investment planning performance?,optimization,Advanced,"[""Overview of investment planning"", ""Step-by-step implementation"", ""Best practices and tips"", ""Common challenges and solutions"", ""Tools and resources needed"", ""Conclusion and next steps""]","[""investment"", ""planning"", ""business"", ""market"", ""optimization"", ""economics""]",6,Professional Investors & Advisors,"[""financial modeling"", ""portfolio management"", ""market analysis""]",51,7,2025-10-25 21:45:02,en,How do you measure {keyword} performance?,0.72,0.9170958415578366,0.59
34700981,financial modeling,economics,What are the seasonal patterns in financial modeling?,evaluation,Beginner,"[""Introduction to financial modeling"", ""Key concepts and definitions"", ""Main categories or types"", ""Examples and case studies"", ""Benefits and advantages"", ""Summary and recommendations""]","[""finance"", ""modeling"", ""financial"", ""evaluation"", ""business"", ""economics""]",6,Students & New Investors,"[""investment planning"", ""market analysis"", ""portfolio management""]",53,8,2025-10-25 21:45:02,en,What are the seasonal patterns in {keyword}?,0.84,0.34896425679908877,0.43
34700982,data science,it,How do you measure the success of data science projects?,comparison,Expert,"[""Overview of data science"", ""Step-by-step implementation"", ""Best practices and tips"", ""Common challenges and solutions"", ""Tools and resources needed"", ""Conclusion and next steps""]","[""technology"", ""software"", ""it"", ""comparison"", ""science"", ""data""]",6,Architects & Technical Directors,"[""web development"", ""machine learning"", ""cloud computing"", ""cybersecurity""]",56,10,2025-10-25 21:45:02,en,How do you measure the success of {keyword} projects?,0.85,1.0,0.55
34700983,social media,marketing,How do you track and analyze social media performance?,comparison,Expert,"[""Overview of social media"", ""Step-by-step implementation"", ""Best practices and tips"", ""Common challenges and solutions"", ""Tools and resources needed"", ""Conclusion and next steps""]","[""media"", ""comparison"", ""marketing"", ""social"", ""advertising"", ""branding""]",6,Marketing Directors & CMOs,"[""brand management"", ""content marketing"", ""digital marketing""]",54,9,2025-10-25 21:45:02,en,How do you track and analyze {keyword} performance?,0.61,1.0,0.84
34700984,content marketing,marketing,What does the future hold for content marketing?,implementation,Intermediate,"[""Introduction to content marketing"", ""Key points and analysis"", ""Practical examples"", ""Expert insights"", ""Action items"", ""Conclusion""]","[""content"", ""implementation"", ""marketing"", ""advertising"", ""branding""]",4,Marketing Coordinators & Specialists,"[""brand management"", ""social media"", ""digital marketing""]",48,8,2025-10-25 21:45:02,en,What does the future hold for {keyword}?,0.67,0.6315600094269882,0.71
34700985,digital marketing,marketing,How do you measure the ROI of digital marketing campaigns?,comparison,Beginner,"[""Overview of digital marketing"", ""Step-by-step implementation"", ""Best practices and tips"", ""Common challenges and solutions"", ""Tools and resources needed"", ""Conclusion and next steps""]","[""branding"", ""marketing"", ""comparison"", ""digital""]",6,Marketing Students & Interns,"[""brand management"", ""content marketing"", ""social media""]",58,10,2025-10-25 21:45:02,en,How do you measure the ROI of {keyword} campaigns?,0.71,0.3822799442965878,0.73
34700986,machine learning,it,Which frameworks support machine learning implementation?,implementation,Advanced,"[""Introduction to machine learning"", ""Key points and analysis"", ""Practical examples"", ""Expert insights"", ""Action items"", ""Conclusion""]","[""development"", ""it"", ""implementation"", ""learning"", ""machine"", ""technology""]",4,Senior Developers & Tech Leads,"[""data science"", ""cloud computing"", ""cybersecurity"", ""web development""]",57,6,2025-10-25 21:45:02,en,Which frameworks support {keyword} implementation?,0.82,0.9849899760328379,0.68
34700987,market analysis,economics,What strategies work best for market analysis investment?,how_to,Beginner,"[""Introduction to market analysis"", ""Key points and analysis"", ""Practical examples"", ""Expert insights"", ""Action items"", ""Conclusion""]","[""how_to"", ""analysis"", ""finance"", ""market"", ""business"", ""economics""]",4,Students & New Investors,"[""portfolio management"", ""investment planning"", ""financial modeling""]",57,8,2025-10-25 21:45:02,en,What strategies work best for {keyword} investment?,0.8,0.4013108186401043,0.76
34700988,brand management,marketing,How do you improve brand management conversion rates?,how_to,Advanced,"[""Overview of brand management"", ""Step-by-step implementation"", ""Best practices and tips"", ""Common challenges and solutions"", ""Tools and resources needed"", ""Conclusion and next steps""]","[""how_to"", ""promotion"", ""marketing"", ""management"", ""advertising"", ""brand""]",6,Marketing Managers & Strategists,"[""digital marketing"", ""content marketing"", ""social media""]",53,8,2025-10-25 21:45:02,en,How do you improve {keyword} conversion rates?,0.83,0.9578552908296563,0.59
34700989,brand management,marketing,How is AI changing brand management approaches?,evaluation,Expert,"[""Introduction to brand management"", ""Key points and analysis"", ""Practical examples"", ""Expert insights"", ""Action items"", ""Conclusion""]","[""promotion"", ""marketing"", ""digital"", ""management"", ""evaluation"", ""brand""]",4,Marketing Directors & CMOs,"[""content marketing"", ""social media"", ""digital marketing""]",47,7,2025-10-25 21:45:02,en,How is AI changing {keyword} approaches?,0.74,1.0,0.45
34700990,portfolio management,economics,How do you protect your portfolio management investments?,comparison,Expert,"[""Overview of portfolio management"", ""Step-by-step implementation"", ""Best practices and tips"", ""Common challenges and solutions"", ""Tools and resources needed"", ""Conclusion and next steps""]","[""investment"", ""finance"", ""portfolio"", ""comparison"", ""management"", ""economics""]",6,Portfolio Managers & Financial Experts,"[""investment planning"", ""financial modeling"", ""market analysis""]",57,8,2025-10-25 21:45:02,en,How do you protect your {keyword} investments?,0.9,1.0,0.77
34700991,social media,marketing,How do you attribute success to social media efforts?,troubleshooting,Beginner,"[""Overview of social media"", ""Step-by-step implementation"", ""Best practices and tips"", ""Common challenges and solutions"", ""Tools and resources needed"", ""Conclusion and next steps""]","[""media"", ""troubleshooting"", ""marketing"", ""digital"", ""social"", ""branding""]",6,Marketing Students & Interns,"[""brand management"", ""digital marketing"", ""content marketing""]",53,9,2025-10-25 21:45:02,en,How do you attribute success to {keyword} efforts?,0.6,0.3072282947869902,0.85
34700992,digital marketing,marketing,How do you attribute success to digital marketing efforts?,planning,Advanced,"[""Overview of digital marketing"", ""Step-by-step implementation"", ""Best practices and tips"", ""Common challenges and solutions"", ""Tools and resources needed"", ""Conclusion and next steps""]","[""marketing"", ""promotion"", ""planning"", ""digital""]",6,Marketing Managers & Strategists,"[""content marketing"", ""brand management"", ""social media""]",58,9,2025-10-25 21:45:02,en,How do you attribute success to {keyword} efforts?,0.84,0.8037008135057365,0.39
34700993,web development,it,How do you design a scalable web development solution?,troubleshooting,Expert,"[""Overview of web development"", ""Step-by-step implementation"", ""Best practices and tips"", ""Common challenges and solutions"", ""Tools and resources needed"", ""Conclusion and next steps""]","[""software"", ""development"", ""it"", ""troubleshooting"", ""web""]",6,Architects & Technical Directors,"[""cloud computing"", ""cybersecurity"", ""data science"", ""machine learning""]",54,9,2025-10-25 21:45:02,en,How do you design a scalable {keyword} solution?,0.92,1.0,0.78
34700994,portfolio management,economics,What exit strategies should be considered for portfolio management?,evaluation,Beginner,"[""Introduction to portfolio management"", ""Key points and analysis"", ""Practical examples"", ""Expert insights"", ""Action items"", ""Conclusion""]","[""finance"", ""portfolio"", ""management"", ""evaluation"", ""market"", ""economics""]",4,Students & New Investors,"[""financial modeling"", ""investment planning"", ""market analysis""]",67,9,2025-10-25 21:45:02,en,What exit strategies should be considered for {keyword}?,0.94,0.30703290084648116,0.35
34700995,portfolio management,economics,What tools help analyze portfolio management data?,troubleshooting,Intermediate,"[""Introduction to portfolio management"", ""Key points and analysis"", ""Practical examples"", ""Expert insights"", ""Action items"", ""Conclusion""]","[""finance"", ""portfolio"", ""troubleshooting"", ""management"", ""market"", ""economics""]",4,Individual Investors & Analysts,"[""market analysis"", ""investment planning"", ""financial modeling""]",50,7,2025-10-25 21:45:02,en,What tools help analyze {keyword} data?,0.81,0.7498033470282395,0.38
34700996,digital marketing,marketing,What KPIs are most important for digital marketing?,planning,Intermediate,"[""Introduction to digital marketing"", ""Key points and analysis"", ""Practical examples"", ""Expert insights"", ""Action items"", ""Conclusion""]","[""marketing"", ""promotion"", ""planning"", ""digital""]",4,Marketing Coordinators & Specialists,"[""social media"", ""brand management"", ""content marketing""]",51,8,2025-10-25 21:45:02,en,What KPIs are most important for {keyword}?,0.8,0.6863671827203857,0.33
34700997,investment planning,economics,What factors should be considered when evaluating investment planning?,planning,Advanced,"[""Introduction to investment planning"", ""Key points and analysis"", ""Practical examples"", ""Expert insights"", ""Action items"", ""Conclusion""]","[""investment"", ""economics"", ""planning"", ""finance""]",4,Professional Investors & Advisors,"[""market analysis"", ""financial modeling"", ""portfolio management""]",70,9,2025-10-25 21:45:02,en,What factors should be considered when evaluating {keyword}?,0.69,0.9054973634860647,0.83
34700998,cybersecurity,it,How do you design a scalable cybersecurity solution?,analysis,Advanced,"[""Overview of cybersecurity"", ""Step-by-step implementation"", ""Best practices and tips"", ""Common challenges and solutions"", ""Tools and resources needed"", ""Conclusion and next steps""]","[""development"", ""analysis"", ""it"", ""programming"", ""cybersecurity""]",5,Senior Developers & Tech Leads,"[""data science"", ""cloud computing"", ""web development"", ""machine learning""]",52,8,2025-10-25 21:45:02,en,How do you design a scalable {keyword} solution?,0.8,0.8900576003741067,0.83
