record_id,keyword,category,question,question_type,difficulty_level,answer_outline,tags,estimated_read_time,target_audience,related_topics,question_length,word_count,created_date,language,source_template,engagement_score,complexity_score,popularity_score
41200001,social media,marketing,How do you develop an effective social media strategy?,implementation,Advanced,"[""Overview of social media"", ""Step-by-step implementation"", ""Best practices and tips"", ""Common challenges and solutions"", ""Tools and resources needed"", ""Conclusion and next steps""]","[""media"", ""implementation"", ""promotion"", ""marketing"", ""social"", ""branding""]",6,Marketing Managers & Strategists,"[""brand management"", ""content marketing"", ""digital marketing""]",54,9,2025-10-25 21:54:03,en,How do you develop an effective {keyword} strategy?,0.91,0.81538866944097,0.89
41200002,market analysis,economics,How do you report on market analysis performance to stakeholders?,troubleshooting,Expert,"[""Overview of market analysis"", ""Step-by-step implementation"", ""Best practices and tips"", ""Common challenges and solutions"", ""Tools and resources needed"", ""Conclusion and next steps""]","[""investment"", ""analysis"", ""troubleshooting"", ""market"", ""economics""]",6,Portfolio Managers & Financial Experts,"[""financial modeling"", ""portfolio management"", ""investment planning""]",65,10,2025-10-25 21:54:03,en,How do you report on {keyword} performance to stakeholders?,0.72,1.0,0.71
41200003,investment planning,economics,How does global economics impact investment planning?,evaluation,Intermediate,"[""Introduction to investment planning"", ""Key points and analysis"", ""Practical examples"", ""Expert insights"", ""Action items"", ""Conclusion""]","[""investment"", ""planning"", ""finance"", ""evaluation"", ""economics""]",4,Individual Investors & Analysts,"[""market analysis"", ""financial modeling"", ""portfolio management""]",53,7,2025-10-25 21:54:03,en,How does global economics impact {keyword}?,0.83,0.6746558817984111,0.7
41200004,cybersecurity,it,What are the key components of a cybersecurity implementation?,analysis,Beginner,"[""Introduction to cybersecurity"", ""Key concepts and definitions"", ""Main categories or types"", ""Examples and case studies"", ""Benefits and advantages"", ""Summary and recommendations""]","[""development"", ""analysis"", ""it"", ""programming"", ""cybersecurity""]",5,Students & Entry-level Developers,"[""data science"", ""web development"", ""cloud computing"", ""machine learning""]",62,9,2025-10-25 21:54:03,en,What are the key components of a {keyword} implementation?,0.76,0.43827296264430526,0.6
41200005,data science,it,What skills are needed to master data science?,planning,Expert,"[""Introduction to data science"", ""Key points and analysis"", ""Practical examples"", ""Expert insights"", ""Action items"", ""Conclusion""]","[""planning"", ""development"", ""it"", ""programming"", ""science"", ""data""]",4,Architects & Technical Directors,"[""web development"", ""machine learning"", ""cloud computing"", ""cybersecurity""]",46,8,2025-10-25 21:54:03,en,What skills are needed to master {keyword}?,0.87,1.0,0.68
41200006,data science,it,How do you troubleshoot common issues with data science?,how_to,Intermediate,"[""Overview of data science"", ""Step-by-step implementation"", ""Best practices and tips"", ""Common challenges and solutions"", ""Tools and resources needed"", ""Conclusion and next steps""]","[""how_to"", ""software"", ""it"", ""programming"", ""science"", ""data""]",6,Junior to Mid-level Developers,"[""cybersecurity"", ""machine learning"", ""web development"", ""cloud computing""]",56,9,2025-10-25 21:54:03,en,How do you troubleshoot common issues with {keyword}?,0.77,0.6274583996724303,0.89
41200007,brand management,marketing,What A/B tests should you run for brand management?,comparison,Advanced,"[""Introduction to brand management"", ""Key points and analysis"", ""Practical examples"", ""Expert insights"", ""Action items"", ""Conclusion""]","[""promotion"", ""comparison"", ""marketing"", ""management"", ""branding"", ""brand""]",4,Marketing Managers & Strategists,"[""digital marketing"", ""social media"", ""content marketing""]",51,9,2025-10-25 21:54:03,en,What A/B tests should you run for {keyword}?,0.69,0.813355394450698,0.8
41200008,market analysis,economics,How do you benchmark market analysis against alternatives?,best_practice,Expert,"[""Overview of market analysis"", ""Step-by-step implementation"", ""Best practices and tips"", ""Common challenges and solutions"", ""Tools and resources needed"", ""Conclusion and next steps""]","[""analysis"", ""finance"", ""best_practice"", ""market"", ""business"", ""economics""]",6,Portfolio Managers & Financial Experts,"[""financial modeling"", ""portfolio management"", ""investment planning""]",58,8,2025-10-25 21:54:03,en,How do you benchmark {keyword} against alternatives?,0.64,1.0,0.82
41200009,market analysis,economics,What is the optimal allocation for market analysis in a portfolio?,analysis,Expert,"[""Introduction to market analysis"", ""Key points and analysis"", ""Practical examples"", ""Expert insights"", ""Action items"", ""Conclusion""]","[""investment"", ""finance"", ""analysis"", ""market"", ""economics""]",4,Portfolio Managers & Financial Experts,"[""financial modeling"", ""portfolio management"", ""investment planning""]",66,11,2025-10-25 21:54:03,en,What is the optimal allocation for {keyword} in a portfolio?,0.76,1.0,0.89
41200010,investment planning,economics,What insurance options are available for investment planning?,comparison,Intermediate,"[""Introduction to investment planning"", ""Key points and analysis"", ""Practical examples"", ""Expert insights"", ""Action items"", ""Conclusion""]","[""investment"", ""planning"", ""finance"", ""comparison"", ""market"", ""economics""]",4,Individual Investors & Analysts,"[""financial modeling"", ""portfolio management"", ""market analysis""]",61,8,2025-10-25 21:54:03,en,What insurance options are available for {keyword}?,0.67,0.664341994080447,0.88
41200011,digital marketing,marketing,What content types work best for digital marketing?,implementation,Beginner,"[""Introduction to digital marketing"", ""Key points and analysis"", ""Practical examples"", ""Expert insights"", ""Action items"", ""Conclusion""]","[""implementation"", ""marketing"", ""promotion"", ""digital""]",4,Marketing Students & Interns,"[""content marketing"", ""brand management"", ""social media""]",51,8,2025-10-25 21:54:03,en,What content types work best for {keyword}?,0.85,0.33429969948293026,0.53
41200012,market analysis,economics,How do you diversify your portfolio using market analysis?,analysis,Expert,"[""Overview of market analysis"", ""Step-by-step implementation"", ""Best practices and tips"", ""Common challenges and solutions"", ""Tools and resources needed"", ""Conclusion and next steps""]","[""market"", ""business"", ""economics"", ""analysis""]",6,Portfolio Managers & Financial Experts,"[""financial modeling"", ""portfolio management"", ""investment planning""]",58,9,2025-10-25 21:54:03,en,How do you diversify your portfolio using {keyword}?,0.9,1.0,0.56
41200013,market analysis,economics,What strategies work best for market analysis investment?,strategy,Beginner,"[""Introduction to market analysis"", ""Key points and analysis"", ""Practical examples"", ""Expert insights"", ""Action items"", ""Conclusion""]","[""analysis"", ""business"", ""market"", ""strategy"", ""economics""]",4,Students & New Investors,"[""investment planning"", ""financial modeling"", ""portfolio management""]",57,8,2025-10-25 21:54:03,en,What strategies work best for {keyword} investment?,0.93,0.4015596566881168,0.42
41200014,cybersecurity,it,How do you implement cybersecurity in a production environment?,how_to,Expert,"[""Overview of cybersecurity"", ""Step-by-step implementation"", ""Best practices and tips"", ""Common challenges and solutions"", ""Tools and resources needed"", ""Conclusion and next steps""]","[""how_to"", ""software"", ""it"", ""programming"", ""cybersecurity""]",5,Architects & Technical Directors,"[""cloud computing"", ""web development"", ""machine learning"", ""data science""]",63,9,2025-10-25 21:54:03,en,How do you implement {keyword} in a production environment?,0.61,1.0,0.81
41200015,content marketing,marketing,What does the future hold for content marketing?,analysis,Beginner,"[""Introduction to content marketing"", ""Key points and analysis"", ""Practical examples"", ""Expert insights"", ""Action items"", ""Conclusion""]","[""content"", ""analysis"", ""promotion"", ""marketing"", ""branding""]",4,Marketing Students & Interns,"[""brand management"", ""digital marketing"", ""social media""]",48,8,2025-10-25 21:54:03,en,What does the future hold for {keyword}?,0.84,0.4055470242784803,0.42
41200016,social media,marketing,What timing strategies work for social media?,troubleshooting,Beginner,"[""Introduction to social media"", ""Key points and analysis"", ""Practical examples"", ""Expert insights"", ""Action items"", ""Conclusion""]","[""media"", ""promotion"", ""troubleshooting"", ""marketing"", ""social"", ""branding""]",4,Marketing Students & Interns,"[""content marketing"", ""digital marketing"", ""brand management""]",45,7,2025-10-25 21:54:03,en,What timing strategies work for {keyword}?,0.71,0.4213536877549999,0.61
41200017,social media,marketing,What A/B tests should you run for social media?,how_to,Expert,"[""Introduction to social media"", ""Key points and analysis"", ""Practical examples"", ""Expert insights"", ""Action items"", ""Conclusion""]","[""how_to"", ""media"", ""promotion"", ""marketing"", ""social"", ""branding""]",4,Marketing Directors & CMOs,"[""brand management"", ""content marketing"", ""digital marketing""]",47,9,2025-10-25 21:54:03,en,What A/B tests should you run for {keyword}?,0.86,1.0,0.88
41200018,digital marketing,marketing,What A/B tests should you run for digital marketing?,planning,Expert,"[""Introduction to digital marketing"", ""Key points and analysis"", ""Practical examples"", ""Expert insights"", ""Action items"", ""Conclusion""]","[""planning"", ""promotion"", ""marketing"", ""digital"", ""advertising""]",4,Marketing Directors & CMOs,"[""content marketing"", ""brand management"", ""social media""]",52,9,2025-10-25 21:54:03,en,What A/B tests should you run for {keyword}?,0.61,1.0,0.66
41200019,investment planning,economics,How do you diversify your portfolio using investment planning?,how_to,Beginner,"[""Overview of investment planning"", ""Step-by-step implementation"", ""Best practices and tips"", ""Common challenges and solutions"", ""Tools and resources needed"", ""Conclusion and next steps""]","[""investment"", ""how_to"", ""planning"", ""finance"", ""business"", ""economics""]",6,Students & New Investors,"[""market analysis"", ""portfolio management"", ""financial modeling""]",62,9,2025-10-25 21:54:03,en,How do you diversify your portfolio using {keyword}?,0.6,0.3065391595935965,0.88
41200020,social media,marketing,What demographics respond best to social media?,planning,Beginner,"[""Introduction to social media"", ""Key points and analysis"", ""Practical examples"", ""Expert insights"", ""Action items"", ""Conclusion""]","[""planning"", ""media"", ""promotion"", ""marketing"", ""social"", ""advertising""]",4,Marketing Students & Interns,"[""brand management"", ""content marketing"", ""digital marketing""]",47,7,2025-10-25 21:54:03,en,What demographics respond best to {keyword}?,0.84,0.33314361794615377,0.41
41200021,machine learning,it,What tools are essential for machine learning development?,comparison,Beginner,"[""Introduction to machine learning"", ""Key points and analysis"", ""Practical examples"", ""Expert insights"", ""Action items"", ""Conclusion""]","[""software"", ""it"", ""comparison"", ""learning"", ""machine"", ""technology""]",4,Students & Entry-level Developers,"[""web development"", ""cybersecurity"", ""data science"", ""cloud computing""]",58,8,2025-10-25 21:54:03,en,What tools are essential for {keyword} development?,0.85,0.43613520073494744,0.67
41200022,investment planning,economics,How do you report on investment planning performance to stakeholders?,strategy,Expert,"[""Overview of investment planning"", ""Step-by-step implementation"", ""Best practices and tips"", ""Common challenges and solutions"", ""Tools and resources needed"", ""Conclusion and next steps""]","[""investment"", ""planning"", ""finance"", ""strategy"", ""economics""]",6,Portfolio Managers & Financial Experts,"[""portfolio management"", ""financial modeling"", ""market analysis""]",69,10,2025-10-25 21:54:03,en,How do you report on {keyword} performance to stakeholders?,0.94,1.0,0.88
41200023,content marketing,marketing,How do you automate content marketing processes?,implementation,Expert,"[""Overview of content marketing"", ""Step-by-step implementation"", ""Best practices and tips"", ""Common challenges and solutions"", ""Tools and resources needed"", ""Conclusion and next steps""]","[""content"", ""implementation"", ""marketing"", ""digital"", ""advertising""]",6,Marketing Directors & CMOs,"[""social media"", ""digital marketing"", ""brand management""]",48,7,2025-10-25 21:54:03,en,How do you automate {keyword} processes?,0.62,1.0,0.53
41200024,market analysis,economics,How do you adjust your market analysis strategy during volatility?,how_to,Expert,"[""Overview of market analysis"", ""Step-by-step implementation"", ""Best practices and tips"", ""Common challenges and solutions"", ""Tools and resources needed"", ""Conclusion and next steps""]","[""how_to"", ""analysis"", ""finance"", ""market"", ""business"", ""economics""]",6,Portfolio Managers & Financial Experts,"[""financial modeling"", ""investment planning"", ""portfolio management""]",66,10,2025-10-25 21:54:03,en,How do you adjust your {keyword} strategy during volatility?,0.63,1.0,0.43
41200025,data science,it,How do you integrate data science with existing systems?,troubleshooting,Advanced,"[""Overview of data science"", ""Step-by-step implementation"", ""Best practices and tips"", ""Common challenges and solutions"", ""Tools and resources needed"", ""Conclusion and next steps""]","[""technology"", ""it"", ""programming"", ""troubleshooting"", ""science"", ""data""]",6,Senior Developers & Tech Leads,"[""cybersecurity"", ""cloud computing"", ""web development"", ""machine learning""]",56,9,2025-10-25 21:54:03,en,How do you integrate {keyword} with existing systems?,0.61,0.9186606233545332,0.69
41200026,cybersecurity,it,What design patterns work best with cybersecurity?,optimization,Advanced,"[""Introduction to cybersecurity"", ""Key points and analysis"", ""Practical examples"", ""Expert insights"", ""Action items"", ""Conclusion""]","[""development"", ""it"", ""optimization"", ""cybersecurity"", ""technology""]",4,Senior Developers & Tech Leads,"[""data science"", ""machine learning"", ""web development"", ""cloud computing""]",50,7,2025-10-25 21:54:03,en,What design patterns work best with {keyword}?,0.79,0.9099676797646855,0.48
41200027,cybersecurity,it,How can cybersecurity improve system performance and scalability?,analysis,Intermediate,"[""Introduction to cybersecurity"", ""Key points and analysis"", ""Practical examples"", ""Expert insights"", ""Action items"", ""Conclusion""]","[""development"", ""analysis"", ""it"", ""programming"", ""cybersecurity""]",4,Junior to Mid-level Developers,"[""cloud computing"", ""web development"", ""data science"", ""machine learning""]",65,8,2025-10-25 21:54:03,en,How can {keyword} improve system performance and scalability?,0.7,0.6343876243685329,0.71
41200028,web development,it,What are the latest trends in web development technology?,troubleshooting,Advanced,"[""Introduction to web development"", ""Key concepts and definitions"", ""Main categories or types"", ""Examples and case studies"", ""Benefits and advantages"", ""Summary and recommendations""]","[""software"", ""development"", ""it"", ""troubleshooting"", ""web""]",6,Senior Developers & Tech Leads,"[""cloud computing"", ""data science"", ""machine learning"", ""cybersecurity""]",57,9,2025-10-25 21:54:03,en,What are the latest trends in {keyword} technology?,0.72,0.8651154923278844,0.74
41200029,brand management,marketing,How do you personalize brand management for different segments?,best_practice,Expert,"[""Overview of brand management"", ""Step-by-step implementation"", ""Best practices and tips"", ""Common challenges and solutions"", ""Tools and resources needed"", ""Conclusion and next steps""]","[""best_practice"", ""digital"", ""marketing"", ""management"", ""advertising"", ""brand""]",6,Marketing Directors & CMOs,"[""social media"", ""digital marketing"", ""content marketing""]",63,9,2025-10-25 21:54:03,en,How do you personalize {keyword} for different segments?,0.88,1.0,0.66
41200030,content marketing,marketing,What demographics respond best to content marketing?,best_practice,Beginner,"[""Introduction to content marketing"", ""Key points and analysis"", ""Practical examples"", ""Expert insights"", ""Action items"", ""Conclusion""]","[""content"", ""best_practice"", ""marketing"", ""advertising"", ""branding""]",4,Marketing Students & Interns,"[""brand management"", ""digital marketing"", ""social media""]",52,7,2025-10-25 21:54:03,en,What demographics respond best to {keyword}?,0.85,0.3909932532318031,0.78
41200031,market analysis,economics,What are the seasonal patterns in market analysis?,analysis,Beginner,"[""Introduction to market analysis"", ""Key concepts and definitions"", ""Main categories or types"", ""Examples and case studies"", ""Benefits and advantages"", ""Summary and recommendations""]","[""finance"", ""analysis"", ""market"", ""business"", ""economics""]",6,Students & New Investors,"[""investment planning"", ""portfolio management"", ""financial modeling""]",50,8,2025-10-25 21:54:03,en,What are the seasonal patterns in {keyword}?,0.94,0.3585100975029386,0.83
41200032,data science,it,What is the recommended architecture for data science systems?,comparison,Advanced,"[""Introduction to data science"", ""Key points and analysis"", ""Practical examples"", ""Expert insights"", ""Action items"", ""Conclusion""]","[""technology"", ""software"", ""it"", ""comparison"", ""science"", ""data""]",4,Senior Developers & Tech Leads,"[""cloud computing"", ""web development"", ""cybersecurity"", ""machine learning""]",62,9,2025-10-25 21:54:03,en,What is the recommended architecture for {keyword} systems?,0.62,0.8922121826071373,0.78
41200033,financial modeling,economics,How do you hedge against financial modeling market downturns?,planning,Beginner,"[""Overview of financial modeling"", ""Step-by-step implementation"", ""Best practices and tips"", ""Common challenges and solutions"", ""Tools and resources needed"", ""Conclusion and next steps""]","[""planning"", ""finance"", ""modeling"", ""financial"", ""market"", ""economics""]",6,Students & New Investors,"[""portfolio management"", ""market analysis"", ""investment planning""]",61,9,2025-10-25 21:54:03,en,How do you hedge against {keyword} market downturns?,0.6,0.33097717028094714,0.77
41200034,brand management,marketing,What KPIs are most important for brand management?,best_practice,Intermediate,"[""Introduction to brand management"", ""Key points and analysis"", ""Practical examples"", ""Expert insights"", ""Action items"", ""Conclusion""]","[""best_practice"", ""marketing"", ""management"", ""advertising"", ""branding"", ""brand""]",4,Marketing Coordinators & Specialists,"[""social media"", ""digital marketing"", ""content marketing""]",50,8,2025-10-25 21:54:03,en,What KPIs are most important for {keyword}?,0.68,0.724223823996709,0.41
41200035,digital marketing,marketing,What KPIs are most important for digital marketing?,comparison,Expert,"[""Introduction to digital marketing"", ""Key points and analysis"", ""Practical examples"", ""Expert insights"", ""Action items"", ""Conclusion""]","[""promotion"", ""comparison"", ""marketing"", ""digital"", ""advertising""]",4,Marketing Directors & CMOs,"[""content marketing"", ""social media"", ""brand management""]",51,8,2025-10-25 21:54:03,en,What KPIs are most important for {keyword}?,0.91,1.0,0.84
41200036,portfolio management,economics,How do you hedge against portfolio management market downturns?,evaluation,Expert,"[""Overview of portfolio management"", ""Step-by-step implementation"", ""Best practices and tips"", ""Common challenges and solutions"", ""Tools and resources needed"", ""Conclusion and next steps""]","[""investment"", ""finance"", ""portfolio"", ""management"", ""evaluation"", ""economics""]",6,Portfolio Managers & Financial Experts,"[""market analysis"", ""investment planning"", ""financial modeling""]",63,9,2025-10-25 21:54:03,en,How do you hedge against {keyword} market downturns?,0.64,1.0,0.7
41200037,data science,it,Which frameworks support data science implementation?,strategy,Intermediate,"[""Introduction to data science"", ""Key points and analysis"", ""Practical examples"", ""Expert insights"", ""Action items"", ""Conclusion""]","[""technology"", ""it"", ""programming"", ""science"", ""strategy"", ""data""]",4,Junior to Mid-level Developers,"[""machine learning"", ""web development"", ""cloud computing"", ""cybersecurity""]",53,6,2025-10-25 21:54:03,en,Which frameworks support {keyword} implementation?,0.91,0.6258983343186492,0.3
41200038,content marketing,marketing,How do you automate content marketing processes?,best_practice,Beginner,"[""Overview of content marketing"", ""Step-by-step implementation"", ""Best practices and tips"", ""Common challenges and solutions"", ""Tools and resources needed"", ""Conclusion and next steps""]","[""content"", ""promotion"", ""best_practice"", ""marketing"", ""advertising""]",6,Marketing Students & Interns,"[""digital marketing"", ""social media"", ""brand management""]",48,7,2025-10-25 21:54:03,en,How do you automate {keyword} processes?,0.68,0.47268501791731304,0.59
41200039,financial modeling,economics,What factors should be considered when evaluating financial modeling?,analysis,Advanced,"[""Introduction to financial modeling"", ""Key points and analysis"", ""Practical examples"", ""Expert insights"", ""Action items"", ""Conclusion""]","[""investment"", ""finance"", ""analysis"", ""modeling"", ""financial"", ""economics""]",4,Professional Investors & Advisors,"[""portfolio management"", ""investment planning"", ""market analysis""]",69,9,2025-10-25 21:54:03,en,What factors should be considered when evaluating {keyword}?,0.8,0.9974580989874081,0.48
41200040,financial modeling,economics,What tools help analyze financial modeling data?,comparison,Expert,"[""Introduction to financial modeling"", ""Key points and analysis"", ""Practical examples"", ""Expert insights"", ""Action items"", ""Conclusion""]","[""investment"", ""finance"", ""comparison"", ""modeling"", ""financial"", ""economics""]",4,Portfolio Managers & Financial Experts,"[""investment planning"", ""market analysis"", ""portfolio management""]",48,7,2025-10-25 21:54:03,en,What tools help analyze {keyword} data?,0.77,1.0,0.86
41200041,financial modeling,economics,What exit strategies should be considered for financial modeling?,planning,Intermediate,"[""Introduction to financial modeling"", ""Key points and analysis"", ""Practical examples"", ""Expert insights"", ""Action items"", ""Conclusion""]","[""investment"", ""planning"", ""finance"", ""modeling"", ""financial"", ""economics""]",4,Individual Investors & Analysts,"[""portfolio management"", ""market analysis"", ""investment planning""]",65,9,2025-10-25 21:54:03,en,What exit strategies should be considered for {keyword}?,0.92,0.7139866716114815,0.39
41200042,data science,it,How do you stay updated with data science developments?,how_to,Expert,"[""Overview of data science"", ""Step-by-step implementation"", ""Best practices and tips"", ""Common challenges and solutions"", ""Tools and resources needed"", ""Conclusion and next steps""]","[""how_to"", ""software"", ""development"", ""it"", ""science"", ""data""]",6,Architects & Technical Directors,"[""machine learning"", ""web development"", ""cloud computing"", ""cybersecurity""]",55,9,2025-10-25 21:54:03,en,How do you stay updated with {keyword} developments?,0.94,1.0,0.51
41200043,machine learning,it,How do you implement machine learning in a production environment?,troubleshooting,Advanced,"[""Overview of machine learning"", ""Step-by-step implementation"", ""Best practices and tips"", ""Common challenges and solutions"", ""Tools and resources needed"", ""Conclusion and next steps""]","[""development"", ""it"", ""troubleshooting"", ""learning"", ""machine"", ""technology""]",6,Senior Developers & Tech Leads,"[""data science"", ""web development"", ""cybersecurity"", ""cloud computing""]",66,10,2025-10-25 21:54:03,en,How do you implement {keyword} in a production environment?,0.79,0.9201639789014839,0.49
41200044,content marketing,marketing,How do you track and analyze content marketing performance?,troubleshooting,Expert,"[""Overview of content marketing"", ""Step-by-step implementation"", ""Best practices and tips"", ""Common challenges and solutions"", ""Tools and resources needed"", ""Conclusion and next steps""]","[""content"", ""promotion"", ""troubleshooting"", ""marketing"", ""advertising""]",6,Marketing Directors & CMOs,"[""brand management"", ""digital marketing"", ""social media""]",59,9,2025-10-25 21:54:03,en,How do you track and analyze {keyword} performance?,0.95,1.0,0.73
