record_id,keyword,category,question,question_type,difficulty_level,answer_outline,tags,estimated_read_time,target_audience,related_topics,question_length,word_count,created_date,language,source_template,engagement_score,complexity_score,popularity_score
40700653,machine learning,it,How do you get started with machine learning as a beginner?,evaluation,Beginner,"[""Overview of machine learning"", ""Step-by-step implementation"", ""Best practices and tips"", ""Common challenges and solutions"", ""Tools and resources needed"", ""Conclusion and next steps""]","[""it"", ""programming"", ""learning"", ""evaluation"", ""machine"", ""technology""]",6,Students & Entry-level Developers,"[""web development"", ""cybersecurity"", ""data science"", ""cloud computing""]",59,11,2025-10-25 21:53:21,en,How do you get started with {keyword} as a beginner?,0.71,0.3236013528209712,0.41
40700654,portfolio management,economics,What factors should be considered when evaluating portfolio management?,how_to,Intermediate,"[""Introduction to portfolio management"", ""Key points and analysis"", ""Practical examples"", ""Expert insights"", ""Action items"", ""Conclusion""]","[""investment"", ""how_to"", ""portfolio"", ""management"", ""market"", ""economics""]",4,Individual Investors & Analysts,"[""market analysis"", ""financial modeling"", ""investment planning""]",71,9,2025-10-25 21:53:21,en,What factors should be considered when evaluating {keyword}?,0.87,0.6244230346823146,0.33
40700655,cybersecurity,it,How does cybersecurity impact business operations?,analysis,Intermediate,"[""Introduction to cybersecurity"", ""Key points and analysis"", ""Practical examples"", ""Expert insights"", ""Action items"", ""Conclusion""]","[""software"", ""analysis"", ""it"", ""cybersecurity"", ""technology""]",4,Junior to Mid-level Developers,"[""cloud computing"", ""machine learning"", ""data science"", ""web development""]",50,6,2025-10-25 21:53:21,en,How does {keyword} impact business operations?,0.84,0.6865506300788807,0.43
40700656,machine learning,it,How do you measure the success of machine learning projects?,strategy,Expert,"[""Overview of machine learning"", ""Step-by-step implementation"", ""Best practices and tips"", ""Common challenges and solutions"", ""Tools and resources needed"", ""Conclusion and next steps""]","[""software"", ""it"", ""learning"", ""strategy"", ""machine"", ""technology""]",6,Architects & Technical Directors,"[""data science"", ""cybersecurity"", ""cloud computing"", ""web development""]",60,10,2025-10-25 21:53:21,en,How do you measure the success of {keyword} projects?,0.65,1.0,0.44
40700657,financial modeling,economics,What are the regulatory considerations for financial modeling?,strategy,Advanced,"[""Introduction to financial modeling"", ""Key concepts and definitions"", ""Main categories or types"", ""Examples and case studies"", ""Benefits and advantages"", ""Summary and recommendations""]","[""investment"", ""modeling"", ""financial"", ""business"", ""strategy"", ""economics""]",6,Professional Investors & Advisors,"[""market analysis"", ""investment planning"", ""portfolio management""]",62,8,2025-10-25 21:53:21,en,What are the regulatory considerations for {keyword}?,0.74,0.9421675651959827,0.62
40700658,cybersecurity,it,How do you integrate cybersecurity with existing systems?,implementation,Beginner,"[""Overview of cybersecurity"", ""Step-by-step implementation"", ""Best practices and tips"", ""Common challenges and solutions"", ""Tools and resources needed"", ""Conclusion and next steps""]","[""development"", ""it"", ""implementation"", ""cybersecurity"", ""technology""]",5,Students & Entry-level Developers,"[""data science"", ""machine learning"", ""web development"", ""cloud computing""]",57,8,2025-10-25 21:53:21,en,How do you integrate {keyword} with existing systems?,0.72,0.48486168062370383,0.82
40700659,investment planning,economics,How do you create a long-term plan for investment planning?,implementation,Advanced,"[""Overview of investment planning"", ""Step-by-step implementation"", ""Best practices and tips"", ""Common challenges and solutions"", ""Tools and resources needed"", ""Conclusion and next steps""]","[""investment"", ""planning"", ""finance"", ""implementation"", ""economics""]",6,Professional Investors & Advisors,"[""market analysis"", ""financial modeling"", ""portfolio management""]",59,10,2025-10-25 21:53:21,en,How do you create a long-term plan for {keyword}?,0.91,0.9176421695313329,0.32
40700660,web development,it,What are the best practices for web development development?,troubleshooting,Advanced,"[""Introduction to web development"", ""Key concepts and definitions"", ""Main categories or types"", ""Examples and case studies"", ""Benefits and advantages"", ""Summary and recommendations""]","[""software"", ""development"", ""it"", ""programming"", ""troubleshooting"", ""web""]",6,Senior Developers & Tech Leads,"[""cybersecurity"", ""machine learning"", ""data science"", ""cloud computing""]",60,9,2025-10-25 21:53:21,en,What are the best practices for {keyword} development?,0.72,0.8785381016910858,0.48
40700661,investment planning,economics,What are the seasonal patterns in investment planning?,best_practice,Expert,"[""Introduction to investment planning"", ""Key concepts and definitions"", ""Main categories or types"", ""Examples and case studies"", ""Benefits and advantages"", ""Summary and recommendations""]","[""investment"", ""planning"", ""best_practice"", ""market"", ""economics""]",6,Portfolio Managers & Financial Experts,"[""market analysis"", ""portfolio management"", ""financial modeling""]",54,8,2025-10-25 21:53:21,en,What are the seasonal patterns in {keyword}?,0.65,1.0,0.88
40700662,social media,marketing,How do you measure the ROI of social media campaigns?,best_practice,Beginner,"[""Overview of social media"", ""Step-by-step implementation"", ""Best practices and tips"", ""Common challenges and solutions"", ""Tools and resources needed"", ""Conclusion and next steps""]","[""media"", ""best_practice"", ""marketing"", ""digital"", ""social"", ""branding""]",6,Marketing Students & Interns,"[""content marketing"", ""digital marketing"", ""brand management""]",53,10,2025-10-25 21:53:21,en,How do you measure the ROI of {keyword} campaigns?,0.86,0.42119350144978374,0.82
40700663,social media,marketing,What demographics respond best to social media?,comparison,Expert,"[""Introduction to social media"", ""Key points and analysis"", ""Practical examples"", ""Expert insights"", ""Action items"", ""Conclusion""]","[""media"", ""comparison"", ""marketing"", ""social"", ""advertising"", ""branding""]",4,Marketing Directors & CMOs,"[""digital marketing"", ""content marketing"", ""brand management""]",47,7,2025-10-25 21:53:21,en,What demographics respond best to {keyword}?,0.78,1.0,0.77
40700664,investment planning,economics,What tools help analyze investment planning data?,analysis,Expert,"[""Introduction to investment planning"", ""Key points and analysis"", ""Practical examples"", ""Expert insights"", ""Action items"", ""Conclusion""]","[""investment"", ""planning"", ""analysis"", ""finance"", ""market"", ""economics""]",4,Portfolio Managers & Financial Experts,"[""financial modeling"", ""market analysis"", ""portfolio management""]",49,7,2025-10-25 21:53:21,en,What tools help analyze {keyword} data?,0.89,1.0,0.61
40700665,market analysis,economics,What indicators predict market analysis market movements?,analysis,Beginner,"[""Introduction to market analysis"", ""Key points and analysis"", ""Practical examples"", ""Expert insights"", ""Action items"", ""Conclusion""]","[""investment"", ""finance"", ""analysis"", ""market"", ""economics""]",4,Students & New Investors,"[""portfolio management"", ""investment planning"", ""financial modeling""]",57,7,2025-10-25 21:53:21,en,What indicators predict {keyword} market movements?,0.73,0.32487945064758295,0.69
40700666,market analysis,economics,What timeline is realistic for market analysis returns?,troubleshooting,Expert,"[""Introduction to market analysis"", ""Key points and analysis"", ""Practical examples"", ""Expert insights"", ""Action items"", ""Conclusion""]","[""investment"", ""analysis"", ""troubleshooting"", ""market"", ""economics""]",4,Portfolio Managers & Financial Experts,"[""investment planning"", ""portfolio management"", ""financial modeling""]",55,8,2025-10-25 21:53:21,en,What timeline is realistic for {keyword} returns?,0.63,1.0,0.49
40700667,content marketing,marketing,What timing strategies work for content marketing?,comparison,Expert,"[""Introduction to content marketing"", ""Key points and analysis"", ""Practical examples"", ""Expert insights"", ""Action items"", ""Conclusion""]","[""content"", ""promotion"", ""comparison"", ""marketing"", ""branding""]",4,Marketing Directors & CMOs,"[""brand management"", ""social media"", ""digital marketing""]",50,7,2025-10-25 21:53:21,en,What timing strategies work for {keyword}?,0.82,1.0,0.63
40700668,machine learning,it,How do you optimize machine learning for different platforms?,analysis,Intermediate,"[""Overview of machine learning"", ""Step-by-step implementation"", ""Best practices and tips"", ""Common challenges and solutions"", ""Tools and resources needed"", ""Conclusion and next steps""]","[""software"", ""development"", ""analysis"", ""it"", ""learning"", ""machine""]",6,Junior to Mid-level Developers,"[""cybersecurity"", ""web development"", ""data science"", ""cloud computing""]",61,9,2025-10-25 21:53:21,en,How do you optimize {keyword} for different platforms?,0.88,0.6032726822359649,0.56
40700669,investment planning,economics,What tools help analyze investment planning data?,implementation,Beginner,"[""Introduction to investment planning"", ""Key points and analysis"", ""Practical examples"", ""Expert insights"", ""Action items"", ""Conclusion""]","[""investment"", ""planning"", ""finance"", ""implementation"", ""business"", ""economics""]",4,Students & New Investors,"[""financial modeling"", ""market analysis"", ""portfolio management""]",49,7,2025-10-25 21:53:21,en,What tools help analyze {keyword} data?,0.69,0.3432209789458961,0.83
40700670,data science,it,What are the latest trends in data science technology?,planning,Intermediate,"[""Introduction to data science"", ""Key concepts and definitions"", ""Main categories or types"", ""Examples and case studies"", ""Benefits and advantages"", ""Summary and recommendations""]","[""technology"", ""software"", ""planning"", ""it"", ""science"", ""data""]",6,Junior to Mid-level Developers,"[""cloud computing"", ""machine learning"", ""web development"", ""cybersecurity""]",54,9,2025-10-25 21:53:21,en,What are the latest trends in {keyword} technology?,0.93,0.6412197680508293,0.77
40700671,social media,marketing,What messaging works best in social media campaigns?,best_practice,Beginner,"[""Introduction to social media"", ""Key points and analysis"", ""Practical examples"", ""Expert insights"", ""Action items"", ""Conclusion""]","[""media"", ""promotion"", ""best_practice"", ""marketing"", ""social"", ""branding""]",4,Marketing Students & Interns,"[""content marketing"", ""brand management"", ""digital marketing""]",52,8,2025-10-25 21:53:21,en,What messaging works best in {keyword} campaigns?,0.67,0.3150619319593043,0.78
40700672,web development,it,How does web development impact business operations?,best_practice,Expert,"[""Introduction to web development"", ""Key points and analysis"", ""Practical examples"", ""Expert insights"", ""Action items"", ""Conclusion""]","[""software"", ""development"", ""it"", ""best_practice"", ""web""]",4,Architects & Technical Directors,"[""cybersecurity"", ""machine learning"", ""data science"", ""cloud computing""]",52,7,2025-10-25 21:53:21,en,How does {keyword} impact business operations?,0.7,1.0,0.34
40700673,investment planning,economics,How does global economics impact investment planning?,implementation,Expert,"[""Introduction to investment planning"", ""Key points and analysis"", ""Practical examples"", ""Expert insights"", ""Action items"", ""Conclusion""]","[""investment"", ""planning"", ""finance"", ""implementation"", ""market"", ""economics""]",4,Portfolio Managers & Financial Experts,"[""financial modeling"", ""market analysis"", ""portfolio management""]",53,7,2025-10-25 21:53:21,en,How does global economics impact {keyword}?,0.76,1.0,0.45
40700674,brand management,marketing,How do you track and analyze brand management performance?,optimization,Intermediate,"[""Overview of brand management"", ""Step-by-step implementation"", ""Best practices and tips"", ""Common challenges and solutions"", ""Tools and resources needed"", ""Conclusion and next steps""]","[""digital"", ""marketing"", ""management"", ""advertising"", ""optimization"", ""brand""]",6,Marketing Coordinators & Specialists,"[""content marketing"", ""digital marketing"", ""social media""]",58,9,2025-10-25 21:53:21,en,How do you track and analyze {keyword} performance?,0.73,0.7117870573422832,0.67
40700675,market analysis,economics,What tools help analyze market analysis data?,strategy,Expert,"[""Introduction to market analysis"", ""Key points and analysis"", ""Practical examples"", ""Expert insights"", ""Action items"", ""Conclusion""]","[""investment"", ""analysis"", ""business"", ""market"", ""strategy"", ""economics""]",4,Portfolio Managers & Financial Experts,"[""investment planning"", ""portfolio management"", ""financial modeling""]",45,7,2025-10-25 21:53:21,en,What tools help analyze {keyword} data?,0.8,1.0,0.4
40700676,digital marketing,marketing,How do you measure the ROI of digital marketing campaigns?,analysis,Intermediate,"[""Overview of digital marketing"", ""Step-by-step implementation"", ""Best practices and tips"", ""Common challenges and solutions"", ""Tools and resources needed"", ""Conclusion and next steps""]","[""analysis"", ""promotion"", ""marketing"", ""digital"", ""advertising""]",6,Marketing Coordinators & Specialists,"[""content marketing"", ""social media"", ""brand management""]",58,10,2025-10-25 21:53:21,en,How do you measure the ROI of {keyword} campaigns?,0.84,0.6857721690903275,0.83
40700677,cybersecurity,it,What ROI can be expected from cybersecurity implementation?,how_to,Intermediate,"[""Introduction to cybersecurity"", ""Key points and analysis"", ""Practical examples"", ""Expert insights"", ""Action items"", ""Conclusion""]","[""how_to"", ""software"", ""it"", ""programming"", ""cybersecurity""]",4,Junior to Mid-level Developers,"[""machine learning"", ""web development"", ""cloud computing"", ""data science""]",59,8,2025-10-25 21:53:21,en,What ROI can be expected from {keyword} implementation?,0.61,0.6704885542886784,0.61
40700678,brand management,marketing,What does the future hold for brand management?,implementation,Beginner,"[""Introduction to brand management"", ""Key points and analysis"", ""Practical examples"", ""Expert insights"", ""Action items"", ""Conclusion""]","[""implementation"", ""promotion"", ""marketing"", ""digital"", ""management"", ""brand""]",4,Marketing Students & Interns,"[""digital marketing"", ""content marketing"", ""social media""]",47,8,2025-10-25 21:53:21,en,What does the future hold for {keyword}?,0.73,0.39347868660841184,0.4
40700679,cybersecurity,it,How do you design a scalable cybersecurity solution?,implementation,Intermediate,"[""Overview of cybersecurity"", ""Step-by-step implementation"", ""Best practices and tips"", ""Common challenges and solutions"", ""Tools and resources needed"", ""Conclusion and next steps""]","[""development"", ""it"", ""implementation"", ""cybersecurity"", ""technology""]",5,Junior to Mid-level Developers,"[""web development"", ""machine learning"", ""cloud computing"", ""data science""]",52,8,2025-10-25 21:53:21,en,How do you design a scalable {keyword} solution?,0.78,0.684879494323153,0.62
40700680,digital marketing,marketing,How is AI changing digital marketing approaches?,planning,Intermediate,"[""Introduction to digital marketing"", ""Key points and analysis"", ""Practical examples"", ""Expert insights"", ""Action items"", ""Conclusion""]","[""branding"", ""marketing"", ""planning"", ""digital""]",4,Marketing Coordinators & Specialists,"[""brand management"", ""content marketing"", ""social media""]",48,7,2025-10-25 21:53:21,en,How is AI changing {keyword} approaches?,0.6,0.6672558573345291,0.7
40700681,financial modeling,economics,What factors should be considered when evaluating financial modeling?,troubleshooting,Advanced,"[""Introduction to financial modeling"", ""Key points and analysis"", ""Practical examples"", ""Expert insights"", ""Action items"", ""Conclusion""]","[""finance"", ""troubleshooting"", ""modeling"", ""financial"", ""market"", ""economics""]",4,Professional Investors & Advisors,"[""market analysis"", ""portfolio management"", ""investment planning""]",69,9,2025-10-25 21:53:21,en,What factors should be considered when evaluating {keyword}?,0.63,0.9504883282141688,0.9
40700682,digital marketing,marketing,What channels are most effective for digital marketing?,how_to,Intermediate,"[""Introduction to digital marketing"", ""Key points and analysis"", ""Practical examples"", ""Expert insights"", ""Action items"", ""Conclusion""]","[""marketing"", ""promotion"", ""how_to"", ""digital""]",4,Marketing Coordinators & Specialists,"[""content marketing"", ""brand management"", ""social media""]",55,8,2025-10-25 21:53:21,en,What channels are most effective for {keyword}?,0.8,0.712995305182856,0.51
40700683,cloud computing,it,What design patterns work best with cloud computing?,comparison,Intermediate,"[""Introduction to cloud computing"", ""Key points and analysis"", ""Practical examples"", ""Expert insights"", ""Action items"", ""Conclusion""]","[""computing"", ""development"", ""it"", ""comparison"", ""programming"", ""cloud""]",4,Junior to Mid-level Developers,"[""data science"", ""machine learning"", ""cybersecurity"", ""web development""]",52,8,2025-10-25 21:53:21,en,What design patterns work best with {keyword}?,0.65,0.7679840192683769,0.71
40700684,social media,marketing,How do you reach new customers through social media?,comparison,Intermediate,"[""Overview of social media"", ""Step-by-step implementation"", ""Best practices and tips"", ""Common challenges and solutions"", ""Tools and resources needed"", ""Conclusion and next steps""]","[""media"", ""comparison"", ""marketing"", ""social"", ""advertising"", ""branding""]",6,Marketing Coordinators & Specialists,"[""digital marketing"", ""brand management"", ""content marketing""]",52,9,2025-10-25 21:53:21,en,How do you reach new customers through {keyword}?,0.85,0.738451037046956,0.49
40700685,brand management,marketing,What KPIs are most important for brand management?,analysis,Advanced,"[""Introduction to brand management"", ""Key points and analysis"", ""Practical examples"", ""Expert insights"", ""Action items"", ""Conclusion""]","[""analysis"", ""promotion"", ""digital"", ""marketing"", ""management"", ""brand""]",4,Marketing Managers & Strategists,"[""social media"", ""digital marketing"", ""content marketing""]",50,8,2025-10-25 21:53:21,en,What KPIs are most important for {keyword}?,0.73,0.9066631680204987,0.54
40700686,web development,it,How do you troubleshoot common issues with web development?,comparison,Expert,"[""Overview of web development"", ""Step-by-step implementation"", ""Best practices and tips"", ""Common challenges and solutions"", ""Tools and resources needed"", ""Conclusion and next steps""]","[""software"", ""development"", ""it"", ""comparison"", ""programming"", ""web""]",6,Architects & Technical Directors,"[""cybersecurity"", ""cloud computing"", ""data science"", ""machine learning""]",59,9,2025-10-25 21:53:21,en,How do you troubleshoot common issues with {keyword}?,0.79,1.0,0.85
40700687,social media,marketing,What content types work best for social media?,optimization,Expert,"[""Introduction to social media"", ""Key points and analysis"", ""Practical examples"", ""Expert insights"", ""Action items"", ""Conclusion""]","[""media"", ""promotion"", ""marketing"", ""social"", ""advertising"", ""optimization""]",4,Marketing Directors & CMOs,"[""content marketing"", ""brand management"", ""digital marketing""]",46,8,2025-10-25 21:53:21,en,What content types work best for {keyword}?,0.64,1.0,0.48
40700688,cybersecurity,it,How do you stay updated with cybersecurity developments?,analysis,Advanced,"[""Overview of cybersecurity"", ""Step-by-step implementation"", ""Best practices and tips"", ""Common challenges and solutions"", ""Tools and resources needed"", ""Conclusion and next steps""]","[""software"", ""analysis"", ""it"", ""cybersecurity"", ""technology""]",5,Senior Developers & Tech Leads,"[""cloud computing"", ""data science"", ""web development"", ""machine learning""]",56,8,2025-10-25 21:53:21,en,How do you stay updated with {keyword} developments?,0.85,0.8670930757751052,0.5
40700689,data science,it,What are the cost considerations for data science?,comparison,Intermediate,"[""Introduction to data science"", ""Key concepts and definitions"", ""Main categories or types"", ""Examples and case studies"", ""Benefits and advantages"", ""Summary and recommendations""]","[""software"", ""development"", ""it"", ""comparison"", ""science"", ""data""]",6,Junior to Mid-level Developers,"[""machine learning"", ""web development"", ""cybersecurity"", ""cloud computing""]",50,8,2025-10-25 21:53:21,en,What are the cost considerations for {keyword}?,0.65,0.649025551214143,0.4
40700690,investment planning,economics,What timeline is realistic for investment planning returns?,comparison,Advanced,"[""Introduction to investment planning"", ""Key points and analysis"", ""Practical examples"", ""Expert insights"", ""Action items"", ""Conclusion""]","[""investment"", ""planning"", ""comparison"", ""business"", ""economics""]",4,Professional Investors & Advisors,"[""market analysis"", ""portfolio management"", ""financial modeling""]",59,8,2025-10-25 21:53:21,en,What timeline is realistic for {keyword} returns?,0.84,0.9758756905905647,0.65
40700691,portfolio management,economics,What timeline is realistic for portfolio management returns?,analysis,Beginner,"[""Introduction to portfolio management"", ""Key points and analysis"", ""Practical examples"", ""Expert insights"", ""Action items"", ""Conclusion""]","[""analysis"", ""finance"", ""portfolio"", ""management"", ""business"", ""economics""]",4,Students & New Investors,"[""investment planning"", ""financial modeling"", ""market analysis""]",60,8,2025-10-25 21:53:21,en,What timeline is realistic for {keyword} returns?,0.86,0.44626050681919316,0.74
40700692,financial modeling,economics,How do you hedge against financial modeling market downturns?,how_to,Expert,"[""Overview of financial modeling"", ""Step-by-step implementation"", ""Best practices and tips"", ""Common challenges and solutions"", ""Tools and resources needed"", ""Conclusion and next steps""]","[""how_to"", ""finance"", ""modeling"", ""financial"", ""business"", ""economics""]",6,Portfolio Managers & Financial Experts,"[""market analysis"", ""portfolio management"", ""investment planning""]",61,9,2025-10-25 21:53:21,en,How do you hedge against {keyword} market downturns?,0.65,1.0,0.85
40700693,portfolio management,economics,How do you benchmark portfolio management against alternatives?,implementation,Expert,"[""Overview of portfolio management"", ""Step-by-step implementation"", ""Best practices and tips"", ""Common challenges and solutions"", ""Tools and resources needed"", ""Conclusion and next steps""]","[""finance"", ""implementation"", ""portfolio"", ""management"", ""market"", ""economics""]",6,Portfolio Managers & Financial Experts,"[""investment planning"", ""market analysis"", ""financial modeling""]",63,8,2025-10-25 21:53:21,en,How do you benchmark {keyword} against alternatives?,0.66,1.0,0.51
40700694,portfolio management,economics,How do economic conditions affect portfolio management performance?,best_practice,Advanced,"[""Introduction to portfolio management"", ""Key points and analysis"", ""Practical examples"", ""Expert insights"", ""Action items"", ""Conclusion""]","[""finance"", ""portfolio"", ""best_practice"", ""management"", ""market"", ""economics""]",4,Professional Investors & Advisors,"[""market analysis"", ""investment planning"", ""financial modeling""]",67,8,2025-10-25 21:53:21,en,How do economic conditions affect {keyword} performance?,0.68,0.9285477392500817,0.33
40700695,cloud computing,it,What security considerations should be taken when using cloud computing?,how_to,Advanced,"[""Introduction to cloud computing"", ""Key points and analysis"", ""Practical examples"", ""Expert insights"", ""Action items"", ""Conclusion""]","[""computing"", ""how_to"", ""software"", ""it"", ""programming"", ""cloud""]",4,Senior Developers & Tech Leads,"[""cybersecurity"", ""machine learning"", ""web development"", ""data science""]",72,10,2025-10-25 21:53:21,en,What security considerations should be taken when using {keyword}?,0.78,0.9169516992170004,0.73
40700696,financial modeling,economics,How do you analyze market trends in financial modeling?,evaluation,Intermediate,"[""Overview of financial modeling"", ""Step-by-step implementation"", ""Best practices and tips"", ""Common challenges and solutions"", ""Tools and resources needed"", ""Conclusion and next steps""]","[""investment"", ""finance"", ""modeling"", ""financial"", ""evaluation"", ""economics""]",6,Individual Investors & Analysts,"[""portfolio management"", ""investment planning"", ""market analysis""]",55,9,2025-10-25 21:53:21,en,How do you analyze market trends in {keyword}?,0.91,0.6035200683444742,0.44
