record_id,keyword,category,question,question_type,difficulty_level,answer_outline,tags,estimated_read_time,target_audience,related_topics,question_length,word_count,created_date,language,source_template,engagement_score,complexity_score,popularity_score
34000001,cloud computing,it,How do you troubleshoot common issues with cloud computing?,evaluation,Advanced,"[""Overview of cloud computing"", ""Step-by-step implementation"", ""Best practices and tips"", ""Common challenges and solutions"", ""Tools and resources needed"", ""Conclusion and next steps""]","[""computing"", ""development"", ""it"", ""evaluation"", ""cloud"", ""technology""]",6,Senior Developers & Tech Leads,"[""web development"", ""cybersecurity"", ""machine learning"", ""data science""]",59,9,2025-10-25 21:44:02,en,How do you troubleshoot common issues with {keyword}?,0.72,0.9406645377970138,0.65
34000002,investment planning,economics,What strategies work best for investment planning investment?,comparison,Expert,"[""Introduction to investment planning"", ""Key points and analysis"", ""Practical examples"", ""Expert insights"", ""Action items"", ""Conclusion""]","[""investment"", ""planning"", ""finance"", ""comparison"", ""business"", ""economics""]",4,Portfolio Managers & Financial Experts,"[""financial modeling"", ""market analysis"", ""portfolio management""]",61,8,2025-10-25 21:44:02,en,What strategies work best for {keyword} investment?,0.85,1.0,0.44
34000003,data science,it,What are the key components of a data science implementation?,optimization,Intermediate,"[""Introduction to data science"", ""Key concepts and definitions"", ""Main categories or types"", ""Examples and case studies"", ""Benefits and advantages"", ""Summary and recommendations""]","[""technology"", ""development"", ""it"", ""science"", ""optimization"", ""data""]",6,Junior to Mid-level Developers,"[""cloud computing"", ""cybersecurity"", ""web development"", ""machine learning""]",61,10,2025-10-25 21:44:02,en,What are the key components of a {keyword} implementation?,0.66,0.6608452174794879,0.65
34000004,content marketing,marketing,How do you reach new customers through content marketing?,analysis,Beginner,"[""Overview of content marketing"", ""Step-by-step implementation"", ""Best practices and tips"", ""Common challenges and solutions"", ""Tools and resources needed"", ""Conclusion and next steps""]","[""content"", ""analysis"", ""marketing"", ""digital"", ""branding""]",6,Marketing Students & Interns,"[""brand management"", ""social media"", ""digital marketing""]",57,9,2025-10-25 21:44:02,en,How do you reach new customers through {keyword}?,0.65,0.43112589039387494,0.64
34000005,financial modeling,economics,How do you protect your financial modeling investments?,optimization,Expert,"[""Overview of financial modeling"", ""Step-by-step implementation"", ""Best practices and tips"", ""Common challenges and solutions"", ""Tools and resources needed"", ""Conclusion and next steps""]","[""investment"", ""finance"", ""modeling"", ""financial"", ""optimization"", ""economics""]",6,Portfolio Managers & Financial Experts,"[""market analysis"", ""portfolio management"", ""investment planning""]",55,8,2025-10-25 21:44:02,en,How do you protect your {keyword} investments?,0.66,1.0,0.64
34000006,investment planning,economics,What are the seasonal patterns in investment planning?,implementation,Expert,"[""Introduction to investment planning"", ""Key concepts and definitions"", ""Main categories or types"", ""Examples and case studies"", ""Benefits and advantages"", ""Summary and recommendations""]","[""investment"", ""planning"", ""implementation"", ""market"", ""business"", ""economics""]",6,Portfolio Managers & Financial Experts,"[""financial modeling"", ""market analysis"", ""portfolio management""]",54,8,2025-10-25 21:44:02,en,What are the seasonal patterns in {keyword}?,0.65,1.0,0.51
34000007,cloud computing,it,How does cloud computing impact business operations?,optimization,Advanced,"[""Introduction to cloud computing"", ""Key points and analysis"", ""Practical examples"", ""Expert insights"", ""Action items"", ""Conclusion""]","[""computing"", ""software"", ""cloud"", ""it"", ""optimization"", ""technology""]",4,Senior Developers & Tech Leads,"[""cybersecurity"", ""data science"", ""machine learning"", ""web development""]",52,7,2025-10-25 21:44:02,en,How does {keyword} impact business operations?,0.9,0.8349031240777541,0.44
34000008,social media,marketing,What KPIs are most important for social media?,optimization,Beginner,"[""Introduction to social media"", ""Key points and analysis"", ""Practical examples"", ""Expert insights"", ""Action items"", ""Conclusion""]","[""media"", ""promotion"", ""marketing"", ""social"", ""advertising"", ""optimization""]",4,Marketing Students & Interns,"[""digital marketing"", ""brand management"", ""content marketing""]",46,8,2025-10-25 21:44:02,en,What KPIs are most important for {keyword}?,0.73,0.38769911648560135,0.66
34000009,financial modeling,economics,How do you measure financial modeling performance?,strategy,Expert,"[""Overview of financial modeling"", ""Step-by-step implementation"", ""Best practices and tips"", ""Common challenges and solutions"", ""Tools and resources needed"", ""Conclusion and next steps""]","[""investment"", ""finance"", ""modeling"", ""financial"", ""strategy"", ""economics""]",6,Portfolio Managers & Financial Experts,"[""investment planning"", ""market analysis"", ""portfolio management""]",50,7,2025-10-25 21:44:02,en,How do you measure {keyword} performance?,0.91,1.0,0.89
34000010,cybersecurity,it,What are the cost considerations for cybersecurity?,analysis,Intermediate,"[""Introduction to cybersecurity"", ""Key concepts and definitions"", ""Main categories or types"", ""Examples and case studies"", ""Benefits and advantages"", ""Summary and recommendations""]","[""software"", ""analysis"", ""it"", ""cybersecurity"", ""technology""]",5,Junior to Mid-level Developers,"[""web development"", ""machine learning"", ""cloud computing"", ""data science""]",51,7,2025-10-25 21:44:02,en,What are the cost considerations for {keyword}?,0.9,0.7274930638955068,0.6
34000011,financial modeling,economics,What are the risks associated with financial modeling?,strategy,Intermediate,"[""Introduction to financial modeling"", ""Key concepts and definitions"", ""Main categories or types"", ""Examples and case studies"", ""Benefits and advantages"", ""Summary and recommendations""]","[""investment"", ""modeling"", ""financial"", ""market"", ""strategy"", ""economics""]",6,Individual Investors & Analysts,"[""portfolio management"", ""investment planning"", ""market analysis""]",54,8,2025-10-25 21:44:02,en,What are the risks associated with {keyword}?,0.73,0.7078696273267703,0.78
34000012,web development,it,What are the cost considerations for web development?,implementation,Advanced,"[""Introduction to web development"", ""Key concepts and definitions"", ""Main categories or types"", ""Examples and case studies"", ""Benefits and advantages"", ""Summary and recommendations""]","[""software"", ""development"", ""it"", ""implementation"", ""programming"", ""web""]",6,Senior Developers & Tech Leads,"[""cybersecurity"", ""data science"", ""cloud computing"", ""machine learning""]",53,8,2025-10-25 21:44:02,en,What are the cost considerations for {keyword}?,0.91,0.8991073797528722,0.68
34000013,digital marketing,marketing,What A/B tests should you run for digital marketing?,strategy,Expert,"[""Introduction to digital marketing"", ""Key points and analysis"", ""Practical examples"", ""Expert insights"", ""Action items"", ""Conclusion""]","[""promotion"", ""marketing"", ""digital"", ""branding"", ""strategy""]",4,Marketing Directors & CMOs,"[""social media"", ""content marketing"", ""brand management""]",52,9,2025-10-25 21:44:02,en,What A/B tests should you run for {keyword}?,0.87,1.0,0.79
34000014,web development,it,How do you implement web development in a production environment?,strategy,Beginner,"[""Overview of web development"", ""Step-by-step implementation"", ""Best practices and tips"", ""Common challenges and solutions"", ""Tools and resources needed"", ""Conclusion and next steps""]","[""software"", ""development"", ""it"", ""programming"", ""strategy"", ""web""]",6,Students & Entry-level Developers,"[""cloud computing"", ""machine learning"", ""cybersecurity"", ""data science""]",65,10,2025-10-25 21:44:02,en,How do you implement {keyword} in a production environment?,0.66,0.42344604580926004,0.51
34000015,content marketing,marketing,What budget should be allocated to content marketing?,evaluation,Beginner,"[""Introduction to content marketing"", ""Key points and analysis"", ""Practical examples"", ""Expert insights"", ""Action items"", ""Conclusion""]","[""content"", ""marketing"", ""digital"", ""advertising"", ""evaluation""]",4,Marketing Students & Interns,"[""digital marketing"", ""social media"", ""brand management""]",53,8,2025-10-25 21:44:02,en,What budget should be allocated to {keyword}?,0.67,0.3741998989237707,0.59
34000016,digital marketing,marketing,What demographics respond best to digital marketing?,evaluation,Expert,"[""Introduction to digital marketing"", ""Key points and analysis"", ""Practical examples"", ""Expert insights"", ""Action items"", ""Conclusion""]","[""promotion"", ""marketing"", ""digital"", ""advertising"", ""evaluation""]",4,Marketing Directors & CMOs,"[""brand management"", ""social media"", ""content marketing""]",52,7,2025-10-25 21:44:02,en,What demographics respond best to {keyword}?,0.76,1.0,0.78
34000017,social media,marketing,How do you automate social media processes?,troubleshooting,Beginner,"[""Overview of social media"", ""Step-by-step implementation"", ""Best practices and tips"", ""Common challenges and solutions"", ""Tools and resources needed"", ""Conclusion and next steps""]","[""media"", ""promotion"", ""troubleshooting"", ""marketing"", ""social"", ""advertising""]",6,Marketing Students & Interns,"[""brand management"", ""content marketing"", ""digital marketing""]",43,7,2025-10-25 21:44:02,en,How do you automate {keyword} processes?,0.92,0.4588552071765581,0.5
34000018,market analysis,economics,What tools help analyze market analysis data?,planning,Beginner,"[""Introduction to market analysis"", ""Key points and analysis"", ""Practical examples"", ""Expert insights"", ""Action items"", ""Conclusion""]","[""investment"", ""planning"", ""analysis"", ""market"", ""business"", ""economics""]",4,Students & New Investors,"[""financial modeling"", ""portfolio management"", ""investment planning""]",45,7,2025-10-25 21:44:02,en,What tools help analyze {keyword} data?,0.89,0.32242439247201815,0.75
34000019,content marketing,marketing,How do you automate content marketing processes?,troubleshooting,Advanced,"[""Overview of content marketing"", ""Step-by-step implementation"", ""Best practices and tips"", ""Common challenges and solutions"", ""Tools and resources needed"", ""Conclusion and next steps""]","[""content"", ""promotion"", ""troubleshooting"", ""marketing"", ""branding""]",6,Marketing Managers & Strategists,"[""social media"", ""digital marketing"", ""brand management""]",48,7,2025-10-25 21:44:02,en,How do you automate {keyword} processes?,0.87,0.9456261804131039,0.72
34000020,investment planning,economics,How does global economics impact investment planning?,evaluation,Beginner,"[""Introduction to investment planning"", ""Key points and analysis"", ""Practical examples"", ""Expert insights"", ""Action items"", ""Conclusion""]","[""investment"", ""planning"", ""finance"", ""evaluation"", ""business"", ""economics""]",4,Students & New Investors,"[""financial modeling"", ""market analysis"", ""portfolio management""]",53,7,2025-10-25 21:44:02,en,How does global economics impact {keyword}?,0.9,0.4145871491536818,0.62
34000021,market analysis,economics,How do you adjust your market analysis strategy during volatility?,comparison,Advanced,"[""Overview of market analysis"", ""Step-by-step implementation"", ""Best practices and tips"", ""Common challenges and solutions"", ""Tools and resources needed"", ""Conclusion and next steps""]","[""analysis"", ""comparison"", ""market"", ""business"", ""economics""]",6,Professional Investors & Advisors,"[""portfolio management"", ""financial modeling"", ""investment planning""]",66,10,2025-10-25 21:44:02,en,How do you adjust your {keyword} strategy during volatility?,0.72,0.9406424232163397,0.71
34000022,digital marketing,marketing,What channels are most effective for digital marketing?,planning,Advanced,"[""Introduction to digital marketing"", ""Key points and analysis"", ""Practical examples"", ""Expert insights"", ""Action items"", ""Conclusion""]","[""planning"", ""promotion"", ""marketing"", ""digital"", ""branding""]",4,Marketing Managers & Strategists,"[""content marketing"", ""brand management"", ""social media""]",55,8,2025-10-25 21:44:02,en,What channels are most effective for {keyword}?,0.66,0.9021711529285097,0.8
34000023,financial modeling,economics,How do you diversify your portfolio using financial modeling?,analysis,Advanced,"[""Overview of financial modeling"", ""Step-by-step implementation"", ""Best practices and tips"", ""Common challenges and solutions"", ""Tools and resources needed"", ""Conclusion and next steps""]","[""investment"", ""analysis"", ""modeling"", ""financial"", ""market"", ""economics""]",6,Professional Investors & Advisors,"[""portfolio management"", ""market analysis"", ""investment planning""]",61,9,2025-10-25 21:44:02,en,How do you diversify your portfolio using {keyword}?,0.84,0.8371763577849276,0.61
34000024,web development,it,How can web development improve system performance and scalability?,optimization,Advanced,"[""Introduction to web development"", ""Key points and analysis"", ""Practical examples"", ""Expert insights"", ""Action items"", ""Conclusion""]","[""development"", ""it"", ""programming"", ""optimization"", ""web""]",4,Senior Developers & Tech Leads,"[""cybersecurity"", ""cloud computing"", ""machine learning"", ""data science""]",67,9,2025-10-25 21:44:02,en,How can {keyword} improve system performance and scalability?,0.74,0.9341986857670779,0.84
34000025,financial modeling,economics,How do economic conditions affect financial modeling performance?,troubleshooting,Beginner,"[""Introduction to financial modeling"", ""Key points and analysis"", ""Practical examples"", ""Expert insights"", ""Action items"", ""Conclusion""]","[""troubleshooting"", ""modeling"", ""financial"", ""market"", ""business"", ""economics""]",4,Students & New Investors,"[""investment planning"", ""portfolio management"", ""market analysis""]",65,8,2025-10-25 21:44:02,en,How do economic conditions affect {keyword} performance?,0.73,0.45110880939334663,0.36
34000026,web development,it,What are the key components of a web development implementation?,implementation,Expert,"[""Introduction to web development"", ""Key concepts and definitions"", ""Main categories or types"", ""Examples and case studies"", ""Benefits and advantages"", ""Summary and recommendations""]","[""software"", ""development"", ""web"", ""implementation"", ""it"", ""technology""]",6,Architects & Technical Directors,"[""cloud computing"", ""data science"", ""cybersecurity"", ""machine learning""]",64,10,2025-10-25 21:44:02,en,What are the key components of a {keyword} implementation?,0.71,1.0,0.87
34000027,social media,marketing,What budget should be allocated to social media?,optimization,Intermediate,"[""Introduction to social media"", ""Key points and analysis"", ""Practical examples"", ""Expert insights"", ""Action items"", ""Conclusion""]","[""media"", ""promotion"", ""marketing"", ""social"", ""advertising"", ""optimization""]",4,Marketing Coordinators & Specialists,"[""brand management"", ""digital marketing"", ""content marketing""]",48,8,2025-10-25 21:44:02,en,What budget should be allocated to {keyword}?,0.68,0.7512251820133546,0.59
34000028,content marketing,marketing,What does the future hold for content marketing?,implementation,Intermediate,"[""Introduction to content marketing"", ""Key points and analysis"", ""Practical examples"", ""Expert insights"", ""Action items"", ""Conclusion""]","[""content"", ""implementation"", ""marketing"", ""digital"", ""advertising""]",4,Marketing Coordinators & Specialists,"[""digital marketing"", ""social media"", ""brand management""]",48,8,2025-10-25 21:44:02,en,What does the future hold for {keyword}?,0.9,0.7518346118657386,0.78
34000029,portfolio management,economics,How do you benchmark portfolio management against alternatives?,optimization,Beginner,"[""Overview of portfolio management"", ""Step-by-step implementation"", ""Best practices and tips"", ""Common challenges and solutions"", ""Tools and resources needed"", ""Conclusion and next steps""]","[""finance"", ""portfolio"", ""management"", ""business"", ""optimization"", ""economics""]",6,Students & New Investors,"[""investment planning"", ""financial modeling"", ""market analysis""]",63,8,2025-10-25 21:44:02,en,How do you benchmark {keyword} against alternatives?,0.75,0.3148525977466434,0.67
34000030,market analysis,economics,How do economic conditions affect market analysis performance?,implementation,Expert,"[""Introduction to market analysis"", ""Key points and analysis"", ""Practical examples"", ""Expert insights"", ""Action items"", ""Conclusion""]","[""analysis"", ""finance"", ""implementation"", ""market"", ""business"", ""economics""]",4,Portfolio Managers & Financial Experts,"[""investment planning"", ""portfolio management"", ""financial modeling""]",62,8,2025-10-25 21:44:02,en,How do economic conditions affect {keyword} performance?,0.63,1.0,0.33
34000031,cybersecurity,it,What are the cost considerations for cybersecurity?,how_to,Beginner,"[""Introduction to cybersecurity"", ""Key concepts and definitions"", ""Main categories or types"", ""Examples and case studies"", ""Benefits and advantages"", ""Summary and recommendations""]","[""how_to"", ""software"", ""it"", ""programming"", ""cybersecurity""]",5,Students & Entry-level Developers,"[""cloud computing"", ""web development"", ""machine learning"", ""data science""]",51,7,2025-10-25 21:44:02,en,What are the cost considerations for {keyword}?,0.74,0.3239535413454275,0.54
34000032,investment planning,economics,What are the risks associated with investment planning?,comparison,Beginner,"[""Introduction to investment planning"", ""Key concepts and definitions"", ""Main categories or types"", ""Examples and case studies"", ""Benefits and advantages"", ""Summary and recommendations""]","[""investment"", ""planning"", ""finance"", ""comparison"", ""business"", ""economics""]",6,Students & New Investors,"[""portfolio management"", ""financial modeling"", ""market analysis""]",55,8,2025-10-25 21:44:02,en,What are the risks associated with {keyword}?,0.7,0.427612137822353,0.35
34000033,financial modeling,economics,How do you benchmark financial modeling against alternatives?,optimization,Beginner,"[""Overview of financial modeling"", ""Step-by-step implementation"", ""Best practices and tips"", ""Common challenges and solutions"", ""Tools and resources needed"", ""Conclusion and next steps""]","[""investment"", ""modeling"", ""financial"", ""business"", ""optimization"", ""economics""]",6,Students & New Investors,"[""market analysis"", ""portfolio management"", ""investment planning""]",61,8,2025-10-25 21:44:02,en,How do you benchmark {keyword} against alternatives?,0.92,0.3149396610113277,0.67
34000034,brand management,marketing,What tools are essential for brand management analytics?,planning,Beginner,"[""Introduction to brand management"", ""Key points and analysis"", ""Practical examples"", ""Expert insights"", ""Action items"", ""Conclusion""]","[""planning"", ""digital"", ""marketing"", ""management"", ""branding"", ""brand""]",4,Marketing Students & Interns,"[""social media"", ""digital marketing"", ""content marketing""]",56,8,2025-10-25 21:44:02,en,What tools are essential for {keyword} analytics?,0.84,0.35668562576867474,0.37
34000035,investment planning,economics,What is the optimal allocation for investment planning in a portfolio?,troubleshooting,Beginner,"[""Introduction to investment planning"", ""Key points and analysis"", ""Practical examples"", ""Expert insights"", ""Action items"", ""Conclusion""]","[""investment"", ""planning"", ""troubleshooting"", ""market"", ""business"", ""economics""]",4,Students & New Investors,"[""market analysis"", ""portfolio management"", ""financial modeling""]",70,11,2025-10-25 21:44:02,en,What is the optimal allocation for {keyword} in a portfolio?,0.87,0.3029478732727972,0.68
34000036,web development,it,What tools are essential for web development development?,troubleshooting,Advanced,"[""Introduction to web development"", ""Key points and analysis"", ""Practical examples"", ""Expert insights"", ""Action items"", ""Conclusion""]","[""software"", ""development"", ""it"", ""troubleshooting"", ""web""]",4,Senior Developers & Tech Leads,"[""data science"", ""machine learning"", ""cybersecurity"", ""cloud computing""]",57,8,2025-10-25 21:44:02,en,What tools are essential for {keyword} development?,0.73,0.9858237198847423,0.3
34000037,market analysis,economics,How do you protect your market analysis investments?,implementation,Beginner,"[""Overview of market analysis"", ""Step-by-step implementation"", ""Best practices and tips"", ""Common challenges and solutions"", ""Tools and resources needed"", ""Conclusion and next steps""]","[""investment"", ""analysis"", ""implementation"", ""market"", ""economics""]",6,Students & New Investors,"[""portfolio management"", ""financial modeling"", ""investment planning""]",52,8,2025-10-25 21:44:02,en,How do you protect your {keyword} investments?,0.62,0.4003732298987645,0.63
34000038,data science,it,What design patterns work best with data science?,strategy,Advanced,"[""Introduction to data science"", ""Key points and analysis"", ""Practical examples"", ""Expert insights"", ""Action items"", ""Conclusion""]","[""technology"", ""software"", ""it"", ""science"", ""strategy"", ""data""]",4,Senior Developers & Tech Leads,"[""cybersecurity"", ""cloud computing"", ""machine learning"", ""web development""]",49,8,2025-10-25 21:44:02,en,What design patterns work best with {keyword}?,0.74,0.9213988010131873,0.64
34000039,market analysis,economics,How do you measure market analysis performance?,planning,Intermediate,"[""Overview of market analysis"", ""Step-by-step implementation"", ""Best practices and tips"", ""Common challenges and solutions"", ""Tools and resources needed"", ""Conclusion and next steps""]","[""investment"", ""planning"", ""analysis"", ""market"", ""economics""]",6,Individual Investors & Analysts,"[""portfolio management"", ""investment planning"", ""financial modeling""]",47,7,2025-10-25 21:44:02,en,How do you measure {keyword} performance?,0.68,0.6873421468234611,0.69
34000040,social media,marketing,What demographics respond best to social media?,implementation,Beginner,"[""Introduction to social media"", ""Key points and analysis"", ""Practical examples"", ""Expert insights"", ""Action items"", ""Conclusion""]","[""media"", ""implementation"", ""promotion"", ""marketing"", ""social"", ""advertising""]",4,Marketing Students & Interns,"[""digital marketing"", ""brand management"", ""content marketing""]",47,7,2025-10-25 21:44:02,en,What demographics respond best to {keyword}?,0.69,0.47832257466898254,0.51
34000041,digital marketing,marketing,What budget should be allocated to digital marketing?,evaluation,Expert,"[""Introduction to digital marketing"", ""Key points and analysis"", ""Practical examples"", ""Expert insights"", ""Action items"", ""Conclusion""]","[""marketing"", ""digital"", ""advertising"", ""branding"", ""evaluation""]",4,Marketing Directors & CMOs,"[""content marketing"", ""brand management"", ""social media""]",53,8,2025-10-25 21:44:02,en,What budget should be allocated to {keyword}?,0.66,1.0,0.64
34000042,machine learning,it,How do you optimize machine learning for different platforms?,analysis,Beginner,"[""Overview of machine learning"", ""Step-by-step implementation"", ""Best practices and tips"", ""Common challenges and solutions"", ""Tools and resources needed"", ""Conclusion and next steps""]","[""development"", ""analysis"", ""it"", ""learning"", ""machine"", ""technology""]",6,Students & Entry-level Developers,"[""cybersecurity"", ""web development"", ""data science"", ""cloud computing""]",61,9,2025-10-25 21:44:02,en,How do you optimize {keyword} for different platforms?,0.76,0.4755493977976928,0.82
34000043,data science,it,How do you measure the success of data science projects?,analysis,Intermediate,"[""Overview of data science"", ""Step-by-step implementation"", ""Best practices and tips"", ""Common challenges and solutions"", ""Tools and resources needed"", ""Conclusion and next steps""]","[""software"", ""analysis"", ""it"", ""programming"", ""science"", ""data""]",6,Junior to Mid-level Developers,"[""web development"", ""cybersecurity"", ""cloud computing"", ""machine learning""]",56,10,2025-10-25 21:44:02,en,How do you measure the success of {keyword} projects?,0.62,0.7287031021535193,0.4
34000044,content marketing,marketing,What does the future hold for content marketing?,best_practice,Advanced,"[""Introduction to content marketing"", ""Key points and analysis"", ""Practical examples"", ""Expert insights"", ""Action items"", ""Conclusion""]","[""content"", ""best_practice"", ""marketing"", ""advertising"", ""branding""]",4,Marketing Managers & Strategists,"[""social media"", ""brand management"", ""digital marketing""]",48,8,2025-10-25 21:44:02,en,What does the future hold for {keyword}?,0.66,0.8083073690155147,0.32
