record_id,keyword,category,question,question_type,difficulty_level,answer_outline,tags,estimated_read_time,target_audience,related_topics,question_length,word_count,created_date,language,source_template,engagement_score,complexity_score,popularity_score
34000351,portfolio management,economics,What strategies work best for portfolio management investment?,optimization,Intermediate,"[""Introduction to portfolio management"", ""Key points and analysis"", ""Practical examples"", ""Expert insights"", ""Action items"", ""Conclusion""]","[""investment"", ""finance"", ""portfolio"", ""management"", ""optimization"", ""economics""]",4,Individual Investors & Analysts,"[""financial modeling"", ""investment planning"", ""market analysis""]",62,8,2025-10-25 21:44:02,en,What strategies work best for {keyword} investment?,0.87,0.7112756134336443,0.72
34000352,content marketing,marketing,What KPIs are most important for content marketing?,best_practice,Expert,"[""Introduction to content marketing"", ""Key points and analysis"", ""Practical examples"", ""Expert insights"", ""Action items"", ""Conclusion""]","[""content"", ""promotion"", ""best_practice"", ""marketing"", ""advertising""]",4,Marketing Directors & CMOs,"[""brand management"", ""social media"", ""digital marketing""]",51,8,2025-10-25 21:44:02,en,What KPIs are most important for {keyword}?,0.71,1.0,0.71
34000353,brand management,marketing,How do you personalize brand management for different segments?,analysis,Intermediate,"[""Overview of brand management"", ""Step-by-step implementation"", ""Best practices and tips"", ""Common challenges and solutions"", ""Tools and resources needed"", ""Conclusion and next steps""]","[""analysis"", ""marketing"", ""management"", ""advertising"", ""branding"", ""brand""]",6,Marketing Coordinators & Specialists,"[""content marketing"", ""digital marketing"", ""social media""]",63,9,2025-10-25 21:44:02,en,How do you personalize {keyword} for different segments?,0.82,0.7949465716058168,0.54
34000354,data science,it,What career opportunities exist in data science?,analysis,Intermediate,"[""Introduction to data science"", ""Key points and analysis"", ""Practical examples"", ""Expert insights"", ""Action items"", ""Conclusion""]","[""development"", ""analysis"", ""it"", ""programming"", ""science"", ""data""]",4,Junior to Mid-level Developers,"[""cybersecurity"", ""web development"", ""machine learning"", ""cloud computing""]",48,7,2025-10-25 21:44:02,en,What career opportunities exist in {keyword}?,0.78,0.7352480352980499,0.66
34000355,brand management,marketing,What content types work best for brand management?,implementation,Beginner,"[""Introduction to brand management"", ""Key points and analysis"", ""Practical examples"", ""Expert insights"", ""Action items"", ""Conclusion""]","[""implementation"", ""promotion"", ""marketing"", ""management"", ""advertising"", ""brand""]",4,Marketing Students & Interns,"[""digital marketing"", ""content marketing"", ""social media""]",50,8,2025-10-25 21:44:02,en,What content types work best for {keyword}?,0.62,0.4531206128761269,0.89
34000356,machine learning,it,How do you stay updated with machine learning developments?,comparison,Expert,"[""Overview of machine learning"", ""Step-by-step implementation"", ""Best practices and tips"", ""Common challenges and solutions"", ""Tools and resources needed"", ""Conclusion and next steps""]","[""software"", ""development"", ""it"", ""comparison"", ""learning"", ""machine""]",6,Architects & Technical Directors,"[""web development"", ""cloud computing"", ""data science"", ""cybersecurity""]",59,9,2025-10-25 21:44:02,en,How do you stay updated with {keyword} developments?,0.93,1.0,0.35
34000357,financial modeling,economics,How do you benchmark financial modeling against alternatives?,troubleshooting,Expert,"[""Overview of financial modeling"", ""Step-by-step implementation"", ""Best practices and tips"", ""Common challenges and solutions"", ""Tools and resources needed"", ""Conclusion and next steps""]","[""finance"", ""troubleshooting"", ""modeling"", ""financial"", ""business"", ""economics""]",6,Portfolio Managers & Financial Experts,"[""portfolio management"", ""investment planning"", ""market analysis""]",61,8,2025-10-25 21:44:02,en,How do you benchmark {keyword} against alternatives?,0.92,1.0,0.69
34000358,portfolio management,economics,How do you hedge against portfolio management market downturns?,implementation,Advanced,"[""Overview of portfolio management"", ""Step-by-step implementation"", ""Best practices and tips"", ""Common challenges and solutions"", ""Tools and resources needed"", ""Conclusion and next steps""]","[""implementation"", ""portfolio"", ""management"", ""market"", ""business"", ""economics""]",6,Professional Investors & Advisors,"[""financial modeling"", ""investment planning"", ""market analysis""]",63,9,2025-10-25 21:44:02,en,How do you hedge against {keyword} market downturns?,0.88,0.8556324340263144,0.82
34000359,content marketing,marketing,What messaging works best in content marketing campaigns?,analysis,Beginner,"[""Introduction to content marketing"", ""Key points and analysis"", ""Practical examples"", ""Expert insights"", ""Action items"", ""Conclusion""]","[""content"", ""analysis"", ""promotion"", ""marketing"", ""branding""]",4,Marketing Students & Interns,"[""digital marketing"", ""brand management"", ""social media""]",57,8,2025-10-25 21:44:02,en,What messaging works best in {keyword} campaigns?,0.68,0.39947840610749863,0.59
34000360,content marketing,marketing,What content types work best for content marketing?,planning,Expert,"[""Introduction to content marketing"", ""Key points and analysis"", ""Practical examples"", ""Expert insights"", ""Action items"", ""Conclusion""]","[""planning"", ""content"", ""digital"", ""marketing"", ""branding""]",4,Marketing Directors & CMOs,"[""social media"", ""digital marketing"", ""brand management""]",51,8,2025-10-25 21:44:02,en,What content types work best for {keyword}?,0.89,1.0,0.53
34000361,cloud computing,it,How do you measure the success of cloud computing projects?,best_practice,Intermediate,"[""Overview of cloud computing"", ""Step-by-step implementation"", ""Best practices and tips"", ""Common challenges and solutions"", ""Tools and resources needed"", ""Conclusion and next steps""]","[""computing"", ""software"", ""it"", ""best_practice"", ""cloud"", ""technology""]",6,Junior to Mid-level Developers,"[""machine learning"", ""web development"", ""data science"", ""cybersecurity""]",59,10,2025-10-25 21:44:02,en,How do you measure the success of {keyword} projects?,0.77,0.6077768074706384,0.57
34000362,web development,it,How do you troubleshoot common issues with web development?,planning,Intermediate,"[""Overview of web development"", ""Step-by-step implementation"", ""Best practices and tips"", ""Common challenges and solutions"", ""Tools and resources needed"", ""Conclusion and next steps""]","[""planning"", ""development"", ""web"", ""it"", ""software"", ""technology""]",6,Junior to Mid-level Developers,"[""data science"", ""cloud computing"", ""cybersecurity"", ""machine learning""]",59,9,2025-10-25 21:44:02,en,How do you troubleshoot common issues with {keyword}?,0.62,0.762277938080438,0.63
34000363,brand management,marketing,How do you create a brand management roadmap?,strategy,Expert,"[""Overview of brand management"", ""Step-by-step implementation"", ""Best practices and tips"", ""Common challenges and solutions"", ""Tools and resources needed"", ""Conclusion and next steps""]","[""promotion"", ""marketing"", ""management"", ""advertising"", ""strategy"", ""brand""]",6,Marketing Directors & CMOs,"[""digital marketing"", ""social media"", ""content marketing""]",45,8,2025-10-25 21:44:02,en,How do you create a {keyword} roadmap?,0.92,1.0,0.66
34000364,data science,it,How do you measure the success of data science projects?,best_practice,Advanced,"[""Overview of data science"", ""Step-by-step implementation"", ""Best practices and tips"", ""Common challenges and solutions"", ""Tools and resources needed"", ""Conclusion and next steps""]","[""technology"", ""software"", ""it"", ""best_practice"", ""science"", ""data""]",6,Senior Developers & Tech Leads,"[""cloud computing"", ""machine learning"", ""cybersecurity"", ""web development""]",56,10,2025-10-25 21:44:02,en,How do you measure the success of {keyword} projects?,0.87,0.9339571304733809,0.73
34000365,web development,it,What are the key components of a web development implementation?,planning,Beginner,"[""Introduction to web development"", ""Key concepts and definitions"", ""Main categories or types"", ""Examples and case studies"", ""Benefits and advantages"", ""Summary and recommendations""]","[""planning"", ""development"", ""it"", ""programming"", ""web""]",6,Students & Entry-level Developers,"[""machine learning"", ""cybersecurity"", ""data science"", ""cloud computing""]",64,10,2025-10-25 21:44:02,en,What are the key components of a {keyword} implementation?,0.78,0.4039851138591546,0.39
34000366,investment planning,economics,What timeline is realistic for investment planning returns?,troubleshooting,Expert,"[""Introduction to investment planning"", ""Key points and analysis"", ""Practical examples"", ""Expert insights"", ""Action items"", ""Conclusion""]","[""investment"", ""planning"", ""troubleshooting"", ""market"", ""business"", ""economics""]",4,Portfolio Managers & Financial Experts,"[""financial modeling"", ""market analysis"", ""portfolio management""]",59,8,2025-10-25 21:44:02,en,What timeline is realistic for {keyword} returns?,0.88,1.0,0.31
34000367,content marketing,marketing,How do you attribute success to content marketing efforts?,evaluation,Expert,"[""Overview of content marketing"", ""Step-by-step implementation"", ""Best practices and tips"", ""Common challenges and solutions"", ""Tools and resources needed"", ""Conclusion and next steps""]","[""content"", ""promotion"", ""marketing"", ""digital"", ""evaluation""]",6,Marketing Directors & CMOs,"[""digital marketing"", ""social media"", ""brand management""]",58,9,2025-10-25 21:44:02,en,How do you attribute success to {keyword} efforts?,0.77,1.0,0.61
34000368,social media,marketing,What tools are essential for social media analytics?,how_to,Advanced,"[""Introduction to social media"", ""Key points and analysis"", ""Practical examples"", ""Expert insights"", ""Action items"", ""Conclusion""]","[""how_to"", ""media"", ""promotion"", ""marketing"", ""social"", ""branding""]",4,Marketing Managers & Strategists,"[""brand management"", ""content marketing"", ""digital marketing""]",52,8,2025-10-25 21:44:02,en,What tools are essential for {keyword} analytics?,0.7,0.9980700434695893,0.52
34000369,investment planning,economics,What is the optimal allocation for investment planning in a portfolio?,comparison,Expert,"[""Introduction to investment planning"", ""Key points and analysis"", ""Practical examples"", ""Expert insights"", ""Action items"", ""Conclusion""]","[""investment"", ""planning"", ""comparison"", ""business"", ""economics""]",4,Portfolio Managers & Financial Experts,"[""market analysis"", ""financial modeling"", ""portfolio management""]",70,11,2025-10-25 21:44:02,en,What is the optimal allocation for {keyword} in a portfolio?,0.88,1.0,0.47
34000370,brand management,marketing,What demographics respond best to brand management?,strategy,Beginner,"[""Introduction to brand management"", ""Key points and analysis"", ""Practical examples"", ""Expert insights"", ""Action items"", ""Conclusion""]","[""promotion"", ""marketing"", ""management"", ""advertising"", ""strategy"", ""brand""]",4,Marketing Students & Interns,"[""content marketing"", ""digital marketing"", ""social media""]",51,7,2025-10-25 21:44:02,en,What demographics respond best to {keyword}?,0.65,0.3248640056643335,0.87
34000371,market analysis,economics,How do you measure market analysis performance?,strategy,Advanced,"[""Overview of market analysis"", ""Step-by-step implementation"", ""Best practices and tips"", ""Common challenges and solutions"", ""Tools and resources needed"", ""Conclusion and next steps""]","[""investment"", ""finance"", ""analysis"", ""market"", ""strategy"", ""economics""]",6,Professional Investors & Advisors,"[""investment planning"", ""portfolio management"", ""financial modeling""]",47,7,2025-10-25 21:44:02,en,How do you measure {keyword} performance?,0.61,0.9299483834010658,0.51
34000372,brand management,marketing,How do you optimize brand management for mobile users?,comparison,Intermediate,"[""Overview of brand management"", ""Step-by-step implementation"", ""Best practices and tips"", ""Common challenges and solutions"", ""Tools and resources needed"", ""Conclusion and next steps""]","[""promotion"", ""comparison"", ""marketing"", ""management"", ""branding"", ""brand""]",6,Marketing Coordinators & Specialists,"[""social media"", ""content marketing"", ""digital marketing""]",54,9,2025-10-25 21:44:02,en,How do you optimize {keyword} for mobile users?,0.87,0.6286324117554867,0.8
34000373,cybersecurity,it,How can cybersecurity improve system performance and scalability?,comparison,Intermediate,"[""Introduction to cybersecurity"", ""Key points and analysis"", ""Practical examples"", ""Expert insights"", ""Action items"", ""Conclusion""]","[""software"", ""it"", ""comparison"", ""cybersecurity"", ""technology""]",4,Junior to Mid-level Developers,"[""cloud computing"", ""machine learning"", ""web development"", ""data science""]",65,8,2025-10-25 21:44:02,en,How can {keyword} improve system performance and scalability?,0.74,0.6008815428653255,0.52
34000374,financial modeling,economics,How do you diversify your portfolio using financial modeling?,evaluation,Intermediate,"[""Overview of financial modeling"", ""Step-by-step implementation"", ""Best practices and tips"", ""Common challenges and solutions"", ""Tools and resources needed"", ""Conclusion and next steps""]","[""investment"", ""finance"", ""modeling"", ""financial"", ""evaluation"", ""economics""]",6,Individual Investors & Analysts,"[""market analysis"", ""portfolio management"", ""investment planning""]",61,9,2025-10-25 21:44:02,en,How do you diversify your portfolio using {keyword}?,0.75,0.7389747661986026,0.53
34000375,digital marketing,marketing,What channels are most effective for digital marketing?,planning,Intermediate,"[""Introduction to digital marketing"", ""Key points and analysis"", ""Practical examples"", ""Expert insights"", ""Action items"", ""Conclusion""]","[""planning"", ""promotion"", ""marketing"", ""digital"", ""advertising""]",4,Marketing Coordinators & Specialists,"[""social media"", ""brand management"", ""content marketing""]",55,8,2025-10-25 21:44:02,en,What channels are most effective for {keyword}?,0.63,0.7440598413885113,0.36
34000376,social media,marketing,How do you identify the right audience for social media?,best_practice,Intermediate,"[""Overview of social media"", ""Step-by-step implementation"", ""Best practices and tips"", ""Common challenges and solutions"", ""Tools and resources needed"", ""Conclusion and next steps""]","[""media"", ""best_practice"", ""marketing"", ""social"", ""advertising"", ""branding""]",6,Marketing Coordinators & Specialists,"[""brand management"", ""content marketing"", ""digital marketing""]",56,10,2025-10-25 21:44:02,en,How do you identify the right audience for {keyword}?,0.89,0.7914610430693463,0.8
34000377,social media,marketing,What budget should be allocated to social media?,optimization,Beginner,"[""Introduction to social media"", ""Key points and analysis"", ""Practical examples"", ""Expert insights"", ""Action items"", ""Conclusion""]","[""media"", ""marketing"", ""social"", ""advertising"", ""branding"", ""optimization""]",4,Marketing Students & Interns,"[""content marketing"", ""digital marketing"", ""brand management""]",48,8,2025-10-25 21:44:02,en,What budget should be allocated to {keyword}?,0.93,0.4456461675538838,0.83
34000378,portfolio management,economics,How do you adjust your portfolio management strategy during volatility?,troubleshooting,Beginner,"[""Overview of portfolio management"", ""Step-by-step implementation"", ""Best practices and tips"", ""Common challenges and solutions"", ""Tools and resources needed"", ""Conclusion and next steps""]","[""portfolio"", ""troubleshooting"", ""management"", ""market"", ""business"", ""economics""]",6,Students & New Investors,"[""market analysis"", ""financial modeling"", ""investment planning""]",71,10,2025-10-25 21:44:02,en,How do you adjust your {keyword} strategy during volatility?,0.88,0.38692319177842616,0.39
34000379,portfolio management,economics,How do you analyze market trends in portfolio management?,strategy,Advanced,"[""Overview of portfolio management"", ""Step-by-step implementation"", ""Best practices and tips"", ""Common challenges and solutions"", ""Tools and resources needed"", ""Conclusion and next steps""]","[""finance"", ""portfolio"", ""management"", ""business"", ""strategy"", ""economics""]",6,Professional Investors & Advisors,"[""market analysis"", ""investment planning"", ""financial modeling""]",57,9,2025-10-25 21:44:02,en,How do you analyze market trends in {keyword}?,0.79,0.9503718406135984,0.72
34000380,financial modeling,economics,What insurance options are available for financial modeling?,evaluation,Intermediate,"[""Introduction to financial modeling"", ""Key points and analysis"", ""Practical examples"", ""Expert insights"", ""Action items"", ""Conclusion""]","[""investment"", ""modeling"", ""financial"", ""evaluation"", ""business"", ""economics""]",4,Individual Investors & Analysts,"[""market analysis"", ""investment planning"", ""portfolio management""]",60,8,2025-10-25 21:44:02,en,What insurance options are available for {keyword}?,0.63,0.6782580747051712,0.41
34000381,machine learning,it,How do you measure the success of machine learning projects?,best_practice,Advanced,"[""Overview of machine learning"", ""Step-by-step implementation"", ""Best practices and tips"", ""Common challenges and solutions"", ""Tools and resources needed"", ""Conclusion and next steps""]","[""it"", ""programming"", ""best_practice"", ""learning"", ""machine"", ""technology""]",6,Senior Developers & Tech Leads,"[""data science"", ""cybersecurity"", ""cloud computing"", ""web development""]",60,10,2025-10-25 21:44:02,en,How do you measure the success of {keyword} projects?,0.87,0.834067248178119,0.65
34000382,digital marketing,marketing,How do you identify the right audience for digital marketing?,strategy,Expert,"[""Overview of digital marketing"", ""Step-by-step implementation"", ""Best practices and tips"", ""Common challenges and solutions"", ""Tools and resources needed"", ""Conclusion and next steps""]","[""promotion"", ""marketing"", ""digital"", ""advertising"", ""strategy""]",6,Marketing Directors & CMOs,"[""content marketing"", ""brand management"", ""social media""]",61,10,2025-10-25 21:44:02,en,How do you identify the right audience for {keyword}?,0.95,1.0,0.85
34000383,web development,it,What skills are needed to master web development?,implementation,Expert,"[""Introduction to web development"", ""Key points and analysis"", ""Practical examples"", ""Expert insights"", ""Action items"", ""Conclusion""]","[""development"", ""web"", ""implementation"", ""it"", ""technology""]",4,Architects & Technical Directors,"[""cloud computing"", ""cybersecurity"", ""data science"", ""machine learning""]",49,8,2025-10-25 21:44:02,en,What skills are needed to master {keyword}?,0.82,1.0,0.88
34000384,investment planning,economics,How do economic conditions affect investment planning performance?,comparison,Intermediate,"[""Introduction to investment planning"", ""Key points and analysis"", ""Practical examples"", ""Expert insights"", ""Action items"", ""Conclusion""]","[""investment"", ""planning"", ""finance"", ""comparison"", ""economics""]",4,Individual Investors & Analysts,"[""market analysis"", ""financial modeling"", ""portfolio management""]",66,8,2025-10-25 21:44:02,en,How do economic conditions affect {keyword} performance?,0.68,0.6729970963613097,0.57
34000385,machine learning,it,What are the key components of a machine learning implementation?,planning,Advanced,"[""Introduction to machine learning"", ""Key concepts and definitions"", ""Main categories or types"", ""Examples and case studies"", ""Benefits and advantages"", ""Summary and recommendations""]","[""planning"", ""it"", ""programming"", ""learning"", ""machine"", ""technology""]",6,Senior Developers & Tech Leads,"[""data science"", ""cloud computing"", ""web development"", ""cybersecurity""]",65,10,2025-10-25 21:44:02,en,What are the key components of a {keyword} implementation?,0.95,0.8222265727606018,0.4
34000386,market analysis,economics,What timeline is realistic for market analysis returns?,optimization,Intermediate,"[""Introduction to market analysis"", ""Key points and analysis"", ""Practical examples"", ""Expert insights"", ""Action items"", ""Conclusion""]","[""finance"", ""analysis"", ""market"", ""optimization"", ""economics""]",4,Individual Investors & Analysts,"[""financial modeling"", ""investment planning"", ""portfolio management""]",55,8,2025-10-25 21:44:02,en,What timeline is realistic for {keyword} returns?,0.7,0.7296984229459023,0.71
34000387,investment planning,economics,What is the optimal allocation for investment planning in a portfolio?,implementation,Intermediate,"[""Introduction to investment planning"", ""Key points and analysis"", ""Practical examples"", ""Expert insights"", ""Action items"", ""Conclusion""]","[""investment"", ""planning"", ""finance"", ""implementation"", ""economics""]",4,Individual Investors & Analysts,"[""market analysis"", ""portfolio management"", ""financial modeling""]",70,11,2025-10-25 21:44:02,en,What is the optimal allocation for {keyword} in a portfolio?,0.72,0.7138285763580872,0.43
34000388,brand management,marketing,What KPIs are most important for brand management?,best_practice,Expert,"[""Introduction to brand management"", ""Key points and analysis"", ""Practical examples"", ""Expert insights"", ""Action items"", ""Conclusion""]","[""promotion"", ""best_practice"", ""marketing"", ""management"", ""advertising"", ""brand""]",4,Marketing Directors & CMOs,"[""content marketing"", ""digital marketing"", ""social media""]",50,8,2025-10-25 21:44:02,en,What KPIs are most important for {keyword}?,0.8,1.0,0.58
34000389,cybersecurity,it,What career opportunities exist in cybersecurity?,strategy,Advanced,"[""Introduction to cybersecurity"", ""Key points and analysis"", ""Practical examples"", ""Expert insights"", ""Action items"", ""Conclusion""]","[""it"", ""programming"", ""strategy"", ""cybersecurity"", ""technology""]",4,Senior Developers & Tech Leads,"[""cloud computing"", ""web development"", ""machine learning"", ""data science""]",49,6,2025-10-25 21:44:02,en,What career opportunities exist in {keyword}?,0.72,0.8456064040069649,0.8
34000390,investment planning,economics,How do you assess and manage investment planning risks?,troubleshooting,Intermediate,"[""Overview of investment planning"", ""Step-by-step implementation"", ""Best practices and tips"", ""Common challenges and solutions"", ""Tools and resources needed"", ""Conclusion and next steps""]","[""investment"", ""planning"", ""finance"", ""troubleshooting"", ""market"", ""economics""]",6,Individual Investors & Analysts,"[""portfolio management"", ""market analysis"", ""financial modeling""]",55,9,2025-10-25 21:44:02,en,How do you assess and manage {keyword} risks?,0.81,0.7956140022172468,0.45
34000391,machine learning,it,What are the latest trends in machine learning technology?,best_practice,Intermediate,"[""Introduction to machine learning"", ""Key concepts and definitions"", ""Main categories or types"", ""Examples and case studies"", ""Benefits and advantages"", ""Summary and recommendations""]","[""it"", ""programming"", ""best_practice"", ""learning"", ""machine"", ""technology""]",6,Junior to Mid-level Developers,"[""web development"", ""data science"", ""cybersecurity"", ""cloud computing""]",58,9,2025-10-25 21:44:02,en,What are the latest trends in {keyword} technology?,0.83,0.6382056947707956,0.77
34000392,digital marketing,marketing,What channels are most effective for digital marketing?,troubleshooting,Beginner,"[""Introduction to digital marketing"", ""Key points and analysis"", ""Practical examples"", ""Expert insights"", ""Action items"", ""Conclusion""]","[""troubleshooting"", ""marketing"", ""digital"", ""advertising"", ""branding""]",4,Marketing Students & Interns,"[""social media"", ""brand management"", ""content marketing""]",55,8,2025-10-25 21:44:02,en,What channels are most effective for {keyword}?,0.64,0.4226490463088285,0.77
34000393,portfolio management,economics,What tools help analyze portfolio management data?,optimization,Intermediate,"[""Introduction to portfolio management"", ""Key points and analysis"", ""Practical examples"", ""Expert insights"", ""Action items"", ""Conclusion""]","[""investment"", ""portfolio"", ""management"", ""business"", ""optimization"", ""economics""]",4,Individual Investors & Analysts,"[""financial modeling"", ""market analysis"", ""investment planning""]",50,7,2025-10-25 21:44:02,en,What tools help analyze {keyword} data?,0.94,0.6841642382526157,0.53
