record_id,keyword,category,question,question_type,difficulty_level,answer_outline,tags,estimated_read_time,target_audience,related_topics,question_length,word_count,created_date,language,source_template,engagement_score,complexity_score,popularity_score
29200960,portfolio management,economics,What are the seasonal patterns in portfolio management?,planning,Advanced,"[""Introduction to portfolio management"", ""Key concepts and definitions"", ""Main categories or types"", ""Examples and case studies"", ""Benefits and advantages"", ""Summary and recommendations""]","[""planning"", ""finance"", ""portfolio"", ""management"", ""business"", ""economics""]",6,Professional Investors & Advisors,"[""investment planning"", ""market analysis"", ""financial modeling""]",55,8,2025-10-25 21:37:21,en,What are the seasonal patterns in {keyword}?,0.64,0.8222611168537611,0.76
29200961,market analysis,economics,How do you protect your market analysis investments?,strategy,Intermediate,"[""Overview of market analysis"", ""Step-by-step implementation"", ""Best practices and tips"", ""Common challenges and solutions"", ""Tools and resources needed"", ""Conclusion and next steps""]","[""analysis"", ""finance"", ""business"", ""market"", ""strategy"", ""economics""]",6,Individual Investors & Analysts,"[""investment planning"", ""portfolio management"", ""financial modeling""]",52,8,2025-10-25 21:37:21,en,How do you protect your {keyword} investments?,0.6,0.6590789941153847,0.38
29200962,financial modeling,economics,What are the regulatory considerations for financial modeling?,evaluation,Beginner,"[""Introduction to financial modeling"", ""Key concepts and definitions"", ""Main categories or types"", ""Examples and case studies"", ""Benefits and advantages"", ""Summary and recommendations""]","[""investment"", ""modeling"", ""financial"", ""evaluation"", ""market"", ""economics""]",6,Students & New Investors,"[""investment planning"", ""portfolio management"", ""market analysis""]",62,8,2025-10-25 21:37:21,en,What are the regulatory considerations for {keyword}?,0.82,0.4770758342438518,0.49
29200963,portfolio management,economics,How do you assess and manage portfolio management risks?,how_to,Expert,"[""Overview of portfolio management"", ""Step-by-step implementation"", ""Best practices and tips"", ""Common challenges and solutions"", ""Tools and resources needed"", ""Conclusion and next steps""]","[""investment"", ""how_to"", ""finance"", ""portfolio"", ""management"", ""economics""]",6,Portfolio Managers & Financial Experts,"[""market analysis"", ""investment planning"", ""financial modeling""]",56,9,2025-10-25 21:37:21,en,How do you assess and manage {keyword} risks?,0.86,1.0,0.34
29200964,market analysis,economics,What are the risks associated with market analysis?,implementation,Beginner,"[""Introduction to market analysis"", ""Key concepts and definitions"", ""Main categories or types"", ""Examples and case studies"", ""Benefits and advantages"", ""Summary and recommendations""]","[""finance"", ""analysis"", ""implementation"", ""market"", ""economics""]",6,Students & New Investors,"[""financial modeling"", ""portfolio management"", ""investment planning""]",51,8,2025-10-25 21:37:21,en,What are the risks associated with {keyword}?,0.87,0.3110418837118892,0.58
29200965,financial modeling,economics,How do you identify opportunities in financial modeling markets?,how_to,Advanced,"[""Overview of financial modeling"", ""Step-by-step implementation"", ""Best practices and tips"", ""Common challenges and solutions"", ""Tools and resources needed"", ""Conclusion and next steps""]","[""how_to"", ""finance"", ""modeling"", ""financial"", ""market"", ""economics""]",6,Professional Investors & Advisors,"[""investment planning"", ""market analysis"", ""portfolio management""]",64,9,2025-10-25 21:37:21,en,How do you identify opportunities in {keyword} markets?,0.92,0.977651006259509,0.32
29200966,portfolio management,economics,How does global economics impact portfolio management?,how_to,Beginner,"[""Introduction to portfolio management"", ""Key points and analysis"", ""Practical examples"", ""Expert insights"", ""Action items"", ""Conclusion""]","[""how_to"", ""finance"", ""portfolio"", ""management"", ""market"", ""economics""]",4,Students & New Investors,"[""investment planning"", ""market analysis"", ""financial modeling""]",54,7,2025-10-25 21:37:21,en,How does global economics impact {keyword}?,0.62,0.4244289169493083,0.68
29200967,content marketing,marketing,What demographics respond best to content marketing?,implementation,Expert,"[""Introduction to content marketing"", ""Key points and analysis"", ""Practical examples"", ""Expert insights"", ""Action items"", ""Conclusion""]","[""content"", ""implementation"", ""marketing"", ""digital"", ""advertising""]",4,Marketing Directors & CMOs,"[""brand management"", ""social media"", ""digital marketing""]",52,7,2025-10-25 21:37:21,en,What demographics respond best to {keyword}?,0.68,1.0,0.31
29200968,content marketing,marketing,What channels are most effective for content marketing?,comparison,Intermediate,"[""Introduction to content marketing"", ""Key points and analysis"", ""Practical examples"", ""Expert insights"", ""Action items"", ""Conclusion""]","[""content"", ""promotion"", ""comparison"", ""marketing"", ""branding""]",4,Marketing Coordinators & Specialists,"[""brand management"", ""social media"", ""digital marketing""]",55,8,2025-10-25 21:37:21,en,What channels are most effective for {keyword}?,0.76,0.6156376239798086,0.82
29200969,financial modeling,economics,What timeline is realistic for financial modeling returns?,planning,Intermediate,"[""Introduction to financial modeling"", ""Key points and analysis"", ""Practical examples"", ""Expert insights"", ""Action items"", ""Conclusion""]","[""investment"", ""planning"", ""modeling"", ""financial"", ""market"", ""economics""]",4,Individual Investors & Analysts,"[""market analysis"", ""investment planning"", ""portfolio management""]",58,8,2025-10-25 21:37:21,en,What timeline is realistic for {keyword} returns?,0.87,0.6257886227106862,0.74
29200970,brand management,marketing,What messaging works best in brand management campaigns?,troubleshooting,Intermediate,"[""Introduction to brand management"", ""Key points and analysis"", ""Practical examples"", ""Expert insights"", ""Action items"", ""Conclusion""]","[""troubleshooting"", ""marketing"", ""management"", ""advertising"", ""branding"", ""brand""]",4,Marketing Coordinators & Specialists,"[""digital marketing"", ""content marketing"", ""social media""]",56,8,2025-10-25 21:37:21,en,What messaging works best in {keyword} campaigns?,0.61,0.7977561150824601,0.7
29200971,machine learning,it,How can machine learning improve system performance and scalability?,how_to,Beginner,"[""Introduction to machine learning"", ""Key points and analysis"", ""Practical examples"", ""Expert insights"", ""Action items"", ""Conclusion""]","[""how_to"", ""software"", ""it"", ""learning"", ""machine"", ""technology""]",4,Students & Entry-level Developers,"[""web development"", ""data science"", ""cloud computing"", ""cybersecurity""]",68,9,2025-10-25 21:37:21,en,How can {keyword} improve system performance and scalability?,0.82,0.4744068381474753,0.48
29200972,cloud computing,it,What is the recommended architecture for cloud computing systems?,analysis,Intermediate,"[""Introduction to cloud computing"", ""Key points and analysis"", ""Practical examples"", ""Expert insights"", ""Action items"", ""Conclusion""]","[""computing"", ""development"", ""analysis"", ""it"", ""programming"", ""cloud""]",4,Junior to Mid-level Developers,"[""data science"", ""cybersecurity"", ""web development"", ""machine learning""]",65,9,2025-10-25 21:37:21,en,What is the recommended architecture for {keyword} systems?,0.83,0.7662392614646206,0.53
29200973,digital marketing,marketing,What messaging works best in digital marketing campaigns?,strategy,Expert,"[""Introduction to digital marketing"", ""Key points and analysis"", ""Practical examples"", ""Expert insights"", ""Action items"", ""Conclusion""]","[""marketing"", ""strategy"", ""advertising"", ""digital""]",4,Marketing Directors & CMOs,"[""brand management"", ""content marketing"", ""social media""]",57,8,2025-10-25 21:37:21,en,What messaging works best in {keyword} campaigns?,0.77,1.0,0.43
29200974,cloud computing,it,What design patterns work best with cloud computing?,how_to,Intermediate,"[""Introduction to cloud computing"", ""Key points and analysis"", ""Practical examples"", ""Expert insights"", ""Action items"", ""Conclusion""]","[""computing"", ""how_to"", ""software"", ""development"", ""it"", ""cloud""]",4,Junior to Mid-level Developers,"[""cybersecurity"", ""machine learning"", ""web development"", ""data science""]",52,8,2025-10-25 21:37:21,en,What design patterns work best with {keyword}?,0.84,0.6845917694769219,0.64
29200975,brand management,marketing,How do you personalize brand management for different segments?,best_practice,Intermediate,"[""Overview of brand management"", ""Step-by-step implementation"", ""Best practices and tips"", ""Common challenges and solutions"", ""Tools and resources needed"", ""Conclusion and next steps""]","[""promotion"", ""best_practice"", ""marketing"", ""management"", ""branding"", ""brand""]",6,Marketing Coordinators & Specialists,"[""content marketing"", ""digital marketing"", ""social media""]",63,9,2025-10-25 21:37:21,en,How do you personalize {keyword} for different segments?,0.86,0.7371720251219351,0.6
29200976,machine learning,it,Which frameworks support machine learning implementation?,analysis,Intermediate,"[""Introduction to machine learning"", ""Key points and analysis"", ""Practical examples"", ""Expert insights"", ""Action items"", ""Conclusion""]","[""software"", ""analysis"", ""it"", ""programming"", ""learning"", ""machine""]",4,Junior to Mid-level Developers,"[""cybersecurity"", ""data science"", ""web development"", ""cloud computing""]",57,6,2025-10-25 21:37:21,en,Which frameworks support {keyword} implementation?,0.66,0.7061874188356205,0.47
29200977,cybersecurity,it,How do you implement cybersecurity in a production environment?,optimization,Expert,"[""Overview of cybersecurity"", ""Step-by-step implementation"", ""Best practices and tips"", ""Common challenges and solutions"", ""Tools and resources needed"", ""Conclusion and next steps""]","[""software"", ""it"", ""optimization"", ""cybersecurity"", ""technology""]",5,Architects & Technical Directors,"[""web development"", ""data science"", ""machine learning"", ""cloud computing""]",63,9,2025-10-25 21:37:21,en,How do you implement {keyword} in a production environment?,0.68,1.0,0.81
29200978,social media,marketing,What content types work best for social media?,analysis,Advanced,"[""Introduction to social media"", ""Key points and analysis"", ""Practical examples"", ""Expert insights"", ""Action items"", ""Conclusion""]","[""analysis"", ""media"", ""marketing"", ""social"", ""advertising"", ""branding""]",4,Marketing Managers & Strategists,"[""brand management"", ""digital marketing"", ""content marketing""]",46,8,2025-10-25 21:37:21,en,What content types work best for {keyword}?,0.88,0.8803282405782159,0.84
29200979,social media,marketing,What are the latest trends in social media?,how_to,Beginner,"[""Introduction to social media"", ""Key concepts and definitions"", ""Main categories or types"", ""Examples and case studies"", ""Benefits and advantages"", ""Summary and recommendations""]","[""how_to"", ""media"", ""promotion"", ""marketing"", ""social"", ""branding""]",6,Marketing Students & Interns,"[""content marketing"", ""digital marketing"", ""brand management""]",43,8,2025-10-25 21:37:21,en,What are the latest trends in {keyword}?,0.66,0.39671730183906717,0.43
29200980,financial modeling,economics,How do you adjust your financial modeling strategy during volatility?,analysis,Expert,"[""Overview of financial modeling"", ""Step-by-step implementation"", ""Best practices and tips"", ""Common challenges and solutions"", ""Tools and resources needed"", ""Conclusion and next steps""]","[""finance"", ""analysis"", ""modeling"", ""financial"", ""market"", ""economics""]",6,Portfolio Managers & Financial Experts,"[""market analysis"", ""portfolio management"", ""investment planning""]",69,10,2025-10-25 21:37:21,en,How do you adjust your {keyword} strategy during volatility?,0.82,1.0,0.36
29200981,market analysis,economics,How do you measure market analysis performance?,evaluation,Expert,"[""Overview of market analysis"", ""Step-by-step implementation"", ""Best practices and tips"", ""Common challenges and solutions"", ""Tools and resources needed"", ""Conclusion and next steps""]","[""investment"", ""analysis"", ""finance"", ""evaluation"", ""market"", ""economics""]",6,Portfolio Managers & Financial Experts,"[""financial modeling"", ""portfolio management"", ""investment planning""]",47,7,2025-10-25 21:37:21,en,How do you measure {keyword} performance?,0.73,1.0,0.65
29200982,cloud computing,it,What security considerations should be taken when using cloud computing?,how_to,Beginner,"[""Introduction to cloud computing"", ""Key points and analysis"", ""Practical examples"", ""Expert insights"", ""Action items"", ""Conclusion""]","[""computing"", ""how_to"", ""software"", ""development"", ""it"", ""cloud""]",4,Students & Entry-level Developers,"[""web development"", ""cybersecurity"", ""data science"", ""machine learning""]",72,10,2025-10-25 21:37:21,en,What security considerations should be taken when using {keyword}?,0.61,0.41431760489512415,0.66
29200983,data science,it,What are the latest trends in data science technology?,comparison,Expert,"[""Introduction to data science"", ""Key concepts and definitions"", ""Main categories or types"", ""Examples and case studies"", ""Benefits and advantages"", ""Summary and recommendations""]","[""technology"", ""it"", ""comparison"", ""programming"", ""science"", ""data""]",6,Architects & Technical Directors,"[""web development"", ""machine learning"", ""cloud computing"", ""cybersecurity""]",54,9,2025-10-25 21:37:21,en,What are the latest trends in {keyword} technology?,0.92,1.0,0.35
29200984,cloud computing,it,How can cloud computing improve system performance and scalability?,comparison,Beginner,"[""Introduction to cloud computing"", ""Key points and analysis"", ""Practical examples"", ""Expert insights"", ""Action items"", ""Conclusion""]","[""computing"", ""software"", ""development"", ""it"", ""comparison"", ""cloud""]",4,Students & Entry-level Developers,"[""web development"", ""data science"", ""cybersecurity"", ""machine learning""]",67,9,2025-10-25 21:37:21,en,How can {keyword} improve system performance and scalability?,0.65,0.453219524504698,0.81
29200985,brand management,marketing,What tools are essential for brand management analytics?,comparison,Intermediate,"[""Introduction to brand management"", ""Key points and analysis"", ""Practical examples"", ""Expert insights"", ""Action items"", ""Conclusion""]","[""promotion"", ""comparison"", ""marketing"", ""management"", ""branding"", ""brand""]",4,Marketing Coordinators & Specialists,"[""content marketing"", ""digital marketing"", ""social media""]",56,8,2025-10-25 21:37:21,en,What tools are essential for {keyword} analytics?,0.63,0.6237870337468443,0.53
29200986,investment planning,economics,What are the risks associated with investment planning?,planning,Expert,"[""Introduction to investment planning"", ""Key concepts and definitions"", ""Main categories or types"", ""Examples and case studies"", ""Benefits and advantages"", ""Summary and recommendations""]","[""market"", ""investment"", ""economics"", ""planning""]",6,Portfolio Managers & Financial Experts,"[""financial modeling"", ""market analysis"", ""portfolio management""]",55,8,2025-10-25 21:37:21,en,What are the risks associated with {keyword}?,0.8,1.0,0.6
29200987,content marketing,marketing,What demographics respond best to content marketing?,troubleshooting,Advanced,"[""Introduction to content marketing"", ""Key points and analysis"", ""Practical examples"", ""Expert insights"", ""Action items"", ""Conclusion""]","[""content"", ""troubleshooting"", ""marketing"", ""advertising"", ""branding""]",4,Marketing Managers & Strategists,"[""social media"", ""brand management"", ""digital marketing""]",52,7,2025-10-25 21:37:21,en,What demographics respond best to {keyword}?,0.67,0.843601507557874,0.59
29200988,market analysis,economics,How do you hedge against market analysis market downturns?,analysis,Expert,"[""Overview of market analysis"", ""Step-by-step implementation"", ""Best practices and tips"", ""Common challenges and solutions"", ""Tools and resources needed"", ""Conclusion and next steps""]","[""market"", ""investment"", ""economics"", ""analysis""]",6,Portfolio Managers & Financial Experts,"[""investment planning"", ""portfolio management"", ""financial modeling""]",58,9,2025-10-25 21:37:21,en,How do you hedge against {keyword} market downturns?,0.66,1.0,0.55
29200989,investment planning,economics,How do you adjust your investment planning strategy during volatility?,strategy,Beginner,"[""Overview of investment planning"", ""Step-by-step implementation"", ""Best practices and tips"", ""Common challenges and solutions"", ""Tools and resources needed"", ""Conclusion and next steps""]","[""investment"", ""planning"", ""business"", ""strategy"", ""economics""]",6,Students & New Investors,"[""financial modeling"", ""market analysis"", ""portfolio management""]",70,10,2025-10-25 21:37:21,en,How do you adjust your {keyword} strategy during volatility?,0.66,0.33017914221450584,0.41
29200990,market analysis,economics,How do you identify opportunities in market analysis markets?,implementation,Expert,"[""Overview of market analysis"", ""Step-by-step implementation"", ""Best practices and tips"", ""Common challenges and solutions"", ""Tools and resources needed"", ""Conclusion and next steps""]","[""investment"", ""analysis"", ""implementation"", ""market"", ""economics""]",6,Portfolio Managers & Financial Experts,"[""portfolio management"", ""investment planning"", ""financial modeling""]",61,9,2025-10-25 21:37:21,en,How do you identify opportunities in {keyword} markets?,0.61,1.0,0.67
29200991,machine learning,it,What skills are needed to master machine learning?,troubleshooting,Beginner,"[""Introduction to machine learning"", ""Key points and analysis"", ""Practical examples"", ""Expert insights"", ""Action items"", ""Conclusion""]","[""development"", ""it"", ""troubleshooting"", ""learning"", ""machine"", ""technology""]",4,Students & Entry-level Developers,"[""cybersecurity"", ""web development"", ""data science"", ""cloud computing""]",50,8,2025-10-25 21:37:21,en,What skills are needed to master {keyword}?,0.9,0.4775624238752416,0.58
29200992,investment planning,economics,How do you assess and manage investment planning risks?,evaluation,Expert,"[""Overview of investment planning"", ""Step-by-step implementation"", ""Best practices and tips"", ""Common challenges and solutions"", ""Tools and resources needed"", ""Conclusion and next steps""]","[""investment"", ""planning"", ""finance"", ""evaluation"", ""market"", ""economics""]",6,Portfolio Managers & Financial Experts,"[""financial modeling"", ""portfolio management"", ""market analysis""]",55,9,2025-10-25 21:37:21,en,How do you assess and manage {keyword} risks?,0.94,1.0,0.78
29200993,investment planning,economics,How do you protect your investment planning investments?,how_to,Expert,"[""Overview of investment planning"", ""Step-by-step implementation"", ""Best practices and tips"", ""Common challenges and solutions"", ""Tools and resources needed"", ""Conclusion and next steps""]","[""investment"", ""how_to"", ""planning"", ""finance"", ""business"", ""economics""]",6,Portfolio Managers & Financial Experts,"[""portfolio management"", ""market analysis"", ""financial modeling""]",56,8,2025-10-25 21:37:21,en,How do you protect your {keyword} investments?,0.77,1.0,0.69
29200994,machine learning,it,What security considerations should be taken when using machine learning?,best_practice,Expert,"[""Introduction to machine learning"", ""Key points and analysis"", ""Practical examples"", ""Expert insights"", ""Action items"", ""Conclusion""]","[""software"", ""it"", ""best_practice"", ""learning"", ""machine"", ""technology""]",4,Architects & Technical Directors,"[""cybersecurity"", ""web development"", ""data science"", ""cloud computing""]",73,10,2025-10-25 21:37:21,en,What security considerations should be taken when using {keyword}?,0.87,1.0,0.81
29200995,digital marketing,marketing,What channels are most effective for digital marketing?,comparison,Advanced,"[""Introduction to digital marketing"", ""Key points and analysis"", ""Practical examples"", ""Expert insights"", ""Action items"", ""Conclusion""]","[""branding"", ""marketing"", ""comparison"", ""digital""]",4,Marketing Managers & Strategists,"[""brand management"", ""content marketing"", ""social media""]",55,8,2025-10-25 21:37:21,en,What channels are most effective for {keyword}?,0.66,0.8363042976282961,0.64
29200996,cybersecurity,it,What are the best practices for cybersecurity development?,optimization,Advanced,"[""Introduction to cybersecurity"", ""Key concepts and definitions"", ""Main categories or types"", ""Examples and case studies"", ""Benefits and advantages"", ""Summary and recommendations""]","[""development"", ""it"", ""programming"", ""optimization"", ""cybersecurity""]",5,Senior Developers & Tech Leads,"[""cloud computing"", ""data science"", ""machine learning"", ""web development""]",58,8,2025-10-25 21:37:21,en,What are the best practices for {keyword} development?,0.81,0.9196103881061027,0.87
29200997,portfolio management,economics,How do you assess and manage portfolio management risks?,analysis,Expert,"[""Overview of portfolio management"", ""Step-by-step implementation"", ""Best practices and tips"", ""Common challenges and solutions"", ""Tools and resources needed"", ""Conclusion and next steps""]","[""analysis"", ""portfolio"", ""management"", ""market"", ""business"", ""economics""]",6,Portfolio Managers & Financial Experts,"[""financial modeling"", ""market analysis"", ""investment planning""]",56,9,2025-10-25 21:37:21,en,How do you assess and manage {keyword} risks?,0.9,1.0,0.65
29200998,investment planning,economics,How do you assess and manage investment planning risks?,troubleshooting,Advanced,"[""Overview of investment planning"", ""Step-by-step implementation"", ""Best practices and tips"", ""Common challenges and solutions"", ""Tools and resources needed"", ""Conclusion and next steps""]","[""investment"", ""planning"", ""troubleshooting"", ""market"", ""business"", ""economics""]",6,Professional Investors & Advisors,"[""market analysis"", ""financial modeling"", ""portfolio management""]",55,9,2025-10-25 21:37:21,en,How do you assess and manage {keyword} risks?,0.82,0.9901909670055485,0.43
29200999,cybersecurity,it,What career opportunities exist in cybersecurity?,optimization,Beginner,"[""Introduction to cybersecurity"", ""Key points and analysis"", ""Practical examples"", ""Expert insights"", ""Action items"", ""Conclusion""]","[""software"", ""it"", ""programming"", ""optimization"", ""cybersecurity""]",4,Students & Entry-level Developers,"[""cloud computing"", ""web development"", ""data science"", ""machine learning""]",49,6,2025-10-25 21:37:21,en,What career opportunities exist in {keyword}?,0.88,0.31019434449007033,0.32
29201000,social media,marketing,How do you track and analyze social media performance?,troubleshooting,Beginner,"[""Overview of social media"", ""Step-by-step implementation"", ""Best practices and tips"", ""Common challenges and solutions"", ""Tools and resources needed"", ""Conclusion and next steps""]","[""media"", ""promotion"", ""troubleshooting"", ""digital"", ""marketing"", ""social""]",6,Marketing Students & Interns,"[""brand management"", ""content marketing"", ""digital marketing""]",54,9,2025-10-25 21:37:21,en,How do you track and analyze {keyword} performance?,0.85,0.3453108353087824,0.79
29201001,brand management,marketing,What messaging works best in brand management campaigns?,analysis,Advanced,"[""Introduction to brand management"", ""Key points and analysis"", ""Practical examples"", ""Expert insights"", ""Action items"", ""Conclusion""]","[""analysis"", ""promotion"", ""marketing"", ""management"", ""digital"", ""brand""]",4,Marketing Managers & Strategists,"[""digital marketing"", ""content marketing"", ""social media""]",56,8,2025-10-25 21:37:21,en,What messaging works best in {keyword} campaigns?,0.75,0.9772402327896497,0.75
29201002,investment planning,economics,What factors should be considered when evaluating investment planning?,how_to,Beginner,"[""Introduction to investment planning"", ""Key points and analysis"", ""Practical examples"", ""Expert insights"", ""Action items"", ""Conclusion""]","[""investment"", ""how_to"", ""planning"", ""finance"", ""business"", ""economics""]",4,Students & New Investors,"[""market analysis"", ""portfolio management"", ""financial modeling""]",70,9,2025-10-25 21:37:21,en,What factors should be considered when evaluating {keyword}?,0.83,0.49865901113185107,0.81
