record_id,keyword,category,question,question_type,difficulty_level,answer_outline,tags,estimated_read_time,target_audience,related_topics,question_length,word_count,created_date,language,source_template,engagement_score,complexity_score,popularity_score
29200350,market analysis,economics,What timeline is realistic for market analysis returns?,strategy,Expert,"[""Introduction to market analysis"", ""Key points and analysis"", ""Practical examples"", ""Expert insights"", ""Action items"", ""Conclusion""]","[""investment"", ""analysis"", ""business"", ""market"", ""strategy"", ""economics""]",4,Portfolio Managers & Financial Experts,"[""portfolio management"", ""investment planning"", ""financial modeling""]",55,8,2025-10-25 21:37:21,en,What timeline is realistic for {keyword} returns?,0.83,1.0,0.75
29200351,brand management,marketing,How do you improve brand management conversion rates?,comparison,Intermediate,"[""Overview of brand management"", ""Step-by-step implementation"", ""Best practices and tips"", ""Common challenges and solutions"", ""Tools and resources needed"", ""Conclusion and next steps""]","[""promotion"", ""comparison"", ""marketing"", ""management"", ""branding"", ""brand""]",6,Marketing Coordinators & Specialists,"[""content marketing"", ""digital marketing"", ""social media""]",53,8,2025-10-25 21:37:21,en,How do you improve {keyword} conversion rates?,0.93,0.6638487118692644,0.84
29200352,financial modeling,economics,How do you create a long-term plan for financial modeling?,strategy,Expert,"[""Overview of financial modeling"", ""Step-by-step implementation"", ""Best practices and tips"", ""Common challenges and solutions"", ""Tools and resources needed"", ""Conclusion and next steps""]","[""investment"", ""finance"", ""modeling"", ""financial"", ""strategy"", ""economics""]",6,Portfolio Managers & Financial Experts,"[""investment planning"", ""portfolio management"", ""market analysis""]",58,10,2025-10-25 21:37:21,en,How do you create a long-term plan for {keyword}?,0.76,1.0,0.88
29200353,market analysis,economics,What are the seasonal patterns in market analysis?,implementation,Beginner,"[""Introduction to market analysis"", ""Key concepts and definitions"", ""Main categories or types"", ""Examples and case studies"", ""Benefits and advantages"", ""Summary and recommendations""]","[""finance"", ""analysis"", ""implementation"", ""market"", ""business"", ""economics""]",6,Students & New Investors,"[""portfolio management"", ""financial modeling"", ""investment planning""]",50,8,2025-10-25 21:37:21,en,What are the seasonal patterns in {keyword}?,0.94,0.36059196457840786,0.39
29200354,machine learning,it,How do you stay updated with machine learning developments?,how_to,Expert,"[""Overview of machine learning"", ""Step-by-step implementation"", ""Best practices and tips"", ""Common challenges and solutions"", ""Tools and resources needed"", ""Conclusion and next steps""]","[""how_to"", ""development"", ""it"", ""learning"", ""machine"", ""technology""]",6,Architects & Technical Directors,"[""data science"", ""web development"", ""cybersecurity"", ""cloud computing""]",59,9,2025-10-25 21:37:21,en,How do you stay updated with {keyword} developments?,0.83,1.0,0.77
29200355,data science,it,What are the best practices for data science development?,troubleshooting,Advanced,"[""Introduction to data science"", ""Key concepts and definitions"", ""Main categories or types"", ""Examples and case studies"", ""Benefits and advantages"", ""Summary and recommendations""]","[""technology"", ""it"", ""programming"", ""troubleshooting"", ""science"", ""data""]",6,Senior Developers & Tech Leads,"[""machine learning"", ""cybersecurity"", ""web development"", ""cloud computing""]",57,9,2025-10-25 21:37:21,en,What are the best practices for {keyword} development?,0.84,0.8212280810251986,0.86
29200356,market analysis,economics,What timeline is realistic for market analysis returns?,comparison,Advanced,"[""Introduction to market analysis"", ""Key points and analysis"", ""Practical examples"", ""Expert insights"", ""Action items"", ""Conclusion""]","[""investment"", ""analysis"", ""finance"", ""comparison"", ""market"", ""economics""]",4,Professional Investors & Advisors,"[""financial modeling"", ""investment planning"", ""portfolio management""]",55,8,2025-10-25 21:37:21,en,What timeline is realistic for {keyword} returns?,0.65,0.971108295198269,0.35
29200357,market analysis,economics,How do economic conditions affect market analysis performance?,comparison,Beginner,"[""Introduction to market analysis"", ""Key points and analysis"", ""Practical examples"", ""Expert insights"", ""Action items"", ""Conclusion""]","[""investment"", ""analysis"", ""comparison"", ""market"", ""economics""]",4,Students & New Investors,"[""financial modeling"", ""investment planning"", ""portfolio management""]",62,8,2025-10-25 21:37:21,en,How do economic conditions affect {keyword} performance?,0.66,0.39560122068202497,0.65
29200358,social media,marketing,What does the future hold for social media?,implementation,Intermediate,"[""Introduction to social media"", ""Key points and analysis"", ""Practical examples"", ""Expert insights"", ""Action items"", ""Conclusion""]","[""media"", ""implementation"", ""promotion"", ""marketing"", ""digital"", ""social""]",4,Marketing Coordinators & Specialists,"[""brand management"", ""digital marketing"", ""content marketing""]",43,8,2025-10-25 21:37:21,en,What does the future hold for {keyword}?,0.71,0.7713819178375685,0.71
29200359,cybersecurity,it,What ROI can be expected from cybersecurity implementation?,planning,Advanced,"[""Introduction to cybersecurity"", ""Key points and analysis"", ""Practical examples"", ""Expert insights"", ""Action items"", ""Conclusion""]","[""software"", ""planning"", ""it"", ""cybersecurity"", ""technology""]",4,Senior Developers & Tech Leads,"[""cloud computing"", ""machine learning"", ""data science"", ""web development""]",59,8,2025-10-25 21:37:21,en,What ROI can be expected from {keyword} implementation?,0.92,0.8366693745428239,0.79
29200360,cybersecurity,it,How do you integrate cybersecurity with existing systems?,evaluation,Expert,"[""Overview of cybersecurity"", ""Step-by-step implementation"", ""Best practices and tips"", ""Common challenges and solutions"", ""Tools and resources needed"", ""Conclusion and next steps""]","[""it"", ""programming"", ""evaluation"", ""cybersecurity"", ""technology""]",5,Architects & Technical Directors,"[""machine learning"", ""cloud computing"", ""data science"", ""web development""]",57,8,2025-10-25 21:37:21,en,How do you integrate {keyword} with existing systems?,0.8,1.0,0.81
29200361,cloud computing,it,What career opportunities exist in cloud computing?,planning,Advanced,"[""Introduction to cloud computing"", ""Key points and analysis"", ""Practical examples"", ""Expert insights"", ""Action items"", ""Conclusion""]","[""computing"", ""software"", ""planning"", ""it"", ""programming"", ""cloud""]",4,Senior Developers & Tech Leads,"[""cybersecurity"", ""machine learning"", ""web development"", ""data science""]",51,7,2025-10-25 21:37:21,en,What career opportunities exist in {keyword}?,0.89,0.9757754895743492,0.88
29200362,market analysis,economics,What tools help analyze market analysis data?,planning,Intermediate,"[""Introduction to market analysis"", ""Key points and analysis"", ""Practical examples"", ""Expert insights"", ""Action items"", ""Conclusion""]","[""planning"", ""finance"", ""analysis"", ""market"", ""economics""]",4,Individual Investors & Analysts,"[""financial modeling"", ""investment planning"", ""portfolio management""]",45,7,2025-10-25 21:37:21,en,What tools help analyze {keyword} data?,0.69,0.6388415640071123,0.4
29200363,brand management,marketing,How do you identify the right audience for brand management?,implementation,Beginner,"[""Overview of brand management"", ""Step-by-step implementation"", ""Best practices and tips"", ""Common challenges and solutions"", ""Tools and resources needed"", ""Conclusion and next steps""]","[""implementation"", ""promotion"", ""marketing"", ""management"", ""advertising"", ""brand""]",6,Marketing Students & Interns,"[""content marketing"", ""social media"", ""digital marketing""]",60,10,2025-10-25 21:37:21,en,How do you identify the right audience for {keyword}?,0.9,0.43279537625909936,0.8
29200364,machine learning,it,What are the cost considerations for machine learning?,analysis,Beginner,"[""Introduction to machine learning"", ""Key concepts and definitions"", ""Main categories or types"", ""Examples and case studies"", ""Benefits and advantages"", ""Summary and recommendations""]","[""software"", ""analysis"", ""it"", ""programming"", ""learning"", ""machine""]",6,Students & Entry-level Developers,"[""cybersecurity"", ""cloud computing"", ""web development"", ""data science""]",54,8,2025-10-25 21:37:21,en,What are the cost considerations for {keyword}?,0.7,0.406027643994923,0.43
29200365,content marketing,marketing,What does the future hold for content marketing?,comparison,Expert,"[""Introduction to content marketing"", ""Key points and analysis"", ""Practical examples"", ""Expert insights"", ""Action items"", ""Conclusion""]","[""content"", ""comparison"", ""marketing"", ""digital"", ""branding""]",4,Marketing Directors & CMOs,"[""digital marketing"", ""social media"", ""brand management""]",48,8,2025-10-25 21:37:21,en,What does the future hold for {keyword}?,0.68,1.0,0.35
29200366,web development,it,What certifications are valuable for web development professionals?,best_practice,Beginner,"[""Introduction to web development"", ""Key points and analysis"", ""Practical examples"", ""Expert insights"", ""Action items"", ""Conclusion""]","[""technology"", ""development"", ""it"", ""best_practice"", ""programming"", ""web""]",4,Students & Entry-level Developers,"[""machine learning"", ""cloud computing"", ""data science"", ""cybersecurity""]",67,8,2025-10-25 21:37:21,en,What certifications are valuable for {keyword} professionals?,0.82,0.41332849774180125,0.59
29200367,investment planning,economics,How do you hedge against investment planning market downturns?,optimization,Advanced,"[""Overview of investment planning"", ""Step-by-step implementation"", ""Best practices and tips"", ""Common challenges and solutions"", ""Tools and resources needed"", ""Conclusion and next steps""]","[""investment"", ""planning"", ""business"", ""optimization"", ""economics""]",6,Professional Investors & Advisors,"[""portfolio management"", ""market analysis"", ""financial modeling""]",62,9,2025-10-25 21:37:21,en,How do you hedge against {keyword} market downturns?,0.64,0.995915402385326,0.68
29200368,content marketing,marketing,How do you personalize content marketing for different segments?,comparison,Expert,"[""Overview of content marketing"", ""Step-by-step implementation"", ""Best practices and tips"", ""Common challenges and solutions"", ""Tools and resources needed"", ""Conclusion and next steps""]","[""content"", ""comparison"", ""digital"", ""marketing"", ""branding""]",6,Marketing Directors & CMOs,"[""digital marketing"", ""brand management"", ""social media""]",64,9,2025-10-25 21:37:21,en,How do you personalize {keyword} for different segments?,0.62,1.0,0.45
29200369,brand management,marketing,What content types work best for brand management?,how_to,Beginner,"[""Introduction to brand management"", ""Key points and analysis"", ""Practical examples"", ""Expert insights"", ""Action items"", ""Conclusion""]","[""how_to"", ""promotion"", ""marketing"", ""management"", ""digital"", ""brand""]",4,Marketing Students & Interns,"[""digital marketing"", ""content marketing"", ""social media""]",50,8,2025-10-25 21:37:21,en,What content types work best for {keyword}?,0.86,0.4491796953145982,0.73
29200370,cloud computing,it,What certifications are valuable for cloud computing professionals?,implementation,Beginner,"[""Introduction to cloud computing"", ""Key points and analysis"", ""Practical examples"", ""Expert insights"", ""Action items"", ""Conclusion""]","[""computing"", ""software"", ""development"", ""it"", ""implementation"", ""cloud""]",4,Students & Entry-level Developers,"[""data science"", ""cybersecurity"", ""machine learning"", ""web development""]",67,8,2025-10-25 21:37:21,en,What certifications are valuable for {keyword} professionals?,0.71,0.48812428778878947,0.57
29200371,brand management,marketing,How do you innovate within brand management?,comparison,Expert,"[""Overview of brand management"", ""Step-by-step implementation"", ""Best practices and tips"", ""Common challenges and solutions"", ""Tools and resources needed"", ""Conclusion and next steps""]","[""promotion"", ""comparison"", ""marketing"", ""management"", ""advertising"", ""brand""]",6,Marketing Directors & CMOs,"[""social media"", ""digital marketing"", ""content marketing""]",44,7,2025-10-25 21:37:21,en,How do you innovate within {keyword}?,0.65,1.0,0.56
29200372,machine learning,it,How do you implement machine learning in a production environment?,comparison,Beginner,"[""Overview of machine learning"", ""Step-by-step implementation"", ""Best practices and tips"", ""Common challenges and solutions"", ""Tools and resources needed"", ""Conclusion and next steps""]","[""software"", ""it"", ""comparison"", ""learning"", ""machine"", ""technology""]",6,Students & Entry-level Developers,"[""web development"", ""cloud computing"", ""data science"", ""cybersecurity""]",66,10,2025-10-25 21:37:21,en,How do you implement {keyword} in a production environment?,0.82,0.3576062878903773,0.84
29200373,digital marketing,marketing,How do you optimize digital marketing for mobile users?,best_practice,Advanced,"[""Overview of digital marketing"", ""Step-by-step implementation"", ""Best practices and tips"", ""Common challenges and solutions"", ""Tools and resources needed"", ""Conclusion and next steps""]","[""promotion"", ""best_practice"", ""marketing"", ""digital"", ""advertising""]",6,Marketing Managers & Strategists,"[""content marketing"", ""brand management"", ""social media""]",55,9,2025-10-25 21:37:21,en,How do you optimize {keyword} for mobile users?,0.8,0.9773164307958321,0.65
29200374,brand management,marketing,How do you reach new customers through brand management?,strategy,Advanced,"[""Overview of brand management"", ""Step-by-step implementation"", ""Best practices and tips"", ""Common challenges and solutions"", ""Tools and resources needed"", ""Conclusion and next steps""]","[""marketing"", ""management"", ""digital"", ""branding"", ""strategy"", ""brand""]",6,Marketing Managers & Strategists,"[""digital marketing"", ""social media"", ""content marketing""]",56,9,2025-10-25 21:37:21,en,How do you reach new customers through {keyword}?,0.92,0.9926737443478605,0.32
29200375,data science,it,What career opportunities exist in data science?,analysis,Advanced,"[""Introduction to data science"", ""Key points and analysis"", ""Practical examples"", ""Expert insights"", ""Action items"", ""Conclusion""]","[""technology"", ""analysis"", ""it"", ""programming"", ""science"", ""data""]",4,Senior Developers & Tech Leads,"[""cybersecurity"", ""machine learning"", ""cloud computing"", ""web development""]",48,7,2025-10-25 21:37:21,en,What career opportunities exist in {keyword}?,0.63,0.9088351907774169,0.36
29200376,market analysis,economics,How do you identify opportunities in market analysis markets?,strategy,Beginner,"[""Overview of market analysis"", ""Step-by-step implementation"", ""Best practices and tips"", ""Common challenges and solutions"", ""Tools and resources needed"", ""Conclusion and next steps""]","[""investment"", ""analysis"", ""business"", ""market"", ""strategy"", ""economics""]",6,Students & New Investors,"[""investment planning"", ""financial modeling"", ""portfolio management""]",61,9,2025-10-25 21:37:21,en,How do you identify opportunities in {keyword} markets?,0.83,0.3355908116452264,0.87
29200377,cybersecurity,it,What skills are needed to master cybersecurity?,troubleshooting,Expert,"[""Introduction to cybersecurity"", ""Key points and analysis"", ""Practical examples"", ""Expert insights"", ""Action items"", ""Conclusion""]","[""software"", ""development"", ""it"", ""troubleshooting"", ""cybersecurity""]",4,Architects & Technical Directors,"[""cloud computing"", ""web development"", ""machine learning"", ""data science""]",47,7,2025-10-25 21:37:21,en,What skills are needed to master {keyword}?,0.63,1.0,0.64
29200378,brand management,marketing,What emerging platforms support brand management?,how_to,Advanced,"[""Introduction to brand management"", ""Key points and analysis"", ""Practical examples"", ""Expert insights"", ""Action items"", ""Conclusion""]","[""how_to"", ""promotion"", ""marketing"", ""management"", ""advertising"", ""brand""]",4,Marketing Managers & Strategists,"[""content marketing"", ""social media"", ""digital marketing""]",49,6,2025-10-25 21:37:21,en,What emerging platforms support {keyword}?,0.93,0.9911999606219855,0.86
29200379,content marketing,marketing,What are the latest trends in content marketing?,best_practice,Intermediate,"[""Introduction to content marketing"", ""Key concepts and definitions"", ""Main categories or types"", ""Examples and case studies"", ""Benefits and advantages"", ""Summary and recommendations""]","[""content"", ""promotion"", ""best_practice"", ""marketing"", ""branding""]",6,Marketing Coordinators & Specialists,"[""social media"", ""digital marketing"", ""brand management""]",48,8,2025-10-25 21:37:21,en,What are the latest trends in {keyword}?,0.68,0.6954154565840664,0.35
29200380,financial modeling,economics,How do you hedge against financial modeling market downturns?,planning,Intermediate,"[""Overview of financial modeling"", ""Step-by-step implementation"", ""Best practices and tips"", ""Common challenges and solutions"", ""Tools and resources needed"", ""Conclusion and next steps""]","[""planning"", ""finance"", ""modeling"", ""financial"", ""business"", ""economics""]",6,Individual Investors & Analysts,"[""market analysis"", ""portfolio management"", ""investment planning""]",61,9,2025-10-25 21:37:21,en,How do you hedge against {keyword} market downturns?,0.75,0.6373298214597994,0.32
29200381,brand management,marketing,What A/B tests should you run for brand management?,optimization,Advanced,"[""Introduction to brand management"", ""Key points and analysis"", ""Practical examples"", ""Expert insights"", ""Action items"", ""Conclusion""]","[""marketing"", ""management"", ""digital"", ""branding"", ""optimization"", ""brand""]",4,Marketing Managers & Strategists,"[""digital marketing"", ""content marketing"", ""social media""]",51,9,2025-10-25 21:37:21,en,What A/B tests should you run for {keyword}?,0.67,0.9417701253383273,0.8
29200382,brand management,marketing,What content types work best for brand management?,best_practice,Beginner,"[""Introduction to brand management"", ""Key points and analysis"", ""Practical examples"", ""Expert insights"", ""Action items"", ""Conclusion""]","[""best_practice"", ""marketing"", ""management"", ""digital"", ""branding"", ""brand""]",4,Marketing Students & Interns,"[""social media"", ""digital marketing"", ""content marketing""]",50,8,2025-10-25 21:37:21,en,What content types work best for {keyword}?,0.7,0.31175833512430895,0.31
29200383,web development,it,How do you stay updated with web development developments?,troubleshooting,Intermediate,"[""Overview of web development"", ""Step-by-step implementation"", ""Best practices and tips"", ""Common challenges and solutions"", ""Tools and resources needed"", ""Conclusion and next steps""]","[""development"", ""web"", ""it"", ""troubleshooting"", ""technology""]",6,Junior to Mid-level Developers,"[""data science"", ""cloud computing"", ""cybersecurity"", ""machine learning""]",58,9,2025-10-25 21:37:21,en,How do you stay updated with {keyword} developments?,0.89,0.7610631646128886,0.72
29200384,cybersecurity,it,What ROI can be expected from cybersecurity implementation?,planning,Intermediate,"[""Introduction to cybersecurity"", ""Key points and analysis"", ""Practical examples"", ""Expert insights"", ""Action items"", ""Conclusion""]","[""planning"", ""development"", ""it"", ""cybersecurity"", ""technology""]",4,Junior to Mid-level Developers,"[""machine learning"", ""web development"", ""cloud computing"", ""data science""]",59,8,2025-10-25 21:37:21,en,What ROI can be expected from {keyword} implementation?,0.85,0.6095467594100876,0.55
29200385,cybersecurity,it,What tools are essential for cybersecurity development?,analysis,Intermediate,"[""Introduction to cybersecurity"", ""Key points and analysis"", ""Practical examples"", ""Expert insights"", ""Action items"", ""Conclusion""]","[""software"", ""development"", ""analysis"", ""it"", ""cybersecurity""]",4,Junior to Mid-level Developers,"[""data science"", ""cloud computing"", ""machine learning"", ""web development""]",55,7,2025-10-25 21:37:21,en,What tools are essential for {keyword} development?,0.67,0.7936082917599565,0.43
29200386,data science,it,What skills are needed to master data science?,evaluation,Beginner,"[""Introduction to data science"", ""Key points and analysis"", ""Practical examples"", ""Expert insights"", ""Action items"", ""Conclusion""]","[""software"", ""development"", ""it"", ""science"", ""evaluation"", ""data""]",4,Students & Entry-level Developers,"[""cloud computing"", ""cybersecurity"", ""web development"", ""machine learning""]",46,8,2025-10-25 21:37:21,en,What skills are needed to master {keyword}?,0.78,0.4367083573651119,0.89
29200387,machine learning,it,What design patterns work best with machine learning?,evaluation,Beginner,"[""Introduction to machine learning"", ""Key points and analysis"", ""Practical examples"", ""Expert insights"", ""Action items"", ""Conclusion""]","[""software"", ""it"", ""programming"", ""learning"", ""evaluation"", ""machine""]",4,Students & Entry-level Developers,"[""data science"", ""cloud computing"", ""cybersecurity"", ""web development""]",53,8,2025-10-25 21:37:21,en,What design patterns work best with {keyword}?,0.74,0.43551311843453844,0.52
29200388,cloud computing,it,What are the cost considerations for cloud computing?,comparison,Advanced,"[""Introduction to cloud computing"", ""Key concepts and definitions"", ""Main categories or types"", ""Examples and case studies"", ""Benefits and advantages"", ""Summary and recommendations""]","[""computing"", ""software"", ""development"", ""it"", ""comparison"", ""cloud""]",6,Senior Developers & Tech Leads,"[""cybersecurity"", ""data science"", ""web development"", ""machine learning""]",53,8,2025-10-25 21:37:21,en,What are the cost considerations for {keyword}?,0.91,0.8985767065617883,0.74
29200389,content marketing,marketing,How do you personalize content marketing for different segments?,planning,Expert,"[""Overview of content marketing"", ""Step-by-step implementation"", ""Best practices and tips"", ""Common challenges and solutions"", ""Tools and resources needed"", ""Conclusion and next steps""]","[""planning"", ""content"", ""marketing"", ""digital"", ""advertising""]",6,Marketing Directors & CMOs,"[""brand management"", ""digital marketing"", ""social media""]",64,9,2025-10-25 21:37:21,en,How do you personalize {keyword} for different segments?,0.9,1.0,0.77
29200390,cloud computing,it,How do you measure the success of cloud computing projects?,strategy,Advanced,"[""Overview of cloud computing"", ""Step-by-step implementation"", ""Best practices and tips"", ""Common challenges and solutions"", ""Tools and resources needed"", ""Conclusion and next steps""]","[""computing"", ""software"", ""cloud"", ""it"", ""development"", ""strategy""]",6,Senior Developers & Tech Leads,"[""cybersecurity"", ""machine learning"", ""data science"", ""web development""]",59,10,2025-10-25 21:37:21,en,How do you measure the success of {keyword} projects?,0.94,0.9924231165525668,0.84
29200391,cybersecurity,it,How do you get started with cybersecurity as a beginner?,analysis,Advanced,"[""Overview of cybersecurity"", ""Step-by-step implementation"", ""Best practices and tips"", ""Common challenges and solutions"", ""Tools and resources needed"", ""Conclusion and next steps""]","[""development"", ""analysis"", ""it"", ""programming"", ""cybersecurity""]",5,Senior Developers & Tech Leads,"[""cloud computing"", ""web development"", ""machine learning"", ""data science""]",56,10,2025-10-25 21:37:21,en,How do you get started with {keyword} as a beginner?,0.64,0.8639729097224031,0.45
29200392,social media,marketing,What timing strategies work for social media?,analysis,Expert,"[""Introduction to social media"", ""Key points and analysis"", ""Practical examples"", ""Expert insights"", ""Action items"", ""Conclusion""]","[""analysis"", ""media"", ""marketing"", ""social"", ""advertising"", ""branding""]",4,Marketing Directors & CMOs,"[""brand management"", ""content marketing"", ""digital marketing""]",45,7,2025-10-25 21:37:21,en,What timing strategies work for {keyword}?,0.64,1.0,0.52
29200393,content marketing,marketing,What timing strategies work for content marketing?,optimization,Intermediate,"[""Introduction to content marketing"", ""Key points and analysis"", ""Practical examples"", ""Expert insights"", ""Action items"", ""Conclusion""]","[""content"", ""promotion"", ""marketing"", ""branding"", ""optimization""]",4,Marketing Coordinators & Specialists,"[""social media"", ""brand management"", ""digital marketing""]",50,7,2025-10-25 21:37:21,en,What timing strategies work for {keyword}?,0.68,0.7028707451773016,0.83
