record_id,keyword,category,question,question_type,difficulty_level,answer_outline,tags,estimated_read_time,target_audience,related_topics,question_length,word_count,created_date,language,source_template,engagement_score,complexity_score,popularity_score
36800652,market analysis,economics,How does global economics impact market analysis?,evaluation,Expert,"[""Introduction to market analysis"", ""Key points and analysis"", ""Practical examples"", ""Expert insights"", ""Action items"", ""Conclusion""]","[""analysis"", ""finance"", ""evaluation"", ""market"", ""business"", ""economics""]",4,Portfolio Managers & Financial Experts,"[""investment planning"", ""financial modeling"", ""portfolio management""]",49,7,2025-10-25 21:47:59,en,How does global economics impact {keyword}?,0.79,1.0,0.55
36800653,cybersecurity,it,How does cybersecurity impact business operations?,optimization,Intermediate,"[""Introduction to cybersecurity"", ""Key points and analysis"", ""Practical examples"", ""Expert insights"", ""Action items"", ""Conclusion""]","[""software"", ""it"", ""optimization"", ""cybersecurity"", ""technology""]",4,Junior to Mid-level Developers,"[""web development"", ""machine learning"", ""data science"", ""cloud computing""]",50,6,2025-10-25 21:47:59,en,How does {keyword} impact business operations?,0.74,0.6557072663231401,0.63
36800654,content marketing,marketing,What A/B tests should you run for content marketing?,comparison,Expert,"[""Introduction to content marketing"", ""Key points and analysis"", ""Practical examples"", ""Expert insights"", ""Action items"", ""Conclusion""]","[""content"", ""comparison"", ""marketing"", ""digital"", ""advertising""]",4,Marketing Directors & CMOs,"[""brand management"", ""digital marketing"", ""social media""]",52,9,2025-10-25 21:47:59,en,What A/B tests should you run for {keyword}?,0.84,1.0,0.57
36800655,market analysis,economics,What metrics are most important for market analysis?,comparison,Beginner,"[""Introduction to market analysis"", ""Key points and analysis"", ""Practical examples"", ""Expert insights"", ""Action items"", ""Conclusion""]","[""investment"", ""analysis"", ""comparison"", ""market"", ""economics""]",4,Students & New Investors,"[""portfolio management"", ""financial modeling"", ""investment planning""]",52,8,2025-10-25 21:47:59,en,What metrics are most important for {keyword}?,0.61,0.4119249606812595,0.78
36800656,content marketing,marketing,How do you automate content marketing processes?,implementation,Advanced,"[""Overview of content marketing"", ""Step-by-step implementation"", ""Best practices and tips"", ""Common challenges and solutions"", ""Tools and resources needed"", ""Conclusion and next steps""]","[""content"", ""implementation"", ""marketing"", ""digital"", ""branding""]",6,Marketing Managers & Strategists,"[""brand management"", ""digital marketing"", ""social media""]",48,7,2025-10-25 21:47:59,en,How do you automate {keyword} processes?,0.93,0.9633960877704739,0.31
36800657,market analysis,economics,What factors should be considered when evaluating market analysis?,implementation,Expert,"[""Introduction to market analysis"", ""Key points and analysis"", ""Practical examples"", ""Expert insights"", ""Action items"", ""Conclusion""]","[""finance"", ""analysis"", ""implementation"", ""market"", ""economics""]",4,Portfolio Managers & Financial Experts,"[""investment planning"", ""financial modeling"", ""portfolio management""]",66,9,2025-10-25 21:47:59,en,What factors should be considered when evaluating {keyword}?,0.81,1.0,0.78
36800658,brand management,marketing,What does the future hold for brand management?,best_practice,Expert,"[""Introduction to brand management"", ""Key points and analysis"", ""Practical examples"", ""Expert insights"", ""Action items"", ""Conclusion""]","[""promotion"", ""best_practice"", ""marketing"", ""management"", ""advertising"", ""brand""]",4,Marketing Directors & CMOs,"[""digital marketing"", ""social media"", ""content marketing""]",47,8,2025-10-25 21:47:59,en,What does the future hold for {keyword}?,0.89,1.0,0.39
36800659,portfolio management,economics,What indicators predict portfolio management market movements?,best_practice,Beginner,"[""Introduction to portfolio management"", ""Key points and analysis"", ""Practical examples"", ""Expert insights"", ""Action items"", ""Conclusion""]","[""investment"", ""finance"", ""portfolio"", ""best_practice"", ""management"", ""economics""]",4,Students & New Investors,"[""market analysis"", ""investment planning"", ""financial modeling""]",62,7,2025-10-25 21:47:59,en,What indicators predict {keyword} market movements?,0.65,0.36076531871838907,0.86
36800660,market analysis,economics,What are the seasonal patterns in market analysis?,evaluation,Intermediate,"[""Introduction to market analysis"", ""Key concepts and definitions"", ""Main categories or types"", ""Examples and case studies"", ""Benefits and advantages"", ""Summary and recommendations""]","[""finance"", ""analysis"", ""evaluation"", ""market"", ""economics""]",6,Individual Investors & Analysts,"[""portfolio management"", ""financial modeling"", ""investment planning""]",50,8,2025-10-25 21:47:59,en,What are the seasonal patterns in {keyword}?,0.92,0.6683293121049992,0.75
36800661,investment planning,economics,How do you adjust your investment planning strategy during volatility?,strategy,Intermediate,"[""Overview of investment planning"", ""Step-by-step implementation"", ""Best practices and tips"", ""Common challenges and solutions"", ""Tools and resources needed"", ""Conclusion and next steps""]","[""investment"", ""planning"", ""market"", ""strategy"", ""economics""]",6,Individual Investors & Analysts,"[""portfolio management"", ""market analysis"", ""financial modeling""]",70,10,2025-10-25 21:47:59,en,How do you adjust your {keyword} strategy during volatility?,0.84,0.7639608058095182,0.39
36800662,financial modeling,economics,How do you assess and manage financial modeling risks?,implementation,Intermediate,"[""Overview of financial modeling"", ""Step-by-step implementation"", ""Best practices and tips"", ""Common challenges and solutions"", ""Tools and resources needed"", ""Conclusion and next steps""]","[""investment"", ""finance"", ""implementation"", ""modeling"", ""financial"", ""economics""]",6,Individual Investors & Analysts,"[""investment planning"", ""portfolio management"", ""market analysis""]",54,9,2025-10-25 21:47:59,en,How do you assess and manage {keyword} risks?,0.87,0.6527071275803409,0.5
36800663,social media,marketing,How do you personalize social media for different segments?,optimization,Beginner,"[""Overview of social media"", ""Step-by-step implementation"", ""Best practices and tips"", ""Common challenges and solutions"", ""Tools and resources needed"", ""Conclusion and next steps""]","[""media"", ""marketing"", ""digital"", ""social"", ""branding"", ""optimization""]",6,Marketing Students & Interns,"[""content marketing"", ""brand management"", ""digital marketing""]",59,9,2025-10-25 21:47:59,en,How do you personalize {keyword} for different segments?,0.88,0.368581653675537,0.38
36800664,portfolio management,economics,What are the regulatory considerations for portfolio management?,optimization,Beginner,"[""Introduction to portfolio management"", ""Key concepts and definitions"", ""Main categories or types"", ""Examples and case studies"", ""Benefits and advantages"", ""Summary and recommendations""]","[""investment"", ""finance"", ""portfolio"", ""management"", ""optimization"", ""economics""]",6,Students & New Investors,"[""market analysis"", ""financial modeling"", ""investment planning""]",64,8,2025-10-25 21:47:59,en,What are the regulatory considerations for {keyword}?,0.76,0.4604811584397139,0.69
36800665,financial modeling,economics,What are the regulatory considerations for financial modeling?,implementation,Intermediate,"[""Introduction to financial modeling"", ""Key concepts and definitions"", ""Main categories or types"", ""Examples and case studies"", ""Benefits and advantages"", ""Summary and recommendations""]","[""investment"", ""finance"", ""implementation"", ""modeling"", ""financial"", ""economics""]",6,Individual Investors & Analysts,"[""market analysis"", ""investment planning"", ""portfolio management""]",62,8,2025-10-25 21:47:59,en,What are the regulatory considerations for {keyword}?,0.72,0.7402416817573125,0.79
36800666,cloud computing,it,What are the best practices for cloud computing development?,implementation,Expert,"[""Introduction to cloud computing"", ""Key concepts and definitions"", ""Main categories or types"", ""Examples and case studies"", ""Benefits and advantages"", ""Summary and recommendations""]","[""computing"", ""software"", ""it"", ""implementation"", ""cloud"", ""technology""]",6,Architects & Technical Directors,"[""web development"", ""data science"", ""cybersecurity"", ""machine learning""]",60,9,2025-10-25 21:47:59,en,What are the best practices for {keyword} development?,0.88,1.0,0.59
36800667,web development,it,How do you implement web development in a production environment?,implementation,Intermediate,"[""Overview of web development"", ""Step-by-step implementation"", ""Best practices and tips"", ""Common challenges and solutions"", ""Tools and resources needed"", ""Conclusion and next steps""]","[""software"", ""development"", ""it"", ""implementation"", ""programming"", ""web""]",6,Junior to Mid-level Developers,"[""data science"", ""cloud computing"", ""machine learning"", ""cybersecurity""]",65,10,2025-10-25 21:47:59,en,How do you implement {keyword} in a production environment?,0.6,0.7557681723511411,0.59
36800668,machine learning,it,What ROI can be expected from machine learning implementation?,strategy,Expert,"[""Introduction to machine learning"", ""Key points and analysis"", ""Practical examples"", ""Expert insights"", ""Action items"", ""Conclusion""]","[""development"", ""it"", ""programming"", ""learning"", ""strategy"", ""machine""]",4,Architects & Technical Directors,"[""web development"", ""data science"", ""cybersecurity"", ""cloud computing""]",62,9,2025-10-25 21:47:59,en,What ROI can be expected from {keyword} implementation?,0.7,1.0,0.52
36800669,cybersecurity,it,How do you get started with cybersecurity as a beginner?,troubleshooting,Expert,"[""Overview of cybersecurity"", ""Step-by-step implementation"", ""Best practices and tips"", ""Common challenges and solutions"", ""Tools and resources needed"", ""Conclusion and next steps""]","[""development"", ""it"", ""programming"", ""troubleshooting"", ""cybersecurity""]",5,Architects & Technical Directors,"[""web development"", ""cloud computing"", ""machine learning"", ""data science""]",56,10,2025-10-25 21:47:59,en,How do you get started with {keyword} as a beginner?,0.62,1.0,0.66
36800670,content marketing,marketing,How do you measure the ROI of content marketing campaigns?,strategy,Advanced,"[""Overview of content marketing"", ""Step-by-step implementation"", ""Best practices and tips"", ""Common challenges and solutions"", ""Tools and resources needed"", ""Conclusion and next steps""]","[""content"", ""marketing"", ""advertising"", ""branding"", ""strategy""]",6,Marketing Managers & Strategists,"[""social media"", ""digital marketing"", ""brand management""]",58,10,2025-10-25 21:47:59,en,How do you measure the ROI of {keyword} campaigns?,0.87,0.9396947126843894,0.37
36800671,web development,it,What security considerations should be taken when using web development?,best_practice,Intermediate,"[""Introduction to web development"", ""Key points and analysis"", ""Practical examples"", ""Expert insights"", ""Action items"", ""Conclusion""]","[""software"", ""development"", ""it"", ""best_practice"", ""programming"", ""web""]",4,Junior to Mid-level Developers,"[""data science"", ""machine learning"", ""cloud computing"", ""cybersecurity""]",72,10,2025-10-25 21:47:59,en,What security considerations should be taken when using {keyword}?,0.94,0.6750795411529936,0.55
36800672,web development,it,What ROI can be expected from web development implementation?,troubleshooting,Advanced,"[""Introduction to web development"", ""Key points and analysis"", ""Practical examples"", ""Expert insights"", ""Action items"", ""Conclusion""]","[""software"", ""development"", ""it"", ""troubleshooting"", ""web""]",4,Senior Developers & Tech Leads,"[""machine learning"", ""data science"", ""cloud computing"", ""cybersecurity""]",61,9,2025-10-25 21:47:59,en,What ROI can be expected from {keyword} implementation?,0.92,0.8578488787762979,0.89
36800673,investment planning,economics,What tools help analyze investment planning data?,comparison,Advanced,"[""Introduction to investment planning"", ""Key points and analysis"", ""Practical examples"", ""Expert insights"", ""Action items"", ""Conclusion""]","[""investment"", ""planning"", ""comparison"", ""market"", ""economics""]",4,Professional Investors & Advisors,"[""portfolio management"", ""financial modeling"", ""market analysis""]",49,7,2025-10-25 21:47:59,en,What tools help analyze {keyword} data?,0.74,0.8938774579569891,0.47
36800674,investment planning,economics,What is the optimal allocation for investment planning in a portfolio?,troubleshooting,Intermediate,"[""Introduction to investment planning"", ""Key points and analysis"", ""Practical examples"", ""Expert insights"", ""Action items"", ""Conclusion""]","[""investment"", ""planning"", ""finance"", ""troubleshooting"", ""business"", ""economics""]",4,Individual Investors & Analysts,"[""market analysis"", ""financial modeling"", ""portfolio management""]",70,11,2025-10-25 21:47:59,en,What is the optimal allocation for {keyword} in a portfolio?,0.84,0.6026811081207422,0.34
36800675,portfolio management,economics,How do you identify opportunities in portfolio management markets?,best_practice,Beginner,"[""Overview of portfolio management"", ""Step-by-step implementation"", ""Best practices and tips"", ""Common challenges and solutions"", ""Tools and resources needed"", ""Conclusion and next steps""]","[""investment"", ""portfolio"", ""best_practice"", ""management"", ""business"", ""economics""]",6,Students & New Investors,"[""market analysis"", ""investment planning"", ""financial modeling""]",66,9,2025-10-25 21:47:59,en,How do you identify opportunities in {keyword} markets?,0.92,0.4994678394937013,0.52
36800676,machine learning,it,What is the recommended architecture for machine learning systems?,evaluation,Advanced,"[""Introduction to machine learning"", ""Key points and analysis"", ""Practical examples"", ""Expert insights"", ""Action items"", ""Conclusion""]","[""development"", ""it"", ""programming"", ""learning"", ""evaluation"", ""machine""]",4,Senior Developers & Tech Leads,"[""cloud computing"", ""data science"", ""cybersecurity"", ""web development""]",66,9,2025-10-25 21:47:59,en,What is the recommended architecture for {keyword} systems?,0.81,0.9380271847629111,0.82
36800677,financial modeling,economics,What factors should be considered when evaluating financial modeling?,implementation,Beginner,"[""Introduction to financial modeling"", ""Key points and analysis"", ""Practical examples"", ""Expert insights"", ""Action items"", ""Conclusion""]","[""finance"", ""implementation"", ""modeling"", ""financial"", ""market"", ""economics""]",4,Students & New Investors,"[""market analysis"", ""portfolio management"", ""investment planning""]",69,9,2025-10-25 21:47:59,en,What factors should be considered when evaluating {keyword}?,0.65,0.39867984258624783,0.64
36800678,market analysis,economics,How does global economics impact market analysis?,analysis,Intermediate,"[""Introduction to market analysis"", ""Key points and analysis"", ""Practical examples"", ""Expert insights"", ""Action items"", ""Conclusion""]","[""market"", ""business"", ""economics"", ""analysis""]",4,Individual Investors & Analysts,"[""investment planning"", ""financial modeling"", ""portfolio management""]",49,7,2025-10-25 21:47:59,en,How does global economics impact {keyword}?,0.78,0.7879037200487513,0.73
36800679,market analysis,economics,How do you adjust your market analysis strategy during volatility?,evaluation,Expert,"[""Overview of market analysis"", ""Step-by-step implementation"", ""Best practices and tips"", ""Common challenges and solutions"", ""Tools and resources needed"", ""Conclusion and next steps""]","[""investment"", ""analysis"", ""evaluation"", ""market"", ""business"", ""economics""]",6,Portfolio Managers & Financial Experts,"[""portfolio management"", ""investment planning"", ""financial modeling""]",66,10,2025-10-25 21:47:59,en,How do you adjust your {keyword} strategy during volatility?,0.66,1.0,0.38
36800680,social media,marketing,How do you automate social media processes?,strategy,Beginner,"[""Overview of social media"", ""Step-by-step implementation"", ""Best practices and tips"", ""Common challenges and solutions"", ""Tools and resources needed"", ""Conclusion and next steps""]","[""media"", ""marketing"", ""social"", ""advertising"", ""branding"", ""strategy""]",6,Marketing Students & Interns,"[""content marketing"", ""brand management"", ""digital marketing""]",43,7,2025-10-25 21:47:59,en,How do you automate {keyword} processes?,0.73,0.42646522380122387,0.66
36800681,machine learning,it,How do you get started with machine learning as a beginner?,implementation,Advanced,"[""Overview of machine learning"", ""Step-by-step implementation"", ""Best practices and tips"", ""Common challenges and solutions"", ""Tools and resources needed"", ""Conclusion and next steps""]","[""it"", ""implementation"", ""programming"", ""learning"", ""machine"", ""technology""]",6,Senior Developers & Tech Leads,"[""cloud computing"", ""cybersecurity"", ""data science"", ""web development""]",59,11,2025-10-25 21:47:59,en,How do you get started with {keyword} as a beginner?,0.73,0.9949860160807722,0.71
36800682,data science,it,How do you integrate data science with existing systems?,optimization,Advanced,"[""Overview of data science"", ""Step-by-step implementation"", ""Best practices and tips"", ""Common challenges and solutions"", ""Tools and resources needed"", ""Conclusion and next steps""]","[""software"", ""it"", ""programming"", ""science"", ""optimization"", ""data""]",6,Senior Developers & Tech Leads,"[""cloud computing"", ""web development"", ""cybersecurity"", ""machine learning""]",56,9,2025-10-25 21:47:59,en,How do you integrate {keyword} with existing systems?,0.73,0.9101932760896833,0.69
36800683,brand management,marketing,What messaging works best in brand management campaigns?,best_practice,Beginner,"[""Introduction to brand management"", ""Key points and analysis"", ""Practical examples"", ""Expert insights"", ""Action items"", ""Conclusion""]","[""promotion"", ""best_practice"", ""marketing"", ""management"", ""digital"", ""brand""]",4,Marketing Students & Interns,"[""social media"", ""content marketing"", ""digital marketing""]",56,8,2025-10-25 21:47:59,en,What messaging works best in {keyword} campaigns?,0.8,0.4386934074170032,0.86
36800684,cloud computing,it,What ROI can be expected from cloud computing implementation?,evaluation,Beginner,"[""Introduction to cloud computing"", ""Key points and analysis"", ""Practical examples"", ""Expert insights"", ""Action items"", ""Conclusion""]","[""computing"", ""software"", ""it"", ""programming"", ""evaluation"", ""cloud""]",4,Students & Entry-level Developers,"[""cybersecurity"", ""data science"", ""web development"", ""machine learning""]",61,9,2025-10-25 21:47:59,en,What ROI can be expected from {keyword} implementation?,0.94,0.32825282212242235,0.6
36800685,social media,marketing,What tools are essential for social media analytics?,optimization,Beginner,"[""Introduction to social media"", ""Key points and analysis"", ""Practical examples"", ""Expert insights"", ""Action items"", ""Conclusion""]","[""media"", ""marketing"", ""social"", ""advertising"", ""branding"", ""optimization""]",4,Marketing Students & Interns,"[""digital marketing"", ""content marketing"", ""brand management""]",52,8,2025-10-25 21:47:59,en,What tools are essential for {keyword} analytics?,0.91,0.4798041559150681,0.76
36800686,brand management,marketing,How do you track and analyze brand management performance?,comparison,Advanced,"[""Overview of brand management"", ""Step-by-step implementation"", ""Best practices and tips"", ""Common challenges and solutions"", ""Tools and resources needed"", ""Conclusion and next steps""]","[""comparison"", ""marketing"", ""management"", ""advertising"", ""branding"", ""brand""]",6,Marketing Managers & Strategists,"[""digital marketing"", ""social media"", ""content marketing""]",58,9,2025-10-25 21:47:59,en,How do you track and analyze {keyword} performance?,0.86,0.8631113541285504,0.55
36800687,social media,marketing,What channels are most effective for social media?,comparison,Expert,"[""Introduction to social media"", ""Key points and analysis"", ""Practical examples"", ""Expert insights"", ""Action items"", ""Conclusion""]","[""media"", ""comparison"", ""marketing"", ""digital"", ""social"", ""branding""]",4,Marketing Directors & CMOs,"[""brand management"", ""content marketing"", ""digital marketing""]",50,8,2025-10-25 21:47:59,en,What channels are most effective for {keyword}?,0.65,1.0,0.38
36800688,brand management,marketing,How do you reach new customers through brand management?,best_practice,Advanced,"[""Overview of brand management"", ""Step-by-step implementation"", ""Best practices and tips"", ""Common challenges and solutions"", ""Tools and resources needed"", ""Conclusion and next steps""]","[""best_practice"", ""marketing"", ""management"", ""digital"", ""branding"", ""brand""]",6,Marketing Managers & Strategists,"[""digital marketing"", ""content marketing"", ""social media""]",56,9,2025-10-25 21:47:59,en,How do you reach new customers through {keyword}?,0.88,0.9132545879523657,0.32
36800689,digital marketing,marketing,How do you optimize digital marketing for mobile users?,troubleshooting,Beginner,"[""Overview of digital marketing"", ""Step-by-step implementation"", ""Best practices and tips"", ""Common challenges and solutions"", ""Tools and resources needed"", ""Conclusion and next steps""]","[""branding"", ""marketing"", ""troubleshooting"", ""digital""]",6,Marketing Students & Interns,"[""social media"", ""content marketing"", ""brand management""]",55,9,2025-10-25 21:47:59,en,How do you optimize {keyword} for mobile users?,0.92,0.30747365430565754,0.83
36800690,data science,it,What are the key components of a data science implementation?,strategy,Advanced,"[""Introduction to data science"", ""Key concepts and definitions"", ""Main categories or types"", ""Examples and case studies"", ""Benefits and advantages"", ""Summary and recommendations""]","[""technology"", ""software"", ""it"", ""science"", ""strategy"", ""data""]",6,Senior Developers & Tech Leads,"[""cloud computing"", ""web development"", ""machine learning"", ""cybersecurity""]",61,10,2025-10-25 21:47:59,en,What are the key components of a {keyword} implementation?,0.85,0.8152472311286868,0.41
36800691,brand management,marketing,What tools are essential for brand management analytics?,planning,Advanced,"[""Introduction to brand management"", ""Key points and analysis"", ""Practical examples"", ""Expert insights"", ""Action items"", ""Conclusion""]","[""planning"", ""promotion"", ""digital"", ""marketing"", ""management"", ""brand""]",4,Marketing Managers & Strategists,"[""social media"", ""digital marketing"", ""content marketing""]",56,8,2025-10-25 21:47:59,en,What tools are essential for {keyword} analytics?,0.61,0.8711512155882554,0.74
36800692,market analysis,economics,How do you create a long-term plan for market analysis?,optimization,Intermediate,"[""Overview of market analysis"", ""Step-by-step implementation"", ""Best practices and tips"", ""Common challenges and solutions"", ""Tools and resources needed"", ""Conclusion and next steps""]","[""finance"", ""analysis"", ""business"", ""market"", ""optimization"", ""economics""]",6,Individual Investors & Analysts,"[""investment planning"", ""portfolio management"", ""financial modeling""]",55,10,2025-10-25 21:47:59,en,How do you create a long-term plan for {keyword}?,0.89,0.6490441710998736,0.6
36800693,web development,it,How do you integrate web development with existing systems?,strategy,Expert,"[""Overview of web development"", ""Step-by-step implementation"", ""Best practices and tips"", ""Common challenges and solutions"", ""Tools and resources needed"", ""Conclusion and next steps""]","[""software"", ""development"", ""web"", ""it"", ""strategy"", ""technology""]",6,Architects & Technical Directors,"[""data science"", ""cybersecurity"", ""cloud computing"", ""machine learning""]",59,9,2025-10-25 21:47:59,en,How do you integrate {keyword} with existing systems?,0.78,1.0,0.55
36800694,machine learning,it,How do you troubleshoot common issues with machine learning?,best_practice,Expert,"[""Overview of machine learning"", ""Step-by-step implementation"", ""Best practices and tips"", ""Common challenges and solutions"", ""Tools and resources needed"", ""Conclusion and next steps""]","[""it"", ""best_practice"", ""programming"", ""learning"", ""machine"", ""technology""]",6,Architects & Technical Directors,"[""web development"", ""cybersecurity"", ""data science"", ""cloud computing""]",60,9,2025-10-25 21:47:59,en,How do you troubleshoot common issues with {keyword}?,0.94,1.0,0.45
