record_id,keyword,category,question,question_type,difficulty_level,answer_outline,tags,estimated_read_time,target_audience,related_topics,question_length,word_count,created_date,language,source_template,engagement_score,complexity_score,popularity_score
38600001,brand management,marketing,How do you develop an effective brand management strategy?,analysis,Advanced,"[""Overview of brand management"", ""Step-by-step implementation"", ""Best practices and tips"", ""Common challenges and solutions"", ""Tools and resources needed"", ""Conclusion and next steps""]","[""analysis"", ""marketing"", ""management"", ""digital"", ""branding"", ""brand""]",6,Marketing Managers & Strategists,"[""social media"", ""content marketing"", ""digital marketing""]",58,9,2025-10-25 21:50:23,en,How do you develop an effective {keyword} strategy?,0.87,0.8320297605567616,0.66
38600002,cybersecurity,it,How do you get started with cybersecurity as a beginner?,comparison,Advanced,"[""Overview of cybersecurity"", ""Step-by-step implementation"", ""Best practices and tips"", ""Common challenges and solutions"", ""Tools and resources needed"", ""Conclusion and next steps""]","[""development"", ""it"", ""comparison"", ""programming"", ""cybersecurity""]",5,Senior Developers & Tech Leads,"[""cloud computing"", ""machine learning"", ""web development"", ""data science""]",56,10,2025-10-25 21:50:23,en,How do you get started with {keyword} as a beginner?,0.84,0.9485108058654459,0.81
38600003,brand management,marketing,What KPIs are most important for brand management?,implementation,Beginner,"[""Introduction to brand management"", ""Key points and analysis"", ""Practical examples"", ""Expert insights"", ""Action items"", ""Conclusion""]","[""implementation"", ""promotion"", ""marketing"", ""management"", ""branding"", ""brand""]",4,Marketing Students & Interns,"[""digital marketing"", ""content marketing"", ""social media""]",50,8,2025-10-25 21:50:23,en,What KPIs are most important for {keyword}?,0.87,0.36182140812581765,0.56
38600004,data science,it,How do you design a scalable data science solution?,troubleshooting,Advanced,"[""Overview of data science"", ""Step-by-step implementation"", ""Best practices and tips"", ""Common challenges and solutions"", ""Tools and resources needed"", ""Conclusion and next steps""]","[""software"", ""development"", ""it"", ""troubleshooting"", ""science"", ""data""]",6,Senior Developers & Tech Leads,"[""machine learning"", ""cybersecurity"", ""cloud computing"", ""web development""]",51,9,2025-10-25 21:50:23,en,How do you design a scalable {keyword} solution?,0.94,0.9236403288872548,0.71
38600005,content marketing,marketing,What tools are essential for content marketing analytics?,strategy,Intermediate,"[""Introduction to content marketing"", ""Key points and analysis"", ""Practical examples"", ""Expert insights"", ""Action items"", ""Conclusion""]","[""content"", ""marketing"", ""advertising"", ""branding"", ""strategy""]",4,Marketing Coordinators & Specialists,"[""brand management"", ""digital marketing"", ""social media""]",57,8,2025-10-25 21:50:23,en,What tools are essential for {keyword} analytics?,0.84,0.7019588934642635,0.36
38600006,content marketing,marketing,What messaging works best in content marketing campaigns?,implementation,Intermediate,"[""Introduction to content marketing"", ""Key points and analysis"", ""Practical examples"", ""Expert insights"", ""Action items"", ""Conclusion""]","[""content"", ""implementation"", ""promotion"", ""marketing"", ""digital""]",4,Marketing Coordinators & Specialists,"[""digital marketing"", ""brand management"", ""social media""]",57,8,2025-10-25 21:50:23,en,What messaging works best in {keyword} campaigns?,0.66,0.7530482514011552,0.59
38600007,machine learning,it,How do you get started with machine learning as a beginner?,strategy,Intermediate,"[""Overview of machine learning"", ""Step-by-step implementation"", ""Best practices and tips"", ""Common challenges and solutions"", ""Tools and resources needed"", ""Conclusion and next steps""]","[""software"", ""it"", ""learning"", ""strategy"", ""machine"", ""technology""]",6,Junior to Mid-level Developers,"[""data science"", ""cybersecurity"", ""cloud computing"", ""web development""]",59,11,2025-10-25 21:50:23,en,How do you get started with {keyword} as a beginner?,0.8,0.6812558755760214,0.41
38600008,content marketing,marketing,What content types work best for content marketing?,optimization,Beginner,"[""Introduction to content marketing"", ""Key points and analysis"", ""Practical examples"", ""Expert insights"", ""Action items"", ""Conclusion""]","[""content"", ""promotion"", ""marketing"", ""advertising"", ""optimization""]",4,Marketing Students & Interns,"[""brand management"", ""digital marketing"", ""social media""]",51,8,2025-10-25 21:50:23,en,What content types work best for {keyword}?,0.92,0.32926514810628804,0.82
38600009,machine learning,it,What career opportunities exist in machine learning?,optimization,Intermediate,"[""Introduction to machine learning"", ""Key points and analysis"", ""Practical examples"", ""Expert insights"", ""Action items"", ""Conclusion""]","[""software"", ""it"", ""learning"", ""optimization"", ""machine"", ""technology""]",4,Junior to Mid-level Developers,"[""cloud computing"", ""data science"", ""cybersecurity"", ""web development""]",52,7,2025-10-25 21:50:23,en,What career opportunities exist in {keyword}?,0.85,0.6579296528468891,0.59
38600010,portfolio management,economics,How do you diversify your portfolio using portfolio management?,best_practice,Expert,"[""Overview of portfolio management"", ""Step-by-step implementation"", ""Best practices and tips"", ""Common challenges and solutions"", ""Tools and resources needed"", ""Conclusion and next steps""]","[""finance"", ""portfolio"", ""best_practice"", ""management"", ""market"", ""economics""]",6,Portfolio Managers & Financial Experts,"[""market analysis"", ""investment planning"", ""financial modeling""]",63,9,2025-10-25 21:50:23,en,How do you diversify your portfolio using {keyword}?,0.62,1.0,0.67
38600011,web development,it,How do you convince stakeholders to invest in web development?,comparison,Intermediate,"[""Overview of web development"", ""Step-by-step implementation"", ""Best practices and tips"", ""Common challenges and solutions"", ""Tools and resources needed"", ""Conclusion and next steps""]","[""software"", ""development"", ""it"", ""comparison"", ""programming"", ""web""]",6,Junior to Mid-level Developers,"[""machine learning"", ""data science"", ""cybersecurity"", ""cloud computing""]",62,10,2025-10-25 21:50:23,en,How do you convince stakeholders to invest in {keyword}?,0.91,0.7787453839783023,0.71
38600012,data science,it,How do you integrate data science with existing systems?,strategy,Expert,"[""Overview of data science"", ""Step-by-step implementation"", ""Best practices and tips"", ""Common challenges and solutions"", ""Tools and resources needed"", ""Conclusion and next steps""]","[""technology"", ""development"", ""it"", ""science"", ""strategy"", ""data""]",6,Architects & Technical Directors,"[""machine learning"", ""cybersecurity"", ""cloud computing"", ""web development""]",56,9,2025-10-25 21:50:23,en,How do you integrate {keyword} with existing systems?,0.71,1.0,0.4
38600013,data science,it,How do you troubleshoot common issues with data science?,analysis,Advanced,"[""Overview of data science"", ""Step-by-step implementation"", ""Best practices and tips"", ""Common challenges and solutions"", ""Tools and resources needed"", ""Conclusion and next steps""]","[""technology"", ""analysis"", ""it"", ""programming"", ""science"", ""data""]",6,Senior Developers & Tech Leads,"[""machine learning"", ""cybersecurity"", ""cloud computing"", ""web development""]",56,9,2025-10-25 21:50:23,en,How do you troubleshoot common issues with {keyword}?,0.68,0.9680691850557761,0.52
38600014,machine learning,it,How do you optimize machine learning for different platforms?,evaluation,Expert,"[""Overview of machine learning"", ""Step-by-step implementation"", ""Best practices and tips"", ""Common challenges and solutions"", ""Tools and resources needed"", ""Conclusion and next steps""]","[""software"", ""it"", ""programming"", ""learning"", ""evaluation"", ""machine""]",6,Architects & Technical Directors,"[""cybersecurity"", ""web development"", ""cloud computing"", ""data science""]",61,9,2025-10-25 21:50:23,en,How do you optimize {keyword} for different platforms?,0.84,1.0,0.55
38600015,content marketing,marketing,How do you track and analyze content marketing performance?,planning,Beginner,"[""Overview of content marketing"", ""Step-by-step implementation"", ""Best practices and tips"", ""Common challenges and solutions"", ""Tools and resources needed"", ""Conclusion and next steps""]","[""planning"", ""content"", ""promotion"", ""marketing"", ""advertising""]",6,Marketing Students & Interns,"[""brand management"", ""digital marketing"", ""social media""]",59,9,2025-10-25 21:50:23,en,How do you track and analyze {keyword} performance?,0.61,0.32243317217391365,0.44
38600016,cybersecurity,it,How do you measure the success of cybersecurity projects?,evaluation,Expert,"[""Overview of cybersecurity"", ""Step-by-step implementation"", ""Best practices and tips"", ""Common challenges and solutions"", ""Tools and resources needed"", ""Conclusion and next steps""]","[""software"", ""it"", ""programming"", ""evaluation"", ""cybersecurity""]",5,Architects & Technical Directors,"[""machine learning"", ""web development"", ""data science"", ""cloud computing""]",57,9,2025-10-25 21:50:23,en,How do you measure the success of {keyword} projects?,0.83,1.0,0.34
38600017,cloud computing,it,How do you implement cloud computing in a production environment?,best_practice,Advanced,"[""Overview of cloud computing"", ""Step-by-step implementation"", ""Best practices and tips"", ""Common challenges and solutions"", ""Tools and resources needed"", ""Conclusion and next steps""]","[""computing"", ""software"", ""it"", ""best_practice"", ""cloud"", ""technology""]",6,Senior Developers & Tech Leads,"[""data science"", ""web development"", ""machine learning"", ""cybersecurity""]",65,10,2025-10-25 21:50:23,en,How do you implement {keyword} in a production environment?,0.68,0.9127139676193006,0.34
38600018,investment planning,economics,How do you benchmark investment planning against alternatives?,optimization,Beginner,"[""Overview of investment planning"", ""Step-by-step implementation"", ""Best practices and tips"", ""Common challenges and solutions"", ""Tools and resources needed"", ""Conclusion and next steps""]","[""investment"", ""planning"", ""market"", ""optimization"", ""economics""]",6,Students & New Investors,"[""financial modeling"", ""portfolio management"", ""market analysis""]",62,8,2025-10-25 21:50:23,en,How do you benchmark {keyword} against alternatives?,0.72,0.471485832937118,0.54
38600019,digital marketing,marketing,How do you create a digital marketing roadmap?,optimization,Expert,"[""Overview of digital marketing"", ""Step-by-step implementation"", ""Best practices and tips"", ""Common challenges and solutions"", ""Tools and resources needed"", ""Conclusion and next steps""]","[""promotion"", ""marketing"", ""digital"", ""branding"", ""optimization""]",6,Marketing Directors & CMOs,"[""social media"", ""content marketing"", ""brand management""]",46,8,2025-10-25 21:50:23,en,How do you create a {keyword} roadmap?,0.9,1.0,0.59
38600020,market analysis,economics,How do you benchmark market analysis against alternatives?,optimization,Advanced,"[""Overview of market analysis"", ""Step-by-step implementation"", ""Best practices and tips"", ""Common challenges and solutions"", ""Tools and resources needed"", ""Conclusion and next steps""]","[""analysis"", ""business"", ""market"", ""optimization"", ""economics""]",6,Professional Investors & Advisors,"[""financial modeling"", ""portfolio management"", ""investment planning""]",58,8,2025-10-25 21:50:23,en,How do you benchmark {keyword} against alternatives?,0.7,0.9710601759651596,0.54
38600021,cloud computing,it,What is the recommended architecture for cloud computing systems?,implementation,Expert,"[""Introduction to cloud computing"", ""Key points and analysis"", ""Practical examples"", ""Expert insights"", ""Action items"", ""Conclusion""]","[""computing"", ""development"", ""it"", ""implementation"", ""programming"", ""cloud""]",4,Architects & Technical Directors,"[""web development"", ""cybersecurity"", ""data science"", ""machine learning""]",65,9,2025-10-25 21:50:23,en,What is the recommended architecture for {keyword} systems?,0.72,1.0,0.72
38600022,digital marketing,marketing,What channels are most effective for digital marketing?,planning,Intermediate,"[""Introduction to digital marketing"", ""Key points and analysis"", ""Practical examples"", ""Expert insights"", ""Action items"", ""Conclusion""]","[""marketing"", ""promotion"", ""planning"", ""digital""]",4,Marketing Coordinators & Specialists,"[""brand management"", ""content marketing"", ""social media""]",55,8,2025-10-25 21:50:23,en,What channels are most effective for {keyword}?,0.65,0.6736490308591878,0.63
38600023,content marketing,marketing,What are the latest trends in content marketing?,optimization,Expert,"[""Introduction to content marketing"", ""Key concepts and definitions"", ""Main categories or types"", ""Examples and case studies"", ""Benefits and advantages"", ""Summary and recommendations""]","[""content"", ""promotion"", ""marketing"", ""advertising"", ""optimization""]",6,Marketing Directors & CMOs,"[""social media"", ""brand management"", ""digital marketing""]",48,8,2025-10-25 21:50:23,en,What are the latest trends in {keyword}?,0.69,1.0,0.55
38600024,market analysis,economics,What metrics are most important for market analysis?,troubleshooting,Advanced,"[""Introduction to market analysis"", ""Key points and analysis"", ""Practical examples"", ""Expert insights"", ""Action items"", ""Conclusion""]","[""analysis"", ""finance"", ""troubleshooting"", ""market"", ""business"", ""economics""]",4,Professional Investors & Advisors,"[""financial modeling"", ""investment planning"", ""portfolio management""]",52,8,2025-10-25 21:50:23,en,What metrics are most important for {keyword}?,0.87,0.9153852689901923,0.67
38600025,web development,it,What are the best practices for web development development?,best_practice,Advanced,"[""Introduction to web development"", ""Key concepts and definitions"", ""Main categories or types"", ""Examples and case studies"", ""Benefits and advantages"", ""Summary and recommendations""]","[""technology"", ""development"", ""it"", ""best_practice"", ""web""]",6,Senior Developers & Tech Leads,"[""machine learning"", ""data science"", ""cybersecurity"", ""cloud computing""]",60,9,2025-10-25 21:50:23,en,What are the best practices for {keyword} development?,0.69,0.8285180581404612,0.69
38600026,cybersecurity,it,What security considerations should be taken when using cybersecurity?,optimization,Intermediate,"[""Introduction to cybersecurity"", ""Key points and analysis"", ""Practical examples"", ""Expert insights"", ""Action items"", ""Conclusion""]","[""software"", ""it"", ""programming"", ""optimization"", ""cybersecurity""]",4,Junior to Mid-level Developers,"[""web development"", ""data science"", ""machine learning"", ""cloud computing""]",70,9,2025-10-25 21:50:23,en,What security considerations should be taken when using {keyword}?,0.76,0.7433692642569685,0.47
38600027,portfolio management,economics,What insurance options are available for portfolio management?,troubleshooting,Beginner,"[""Introduction to portfolio management"", ""Key points and analysis"", ""Practical examples"", ""Expert insights"", ""Action items"", ""Conclusion""]","[""investment"", ""finance"", ""portfolio"", ""troubleshooting"", ""management"", ""economics""]",4,Students & New Investors,"[""financial modeling"", ""market analysis"", ""investment planning""]",62,8,2025-10-25 21:50:23,en,What insurance options are available for {keyword}?,0.92,0.3085862937102521,0.78
38600028,web development,it,What are the key components of a web development implementation?,analysis,Beginner,"[""Introduction to web development"", ""Key concepts and definitions"", ""Main categories or types"", ""Examples and case studies"", ""Benefits and advantages"", ""Summary and recommendations""]","[""software"", ""development"", ""analysis"", ""it"", ""programming"", ""web""]",6,Students & Entry-level Developers,"[""data science"", ""machine learning"", ""cybersecurity"", ""cloud computing""]",64,10,2025-10-25 21:50:23,en,What are the key components of a {keyword} implementation?,0.79,0.3239935684951172,0.87
38600029,data science,it,What is the recommended architecture for data science systems?,comparison,Beginner,"[""Introduction to data science"", ""Key points and analysis"", ""Practical examples"", ""Expert insights"", ""Action items"", ""Conclusion""]","[""technology"", ""development"", ""it"", ""comparison"", ""science"", ""data""]",4,Students & Entry-level Developers,"[""machine learning"", ""cloud computing"", ""web development"", ""cybersecurity""]",62,9,2025-10-25 21:50:23,en,What is the recommended architecture for {keyword} systems?,0.88,0.4250419360010451,0.72
38600030,social media,marketing,How do you identify the right audience for social media?,how_to,Expert,"[""Overview of social media"", ""Step-by-step implementation"", ""Best practices and tips"", ""Common challenges and solutions"", ""Tools and resources needed"", ""Conclusion and next steps""]","[""how_to"", ""media"", ""marketing"", ""social"", ""advertising"", ""branding""]",6,Marketing Directors & CMOs,"[""digital marketing"", ""content marketing"", ""brand management""]",56,10,2025-10-25 21:50:23,en,How do you identify the right audience for {keyword}?,0.81,1.0,0.69
38600031,digital marketing,marketing,How do you develop an effective digital marketing strategy?,analysis,Beginner,"[""Overview of digital marketing"", ""Step-by-step implementation"", ""Best practices and tips"", ""Common challenges and solutions"", ""Tools and resources needed"", ""Conclusion and next steps""]","[""analysis"", ""marketing"", ""digital"", ""advertising"", ""branding""]",6,Marketing Students & Interns,"[""social media"", ""content marketing"", ""brand management""]",59,9,2025-10-25 21:50:23,en,How do you develop an effective {keyword} strategy?,0.7,0.4239238932662542,0.49
38600032,machine learning,it,How do you convince stakeholders to invest in machine learning?,analysis,Intermediate,"[""Overview of machine learning"", ""Step-by-step implementation"", ""Best practices and tips"", ""Common challenges and solutions"", ""Tools and resources needed"", ""Conclusion and next steps""]","[""analysis"", ""it"", ""programming"", ""learning"", ""machine"", ""technology""]",6,Junior to Mid-level Developers,"[""cybersecurity"", ""web development"", ""cloud computing"", ""data science""]",63,10,2025-10-25 21:50:23,en,How do you convince stakeholders to invest in {keyword}?,0.66,0.7550308349592484,0.37
38600033,content marketing,marketing,What content types work best for content marketing?,analysis,Advanced,"[""Introduction to content marketing"", ""Key points and analysis"", ""Practical examples"", ""Expert insights"", ""Action items"", ""Conclusion""]","[""content"", ""analysis"", ""promotion"", ""marketing"", ""digital""]",4,Marketing Managers & Strategists,"[""digital marketing"", ""social media"", ""brand management""]",51,8,2025-10-25 21:50:23,en,What content types work best for {keyword}?,0.9,0.9817267402715266,0.75
38600034,data science,it,What ROI can be expected from data science implementation?,evaluation,Expert,"[""Introduction to data science"", ""Key points and analysis"", ""Practical examples"", ""Expert insights"", ""Action items"", ""Conclusion""]","[""technology"", ""development"", ""it"", ""science"", ""evaluation"", ""data""]",4,Architects & Technical Directors,"[""machine learning"", ""web development"", ""cybersecurity"", ""cloud computing""]",58,9,2025-10-25 21:50:23,en,What ROI can be expected from {keyword} implementation?,0.95,1.0,0.53
38600035,content marketing,marketing,How do you track and analyze content marketing performance?,best_practice,Expert,"[""Overview of content marketing"", ""Step-by-step implementation"", ""Best practices and tips"", ""Common challenges and solutions"", ""Tools and resources needed"", ""Conclusion and next steps""]","[""content"", ""promotion"", ""best_practice"", ""marketing"", ""digital""]",6,Marketing Directors & CMOs,"[""brand management"", ""social media"", ""digital marketing""]",59,9,2025-10-25 21:50:23,en,How do you track and analyze {keyword} performance?,0.81,1.0,0.82
38600036,market analysis,economics,How do economic conditions affect market analysis performance?,implementation,Expert,"[""Introduction to market analysis"", ""Key points and analysis"", ""Practical examples"", ""Expert insights"", ""Action items"", ""Conclusion""]","[""investment"", ""finance"", ""analysis"", ""implementation"", ""market"", ""economics""]",4,Portfolio Managers & Financial Experts,"[""portfolio management"", ""financial modeling"", ""investment planning""]",62,8,2025-10-25 21:50:23,en,How do economic conditions affect {keyword} performance?,0.82,1.0,0.31
38600037,machine learning,it,What ROI can be expected from machine learning implementation?,best_practice,Intermediate,"[""Introduction to machine learning"", ""Key points and analysis"", ""Practical examples"", ""Expert insights"", ""Action items"", ""Conclusion""]","[""development"", ""it"", ""best_practice"", ""learning"", ""machine"", ""technology""]",4,Junior to Mid-level Developers,"[""data science"", ""cybersecurity"", ""cloud computing"", ""web development""]",62,9,2025-10-25 21:50:23,en,What ROI can be expected from {keyword} implementation?,0.83,0.7082310769313783,0.55
38600038,machine learning,it,What are the latest trends in machine learning technology?,implementation,Advanced,"[""Introduction to machine learning"", ""Key concepts and definitions"", ""Main categories or types"", ""Examples and case studies"", ""Benefits and advantages"", ""Summary and recommendations""]","[""software"", ""it"", ""implementation"", ""learning"", ""machine"", ""technology""]",6,Senior Developers & Tech Leads,"[""cybersecurity"", ""web development"", ""cloud computing"", ""data science""]",58,9,2025-10-25 21:50:23,en,What are the latest trends in {keyword} technology?,0.88,0.9767722367849934,0.62
38600039,cloud computing,it,How do you get started with cloud computing as a beginner?,analysis,Beginner,"[""Overview of cloud computing"", ""Step-by-step implementation"", ""Best practices and tips"", ""Common challenges and solutions"", ""Tools and resources needed"", ""Conclusion and next steps""]","[""computing"", ""software"", ""analysis"", ""it"", ""cloud"", ""technology""]",6,Students & Entry-level Developers,"[""web development"", ""data science"", ""machine learning"", ""cybersecurity""]",58,11,2025-10-25 21:50:23,en,How do you get started with {keyword} as a beginner?,0.69,0.4629180585267848,0.54
38600040,market analysis,economics,What are the risks associated with market analysis?,planning,Intermediate,"[""Introduction to market analysis"", ""Key concepts and definitions"", ""Main categories or types"", ""Examples and case studies"", ""Benefits and advantages"", ""Summary and recommendations""]","[""planning"", ""finance"", ""analysis"", ""market"", ""economics""]",6,Individual Investors & Analysts,"[""investment planning"", ""portfolio management"", ""financial modeling""]",51,8,2025-10-25 21:50:23,en,What are the risks associated with {keyword}?,0.73,0.6355817781798916,0.58
38600041,data science,it,How do you optimize data science for different platforms?,strategy,Expert,"[""Overview of data science"", ""Step-by-step implementation"", ""Best practices and tips"", ""Common challenges and solutions"", ""Tools and resources needed"", ""Conclusion and next steps""]","[""development"", ""it"", ""programming"", ""science"", ""strategy"", ""data""]",6,Architects & Technical Directors,"[""cybersecurity"", ""web development"", ""cloud computing"", ""machine learning""]",57,9,2025-10-25 21:50:23,en,How do you optimize {keyword} for different platforms?,0.78,1.0,0.77
38600042,cloud computing,it,How do you choose the right technology stack for cloud computing?,comparison,Intermediate,"[""Overview of cloud computing"", ""Step-by-step implementation"", ""Best practices and tips"", ""Common challenges and solutions"", ""Tools and resources needed"", ""Conclusion and next steps""]","[""computing"", ""development"", ""it"", ""comparison"", ""cloud"", ""technology""]",6,Junior to Mid-level Developers,"[""machine learning"", ""data science"", ""cybersecurity"", ""web development""]",65,11,2025-10-25 21:50:23,en,How do you choose the right technology stack for {keyword}?,0.93,0.796547420188376,0.48
38600043,digital marketing,marketing,What demographics respond best to digital marketing?,analysis,Advanced,"[""Introduction to digital marketing"", ""Key points and analysis"", ""Practical examples"", ""Expert insights"", ""Action items"", ""Conclusion""]","[""analysis"", ""marketing"", ""digital"", ""advertising"", ""branding""]",4,Marketing Managers & Strategists,"[""brand management"", ""social media"", ""content marketing""]",52,7,2025-10-25 21:50:23,en,What demographics respond best to {keyword}?,0.88,0.9054571534468432,0.66
