record_id,keyword,category,question,question_type,difficulty_level,answer_outline,tags,estimated_read_time,target_audience,related_topics,question_length,word_count,created_date,language,source_template,engagement_score,complexity_score,popularity_score
42300956,machine learning,it,What are the best practices for machine learning development?,strategy,Advanced,"[""Introduction to machine learning"", ""Key concepts and definitions"", ""Main categories or types"", ""Examples and case studies"", ""Benefits and advantages"", ""Summary and recommendations""]","[""software"", ""it"", ""programming"", ""learning"", ""strategy"", ""machine""]",6,Senior Developers & Tech Leads,"[""data science"", ""cloud computing"", ""cybersecurity"", ""web development""]",61,9,2025-10-25 21:55:30,en,What are the best practices for {keyword} development?,0.92,0.9964498834513729,0.81
42300957,financial modeling,economics,What are the seasonal patterns in financial modeling?,best_practice,Advanced,"[""Introduction to financial modeling"", ""Key concepts and definitions"", ""Main categories or types"", ""Examples and case studies"", ""Benefits and advantages"", ""Summary and recommendations""]","[""investment"", ""best_practice"", ""modeling"", ""financial"", ""business"", ""economics""]",6,Professional Investors & Advisors,"[""portfolio management"", ""market analysis"", ""investment planning""]",53,8,2025-10-25 21:55:30,en,What are the seasonal patterns in {keyword}?,0.82,0.9314505280616676,0.45
42300958,cloud computing,it,How do you choose the right technology stack for cloud computing?,best_practice,Beginner,"[""Overview of cloud computing"", ""Step-by-step implementation"", ""Best practices and tips"", ""Common challenges and solutions"", ""Tools and resources needed"", ""Conclusion and next steps""]","[""computing"", ""development"", ""it"", ""best_practice"", ""programming"", ""cloud""]",6,Students & Entry-level Developers,"[""data science"", ""cybersecurity"", ""machine learning"", ""web development""]",65,11,2025-10-25 21:55:30,en,How do you choose the right technology stack for {keyword}?,0.66,0.3703755714774589,0.56
42300959,market analysis,economics,What are the risks associated with market analysis?,troubleshooting,Expert,"[""Introduction to market analysis"", ""Key concepts and definitions"", ""Main categories or types"", ""Examples and case studies"", ""Benefits and advantages"", ""Summary and recommendations""]","[""finance"", ""analysis"", ""troubleshooting"", ""market"", ""economics""]",6,Portfolio Managers & Financial Experts,"[""portfolio management"", ""financial modeling"", ""investment planning""]",51,8,2025-10-25 21:55:30,en,What are the risks associated with {keyword}?,0.78,1.0,0.42
42300960,data science,it,How do you integrate data science with existing systems?,optimization,Expert,"[""Overview of data science"", ""Step-by-step implementation"", ""Best practices and tips"", ""Common challenges and solutions"", ""Tools and resources needed"", ""Conclusion and next steps""]","[""technology"", ""it"", ""programming"", ""science"", ""optimization"", ""data""]",6,Architects & Technical Directors,"[""cloud computing"", ""cybersecurity"", ""web development"", ""machine learning""]",56,9,2025-10-25 21:55:30,en,How do you integrate {keyword} with existing systems?,0.68,1.0,0.62
42300961,web development,it,How do you measure the success of web development projects?,evaluation,Expert,"[""Overview of web development"", ""Step-by-step implementation"", ""Best practices and tips"", ""Common challenges and solutions"", ""Tools and resources needed"", ""Conclusion and next steps""]","[""software"", ""development"", ""web"", ""it"", ""evaluation"", ""technology""]",6,Architects & Technical Directors,"[""data science"", ""cybersecurity"", ""machine learning"", ""cloud computing""]",59,10,2025-10-25 21:55:30,en,How do you measure the success of {keyword} projects?,0.62,1.0,0.82
42300962,portfolio management,economics,What exit strategies should be considered for portfolio management?,strategy,Beginner,"[""Introduction to portfolio management"", ""Key points and analysis"", ""Practical examples"", ""Expert insights"", ""Action items"", ""Conclusion""]","[""investment"", ""portfolio"", ""management"", ""business"", ""strategy"", ""economics""]",4,Students & New Investors,"[""market analysis"", ""financial modeling"", ""investment planning""]",67,9,2025-10-25 21:55:30,en,What exit strategies should be considered for {keyword}?,0.95,0.4806336076772712,0.72
42300963,market analysis,economics,What tools help analyze market analysis data?,implementation,Expert,"[""Introduction to market analysis"", ""Key points and analysis"", ""Practical examples"", ""Expert insights"", ""Action items"", ""Conclusion""]","[""finance"", ""analysis"", ""implementation"", ""market"", ""economics""]",4,Portfolio Managers & Financial Experts,"[""financial modeling"", ""investment planning"", ""portfolio management""]",45,7,2025-10-25 21:55:30,en,What tools help analyze {keyword} data?,0.9,1.0,0.87
42300964,digital marketing,marketing,What emerging platforms support digital marketing?,analysis,Advanced,"[""Introduction to digital marketing"", ""Key points and analysis"", ""Practical examples"", ""Expert insights"", ""Action items"", ""Conclusion""]","[""branding"", ""marketing"", ""analysis"", ""digital""]",4,Marketing Managers & Strategists,"[""content marketing"", ""social media"", ""brand management""]",50,6,2025-10-25 21:55:30,en,What emerging platforms support {keyword}?,0.91,0.9737182630910494,0.46
42300965,portfolio management,economics,How does global economics impact portfolio management?,troubleshooting,Expert,"[""Introduction to portfolio management"", ""Key points and analysis"", ""Practical examples"", ""Expert insights"", ""Action items"", ""Conclusion""]","[""investment"", ""portfolio"", ""troubleshooting"", ""management"", ""market"", ""economics""]",4,Portfolio Managers & Financial Experts,"[""investment planning"", ""market analysis"", ""financial modeling""]",54,7,2025-10-25 21:55:30,en,How does global economics impact {keyword}?,0.87,1.0,0.55
42300966,investment planning,economics,How do you measure investment planning performance?,comparison,Beginner,"[""Overview of investment planning"", ""Step-by-step implementation"", ""Best practices and tips"", ""Common challenges and solutions"", ""Tools and resources needed"", ""Conclusion and next steps""]","[""investment"", ""planning"", ""comparison"", ""market"", ""economics""]",6,Students & New Investors,"[""market analysis"", ""financial modeling"", ""portfolio management""]",51,7,2025-10-25 21:55:30,en,How do you measure {keyword} performance?,0.64,0.33638461925390983,0.47
42300967,brand management,marketing,How do you attribute success to brand management efforts?,comparison,Beginner,"[""Overview of brand management"", ""Step-by-step implementation"", ""Best practices and tips"", ""Common challenges and solutions"", ""Tools and resources needed"", ""Conclusion and next steps""]","[""comparison"", ""marketing"", ""management"", ""advertising"", ""digital"", ""brand""]",6,Marketing Students & Interns,"[""social media"", ""digital marketing"", ""content marketing""]",57,9,2025-10-25 21:55:30,en,How do you attribute success to {keyword} efforts?,0.78,0.38874233837563915,0.6
42300968,machine learning,it,What certifications are valuable for machine learning professionals?,best_practice,Advanced,"[""Introduction to machine learning"", ""Key points and analysis"", ""Practical examples"", ""Expert insights"", ""Action items"", ""Conclusion""]","[""software"", ""it"", ""best_practice"", ""programming"", ""learning"", ""machine""]",4,Senior Developers & Tech Leads,"[""cloud computing"", ""cybersecurity"", ""data science"", ""web development""]",68,8,2025-10-25 21:55:30,en,What certifications are valuable for {keyword} professionals?,0.74,0.9292672314602455,0.59
42300969,brand management,marketing,How do you personalize brand management for different segments?,strategy,Intermediate,"[""Overview of brand management"", ""Step-by-step implementation"", ""Best practices and tips"", ""Common challenges and solutions"", ""Tools and resources needed"", ""Conclusion and next steps""]","[""promotion"", ""digital"", ""marketing"", ""management"", ""strategy"", ""brand""]",6,Marketing Coordinators & Specialists,"[""digital marketing"", ""content marketing"", ""social media""]",63,9,2025-10-25 21:55:30,en,How do you personalize {keyword} for different segments?,0.74,0.6446862627968437,0.43
42300970,content marketing,marketing,What A/B tests should you run for content marketing?,analysis,Expert,"[""Introduction to content marketing"", ""Key points and analysis"", ""Practical examples"", ""Expert insights"", ""Action items"", ""Conclusion""]","[""content"", ""analysis"", ""marketing"", ""advertising"", ""branding""]",4,Marketing Directors & CMOs,"[""digital marketing"", ""brand management"", ""social media""]",52,9,2025-10-25 21:55:30,en,What A/B tests should you run for {keyword}?,0.63,1.0,0.6
42300971,market analysis,economics,What are the regulatory considerations for market analysis?,best_practice,Beginner,"[""Introduction to market analysis"", ""Key concepts and definitions"", ""Main categories or types"", ""Examples and case studies"", ""Benefits and advantages"", ""Summary and recommendations""]","[""finance"", ""analysis"", ""best_practice"", ""market"", ""business"", ""economics""]",6,Students & New Investors,"[""financial modeling"", ""investment planning"", ""portfolio management""]",59,8,2025-10-25 21:55:30,en,What are the regulatory considerations for {keyword}?,0.87,0.3642058209375102,0.46
42300972,brand management,marketing,What budget should be allocated to brand management?,how_to,Beginner,"[""Introduction to brand management"", ""Key points and analysis"", ""Practical examples"", ""Expert insights"", ""Action items"", ""Conclusion""]","[""how_to"", ""promotion"", ""marketing"", ""management"", ""branding"", ""brand""]",4,Marketing Students & Interns,"[""content marketing"", ""social media"", ""digital marketing""]",52,8,2025-10-25 21:55:30,en,What budget should be allocated to {keyword}?,0.85,0.4628232721804555,0.77
42300973,financial modeling,economics,What are the risks associated with financial modeling?,analysis,Expert,"[""Introduction to financial modeling"", ""Key concepts and definitions"", ""Main categories or types"", ""Examples and case studies"", ""Benefits and advantages"", ""Summary and recommendations""]","[""investment"", ""analysis"", ""modeling"", ""financial"", ""business"", ""economics""]",6,Portfolio Managers & Financial Experts,"[""investment planning"", ""portfolio management"", ""market analysis""]",54,8,2025-10-25 21:55:30,en,What are the risks associated with {keyword}?,0.71,1.0,0.58
42300974,cloud computing,it,How do you integrate cloud computing with existing systems?,troubleshooting,Beginner,"[""Overview of cloud computing"", ""Step-by-step implementation"", ""Best practices and tips"", ""Common challenges and solutions"", ""Tools and resources needed"", ""Conclusion and next steps""]","[""computing"", ""development"", ""it"", ""programming"", ""troubleshooting"", ""cloud""]",6,Students & Entry-level Developers,"[""cybersecurity"", ""machine learning"", ""web development"", ""data science""]",59,9,2025-10-25 21:55:30,en,How do you integrate {keyword} with existing systems?,0.85,0.45232469837724626,0.47
42300975,brand management,marketing,What KPIs are most important for brand management?,how_to,Advanced,"[""Introduction to brand management"", ""Key points and analysis"", ""Practical examples"", ""Expert insights"", ""Action items"", ""Conclusion""]","[""how_to"", ""promotion"", ""marketing"", ""management"", ""digital"", ""brand""]",4,Marketing Managers & Strategists,"[""social media"", ""digital marketing"", ""content marketing""]",50,8,2025-10-25 21:55:30,en,What KPIs are most important for {keyword}?,0.73,0.8186258799188142,0.9
42300976,cloud computing,it,How do you design a scalable cloud computing solution?,how_to,Advanced,"[""Overview of cloud computing"", ""Step-by-step implementation"", ""Best practices and tips"", ""Common challenges and solutions"", ""Tools and resources needed"", ""Conclusion and next steps""]","[""computing"", ""how_to"", ""software"", ""it"", ""cloud"", ""technology""]",6,Senior Developers & Tech Leads,"[""machine learning"", ""cybersecurity"", ""web development"", ""data science""]",54,9,2025-10-25 21:55:30,en,How do you design a scalable {keyword} solution?,0.72,0.9084924807826291,0.61
42300977,market analysis,economics,What are the risks associated with market analysis?,analysis,Intermediate,"[""Introduction to market analysis"", ""Key concepts and definitions"", ""Main categories or types"", ""Examples and case studies"", ""Benefits and advantages"", ""Summary and recommendations""]","[""investment"", ""analysis"", ""market"", ""business"", ""economics""]",6,Individual Investors & Analysts,"[""financial modeling"", ""portfolio management"", ""investment planning""]",51,8,2025-10-25 21:55:30,en,What are the risks associated with {keyword}?,0.77,0.6638362396113638,0.71
42300978,social media,marketing,How do you create a social media roadmap?,comparison,Intermediate,"[""Overview of social media"", ""Step-by-step implementation"", ""Best practices and tips"", ""Common challenges and solutions"", ""Tools and resources needed"", ""Conclusion and next steps""]","[""media"", ""promotion"", ""comparison"", ""marketing"", ""social"", ""advertising""]",6,Marketing Coordinators & Specialists,"[""content marketing"", ""brand management"", ""digital marketing""]",41,8,2025-10-25 21:55:30,en,How do you create a {keyword} roadmap?,0.91,0.6117474142533808,0.7
42300979,cybersecurity,it,How do you choose the right technology stack for cybersecurity?,implementation,Beginner,"[""Overview of cybersecurity"", ""Step-by-step implementation"", ""Best practices and tips"", ""Common challenges and solutions"", ""Tools and resources needed"", ""Conclusion and next steps""]","[""development"", ""it"", ""implementation"", ""cybersecurity"", ""technology""]",5,Students & Entry-level Developers,"[""machine learning"", ""data science"", ""web development"", ""cloud computing""]",63,10,2025-10-25 21:55:30,en,How do you choose the right technology stack for {keyword}?,0.91,0.3978864712169884,0.69
42300980,cloud computing,it,What are the best practices for cloud computing development?,comparison,Expert,"[""Introduction to cloud computing"", ""Key concepts and definitions"", ""Main categories or types"", ""Examples and case studies"", ""Benefits and advantages"", ""Summary and recommendations""]","[""computing"", ""it"", ""comparison"", ""programming"", ""cloud"", ""technology""]",6,Architects & Technical Directors,"[""web development"", ""machine learning"", ""data science"", ""cybersecurity""]",60,9,2025-10-25 21:55:30,en,What are the best practices for {keyword} development?,0.6,1.0,0.81
42300981,machine learning,it,What career opportunities exist in machine learning?,best_practice,Advanced,"[""Introduction to machine learning"", ""Key points and analysis"", ""Practical examples"", ""Expert insights"", ""Action items"", ""Conclusion""]","[""development"", ""it"", ""best_practice"", ""learning"", ""machine"", ""technology""]",4,Senior Developers & Tech Leads,"[""data science"", ""cloud computing"", ""web development"", ""cybersecurity""]",52,7,2025-10-25 21:55:30,en,What career opportunities exist in {keyword}?,0.74,0.8301070816858414,0.82
42300982,financial modeling,economics,How do you measure financial modeling performance?,optimization,Advanced,"[""Overview of financial modeling"", ""Step-by-step implementation"", ""Best practices and tips"", ""Common challenges and solutions"", ""Tools and resources needed"", ""Conclusion and next steps""]","[""investment"", ""finance"", ""modeling"", ""financial"", ""optimization"", ""economics""]",6,Professional Investors & Advisors,"[""portfolio management"", ""market analysis"", ""investment planning""]",50,7,2025-10-25 21:55:30,en,How do you measure {keyword} performance?,0.76,0.996489470186346,0.5
42300983,web development,it,How do you stay updated with web development developments?,best_practice,Beginner,"[""Overview of web development"", ""Step-by-step implementation"", ""Best practices and tips"", ""Common challenges and solutions"", ""Tools and resources needed"", ""Conclusion and next steps""]","[""software"", ""development"", ""it"", ""best_practice"", ""web""]",6,Students & Entry-level Developers,"[""machine learning"", ""cloud computing"", ""data science"", ""cybersecurity""]",58,9,2025-10-25 21:55:30,en,How do you stay updated with {keyword} developments?,0.92,0.3534261147993973,0.6
42300984,cloud computing,it,Which frameworks support cloud computing implementation?,troubleshooting,Intermediate,"[""Introduction to cloud computing"", ""Key points and analysis"", ""Practical examples"", ""Expert insights"", ""Action items"", ""Conclusion""]","[""computing"", ""software"", ""development"", ""it"", ""troubleshooting"", ""cloud""]",4,Junior to Mid-level Developers,"[""cybersecurity"", ""machine learning"", ""web development"", ""data science""]",56,6,2025-10-25 21:55:30,en,Which frameworks support {keyword} implementation?,0.9,0.6757226216990708,0.4
42300985,digital marketing,marketing,How do you identify the right audience for digital marketing?,evaluation,Expert,"[""Overview of digital marketing"", ""Step-by-step implementation"", ""Best practices and tips"", ""Common challenges and solutions"", ""Tools and resources needed"", ""Conclusion and next steps""]","[""marketing"", ""digital"", ""advertising"", ""branding"", ""evaluation""]",6,Marketing Directors & CMOs,"[""content marketing"", ""social media"", ""brand management""]",61,10,2025-10-25 21:55:30,en,How do you identify the right audience for {keyword}?,0.62,1.0,0.59
42300986,cybersecurity,it,What are the cost considerations for cybersecurity?,analysis,Advanced,"[""Introduction to cybersecurity"", ""Key concepts and definitions"", ""Main categories or types"", ""Examples and case studies"", ""Benefits and advantages"", ""Summary and recommendations""]","[""software"", ""analysis"", ""it"", ""programming"", ""cybersecurity""]",5,Senior Developers & Tech Leads,"[""cloud computing"", ""machine learning"", ""web development"", ""data science""]",51,7,2025-10-25 21:55:30,en,What are the cost considerations for {keyword}?,0.63,0.8977546519290319,0.75
42300987,web development,it,What tools are essential for web development development?,planning,Intermediate,"[""Introduction to web development"", ""Key points and analysis"", ""Practical examples"", ""Expert insights"", ""Action items"", ""Conclusion""]","[""software"", ""planning"", ""development"", ""it"", ""web""]",4,Junior to Mid-level Developers,"[""machine learning"", ""data science"", ""cybersecurity"", ""cloud computing""]",57,8,2025-10-25 21:55:30,en,What tools are essential for {keyword} development?,0.66,0.7361663931575072,0.65
42300988,cloud computing,it,How do you convince stakeholders to invest in cloud computing?,best_practice,Intermediate,"[""Overview of cloud computing"", ""Step-by-step implementation"", ""Best practices and tips"", ""Common challenges and solutions"", ""Tools and resources needed"", ""Conclusion and next steps""]","[""computing"", ""it"", ""programming"", ""best_practice"", ""cloud"", ""technology""]",6,Junior to Mid-level Developers,"[""web development"", ""data science"", ""cybersecurity"", ""machine learning""]",62,10,2025-10-25 21:55:30,en,How do you convince stakeholders to invest in {keyword}?,0.68,0.6214854550507996,0.5
42300989,portfolio management,economics,How do economic conditions affect portfolio management performance?,analysis,Expert,"[""Introduction to portfolio management"", ""Key points and analysis"", ""Practical examples"", ""Expert insights"", ""Action items"", ""Conclusion""]","[""analysis"", ""portfolio"", ""management"", ""market"", ""business"", ""economics""]",4,Portfolio Managers & Financial Experts,"[""market analysis"", ""financial modeling"", ""investment planning""]",67,8,2025-10-25 21:55:30,en,How do economic conditions affect {keyword} performance?,0.75,1.0,0.55
42300990,market analysis,economics,How do you create a long-term plan for market analysis?,analysis,Beginner,"[""Overview of market analysis"", ""Step-by-step implementation"", ""Best practices and tips"", ""Common challenges and solutions"", ""Tools and resources needed"", ""Conclusion and next steps""]","[""finance"", ""market"", ""economics"", ""analysis""]",6,Students & New Investors,"[""investment planning"", ""financial modeling"", ""portfolio management""]",55,10,2025-10-25 21:55:30,en,How do you create a long-term plan for {keyword}?,0.75,0.45701694082489674,0.8
42300991,cybersecurity,it,What tools are essential for cybersecurity development?,planning,Expert,"[""Introduction to cybersecurity"", ""Key points and analysis"", ""Practical examples"", ""Expert insights"", ""Action items"", ""Conclusion""]","[""software"", ""planning"", ""development"", ""it"", ""cybersecurity""]",4,Architects & Technical Directors,"[""data science"", ""cloud computing"", ""machine learning"", ""web development""]",55,7,2025-10-25 21:55:30,en,What tools are essential for {keyword} development?,0.81,1.0,0.69
42300992,digital marketing,marketing,How do you measure the ROI of digital marketing campaigns?,planning,Expert,"[""Overview of digital marketing"", ""Step-by-step implementation"", ""Best practices and tips"", ""Common challenges and solutions"", ""Tools and resources needed"", ""Conclusion and next steps""]","[""planning"", ""promotion"", ""marketing"", ""digital"", ""branding""]",6,Marketing Directors & CMOs,"[""content marketing"", ""brand management"", ""social media""]",58,10,2025-10-25 21:55:30,en,How do you measure the ROI of {keyword} campaigns?,0.67,1.0,0.64
42300993,social media,marketing,What emerging platforms support social media?,how_to,Advanced,"[""Introduction to social media"", ""Key points and analysis"", ""Practical examples"", ""Expert insights"", ""Action items"", ""Conclusion""]","[""how_to"", ""media"", ""promotion"", ""digital"", ""marketing"", ""social""]",4,Marketing Managers & Strategists,"[""digital marketing"", ""brand management"", ""content marketing""]",45,6,2025-10-25 21:55:30,en,What emerging platforms support {keyword}?,0.84,0.9821833780824702,0.38
42300994,portfolio management,economics,What are the seasonal patterns in portfolio management?,how_to,Advanced,"[""Introduction to portfolio management"", ""Key concepts and definitions"", ""Main categories or types"", ""Examples and case studies"", ""Benefits and advantages"", ""Summary and recommendations""]","[""how_to"", ""portfolio"", ""management"", ""market"", ""business"", ""economics""]",6,Professional Investors & Advisors,"[""market analysis"", ""financial modeling"", ""investment planning""]",55,8,2025-10-25 21:55:30,en,What are the seasonal patterns in {keyword}?,0.79,0.95435578425464,0.84
42300995,social media,marketing,What content types work best for social media?,planning,Beginner,"[""Introduction to social media"", ""Key points and analysis"", ""Practical examples"", ""Expert insights"", ""Action items"", ""Conclusion""]","[""planning"", ""media"", ""marketing"", ""digital"", ""social"", ""advertising""]",4,Marketing Students & Interns,"[""content marketing"", ""digital marketing"", ""brand management""]",46,8,2025-10-25 21:55:30,en,What content types work best for {keyword}?,0.85,0.42898513335494554,0.48
42300996,market analysis,economics,What metrics are most important for market analysis?,evaluation,Advanced,"[""Introduction to market analysis"", ""Key points and analysis"", ""Practical examples"", ""Expert insights"", ""Action items"", ""Conclusion""]","[""analysis"", ""evaluation"", ""market"", ""business"", ""economics""]",4,Professional Investors & Advisors,"[""portfolio management"", ""financial modeling"", ""investment planning""]",52,8,2025-10-25 21:55:30,en,What metrics are most important for {keyword}?,0.68,0.9234030558793861,0.32
42300997,data science,it,What are the key components of a data science implementation?,strategy,Beginner,"[""Introduction to data science"", ""Key concepts and definitions"", ""Main categories or types"", ""Examples and case studies"", ""Benefits and advantages"", ""Summary and recommendations""]","[""software"", ""development"", ""it"", ""science"", ""strategy"", ""data""]",6,Students & Entry-level Developers,"[""web development"", ""cybersecurity"", ""cloud computing"", ""machine learning""]",61,10,2025-10-25 21:55:30,en,What are the key components of a {keyword} implementation?,0.9,0.3260209897638876,0.46
42300998,content marketing,marketing,What content types work best for content marketing?,best_practice,Beginner,"[""Introduction to content marketing"", ""Key points and analysis"", ""Practical examples"", ""Expert insights"", ""Action items"", ""Conclusion""]","[""content"", ""promotion"", ""best_practice"", ""marketing"", ""digital""]",4,Marketing Students & Interns,"[""digital marketing"", ""brand management"", ""social media""]",51,8,2025-10-25 21:55:30,en,What content types work best for {keyword}?,0.6,0.38697329664238306,0.34
42300999,content marketing,marketing,What channels are most effective for content marketing?,optimization,Expert,"[""Introduction to content marketing"", ""Key points and analysis"", ""Practical examples"", ""Expert insights"", ""Action items"", ""Conclusion""]","[""content"", ""promotion"", ""marketing"", ""advertising"", ""optimization""]",4,Marketing Directors & CMOs,"[""brand management"", ""social media"", ""digital marketing""]",55,8,2025-10-25 21:55:30,en,What channels are most effective for {keyword}?,0.63,1.0,0.33
