record_id,keyword,category,question,question_type,difficulty_level,answer_outline,tags,estimated_read_time,target_audience,related_topics,question_length,word_count,created_date,language,source_template,engagement_score,complexity_score,popularity_score
42300349,market analysis,economics,How does global economics impact market analysis?,comparison,Beginner,"[""Introduction to market analysis"", ""Key points and analysis"", ""Practical examples"", ""Expert insights"", ""Action items"", ""Conclusion""]","[""analysis"", ""comparison"", ""market"", ""business"", ""economics""]",4,Students & New Investors,"[""investment planning"", ""portfolio management"", ""financial modeling""]",49,7,2025-10-25 21:55:30,en,How does global economics impact {keyword}?,0.73,0.3171402783420802,0.86
42300350,web development,it,What tools are essential for web development development?,comparison,Advanced,"[""Introduction to web development"", ""Key points and analysis"", ""Practical examples"", ""Expert insights"", ""Action items"", ""Conclusion""]","[""software"", ""development"", ""web"", ""it"", ""comparison"", ""technology""]",4,Senior Developers & Tech Leads,"[""data science"", ""machine learning"", ""cybersecurity"", ""cloud computing""]",57,8,2025-10-25 21:55:30,en,What tools are essential for {keyword} development?,0.79,0.9564080781971858,0.82
42300351,market analysis,economics,How does global economics impact market analysis?,implementation,Expert,"[""Introduction to market analysis"", ""Key points and analysis"", ""Practical examples"", ""Expert insights"", ""Action items"", ""Conclusion""]","[""investment"", ""analysis"", ""implementation"", ""market"", ""economics""]",4,Portfolio Managers & Financial Experts,"[""financial modeling"", ""investment planning"", ""portfolio management""]",49,7,2025-10-25 21:55:30,en,How does global economics impact {keyword}?,0.79,1.0,0.33
42300352,social media,marketing,What emerging platforms support social media?,troubleshooting,Advanced,"[""Introduction to social media"", ""Key points and analysis"", ""Practical examples"", ""Expert insights"", ""Action items"", ""Conclusion""]","[""media"", ""troubleshooting"", ""marketing"", ""digital"", ""social"", ""advertising""]",4,Marketing Managers & Strategists,"[""digital marketing"", ""content marketing"", ""brand management""]",45,6,2025-10-25 21:55:30,en,What emerging platforms support {keyword}?,0.89,0.9527969806513098,0.81
42300353,web development,it,How does web development impact business operations?,how_to,Beginner,"[""Introduction to web development"", ""Key points and analysis"", ""Practical examples"", ""Expert insights"", ""Action items"", ""Conclusion""]","[""how_to"", ""software"", ""development"", ""web"", ""it"", ""technology""]",4,Students & Entry-level Developers,"[""data science"", ""machine learning"", ""cloud computing"", ""cybersecurity""]",52,7,2025-10-25 21:55:30,en,How does {keyword} impact business operations?,0.87,0.3002654812792726,0.69
42300354,investment planning,economics,What are the regulatory considerations for investment planning?,comparison,Advanced,"[""Introduction to investment planning"", ""Key concepts and definitions"", ""Main categories or types"", ""Examples and case studies"", ""Benefits and advantages"", ""Summary and recommendations""]","[""investment"", ""planning"", ""comparison"", ""market"", ""business"", ""economics""]",6,Professional Investors & Advisors,"[""portfolio management"", ""market analysis"", ""financial modeling""]",63,8,2025-10-25 21:55:30,en,What are the regulatory considerations for {keyword}?,0.65,0.8178633722412118,0.85
42300355,portfolio management,economics,How do you create a long-term plan for portfolio management?,planning,Intermediate,"[""Overview of portfolio management"", ""Step-by-step implementation"", ""Best practices and tips"", ""Common challenges and solutions"", ""Tools and resources needed"", ""Conclusion and next steps""]","[""planning"", ""portfolio"", ""management"", ""market"", ""business"", ""economics""]",6,Individual Investors & Analysts,"[""investment planning"", ""financial modeling"", ""market analysis""]",60,10,2025-10-25 21:55:30,en,How do you create a long-term plan for {keyword}?,0.8,0.7745304089803441,0.86
42300356,investment planning,economics,How do you benchmark investment planning against alternatives?,strategy,Expert,"[""Overview of investment planning"", ""Step-by-step implementation"", ""Best practices and tips"", ""Common challenges and solutions"", ""Tools and resources needed"", ""Conclusion and next steps""]","[""investment"", ""planning"", ""finance"", ""business"", ""strategy"", ""economics""]",6,Portfolio Managers & Financial Experts,"[""financial modeling"", ""market analysis"", ""portfolio management""]",62,8,2025-10-25 21:55:30,en,How do you benchmark {keyword} against alternatives?,0.9,1.0,0.57
42300357,brand management,marketing,How do you create a brand management roadmap?,comparison,Expert,"[""Overview of brand management"", ""Step-by-step implementation"", ""Best practices and tips"", ""Common challenges and solutions"", ""Tools and resources needed"", ""Conclusion and next steps""]","[""comparison"", ""marketing"", ""management"", ""advertising"", ""branding"", ""brand""]",6,Marketing Directors & CMOs,"[""digital marketing"", ""social media"", ""content marketing""]",45,8,2025-10-25 21:55:30,en,How do you create a {keyword} roadmap?,0.91,1.0,0.54
42300358,portfolio management,economics,What are the seasonal patterns in portfolio management?,how_to,Expert,"[""Introduction to portfolio management"", ""Key concepts and definitions"", ""Main categories or types"", ""Examples and case studies"", ""Benefits and advantages"", ""Summary and recommendations""]","[""investment"", ""how_to"", ""portfolio"", ""management"", ""business"", ""economics""]",6,Portfolio Managers & Financial Experts,"[""financial modeling"", ""investment planning"", ""market analysis""]",55,8,2025-10-25 21:55:30,en,What are the seasonal patterns in {keyword}?,0.88,1.0,0.77
42300359,financial modeling,economics,How do you protect your financial modeling investments?,best_practice,Advanced,"[""Overview of financial modeling"", ""Step-by-step implementation"", ""Best practices and tips"", ""Common challenges and solutions"", ""Tools and resources needed"", ""Conclusion and next steps""]","[""best_practice"", ""modeling"", ""financial"", ""market"", ""business"", ""economics""]",6,Professional Investors & Advisors,"[""market analysis"", ""portfolio management"", ""investment planning""]",55,8,2025-10-25 21:55:30,en,How do you protect your {keyword} investments?,0.77,0.8696508803437998,0.76
42300360,web development,it,How do you design a scalable web development solution?,optimization,Beginner,"[""Overview of web development"", ""Step-by-step implementation"", ""Best practices and tips"", ""Common challenges and solutions"", ""Tools and resources needed"", ""Conclusion and next steps""]","[""software"", ""development"", ""it"", ""programming"", ""optimization"", ""web""]",6,Students & Entry-level Developers,"[""cloud computing"", ""machine learning"", ""data science"", ""cybersecurity""]",54,9,2025-10-25 21:55:30,en,How do you design a scalable {keyword} solution?,0.84,0.4068423720673976,0.72
42300361,digital marketing,marketing,How do you automate digital marketing processes?,optimization,Beginner,"[""Overview of digital marketing"", ""Step-by-step implementation"", ""Best practices and tips"", ""Common challenges and solutions"", ""Tools and resources needed"", ""Conclusion and next steps""]","[""promotion"", ""marketing"", ""digital"", ""branding"", ""optimization""]",6,Marketing Students & Interns,"[""content marketing"", ""brand management"", ""social media""]",48,7,2025-10-25 21:55:30,en,How do you automate {keyword} processes?,0.73,0.38116230458293976,0.71
42300362,market analysis,economics,What metrics are most important for market analysis?,optimization,Advanced,"[""Introduction to market analysis"", ""Key points and analysis"", ""Practical examples"", ""Expert insights"", ""Action items"", ""Conclusion""]","[""analysis"", ""business"", ""market"", ""optimization"", ""economics""]",4,Professional Investors & Advisors,"[""portfolio management"", ""investment planning"", ""financial modeling""]",52,8,2025-10-25 21:55:30,en,What metrics are most important for {keyword}?,0.89,0.8881555095612423,0.57
42300363,brand management,marketing,How do you automate brand management processes?,implementation,Beginner,"[""Overview of brand management"", ""Step-by-step implementation"", ""Best practices and tips"", ""Common challenges and solutions"", ""Tools and resources needed"", ""Conclusion and next steps""]","[""implementation"", ""promotion"", ""marketing"", ""digital"", ""management"", ""brand""]",6,Marketing Students & Interns,"[""content marketing"", ""social media"", ""digital marketing""]",47,7,2025-10-25 21:55:30,en,How do you automate {keyword} processes?,0.87,0.4379102455120135,0.72
42300364,financial modeling,economics,How do you assess and manage financial modeling risks?,implementation,Expert,"[""Overview of financial modeling"", ""Step-by-step implementation"", ""Best practices and tips"", ""Common challenges and solutions"", ""Tools and resources needed"", ""Conclusion and next steps""]","[""investment"", ""finance"", ""implementation"", ""modeling"", ""financial"", ""economics""]",6,Portfolio Managers & Financial Experts,"[""investment planning"", ""market analysis"", ""portfolio management""]",54,9,2025-10-25 21:55:30,en,How do you assess and manage {keyword} risks?,0.85,1.0,0.75
42300365,financial modeling,economics,What insurance options are available for financial modeling?,best_practice,Advanced,"[""Introduction to financial modeling"", ""Key points and analysis"", ""Practical examples"", ""Expert insights"", ""Action items"", ""Conclusion""]","[""finance"", ""best_practice"", ""modeling"", ""financial"", ""market"", ""economics""]",4,Professional Investors & Advisors,"[""market analysis"", ""portfolio management"", ""investment planning""]",60,8,2025-10-25 21:55:30,en,What insurance options are available for {keyword}?,0.62,0.9497083220254852,0.5
42300366,portfolio management,economics,How do you benchmark portfolio management against alternatives?,troubleshooting,Intermediate,"[""Overview of portfolio management"", ""Step-by-step implementation"", ""Best practices and tips"", ""Common challenges and solutions"", ""Tools and resources needed"", ""Conclusion and next steps""]","[""finance"", ""portfolio"", ""troubleshooting"", ""management"", ""market"", ""economics""]",6,Individual Investors & Analysts,"[""market analysis"", ""financial modeling"", ""investment planning""]",63,8,2025-10-25 21:55:30,en,How do you benchmark {keyword} against alternatives?,0.77,0.6264753367723335,0.5
42300367,social media,marketing,What does the future hold for social media?,implementation,Expert,"[""Introduction to social media"", ""Key points and analysis"", ""Practical examples"", ""Expert insights"", ""Action items"", ""Conclusion""]","[""media"", ""implementation"", ""promotion"", ""marketing"", ""social"", ""branding""]",4,Marketing Directors & CMOs,"[""digital marketing"", ""content marketing"", ""brand management""]",43,8,2025-10-25 21:55:30,en,What does the future hold for {keyword}?,0.93,1.0,0.76
42300368,data science,it,What security considerations should be taken when using data science?,optimization,Advanced,"[""Introduction to data science"", ""Key points and analysis"", ""Practical examples"", ""Expert insights"", ""Action items"", ""Conclusion""]","[""development"", ""it"", ""programming"", ""science"", ""optimization"", ""data""]",4,Senior Developers & Tech Leads,"[""cybersecurity"", ""cloud computing"", ""machine learning"", ""web development""]",69,10,2025-10-25 21:55:30,en,What security considerations should be taken when using {keyword}?,0.72,0.8956443689890343,0.42
42300369,brand management,marketing,How do you attribute success to brand management efforts?,comparison,Intermediate,"[""Overview of brand management"", ""Step-by-step implementation"", ""Best practices and tips"", ""Common challenges and solutions"", ""Tools and resources needed"", ""Conclusion and next steps""]","[""comparison"", ""marketing"", ""management"", ""advertising"", ""branding"", ""brand""]",6,Marketing Coordinators & Specialists,"[""content marketing"", ""digital marketing"", ""social media""]",57,9,2025-10-25 21:55:30,en,How do you attribute success to {keyword} efforts?,0.67,0.6796828232426201,0.62
42300370,portfolio management,economics,What are the risks associated with portfolio management?,optimization,Expert,"[""Introduction to portfolio management"", ""Key concepts and definitions"", ""Main categories or types"", ""Examples and case studies"", ""Benefits and advantages"", ""Summary and recommendations""]","[""investment"", ""portfolio"", ""management"", ""business"", ""optimization"", ""economics""]",6,Portfolio Managers & Financial Experts,"[""financial modeling"", ""investment planning"", ""market analysis""]",56,8,2025-10-25 21:55:30,en,What are the risks associated with {keyword}?,0.72,1.0,0.47
42300371,investment planning,economics,How do you diversify your portfolio using investment planning?,optimization,Expert,"[""Overview of investment planning"", ""Step-by-step implementation"", ""Best practices and tips"", ""Common challenges and solutions"", ""Tools and resources needed"", ""Conclusion and next steps""]","[""investment"", ""planning"", ""market"", ""optimization"", ""economics""]",6,Portfolio Managers & Financial Experts,"[""market analysis"", ""portfolio management"", ""financial modeling""]",62,9,2025-10-25 21:55:30,en,How do you diversify your portfolio using {keyword}?,0.65,1.0,0.75
42300372,financial modeling,economics,What are the risks associated with financial modeling?,optimization,Beginner,"[""Introduction to financial modeling"", ""Key concepts and definitions"", ""Main categories or types"", ""Examples and case studies"", ""Benefits and advantages"", ""Summary and recommendations""]","[""investment"", ""modeling"", ""financial"", ""business"", ""optimization"", ""economics""]",6,Students & New Investors,"[""market analysis"", ""investment planning"", ""portfolio management""]",54,8,2025-10-25 21:55:30,en,What are the risks associated with {keyword}?,0.81,0.4960151417004911,0.51
42300373,content marketing,marketing,How do you measure the ROI of content marketing campaigns?,best_practice,Expert,"[""Overview of content marketing"", ""Step-by-step implementation"", ""Best practices and tips"", ""Common challenges and solutions"", ""Tools and resources needed"", ""Conclusion and next steps""]","[""content"", ""promotion"", ""best_practice"", ""marketing"", ""digital""]",6,Marketing Directors & CMOs,"[""social media"", ""brand management"", ""digital marketing""]",58,10,2025-10-25 21:55:30,en,How do you measure the ROI of {keyword} campaigns?,0.8,1.0,0.38
42300374,digital marketing,marketing,What KPIs are most important for digital marketing?,planning,Expert,"[""Introduction to digital marketing"", ""Key points and analysis"", ""Practical examples"", ""Expert insights"", ""Action items"", ""Conclusion""]","[""marketing"", ""promotion"", ""planning"", ""digital""]",4,Marketing Directors & CMOs,"[""social media"", ""content marketing"", ""brand management""]",51,8,2025-10-25 21:55:30,en,What KPIs are most important for {keyword}?,0.61,1.0,0.34
42300375,web development,it,What ROI can be expected from web development implementation?,implementation,Beginner,"[""Introduction to web development"", ""Key points and analysis"", ""Practical examples"", ""Expert insights"", ""Action items"", ""Conclusion""]","[""development"", ""it"", ""implementation"", ""programming"", ""web""]",4,Students & Entry-level Developers,"[""cybersecurity"", ""data science"", ""cloud computing"", ""machine learning""]",61,9,2025-10-25 21:55:30,en,What ROI can be expected from {keyword} implementation?,0.73,0.35124563583115026,0.73
42300376,digital marketing,marketing,How do you innovate within digital marketing?,optimization,Advanced,"[""Overview of digital marketing"", ""Step-by-step implementation"", ""Best practices and tips"", ""Common challenges and solutions"", ""Tools and resources needed"", ""Conclusion and next steps""]","[""marketing"", ""optimization"", ""advertising"", ""digital""]",6,Marketing Managers & Strategists,"[""brand management"", ""content marketing"", ""social media""]",45,7,2025-10-25 21:55:30,en,How do you innovate within {keyword}?,0.78,0.9120946724722475,0.56
42300377,cloud computing,it,How do you implement cloud computing in a production environment?,evaluation,Beginner,"[""Overview of cloud computing"", ""Step-by-step implementation"", ""Best practices and tips"", ""Common challenges and solutions"", ""Tools and resources needed"", ""Conclusion and next steps""]","[""computing"", ""software"", ""it"", ""programming"", ""evaluation"", ""cloud""]",6,Students & Entry-level Developers,"[""web development"", ""machine learning"", ""cybersecurity"", ""data science""]",65,10,2025-10-25 21:55:30,en,How do you implement {keyword} in a production environment?,0.61,0.3491009476357507,0.86
42300378,portfolio management,economics,How do you protect your portfolio management investments?,how_to,Intermediate,"[""Overview of portfolio management"", ""Step-by-step implementation"", ""Best practices and tips"", ""Common challenges and solutions"", ""Tools and resources needed"", ""Conclusion and next steps""]","[""how_to"", ""portfolio"", ""management"", ""market"", ""business"", ""economics""]",6,Individual Investors & Analysts,"[""financial modeling"", ""investment planning"", ""market analysis""]",57,8,2025-10-25 21:55:30,en,How do you protect your {keyword} investments?,0.8,0.7557407214225843,0.39
42300379,web development,it,What certifications are valuable for web development professionals?,planning,Expert,"[""Introduction to web development"", ""Key points and analysis"", ""Practical examples"", ""Expert insights"", ""Action items"", ""Conclusion""]","[""technology"", ""software"", ""planning"", ""development"", ""it"", ""web""]",4,Architects & Technical Directors,"[""machine learning"", ""cybersecurity"", ""cloud computing"", ""data science""]",67,8,2025-10-25 21:55:30,en,What certifications are valuable for {keyword} professionals?,0.75,1.0,0.61
42300380,financial modeling,economics,How do you create a long-term plan for financial modeling?,troubleshooting,Beginner,"[""Overview of financial modeling"", ""Step-by-step implementation"", ""Best practices and tips"", ""Common challenges and solutions"", ""Tools and resources needed"", ""Conclusion and next steps""]","[""troubleshooting"", ""modeling"", ""financial"", ""market"", ""business"", ""economics""]",6,Students & New Investors,"[""investment planning"", ""portfolio management"", ""market analysis""]",58,10,2025-10-25 21:55:30,en,How do you create a long-term plan for {keyword}?,0.63,0.3573743598745993,0.44
42300381,financial modeling,economics,What factors should be considered when evaluating financial modeling?,comparison,Beginner,"[""Introduction to financial modeling"", ""Key points and analysis"", ""Practical examples"", ""Expert insights"", ""Action items"", ""Conclusion""]","[""comparison"", ""modeling"", ""financial"", ""market"", ""business"", ""economics""]",4,Students & New Investors,"[""investment planning"", ""market analysis"", ""portfolio management""]",69,9,2025-10-25 21:55:30,en,What factors should be considered when evaluating {keyword}?,0.87,0.3692591869038827,0.78
42300382,machine learning,it,What is the recommended architecture for machine learning systems?,analysis,Advanced,"[""Introduction to machine learning"", ""Key points and analysis"", ""Practical examples"", ""Expert insights"", ""Action items"", ""Conclusion""]","[""analysis"", ""it"", ""programming"", ""learning"", ""machine"", ""technology""]",4,Senior Developers & Tech Leads,"[""web development"", ""cloud computing"", ""data science"", ""cybersecurity""]",66,9,2025-10-25 21:55:30,en,What is the recommended architecture for {keyword} systems?,0.72,0.9145936129819396,0.88
42300383,financial modeling,economics,How does global economics impact financial modeling?,how_to,Advanced,"[""Introduction to financial modeling"", ""Key points and analysis"", ""Practical examples"", ""Expert insights"", ""Action items"", ""Conclusion""]","[""investment"", ""how_to"", ""finance"", ""modeling"", ""financial"", ""economics""]",4,Professional Investors & Advisors,"[""investment planning"", ""market analysis"", ""portfolio management""]",52,7,2025-10-25 21:55:30,en,How does global economics impact {keyword}?,0.73,0.9461085594077498,0.64
42300384,brand management,marketing,What emerging platforms support brand management?,evaluation,Advanced,"[""Introduction to brand management"", ""Key points and analysis"", ""Practical examples"", ""Expert insights"", ""Action items"", ""Conclusion""]","[""marketing"", ""management"", ""advertising"", ""branding"", ""evaluation"", ""brand""]",4,Marketing Managers & Strategists,"[""digital marketing"", ""social media"", ""content marketing""]",49,6,2025-10-25 21:55:30,en,What emerging platforms support {keyword}?,0.84,0.830801706690286,0.35
42300385,web development,it,What security considerations should be taken when using web development?,best_practice,Advanced,"[""Introduction to web development"", ""Key points and analysis"", ""Practical examples"", ""Expert insights"", ""Action items"", ""Conclusion""]","[""software"", ""development"", ""it"", ""best_practice"", ""web""]",4,Senior Developers & Tech Leads,"[""data science"", ""cloud computing"", ""cybersecurity"", ""machine learning""]",72,10,2025-10-25 21:55:30,en,What security considerations should be taken when using {keyword}?,0.73,0.9372023139506698,0.38
42300386,market analysis,economics,What timeline is realistic for market analysis returns?,analysis,Intermediate,"[""Introduction to market analysis"", ""Key points and analysis"", ""Practical examples"", ""Expert insights"", ""Action items"", ""Conclusion""]","[""finance"", ""analysis"", ""market"", ""business"", ""economics""]",4,Individual Investors & Analysts,"[""investment planning"", ""financial modeling"", ""portfolio management""]",55,8,2025-10-25 21:55:30,en,What timeline is realistic for {keyword} returns?,0.77,0.605260763831821,0.85
42300387,financial modeling,economics,How do you create a long-term plan for financial modeling?,strategy,Expert,"[""Overview of financial modeling"", ""Step-by-step implementation"", ""Best practices and tips"", ""Common challenges and solutions"", ""Tools and resources needed"", ""Conclusion and next steps""]","[""finance"", ""modeling"", ""financial"", ""market"", ""strategy"", ""economics""]",6,Portfolio Managers & Financial Experts,"[""investment planning"", ""portfolio management"", ""market analysis""]",58,10,2025-10-25 21:55:30,en,How do you create a long-term plan for {keyword}?,0.95,1.0,0.47
42300388,cybersecurity,it,How does cybersecurity impact business operations?,best_practice,Intermediate,"[""Introduction to cybersecurity"", ""Key points and analysis"", ""Practical examples"", ""Expert insights"", ""Action items"", ""Conclusion""]","[""software"", ""it"", ""best_practice"", ""cybersecurity"", ""technology""]",4,Junior to Mid-level Developers,"[""data science"", ""machine learning"", ""web development"", ""cloud computing""]",50,6,2025-10-25 21:55:30,en,How does {keyword} impact business operations?,0.71,0.7505381854371181,0.81
42300389,cloud computing,it,What are the cost considerations for cloud computing?,analysis,Expert,"[""Introduction to cloud computing"", ""Key concepts and definitions"", ""Main categories or types"", ""Examples and case studies"", ""Benefits and advantages"", ""Summary and recommendations""]","[""computing"", ""development"", ""analysis"", ""it"", ""programming"", ""cloud""]",6,Architects & Technical Directors,"[""data science"", ""machine learning"", ""web development"", ""cybersecurity""]",53,8,2025-10-25 21:55:30,en,What are the cost considerations for {keyword}?,0.89,1.0,0.83
42300390,investment planning,economics,How do you measure investment planning performance?,troubleshooting,Expert,"[""Overview of investment planning"", ""Step-by-step implementation"", ""Best practices and tips"", ""Common challenges and solutions"", ""Tools and resources needed"", ""Conclusion and next steps""]","[""investment"", ""planning"", ""finance"", ""troubleshooting"", ""economics""]",6,Portfolio Managers & Financial Experts,"[""portfolio management"", ""financial modeling"", ""market analysis""]",51,7,2025-10-25 21:55:30,en,How do you measure {keyword} performance?,0.72,1.0,0.61
42300391,portfolio management,economics,How do you create a long-term plan for portfolio management?,troubleshooting,Intermediate,"[""Overview of portfolio management"", ""Step-by-step implementation"", ""Best practices and tips"", ""Common challenges and solutions"", ""Tools and resources needed"", ""Conclusion and next steps""]","[""finance"", ""portfolio"", ""troubleshooting"", ""management"", ""business"", ""economics""]",6,Individual Investors & Analysts,"[""financial modeling"", ""investment planning"", ""market analysis""]",60,10,2025-10-25 21:55:30,en,How do you create a long-term plan for {keyword}?,0.68,0.7392339999749816,0.87
