record_id,keyword,category,question,question_type,difficulty_level,answer_outline,tags,estimated_read_time,target_audience,related_topics,question_length,word_count,created_date,language,source_template,engagement_score,complexity_score,popularity_score
35100001,data science,it,What are the latest trends in data science technology?,planning,Intermediate,"[""Introduction to data science"", ""Key concepts and definitions"", ""Main categories or types"", ""Examples and case studies"", ""Benefits and advantages"", ""Summary and recommendations""]","[""software"", ""planning"", ""it"", ""programming"", ""science"", ""data""]",6,Junior to Mid-level Developers,"[""cloud computing"", ""machine learning"", ""web development"", ""cybersecurity""]",54,9,2025-10-25 21:45:37,en,What are the latest trends in {keyword} technology?,0.62,0.7475133280744328,0.35
35100002,digital marketing,marketing,What KPIs are most important for digital marketing?,analysis,Advanced,"[""Introduction to digital marketing"", ""Key points and analysis"", ""Practical examples"", ""Expert insights"", ""Action items"", ""Conclusion""]","[""analysis"", ""promotion"", ""marketing"", ""digital"", ""advertising""]",4,Marketing Managers & Strategists,"[""content marketing"", ""brand management"", ""social media""]",51,8,2025-10-25 21:45:37,en,What KPIs are most important for {keyword}?,0.63,0.8837759899590446,0.34
35100003,investment planning,economics,How do you analyze market trends in investment planning?,analysis,Expert,"[""Overview of investment planning"", ""Step-by-step implementation"", ""Best practices and tips"", ""Common challenges and solutions"", ""Tools and resources needed"", ""Conclusion and next steps""]","[""investment"", ""planning"", ""finance"", ""analysis"", ""economics""]",6,Portfolio Managers & Financial Experts,"[""market analysis"", ""portfolio management"", ""financial modeling""]",56,9,2025-10-25 21:45:37,en,How do you analyze market trends in {keyword}?,0.94,1.0,0.37
35100004,financial modeling,economics,What insurance options are available for financial modeling?,planning,Expert,"[""Introduction to financial modeling"", ""Key points and analysis"", ""Practical examples"", ""Expert insights"", ""Action items"", ""Conclusion""]","[""planning"", ""modeling"", ""financial"", ""market"", ""business"", ""economics""]",4,Portfolio Managers & Financial Experts,"[""portfolio management"", ""market analysis"", ""investment planning""]",60,8,2025-10-25 21:45:37,en,What insurance options are available for {keyword}?,0.93,1.0,0.66
35100005,brand management,marketing,How do you attribute success to brand management efforts?,comparison,Beginner,"[""Overview of brand management"", ""Step-by-step implementation"", ""Best practices and tips"", ""Common challenges and solutions"", ""Tools and resources needed"", ""Conclusion and next steps""]","[""promotion"", ""comparison"", ""marketing"", ""management"", ""advertising"", ""brand""]",6,Marketing Students & Interns,"[""content marketing"", ""social media"", ""digital marketing""]",57,9,2025-10-25 21:45:37,en,How do you attribute success to {keyword} efforts?,0.84,0.3720438851709125,0.75
35100006,digital marketing,marketing,How do you track and analyze digital marketing performance?,planning,Advanced,"[""Overview of digital marketing"", ""Step-by-step implementation"", ""Best practices and tips"", ""Common challenges and solutions"", ""Tools and resources needed"", ""Conclusion and next steps""]","[""planning"", ""promotion"", ""marketing"", ""digital"", ""advertising""]",6,Marketing Managers & Strategists,"[""content marketing"", ""social media"", ""brand management""]",59,9,2025-10-25 21:45:37,en,How do you track and analyze {keyword} performance?,0.73,0.8462203362206313,0.72
35100007,brand management,marketing,How do you attribute success to brand management efforts?,implementation,Intermediate,"[""Overview of brand management"", ""Step-by-step implementation"", ""Best practices and tips"", ""Common challenges and solutions"", ""Tools and resources needed"", ""Conclusion and next steps""]","[""implementation"", ""promotion"", ""marketing"", ""management"", ""advertising"", ""brand""]",6,Marketing Coordinators & Specialists,"[""social media"", ""digital marketing"", ""content marketing""]",57,9,2025-10-25 21:45:37,en,How do you attribute success to {keyword} efforts?,0.71,0.7108304850371767,0.55
35100008,brand management,marketing,How do you develop an effective brand management strategy?,planning,Beginner,"[""Overview of brand management"", ""Step-by-step implementation"", ""Best practices and tips"", ""Common challenges and solutions"", ""Tools and resources needed"", ""Conclusion and next steps""]","[""planning"", ""digital"", ""marketing"", ""management"", ""advertising"", ""brand""]",6,Marketing Students & Interns,"[""digital marketing"", ""social media"", ""content marketing""]",58,9,2025-10-25 21:45:37,en,How do you develop an effective {keyword} strategy?,0.61,0.35312348468181254,0.72
35100009,investment planning,economics,How do you benchmark investment planning against alternatives?,comparison,Beginner,"[""Overview of investment planning"", ""Step-by-step implementation"", ""Best practices and tips"", ""Common challenges and solutions"", ""Tools and resources needed"", ""Conclusion and next steps""]","[""investment"", ""planning"", ""comparison"", ""market"", ""business"", ""economics""]",6,Students & New Investors,"[""portfolio management"", ""financial modeling"", ""market analysis""]",62,8,2025-10-25 21:45:37,en,How do you benchmark {keyword} against alternatives?,0.9,0.4039158900143631,0.56
35100010,market analysis,economics,What are the risks associated with market analysis?,analysis,Intermediate,"[""Introduction to market analysis"", ""Key concepts and definitions"", ""Main categories or types"", ""Examples and case studies"", ""Benefits and advantages"", ""Summary and recommendations""]","[""market"", ""investment"", ""economics"", ""analysis""]",6,Individual Investors & Analysts,"[""investment planning"", ""portfolio management"", ""financial modeling""]",51,8,2025-10-25 21:45:37,en,What are the risks associated with {keyword}?,0.88,0.6627074521613641,0.46
35100011,investment planning,economics,How do you report on investment planning performance to stakeholders?,analysis,Beginner,"[""Overview of investment planning"", ""Step-by-step implementation"", ""Best practices and tips"", ""Common challenges and solutions"", ""Tools and resources needed"", ""Conclusion and next steps""]","[""investment"", ""planning"", ""analysis"", ""market"", ""business"", ""economics""]",6,Students & New Investors,"[""financial modeling"", ""portfolio management"", ""market analysis""]",69,10,2025-10-25 21:45:37,en,How do you report on {keyword} performance to stakeholders?,0.75,0.4539722428860603,0.78
35100012,social media,marketing,What does the future hold for social media?,optimization,Beginner,"[""Introduction to social media"", ""Key points and analysis"", ""Practical examples"", ""Expert insights"", ""Action items"", ""Conclusion""]","[""media"", ""promotion"", ""digital"", ""marketing"", ""social"", ""optimization""]",4,Marketing Students & Interns,"[""brand management"", ""digital marketing"", ""content marketing""]",43,8,2025-10-25 21:45:37,en,What does the future hold for {keyword}?,0.67,0.34412475941461146,0.59
35100013,web development,it,What are the latest trends in web development technology?,comparison,Beginner,"[""Introduction to web development"", ""Key concepts and definitions"", ""Main categories or types"", ""Examples and case studies"", ""Benefits and advantages"", ""Summary and recommendations""]","[""development"", ""it"", ""comparison"", ""programming"", ""web""]",6,Students & Entry-level Developers,"[""cybersecurity"", ""cloud computing"", ""data science"", ""machine learning""]",57,9,2025-10-25 21:45:37,en,What are the latest trends in {keyword} technology?,0.8,0.3662560236748174,0.86
35100014,machine learning,it,What design patterns work best with machine learning?,comparison,Beginner,"[""Introduction to machine learning"", ""Key points and analysis"", ""Practical examples"", ""Expert insights"", ""Action items"", ""Conclusion""]","[""software"", ""development"", ""it"", ""comparison"", ""learning"", ""machine""]",4,Students & Entry-level Developers,"[""web development"", ""cybersecurity"", ""data science"", ""cloud computing""]",53,8,2025-10-25 21:45:37,en,What design patterns work best with {keyword}?,0.78,0.41845718078013566,0.54
35100015,web development,it,How do you get started with web development as a beginner?,comparison,Beginner,"[""Overview of web development"", ""Step-by-step implementation"", ""Best practices and tips"", ""Common challenges and solutions"", ""Tools and resources needed"", ""Conclusion and next steps""]","[""technology"", ""software"", ""development"", ""it"", ""comparison"", ""web""]",6,Students & Entry-level Developers,"[""cybersecurity"", ""data science"", ""machine learning"", ""cloud computing""]",58,11,2025-10-25 21:45:37,en,How do you get started with {keyword} as a beginner?,0.8,0.3366134681917584,0.5
35100016,digital marketing,marketing,How do you reach new customers through digital marketing?,analysis,Intermediate,"[""Overview of digital marketing"", ""Step-by-step implementation"", ""Best practices and tips"", ""Common challenges and solutions"", ""Tools and resources needed"", ""Conclusion and next steps""]","[""marketing"", ""advertising"", ""analysis"", ""digital""]",6,Marketing Coordinators & Specialists,"[""brand management"", ""social media"", ""content marketing""]",57,9,2025-10-25 21:45:37,en,How do you reach new customers through {keyword}?,0.69,0.6438631549026249,0.44
35100017,digital marketing,marketing,What A/B tests should you run for digital marketing?,strategy,Expert,"[""Introduction to digital marketing"", ""Key points and analysis"", ""Practical examples"", ""Expert insights"", ""Action items"", ""Conclusion""]","[""promotion"", ""marketing"", ""digital"", ""branding"", ""strategy""]",4,Marketing Directors & CMOs,"[""brand management"", ""social media"", ""content marketing""]",52,9,2025-10-25 21:45:37,en,What A/B tests should you run for {keyword}?,0.91,1.0,0.84
35100018,social media,marketing,How do you personalize social media for different segments?,troubleshooting,Intermediate,"[""Overview of social media"", ""Step-by-step implementation"", ""Best practices and tips"", ""Common challenges and solutions"", ""Tools and resources needed"", ""Conclusion and next steps""]","[""media"", ""promotion"", ""troubleshooting"", ""digital"", ""marketing"", ""social""]",6,Marketing Coordinators & Specialists,"[""digital marketing"", ""content marketing"", ""brand management""]",59,9,2025-10-25 21:45:37,en,How do you personalize {keyword} for different segments?,0.68,0.7334322215200169,0.63
35100019,social media,marketing,How do you develop an effective social media strategy?,evaluation,Beginner,"[""Overview of social media"", ""Step-by-step implementation"", ""Best practices and tips"", ""Common challenges and solutions"", ""Tools and resources needed"", ""Conclusion and next steps""]","[""media"", ""marketing"", ""social"", ""advertising"", ""branding"", ""evaluation""]",6,Marketing Students & Interns,"[""content marketing"", ""brand management"", ""digital marketing""]",54,9,2025-10-25 21:45:37,en,How do you develop an effective {keyword} strategy?,0.94,0.3184650183489659,0.53
35100020,machine learning,it,How can machine learning improve system performance and scalability?,troubleshooting,Beginner,"[""Introduction to machine learning"", ""Key points and analysis"", ""Practical examples"", ""Expert insights"", ""Action items"", ""Conclusion""]","[""software"", ""it"", ""troubleshooting"", ""learning"", ""machine"", ""technology""]",4,Students & Entry-level Developers,"[""cybersecurity"", ""web development"", ""data science"", ""cloud computing""]",68,9,2025-10-25 21:45:37,en,How can {keyword} improve system performance and scalability?,0.64,0.45960190800299394,0.84
35100021,social media,marketing,How do you attribute success to social media efforts?,strategy,Beginner,"[""Overview of social media"", ""Step-by-step implementation"", ""Best practices and tips"", ""Common challenges and solutions"", ""Tools and resources needed"", ""Conclusion and next steps""]","[""media"", ""marketing"", ""social"", ""advertising"", ""branding"", ""strategy""]",6,Marketing Students & Interns,"[""brand management"", ""digital marketing"", ""content marketing""]",53,9,2025-10-25 21:45:37,en,How do you attribute success to {keyword} efforts?,0.82,0.3334412752208289,0.52
35100022,machine learning,it,What is the recommended architecture for machine learning systems?,comparison,Advanced,"[""Introduction to machine learning"", ""Key points and analysis"", ""Practical examples"", ""Expert insights"", ""Action items"", ""Conclusion""]","[""it"", ""comparison"", ""programming"", ""learning"", ""machine"", ""technology""]",4,Senior Developers & Tech Leads,"[""data science"", ""cloud computing"", ""web development"", ""cybersecurity""]",66,9,2025-10-25 21:45:37,en,What is the recommended architecture for {keyword} systems?,0.86,0.822824182328346,0.54
35100023,machine learning,it,What is the recommended architecture for machine learning systems?,implementation,Advanced,"[""Introduction to machine learning"", ""Key points and analysis"", ""Practical examples"", ""Expert insights"", ""Action items"", ""Conclusion""]","[""development"", ""it"", ""implementation"", ""programming"", ""learning"", ""machine""]",4,Senior Developers & Tech Leads,"[""web development"", ""data science"", ""cybersecurity"", ""cloud computing""]",66,9,2025-10-25 21:45:37,en,What is the recommended architecture for {keyword} systems?,0.83,0.9959167059193611,0.57
35100024,financial modeling,economics,What exit strategies should be considered for financial modeling?,evaluation,Beginner,"[""Introduction to financial modeling"", ""Key points and analysis"", ""Practical examples"", ""Expert insights"", ""Action items"", ""Conclusion""]","[""modeling"", ""financial"", ""evaluation"", ""market"", ""business"", ""economics""]",4,Students & New Investors,"[""market analysis"", ""portfolio management"", ""investment planning""]",65,9,2025-10-25 21:45:37,en,What exit strategies should be considered for {keyword}?,0.92,0.44832588869571566,0.76
35100025,social media,marketing,How is AI changing social media approaches?,strategy,Beginner,"[""Introduction to social media"", ""Key points and analysis"", ""Practical examples"", ""Expert insights"", ""Action items"", ""Conclusion""]","[""media"", ""promotion"", ""marketing"", ""social"", ""branding"", ""strategy""]",4,Marketing Students & Interns,"[""content marketing"", ""digital marketing"", ""brand management""]",43,7,2025-10-25 21:45:37,en,How is AI changing {keyword} approaches?,0.86,0.3492042969770365,0.74
35100026,social media,marketing,What content types work best for social media?,comparison,Advanced,"[""Introduction to social media"", ""Key points and analysis"", ""Practical examples"", ""Expert insights"", ""Action items"", ""Conclusion""]","[""media"", ""comparison"", ""marketing"", ""digital"", ""social"", ""branding""]",4,Marketing Managers & Strategists,"[""content marketing"", ""digital marketing"", ""brand management""]",46,8,2025-10-25 21:45:37,en,What content types work best for {keyword}?,0.66,0.8714405779783752,0.38
35100027,data science,it,What tools are essential for data science development?,planning,Beginner,"[""Introduction to data science"", ""Key points and analysis"", ""Practical examples"", ""Expert insights"", ""Action items"", ""Conclusion""]","[""technology"", ""planning"", ""development"", ""it"", ""science"", ""data""]",4,Students & Entry-level Developers,"[""cybersecurity"", ""cloud computing"", ""machine learning"", ""web development""]",54,8,2025-10-25 21:45:37,en,What tools are essential for {keyword} development?,0.93,0.39629748350164484,0.44
35100028,financial modeling,economics,How does global economics impact financial modeling?,best_practice,Expert,"[""Introduction to financial modeling"", ""Key points and analysis"", ""Practical examples"", ""Expert insights"", ""Action items"", ""Conclusion""]","[""best_practice"", ""modeling"", ""financial"", ""market"", ""business"", ""economics""]",4,Portfolio Managers & Financial Experts,"[""investment planning"", ""market analysis"", ""portfolio management""]",52,7,2025-10-25 21:45:37,en,How does global economics impact {keyword}?,0.72,1.0,0.8
35100029,social media,marketing,How do you develop an effective social media strategy?,how_to,Advanced,"[""Overview of social media"", ""Step-by-step implementation"", ""Best practices and tips"", ""Common challenges and solutions"", ""Tools and resources needed"", ""Conclusion and next steps""]","[""how_to"", ""media"", ""digital"", ""marketing"", ""social"", ""advertising""]",6,Marketing Managers & Strategists,"[""content marketing"", ""brand management"", ""digital marketing""]",54,9,2025-10-25 21:45:37,en,How do you develop an effective {keyword} strategy?,0.66,0.9555966303766252,0.78
35100030,investment planning,economics,What factors should be considered when evaluating investment planning?,planning,Expert,"[""Introduction to investment planning"", ""Key points and analysis"", ""Practical examples"", ""Expert insights"", ""Action items"", ""Conclusion""]","[""market"", ""investment"", ""economics"", ""planning""]",4,Portfolio Managers & Financial Experts,"[""portfolio management"", ""market analysis"", ""financial modeling""]",70,9,2025-10-25 21:45:37,en,What factors should be considered when evaluating {keyword}?,0.78,1.0,0.82
35100031,web development,it,How can web development improve system performance and scalability?,analysis,Intermediate,"[""Introduction to web development"", ""Key points and analysis"", ""Practical examples"", ""Expert insights"", ""Action items"", ""Conclusion""]","[""software"", ""development"", ""web"", ""analysis"", ""it"", ""technology""]",4,Junior to Mid-level Developers,"[""machine learning"", ""cybersecurity"", ""cloud computing"", ""data science""]",67,9,2025-10-25 21:45:37,en,How can {keyword} improve system performance and scalability?,0.76,0.7197338235255791,0.81
35100032,brand management,marketing,How do you develop an effective brand management strategy?,evaluation,Intermediate,"[""Overview of brand management"", ""Step-by-step implementation"", ""Best practices and tips"", ""Common challenges and solutions"", ""Tools and resources needed"", ""Conclusion and next steps""]","[""marketing"", ""digital"", ""management"", ""advertising"", ""evaluation"", ""brand""]",6,Marketing Coordinators & Specialists,"[""content marketing"", ""digital marketing"", ""social media""]",58,9,2025-10-25 21:45:37,en,How do you develop an effective {keyword} strategy?,0.61,0.791355183883571,0.86
35100033,financial modeling,economics,What strategies work best for financial modeling investment?,strategy,Expert,"[""Introduction to financial modeling"", ""Key points and analysis"", ""Practical examples"", ""Expert insights"", ""Action items"", ""Conclusion""]","[""investment"", ""finance"", ""modeling"", ""financial"", ""strategy"", ""economics""]",4,Portfolio Managers & Financial Experts,"[""portfolio management"", ""investment planning"", ""market analysis""]",60,8,2025-10-25 21:45:37,en,What strategies work best for {keyword} investment?,0.69,1.0,0.66
35100034,investment planning,economics,How do you identify opportunities in investment planning markets?,comparison,Intermediate,"[""Overview of investment planning"", ""Step-by-step implementation"", ""Best practices and tips"", ""Common challenges and solutions"", ""Tools and resources needed"", ""Conclusion and next steps""]","[""investment"", ""planning"", ""finance"", ""comparison"", ""market"", ""economics""]",6,Individual Investors & Analysts,"[""financial modeling"", ""portfolio management"", ""market analysis""]",65,9,2025-10-25 21:45:37,en,How do you identify opportunities in {keyword} markets?,0.67,0.6195058385548872,0.52
35100035,investment planning,economics,How does global economics impact investment planning?,how_to,Advanced,"[""Introduction to investment planning"", ""Key points and analysis"", ""Practical examples"", ""Expert insights"", ""Action items"", ""Conclusion""]","[""investment"", ""how_to"", ""planning"", ""market"", ""business"", ""economics""]",4,Professional Investors & Advisors,"[""market analysis"", ""portfolio management"", ""financial modeling""]",53,7,2025-10-25 21:45:37,en,How does global economics impact {keyword}?,0.93,0.9090527868599292,0.57
35100036,content marketing,marketing,What are the latest trends in content marketing?,implementation,Expert,"[""Introduction to content marketing"", ""Key concepts and definitions"", ""Main categories or types"", ""Examples and case studies"", ""Benefits and advantages"", ""Summary and recommendations""]","[""content"", ""implementation"", ""marketing"", ""advertising"", ""branding""]",6,Marketing Directors & CMOs,"[""brand management"", ""digital marketing"", ""social media""]",48,8,2025-10-25 21:45:37,en,What are the latest trends in {keyword}?,0.76,1.0,0.53
35100037,financial modeling,economics,How do economic conditions affect financial modeling performance?,troubleshooting,Beginner,"[""Introduction to financial modeling"", ""Key points and analysis"", ""Practical examples"", ""Expert insights"", ""Action items"", ""Conclusion""]","[""investment"", ""troubleshooting"", ""modeling"", ""financial"", ""business"", ""economics""]",4,Students & New Investors,"[""investment planning"", ""market analysis"", ""portfolio management""]",65,8,2025-10-25 21:45:37,en,How do economic conditions affect {keyword} performance?,0.85,0.40051706978838697,0.34
35100038,social media,marketing,How do you create a social media roadmap?,how_to,Advanced,"[""Overview of social media"", ""Step-by-step implementation"", ""Best practices and tips"", ""Common challenges and solutions"", ""Tools and resources needed"", ""Conclusion and next steps""]","[""how_to"", ""media"", ""promotion"", ""marketing"", ""social"", ""advertising""]",6,Marketing Managers & Strategists,"[""content marketing"", ""digital marketing"", ""brand management""]",41,8,2025-10-25 21:45:37,en,How do you create a {keyword} roadmap?,0.8,0.9779999942068819,0.7
35100039,digital marketing,marketing,What does the future hold for digital marketing?,comparison,Intermediate,"[""Introduction to digital marketing"", ""Key points and analysis"", ""Practical examples"", ""Expert insights"", ""Action items"", ""Conclusion""]","[""promotion"", ""comparison"", ""marketing"", ""digital"", ""advertising""]",4,Marketing Coordinators & Specialists,"[""social media"", ""content marketing"", ""brand management""]",48,8,2025-10-25 21:45:37,en,What does the future hold for {keyword}?,0.63,0.7444236834642272,0.37
35100040,data science,it,How does data science impact business operations?,evaluation,Advanced,"[""Introduction to data science"", ""Key points and analysis"", ""Practical examples"", ""Expert insights"", ""Action items"", ""Conclusion""]","[""technology"", ""development"", ""it"", ""science"", ""evaluation"", ""data""]",4,Senior Developers & Tech Leads,"[""cybersecurity"", ""machine learning"", ""web development"", ""cloud computing""]",49,7,2025-10-25 21:45:37,en,How does {keyword} impact business operations?,0.77,0.875932565290316,0.9
35100041,cybersecurity,it,How do you integrate cybersecurity with existing systems?,optimization,Intermediate,"[""Overview of cybersecurity"", ""Step-by-step implementation"", ""Best practices and tips"", ""Common challenges and solutions"", ""Tools and resources needed"", ""Conclusion and next steps""]","[""development"", ""it"", ""programming"", ""optimization"", ""cybersecurity""]",5,Junior to Mid-level Developers,"[""machine learning"", ""cloud computing"", ""web development"", ""data science""]",57,8,2025-10-25 21:45:37,en,How do you integrate {keyword} with existing systems?,0.79,0.6004455136956591,0.41
35100042,portfolio management,economics,What factors should be considered when evaluating portfolio management?,how_to,Intermediate,"[""Introduction to portfolio management"", ""Key points and analysis"", ""Practical examples"", ""Expert insights"", ""Action items"", ""Conclusion""]","[""investment"", ""how_to"", ""portfolio"", ""management"", ""market"", ""economics""]",4,Individual Investors & Analysts,"[""market analysis"", ""investment planning"", ""financial modeling""]",71,9,2025-10-25 21:45:37,en,What factors should be considered when evaluating {keyword}?,0.71,0.7706487329202876,0.53
35100043,financial modeling,economics,What insurance options are available for financial modeling?,how_to,Advanced,"[""Introduction to financial modeling"", ""Key points and analysis"", ""Practical examples"", ""Expert insights"", ""Action items"", ""Conclusion""]","[""how_to"", ""finance"", ""modeling"", ""financial"", ""business"", ""economics""]",4,Professional Investors & Advisors,"[""portfolio management"", ""market analysis"", ""investment planning""]",60,8,2025-10-25 21:45:37,en,What insurance options are available for {keyword}?,0.89,0.8870258077883634,0.88
35100044,market analysis,economics,What strategies work best for market analysis investment?,how_to,Intermediate,"[""Introduction to market analysis"", ""Key points and analysis"", ""Practical examples"", ""Expert insights"", ""Action items"", ""Conclusion""]","[""how_to"", ""analysis"", ""finance"", ""market"", ""business"", ""economics""]",4,Individual Investors & Analysts,"[""portfolio management"", ""investment planning"", ""financial modeling""]",57,8,2025-10-25 21:45:37,en,What strategies work best for {keyword} investment?,0.64,0.7061065179079159,0.69
