record_id,keyword,category,question,question_type,difficulty_level,answer_outline,tags,estimated_read_time,target_audience,related_topics,question_length,word_count,created_date,language,source_template,engagement_score,complexity_score,popularity_score
34700654,market analysis,economics,How do you diversify your portfolio using market analysis?,how_to,Advanced,"[""Overview of market analysis"", ""Step-by-step implementation"", ""Best practices and tips"", ""Common challenges and solutions"", ""Tools and resources needed"", ""Conclusion and next steps""]","[""investment"", ""how_to"", ""finance"", ""analysis"", ""market"", ""economics""]",6,Professional Investors & Advisors,"[""portfolio management"", ""investment planning"", ""financial modeling""]",58,9,2025-10-25 21:45:02,en,How do you diversify your portfolio using {keyword}?,0.87,0.8110498050675897,0.81
34700655,content marketing,marketing,How do you improve content marketing conversion rates?,best_practice,Intermediate,"[""Overview of content marketing"", ""Step-by-step implementation"", ""Best practices and tips"", ""Common challenges and solutions"", ""Tools and resources needed"", ""Conclusion and next steps""]","[""content"", ""best_practice"", ""marketing"", ""digital"", ""branding""]",6,Marketing Coordinators & Specialists,"[""social media"", ""brand management"", ""digital marketing""]",54,8,2025-10-25 21:45:02,en,How do you improve {keyword} conversion rates?,0.82,0.7271139557613093,0.57
34700656,web development,it,What career opportunities exist in web development?,comparison,Advanced,"[""Introduction to web development"", ""Key points and analysis"", ""Practical examples"", ""Expert insights"", ""Action items"", ""Conclusion""]","[""development"", ""it"", ""comparison"", ""programming"", ""web""]",4,Senior Developers & Tech Leads,"[""data science"", ""machine learning"", ""cloud computing"", ""cybersecurity""]",51,7,2025-10-25 21:45:02,en,What career opportunities exist in {keyword}?,0.82,0.8431180426544285,0.49
34700657,content marketing,marketing,What timing strategies work for content marketing?,comparison,Intermediate,"[""Introduction to content marketing"", ""Key points and analysis"", ""Practical examples"", ""Expert insights"", ""Action items"", ""Conclusion""]","[""content"", ""comparison"", ""marketing"", ""advertising"", ""branding""]",4,Marketing Coordinators & Specialists,"[""social media"", ""digital marketing"", ""brand management""]",50,7,2025-10-25 21:45:02,en,What timing strategies work for {keyword}?,0.66,0.7675326354420865,0.37
34700658,brand management,marketing,How do you attribute success to brand management efforts?,implementation,Intermediate,"[""Overview of brand management"", ""Step-by-step implementation"", ""Best practices and tips"", ""Common challenges and solutions"", ""Tools and resources needed"", ""Conclusion and next steps""]","[""implementation"", ""marketing"", ""management"", ""advertising"", ""digital"", ""brand""]",6,Marketing Coordinators & Specialists,"[""digital marketing"", ""social media"", ""content marketing""]",57,9,2025-10-25 21:45:02,en,How do you attribute success to {keyword} efforts?,0.81,0.6289944673986565,0.62
34700659,portfolio management,economics,How do you assess and manage portfolio management risks?,planning,Expert,"[""Overview of portfolio management"", ""Step-by-step implementation"", ""Best practices and tips"", ""Common challenges and solutions"", ""Tools and resources needed"", ""Conclusion and next steps""]","[""investment"", ""planning"", ""portfolio"", ""management"", ""business"", ""economics""]",6,Portfolio Managers & Financial Experts,"[""investment planning"", ""market analysis"", ""financial modeling""]",56,9,2025-10-25 21:45:02,en,How do you assess and manage {keyword} risks?,0.71,1.0,0.63
34700660,machine learning,it,What security considerations should be taken when using machine learning?,optimization,Expert,"[""Introduction to machine learning"", ""Key points and analysis"", ""Practical examples"", ""Expert insights"", ""Action items"", ""Conclusion""]","[""development"", ""it"", ""programming"", ""learning"", ""optimization"", ""machine""]",4,Architects & Technical Directors,"[""web development"", ""cybersecurity"", ""cloud computing"", ""data science""]",73,10,2025-10-25 21:45:02,en,What security considerations should be taken when using {keyword}?,0.72,1.0,0.59
34700661,content marketing,marketing,How do you reach new customers through content marketing?,comparison,Intermediate,"[""Overview of content marketing"", ""Step-by-step implementation"", ""Best practices and tips"", ""Common challenges and solutions"", ""Tools and resources needed"", ""Conclusion and next steps""]","[""content"", ""promotion"", ""comparison"", ""marketing"", ""digital""]",6,Marketing Coordinators & Specialists,"[""digital marketing"", ""brand management"", ""social media""]",57,9,2025-10-25 21:45:02,en,How do you reach new customers through {keyword}?,0.65,0.6892240429674988,0.55
34700662,portfolio management,economics,How do you protect your portfolio management investments?,analysis,Beginner,"[""Overview of portfolio management"", ""Step-by-step implementation"", ""Best practices and tips"", ""Common challenges and solutions"", ""Tools and resources needed"", ""Conclusion and next steps""]","[""finance"", ""analysis"", ""portfolio"", ""management"", ""market"", ""economics""]",6,Students & New Investors,"[""financial modeling"", ""market analysis"", ""investment planning""]",57,8,2025-10-25 21:45:02,en,How do you protect your {keyword} investments?,0.75,0.40541548116250364,0.51
34700663,investment planning,economics,How do you analyze market trends in investment planning?,analysis,Expert,"[""Overview of investment planning"", ""Step-by-step implementation"", ""Best practices and tips"", ""Common challenges and solutions"", ""Tools and resources needed"", ""Conclusion and next steps""]","[""investment"", ""planning"", ""analysis"", ""market"", ""business"", ""economics""]",6,Portfolio Managers & Financial Experts,"[""market analysis"", ""financial modeling"", ""portfolio management""]",56,9,2025-10-25 21:45:02,en,How do you analyze market trends in {keyword}?,0.9,1.0,0.54
34700664,content marketing,marketing,How do you optimize content marketing for mobile users?,evaluation,Intermediate,"[""Overview of content marketing"", ""Step-by-step implementation"", ""Best practices and tips"", ""Common challenges and solutions"", ""Tools and resources needed"", ""Conclusion and next steps""]","[""content"", ""marketing"", ""digital"", ""branding"", ""evaluation""]",6,Marketing Coordinators & Specialists,"[""digital marketing"", ""social media"", ""brand management""]",55,9,2025-10-25 21:45:02,en,How do you optimize {keyword} for mobile users?,0.81,0.646765490778194,0.71
34700665,financial modeling,economics,What tools help analyze financial modeling data?,strategy,Expert,"[""Introduction to financial modeling"", ""Key points and analysis"", ""Practical examples"", ""Expert insights"", ""Action items"", ""Conclusion""]","[""investment"", ""finance"", ""modeling"", ""financial"", ""strategy"", ""economics""]",4,Portfolio Managers & Financial Experts,"[""portfolio management"", ""investment planning"", ""market analysis""]",48,7,2025-10-25 21:45:02,en,What tools help analyze {keyword} data?,0.83,1.0,0.35
34700666,investment planning,economics,How do economic conditions affect investment planning performance?,implementation,Advanced,"[""Introduction to investment planning"", ""Key points and analysis"", ""Practical examples"", ""Expert insights"", ""Action items"", ""Conclusion""]","[""investment"", ""planning"", ""finance"", ""implementation"", ""market"", ""economics""]",4,Professional Investors & Advisors,"[""portfolio management"", ""financial modeling"", ""market analysis""]",66,8,2025-10-25 21:45:02,en,How do economic conditions affect {keyword} performance?,0.71,0.9181397706183567,0.45
34700667,market analysis,economics,What insurance options are available for market analysis?,implementation,Expert,"[""Introduction to market analysis"", ""Key points and analysis"", ""Practical examples"", ""Expert insights"", ""Action items"", ""Conclusion""]","[""investment"", ""analysis"", ""implementation"", ""market"", ""business"", ""economics""]",4,Portfolio Managers & Financial Experts,"[""investment planning"", ""financial modeling"", ""portfolio management""]",57,8,2025-10-25 21:45:02,en,What insurance options are available for {keyword}?,0.81,1.0,0.53
34700668,data science,it,What tools are essential for data science development?,planning,Advanced,"[""Introduction to data science"", ""Key points and analysis"", ""Practical examples"", ""Expert insights"", ""Action items"", ""Conclusion""]","[""technology"", ""planning"", ""development"", ""it"", ""science"", ""data""]",4,Senior Developers & Tech Leads,"[""web development"", ""machine learning"", ""cybersecurity"", ""cloud computing""]",54,8,2025-10-25 21:45:02,en,What tools are essential for {keyword} development?,0.81,0.9082617011524865,0.43
34700669,financial modeling,economics,How do you adjust your financial modeling strategy during volatility?,strategy,Advanced,"[""Overview of financial modeling"", ""Step-by-step implementation"", ""Best practices and tips"", ""Common challenges and solutions"", ""Tools and resources needed"", ""Conclusion and next steps""]","[""investment"", ""finance"", ""modeling"", ""financial"", ""strategy"", ""economics""]",6,Professional Investors & Advisors,"[""portfolio management"", ""investment planning"", ""market analysis""]",69,10,2025-10-25 21:45:02,en,How do you adjust your {keyword} strategy during volatility?,0.91,0.8907535031503641,0.47
34700670,brand management,marketing,How do you develop an effective brand management strategy?,how_to,Intermediate,"[""Overview of brand management"", ""Step-by-step implementation"", ""Best practices and tips"", ""Common challenges and solutions"", ""Tools and resources needed"", ""Conclusion and next steps""]","[""how_to"", ""marketing"", ""management"", ""advertising"", ""branding"", ""brand""]",6,Marketing Coordinators & Specialists,"[""content marketing"", ""digital marketing"", ""social media""]",58,9,2025-10-25 21:45:02,en,How do you develop an effective {keyword} strategy?,0.82,0.7802229040043664,0.45
34700671,machine learning,it,How do you measure the success of machine learning projects?,implementation,Advanced,"[""Overview of machine learning"", ""Step-by-step implementation"", ""Best practices and tips"", ""Common challenges and solutions"", ""Tools and resources needed"", ""Conclusion and next steps""]","[""software"", ""development"", ""it"", ""implementation"", ""learning"", ""machine""]",6,Senior Developers & Tech Leads,"[""cybersecurity"", ""data science"", ""cloud computing"", ""web development""]",60,10,2025-10-25 21:45:02,en,How do you measure the success of {keyword} projects?,0.76,0.8486520399341559,0.79
34700672,investment planning,economics,How do you identify opportunities in investment planning markets?,implementation,Beginner,"[""Overview of investment planning"", ""Step-by-step implementation"", ""Best practices and tips"", ""Common challenges and solutions"", ""Tools and resources needed"", ""Conclusion and next steps""]","[""investment"", ""planning"", ""implementation"", ""market"", ""business"", ""economics""]",6,Students & New Investors,"[""financial modeling"", ""market analysis"", ""portfolio management""]",65,9,2025-10-25 21:45:02,en,How do you identify opportunities in {keyword} markets?,0.63,0.46084549545323883,0.88
34700673,social media,marketing,What A/B tests should you run for social media?,comparison,Beginner,"[""Introduction to social media"", ""Key points and analysis"", ""Practical examples"", ""Expert insights"", ""Action items"", ""Conclusion""]","[""media"", ""promotion"", ""comparison"", ""marketing"", ""social"", ""advertising""]",4,Marketing Students & Interns,"[""digital marketing"", ""content marketing"", ""brand management""]",47,9,2025-10-25 21:45:02,en,What A/B tests should you run for {keyword}?,0.83,0.38566379159067776,0.5
34700674,content marketing,marketing,How is AI changing content marketing approaches?,planning,Expert,"[""Introduction to content marketing"", ""Key points and analysis"", ""Practical examples"", ""Expert insights"", ""Action items"", ""Conclusion""]","[""planning"", ""content"", ""marketing"", ""advertising"", ""branding""]",4,Marketing Directors & CMOs,"[""social media"", ""digital marketing"", ""brand management""]",48,7,2025-10-25 21:45:02,en,How is AI changing {keyword} approaches?,0.75,1.0,0.69
34700675,content marketing,marketing,What KPIs are most important for content marketing?,evaluation,Intermediate,"[""Introduction to content marketing"", ""Key points and analysis"", ""Practical examples"", ""Expert insights"", ""Action items"", ""Conclusion""]","[""content"", ""marketing"", ""advertising"", ""branding"", ""evaluation""]",4,Marketing Coordinators & Specialists,"[""digital marketing"", ""social media"", ""brand management""]",51,8,2025-10-25 21:45:02,en,What KPIs are most important for {keyword}?,0.89,0.6239933469244262,0.8
34700676,digital marketing,marketing,What emerging platforms support digital marketing?,implementation,Intermediate,"[""Introduction to digital marketing"", ""Key points and analysis"", ""Practical examples"", ""Expert insights"", ""Action items"", ""Conclusion""]","[""implementation"", ""marketing"", ""branding"", ""digital""]",4,Marketing Coordinators & Specialists,"[""social media"", ""content marketing"", ""brand management""]",50,6,2025-10-25 21:45:02,en,What emerging platforms support {keyword}?,0.87,0.6000786127332369,0.67
34700677,financial modeling,economics,What exit strategies should be considered for financial modeling?,best_practice,Beginner,"[""Introduction to financial modeling"", ""Key points and analysis"", ""Practical examples"", ""Expert insights"", ""Action items"", ""Conclusion""]","[""finance"", ""best_practice"", ""modeling"", ""financial"", ""business"", ""economics""]",4,Students & New Investors,"[""portfolio management"", ""investment planning"", ""market analysis""]",65,9,2025-10-25 21:45:02,en,What exit strategies should be considered for {keyword}?,0.61,0.39213073443942864,0.72
34700678,cloud computing,it,What ROI can be expected from cloud computing implementation?,implementation,Beginner,"[""Introduction to cloud computing"", ""Key points and analysis"", ""Practical examples"", ""Expert insights"", ""Action items"", ""Conclusion""]","[""computing"", ""software"", ""it"", ""implementation"", ""cloud"", ""technology""]",4,Students & Entry-level Developers,"[""data science"", ""cybersecurity"", ""machine learning"", ""web development""]",61,9,2025-10-25 21:45:02,en,What ROI can be expected from {keyword} implementation?,0.65,0.37227635312608953,0.46
34700679,digital marketing,marketing,What content types work best for digital marketing?,troubleshooting,Advanced,"[""Introduction to digital marketing"", ""Key points and analysis"", ""Practical examples"", ""Expert insights"", ""Action items"", ""Conclusion""]","[""promotion"", ""troubleshooting"", ""marketing"", ""digital"", ""branding""]",4,Marketing Managers & Strategists,"[""content marketing"", ""social media"", ""brand management""]",51,8,2025-10-25 21:45:02,en,What content types work best for {keyword}?,0.68,0.8501023834063667,0.53
34700680,investment planning,economics,How do you identify opportunities in investment planning markets?,optimization,Expert,"[""Overview of investment planning"", ""Step-by-step implementation"", ""Best practices and tips"", ""Common challenges and solutions"", ""Tools and resources needed"", ""Conclusion and next steps""]","[""investment"", ""planning"", ""business"", ""optimization"", ""economics""]",6,Portfolio Managers & Financial Experts,"[""financial modeling"", ""market analysis"", ""portfolio management""]",65,9,2025-10-25 21:45:02,en,How do you identify opportunities in {keyword} markets?,0.6,1.0,0.37
34700681,web development,it,What are the best practices for web development development?,analysis,Intermediate,"[""Introduction to web development"", ""Key concepts and definitions"", ""Main categories or types"", ""Examples and case studies"", ""Benefits and advantages"", ""Summary and recommendations""]","[""software"", ""development"", ""web"", ""analysis"", ""it"", ""technology""]",6,Junior to Mid-level Developers,"[""cloud computing"", ""machine learning"", ""cybersecurity"", ""data science""]",60,9,2025-10-25 21:45:02,en,What are the best practices for {keyword} development?,0.71,0.738926015561735,0.31
34700682,brand management,marketing,How do you reach new customers through brand management?,evaluation,Beginner,"[""Overview of brand management"", ""Step-by-step implementation"", ""Best practices and tips"", ""Common challenges and solutions"", ""Tools and resources needed"", ""Conclusion and next steps""]","[""promotion"", ""marketing"", ""management"", ""digital"", ""evaluation"", ""brand""]",6,Marketing Students & Interns,"[""social media"", ""digital marketing"", ""content marketing""]",56,9,2025-10-25 21:45:02,en,How do you reach new customers through {keyword}?,0.78,0.3861240448107981,0.65
34700683,market analysis,economics,How does global economics impact market analysis?,how_to,Intermediate,"[""Introduction to market analysis"", ""Key points and analysis"", ""Practical examples"", ""Expert insights"", ""Action items"", ""Conclusion""]","[""how_to"", ""finance"", ""analysis"", ""market"", ""business"", ""economics""]",4,Individual Investors & Analysts,"[""portfolio management"", ""financial modeling"", ""investment planning""]",49,7,2025-10-25 21:45:02,en,How does global economics impact {keyword}?,0.87,0.6967638742544577,0.89
34700684,brand management,marketing,What emerging platforms support brand management?,troubleshooting,Advanced,"[""Introduction to brand management"", ""Key points and analysis"", ""Practical examples"", ""Expert insights"", ""Action items"", ""Conclusion""]","[""promotion"", ""troubleshooting"", ""marketing"", ""management"", ""branding"", ""brand""]",4,Marketing Managers & Strategists,"[""social media"", ""digital marketing"", ""content marketing""]",49,6,2025-10-25 21:45:02,en,What emerging platforms support {keyword}?,0.76,0.8537939350300886,0.49
34700685,financial modeling,economics,How do you create a long-term plan for financial modeling?,optimization,Beginner,"[""Overview of financial modeling"", ""Step-by-step implementation"", ""Best practices and tips"", ""Common challenges and solutions"", ""Tools and resources needed"", ""Conclusion and next steps""]","[""modeling"", ""financial"", ""business"", ""market"", ""optimization"", ""economics""]",6,Students & New Investors,"[""market analysis"", ""portfolio management"", ""investment planning""]",58,10,2025-10-25 21:45:02,en,How do you create a long-term plan for {keyword}?,0.88,0.40413680006408653,0.37
34700686,web development,it,What are the cost considerations for web development?,planning,Expert,"[""Introduction to web development"", ""Key concepts and definitions"", ""Main categories or types"", ""Examples and case studies"", ""Benefits and advantages"", ""Summary and recommendations""]","[""planning"", ""development"", ""it"", ""programming"", ""web""]",6,Architects & Technical Directors,"[""cybersecurity"", ""cloud computing"", ""data science"", ""machine learning""]",53,8,2025-10-25 21:45:02,en,What are the cost considerations for {keyword}?,0.85,1.0,0.69
34700687,content marketing,marketing,What KPIs are most important for content marketing?,planning,Expert,"[""Introduction to content marketing"", ""Key points and analysis"", ""Practical examples"", ""Expert insights"", ""Action items"", ""Conclusion""]","[""planning"", ""content"", ""promotion"", ""marketing"", ""branding""]",4,Marketing Directors & CMOs,"[""brand management"", ""digital marketing"", ""social media""]",51,8,2025-10-25 21:45:02,en,What KPIs are most important for {keyword}?,0.7,1.0,0.55
34700688,cybersecurity,it,What certifications are valuable for cybersecurity professionals?,analysis,Intermediate,"[""Introduction to cybersecurity"", ""Key points and analysis"", ""Practical examples"", ""Expert insights"", ""Action items"", ""Conclusion""]","[""development"", ""analysis"", ""it"", ""cybersecurity"", ""technology""]",4,Junior to Mid-level Developers,"[""web development"", ""data science"", ""cloud computing"", ""machine learning""]",65,7,2025-10-25 21:45:02,en,What certifications are valuable for {keyword} professionals?,0.67,0.7539039451681692,0.64
34700689,social media,marketing,How do you improve social media conversion rates?,optimization,Expert,"[""Overview of social media"", ""Step-by-step implementation"", ""Best practices and tips"", ""Common challenges and solutions"", ""Tools and resources needed"", ""Conclusion and next steps""]","[""media"", ""digital"", ""marketing"", ""social"", ""branding"", ""optimization""]",6,Marketing Directors & CMOs,"[""digital marketing"", ""brand management"", ""content marketing""]",49,8,2025-10-25 21:45:02,en,How do you improve {keyword} conversion rates?,0.86,1.0,0.36
34700690,machine learning,it,What career opportunities exist in machine learning?,analysis,Intermediate,"[""Introduction to machine learning"", ""Key points and analysis"", ""Practical examples"", ""Expert insights"", ""Action items"", ""Conclusion""]","[""software"", ""analysis"", ""it"", ""learning"", ""machine"", ""technology""]",4,Junior to Mid-level Developers,"[""web development"", ""data science"", ""cybersecurity"", ""cloud computing""]",52,7,2025-10-25 21:45:02,en,What career opportunities exist in {keyword}?,0.81,0.7805358657599368,0.65
34700691,social media,marketing,What does the future hold for social media?,implementation,Intermediate,"[""Introduction to social media"", ""Key points and analysis"", ""Practical examples"", ""Expert insights"", ""Action items"", ""Conclusion""]","[""media"", ""implementation"", ""marketing"", ""social"", ""advertising"", ""branding""]",4,Marketing Coordinators & Specialists,"[""digital marketing"", ""brand management"", ""content marketing""]",43,8,2025-10-25 21:45:02,en,What does the future hold for {keyword}?,0.84,0.7031148448230602,0.38
34700692,data science,it,What are the best practices for data science development?,implementation,Advanced,"[""Introduction to data science"", ""Key concepts and definitions"", ""Main categories or types"", ""Examples and case studies"", ""Benefits and advantages"", ""Summary and recommendations""]","[""software"", ""it"", ""implementation"", ""programming"", ""science"", ""data""]",6,Senior Developers & Tech Leads,"[""cloud computing"", ""web development"", ""cybersecurity"", ""machine learning""]",57,9,2025-10-25 21:45:02,en,What are the best practices for {keyword} development?,0.78,0.8004337287183577,0.68
34700693,machine learning,it,How can machine learning improve system performance and scalability?,comparison,Expert,"[""Introduction to machine learning"", ""Key points and analysis"", ""Practical examples"", ""Expert insights"", ""Action items"", ""Conclusion""]","[""development"", ""it"", ""comparison"", ""programming"", ""learning"", ""machine""]",4,Architects & Technical Directors,"[""cloud computing"", ""data science"", ""web development"", ""cybersecurity""]",68,9,2025-10-25 21:45:02,en,How can {keyword} improve system performance and scalability?,0.76,1.0,0.54
34700694,content marketing,marketing,How do you innovate within content marketing?,evaluation,Intermediate,"[""Overview of content marketing"", ""Step-by-step implementation"", ""Best practices and tips"", ""Common challenges and solutions"", ""Tools and resources needed"", ""Conclusion and next steps""]","[""content"", ""marketing"", ""advertising"", ""branding"", ""evaluation""]",6,Marketing Coordinators & Specialists,"[""social media"", ""brand management"", ""digital marketing""]",45,7,2025-10-25 21:45:02,en,How do you innovate within {keyword}?,0.93,0.7292619086109762,0.82
34700695,portfolio management,economics,What tools help analyze portfolio management data?,best_practice,Beginner,"[""Introduction to portfolio management"", ""Key points and analysis"", ""Practical examples"", ""Expert insights"", ""Action items"", ""Conclusion""]","[""finance"", ""portfolio"", ""best_practice"", ""management"", ""market"", ""economics""]",4,Students & New Investors,"[""market analysis"", ""investment planning"", ""financial modeling""]",50,7,2025-10-25 21:45:02,en,What tools help analyze {keyword} data?,0.65,0.4879024259469485,0.42
34700696,cloud computing,it,What security considerations should be taken when using cloud computing?,best_practice,Expert,"[""Introduction to cloud computing"", ""Key points and analysis"", ""Practical examples"", ""Expert insights"", ""Action items"", ""Conclusion""]","[""computing"", ""software"", ""it"", ""best_practice"", ""programming"", ""cloud""]",4,Architects & Technical Directors,"[""web development"", ""data science"", ""cybersecurity"", ""machine learning""]",72,10,2025-10-25 21:45:02,en,What security considerations should be taken when using {keyword}?,0.9,1.0,0.52
34700697,portfolio management,economics,How do you hedge against portfolio management market downturns?,planning,Advanced,"[""Overview of portfolio management"", ""Step-by-step implementation"", ""Best practices and tips"", ""Common challenges and solutions"", ""Tools and resources needed"", ""Conclusion and next steps""]","[""planning"", ""finance"", ""portfolio"", ""management"", ""market"", ""economics""]",6,Professional Investors & Advisors,"[""financial modeling"", ""market analysis"", ""investment planning""]",63,9,2025-10-25 21:45:02,en,How do you hedge against {keyword} market downturns?,0.88,0.9579003486057687,0.68
