record_id,keyword,category,question,question_type,difficulty_level,answer_outline,tags,estimated_read_time,target_audience,related_topics,question_length,word_count,created_date,language,source_template,engagement_score,complexity_score,popularity_score
36800001,social media,marketing,How do you identify the right audience for social media?,planning,Beginner,"[""Overview of social media"", ""Step-by-step implementation"", ""Best practices and tips"", ""Common challenges and solutions"", ""Tools and resources needed"", ""Conclusion and next steps""]","[""planning"", ""media"", ""digital"", ""marketing"", ""social"", ""advertising""]",6,Marketing Students & Interns,"[""brand management"", ""content marketing"", ""digital marketing""]",56,10,2025-10-25 21:47:59,en,How do you identify the right audience for {keyword}?,0.66,0.3275684811542702,0.84
36800002,web development,it,How do you get started with web development as a beginner?,comparison,Expert,"[""Overview of web development"", ""Step-by-step implementation"", ""Best practices and tips"", ""Common challenges and solutions"", ""Tools and resources needed"", ""Conclusion and next steps""]","[""technology"", ""software"", ""development"", ""it"", ""comparison"", ""web""]",6,Architects & Technical Directors,"[""data science"", ""machine learning"", ""cybersecurity"", ""cloud computing""]",58,11,2025-10-25 21:47:59,en,How do you get started with {keyword} as a beginner?,0.92,1.0,0.7
36800003,data science,it,What certifications are valuable for data science professionals?,evaluation,Intermediate,"[""Introduction to data science"", ""Key points and analysis"", ""Practical examples"", ""Expert insights"", ""Action items"", ""Conclusion""]","[""software"", ""development"", ""it"", ""science"", ""evaluation"", ""data""]",4,Junior to Mid-level Developers,"[""cloud computing"", ""machine learning"", ""web development"", ""cybersecurity""]",64,8,2025-10-25 21:47:59,en,What certifications are valuable for {keyword} professionals?,0.8,0.6710870890144125,0.7
36800004,financial modeling,economics,What timeline is realistic for financial modeling returns?,comparison,Advanced,"[""Introduction to financial modeling"", ""Key points and analysis"", ""Practical examples"", ""Expert insights"", ""Action items"", ""Conclusion""]","[""comparison"", ""modeling"", ""financial"", ""market"", ""business"", ""economics""]",4,Professional Investors & Advisors,"[""market analysis"", ""investment planning"", ""portfolio management""]",58,8,2025-10-25 21:47:59,en,What timeline is realistic for {keyword} returns?,0.93,0.8347717095578824,0.53
36800005,brand management,marketing,What emerging platforms support brand management?,strategy,Expert,"[""Introduction to brand management"", ""Key points and analysis"", ""Practical examples"", ""Expert insights"", ""Action items"", ""Conclusion""]","[""marketing"", ""management"", ""digital"", ""branding"", ""strategy"", ""brand""]",4,Marketing Directors & CMOs,"[""content marketing"", ""digital marketing"", ""social media""]",49,6,2025-10-25 21:47:59,en,What emerging platforms support {keyword}?,0.62,1.0,0.73
36800006,web development,it,What design patterns work best with web development?,optimization,Expert,"[""Introduction to web development"", ""Key points and analysis"", ""Practical examples"", ""Expert insights"", ""Action items"", ""Conclusion""]","[""software"", ""development"", ""it"", ""optimization"", ""web""]",4,Architects & Technical Directors,"[""machine learning"", ""cloud computing"", ""cybersecurity"", ""data science""]",52,8,2025-10-25 21:47:59,en,What design patterns work best with {keyword}?,0.78,1.0,0.53
36800007,data science,it,How do you convince stakeholders to invest in data science?,comparison,Expert,"[""Overview of data science"", ""Step-by-step implementation"", ""Best practices and tips"", ""Common challenges and solutions"", ""Tools and resources needed"", ""Conclusion and next steps""]","[""software"", ""it"", ""comparison"", ""programming"", ""science"", ""data""]",6,Architects & Technical Directors,"[""cloud computing"", ""web development"", ""machine learning"", ""cybersecurity""]",59,10,2025-10-25 21:47:59,en,How do you convince stakeholders to invest in {keyword}?,0.85,1.0,0.37
36800008,social media,marketing,How do you reach new customers through social media?,evaluation,Intermediate,"[""Overview of social media"", ""Step-by-step implementation"", ""Best practices and tips"", ""Common challenges and solutions"", ""Tools and resources needed"", ""Conclusion and next steps""]","[""media"", ""promotion"", ""marketing"", ""digital"", ""social"", ""evaluation""]",6,Marketing Coordinators & Specialists,"[""digital marketing"", ""content marketing"", ""brand management""]",52,9,2025-10-25 21:47:59,en,How do you reach new customers through {keyword}?,0.62,0.7117462319670426,0.48
36800009,brand management,marketing,How do you reach new customers through brand management?,best_practice,Beginner,"[""Overview of brand management"", ""Step-by-step implementation"", ""Best practices and tips"", ""Common challenges and solutions"", ""Tools and resources needed"", ""Conclusion and next steps""]","[""best_practice"", ""digital"", ""marketing"", ""management"", ""advertising"", ""brand""]",6,Marketing Students & Interns,"[""digital marketing"", ""social media"", ""content marketing""]",56,9,2025-10-25 21:47:59,en,How do you reach new customers through {keyword}?,0.76,0.48434432756186047,0.76
36800010,cybersecurity,it,How do you measure the success of cybersecurity projects?,how_to,Intermediate,"[""Overview of cybersecurity"", ""Step-by-step implementation"", ""Best practices and tips"", ""Common challenges and solutions"", ""Tools and resources needed"", ""Conclusion and next steps""]","[""how_to"", ""software"", ""it"", ""programming"", ""cybersecurity""]",5,Junior to Mid-level Developers,"[""data science"", ""machine learning"", ""web development"", ""cloud computing""]",57,9,2025-10-25 21:47:59,en,How do you measure the success of {keyword} projects?,0.72,0.6662162230300689,0.7
36800011,brand management,marketing,What content types work best for brand management?,optimization,Intermediate,"[""Introduction to brand management"", ""Key points and analysis"", ""Practical examples"", ""Expert insights"", ""Action items"", ""Conclusion""]","[""marketing"", ""management"", ""advertising"", ""branding"", ""optimization"", ""brand""]",4,Marketing Coordinators & Specialists,"[""content marketing"", ""social media"", ""digital marketing""]",50,8,2025-10-25 21:47:59,en,What content types work best for {keyword}?,0.88,0.7668982796848154,0.33
36800012,cloud computing,it,How do you troubleshoot common issues with cloud computing?,evaluation,Beginner,"[""Overview of cloud computing"", ""Step-by-step implementation"", ""Best practices and tips"", ""Common challenges and solutions"", ""Tools and resources needed"", ""Conclusion and next steps""]","[""computing"", ""software"", ""it"", ""evaluation"", ""cloud"", ""technology""]",6,Students & Entry-level Developers,"[""machine learning"", ""data science"", ""web development"", ""cybersecurity""]",59,9,2025-10-25 21:47:59,en,How do you troubleshoot common issues with {keyword}?,0.79,0.4746462631952858,0.66
36800013,web development,it,What tools are essential for web development development?,strategy,Beginner,"[""Introduction to web development"", ""Key points and analysis"", ""Practical examples"", ""Expert insights"", ""Action items"", ""Conclusion""]","[""technology"", ""development"", ""it"", ""programming"", ""strategy"", ""web""]",4,Students & Entry-level Developers,"[""cloud computing"", ""data science"", ""machine learning"", ""cybersecurity""]",57,8,2025-10-25 21:47:59,en,What tools are essential for {keyword} development?,0.8,0.35050142071606255,0.81
36800014,social media,marketing,How do you develop an effective social media strategy?,evaluation,Intermediate,"[""Overview of social media"", ""Step-by-step implementation"", ""Best practices and tips"", ""Common challenges and solutions"", ""Tools and resources needed"", ""Conclusion and next steps""]","[""media"", ""marketing"", ""digital"", ""social"", ""branding"", ""evaluation""]",6,Marketing Coordinators & Specialists,"[""digital marketing"", ""content marketing"", ""brand management""]",54,9,2025-10-25 21:47:59,en,How do you develop an effective {keyword} strategy?,0.69,0.7629507155594842,0.45
36800015,brand management,marketing,What channels are most effective for brand management?,troubleshooting,Beginner,"[""Introduction to brand management"", ""Key points and analysis"", ""Practical examples"", ""Expert insights"", ""Action items"", ""Conclusion""]","[""troubleshooting"", ""digital"", ""marketing"", ""management"", ""branding"", ""brand""]",4,Marketing Students & Interns,"[""content marketing"", ""digital marketing"", ""social media""]",54,8,2025-10-25 21:47:59,en,What channels are most effective for {keyword}?,0.86,0.3707872480497688,0.49
36800016,investment planning,economics,How do you diversify your portfolio using investment planning?,optimization,Advanced,"[""Overview of investment planning"", ""Step-by-step implementation"", ""Best practices and tips"", ""Common challenges and solutions"", ""Tools and resources needed"", ""Conclusion and next steps""]","[""investment"", ""planning"", ""finance"", ""business"", ""optimization"", ""economics""]",6,Professional Investors & Advisors,"[""portfolio management"", ""financial modeling"", ""market analysis""]",62,9,2025-10-25 21:47:59,en,How do you diversify your portfolio using {keyword}?,0.94,0.8537565295952128,0.82
36800017,digital marketing,marketing,How do you identify the right audience for digital marketing?,planning,Advanced,"[""Overview of digital marketing"", ""Step-by-step implementation"", ""Best practices and tips"", ""Common challenges and solutions"", ""Tools and resources needed"", ""Conclusion and next steps""]","[""planning"", ""promotion"", ""marketing"", ""digital"", ""branding""]",6,Marketing Managers & Strategists,"[""social media"", ""content marketing"", ""brand management""]",61,10,2025-10-25 21:47:59,en,How do you identify the right audience for {keyword}?,0.6,0.8447457159382915,0.41
36800018,machine learning,it,How do you design a scalable machine learning solution?,planning,Beginner,"[""Overview of machine learning"", ""Step-by-step implementation"", ""Best practices and tips"", ""Common challenges and solutions"", ""Tools and resources needed"", ""Conclusion and next steps""]","[""planning"", ""development"", ""it"", ""learning"", ""machine"", ""technology""]",6,Students & Entry-level Developers,"[""web development"", ""cloud computing"", ""cybersecurity"", ""data science""]",55,9,2025-10-25 21:47:59,en,How do you design a scalable {keyword} solution?,0.81,0.43875263658177344,0.39
36800019,investment planning,economics,How do you identify opportunities in investment planning markets?,troubleshooting,Advanced,"[""Overview of investment planning"", ""Step-by-step implementation"", ""Best practices and tips"", ""Common challenges and solutions"", ""Tools and resources needed"", ""Conclusion and next steps""]","[""investment"", ""planning"", ""troubleshooting"", ""business"", ""economics""]",6,Professional Investors & Advisors,"[""portfolio management"", ""market analysis"", ""financial modeling""]",65,9,2025-10-25 21:47:59,en,How do you identify opportunities in {keyword} markets?,0.82,0.9446911208648456,0.59
36800020,brand management,marketing,What budget should be allocated to brand management?,best_practice,Beginner,"[""Introduction to brand management"", ""Key points and analysis"", ""Practical examples"", ""Expert insights"", ""Action items"", ""Conclusion""]","[""best_practice"", ""digital"", ""marketing"", ""management"", ""branding"", ""brand""]",4,Marketing Students & Interns,"[""digital marketing"", ""social media"", ""content marketing""]",52,8,2025-10-25 21:47:59,en,What budget should be allocated to {keyword}?,0.89,0.4157136194149356,0.46
36800021,financial modeling,economics,What exit strategies should be considered for financial modeling?,comparison,Expert,"[""Introduction to financial modeling"", ""Key points and analysis"", ""Practical examples"", ""Expert insights"", ""Action items"", ""Conclusion""]","[""investment"", ""comparison"", ""modeling"", ""financial"", ""business"", ""economics""]",4,Portfolio Managers & Financial Experts,"[""market analysis"", ""investment planning"", ""portfolio management""]",65,9,2025-10-25 21:47:59,en,What exit strategies should be considered for {keyword}?,0.65,1.0,0.72
36800022,web development,it,How do you optimize web development for different platforms?,implementation,Beginner,"[""Overview of web development"", ""Step-by-step implementation"", ""Best practices and tips"", ""Common challenges and solutions"", ""Tools and resources needed"", ""Conclusion and next steps""]","[""technology"", ""software"", ""development"", ""it"", ""implementation"", ""web""]",6,Students & Entry-level Developers,"[""machine learning"", ""cloud computing"", ""cybersecurity"", ""data science""]",60,9,2025-10-25 21:47:59,en,How do you optimize {keyword} for different platforms?,0.62,0.31534502000654774,0.83
36800023,cloud computing,it,Which frameworks support cloud computing implementation?,planning,Beginner,"[""Introduction to cloud computing"", ""Key points and analysis"", ""Practical examples"", ""Expert insights"", ""Action items"", ""Conclusion""]","[""computing"", ""planning"", ""development"", ""it"", ""software"", ""cloud""]",4,Students & Entry-level Developers,"[""web development"", ""data science"", ""cybersecurity"", ""machine learning""]",56,6,2025-10-25 21:47:59,en,Which frameworks support {keyword} implementation?,0.93,0.3913954298171822,0.39
36800024,web development,it,How do you measure the success of web development projects?,how_to,Advanced,"[""Overview of web development"", ""Step-by-step implementation"", ""Best practices and tips"", ""Common challenges and solutions"", ""Tools and resources needed"", ""Conclusion and next steps""]","[""how_to"", ""software"", ""development"", ""web"", ""it"", ""technology""]",6,Senior Developers & Tech Leads,"[""cloud computing"", ""data science"", ""cybersecurity"", ""machine learning""]",59,10,2025-10-25 21:47:59,en,How do you measure the success of {keyword} projects?,0.88,0.8699178658600536,0.82
36800025,investment planning,economics,What exit strategies should be considered for investment planning?,how_to,Intermediate,"[""Introduction to investment planning"", ""Key points and analysis"", ""Practical examples"", ""Expert insights"", ""Action items"", ""Conclusion""]","[""investment"", ""how_to"", ""planning"", ""finance"", ""market"", ""economics""]",4,Individual Investors & Analysts,"[""financial modeling"", ""portfolio management"", ""market analysis""]",66,9,2025-10-25 21:47:59,en,What exit strategies should be considered for {keyword}?,0.63,0.6709816849351279,0.65
36800026,investment planning,economics,What tools help analyze investment planning data?,troubleshooting,Advanced,"[""Introduction to investment planning"", ""Key points and analysis"", ""Practical examples"", ""Expert insights"", ""Action items"", ""Conclusion""]","[""investment"", ""planning"", ""troubleshooting"", ""business"", ""economics""]",4,Professional Investors & Advisors,"[""portfolio management"", ""financial modeling"", ""market analysis""]",49,7,2025-10-25 21:47:59,en,What tools help analyze {keyword} data?,0.83,0.9211963042039224,0.42
36800027,portfolio management,economics,How do you hedge against portfolio management market downturns?,best_practice,Expert,"[""Overview of portfolio management"", ""Step-by-step implementation"", ""Best practices and tips"", ""Common challenges and solutions"", ""Tools and resources needed"", ""Conclusion and next steps""]","[""investment"", ""finance"", ""portfolio"", ""best_practice"", ""management"", ""economics""]",6,Portfolio Managers & Financial Experts,"[""financial modeling"", ""market analysis"", ""investment planning""]",63,9,2025-10-25 21:47:59,en,How do you hedge against {keyword} market downturns?,0.89,1.0,0.62
36800028,investment planning,economics,What is the optimal allocation for investment planning in a portfolio?,analysis,Advanced,"[""Introduction to investment planning"", ""Key points and analysis"", ""Practical examples"", ""Expert insights"", ""Action items"", ""Conclusion""]","[""investment"", ""planning"", ""finance"", ""analysis"", ""economics""]",4,Professional Investors & Advisors,"[""market analysis"", ""financial modeling"", ""portfolio management""]",70,11,2025-10-25 21:47:59,en,What is the optimal allocation for {keyword} in a portfolio?,0.68,0.9937391725586022,0.36
36800029,portfolio management,economics,What are the regulatory considerations for portfolio management?,strategy,Advanced,"[""Introduction to portfolio management"", ""Key concepts and definitions"", ""Main categories or types"", ""Examples and case studies"", ""Benefits and advantages"", ""Summary and recommendations""]","[""finance"", ""portfolio"", ""management"", ""business"", ""strategy"", ""economics""]",6,Professional Investors & Advisors,"[""financial modeling"", ""investment planning"", ""market analysis""]",64,8,2025-10-25 21:47:59,en,What are the regulatory considerations for {keyword}?,0.77,0.8792493547444397,0.42
36800030,brand management,marketing,How do you identify the right audience for brand management?,best_practice,Advanced,"[""Overview of brand management"", ""Step-by-step implementation"", ""Best practices and tips"", ""Common challenges and solutions"", ""Tools and resources needed"", ""Conclusion and next steps""]","[""best_practice"", ""marketing"", ""management"", ""advertising"", ""digital"", ""brand""]",6,Marketing Managers & Strategists,"[""social media"", ""content marketing"", ""digital marketing""]",60,10,2025-10-25 21:47:59,en,How do you identify the right audience for {keyword}?,0.71,0.8122542735516469,0.37
36800031,cybersecurity,it,What skills are needed to master cybersecurity?,analysis,Intermediate,"[""Introduction to cybersecurity"", ""Key points and analysis"", ""Practical examples"", ""Expert insights"", ""Action items"", ""Conclusion""]","[""software"", ""analysis"", ""it"", ""programming"", ""cybersecurity""]",4,Junior to Mid-level Developers,"[""machine learning"", ""cloud computing"", ""data science"", ""web development""]",47,7,2025-10-25 21:47:59,en,What skills are needed to master {keyword}?,0.88,0.7456269228315305,0.64
36800032,financial modeling,economics,What metrics are most important for financial modeling?,comparison,Advanced,"[""Introduction to financial modeling"", ""Key points and analysis"", ""Practical examples"", ""Expert insights"", ""Action items"", ""Conclusion""]","[""investment"", ""comparison"", ""modeling"", ""financial"", ""market"", ""economics""]",4,Professional Investors & Advisors,"[""portfolio management"", ""investment planning"", ""market analysis""]",55,8,2025-10-25 21:47:59,en,What metrics are most important for {keyword}?,0.93,0.8977409471016785,0.58
36800033,data science,it,How does data science impact business operations?,troubleshooting,Advanced,"[""Introduction to data science"", ""Key points and analysis"", ""Practical examples"", ""Expert insights"", ""Action items"", ""Conclusion""]","[""development"", ""it"", ""programming"", ""troubleshooting"", ""science"", ""data""]",4,Senior Developers & Tech Leads,"[""cybersecurity"", ""cloud computing"", ""web development"", ""machine learning""]",49,7,2025-10-25 21:47:59,en,How does {keyword} impact business operations?,0.74,0.9655022508413343,0.36
36800034,financial modeling,economics,What indicators predict financial modeling market movements?,analysis,Expert,"[""Introduction to financial modeling"", ""Key points and analysis"", ""Practical examples"", ""Expert insights"", ""Action items"", ""Conclusion""]","[""investment"", ""analysis"", ""modeling"", ""financial"", ""market"", ""economics""]",4,Portfolio Managers & Financial Experts,"[""investment planning"", ""portfolio management"", ""market analysis""]",60,7,2025-10-25 21:47:59,en,What indicators predict {keyword} market movements?,0.73,1.0,0.84
36800035,data science,it,What are the best practices for data science development?,optimization,Intermediate,"[""Introduction to data science"", ""Key concepts and definitions"", ""Main categories or types"", ""Examples and case studies"", ""Benefits and advantages"", ""Summary and recommendations""]","[""technology"", ""software"", ""it"", ""science"", ""optimization"", ""data""]",6,Junior to Mid-level Developers,"[""web development"", ""machine learning"", ""cloud computing"", ""cybersecurity""]",57,9,2025-10-25 21:47:59,en,What are the best practices for {keyword} development?,0.89,0.6692548275996801,0.73
36800036,cloud computing,it,How do you stay updated with cloud computing developments?,implementation,Beginner,"[""Overview of cloud computing"", ""Step-by-step implementation"", ""Best practices and tips"", ""Common challenges and solutions"", ""Tools and resources needed"", ""Conclusion and next steps""]","[""computing"", ""development"", ""it"", ""implementation"", ""cloud"", ""technology""]",6,Students & Entry-level Developers,"[""cybersecurity"", ""data science"", ""web development"", ""machine learning""]",58,9,2025-10-25 21:47:59,en,How do you stay updated with {keyword} developments?,0.75,0.3086692547840522,0.71
36800037,financial modeling,economics,How do you hedge against financial modeling market downturns?,optimization,Advanced,"[""Overview of financial modeling"", ""Step-by-step implementation"", ""Best practices and tips"", ""Common challenges and solutions"", ""Tools and resources needed"", ""Conclusion and next steps""]","[""investment"", ""modeling"", ""financial"", ""business"", ""optimization"", ""economics""]",6,Professional Investors & Advisors,"[""portfolio management"", ""market analysis"", ""investment planning""]",61,9,2025-10-25 21:47:59,en,How do you hedge against {keyword} market downturns?,0.85,0.9100056895817568,0.59
36800038,portfolio management,economics,How do you measure portfolio management performance?,how_to,Expert,"[""Overview of portfolio management"", ""Step-by-step implementation"", ""Best practices and tips"", ""Common challenges and solutions"", ""Tools and resources needed"", ""Conclusion and next steps""]","[""investment"", ""how_to"", ""portfolio"", ""management"", ""market"", ""economics""]",6,Portfolio Managers & Financial Experts,"[""financial modeling"", ""investment planning"", ""market analysis""]",52,7,2025-10-25 21:47:59,en,How do you measure {keyword} performance?,0.94,1.0,0.46
36800039,cloud computing,it,How do you choose the right technology stack for cloud computing?,planning,Beginner,"[""Overview of cloud computing"", ""Step-by-step implementation"", ""Best practices and tips"", ""Common challenges and solutions"", ""Tools and resources needed"", ""Conclusion and next steps""]","[""computing"", ""software"", ""planning"", ""it"", ""programming"", ""cloud""]",6,Students & Entry-level Developers,"[""cybersecurity"", ""data science"", ""machine learning"", ""web development""]",65,11,2025-10-25 21:47:59,en,How do you choose the right technology stack for {keyword}?,0.68,0.4244726423144707,0.63
36800040,investment planning,economics,How do you protect your investment planning investments?,strategy,Advanced,"[""Overview of investment planning"", ""Step-by-step implementation"", ""Best practices and tips"", ""Common challenges and solutions"", ""Tools and resources needed"", ""Conclusion and next steps""]","[""investment"", ""planning"", ""market"", ""strategy"", ""economics""]",6,Professional Investors & Advisors,"[""financial modeling"", ""portfolio management"", ""market analysis""]",56,8,2025-10-25 21:47:59,en,How do you protect your {keyword} investments?,0.69,0.8102024460377757,0.34
36800041,cybersecurity,it,How do you troubleshoot common issues with cybersecurity?,implementation,Intermediate,"[""Overview of cybersecurity"", ""Step-by-step implementation"", ""Best practices and tips"", ""Common challenges and solutions"", ""Tools and resources needed"", ""Conclusion and next steps""]","[""development"", ""it"", ""implementation"", ""cybersecurity"", ""technology""]",5,Junior to Mid-level Developers,"[""machine learning"", ""cloud computing"", ""data science"", ""web development""]",57,8,2025-10-25 21:47:59,en,How do you troubleshoot common issues with {keyword}?,0.89,0.6712327524560234,0.46
36800042,machine learning,it,How do you design a scalable machine learning solution?,best_practice,Intermediate,"[""Overview of machine learning"", ""Step-by-step implementation"", ""Best practices and tips"", ""Common challenges and solutions"", ""Tools and resources needed"", ""Conclusion and next steps""]","[""development"", ""it"", ""programming"", ""best_practice"", ""learning"", ""machine""]",6,Junior to Mid-level Developers,"[""data science"", ""cloud computing"", ""web development"", ""cybersecurity""]",55,9,2025-10-25 21:47:59,en,How do you design a scalable {keyword} solution?,0.76,0.7032582093656634,0.51
36800043,data science,it,How do you integrate data science with existing systems?,optimization,Expert,"[""Overview of data science"", ""Step-by-step implementation"", ""Best practices and tips"", ""Common challenges and solutions"", ""Tools and resources needed"", ""Conclusion and next steps""]","[""technology"", ""software"", ""it"", ""science"", ""optimization"", ""data""]",6,Architects & Technical Directors,"[""web development"", ""cybersecurity"", ""machine learning"", ""cloud computing""]",56,9,2025-10-25 21:47:59,en,How do you integrate {keyword} with existing systems?,0.61,1.0,0.61
