record_id,keyword,category,question,question_type,difficulty_level,answer_outline,tags,estimated_read_time,target_audience,related_topics,question_length,word_count,created_date,language,source_template,engagement_score,complexity_score,popularity_score
48500350,market analysis,economics,How do you assess and manage market analysis risks?,optimization,Intermediate,"[""Overview of market analysis"", ""Step-by-step implementation"", ""Best practices and tips"", ""Common challenges and solutions"", ""Tools and resources needed"", ""Conclusion and next steps""]","[""analysis"", ""business"", ""market"", ""optimization"", ""economics""]",6,Individual Investors & Analysts,"[""portfolio management"", ""financial modeling"", ""investment planning""]",51,9,2025-10-25 22:04:17,en,How do you assess and manage {keyword} risks?,0.74,0.7777773488753245,0.55
48500351,market analysis,economics,What are the risks associated with market analysis?,strategy,Intermediate,"[""Introduction to market analysis"", ""Key concepts and definitions"", ""Main categories or types"", ""Examples and case studies"", ""Benefits and advantages"", ""Summary and recommendations""]","[""investment"", ""analysis"", ""finance"", ""market"", ""strategy"", ""economics""]",6,Individual Investors & Analysts,"[""investment planning"", ""portfolio management"", ""financial modeling""]",51,8,2025-10-25 22:04:17,en,What are the risks associated with {keyword}?,0.66,0.6789064300951955,0.71
48500352,digital marketing,marketing,What tools are essential for digital marketing analytics?,troubleshooting,Expert,"[""Introduction to digital marketing"", ""Key points and analysis"", ""Practical examples"", ""Expert insights"", ""Action items"", ""Conclusion""]","[""marketing"", ""promotion"", ""troubleshooting"", ""digital""]",4,Marketing Directors & CMOs,"[""social media"", ""content marketing"", ""brand management""]",57,8,2025-10-25 22:04:17,en,What tools are essential for {keyword} analytics?,0.85,1.0,0.65
48500353,digital marketing,marketing,How do you personalize digital marketing for different segments?,implementation,Beginner,"[""Overview of digital marketing"", ""Step-by-step implementation"", ""Best practices and tips"", ""Common challenges and solutions"", ""Tools and resources needed"", ""Conclusion and next steps""]","[""implementation"", ""marketing"", ""branding"", ""digital""]",6,Marketing Students & Interns,"[""social media"", ""content marketing"", ""brand management""]",64,9,2025-10-25 22:04:17,en,How do you personalize {keyword} for different segments?,0.68,0.304121858484251,0.73
48500354,financial modeling,economics,How do you create a long-term plan for financial modeling?,implementation,Expert,"[""Overview of financial modeling"", ""Step-by-step implementation"", ""Best practices and tips"", ""Common challenges and solutions"", ""Tools and resources needed"", ""Conclusion and next steps""]","[""finance"", ""implementation"", ""modeling"", ""financial"", ""business"", ""economics""]",6,Portfolio Managers & Financial Experts,"[""investment planning"", ""market analysis"", ""portfolio management""]",58,10,2025-10-25 22:04:17,en,How do you create a long-term plan for {keyword}?,0.75,1.0,0.89
48500355,investment planning,economics,How do you assess and manage investment planning risks?,planning,Beginner,"[""Overview of investment planning"", ""Step-by-step implementation"", ""Best practices and tips"", ""Common challenges and solutions"", ""Tools and resources needed"", ""Conclusion and next steps""]","[""market"", ""investment"", ""economics"", ""planning""]",6,Students & New Investors,"[""market analysis"", ""financial modeling"", ""portfolio management""]",55,9,2025-10-25 22:04:17,en,How do you assess and manage {keyword} risks?,0.73,0.49990767659197255,0.32
48500356,social media,marketing,What content types work best for social media?,optimization,Intermediate,"[""Introduction to social media"", ""Key points and analysis"", ""Practical examples"", ""Expert insights"", ""Action items"", ""Conclusion""]","[""media"", ""digital"", ""marketing"", ""social"", ""branding"", ""optimization""]",4,Marketing Coordinators & Specialists,"[""content marketing"", ""digital marketing"", ""brand management""]",46,8,2025-10-25 22:04:17,en,What content types work best for {keyword}?,0.67,0.6467297316999336,0.44
48500357,digital marketing,marketing,How do you identify the right audience for digital marketing?,analysis,Expert,"[""Overview of digital marketing"", ""Step-by-step implementation"", ""Best practices and tips"", ""Common challenges and solutions"", ""Tools and resources needed"", ""Conclusion and next steps""]","[""marketing"", ""advertising"", ""analysis"", ""digital""]",6,Marketing Directors & CMOs,"[""content marketing"", ""social media"", ""brand management""]",61,10,2025-10-25 22:04:17,en,How do you identify the right audience for {keyword}?,0.85,1.0,0.5
48500358,machine learning,it,How does machine learning impact business operations?,comparison,Intermediate,"[""Introduction to machine learning"", ""Key points and analysis"", ""Practical examples"", ""Expert insights"", ""Action items"", ""Conclusion""]","[""it"", ""comparison"", ""programming"", ""learning"", ""machine"", ""technology""]",4,Junior to Mid-level Developers,"[""cloud computing"", ""data science"", ""web development"", ""cybersecurity""]",53,7,2025-10-25 22:04:17,en,How does {keyword} impact business operations?,0.63,0.7239818116614489,0.33
48500359,web development,it,How can web development improve system performance and scalability?,comparison,Intermediate,"[""Introduction to web development"", ""Key points and analysis"", ""Practical examples"", ""Expert insights"", ""Action items"", ""Conclusion""]","[""software"", ""development"", ""it"", ""comparison"", ""programming"", ""web""]",4,Junior to Mid-level Developers,"[""cloud computing"", ""cybersecurity"", ""data science"", ""machine learning""]",67,9,2025-10-25 22:04:17,en,How can {keyword} improve system performance and scalability?,0.72,0.691199769812097,0.69
48500360,content marketing,marketing,What timing strategies work for content marketing?,implementation,Advanced,"[""Introduction to content marketing"", ""Key points and analysis"", ""Practical examples"", ""Expert insights"", ""Action items"", ""Conclusion""]","[""content"", ""implementation"", ""promotion"", ""marketing"", ""digital""]",4,Marketing Managers & Strategists,"[""social media"", ""digital marketing"", ""brand management""]",50,7,2025-10-25 22:04:17,en,What timing strategies work for {keyword}?,0.67,0.8848340273539343,0.81
48500361,financial modeling,economics,What timeline is realistic for financial modeling returns?,how_to,Intermediate,"[""Introduction to financial modeling"", ""Key points and analysis"", ""Practical examples"", ""Expert insights"", ""Action items"", ""Conclusion""]","[""how_to"", ""modeling"", ""financial"", ""market"", ""business"", ""economics""]",4,Individual Investors & Analysts,"[""investment planning"", ""market analysis"", ""portfolio management""]",58,8,2025-10-25 22:04:17,en,What timeline is realistic for {keyword} returns?,0.83,0.7365653341524323,0.84
48500362,investment planning,economics,What timeline is realistic for investment planning returns?,how_to,Intermediate,"[""Introduction to investment planning"", ""Key points and analysis"", ""Practical examples"", ""Expert insights"", ""Action items"", ""Conclusion""]","[""investment"", ""how_to"", ""planning"", ""market"", ""business"", ""economics""]",4,Individual Investors & Analysts,"[""financial modeling"", ""market analysis"", ""portfolio management""]",59,8,2025-10-25 22:04:17,en,What timeline is realistic for {keyword} returns?,0.75,0.7541249204712748,0.39
48500363,investment planning,economics,How do you create a long-term plan for investment planning?,comparison,Expert,"[""Overview of investment planning"", ""Step-by-step implementation"", ""Best practices and tips"", ""Common challenges and solutions"", ""Tools and resources needed"", ""Conclusion and next steps""]","[""investment"", ""planning"", ""comparison"", ""market"", ""economics""]",6,Portfolio Managers & Financial Experts,"[""portfolio management"", ""financial modeling"", ""market analysis""]",59,10,2025-10-25 22:04:17,en,How do you create a long-term plan for {keyword}?,0.82,1.0,0.73
48500364,investment planning,economics,How do you assess and manage investment planning risks?,evaluation,Beginner,"[""Overview of investment planning"", ""Step-by-step implementation"", ""Best practices and tips"", ""Common challenges and solutions"", ""Tools and resources needed"", ""Conclusion and next steps""]","[""investment"", ""planning"", ""evaluation"", ""market"", ""economics""]",6,Students & New Investors,"[""portfolio management"", ""market analysis"", ""financial modeling""]",55,9,2025-10-25 22:04:17,en,How do you assess and manage {keyword} risks?,0.93,0.3286383658602994,0.34
48500365,financial modeling,economics,How do you create a long-term plan for financial modeling?,evaluation,Beginner,"[""Overview of financial modeling"", ""Step-by-step implementation"", ""Best practices and tips"", ""Common challenges and solutions"", ""Tools and resources needed"", ""Conclusion and next steps""]","[""modeling"", ""financial"", ""evaluation"", ""market"", ""business"", ""economics""]",6,Students & New Investors,"[""investment planning"", ""market analysis"", ""portfolio management""]",58,10,2025-10-25 22:04:17,en,How do you create a long-term plan for {keyword}?,0.74,0.49671577720236215,0.33
48500366,web development,it,What is the recommended architecture for web development systems?,troubleshooting,Expert,"[""Introduction to web development"", ""Key points and analysis"", ""Practical examples"", ""Expert insights"", ""Action items"", ""Conclusion""]","[""development"", ""web"", ""it"", ""troubleshooting"", ""technology""]",4,Architects & Technical Directors,"[""data science"", ""machine learning"", ""cybersecurity"", ""cloud computing""]",65,9,2025-10-25 22:04:17,en,What is the recommended architecture for {keyword} systems?,0.88,1.0,0.62
48500367,web development,it,What are the best practices for web development development?,planning,Intermediate,"[""Introduction to web development"", ""Key concepts and definitions"", ""Main categories or types"", ""Examples and case studies"", ""Benefits and advantages"", ""Summary and recommendations""]","[""planning"", ""development"", ""web"", ""it"", ""programming"", ""technology""]",6,Junior to Mid-level Developers,"[""cybersecurity"", ""data science"", ""cloud computing"", ""machine learning""]",60,9,2025-10-25 22:04:17,en,What are the best practices for {keyword} development?,0.94,0.6315138336230983,0.72
48500368,cloud computing,it,What are the latest trends in cloud computing technology?,best_practice,Expert,"[""Introduction to cloud computing"", ""Key concepts and definitions"", ""Main categories or types"", ""Examples and case studies"", ""Benefits and advantages"", ""Summary and recommendations""]","[""computing"", ""software"", ""development"", ""it"", ""best_practice"", ""cloud""]",6,Architects & Technical Directors,"[""machine learning"", ""cybersecurity"", ""web development"", ""data science""]",57,9,2025-10-25 22:04:17,en,What are the latest trends in {keyword} technology?,0.87,1.0,0.38
48500369,cloud computing,it,Which frameworks support cloud computing implementation?,evaluation,Beginner,"[""Introduction to cloud computing"", ""Key points and analysis"", ""Practical examples"", ""Expert insights"", ""Action items"", ""Conclusion""]","[""computing"", ""development"", ""it"", ""evaluation"", ""cloud"", ""technology""]",4,Students & Entry-level Developers,"[""data science"", ""cybersecurity"", ""web development"", ""machine learning""]",56,6,2025-10-25 22:04:17,en,Which frameworks support {keyword} implementation?,0.81,0.3474847350044543,0.61
48500370,financial modeling,economics,What insurance options are available for financial modeling?,best_practice,Beginner,"[""Introduction to financial modeling"", ""Key points and analysis"", ""Practical examples"", ""Expert insights"", ""Action items"", ""Conclusion""]","[""finance"", ""best_practice"", ""modeling"", ""financial"", ""business"", ""economics""]",4,Students & New Investors,"[""investment planning"", ""portfolio management"", ""market analysis""]",60,8,2025-10-25 22:04:17,en,What insurance options are available for {keyword}?,0.81,0.4624311731413916,0.83
48500371,social media,marketing,How is AI changing social media approaches?,troubleshooting,Beginner,"[""Introduction to social media"", ""Key points and analysis"", ""Practical examples"", ""Expert insights"", ""Action items"", ""Conclusion""]","[""media"", ""promotion"", ""troubleshooting"", ""marketing"", ""social"", ""branding""]",4,Marketing Students & Interns,"[""content marketing"", ""digital marketing"", ""brand management""]",43,7,2025-10-25 22:04:17,en,How is AI changing {keyword} approaches?,0.76,0.45651009756943045,0.75
48500372,portfolio management,economics,How do you measure portfolio management performance?,analysis,Expert,"[""Overview of portfolio management"", ""Step-by-step implementation"", ""Best practices and tips"", ""Common challenges and solutions"", ""Tools and resources needed"", ""Conclusion and next steps""]","[""investment"", ""analysis"", ""portfolio"", ""management"", ""business"", ""economics""]",6,Portfolio Managers & Financial Experts,"[""financial modeling"", ""market analysis"", ""investment planning""]",52,7,2025-10-25 22:04:17,en,How do you measure {keyword} performance?,0.67,1.0,0.86
48500373,financial modeling,economics,How do you protect your financial modeling investments?,analysis,Expert,"[""Overview of financial modeling"", ""Step-by-step implementation"", ""Best practices and tips"", ""Common challenges and solutions"", ""Tools and resources needed"", ""Conclusion and next steps""]","[""finance"", ""analysis"", ""modeling"", ""financial"", ""market"", ""economics""]",6,Portfolio Managers & Financial Experts,"[""investment planning"", ""market analysis"", ""portfolio management""]",55,8,2025-10-25 22:04:17,en,How do you protect your {keyword} investments?,0.63,1.0,0.55
48500374,market analysis,economics,What exit strategies should be considered for market analysis?,strategy,Intermediate,"[""Introduction to market analysis"", ""Key points and analysis"", ""Practical examples"", ""Expert insights"", ""Action items"", ""Conclusion""]","[""finance"", ""analysis"", ""market"", ""strategy"", ""economics""]",4,Individual Investors & Analysts,"[""financial modeling"", ""investment planning"", ""portfolio management""]",62,9,2025-10-25 22:04:17,en,What exit strategies should be considered for {keyword}?,0.62,0.6845135147911928,0.57
48500375,digital marketing,marketing,How do you improve digital marketing conversion rates?,troubleshooting,Beginner,"[""Overview of digital marketing"", ""Step-by-step implementation"", ""Best practices and tips"", ""Common challenges and solutions"", ""Tools and resources needed"", ""Conclusion and next steps""]","[""branding"", ""marketing"", ""troubleshooting"", ""digital""]",6,Marketing Students & Interns,"[""brand management"", ""social media"", ""content marketing""]",54,8,2025-10-25 22:04:17,en,How do you improve {keyword} conversion rates?,0.83,0.3418056587851901,0.55
48500376,market analysis,economics,How do you adjust your market analysis strategy during volatility?,implementation,Expert,"[""Overview of market analysis"", ""Step-by-step implementation"", ""Best practices and tips"", ""Common challenges and solutions"", ""Tools and resources needed"", ""Conclusion and next steps""]","[""finance"", ""analysis"", ""implementation"", ""market"", ""economics""]",6,Portfolio Managers & Financial Experts,"[""investment planning"", ""portfolio management"", ""financial modeling""]",66,10,2025-10-25 22:04:17,en,How do you adjust your {keyword} strategy during volatility?,0.71,1.0,0.59
48500377,market analysis,economics,What exit strategies should be considered for market analysis?,analysis,Beginner,"[""Introduction to market analysis"", ""Key points and analysis"", ""Practical examples"", ""Expert insights"", ""Action items"", ""Conclusion""]","[""finance"", ""market"", ""economics"", ""analysis""]",4,Students & New Investors,"[""financial modeling"", ""portfolio management"", ""investment planning""]",62,9,2025-10-25 22:04:17,en,What exit strategies should be considered for {keyword}?,0.85,0.490528091511645,0.49
48500378,brand management,marketing,How do you develop an effective brand management strategy?,implementation,Beginner,"[""Overview of brand management"", ""Step-by-step implementation"", ""Best practices and tips"", ""Common challenges and solutions"", ""Tools and resources needed"", ""Conclusion and next steps""]","[""implementation"", ""marketing"", ""management"", ""advertising"", ""branding"", ""brand""]",6,Marketing Students & Interns,"[""digital marketing"", ""content marketing"", ""social media""]",58,9,2025-10-25 22:04:17,en,How do you develop an effective {keyword} strategy?,0.93,0.3096053908177323,0.4
48500379,machine learning,it,What career opportunities exist in machine learning?,planning,Advanced,"[""Introduction to machine learning"", ""Key points and analysis"", ""Practical examples"", ""Expert insights"", ""Action items"", ""Conclusion""]","[""planning"", ""software"", ""it"", ""programming"", ""learning"", ""machine""]",4,Senior Developers & Tech Leads,"[""web development"", ""cloud computing"", ""data science"", ""cybersecurity""]",52,7,2025-10-25 22:04:17,en,What career opportunities exist in {keyword}?,0.91,0.8561548795601821,0.55
48500380,machine learning,it,What career opportunities exist in machine learning?,strategy,Expert,"[""Introduction to machine learning"", ""Key points and analysis"", ""Practical examples"", ""Expert insights"", ""Action items"", ""Conclusion""]","[""development"", ""it"", ""programming"", ""learning"", ""strategy"", ""machine""]",4,Architects & Technical Directors,"[""cybersecurity"", ""web development"", ""cloud computing"", ""data science""]",52,7,2025-10-25 22:04:17,en,What career opportunities exist in {keyword}?,0.83,1.0,0.71
48500381,investment planning,economics,What insurance options are available for investment planning?,planning,Advanced,"[""Introduction to investment planning"", ""Key points and analysis"", ""Practical examples"", ""Expert insights"", ""Action items"", ""Conclusion""]","[""investment"", ""planning"", ""finance"", ""market"", ""economics""]",4,Professional Investors & Advisors,"[""market analysis"", ""financial modeling"", ""portfolio management""]",61,8,2025-10-25 22:04:17,en,What insurance options are available for {keyword}?,0.9,0.9877833510992051,0.32
48500382,machine learning,it,How do you choose the right technology stack for machine learning?,planning,Expert,"[""Overview of machine learning"", ""Step-by-step implementation"", ""Best practices and tips"", ""Common challenges and solutions"", ""Tools and resources needed"", ""Conclusion and next steps""]","[""planning"", ""it"", ""programming"", ""learning"", ""machine"", ""technology""]",6,Architects & Technical Directors,"[""web development"", ""cybersecurity"", ""data science"", ""cloud computing""]",66,11,2025-10-25 22:04:17,en,How do you choose the right technology stack for {keyword}?,0.66,1.0,0.42
48500383,investment planning,economics,What metrics are most important for investment planning?,implementation,Beginner,"[""Introduction to investment planning"", ""Key points and analysis"", ""Practical examples"", ""Expert insights"", ""Action items"", ""Conclusion""]","[""investment"", ""planning"", ""finance"", ""implementation"", ""business"", ""economics""]",4,Students & New Investors,"[""financial modeling"", ""market analysis"", ""portfolio management""]",56,8,2025-10-25 22:04:17,en,What metrics are most important for {keyword}?,0.68,0.33458349484202365,0.35
48500384,social media,marketing,How do you track and analyze social media performance?,strategy,Intermediate,"[""Overview of social media"", ""Step-by-step implementation"", ""Best practices and tips"", ""Common challenges and solutions"", ""Tools and resources needed"", ""Conclusion and next steps""]","[""media"", ""promotion"", ""marketing"", ""social"", ""advertising"", ""strategy""]",6,Marketing Coordinators & Specialists,"[""content marketing"", ""digital marketing"", ""brand management""]",54,9,2025-10-25 22:04:17,en,How do you track and analyze {keyword} performance?,0.68,0.6512387156053325,0.79
48500385,market analysis,economics,How do you diversify your portfolio using market analysis?,planning,Expert,"[""Overview of market analysis"", ""Step-by-step implementation"", ""Best practices and tips"", ""Common challenges and solutions"", ""Tools and resources needed"", ""Conclusion and next steps""]","[""planning"", ""analysis"", ""market"", ""business"", ""economics""]",6,Portfolio Managers & Financial Experts,"[""portfolio management"", ""investment planning"", ""financial modeling""]",58,9,2025-10-25 22:04:17,en,How do you diversify your portfolio using {keyword}?,0.81,1.0,0.6
48500386,cloud computing,it,Which frameworks support cloud computing implementation?,planning,Expert,"[""Introduction to cloud computing"", ""Key points and analysis"", ""Practical examples"", ""Expert insights"", ""Action items"", ""Conclusion""]","[""computing"", ""planning"", ""development"", ""it"", ""software"", ""cloud""]",4,Architects & Technical Directors,"[""machine learning"", ""cybersecurity"", ""data science"", ""web development""]",56,6,2025-10-25 22:04:17,en,Which frameworks support {keyword} implementation?,0.75,1.0,0.75
48500387,machine learning,it,What are the best practices for machine learning development?,evaluation,Expert,"[""Introduction to machine learning"", ""Key concepts and definitions"", ""Main categories or types"", ""Examples and case studies"", ""Benefits and advantages"", ""Summary and recommendations""]","[""software"", ""development"", ""it"", ""learning"", ""evaluation"", ""machine""]",6,Architects & Technical Directors,"[""cybersecurity"", ""cloud computing"", ""data science"", ""web development""]",61,9,2025-10-25 22:04:17,en,What are the best practices for {keyword} development?,0.93,1.0,0.34
48500388,financial modeling,economics,How do you identify opportunities in financial modeling markets?,planning,Expert,"[""Overview of financial modeling"", ""Step-by-step implementation"", ""Best practices and tips"", ""Common challenges and solutions"", ""Tools and resources needed"", ""Conclusion and next steps""]","[""investment"", ""planning"", ""finance"", ""modeling"", ""financial"", ""economics""]",6,Portfolio Managers & Financial Experts,"[""investment planning"", ""portfolio management"", ""market analysis""]",64,9,2025-10-25 22:04:17,en,How do you identify opportunities in {keyword} markets?,0.88,1.0,0.46
48500389,financial modeling,economics,What timeline is realistic for financial modeling returns?,implementation,Intermediate,"[""Introduction to financial modeling"", ""Key points and analysis"", ""Practical examples"", ""Expert insights"", ""Action items"", ""Conclusion""]","[""investment"", ""implementation"", ""modeling"", ""financial"", ""market"", ""economics""]",4,Individual Investors & Analysts,"[""investment planning"", ""portfolio management"", ""market analysis""]",58,8,2025-10-25 22:04:17,en,What timeline is realistic for {keyword} returns?,0.61,0.7667055572702131,0.65
48500390,data science,it,How do you integrate data science with existing systems?,best_practice,Beginner,"[""Overview of data science"", ""Step-by-step implementation"", ""Best practices and tips"", ""Common challenges and solutions"", ""Tools and resources needed"", ""Conclusion and next steps""]","[""technology"", ""development"", ""it"", ""best_practice"", ""science"", ""data""]",6,Students & Entry-level Developers,"[""cloud computing"", ""cybersecurity"", ""web development"", ""machine learning""]",56,9,2025-10-25 22:04:17,en,How do you integrate {keyword} with existing systems?,0.71,0.48942552515737203,0.63
48500391,market analysis,economics,What is the optimal allocation for market analysis in a portfolio?,optimization,Beginner,"[""Introduction to market analysis"", ""Key points and analysis"", ""Practical examples"", ""Expert insights"", ""Action items"", ""Conclusion""]","[""investment"", ""analysis"", ""business"", ""market"", ""optimization"", ""economics""]",4,Students & New Investors,"[""portfolio management"", ""investment planning"", ""financial modeling""]",66,11,2025-10-25 22:04:17,en,What is the optimal allocation for {keyword} in a portfolio?,0.7,0.3325612458241495,0.83
48500392,content marketing,marketing,How do you track and analyze content marketing performance?,strategy,Beginner,"[""Overview of content marketing"", ""Step-by-step implementation"", ""Best practices and tips"", ""Common challenges and solutions"", ""Tools and resources needed"", ""Conclusion and next steps""]","[""content"", ""marketing"", ""advertising"", ""branding"", ""strategy""]",6,Marketing Students & Interns,"[""brand management"", ""digital marketing"", ""social media""]",59,9,2025-10-25 22:04:17,en,How do you track and analyze {keyword} performance?,0.91,0.3996942321138973,0.82
48500393,content marketing,marketing,What budget should be allocated to content marketing?,analysis,Expert,"[""Introduction to content marketing"", ""Key points and analysis"", ""Practical examples"", ""Expert insights"", ""Action items"", ""Conclusion""]","[""content"", ""analysis"", ""marketing"", ""advertising"", ""branding""]",4,Marketing Directors & CMOs,"[""brand management"", ""social media"", ""digital marketing""]",53,8,2025-10-25 22:04:17,en,What budget should be allocated to {keyword}?,0.61,1.0,0.61
