record_id,keyword,category,question,question_type,difficulty_level,answer_outline,tags,estimated_read_time,target_audience,related_topics,question_length,word_count,created_date,language,source_template,engagement_score,complexity_score,popularity_score
44600649,brand management,marketing,What KPIs are most important for brand management?,strategy,Intermediate,"[""Introduction to brand management"", ""Key points and analysis"", ""Practical examples"", ""Expert insights"", ""Action items"", ""Conclusion""]","[""marketing"", ""management"", ""advertising"", ""branding"", ""strategy"", ""brand""]",4,Marketing Coordinators & Specialists,"[""social media"", ""digital marketing"", ""content marketing""]",50,8,2025-10-25 21:58:42,en,What KPIs are most important for {keyword}?,0.84,0.7772422709405051,0.63
44600650,investment planning,economics,How do you assess and manage investment planning risks?,optimization,Advanced,"[""Overview of investment planning"", ""Step-by-step implementation"", ""Best practices and tips"", ""Common challenges and solutions"", ""Tools and resources needed"", ""Conclusion and next steps""]","[""investment"", ""planning"", ""finance"", ""optimization"", ""economics""]",6,Professional Investors & Advisors,"[""market analysis"", ""portfolio management"", ""financial modeling""]",55,9,2025-10-25 21:58:42,en,How do you assess and manage {keyword} risks?,0.72,0.8032977940357028,0.47
44600651,cybersecurity,it,What career opportunities exist in cybersecurity?,best_practice,Intermediate,"[""Introduction to cybersecurity"", ""Key points and analysis"", ""Practical examples"", ""Expert insights"", ""Action items"", ""Conclusion""]","[""software"", ""development"", ""it"", ""best_practice"", ""cybersecurity""]",4,Junior to Mid-level Developers,"[""web development"", ""data science"", ""machine learning"", ""cloud computing""]",49,6,2025-10-25 21:58:42,en,What career opportunities exist in {keyword}?,0.89,0.7712620745243124,0.35
44600652,social media,marketing,How do you innovate within social media?,how_to,Expert,"[""Overview of social media"", ""Step-by-step implementation"", ""Best practices and tips"", ""Common challenges and solutions"", ""Tools and resources needed"", ""Conclusion and next steps""]","[""how_to"", ""media"", ""promotion"", ""digital"", ""marketing"", ""social""]",6,Marketing Directors & CMOs,"[""digital marketing"", ""brand management"", ""content marketing""]",40,7,2025-10-25 21:58:42,en,How do you innovate within {keyword}?,0.71,1.0,0.82
44600653,market analysis,economics,What tools help analyze market analysis data?,how_to,Intermediate,"[""Introduction to market analysis"", ""Key points and analysis"", ""Practical examples"", ""Expert insights"", ""Action items"", ""Conclusion""]","[""investment"", ""how_to"", ""finance"", ""analysis"", ""market"", ""economics""]",4,Individual Investors & Analysts,"[""investment planning"", ""financial modeling"", ""portfolio management""]",45,7,2025-10-25 21:58:42,en,What tools help analyze {keyword} data?,0.66,0.7524754996222445,0.48
44600654,digital marketing,marketing,What emerging platforms support digital marketing?,optimization,Beginner,"[""Introduction to digital marketing"", ""Key points and analysis"", ""Practical examples"", ""Expert insights"", ""Action items"", ""Conclusion""]","[""promotion"", ""marketing"", ""digital"", ""branding"", ""optimization""]",4,Marketing Students & Interns,"[""social media"", ""brand management"", ""content marketing""]",50,6,2025-10-25 21:58:42,en,What emerging platforms support {keyword}?,0.64,0.3486265504407001,0.84
44600655,financial modeling,economics,What tools help analyze financial modeling data?,troubleshooting,Beginner,"[""Introduction to financial modeling"", ""Key points and analysis"", ""Practical examples"", ""Expert insights"", ""Action items"", ""Conclusion""]","[""investment"", ""troubleshooting"", ""modeling"", ""financial"", ""business"", ""economics""]",4,Students & New Investors,"[""investment planning"", ""portfolio management"", ""market analysis""]",48,7,2025-10-25 21:58:42,en,What tools help analyze {keyword} data?,0.87,0.4203311544170465,0.3
44600656,digital marketing,marketing,What are the latest trends in digital marketing?,planning,Beginner,"[""Introduction to digital marketing"", ""Key concepts and definitions"", ""Main categories or types"", ""Examples and case studies"", ""Benefits and advantages"", ""Summary and recommendations""]","[""marketing"", ""promotion"", ""planning"", ""digital""]",6,Marketing Students & Interns,"[""content marketing"", ""social media"", ""brand management""]",48,8,2025-10-25 21:58:42,en,What are the latest trends in {keyword}?,0.89,0.3085656859275329,0.42
44600657,social media,marketing,What timing strategies work for social media?,how_to,Expert,"[""Introduction to social media"", ""Key points and analysis"", ""Practical examples"", ""Expert insights"", ""Action items"", ""Conclusion""]","[""how_to"", ""media"", ""promotion"", ""marketing"", ""digital"", ""social""]",4,Marketing Directors & CMOs,"[""brand management"", ""content marketing"", ""digital marketing""]",45,7,2025-10-25 21:58:42,en,What timing strategies work for {keyword}?,0.91,1.0,0.86
44600658,investment planning,economics,What insurance options are available for investment planning?,best_practice,Beginner,"[""Introduction to investment planning"", ""Key points and analysis"", ""Practical examples"", ""Expert insights"", ""Action items"", ""Conclusion""]","[""investment"", ""planning"", ""best_practice"", ""market"", ""business"", ""economics""]",4,Students & New Investors,"[""financial modeling"", ""market analysis"", ""portfolio management""]",61,8,2025-10-25 21:58:42,en,What insurance options are available for {keyword}?,0.66,0.4458638381410301,0.74
44600659,market analysis,economics,What tools help analyze market analysis data?,troubleshooting,Intermediate,"[""Introduction to market analysis"", ""Key points and analysis"", ""Practical examples"", ""Expert insights"", ""Action items"", ""Conclusion""]","[""investment"", ""analysis"", ""troubleshooting"", ""market"", ""business"", ""economics""]",4,Individual Investors & Analysts,"[""financial modeling"", ""investment planning"", ""portfolio management""]",45,7,2025-10-25 21:58:42,en,What tools help analyze {keyword} data?,0.74,0.742197326807125,0.54
44600660,market analysis,economics,How do you benchmark market analysis against alternatives?,strategy,Advanced,"[""Overview of market analysis"", ""Step-by-step implementation"", ""Best practices and tips"", ""Common challenges and solutions"", ""Tools and resources needed"", ""Conclusion and next steps""]","[""investment"", ""analysis"", ""market"", ""strategy"", ""economics""]",6,Professional Investors & Advisors,"[""portfolio management"", ""financial modeling"", ""investment planning""]",58,8,2025-10-25 21:58:42,en,How do you benchmark {keyword} against alternatives?,0.84,0.9307216670387262,0.89
44600661,web development,it,How do you integrate web development with existing systems?,comparison,Beginner,"[""Overview of web development"", ""Step-by-step implementation"", ""Best practices and tips"", ""Common challenges and solutions"", ""Tools and resources needed"", ""Conclusion and next steps""]","[""technology"", ""development"", ""it"", ""comparison"", ""programming"", ""web""]",6,Students & Entry-level Developers,"[""cybersecurity"", ""machine learning"", ""cloud computing"", ""data science""]",59,9,2025-10-25 21:58:42,en,How do you integrate {keyword} with existing systems?,0.94,0.4021766990439426,0.52
44600662,digital marketing,marketing,How do you track and analyze digital marketing performance?,best_practice,Advanced,"[""Overview of digital marketing"", ""Step-by-step implementation"", ""Best practices and tips"", ""Common challenges and solutions"", ""Tools and resources needed"", ""Conclusion and next steps""]","[""marketing"", ""promotion"", ""best_practice"", ""digital""]",6,Marketing Managers & Strategists,"[""social media"", ""brand management"", ""content marketing""]",59,9,2025-10-25 21:58:42,en,How do you track and analyze {keyword} performance?,0.7,0.8798803893802652,0.7
44600663,market analysis,economics,What timeline is realistic for market analysis returns?,how_to,Beginner,"[""Introduction to market analysis"", ""Key points and analysis"", ""Practical examples"", ""Expert insights"", ""Action items"", ""Conclusion""]","[""investment"", ""how_to"", ""analysis"", ""finance"", ""market"", ""economics""]",4,Students & New Investors,"[""financial modeling"", ""portfolio management"", ""investment planning""]",55,8,2025-10-25 21:58:42,en,What timeline is realistic for {keyword} returns?,0.65,0.40142594186828645,0.8
44600664,digital marketing,marketing,How do you optimize digital marketing for mobile users?,how_to,Beginner,"[""Overview of digital marketing"", ""Step-by-step implementation"", ""Best practices and tips"", ""Common challenges and solutions"", ""Tools and resources needed"", ""Conclusion and next steps""]","[""how_to"", ""promotion"", ""marketing"", ""digital"", ""branding""]",6,Marketing Students & Interns,"[""brand management"", ""content marketing"", ""social media""]",55,9,2025-10-25 21:58:42,en,How do you optimize {keyword} for mobile users?,0.77,0.4069195442563589,0.46
44600665,cloud computing,it,How do you implement cloud computing in a production environment?,planning,Expert,"[""Overview of cloud computing"", ""Step-by-step implementation"", ""Best practices and tips"", ""Common challenges and solutions"", ""Tools and resources needed"", ""Conclusion and next steps""]","[""computing"", ""planning"", ""software"", ""it"", ""cloud"", ""technology""]",6,Architects & Technical Directors,"[""web development"", ""data science"", ""cybersecurity"", ""machine learning""]",65,10,2025-10-25 21:58:42,en,How do you implement {keyword} in a production environment?,0.87,1.0,0.82
44600666,content marketing,marketing,How do you measure the ROI of content marketing campaigns?,evaluation,Advanced,"[""Overview of content marketing"", ""Step-by-step implementation"", ""Best practices and tips"", ""Common challenges and solutions"", ""Tools and resources needed"", ""Conclusion and next steps""]","[""content"", ""promotion"", ""marketing"", ""branding"", ""evaluation""]",6,Marketing Managers & Strategists,"[""social media"", ""digital marketing"", ""brand management""]",58,10,2025-10-25 21:58:42,en,How do you measure the ROI of {keyword} campaigns?,0.93,0.9183935454384664,0.88
44600667,content marketing,marketing,What tools are essential for content marketing analytics?,how_to,Intermediate,"[""Introduction to content marketing"", ""Key points and analysis"", ""Practical examples"", ""Expert insights"", ""Action items"", ""Conclusion""]","[""how_to"", ""content"", ""promotion"", ""marketing"", ""branding""]",4,Marketing Coordinators & Specialists,"[""brand management"", ""social media"", ""digital marketing""]",57,8,2025-10-25 21:58:42,en,What tools are essential for {keyword} analytics?,0.93,0.7003964025289658,0.33
44600668,data science,it,How do you convince stakeholders to invest in data science?,strategy,Intermediate,"[""Overview of data science"", ""Step-by-step implementation"", ""Best practices and tips"", ""Common challenges and solutions"", ""Tools and resources needed"", ""Conclusion and next steps""]","[""technology"", ""development"", ""it"", ""science"", ""strategy"", ""data""]",6,Junior to Mid-level Developers,"[""cloud computing"", ""cybersecurity"", ""machine learning"", ""web development""]",59,10,2025-10-25 21:58:42,en,How do you convince stakeholders to invest in {keyword}?,0.7,0.6470719714059477,0.45
44600669,investment planning,economics,What are the seasonal patterns in investment planning?,how_to,Advanced,"[""Introduction to investment planning"", ""Key concepts and definitions"", ""Main categories or types"", ""Examples and case studies"", ""Benefits and advantages"", ""Summary and recommendations""]","[""investment"", ""how_to"", ""planning"", ""market"", ""economics""]",6,Professional Investors & Advisors,"[""market analysis"", ""portfolio management"", ""financial modeling""]",54,8,2025-10-25 21:58:42,en,What are the seasonal patterns in {keyword}?,0.79,0.9504506377339024,0.43
44600670,investment planning,economics,How do you identify opportunities in investment planning markets?,analysis,Expert,"[""Overview of investment planning"", ""Step-by-step implementation"", ""Best practices and tips"", ""Common challenges and solutions"", ""Tools and resources needed"", ""Conclusion and next steps""]","[""investment"", ""planning"", ""finance"", ""analysis"", ""economics""]",6,Portfolio Managers & Financial Experts,"[""financial modeling"", ""market analysis"", ""portfolio management""]",65,9,2025-10-25 21:58:42,en,How do you identify opportunities in {keyword} markets?,0.93,1.0,0.39
44600671,content marketing,marketing,What tools are essential for content marketing analytics?,comparison,Intermediate,"[""Introduction to content marketing"", ""Key points and analysis"", ""Practical examples"", ""Expert insights"", ""Action items"", ""Conclusion""]","[""content"", ""promotion"", ""comparison"", ""marketing"", ""branding""]",4,Marketing Coordinators & Specialists,"[""social media"", ""digital marketing"", ""brand management""]",57,8,2025-10-25 21:58:42,en,What tools are essential for {keyword} analytics?,0.84,0.7192361790575605,0.58
44600672,cloud computing,it,How do you troubleshoot common issues with cloud computing?,comparison,Beginner,"[""Overview of cloud computing"", ""Step-by-step implementation"", ""Best practices and tips"", ""Common challenges and solutions"", ""Tools and resources needed"", ""Conclusion and next steps""]","[""computing"", ""software"", ""development"", ""it"", ""comparison"", ""cloud""]",6,Students & Entry-level Developers,"[""machine learning"", ""data science"", ""cybersecurity"", ""web development""]",59,9,2025-10-25 21:58:42,en,How do you troubleshoot common issues with {keyword}?,0.68,0.4316887437410456,0.9
44600673,market analysis,economics,How do you hedge against market analysis market downturns?,strategy,Beginner,"[""Overview of market analysis"", ""Step-by-step implementation"", ""Best practices and tips"", ""Common challenges and solutions"", ""Tools and resources needed"", ""Conclusion and next steps""]","[""investment"", ""finance"", ""analysis"", ""market"", ""strategy"", ""economics""]",6,Students & New Investors,"[""portfolio management"", ""financial modeling"", ""investment planning""]",58,9,2025-10-25 21:58:42,en,How do you hedge against {keyword} market downturns?,0.72,0.45431006311933897,0.79
44600674,web development,it,How do you troubleshoot common issues with web development?,troubleshooting,Advanced,"[""Overview of web development"", ""Step-by-step implementation"", ""Best practices and tips"", ""Common challenges and solutions"", ""Tools and resources needed"", ""Conclusion and next steps""]","[""technology"", ""development"", ""it"", ""programming"", ""troubleshooting"", ""web""]",6,Senior Developers & Tech Leads,"[""cloud computing"", ""data science"", ""machine learning"", ""cybersecurity""]",59,9,2025-10-25 21:58:42,en,How do you troubleshoot common issues with {keyword}?,0.65,0.8092914726341582,0.66
44600675,market analysis,economics,How do you diversify your portfolio using market analysis?,strategy,Beginner,"[""Overview of market analysis"", ""Step-by-step implementation"", ""Best practices and tips"", ""Common challenges and solutions"", ""Tools and resources needed"", ""Conclusion and next steps""]","[""analysis"", ""business"", ""market"", ""strategy"", ""economics""]",6,Students & New Investors,"[""financial modeling"", ""portfolio management"", ""investment planning""]",58,9,2025-10-25 21:58:42,en,How do you diversify your portfolio using {keyword}?,0.82,0.30181670536587746,0.57
44600676,machine learning,it,What ROI can be expected from machine learning implementation?,planning,Beginner,"[""Introduction to machine learning"", ""Key points and analysis"", ""Practical examples"", ""Expert insights"", ""Action items"", ""Conclusion""]","[""planning"", ""development"", ""it"", ""learning"", ""machine"", ""technology""]",4,Students & Entry-level Developers,"[""web development"", ""cloud computing"", ""data science"", ""cybersecurity""]",62,9,2025-10-25 21:58:42,en,What ROI can be expected from {keyword} implementation?,0.77,0.47553156814771375,0.7
44600677,financial modeling,economics,What indicators predict financial modeling market movements?,planning,Expert,"[""Introduction to financial modeling"", ""Key points and analysis"", ""Practical examples"", ""Expert insights"", ""Action items"", ""Conclusion""]","[""investment"", ""planning"", ""finance"", ""modeling"", ""financial"", ""economics""]",4,Portfolio Managers & Financial Experts,"[""investment planning"", ""market analysis"", ""portfolio management""]",60,7,2025-10-25 21:58:42,en,What indicators predict {keyword} market movements?,0.75,1.0,0.9
44600678,investment planning,economics,What exit strategies should be considered for investment planning?,optimization,Intermediate,"[""Introduction to investment planning"", ""Key points and analysis"", ""Practical examples"", ""Expert insights"", ""Action items"", ""Conclusion""]","[""investment"", ""planning"", ""finance"", ""optimization"", ""economics""]",4,Individual Investors & Analysts,"[""market analysis"", ""portfolio management"", ""financial modeling""]",66,9,2025-10-25 21:58:42,en,What exit strategies should be considered for {keyword}?,0.65,0.7066795880856479,0.5
44600679,market analysis,economics,How does global economics impact market analysis?,comparison,Expert,"[""Introduction to market analysis"", ""Key points and analysis"", ""Practical examples"", ""Expert insights"", ""Action items"", ""Conclusion""]","[""investment"", ""analysis"", ""comparison"", ""market"", ""business"", ""economics""]",4,Portfolio Managers & Financial Experts,"[""portfolio management"", ""financial modeling"", ""investment planning""]",49,7,2025-10-25 21:58:42,en,How does global economics impact {keyword}?,0.94,1.0,0.59
44600680,social media,marketing,What content types work best for social media?,implementation,Beginner,"[""Introduction to social media"", ""Key points and analysis"", ""Practical examples"", ""Expert insights"", ""Action items"", ""Conclusion""]","[""media"", ""implementation"", ""marketing"", ""digital"", ""social"", ""branding""]",4,Marketing Students & Interns,"[""brand management"", ""content marketing"", ""digital marketing""]",46,8,2025-10-25 21:58:42,en,What content types work best for {keyword}?,0.67,0.3018331844550033,0.71
44600681,financial modeling,economics,What is the optimal allocation for financial modeling in a portfolio?,best_practice,Expert,"[""Introduction to financial modeling"", ""Key points and analysis"", ""Practical examples"", ""Expert insights"", ""Action items"", ""Conclusion""]","[""finance"", ""best_practice"", ""modeling"", ""financial"", ""business"", ""economics""]",4,Portfolio Managers & Financial Experts,"[""portfolio management"", ""market analysis"", ""investment planning""]",69,11,2025-10-25 21:58:42,en,What is the optimal allocation for {keyword} in a portfolio?,0.7,1.0,0.82
44600682,brand management,marketing,How do you automate brand management processes?,implementation,Beginner,"[""Overview of brand management"", ""Step-by-step implementation"", ""Best practices and tips"", ""Common challenges and solutions"", ""Tools and resources needed"", ""Conclusion and next steps""]","[""implementation"", ""promotion"", ""marketing"", ""management"", ""advertising"", ""brand""]",6,Marketing Students & Interns,"[""digital marketing"", ""content marketing"", ""social media""]",47,7,2025-10-25 21:58:42,en,How do you automate {keyword} processes?,0.91,0.45383948743784,0.72
44600683,market analysis,economics,How do economic conditions affect market analysis performance?,planning,Advanced,"[""Introduction to market analysis"", ""Key points and analysis"", ""Practical examples"", ""Expert insights"", ""Action items"", ""Conclusion""]","[""planning"", ""finance"", ""analysis"", ""market"", ""business"", ""economics""]",4,Professional Investors & Advisors,"[""investment planning"", ""financial modeling"", ""portfolio management""]",62,8,2025-10-25 21:58:42,en,How do economic conditions affect {keyword} performance?,0.7,0.976001203541776,0.74
44600684,machine learning,it,How do you implement machine learning in a production environment?,how_to,Expert,"[""Overview of machine learning"", ""Step-by-step implementation"", ""Best practices and tips"", ""Common challenges and solutions"", ""Tools and resources needed"", ""Conclusion and next steps""]","[""how_to"", ""software"", ""it"", ""programming"", ""learning"", ""machine""]",6,Architects & Technical Directors,"[""cybersecurity"", ""web development"", ""cloud computing"", ""data science""]",66,10,2025-10-25 21:58:42,en,How do you implement {keyword} in a production environment?,0.92,1.0,0.61
44600685,financial modeling,economics,How do you analyze market trends in financial modeling?,optimization,Advanced,"[""Overview of financial modeling"", ""Step-by-step implementation"", ""Best practices and tips"", ""Common challenges and solutions"", ""Tools and resources needed"", ""Conclusion and next steps""]","[""modeling"", ""financial"", ""business"", ""market"", ""optimization"", ""economics""]",6,Professional Investors & Advisors,"[""market analysis"", ""investment planning"", ""portfolio management""]",55,9,2025-10-25 21:58:42,en,How do you analyze market trends in {keyword}?,0.82,0.890962079157667,0.46
44600686,financial modeling,economics,How do you adjust your financial modeling strategy during volatility?,analysis,Intermediate,"[""Overview of financial modeling"", ""Step-by-step implementation"", ""Best practices and tips"", ""Common challenges and solutions"", ""Tools and resources needed"", ""Conclusion and next steps""]","[""analysis"", ""finance"", ""modeling"", ""financial"", ""market"", ""economics""]",6,Individual Investors & Analysts,"[""market analysis"", ""portfolio management"", ""investment planning""]",69,10,2025-10-25 21:58:42,en,How do you adjust your {keyword} strategy during volatility?,0.82,0.6622428411207151,0.57
44600687,investment planning,economics,How do you create a long-term plan for investment planning?,implementation,Expert,"[""Overview of investment planning"", ""Step-by-step implementation"", ""Best practices and tips"", ""Common challenges and solutions"", ""Tools and resources needed"", ""Conclusion and next steps""]","[""investment"", ""planning"", ""finance"", ""implementation"", ""business"", ""economics""]",6,Portfolio Managers & Financial Experts,"[""portfolio management"", ""market analysis"", ""financial modeling""]",59,10,2025-10-25 21:58:42,en,How do you create a long-term plan for {keyword}?,0.77,1.0,0.61
44600688,digital marketing,marketing,How do you innovate within digital marketing?,planning,Advanced,"[""Overview of digital marketing"", ""Step-by-step implementation"", ""Best practices and tips"", ""Common challenges and solutions"", ""Tools and resources needed"", ""Conclusion and next steps""]","[""marketing"", ""advertising"", ""planning"", ""digital""]",6,Marketing Managers & Strategists,"[""brand management"", ""social media"", ""content marketing""]",45,7,2025-10-25 21:58:42,en,How do you innovate within {keyword}?,0.85,0.9974922098216724,0.61
44600689,market analysis,economics,How do you benchmark market analysis against alternatives?,troubleshooting,Advanced,"[""Overview of market analysis"", ""Step-by-step implementation"", ""Best practices and tips"", ""Common challenges and solutions"", ""Tools and resources needed"", ""Conclusion and next steps""]","[""investment"", ""analysis"", ""finance"", ""troubleshooting"", ""market"", ""economics""]",6,Professional Investors & Advisors,"[""portfolio management"", ""financial modeling"", ""investment planning""]",58,8,2025-10-25 21:58:42,en,How do you benchmark {keyword} against alternatives?,0.74,0.8273089118686042,0.58
44600690,social media,marketing,How do you personalize social media for different segments?,implementation,Beginner,"[""Overview of social media"", ""Step-by-step implementation"", ""Best practices and tips"", ""Common challenges and solutions"", ""Tools and resources needed"", ""Conclusion and next steps""]","[""media"", ""implementation"", ""promotion"", ""marketing"", ""digital"", ""social""]",6,Marketing Students & Interns,"[""content marketing"", ""digital marketing"", ""brand management""]",59,9,2025-10-25 21:58:42,en,How do you personalize {keyword} for different segments?,0.61,0.3969717670772398,0.52
44600691,portfolio management,economics,What strategies work best for portfolio management investment?,strategy,Advanced,"[""Introduction to portfolio management"", ""Key points and analysis"", ""Practical examples"", ""Expert insights"", ""Action items"", ""Conclusion""]","[""finance"", ""portfolio"", ""management"", ""business"", ""strategy"", ""economics""]",4,Professional Investors & Advisors,"[""investment planning"", ""financial modeling"", ""market analysis""]",62,8,2025-10-25 21:58:42,en,What strategies work best for {keyword} investment?,0.75,0.8933794246125035,0.8
44600692,web development,it,How do you implement web development in a production environment?,strategy,Advanced,"[""Overview of web development"", ""Step-by-step implementation"", ""Best practices and tips"", ""Common challenges and solutions"", ""Tools and resources needed"", ""Conclusion and next steps""]","[""development"", ""web"", ""it"", ""strategy"", ""technology""]",6,Senior Developers & Tech Leads,"[""cloud computing"", ""data science"", ""cybersecurity"", ""machine learning""]",65,10,2025-10-25 21:58:42,en,How do you implement {keyword} in a production environment?,0.75,0.9468684610151147,0.47
