record_id,keyword,category,question,question_type,difficulty_level,answer_outline,tags,estimated_read_time,target_audience,related_topics,question_length,word_count,created_date,language,source_template,engagement_score,complexity_score,popularity_score
46800351,market analysis,economics,What exit strategies should be considered for market analysis?,analysis,Expert,"[""Introduction to market analysis"", ""Key points and analysis"", ""Practical examples"", ""Expert insights"", ""Action items"", ""Conclusion""]","[""market"", ""business"", ""economics"", ""analysis""]",4,Portfolio Managers & Financial Experts,"[""financial modeling"", ""investment planning"", ""portfolio management""]",62,9,2025-10-25 22:01:45,en,What exit strategies should be considered for {keyword}?,0.87,1.0,0.81
46800352,digital marketing,marketing,What emerging platforms support digital marketing?,planning,Beginner,"[""Introduction to digital marketing"", ""Key points and analysis"", ""Practical examples"", ""Expert insights"", ""Action items"", ""Conclusion""]","[""planning"", ""promotion"", ""marketing"", ""digital"", ""advertising""]",4,Marketing Students & Interns,"[""brand management"", ""social media"", ""content marketing""]",50,6,2025-10-25 22:01:45,en,What emerging platforms support {keyword}?,0.65,0.3071461635055051,0.38
46800353,cybersecurity,it,How does cybersecurity impact business operations?,best_practice,Beginner,"[""Introduction to cybersecurity"", ""Key points and analysis"", ""Practical examples"", ""Expert insights"", ""Action items"", ""Conclusion""]","[""development"", ""it"", ""best_practice"", ""cybersecurity"", ""technology""]",4,Students & Entry-level Developers,"[""data science"", ""cloud computing"", ""machine learning"", ""web development""]",50,6,2025-10-25 22:01:45,en,How does {keyword} impact business operations?,0.7,0.40190337825080646,0.67
46800354,social media,marketing,What are the latest trends in social media?,planning,Advanced,"[""Introduction to social media"", ""Key concepts and definitions"", ""Main categories or types"", ""Examples and case studies"", ""Benefits and advantages"", ""Summary and recommendations""]","[""planning"", ""media"", ""promotion"", ""marketing"", ""social"", ""advertising""]",6,Marketing Managers & Strategists,"[""digital marketing"", ""content marketing"", ""brand management""]",43,8,2025-10-25 22:01:45,en,What are the latest trends in {keyword}?,0.78,0.8244215157787212,0.75
46800355,data science,it,What certifications are valuable for data science professionals?,analysis,Intermediate,"[""Introduction to data science"", ""Key points and analysis"", ""Practical examples"", ""Expert insights"", ""Action items"", ""Conclusion""]","[""software"", ""analysis"", ""it"", ""development"", ""science"", ""data""]",4,Junior to Mid-level Developers,"[""machine learning"", ""cloud computing"", ""cybersecurity"", ""web development""]",64,8,2025-10-25 22:01:45,en,What certifications are valuable for {keyword} professionals?,0.94,0.7208010066095669,0.71
46800356,social media,marketing,How do you develop an effective social media strategy?,evaluation,Beginner,"[""Overview of social media"", ""Step-by-step implementation"", ""Best practices and tips"", ""Common challenges and solutions"", ""Tools and resources needed"", ""Conclusion and next steps""]","[""media"", ""marketing"", ""social"", ""advertising"", ""branding"", ""evaluation""]",6,Marketing Students & Interns,"[""brand management"", ""digital marketing"", ""content marketing""]",54,9,2025-10-25 22:01:45,en,How do you develop an effective {keyword} strategy?,0.77,0.30932841296231195,0.34
46800357,data science,it,How do you troubleshoot common issues with data science?,optimization,Intermediate,"[""Overview of data science"", ""Step-by-step implementation"", ""Best practices and tips"", ""Common challenges and solutions"", ""Tools and resources needed"", ""Conclusion and next steps""]","[""software"", ""it"", ""programming"", ""science"", ""optimization"", ""data""]",6,Junior to Mid-level Developers,"[""machine learning"", ""web development"", ""cloud computing"", ""cybersecurity""]",56,9,2025-10-25 22:01:45,en,How do you troubleshoot common issues with {keyword}?,0.79,0.6414414508826919,0.59
46800358,cloud computing,it,How can cloud computing improve system performance and scalability?,optimization,Beginner,"[""Introduction to cloud computing"", ""Key points and analysis"", ""Practical examples"", ""Expert insights"", ""Action items"", ""Conclusion""]","[""computing"", ""software"", ""cloud"", ""it"", ""development"", ""optimization""]",4,Students & Entry-level Developers,"[""web development"", ""data science"", ""machine learning"", ""cybersecurity""]",67,9,2025-10-25 22:01:45,en,How can {keyword} improve system performance and scalability?,0.68,0.4904605397952125,0.81
46800359,web development,it,Which frameworks support web development implementation?,how_to,Advanced,"[""Introduction to web development"", ""Key points and analysis"", ""Practical examples"", ""Expert insights"", ""Action items"", ""Conclusion""]","[""how_to"", ""technology"", ""development"", ""it"", ""programming"", ""web""]",4,Senior Developers & Tech Leads,"[""data science"", ""machine learning"", ""cloud computing"", ""cybersecurity""]",56,6,2025-10-25 22:01:45,en,Which frameworks support {keyword} implementation?,0.6,0.8282221489554886,0.63
46800360,data science,it,How do you choose the right technology stack for data science?,how_to,Advanced,"[""Overview of data science"", ""Step-by-step implementation"", ""Best practices and tips"", ""Common challenges and solutions"", ""Tools and resources needed"", ""Conclusion and next steps""]","[""how_to"", ""technology"", ""it"", ""programming"", ""science"", ""data""]",6,Senior Developers & Tech Leads,"[""cloud computing"", ""machine learning"", ""cybersecurity"", ""web development""]",62,11,2025-10-25 22:01:45,en,How do you choose the right technology stack for {keyword}?,0.82,0.9716737328008346,0.81
46800361,machine learning,it,What are the key components of a machine learning implementation?,planning,Beginner,"[""Introduction to machine learning"", ""Key concepts and definitions"", ""Main categories or types"", ""Examples and case studies"", ""Benefits and advantages"", ""Summary and recommendations""]","[""software"", ""planning"", ""it"", ""development"", ""learning"", ""machine""]",6,Students & Entry-level Developers,"[""web development"", ""data science"", ""cybersecurity"", ""cloud computing""]",65,10,2025-10-25 22:01:45,en,What are the key components of a {keyword} implementation?,0.84,0.3925051197079753,0.44
46800362,digital marketing,marketing,What demographics respond best to digital marketing?,best_practice,Expert,"[""Introduction to digital marketing"", ""Key points and analysis"", ""Practical examples"", ""Expert insights"", ""Action items"", ""Conclusion""]","[""branding"", ""marketing"", ""best_practice"", ""digital""]",4,Marketing Directors & CMOs,"[""content marketing"", ""brand management"", ""social media""]",52,7,2025-10-25 22:01:45,en,What demographics respond best to {keyword}?,0.77,1.0,0.4
46800363,brand management,marketing,What emerging platforms support brand management?,planning,Advanced,"[""Introduction to brand management"", ""Key points and analysis"", ""Practical examples"", ""Expert insights"", ""Action items"", ""Conclusion""]","[""planning"", ""promotion"", ""marketing"", ""management"", ""branding"", ""brand""]",4,Marketing Managers & Strategists,"[""social media"", ""content marketing"", ""digital marketing""]",49,6,2025-10-25 22:01:45,en,What emerging platforms support {keyword}?,0.92,0.9050988954105681,0.39
46800364,portfolio management,economics,How do you identify opportunities in portfolio management markets?,implementation,Beginner,"[""Overview of portfolio management"", ""Step-by-step implementation"", ""Best practices and tips"", ""Common challenges and solutions"", ""Tools and resources needed"", ""Conclusion and next steps""]","[""investment"", ""implementation"", ""portfolio"", ""management"", ""market"", ""economics""]",6,Students & New Investors,"[""investment planning"", ""financial modeling"", ""market analysis""]",66,9,2025-10-25 22:01:45,en,How do you identify opportunities in {keyword} markets?,0.65,0.42323620753784985,0.87
46800365,brand management,marketing,How do you automate brand management processes?,best_practice,Intermediate,"[""Overview of brand management"", ""Step-by-step implementation"", ""Best practices and tips"", ""Common challenges and solutions"", ""Tools and resources needed"", ""Conclusion and next steps""]","[""promotion"", ""best_practice"", ""digital"", ""marketing"", ""management"", ""brand""]",6,Marketing Coordinators & Specialists,"[""social media"", ""content marketing"", ""digital marketing""]",47,7,2025-10-25 22:01:45,en,How do you automate {keyword} processes?,0.83,0.7179953696533222,0.38
46800366,financial modeling,economics,What insurance options are available for financial modeling?,analysis,Intermediate,"[""Introduction to financial modeling"", ""Key points and analysis"", ""Practical examples"", ""Expert insights"", ""Action items"", ""Conclusion""]","[""analysis"", ""modeling"", ""financial"", ""market"", ""business"", ""economics""]",4,Individual Investors & Analysts,"[""investment planning"", ""market analysis"", ""portfolio management""]",60,8,2025-10-25 22:01:45,en,What insurance options are available for {keyword}?,0.79,0.6598221320967949,0.85
46800367,data science,it,What are the key components of a data science implementation?,strategy,Expert,"[""Introduction to data science"", ""Key concepts and definitions"", ""Main categories or types"", ""Examples and case studies"", ""Benefits and advantages"", ""Summary and recommendations""]","[""software"", ""development"", ""it"", ""science"", ""strategy"", ""data""]",6,Architects & Technical Directors,"[""machine learning"", ""cybersecurity"", ""cloud computing"", ""web development""]",61,10,2025-10-25 22:01:45,en,What are the key components of a {keyword} implementation?,0.64,1.0,0.31
46800368,financial modeling,economics,How do you identify opportunities in financial modeling markets?,analysis,Advanced,"[""Overview of financial modeling"", ""Step-by-step implementation"", ""Best practices and tips"", ""Common challenges and solutions"", ""Tools and resources needed"", ""Conclusion and next steps""]","[""analysis"", ""modeling"", ""financial"", ""market"", ""business"", ""economics""]",6,Professional Investors & Advisors,"[""investment planning"", ""market analysis"", ""portfolio management""]",64,9,2025-10-25 22:01:45,en,How do you identify opportunities in {keyword} markets?,0.66,0.8675686800711279,0.49
46800369,digital marketing,marketing,How do you improve digital marketing conversion rates?,implementation,Expert,"[""Overview of digital marketing"", ""Step-by-step implementation"", ""Best practices and tips"", ""Common challenges and solutions"", ""Tools and resources needed"", ""Conclusion and next steps""]","[""implementation"", ""marketing"", ""branding"", ""digital""]",6,Marketing Directors & CMOs,"[""content marketing"", ""brand management"", ""social media""]",54,8,2025-10-25 22:01:45,en,How do you improve {keyword} conversion rates?,0.9,1.0,0.62
46800370,cloud computing,it,How do you integrate cloud computing with existing systems?,optimization,Advanced,"[""Overview of cloud computing"", ""Step-by-step implementation"", ""Best practices and tips"", ""Common challenges and solutions"", ""Tools and resources needed"", ""Conclusion and next steps""]","[""computing"", ""software"", ""cloud"", ""it"", ""optimization"", ""technology""]",6,Senior Developers & Tech Leads,"[""web development"", ""cybersecurity"", ""data science"", ""machine learning""]",59,9,2025-10-25 22:01:45,en,How do you integrate {keyword} with existing systems?,0.91,0.9007891708826384,0.52
46800371,content marketing,marketing,What A/B tests should you run for content marketing?,optimization,Intermediate,"[""Introduction to content marketing"", ""Key points and analysis"", ""Practical examples"", ""Expert insights"", ""Action items"", ""Conclusion""]","[""content"", ""marketing"", ""advertising"", ""branding"", ""optimization""]",4,Marketing Coordinators & Specialists,"[""brand management"", ""social media"", ""digital marketing""]",52,9,2025-10-25 22:01:45,en,What A/B tests should you run for {keyword}?,0.69,0.799238968492162,0.57
46800372,digital marketing,marketing,What tools are essential for digital marketing analytics?,how_to,Expert,"[""Introduction to digital marketing"", ""Key points and analysis"", ""Practical examples"", ""Expert insights"", ""Action items"", ""Conclusion""]","[""branding"", ""marketing"", ""how_to"", ""digital""]",4,Marketing Directors & CMOs,"[""content marketing"", ""brand management"", ""social media""]",57,8,2025-10-25 22:01:45,en,What tools are essential for {keyword} analytics?,0.64,1.0,0.63
46800373,social media,marketing,How is AI changing social media approaches?,best_practice,Intermediate,"[""Introduction to social media"", ""Key points and analysis"", ""Practical examples"", ""Expert insights"", ""Action items"", ""Conclusion""]","[""media"", ""best_practice"", ""marketing"", ""digital"", ""social"", ""advertising""]",4,Marketing Coordinators & Specialists,"[""digital marketing"", ""brand management"", ""content marketing""]",43,7,2025-10-25 22:01:45,en,How is AI changing {keyword} approaches?,0.69,0.7318993850210241,0.42
46800374,portfolio management,economics,How do you report on portfolio management performance to stakeholders?,analysis,Beginner,"[""Overview of portfolio management"", ""Step-by-step implementation"", ""Best practices and tips"", ""Common challenges and solutions"", ""Tools and resources needed"", ""Conclusion and next steps""]","[""analysis"", ""portfolio"", ""management"", ""market"", ""business"", ""economics""]",6,Students & New Investors,"[""investment planning"", ""market analysis"", ""financial modeling""]",70,10,2025-10-25 22:01:45,en,How do you report on {keyword} performance to stakeholders?,0.85,0.4859226115978743,0.38
46800375,digital marketing,marketing,What emerging platforms support digital marketing?,evaluation,Beginner,"[""Introduction to digital marketing"", ""Key points and analysis"", ""Practical examples"", ""Expert insights"", ""Action items"", ""Conclusion""]","[""marketing"", ""digital"", ""advertising"", ""branding"", ""evaluation""]",4,Marketing Students & Interns,"[""content marketing"", ""social media"", ""brand management""]",50,6,2025-10-25 22:01:45,en,What emerging platforms support {keyword}?,0.65,0.45452474091038675,0.37
46800376,web development,it,What tools are essential for web development development?,strategy,Beginner,"[""Introduction to web development"", ""Key points and analysis"", ""Practical examples"", ""Expert insights"", ""Action items"", ""Conclusion""]","[""technology"", ""development"", ""it"", ""programming"", ""strategy"", ""web""]",4,Students & Entry-level Developers,"[""cloud computing"", ""machine learning"", ""cybersecurity"", ""data science""]",57,8,2025-10-25 22:01:45,en,What tools are essential for {keyword} development?,0.65,0.4181896370815618,0.86
46800377,market analysis,economics,How do you protect your market analysis investments?,how_to,Advanced,"[""Overview of market analysis"", ""Step-by-step implementation"", ""Best practices and tips"", ""Common challenges and solutions"", ""Tools and resources needed"", ""Conclusion and next steps""]","[""how_to"", ""analysis"", ""market"", ""business"", ""economics""]",6,Professional Investors & Advisors,"[""investment planning"", ""portfolio management"", ""financial modeling""]",52,8,2025-10-25 22:01:45,en,How do you protect your {keyword} investments?,0.76,0.8965397326956986,0.46
46800378,social media,marketing,How do you measure the ROI of social media campaigns?,implementation,Expert,"[""Overview of social media"", ""Step-by-step implementation"", ""Best practices and tips"", ""Common challenges and solutions"", ""Tools and resources needed"", ""Conclusion and next steps""]","[""media"", ""implementation"", ""promotion"", ""marketing"", ""social"", ""branding""]",6,Marketing Directors & CMOs,"[""content marketing"", ""digital marketing"", ""brand management""]",53,10,2025-10-25 22:01:45,en,How do you measure the ROI of {keyword} campaigns?,0.69,1.0,0.3
46800379,content marketing,marketing,What emerging platforms support content marketing?,troubleshooting,Advanced,"[""Introduction to content marketing"", ""Key points and analysis"", ""Practical examples"", ""Expert insights"", ""Action items"", ""Conclusion""]","[""content"", ""promotion"", ""troubleshooting"", ""marketing"", ""advertising""]",4,Marketing Managers & Strategists,"[""brand management"", ""social media"", ""digital marketing""]",50,6,2025-10-25 22:01:45,en,What emerging platforms support {keyword}?,0.61,0.924262721744499,0.61
46800380,investment planning,economics,How do you assess and manage investment planning risks?,comparison,Advanced,"[""Overview of investment planning"", ""Step-by-step implementation"", ""Best practices and tips"", ""Common challenges and solutions"", ""Tools and resources needed"", ""Conclusion and next steps""]","[""investment"", ""planning"", ""finance"", ""comparison"", ""economics""]",6,Professional Investors & Advisors,"[""portfolio management"", ""financial modeling"", ""market analysis""]",55,9,2025-10-25 22:01:45,en,How do you assess and manage {keyword} risks?,0.92,0.9402975630037074,0.83
46800381,brand management,marketing,How do you track and analyze brand management performance?,evaluation,Advanced,"[""Overview of brand management"", ""Step-by-step implementation"", ""Best practices and tips"", ""Common challenges and solutions"", ""Tools and resources needed"", ""Conclusion and next steps""]","[""promotion"", ""marketing"", ""management"", ""advertising"", ""evaluation"", ""brand""]",6,Marketing Managers & Strategists,"[""content marketing"", ""digital marketing"", ""social media""]",58,9,2025-10-25 22:01:45,en,How do you track and analyze {keyword} performance?,0.89,0.890346431969475,0.75
46800382,web development,it,What are the key components of a web development implementation?,analysis,Intermediate,"[""Introduction to web development"", ""Key concepts and definitions"", ""Main categories or types"", ""Examples and case studies"", ""Benefits and advantages"", ""Summary and recommendations""]","[""development"", ""web"", ""analysis"", ""it"", ""programming"", ""technology""]",6,Junior to Mid-level Developers,"[""machine learning"", ""data science"", ""cloud computing"", ""cybersecurity""]",64,10,2025-10-25 22:01:45,en,What are the key components of a {keyword} implementation?,0.91,0.748161863125091,0.37
46800383,market analysis,economics,What metrics are most important for market analysis?,evaluation,Beginner,"[""Introduction to market analysis"", ""Key points and analysis"", ""Practical examples"", ""Expert insights"", ""Action items"", ""Conclusion""]","[""investment"", ""analysis"", ""finance"", ""evaluation"", ""market"", ""economics""]",4,Students & New Investors,"[""investment planning"", ""financial modeling"", ""portfolio management""]",52,8,2025-10-25 22:01:45,en,What metrics are most important for {keyword}?,0.67,0.3069782274512268,0.41
46800384,cybersecurity,it,How do you optimize cybersecurity for different platforms?,analysis,Beginner,"[""Overview of cybersecurity"", ""Step-by-step implementation"", ""Best practices and tips"", ""Common challenges and solutions"", ""Tools and resources needed"", ""Conclusion and next steps""]","[""analysis"", ""it"", ""programming"", ""cybersecurity"", ""technology""]",5,Students & Entry-level Developers,"[""data science"", ""web development"", ""cloud computing"", ""machine learning""]",58,8,2025-10-25 22:01:45,en,How do you optimize {keyword} for different platforms?,0.8,0.42906762221085437,0.71
46800385,digital marketing,marketing,How do you reach new customers through digital marketing?,strategy,Expert,"[""Overview of digital marketing"", ""Step-by-step implementation"", ""Best practices and tips"", ""Common challenges and solutions"", ""Tools and resources needed"", ""Conclusion and next steps""]","[""marketing"", ""strategy"", ""advertising"", ""digital""]",6,Marketing Directors & CMOs,"[""content marketing"", ""brand management"", ""social media""]",57,9,2025-10-25 22:01:45,en,How do you reach new customers through {keyword}?,0.87,1.0,0.5
46800386,cybersecurity,it,What career opportunities exist in cybersecurity?,how_to,Advanced,"[""Introduction to cybersecurity"", ""Key points and analysis"", ""Practical examples"", ""Expert insights"", ""Action items"", ""Conclusion""]","[""how_to"", ""development"", ""it"", ""programming"", ""cybersecurity""]",4,Senior Developers & Tech Leads,"[""data science"", ""web development"", ""machine learning"", ""cloud computing""]",49,6,2025-10-25 22:01:45,en,What career opportunities exist in {keyword}?,0.67,0.9048220749629763,0.71
46800387,portfolio management,economics,What are the regulatory considerations for portfolio management?,implementation,Advanced,"[""Introduction to portfolio management"", ""Key concepts and definitions"", ""Main categories or types"", ""Examples and case studies"", ""Benefits and advantages"", ""Summary and recommendations""]","[""implementation"", ""portfolio"", ""management"", ""market"", ""business"", ""economics""]",6,Professional Investors & Advisors,"[""market analysis"", ""financial modeling"", ""investment planning""]",64,8,2025-10-25 22:01:45,en,What are the regulatory considerations for {keyword}?,0.61,0.9490300164387349,0.73
46800388,cloud computing,it,What ROI can be expected from cloud computing implementation?,strategy,Beginner,"[""Introduction to cloud computing"", ""Key points and analysis"", ""Practical examples"", ""Expert insights"", ""Action items"", ""Conclusion""]","[""computing"", ""cloud"", ""development"", ""it"", ""software"", ""strategy""]",4,Students & Entry-level Developers,"[""machine learning"", ""cybersecurity"", ""web development"", ""data science""]",61,9,2025-10-25 22:01:45,en,What ROI can be expected from {keyword} implementation?,0.76,0.3133146995754286,0.7
46800389,portfolio management,economics,What factors should be considered when evaluating portfolio management?,strategy,Advanced,"[""Introduction to portfolio management"", ""Key points and analysis"", ""Practical examples"", ""Expert insights"", ""Action items"", ""Conclusion""]","[""investment"", ""finance"", ""portfolio"", ""management"", ""strategy"", ""economics""]",4,Professional Investors & Advisors,"[""investment planning"", ""financial modeling"", ""market analysis""]",71,9,2025-10-25 22:01:45,en,What factors should be considered when evaluating {keyword}?,0.84,0.9995385504691188,0.46
46800390,financial modeling,economics,How do you adjust your financial modeling strategy during volatility?,strategy,Intermediate,"[""Overview of financial modeling"", ""Step-by-step implementation"", ""Best practices and tips"", ""Common challenges and solutions"", ""Tools and resources needed"", ""Conclusion and next steps""]","[""finance"", ""modeling"", ""financial"", ""business"", ""strategy"", ""economics""]",6,Individual Investors & Analysts,"[""portfolio management"", ""market analysis"", ""investment planning""]",69,10,2025-10-25 22:01:45,en,How do you adjust your {keyword} strategy during volatility?,0.73,0.7711616541278639,0.88
46800391,content marketing,marketing,What A/B tests should you run for content marketing?,troubleshooting,Intermediate,"[""Introduction to content marketing"", ""Key points and analysis"", ""Practical examples"", ""Expert insights"", ""Action items"", ""Conclusion""]","[""content"", ""promotion"", ""troubleshooting"", ""marketing"", ""advertising""]",4,Marketing Coordinators & Specialists,"[""social media"", ""brand management"", ""digital marketing""]",52,9,2025-10-25 22:01:45,en,What A/B tests should you run for {keyword}?,0.73,0.6899535720001332,0.59
46800392,cybersecurity,it,How do you implement cybersecurity in a production environment?,best_practice,Intermediate,"[""Overview of cybersecurity"", ""Step-by-step implementation"", ""Best practices and tips"", ""Common challenges and solutions"", ""Tools and resources needed"", ""Conclusion and next steps""]","[""software"", ""development"", ""it"", ""best_practice"", ""cybersecurity""]",5,Junior to Mid-level Developers,"[""cloud computing"", ""machine learning"", ""web development"", ""data science""]",63,9,2025-10-25 22:01:45,en,How do you implement {keyword} in a production environment?,0.62,0.7019418782484553,0.37
46800393,investment planning,economics,What exit strategies should be considered for investment planning?,how_to,Beginner,"[""Introduction to investment planning"", ""Key points and analysis"", ""Practical examples"", ""Expert insights"", ""Action items"", ""Conclusion""]","[""investment"", ""how_to"", ""planning"", ""market"", ""economics""]",4,Students & New Investors,"[""portfolio management"", ""financial modeling"", ""market analysis""]",66,9,2025-10-25 22:01:45,en,What exit strategies should be considered for {keyword}?,0.81,0.3407412179043818,0.44
46800394,cloud computing,it,How do you implement cloud computing in a production environment?,strategy,Beginner,"[""Overview of cloud computing"", ""Step-by-step implementation"", ""Best practices and tips"", ""Common challenges and solutions"", ""Tools and resources needed"", ""Conclusion and next steps""]","[""computing"", ""software"", ""cloud"", ""it"", ""programming"", ""strategy""]",6,Students & Entry-level Developers,"[""machine learning"", ""cybersecurity"", ""web development"", ""data science""]",65,10,2025-10-25 22:01:45,en,How do you implement {keyword} in a production environment?,0.84,0.36801522168199224,0.6
