record_id,keyword,category,question,question_type,difficulty_level,answer_outline,tags,estimated_read_time,target_audience,related_topics,question_length,word_count,created_date,language,source_template,engagement_score,complexity_score,popularity_score
30300655,web development,it,What skills are needed to master web development?,optimization,Advanced,"[""Introduction to web development"", ""Key points and analysis"", ""Practical examples"", ""Expert insights"", ""Action items"", ""Conclusion""]","[""software"", ""development"", ""it"", ""optimization"", ""web""]",4,Senior Developers & Tech Leads,"[""data science"", ""machine learning"", ""cybersecurity"", ""cloud computing""]",49,8,2025-10-25 21:38:46,en,What skills are needed to master {keyword}?,0.69,0.9474518562008759,0.44
30300656,portfolio management,economics,What exit strategies should be considered for portfolio management?,how_to,Beginner,"[""Introduction to portfolio management"", ""Key points and analysis"", ""Practical examples"", ""Expert insights"", ""Action items"", ""Conclusion""]","[""investment"", ""how_to"", ""portfolio"", ""management"", ""market"", ""economics""]",4,Students & New Investors,"[""investment planning"", ""market analysis"", ""financial modeling""]",67,9,2025-10-25 21:38:46,en,What exit strategies should be considered for {keyword}?,0.63,0.45833318689840497,0.75
30300657,web development,it,Which frameworks support web development implementation?,optimization,Beginner,"[""Introduction to web development"", ""Key points and analysis"", ""Practical examples"", ""Expert insights"", ""Action items"", ""Conclusion""]","[""technology"", ""software"", ""development"", ""it"", ""optimization"", ""web""]",4,Students & Entry-level Developers,"[""data science"", ""cybersecurity"", ""cloud computing"", ""machine learning""]",56,6,2025-10-25 21:38:46,en,Which frameworks support {keyword} implementation?,0.61,0.31842032030765116,0.87
30300658,digital marketing,marketing,How do you personalize digital marketing for different segments?,best_practice,Intermediate,"[""Overview of digital marketing"", ""Step-by-step implementation"", ""Best practices and tips"", ""Common challenges and solutions"", ""Tools and resources needed"", ""Conclusion and next steps""]","[""branding"", ""marketing"", ""best_practice"", ""digital""]",6,Marketing Coordinators & Specialists,"[""brand management"", ""content marketing"", ""social media""]",64,9,2025-10-25 21:38:46,en,How do you personalize {keyword} for different segments?,0.84,0.7742514947148819,0.59
30300659,cybersecurity,it,What security considerations should be taken when using cybersecurity?,planning,Intermediate,"[""Introduction to cybersecurity"", ""Key points and analysis"", ""Practical examples"", ""Expert insights"", ""Action items"", ""Conclusion""]","[""software"", ""planning"", ""it"", ""programming"", ""cybersecurity""]",4,Junior to Mid-level Developers,"[""machine learning"", ""web development"", ""data science"", ""cloud computing""]",70,9,2025-10-25 21:38:46,en,What security considerations should be taken when using {keyword}?,0.95,0.6093455275699351,0.57
30300660,digital marketing,marketing,What demographics respond best to digital marketing?,troubleshooting,Beginner,"[""Introduction to digital marketing"", ""Key points and analysis"", ""Practical examples"", ""Expert insights"", ""Action items"", ""Conclusion""]","[""promotion"", ""troubleshooting"", ""marketing"", ""digital"", ""advertising""]",4,Marketing Students & Interns,"[""content marketing"", ""social media"", ""brand management""]",52,7,2025-10-25 21:38:46,en,What demographics respond best to {keyword}?,0.91,0.4145764088393278,0.8
30300661,financial modeling,economics,How do you benchmark financial modeling against alternatives?,strategy,Intermediate,"[""Overview of financial modeling"", ""Step-by-step implementation"", ""Best practices and tips"", ""Common challenges and solutions"", ""Tools and resources needed"", ""Conclusion and next steps""]","[""finance"", ""modeling"", ""financial"", ""market"", ""strategy"", ""economics""]",6,Individual Investors & Analysts,"[""market analysis"", ""investment planning"", ""portfolio management""]",61,8,2025-10-25 21:38:46,en,How do you benchmark {keyword} against alternatives?,0.64,0.6738314965266902,0.67
30300662,web development,it,How do you implement web development in a production environment?,optimization,Expert,"[""Overview of web development"", ""Step-by-step implementation"", ""Best practices and tips"", ""Common challenges and solutions"", ""Tools and resources needed"", ""Conclusion and next steps""]","[""technology"", ""software"", ""development"", ""it"", ""optimization"", ""web""]",6,Architects & Technical Directors,"[""cloud computing"", ""machine learning"", ""data science"", ""cybersecurity""]",65,10,2025-10-25 21:38:46,en,How do you implement {keyword} in a production environment?,0.71,1.0,0.33
30300663,cybersecurity,it,What are the latest trends in cybersecurity technology?,strategy,Intermediate,"[""Introduction to cybersecurity"", ""Key concepts and definitions"", ""Main categories or types"", ""Examples and case studies"", ""Benefits and advantages"", ""Summary and recommendations""]","[""software"", ""it"", ""strategy"", ""cybersecurity"", ""technology""]",5,Junior to Mid-level Developers,"[""machine learning"", ""cloud computing"", ""data science"", ""web development""]",55,8,2025-10-25 21:38:46,en,What are the latest trends in {keyword} technology?,0.92,0.7295683133172609,0.9
30300664,web development,it,How do you implement web development in a production environment?,evaluation,Intermediate,"[""Overview of web development"", ""Step-by-step implementation"", ""Best practices and tips"", ""Common challenges and solutions"", ""Tools and resources needed"", ""Conclusion and next steps""]","[""development"", ""web"", ""it"", ""evaluation"", ""technology""]",6,Junior to Mid-level Developers,"[""machine learning"", ""data science"", ""cloud computing"", ""cybersecurity""]",65,10,2025-10-25 21:38:46,en,How do you implement {keyword} in a production environment?,0.79,0.687755581725529,0.58
30300665,content marketing,marketing,What timing strategies work for content marketing?,comparison,Intermediate,"[""Introduction to content marketing"", ""Key points and analysis"", ""Practical examples"", ""Expert insights"", ""Action items"", ""Conclusion""]","[""content"", ""comparison"", ""digital"", ""marketing"", ""branding""]",4,Marketing Coordinators & Specialists,"[""digital marketing"", ""social media"", ""brand management""]",50,7,2025-10-25 21:38:46,en,What timing strategies work for {keyword}?,0.64,0.790027037110623,0.57
30300666,cloud computing,it,How do you optimize cloud computing for different platforms?,evaluation,Expert,"[""Overview of cloud computing"", ""Step-by-step implementation"", ""Best practices and tips"", ""Common challenges and solutions"", ""Tools and resources needed"", ""Conclusion and next steps""]","[""computing"", ""software"", ""development"", ""it"", ""evaluation"", ""cloud""]",6,Architects & Technical Directors,"[""machine learning"", ""web development"", ""data science"", ""cybersecurity""]",60,9,2025-10-25 21:38:46,en,How do you optimize {keyword} for different platforms?,0.71,1.0,0.52
30300667,market analysis,economics,What exit strategies should be considered for market analysis?,evaluation,Advanced,"[""Introduction to market analysis"", ""Key points and analysis"", ""Practical examples"", ""Expert insights"", ""Action items"", ""Conclusion""]","[""analysis"", ""evaluation"", ""market"", ""business"", ""economics""]",4,Professional Investors & Advisors,"[""financial modeling"", ""portfolio management"", ""investment planning""]",62,9,2025-10-25 21:38:46,en,What exit strategies should be considered for {keyword}?,0.72,0.8933077450087469,0.64
30300668,portfolio management,economics,How do you protect your portfolio management investments?,how_to,Advanced,"[""Overview of portfolio management"", ""Step-by-step implementation"", ""Best practices and tips"", ""Common challenges and solutions"", ""Tools and resources needed"", ""Conclusion and next steps""]","[""investment"", ""how_to"", ""finance"", ""portfolio"", ""management"", ""economics""]",6,Professional Investors & Advisors,"[""investment planning"", ""financial modeling"", ""market analysis""]",57,8,2025-10-25 21:38:46,en,How do you protect your {keyword} investments?,0.62,0.8954176616182971,0.43
30300669,investment planning,economics,What strategies work best for investment planning investment?,how_to,Advanced,"[""Introduction to investment planning"", ""Key points and analysis"", ""Practical examples"", ""Expert insights"", ""Action items"", ""Conclusion""]","[""investment"", ""how_to"", ""planning"", ""market"", ""business"", ""economics""]",4,Professional Investors & Advisors,"[""financial modeling"", ""portfolio management"", ""market analysis""]",61,8,2025-10-25 21:38:46,en,What strategies work best for {keyword} investment?,0.84,0.805405342040304,0.51
30300670,investment planning,economics,How do you adjust your investment planning strategy during volatility?,analysis,Advanced,"[""Overview of investment planning"", ""Step-by-step implementation"", ""Best practices and tips"", ""Common challenges and solutions"", ""Tools and resources needed"", ""Conclusion and next steps""]","[""investment"", ""planning"", ""finance"", ""analysis"", ""market"", ""economics""]",6,Professional Investors & Advisors,"[""financial modeling"", ""portfolio management"", ""market analysis""]",70,10,2025-10-25 21:38:46,en,How do you adjust your {keyword} strategy during volatility?,0.91,0.8433881077556068,0.68
30300671,social media,marketing,How do you optimize social media for mobile users?,strategy,Expert,"[""Overview of social media"", ""Step-by-step implementation"", ""Best practices and tips"", ""Common challenges and solutions"", ""Tools and resources needed"", ""Conclusion and next steps""]","[""media"", ""marketing"", ""social"", ""advertising"", ""branding"", ""strategy""]",6,Marketing Directors & CMOs,"[""brand management"", ""digital marketing"", ""content marketing""]",50,9,2025-10-25 21:38:46,en,How do you optimize {keyword} for mobile users?,0.69,1.0,0.69
30300672,brand management,marketing,What messaging works best in brand management campaigns?,how_to,Expert,"[""Introduction to brand management"", ""Key points and analysis"", ""Practical examples"", ""Expert insights"", ""Action items"", ""Conclusion""]","[""how_to"", ""marketing"", ""management"", ""advertising"", ""branding"", ""brand""]",4,Marketing Directors & CMOs,"[""content marketing"", ""digital marketing"", ""social media""]",56,8,2025-10-25 21:38:46,en,What messaging works best in {keyword} campaigns?,0.89,1.0,0.62
30300673,brand management,marketing,What demographics respond best to brand management?,implementation,Expert,"[""Introduction to brand management"", ""Key points and analysis"", ""Practical examples"", ""Expert insights"", ""Action items"", ""Conclusion""]","[""implementation"", ""promotion"", ""marketing"", ""management"", ""advertising"", ""brand""]",4,Marketing Directors & CMOs,"[""content marketing"", ""social media"", ""digital marketing""]",51,7,2025-10-25 21:38:46,en,What demographics respond best to {keyword}?,0.64,1.0,0.56
30300674,financial modeling,economics,How do you protect your financial modeling investments?,best_practice,Beginner,"[""Overview of financial modeling"", ""Step-by-step implementation"", ""Best practices and tips"", ""Common challenges and solutions"", ""Tools and resources needed"", ""Conclusion and next steps""]","[""investment"", ""best_practice"", ""modeling"", ""financial"", ""business"", ""economics""]",6,Students & New Investors,"[""market analysis"", ""portfolio management"", ""investment planning""]",55,8,2025-10-25 21:38:46,en,How do you protect your {keyword} investments?,0.9,0.44431686692018446,0.6
30300675,brand management,marketing,What tools are essential for brand management analytics?,how_to,Advanced,"[""Introduction to brand management"", ""Key points and analysis"", ""Practical examples"", ""Expert insights"", ""Action items"", ""Conclusion""]","[""how_to"", ""digital"", ""marketing"", ""management"", ""advertising"", ""brand""]",4,Marketing Managers & Strategists,"[""social media"", ""digital marketing"", ""content marketing""]",56,8,2025-10-25 21:38:46,en,What tools are essential for {keyword} analytics?,0.71,0.8019246616291668,0.81
30300676,brand management,marketing,What A/B tests should you run for brand management?,how_to,Intermediate,"[""Introduction to brand management"", ""Key points and analysis"", ""Practical examples"", ""Expert insights"", ""Action items"", ""Conclusion""]","[""how_to"", ""marketing"", ""management"", ""advertising"", ""digital"", ""brand""]",4,Marketing Coordinators & Specialists,"[""social media"", ""content marketing"", ""digital marketing""]",51,9,2025-10-25 21:38:46,en,What A/B tests should you run for {keyword}?,0.6,0.7192111961099981,0.46
30300677,social media,marketing,How do you attribute success to social media efforts?,evaluation,Intermediate,"[""Overview of social media"", ""Step-by-step implementation"", ""Best practices and tips"", ""Common challenges and solutions"", ""Tools and resources needed"", ""Conclusion and next steps""]","[""media"", ""marketing"", ""social"", ""advertising"", ""branding"", ""evaluation""]",6,Marketing Coordinators & Specialists,"[""content marketing"", ""digital marketing"", ""brand management""]",53,9,2025-10-25 21:38:46,en,How do you attribute success to {keyword} efforts?,0.78,0.6813080800424329,0.39
30300678,market analysis,economics,What indicators predict market analysis market movements?,implementation,Beginner,"[""Introduction to market analysis"", ""Key points and analysis"", ""Practical examples"", ""Expert insights"", ""Action items"", ""Conclusion""]","[""analysis"", ""finance"", ""implementation"", ""market"", ""business"", ""economics""]",4,Students & New Investors,"[""financial modeling"", ""investment planning"", ""portfolio management""]",57,7,2025-10-25 21:38:46,en,What indicators predict {keyword} market movements?,0.89,0.4666939964798864,0.81
30300679,social media,marketing,How do you personalize social media for different segments?,analysis,Advanced,"[""Overview of social media"", ""Step-by-step implementation"", ""Best practices and tips"", ""Common challenges and solutions"", ""Tools and resources needed"", ""Conclusion and next steps""]","[""analysis"", ""media"", ""promotion"", ""marketing"", ""social"", ""branding""]",6,Marketing Managers & Strategists,"[""content marketing"", ""digital marketing"", ""brand management""]",59,9,2025-10-25 21:38:46,en,How do you personalize {keyword} for different segments?,0.82,0.8772391445361941,0.8
30300680,content marketing,marketing,How do you create a content marketing roadmap?,implementation,Intermediate,"[""Overview of content marketing"", ""Step-by-step implementation"", ""Best practices and tips"", ""Common challenges and solutions"", ""Tools and resources needed"", ""Conclusion and next steps""]","[""content"", ""implementation"", ""promotion"", ""marketing"", ""advertising""]",6,Marketing Coordinators & Specialists,"[""brand management"", ""digital marketing"", ""social media""]",46,8,2025-10-25 21:38:46,en,How do you create a {keyword} roadmap?,0.62,0.7088542177795683,0.61
30300681,portfolio management,economics,How do you create a long-term plan for portfolio management?,evaluation,Intermediate,"[""Overview of portfolio management"", ""Step-by-step implementation"", ""Best practices and tips"", ""Common challenges and solutions"", ""Tools and resources needed"", ""Conclusion and next steps""]","[""portfolio"", ""management"", ""evaluation"", ""market"", ""business"", ""economics""]",6,Individual Investors & Analysts,"[""financial modeling"", ""investment planning"", ""market analysis""]",60,10,2025-10-25 21:38:46,en,How do you create a long-term plan for {keyword}?,0.61,0.6473235641889061,0.84
30300682,portfolio management,economics,What are the regulatory considerations for portfolio management?,best_practice,Beginner,"[""Introduction to portfolio management"", ""Key concepts and definitions"", ""Main categories or types"", ""Examples and case studies"", ""Benefits and advantages"", ""Summary and recommendations""]","[""investment"", ""finance"", ""portfolio"", ""best_practice"", ""management"", ""economics""]",6,Students & New Investors,"[""investment planning"", ""financial modeling"", ""market analysis""]",64,8,2025-10-25 21:38:46,en,What are the regulatory considerations for {keyword}?,0.92,0.3730336984856332,0.86
30300683,cloud computing,it,How do you get started with cloud computing as a beginner?,optimization,Expert,"[""Overview of cloud computing"", ""Step-by-step implementation"", ""Best practices and tips"", ""Common challenges and solutions"", ""Tools and resources needed"", ""Conclusion and next steps""]","[""computing"", ""cloud"", ""it"", ""programming"", ""optimization"", ""technology""]",6,Architects & Technical Directors,"[""data science"", ""machine learning"", ""cybersecurity"", ""web development""]",58,11,2025-10-25 21:38:46,en,How do you get started with {keyword} as a beginner?,0.79,1.0,0.37
30300684,investment planning,economics,What is the optimal allocation for investment planning in a portfolio?,troubleshooting,Expert,"[""Introduction to investment planning"", ""Key points and analysis"", ""Practical examples"", ""Expert insights"", ""Action items"", ""Conclusion""]","[""investment"", ""planning"", ""finance"", ""troubleshooting"", ""business"", ""economics""]",4,Portfolio Managers & Financial Experts,"[""market analysis"", ""financial modeling"", ""portfolio management""]",70,11,2025-10-25 21:38:46,en,What is the optimal allocation for {keyword} in a portfolio?,0.63,1.0,0.81
30300685,social media,marketing,What A/B tests should you run for social media?,strategy,Advanced,"[""Introduction to social media"", ""Key points and analysis"", ""Practical examples"", ""Expert insights"", ""Action items"", ""Conclusion""]","[""media"", ""promotion"", ""marketing"", ""digital"", ""social"", ""strategy""]",4,Marketing Managers & Strategists,"[""brand management"", ""digital marketing"", ""content marketing""]",47,9,2025-10-25 21:38:46,en,What A/B tests should you run for {keyword}?,0.77,0.911872379243454,0.82
30300686,market analysis,economics,What metrics are most important for market analysis?,optimization,Advanced,"[""Introduction to market analysis"", ""Key points and analysis"", ""Practical examples"", ""Expert insights"", ""Action items"", ""Conclusion""]","[""analysis"", ""finance"", ""business"", ""market"", ""optimization"", ""economics""]",4,Professional Investors & Advisors,"[""financial modeling"", ""investment planning"", ""portfolio management""]",52,8,2025-10-25 21:38:46,en,What metrics are most important for {keyword}?,0.79,0.9667355398298493,0.64
30300687,digital marketing,marketing,How do you identify the right audience for digital marketing?,troubleshooting,Beginner,"[""Overview of digital marketing"", ""Step-by-step implementation"", ""Best practices and tips"", ""Common challenges and solutions"", ""Tools and resources needed"", ""Conclusion and next steps""]","[""promotion"", ""troubleshooting"", ""marketing"", ""digital"", ""branding""]",6,Marketing Students & Interns,"[""brand management"", ""content marketing"", ""social media""]",61,10,2025-10-25 21:38:46,en,How do you identify the right audience for {keyword}?,0.81,0.3200543540860334,0.82
30300688,portfolio management,economics,What timeline is realistic for portfolio management returns?,implementation,Advanced,"[""Introduction to portfolio management"", ""Key points and analysis"", ""Practical examples"", ""Expert insights"", ""Action items"", ""Conclusion""]","[""finance"", ""implementation"", ""portfolio"", ""management"", ""business"", ""economics""]",4,Professional Investors & Advisors,"[""market analysis"", ""investment planning"", ""financial modeling""]",60,8,2025-10-25 21:38:46,en,What timeline is realistic for {keyword} returns?,0.68,0.9876573308599668,0.73
30300689,machine learning,it,How do you measure the success of machine learning projects?,evaluation,Advanced,"[""Overview of machine learning"", ""Step-by-step implementation"", ""Best practices and tips"", ""Common challenges and solutions"", ""Tools and resources needed"", ""Conclusion and next steps""]","[""software"", ""it"", ""learning"", ""evaluation"", ""machine"", ""technology""]",6,Senior Developers & Tech Leads,"[""cloud computing"", ""data science"", ""web development"", ""cybersecurity""]",60,10,2025-10-25 21:38:46,en,How do you measure the success of {keyword} projects?,0.72,0.8607093941547733,0.89
30300690,market analysis,economics,What indicators predict market analysis market movements?,evaluation,Beginner,"[""Introduction to market analysis"", ""Key points and analysis"", ""Practical examples"", ""Expert insights"", ""Action items"", ""Conclusion""]","[""finance"", ""analysis"", ""evaluation"", ""market"", ""business"", ""economics""]",4,Students & New Investors,"[""financial modeling"", ""portfolio management"", ""investment planning""]",57,7,2025-10-25 21:38:46,en,What indicators predict {keyword} market movements?,0.67,0.449871559267659,0.45
30300691,financial modeling,economics,How does global economics impact financial modeling?,implementation,Advanced,"[""Introduction to financial modeling"", ""Key points and analysis"", ""Practical examples"", ""Expert insights"", ""Action items"", ""Conclusion""]","[""investment"", ""finance"", ""implementation"", ""modeling"", ""financial"", ""economics""]",4,Professional Investors & Advisors,"[""investment planning"", ""market analysis"", ""portfolio management""]",52,7,2025-10-25 21:38:46,en,How does global economics impact {keyword}?,0.84,0.8799316533913513,0.75
30300692,cloud computing,it,How do you design a scalable cloud computing solution?,optimization,Expert,"[""Overview of cloud computing"", ""Step-by-step implementation"", ""Best practices and tips"", ""Common challenges and solutions"", ""Tools and resources needed"", ""Conclusion and next steps""]","[""computing"", ""software"", ""cloud"", ""it"", ""development"", ""optimization""]",6,Architects & Technical Directors,"[""machine learning"", ""web development"", ""cybersecurity"", ""data science""]",54,9,2025-10-25 21:38:46,en,How do you design a scalable {keyword} solution?,0.86,1.0,0.86
30300693,data science,it,What are the latest trends in data science technology?,how_to,Intermediate,"[""Introduction to data science"", ""Key concepts and definitions"", ""Main categories or types"", ""Examples and case studies"", ""Benefits and advantages"", ""Summary and recommendations""]","[""how_to"", ""technology"", ""it"", ""programming"", ""science"", ""data""]",6,Junior to Mid-level Developers,"[""cybersecurity"", ""machine learning"", ""cloud computing"", ""web development""]",54,9,2025-10-25 21:38:46,en,What are the latest trends in {keyword} technology?,0.78,0.7228092739020193,0.32
30300694,digital marketing,marketing,How do you improve digital marketing conversion rates?,comparison,Intermediate,"[""Overview of digital marketing"", ""Step-by-step implementation"", ""Best practices and tips"", ""Common challenges and solutions"", ""Tools and resources needed"", ""Conclusion and next steps""]","[""marketing"", ""promotion"", ""comparison"", ""digital""]",6,Marketing Coordinators & Specialists,"[""social media"", ""content marketing"", ""brand management""]",54,8,2025-10-25 21:38:46,en,How do you improve {keyword} conversion rates?,0.93,0.6765266172901433,0.36
30300695,brand management,marketing,How do you innovate within brand management?,strategy,Beginner,"[""Overview of brand management"", ""Step-by-step implementation"", ""Best practices and tips"", ""Common challenges and solutions"", ""Tools and resources needed"", ""Conclusion and next steps""]","[""promotion"", ""marketing"", ""management"", ""digital"", ""strategy"", ""brand""]",6,Marketing Students & Interns,"[""social media"", ""digital marketing"", ""content marketing""]",44,7,2025-10-25 21:38:46,en,How do you innovate within {keyword}?,0.62,0.47773540521250946,0.6
30300696,investment planning,economics,What factors should be considered when evaluating investment planning?,best_practice,Advanced,"[""Introduction to investment planning"", ""Key points and analysis"", ""Practical examples"", ""Expert insights"", ""Action items"", ""Conclusion""]","[""investment"", ""planning"", ""finance"", ""best_practice"", ""economics""]",4,Professional Investors & Advisors,"[""financial modeling"", ""portfolio management"", ""market analysis""]",70,9,2025-10-25 21:38:46,en,What factors should be considered when evaluating {keyword}?,0.71,0.8331956333781402,0.81
30300697,machine learning,it,How do you optimize machine learning for different platforms?,planning,Beginner,"[""Overview of machine learning"", ""Step-by-step implementation"", ""Best practices and tips"", ""Common challenges and solutions"", ""Tools and resources needed"", ""Conclusion and next steps""]","[""software"", ""planning"", ""it"", ""programming"", ""learning"", ""machine""]",6,Students & Entry-level Developers,"[""web development"", ""cloud computing"", ""cybersecurity"", ""data science""]",61,9,2025-10-25 21:38:46,en,How do you optimize {keyword} for different platforms?,0.92,0.3520052941713179,0.41
