record_id,keyword,category,question,question_type,difficulty_level,answer_outline,tags,estimated_read_time,target_audience,related_topics,question_length,word_count,created_date,language,source_template,engagement_score,complexity_score,popularity_score
390,content marketing,marketing,How do you personalize content marketing for different segments?,planning,Expert,"[""Overview of content marketing"", ""Step-by-step implementation"", ""Best practices and tips"", ""Common challenges and solutions"", ""Tools and resources needed"", ""Conclusion and next steps""]","[""marketing"", ""digital"", ""promotion"", ""planning"", ""content""]",6,Marketing Directors & CMOs,"[""digital marketing"", ""social media"", ""brand management""]",64,9,2025-10-25 19:28:21,en,How do you personalize {keyword} for different segments?,0.77,1.0,0.87
393,social media,marketing,What channels are most effective for social media?,evaluation,Advanced,"[""Introduction to social media"", ""Key points and analysis"", ""Practical examples"", ""Expert insights"", ""Action items"", ""Conclusion""]","[""marketing"", ""social"", ""evaluation"", ""promotion"", ""media"", ""advertising""]",4,Marketing Managers & Strategists,"[""content marketing"", ""digital marketing"", ""brand management""]",50,8,2025-10-25 19:28:21,en,What channels are most effective for {keyword}?,0.77,0.9912585480058956,0.8
395,content marketing,marketing,How do you personalize content marketing for different segments?,strategy,Intermediate,"[""Overview of content marketing"", ""Step-by-step implementation"", ""Best practices and tips"", ""Common challenges and solutions"", ""Tools and resources needed"", ""Conclusion and next steps""]","[""marketing"", ""strategy"", ""branding"", ""advertising"", ""content""]",6,Marketing Coordinators & Specialists,"[""social media"", ""digital marketing"", ""brand management""]",64,9,2025-10-25 19:28:21,en,How do you personalize {keyword} for different segments?,0.91,0.6281184186533175,0.8
399,brand management,marketing,What budget should be allocated to brand management?,comparison,Beginner,"[""Introduction to brand management"", ""Key points and analysis"", ""Practical examples"", ""Expert insights"", ""Action items"", ""Conclusion""]","[""marketing"", ""management"", ""branding"", ""promotion"", ""brand"", ""comparison""]",4,Marketing Students & Interns,"[""content marketing"", ""social media"", ""digital marketing""]",52,8,2025-10-25 19:28:21,en,What budget should be allocated to {keyword}?,0.62,0.4734158755435983,0.65
403,brand management,marketing,How do you attribute success to brand management efforts?,best_practice,Expert,"[""Overview of brand management"", ""Step-by-step implementation"", ""Best practices and tips"", ""Common challenges and solutions"", ""Tools and resources needed"", ""Conclusion and next steps""]","[""marketing"", ""best_practice"", ""management"", ""branding"", ""promotion"", ""brand""]",6,Marketing Directors & CMOs,"[""content marketing"", ""social media"", ""digital marketing""]",57,9,2025-10-25 19:28:21,en,How do you attribute success to {keyword} efforts?,0.94,1.0,0.62
409,brand management,marketing,How do you improve brand management conversion rates?,strategy,Expert,"[""Overview of brand management"", ""Step-by-step implementation"", ""Best practices and tips"", ""Common challenges and solutions"", ""Tools and resources needed"", ""Conclusion and next steps""]","[""marketing"", ""management"", ""strategy"", ""promotion"", ""advertising"", ""brand""]",6,Marketing Directors & CMOs,"[""digital marketing"", ""social media"", ""content marketing""]",53,8,2025-10-25 19:28:21,en,How do you improve {keyword} conversion rates?,0.92,1.0,0.47
413,social media,marketing,How do you automate social media processes?,comparison,Advanced,"[""Overview of social media"", ""Step-by-step implementation"", ""Best practices and tips"", ""Common challenges and solutions"", ""Tools and resources needed"", ""Conclusion and next steps""]","[""marketing"", ""social"", ""digital"", ""promotion"", ""media"", ""comparison""]",6,Marketing Managers & Strategists,"[""brand management"", ""digital marketing"", ""content marketing""]",43,7,2025-10-25 19:28:21,en,How do you automate {keyword} processes?,0.72,0.932147927280962,0.77
414,brand management,marketing,What tools are essential for brand management analytics?,implementation,Expert,"[""Introduction to brand management"", ""Key points and analysis"", ""Practical examples"", ""Expert insights"", ""Action items"", ""Conclusion""]","[""marketing"", ""management"", ""digital"", ""promotion"", ""brand"", ""implementation""]",4,Marketing Directors & CMOs,"[""digital marketing"", ""social media"", ""content marketing""]",56,8,2025-10-25 19:28:21,en,What tools are essential for {keyword} analytics?,0.78,1.0,0.87
421,social media,marketing,What budget should be allocated to social media?,optimization,Intermediate,"[""Introduction to social media"", ""Key points and analysis"", ""Practical examples"", ""Expert insights"", ""Action items"", ""Conclusion""]","[""marketing"", ""social"", ""branding"", ""promotion"", ""media"", ""optimization""]",4,Marketing Coordinators & Specialists,"[""digital marketing"", ""brand management"", ""content marketing""]",48,8,2025-10-25 19:28:21,en,What budget should be allocated to {keyword}?,0.61,0.7372925286239856,0.52
422,brand management,marketing,How do you improve brand management conversion rates?,strategy,Expert,"[""Overview of brand management"", ""Step-by-step implementation"", ""Best practices and tips"", ""Common challenges and solutions"", ""Tools and resources needed"", ""Conclusion and next steps""]","[""marketing"", ""management"", ""strategy"", ""digital"", ""promotion"", ""brand""]",6,Marketing Directors & CMOs,"[""digital marketing"", ""social media"", ""content marketing""]",53,8,2025-10-25 19:28:21,en,How do you improve {keyword} conversion rates?,0.67,1.0,0.52
423,social media,marketing,How do you reach new customers through social media?,evaluation,Beginner,"[""Overview of social media"", ""Step-by-step implementation"", ""Best practices and tips"", ""Common challenges and solutions"", ""Tools and resources needed"", ""Conclusion and next steps""]","[""marketing"", ""social"", ""evaluation"", ""digital"", ""promotion"", ""media""]",6,Marketing Students & Interns,"[""digital marketing"", ""brand management"", ""content marketing""]",52,9,2025-10-25 19:28:21,en,How do you reach new customers through {keyword}?,0.74,0.3679013395549204,0.5
424,content marketing,marketing,How do you reach new customers through content marketing?,analysis,Intermediate,"[""Overview of content marketing"", ""Step-by-step implementation"", ""Best practices and tips"", ""Common challenges and solutions"", ""Tools and resources needed"", ""Conclusion and next steps""]","[""marketing"", ""branding"", ""promotion"", ""analysis"", ""content""]",6,Marketing Coordinators & Specialists,"[""social media"", ""brand management"", ""digital marketing""]",57,9,2025-10-25 19:28:21,en,How do you reach new customers through {keyword}?,0.62,0.6151431817674061,0.75
425,brand management,marketing,How do you personalize brand management for different segments?,implementation,Beginner,"[""Overview of brand management"", ""Step-by-step implementation"", ""Best practices and tips"", ""Common challenges and solutions"", ""Tools and resources needed"", ""Conclusion and next steps""]","[""marketing"", ""management"", ""branding"", ""digital"", ""brand"", ""implementation""]",6,Marketing Students & Interns,"[""content marketing"", ""digital marketing"", ""social media""]",63,9,2025-10-25 19:28:21,en,How do you personalize {keyword} for different segments?,0.92,0.3511014417835066,0.43
429,content marketing,marketing,What demographics respond best to content marketing?,implementation,Beginner,"[""Introduction to content marketing"", ""Key points and analysis"", ""Practical examples"", ""Expert insights"", ""Action items"", ""Conclusion""]","[""marketing"", ""branding"", ""advertising"", ""content"", ""implementation""]",4,Marketing Students & Interns,"[""brand management"", ""social media"", ""digital marketing""]",52,7,2025-10-25 19:28:21,en,What demographics respond best to {keyword}?,0.92,0.3588842736350082,0.71
430,digital marketing,marketing,How do you identify the right audience for digital marketing?,how_to,Intermediate,"[""Overview of digital marketing"", ""Step-by-step implementation"", ""Best practices and tips"", ""Common challenges and solutions"", ""Tools and resources needed"", ""Conclusion and next steps""]","[""marketing"", ""digital"", ""promotion"", ""how_to""]",6,Marketing Coordinators & Specialists,"[""content marketing"", ""brand management"", ""social media""]",61,10,2025-10-25 19:28:21,en,How do you identify the right audience for {keyword}?,0.63,0.6045259951994539,0.36
434,digital marketing,marketing,What does the future hold for digital marketing?,comparison,Intermediate,"[""Introduction to digital marketing"", ""Key points and analysis"", ""Practical examples"", ""Expert insights"", ""Action items"", ""Conclusion""]","[""marketing"", ""digital"", ""promotion"", ""comparison""]",4,Marketing Coordinators & Specialists,"[""brand management"", ""social media"", ""content marketing""]",48,8,2025-10-25 19:28:21,en,What does the future hold for {keyword}?,0.64,0.6340549971117179,0.89
436,social media,marketing,How do you track and analyze social media performance?,best_practice,Beginner,"[""Overview of social media"", ""Step-by-step implementation"", ""Best practices and tips"", ""Common challenges and solutions"", ""Tools and resources needed"", ""Conclusion and next steps""]","[""marketing"", ""best_practice"", ""social"", ""branding"", ""digital"", ""media""]",6,Marketing Students & Interns,"[""digital marketing"", ""brand management"", ""content marketing""]",54,9,2025-10-25 19:28:21,en,How do you track and analyze {keyword} performance?,0.78,0.4039016729337559,0.71
437,digital marketing,marketing,What budget should be allocated to digital marketing?,strategy,Advanced,"[""Introduction to digital marketing"", ""Key points and analysis"", ""Practical examples"", ""Expert insights"", ""Action items"", ""Conclusion""]","[""marketing"", ""strategy"", ""branding"", ""digital"", ""advertising""]",4,Marketing Managers & Strategists,"[""content marketing"", ""brand management"", ""social media""]",53,8,2025-10-25 19:28:21,en,What budget should be allocated to {keyword}?,0.83,0.914217408555884,0.77
444,digital marketing,marketing,What KPIs are most important for digital marketing?,evaluation,Advanced,"[""Introduction to digital marketing"", ""Key points and analysis"", ""Practical examples"", ""Expert insights"", ""Action items"", ""Conclusion""]","[""marketing"", ""branding"", ""digital"", ""evaluation""]",4,Marketing Managers & Strategists,"[""brand management"", ""social media"", ""content marketing""]",51,8,2025-10-25 19:28:21,en,What KPIs are most important for {keyword}?,0.92,0.9806526482689883,0.37
446,brand management,marketing,What content types work best for brand management?,strategy,Intermediate,"[""Introduction to brand management"", ""Key points and analysis"", ""Practical examples"", ""Expert insights"", ""Action items"", ""Conclusion""]","[""marketing"", ""management"", ""strategy"", ""promotion"", ""digital"", ""brand""]",4,Marketing Coordinators & Specialists,"[""content marketing"", ""social media"", ""digital marketing""]",50,8,2025-10-25 19:28:21,en,What content types work best for {keyword}?,0.93,0.7481864680814738,0.88
447,brand management,marketing,How do you develop an effective brand management strategy?,comparison,Beginner,"[""Overview of brand management"", ""Step-by-step implementation"", ""Best practices and tips"", ""Common challenges and solutions"", ""Tools and resources needed"", ""Conclusion and next steps""]","[""marketing"", ""management"", ""branding"", ""digital"", ""brand"", ""comparison""]",6,Marketing Students & Interns,"[""social media"", ""content marketing"", ""digital marketing""]",58,9,2025-10-25 19:28:21,en,How do you develop an effective {keyword} strategy?,0.73,0.4451433755620396,0.69
454,content marketing,marketing,How do you automate content marketing processes?,how_to,Advanced,"[""Overview of content marketing"", ""Step-by-step implementation"", ""Best practices and tips"", ""Common challenges and solutions"", ""Tools and resources needed"", ""Conclusion and next steps""]","[""marketing"", ""branding"", ""digital"", ""content"", ""how_to""]",6,Marketing Managers & Strategists,"[""social media"", ""digital marketing"", ""brand management""]",48,7,2025-10-25 19:28:21,en,How do you automate {keyword} processes?,0.67,0.9573460474369327,0.59
455,digital marketing,marketing,What timing strategies work for digital marketing?,best_practice,Advanced,"[""Introduction to digital marketing"", ""Key points and analysis"", ""Practical examples"", ""Expert insights"", ""Action items"", ""Conclusion""]","[""marketing"", ""best_practice"", ""branding"", ""digital"", ""advertising""]",4,Marketing Managers & Strategists,"[""content marketing"", ""social media"", ""brand management""]",50,7,2025-10-25 19:28:21,en,What timing strategies work for {keyword}?,0.72,0.8199526828846362,0.64
461,content marketing,marketing,How do you create a content marketing roadmap?,planning,Expert,"[""Overview of content marketing"", ""Step-by-step implementation"", ""Best practices and tips"", ""Common challenges and solutions"", ""Tools and resources needed"", ""Conclusion and next steps""]","[""marketing"", ""branding"", ""digital"", ""planning"", ""content""]",6,Marketing Directors & CMOs,"[""social media"", ""brand management"", ""digital marketing""]",46,8,2025-10-25 19:28:21,en,How do you create a {keyword} roadmap?,0.64,1.0,0.74
469,brand management,marketing,How do you identify the right audience for brand management?,implementation,Beginner,"[""Overview of brand management"", ""Step-by-step implementation"", ""Best practices and tips"", ""Common challenges and solutions"", ""Tools and resources needed"", ""Conclusion and next steps""]","[""marketing"", ""management"", ""promotion"", ""advertising"", ""brand"", ""implementation""]",6,Marketing Students & Interns,"[""social media"", ""content marketing"", ""digital marketing""]",60,10,2025-10-25 19:28:21,en,How do you identify the right audience for {keyword}?,0.72,0.3824199751878169,0.39
470,content marketing,marketing,What channels are most effective for content marketing?,troubleshooting,Expert,"[""Introduction to content marketing"", ""Key points and analysis"", ""Practical examples"", ""Expert insights"", ""Action items"", ""Conclusion""]","[""marketing"", ""branding"", ""troubleshooting"", ""promotion"", ""content""]",4,Marketing Directors & CMOs,"[""social media"", ""brand management"", ""digital marketing""]",55,8,2025-10-25 19:28:21,en,What channels are most effective for {keyword}?,0.88,1.0,0.9
472,content marketing,marketing,What A/B tests should you run for content marketing?,evaluation,Expert,"[""Introduction to content marketing"", ""Key points and analysis"", ""Practical examples"", ""Expert insights"", ""Action items"", ""Conclusion""]","[""marketing"", ""evaluation"", ""branding"", ""digital"", ""content""]",4,Marketing Directors & CMOs,"[""brand management"", ""social media"", ""digital marketing""]",52,9,2025-10-25 19:28:21,en,What A/B tests should you run for {keyword}?,0.93,1.0,0.86
473,brand management,marketing,What are the latest trends in brand management?,optimization,Intermediate,"[""Introduction to brand management"", ""Key concepts and definitions"", ""Main categories or types"", ""Examples and case studies"", ""Benefits and advantages"", ""Summary and recommendations""]","[""marketing"", ""management"", ""branding"", ""advertising"", ""brand"", ""optimization""]",6,Marketing Coordinators & Specialists,"[""content marketing"", ""social media"", ""digital marketing""]",47,8,2025-10-25 19:28:21,en,What are the latest trends in {keyword}?,0.8,0.752575532930392,0.67
476,social media,marketing,What timing strategies work for social media?,optimization,Expert,"[""Introduction to social media"", ""Key points and analysis"", ""Practical examples"", ""Expert insights"", ""Action items"", ""Conclusion""]","[""marketing"", ""social"", ""branding"", ""media"", ""advertising"", ""optimization""]",4,Marketing Directors & CMOs,"[""digital marketing"", ""content marketing"", ""brand management""]",45,7,2025-10-25 19:28:21,en,What timing strategies work for {keyword}?,0.9,1.0,0.59
487,content marketing,marketing,What A/B tests should you run for content marketing?,comparison,Advanced,"[""Introduction to content marketing"", ""Key points and analysis"", ""Practical examples"", ""Expert insights"", ""Action items"", ""Conclusion""]","[""marketing"", ""branding"", ""digital"", ""content"", ""comparison""]",4,Marketing Managers & Strategists,"[""social media"", ""digital marketing"", ""brand management""]",52,9,2025-10-25 19:28:21,en,What A/B tests should you run for {keyword}?,0.72,0.808640914531479,0.84
489,brand management,marketing,How do you innovate within brand management?,troubleshooting,Advanced,"[""Overview of brand management"", ""Step-by-step implementation"", ""Best practices and tips"", ""Common challenges and solutions"", ""Tools and resources needed"", ""Conclusion and next steps""]","[""marketing"", ""management"", ""troubleshooting"", ""promotion"", ""advertising"", ""brand""]",6,Marketing Managers & Strategists,"[""social media"", ""digital marketing"", ""content marketing""]",44,7,2025-10-25 19:28:21,en,How do you innovate within {keyword}?,0.93,0.9768783645968536,0.7
491,social media,marketing,How do you develop an effective social media strategy?,evaluation,Intermediate,"[""Overview of social media"", ""Step-by-step implementation"", ""Best practices and tips"", ""Common challenges and solutions"", ""Tools and resources needed"", ""Conclusion and next steps""]","[""marketing"", ""social"", ""evaluation"", ""digital"", ""media"", ""advertising""]",6,Marketing Coordinators & Specialists,"[""brand management"", ""digital marketing"", ""content marketing""]",54,9,2025-10-25 19:28:21,en,How do you develop an effective {keyword} strategy?,0.85,0.7087822163351443,0.71
497,brand management,marketing,What content types work best for brand management?,planning,Expert,"[""Introduction to brand management"", ""Key points and analysis"", ""Practical examples"", ""Expert insights"", ""Action items"", ""Conclusion""]","[""marketing"", ""management"", ""branding"", ""digital"", ""planning"", ""brand""]",4,Marketing Directors & CMOs,"[""social media"", ""digital marketing"", ""content marketing""]",50,8,2025-10-25 19:28:21,en,What content types work best for {keyword}?,0.91,1.0,0.37
498,brand management,marketing,What KPIs are most important for brand management?,comparison,Advanced,"[""Introduction to brand management"", ""Key points and analysis"", ""Practical examples"", ""Expert insights"", ""Action items"", ""Conclusion""]","[""marketing"", ""management"", ""promotion"", ""digital"", ""brand"", ""comparison""]",4,Marketing Managers & Strategists,"[""digital marketing"", ""content marketing"", ""social media""]",50,8,2025-10-25 19:28:21,en,What KPIs are most important for {keyword}?,0.77,0.87777135024635,0.75
