record_id,keyword,category,question,question_type,difficulty_level,answer_outline,tags,estimated_read_time,target_audience,related_topics,question_length,word_count,created_date,language,source_template,engagement_score,complexity_score,popularity_score
29200655,cloud computing,it,How do you convince stakeholders to invest in cloud computing?,strategy,Advanced,"[""Overview of cloud computing"", ""Step-by-step implementation"", ""Best practices and tips"", ""Common challenges and solutions"", ""Tools and resources needed"", ""Conclusion and next steps""]","[""computing"", ""cloud"", ""development"", ""it"", ""programming"", ""strategy""]",6,Senior Developers & Tech Leads,"[""web development"", ""cybersecurity"", ""data science"", ""machine learning""]",62,10,2025-10-25 21:37:21,en,How do you convince stakeholders to invest in {keyword}?,0.68,0.9887278979362397,0.58
29200656,portfolio management,economics,What factors should be considered when evaluating portfolio management?,troubleshooting,Expert,"[""Introduction to portfolio management"", ""Key points and analysis"", ""Practical examples"", ""Expert insights"", ""Action items"", ""Conclusion""]","[""investment"", ""finance"", ""portfolio"", ""troubleshooting"", ""management"", ""economics""]",4,Portfolio Managers & Financial Experts,"[""financial modeling"", ""market analysis"", ""investment planning""]",71,9,2025-10-25 21:37:21,en,What factors should be considered when evaluating {keyword}?,0.86,1.0,0.58
29200657,financial modeling,economics,How do you analyze market trends in financial modeling?,analysis,Expert,"[""Overview of financial modeling"", ""Step-by-step implementation"", ""Best practices and tips"", ""Common challenges and solutions"", ""Tools and resources needed"", ""Conclusion and next steps""]","[""finance"", ""analysis"", ""modeling"", ""financial"", ""market"", ""economics""]",6,Portfolio Managers & Financial Experts,"[""portfolio management"", ""market analysis"", ""investment planning""]",55,9,2025-10-25 21:37:21,en,How do you analyze market trends in {keyword}?,0.67,1.0,0.51
29200658,cybersecurity,it,How do you integrate cybersecurity with existing systems?,evaluation,Expert,"[""Overview of cybersecurity"", ""Step-by-step implementation"", ""Best practices and tips"", ""Common challenges and solutions"", ""Tools and resources needed"", ""Conclusion and next steps""]","[""software"", ""development"", ""it"", ""evaluation"", ""cybersecurity""]",5,Architects & Technical Directors,"[""machine learning"", ""web development"", ""cloud computing"", ""data science""]",57,8,2025-10-25 21:37:21,en,How do you integrate {keyword} with existing systems?,0.81,1.0,0.37
29200659,brand management,marketing,How do you create a brand management roadmap?,planning,Expert,"[""Overview of brand management"", ""Step-by-step implementation"", ""Best practices and tips"", ""Common challenges and solutions"", ""Tools and resources needed"", ""Conclusion and next steps""]","[""planning"", ""promotion"", ""marketing"", ""management"", ""branding"", ""brand""]",6,Marketing Directors & CMOs,"[""content marketing"", ""social media"", ""digital marketing""]",45,8,2025-10-25 21:37:21,en,How do you create a {keyword} roadmap?,0.66,1.0,0.4
29200660,social media,marketing,What KPIs are most important for social media?,analysis,Advanced,"[""Introduction to social media"", ""Key points and analysis"", ""Practical examples"", ""Expert insights"", ""Action items"", ""Conclusion""]","[""analysis"", ""media"", ""marketing"", ""digital"", ""social"", ""branding""]",4,Marketing Managers & Strategists,"[""brand management"", ""content marketing"", ""digital marketing""]",46,8,2025-10-25 21:37:21,en,What KPIs are most important for {keyword}?,0.75,0.9522375912898342,0.66
29200661,digital marketing,marketing,How do you improve digital marketing conversion rates?,analysis,Beginner,"[""Overview of digital marketing"", ""Step-by-step implementation"", ""Best practices and tips"", ""Common challenges and solutions"", ""Tools and resources needed"", ""Conclusion and next steps""]","[""analysis"", ""marketing"", ""digital"", ""advertising"", ""branding""]",6,Marketing Students & Interns,"[""content marketing"", ""social media"", ""brand management""]",54,8,2025-10-25 21:37:21,en,How do you improve {keyword} conversion rates?,0.69,0.4543404697080005,0.46
29200662,data science,it,What career opportunities exist in data science?,how_to,Beginner,"[""Introduction to data science"", ""Key points and analysis"", ""Practical examples"", ""Expert insights"", ""Action items"", ""Conclusion""]","[""how_to"", ""software"", ""it"", ""programming"", ""science"", ""data""]",4,Students & Entry-level Developers,"[""machine learning"", ""cloud computing"", ""cybersecurity"", ""web development""]",48,7,2025-10-25 21:37:21,en,What career opportunities exist in {keyword}?,0.74,0.3885169956338379,0.49
29200663,investment planning,economics,What are the regulatory considerations for investment planning?,planning,Advanced,"[""Introduction to investment planning"", ""Key concepts and definitions"", ""Main categories or types"", ""Examples and case studies"", ""Benefits and advantages"", ""Summary and recommendations""]","[""investment"", ""planning"", ""finance"", ""business"", ""economics""]",6,Professional Investors & Advisors,"[""portfolio management"", ""market analysis"", ""financial modeling""]",63,8,2025-10-25 21:37:21,en,What are the regulatory considerations for {keyword}?,0.9,0.9167774243040482,0.89
29200664,cybersecurity,it,How can cybersecurity improve system performance and scalability?,optimization,Intermediate,"[""Introduction to cybersecurity"", ""Key points and analysis"", ""Practical examples"", ""Expert insights"", ""Action items"", ""Conclusion""]","[""software"", ""it"", ""optimization"", ""cybersecurity"", ""technology""]",4,Junior to Mid-level Developers,"[""machine learning"", ""data science"", ""web development"", ""cloud computing""]",65,8,2025-10-25 21:37:21,en,How can {keyword} improve system performance and scalability?,0.85,0.6951055180588219,0.8
29200665,data science,it,How do you troubleshoot common issues with data science?,how_to,Expert,"[""Overview of data science"", ""Step-by-step implementation"", ""Best practices and tips"", ""Common challenges and solutions"", ""Tools and resources needed"", ""Conclusion and next steps""]","[""how_to"", ""software"", ""development"", ""it"", ""science"", ""data""]",6,Architects & Technical Directors,"[""cybersecurity"", ""web development"", ""cloud computing"", ""machine learning""]",56,9,2025-10-25 21:37:21,en,How do you troubleshoot common issues with {keyword}?,0.8,1.0,0.52
29200666,cybersecurity,it,How do you choose the right technology stack for cybersecurity?,planning,Advanced,"[""Overview of cybersecurity"", ""Step-by-step implementation"", ""Best practices and tips"", ""Common challenges and solutions"", ""Tools and resources needed"", ""Conclusion and next steps""]","[""software"", ""planning"", ""it"", ""cybersecurity"", ""technology""]",5,Senior Developers & Tech Leads,"[""cloud computing"", ""web development"", ""machine learning"", ""data science""]",63,10,2025-10-25 21:37:21,en,How do you choose the right technology stack for {keyword}?,0.7,0.9049344385313903,0.57
29200667,financial modeling,economics,How does global economics impact financial modeling?,planning,Intermediate,"[""Introduction to financial modeling"", ""Key points and analysis"", ""Practical examples"", ""Expert insights"", ""Action items"", ""Conclusion""]","[""planning"", ""finance"", ""modeling"", ""financial"", ""market"", ""economics""]",4,Individual Investors & Analysts,"[""portfolio management"", ""investment planning"", ""market analysis""]",52,7,2025-10-25 21:37:21,en,How does global economics impact {keyword}?,0.74,0.6574945656074456,0.74
29200668,social media,marketing,What A/B tests should you run for social media?,how_to,Beginner,"[""Introduction to social media"", ""Key points and analysis"", ""Practical examples"", ""Expert insights"", ""Action items"", ""Conclusion""]","[""how_to"", ""media"", ""digital"", ""marketing"", ""social"", ""branding""]",4,Marketing Students & Interns,"[""content marketing"", ""brand management"", ""digital marketing""]",47,9,2025-10-25 21:37:21,en,What A/B tests should you run for {keyword}?,0.64,0.39809046617093785,0.6
29200669,brand management,marketing,What budget should be allocated to brand management?,comparison,Intermediate,"[""Introduction to brand management"", ""Key points and analysis"", ""Practical examples"", ""Expert insights"", ""Action items"", ""Conclusion""]","[""comparison"", ""digital"", ""marketing"", ""management"", ""advertising"", ""brand""]",4,Marketing Coordinators & Specialists,"[""digital marketing"", ""content marketing"", ""social media""]",52,8,2025-10-25 21:37:21,en,What budget should be allocated to {keyword}?,0.8,0.7032199832847873,0.65
29200670,brand management,marketing,How do you identify the right audience for brand management?,implementation,Expert,"[""Overview of brand management"", ""Step-by-step implementation"", ""Best practices and tips"", ""Common challenges and solutions"", ""Tools and resources needed"", ""Conclusion and next steps""]","[""implementation"", ""marketing"", ""management"", ""advertising"", ""digital"", ""brand""]",6,Marketing Directors & CMOs,"[""digital marketing"", ""content marketing"", ""social media""]",60,10,2025-10-25 21:37:21,en,How do you identify the right audience for {keyword}?,0.75,1.0,0.53
29200671,market analysis,economics,What are the regulatory considerations for market analysis?,troubleshooting,Beginner,"[""Introduction to market analysis"", ""Key concepts and definitions"", ""Main categories or types"", ""Examples and case studies"", ""Benefits and advantages"", ""Summary and recommendations""]","[""investment"", ""analysis"", ""troubleshooting"", ""market"", ""economics""]",6,Students & New Investors,"[""portfolio management"", ""financial modeling"", ""investment planning""]",59,8,2025-10-25 21:37:21,en,What are the regulatory considerations for {keyword}?,0.8,0.362515708833817,0.81
29200672,content marketing,marketing,What timing strategies work for content marketing?,optimization,Beginner,"[""Introduction to content marketing"", ""Key points and analysis"", ""Practical examples"", ""Expert insights"", ""Action items"", ""Conclusion""]","[""content"", ""promotion"", ""marketing"", ""advertising"", ""optimization""]",4,Marketing Students & Interns,"[""digital marketing"", ""brand management"", ""social media""]",50,7,2025-10-25 21:37:21,en,What timing strategies work for {keyword}?,0.69,0.4298960931057286,0.47
29200673,data science,it,How do you troubleshoot common issues with data science?,implementation,Intermediate,"[""Overview of data science"", ""Step-by-step implementation"", ""Best practices and tips"", ""Common challenges and solutions"", ""Tools and resources needed"", ""Conclusion and next steps""]","[""technology"", ""software"", ""it"", ""implementation"", ""science"", ""data""]",6,Junior to Mid-level Developers,"[""machine learning"", ""web development"", ""cybersecurity"", ""cloud computing""]",56,9,2025-10-25 21:37:21,en,How do you troubleshoot common issues with {keyword}?,0.79,0.6873785276522437,0.46
29200674,social media,marketing,What A/B tests should you run for social media?,best_practice,Intermediate,"[""Introduction to social media"", ""Key points and analysis"", ""Practical examples"", ""Expert insights"", ""Action items"", ""Conclusion""]","[""media"", ""best_practice"", ""marketing"", ""social"", ""advertising"", ""branding""]",4,Marketing Coordinators & Specialists,"[""content marketing"", ""brand management"", ""digital marketing""]",47,9,2025-10-25 21:37:21,en,What A/B tests should you run for {keyword}?,0.86,0.7348614128248965,0.58
29200675,data science,it,What ROI can be expected from data science implementation?,optimization,Advanced,"[""Introduction to data science"", ""Key points and analysis"", ""Practical examples"", ""Expert insights"", ""Action items"", ""Conclusion""]","[""software"", ""it"", ""programming"", ""science"", ""optimization"", ""data""]",4,Senior Developers & Tech Leads,"[""machine learning"", ""cloud computing"", ""web development"", ""cybersecurity""]",58,9,2025-10-25 21:37:21,en,What ROI can be expected from {keyword} implementation?,0.65,0.9910012652419753,0.75
29200676,investment planning,economics,How do you analyze market trends in investment planning?,best_practice,Beginner,"[""Overview of investment planning"", ""Step-by-step implementation"", ""Best practices and tips"", ""Common challenges and solutions"", ""Tools and resources needed"", ""Conclusion and next steps""]","[""investment"", ""planning"", ""best_practice"", ""business"", ""economics""]",6,Students & New Investors,"[""market analysis"", ""financial modeling"", ""portfolio management""]",56,9,2025-10-25 21:37:21,en,How do you analyze market trends in {keyword}?,0.95,0.4358625591910295,0.53
29200677,market analysis,economics,What tools help analyze market analysis data?,strategy,Beginner,"[""Introduction to market analysis"", ""Key points and analysis"", ""Practical examples"", ""Expert insights"", ""Action items"", ""Conclusion""]","[""investment"", ""analysis"", ""business"", ""market"", ""strategy"", ""economics""]",4,Students & New Investors,"[""portfolio management"", ""financial modeling"", ""investment planning""]",45,7,2025-10-25 21:37:21,en,What tools help analyze {keyword} data?,0.72,0.45073241249978224,0.48
29200678,portfolio management,economics,How do you create a long-term plan for portfolio management?,comparison,Intermediate,"[""Overview of portfolio management"", ""Step-by-step implementation"", ""Best practices and tips"", ""Common challenges and solutions"", ""Tools and resources needed"", ""Conclusion and next steps""]","[""investment"", ""finance"", ""portfolio"", ""comparison"", ""management"", ""economics""]",6,Individual Investors & Analysts,"[""financial modeling"", ""investment planning"", ""market analysis""]",60,10,2025-10-25 21:37:21,en,How do you create a long-term plan for {keyword}?,0.93,0.691028127349592,0.76
29200679,content marketing,marketing,What tools are essential for content marketing analytics?,comparison,Beginner,"[""Introduction to content marketing"", ""Key points and analysis"", ""Practical examples"", ""Expert insights"", ""Action items"", ""Conclusion""]","[""content"", ""promotion"", ""comparison"", ""marketing"", ""advertising""]",4,Marketing Students & Interns,"[""brand management"", ""social media"", ""digital marketing""]",57,8,2025-10-25 21:37:21,en,What tools are essential for {keyword} analytics?,0.94,0.496393118852397,0.69
29200680,brand management,marketing,What are the latest trends in brand management?,evaluation,Expert,"[""Introduction to brand management"", ""Key concepts and definitions"", ""Main categories or types"", ""Examples and case studies"", ""Benefits and advantages"", ""Summary and recommendations""]","[""marketing"", ""digital"", ""management"", ""branding"", ""evaluation"", ""brand""]",6,Marketing Directors & CMOs,"[""content marketing"", ""social media"", ""digital marketing""]",47,8,2025-10-25 21:37:21,en,What are the latest trends in {keyword}?,0.88,1.0,0.72
29200681,portfolio management,economics,What tools help analyze portfolio management data?,troubleshooting,Beginner,"[""Introduction to portfolio management"", ""Key points and analysis"", ""Practical examples"", ""Expert insights"", ""Action items"", ""Conclusion""]","[""investment"", ""finance"", ""portfolio"", ""troubleshooting"", ""management"", ""economics""]",4,Students & New Investors,"[""market analysis"", ""financial modeling"", ""investment planning""]",50,7,2025-10-25 21:37:21,en,What tools help analyze {keyword} data?,0.6,0.3399829170635442,0.87
29200682,content marketing,marketing,What budget should be allocated to content marketing?,implementation,Advanced,"[""Introduction to content marketing"", ""Key points and analysis"", ""Practical examples"", ""Expert insights"", ""Action items"", ""Conclusion""]","[""content"", ""implementation"", ""marketing"", ""digital"", ""branding""]",4,Marketing Managers & Strategists,"[""brand management"", ""social media"", ""digital marketing""]",53,8,2025-10-25 21:37:21,en,What budget should be allocated to {keyword}?,0.8,0.8088743985891482,0.59
29200683,content marketing,marketing,What demographics respond best to content marketing?,analysis,Beginner,"[""Introduction to content marketing"", ""Key points and analysis"", ""Practical examples"", ""Expert insights"", ""Action items"", ""Conclusion""]","[""content"", ""analysis"", ""marketing"", ""advertising"", ""branding""]",4,Marketing Students & Interns,"[""brand management"", ""social media"", ""digital marketing""]",52,7,2025-10-25 21:37:21,en,What demographics respond best to {keyword}?,0.79,0.4703848146771454,0.76
29200684,cloud computing,it,How do you convince stakeholders to invest in cloud computing?,evaluation,Advanced,"[""Overview of cloud computing"", ""Step-by-step implementation"", ""Best practices and tips"", ""Common challenges and solutions"", ""Tools and resources needed"", ""Conclusion and next steps""]","[""computing"", ""software"", ""it"", ""programming"", ""evaluation"", ""cloud""]",6,Senior Developers & Tech Leads,"[""machine learning"", ""data science"", ""web development"", ""cybersecurity""]",62,10,2025-10-25 21:37:21,en,How do you convince stakeholders to invest in {keyword}?,0.94,0.902378419598304,0.34
29200685,portfolio management,economics,How do economic conditions affect portfolio management performance?,best_practice,Advanced,"[""Introduction to portfolio management"", ""Key points and analysis"", ""Practical examples"", ""Expert insights"", ""Action items"", ""Conclusion""]","[""finance"", ""portfolio"", ""best_practice"", ""management"", ""business"", ""economics""]",4,Professional Investors & Advisors,"[""market analysis"", ""financial modeling"", ""investment planning""]",67,8,2025-10-25 21:37:21,en,How do economic conditions affect {keyword} performance?,0.61,0.8925803129347947,0.87
29200686,data science,it,How do you design a scalable data science solution?,how_to,Intermediate,"[""Overview of data science"", ""Step-by-step implementation"", ""Best practices and tips"", ""Common challenges and solutions"", ""Tools and resources needed"", ""Conclusion and next steps""]","[""how_to"", ""technology"", ""it"", ""programming"", ""science"", ""data""]",6,Junior to Mid-level Developers,"[""web development"", ""machine learning"", ""cybersecurity"", ""cloud computing""]",51,9,2025-10-25 21:37:21,en,How do you design a scalable {keyword} solution?,0.66,0.7054075618998272,0.49
29200687,digital marketing,marketing,How do you attribute success to digital marketing efforts?,best_practice,Expert,"[""Overview of digital marketing"", ""Step-by-step implementation"", ""Best practices and tips"", ""Common challenges and solutions"", ""Tools and resources needed"", ""Conclusion and next steps""]","[""marketing"", ""promotion"", ""best_practice"", ""digital""]",6,Marketing Directors & CMOs,"[""content marketing"", ""brand management"", ""social media""]",58,9,2025-10-25 21:37:21,en,How do you attribute success to {keyword} efforts?,0.94,1.0,0.39
29200688,content marketing,marketing,How do you track and analyze content marketing performance?,best_practice,Advanced,"[""Overview of content marketing"", ""Step-by-step implementation"", ""Best practices and tips"", ""Common challenges and solutions"", ""Tools and resources needed"", ""Conclusion and next steps""]","[""content"", ""promotion"", ""best_practice"", ""marketing"", ""digital""]",6,Marketing Managers & Strategists,"[""social media"", ""digital marketing"", ""brand management""]",59,9,2025-10-25 21:37:21,en,How do you track and analyze {keyword} performance?,0.75,0.9902671693092333,0.85
29200689,portfolio management,economics,How do you create a long-term plan for portfolio management?,optimization,Advanced,"[""Overview of portfolio management"", ""Step-by-step implementation"", ""Best practices and tips"", ""Common challenges and solutions"", ""Tools and resources needed"", ""Conclusion and next steps""]","[""portfolio"", ""management"", ""business"", ""market"", ""optimization"", ""economics""]",6,Professional Investors & Advisors,"[""market analysis"", ""financial modeling"", ""investment planning""]",60,10,2025-10-25 21:37:21,en,How do you create a long-term plan for {keyword}?,0.61,0.808038179004322,0.76
29200690,market analysis,economics,How do you assess and manage market analysis risks?,evaluation,Expert,"[""Overview of market analysis"", ""Step-by-step implementation"", ""Best practices and tips"", ""Common challenges and solutions"", ""Tools and resources needed"", ""Conclusion and next steps""]","[""analysis"", ""evaluation"", ""market"", ""business"", ""economics""]",6,Portfolio Managers & Financial Experts,"[""portfolio management"", ""investment planning"", ""financial modeling""]",51,9,2025-10-25 21:37:21,en,How do you assess and manage {keyword} risks?,0.94,1.0,0.46
29200691,market analysis,economics,How do economic conditions affect market analysis performance?,troubleshooting,Advanced,"[""Introduction to market analysis"", ""Key points and analysis"", ""Practical examples"", ""Expert insights"", ""Action items"", ""Conclusion""]","[""finance"", ""analysis"", ""troubleshooting"", ""market"", ""economics""]",4,Professional Investors & Advisors,"[""portfolio management"", ""investment planning"", ""financial modeling""]",62,8,2025-10-25 21:37:21,en,How do economic conditions affect {keyword} performance?,0.71,0.878249490200823,0.42
29200692,content marketing,marketing,What does the future hold for content marketing?,how_to,Expert,"[""Introduction to content marketing"", ""Key points and analysis"", ""Practical examples"", ""Expert insights"", ""Action items"", ""Conclusion""]","[""how_to"", ""content"", ""promotion"", ""marketing"", ""advertising""]",4,Marketing Directors & CMOs,"[""digital marketing"", ""brand management"", ""social media""]",48,8,2025-10-25 21:37:21,en,What does the future hold for {keyword}?,0.81,1.0,0.32
29200693,portfolio management,economics,How do economic conditions affect portfolio management performance?,how_to,Beginner,"[""Introduction to portfolio management"", ""Key points and analysis"", ""Practical examples"", ""Expert insights"", ""Action items"", ""Conclusion""]","[""how_to"", ""finance"", ""portfolio"", ""management"", ""business"", ""economics""]",4,Students & New Investors,"[""investment planning"", ""market analysis"", ""financial modeling""]",67,8,2025-10-25 21:37:21,en,How do economic conditions affect {keyword} performance?,0.62,0.4552573703799071,0.85
29200694,content marketing,marketing,How do you track and analyze content marketing performance?,evaluation,Beginner,"[""Overview of content marketing"", ""Step-by-step implementation"", ""Best practices and tips"", ""Common challenges and solutions"", ""Tools and resources needed"", ""Conclusion and next steps""]","[""content"", ""promotion"", ""marketing"", ""branding"", ""evaluation""]",6,Marketing Students & Interns,"[""digital marketing"", ""brand management"", ""social media""]",59,9,2025-10-25 21:37:21,en,How do you track and analyze {keyword} performance?,0.73,0.3906628459508522,0.87
29200695,financial modeling,economics,How do you create a long-term plan for financial modeling?,troubleshooting,Intermediate,"[""Overview of financial modeling"", ""Step-by-step implementation"", ""Best practices and tips"", ""Common challenges and solutions"", ""Tools and resources needed"", ""Conclusion and next steps""]","[""finance"", ""troubleshooting"", ""modeling"", ""financial"", ""market"", ""economics""]",6,Individual Investors & Analysts,"[""market analysis"", ""investment planning"", ""portfolio management""]",58,10,2025-10-25 21:37:21,en,How do you create a long-term plan for {keyword}?,0.75,0.6602494785887654,0.75
29200696,portfolio management,economics,What are the regulatory considerations for portfolio management?,troubleshooting,Beginner,"[""Introduction to portfolio management"", ""Key concepts and definitions"", ""Main categories or types"", ""Examples and case studies"", ""Benefits and advantages"", ""Summary and recommendations""]","[""finance"", ""portfolio"", ""troubleshooting"", ""management"", ""business"", ""economics""]",6,Students & New Investors,"[""market analysis"", ""investment planning"", ""financial modeling""]",64,8,2025-10-25 21:37:21,en,What are the regulatory considerations for {keyword}?,0.79,0.30599867074019826,0.55
29200697,market analysis,economics,How do you hedge against market analysis market downturns?,analysis,Advanced,"[""Overview of market analysis"", ""Step-by-step implementation"", ""Best practices and tips"", ""Common challenges and solutions"", ""Tools and resources needed"", ""Conclusion and next steps""]","[""investment"", ""finance"", ""analysis"", ""market"", ""economics""]",6,Professional Investors & Advisors,"[""portfolio management"", ""financial modeling"", ""investment planning""]",58,9,2025-10-25 21:37:21,en,How do you hedge against {keyword} market downturns?,0.92,0.8013430886457646,0.63
29200698,digital marketing,marketing,How do you optimize digital marketing for mobile users?,evaluation,Advanced,"[""Overview of digital marketing"", ""Step-by-step implementation"", ""Best practices and tips"", ""Common challenges and solutions"", ""Tools and resources needed"", ""Conclusion and next steps""]","[""marketing"", ""digital"", ""advertising"", ""branding"", ""evaluation""]",6,Marketing Managers & Strategists,"[""social media"", ""brand management"", ""content marketing""]",55,9,2025-10-25 21:37:21,en,How do you optimize {keyword} for mobile users?,0.74,0.8427358973071055,0.79
