record_id,keyword,category,question,question_type,difficulty_level,answer_outline,tags,estimated_read_time,target_audience,related_topics,question_length,word_count,created_date,language,source_template,engagement_score,complexity_score,popularity_score
46800657,web development,it,How do you measure the success of web development projects?,implementation,Intermediate,"[""Overview of web development"", ""Step-by-step implementation"", ""Best practices and tips"", ""Common challenges and solutions"", ""Tools and resources needed"", ""Conclusion and next steps""]","[""technology"", ""software"", ""development"", ""it"", ""implementation"", ""web""]",6,Junior to Mid-level Developers,"[""cloud computing"", ""machine learning"", ""cybersecurity"", ""data science""]",59,10,2025-10-25 22:01:45,en,How do you measure the success of {keyword} projects?,0.74,0.6456822402734614,0.78
46800658,machine learning,it,What is the recommended architecture for machine learning systems?,evaluation,Expert,"[""Introduction to machine learning"", ""Key points and analysis"", ""Practical examples"", ""Expert insights"", ""Action items"", ""Conclusion""]","[""software"", ""it"", ""programming"", ""learning"", ""evaluation"", ""machine""]",4,Architects & Technical Directors,"[""cybersecurity"", ""data science"", ""web development"", ""cloud computing""]",66,9,2025-10-25 22:01:45,en,What is the recommended architecture for {keyword} systems?,0.89,1.0,0.87
46800659,machine learning,it,How do you choose the right technology stack for machine learning?,how_to,Intermediate,"[""Overview of machine learning"", ""Step-by-step implementation"", ""Best practices and tips"", ""Common challenges and solutions"", ""Tools and resources needed"", ""Conclusion and next steps""]","[""how_to"", ""it"", ""programming"", ""learning"", ""machine"", ""technology""]",6,Junior to Mid-level Developers,"[""cloud computing"", ""data science"", ""web development"", ""cybersecurity""]",66,11,2025-10-25 22:01:45,en,How do you choose the right technology stack for {keyword}?,0.67,0.6658321093504268,0.52
46800660,cybersecurity,it,How do you design a scalable cybersecurity solution?,planning,Intermediate,"[""Overview of cybersecurity"", ""Step-by-step implementation"", ""Best practices and tips"", ""Common challenges and solutions"", ""Tools and resources needed"", ""Conclusion and next steps""]","[""planning"", ""development"", ""it"", ""programming"", ""cybersecurity""]",5,Junior to Mid-level Developers,"[""cloud computing"", ""machine learning"", ""data science"", ""web development""]",52,8,2025-10-25 22:01:45,en,How do you design a scalable {keyword} solution?,0.78,0.6200931821074727,0.79
46800661,data science,it,How do you stay updated with data science developments?,strategy,Expert,"[""Overview of data science"", ""Step-by-step implementation"", ""Best practices and tips"", ""Common challenges and solutions"", ""Tools and resources needed"", ""Conclusion and next steps""]","[""technology"", ""development"", ""it"", ""science"", ""strategy"", ""data""]",6,Architects & Technical Directors,"[""cybersecurity"", ""web development"", ""machine learning"", ""cloud computing""]",55,9,2025-10-25 22:01:45,en,How do you stay updated with {keyword} developments?,0.62,1.0,0.38
46800662,social media,marketing,What are the latest trends in social media?,implementation,Intermediate,"[""Introduction to social media"", ""Key concepts and definitions"", ""Main categories or types"", ""Examples and case studies"", ""Benefits and advantages"", ""Summary and recommendations""]","[""media"", ""implementation"", ""marketing"", ""social"", ""advertising"", ""branding""]",6,Marketing Coordinators & Specialists,"[""content marketing"", ""brand management"", ""digital marketing""]",43,8,2025-10-25 22:01:45,en,What are the latest trends in {keyword}?,0.95,0.6109085939879165,0.51
46800663,investment planning,economics,What are the risks associated with investment planning?,evaluation,Advanced,"[""Introduction to investment planning"", ""Key concepts and definitions"", ""Main categories or types"", ""Examples and case studies"", ""Benefits and advantages"", ""Summary and recommendations""]","[""investment"", ""planning"", ""finance"", ""evaluation"", ""business"", ""economics""]",6,Professional Investors & Advisors,"[""portfolio management"", ""financial modeling"", ""market analysis""]",55,8,2025-10-25 22:01:45,en,What are the risks associated with {keyword}?,0.69,0.8171581756168237,0.84
46800664,market analysis,economics,How do you hedge against market analysis market downturns?,implementation,Advanced,"[""Overview of market analysis"", ""Step-by-step implementation"", ""Best practices and tips"", ""Common challenges and solutions"", ""Tools and resources needed"", ""Conclusion and next steps""]","[""finance"", ""analysis"", ""implementation"", ""market"", ""business"", ""economics""]",6,Professional Investors & Advisors,"[""investment planning"", ""financial modeling"", ""portfolio management""]",58,9,2025-10-25 22:01:45,en,How do you hedge against {keyword} market downturns?,0.7,0.8531924555510976,0.43
46800665,market analysis,economics,What factors should be considered when evaluating market analysis?,implementation,Intermediate,"[""Introduction to market analysis"", ""Key points and analysis"", ""Practical examples"", ""Expert insights"", ""Action items"", ""Conclusion""]","[""analysis"", ""implementation"", ""market"", ""business"", ""economics""]",4,Individual Investors & Analysts,"[""portfolio management"", ""financial modeling"", ""investment planning""]",66,9,2025-10-25 22:01:45,en,What factors should be considered when evaluating {keyword}?,0.87,0.6159374720181716,0.68
46800666,portfolio management,economics,How do you benchmark portfolio management against alternatives?,strategy,Intermediate,"[""Overview of portfolio management"", ""Step-by-step implementation"", ""Best practices and tips"", ""Common challenges and solutions"", ""Tools and resources needed"", ""Conclusion and next steps""]","[""finance"", ""portfolio"", ""management"", ""business"", ""strategy"", ""economics""]",6,Individual Investors & Analysts,"[""financial modeling"", ""market analysis"", ""investment planning""]",63,8,2025-10-25 22:01:45,en,How do you benchmark {keyword} against alternatives?,0.95,0.7201359877577163,0.71
46800667,cybersecurity,it,How do you measure the success of cybersecurity projects?,implementation,Beginner,"[""Overview of cybersecurity"", ""Step-by-step implementation"", ""Best practices and tips"", ""Common challenges and solutions"", ""Tools and resources needed"", ""Conclusion and next steps""]","[""software"", ""it"", ""implementation"", ""cybersecurity"", ""technology""]",5,Students & Entry-level Developers,"[""machine learning"", ""data science"", ""web development"", ""cloud computing""]",57,9,2025-10-25 22:01:45,en,How do you measure the success of {keyword} projects?,0.78,0.4625836968818321,0.87
46800668,content marketing,marketing,What A/B tests should you run for content marketing?,optimization,Advanced,"[""Introduction to content marketing"", ""Key points and analysis"", ""Practical examples"", ""Expert insights"", ""Action items"", ""Conclusion""]","[""content"", ""promotion"", ""marketing"", ""branding"", ""optimization""]",4,Marketing Managers & Strategists,"[""digital marketing"", ""brand management"", ""social media""]",52,9,2025-10-25 22:01:45,en,What A/B tests should you run for {keyword}?,0.88,0.9999442055268064,0.65
46800669,cloud computing,it,How do you convince stakeholders to invest in cloud computing?,implementation,Intermediate,"[""Overview of cloud computing"", ""Step-by-step implementation"", ""Best practices and tips"", ""Common challenges and solutions"", ""Tools and resources needed"", ""Conclusion and next steps""]","[""computing"", ""development"", ""it"", ""implementation"", ""cloud"", ""technology""]",6,Junior to Mid-level Developers,"[""machine learning"", ""data science"", ""cybersecurity"", ""web development""]",62,10,2025-10-25 22:01:45,en,How do you convince stakeholders to invest in {keyword}?,0.67,0.758980966470864,0.84
46800670,content marketing,marketing,How do you attribute success to content marketing efforts?,best_practice,Advanced,"[""Overview of content marketing"", ""Step-by-step implementation"", ""Best practices and tips"", ""Common challenges and solutions"", ""Tools and resources needed"", ""Conclusion and next steps""]","[""content"", ""best_practice"", ""marketing"", ""advertising"", ""branding""]",6,Marketing Managers & Strategists,"[""social media"", ""digital marketing"", ""brand management""]",58,9,2025-10-25 22:01:45,en,How do you attribute success to {keyword} efforts?,0.78,0.9062103081754429,0.35
46800671,digital marketing,marketing,What messaging works best in digital marketing campaigns?,strategy,Intermediate,"[""Introduction to digital marketing"", ""Key points and analysis"", ""Practical examples"", ""Expert insights"", ""Action items"", ""Conclusion""]","[""promotion"", ""marketing"", ""digital"", ""advertising"", ""strategy""]",4,Marketing Coordinators & Specialists,"[""social media"", ""content marketing"", ""brand management""]",57,8,2025-10-25 22:01:45,en,What messaging works best in {keyword} campaigns?,0.8,0.739351142173623,0.66
46800672,social media,marketing,How do you identify the right audience for social media?,best_practice,Expert,"[""Overview of social media"", ""Step-by-step implementation"", ""Best practices and tips"", ""Common challenges and solutions"", ""Tools and resources needed"", ""Conclusion and next steps""]","[""media"", ""best_practice"", ""marketing"", ""social"", ""advertising"", ""branding""]",6,Marketing Directors & CMOs,"[""digital marketing"", ""brand management"", ""content marketing""]",56,10,2025-10-25 22:01:45,en,How do you identify the right audience for {keyword}?,0.76,1.0,0.63
46800673,financial modeling,economics,How do you benchmark financial modeling against alternatives?,analysis,Beginner,"[""Overview of financial modeling"", ""Step-by-step implementation"", ""Best practices and tips"", ""Common challenges and solutions"", ""Tools and resources needed"", ""Conclusion and next steps""]","[""investment"", ""analysis"", ""modeling"", ""financial"", ""market"", ""economics""]",6,Students & New Investors,"[""market analysis"", ""investment planning"", ""portfolio management""]",61,8,2025-10-25 22:01:45,en,How do you benchmark {keyword} against alternatives?,0.65,0.35793071196868514,0.38
46800674,cloud computing,it,What are the cost considerations for cloud computing?,troubleshooting,Intermediate,"[""Introduction to cloud computing"", ""Key concepts and definitions"", ""Main categories or types"", ""Examples and case studies"", ""Benefits and advantages"", ""Summary and recommendations""]","[""computing"", ""software"", ""development"", ""it"", ""troubleshooting"", ""cloud""]",6,Junior to Mid-level Developers,"[""data science"", ""web development"", ""machine learning"", ""cybersecurity""]",53,8,2025-10-25 22:01:45,en,What are the cost considerations for {keyword}?,0.75,0.7726009264360193,0.36
46800675,investment planning,economics,What indicators predict investment planning market movements?,comparison,Beginner,"[""Introduction to investment planning"", ""Key points and analysis"", ""Practical examples"", ""Expert insights"", ""Action items"", ""Conclusion""]","[""investment"", ""planning"", ""finance"", ""comparison"", ""economics""]",4,Students & New Investors,"[""portfolio management"", ""market analysis"", ""financial modeling""]",61,7,2025-10-25 22:01:45,en,What indicators predict {keyword} market movements?,0.75,0.31124295660529006,0.65
46800676,content marketing,marketing,How do you automate content marketing processes?,best_practice,Advanced,"[""Overview of content marketing"", ""Step-by-step implementation"", ""Best practices and tips"", ""Common challenges and solutions"", ""Tools and resources needed"", ""Conclusion and next steps""]","[""content"", ""promotion"", ""best_practice"", ""marketing"", ""advertising""]",6,Marketing Managers & Strategists,"[""digital marketing"", ""social media"", ""brand management""]",48,7,2025-10-25 22:01:45,en,How do you automate {keyword} processes?,0.67,0.8221429385674683,0.79
46800677,brand management,marketing,What content types work best for brand management?,how_to,Advanced,"[""Introduction to brand management"", ""Key points and analysis"", ""Practical examples"", ""Expert insights"", ""Action items"", ""Conclusion""]","[""how_to"", ""marketing"", ""management"", ""advertising"", ""branding"", ""brand""]",4,Marketing Managers & Strategists,"[""content marketing"", ""digital marketing"", ""social media""]",50,8,2025-10-25 22:01:45,en,What content types work best for {keyword}?,0.82,0.9840204478109043,0.75
46800678,brand management,marketing,How do you automate brand management processes?,troubleshooting,Advanced,"[""Overview of brand management"", ""Step-by-step implementation"", ""Best practices and tips"", ""Common challenges and solutions"", ""Tools and resources needed"", ""Conclusion and next steps""]","[""troubleshooting"", ""marketing"", ""management"", ""advertising"", ""branding"", ""brand""]",6,Marketing Managers & Strategists,"[""content marketing"", ""social media"", ""digital marketing""]",47,7,2025-10-25 22:01:45,en,How do you automate {keyword} processes?,0.86,0.962899971507997,0.35
46800679,market analysis,economics,How do you benchmark market analysis against alternatives?,analysis,Expert,"[""Overview of market analysis"", ""Step-by-step implementation"", ""Best practices and tips"", ""Common challenges and solutions"", ""Tools and resources needed"", ""Conclusion and next steps""]","[""investment"", ""analysis"", ""market"", ""business"", ""economics""]",6,Portfolio Managers & Financial Experts,"[""portfolio management"", ""investment planning"", ""financial modeling""]",58,8,2025-10-25 22:01:45,en,How do you benchmark {keyword} against alternatives?,0.76,1.0,0.49
46800680,content marketing,marketing,What KPIs are most important for content marketing?,implementation,Beginner,"[""Introduction to content marketing"", ""Key points and analysis"", ""Practical examples"", ""Expert insights"", ""Action items"", ""Conclusion""]","[""content"", ""implementation"", ""marketing"", ""digital"", ""advertising""]",4,Marketing Students & Interns,"[""digital marketing"", ""brand management"", ""social media""]",51,8,2025-10-25 22:01:45,en,What KPIs are most important for {keyword}?,0.83,0.40478048626112456,0.37
46800681,machine learning,it,What are the best practices for machine learning development?,best_practice,Intermediate,"[""Introduction to machine learning"", ""Key concepts and definitions"", ""Main categories or types"", ""Examples and case studies"", ""Benefits and advantages"", ""Summary and recommendations""]","[""it"", ""best_practice"", ""programming"", ""learning"", ""machine"", ""technology""]",6,Junior to Mid-level Developers,"[""cloud computing"", ""cybersecurity"", ""data science"", ""web development""]",61,9,2025-10-25 22:01:45,en,What are the best practices for {keyword} development?,0.77,0.7268438026059477,0.76
46800682,web development,it,How do you optimize web development for different platforms?,implementation,Advanced,"[""Overview of web development"", ""Step-by-step implementation"", ""Best practices and tips"", ""Common challenges and solutions"", ""Tools and resources needed"", ""Conclusion and next steps""]","[""development"", ""web"", ""implementation"", ""it"", ""programming"", ""technology""]",6,Senior Developers & Tech Leads,"[""cloud computing"", ""machine learning"", ""data science"", ""cybersecurity""]",60,9,2025-10-25 22:01:45,en,How do you optimize {keyword} for different platforms?,0.79,0.9883029724640092,0.55
46800683,data science,it,What ROI can be expected from data science implementation?,planning,Expert,"[""Introduction to data science"", ""Key points and analysis"", ""Practical examples"", ""Expert insights"", ""Action items"", ""Conclusion""]","[""planning"", ""software"", ""it"", ""programming"", ""science"", ""data""]",4,Architects & Technical Directors,"[""web development"", ""cybersecurity"", ""cloud computing"", ""machine learning""]",58,9,2025-10-25 22:01:45,en,What ROI can be expected from {keyword} implementation?,0.75,1.0,0.83
46800684,content marketing,marketing,What KPIs are most important for content marketing?,strategy,Expert,"[""Introduction to content marketing"", ""Key points and analysis"", ""Practical examples"", ""Expert insights"", ""Action items"", ""Conclusion""]","[""content"", ""marketing"", ""digital"", ""advertising"", ""strategy""]",4,Marketing Directors & CMOs,"[""social media"", ""digital marketing"", ""brand management""]",51,8,2025-10-25 22:01:45,en,What KPIs are most important for {keyword}?,0.73,1.0,0.31
46800685,machine learning,it,How do you design a scalable machine learning solution?,best_practice,Advanced,"[""Overview of machine learning"", ""Step-by-step implementation"", ""Best practices and tips"", ""Common challenges and solutions"", ""Tools and resources needed"", ""Conclusion and next steps""]","[""development"", ""it"", ""best_practice"", ""learning"", ""machine"", ""technology""]",6,Senior Developers & Tech Leads,"[""web development"", ""cybersecurity"", ""data science"", ""cloud computing""]",55,9,2025-10-25 22:01:45,en,How do you design a scalable {keyword} solution?,0.93,0.9314540529171271,0.84
46800686,financial modeling,economics,How do economic conditions affect financial modeling performance?,optimization,Intermediate,"[""Introduction to financial modeling"", ""Key points and analysis"", ""Practical examples"", ""Expert insights"", ""Action items"", ""Conclusion""]","[""investment"", ""modeling"", ""financial"", ""market"", ""optimization"", ""economics""]",4,Individual Investors & Analysts,"[""portfolio management"", ""investment planning"", ""market analysis""]",65,8,2025-10-25 22:01:45,en,How do economic conditions affect {keyword} performance?,0.69,0.6324211284199595,0.58
46800687,social media,marketing,What timing strategies work for social media?,how_to,Advanced,"[""Introduction to social media"", ""Key points and analysis"", ""Practical examples"", ""Expert insights"", ""Action items"", ""Conclusion""]","[""how_to"", ""media"", ""digital"", ""marketing"", ""social"", ""branding""]",4,Marketing Managers & Strategists,"[""content marketing"", ""brand management"", ""digital marketing""]",45,7,2025-10-25 22:01:45,en,What timing strategies work for {keyword}?,0.65,0.8156835470102007,0.65
46800688,brand management,marketing,What timing strategies work for brand management?,comparison,Expert,"[""Introduction to brand management"", ""Key points and analysis"", ""Practical examples"", ""Expert insights"", ""Action items"", ""Conclusion""]","[""comparison"", ""marketing"", ""management"", ""advertising"", ""branding"", ""brand""]",4,Marketing Directors & CMOs,"[""content marketing"", ""social media"", ""digital marketing""]",49,7,2025-10-25 22:01:45,en,What timing strategies work for {keyword}?,0.71,1.0,0.62
46800689,portfolio management,economics,How do you adjust your portfolio management strategy during volatility?,analysis,Advanced,"[""Overview of portfolio management"", ""Step-by-step implementation"", ""Best practices and tips"", ""Common challenges and solutions"", ""Tools and resources needed"", ""Conclusion and next steps""]","[""analysis"", ""finance"", ""portfolio"", ""management"", ""business"", ""economics""]",6,Professional Investors & Advisors,"[""market analysis"", ""investment planning"", ""financial modeling""]",71,10,2025-10-25 22:01:45,en,How do you adjust your {keyword} strategy during volatility?,0.81,0.8337343733328934,0.33
46800690,digital marketing,marketing,What demographics respond best to digital marketing?,best_practice,Advanced,"[""Introduction to digital marketing"", ""Key points and analysis"", ""Practical examples"", ""Expert insights"", ""Action items"", ""Conclusion""]","[""promotion"", ""best_practice"", ""marketing"", ""digital"", ""advertising""]",4,Marketing Managers & Strategists,"[""social media"", ""content marketing"", ""brand management""]",52,7,2025-10-25 22:01:45,en,What demographics respond best to {keyword}?,0.94,0.9590099555097776,0.78
46800691,portfolio management,economics,What is the optimal allocation for portfolio management in a portfolio?,planning,Advanced,"[""Introduction to portfolio management"", ""Key points and analysis"", ""Practical examples"", ""Expert insights"", ""Action items"", ""Conclusion""]","[""investment"", ""planning"", ""finance"", ""portfolio"", ""management"", ""economics""]",4,Professional Investors & Advisors,"[""market analysis"", ""financial modeling"", ""investment planning""]",71,11,2025-10-25 22:01:45,en,What is the optimal allocation for {keyword} in a portfolio?,0.67,0.8310709758168187,0.41
46800692,portfolio management,economics,How do you identify opportunities in portfolio management markets?,implementation,Expert,"[""Overview of portfolio management"", ""Step-by-step implementation"", ""Best practices and tips"", ""Common challenges and solutions"", ""Tools and resources needed"", ""Conclusion and next steps""]","[""implementation"", ""portfolio"", ""management"", ""market"", ""business"", ""economics""]",6,Portfolio Managers & Financial Experts,"[""investment planning"", ""market analysis"", ""financial modeling""]",66,9,2025-10-25 22:01:45,en,How do you identify opportunities in {keyword} markets?,0.67,1.0,0.3
46800693,financial modeling,economics,How does global economics impact financial modeling?,best_practice,Advanced,"[""Introduction to financial modeling"", ""Key points and analysis"", ""Practical examples"", ""Expert insights"", ""Action items"", ""Conclusion""]","[""best_practice"", ""modeling"", ""financial"", ""market"", ""business"", ""economics""]",4,Professional Investors & Advisors,"[""investment planning"", ""market analysis"", ""portfolio management""]",52,7,2025-10-25 22:01:45,en,How does global economics impact {keyword}?,0.77,0.9436834166456868,0.37
46800694,web development,it,How can web development improve system performance and scalability?,troubleshooting,Advanced,"[""Introduction to web development"", ""Key points and analysis"", ""Practical examples"", ""Expert insights"", ""Action items"", ""Conclusion""]","[""software"", ""development"", ""web"", ""it"", ""troubleshooting"", ""technology""]",4,Senior Developers & Tech Leads,"[""data science"", ""cybersecurity"", ""machine learning"", ""cloud computing""]",67,9,2025-10-25 22:01:45,en,How can {keyword} improve system performance and scalability?,0.85,0.9932236948531895,0.85
46800695,machine learning,it,How do you optimize machine learning for different platforms?,planning,Advanced,"[""Overview of machine learning"", ""Step-by-step implementation"", ""Best practices and tips"", ""Common challenges and solutions"", ""Tools and resources needed"", ""Conclusion and next steps""]","[""software"", ""planning"", ""it"", ""development"", ""learning"", ""machine""]",6,Senior Developers & Tech Leads,"[""data science"", ""cybersecurity"", ""cloud computing"", ""web development""]",61,9,2025-10-25 22:01:45,en,How do you optimize {keyword} for different platforms?,0.93,0.8058659300644664,0.61
46800696,cloud computing,it,How do you convince stakeholders to invest in cloud computing?,strategy,Intermediate,"[""Overview of cloud computing"", ""Step-by-step implementation"", ""Best practices and tips"", ""Common challenges and solutions"", ""Tools and resources needed"", ""Conclusion and next steps""]","[""computing"", ""cloud"", ""software"", ""it"", ""strategy"", ""technology""]",6,Junior to Mid-level Developers,"[""data science"", ""web development"", ""machine learning"", ""cybersecurity""]",62,10,2025-10-25 22:01:45,en,How do you convince stakeholders to invest in {keyword}?,0.9,0.7301016338759131,0.37
46800697,financial modeling,economics,How do you diversify your portfolio using financial modeling?,analysis,Beginner,"[""Overview of financial modeling"", ""Step-by-step implementation"", ""Best practices and tips"", ""Common challenges and solutions"", ""Tools and resources needed"", ""Conclusion and next steps""]","[""analysis"", ""modeling"", ""financial"", ""market"", ""business"", ""economics""]",6,Students & New Investors,"[""investment planning"", ""market analysis"", ""portfolio management""]",61,9,2025-10-25 22:01:45,en,How do you diversify your portfolio using {keyword}?,0.95,0.44980747097237844,0.84
46800698,financial modeling,economics,How do you diversify your portfolio using financial modeling?,best_practice,Intermediate,"[""Overview of financial modeling"", ""Step-by-step implementation"", ""Best practices and tips"", ""Common challenges and solutions"", ""Tools and resources needed"", ""Conclusion and next steps""]","[""finance"", ""best_practice"", ""modeling"", ""financial"", ""business"", ""economics""]",6,Individual Investors & Analysts,"[""investment planning"", ""portfolio management"", ""market analysis""]",61,9,2025-10-25 22:01:45,en,How do you diversify your portfolio using {keyword}?,0.8,0.6234143211953109,0.67
46800699,market analysis,economics,How do you hedge against market analysis market downturns?,implementation,Expert,"[""Overview of market analysis"", ""Step-by-step implementation"", ""Best practices and tips"", ""Common challenges and solutions"", ""Tools and resources needed"", ""Conclusion and next steps""]","[""investment"", ""finance"", ""analysis"", ""implementation"", ""market"", ""economics""]",6,Portfolio Managers & Financial Experts,"[""investment planning"", ""financial modeling"", ""portfolio management""]",58,9,2025-10-25 22:01:45,en,How do you hedge against {keyword} market downturns?,0.71,1.0,0.9
