record_id,keyword,category,question,question_type,difficulty_level,answer_outline,tags,estimated_read_time,target_audience,related_topics,question_length,word_count,created_date,language,source_template,engagement_score,complexity_score,popularity_score
29200001,financial modeling,economics,What exit strategies should be considered for financial modeling?,best_practice,Intermediate,"[""Introduction to financial modeling"", ""Key points and analysis"", ""Practical examples"", ""Expert insights"", ""Action items"", ""Conclusion""]","[""investment"", ""best_practice"", ""modeling"", ""financial"", ""business"", ""economics""]",4,Individual Investors & Analysts,"[""portfolio management"", ""investment planning"", ""market analysis""]",65,9,2025-10-25 21:37:21,en,What exit strategies should be considered for {keyword}?,0.79,0.7708284612831663,0.44
29200002,digital marketing,marketing,How do you optimize digital marketing for mobile users?,planning,Expert,"[""Overview of digital marketing"", ""Step-by-step implementation"", ""Best practices and tips"", ""Common challenges and solutions"", ""Tools and resources needed"", ""Conclusion and next steps""]","[""marketing"", ""promotion"", ""planning"", ""digital""]",6,Marketing Directors & CMOs,"[""social media"", ""brand management"", ""content marketing""]",55,9,2025-10-25 21:37:21,en,How do you optimize {keyword} for mobile users?,0.91,1.0,0.6
29200003,brand management,marketing,What are the latest trends in brand management?,implementation,Beginner,"[""Introduction to brand management"", ""Key concepts and definitions"", ""Main categories or types"", ""Examples and case studies"", ""Benefits and advantages"", ""Summary and recommendations""]","[""implementation"", ""promotion"", ""marketing"", ""digital"", ""management"", ""brand""]",6,Marketing Students & Interns,"[""social media"", ""content marketing"", ""digital marketing""]",47,8,2025-10-25 21:37:21,en,What are the latest trends in {keyword}?,0.78,0.40531337627562614,0.7
29200004,financial modeling,economics,How do you diversify your portfolio using financial modeling?,best_practice,Expert,"[""Overview of financial modeling"", ""Step-by-step implementation"", ""Best practices and tips"", ""Common challenges and solutions"", ""Tools and resources needed"", ""Conclusion and next steps""]","[""finance"", ""best_practice"", ""modeling"", ""financial"", ""market"", ""economics""]",6,Portfolio Managers & Financial Experts,"[""portfolio management"", ""investment planning"", ""market analysis""]",61,9,2025-10-25 21:37:21,en,How do you diversify your portfolio using {keyword}?,0.62,1.0,0.59
29200005,web development,it,How do you get started with web development as a beginner?,implementation,Beginner,"[""Overview of web development"", ""Step-by-step implementation"", ""Best practices and tips"", ""Common challenges and solutions"", ""Tools and resources needed"", ""Conclusion and next steps""]","[""software"", ""development"", ""it"", ""implementation"", ""programming"", ""web""]",6,Students & Entry-level Developers,"[""machine learning"", ""cloud computing"", ""cybersecurity"", ""data science""]",58,11,2025-10-25 21:37:21,en,How do you get started with {keyword} as a beginner?,0.86,0.3746085544068568,0.72
29200006,market analysis,economics,What are the risks associated with market analysis?,implementation,Intermediate,"[""Introduction to market analysis"", ""Key concepts and definitions"", ""Main categories or types"", ""Examples and case studies"", ""Benefits and advantages"", ""Summary and recommendations""]","[""finance"", ""analysis"", ""implementation"", ""market"", ""economics""]",6,Individual Investors & Analysts,"[""financial modeling"", ""investment planning"", ""portfolio management""]",51,8,2025-10-25 21:37:21,en,What are the risks associated with {keyword}?,0.65,0.6794208402194996,0.51
29200007,investment planning,economics,What factors should be considered when evaluating investment planning?,optimization,Expert,"[""Introduction to investment planning"", ""Key points and analysis"", ""Practical examples"", ""Expert insights"", ""Action items"", ""Conclusion""]","[""investment"", ""planning"", ""finance"", ""optimization"", ""economics""]",4,Portfolio Managers & Financial Experts,"[""portfolio management"", ""financial modeling"", ""market analysis""]",70,9,2025-10-25 21:37:21,en,What factors should be considered when evaluating {keyword}?,0.61,1.0,0.79
29200008,portfolio management,economics,What tools help analyze portfolio management data?,evaluation,Intermediate,"[""Introduction to portfolio management"", ""Key points and analysis"", ""Practical examples"", ""Expert insights"", ""Action items"", ""Conclusion""]","[""investment"", ""portfolio"", ""management"", ""evaluation"", ""market"", ""economics""]",4,Individual Investors & Analysts,"[""market analysis"", ""investment planning"", ""financial modeling""]",50,7,2025-10-25 21:37:21,en,What tools help analyze {keyword} data?,0.84,0.7679802357521182,0.59
29200009,social media,marketing,How do you automate social media processes?,optimization,Intermediate,"[""Overview of social media"", ""Step-by-step implementation"", ""Best practices and tips"", ""Common challenges and solutions"", ""Tools and resources needed"", ""Conclusion and next steps""]","[""media"", ""marketing"", ""digital"", ""social"", ""branding"", ""optimization""]",6,Marketing Coordinators & Specialists,"[""digital marketing"", ""content marketing"", ""brand management""]",43,7,2025-10-25 21:37:21,en,How do you automate {keyword} processes?,0.64,0.6389432747655032,0.79
29200010,portfolio management,economics,What indicators predict portfolio management market movements?,evaluation,Advanced,"[""Introduction to portfolio management"", ""Key points and analysis"", ""Practical examples"", ""Expert insights"", ""Action items"", ""Conclusion""]","[""portfolio"", ""management"", ""evaluation"", ""market"", ""business"", ""economics""]",4,Professional Investors & Advisors,"[""financial modeling"", ""market analysis"", ""investment planning""]",62,7,2025-10-25 21:37:21,en,What indicators predict {keyword} market movements?,0.66,0.9156252795821069,0.58
29200011,social media,marketing,What timing strategies work for social media?,best_practice,Beginner,"[""Introduction to social media"", ""Key points and analysis"", ""Practical examples"", ""Expert insights"", ""Action items"", ""Conclusion""]","[""media"", ""best_practice"", ""marketing"", ""social"", ""advertising"", ""branding""]",4,Marketing Students & Interns,"[""content marketing"", ""brand management"", ""digital marketing""]",45,7,2025-10-25 21:37:21,en,What timing strategies work for {keyword}?,0.64,0.4429097623443775,0.54
29200012,web development,it,How do you choose the right technology stack for web development?,implementation,Intermediate,"[""Overview of web development"", ""Step-by-step implementation"", ""Best practices and tips"", ""Common challenges and solutions"", ""Tools and resources needed"", ""Conclusion and next steps""]","[""software"", ""development"", ""web"", ""implementation"", ""it"", ""technology""]",6,Junior to Mid-level Developers,"[""cloud computing"", ""data science"", ""cybersecurity"", ""machine learning""]",65,11,2025-10-25 21:37:21,en,How do you choose the right technology stack for {keyword}?,0.91,0.7819730928565773,0.58
29200013,social media,marketing,What channels are most effective for social media?,planning,Intermediate,"[""Introduction to social media"", ""Key points and analysis"", ""Practical examples"", ""Expert insights"", ""Action items"", ""Conclusion""]","[""planning"", ""media"", ""promotion"", ""digital"", ""marketing"", ""social""]",4,Marketing Coordinators & Specialists,"[""digital marketing"", ""brand management"", ""content marketing""]",50,8,2025-10-25 21:37:21,en,What channels are most effective for {keyword}?,0.71,0.6545427565631045,0.52
29200014,financial modeling,economics,How do you identify opportunities in financial modeling markets?,strategy,Expert,"[""Overview of financial modeling"", ""Step-by-step implementation"", ""Best practices and tips"", ""Common challenges and solutions"", ""Tools and resources needed"", ""Conclusion and next steps""]","[""finance"", ""modeling"", ""financial"", ""market"", ""strategy"", ""economics""]",6,Portfolio Managers & Financial Experts,"[""investment planning"", ""portfolio management"", ""market analysis""]",64,9,2025-10-25 21:37:21,en,How do you identify opportunities in {keyword} markets?,0.63,1.0,0.48
29200015,financial modeling,economics,How do you assess and manage financial modeling risks?,implementation,Intermediate,"[""Overview of financial modeling"", ""Step-by-step implementation"", ""Best practices and tips"", ""Common challenges and solutions"", ""Tools and resources needed"", ""Conclusion and next steps""]","[""finance"", ""implementation"", ""modeling"", ""financial"", ""market"", ""economics""]",6,Individual Investors & Analysts,"[""investment planning"", ""market analysis"", ""portfolio management""]",54,9,2025-10-25 21:37:21,en,How do you assess and manage {keyword} risks?,0.88,0.72551677111308,0.41
29200016,cloud computing,it,How do you optimize cloud computing for different platforms?,troubleshooting,Advanced,"[""Overview of cloud computing"", ""Step-by-step implementation"", ""Best practices and tips"", ""Common challenges and solutions"", ""Tools and resources needed"", ""Conclusion and next steps""]","[""computing"", ""software"", ""it"", ""programming"", ""troubleshooting"", ""cloud""]",6,Senior Developers & Tech Leads,"[""machine learning"", ""web development"", ""data science"", ""cybersecurity""]",60,9,2025-10-25 21:37:21,en,How do you optimize {keyword} for different platforms?,0.88,0.8225151297983888,0.48
29200017,financial modeling,economics,What are the regulatory considerations for financial modeling?,best_practice,Beginner,"[""Introduction to financial modeling"", ""Key concepts and definitions"", ""Main categories or types"", ""Examples and case studies"", ""Benefits and advantages"", ""Summary and recommendations""]","[""investment"", ""finance"", ""best_practice"", ""modeling"", ""financial"", ""economics""]",6,Students & New Investors,"[""market analysis"", ""portfolio management"", ""investment planning""]",62,8,2025-10-25 21:37:21,en,What are the regulatory considerations for {keyword}?,0.69,0.3096995911690164,0.83
29200018,social media,marketing,How do you track and analyze social media performance?,how_to,Advanced,"[""Overview of social media"", ""Step-by-step implementation"", ""Best practices and tips"", ""Common challenges and solutions"", ""Tools and resources needed"", ""Conclusion and next steps""]","[""how_to"", ""media"", ""marketing"", ""digital"", ""social"", ""advertising""]",6,Marketing Managers & Strategists,"[""digital marketing"", ""content marketing"", ""brand management""]",54,9,2025-10-25 21:37:21,en,How do you track and analyze {keyword} performance?,0.69,0.8882989255073249,0.38
29200019,investment planning,economics,What tools help analyze investment planning data?,how_to,Expert,"[""Introduction to investment planning"", ""Key points and analysis"", ""Practical examples"", ""Expert insights"", ""Action items"", ""Conclusion""]","[""investment"", ""how_to"", ""planning"", ""finance"", ""market"", ""economics""]",4,Portfolio Managers & Financial Experts,"[""market analysis"", ""portfolio management"", ""financial modeling""]",49,7,2025-10-25 21:37:21,en,What tools help analyze {keyword} data?,0.66,1.0,0.79
29200020,cloud computing,it,What ROI can be expected from cloud computing implementation?,comparison,Expert,"[""Introduction to cloud computing"", ""Key points and analysis"", ""Practical examples"", ""Expert insights"", ""Action items"", ""Conclusion""]","[""computing"", ""it"", ""comparison"", ""programming"", ""cloud"", ""technology""]",4,Architects & Technical Directors,"[""web development"", ""data science"", ""machine learning"", ""cybersecurity""]",61,9,2025-10-25 21:37:21,en,What ROI can be expected from {keyword} implementation?,0.95,1.0,0.61
29200021,web development,it,How do you optimize web development for different platforms?,analysis,Expert,"[""Overview of web development"", ""Step-by-step implementation"", ""Best practices and tips"", ""Common challenges and solutions"", ""Tools and resources needed"", ""Conclusion and next steps""]","[""development"", ""web"", ""analysis"", ""it"", ""programming"", ""technology""]",6,Architects & Technical Directors,"[""cloud computing"", ""data science"", ""machine learning"", ""cybersecurity""]",60,9,2025-10-25 21:37:21,en,How do you optimize {keyword} for different platforms?,0.68,1.0,0.37
29200022,market analysis,economics,How do you identify opportunities in market analysis markets?,best_practice,Expert,"[""Overview of market analysis"", ""Step-by-step implementation"", ""Best practices and tips"", ""Common challenges and solutions"", ""Tools and resources needed"", ""Conclusion and next steps""]","[""investment"", ""analysis"", ""finance"", ""best_practice"", ""market"", ""economics""]",6,Portfolio Managers & Financial Experts,"[""financial modeling"", ""investment planning"", ""portfolio management""]",61,9,2025-10-25 21:37:21,en,How do you identify opportunities in {keyword} markets?,0.88,1.0,0.52
29200023,digital marketing,marketing,How do you create a digital marketing roadmap?,analysis,Expert,"[""Overview of digital marketing"", ""Step-by-step implementation"", ""Best practices and tips"", ""Common challenges and solutions"", ""Tools and resources needed"", ""Conclusion and next steps""]","[""analysis"", ""promotion"", ""marketing"", ""digital"", ""advertising""]",6,Marketing Directors & CMOs,"[""social media"", ""brand management"", ""content marketing""]",46,8,2025-10-25 21:37:21,en,How do you create a {keyword} roadmap?,0.63,1.0,0.66
29200024,data science,it,How do you implement data science in a production environment?,comparison,Expert,"[""Overview of data science"", ""Step-by-step implementation"", ""Best practices and tips"", ""Common challenges and solutions"", ""Tools and resources needed"", ""Conclusion and next steps""]","[""technology"", ""software"", ""it"", ""comparison"", ""science"", ""data""]",6,Architects & Technical Directors,"[""cloud computing"", ""machine learning"", ""cybersecurity"", ""web development""]",62,10,2025-10-25 21:37:21,en,How do you implement {keyword} in a production environment?,0.84,1.0,0.62
29200025,market analysis,economics,What are the regulatory considerations for market analysis?,evaluation,Intermediate,"[""Introduction to market analysis"", ""Key concepts and definitions"", ""Main categories or types"", ""Examples and case studies"", ""Benefits and advantages"", ""Summary and recommendations""]","[""finance"", ""analysis"", ""evaluation"", ""market"", ""economics""]",6,Individual Investors & Analysts,"[""financial modeling"", ""investment planning"", ""portfolio management""]",59,8,2025-10-25 21:37:21,en,What are the regulatory considerations for {keyword}?,0.79,0.653933072599084,0.49
29200026,web development,it,What are the best practices for web development development?,troubleshooting,Expert,"[""Introduction to web development"", ""Key concepts and definitions"", ""Main categories or types"", ""Examples and case studies"", ""Benefits and advantages"", ""Summary and recommendations""]","[""development"", ""web"", ""it"", ""troubleshooting"", ""technology""]",6,Architects & Technical Directors,"[""machine learning"", ""cloud computing"", ""data science"", ""cybersecurity""]",60,9,2025-10-25 21:37:21,en,What are the best practices for {keyword} development?,0.92,1.0,0.45
29200027,financial modeling,economics,What factors should be considered when evaluating financial modeling?,planning,Beginner,"[""Introduction to financial modeling"", ""Key points and analysis"", ""Practical examples"", ""Expert insights"", ""Action items"", ""Conclusion""]","[""planning"", ""finance"", ""modeling"", ""financial"", ""market"", ""economics""]",4,Students & New Investors,"[""investment planning"", ""market analysis"", ""portfolio management""]",69,9,2025-10-25 21:37:21,en,What factors should be considered when evaluating {keyword}?,0.66,0.42416921849300643,0.77
29200028,digital marketing,marketing,How do you reach new customers through digital marketing?,comparison,Expert,"[""Overview of digital marketing"", ""Step-by-step implementation"", ""Best practices and tips"", ""Common challenges and solutions"", ""Tools and resources needed"", ""Conclusion and next steps""]","[""comparison"", ""marketing"", ""digital"", ""advertising"", ""branding""]",6,Marketing Directors & CMOs,"[""brand management"", ""content marketing"", ""social media""]",57,9,2025-10-25 21:37:21,en,How do you reach new customers through {keyword}?,0.95,1.0,0.37
29200029,portfolio management,economics,How do you protect your portfolio management investments?,implementation,Intermediate,"[""Overview of portfolio management"", ""Step-by-step implementation"", ""Best practices and tips"", ""Common challenges and solutions"", ""Tools and resources needed"", ""Conclusion and next steps""]","[""investment"", ""finance"", ""implementation"", ""portfolio"", ""management"", ""economics""]",6,Individual Investors & Analysts,"[""market analysis"", ""investment planning"", ""financial modeling""]",57,8,2025-10-25 21:37:21,en,How do you protect your {keyword} investments?,0.83,0.6416369036442324,0.48
29200030,brand management,marketing,How do you personalize brand management for different segments?,evaluation,Beginner,"[""Overview of brand management"", ""Step-by-step implementation"", ""Best practices and tips"", ""Common challenges and solutions"", ""Tools and resources needed"", ""Conclusion and next steps""]","[""promotion"", ""marketing"", ""management"", ""branding"", ""evaluation"", ""brand""]",6,Marketing Students & Interns,"[""content marketing"", ""digital marketing"", ""social media""]",63,9,2025-10-25 21:37:21,en,How do you personalize {keyword} for different segments?,0.85,0.4295436260107019,0.32
29200031,web development,it,How do you convince stakeholders to invest in web development?,planning,Advanced,"[""Overview of web development"", ""Step-by-step implementation"", ""Best practices and tips"", ""Common challenges and solutions"", ""Tools and resources needed"", ""Conclusion and next steps""]","[""technology"", ""planning"", ""development"", ""it"", ""programming"", ""web""]",6,Senior Developers & Tech Leads,"[""data science"", ""machine learning"", ""cybersecurity"", ""cloud computing""]",62,10,2025-10-25 21:37:21,en,How do you convince stakeholders to invest in {keyword}?,0.75,0.9942249527323015,0.88
29200032,social media,marketing,What emerging platforms support social media?,how_to,Beginner,"[""Introduction to social media"", ""Key points and analysis"", ""Practical examples"", ""Expert insights"", ""Action items"", ""Conclusion""]","[""how_to"", ""media"", ""promotion"", ""marketing"", ""social"", ""advertising""]",4,Marketing Students & Interns,"[""brand management"", ""content marketing"", ""digital marketing""]",45,6,2025-10-25 21:37:21,en,What emerging platforms support {keyword}?,0.61,0.33757424793993485,0.41
29200033,digital marketing,marketing,How do you track and analyze digital marketing performance?,implementation,Expert,"[""Overview of digital marketing"", ""Step-by-step implementation"", ""Best practices and tips"", ""Common challenges and solutions"", ""Tools and resources needed"", ""Conclusion and next steps""]","[""implementation"", ""marketing"", ""digital"", ""advertising"", ""branding""]",6,Marketing Directors & CMOs,"[""social media"", ""content marketing"", ""brand management""]",59,9,2025-10-25 21:37:21,en,How do you track and analyze {keyword} performance?,0.62,1.0,0.58
29200034,cybersecurity,it,What are the key components of a cybersecurity implementation?,best_practice,Intermediate,"[""Introduction to cybersecurity"", ""Key concepts and definitions"", ""Main categories or types"", ""Examples and case studies"", ""Benefits and advantages"", ""Summary and recommendations""]","[""software"", ""it"", ""programming"", ""best_practice"", ""cybersecurity""]",5,Junior to Mid-level Developers,"[""web development"", ""cloud computing"", ""data science"", ""machine learning""]",62,9,2025-10-25 21:37:21,en,What are the key components of a {keyword} implementation?,0.92,0.727347865859931,0.38
29200035,portfolio management,economics,What timeline is realistic for portfolio management returns?,how_to,Beginner,"[""Introduction to portfolio management"", ""Key points and analysis"", ""Practical examples"", ""Expert insights"", ""Action items"", ""Conclusion""]","[""investment"", ""how_to"", ""finance"", ""portfolio"", ""management"", ""economics""]",4,Students & New Investors,"[""market analysis"", ""financial modeling"", ""investment planning""]",60,8,2025-10-25 21:37:21,en,What timeline is realistic for {keyword} returns?,0.75,0.35170987665508,0.68
29200036,digital marketing,marketing,What messaging works best in digital marketing campaigns?,strategy,Beginner,"[""Introduction to digital marketing"", ""Key points and analysis"", ""Practical examples"", ""Expert insights"", ""Action items"", ""Conclusion""]","[""promotion"", ""marketing"", ""digital"", ""advertising"", ""strategy""]",4,Marketing Students & Interns,"[""content marketing"", ""social media"", ""brand management""]",57,8,2025-10-25 21:37:21,en,What messaging works best in {keyword} campaigns?,0.9,0.3974460874512366,0.71
29200037,machine learning,it,What career opportunities exist in machine learning?,best_practice,Advanced,"[""Introduction to machine learning"", ""Key points and analysis"", ""Practical examples"", ""Expert insights"", ""Action items"", ""Conclusion""]","[""it"", ""programming"", ""best_practice"", ""learning"", ""machine"", ""technology""]",4,Senior Developers & Tech Leads,"[""data science"", ""cloud computing"", ""web development"", ""cybersecurity""]",52,7,2025-10-25 21:37:21,en,What career opportunities exist in {keyword}?,0.72,0.9395493563298682,0.71
29200038,social media,marketing,What does the future hold for social media?,best_practice,Intermediate,"[""Introduction to social media"", ""Key points and analysis"", ""Practical examples"", ""Expert insights"", ""Action items"", ""Conclusion""]","[""media"", ""best_practice"", ""marketing"", ""social"", ""advertising"", ""branding""]",4,Marketing Coordinators & Specialists,"[""brand management"", ""content marketing"", ""digital marketing""]",43,8,2025-10-25 21:37:21,en,What does the future hold for {keyword}?,0.81,0.765174510804149,0.79
29200039,machine learning,it,What are the latest trends in machine learning technology?,planning,Intermediate,"[""Introduction to machine learning"", ""Key concepts and definitions"", ""Main categories or types"", ""Examples and case studies"", ""Benefits and advantages"", ""Summary and recommendations""]","[""planning"", ""development"", ""it"", ""software"", ""learning"", ""machine""]",6,Junior to Mid-level Developers,"[""cloud computing"", ""web development"", ""data science"", ""cybersecurity""]",58,9,2025-10-25 21:37:21,en,What are the latest trends in {keyword} technology?,0.65,0.6933745569448547,0.65
29200040,financial modeling,economics,How do you measure financial modeling performance?,best_practice,Advanced,"[""Overview of financial modeling"", ""Step-by-step implementation"", ""Best practices and tips"", ""Common challenges and solutions"", ""Tools and resources needed"", ""Conclusion and next steps""]","[""finance"", ""best_practice"", ""modeling"", ""financial"", ""business"", ""economics""]",6,Professional Investors & Advisors,"[""market analysis"", ""investment planning"", ""portfolio management""]",50,7,2025-10-25 21:37:21,en,How do you measure {keyword} performance?,0.62,0.9587675715572113,0.32
29200041,cloud computing,it,How do you design a scalable cloud computing solution?,how_to,Expert,"[""Overview of cloud computing"", ""Step-by-step implementation"", ""Best practices and tips"", ""Common challenges and solutions"", ""Tools and resources needed"", ""Conclusion and next steps""]","[""computing"", ""how_to"", ""development"", ""it"", ""programming"", ""cloud""]",6,Architects & Technical Directors,"[""web development"", ""cybersecurity"", ""machine learning"", ""data science""]",54,9,2025-10-25 21:37:21,en,How do you design a scalable {keyword} solution?,0.83,1.0,0.78
29200042,web development,it,How do you design a scalable web development solution?,optimization,Advanced,"[""Overview of web development"", ""Step-by-step implementation"", ""Best practices and tips"", ""Common challenges and solutions"", ""Tools and resources needed"", ""Conclusion and next steps""]","[""development"", ""web"", ""it"", ""optimization"", ""technology""]",6,Senior Developers & Tech Leads,"[""cloud computing"", ""machine learning"", ""cybersecurity"", ""data science""]",54,9,2025-10-25 21:37:21,en,How do you design a scalable {keyword} solution?,0.86,0.8364559972015182,0.78
29200043,cybersecurity,it,What are the key components of a cybersecurity implementation?,strategy,Beginner,"[""Introduction to cybersecurity"", ""Key concepts and definitions"", ""Main categories or types"", ""Examples and case studies"", ""Benefits and advantages"", ""Summary and recommendations""]","[""software"", ""it"", ""strategy"", ""cybersecurity"", ""technology""]",5,Students & Entry-level Developers,"[""cloud computing"", ""machine learning"", ""web development"", ""data science""]",62,9,2025-10-25 21:37:21,en,What are the key components of a {keyword} implementation?,0.89,0.38676955139478886,0.72
