record_id,keyword,category,question,question_type,difficulty_level,answer_outline,tags,estimated_read_time,target_audience,related_topics,question_length,word_count,created_date,language,source_template,engagement_score,complexity_score,popularity_score
34300653,content marketing,marketing,What messaging works best in content marketing campaigns?,comparison,Advanced,"[""Introduction to content marketing"", ""Key points and analysis"", ""Practical examples"", ""Expert insights"", ""Action items"", ""Conclusion""]","[""content"", ""promotion"", ""comparison"", ""marketing"", ""branding""]",4,Marketing Managers & Strategists,"[""brand management"", ""digital marketing"", ""social media""]",57,8,2025-10-25 21:44:28,en,What messaging works best in {keyword} campaigns?,0.62,0.8101570888502664,0.89
34300654,digital marketing,marketing,What channels are most effective for digital marketing?,evaluation,Expert,"[""Introduction to digital marketing"", ""Key points and analysis"", ""Practical examples"", ""Expert insights"", ""Action items"", ""Conclusion""]","[""marketing"", ""digital"", ""advertising"", ""branding"", ""evaluation""]",4,Marketing Directors & CMOs,"[""social media"", ""content marketing"", ""brand management""]",55,8,2025-10-25 21:44:28,en,What channels are most effective for {keyword}?,0.68,1.0,0.65
34300655,cybersecurity,it,What design patterns work best with cybersecurity?,optimization,Intermediate,"[""Introduction to cybersecurity"", ""Key points and analysis"", ""Practical examples"", ""Expert insights"", ""Action items"", ""Conclusion""]","[""development"", ""it"", ""programming"", ""optimization"", ""cybersecurity""]",4,Junior to Mid-level Developers,"[""cloud computing"", ""web development"", ""data science"", ""machine learning""]",50,7,2025-10-25 21:44:28,en,What design patterns work best with {keyword}?,0.7,0.6159104725756108,0.75
34300656,social media,marketing,How do you identify the right audience for social media?,how_to,Intermediate,"[""Overview of social media"", ""Step-by-step implementation"", ""Best practices and tips"", ""Common challenges and solutions"", ""Tools and resources needed"", ""Conclusion and next steps""]","[""how_to"", ""media"", ""promotion"", ""digital"", ""marketing"", ""social""]",6,Marketing Coordinators & Specialists,"[""content marketing"", ""digital marketing"", ""brand management""]",56,10,2025-10-25 21:44:28,en,How do you identify the right audience for {keyword}?,0.76,0.6785544957630848,0.3
34300657,brand management,marketing,How do you create a brand management roadmap?,evaluation,Beginner,"[""Overview of brand management"", ""Step-by-step implementation"", ""Best practices and tips"", ""Common challenges and solutions"", ""Tools and resources needed"", ""Conclusion and next steps""]","[""promotion"", ""marketing"", ""digital"", ""management"", ""evaluation"", ""brand""]",6,Marketing Students & Interns,"[""digital marketing"", ""social media"", ""content marketing""]",45,8,2025-10-25 21:44:28,en,How do you create a {keyword} roadmap?,0.77,0.4186536596338321,0.64
34300658,data science,it,How do you implement data science in a production environment?,how_to,Expert,"[""Overview of data science"", ""Step-by-step implementation"", ""Best practices and tips"", ""Common challenges and solutions"", ""Tools and resources needed"", ""Conclusion and next steps""]","[""how_to"", ""software"", ""development"", ""it"", ""science"", ""data""]",6,Architects & Technical Directors,"[""cloud computing"", ""machine learning"", ""cybersecurity"", ""web development""]",62,10,2025-10-25 21:44:28,en,How do you implement {keyword} in a production environment?,0.83,1.0,0.55
34300659,cloud computing,it,What are the latest trends in cloud computing technology?,strategy,Intermediate,"[""Introduction to cloud computing"", ""Key concepts and definitions"", ""Main categories or types"", ""Examples and case studies"", ""Benefits and advantages"", ""Summary and recommendations""]","[""computing"", ""cloud"", ""development"", ""it"", ""software"", ""strategy""]",6,Junior to Mid-level Developers,"[""web development"", ""data science"", ""machine learning"", ""cybersecurity""]",57,9,2025-10-25 21:44:28,en,What are the latest trends in {keyword} technology?,0.72,0.6599069091520653,0.56
34300660,financial modeling,economics,How do you measure financial modeling performance?,how_to,Intermediate,"[""Overview of financial modeling"", ""Step-by-step implementation"", ""Best practices and tips"", ""Common challenges and solutions"", ""Tools and resources needed"", ""Conclusion and next steps""]","[""investment"", ""how_to"", ""modeling"", ""financial"", ""business"", ""economics""]",6,Individual Investors & Analysts,"[""investment planning"", ""portfolio management"", ""market analysis""]",50,7,2025-10-25 21:44:28,en,How do you measure {keyword} performance?,0.74,0.7538586116323087,0.62
34300661,market analysis,economics,What are the regulatory considerations for market analysis?,best_practice,Intermediate,"[""Introduction to market analysis"", ""Key concepts and definitions"", ""Main categories or types"", ""Examples and case studies"", ""Benefits and advantages"", ""Summary and recommendations""]","[""finance"", ""analysis"", ""best_practice"", ""market"", ""economics""]",6,Individual Investors & Analysts,"[""portfolio management"", ""financial modeling"", ""investment planning""]",59,8,2025-10-25 21:44:28,en,What are the regulatory considerations for {keyword}?,0.83,0.7007001993717492,0.33
34300662,cloud computing,it,What are the key components of a cloud computing implementation?,troubleshooting,Beginner,"[""Introduction to cloud computing"", ""Key concepts and definitions"", ""Main categories or types"", ""Examples and case studies"", ""Benefits and advantages"", ""Summary and recommendations""]","[""computing"", ""software"", ""development"", ""it"", ""troubleshooting"", ""cloud""]",6,Students & Entry-level Developers,"[""cybersecurity"", ""data science"", ""machine learning"", ""web development""]",64,10,2025-10-25 21:44:28,en,What are the key components of a {keyword} implementation?,0.92,0.46471103604641484,0.42
34300663,portfolio management,economics,How do you measure portfolio management performance?,planning,Beginner,"[""Overview of portfolio management"", ""Step-by-step implementation"", ""Best practices and tips"", ""Common challenges and solutions"", ""Tools and resources needed"", ""Conclusion and next steps""]","[""investment"", ""planning"", ""portfolio"", ""management"", ""market"", ""economics""]",6,Students & New Investors,"[""market analysis"", ""investment planning"", ""financial modeling""]",52,7,2025-10-25 21:44:28,en,How do you measure {keyword} performance?,0.73,0.3672304745497861,0.89
34300664,cybersecurity,it,How do you implement cybersecurity in a production environment?,evaluation,Advanced,"[""Overview of cybersecurity"", ""Step-by-step implementation"", ""Best practices and tips"", ""Common challenges and solutions"", ""Tools and resources needed"", ""Conclusion and next steps""]","[""software"", ""it"", ""programming"", ""evaluation"", ""cybersecurity""]",5,Senior Developers & Tech Leads,"[""cloud computing"", ""web development"", ""machine learning"", ""data science""]",63,9,2025-10-25 21:44:28,en,How do you implement {keyword} in a production environment?,0.76,0.9070982857873181,0.83
34300665,cloud computing,it,What are the key components of a cloud computing implementation?,implementation,Beginner,"[""Introduction to cloud computing"", ""Key concepts and definitions"", ""Main categories or types"", ""Examples and case studies"", ""Benefits and advantages"", ""Summary and recommendations""]","[""computing"", ""it"", ""implementation"", ""programming"", ""cloud"", ""technology""]",6,Students & Entry-level Developers,"[""machine learning"", ""cybersecurity"", ""data science"", ""web development""]",64,10,2025-10-25 21:44:28,en,What are the key components of a {keyword} implementation?,0.68,0.4204664410828217,0.67
34300666,investment planning,economics,How do you hedge against investment planning market downturns?,optimization,Intermediate,"[""Overview of investment planning"", ""Step-by-step implementation"", ""Best practices and tips"", ""Common challenges and solutions"", ""Tools and resources needed"", ""Conclusion and next steps""]","[""investment"", ""planning"", ""finance"", ""optimization"", ""economics""]",6,Individual Investors & Analysts,"[""market analysis"", ""portfolio management"", ""financial modeling""]",62,9,2025-10-25 21:44:28,en,How do you hedge against {keyword} market downturns?,0.8,0.6978315889119954,0.85
34300667,market analysis,economics,What strategies work best for market analysis investment?,best_practice,Beginner,"[""Introduction to market analysis"", ""Key points and analysis"", ""Practical examples"", ""Expert insights"", ""Action items"", ""Conclusion""]","[""finance"", ""analysis"", ""best_practice"", ""market"", ""economics""]",4,Students & New Investors,"[""investment planning"", ""portfolio management"", ""financial modeling""]",57,8,2025-10-25 21:44:28,en,What strategies work best for {keyword} investment?,0.86,0.44437205540064506,0.77
34300668,social media,marketing,How do you track and analyze social media performance?,how_to,Intermediate,"[""Overview of social media"", ""Step-by-step implementation"", ""Best practices and tips"", ""Common challenges and solutions"", ""Tools and resources needed"", ""Conclusion and next steps""]","[""how_to"", ""media"", ""promotion"", ""marketing"", ""social"", ""branding""]",6,Marketing Coordinators & Specialists,"[""digital marketing"", ""brand management"", ""content marketing""]",54,9,2025-10-25 21:44:28,en,How do you track and analyze {keyword} performance?,0.73,0.6369062825837113,0.88
34300669,social media,marketing,What timing strategies work for social media?,analysis,Beginner,"[""Introduction to social media"", ""Key points and analysis"", ""Practical examples"", ""Expert insights"", ""Action items"", ""Conclusion""]","[""analysis"", ""media"", ""promotion"", ""digital"", ""marketing"", ""social""]",4,Marketing Students & Interns,"[""content marketing"", ""digital marketing"", ""brand management""]",45,7,2025-10-25 21:44:28,en,What timing strategies work for {keyword}?,0.92,0.48763779110151606,0.36
34300670,machine learning,it,How do you troubleshoot common issues with machine learning?,comparison,Expert,"[""Overview of machine learning"", ""Step-by-step implementation"", ""Best practices and tips"", ""Common challenges and solutions"", ""Tools and resources needed"", ""Conclusion and next steps""]","[""it"", ""comparison"", ""programming"", ""learning"", ""machine"", ""technology""]",6,Architects & Technical Directors,"[""data science"", ""cloud computing"", ""cybersecurity"", ""web development""]",60,9,2025-10-25 21:44:28,en,How do you troubleshoot common issues with {keyword}?,0.9,1.0,0.52
34300671,brand management,marketing,How do you personalize brand management for different segments?,analysis,Advanced,"[""Overview of brand management"", ""Step-by-step implementation"", ""Best practices and tips"", ""Common challenges and solutions"", ""Tools and resources needed"", ""Conclusion and next steps""]","[""analysis"", ""marketing"", ""management"", ""advertising"", ""branding"", ""brand""]",6,Marketing Managers & Strategists,"[""digital marketing"", ""content marketing"", ""social media""]",63,9,2025-10-25 21:44:28,en,How do you personalize {keyword} for different segments?,0.84,0.9759276381553345,0.64
34300672,social media,marketing,What messaging works best in social media campaigns?,strategy,Advanced,"[""Introduction to social media"", ""Key points and analysis"", ""Practical examples"", ""Expert insights"", ""Action items"", ""Conclusion""]","[""media"", ""marketing"", ""social"", ""advertising"", ""branding"", ""strategy""]",4,Marketing Managers & Strategists,"[""brand management"", ""content marketing"", ""digital marketing""]",52,8,2025-10-25 21:44:28,en,What messaging works best in {keyword} campaigns?,0.64,0.9477613902743328,0.84
34300673,brand management,marketing,What does the future hold for brand management?,optimization,Intermediate,"[""Introduction to brand management"", ""Key points and analysis"", ""Practical examples"", ""Expert insights"", ""Action items"", ""Conclusion""]","[""marketing"", ""management"", ""advertising"", ""branding"", ""optimization"", ""brand""]",4,Marketing Coordinators & Specialists,"[""digital marketing"", ""content marketing"", ""social media""]",47,8,2025-10-25 21:44:28,en,What does the future hold for {keyword}?,0.76,0.713628832021043,0.75
34300674,investment planning,economics,How do economic conditions affect investment planning performance?,planning,Intermediate,"[""Introduction to investment planning"", ""Key points and analysis"", ""Practical examples"", ""Expert insights"", ""Action items"", ""Conclusion""]","[""investment"", ""planning"", ""finance"", ""market"", ""economics""]",4,Individual Investors & Analysts,"[""market analysis"", ""financial modeling"", ""portfolio management""]",66,8,2025-10-25 21:44:28,en,How do economic conditions affect {keyword} performance?,0.7,0.6649573080827893,0.7
34300675,content marketing,marketing,How do you track and analyze content marketing performance?,comparison,Beginner,"[""Overview of content marketing"", ""Step-by-step implementation"", ""Best practices and tips"", ""Common challenges and solutions"", ""Tools and resources needed"", ""Conclusion and next steps""]","[""content"", ""promotion"", ""comparison"", ""marketing"", ""digital""]",6,Marketing Students & Interns,"[""social media"", ""digital marketing"", ""brand management""]",59,9,2025-10-25 21:44:28,en,How do you track and analyze {keyword} performance?,0.83,0.47817941645661166,0.72
34300676,financial modeling,economics,What exit strategies should be considered for financial modeling?,optimization,Beginner,"[""Introduction to financial modeling"", ""Key points and analysis"", ""Practical examples"", ""Expert insights"", ""Action items"", ""Conclusion""]","[""investment"", ""modeling"", ""financial"", ""market"", ""optimization"", ""economics""]",4,Students & New Investors,"[""portfolio management"", ""investment planning"", ""market analysis""]",65,9,2025-10-25 21:44:28,en,What exit strategies should be considered for {keyword}?,0.67,0.3967522748989938,0.46
34300677,market analysis,economics,What indicators predict market analysis market movements?,planning,Expert,"[""Introduction to market analysis"", ""Key points and analysis"", ""Practical examples"", ""Expert insights"", ""Action items"", ""Conclusion""]","[""planning"", ""finance"", ""analysis"", ""market"", ""business"", ""economics""]",4,Portfolio Managers & Financial Experts,"[""investment planning"", ""portfolio management"", ""financial modeling""]",57,7,2025-10-25 21:44:28,en,What indicators predict {keyword} market movements?,0.88,1.0,0.57
34300678,portfolio management,economics,What timeline is realistic for portfolio management returns?,comparison,Beginner,"[""Introduction to portfolio management"", ""Key points and analysis"", ""Practical examples"", ""Expert insights"", ""Action items"", ""Conclusion""]","[""investment"", ""portfolio"", ""comparison"", ""management"", ""business"", ""economics""]",4,Students & New Investors,"[""investment planning"", ""market analysis"", ""financial modeling""]",60,8,2025-10-25 21:44:28,en,What timeline is realistic for {keyword} returns?,0.91,0.36209186236493546,0.76
34300679,financial modeling,economics,What factors should be considered when evaluating financial modeling?,strategy,Expert,"[""Introduction to financial modeling"", ""Key points and analysis"", ""Practical examples"", ""Expert insights"", ""Action items"", ""Conclusion""]","[""finance"", ""modeling"", ""financial"", ""market"", ""strategy"", ""economics""]",4,Portfolio Managers & Financial Experts,"[""market analysis"", ""investment planning"", ""portfolio management""]",69,9,2025-10-25 21:44:28,en,What factors should be considered when evaluating {keyword}?,0.72,1.0,0.63
34300680,machine learning,it,What tools are essential for machine learning development?,analysis,Advanced,"[""Introduction to machine learning"", ""Key points and analysis"", ""Practical examples"", ""Expert insights"", ""Action items"", ""Conclusion""]","[""software"", ""analysis"", ""it"", ""learning"", ""machine"", ""technology""]",4,Senior Developers & Tech Leads,"[""data science"", ""cybersecurity"", ""cloud computing"", ""web development""]",58,8,2025-10-25 21:44:28,en,What tools are essential for {keyword} development?,0.61,0.9366617036110567,0.5
34300681,content marketing,marketing,How do you innovate within content marketing?,comparison,Intermediate,"[""Overview of content marketing"", ""Step-by-step implementation"", ""Best practices and tips"", ""Common challenges and solutions"", ""Tools and resources needed"", ""Conclusion and next steps""]","[""content"", ""comparison"", ""digital"", ""marketing"", ""branding""]",6,Marketing Coordinators & Specialists,"[""digital marketing"", ""social media"", ""brand management""]",45,7,2025-10-25 21:44:28,en,How do you innovate within {keyword}?,0.77,0.7224669196536798,0.54
34300682,financial modeling,economics,How do you identify opportunities in financial modeling markets?,planning,Expert,"[""Overview of financial modeling"", ""Step-by-step implementation"", ""Best practices and tips"", ""Common challenges and solutions"", ""Tools and resources needed"", ""Conclusion and next steps""]","[""investment"", ""planning"", ""modeling"", ""financial"", ""business"", ""economics""]",6,Portfolio Managers & Financial Experts,"[""portfolio management"", ""investment planning"", ""market analysis""]",64,9,2025-10-25 21:44:28,en,How do you identify opportunities in {keyword} markets?,0.75,1.0,0.85
34300683,financial modeling,economics,How do you assess and manage financial modeling risks?,evaluation,Beginner,"[""Overview of financial modeling"", ""Step-by-step implementation"", ""Best practices and tips"", ""Common challenges and solutions"", ""Tools and resources needed"", ""Conclusion and next steps""]","[""investment"", ""finance"", ""modeling"", ""financial"", ""evaluation"", ""economics""]",6,Students & New Investors,"[""portfolio management"", ""investment planning"", ""market analysis""]",54,9,2025-10-25 21:44:28,en,How do you assess and manage {keyword} risks?,0.84,0.44150393192708914,0.48
34300684,machine learning,it,How do you optimize machine learning for different platforms?,analysis,Advanced,"[""Overview of machine learning"", ""Step-by-step implementation"", ""Best practices and tips"", ""Common challenges and solutions"", ""Tools and resources needed"", ""Conclusion and next steps""]","[""development"", ""analysis"", ""it"", ""learning"", ""machine"", ""technology""]",6,Senior Developers & Tech Leads,"[""cybersecurity"", ""data science"", ""cloud computing"", ""web development""]",61,9,2025-10-25 21:44:28,en,How do you optimize {keyword} for different platforms?,0.64,0.9703655653218292,0.42
34300685,data science,it,How do you integrate data science with existing systems?,how_to,Intermediate,"[""Overview of data science"", ""Step-by-step implementation"", ""Best practices and tips"", ""Common challenges and solutions"", ""Tools and resources needed"", ""Conclusion and next steps""]","[""how_to"", ""technology"", ""it"", ""programming"", ""science"", ""data""]",6,Junior to Mid-level Developers,"[""web development"", ""cloud computing"", ""cybersecurity"", ""machine learning""]",56,9,2025-10-25 21:44:28,en,How do you integrate {keyword} with existing systems?,0.93,0.7715748815207835,0.83
34300686,data science,it,How do you convince stakeholders to invest in data science?,planning,Beginner,"[""Overview of data science"", ""Step-by-step implementation"", ""Best practices and tips"", ""Common challenges and solutions"", ""Tools and resources needed"", ""Conclusion and next steps""]","[""software"", ""planning"", ""it"", ""programming"", ""science"", ""data""]",6,Students & Entry-level Developers,"[""machine learning"", ""cybersecurity"", ""cloud computing"", ""web development""]",59,10,2025-10-25 21:44:28,en,How do you convince stakeholders to invest in {keyword}?,0.87,0.3136953643076181,0.38
34300687,investment planning,economics,How do you protect your investment planning investments?,best_practice,Advanced,"[""Overview of investment planning"", ""Step-by-step implementation"", ""Best practices and tips"", ""Common challenges and solutions"", ""Tools and resources needed"", ""Conclusion and next steps""]","[""investment"", ""planning"", ""best_practice"", ""business"", ""economics""]",6,Professional Investors & Advisors,"[""market analysis"", ""portfolio management"", ""financial modeling""]",56,8,2025-10-25 21:44:28,en,How do you protect your {keyword} investments?,0.72,0.867244700032895,0.54
34300688,machine learning,it,How do you integrate machine learning with existing systems?,how_to,Advanced,"[""Overview of machine learning"", ""Step-by-step implementation"", ""Best practices and tips"", ""Common challenges and solutions"", ""Tools and resources needed"", ""Conclusion and next steps""]","[""how_to"", ""it"", ""programming"", ""learning"", ""machine"", ""technology""]",6,Senior Developers & Tech Leads,"[""cloud computing"", ""web development"", ""cybersecurity"", ""data science""]",60,9,2025-10-25 21:44:28,en,How do you integrate {keyword} with existing systems?,0.61,0.8974702758764515,0.66
34300689,digital marketing,marketing,What KPIs are most important for digital marketing?,optimization,Expert,"[""Introduction to digital marketing"", ""Key points and analysis"", ""Practical examples"", ""Expert insights"", ""Action items"", ""Conclusion""]","[""marketing"", ""digital"", ""advertising"", ""branding"", ""optimization""]",4,Marketing Directors & CMOs,"[""social media"", ""content marketing"", ""brand management""]",51,8,2025-10-25 21:44:28,en,What KPIs are most important for {keyword}?,0.6,1.0,0.63
34300690,content marketing,marketing,How do you track and analyze content marketing performance?,analysis,Expert,"[""Overview of content marketing"", ""Step-by-step implementation"", ""Best practices and tips"", ""Common challenges and solutions"", ""Tools and resources needed"", ""Conclusion and next steps""]","[""content"", ""analysis"", ""marketing"", ""digital"", ""advertising""]",6,Marketing Directors & CMOs,"[""social media"", ""brand management"", ""digital marketing""]",59,9,2025-10-25 21:44:28,en,How do you track and analyze {keyword} performance?,0.88,1.0,0.49
34300691,portfolio management,economics,How do you protect your portfolio management investments?,best_practice,Intermediate,"[""Overview of portfolio management"", ""Step-by-step implementation"", ""Best practices and tips"", ""Common challenges and solutions"", ""Tools and resources needed"", ""Conclusion and next steps""]","[""investment"", ""portfolio"", ""best_practice"", ""management"", ""business"", ""economics""]",6,Individual Investors & Analysts,"[""financial modeling"", ""investment planning"", ""market analysis""]",57,8,2025-10-25 21:44:28,en,How do you protect your {keyword} investments?,0.63,0.7362863897194007,0.76
34300692,financial modeling,economics,What indicators predict financial modeling market movements?,troubleshooting,Intermediate,"[""Introduction to financial modeling"", ""Key points and analysis"", ""Practical examples"", ""Expert insights"", ""Action items"", ""Conclusion""]","[""investment"", ""troubleshooting"", ""modeling"", ""financial"", ""business"", ""economics""]",4,Individual Investors & Analysts,"[""portfolio management"", ""investment planning"", ""market analysis""]",60,7,2025-10-25 21:44:28,en,What indicators predict {keyword} market movements?,0.76,0.6651891903292438,0.32
34300693,financial modeling,economics,How do you analyze market trends in financial modeling?,best_practice,Beginner,"[""Overview of financial modeling"", ""Step-by-step implementation"", ""Best practices and tips"", ""Common challenges and solutions"", ""Tools and resources needed"", ""Conclusion and next steps""]","[""investment"", ""finance"", ""best_practice"", ""modeling"", ""financial"", ""economics""]",6,Students & New Investors,"[""investment planning"", ""portfolio management"", ""market analysis""]",55,9,2025-10-25 21:44:28,en,How do you analyze market trends in {keyword}?,0.79,0.3971571607612542,0.86
34300694,web development,it,What are the cost considerations for web development?,evaluation,Advanced,"[""Introduction to web development"", ""Key concepts and definitions"", ""Main categories or types"", ""Examples and case studies"", ""Benefits and advantages"", ""Summary and recommendations""]","[""software"", ""development"", ""it"", ""evaluation"", ""web""]",6,Senior Developers & Tech Leads,"[""cloud computing"", ""machine learning"", ""cybersecurity"", ""data science""]",53,8,2025-10-25 21:44:28,en,What are the cost considerations for {keyword}?,0.93,0.984144807363736,0.39
34300695,content marketing,marketing,How do you track and analyze content marketing performance?,how_to,Advanced,"[""Overview of content marketing"", ""Step-by-step implementation"", ""Best practices and tips"", ""Common challenges and solutions"", ""Tools and resources needed"", ""Conclusion and next steps""]","[""how_to"", ""content"", ""promotion"", ""marketing"", ""advertising""]",6,Marketing Managers & Strategists,"[""social media"", ""brand management"", ""digital marketing""]",59,9,2025-10-25 21:44:28,en,How do you track and analyze {keyword} performance?,0.83,0.8584612814059698,0.85
