record_id,keyword,category,question,question_type,difficulty_level,answer_outline,tags,estimated_read_time,target_audience,related_topics,question_length,word_count,created_date,language,source_template,engagement_score,complexity_score,popularity_score
34700001,brand management,marketing,How do you reach new customers through brand management?,optimization,Advanced,"[""Overview of brand management"", ""Step-by-step implementation"", ""Best practices and tips"", ""Common challenges and solutions"", ""Tools and resources needed"", ""Conclusion and next steps""]","[""promotion"", ""digital"", ""marketing"", ""management"", ""optimization"", ""brand""]",6,Marketing Managers & Strategists,"[""content marketing"", ""digital marketing"", ""social media""]",56,9,2025-10-25 21:45:02,en,How do you reach new customers through {keyword}?,0.79,0.8083296898215491,0.4
34700002,content marketing,marketing,What demographics respond best to content marketing?,planning,Beginner,"[""Introduction to content marketing"", ""Key points and analysis"", ""Practical examples"", ""Expert insights"", ""Action items"", ""Conclusion""]","[""planning"", ""content"", ""promotion"", ""marketing"", ""digital""]",4,Marketing Students & Interns,"[""digital marketing"", ""social media"", ""brand management""]",52,7,2025-10-25 21:45:02,en,What demographics respond best to {keyword}?,0.94,0.35811544935649064,0.32
34700003,market analysis,economics,How do you hedge against market analysis market downturns?,best_practice,Advanced,"[""Overview of market analysis"", ""Step-by-step implementation"", ""Best practices and tips"", ""Common challenges and solutions"", ""Tools and resources needed"", ""Conclusion and next steps""]","[""investment"", ""analysis"", ""best_practice"", ""market"", ""business"", ""economics""]",6,Professional Investors & Advisors,"[""financial modeling"", ""investment planning"", ""portfolio management""]",58,9,2025-10-25 21:45:02,en,How do you hedge against {keyword} market downturns?,0.79,0.9950701833284282,0.66
34700004,financial modeling,economics,What are the risks associated with financial modeling?,how_to,Intermediate,"[""Introduction to financial modeling"", ""Key concepts and definitions"", ""Main categories or types"", ""Examples and case studies"", ""Benefits and advantages"", ""Summary and recommendations""]","[""investment"", ""how_to"", ""modeling"", ""financial"", ""market"", ""economics""]",6,Individual Investors & Analysts,"[""portfolio management"", ""investment planning"", ""market analysis""]",54,8,2025-10-25 21:45:02,en,What are the risks associated with {keyword}?,0.69,0.7559236925998624,0.51
34700005,brand management,marketing,What does the future hold for brand management?,comparison,Beginner,"[""Introduction to brand management"", ""Key points and analysis"", ""Practical examples"", ""Expert insights"", ""Action items"", ""Conclusion""]","[""comparison"", ""digital"", ""marketing"", ""management"", ""branding"", ""brand""]",4,Marketing Students & Interns,"[""content marketing"", ""social media"", ""digital marketing""]",47,8,2025-10-25 21:45:02,en,What does the future hold for {keyword}?,0.74,0.4823966322241745,0.56
34700006,web development,it,How do you convince stakeholders to invest in web development?,best_practice,Expert,"[""Overview of web development"", ""Step-by-step implementation"", ""Best practices and tips"", ""Common challenges and solutions"", ""Tools and resources needed"", ""Conclusion and next steps""]","[""software"", ""development"", ""it"", ""programming"", ""best_practice"", ""web""]",6,Architects & Technical Directors,"[""machine learning"", ""cybersecurity"", ""data science"", ""cloud computing""]",62,10,2025-10-25 21:45:02,en,How do you convince stakeholders to invest in {keyword}?,0.89,1.0,0.82
34700007,investment planning,economics,What are the risks associated with investment planning?,planning,Advanced,"[""Introduction to investment planning"", ""Key concepts and definitions"", ""Main categories or types"", ""Examples and case studies"", ""Benefits and advantages"", ""Summary and recommendations""]","[""investment"", ""planning"", ""finance"", ""business"", ""economics""]",6,Professional Investors & Advisors,"[""portfolio management"", ""financial modeling"", ""market analysis""]",55,8,2025-10-25 21:45:02,en,What are the risks associated with {keyword}?,0.8,0.8305887649258774,0.49
34700008,investment planning,economics,What factors should be considered when evaluating investment planning?,optimization,Advanced,"[""Introduction to investment planning"", ""Key points and analysis"", ""Practical examples"", ""Expert insights"", ""Action items"", ""Conclusion""]","[""investment"", ""planning"", ""business"", ""market"", ""optimization"", ""economics""]",4,Professional Investors & Advisors,"[""portfolio management"", ""market analysis"", ""financial modeling""]",70,9,2025-10-25 21:45:02,en,What factors should be considered when evaluating {keyword}?,0.93,0.9417231224425608,0.79
34700009,data science,it,How does data science impact business operations?,strategy,Intermediate,"[""Introduction to data science"", ""Key points and analysis"", ""Practical examples"", ""Expert insights"", ""Action items"", ""Conclusion""]","[""software"", ""development"", ""it"", ""science"", ""strategy"", ""data""]",4,Junior to Mid-level Developers,"[""machine learning"", ""cloud computing"", ""cybersecurity"", ""web development""]",49,7,2025-10-25 21:45:02,en,How does {keyword} impact business operations?,0.73,0.6425700226973735,0.82
34700010,web development,it,What certifications are valuable for web development professionals?,planning,Beginner,"[""Introduction to web development"", ""Key points and analysis"", ""Practical examples"", ""Expert insights"", ""Action items"", ""Conclusion""]","[""software"", ""planning"", ""development"", ""it"", ""web""]",4,Students & Entry-level Developers,"[""machine learning"", ""cybersecurity"", ""data science"", ""cloud computing""]",67,8,2025-10-25 21:45:02,en,What certifications are valuable for {keyword} professionals?,0.71,0.45033154793897545,0.7
34700011,financial modeling,economics,What timeline is realistic for financial modeling returns?,evaluation,Advanced,"[""Introduction to financial modeling"", ""Key points and analysis"", ""Practical examples"", ""Expert insights"", ""Action items"", ""Conclusion""]","[""investment"", ""modeling"", ""financial"", ""evaluation"", ""business"", ""economics""]",4,Professional Investors & Advisors,"[""portfolio management"", ""market analysis"", ""investment planning""]",58,8,2025-10-25 21:45:02,en,What timeline is realistic for {keyword} returns?,0.71,0.9346160217241009,0.4
34700012,data science,it,What design patterns work best with data science?,troubleshooting,Expert,"[""Introduction to data science"", ""Key points and analysis"", ""Practical examples"", ""Expert insights"", ""Action items"", ""Conclusion""]","[""technology"", ""it"", ""programming"", ""troubleshooting"", ""science"", ""data""]",4,Architects & Technical Directors,"[""cloud computing"", ""web development"", ""cybersecurity"", ""machine learning""]",49,8,2025-10-25 21:45:02,en,What design patterns work best with {keyword}?,0.61,1.0,0.55
34700013,financial modeling,economics,How do you diversify your portfolio using financial modeling?,optimization,Expert,"[""Overview of financial modeling"", ""Step-by-step implementation"", ""Best practices and tips"", ""Common challenges and solutions"", ""Tools and resources needed"", ""Conclusion and next steps""]","[""finance"", ""modeling"", ""financial"", ""business"", ""optimization"", ""economics""]",6,Portfolio Managers & Financial Experts,"[""investment planning"", ""portfolio management"", ""market analysis""]",61,9,2025-10-25 21:45:02,en,How do you diversify your portfolio using {keyword}?,0.93,1.0,0.3
34700014,social media,marketing,What A/B tests should you run for social media?,analysis,Beginner,"[""Introduction to social media"", ""Key points and analysis"", ""Practical examples"", ""Expert insights"", ""Action items"", ""Conclusion""]","[""analysis"", ""media"", ""promotion"", ""marketing"", ""digital"", ""social""]",4,Marketing Students & Interns,"[""digital marketing"", ""content marketing"", ""brand management""]",47,9,2025-10-25 21:45:02,en,What A/B tests should you run for {keyword}?,0.93,0.4050630107812051,0.54
34700015,brand management,marketing,How do you optimize brand management for mobile users?,implementation,Advanced,"[""Overview of brand management"", ""Step-by-step implementation"", ""Best practices and tips"", ""Common challenges and solutions"", ""Tools and resources needed"", ""Conclusion and next steps""]","[""implementation"", ""promotion"", ""marketing"", ""digital"", ""management"", ""brand""]",6,Marketing Managers & Strategists,"[""digital marketing"", ""social media"", ""content marketing""]",54,9,2025-10-25 21:45:02,en,How do you optimize {keyword} for mobile users?,0.68,0.9503802385034619,0.73
34700016,cloud computing,it,What are the best practices for cloud computing development?,implementation,Beginner,"[""Introduction to cloud computing"", ""Key concepts and definitions"", ""Main categories or types"", ""Examples and case studies"", ""Benefits and advantages"", ""Summary and recommendations""]","[""computing"", ""software"", ""development"", ""it"", ""implementation"", ""cloud""]",6,Students & Entry-level Developers,"[""machine learning"", ""web development"", ""cybersecurity"", ""data science""]",60,9,2025-10-25 21:45:02,en,What are the best practices for {keyword} development?,0.69,0.3658658024688621,0.87
34700017,cybersecurity,it,How does cybersecurity impact business operations?,comparison,Expert,"[""Introduction to cybersecurity"", ""Key points and analysis"", ""Practical examples"", ""Expert insights"", ""Action items"", ""Conclusion""]","[""software"", ""it"", ""comparison"", ""cybersecurity"", ""technology""]",4,Architects & Technical Directors,"[""web development"", ""machine learning"", ""cloud computing"", ""data science""]",50,6,2025-10-25 21:45:02,en,How does {keyword} impact business operations?,0.6,1.0,0.59
34700018,market analysis,economics,How do you protect your market analysis investments?,planning,Advanced,"[""Overview of market analysis"", ""Step-by-step implementation"", ""Best practices and tips"", ""Common challenges and solutions"", ""Tools and resources needed"", ""Conclusion and next steps""]","[""investment"", ""planning"", ""analysis"", ""market"", ""economics""]",6,Professional Investors & Advisors,"[""financial modeling"", ""portfolio management"", ""investment planning""]",52,8,2025-10-25 21:45:02,en,How do you protect your {keyword} investments?,0.84,0.82127508280908,0.49
34700019,investment planning,economics,What are the seasonal patterns in investment planning?,optimization,Intermediate,"[""Introduction to investment planning"", ""Key concepts and definitions"", ""Main categories or types"", ""Examples and case studies"", ""Benefits and advantages"", ""Summary and recommendations""]","[""investment"", ""planning"", ""market"", ""optimization"", ""economics""]",6,Individual Investors & Analysts,"[""market analysis"", ""financial modeling"", ""portfolio management""]",54,8,2025-10-25 21:45:02,en,What are the seasonal patterns in {keyword}?,0.75,0.7482236930868821,0.57
34700020,cloud computing,it,How do you integrate cloud computing with existing systems?,comparison,Beginner,"[""Overview of cloud computing"", ""Step-by-step implementation"", ""Best practices and tips"", ""Common challenges and solutions"", ""Tools and resources needed"", ""Conclusion and next steps""]","[""computing"", ""software"", ""development"", ""it"", ""comparison"", ""cloud""]",6,Students & Entry-level Developers,"[""data science"", ""web development"", ""machine learning"", ""cybersecurity""]",59,9,2025-10-25 21:45:02,en,How do you integrate {keyword} with existing systems?,0.86,0.32090433094088316,0.83
34700021,web development,it,What are the cost considerations for web development?,optimization,Beginner,"[""Introduction to web development"", ""Key concepts and definitions"", ""Main categories or types"", ""Examples and case studies"", ""Benefits and advantages"", ""Summary and recommendations""]","[""development"", ""web"", ""it"", ""optimization"", ""technology""]",6,Students & Entry-level Developers,"[""machine learning"", ""data science"", ""cloud computing"", ""cybersecurity""]",53,8,2025-10-25 21:45:02,en,What are the cost considerations for {keyword}?,0.73,0.32953535853860316,0.79
34700022,machine learning,it,How do you choose the right technology stack for machine learning?,analysis,Beginner,"[""Overview of machine learning"", ""Step-by-step implementation"", ""Best practices and tips"", ""Common challenges and solutions"", ""Tools and resources needed"", ""Conclusion and next steps""]","[""software"", ""analysis"", ""it"", ""development"", ""learning"", ""machine""]",6,Students & Entry-level Developers,"[""cloud computing"", ""data science"", ""cybersecurity"", ""web development""]",66,11,2025-10-25 21:45:02,en,How do you choose the right technology stack for {keyword}?,0.76,0.41842665599492007,0.76
34700023,content marketing,marketing,What KPIs are most important for content marketing?,best_practice,Beginner,"[""Introduction to content marketing"", ""Key points and analysis"", ""Practical examples"", ""Expert insights"", ""Action items"", ""Conclusion""]","[""content"", ""promotion"", ""best_practice"", ""marketing"", ""branding""]",4,Marketing Students & Interns,"[""social media"", ""digital marketing"", ""brand management""]",51,8,2025-10-25 21:45:02,en,What KPIs are most important for {keyword}?,0.69,0.3323990069295652,0.44
34700024,financial modeling,economics,What indicators predict financial modeling market movements?,how_to,Advanced,"[""Introduction to financial modeling"", ""Key points and analysis"", ""Practical examples"", ""Expert insights"", ""Action items"", ""Conclusion""]","[""investment"", ""how_to"", ""modeling"", ""financial"", ""business"", ""economics""]",4,Professional Investors & Advisors,"[""portfolio management"", ""investment planning"", ""market analysis""]",60,7,2025-10-25 21:45:02,en,What indicators predict {keyword} market movements?,0.69,0.9614645268787981,0.53
34700025,content marketing,marketing,What A/B tests should you run for content marketing?,planning,Intermediate,"[""Introduction to content marketing"", ""Key points and analysis"", ""Practical examples"", ""Expert insights"", ""Action items"", ""Conclusion""]","[""planning"", ""content"", ""promotion"", ""marketing"", ""advertising""]",4,Marketing Coordinators & Specialists,"[""digital marketing"", ""brand management"", ""social media""]",52,9,2025-10-25 21:45:02,en,What A/B tests should you run for {keyword}?,0.74,0.7616733800849065,0.63
34700026,social media,marketing,How do you create a social media roadmap?,evaluation,Beginner,"[""Overview of social media"", ""Step-by-step implementation"", ""Best practices and tips"", ""Common challenges and solutions"", ""Tools and resources needed"", ""Conclusion and next steps""]","[""media"", ""marketing"", ""digital"", ""social"", ""branding"", ""evaluation""]",6,Marketing Students & Interns,"[""brand management"", ""content marketing"", ""digital marketing""]",41,8,2025-10-25 21:45:02,en,How do you create a {keyword} roadmap?,0.8,0.4804430499493988,0.4
34700027,digital marketing,marketing,How do you innovate within digital marketing?,optimization,Beginner,"[""Overview of digital marketing"", ""Step-by-step implementation"", ""Best practices and tips"", ""Common challenges and solutions"", ""Tools and resources needed"", ""Conclusion and next steps""]","[""marketing"", ""optimization"", ""promotion"", ""digital""]",6,Marketing Students & Interns,"[""brand management"", ""content marketing"", ""social media""]",45,7,2025-10-25 21:45:02,en,How do you innovate within {keyword}?,0.95,0.4663975258086904,0.73
34700028,financial modeling,economics,How do you hedge against financial modeling market downturns?,comparison,Intermediate,"[""Overview of financial modeling"", ""Step-by-step implementation"", ""Best practices and tips"", ""Common challenges and solutions"", ""Tools and resources needed"", ""Conclusion and next steps""]","[""investment"", ""finance"", ""comparison"", ""modeling"", ""financial"", ""economics""]",6,Individual Investors & Analysts,"[""portfolio management"", ""investment planning"", ""market analysis""]",61,9,2025-10-25 21:45:02,en,How do you hedge against {keyword} market downturns?,0.62,0.6451012467163418,0.67
34700029,portfolio management,economics,What indicators predict portfolio management market movements?,comparison,Intermediate,"[""Introduction to portfolio management"", ""Key points and analysis"", ""Practical examples"", ""Expert insights"", ""Action items"", ""Conclusion""]","[""investment"", ""finance"", ""portfolio"", ""comparison"", ""management"", ""economics""]",4,Individual Investors & Analysts,"[""investment planning"", ""market analysis"", ""financial modeling""]",62,7,2025-10-25 21:45:02,en,What indicators predict {keyword} market movements?,0.77,0.6073265602108926,0.48
34700030,machine learning,it,How do you implement machine learning in a production environment?,troubleshooting,Intermediate,"[""Overview of machine learning"", ""Step-by-step implementation"", ""Best practices and tips"", ""Common challenges and solutions"", ""Tools and resources needed"", ""Conclusion and next steps""]","[""software"", ""it"", ""programming"", ""troubleshooting"", ""learning"", ""machine""]",6,Junior to Mid-level Developers,"[""cybersecurity"", ""cloud computing"", ""web development"", ""data science""]",66,10,2025-10-25 21:45:02,en,How do you implement {keyword} in a production environment?,0.82,0.6311262378963244,0.8
34700031,brand management,marketing,How do you reach new customers through brand management?,strategy,Beginner,"[""Overview of brand management"", ""Step-by-step implementation"", ""Best practices and tips"", ""Common challenges and solutions"", ""Tools and resources needed"", ""Conclusion and next steps""]","[""promotion"", ""digital"", ""marketing"", ""management"", ""strategy"", ""brand""]",6,Marketing Students & Interns,"[""digital marketing"", ""content marketing"", ""social media""]",56,9,2025-10-25 21:45:02,en,How do you reach new customers through {keyword}?,0.84,0.440089199461066,0.76
34700032,machine learning,it,What are the latest trends in machine learning technology?,evaluation,Beginner,"[""Introduction to machine learning"", ""Key concepts and definitions"", ""Main categories or types"", ""Examples and case studies"", ""Benefits and advantages"", ""Summary and recommendations""]","[""software"", ""it"", ""learning"", ""evaluation"", ""machine"", ""technology""]",6,Students & Entry-level Developers,"[""data science"", ""cloud computing"", ""web development"", ""cybersecurity""]",58,9,2025-10-25 21:45:02,en,What are the latest trends in {keyword} technology?,0.89,0.4414481888858412,0.38
34700033,content marketing,marketing,How do you optimize content marketing for mobile users?,implementation,Expert,"[""Overview of content marketing"", ""Step-by-step implementation"", ""Best practices and tips"", ""Common challenges and solutions"", ""Tools and resources needed"", ""Conclusion and next steps""]","[""content"", ""implementation"", ""marketing"", ""digital"", ""branding""]",6,Marketing Directors & CMOs,"[""social media"", ""brand management"", ""digital marketing""]",55,9,2025-10-25 21:45:02,en,How do you optimize {keyword} for mobile users?,0.95,1.0,0.74
34700034,portfolio management,economics,What are the risks associated with portfolio management?,implementation,Advanced,"[""Introduction to portfolio management"", ""Key concepts and definitions"", ""Main categories or types"", ""Examples and case studies"", ""Benefits and advantages"", ""Summary and recommendations""]","[""investment"", ""finance"", ""implementation"", ""portfolio"", ""management"", ""economics""]",6,Professional Investors & Advisors,"[""market analysis"", ""investment planning"", ""financial modeling""]",56,8,2025-10-25 21:45:02,en,What are the risks associated with {keyword}?,0.9,0.8984256703588764,0.67
34700035,social media,marketing,How do you innovate within social media?,planning,Intermediate,"[""Overview of social media"", ""Step-by-step implementation"", ""Best practices and tips"", ""Common challenges and solutions"", ""Tools and resources needed"", ""Conclusion and next steps""]","[""planning"", ""media"", ""promotion"", ""marketing"", ""social"", ""advertising""]",6,Marketing Coordinators & Specialists,"[""digital marketing"", ""content marketing"", ""brand management""]",40,7,2025-10-25 21:45:02,en,How do you innovate within {keyword}?,0.77,0.7262395817604794,0.61
34700036,social media,marketing,What content types work best for social media?,troubleshooting,Beginner,"[""Introduction to social media"", ""Key points and analysis"", ""Practical examples"", ""Expert insights"", ""Action items"", ""Conclusion""]","[""media"", ""troubleshooting"", ""digital"", ""marketing"", ""social"", ""advertising""]",4,Marketing Students & Interns,"[""content marketing"", ""digital marketing"", ""brand management""]",46,8,2025-10-25 21:45:02,en,What content types work best for {keyword}?,0.94,0.4113718338229908,0.86
34700037,web development,it,How do you stay updated with web development developments?,how_to,Intermediate,"[""Overview of web development"", ""Step-by-step implementation"", ""Best practices and tips"", ""Common challenges and solutions"", ""Tools and resources needed"", ""Conclusion and next steps""]","[""how_to"", ""development"", ""web"", ""it"", ""technology""]",6,Junior to Mid-level Developers,"[""cloud computing"", ""machine learning"", ""cybersecurity"", ""data science""]",58,9,2025-10-25 21:45:02,en,How do you stay updated with {keyword} developments?,0.73,0.7957314406513927,0.45
34700038,brand management,marketing,What A/B tests should you run for brand management?,analysis,Intermediate,"[""Introduction to brand management"", ""Key points and analysis"", ""Practical examples"", ""Expert insights"", ""Action items"", ""Conclusion""]","[""analysis"", ""promotion"", ""marketing"", ""management"", ""branding"", ""brand""]",4,Marketing Coordinators & Specialists,"[""digital marketing"", ""content marketing"", ""social media""]",51,9,2025-10-25 21:45:02,en,What A/B tests should you run for {keyword}?,0.75,0.618195639035047,0.74
34700039,portfolio management,economics,How does global economics impact portfolio management?,optimization,Beginner,"[""Introduction to portfolio management"", ""Key points and analysis"", ""Practical examples"", ""Expert insights"", ""Action items"", ""Conclusion""]","[""finance"", ""portfolio"", ""management"", ""business"", ""optimization"", ""economics""]",4,Students & New Investors,"[""investment planning"", ""financial modeling"", ""market analysis""]",54,7,2025-10-25 21:45:02,en,How does global economics impact {keyword}?,0.75,0.4906186582628853,0.5
34700040,machine learning,it,What career opportunities exist in machine learning?,planning,Intermediate,"[""Introduction to machine learning"", ""Key points and analysis"", ""Practical examples"", ""Expert insights"", ""Action items"", ""Conclusion""]","[""software"", ""planning"", ""it"", ""learning"", ""machine"", ""technology""]",4,Junior to Mid-level Developers,"[""web development"", ""data science"", ""cloud computing"", ""cybersecurity""]",52,7,2025-10-25 21:45:02,en,What career opportunities exist in {keyword}?,0.76,0.6180435249097945,0.68
34700041,digital marketing,marketing,What KPIs are most important for digital marketing?,evaluation,Intermediate,"[""Introduction to digital marketing"", ""Key points and analysis"", ""Practical examples"", ""Expert insights"", ""Action items"", ""Conclusion""]","[""promotion"", ""marketing"", ""digital"", ""advertising"", ""evaluation""]",4,Marketing Coordinators & Specialists,"[""social media"", ""brand management"", ""content marketing""]",51,8,2025-10-25 21:45:02,en,What KPIs are most important for {keyword}?,0.6,0.6815818203002775,0.69
34700042,content marketing,marketing,What are the latest trends in content marketing?,planning,Intermediate,"[""Introduction to content marketing"", ""Key concepts and definitions"", ""Main categories or types"", ""Examples and case studies"", ""Benefits and advantages"", ""Summary and recommendations""]","[""planning"", ""content"", ""promotion"", ""marketing"", ""advertising""]",6,Marketing Coordinators & Specialists,"[""social media"", ""digital marketing"", ""brand management""]",48,8,2025-10-25 21:45:02,en,What are the latest trends in {keyword}?,0.76,0.7291708785363619,0.46
34700043,digital marketing,marketing,What emerging platforms support digital marketing?,strategy,Expert,"[""Introduction to digital marketing"", ""Key points and analysis"", ""Practical examples"", ""Expert insights"", ""Action items"", ""Conclusion""]","[""marketing"", ""strategy"", ""promotion"", ""digital""]",4,Marketing Directors & CMOs,"[""content marketing"", ""brand management"", ""social media""]",50,6,2025-10-25 21:45:02,en,What emerging platforms support {keyword}?,0.76,1.0,0.41
34700044,cloud computing,it,How do you choose the right technology stack for cloud computing?,analysis,Beginner,"[""Overview of cloud computing"", ""Step-by-step implementation"", ""Best practices and tips"", ""Common challenges and solutions"", ""Tools and resources needed"", ""Conclusion and next steps""]","[""computing"", ""analysis"", ""it"", ""programming"", ""cloud"", ""technology""]",6,Students & Entry-level Developers,"[""web development"", ""machine learning"", ""data science"", ""cybersecurity""]",65,11,2025-10-25 21:45:02,en,How do you choose the right technology stack for {keyword}?,0.95,0.41222216040644966,0.64
