record_id,keyword,category,question,question_type,difficulty_level,answer_outline,tags,estimated_read_time,target_audience,related_topics,question_length,word_count,created_date,language,source_template,engagement_score,complexity_score,popularity_score
38000653,cloud computing,it,What tools are essential for cloud computing development?,comparison,Expert,"[""Introduction to cloud computing"", ""Key points and analysis"", ""Practical examples"", ""Expert insights"", ""Action items"", ""Conclusion""]","[""computing"", ""software"", ""it"", ""comparison"", ""cloud"", ""technology""]",4,Architects & Technical Directors,"[""machine learning"", ""web development"", ""cybersecurity"", ""data science""]",57,8,2025-10-25 21:49:34,en,What tools are essential for {keyword} development?,0.82,1.0,0.55
38000654,brand management,marketing,How do you personalize brand management for different segments?,how_to,Advanced,"[""Overview of brand management"", ""Step-by-step implementation"", ""Best practices and tips"", ""Common challenges and solutions"", ""Tools and resources needed"", ""Conclusion and next steps""]","[""how_to"", ""promotion"", ""digital"", ""marketing"", ""management"", ""brand""]",6,Marketing Managers & Strategists,"[""content marketing"", ""social media"", ""digital marketing""]",63,9,2025-10-25 21:49:34,en,How do you personalize {keyword} for different segments?,0.9,0.9509661105954144,0.4
38000655,brand management,marketing,How do you improve brand management conversion rates?,optimization,Intermediate,"[""Overview of brand management"", ""Step-by-step implementation"", ""Best practices and tips"", ""Common challenges and solutions"", ""Tools and resources needed"", ""Conclusion and next steps""]","[""promotion"", ""marketing"", ""management"", ""branding"", ""optimization"", ""brand""]",6,Marketing Coordinators & Specialists,"[""social media"", ""digital marketing"", ""content marketing""]",53,8,2025-10-25 21:49:34,en,How do you improve {keyword} conversion rates?,0.65,0.7361204499632503,0.56
38000656,brand management,marketing,What timing strategies work for brand management?,best_practice,Advanced,"[""Introduction to brand management"", ""Key points and analysis"", ""Practical examples"", ""Expert insights"", ""Action items"", ""Conclusion""]","[""best_practice"", ""marketing"", ""management"", ""advertising"", ""branding"", ""brand""]",4,Marketing Managers & Strategists,"[""content marketing"", ""social media"", ""digital marketing""]",49,7,2025-10-25 21:49:34,en,What timing strategies work for {keyword}?,0.74,0.8883498879250107,0.53
38000657,content marketing,marketing,How do you reach new customers through content marketing?,analysis,Intermediate,"[""Overview of content marketing"", ""Step-by-step implementation"", ""Best practices and tips"", ""Common challenges and solutions"", ""Tools and resources needed"", ""Conclusion and next steps""]","[""content"", ""analysis"", ""marketing"", ""digital"", ""branding""]",6,Marketing Coordinators & Specialists,"[""social media"", ""brand management"", ""digital marketing""]",57,9,2025-10-25 21:49:34,en,How do you reach new customers through {keyword}?,0.91,0.6041829432362602,0.39
38000658,market analysis,economics,What factors should be considered when evaluating market analysis?,strategy,Advanced,"[""Introduction to market analysis"", ""Key points and analysis"", ""Practical examples"", ""Expert insights"", ""Action items"", ""Conclusion""]","[""analysis"", ""finance"", ""business"", ""market"", ""strategy"", ""economics""]",4,Professional Investors & Advisors,"[""portfolio management"", ""investment planning"", ""financial modeling""]",66,9,2025-10-25 21:49:34,en,What factors should be considered when evaluating {keyword}?,0.71,0.9862740898937278,0.87
38000659,digital marketing,marketing,What budget should be allocated to digital marketing?,optimization,Beginner,"[""Introduction to digital marketing"", ""Key points and analysis"", ""Practical examples"", ""Expert insights"", ""Action items"", ""Conclusion""]","[""marketing"", ""digital"", ""advertising"", ""branding"", ""optimization""]",4,Marketing Students & Interns,"[""content marketing"", ""brand management"", ""social media""]",53,8,2025-10-25 21:49:34,en,What budget should be allocated to {keyword}?,0.94,0.3751059766943835,0.8
38000660,content marketing,marketing,What A/B tests should you run for content marketing?,implementation,Intermediate,"[""Introduction to content marketing"", ""Key points and analysis"", ""Practical examples"", ""Expert insights"", ""Action items"", ""Conclusion""]","[""content"", ""implementation"", ""promotion"", ""marketing"", ""branding""]",4,Marketing Coordinators & Specialists,"[""digital marketing"", ""brand management"", ""social media""]",52,9,2025-10-25 21:49:34,en,What A/B tests should you run for {keyword}?,0.62,0.7702141836702417,0.69
38000661,cybersecurity,it,How do you design a scalable cybersecurity solution?,how_to,Expert,"[""Overview of cybersecurity"", ""Step-by-step implementation"", ""Best practices and tips"", ""Common challenges and solutions"", ""Tools and resources needed"", ""Conclusion and next steps""]","[""how_to"", ""software"", ""it"", ""cybersecurity"", ""technology""]",5,Architects & Technical Directors,"[""cloud computing"", ""web development"", ""machine learning"", ""data science""]",52,8,2025-10-25 21:49:34,en,How do you design a scalable {keyword} solution?,0.84,1.0,0.79
38000662,investment planning,economics,What strategies work best for investment planning investment?,best_practice,Intermediate,"[""Introduction to investment planning"", ""Key points and analysis"", ""Practical examples"", ""Expert insights"", ""Action items"", ""Conclusion""]","[""investment"", ""planning"", ""best_practice"", ""market"", ""economics""]",4,Individual Investors & Analysts,"[""market analysis"", ""financial modeling"", ""portfolio management""]",61,8,2025-10-25 21:49:34,en,What strategies work best for {keyword} investment?,0.78,0.7396673164578257,0.31
38000663,financial modeling,economics,What are the regulatory considerations for financial modeling?,analysis,Advanced,"[""Introduction to financial modeling"", ""Key concepts and definitions"", ""Main categories or types"", ""Examples and case studies"", ""Benefits and advantages"", ""Summary and recommendations""]","[""analysis"", ""finance"", ""modeling"", ""financial"", ""market"", ""economics""]",6,Professional Investors & Advisors,"[""market analysis"", ""investment planning"", ""portfolio management""]",62,8,2025-10-25 21:49:34,en,What are the regulatory considerations for {keyword}?,0.88,0.9659552085145162,0.74
38000664,market analysis,economics,What timeline is realistic for market analysis returns?,implementation,Expert,"[""Introduction to market analysis"", ""Key points and analysis"", ""Practical examples"", ""Expert insights"", ""Action items"", ""Conclusion""]","[""investment"", ""analysis"", ""implementation"", ""market"", ""business"", ""economics""]",4,Portfolio Managers & Financial Experts,"[""financial modeling"", ""portfolio management"", ""investment planning""]",55,8,2025-10-25 21:49:34,en,What timeline is realistic for {keyword} returns?,0.75,1.0,0.53
38000665,content marketing,marketing,What emerging platforms support content marketing?,strategy,Advanced,"[""Introduction to content marketing"", ""Key points and analysis"", ""Practical examples"", ""Expert insights"", ""Action items"", ""Conclusion""]","[""content"", ""promotion"", ""marketing"", ""advertising"", ""strategy""]",4,Marketing Managers & Strategists,"[""brand management"", ""social media"", ""digital marketing""]",50,6,2025-10-25 21:49:34,en,What emerging platforms support {keyword}?,0.82,0.8501588540468717,0.79
38000666,digital marketing,marketing,How do you optimize digital marketing for mobile users?,how_to,Beginner,"[""Overview of digital marketing"", ""Step-by-step implementation"", ""Best practices and tips"", ""Common challenges and solutions"", ""Tools and resources needed"", ""Conclusion and next steps""]","[""how_to"", ""promotion"", ""marketing"", ""digital"", ""advertising""]",6,Marketing Students & Interns,"[""content marketing"", ""brand management"", ""social media""]",55,9,2025-10-25 21:49:34,en,How do you optimize {keyword} for mobile users?,0.88,0.4213324685319967,0.48
38000667,digital marketing,marketing,What does the future hold for digital marketing?,best_practice,Advanced,"[""Introduction to digital marketing"", ""Key points and analysis"", ""Practical examples"", ""Expert insights"", ""Action items"", ""Conclusion""]","[""branding"", ""marketing"", ""best_practice"", ""digital""]",4,Marketing Managers & Strategists,"[""social media"", ""content marketing"", ""brand management""]",48,8,2025-10-25 21:49:34,en,What does the future hold for {keyword}?,0.84,0.8065767012690767,0.51
38000668,portfolio management,economics,What timeline is realistic for portfolio management returns?,evaluation,Beginner,"[""Introduction to portfolio management"", ""Key points and analysis"", ""Practical examples"", ""Expert insights"", ""Action items"", ""Conclusion""]","[""portfolio"", ""management"", ""evaluation"", ""market"", ""business"", ""economics""]",4,Students & New Investors,"[""investment planning"", ""market analysis"", ""financial modeling""]",60,8,2025-10-25 21:49:34,en,What timeline is realistic for {keyword} returns?,0.87,0.3290444546465214,0.71
38000669,portfolio management,economics,How do you create a long-term plan for portfolio management?,how_to,Intermediate,"[""Overview of portfolio management"", ""Step-by-step implementation"", ""Best practices and tips"", ""Common challenges and solutions"", ""Tools and resources needed"", ""Conclusion and next steps""]","[""investment"", ""how_to"", ""portfolio"", ""management"", ""business"", ""economics""]",6,Individual Investors & Analysts,"[""market analysis"", ""financial modeling"", ""investment planning""]",60,10,2025-10-25 21:49:34,en,How do you create a long-term plan for {keyword}?,0.72,0.6892567714218814,0.35
38000670,machine learning,it,How can machine learning improve system performance and scalability?,optimization,Expert,"[""Introduction to machine learning"", ""Key points and analysis"", ""Practical examples"", ""Expert insights"", ""Action items"", ""Conclusion""]","[""software"", ""it"", ""programming"", ""learning"", ""optimization"", ""machine""]",4,Architects & Technical Directors,"[""cloud computing"", ""web development"", ""cybersecurity"", ""data science""]",68,9,2025-10-25 21:49:34,en,How can {keyword} improve system performance and scalability?,0.67,1.0,0.89
38000671,social media,marketing,How do you improve social media conversion rates?,strategy,Expert,"[""Overview of social media"", ""Step-by-step implementation"", ""Best practices and tips"", ""Common challenges and solutions"", ""Tools and resources needed"", ""Conclusion and next steps""]","[""media"", ""marketing"", ""digital"", ""social"", ""branding"", ""strategy""]",6,Marketing Directors & CMOs,"[""content marketing"", ""digital marketing"", ""brand management""]",49,8,2025-10-25 21:49:34,en,How do you improve {keyword} conversion rates?,0.72,1.0,0.84
38000672,machine learning,it,How does machine learning impact business operations?,strategy,Beginner,"[""Introduction to machine learning"", ""Key points and analysis"", ""Practical examples"", ""Expert insights"", ""Action items"", ""Conclusion""]","[""software"", ""development"", ""it"", ""learning"", ""strategy"", ""machine""]",4,Students & Entry-level Developers,"[""cloud computing"", ""data science"", ""web development"", ""cybersecurity""]",53,7,2025-10-25 21:49:34,en,How does {keyword} impact business operations?,0.91,0.33598084005139794,0.42
38000673,financial modeling,economics,What insurance options are available for financial modeling?,comparison,Expert,"[""Introduction to financial modeling"", ""Key points and analysis"", ""Practical examples"", ""Expert insights"", ""Action items"", ""Conclusion""]","[""investment"", ""finance"", ""comparison"", ""modeling"", ""financial"", ""economics""]",4,Portfolio Managers & Financial Experts,"[""investment planning"", ""portfolio management"", ""market analysis""]",60,8,2025-10-25 21:49:34,en,What insurance options are available for {keyword}?,0.71,1.0,0.5
38000674,market analysis,economics,How do you diversify your portfolio using market analysis?,strategy,Beginner,"[""Overview of market analysis"", ""Step-by-step implementation"", ""Best practices and tips"", ""Common challenges and solutions"", ""Tools and resources needed"", ""Conclusion and next steps""]","[""investment"", ""analysis"", ""market"", ""strategy"", ""economics""]",6,Students & New Investors,"[""portfolio management"", ""financial modeling"", ""investment planning""]",58,9,2025-10-25 21:49:34,en,How do you diversify your portfolio using {keyword}?,0.81,0.45116600737043155,0.41
38000675,portfolio management,economics,What tools help analyze portfolio management data?,evaluation,Expert,"[""Introduction to portfolio management"", ""Key points and analysis"", ""Practical examples"", ""Expert insights"", ""Action items"", ""Conclusion""]","[""finance"", ""portfolio"", ""management"", ""evaluation"", ""business"", ""economics""]",4,Portfolio Managers & Financial Experts,"[""financial modeling"", ""investment planning"", ""market analysis""]",50,7,2025-10-25 21:49:34,en,What tools help analyze {keyword} data?,0.91,1.0,0.49
38000676,cloud computing,it,How do you design a scalable cloud computing solution?,how_to,Intermediate,"[""Overview of cloud computing"", ""Step-by-step implementation"", ""Best practices and tips"", ""Common challenges and solutions"", ""Tools and resources needed"", ""Conclusion and next steps""]","[""computing"", ""how_to"", ""software"", ""it"", ""programming"", ""cloud""]",6,Junior to Mid-level Developers,"[""web development"", ""data science"", ""machine learning"", ""cybersecurity""]",54,9,2025-10-25 21:49:34,en,How do you design a scalable {keyword} solution?,0.87,0.6734678484079619,0.67
38000677,cybersecurity,it,How do you optimize cybersecurity for different platforms?,comparison,Beginner,"[""Overview of cybersecurity"", ""Step-by-step implementation"", ""Best practices and tips"", ""Common challenges and solutions"", ""Tools and resources needed"", ""Conclusion and next steps""]","[""development"", ""it"", ""comparison"", ""cybersecurity"", ""technology""]",5,Students & Entry-level Developers,"[""machine learning"", ""web development"", ""cloud computing"", ""data science""]",58,8,2025-10-25 21:49:34,en,How do you optimize {keyword} for different platforms?,0.69,0.3616573158269719,0.76
38000678,brand management,marketing,How do you automate brand management processes?,optimization,Intermediate,"[""Overview of brand management"", ""Step-by-step implementation"", ""Best practices and tips"", ""Common challenges and solutions"", ""Tools and resources needed"", ""Conclusion and next steps""]","[""digital"", ""marketing"", ""management"", ""branding"", ""optimization"", ""brand""]",6,Marketing Coordinators & Specialists,"[""content marketing"", ""digital marketing"", ""social media""]",47,7,2025-10-25 21:49:34,en,How do you automate {keyword} processes?,0.72,0.7070860549650022,0.49
38000679,market analysis,economics,How do you analyze market trends in market analysis?,troubleshooting,Beginner,"[""Overview of market analysis"", ""Step-by-step implementation"", ""Best practices and tips"", ""Common challenges and solutions"", ""Tools and resources needed"", ""Conclusion and next steps""]","[""finance"", ""analysis"", ""troubleshooting"", ""market"", ""business"", ""economics""]",6,Students & New Investors,"[""financial modeling"", ""investment planning"", ""portfolio management""]",52,9,2025-10-25 21:49:34,en,How do you analyze market trends in {keyword}?,0.63,0.3108882540387964,0.85
38000680,portfolio management,economics,What insurance options are available for portfolio management?,evaluation,Expert,"[""Introduction to portfolio management"", ""Key points and analysis"", ""Practical examples"", ""Expert insights"", ""Action items"", ""Conclusion""]","[""finance"", ""portfolio"", ""management"", ""evaluation"", ""business"", ""economics""]",4,Portfolio Managers & Financial Experts,"[""investment planning"", ""financial modeling"", ""market analysis""]",62,8,2025-10-25 21:49:34,en,What insurance options are available for {keyword}?,0.8,1.0,0.48
38000681,cybersecurity,it,What tools are essential for cybersecurity development?,troubleshooting,Expert,"[""Introduction to cybersecurity"", ""Key points and analysis"", ""Practical examples"", ""Expert insights"", ""Action items"", ""Conclusion""]","[""development"", ""it"", ""programming"", ""troubleshooting"", ""cybersecurity""]",4,Architects & Technical Directors,"[""cloud computing"", ""data science"", ""web development"", ""machine learning""]",55,7,2025-10-25 21:49:34,en,What tools are essential for {keyword} development?,0.8,1.0,0.69
38000682,content marketing,marketing,How is AI changing content marketing approaches?,comparison,Advanced,"[""Introduction to content marketing"", ""Key points and analysis"", ""Practical examples"", ""Expert insights"", ""Action items"", ""Conclusion""]","[""content"", ""promotion"", ""comparison"", ""marketing"", ""digital""]",4,Marketing Managers & Strategists,"[""brand management"", ""social media"", ""digital marketing""]",48,7,2025-10-25 21:49:34,en,How is AI changing {keyword} approaches?,0.89,0.8148799517515891,0.61
38000683,brand management,marketing,How do you improve brand management conversion rates?,strategy,Advanced,"[""Overview of brand management"", ""Step-by-step implementation"", ""Best practices and tips"", ""Common challenges and solutions"", ""Tools and resources needed"", ""Conclusion and next steps""]","[""digital"", ""marketing"", ""management"", ""branding"", ""strategy"", ""brand""]",6,Marketing Managers & Strategists,"[""social media"", ""content marketing"", ""digital marketing""]",53,8,2025-10-25 21:49:34,en,How do you improve {keyword} conversion rates?,0.91,0.9006645324884686,0.69
38000684,brand management,marketing,What budget should be allocated to brand management?,strategy,Beginner,"[""Introduction to brand management"", ""Key points and analysis"", ""Practical examples"", ""Expert insights"", ""Action items"", ""Conclusion""]","[""digital"", ""marketing"", ""management"", ""branding"", ""strategy"", ""brand""]",4,Marketing Students & Interns,"[""social media"", ""digital marketing"", ""content marketing""]",52,8,2025-10-25 21:49:34,en,What budget should be allocated to {keyword}?,0.72,0.3931164016692296,0.52
38000685,market analysis,economics,What is the optimal allocation for market analysis in a portfolio?,strategy,Expert,"[""Introduction to market analysis"", ""Key points and analysis"", ""Practical examples"", ""Expert insights"", ""Action items"", ""Conclusion""]","[""investment"", ""finance"", ""analysis"", ""market"", ""strategy"", ""economics""]",4,Portfolio Managers & Financial Experts,"[""financial modeling"", ""portfolio management"", ""investment planning""]",66,11,2025-10-25 21:49:34,en,What is the optimal allocation for {keyword} in a portfolio?,0.89,1.0,0.32
38000686,market analysis,economics,How do you benchmark market analysis against alternatives?,implementation,Intermediate,"[""Overview of market analysis"", ""Step-by-step implementation"", ""Best practices and tips"", ""Common challenges and solutions"", ""Tools and resources needed"", ""Conclusion and next steps""]","[""investment"", ""analysis"", ""implementation"", ""market"", ""economics""]",6,Individual Investors & Analysts,"[""portfolio management"", ""investment planning"", ""financial modeling""]",58,8,2025-10-25 21:49:34,en,How do you benchmark {keyword} against alternatives?,0.65,0.6873193623506235,0.42
38000687,digital marketing,marketing,How do you improve digital marketing conversion rates?,optimization,Advanced,"[""Overview of digital marketing"", ""Step-by-step implementation"", ""Best practices and tips"", ""Common challenges and solutions"", ""Tools and resources needed"", ""Conclusion and next steps""]","[""promotion"", ""marketing"", ""digital"", ""branding"", ""optimization""]",6,Marketing Managers & Strategists,"[""brand management"", ""content marketing"", ""social media""]",54,8,2025-10-25 21:49:34,en,How do you improve {keyword} conversion rates?,0.94,0.9029699266337448,0.34
38000688,digital marketing,marketing,How do you identify the right audience for digital marketing?,implementation,Intermediate,"[""Overview of digital marketing"", ""Step-by-step implementation"", ""Best practices and tips"", ""Common challenges and solutions"", ""Tools and resources needed"", ""Conclusion and next steps""]","[""implementation"", ""promotion"", ""marketing"", ""digital"", ""branding""]",6,Marketing Coordinators & Specialists,"[""brand management"", ""social media"", ""content marketing""]",61,10,2025-10-25 21:49:34,en,How do you identify the right audience for {keyword}?,0.67,0.6331324575659963,0.82
38000689,data science,it,What career opportunities exist in data science?,analysis,Advanced,"[""Introduction to data science"", ""Key points and analysis"", ""Practical examples"", ""Expert insights"", ""Action items"", ""Conclusion""]","[""software"", ""analysis"", ""it"", ""development"", ""science"", ""data""]",4,Senior Developers & Tech Leads,"[""web development"", ""machine learning"", ""cloud computing"", ""cybersecurity""]",48,7,2025-10-25 21:49:34,en,What career opportunities exist in {keyword}?,0.67,0.9805763167811987,0.65
38000690,social media,marketing,How do you attribute success to social media efforts?,best_practice,Intermediate,"[""Overview of social media"", ""Step-by-step implementation"", ""Best practices and tips"", ""Common challenges and solutions"", ""Tools and resources needed"", ""Conclusion and next steps""]","[""media"", ""promotion"", ""best_practice"", ""marketing"", ""social"", ""advertising""]",6,Marketing Coordinators & Specialists,"[""digital marketing"", ""brand management"", ""content marketing""]",53,9,2025-10-25 21:49:34,en,How do you attribute success to {keyword} efforts?,0.66,0.7779643495399493,0.8
38000691,cybersecurity,it,How do you troubleshoot common issues with cybersecurity?,implementation,Intermediate,"[""Overview of cybersecurity"", ""Step-by-step implementation"", ""Best practices and tips"", ""Common challenges and solutions"", ""Tools and resources needed"", ""Conclusion and next steps""]","[""software"", ""development"", ""it"", ""implementation"", ""cybersecurity""]",5,Junior to Mid-level Developers,"[""data science"", ""cloud computing"", ""web development"", ""machine learning""]",57,8,2025-10-25 21:49:34,en,How do you troubleshoot common issues with {keyword}?,0.94,0.6429418074698031,0.71
38000692,content marketing,marketing,What budget should be allocated to content marketing?,comparison,Beginner,"[""Introduction to content marketing"", ""Key points and analysis"", ""Practical examples"", ""Expert insights"", ""Action items"", ""Conclusion""]","[""content"", ""promotion"", ""comparison"", ""marketing"", ""branding""]",4,Marketing Students & Interns,"[""brand management"", ""social media"", ""digital marketing""]",53,8,2025-10-25 21:49:34,en,What budget should be allocated to {keyword}?,0.65,0.48594677198825686,0.88
38000693,cloud computing,it,How does cloud computing impact business operations?,implementation,Advanced,"[""Introduction to cloud computing"", ""Key points and analysis"", ""Practical examples"", ""Expert insights"", ""Action items"", ""Conclusion""]","[""computing"", ""software"", ""it"", ""implementation"", ""programming"", ""cloud""]",4,Senior Developers & Tech Leads,"[""data science"", ""machine learning"", ""cybersecurity"", ""web development""]",52,7,2025-10-25 21:49:34,en,How does {keyword} impact business operations?,0.73,0.8151588801709442,0.64
38000694,social media,marketing,What timing strategies work for social media?,troubleshooting,Intermediate,"[""Introduction to social media"", ""Key points and analysis"", ""Practical examples"", ""Expert insights"", ""Action items"", ""Conclusion""]","[""media"", ""troubleshooting"", ""marketing"", ""digital"", ""social"", ""advertising""]",4,Marketing Coordinators & Specialists,"[""content marketing"", ""brand management"", ""digital marketing""]",45,7,2025-10-25 21:49:34,en,What timing strategies work for {keyword}?,0.65,0.6393203969446072,0.32
38000695,digital marketing,marketing,What content types work best for digital marketing?,optimization,Advanced,"[""Introduction to digital marketing"", ""Key points and analysis"", ""Practical examples"", ""Expert insights"", ""Action items"", ""Conclusion""]","[""marketing"", ""digital"", ""advertising"", ""branding"", ""optimization""]",4,Marketing Managers & Strategists,"[""content marketing"", ""social media"", ""brand management""]",51,8,2025-10-25 21:49:34,en,What content types work best for {keyword}?,0.63,0.8883528727532716,0.38
38000696,social media,marketing,What budget should be allocated to social media?,evaluation,Expert,"[""Introduction to social media"", ""Key points and analysis"", ""Practical examples"", ""Expert insights"", ""Action items"", ""Conclusion""]","[""media"", ""promotion"", ""marketing"", ""digital"", ""social"", ""evaluation""]",4,Marketing Directors & CMOs,"[""brand management"", ""content marketing"", ""digital marketing""]",48,8,2025-10-25 21:49:34,en,What budget should be allocated to {keyword}?,0.92,1.0,0.34
