record_id,keyword,category,question,question_type,difficulty_level,answer_outline,tags,estimated_read_time,target_audience,related_topics,question_length,word_count,created_date,language,source_template,engagement_score,complexity_score,popularity_score
28800955,brand management,marketing,What budget should be allocated to brand management?,comparison,Intermediate,"[""Introduction to brand management"", ""Key points and analysis"", ""Practical examples"", ""Expert insights"", ""Action items"", ""Conclusion""]","[""comparison"", ""marketing"", ""management"", ""digital"", ""branding"", ""brand""]",4,Marketing Coordinators & Specialists,"[""social media"", ""digital marketing"", ""content marketing""]",52,8,2025-10-25 21:36:49,en,What budget should be allocated to {keyword}?,0.68,0.7341329509140917,0.84
28800956,digital marketing,marketing,What tools are essential for digital marketing analytics?,optimization,Intermediate,"[""Introduction to digital marketing"", ""Key points and analysis"", ""Practical examples"", ""Expert insights"", ""Action items"", ""Conclusion""]","[""marketing"", ""digital"", ""advertising"", ""branding"", ""optimization""]",4,Marketing Coordinators & Specialists,"[""brand management"", ""content marketing"", ""social media""]",57,8,2025-10-25 21:36:49,en,What tools are essential for {keyword} analytics?,0.74,0.6371222774533856,0.6
28800957,investment planning,economics,What factors should be considered when evaluating investment planning?,best_practice,Beginner,"[""Introduction to investment planning"", ""Key points and analysis"", ""Practical examples"", ""Expert insights"", ""Action items"", ""Conclusion""]","[""investment"", ""planning"", ""finance"", ""best_practice"", ""business"", ""economics""]",4,Students & New Investors,"[""market analysis"", ""portfolio management"", ""financial modeling""]",70,9,2025-10-25 21:36:49,en,What factors should be considered when evaluating {keyword}?,0.91,0.43489280673333547,0.69
28800958,cybersecurity,it,What are the key components of a cybersecurity implementation?,best_practice,Beginner,"[""Introduction to cybersecurity"", ""Key concepts and definitions"", ""Main categories or types"", ""Examples and case studies"", ""Benefits and advantages"", ""Summary and recommendations""]","[""software"", ""development"", ""it"", ""best_practice"", ""cybersecurity""]",5,Students & Entry-level Developers,"[""machine learning"", ""cloud computing"", ""data science"", ""web development""]",62,9,2025-10-25 21:36:49,en,What are the key components of a {keyword} implementation?,0.85,0.3402477222262358,0.86
28800959,web development,it,How do you optimize web development for different platforms?,troubleshooting,Advanced,"[""Overview of web development"", ""Step-by-step implementation"", ""Best practices and tips"", ""Common challenges and solutions"", ""Tools and resources needed"", ""Conclusion and next steps""]","[""development"", ""it"", ""programming"", ""troubleshooting"", ""web""]",6,Senior Developers & Tech Leads,"[""cloud computing"", ""cybersecurity"", ""machine learning"", ""data science""]",60,9,2025-10-25 21:36:49,en,How do you optimize {keyword} for different platforms?,0.82,0.8611172679399974,0.75
28800960,brand management,marketing,How do you develop an effective brand management strategy?,best_practice,Expert,"[""Overview of brand management"", ""Step-by-step implementation"", ""Best practices and tips"", ""Common challenges and solutions"", ""Tools and resources needed"", ""Conclusion and next steps""]","[""promotion"", ""best_practice"", ""marketing"", ""management"", ""branding"", ""brand""]",6,Marketing Directors & CMOs,"[""social media"", ""content marketing"", ""digital marketing""]",58,9,2025-10-25 21:36:49,en,How do you develop an effective {keyword} strategy?,0.81,1.0,0.77
28800961,financial modeling,economics,How do you identify opportunities in financial modeling markets?,best_practice,Intermediate,"[""Overview of financial modeling"", ""Step-by-step implementation"", ""Best practices and tips"", ""Common challenges and solutions"", ""Tools and resources needed"", ""Conclusion and next steps""]","[""investment"", ""best_practice"", ""modeling"", ""financial"", ""business"", ""economics""]",6,Individual Investors & Analysts,"[""investment planning"", ""portfolio management"", ""market analysis""]",64,9,2025-10-25 21:36:49,en,How do you identify opportunities in {keyword} markets?,0.81,0.7336259123053386,0.57
28800962,social media,marketing,How do you optimize social media for mobile users?,evaluation,Advanced,"[""Overview of social media"", ""Step-by-step implementation"", ""Best practices and tips"", ""Common challenges and solutions"", ""Tools and resources needed"", ""Conclusion and next steps""]","[""media"", ""marketing"", ""digital"", ""social"", ""branding"", ""evaluation""]",6,Marketing Managers & Strategists,"[""content marketing"", ""digital marketing"", ""brand management""]",50,9,2025-10-25 21:36:49,en,How do you optimize {keyword} for mobile users?,0.62,0.9084210572682113,0.58
28800963,investment planning,economics,How does global economics impact investment planning?,optimization,Expert,"[""Introduction to investment planning"", ""Key points and analysis"", ""Practical examples"", ""Expert insights"", ""Action items"", ""Conclusion""]","[""investment"", ""planning"", ""finance"", ""optimization"", ""economics""]",4,Portfolio Managers & Financial Experts,"[""portfolio management"", ""market analysis"", ""financial modeling""]",53,7,2025-10-25 21:36:49,en,How does global economics impact {keyword}?,0.9,1.0,0.84
28800964,financial modeling,economics,What are the risks associated with financial modeling?,evaluation,Advanced,"[""Introduction to financial modeling"", ""Key concepts and definitions"", ""Main categories or types"", ""Examples and case studies"", ""Benefits and advantages"", ""Summary and recommendations""]","[""finance"", ""modeling"", ""financial"", ""evaluation"", ""market"", ""economics""]",6,Professional Investors & Advisors,"[""portfolio management"", ""investment planning"", ""market analysis""]",54,8,2025-10-25 21:36:49,en,What are the risks associated with {keyword}?,0.76,0.8162022130212846,0.53
28800965,machine learning,it,What is the recommended architecture for machine learning systems?,optimization,Intermediate,"[""Introduction to machine learning"", ""Key points and analysis"", ""Practical examples"", ""Expert insights"", ""Action items"", ""Conclusion""]","[""software"", ""development"", ""it"", ""learning"", ""optimization"", ""machine""]",4,Junior to Mid-level Developers,"[""data science"", ""cybersecurity"", ""cloud computing"", ""web development""]",66,9,2025-10-25 21:36:49,en,What is the recommended architecture for {keyword} systems?,0.91,0.6743767183736101,0.75
28800966,content marketing,marketing,How do you develop an effective content marketing strategy?,implementation,Advanced,"[""Overview of content marketing"", ""Step-by-step implementation"", ""Best practices and tips"", ""Common challenges and solutions"", ""Tools and resources needed"", ""Conclusion and next steps""]","[""content"", ""implementation"", ""marketing"", ""advertising"", ""branding""]",6,Marketing Managers & Strategists,"[""brand management"", ""digital marketing"", ""social media""]",59,9,2025-10-25 21:36:49,en,How do you develop an effective {keyword} strategy?,0.81,0.8595227972592508,0.42
28800967,portfolio management,economics,What exit strategies should be considered for portfolio management?,analysis,Advanced,"[""Introduction to portfolio management"", ""Key points and analysis"", ""Practical examples"", ""Expert insights"", ""Action items"", ""Conclusion""]","[""finance"", ""analysis"", ""portfolio"", ""management"", ""business"", ""economics""]",4,Professional Investors & Advisors,"[""market analysis"", ""financial modeling"", ""investment planning""]",67,9,2025-10-25 21:36:49,en,What exit strategies should be considered for {keyword}?,0.84,0.8891939272428074,0.81
28800968,data science,it,How can data science improve system performance and scalability?,analysis,Beginner,"[""Introduction to data science"", ""Key points and analysis"", ""Practical examples"", ""Expert insights"", ""Action items"", ""Conclusion""]","[""technology"", ""software"", ""analysis"", ""it"", ""science"", ""data""]",4,Students & Entry-level Developers,"[""machine learning"", ""web development"", ""cloud computing"", ""cybersecurity""]",64,9,2025-10-25 21:36:49,en,How can {keyword} improve system performance and scalability?,0.77,0.4071119814390357,0.74
28800969,cybersecurity,it,What is the recommended architecture for cybersecurity systems?,implementation,Intermediate,"[""Introduction to cybersecurity"", ""Key points and analysis"", ""Practical examples"", ""Expert insights"", ""Action items"", ""Conclusion""]","[""software"", ""it"", ""implementation"", ""cybersecurity"", ""technology""]",4,Junior to Mid-level Developers,"[""web development"", ""data science"", ""machine learning"", ""cloud computing""]",63,8,2025-10-25 21:36:49,en,What is the recommended architecture for {keyword} systems?,0.72,0.713148906772217,0.82
28800970,brand management,marketing,How is AI changing brand management approaches?,comparison,Expert,"[""Introduction to brand management"", ""Key points and analysis"", ""Practical examples"", ""Expert insights"", ""Action items"", ""Conclusion""]","[""comparison"", ""marketing"", ""management"", ""advertising"", ""branding"", ""brand""]",4,Marketing Directors & CMOs,"[""digital marketing"", ""content marketing"", ""social media""]",47,7,2025-10-25 21:36:49,en,How is AI changing {keyword} approaches?,0.89,1.0,0.39
28800971,cybersecurity,it,What design patterns work best with cybersecurity?,analysis,Intermediate,"[""Introduction to cybersecurity"", ""Key points and analysis"", ""Practical examples"", ""Expert insights"", ""Action items"", ""Conclusion""]","[""analysis"", ""it"", ""programming"", ""cybersecurity"", ""technology""]",4,Junior to Mid-level Developers,"[""cloud computing"", ""machine learning"", ""web development"", ""data science""]",50,7,2025-10-25 21:36:49,en,What design patterns work best with {keyword}?,0.77,0.7730157480119297,0.73
28800972,social media,marketing,How do you develop an effective social media strategy?,planning,Expert,"[""Overview of social media"", ""Step-by-step implementation"", ""Best practices and tips"", ""Common challenges and solutions"", ""Tools and resources needed"", ""Conclusion and next steps""]","[""planning"", ""media"", ""marketing"", ""social"", ""advertising"", ""branding""]",6,Marketing Directors & CMOs,"[""digital marketing"", ""content marketing"", ""brand management""]",54,9,2025-10-25 21:36:49,en,How do you develop an effective {keyword} strategy?,0.93,1.0,0.74
28800973,portfolio management,economics,How do you measure portfolio management performance?,analysis,Beginner,"[""Overview of portfolio management"", ""Step-by-step implementation"", ""Best practices and tips"", ""Common challenges and solutions"", ""Tools and resources needed"", ""Conclusion and next steps""]","[""investment"", ""analysis"", ""finance"", ""portfolio"", ""management"", ""economics""]",6,Students & New Investors,"[""financial modeling"", ""market analysis"", ""investment planning""]",52,7,2025-10-25 21:36:49,en,How do you measure {keyword} performance?,0.93,0.49393447912875965,0.33
28800974,digital marketing,marketing,What demographics respond best to digital marketing?,planning,Beginner,"[""Introduction to digital marketing"", ""Key points and analysis"", ""Practical examples"", ""Expert insights"", ""Action items"", ""Conclusion""]","[""marketing"", ""advertising"", ""planning"", ""digital""]",4,Marketing Students & Interns,"[""social media"", ""brand management"", ""content marketing""]",52,7,2025-10-25 21:36:49,en,What demographics respond best to {keyword}?,0.69,0.3974904317368547,0.5
28800975,market analysis,economics,How do you adjust your market analysis strategy during volatility?,troubleshooting,Advanced,"[""Overview of market analysis"", ""Step-by-step implementation"", ""Best practices and tips"", ""Common challenges and solutions"", ""Tools and resources needed"", ""Conclusion and next steps""]","[""analysis"", ""troubleshooting"", ""market"", ""business"", ""economics""]",6,Professional Investors & Advisors,"[""investment planning"", ""financial modeling"", ""portfolio management""]",66,10,2025-10-25 21:36:49,en,How do you adjust your {keyword} strategy during volatility?,0.93,0.8178652063982708,0.58
28800976,investment planning,economics,What are the regulatory considerations for investment planning?,planning,Intermediate,"[""Introduction to investment planning"", ""Key concepts and definitions"", ""Main categories or types"", ""Examples and case studies"", ""Benefits and advantages"", ""Summary and recommendations""]","[""investment"", ""economics"", ""planning"", ""finance""]",6,Individual Investors & Analysts,"[""market analysis"", ""financial modeling"", ""portfolio management""]",63,8,2025-10-25 21:36:49,en,What are the regulatory considerations for {keyword}?,0.93,0.7226559844144865,0.58
28800977,cloud computing,it,How do you stay updated with cloud computing developments?,strategy,Expert,"[""Overview of cloud computing"", ""Step-by-step implementation"", ""Best practices and tips"", ""Common challenges and solutions"", ""Tools and resources needed"", ""Conclusion and next steps""]","[""computing"", ""cloud"", ""development"", ""it"", ""software"", ""strategy""]",6,Architects & Technical Directors,"[""web development"", ""data science"", ""cybersecurity"", ""machine learning""]",58,9,2025-10-25 21:36:49,en,How do you stay updated with {keyword} developments?,0.64,1.0,0.68
28800978,cybersecurity,it,What certifications are valuable for cybersecurity professionals?,troubleshooting,Beginner,"[""Introduction to cybersecurity"", ""Key points and analysis"", ""Practical examples"", ""Expert insights"", ""Action items"", ""Conclusion""]","[""development"", ""it"", ""programming"", ""troubleshooting"", ""cybersecurity""]",4,Students & Entry-level Developers,"[""machine learning"", ""data science"", ""web development"", ""cloud computing""]",65,7,2025-10-25 21:36:49,en,What certifications are valuable for {keyword} professionals?,0.66,0.353714785014495,0.45
28800979,financial modeling,economics,How do you diversify your portfolio using financial modeling?,planning,Advanced,"[""Overview of financial modeling"", ""Step-by-step implementation"", ""Best practices and tips"", ""Common challenges and solutions"", ""Tools and resources needed"", ""Conclusion and next steps""]","[""planning"", ""finance"", ""modeling"", ""financial"", ""business"", ""economics""]",6,Professional Investors & Advisors,"[""portfolio management"", ""market analysis"", ""investment planning""]",61,9,2025-10-25 21:36:49,en,How do you diversify your portfolio using {keyword}?,0.91,0.8594290729573503,0.65
28800980,portfolio management,economics,How do you report on portfolio management performance to stakeholders?,comparison,Expert,"[""Overview of portfolio management"", ""Step-by-step implementation"", ""Best practices and tips"", ""Common challenges and solutions"", ""Tools and resources needed"", ""Conclusion and next steps""]","[""finance"", ""portfolio"", ""comparison"", ""management"", ""business"", ""economics""]",6,Portfolio Managers & Financial Experts,"[""financial modeling"", ""investment planning"", ""market analysis""]",70,10,2025-10-25 21:36:49,en,How do you report on {keyword} performance to stakeholders?,0.75,1.0,0.79
28800981,social media,marketing,How do you attribute success to social media efforts?,analysis,Beginner,"[""Overview of social media"", ""Step-by-step implementation"", ""Best practices and tips"", ""Common challenges and solutions"", ""Tools and resources needed"", ""Conclusion and next steps""]","[""analysis"", ""media"", ""marketing"", ""social"", ""advertising"", ""branding""]",6,Marketing Students & Interns,"[""digital marketing"", ""brand management"", ""content marketing""]",53,9,2025-10-25 21:36:49,en,How do you attribute success to {keyword} efforts?,0.66,0.38435445895200077,0.49
28800982,cloud computing,it,What is the recommended architecture for cloud computing systems?,strategy,Advanced,"[""Introduction to cloud computing"", ""Key points and analysis"", ""Practical examples"", ""Expert insights"", ""Action items"", ""Conclusion""]","[""computing"", ""software"", ""cloud"", ""it"", ""programming"", ""strategy""]",4,Senior Developers & Tech Leads,"[""cybersecurity"", ""data science"", ""web development"", ""machine learning""]",65,9,2025-10-25 21:36:49,en,What is the recommended architecture for {keyword} systems?,0.73,0.8248568827330678,0.74
28800983,market analysis,economics,What indicators predict market analysis market movements?,how_to,Advanced,"[""Introduction to market analysis"", ""Key points and analysis"", ""Practical examples"", ""Expert insights"", ""Action items"", ""Conclusion""]","[""investment"", ""how_to"", ""analysis"", ""market"", ""business"", ""economics""]",4,Professional Investors & Advisors,"[""financial modeling"", ""investment planning"", ""portfolio management""]",57,7,2025-10-25 21:36:49,en,What indicators predict {keyword} market movements?,0.65,0.9525975551851142,0.51
28800984,investment planning,economics,How do you diversify your portfolio using investment planning?,optimization,Intermediate,"[""Overview of investment planning"", ""Step-by-step implementation"", ""Best practices and tips"", ""Common challenges and solutions"", ""Tools and resources needed"", ""Conclusion and next steps""]","[""investment"", ""planning"", ""finance"", ""optimization"", ""economics""]",6,Individual Investors & Analysts,"[""portfolio management"", ""financial modeling"", ""market analysis""]",62,9,2025-10-25 21:36:49,en,How do you diversify your portfolio using {keyword}?,0.93,0.7040415939873518,0.54
28800985,cybersecurity,it,What are the best practices for cybersecurity development?,comparison,Beginner,"[""Introduction to cybersecurity"", ""Key concepts and definitions"", ""Main categories or types"", ""Examples and case studies"", ""Benefits and advantages"", ""Summary and recommendations""]","[""development"", ""it"", ""comparison"", ""cybersecurity"", ""technology""]",5,Students & Entry-level Developers,"[""data science"", ""web development"", ""cloud computing"", ""machine learning""]",58,8,2025-10-25 21:36:49,en,What are the best practices for {keyword} development?,0.92,0.36344376266942535,0.68
28800986,social media,marketing,What channels are most effective for social media?,implementation,Expert,"[""Introduction to social media"", ""Key points and analysis"", ""Practical examples"", ""Expert insights"", ""Action items"", ""Conclusion""]","[""media"", ""implementation"", ""marketing"", ""digital"", ""social"", ""branding""]",4,Marketing Directors & CMOs,"[""brand management"", ""digital marketing"", ""content marketing""]",50,8,2025-10-25 21:36:49,en,What channels are most effective for {keyword}?,0.66,1.0,0.69
28800987,content marketing,marketing,What tools are essential for content marketing analytics?,implementation,Advanced,"[""Introduction to content marketing"", ""Key points and analysis"", ""Practical examples"", ""Expert insights"", ""Action items"", ""Conclusion""]","[""content"", ""implementation"", ""promotion"", ""marketing"", ""branding""]",4,Marketing Managers & Strategists,"[""social media"", ""digital marketing"", ""brand management""]",57,8,2025-10-25 21:36:49,en,What tools are essential for {keyword} analytics?,0.89,0.9010748455396473,0.4
28800988,cloud computing,it,How do you get started with cloud computing as a beginner?,analysis,Expert,"[""Overview of cloud computing"", ""Step-by-step implementation"", ""Best practices and tips"", ""Common challenges and solutions"", ""Tools and resources needed"", ""Conclusion and next steps""]","[""computing"", ""analysis"", ""it"", ""development"", ""cloud"", ""technology""]",6,Architects & Technical Directors,"[""cybersecurity"", ""machine learning"", ""data science"", ""web development""]",58,11,2025-10-25 21:36:49,en,How do you get started with {keyword} as a beginner?,0.61,1.0,0.56
28800989,machine learning,it,What is the recommended architecture for machine learning systems?,implementation,Beginner,"[""Introduction to machine learning"", ""Key points and analysis"", ""Practical examples"", ""Expert insights"", ""Action items"", ""Conclusion""]","[""development"", ""it"", ""implementation"", ""learning"", ""machine"", ""technology""]",4,Students & Entry-level Developers,"[""data science"", ""cloud computing"", ""web development"", ""cybersecurity""]",66,9,2025-10-25 21:36:49,en,What is the recommended architecture for {keyword} systems?,0.7,0.38908824355541577,0.79
28800990,market analysis,economics,How do you report on market analysis performance to stakeholders?,analysis,Advanced,"[""Overview of market analysis"", ""Step-by-step implementation"", ""Best practices and tips"", ""Common challenges and solutions"", ""Tools and resources needed"", ""Conclusion and next steps""]","[""finance"", ""market"", ""economics"", ""analysis""]",6,Professional Investors & Advisors,"[""investment planning"", ""financial modeling"", ""portfolio management""]",65,10,2025-10-25 21:36:49,en,How do you report on {keyword} performance to stakeholders?,0.63,0.8883642345236693,0.53
28800991,social media,marketing,What does the future hold for social media?,best_practice,Expert,"[""Introduction to social media"", ""Key points and analysis"", ""Practical examples"", ""Expert insights"", ""Action items"", ""Conclusion""]","[""media"", ""promotion"", ""best_practice"", ""marketing"", ""social"", ""branding""]",4,Marketing Directors & CMOs,"[""content marketing"", ""digital marketing"", ""brand management""]",43,8,2025-10-25 21:36:49,en,What does the future hold for {keyword}?,0.67,1.0,0.54
28800992,cybersecurity,it,What ROI can be expected from cybersecurity implementation?,comparison,Beginner,"[""Introduction to cybersecurity"", ""Key points and analysis"", ""Practical examples"", ""Expert insights"", ""Action items"", ""Conclusion""]","[""development"", ""it"", ""comparison"", ""cybersecurity"", ""technology""]",4,Students & Entry-level Developers,"[""data science"", ""web development"", ""machine learning"", ""cloud computing""]",59,8,2025-10-25 21:36:49,en,What ROI can be expected from {keyword} implementation?,0.86,0.45767747335579223,0.31
28800993,digital marketing,marketing,How do you track and analyze digital marketing performance?,implementation,Beginner,"[""Overview of digital marketing"", ""Step-by-step implementation"", ""Best practices and tips"", ""Common challenges and solutions"", ""Tools and resources needed"", ""Conclusion and next steps""]","[""implementation"", ""marketing"", ""advertising"", ""digital""]",6,Marketing Students & Interns,"[""brand management"", ""content marketing"", ""social media""]",59,9,2025-10-25 21:36:49,en,How do you track and analyze {keyword} performance?,0.91,0.49731324608954214,0.36
28800994,digital marketing,marketing,How do you optimize digital marketing for mobile users?,troubleshooting,Intermediate,"[""Overview of digital marketing"", ""Step-by-step implementation"", ""Best practices and tips"", ""Common challenges and solutions"", ""Tools and resources needed"", ""Conclusion and next steps""]","[""promotion"", ""troubleshooting"", ""marketing"", ""digital"", ""branding""]",6,Marketing Coordinators & Specialists,"[""content marketing"", ""social media"", ""brand management""]",55,9,2025-10-25 21:36:49,en,How do you optimize {keyword} for mobile users?,0.86,0.7398005327030116,0.75
28800995,content marketing,marketing,How do you optimize content marketing for mobile users?,troubleshooting,Expert,"[""Overview of content marketing"", ""Step-by-step implementation"", ""Best practices and tips"", ""Common challenges and solutions"", ""Tools and resources needed"", ""Conclusion and next steps""]","[""content"", ""troubleshooting"", ""digital"", ""marketing"", ""branding""]",6,Marketing Directors & CMOs,"[""digital marketing"", ""brand management"", ""social media""]",55,9,2025-10-25 21:36:49,en,How do you optimize {keyword} for mobile users?,0.81,1.0,0.45
28800996,financial modeling,economics,What are the risks associated with financial modeling?,best_practice,Intermediate,"[""Introduction to financial modeling"", ""Key concepts and definitions"", ""Main categories or types"", ""Examples and case studies"", ""Benefits and advantages"", ""Summary and recommendations""]","[""investment"", ""best_practice"", ""modeling"", ""financial"", ""business"", ""economics""]",6,Individual Investors & Analysts,"[""market analysis"", ""investment planning"", ""portfolio management""]",54,8,2025-10-25 21:36:49,en,What are the risks associated with {keyword}?,0.66,0.6274187890120985,0.71
28800997,machine learning,it,What are the key components of a machine learning implementation?,optimization,Intermediate,"[""Introduction to machine learning"", ""Key concepts and definitions"", ""Main categories or types"", ""Examples and case studies"", ""Benefits and advantages"", ""Summary and recommendations""]","[""development"", ""it"", ""programming"", ""learning"", ""optimization"", ""machine""]",6,Junior to Mid-level Developers,"[""data science"", ""cloud computing"", ""web development"", ""cybersecurity""]",65,10,2025-10-25 21:36:49,en,What are the key components of a {keyword} implementation?,0.61,0.6486701809176301,0.45
