record_id,keyword,category,question,question_type,difficulty_level,answer_outline,tags,estimated_read_time,target_audience,related_topics,question_length,word_count,created_date,language,source_template,engagement_score,complexity_score,popularity_score
38000957,social media,marketing,What emerging platforms support social media?,how_to,Beginner,"[""Introduction to social media"", ""Key points and analysis"", ""Practical examples"", ""Expert insights"", ""Action items"", ""Conclusion""]","[""how_to"", ""media"", ""marketing"", ""digital"", ""social"", ""branding""]",4,Marketing Students & Interns,"[""digital marketing"", ""content marketing"", ""brand management""]",45,6,2025-10-25 21:49:34,en,What emerging platforms support {keyword}?,0.66,0.40447174482093995,0.58
38000958,market analysis,economics,What timeline is realistic for market analysis returns?,evaluation,Beginner,"[""Introduction to market analysis"", ""Key points and analysis"", ""Practical examples"", ""Expert insights"", ""Action items"", ""Conclusion""]","[""analysis"", ""evaluation"", ""market"", ""business"", ""economics""]",4,Students & New Investors,"[""investment planning"", ""portfolio management"", ""financial modeling""]",55,8,2025-10-25 21:49:34,en,What timeline is realistic for {keyword} returns?,0.62,0.4238282256470929,0.64
38000959,machine learning,it,How do you stay updated with machine learning developments?,implementation,Beginner,"[""Overview of machine learning"", ""Step-by-step implementation"", ""Best practices and tips"", ""Common challenges and solutions"", ""Tools and resources needed"", ""Conclusion and next steps""]","[""software"", ""development"", ""it"", ""implementation"", ""learning"", ""machine""]",6,Students & Entry-level Developers,"[""web development"", ""data science"", ""cloud computing"", ""cybersecurity""]",59,9,2025-10-25 21:49:34,en,How do you stay updated with {keyword} developments?,0.7,0.39086744212626334,0.51
38000960,market analysis,economics,How do economic conditions affect market analysis performance?,strategy,Beginner,"[""Introduction to market analysis"", ""Key points and analysis"", ""Practical examples"", ""Expert insights"", ""Action items"", ""Conclusion""]","[""analysis"", ""business"", ""market"", ""strategy"", ""economics""]",4,Students & New Investors,"[""investment planning"", ""financial modeling"", ""portfolio management""]",62,8,2025-10-25 21:49:34,en,How do economic conditions affect {keyword} performance?,0.62,0.3741502448455263,0.89
38000961,market analysis,economics,What timeline is realistic for market analysis returns?,implementation,Advanced,"[""Introduction to market analysis"", ""Key points and analysis"", ""Practical examples"", ""Expert insights"", ""Action items"", ""Conclusion""]","[""investment"", ""analysis"", ""implementation"", ""market"", ""business"", ""economics""]",4,Professional Investors & Advisors,"[""portfolio management"", ""investment planning"", ""financial modeling""]",55,8,2025-10-25 21:49:34,en,What timeline is realistic for {keyword} returns?,0.72,0.9974155426055188,0.71
38000962,social media,marketing,How do you optimize social media for mobile users?,strategy,Advanced,"[""Overview of social media"", ""Step-by-step implementation"", ""Best practices and tips"", ""Common challenges and solutions"", ""Tools and resources needed"", ""Conclusion and next steps""]","[""media"", ""marketing"", ""digital"", ""social"", ""branding"", ""strategy""]",6,Marketing Managers & Strategists,"[""content marketing"", ""brand management"", ""digital marketing""]",50,9,2025-10-25 21:49:34,en,How do you optimize {keyword} for mobile users?,0.86,0.8202576246623565,0.42
38000963,content marketing,marketing,How do you identify the right audience for content marketing?,comparison,Beginner,"[""Overview of content marketing"", ""Step-by-step implementation"", ""Best practices and tips"", ""Common challenges and solutions"", ""Tools and resources needed"", ""Conclusion and next steps""]","[""content"", ""comparison"", ""marketing"", ""digital"", ""advertising""]",6,Marketing Students & Interns,"[""brand management"", ""digital marketing"", ""social media""]",61,10,2025-10-25 21:49:34,en,How do you identify the right audience for {keyword}?,0.6,0.32654171794882525,0.83
38000964,brand management,marketing,How do you identify the right audience for brand management?,evaluation,Beginner,"[""Overview of brand management"", ""Step-by-step implementation"", ""Best practices and tips"", ""Common challenges and solutions"", ""Tools and resources needed"", ""Conclusion and next steps""]","[""marketing"", ""digital"", ""management"", ""branding"", ""evaluation"", ""brand""]",6,Marketing Students & Interns,"[""content marketing"", ""social media"", ""digital marketing""]",60,10,2025-10-25 21:49:34,en,How do you identify the right audience for {keyword}?,0.91,0.36811569023536583,0.4
38000965,cloud computing,it,How do you integrate cloud computing with existing systems?,planning,Expert,"[""Overview of cloud computing"", ""Step-by-step implementation"", ""Best practices and tips"", ""Common challenges and solutions"", ""Tools and resources needed"", ""Conclusion and next steps""]","[""computing"", ""planning"", ""software"", ""it"", ""cloud"", ""technology""]",6,Architects & Technical Directors,"[""data science"", ""cybersecurity"", ""web development"", ""machine learning""]",59,9,2025-10-25 21:49:34,en,How do you integrate {keyword} with existing systems?,0.77,1.0,0.37
38000966,market analysis,economics,What metrics are most important for market analysis?,best_practice,Advanced,"[""Introduction to market analysis"", ""Key points and analysis"", ""Practical examples"", ""Expert insights"", ""Action items"", ""Conclusion""]","[""investment"", ""analysis"", ""best_practice"", ""market"", ""economics""]",4,Professional Investors & Advisors,"[""portfolio management"", ""investment planning"", ""financial modeling""]",52,8,2025-10-25 21:49:34,en,What metrics are most important for {keyword}?,0.82,0.8859280854687068,0.82
38000967,market analysis,economics,What is the optimal allocation for market analysis in a portfolio?,analysis,Beginner,"[""Introduction to market analysis"", ""Key points and analysis"", ""Practical examples"", ""Expert insights"", ""Action items"", ""Conclusion""]","[""finance"", ""market"", ""economics"", ""analysis""]",4,Students & New Investors,"[""investment planning"", ""portfolio management"", ""financial modeling""]",66,11,2025-10-25 21:49:34,en,What is the optimal allocation for {keyword} in a portfolio?,0.81,0.43199242119020387,0.48
38000968,digital marketing,marketing,What demographics respond best to digital marketing?,comparison,Advanced,"[""Introduction to digital marketing"", ""Key points and analysis"", ""Practical examples"", ""Expert insights"", ""Action items"", ""Conclusion""]","[""marketing"", ""comparison"", ""advertising"", ""digital""]",4,Marketing Managers & Strategists,"[""social media"", ""content marketing"", ""brand management""]",52,7,2025-10-25 21:49:34,en,What demographics respond best to {keyword}?,0.86,0.8483976262731658,0.6
38000969,portfolio management,economics,What strategies work best for portfolio management investment?,optimization,Expert,"[""Introduction to portfolio management"", ""Key points and analysis"", ""Practical examples"", ""Expert insights"", ""Action items"", ""Conclusion""]","[""investment"", ""portfolio"", ""management"", ""business"", ""optimization"", ""economics""]",4,Portfolio Managers & Financial Experts,"[""market analysis"", ""investment planning"", ""financial modeling""]",62,8,2025-10-25 21:49:34,en,What strategies work best for {keyword} investment?,0.61,1.0,0.39
38000970,portfolio management,economics,What exit strategies should be considered for portfolio management?,implementation,Beginner,"[""Introduction to portfolio management"", ""Key points and analysis"", ""Practical examples"", ""Expert insights"", ""Action items"", ""Conclusion""]","[""implementation"", ""portfolio"", ""management"", ""market"", ""business"", ""economics""]",4,Students & New Investors,"[""market analysis"", ""financial modeling"", ""investment planning""]",67,9,2025-10-25 21:49:34,en,What exit strategies should be considered for {keyword}?,0.9,0.4398557761771935,0.62
38000971,market analysis,economics,What factors should be considered when evaluating market analysis?,strategy,Beginner,"[""Introduction to market analysis"", ""Key points and analysis"", ""Practical examples"", ""Expert insights"", ""Action items"", ""Conclusion""]","[""finance"", ""analysis"", ""business"", ""market"", ""strategy"", ""economics""]",4,Students & New Investors,"[""financial modeling"", ""investment planning"", ""portfolio management""]",66,9,2025-10-25 21:49:34,en,What factors should be considered when evaluating {keyword}?,0.85,0.4897415802743501,0.42
38000972,portfolio management,economics,How do you report on portfolio management performance to stakeholders?,optimization,Expert,"[""Overview of portfolio management"", ""Step-by-step implementation"", ""Best practices and tips"", ""Common challenges and solutions"", ""Tools and resources needed"", ""Conclusion and next steps""]","[""portfolio"", ""management"", ""business"", ""market"", ""optimization"", ""economics""]",6,Portfolio Managers & Financial Experts,"[""market analysis"", ""investment planning"", ""financial modeling""]",70,10,2025-10-25 21:49:34,en,How do you report on {keyword} performance to stakeholders?,0.69,1.0,0.54
38000973,web development,it,How does web development impact business operations?,planning,Expert,"[""Introduction to web development"", ""Key points and analysis"", ""Practical examples"", ""Expert insights"", ""Action items"", ""Conclusion""]","[""technology"", ""software"", ""planning"", ""development"", ""it"", ""web""]",4,Architects & Technical Directors,"[""machine learning"", ""cybersecurity"", ""cloud computing"", ""data science""]",52,7,2025-10-25 21:49:34,en,How does {keyword} impact business operations?,0.85,1.0,0.43
38000974,social media,marketing,What emerging platforms support social media?,optimization,Expert,"[""Introduction to social media"", ""Key points and analysis"", ""Practical examples"", ""Expert insights"", ""Action items"", ""Conclusion""]","[""media"", ""promotion"", ""digital"", ""marketing"", ""social"", ""optimization""]",4,Marketing Directors & CMOs,"[""brand management"", ""digital marketing"", ""content marketing""]",45,6,2025-10-25 21:49:34,en,What emerging platforms support {keyword}?,0.62,1.0,0.65
38000975,web development,it,What skills are needed to master web development?,optimization,Expert,"[""Introduction to web development"", ""Key points and analysis"", ""Practical examples"", ""Expert insights"", ""Action items"", ""Conclusion""]","[""development"", ""web"", ""it"", ""programming"", ""optimization"", ""technology""]",4,Architects & Technical Directors,"[""machine learning"", ""cloud computing"", ""cybersecurity"", ""data science""]",49,8,2025-10-25 21:49:34,en,What skills are needed to master {keyword}?,0.78,1.0,0.9
38000976,market analysis,economics,How do you assess and manage market analysis risks?,evaluation,Beginner,"[""Overview of market analysis"", ""Step-by-step implementation"", ""Best practices and tips"", ""Common challenges and solutions"", ""Tools and resources needed"", ""Conclusion and next steps""]","[""investment"", ""analysis"", ""finance"", ""evaluation"", ""market"", ""economics""]",6,Students & New Investors,"[""financial modeling"", ""investment planning"", ""portfolio management""]",51,9,2025-10-25 21:49:34,en,How do you assess and manage {keyword} risks?,0.85,0.3954642252106413,0.33
38000977,data science,it,How do you measure the success of data science projects?,troubleshooting,Beginner,"[""Overview of data science"", ""Step-by-step implementation"", ""Best practices and tips"", ""Common challenges and solutions"", ""Tools and resources needed"", ""Conclusion and next steps""]","[""development"", ""it"", ""programming"", ""troubleshooting"", ""science"", ""data""]",6,Students & Entry-level Developers,"[""cybersecurity"", ""machine learning"", ""web development"", ""cloud computing""]",56,10,2025-10-25 21:49:34,en,How do you measure the success of {keyword} projects?,0.74,0.38811821382695205,0.42
38000978,digital marketing,marketing,What KPIs are most important for digital marketing?,planning,Expert,"[""Introduction to digital marketing"", ""Key points and analysis"", ""Practical examples"", ""Expert insights"", ""Action items"", ""Conclusion""]","[""planning"", ""promotion"", ""marketing"", ""digital"", ""advertising""]",4,Marketing Directors & CMOs,"[""content marketing"", ""social media"", ""brand management""]",51,8,2025-10-25 21:49:34,en,What KPIs are most important for {keyword}?,0.67,1.0,0.47
38000979,content marketing,marketing,How do you develop an effective content marketing strategy?,analysis,Intermediate,"[""Overview of content marketing"", ""Step-by-step implementation"", ""Best practices and tips"", ""Common challenges and solutions"", ""Tools and resources needed"", ""Conclusion and next steps""]","[""content"", ""analysis"", ""promotion"", ""marketing"", ""digital""]",6,Marketing Coordinators & Specialists,"[""digital marketing"", ""brand management"", ""social media""]",59,9,2025-10-25 21:49:34,en,How do you develop an effective {keyword} strategy?,0.81,0.6867777369826416,0.9
38000980,financial modeling,economics,How do you hedge against financial modeling market downturns?,analysis,Beginner,"[""Overview of financial modeling"", ""Step-by-step implementation"", ""Best practices and tips"", ""Common challenges and solutions"", ""Tools and resources needed"", ""Conclusion and next steps""]","[""investment"", ""analysis"", ""modeling"", ""financial"", ""market"", ""economics""]",6,Students & New Investors,"[""portfolio management"", ""market analysis"", ""investment planning""]",61,9,2025-10-25 21:49:34,en,How do you hedge against {keyword} market downturns?,0.72,0.39788250521468577,0.36
38000981,content marketing,marketing,How do you track and analyze content marketing performance?,implementation,Expert,"[""Overview of content marketing"", ""Step-by-step implementation"", ""Best practices and tips"", ""Common challenges and solutions"", ""Tools and resources needed"", ""Conclusion and next steps""]","[""content"", ""implementation"", ""promotion"", ""marketing"", ""digital""]",6,Marketing Directors & CMOs,"[""social media"", ""digital marketing"", ""brand management""]",59,9,2025-10-25 21:49:34,en,How do you track and analyze {keyword} performance?,0.95,1.0,0.87
38000982,social media,marketing,What emerging platforms support social media?,evaluation,Expert,"[""Introduction to social media"", ""Key points and analysis"", ""Practical examples"", ""Expert insights"", ""Action items"", ""Conclusion""]","[""media"", ""marketing"", ""social"", ""advertising"", ""branding"", ""evaluation""]",4,Marketing Directors & CMOs,"[""content marketing"", ""digital marketing"", ""brand management""]",45,6,2025-10-25 21:49:34,en,What emerging platforms support {keyword}?,0.72,1.0,0.73
38000983,data science,it,Which frameworks support data science implementation?,analysis,Intermediate,"[""Introduction to data science"", ""Key points and analysis"", ""Practical examples"", ""Expert insights"", ""Action items"", ""Conclusion""]","[""technology"", ""software"", ""analysis"", ""it"", ""science"", ""data""]",4,Junior to Mid-level Developers,"[""cybersecurity"", ""machine learning"", ""cloud computing"", ""web development""]",53,6,2025-10-25 21:49:34,en,Which frameworks support {keyword} implementation?,0.88,0.6593657457390163,0.46
38000984,market analysis,economics,What is the optimal allocation for market analysis in a portfolio?,optimization,Beginner,"[""Introduction to market analysis"", ""Key points and analysis"", ""Practical examples"", ""Expert insights"", ""Action items"", ""Conclusion""]","[""analysis"", ""business"", ""market"", ""optimization"", ""economics""]",4,Students & New Investors,"[""investment planning"", ""portfolio management"", ""financial modeling""]",66,11,2025-10-25 21:49:34,en,What is the optimal allocation for {keyword} in a portfolio?,0.66,0.34626705493146426,0.33
38000985,financial modeling,economics,How do you benchmark financial modeling against alternatives?,troubleshooting,Advanced,"[""Overview of financial modeling"", ""Step-by-step implementation"", ""Best practices and tips"", ""Common challenges and solutions"", ""Tools and resources needed"", ""Conclusion and next steps""]","[""investment"", ""finance"", ""troubleshooting"", ""modeling"", ""financial"", ""economics""]",6,Professional Investors & Advisors,"[""market analysis"", ""investment planning"", ""portfolio management""]",61,8,2025-10-25 21:49:34,en,How do you benchmark {keyword} against alternatives?,0.64,0.8258055426228487,0.41
38000986,content marketing,marketing,How do you create a content marketing roadmap?,implementation,Intermediate,"[""Overview of content marketing"", ""Step-by-step implementation"", ""Best practices and tips"", ""Common challenges and solutions"", ""Tools and resources needed"", ""Conclusion and next steps""]","[""content"", ""implementation"", ""promotion"", ""marketing"", ""branding""]",6,Marketing Coordinators & Specialists,"[""brand management"", ""social media"", ""digital marketing""]",46,8,2025-10-25 21:49:34,en,How do you create a {keyword} roadmap?,0.92,0.6544832765119977,0.89
38000987,market analysis,economics,What are the regulatory considerations for market analysis?,best_practice,Beginner,"[""Introduction to market analysis"", ""Key concepts and definitions"", ""Main categories or types"", ""Examples and case studies"", ""Benefits and advantages"", ""Summary and recommendations""]","[""investment"", ""analysis"", ""best_practice"", ""market"", ""business"", ""economics""]",6,Students & New Investors,"[""investment planning"", ""financial modeling"", ""portfolio management""]",59,8,2025-10-25 21:49:34,en,What are the regulatory considerations for {keyword}?,0.68,0.4153520213815184,0.53
38000988,market analysis,economics,How do you adjust your market analysis strategy during volatility?,troubleshooting,Expert,"[""Overview of market analysis"", ""Step-by-step implementation"", ""Best practices and tips"", ""Common challenges and solutions"", ""Tools and resources needed"", ""Conclusion and next steps""]","[""investment"", ""analysis"", ""troubleshooting"", ""market"", ""business"", ""economics""]",6,Portfolio Managers & Financial Experts,"[""investment planning"", ""portfolio management"", ""financial modeling""]",66,10,2025-10-25 21:49:34,en,How do you adjust your {keyword} strategy during volatility?,0.65,1.0,0.7
38000989,portfolio management,economics,What are the risks associated with portfolio management?,evaluation,Intermediate,"[""Introduction to portfolio management"", ""Key concepts and definitions"", ""Main categories or types"", ""Examples and case studies"", ""Benefits and advantages"", ""Summary and recommendations""]","[""finance"", ""portfolio"", ""management"", ""evaluation"", ""business"", ""economics""]",6,Individual Investors & Analysts,"[""investment planning"", ""financial modeling"", ""market analysis""]",56,8,2025-10-25 21:49:34,en,What are the risks associated with {keyword}?,0.75,0.7305827281390626,0.58
38000990,cloud computing,it,How does cloud computing impact business operations?,how_to,Beginner,"[""Introduction to cloud computing"", ""Key points and analysis"", ""Practical examples"", ""Expert insights"", ""Action items"", ""Conclusion""]","[""computing"", ""how_to"", ""software"", ""development"", ""it"", ""cloud""]",4,Students & Entry-level Developers,"[""machine learning"", ""web development"", ""cybersecurity"", ""data science""]",52,7,2025-10-25 21:49:34,en,How does {keyword} impact business operations?,0.64,0.34550071452966147,0.88
38000991,machine learning,it,What security considerations should be taken when using machine learning?,strategy,Intermediate,"[""Introduction to machine learning"", ""Key points and analysis"", ""Practical examples"", ""Expert insights"", ""Action items"", ""Conclusion""]","[""software"", ""it"", ""programming"", ""learning"", ""strategy"", ""machine""]",4,Junior to Mid-level Developers,"[""data science"", ""web development"", ""cybersecurity"", ""cloud computing""]",73,10,2025-10-25 21:49:34,en,What security considerations should be taken when using {keyword}?,0.88,0.7918667003133669,0.49
38000992,brand management,marketing,What channels are most effective for brand management?,analysis,Intermediate,"[""Introduction to brand management"", ""Key points and analysis"", ""Practical examples"", ""Expert insights"", ""Action items"", ""Conclusion""]","[""analysis"", ""marketing"", ""management"", ""advertising"", ""digital"", ""brand""]",4,Marketing Coordinators & Specialists,"[""social media"", ""digital marketing"", ""content marketing""]",54,8,2025-10-25 21:49:34,en,What channels are most effective for {keyword}?,0.73,0.7666048037302824,0.74
38000993,social media,marketing,What budget should be allocated to social media?,planning,Expert,"[""Introduction to social media"", ""Key points and analysis"", ""Practical examples"", ""Expert insights"", ""Action items"", ""Conclusion""]","[""planning"", ""media"", ""marketing"", ""social"", ""advertising"", ""branding""]",4,Marketing Directors & CMOs,"[""content marketing"", ""digital marketing"", ""brand management""]",48,8,2025-10-25 21:49:34,en,What budget should be allocated to {keyword}?,0.69,1.0,0.33
38000994,machine learning,it,What are the latest trends in machine learning technology?,comparison,Intermediate,"[""Introduction to machine learning"", ""Key concepts and definitions"", ""Main categories or types"", ""Examples and case studies"", ""Benefits and advantages"", ""Summary and recommendations""]","[""software"", ""development"", ""it"", ""comparison"", ""learning"", ""machine""]",6,Junior to Mid-level Developers,"[""data science"", ""cybersecurity"", ""web development"", ""cloud computing""]",58,9,2025-10-25 21:49:34,en,What are the latest trends in {keyword} technology?,0.71,0.6897971961357761,0.8
38000995,cybersecurity,it,How can cybersecurity improve system performance and scalability?,implementation,Intermediate,"[""Introduction to cybersecurity"", ""Key points and analysis"", ""Practical examples"", ""Expert insights"", ""Action items"", ""Conclusion""]","[""software"", ""development"", ""it"", ""implementation"", ""cybersecurity""]",4,Junior to Mid-level Developers,"[""machine learning"", ""data science"", ""cloud computing"", ""web development""]",65,8,2025-10-25 21:49:34,en,How can {keyword} improve system performance and scalability?,0.73,0.7663152693171382,0.64
38000996,brand management,marketing,How do you improve brand management conversion rates?,evaluation,Expert,"[""Overview of brand management"", ""Step-by-step implementation"", ""Best practices and tips"", ""Common challenges and solutions"", ""Tools and resources needed"", ""Conclusion and next steps""]","[""marketing"", ""management"", ""advertising"", ""branding"", ""evaluation"", ""brand""]",6,Marketing Directors & CMOs,"[""social media"", ""content marketing"", ""digital marketing""]",53,8,2025-10-25 21:49:34,en,How do you improve {keyword} conversion rates?,0.69,1.0,0.39
38000997,social media,marketing,What A/B tests should you run for social media?,evaluation,Advanced,"[""Introduction to social media"", ""Key points and analysis"", ""Practical examples"", ""Expert insights"", ""Action items"", ""Conclusion""]","[""media"", ""promotion"", ""marketing"", ""social"", ""advertising"", ""evaluation""]",4,Marketing Managers & Strategists,"[""brand management"", ""digital marketing"", ""content marketing""]",47,9,2025-10-25 21:49:34,en,What A/B tests should you run for {keyword}?,0.74,0.9806742416838136,0.64
38000998,machine learning,it,How do you implement machine learning in a production environment?,evaluation,Intermediate,"[""Overview of machine learning"", ""Step-by-step implementation"", ""Best practices and tips"", ""Common challenges and solutions"", ""Tools and resources needed"", ""Conclusion and next steps""]","[""development"", ""it"", ""programming"", ""learning"", ""evaluation"", ""machine""]",6,Junior to Mid-level Developers,"[""cloud computing"", ""data science"", ""web development"", ""cybersecurity""]",66,10,2025-10-25 21:49:34,en,How do you implement {keyword} in a production environment?,0.93,0.6394061632035447,0.36
38000999,content marketing,marketing,How do you innovate within content marketing?,evaluation,Expert,"[""Overview of content marketing"", ""Step-by-step implementation"", ""Best practices and tips"", ""Common challenges and solutions"", ""Tools and resources needed"", ""Conclusion and next steps""]","[""content"", ""promotion"", ""marketing"", ""advertising"", ""evaluation""]",6,Marketing Directors & CMOs,"[""digital marketing"", ""brand management"", ""social media""]",45,7,2025-10-25 21:49:34,en,How do you innovate within {keyword}?,0.93,1.0,0.5
38001000,financial modeling,economics,How do you diversify your portfolio using financial modeling?,best_practice,Expert,"[""Overview of financial modeling"", ""Step-by-step implementation"", ""Best practices and tips"", ""Common challenges and solutions"", ""Tools and resources needed"", ""Conclusion and next steps""]","[""investment"", ""finance"", ""best_practice"", ""modeling"", ""financial"", ""economics""]",6,Portfolio Managers & Financial Experts,"[""market analysis"", ""investment planning"", ""portfolio management""]",61,9,2025-10-25 21:49:34,en,How do you diversify your portfolio using {keyword}?,0.73,1.0,0.42
