record_id,keyword,category,question,question_type,difficulty_level,answer_outline,tags,estimated_read_time,target_audience,related_topics,question_length,word_count,created_date,language,source_template,engagement_score,complexity_score,popularity_score
129,brand management,marketing,What KPIs are most important for brand management?,planning,Intermediate,"[""Introduction to brand management"", ""Key points and analysis"", ""Practical examples"", ""Expert insights"", ""Action items"", ""Conclusion""]","[""marketing"", ""management"", ""promotion"", ""planning"", ""advertising"", ""brand""]",4,Marketing Coordinators & Specialists,"[""digital marketing"", ""social media"", ""content marketing""]",50,8,2025-10-25 19:28:21,en,What KPIs are most important for {keyword}?,0.77,0.6970936437933403,0.66
130,brand management,marketing,How do you attribute success to brand management efforts?,how_to,Expert,"[""Overview of brand management"", ""Step-by-step implementation"", ""Best practices and tips"", ""Common challenges and solutions"", ""Tools and resources needed"", ""Conclusion and next steps""]","[""marketing"", ""management"", ""branding"", ""promotion"", ""brand"", ""how_to""]",6,Marketing Directors & CMOs,"[""social media"", ""digital marketing"", ""content marketing""]",57,9,2025-10-25 19:28:21,en,How do you attribute success to {keyword} efforts?,0.93,1.0,0.47
138,content marketing,marketing,How do you reach new customers through content marketing?,evaluation,Expert,"[""Overview of content marketing"", ""Step-by-step implementation"", ""Best practices and tips"", ""Common challenges and solutions"", ""Tools and resources needed"", ""Conclusion and next steps""]","[""marketing"", ""evaluation"", ""branding"", ""advertising"", ""content""]",6,Marketing Directors & CMOs,"[""brand management"", ""digital marketing"", ""social media""]",57,9,2025-10-25 19:28:21,en,How do you reach new customers through {keyword}?,0.92,1.0,0.62
142,brand management,marketing,What does the future hold for brand management?,optimization,Expert,"[""Introduction to brand management"", ""Key points and analysis"", ""Practical examples"", ""Expert insights"", ""Action items"", ""Conclusion""]","[""marketing"", ""management"", ""digital"", ""advertising"", ""brand"", ""optimization""]",4,Marketing Directors & CMOs,"[""content marketing"", ""social media"", ""digital marketing""]",47,8,2025-10-25 19:28:21,en,What does the future hold for {keyword}?,0.89,1.0,0.6
144,digital marketing,marketing,What KPIs are most important for digital marketing?,optimization,Beginner,"[""Introduction to digital marketing"", ""Key points and analysis"", ""Practical examples"", ""Expert insights"", ""Action items"", ""Conclusion""]","[""marketing"", ""branding"", ""digital"", ""advertising"", ""optimization""]",4,Marketing Students & Interns,"[""content marketing"", ""brand management"", ""social media""]",51,8,2025-10-25 19:28:21,en,What KPIs are most important for {keyword}?,0.74,0.4522047888915563,0.63
145,social media,marketing,What demographics respond best to social media?,evaluation,Advanced,"[""Introduction to social media"", ""Key points and analysis"", ""Practical examples"", ""Expert insights"", ""Action items"", ""Conclusion""]","[""marketing"", ""social"", ""evaluation"", ""branding"", ""digital"", ""media""]",4,Marketing Managers & Strategists,"[""brand management"", ""digital marketing"", ""content marketing""]",47,7,2025-10-25 19:28:21,en,What demographics respond best to {keyword}?,0.68,0.8570676371832557,0.42
150,digital marketing,marketing,What content types work best for digital marketing?,troubleshooting,Expert,"[""Introduction to digital marketing"", ""Key points and analysis"", ""Practical examples"", ""Expert insights"", ""Action items"", ""Conclusion""]","[""marketing"", ""digital"", ""troubleshooting"", ""promotion"", ""advertising""]",4,Marketing Directors & CMOs,"[""brand management"", ""content marketing"", ""social media""]",51,8,2025-10-25 19:28:21,en,What content types work best for {keyword}?,0.85,1.0,0.71
152,social media,marketing,What channels are most effective for social media?,implementation,Intermediate,"[""Introduction to social media"", ""Key points and analysis"", ""Practical examples"", ""Expert insights"", ""Action items"", ""Conclusion""]","[""marketing"", ""social"", ""branding"", ""promotion"", ""media"", ""implementation""]",4,Marketing Coordinators & Specialists,"[""content marketing"", ""brand management"", ""digital marketing""]",50,8,2025-10-25 19:28:21,en,What channels are most effective for {keyword}?,0.68,0.6636480427061511,0.49
155,digital marketing,marketing,How do you track and analyze digital marketing performance?,troubleshooting,Beginner,"[""Overview of digital marketing"", ""Step-by-step implementation"", ""Best practices and tips"", ""Common challenges and solutions"", ""Tools and resources needed"", ""Conclusion and next steps""]","[""marketing"", ""branding"", ""digital"", ""troubleshooting"", ""promotion""]",6,Marketing Students & Interns,"[""social media"", ""brand management"", ""content marketing""]",59,9,2025-10-25 19:28:21,en,How do you track and analyze {keyword} performance?,0.83,0.345986474604661,0.51
157,content marketing,marketing,How do you automate content marketing processes?,comparison,Beginner,"[""Overview of content marketing"", ""Step-by-step implementation"", ""Best practices and tips"", ""Common challenges and solutions"", ""Tools and resources needed"", ""Conclusion and next steps""]","[""marketing"", ""digital"", ""advertising"", ""content"", ""comparison""]",6,Marketing Students & Interns,"[""digital marketing"", ""brand management"", ""social media""]",48,7,2025-10-25 19:28:21,en,How do you automate {keyword} processes?,0.82,0.4484086360710445,0.45
165,digital marketing,marketing,What KPIs are most important for digital marketing?,comparison,Advanced,"[""Introduction to digital marketing"", ""Key points and analysis"", ""Practical examples"", ""Expert insights"", ""Action items"", ""Conclusion""]","[""marketing"", ""branding"", ""digital"", ""promotion"", ""comparison""]",4,Marketing Managers & Strategists,"[""content marketing"", ""brand management"", ""social media""]",51,8,2025-10-25 19:28:21,en,What KPIs are most important for {keyword}?,0.76,0.8672778801967367,0.41
169,brand management,marketing,How do you track and analyze brand management performance?,strategy,Beginner,"[""Overview of brand management"", ""Step-by-step implementation"", ""Best practices and tips"", ""Common challenges and solutions"", ""Tools and resources needed"", ""Conclusion and next steps""]","[""marketing"", ""management"", ""strategy"", ""branding"", ""digital"", ""brand""]",6,Marketing Students & Interns,"[""digital marketing"", ""social media"", ""content marketing""]",58,9,2025-10-25 19:28:21,en,How do you track and analyze {keyword} performance?,0.9,0.3925819617832157,0.36
170,social media,marketing,What budget should be allocated to social media?,analysis,Intermediate,"[""Introduction to social media"", ""Key points and analysis"", ""Practical examples"", ""Expert insights"", ""Action items"", ""Conclusion""]","[""marketing"", ""social"", ""digital"", ""promotion"", ""media"", ""analysis""]",4,Marketing Coordinators & Specialists,"[""content marketing"", ""brand management"", ""digital marketing""]",48,8,2025-10-25 19:28:21,en,What budget should be allocated to {keyword}?,0.81,0.6927160264083112,0.62
172,brand management,marketing,What emerging platforms support brand management?,evaluation,Expert,"[""Introduction to brand management"", ""Key points and analysis"", ""Practical examples"", ""Expert insights"", ""Action items"", ""Conclusion""]","[""marketing"", ""evaluation"", ""management"", ""promotion"", ""advertising"", ""brand""]",4,Marketing Directors & CMOs,"[""social media"", ""content marketing"", ""digital marketing""]",49,6,2025-10-25 19:28:21,en,What emerging platforms support {keyword}?,0.8,1.0,0.66
174,brand management,marketing,What tools are essential for brand management analytics?,optimization,Intermediate,"[""Introduction to brand management"", ""Key points and analysis"", ""Practical examples"", ""Expert insights"", ""Action items"", ""Conclusion""]","[""marketing"", ""management"", ""branding"", ""digital"", ""brand"", ""optimization""]",4,Marketing Coordinators & Specialists,"[""content marketing"", ""social media"", ""digital marketing""]",56,8,2025-10-25 19:28:21,en,What tools are essential for {keyword} analytics?,0.65,0.724471536157829,0.72
176,brand management,marketing,What demographics respond best to brand management?,implementation,Beginner,"[""Introduction to brand management"", ""Key points and analysis"", ""Practical examples"", ""Expert insights"", ""Action items"", ""Conclusion""]","[""marketing"", ""management"", ""branding"", ""digital"", ""brand"", ""implementation""]",4,Marketing Students & Interns,"[""social media"", ""content marketing"", ""digital marketing""]",51,7,2025-10-25 19:28:21,en,What demographics respond best to {keyword}?,0.86,0.4266156228780134,0.76
179,digital marketing,marketing,What does the future hold for digital marketing?,planning,Beginner,"[""Introduction to digital marketing"", ""Key points and analysis"", ""Practical examples"", ""Expert insights"", ""Action items"", ""Conclusion""]","[""marketing"", ""digital"", ""planning"", ""advertising""]",4,Marketing Students & Interns,"[""content marketing"", ""brand management"", ""social media""]",48,8,2025-10-25 19:28:21,en,What does the future hold for {keyword}?,0.63,0.4808672785995208,0.79
181,content marketing,marketing,What timing strategies work for content marketing?,analysis,Intermediate,"[""Introduction to content marketing"", ""Key points and analysis"", ""Practical examples"", ""Expert insights"", ""Action items"", ""Conclusion""]","[""marketing"", ""branding"", ""analysis"", ""advertising"", ""content""]",4,Marketing Coordinators & Specialists,"[""social media"", ""digital marketing"", ""brand management""]",50,7,2025-10-25 19:28:21,en,What timing strategies work for {keyword}?,0.85,0.606786244095562,0.31
184,content marketing,marketing,What A/B tests should you run for content marketing?,troubleshooting,Beginner,"[""Introduction to content marketing"", ""Key points and analysis"", ""Practical examples"", ""Expert insights"", ""Action items"", ""Conclusion""]","[""marketing"", ""digital"", ""troubleshooting"", ""promotion"", ""content""]",4,Marketing Students & Interns,"[""digital marketing"", ""brand management"", ""social media""]",52,9,2025-10-25 19:28:21,en,What A/B tests should you run for {keyword}?,0.79,0.4704857142615807,0.8
186,social media,marketing,What messaging works best in social media campaigns?,strategy,Beginner,"[""Introduction to social media"", ""Key points and analysis"", ""Practical examples"", ""Expert insights"", ""Action items"", ""Conclusion""]","[""marketing"", ""social"", ""strategy"", ""promotion"", ""digital"", ""media""]",4,Marketing Students & Interns,"[""digital marketing"", ""brand management"", ""content marketing""]",52,8,2025-10-25 19:28:21,en,What messaging works best in {keyword} campaigns?,0.93,0.4310288432377376,0.79
189,social media,marketing,How do you create a social media roadmap?,how_to,Beginner,"[""Overview of social media"", ""Step-by-step implementation"", ""Best practices and tips"", ""Common challenges and solutions"", ""Tools and resources needed"", ""Conclusion and next steps""]","[""marketing"", ""social"", ""promotion"", ""digital"", ""media"", ""how_to""]",6,Marketing Students & Interns,"[""digital marketing"", ""content marketing"", ""brand management""]",41,8,2025-10-25 19:28:21,en,How do you create a {keyword} roadmap?,0.75,0.3439004441235488,0.8
191,social media,marketing,How do you create a social media roadmap?,evaluation,Advanced,"[""Overview of social media"", ""Step-by-step implementation"", ""Best practices and tips"", ""Common challenges and solutions"", ""Tools and resources needed"", ""Conclusion and next steps""]","[""marketing"", ""social"", ""evaluation"", ""promotion"", ""digital"", ""media""]",6,Marketing Managers & Strategists,"[""brand management"", ""digital marketing"", ""content marketing""]",41,8,2025-10-25 19:28:21,en,How do you create a {keyword} roadmap?,0.85,0.8647809137381528,0.71
192,content marketing,marketing,What timing strategies work for content marketing?,implementation,Intermediate,"[""Introduction to content marketing"", ""Key points and analysis"", ""Practical examples"", ""Expert insights"", ""Action items"", ""Conclusion""]","[""marketing"", ""digital"", ""advertising"", ""content"", ""implementation""]",4,Marketing Coordinators & Specialists,"[""social media"", ""brand management"", ""digital marketing""]",50,7,2025-10-25 19:28:21,en,What timing strategies work for {keyword}?,0.82,0.6093691947926948,0.51
193,digital marketing,marketing,How do you develop an effective digital marketing strategy?,evaluation,Advanced,"[""Overview of digital marketing"", ""Step-by-step implementation"", ""Best practices and tips"", ""Common challenges and solutions"", ""Tools and resources needed"", ""Conclusion and next steps""]","[""marketing"", ""evaluation"", ""branding"", ""digital"", ""advertising""]",6,Marketing Managers & Strategists,"[""social media"", ""brand management"", ""content marketing""]",59,9,2025-10-25 19:28:21,en,How do you develop an effective {keyword} strategy?,0.89,0.8399472329359057,0.31
195,brand management,marketing,What content types work best for brand management?,how_to,Beginner,"[""Introduction to brand management"", ""Key points and analysis"", ""Practical examples"", ""Expert insights"", ""Action items"", ""Conclusion""]","[""marketing"", ""management"", ""digital"", ""advertising"", ""brand"", ""how_to""]",4,Marketing Students & Interns,"[""digital marketing"", ""content marketing"", ""social media""]",50,8,2025-10-25 19:28:21,en,What content types work best for {keyword}?,0.69,0.4044037256222196,0.65
198,social media,marketing,How do you measure the ROI of social media campaigns?,implementation,Beginner,"[""Overview of social media"", ""Step-by-step implementation"", ""Best practices and tips"", ""Common challenges and solutions"", ""Tools and resources needed"", ""Conclusion and next steps""]","[""marketing"", ""social"", ""branding"", ""promotion"", ""media"", ""implementation""]",6,Marketing Students & Interns,"[""brand management"", ""digital marketing"", ""content marketing""]",53,10,2025-10-25 19:28:21,en,How do you measure the ROI of {keyword} campaigns?,0.7,0.3112933120303062,0.41
202,content marketing,marketing,What are the latest trends in content marketing?,best_practice,Beginner,"[""Introduction to content marketing"", ""Key concepts and definitions"", ""Main categories or types"", ""Examples and case studies"", ""Benefits and advantages"", ""Summary and recommendations""]","[""marketing"", ""best_practice"", ""branding"", ""promotion"", ""content""]",6,Marketing Students & Interns,"[""brand management"", ""social media"", ""digital marketing""]",48,8,2025-10-25 19:28:21,en,What are the latest trends in {keyword}?,0.72,0.369451691205875,0.68
204,social media,marketing,What are the latest trends in social media?,best_practice,Intermediate,"[""Introduction to social media"", ""Key concepts and definitions"", ""Main categories or types"", ""Examples and case studies"", ""Benefits and advantages"", ""Summary and recommendations""]","[""marketing"", ""best_practice"", ""social"", ""branding"", ""digital"", ""media""]",6,Marketing Coordinators & Specialists,"[""content marketing"", ""brand management"", ""digital marketing""]",43,8,2025-10-25 19:28:21,en,What are the latest trends in {keyword}?,0.74,0.7770579857351543,0.61
206,content marketing,marketing,How do you innovate within content marketing?,evaluation,Intermediate,"[""Overview of content marketing"", ""Step-by-step implementation"", ""Best practices and tips"", ""Common challenges and solutions"", ""Tools and resources needed"", ""Conclusion and next steps""]","[""marketing"", ""evaluation"", ""branding"", ""advertising"", ""content""]",6,Marketing Coordinators & Specialists,"[""social media"", ""brand management"", ""digital marketing""]",45,7,2025-10-25 19:28:21,en,How do you innovate within {keyword}?,0.88,0.6111355286344148,0.51
207,brand management,marketing,What does the future hold for brand management?,troubleshooting,Intermediate,"[""Introduction to brand management"", ""Key points and analysis"", ""Practical examples"", ""Expert insights"", ""Action items"", ""Conclusion""]","[""marketing"", ""management"", ""branding"", ""troubleshooting"", ""advertising"", ""brand""]",4,Marketing Coordinators & Specialists,"[""content marketing"", ""social media"", ""digital marketing""]",47,8,2025-10-25 19:28:21,en,What does the future hold for {keyword}?,0.92,0.7030325397256546,0.88
209,digital marketing,marketing,How do you identify the right audience for digital marketing?,troubleshooting,Advanced,"[""Overview of digital marketing"", ""Step-by-step implementation"", ""Best practices and tips"", ""Common challenges and solutions"", ""Tools and resources needed"", ""Conclusion and next steps""]","[""marketing"", ""digital"", ""troubleshooting"", ""promotion"", ""advertising""]",6,Marketing Managers & Strategists,"[""brand management"", ""content marketing"", ""social media""]",61,10,2025-10-25 19:28:21,en,How do you identify the right audience for {keyword}?,0.87,0.9687718046146968,0.4
212,brand management,marketing,What budget should be allocated to brand management?,analysis,Advanced,"[""Introduction to brand management"", ""Key points and analysis"", ""Practical examples"", ""Expert insights"", ""Action items"", ""Conclusion""]","[""marketing"", ""management"", ""branding"", ""digital"", ""analysis"", ""brand""]",4,Marketing Managers & Strategists,"[""digital marketing"", ""social media"", ""content marketing""]",52,8,2025-10-25 19:28:21,en,What budget should be allocated to {keyword}?,0.92,0.8194816238149849,0.63
213,social media,marketing,What messaging works best in social media campaigns?,analysis,Advanced,"[""Introduction to social media"", ""Key points and analysis"", ""Practical examples"", ""Expert insights"", ""Action items"", ""Conclusion""]","[""marketing"", ""social"", ""digital"", ""media"", ""analysis"", ""advertising""]",4,Marketing Managers & Strategists,"[""content marketing"", ""brand management"", ""digital marketing""]",52,8,2025-10-25 19:28:21,en,What messaging works best in {keyword} campaigns?,0.8,0.9930665851727782,0.45
215,content marketing,marketing,How do you measure the ROI of content marketing campaigns?,comparison,Beginner,"[""Overview of content marketing"", ""Step-by-step implementation"", ""Best practices and tips"", ""Common challenges and solutions"", ""Tools and resources needed"", ""Conclusion and next steps""]","[""marketing"", ""promotion"", ""advertising"", ""content"", ""comparison""]",6,Marketing Students & Interns,"[""social media"", ""brand management"", ""digital marketing""]",58,10,2025-10-25 19:28:21,en,How do you measure the ROI of {keyword} campaigns?,0.93,0.4606243374000464,0.75
217,content marketing,marketing,What are the latest trends in content marketing?,best_practice,Expert,"[""Introduction to content marketing"", ""Key concepts and definitions"", ""Main categories or types"", ""Examples and case studies"", ""Benefits and advantages"", ""Summary and recommendations""]","[""marketing"", ""best_practice"", ""digital"", ""advertising"", ""content""]",6,Marketing Directors & CMOs,"[""digital marketing"", ""brand management"", ""social media""]",48,8,2025-10-25 19:28:21,en,What are the latest trends in {keyword}?,0.93,1.0,0.47
218,brand management,marketing,What channels are most effective for brand management?,strategy,Intermediate,"[""Introduction to brand management"", ""Key points and analysis"", ""Practical examples"", ""Expert insights"", ""Action items"", ""Conclusion""]","[""marketing"", ""management"", ""strategy"", ""digital"", ""advertising"", ""brand""]",4,Marketing Coordinators & Specialists,"[""digital marketing"", ""social media"", ""content marketing""]",54,8,2025-10-25 19:28:21,en,What channels are most effective for {keyword}?,0.86,0.7806371332673638,0.78
221,social media,marketing,How do you personalize social media for different segments?,best_practice,Intermediate,"[""Overview of social media"", ""Step-by-step implementation"", ""Best practices and tips"", ""Common challenges and solutions"", ""Tools and resources needed"", ""Conclusion and next steps""]","[""marketing"", ""best_practice"", ""social"", ""branding"", ""media"", ""advertising""]",6,Marketing Coordinators & Specialists,"[""brand management"", ""digital marketing"", ""content marketing""]",59,9,2025-10-25 19:28:21,en,How do you personalize {keyword} for different segments?,0.91,0.7775944596630824,0.62
223,brand management,marketing,How do you develop an effective brand management strategy?,optimization,Intermediate,"[""Overview of brand management"", ""Step-by-step implementation"", ""Best practices and tips"", ""Common challenges and solutions"", ""Tools and resources needed"", ""Conclusion and next steps""]","[""marketing"", ""management"", ""promotion"", ""advertising"", ""brand"", ""optimization""]",6,Marketing Coordinators & Specialists,"[""digital marketing"", ""content marketing"", ""social media""]",58,9,2025-10-25 19:28:21,en,How do you develop an effective {keyword} strategy?,0.82,0.6361394289313199,0.32
226,digital marketing,marketing,How do you automate digital marketing processes?,planning,Advanced,"[""Overview of digital marketing"", ""Step-by-step implementation"", ""Best practices and tips"", ""Common challenges and solutions"", ""Tools and resources needed"", ""Conclusion and next steps""]","[""marketing"", ""branding"", ""digital"", ""promotion"", ""planning""]",6,Marketing Managers & Strategists,"[""content marketing"", ""social media"", ""brand management""]",48,7,2025-10-25 19:28:21,en,How do you automate {keyword} processes?,0.69,0.8575204204284138,0.53
231,brand management,marketing,What messaging works best in brand management campaigns?,strategy,Advanced,"[""Introduction to brand management"", ""Key points and analysis"", ""Practical examples"", ""Expert insights"", ""Action items"", ""Conclusion""]","[""marketing"", ""management"", ""strategy"", ""branding"", ""promotion"", ""brand""]",4,Marketing Managers & Strategists,"[""social media"", ""content marketing"", ""digital marketing""]",56,8,2025-10-25 19:28:21,en,What messaging works best in {keyword} campaigns?,0.67,0.8745024663756299,0.72
232,social media,marketing,What timing strategies work for social media?,how_to,Intermediate,"[""Introduction to social media"", ""Key points and analysis"", ""Practical examples"", ""Expert insights"", ""Action items"", ""Conclusion""]","[""marketing"", ""social"", ""branding"", ""digital"", ""media"", ""how_to""]",4,Marketing Coordinators & Specialists,"[""content marketing"", ""digital marketing"", ""brand management""]",45,7,2025-10-25 19:28:21,en,What timing strategies work for {keyword}?,0.85,0.7732569071084953,0.61
236,brand management,marketing,How do you attribute success to brand management efforts?,optimization,Expert,"[""Overview of brand management"", ""Step-by-step implementation"", ""Best practices and tips"", ""Common challenges and solutions"", ""Tools and resources needed"", ""Conclusion and next steps""]","[""marketing"", ""management"", ""branding"", ""promotion"", ""brand"", ""optimization""]",6,Marketing Directors & CMOs,"[""digital marketing"", ""content marketing"", ""social media""]",57,9,2025-10-25 19:28:21,en,How do you attribute success to {keyword} efforts?,0.85,1.0,0.84
238,content marketing,marketing,What channels are most effective for content marketing?,troubleshooting,Beginner,"[""Introduction to content marketing"", ""Key points and analysis"", ""Practical examples"", ""Expert insights"", ""Action items"", ""Conclusion""]","[""marketing"", ""branding"", ""troubleshooting"", ""advertising"", ""content""]",4,Marketing Students & Interns,"[""brand management"", ""digital marketing"", ""social media""]",55,8,2025-10-25 19:28:21,en,What channels are most effective for {keyword}?,0.78,0.4765764339951412,0.69
240,brand management,marketing,How do you create a brand management roadmap?,comparison,Expert,"[""Overview of brand management"", ""Step-by-step implementation"", ""Best practices and tips"", ""Common challenges and solutions"", ""Tools and resources needed"", ""Conclusion and next steps""]","[""marketing"", ""management"", ""digital"", ""promotion"", ""brand"", ""comparison""]",6,Marketing Directors & CMOs,"[""social media"", ""content marketing"", ""digital marketing""]",45,8,2025-10-25 19:28:21,en,How do you create a {keyword} roadmap?,0.67,1.0,0.75
243,digital marketing,marketing,What KPIs are most important for digital marketing?,evaluation,Advanced,"[""Introduction to digital marketing"", ""Key points and analysis"", ""Practical examples"", ""Expert insights"", ""Action items"", ""Conclusion""]","[""marketing"", ""evaluation"", ""branding"", ""digital"", ""promotion""]",4,Marketing Managers & Strategists,"[""content marketing"", ""social media"", ""brand management""]",51,8,2025-10-25 19:28:21,en,What KPIs are most important for {keyword}?,0.65,0.8390813651631891,0.33
