record_id,keyword,category,question,question_type,difficulty_level,answer_outline,tags,estimated_read_time,target_audience,related_topics,question_length,word_count,created_date,language,source_template,engagement_score,complexity_score,popularity_score
30300350,social media,marketing,How do you automate social media processes?,optimization,Beginner,"[""Overview of social media"", ""Step-by-step implementation"", ""Best practices and tips"", ""Common challenges and solutions"", ""Tools and resources needed"", ""Conclusion and next steps""]","[""media"", ""promotion"", ""marketing"", ""digital"", ""social"", ""optimization""]",6,Marketing Students & Interns,"[""content marketing"", ""digital marketing"", ""brand management""]",43,7,2025-10-25 21:38:46,en,How do you automate {keyword} processes?,0.83,0.37329689120311504,0.58
30300351,cloud computing,it,How can cloud computing improve system performance and scalability?,analysis,Beginner,"[""Introduction to cloud computing"", ""Key points and analysis"", ""Practical examples"", ""Expert insights"", ""Action items"", ""Conclusion""]","[""computing"", ""software"", ""analysis"", ""it"", ""programming"", ""cloud""]",4,Students & Entry-level Developers,"[""machine learning"", ""web development"", ""cybersecurity"", ""data science""]",67,9,2025-10-25 21:38:46,en,How can {keyword} improve system performance and scalability?,0.77,0.35976193909953447,0.37
30300352,content marketing,marketing,What KPIs are most important for content marketing?,strategy,Advanced,"[""Introduction to content marketing"", ""Key points and analysis"", ""Practical examples"", ""Expert insights"", ""Action items"", ""Conclusion""]","[""content"", ""marketing"", ""advertising"", ""branding"", ""strategy""]",4,Marketing Managers & Strategists,"[""brand management"", ""digital marketing"", ""social media""]",51,8,2025-10-25 21:38:46,en,What KPIs are most important for {keyword}?,0.76,0.9385334225111894,0.84
30300353,financial modeling,economics,What are the seasonal patterns in financial modeling?,how_to,Advanced,"[""Introduction to financial modeling"", ""Key concepts and definitions"", ""Main categories or types"", ""Examples and case studies"", ""Benefits and advantages"", ""Summary and recommendations""]","[""investment"", ""how_to"", ""modeling"", ""financial"", ""business"", ""economics""]",6,Professional Investors & Advisors,"[""market analysis"", ""portfolio management"", ""investment planning""]",53,8,2025-10-25 21:38:46,en,What are the seasonal patterns in {keyword}?,0.77,0.8719715113408611,0.45
30300354,machine learning,it,How do you get started with machine learning as a beginner?,troubleshooting,Advanced,"[""Overview of machine learning"", ""Step-by-step implementation"", ""Best practices and tips"", ""Common challenges and solutions"", ""Tools and resources needed"", ""Conclusion and next steps""]","[""it"", ""programming"", ""troubleshooting"", ""learning"", ""machine"", ""technology""]",6,Senior Developers & Tech Leads,"[""web development"", ""cybersecurity"", ""data science"", ""cloud computing""]",59,11,2025-10-25 21:38:46,en,How do you get started with {keyword} as a beginner?,0.86,0.9294718066539736,0.52
30300355,data science,it,How do you stay updated with data science developments?,planning,Intermediate,"[""Overview of data science"", ""Step-by-step implementation"", ""Best practices and tips"", ""Common challenges and solutions"", ""Tools and resources needed"", ""Conclusion and next steps""]","[""planning"", ""software"", ""it"", ""programming"", ""science"", ""data""]",6,Junior to Mid-level Developers,"[""machine learning"", ""web development"", ""cloud computing"", ""cybersecurity""]",55,9,2025-10-25 21:38:46,en,How do you stay updated with {keyword} developments?,0.78,0.7444341576241243,0.85
30300356,brand management,marketing,What demographics respond best to brand management?,analysis,Beginner,"[""Introduction to brand management"", ""Key points and analysis"", ""Practical examples"", ""Expert insights"", ""Action items"", ""Conclusion""]","[""analysis"", ""promotion"", ""marketing"", ""management"", ""advertising"", ""brand""]",4,Marketing Students & Interns,"[""social media"", ""digital marketing"", ""content marketing""]",51,7,2025-10-25 21:38:46,en,What demographics respond best to {keyword}?,0.82,0.44518433605190616,0.66
30300357,cloud computing,it,How do you optimize cloud computing for different platforms?,planning,Intermediate,"[""Overview of cloud computing"", ""Step-by-step implementation"", ""Best practices and tips"", ""Common challenges and solutions"", ""Tools and resources needed"", ""Conclusion and next steps""]","[""computing"", ""software"", ""planning"", ""it"", ""development"", ""cloud""]",6,Junior to Mid-level Developers,"[""cybersecurity"", ""web development"", ""machine learning"", ""data science""]",60,9,2025-10-25 21:38:46,en,How do you optimize {keyword} for different platforms?,0.83,0.688824202545251,0.69
30300358,digital marketing,marketing,How do you identify the right audience for digital marketing?,planning,Beginner,"[""Overview of digital marketing"", ""Step-by-step implementation"", ""Best practices and tips"", ""Common challenges and solutions"", ""Tools and resources needed"", ""Conclusion and next steps""]","[""planning"", ""marketing"", ""digital"", ""advertising"", ""branding""]",6,Marketing Students & Interns,"[""brand management"", ""social media"", ""content marketing""]",61,10,2025-10-25 21:38:46,en,How do you identify the right audience for {keyword}?,0.74,0.39485805828556486,0.37
30300359,investment planning,economics,How do you measure investment planning performance?,how_to,Intermediate,"[""Overview of investment planning"", ""Step-by-step implementation"", ""Best practices and tips"", ""Common challenges and solutions"", ""Tools and resources needed"", ""Conclusion and next steps""]","[""investment"", ""how_to"", ""planning"", ""finance"", ""business"", ""economics""]",6,Individual Investors & Analysts,"[""portfolio management"", ""financial modeling"", ""market analysis""]",51,7,2025-10-25 21:38:46,en,How do you measure {keyword} performance?,0.93,0.6428071503075229,0.53
30300360,portfolio management,economics,How do you report on portfolio management performance to stakeholders?,troubleshooting,Beginner,"[""Overview of portfolio management"", ""Step-by-step implementation"", ""Best practices and tips"", ""Common challenges and solutions"", ""Tools and resources needed"", ""Conclusion and next steps""]","[""portfolio"", ""troubleshooting"", ""management"", ""market"", ""business"", ""economics""]",6,Students & New Investors,"[""investment planning"", ""market analysis"", ""financial modeling""]",70,10,2025-10-25 21:38:46,en,How do you report on {keyword} performance to stakeholders?,0.89,0.4729806031078274,0.47
30300361,content marketing,marketing,What KPIs are most important for content marketing?,planning,Intermediate,"[""Introduction to content marketing"", ""Key points and analysis"", ""Practical examples"", ""Expert insights"", ""Action items"", ""Conclusion""]","[""planning"", ""content"", ""promotion"", ""marketing"", ""advertising""]",4,Marketing Coordinators & Specialists,"[""social media"", ""brand management"", ""digital marketing""]",51,8,2025-10-25 21:38:46,en,What KPIs are most important for {keyword}?,0.65,0.7911743517242735,0.59
30300362,brand management,marketing,What emerging platforms support brand management?,comparison,Beginner,"[""Introduction to brand management"", ""Key points and analysis"", ""Practical examples"", ""Expert insights"", ""Action items"", ""Conclusion""]","[""promotion"", ""comparison"", ""marketing"", ""management"", ""advertising"", ""brand""]",4,Marketing Students & Interns,"[""digital marketing"", ""content marketing"", ""social media""]",49,6,2025-10-25 21:38:46,en,What emerging platforms support {keyword}?,0.87,0.34029153540624124,0.46
30300363,data science,it,How do you implement data science in a production environment?,comparison,Beginner,"[""Overview of data science"", ""Step-by-step implementation"", ""Best practices and tips"", ""Common challenges and solutions"", ""Tools and resources needed"", ""Conclusion and next steps""]","[""development"", ""it"", ""comparison"", ""programming"", ""science"", ""data""]",6,Students & Entry-level Developers,"[""cloud computing"", ""cybersecurity"", ""machine learning"", ""web development""]",62,10,2025-10-25 21:38:46,en,How do you implement {keyword} in a production environment?,0.95,0.41920905310229606,0.43
30300364,social media,marketing,What budget should be allocated to social media?,strategy,Advanced,"[""Introduction to social media"", ""Key points and analysis"", ""Practical examples"", ""Expert insights"", ""Action items"", ""Conclusion""]","[""media"", ""digital"", ""marketing"", ""social"", ""branding"", ""strategy""]",4,Marketing Managers & Strategists,"[""digital marketing"", ""content marketing"", ""brand management""]",48,8,2025-10-25 21:38:46,en,What budget should be allocated to {keyword}?,0.76,0.8640675704665162,0.73
30300365,financial modeling,economics,What indicators predict financial modeling market movements?,analysis,Intermediate,"[""Introduction to financial modeling"", ""Key points and analysis"", ""Practical examples"", ""Expert insights"", ""Action items"", ""Conclusion""]","[""analysis"", ""modeling"", ""financial"", ""market"", ""business"", ""economics""]",4,Individual Investors & Analysts,"[""market analysis"", ""portfolio management"", ""investment planning""]",60,7,2025-10-25 21:38:46,en,What indicators predict {keyword} market movements?,0.69,0.6527995058865244,0.84
30300366,brand management,marketing,What A/B tests should you run for brand management?,best_practice,Expert,"[""Introduction to brand management"", ""Key points and analysis"", ""Practical examples"", ""Expert insights"", ""Action items"", ""Conclusion""]","[""promotion"", ""best_practice"", ""marketing"", ""management"", ""digital"", ""brand""]",4,Marketing Directors & CMOs,"[""social media"", ""digital marketing"", ""content marketing""]",51,9,2025-10-25 21:38:46,en,What A/B tests should you run for {keyword}?,0.73,1.0,0.51
30300367,cybersecurity,it,What career opportunities exist in cybersecurity?,optimization,Intermediate,"[""Introduction to cybersecurity"", ""Key points and analysis"", ""Practical examples"", ""Expert insights"", ""Action items"", ""Conclusion""]","[""software"", ""it"", ""programming"", ""optimization"", ""cybersecurity""]",4,Junior to Mid-level Developers,"[""machine learning"", ""cloud computing"", ""data science"", ""web development""]",49,6,2025-10-25 21:38:46,en,What career opportunities exist in {keyword}?,0.61,0.6056415715801984,0.79
30300368,machine learning,it,What ROI can be expected from machine learning implementation?,best_practice,Intermediate,"[""Introduction to machine learning"", ""Key points and analysis"", ""Practical examples"", ""Expert insights"", ""Action items"", ""Conclusion""]","[""software"", ""it"", ""best_practice"", ""learning"", ""machine"", ""technology""]",4,Junior to Mid-level Developers,"[""cybersecurity"", ""cloud computing"", ""web development"", ""data science""]",62,9,2025-10-25 21:38:46,en,What ROI can be expected from {keyword} implementation?,0.82,0.7490169689562094,0.42
30300369,financial modeling,economics,How do you diversify your portfolio using financial modeling?,how_to,Advanced,"[""Overview of financial modeling"", ""Step-by-step implementation"", ""Best practices and tips"", ""Common challenges and solutions"", ""Tools and resources needed"", ""Conclusion and next steps""]","[""how_to"", ""finance"", ""modeling"", ""financial"", ""market"", ""economics""]",6,Professional Investors & Advisors,"[""investment planning"", ""market analysis"", ""portfolio management""]",61,9,2025-10-25 21:38:46,en,How do you diversify your portfolio using {keyword}?,0.68,0.9011395750349356,0.36
30300370,portfolio management,economics,What are the risks associated with portfolio management?,planning,Advanced,"[""Introduction to portfolio management"", ""Key concepts and definitions"", ""Main categories or types"", ""Examples and case studies"", ""Benefits and advantages"", ""Summary and recommendations""]","[""planning"", ""finance"", ""portfolio"", ""management"", ""market"", ""economics""]",6,Professional Investors & Advisors,"[""financial modeling"", ""investment planning"", ""market analysis""]",56,8,2025-10-25 21:38:46,en,What are the risks associated with {keyword}?,0.86,0.9192919999174669,0.35
30300371,digital marketing,marketing,How do you identify the right audience for digital marketing?,comparison,Expert,"[""Overview of digital marketing"", ""Step-by-step implementation"", ""Best practices and tips"", ""Common challenges and solutions"", ""Tools and resources needed"", ""Conclusion and next steps""]","[""comparison"", ""marketing"", ""digital"", ""advertising"", ""branding""]",6,Marketing Directors & CMOs,"[""content marketing"", ""social media"", ""brand management""]",61,10,2025-10-25 21:38:46,en,How do you identify the right audience for {keyword}?,0.84,1.0,0.62
30300372,data science,it,Which frameworks support data science implementation?,troubleshooting,Expert,"[""Introduction to data science"", ""Key points and analysis"", ""Practical examples"", ""Expert insights"", ""Action items"", ""Conclusion""]","[""software"", ""it"", ""programming"", ""troubleshooting"", ""science"", ""data""]",4,Architects & Technical Directors,"[""machine learning"", ""cloud computing"", ""web development"", ""cybersecurity""]",53,6,2025-10-25 21:38:46,en,Which frameworks support {keyword} implementation?,0.66,1.0,0.82
30300373,investment planning,economics,What timeline is realistic for investment planning returns?,evaluation,Expert,"[""Introduction to investment planning"", ""Key points and analysis"", ""Practical examples"", ""Expert insights"", ""Action items"", ""Conclusion""]","[""investment"", ""planning"", ""evaluation"", ""business"", ""economics""]",4,Portfolio Managers & Financial Experts,"[""financial modeling"", ""market analysis"", ""portfolio management""]",59,8,2025-10-25 21:38:46,en,What timeline is realistic for {keyword} returns?,0.68,1.0,0.55
30300374,machine learning,it,What career opportunities exist in machine learning?,evaluation,Expert,"[""Introduction to machine learning"", ""Key points and analysis"", ""Practical examples"", ""Expert insights"", ""Action items"", ""Conclusion""]","[""software"", ""development"", ""it"", ""learning"", ""evaluation"", ""machine""]",4,Architects & Technical Directors,"[""cybersecurity"", ""web development"", ""cloud computing"", ""data science""]",52,7,2025-10-25 21:38:46,en,What career opportunities exist in {keyword}?,0.86,1.0,0.69
30300375,portfolio management,economics,What are the risks associated with portfolio management?,best_practice,Advanced,"[""Introduction to portfolio management"", ""Key concepts and definitions"", ""Main categories or types"", ""Examples and case studies"", ""Benefits and advantages"", ""Summary and recommendations""]","[""investment"", ""finance"", ""portfolio"", ""best_practice"", ""management"", ""economics""]",6,Professional Investors & Advisors,"[""financial modeling"", ""investment planning"", ""market analysis""]",56,8,2025-10-25 21:38:46,en,What are the risks associated with {keyword}?,0.63,0.8562810463637525,0.73
30300376,financial modeling,economics,How do you analyze market trends in financial modeling?,comparison,Beginner,"[""Overview of financial modeling"", ""Step-by-step implementation"", ""Best practices and tips"", ""Common challenges and solutions"", ""Tools and resources needed"", ""Conclusion and next steps""]","[""investment"", ""comparison"", ""modeling"", ""financial"", ""business"", ""economics""]",6,Students & New Investors,"[""investment planning"", ""portfolio management"", ""market analysis""]",55,9,2025-10-25 21:38:46,en,How do you analyze market trends in {keyword}?,0.74,0.40931126288751474,0.65
30300377,investment planning,economics,What indicators predict investment planning market movements?,evaluation,Advanced,"[""Introduction to investment planning"", ""Key points and analysis"", ""Practical examples"", ""Expert insights"", ""Action items"", ""Conclusion""]","[""investment"", ""planning"", ""finance"", ""evaluation"", ""market"", ""economics""]",4,Professional Investors & Advisors,"[""market analysis"", ""portfolio management"", ""financial modeling""]",61,7,2025-10-25 21:38:46,en,What indicators predict {keyword} market movements?,0.79,0.807118143880517,0.43
30300378,brand management,marketing,How do you reach new customers through brand management?,comparison,Expert,"[""Overview of brand management"", ""Step-by-step implementation"", ""Best practices and tips"", ""Common challenges and solutions"", ""Tools and resources needed"", ""Conclusion and next steps""]","[""comparison"", ""marketing"", ""management"", ""advertising"", ""branding"", ""brand""]",6,Marketing Directors & CMOs,"[""content marketing"", ""social media"", ""digital marketing""]",56,9,2025-10-25 21:38:46,en,How do you reach new customers through {keyword}?,0.91,1.0,0.38
30300379,data science,it,What ROI can be expected from data science implementation?,strategy,Beginner,"[""Introduction to data science"", ""Key points and analysis"", ""Practical examples"", ""Expert insights"", ""Action items"", ""Conclusion""]","[""software"", ""development"", ""it"", ""science"", ""strategy"", ""data""]",4,Students & Entry-level Developers,"[""cybersecurity"", ""machine learning"", ""web development"", ""cloud computing""]",58,9,2025-10-25 21:38:46,en,What ROI can be expected from {keyword} implementation?,0.71,0.4279871080384805,0.68
30300380,digital marketing,marketing,What does the future hold for digital marketing?,evaluation,Beginner,"[""Introduction to digital marketing"", ""Key points and analysis"", ""Practical examples"", ""Expert insights"", ""Action items"", ""Conclusion""]","[""promotion"", ""marketing"", ""digital"", ""advertising"", ""evaluation""]",4,Marketing Students & Interns,"[""brand management"", ""social media"", ""content marketing""]",48,8,2025-10-25 21:38:46,en,What does the future hold for {keyword}?,0.62,0.40643606838190144,0.78
30300381,data science,it,How do you get started with data science as a beginner?,best_practice,Advanced,"[""Overview of data science"", ""Step-by-step implementation"", ""Best practices and tips"", ""Common challenges and solutions"", ""Tools and resources needed"", ""Conclusion and next steps""]","[""development"", ""it"", ""best_practice"", ""programming"", ""science"", ""data""]",6,Senior Developers & Tech Leads,"[""web development"", ""machine learning"", ""cybersecurity"", ""cloud computing""]",55,11,2025-10-25 21:38:46,en,How do you get started with {keyword} as a beginner?,0.87,0.8489385725327032,0.83
30300382,investment planning,economics,What are the risks associated with investment planning?,planning,Advanced,"[""Introduction to investment planning"", ""Key concepts and definitions"", ""Main categories or types"", ""Examples and case studies"", ""Benefits and advantages"", ""Summary and recommendations""]","[""investment"", ""planning"", ""finance"", ""business"", ""economics""]",6,Professional Investors & Advisors,"[""market analysis"", ""financial modeling"", ""portfolio management""]",55,8,2025-10-25 21:38:46,en,What are the risks associated with {keyword}?,0.73,0.876430075569825,0.56
30300383,market analysis,economics,How do you benchmark market analysis against alternatives?,analysis,Intermediate,"[""Overview of market analysis"", ""Step-by-step implementation"", ""Best practices and tips"", ""Common challenges and solutions"", ""Tools and resources needed"", ""Conclusion and next steps""]","[""finance"", ""analysis"", ""market"", ""business"", ""economics""]",6,Individual Investors & Analysts,"[""portfolio management"", ""financial modeling"", ""investment planning""]",58,8,2025-10-25 21:38:46,en,How do you benchmark {keyword} against alternatives?,0.6,0.6117885234192462,0.65
30300384,web development,it,How do you choose the right technology stack for web development?,optimization,Beginner,"[""Overview of web development"", ""Step-by-step implementation"", ""Best practices and tips"", ""Common challenges and solutions"", ""Tools and resources needed"", ""Conclusion and next steps""]","[""development"", ""web"", ""it"", ""optimization"", ""technology""]",6,Students & Entry-level Developers,"[""machine learning"", ""cloud computing"", ""data science"", ""cybersecurity""]",65,11,2025-10-25 21:38:46,en,How do you choose the right technology stack for {keyword}?,0.69,0.3526400507423872,0.55
30300385,data science,it,How do you optimize data science for different platforms?,optimization,Advanced,"[""Overview of data science"", ""Step-by-step implementation"", ""Best practices and tips"", ""Common challenges and solutions"", ""Tools and resources needed"", ""Conclusion and next steps""]","[""technology"", ""development"", ""it"", ""science"", ""optimization"", ""data""]",6,Senior Developers & Tech Leads,"[""web development"", ""cloud computing"", ""cybersecurity"", ""machine learning""]",57,9,2025-10-25 21:38:46,en,How do you optimize {keyword} for different platforms?,0.64,0.8080025116380849,0.59
30300386,social media,marketing,What demographics respond best to social media?,evaluation,Intermediate,"[""Introduction to social media"", ""Key points and analysis"", ""Practical examples"", ""Expert insights"", ""Action items"", ""Conclusion""]","[""media"", ""promotion"", ""marketing"", ""social"", ""advertising"", ""evaluation""]",4,Marketing Coordinators & Specialists,"[""brand management"", ""digital marketing"", ""content marketing""]",47,7,2025-10-25 21:38:46,en,What demographics respond best to {keyword}?,0.77,0.7124056164846201,0.51
30300387,cloud computing,it,How do you measure the success of cloud computing projects?,best_practice,Beginner,"[""Overview of cloud computing"", ""Step-by-step implementation"", ""Best practices and tips"", ""Common challenges and solutions"", ""Tools and resources needed"", ""Conclusion and next steps""]","[""computing"", ""development"", ""it"", ""best_practice"", ""cloud"", ""technology""]",6,Students & Entry-level Developers,"[""web development"", ""data science"", ""machine learning"", ""cybersecurity""]",59,10,2025-10-25 21:38:46,en,How do you measure the success of {keyword} projects?,0.71,0.3924442615704882,0.54
30300388,content marketing,marketing,How do you create a content marketing roadmap?,planning,Expert,"[""Overview of content marketing"", ""Step-by-step implementation"", ""Best practices and tips"", ""Common challenges and solutions"", ""Tools and resources needed"", ""Conclusion and next steps""]","[""planning"", ""content"", ""promotion"", ""marketing"", ""digital""]",6,Marketing Directors & CMOs,"[""brand management"", ""social media"", ""digital marketing""]",46,8,2025-10-25 21:38:46,en,How do you create a {keyword} roadmap?,0.92,1.0,0.35
30300389,market analysis,economics,How do you adjust your market analysis strategy during volatility?,analysis,Beginner,"[""Overview of market analysis"", ""Step-by-step implementation"", ""Best practices and tips"", ""Common challenges and solutions"", ""Tools and resources needed"", ""Conclusion and next steps""]","[""investment"", ""analysis"", ""market"", ""business"", ""economics""]",6,Students & New Investors,"[""investment planning"", ""portfolio management"", ""financial modeling""]",66,10,2025-10-25 21:38:46,en,How do you adjust your {keyword} strategy during volatility?,0.61,0.3684070899299895,0.51
30300390,portfolio management,economics,What timeline is realistic for portfolio management returns?,strategy,Advanced,"[""Introduction to portfolio management"", ""Key points and analysis"", ""Practical examples"", ""Expert insights"", ""Action items"", ""Conclusion""]","[""portfolio"", ""management"", ""business"", ""market"", ""strategy"", ""economics""]",4,Professional Investors & Advisors,"[""investment planning"", ""financial modeling"", ""market analysis""]",60,8,2025-10-25 21:38:46,en,What timeline is realistic for {keyword} returns?,0.82,0.855896459146568,0.61
30300391,cybersecurity,it,How do you integrate cybersecurity with existing systems?,how_to,Intermediate,"[""Overview of cybersecurity"", ""Step-by-step implementation"", ""Best practices and tips"", ""Common challenges and solutions"", ""Tools and resources needed"", ""Conclusion and next steps""]","[""how_to"", ""development"", ""it"", ""cybersecurity"", ""technology""]",5,Junior to Mid-level Developers,"[""data science"", ""web development"", ""machine learning"", ""cloud computing""]",57,8,2025-10-25 21:38:46,en,How do you integrate {keyword} with existing systems?,0.9,0.6729743892829649,0.89
30300392,digital marketing,marketing,How do you track and analyze digital marketing performance?,comparison,Expert,"[""Overview of digital marketing"", ""Step-by-step implementation"", ""Best practices and tips"", ""Common challenges and solutions"", ""Tools and resources needed"", ""Conclusion and next steps""]","[""promotion"", ""comparison"", ""marketing"", ""digital"", ""branding""]",6,Marketing Directors & CMOs,"[""brand management"", ""content marketing"", ""social media""]",59,9,2025-10-25 21:38:46,en,How do you track and analyze {keyword} performance?,0.62,1.0,0.41
