record_id,keyword,category,question,question_type,difficulty_level,answer_outline,tags,estimated_read_time,target_audience,related_topics,question_length,word_count,created_date,language,source_template,engagement_score,complexity_score,popularity_score
48500001,investment planning,economics,How do you create a long-term plan for investment planning?,comparison,Advanced,"[""Overview of investment planning"", ""Step-by-step implementation"", ""Best practices and tips"", ""Common challenges and solutions"", ""Tools and resources needed"", ""Conclusion and next steps""]","[""investment"", ""planning"", ""finance"", ""comparison"", ""market"", ""economics""]",6,Professional Investors & Advisors,"[""market analysis"", ""financial modeling"", ""portfolio management""]",59,10,2025-10-25 22:04:17,en,How do you create a long-term plan for {keyword}?,0.69,0.8479144300260669,0.56
48500002,content marketing,marketing,How do you reach new customers through content marketing?,implementation,Intermediate,"[""Overview of content marketing"", ""Step-by-step implementation"", ""Best practices and tips"", ""Common challenges and solutions"", ""Tools and resources needed"", ""Conclusion and next steps""]","[""content"", ""implementation"", ""marketing"", ""advertising"", ""branding""]",6,Marketing Coordinators & Specialists,"[""social media"", ""brand management"", ""digital marketing""]",57,9,2025-10-25 22:04:17,en,How do you reach new customers through {keyword}?,0.66,0.7141282822876573,0.58
48500003,market analysis,economics,What indicators predict market analysis market movements?,best_practice,Beginner,"[""Introduction to market analysis"", ""Key points and analysis"", ""Practical examples"", ""Expert insights"", ""Action items"", ""Conclusion""]","[""investment"", ""analysis"", ""best_practice"", ""market"", ""economics""]",4,Students & New Investors,"[""financial modeling"", ""investment planning"", ""portfolio management""]",57,7,2025-10-25 22:04:17,en,What indicators predict {keyword} market movements?,0.93,0.30767205789851654,0.38
48500004,portfolio management,economics,What metrics are most important for portfolio management?,planning,Intermediate,"[""Introduction to portfolio management"", ""Key points and analysis"", ""Practical examples"", ""Expert insights"", ""Action items"", ""Conclusion""]","[""planning"", ""finance"", ""portfolio"", ""management"", ""business"", ""economics""]",4,Individual Investors & Analysts,"[""financial modeling"", ""investment planning"", ""market analysis""]",57,8,2025-10-25 22:04:17,en,What metrics are most important for {keyword}?,0.91,0.6700328494703368,0.82
48500005,machine learning,it,How do you stay updated with machine learning developments?,comparison,Advanced,"[""Overview of machine learning"", ""Step-by-step implementation"", ""Best practices and tips"", ""Common challenges and solutions"", ""Tools and resources needed"", ""Conclusion and next steps""]","[""development"", ""it"", ""comparison"", ""learning"", ""machine"", ""technology""]",6,Senior Developers & Tech Leads,"[""web development"", ""data science"", ""cloud computing"", ""cybersecurity""]",59,9,2025-10-25 22:04:17,en,How do you stay updated with {keyword} developments?,0.62,0.9955353653155805,0.31
48500006,data science,it,What are the key components of a data science implementation?,evaluation,Intermediate,"[""Introduction to data science"", ""Key concepts and definitions"", ""Main categories or types"", ""Examples and case studies"", ""Benefits and advantages"", ""Summary and recommendations""]","[""software"", ""it"", ""programming"", ""science"", ""evaluation"", ""data""]",6,Junior to Mid-level Developers,"[""cybersecurity"", ""web development"", ""cloud computing"", ""machine learning""]",61,10,2025-10-25 22:04:17,en,What are the key components of a {keyword} implementation?,0.71,0.6153499512523437,0.32
48500007,social media,marketing,What timing strategies work for social media?,how_to,Intermediate,"[""Introduction to social media"", ""Key points and analysis"", ""Practical examples"", ""Expert insights"", ""Action items"", ""Conclusion""]","[""how_to"", ""media"", ""promotion"", ""marketing"", ""social"", ""advertising""]",4,Marketing Coordinators & Specialists,"[""brand management"", ""digital marketing"", ""content marketing""]",45,7,2025-10-25 22:04:17,en,What timing strategies work for {keyword}?,0.79,0.744335299422536,0.54
48500008,brand management,marketing,What messaging works best in brand management campaigns?,evaluation,Beginner,"[""Introduction to brand management"", ""Key points and analysis"", ""Practical examples"", ""Expert insights"", ""Action items"", ""Conclusion""]","[""promotion"", ""marketing"", ""management"", ""digital"", ""evaluation"", ""brand""]",4,Marketing Students & Interns,"[""digital marketing"", ""social media"", ""content marketing""]",56,8,2025-10-25 22:04:17,en,What messaging works best in {keyword} campaigns?,0.72,0.3840053828788019,0.45
48500009,financial modeling,economics,How do you adjust your financial modeling strategy during volatility?,implementation,Intermediate,"[""Overview of financial modeling"", ""Step-by-step implementation"", ""Best practices and tips"", ""Common challenges and solutions"", ""Tools and resources needed"", ""Conclusion and next steps""]","[""investment"", ""implementation"", ""modeling"", ""financial"", ""business"", ""economics""]",6,Individual Investors & Analysts,"[""investment planning"", ""portfolio management"", ""market analysis""]",69,10,2025-10-25 22:04:17,en,How do you adjust your {keyword} strategy during volatility?,0.92,0.6148676850633169,0.63
48500010,cloud computing,it,What security considerations should be taken when using cloud computing?,how_to,Beginner,"[""Introduction to cloud computing"", ""Key points and analysis"", ""Practical examples"", ""Expert insights"", ""Action items"", ""Conclusion""]","[""computing"", ""how_to"", ""software"", ""development"", ""it"", ""cloud""]",4,Students & Entry-level Developers,"[""data science"", ""web development"", ""machine learning"", ""cybersecurity""]",72,10,2025-10-25 22:04:17,en,What security considerations should be taken when using {keyword}?,0.87,0.38816679276598476,0.39
48500011,social media,marketing,How do you reach new customers through social media?,implementation,Intermediate,"[""Overview of social media"", ""Step-by-step implementation"", ""Best practices and tips"", ""Common challenges and solutions"", ""Tools and resources needed"", ""Conclusion and next steps""]","[""media"", ""implementation"", ""marketing"", ""digital"", ""social"", ""branding""]",6,Marketing Coordinators & Specialists,"[""brand management"", ""content marketing"", ""digital marketing""]",52,9,2025-10-25 22:04:17,en,How do you reach new customers through {keyword}?,0.89,0.7424533572179456,0.47
48500012,data science,it,How do you stay updated with data science developments?,implementation,Beginner,"[""Overview of data science"", ""Step-by-step implementation"", ""Best practices and tips"", ""Common challenges and solutions"", ""Tools and resources needed"", ""Conclusion and next steps""]","[""technology"", ""it"", ""implementation"", ""programming"", ""science"", ""data""]",6,Students & Entry-level Developers,"[""web development"", ""cloud computing"", ""machine learning"", ""cybersecurity""]",55,9,2025-10-25 22:04:17,en,How do you stay updated with {keyword} developments?,0.81,0.3399533892747962,0.49
48500013,portfolio management,economics,What strategies work best for portfolio management investment?,troubleshooting,Beginner,"[""Introduction to portfolio management"", ""Key points and analysis"", ""Practical examples"", ""Expert insights"", ""Action items"", ""Conclusion""]","[""portfolio"", ""troubleshooting"", ""management"", ""market"", ""business"", ""economics""]",4,Students & New Investors,"[""market analysis"", ""investment planning"", ""financial modeling""]",62,8,2025-10-25 22:04:17,en,What strategies work best for {keyword} investment?,0.76,0.3817280304232431,0.52
48500014,investment planning,economics,How do economic conditions affect investment planning performance?,analysis,Beginner,"[""Introduction to investment planning"", ""Key points and analysis"", ""Practical examples"", ""Expert insights"", ""Action items"", ""Conclusion""]","[""investment"", ""planning"", ""analysis"", ""market"", ""business"", ""economics""]",4,Students & New Investors,"[""financial modeling"", ""portfolio management"", ""market analysis""]",66,8,2025-10-25 22:04:17,en,How do economic conditions affect {keyword} performance?,0.78,0.47031747233110527,0.77
48500015,market analysis,economics,How do you report on market analysis performance to stakeholders?,implementation,Expert,"[""Overview of market analysis"", ""Step-by-step implementation"", ""Best practices and tips"", ""Common challenges and solutions"", ""Tools and resources needed"", ""Conclusion and next steps""]","[""investment"", ""analysis"", ""implementation"", ""market"", ""business"", ""economics""]",6,Portfolio Managers & Financial Experts,"[""investment planning"", ""portfolio management"", ""financial modeling""]",65,10,2025-10-25 22:04:17,en,How do you report on {keyword} performance to stakeholders?,0.68,1.0,0.47
48500016,financial modeling,economics,How do economic conditions affect financial modeling performance?,troubleshooting,Expert,"[""Introduction to financial modeling"", ""Key points and analysis"", ""Practical examples"", ""Expert insights"", ""Action items"", ""Conclusion""]","[""investment"", ""troubleshooting"", ""modeling"", ""financial"", ""market"", ""economics""]",4,Portfolio Managers & Financial Experts,"[""portfolio management"", ""investment planning"", ""market analysis""]",65,8,2025-10-25 22:04:17,en,How do economic conditions affect {keyword} performance?,0.81,1.0,0.45
48500017,content marketing,marketing,What tools are essential for content marketing analytics?,comparison,Beginner,"[""Introduction to content marketing"", ""Key points and analysis"", ""Practical examples"", ""Expert insights"", ""Action items"", ""Conclusion""]","[""content"", ""comparison"", ""marketing"", ""advertising"", ""branding""]",4,Marketing Students & Interns,"[""brand management"", ""digital marketing"", ""social media""]",57,8,2025-10-25 22:04:17,en,What tools are essential for {keyword} analytics?,0.83,0.3998379048296213,0.67
48500018,machine learning,it,How do you troubleshoot common issues with machine learning?,analysis,Intermediate,"[""Overview of machine learning"", ""Step-by-step implementation"", ""Best practices and tips"", ""Common challenges and solutions"", ""Tools and resources needed"", ""Conclusion and next steps""]","[""software"", ""development"", ""analysis"", ""it"", ""learning"", ""machine""]",6,Junior to Mid-level Developers,"[""cybersecurity"", ""data science"", ""web development"", ""cloud computing""]",60,9,2025-10-25 22:04:17,en,How do you troubleshoot common issues with {keyword}?,0.85,0.7196733474394333,0.85
48500019,content marketing,marketing,How do you attribute success to content marketing efforts?,analysis,Beginner,"[""Overview of content marketing"", ""Step-by-step implementation"", ""Best practices and tips"", ""Common challenges and solutions"", ""Tools and resources needed"", ""Conclusion and next steps""]","[""content"", ""analysis"", ""promotion"", ""marketing"", ""branding""]",6,Marketing Students & Interns,"[""social media"", ""digital marketing"", ""brand management""]",58,9,2025-10-25 22:04:17,en,How do you attribute success to {keyword} efforts?,0.81,0.30696496494228875,0.31
48500020,brand management,marketing,What does the future hold for brand management?,comparison,Advanced,"[""Introduction to brand management"", ""Key points and analysis"", ""Practical examples"", ""Expert insights"", ""Action items"", ""Conclusion""]","[""promotion"", ""comparison"", ""marketing"", ""management"", ""branding"", ""brand""]",4,Marketing Managers & Strategists,"[""digital marketing"", ""social media"", ""content marketing""]",47,8,2025-10-25 22:04:17,en,What does the future hold for {keyword}?,0.7,0.9516594098500498,0.77
48500021,content marketing,marketing,What budget should be allocated to content marketing?,optimization,Advanced,"[""Introduction to content marketing"", ""Key points and analysis"", ""Practical examples"", ""Expert insights"", ""Action items"", ""Conclusion""]","[""content"", ""marketing"", ""advertising"", ""branding"", ""optimization""]",4,Marketing Managers & Strategists,"[""digital marketing"", ""social media"", ""brand management""]",53,8,2025-10-25 22:04:17,en,What budget should be allocated to {keyword}?,0.82,0.985570603568688,0.52
48500022,web development,it,What skills are needed to master web development?,implementation,Advanced,"[""Introduction to web development"", ""Key points and analysis"", ""Practical examples"", ""Expert insights"", ""Action items"", ""Conclusion""]","[""software"", ""development"", ""web"", ""implementation"", ""it"", ""technology""]",4,Senior Developers & Tech Leads,"[""cloud computing"", ""machine learning"", ""cybersecurity"", ""data science""]",49,8,2025-10-25 22:04:17,en,What skills are needed to master {keyword}?,0.89,0.990248597192833,0.6
48500023,financial modeling,economics,What factors should be considered when evaluating financial modeling?,best_practice,Beginner,"[""Introduction to financial modeling"", ""Key points and analysis"", ""Practical examples"", ""Expert insights"", ""Action items"", ""Conclusion""]","[""investment"", ""best_practice"", ""modeling"", ""financial"", ""business"", ""economics""]",4,Students & New Investors,"[""investment planning"", ""market analysis"", ""portfolio management""]",69,9,2025-10-25 22:04:17,en,What factors should be considered when evaluating {keyword}?,0.8,0.31061147555447916,0.49
48500024,portfolio management,economics,How do economic conditions affect portfolio management performance?,strategy,Intermediate,"[""Introduction to portfolio management"", ""Key points and analysis"", ""Practical examples"", ""Expert insights"", ""Action items"", ""Conclusion""]","[""finance"", ""portfolio"", ""management"", ""market"", ""strategy"", ""economics""]",4,Individual Investors & Analysts,"[""market analysis"", ""financial modeling"", ""investment planning""]",67,8,2025-10-25 22:04:17,en,How do economic conditions affect {keyword} performance?,0.94,0.7873436580843878,0.45
48500025,machine learning,it,What career opportunities exist in machine learning?,troubleshooting,Expert,"[""Introduction to machine learning"", ""Key points and analysis"", ""Practical examples"", ""Expert insights"", ""Action items"", ""Conclusion""]","[""software"", ""it"", ""programming"", ""troubleshooting"", ""learning"", ""machine""]",4,Architects & Technical Directors,"[""cloud computing"", ""cybersecurity"", ""data science"", ""web development""]",52,7,2025-10-25 22:04:17,en,What career opportunities exist in {keyword}?,0.7,1.0,0.43
48500026,social media,marketing,What emerging platforms support social media?,how_to,Advanced,"[""Introduction to social media"", ""Key points and analysis"", ""Practical examples"", ""Expert insights"", ""Action items"", ""Conclusion""]","[""how_to"", ""media"", ""promotion"", ""marketing"", ""digital"", ""social""]",4,Marketing Managers & Strategists,"[""content marketing"", ""brand management"", ""digital marketing""]",45,6,2025-10-25 22:04:17,en,What emerging platforms support {keyword}?,0.92,0.9786509606506885,0.39
48500027,content marketing,marketing,How do you automate content marketing processes?,planning,Beginner,"[""Overview of content marketing"", ""Step-by-step implementation"", ""Best practices and tips"", ""Common challenges and solutions"", ""Tools and resources needed"", ""Conclusion and next steps""]","[""planning"", ""content"", ""promotion"", ""marketing"", ""advertising""]",6,Marketing Students & Interns,"[""social media"", ""digital marketing"", ""brand management""]",48,7,2025-10-25 22:04:17,en,How do you automate {keyword} processes?,0.91,0.3954400598856954,0.53
48500028,data science,it,How do you stay updated with data science developments?,implementation,Beginner,"[""Overview of data science"", ""Step-by-step implementation"", ""Best practices and tips"", ""Common challenges and solutions"", ""Tools and resources needed"", ""Conclusion and next steps""]","[""technology"", ""it"", ""implementation"", ""programming"", ""science"", ""data""]",6,Students & Entry-level Developers,"[""machine learning"", ""web development"", ""cybersecurity"", ""cloud computing""]",55,9,2025-10-25 22:04:17,en,How do you stay updated with {keyword} developments?,0.65,0.3407084268940068,0.78
48500029,content marketing,marketing,How do you track and analyze content marketing performance?,planning,Intermediate,"[""Overview of content marketing"", ""Step-by-step implementation"", ""Best practices and tips"", ""Common challenges and solutions"", ""Tools and resources needed"", ""Conclusion and next steps""]","[""planning"", ""content"", ""promotion"", ""marketing"", ""advertising""]",6,Marketing Coordinators & Specialists,"[""brand management"", ""social media"", ""digital marketing""]",59,9,2025-10-25 22:04:17,en,How do you track and analyze {keyword} performance?,0.63,0.6517744967506227,0.83
48500030,web development,it,What are the latest trends in web development technology?,how_to,Advanced,"[""Introduction to web development"", ""Key concepts and definitions"", ""Main categories or types"", ""Examples and case studies"", ""Benefits and advantages"", ""Summary and recommendations""]","[""how_to"", ""technology"", ""software"", ""development"", ""it"", ""web""]",6,Senior Developers & Tech Leads,"[""cloud computing"", ""cybersecurity"", ""machine learning"", ""data science""]",57,9,2025-10-25 22:04:17,en,What are the latest trends in {keyword} technology?,0.7,0.9115530303540135,0.58
48500031,cloud computing,it,What tools are essential for cloud computing development?,best_practice,Advanced,"[""Introduction to cloud computing"", ""Key points and analysis"", ""Practical examples"", ""Expert insights"", ""Action items"", ""Conclusion""]","[""computing"", ""it"", ""programming"", ""best_practice"", ""cloud"", ""technology""]",4,Senior Developers & Tech Leads,"[""web development"", ""cybersecurity"", ""machine learning"", ""data science""]",57,8,2025-10-25 22:04:17,en,What tools are essential for {keyword} development?,0.74,0.908730346269409,0.5
48500032,web development,it,What certifications are valuable for web development professionals?,troubleshooting,Advanced,"[""Introduction to web development"", ""Key points and analysis"", ""Practical examples"", ""Expert insights"", ""Action items"", ""Conclusion""]","[""technology"", ""development"", ""it"", ""programming"", ""troubleshooting"", ""web""]",4,Senior Developers & Tech Leads,"[""machine learning"", ""cloud computing"", ""data science"", ""cybersecurity""]",67,8,2025-10-25 22:04:17,en,What certifications are valuable for {keyword} professionals?,0.77,0.8808443155440853,0.38
48500033,cloud computing,it,What certifications are valuable for cloud computing professionals?,optimization,Intermediate,"[""Introduction to cloud computing"", ""Key points and analysis"", ""Practical examples"", ""Expert insights"", ""Action items"", ""Conclusion""]","[""computing"", ""software"", ""cloud"", ""it"", ""development"", ""optimization""]",4,Junior to Mid-level Developers,"[""cybersecurity"", ""web development"", ""machine learning"", ""data science""]",67,8,2025-10-25 22:04:17,en,What certifications are valuable for {keyword} professionals?,0.75,0.6346234367513099,0.45
48500034,market analysis,economics,What insurance options are available for market analysis?,optimization,Intermediate,"[""Introduction to market analysis"", ""Key points and analysis"", ""Practical examples"", ""Expert insights"", ""Action items"", ""Conclusion""]","[""investment"", ""finance"", ""analysis"", ""market"", ""optimization"", ""economics""]",4,Individual Investors & Analysts,"[""portfolio management"", ""financial modeling"", ""investment planning""]",57,8,2025-10-25 22:04:17,en,What insurance options are available for {keyword}?,0.72,0.6370646370887081,0.65
48500035,digital marketing,marketing,How do you track and analyze digital marketing performance?,implementation,Intermediate,"[""Overview of digital marketing"", ""Step-by-step implementation"", ""Best practices and tips"", ""Common challenges and solutions"", ""Tools and resources needed"", ""Conclusion and next steps""]","[""implementation"", ""marketing"", ""promotion"", ""digital""]",6,Marketing Coordinators & Specialists,"[""brand management"", ""content marketing"", ""social media""]",59,9,2025-10-25 22:04:17,en,How do you track and analyze {keyword} performance?,0.73,0.7704156470669755,0.38
48500036,investment planning,economics,How do economic conditions affect investment planning performance?,best_practice,Intermediate,"[""Introduction to investment planning"", ""Key points and analysis"", ""Practical examples"", ""Expert insights"", ""Action items"", ""Conclusion""]","[""investment"", ""planning"", ""finance"", ""best_practice"", ""economics""]",4,Individual Investors & Analysts,"[""portfolio management"", ""financial modeling"", ""market analysis""]",66,8,2025-10-25 22:04:17,en,How do economic conditions affect {keyword} performance?,0.91,0.6108560272054486,0.88
48500037,brand management,marketing,How do you measure the ROI of brand management campaigns?,best_practice,Advanced,"[""Overview of brand management"", ""Step-by-step implementation"", ""Best practices and tips"", ""Common challenges and solutions"", ""Tools and resources needed"", ""Conclusion and next steps""]","[""promotion"", ""best_practice"", ""marketing"", ""management"", ""digital"", ""brand""]",6,Marketing Managers & Strategists,"[""social media"", ""digital marketing"", ""content marketing""]",57,10,2025-10-25 22:04:17,en,How do you measure the ROI of {keyword} campaigns?,0.7,0.9816796661227116,0.31
48500038,data science,it,What tools are essential for data science development?,implementation,Advanced,"[""Introduction to data science"", ""Key points and analysis"", ""Practical examples"", ""Expert insights"", ""Action items"", ""Conclusion""]","[""technology"", ""software"", ""it"", ""implementation"", ""science"", ""data""]",4,Senior Developers & Tech Leads,"[""cloud computing"", ""machine learning"", ""web development"", ""cybersecurity""]",54,8,2025-10-25 22:04:17,en,What tools are essential for {keyword} development?,0.84,0.8115303894156428,0.82
48500039,market analysis,economics,What are the regulatory considerations for market analysis?,how_to,Intermediate,"[""Introduction to market analysis"", ""Key concepts and definitions"", ""Main categories or types"", ""Examples and case studies"", ""Benefits and advantages"", ""Summary and recommendations""]","[""how_to"", ""finance"", ""analysis"", ""market"", ""economics""]",6,Individual Investors & Analysts,"[""financial modeling"", ""investment planning"", ""portfolio management""]",59,8,2025-10-25 22:04:17,en,What are the regulatory considerations for {keyword}?,0.82,0.7448944600440113,0.44
48500040,financial modeling,economics,What strategies work best for financial modeling investment?,planning,Advanced,"[""Introduction to financial modeling"", ""Key points and analysis"", ""Practical examples"", ""Expert insights"", ""Action items"", ""Conclusion""]","[""investment"", ""planning"", ""modeling"", ""financial"", ""business"", ""economics""]",4,Professional Investors & Advisors,"[""market analysis"", ""portfolio management"", ""investment planning""]",60,8,2025-10-25 22:04:17,en,What strategies work best for {keyword} investment?,0.84,0.9434422857397271,0.31
48500041,machine learning,it,What skills are needed to master machine learning?,troubleshooting,Expert,"[""Introduction to machine learning"", ""Key points and analysis"", ""Practical examples"", ""Expert insights"", ""Action items"", ""Conclusion""]","[""software"", ""it"", ""programming"", ""troubleshooting"", ""learning"", ""machine""]",4,Architects & Technical Directors,"[""cybersecurity"", ""web development"", ""data science"", ""cloud computing""]",50,8,2025-10-25 22:04:17,en,What skills are needed to master {keyword}?,0.75,1.0,0.74
48500042,social media,marketing,How do you attribute success to social media efforts?,how_to,Intermediate,"[""Overview of social media"", ""Step-by-step implementation"", ""Best practices and tips"", ""Common challenges and solutions"", ""Tools and resources needed"", ""Conclusion and next steps""]","[""how_to"", ""media"", ""marketing"", ""social"", ""advertising"", ""branding""]",6,Marketing Coordinators & Specialists,"[""brand management"", ""digital marketing"", ""content marketing""]",53,9,2025-10-25 22:04:17,en,How do you attribute success to {keyword} efforts?,0.82,0.6142130878038433,0.65
48500043,data science,it,What are the cost considerations for data science?,troubleshooting,Beginner,"[""Introduction to data science"", ""Key concepts and definitions"", ""Main categories or types"", ""Examples and case studies"", ""Benefits and advantages"", ""Summary and recommendations""]","[""software"", ""it"", ""programming"", ""troubleshooting"", ""science"", ""data""]",6,Students & Entry-level Developers,"[""machine learning"", ""cloud computing"", ""cybersecurity"", ""web development""]",50,8,2025-10-25 22:04:17,en,What are the cost considerations for {keyword}?,0.65,0.3896461376965286,0.66
