record_id,keyword,category,question,question_type,difficulty_level,answer_outline,tags,estimated_read_time,target_audience,related_topics,question_length,word_count,created_date,language,source_template,engagement_score,complexity_score,popularity_score
28800348,financial modeling,economics,What factors should be considered when evaluating financial modeling?,implementation,Intermediate,"[""Introduction to financial modeling"", ""Key points and analysis"", ""Practical examples"", ""Expert insights"", ""Action items"", ""Conclusion""]","[""investment"", ""finance"", ""implementation"", ""modeling"", ""financial"", ""economics""]",4,Individual Investors & Analysts,"[""portfolio management"", ""investment planning"", ""market analysis""]",69,9,2025-10-25 21:36:49,en,What factors should be considered when evaluating {keyword}?,0.91,0.7008092469243933,0.78
28800349,cybersecurity,it,How do you stay updated with cybersecurity developments?,best_practice,Beginner,"[""Overview of cybersecurity"", ""Step-by-step implementation"", ""Best practices and tips"", ""Common challenges and solutions"", ""Tools and resources needed"", ""Conclusion and next steps""]","[""software"", ""it"", ""best_practice"", ""cybersecurity"", ""technology""]",5,Students & Entry-level Developers,"[""web development"", ""machine learning"", ""data science"", ""cloud computing""]",56,8,2025-10-25 21:36:49,en,How do you stay updated with {keyword} developments?,0.65,0.3644018561565796,0.35
28800350,social media,marketing,What budget should be allocated to social media?,implementation,Expert,"[""Introduction to social media"", ""Key points and analysis"", ""Practical examples"", ""Expert insights"", ""Action items"", ""Conclusion""]","[""media"", ""implementation"", ""promotion"", ""marketing"", ""social"", ""advertising""]",4,Marketing Directors & CMOs,"[""brand management"", ""digital marketing"", ""content marketing""]",48,8,2025-10-25 21:36:49,en,What budget should be allocated to {keyword}?,0.92,1.0,0.87
28800351,portfolio management,economics,How do you hedge against portfolio management market downturns?,optimization,Beginner,"[""Overview of portfolio management"", ""Step-by-step implementation"", ""Best practices and tips"", ""Common challenges and solutions"", ""Tools and resources needed"", ""Conclusion and next steps""]","[""finance"", ""portfolio"", ""management"", ""business"", ""optimization"", ""economics""]",6,Students & New Investors,"[""investment planning"", ""financial modeling"", ""market analysis""]",63,9,2025-10-25 21:36:49,en,How do you hedge against {keyword} market downturns?,0.72,0.3873847015457249,0.85
28800352,portfolio management,economics,How do you adjust your portfolio management strategy during volatility?,evaluation,Expert,"[""Overview of portfolio management"", ""Step-by-step implementation"", ""Best practices and tips"", ""Common challenges and solutions"", ""Tools and resources needed"", ""Conclusion and next steps""]","[""finance"", ""portfolio"", ""management"", ""evaluation"", ""business"", ""economics""]",6,Portfolio Managers & Financial Experts,"[""market analysis"", ""investment planning"", ""financial modeling""]",71,10,2025-10-25 21:36:49,en,How do you adjust your {keyword} strategy during volatility?,0.62,1.0,0.49
28800353,cybersecurity,it,What certifications are valuable for cybersecurity professionals?,implementation,Expert,"[""Introduction to cybersecurity"", ""Key points and analysis"", ""Practical examples"", ""Expert insights"", ""Action items"", ""Conclusion""]","[""development"", ""it"", ""implementation"", ""cybersecurity"", ""technology""]",4,Architects & Technical Directors,"[""cloud computing"", ""data science"", ""machine learning"", ""web development""]",65,7,2025-10-25 21:36:49,en,What certifications are valuable for {keyword} professionals?,0.86,1.0,0.62
28800354,web development,it,How do you choose the right technology stack for web development?,analysis,Advanced,"[""Overview of web development"", ""Step-by-step implementation"", ""Best practices and tips"", ""Common challenges and solutions"", ""Tools and resources needed"", ""Conclusion and next steps""]","[""software"", ""development"", ""analysis"", ""it"", ""programming"", ""web""]",6,Senior Developers & Tech Leads,"[""machine learning"", ""cloud computing"", ""data science"", ""cybersecurity""]",65,11,2025-10-25 21:36:49,en,How do you choose the right technology stack for {keyword}?,0.8,0.9535376322464487,0.81
28800355,data science,it,How do you integrate data science with existing systems?,strategy,Intermediate,"[""Overview of data science"", ""Step-by-step implementation"", ""Best practices and tips"", ""Common challenges and solutions"", ""Tools and resources needed"", ""Conclusion and next steps""]","[""software"", ""development"", ""it"", ""science"", ""strategy"", ""data""]",6,Junior to Mid-level Developers,"[""cybersecurity"", ""cloud computing"", ""machine learning"", ""web development""]",56,9,2025-10-25 21:36:49,en,How do you integrate {keyword} with existing systems?,0.71,0.6721935681149543,0.57
28800356,cloud computing,it,What ROI can be expected from cloud computing implementation?,analysis,Intermediate,"[""Introduction to cloud computing"", ""Key points and analysis"", ""Practical examples"", ""Expert insights"", ""Action items"", ""Conclusion""]","[""computing"", ""software"", ""analysis"", ""it"", ""cloud"", ""technology""]",4,Junior to Mid-level Developers,"[""machine learning"", ""cybersecurity"", ""data science"", ""web development""]",61,9,2025-10-25 21:36:49,en,What ROI can be expected from {keyword} implementation?,0.82,0.7051963418956714,0.34
28800357,brand management,marketing,How do you reach new customers through brand management?,planning,Intermediate,"[""Overview of brand management"", ""Step-by-step implementation"", ""Best practices and tips"", ""Common challenges and solutions"", ""Tools and resources needed"", ""Conclusion and next steps""]","[""planning"", ""promotion"", ""marketing"", ""management"", ""advertising"", ""brand""]",6,Marketing Coordinators & Specialists,"[""content marketing"", ""digital marketing"", ""social media""]",56,9,2025-10-25 21:36:49,en,How do you reach new customers through {keyword}?,0.89,0.7505380641881745,0.66
28800358,financial modeling,economics,How do economic conditions affect financial modeling performance?,troubleshooting,Advanced,"[""Introduction to financial modeling"", ""Key points and analysis"", ""Practical examples"", ""Expert insights"", ""Action items"", ""Conclusion""]","[""finance"", ""troubleshooting"", ""modeling"", ""financial"", ""business"", ""economics""]",4,Professional Investors & Advisors,"[""investment planning"", ""portfolio management"", ""market analysis""]",65,8,2025-10-25 21:36:49,en,How do economic conditions affect {keyword} performance?,0.87,0.9242489337125962,0.61
28800359,digital marketing,marketing,How do you create a digital marketing roadmap?,strategy,Intermediate,"[""Overview of digital marketing"", ""Step-by-step implementation"", ""Best practices and tips"", ""Common challenges and solutions"", ""Tools and resources needed"", ""Conclusion and next steps""]","[""marketing"", ""digital"", ""advertising"", ""branding"", ""strategy""]",6,Marketing Coordinators & Specialists,"[""brand management"", ""content marketing"", ""social media""]",46,8,2025-10-25 21:36:49,en,How do you create a {keyword} roadmap?,0.83,0.7426024226631714,0.48
28800360,investment planning,economics,How do you identify opportunities in investment planning markets?,troubleshooting,Beginner,"[""Overview of investment planning"", ""Step-by-step implementation"", ""Best practices and tips"", ""Common challenges and solutions"", ""Tools and resources needed"", ""Conclusion and next steps""]","[""investment"", ""planning"", ""troubleshooting"", ""business"", ""economics""]",6,Students & New Investors,"[""market analysis"", ""portfolio management"", ""financial modeling""]",65,9,2025-10-25 21:36:49,en,How do you identify opportunities in {keyword} markets?,0.67,0.49314299532261285,0.65
28800361,web development,it,What ROI can be expected from web development implementation?,strategy,Advanced,"[""Introduction to web development"", ""Key points and analysis"", ""Practical examples"", ""Expert insights"", ""Action items"", ""Conclusion""]","[""software"", ""development"", ""it"", ""programming"", ""strategy"", ""web""]",4,Senior Developers & Tech Leads,"[""cybersecurity"", ""data science"", ""machine learning"", ""cloud computing""]",61,9,2025-10-25 21:36:49,en,What ROI can be expected from {keyword} implementation?,0.85,0.8413791335164414,0.86
28800362,web development,it,How do you choose the right technology stack for web development?,analysis,Expert,"[""Overview of web development"", ""Step-by-step implementation"", ""Best practices and tips"", ""Common challenges and solutions"", ""Tools and resources needed"", ""Conclusion and next steps""]","[""software"", ""development"", ""analysis"", ""it"", ""programming"", ""web""]",6,Architects & Technical Directors,"[""cloud computing"", ""cybersecurity"", ""machine learning"", ""data science""]",65,11,2025-10-25 21:36:49,en,How do you choose the right technology stack for {keyword}?,0.64,1.0,0.32
28800363,investment planning,economics,How do you diversify your portfolio using investment planning?,optimization,Expert,"[""Overview of investment planning"", ""Step-by-step implementation"", ""Best practices and tips"", ""Common challenges and solutions"", ""Tools and resources needed"", ""Conclusion and next steps""]","[""investment"", ""planning"", ""market"", ""optimization"", ""economics""]",6,Portfolio Managers & Financial Experts,"[""market analysis"", ""financial modeling"", ""portfolio management""]",62,9,2025-10-25 21:36:49,en,How do you diversify your portfolio using {keyword}?,0.77,1.0,0.46
28800364,cybersecurity,it,How do you convince stakeholders to invest in cybersecurity?,strategy,Intermediate,"[""Overview of cybersecurity"", ""Step-by-step implementation"", ""Best practices and tips"", ""Common challenges and solutions"", ""Tools and resources needed"", ""Conclusion and next steps""]","[""software"", ""development"", ""it"", ""strategy"", ""cybersecurity""]",5,Junior to Mid-level Developers,"[""cloud computing"", ""web development"", ""machine learning"", ""data science""]",60,9,2025-10-25 21:36:49,en,How do you convince stakeholders to invest in {keyword}?,0.6,0.6627456433969456,0.4
28800365,financial modeling,economics,What indicators predict financial modeling market movements?,how_to,Intermediate,"[""Introduction to financial modeling"", ""Key points and analysis"", ""Practical examples"", ""Expert insights"", ""Action items"", ""Conclusion""]","[""investment"", ""how_to"", ""modeling"", ""financial"", ""market"", ""economics""]",4,Individual Investors & Analysts,"[""portfolio management"", ""market analysis"", ""investment planning""]",60,7,2025-10-25 21:36:49,en,What indicators predict {keyword} market movements?,0.65,0.6558091921954603,0.6
28800366,cybersecurity,it,How do you implement cybersecurity in a production environment?,comparison,Expert,"[""Overview of cybersecurity"", ""Step-by-step implementation"", ""Best practices and tips"", ""Common challenges and solutions"", ""Tools and resources needed"", ""Conclusion and next steps""]","[""it"", ""comparison"", ""programming"", ""cybersecurity"", ""technology""]",5,Architects & Technical Directors,"[""machine learning"", ""data science"", ""web development"", ""cloud computing""]",63,9,2025-10-25 21:36:49,en,How do you implement {keyword} in a production environment?,0.81,1.0,0.7
28800367,digital marketing,marketing,What KPIs are most important for digital marketing?,troubleshooting,Advanced,"[""Introduction to digital marketing"", ""Key points and analysis"", ""Practical examples"", ""Expert insights"", ""Action items"", ""Conclusion""]","[""troubleshooting"", ""marketing"", ""digital"", ""advertising"", ""branding""]",4,Marketing Managers & Strategists,"[""social media"", ""brand management"", ""content marketing""]",51,8,2025-10-25 21:36:49,en,What KPIs are most important for {keyword}?,0.76,0.9361506474519555,0.56
28800368,market analysis,economics,How do you measure market analysis performance?,strategy,Advanced,"[""Overview of market analysis"", ""Step-by-step implementation"", ""Best practices and tips"", ""Common challenges and solutions"", ""Tools and resources needed"", ""Conclusion and next steps""]","[""analysis"", ""business"", ""market"", ""strategy"", ""economics""]",6,Professional Investors & Advisors,"[""financial modeling"", ""investment planning"", ""portfolio management""]",47,7,2025-10-25 21:36:49,en,How do you measure {keyword} performance?,0.92,0.9521660078486693,0.55
28800369,data science,it,How does data science impact business operations?,implementation,Advanced,"[""Introduction to data science"", ""Key points and analysis"", ""Practical examples"", ""Expert insights"", ""Action items"", ""Conclusion""]","[""development"", ""it"", ""implementation"", ""programming"", ""science"", ""data""]",4,Senior Developers & Tech Leads,"[""machine learning"", ""web development"", ""cloud computing"", ""cybersecurity""]",49,7,2025-10-25 21:36:49,en,How does {keyword} impact business operations?,0.72,0.9991996743134695,0.81
28800370,data science,it,What certifications are valuable for data science professionals?,strategy,Expert,"[""Introduction to data science"", ""Key points and analysis"", ""Practical examples"", ""Expert insights"", ""Action items"", ""Conclusion""]","[""software"", ""development"", ""it"", ""science"", ""strategy"", ""data""]",4,Architects & Technical Directors,"[""machine learning"", ""cloud computing"", ""web development"", ""cybersecurity""]",64,8,2025-10-25 21:36:49,en,What certifications are valuable for {keyword} professionals?,0.86,1.0,0.89
28800371,investment planning,economics,What tools help analyze investment planning data?,comparison,Advanced,"[""Introduction to investment planning"", ""Key points and analysis"", ""Practical examples"", ""Expert insights"", ""Action items"", ""Conclusion""]","[""investment"", ""planning"", ""finance"", ""comparison"", ""market"", ""economics""]",4,Professional Investors & Advisors,"[""market analysis"", ""portfolio management"", ""financial modeling""]",49,7,2025-10-25 21:36:49,en,What tools help analyze {keyword} data?,0.6,0.8430855065997127,0.81
28800372,machine learning,it,How do you convince stakeholders to invest in machine learning?,implementation,Advanced,"[""Overview of machine learning"", ""Step-by-step implementation"", ""Best practices and tips"", ""Common challenges and solutions"", ""Tools and resources needed"", ""Conclusion and next steps""]","[""software"", ""it"", ""implementation"", ""learning"", ""machine"", ""technology""]",6,Senior Developers & Tech Leads,"[""cloud computing"", ""web development"", ""cybersecurity"", ""data science""]",63,10,2025-10-25 21:36:49,en,How do you convince stakeholders to invest in {keyword}?,0.84,0.9647654738148366,0.65
28800373,market analysis,economics,What metrics are most important for market analysis?,analysis,Intermediate,"[""Introduction to market analysis"", ""Key points and analysis"", ""Practical examples"", ""Expert insights"", ""Action items"", ""Conclusion""]","[""market"", ""investment"", ""economics"", ""analysis""]",4,Individual Investors & Analysts,"[""financial modeling"", ""portfolio management"", ""investment planning""]",52,8,2025-10-25 21:36:49,en,What metrics are most important for {keyword}?,0.87,0.7962169784204253,0.7
28800374,digital marketing,marketing,What are the latest trends in digital marketing?,how_to,Beginner,"[""Introduction to digital marketing"", ""Key concepts and definitions"", ""Main categories or types"", ""Examples and case studies"", ""Benefits and advantages"", ""Summary and recommendations""]","[""branding"", ""marketing"", ""how_to"", ""digital""]",6,Marketing Students & Interns,"[""brand management"", ""content marketing"", ""social media""]",48,8,2025-10-25 21:36:49,en,What are the latest trends in {keyword}?,0.77,0.44065598608809603,0.33
28800375,social media,marketing,How do you automate social media processes?,best_practice,Intermediate,"[""Overview of social media"", ""Step-by-step implementation"", ""Best practices and tips"", ""Common challenges and solutions"", ""Tools and resources needed"", ""Conclusion and next steps""]","[""media"", ""best_practice"", ""digital"", ""marketing"", ""social"", ""branding""]",6,Marketing Coordinators & Specialists,"[""digital marketing"", ""content marketing"", ""brand management""]",43,7,2025-10-25 21:36:49,en,How do you automate {keyword} processes?,0.69,0.6254455782071113,0.41
28800376,digital marketing,marketing,How do you automate digital marketing processes?,implementation,Intermediate,"[""Overview of digital marketing"", ""Step-by-step implementation"", ""Best practices and tips"", ""Common challenges and solutions"", ""Tools and resources needed"", ""Conclusion and next steps""]","[""implementation"", ""promotion"", ""marketing"", ""digital"", ""advertising""]",6,Marketing Coordinators & Specialists,"[""social media"", ""brand management"", ""content marketing""]",48,7,2025-10-25 21:36:49,en,How do you automate {keyword} processes?,0.67,0.7698790073643781,0.82
28800377,content marketing,marketing,What content types work best for content marketing?,comparison,Beginner,"[""Introduction to content marketing"", ""Key points and analysis"", ""Practical examples"", ""Expert insights"", ""Action items"", ""Conclusion""]","[""content"", ""promotion"", ""comparison"", ""marketing"", ""advertising""]",4,Marketing Students & Interns,"[""brand management"", ""digital marketing"", ""social media""]",51,8,2025-10-25 21:36:49,en,What content types work best for {keyword}?,0.65,0.35799571349756626,0.52
28800378,cloud computing,it,How do you convince stakeholders to invest in cloud computing?,planning,Intermediate,"[""Overview of cloud computing"", ""Step-by-step implementation"", ""Best practices and tips"", ""Common challenges and solutions"", ""Tools and resources needed"", ""Conclusion and next steps""]","[""computing"", ""planning"", ""software"", ""it"", ""programming"", ""cloud""]",6,Junior to Mid-level Developers,"[""machine learning"", ""web development"", ""cybersecurity"", ""data science""]",62,10,2025-10-25 21:36:49,en,How do you convince stakeholders to invest in {keyword}?,0.81,0.7571476598948772,0.76
28800379,data science,it,What skills are needed to master data science?,strategy,Beginner,"[""Introduction to data science"", ""Key points and analysis"", ""Practical examples"", ""Expert insights"", ""Action items"", ""Conclusion""]","[""development"", ""it"", ""programming"", ""science"", ""strategy"", ""data""]",4,Students & Entry-level Developers,"[""web development"", ""machine learning"", ""cloud computing"", ""cybersecurity""]",46,8,2025-10-25 21:36:49,en,What skills are needed to master {keyword}?,0.65,0.4370341810389387,0.82
28800380,digital marketing,marketing,What does the future hold for digital marketing?,implementation,Advanced,"[""Introduction to digital marketing"", ""Key points and analysis"", ""Practical examples"", ""Expert insights"", ""Action items"", ""Conclusion""]","[""implementation"", ""promotion"", ""marketing"", ""digital"", ""branding""]",4,Marketing Managers & Strategists,"[""content marketing"", ""social media"", ""brand management""]",48,8,2025-10-25 21:36:49,en,What does the future hold for {keyword}?,0.81,0.8910123549613447,0.56
28800381,financial modeling,economics,How do you benchmark financial modeling against alternatives?,troubleshooting,Beginner,"[""Overview of financial modeling"", ""Step-by-step implementation"", ""Best practices and tips"", ""Common challenges and solutions"", ""Tools and resources needed"", ""Conclusion and next steps""]","[""investment"", ""troubleshooting"", ""modeling"", ""financial"", ""market"", ""economics""]",6,Students & New Investors,"[""market analysis"", ""investment planning"", ""portfolio management""]",61,8,2025-10-25 21:36:49,en,How do you benchmark {keyword} against alternatives?,0.67,0.4045646910974612,0.31
28800382,investment planning,economics,What exit strategies should be considered for investment planning?,strategy,Expert,"[""Introduction to investment planning"", ""Key points and analysis"", ""Practical examples"", ""Expert insights"", ""Action items"", ""Conclusion""]","[""investment"", ""planning"", ""business"", ""market"", ""strategy"", ""economics""]",4,Portfolio Managers & Financial Experts,"[""market analysis"", ""portfolio management"", ""financial modeling""]",66,9,2025-10-25 21:36:49,en,What exit strategies should be considered for {keyword}?,0.86,1.0,0.76
28800383,market analysis,economics,How do you analyze market trends in market analysis?,planning,Intermediate,"[""Overview of market analysis"", ""Step-by-step implementation"", ""Best practices and tips"", ""Common challenges and solutions"", ""Tools and resources needed"", ""Conclusion and next steps""]","[""investment"", ""planning"", ""analysis"", ""market"", ""business"", ""economics""]",6,Individual Investors & Analysts,"[""portfolio management"", ""financial modeling"", ""investment planning""]",52,9,2025-10-25 21:36:49,en,How do you analyze market trends in {keyword}?,0.91,0.6475324963208151,0.35
28800384,portfolio management,economics,How do you analyze market trends in portfolio management?,troubleshooting,Beginner,"[""Overview of portfolio management"", ""Step-by-step implementation"", ""Best practices and tips"", ""Common challenges and solutions"", ""Tools and resources needed"", ""Conclusion and next steps""]","[""finance"", ""portfolio"", ""troubleshooting"", ""management"", ""market"", ""economics""]",6,Students & New Investors,"[""investment planning"", ""market analysis"", ""financial modeling""]",57,9,2025-10-25 21:36:49,en,How do you analyze market trends in {keyword}?,0.65,0.3444397522219942,0.36
28800385,machine learning,it,What are the best practices for machine learning development?,planning,Intermediate,"[""Introduction to machine learning"", ""Key concepts and definitions"", ""Main categories or types"", ""Examples and case studies"", ""Benefits and advantages"", ""Summary and recommendations""]","[""software"", ""planning"", ""it"", ""learning"", ""machine"", ""technology""]",6,Junior to Mid-level Developers,"[""web development"", ""cloud computing"", ""data science"", ""cybersecurity""]",61,9,2025-10-25 21:36:49,en,What are the best practices for {keyword} development?,0.62,0.6408019664797866,0.74
28800386,machine learning,it,Which frameworks support machine learning implementation?,comparison,Advanced,"[""Introduction to machine learning"", ""Key points and analysis"", ""Practical examples"", ""Expert insights"", ""Action items"", ""Conclusion""]","[""it"", ""comparison"", ""programming"", ""learning"", ""machine"", ""technology""]",4,Senior Developers & Tech Leads,"[""web development"", ""cloud computing"", ""data science"", ""cybersecurity""]",57,6,2025-10-25 21:36:49,en,Which frameworks support {keyword} implementation?,0.77,0.9512772070777036,0.4
28800387,investment planning,economics,How do you create a long-term plan for investment planning?,comparison,Expert,"[""Overview of investment planning"", ""Step-by-step implementation"", ""Best practices and tips"", ""Common challenges and solutions"", ""Tools and resources needed"", ""Conclusion and next steps""]","[""investment"", ""planning"", ""comparison"", ""market"", ""economics""]",6,Portfolio Managers & Financial Experts,"[""portfolio management"", ""market analysis"", ""financial modeling""]",59,10,2025-10-25 21:36:49,en,How do you create a long-term plan for {keyword}?,0.78,1.0,0.72
28800388,brand management,marketing,What are the latest trends in brand management?,comparison,Beginner,"[""Introduction to brand management"", ""Key concepts and definitions"", ""Main categories or types"", ""Examples and case studies"", ""Benefits and advantages"", ""Summary and recommendations""]","[""promotion"", ""comparison"", ""marketing"", ""management"", ""digital"", ""brand""]",6,Marketing Students & Interns,"[""digital marketing"", ""content marketing"", ""social media""]",47,8,2025-10-25 21:36:49,en,What are the latest trends in {keyword}?,0.83,0.39502401378962937,0.4
28800389,portfolio management,economics,How do you assess and manage portfolio management risks?,optimization,Advanced,"[""Overview of portfolio management"", ""Step-by-step implementation"", ""Best practices and tips"", ""Common challenges and solutions"", ""Tools and resources needed"", ""Conclusion and next steps""]","[""investment"", ""portfolio"", ""management"", ""market"", ""optimization"", ""economics""]",6,Professional Investors & Advisors,"[""financial modeling"", ""investment planning"", ""market analysis""]",56,9,2025-10-25 21:36:49,en,How do you assess and manage {keyword} risks?,0.75,0.8466530344698182,0.56
28800390,data science,it,What design patterns work best with data science?,planning,Advanced,"[""Introduction to data science"", ""Key points and analysis"", ""Practical examples"", ""Expert insights"", ""Action items"", ""Conclusion""]","[""planning"", ""software"", ""it"", ""programming"", ""science"", ""data""]",4,Senior Developers & Tech Leads,"[""web development"", ""machine learning"", ""cybersecurity"", ""cloud computing""]",49,8,2025-10-25 21:36:49,en,What design patterns work best with {keyword}?,0.92,0.8842228676486387,0.48
