record_id,keyword,category,question,question_type,difficulty_level,answer_outline,tags,estimated_read_time,target_audience,related_topics,question_length,word_count,created_date,language,source_template,engagement_score,complexity_score,popularity_score
42300650,data science,it,What design patterns work best with data science?,strategy,Advanced,"[""Introduction to data science"", ""Key points and analysis"", ""Practical examples"", ""Expert insights"", ""Action items"", ""Conclusion""]","[""development"", ""it"", ""programming"", ""science"", ""strategy"", ""data""]",4,Senior Developers & Tech Leads,"[""cloud computing"", ""cybersecurity"", ""web development"", ""machine learning""]",49,8,2025-10-25 21:55:30,en,What design patterns work best with {keyword}?,0.67,0.9859469046376076,0.5
42300651,cloud computing,it,How do you integrate cloud computing with existing systems?,implementation,Intermediate,"[""Overview of cloud computing"", ""Step-by-step implementation"", ""Best practices and tips"", ""Common challenges and solutions"", ""Tools and resources needed"", ""Conclusion and next steps""]","[""computing"", ""software"", ""development"", ""it"", ""implementation"", ""cloud""]",6,Junior to Mid-level Developers,"[""cybersecurity"", ""machine learning"", ""web development"", ""data science""]",59,9,2025-10-25 21:55:30,en,How do you integrate {keyword} with existing systems?,0.65,0.7217808572386591,0.89
42300652,financial modeling,economics,How do you measure financial modeling performance?,strategy,Intermediate,"[""Overview of financial modeling"", ""Step-by-step implementation"", ""Best practices and tips"", ""Common challenges and solutions"", ""Tools and resources needed"", ""Conclusion and next steps""]","[""investment"", ""modeling"", ""financial"", ""market"", ""strategy"", ""economics""]",6,Individual Investors & Analysts,"[""portfolio management"", ""investment planning"", ""market analysis""]",50,7,2025-10-25 21:55:30,en,How do you measure {keyword} performance?,0.66,0.7908421432896088,0.44
42300653,data science,it,What are the latest trends in data science technology?,planning,Beginner,"[""Introduction to data science"", ""Key concepts and definitions"", ""Main categories or types"", ""Examples and case studies"", ""Benefits and advantages"", ""Summary and recommendations""]","[""technology"", ""planning"", ""it"", ""programming"", ""science"", ""data""]",6,Students & Entry-level Developers,"[""cloud computing"", ""web development"", ""machine learning"", ""cybersecurity""]",54,9,2025-10-25 21:55:30,en,What are the latest trends in {keyword} technology?,0.79,0.48268371530418697,0.79
42300654,cybersecurity,it,What is the recommended architecture for cybersecurity systems?,implementation,Advanced,"[""Introduction to cybersecurity"", ""Key points and analysis"", ""Practical examples"", ""Expert insights"", ""Action items"", ""Conclusion""]","[""software"", ""development"", ""it"", ""implementation"", ""cybersecurity""]",4,Senior Developers & Tech Leads,"[""data science"", ""machine learning"", ""cloud computing"", ""web development""]",63,8,2025-10-25 21:55:30,en,What is the recommended architecture for {keyword} systems?,0.69,0.9416309519245939,0.64
42300655,market analysis,economics,What is the optimal allocation for market analysis in a portfolio?,how_to,Advanced,"[""Introduction to market analysis"", ""Key points and analysis"", ""Practical examples"", ""Expert insights"", ""Action items"", ""Conclusion""]","[""how_to"", ""finance"", ""analysis"", ""market"", ""economics""]",4,Professional Investors & Advisors,"[""investment planning"", ""financial modeling"", ""portfolio management""]",66,11,2025-10-25 21:55:30,en,What is the optimal allocation for {keyword} in a portfolio?,0.86,0.8186697281874106,0.64
42300656,market analysis,economics,What strategies work best for market analysis investment?,evaluation,Beginner,"[""Introduction to market analysis"", ""Key points and analysis"", ""Practical examples"", ""Expert insights"", ""Action items"", ""Conclusion""]","[""investment"", ""analysis"", ""evaluation"", ""market"", ""economics""]",4,Students & New Investors,"[""investment planning"", ""financial modeling"", ""portfolio management""]",57,8,2025-10-25 21:55:30,en,What strategies work best for {keyword} investment?,0.79,0.378688825535047,0.7
42300657,cloud computing,it,What security considerations should be taken when using cloud computing?,analysis,Advanced,"[""Introduction to cloud computing"", ""Key points and analysis"", ""Practical examples"", ""Expert insights"", ""Action items"", ""Conclusion""]","[""computing"", ""analysis"", ""it"", ""development"", ""programming"", ""cloud""]",4,Senior Developers & Tech Leads,"[""cybersecurity"", ""web development"", ""machine learning"", ""data science""]",72,10,2025-10-25 21:55:30,en,What security considerations should be taken when using {keyword}?,0.9,0.837440796336802,0.68
42300658,digital marketing,marketing,How do you improve digital marketing conversion rates?,troubleshooting,Beginner,"[""Overview of digital marketing"", ""Step-by-step implementation"", ""Best practices and tips"", ""Common challenges and solutions"", ""Tools and resources needed"", ""Conclusion and next steps""]","[""promotion"", ""troubleshooting"", ""marketing"", ""digital"", ""branding""]",6,Marketing Students & Interns,"[""social media"", ""content marketing"", ""brand management""]",54,8,2025-10-25 21:55:30,en,How do you improve {keyword} conversion rates?,0.72,0.44043799565563463,0.78
42300659,social media,marketing,What channels are most effective for social media?,evaluation,Intermediate,"[""Introduction to social media"", ""Key points and analysis"", ""Practical examples"", ""Expert insights"", ""Action items"", ""Conclusion""]","[""media"", ""promotion"", ""marketing"", ""social"", ""branding"", ""evaluation""]",4,Marketing Coordinators & Specialists,"[""content marketing"", ""brand management"", ""digital marketing""]",50,8,2025-10-25 21:55:30,en,What channels are most effective for {keyword}?,0.78,0.6215506678965517,0.39
42300660,cybersecurity,it,What career opportunities exist in cybersecurity?,how_to,Intermediate,"[""Introduction to cybersecurity"", ""Key points and analysis"", ""Practical examples"", ""Expert insights"", ""Action items"", ""Conclusion""]","[""how_to"", ""development"", ""it"", ""cybersecurity"", ""technology""]",4,Junior to Mid-level Developers,"[""data science"", ""web development"", ""machine learning"", ""cloud computing""]",49,6,2025-10-25 21:55:30,en,What career opportunities exist in {keyword}?,0.62,0.6220423628211258,0.42
42300661,portfolio management,economics,How do you identify opportunities in portfolio management markets?,implementation,Advanced,"[""Overview of portfolio management"", ""Step-by-step implementation"", ""Best practices and tips"", ""Common challenges and solutions"", ""Tools and resources needed"", ""Conclusion and next steps""]","[""investment"", ""finance"", ""implementation"", ""portfolio"", ""management"", ""economics""]",6,Professional Investors & Advisors,"[""market analysis"", ""financial modeling"", ""investment planning""]",66,9,2025-10-25 21:55:30,en,How do you identify opportunities in {keyword} markets?,0.95,0.893061679623438,0.4
42300662,web development,it,How do you design a scalable web development solution?,planning,Intermediate,"[""Overview of web development"", ""Step-by-step implementation"", ""Best practices and tips"", ""Common challenges and solutions"", ""Tools and resources needed"", ""Conclusion and next steps""]","[""planning"", ""development"", ""it"", ""software"", ""programming"", ""web""]",6,Junior to Mid-level Developers,"[""cloud computing"", ""data science"", ""machine learning"", ""cybersecurity""]",54,9,2025-10-25 21:55:30,en,How do you design a scalable {keyword} solution?,0.93,0.7910880204581421,0.54
42300663,investment planning,economics,How do you protect your investment planning investments?,how_to,Intermediate,"[""Overview of investment planning"", ""Step-by-step implementation"", ""Best practices and tips"", ""Common challenges and solutions"", ""Tools and resources needed"", ""Conclusion and next steps""]","[""investment"", ""how_to"", ""planning"", ""finance"", ""business"", ""economics""]",6,Individual Investors & Analysts,"[""financial modeling"", ""portfolio management"", ""market analysis""]",56,8,2025-10-25 21:55:30,en,How do you protect your {keyword} investments?,0.87,0.7435156696050375,0.7
42300664,brand management,marketing,How do you attribute success to brand management efforts?,optimization,Beginner,"[""Overview of brand management"", ""Step-by-step implementation"", ""Best practices and tips"", ""Common challenges and solutions"", ""Tools and resources needed"", ""Conclusion and next steps""]","[""digital"", ""marketing"", ""management"", ""branding"", ""optimization"", ""brand""]",6,Marketing Students & Interns,"[""digital marketing"", ""content marketing"", ""social media""]",57,9,2025-10-25 21:55:30,en,How do you attribute success to {keyword} efforts?,0.74,0.38206405884601685,0.79
42300665,machine learning,it,How do you get started with machine learning as a beginner?,analysis,Beginner,"[""Overview of machine learning"", ""Step-by-step implementation"", ""Best practices and tips"", ""Common challenges and solutions"", ""Tools and resources needed"", ""Conclusion and next steps""]","[""software"", ""analysis"", ""it"", ""development"", ""learning"", ""machine""]",6,Students & Entry-level Developers,"[""cybersecurity"", ""web development"", ""cloud computing"", ""data science""]",59,11,2025-10-25 21:55:30,en,How do you get started with {keyword} as a beginner?,0.83,0.3005526190253408,0.8
42300666,content marketing,marketing,What are the latest trends in content marketing?,evaluation,Beginner,"[""Introduction to content marketing"", ""Key concepts and definitions"", ""Main categories or types"", ""Examples and case studies"", ""Benefits and advantages"", ""Summary and recommendations""]","[""content"", ""promotion"", ""marketing"", ""digital"", ""evaluation""]",6,Marketing Students & Interns,"[""social media"", ""brand management"", ""digital marketing""]",48,8,2025-10-25 21:55:30,en,What are the latest trends in {keyword}?,0.75,0.40520818517701696,0.81
42300667,financial modeling,economics,How do you report on financial modeling performance to stakeholders?,analysis,Expert,"[""Overview of financial modeling"", ""Step-by-step implementation"", ""Best practices and tips"", ""Common challenges and solutions"", ""Tools and resources needed"", ""Conclusion and next steps""]","[""investment"", ""finance"", ""analysis"", ""modeling"", ""financial"", ""economics""]",6,Portfolio Managers & Financial Experts,"[""market analysis"", ""investment planning"", ""portfolio management""]",68,10,2025-10-25 21:55:30,en,How do you report on {keyword} performance to stakeholders?,0.82,1.0,0.37
42300668,digital marketing,marketing,What channels are most effective for digital marketing?,implementation,Intermediate,"[""Introduction to digital marketing"", ""Key points and analysis"", ""Practical examples"", ""Expert insights"", ""Action items"", ""Conclusion""]","[""implementation"", ""promotion"", ""marketing"", ""digital"", ""advertising""]",4,Marketing Coordinators & Specialists,"[""social media"", ""content marketing"", ""brand management""]",55,8,2025-10-25 21:55:30,en,What channels are most effective for {keyword}?,0.61,0.6215324861567331,0.46
42300669,brand management,marketing,What tools are essential for brand management analytics?,troubleshooting,Intermediate,"[""Introduction to brand management"", ""Key points and analysis"", ""Practical examples"", ""Expert insights"", ""Action items"", ""Conclusion""]","[""promotion"", ""troubleshooting"", ""marketing"", ""management"", ""advertising"", ""brand""]",4,Marketing Coordinators & Specialists,"[""social media"", ""content marketing"", ""digital marketing""]",56,8,2025-10-25 21:55:30,en,What tools are essential for {keyword} analytics?,0.75,0.6392769013351629,0.37
42300670,cybersecurity,it,How do you measure the success of cybersecurity projects?,optimization,Advanced,"[""Overview of cybersecurity"", ""Step-by-step implementation"", ""Best practices and tips"", ""Common challenges and solutions"", ""Tools and resources needed"", ""Conclusion and next steps""]","[""it"", ""programming"", ""optimization"", ""cybersecurity"", ""technology""]",5,Senior Developers & Tech Leads,"[""data science"", ""web development"", ""machine learning"", ""cloud computing""]",57,9,2025-10-25 21:55:30,en,How do you measure the success of {keyword} projects?,0.65,0.956521775186802,0.7
42300671,market analysis,economics,How do you identify opportunities in market analysis markets?,analysis,Intermediate,"[""Overview of market analysis"", ""Step-by-step implementation"", ""Best practices and tips"", ""Common challenges and solutions"", ""Tools and resources needed"", ""Conclusion and next steps""]","[""investment"", ""analysis"", ""market"", ""business"", ""economics""]",6,Individual Investors & Analysts,"[""financial modeling"", ""portfolio management"", ""investment planning""]",61,9,2025-10-25 21:55:30,en,How do you identify opportunities in {keyword} markets?,0.9,0.6093680230196103,0.47
42300672,digital marketing,marketing,What messaging works best in digital marketing campaigns?,best_practice,Beginner,"[""Introduction to digital marketing"", ""Key points and analysis"", ""Practical examples"", ""Expert insights"", ""Action items"", ""Conclusion""]","[""promotion"", ""best_practice"", ""marketing"", ""digital"", ""advertising""]",4,Marketing Students & Interns,"[""content marketing"", ""brand management"", ""social media""]",57,8,2025-10-25 21:55:30,en,What messaging works best in {keyword} campaigns?,0.81,0.3791124809352396,0.32
42300673,portfolio management,economics,How do you adjust your portfolio management strategy during volatility?,comparison,Advanced,"[""Overview of portfolio management"", ""Step-by-step implementation"", ""Best practices and tips"", ""Common challenges and solutions"", ""Tools and resources needed"", ""Conclusion and next steps""]","[""investment"", ""finance"", ""portfolio"", ""comparison"", ""management"", ""economics""]",6,Professional Investors & Advisors,"[""investment planning"", ""market analysis"", ""financial modeling""]",71,10,2025-10-25 21:55:30,en,How do you adjust your {keyword} strategy during volatility?,0.89,0.9986890274187368,0.37
42300674,social media,marketing,How do you automate social media processes?,optimization,Advanced,"[""Overview of social media"", ""Step-by-step implementation"", ""Best practices and tips"", ""Common challenges and solutions"", ""Tools and resources needed"", ""Conclusion and next steps""]","[""media"", ""digital"", ""marketing"", ""social"", ""advertising"", ""optimization""]",6,Marketing Managers & Strategists,"[""content marketing"", ""brand management"", ""digital marketing""]",43,7,2025-10-25 21:55:30,en,How do you automate {keyword} processes?,0.94,0.9719654236613686,0.34
42300675,content marketing,marketing,How do you automate content marketing processes?,implementation,Beginner,"[""Overview of content marketing"", ""Step-by-step implementation"", ""Best practices and tips"", ""Common challenges and solutions"", ""Tools and resources needed"", ""Conclusion and next steps""]","[""content"", ""implementation"", ""promotion"", ""marketing"", ""advertising""]",6,Marketing Students & Interns,"[""digital marketing"", ""brand management"", ""social media""]",48,7,2025-10-25 21:55:30,en,How do you automate {keyword} processes?,0.76,0.4197701817027243,0.69
42300676,cloud computing,it,What career opportunities exist in cloud computing?,analysis,Expert,"[""Introduction to cloud computing"", ""Key points and analysis"", ""Practical examples"", ""Expert insights"", ""Action items"", ""Conclusion""]","[""computing"", ""software"", ""analysis"", ""it"", ""programming"", ""cloud""]",4,Architects & Technical Directors,"[""web development"", ""machine learning"", ""data science"", ""cybersecurity""]",51,7,2025-10-25 21:55:30,en,What career opportunities exist in {keyword}?,0.76,1.0,0.83
42300677,brand management,marketing,What are the latest trends in brand management?,implementation,Intermediate,"[""Introduction to brand management"", ""Key concepts and definitions"", ""Main categories or types"", ""Examples and case studies"", ""Benefits and advantages"", ""Summary and recommendations""]","[""implementation"", ""promotion"", ""marketing"", ""management"", ""advertising"", ""brand""]",6,Marketing Coordinators & Specialists,"[""content marketing"", ""digital marketing"", ""social media""]",47,8,2025-10-25 21:55:30,en,What are the latest trends in {keyword}?,0.79,0.7835161566926566,0.57
42300678,content marketing,marketing,How do you create a content marketing roadmap?,optimization,Beginner,"[""Overview of content marketing"", ""Step-by-step implementation"", ""Best practices and tips"", ""Common challenges and solutions"", ""Tools and resources needed"", ""Conclusion and next steps""]","[""content"", ""marketing"", ""digital"", ""branding"", ""optimization""]",6,Marketing Students & Interns,"[""brand management"", ""digital marketing"", ""social media""]",46,8,2025-10-25 21:55:30,en,How do you create a {keyword} roadmap?,0.66,0.411909240513482,0.37
42300679,content marketing,marketing,What emerging platforms support content marketing?,optimization,Intermediate,"[""Introduction to content marketing"", ""Key points and analysis"", ""Practical examples"", ""Expert insights"", ""Action items"", ""Conclusion""]","[""content"", ""marketing"", ""digital"", ""advertising"", ""optimization""]",4,Marketing Coordinators & Specialists,"[""social media"", ""digital marketing"", ""brand management""]",50,6,2025-10-25 21:55:30,en,What emerging platforms support {keyword}?,0.62,0.7387857832829133,0.64
42300680,market analysis,economics,What is the optimal allocation for market analysis in a portfolio?,best_practice,Intermediate,"[""Introduction to market analysis"", ""Key points and analysis"", ""Practical examples"", ""Expert insights"", ""Action items"", ""Conclusion""]","[""investment"", ""analysis"", ""best_practice"", ""market"", ""business"", ""economics""]",4,Individual Investors & Analysts,"[""portfolio management"", ""financial modeling"", ""investment planning""]",66,11,2025-10-25 21:55:30,en,What is the optimal allocation for {keyword} in a portfolio?,0.68,0.6593838015049056,0.67
42300681,cybersecurity,it,What ROI can be expected from cybersecurity implementation?,strategy,Beginner,"[""Introduction to cybersecurity"", ""Key points and analysis"", ""Practical examples"", ""Expert insights"", ""Action items"", ""Conclusion""]","[""software"", ""it"", ""programming"", ""strategy"", ""cybersecurity""]",4,Students & Entry-level Developers,"[""cloud computing"", ""web development"", ""data science"", ""machine learning""]",59,8,2025-10-25 21:55:30,en,What ROI can be expected from {keyword} implementation?,0.81,0.3389941052506052,0.62
42300682,brand management,marketing,What tools are essential for brand management analytics?,analysis,Intermediate,"[""Introduction to brand management"", ""Key points and analysis"", ""Practical examples"", ""Expert insights"", ""Action items"", ""Conclusion""]","[""analysis"", ""digital"", ""marketing"", ""management"", ""advertising"", ""brand""]",4,Marketing Coordinators & Specialists,"[""digital marketing"", ""social media"", ""content marketing""]",56,8,2025-10-25 21:55:30,en,What tools are essential for {keyword} analytics?,0.89,0.6435151141263401,0.88
42300683,investment planning,economics,How do you report on investment planning performance to stakeholders?,how_to,Beginner,"[""Overview of investment planning"", ""Step-by-step implementation"", ""Best practices and tips"", ""Common challenges and solutions"", ""Tools and resources needed"", ""Conclusion and next steps""]","[""investment"", ""how_to"", ""planning"", ""finance"", ""business"", ""economics""]",6,Students & New Investors,"[""financial modeling"", ""portfolio management"", ""market analysis""]",69,10,2025-10-25 21:55:30,en,How do you report on {keyword} performance to stakeholders?,0.83,0.4304575464692811,0.76
42300684,cybersecurity,it,How do you integrate cybersecurity with existing systems?,strategy,Expert,"[""Overview of cybersecurity"", ""Step-by-step implementation"", ""Best practices and tips"", ""Common challenges and solutions"", ""Tools and resources needed"", ""Conclusion and next steps""]","[""development"", ""it"", ""strategy"", ""cybersecurity"", ""technology""]",5,Architects & Technical Directors,"[""cloud computing"", ""data science"", ""web development"", ""machine learning""]",57,8,2025-10-25 21:55:30,en,How do you integrate {keyword} with existing systems?,0.81,1.0,0.64
42300685,machine learning,it,What skills are needed to master machine learning?,comparison,Beginner,"[""Introduction to machine learning"", ""Key points and analysis"", ""Practical examples"", ""Expert insights"", ""Action items"", ""Conclusion""]","[""it"", ""comparison"", ""programming"", ""learning"", ""machine"", ""technology""]",4,Students & Entry-level Developers,"[""cybersecurity"", ""web development"", ""cloud computing"", ""data science""]",50,8,2025-10-25 21:55:30,en,What skills are needed to master {keyword}?,0.77,0.44834289541572386,0.4
42300686,cloud computing,it,How do you design a scalable cloud computing solution?,strategy,Intermediate,"[""Overview of cloud computing"", ""Step-by-step implementation"", ""Best practices and tips"", ""Common challenges and solutions"", ""Tools and resources needed"", ""Conclusion and next steps""]","[""computing"", ""software"", ""cloud"", ""it"", ""programming"", ""strategy""]",6,Junior to Mid-level Developers,"[""web development"", ""data science"", ""machine learning"", ""cybersecurity""]",54,9,2025-10-25 21:55:30,en,How do you design a scalable {keyword} solution?,0.63,0.7495336777067529,0.77
42300687,investment planning,economics,How do you protect your investment planning investments?,planning,Beginner,"[""Overview of investment planning"", ""Step-by-step implementation"", ""Best practices and tips"", ""Common challenges and solutions"", ""Tools and resources needed"", ""Conclusion and next steps""]","[""investment"", ""economics"", ""planning"", ""finance""]",6,Students & New Investors,"[""portfolio management"", ""market analysis"", ""financial modeling""]",56,8,2025-10-25 21:55:30,en,How do you protect your {keyword} investments?,0.78,0.3939081983866245,0.58
42300688,content marketing,marketing,What KPIs are most important for content marketing?,strategy,Advanced,"[""Introduction to content marketing"", ""Key points and analysis"", ""Practical examples"", ""Expert insights"", ""Action items"", ""Conclusion""]","[""content"", ""marketing"", ""advertising"", ""branding"", ""strategy""]",4,Marketing Managers & Strategists,"[""digital marketing"", ""brand management"", ""social media""]",51,8,2025-10-25 21:55:30,en,What KPIs are most important for {keyword}?,0.72,0.8130861793924516,0.89
42300689,social media,marketing,What emerging platforms support social media?,comparison,Advanced,"[""Introduction to social media"", ""Key points and analysis"", ""Practical examples"", ""Expert insights"", ""Action items"", ""Conclusion""]","[""media"", ""comparison"", ""marketing"", ""social"", ""advertising"", ""branding""]",4,Marketing Managers & Strategists,"[""content marketing"", ""digital marketing"", ""brand management""]",45,6,2025-10-25 21:55:30,en,What emerging platforms support {keyword}?,0.67,0.9347033111368812,0.84
42300690,market analysis,economics,How do you measure market analysis performance?,implementation,Intermediate,"[""Overview of market analysis"", ""Step-by-step implementation"", ""Best practices and tips"", ""Common challenges and solutions"", ""Tools and resources needed"", ""Conclusion and next steps""]","[""finance"", ""analysis"", ""implementation"", ""market"", ""economics""]",6,Individual Investors & Analysts,"[""financial modeling"", ""portfolio management"", ""investment planning""]",47,7,2025-10-25 21:55:30,en,How do you measure {keyword} performance?,0.72,0.7465243187735799,0.66
42300691,digital marketing,marketing,How do you identify the right audience for digital marketing?,best_practice,Advanced,"[""Overview of digital marketing"", ""Step-by-step implementation"", ""Best practices and tips"", ""Common challenges and solutions"", ""Tools and resources needed"", ""Conclusion and next steps""]","[""marketing"", ""promotion"", ""best_practice"", ""digital""]",6,Marketing Managers & Strategists,"[""social media"", ""brand management"", ""content marketing""]",61,10,2025-10-25 21:55:30,en,How do you identify the right audience for {keyword}?,0.79,0.8136334917628353,0.52
42300692,cybersecurity,it,How does cybersecurity impact business operations?,how_to,Intermediate,"[""Introduction to cybersecurity"", ""Key points and analysis"", ""Practical examples"", ""Expert insights"", ""Action items"", ""Conclusion""]","[""how_to"", ""software"", ""it"", ""programming"", ""cybersecurity""]",4,Junior to Mid-level Developers,"[""cloud computing"", ""data science"", ""web development"", ""machine learning""]",50,6,2025-10-25 21:55:30,en,How does {keyword} impact business operations?,0.83,0.7817115677944498,0.75
42300693,digital marketing,marketing,How is AI changing digital marketing approaches?,how_to,Beginner,"[""Introduction to digital marketing"", ""Key points and analysis"", ""Practical examples"", ""Expert insights"", ""Action items"", ""Conclusion""]","[""branding"", ""marketing"", ""how_to"", ""digital""]",4,Marketing Students & Interns,"[""content marketing"", ""brand management"", ""social media""]",48,7,2025-10-25 21:55:30,en,How is AI changing {keyword} approaches?,0.66,0.49656088789403174,0.61
