record_id,keyword,category,question,question_type,difficulty_level,answer_outline,tags,estimated_read_time,target_audience,related_topics,question_length,word_count,created_date,language,source_template,engagement_score,complexity_score,popularity_score
40700001,data science,it,Which frameworks support data science implementation?,troubleshooting,Advanced,"[""Introduction to data science"", ""Key points and analysis"", ""Practical examples"", ""Expert insights"", ""Action items"", ""Conclusion""]","[""technology"", ""it"", ""programming"", ""troubleshooting"", ""science"", ""data""]",4,Senior Developers & Tech Leads,"[""machine learning"", ""cloud computing"", ""cybersecurity"", ""web development""]",53,6,2025-10-25 21:53:21,en,Which frameworks support {keyword} implementation?,0.76,0.9341497970732203,0.52
40700002,investment planning,economics,How do you report on investment planning performance to stakeholders?,implementation,Beginner,"[""Overview of investment planning"", ""Step-by-step implementation"", ""Best practices and tips"", ""Common challenges and solutions"", ""Tools and resources needed"", ""Conclusion and next steps""]","[""investment"", ""planning"", ""finance"", ""implementation"", ""economics""]",6,Students & New Investors,"[""portfolio management"", ""financial modeling"", ""market analysis""]",69,10,2025-10-25 21:53:21,en,How do you report on {keyword} performance to stakeholders?,0.81,0.4790049920118604,0.73
40700003,financial modeling,economics,How do you analyze market trends in financial modeling?,strategy,Advanced,"[""Overview of financial modeling"", ""Step-by-step implementation"", ""Best practices and tips"", ""Common challenges and solutions"", ""Tools and resources needed"", ""Conclusion and next steps""]","[""finance"", ""modeling"", ""financial"", ""market"", ""strategy"", ""economics""]",6,Professional Investors & Advisors,"[""portfolio management"", ""investment planning"", ""market analysis""]",55,9,2025-10-25 21:53:21,en,How do you analyze market trends in {keyword}?,0.6,0.8014777198229184,0.64
40700004,cloud computing,it,What are the cost considerations for cloud computing?,best_practice,Intermediate,"[""Introduction to cloud computing"", ""Key concepts and definitions"", ""Main categories or types"", ""Examples and case studies"", ""Benefits and advantages"", ""Summary and recommendations""]","[""computing"", ""it"", ""best_practice"", ""programming"", ""cloud"", ""technology""]",6,Junior to Mid-level Developers,"[""web development"", ""data science"", ""machine learning"", ""cybersecurity""]",53,8,2025-10-25 21:53:21,en,What are the cost considerations for {keyword}?,0.88,0.6093640815672504,0.59
40700005,content marketing,marketing,What tools are essential for content marketing analytics?,troubleshooting,Expert,"[""Introduction to content marketing"", ""Key points and analysis"", ""Practical examples"", ""Expert insights"", ""Action items"", ""Conclusion""]","[""content"", ""troubleshooting"", ""marketing"", ""advertising"", ""branding""]",4,Marketing Directors & CMOs,"[""social media"", ""brand management"", ""digital marketing""]",57,8,2025-10-25 21:53:21,en,What tools are essential for {keyword} analytics?,0.82,1.0,0.66
40700006,data science,it,How do you design a scalable data science solution?,planning,Advanced,"[""Overview of data science"", ""Step-by-step implementation"", ""Best practices and tips"", ""Common challenges and solutions"", ""Tools and resources needed"", ""Conclusion and next steps""]","[""software"", ""planning"", ""it"", ""development"", ""science"", ""data""]",6,Senior Developers & Tech Leads,"[""machine learning"", ""web development"", ""cloud computing"", ""cybersecurity""]",51,9,2025-10-25 21:53:21,en,How do you design a scalable {keyword} solution?,0.62,0.9891177073637487,0.62
40700007,market analysis,economics,How do you diversify your portfolio using market analysis?,analysis,Intermediate,"[""Overview of market analysis"", ""Step-by-step implementation"", ""Best practices and tips"", ""Common challenges and solutions"", ""Tools and resources needed"", ""Conclusion and next steps""]","[""investment"", ""analysis"", ""market"", ""business"", ""economics""]",6,Individual Investors & Analysts,"[""portfolio management"", ""financial modeling"", ""investment planning""]",58,9,2025-10-25 21:53:21,en,How do you diversify your portfolio using {keyword}?,0.86,0.7072871751406727,0.87
40700008,brand management,marketing,How do you optimize brand management for mobile users?,evaluation,Intermediate,"[""Overview of brand management"", ""Step-by-step implementation"", ""Best practices and tips"", ""Common challenges and solutions"", ""Tools and resources needed"", ""Conclusion and next steps""]","[""promotion"", ""marketing"", ""management"", ""branding"", ""evaluation"", ""brand""]",6,Marketing Coordinators & Specialists,"[""content marketing"", ""social media"", ""digital marketing""]",54,9,2025-10-25 21:53:21,en,How do you optimize {keyword} for mobile users?,0.77,0.7351826434742726,0.56
40700009,digital marketing,marketing,How do you measure the ROI of digital marketing campaigns?,how_to,Advanced,"[""Overview of digital marketing"", ""Step-by-step implementation"", ""Best practices and tips"", ""Common challenges and solutions"", ""Tools and resources needed"", ""Conclusion and next steps""]","[""marketing"", ""promotion"", ""how_to"", ""digital""]",6,Marketing Managers & Strategists,"[""content marketing"", ""brand management"", ""social media""]",58,10,2025-10-25 21:53:21,en,How do you measure the ROI of {keyword} campaigns?,0.76,0.8336480946723256,0.37
40700010,social media,marketing,How do you identify the right audience for social media?,comparison,Intermediate,"[""Overview of social media"", ""Step-by-step implementation"", ""Best practices and tips"", ""Common challenges and solutions"", ""Tools and resources needed"", ""Conclusion and next steps""]","[""media"", ""comparison"", ""marketing"", ""social"", ""advertising"", ""branding""]",6,Marketing Coordinators & Specialists,"[""digital marketing"", ""brand management"", ""content marketing""]",56,10,2025-10-25 21:53:21,en,How do you identify the right audience for {keyword}?,0.72,0.7314246501238097,0.47
40700011,data science,it,What security considerations should be taken when using data science?,implementation,Intermediate,"[""Introduction to data science"", ""Key points and analysis"", ""Practical examples"", ""Expert insights"", ""Action items"", ""Conclusion""]","[""technology"", ""it"", ""implementation"", ""programming"", ""science"", ""data""]",4,Junior to Mid-level Developers,"[""cloud computing"", ""machine learning"", ""cybersecurity"", ""web development""]",69,10,2025-10-25 21:53:21,en,What security considerations should be taken when using {keyword}?,0.74,0.7894562742410194,0.68
40700012,portfolio management,economics,How do you analyze market trends in portfolio management?,best_practice,Intermediate,"[""Overview of portfolio management"", ""Step-by-step implementation"", ""Best practices and tips"", ""Common challenges and solutions"", ""Tools and resources needed"", ""Conclusion and next steps""]","[""investment"", ""portfolio"", ""best_practice"", ""management"", ""business"", ""economics""]",6,Individual Investors & Analysts,"[""investment planning"", ""market analysis"", ""financial modeling""]",57,9,2025-10-25 21:53:21,en,How do you analyze market trends in {keyword}?,0.81,0.6955223066150713,0.58
40700013,portfolio management,economics,How do you protect your portfolio management investments?,how_to,Intermediate,"[""Overview of portfolio management"", ""Step-by-step implementation"", ""Best practices and tips"", ""Common challenges and solutions"", ""Tools and resources needed"", ""Conclusion and next steps""]","[""investment"", ""how_to"", ""finance"", ""portfolio"", ""management"", ""economics""]",6,Individual Investors & Analysts,"[""market analysis"", ""financial modeling"", ""investment planning""]",57,8,2025-10-25 21:53:21,en,How do you protect your {keyword} investments?,0.7,0.6741341106092781,0.65
40700014,digital marketing,marketing,How do you personalize digital marketing for different segments?,strategy,Beginner,"[""Overview of digital marketing"", ""Step-by-step implementation"", ""Best practices and tips"", ""Common challenges and solutions"", ""Tools and resources needed"", ""Conclusion and next steps""]","[""marketing"", ""digital"", ""advertising"", ""branding"", ""strategy""]",6,Marketing Students & Interns,"[""social media"", ""content marketing"", ""brand management""]",64,9,2025-10-25 21:53:21,en,How do you personalize {keyword} for different segments?,0.8,0.33402247620563097,0.78
40700015,social media,marketing,How do you optimize social media for mobile users?,comparison,Expert,"[""Overview of social media"", ""Step-by-step implementation"", ""Best practices and tips"", ""Common challenges and solutions"", ""Tools and resources needed"", ""Conclusion and next steps""]","[""media"", ""promotion"", ""comparison"", ""marketing"", ""social"", ""advertising""]",6,Marketing Directors & CMOs,"[""content marketing"", ""brand management"", ""digital marketing""]",50,9,2025-10-25 21:53:21,en,How do you optimize {keyword} for mobile users?,0.75,1.0,0.64
40700016,financial modeling,economics,What insurance options are available for financial modeling?,implementation,Advanced,"[""Introduction to financial modeling"", ""Key points and analysis"", ""Practical examples"", ""Expert insights"", ""Action items"", ""Conclusion""]","[""finance"", ""implementation"", ""modeling"", ""financial"", ""market"", ""economics""]",4,Professional Investors & Advisors,"[""investment planning"", ""market analysis"", ""portfolio management""]",60,8,2025-10-25 21:53:21,en,What insurance options are available for {keyword}?,0.85,0.8587019819568321,0.82
40700017,machine learning,it,How do you optimize machine learning for different platforms?,evaluation,Expert,"[""Overview of machine learning"", ""Step-by-step implementation"", ""Best practices and tips"", ""Common challenges and solutions"", ""Tools and resources needed"", ""Conclusion and next steps""]","[""software"", ""development"", ""it"", ""learning"", ""evaluation"", ""machine""]",6,Architects & Technical Directors,"[""cybersecurity"", ""cloud computing"", ""web development"", ""data science""]",61,9,2025-10-25 21:53:21,en,How do you optimize {keyword} for different platforms?,0.66,1.0,0.44
40700018,machine learning,it,How do you integrate machine learning with existing systems?,best_practice,Expert,"[""Overview of machine learning"", ""Step-by-step implementation"", ""Best practices and tips"", ""Common challenges and solutions"", ""Tools and resources needed"", ""Conclusion and next steps""]","[""software"", ""it"", ""best_practice"", ""programming"", ""learning"", ""machine""]",6,Architects & Technical Directors,"[""data science"", ""cybersecurity"", ""cloud computing"", ""web development""]",60,9,2025-10-25 21:53:21,en,How do you integrate {keyword} with existing systems?,0.61,1.0,0.53
40700019,digital marketing,marketing,How do you personalize digital marketing for different segments?,analysis,Beginner,"[""Overview of digital marketing"", ""Step-by-step implementation"", ""Best practices and tips"", ""Common challenges and solutions"", ""Tools and resources needed"", ""Conclusion and next steps""]","[""analysis"", ""promotion"", ""marketing"", ""digital"", ""advertising""]",6,Marketing Students & Interns,"[""content marketing"", ""brand management"", ""social media""]",64,9,2025-10-25 21:53:21,en,How do you personalize {keyword} for different segments?,0.93,0.4874392503094238,0.37
40700020,digital marketing,marketing,What demographics respond best to digital marketing?,evaluation,Intermediate,"[""Introduction to digital marketing"", ""Key points and analysis"", ""Practical examples"", ""Expert insights"", ""Action items"", ""Conclusion""]","[""marketing"", ""digital"", ""advertising"", ""branding"", ""evaluation""]",4,Marketing Coordinators & Specialists,"[""content marketing"", ""social media"", ""brand management""]",52,7,2025-10-25 21:53:21,en,What demographics respond best to {keyword}?,0.93,0.7621025874819725,0.82
40700021,digital marketing,marketing,How do you reach new customers through digital marketing?,best_practice,Intermediate,"[""Overview of digital marketing"", ""Step-by-step implementation"", ""Best practices and tips"", ""Common challenges and solutions"", ""Tools and resources needed"", ""Conclusion and next steps""]","[""promotion"", ""best_practice"", ""marketing"", ""digital"", ""branding""]",6,Marketing Coordinators & Specialists,"[""content marketing"", ""brand management"", ""social media""]",57,9,2025-10-25 21:53:21,en,How do you reach new customers through {keyword}?,0.74,0.6314494125411494,0.9
40700022,brand management,marketing,How do you optimize brand management for mobile users?,analysis,Expert,"[""Overview of brand management"", ""Step-by-step implementation"", ""Best practices and tips"", ""Common challenges and solutions"", ""Tools and resources needed"", ""Conclusion and next steps""]","[""analysis"", ""digital"", ""marketing"", ""management"", ""advertising"", ""brand""]",6,Marketing Directors & CMOs,"[""content marketing"", ""social media"", ""digital marketing""]",54,9,2025-10-25 21:53:21,en,How do you optimize {keyword} for mobile users?,0.85,1.0,0.56
40700023,cybersecurity,it,How do you convince stakeholders to invest in cybersecurity?,optimization,Intermediate,"[""Overview of cybersecurity"", ""Step-by-step implementation"", ""Best practices and tips"", ""Common challenges and solutions"", ""Tools and resources needed"", ""Conclusion and next steps""]","[""development"", ""it"", ""optimization"", ""cybersecurity"", ""technology""]",5,Junior to Mid-level Developers,"[""data science"", ""machine learning"", ""cloud computing"", ""web development""]",60,9,2025-10-25 21:53:21,en,How do you convince stakeholders to invest in {keyword}?,0.75,0.7961345020740004,0.43
40700024,financial modeling,economics,What strategies work best for financial modeling investment?,strategy,Advanced,"[""Introduction to financial modeling"", ""Key points and analysis"", ""Practical examples"", ""Expert insights"", ""Action items"", ""Conclusion""]","[""investment"", ""modeling"", ""financial"", ""business"", ""strategy"", ""economics""]",4,Professional Investors & Advisors,"[""market analysis"", ""investment planning"", ""portfolio management""]",60,8,2025-10-25 21:53:21,en,What strategies work best for {keyword} investment?,0.72,0.9996202545443088,0.86
40700025,investment planning,economics,What are the regulatory considerations for investment planning?,how_to,Advanced,"[""Introduction to investment planning"", ""Key concepts and definitions"", ""Main categories or types"", ""Examples and case studies"", ""Benefits and advantages"", ""Summary and recommendations""]","[""investment"", ""how_to"", ""planning"", ""market"", ""business"", ""economics""]",6,Professional Investors & Advisors,"[""market analysis"", ""portfolio management"", ""financial modeling""]",63,8,2025-10-25 21:53:21,en,What are the regulatory considerations for {keyword}?,0.91,0.9822223142431477,0.86
40700026,financial modeling,economics,How do you analyze market trends in financial modeling?,analysis,Intermediate,"[""Overview of financial modeling"", ""Step-by-step implementation"", ""Best practices and tips"", ""Common challenges and solutions"", ""Tools and resources needed"", ""Conclusion and next steps""]","[""finance"", ""analysis"", ""modeling"", ""financial"", ""business"", ""economics""]",6,Individual Investors & Analysts,"[""market analysis"", ""portfolio management"", ""investment planning""]",55,9,2025-10-25 21:53:21,en,How do you analyze market trends in {keyword}?,0.71,0.7129982520211796,0.61
40700027,investment planning,economics,What strategies work best for investment planning investment?,how_to,Beginner,"[""Introduction to investment planning"", ""Key points and analysis"", ""Practical examples"", ""Expert insights"", ""Action items"", ""Conclusion""]","[""investment"", ""how_to"", ""planning"", ""finance"", ""market"", ""economics""]",4,Students & New Investors,"[""portfolio management"", ""financial modeling"", ""market analysis""]",61,8,2025-10-25 21:53:21,en,What strategies work best for {keyword} investment?,0.69,0.3553653022207316,0.39
40700028,data science,it,What are the best practices for data science development?,planning,Advanced,"[""Introduction to data science"", ""Key concepts and definitions"", ""Main categories or types"", ""Examples and case studies"", ""Benefits and advantages"", ""Summary and recommendations""]","[""technology"", ""planning"", ""it"", ""programming"", ""science"", ""data""]",6,Senior Developers & Tech Leads,"[""web development"", ""cloud computing"", ""cybersecurity"", ""machine learning""]",57,9,2025-10-25 21:53:21,en,What are the best practices for {keyword} development?,0.64,0.9725511197045551,0.41
40700029,social media,marketing,How do you innovate within social media?,implementation,Expert,"[""Overview of social media"", ""Step-by-step implementation"", ""Best practices and tips"", ""Common challenges and solutions"", ""Tools and resources needed"", ""Conclusion and next steps""]","[""media"", ""implementation"", ""promotion"", ""marketing"", ""digital"", ""social""]",6,Marketing Directors & CMOs,"[""digital marketing"", ""brand management"", ""content marketing""]",40,7,2025-10-25 21:53:21,en,How do you innovate within {keyword}?,0.71,1.0,0.79
40700030,machine learning,it,What are the cost considerations for machine learning?,strategy,Intermediate,"[""Introduction to machine learning"", ""Key concepts and definitions"", ""Main categories or types"", ""Examples and case studies"", ""Benefits and advantages"", ""Summary and recommendations""]","[""development"", ""it"", ""programming"", ""learning"", ""strategy"", ""machine""]",6,Junior to Mid-level Developers,"[""cybersecurity"", ""web development"", ""data science"", ""cloud computing""]",54,8,2025-10-25 21:53:21,en,What are the cost considerations for {keyword}?,0.85,0.7116203457937871,0.4
40700031,social media,marketing,What does the future hold for social media?,analysis,Expert,"[""Introduction to social media"", ""Key points and analysis"", ""Practical examples"", ""Expert insights"", ""Action items"", ""Conclusion""]","[""analysis"", ""media"", ""marketing"", ""social"", ""advertising"", ""branding""]",4,Marketing Directors & CMOs,"[""digital marketing"", ""content marketing"", ""brand management""]",43,8,2025-10-25 21:53:21,en,What does the future hold for {keyword}?,0.71,1.0,0.45
40700032,content marketing,marketing,What emerging platforms support content marketing?,implementation,Intermediate,"[""Introduction to content marketing"", ""Key points and analysis"", ""Practical examples"", ""Expert insights"", ""Action items"", ""Conclusion""]","[""content"", ""implementation"", ""marketing"", ""advertising"", ""branding""]",4,Marketing Coordinators & Specialists,"[""digital marketing"", ""brand management"", ""social media""]",50,6,2025-10-25 21:53:21,en,What emerging platforms support {keyword}?,0.87,0.7188307327480485,0.54
40700033,investment planning,economics,How do you adjust your investment planning strategy during volatility?,troubleshooting,Beginner,"[""Overview of investment planning"", ""Step-by-step implementation"", ""Best practices and tips"", ""Common challenges and solutions"", ""Tools and resources needed"", ""Conclusion and next steps""]","[""investment"", ""planning"", ""finance"", ""troubleshooting"", ""market"", ""economics""]",6,Students & New Investors,"[""portfolio management"", ""market analysis"", ""financial modeling""]",70,10,2025-10-25 21:53:21,en,How do you adjust your {keyword} strategy during volatility?,0.73,0.3664081092686664,0.39
40700034,machine learning,it,How do you implement machine learning in a production environment?,troubleshooting,Intermediate,"[""Overview of machine learning"", ""Step-by-step implementation"", ""Best practices and tips"", ""Common challenges and solutions"", ""Tools and resources needed"", ""Conclusion and next steps""]","[""software"", ""it"", ""programming"", ""troubleshooting"", ""learning"", ""machine""]",6,Junior to Mid-level Developers,"[""cybersecurity"", ""cloud computing"", ""data science"", ""web development""]",66,10,2025-10-25 21:53:21,en,How do you implement {keyword} in a production environment?,0.63,0.615044550580578,0.67
40700035,portfolio management,economics,What timeline is realistic for portfolio management returns?,planning,Advanced,"[""Introduction to portfolio management"", ""Key points and analysis"", ""Practical examples"", ""Expert insights"", ""Action items"", ""Conclusion""]","[""investment"", ""planning"", ""portfolio"", ""management"", ""business"", ""economics""]",4,Professional Investors & Advisors,"[""financial modeling"", ""investment planning"", ""market analysis""]",60,8,2025-10-25 21:53:21,en,What timeline is realistic for {keyword} returns?,0.7,0.8877705112389684,0.69
40700036,web development,it,How do you get started with web development as a beginner?,best_practice,Expert,"[""Overview of web development"", ""Step-by-step implementation"", ""Best practices and tips"", ""Common challenges and solutions"", ""Tools and resources needed"", ""Conclusion and next steps""]","[""technology"", ""software"", ""development"", ""it"", ""best_practice"", ""web""]",6,Architects & Technical Directors,"[""cloud computing"", ""machine learning"", ""cybersecurity"", ""data science""]",58,11,2025-10-25 21:53:21,en,How do you get started with {keyword} as a beginner?,0.94,1.0,0.4
40700037,data science,it,What are the best practices for data science development?,optimization,Intermediate,"[""Introduction to data science"", ""Key concepts and definitions"", ""Main categories or types"", ""Examples and case studies"", ""Benefits and advantages"", ""Summary and recommendations""]","[""technology"", ""software"", ""it"", ""science"", ""optimization"", ""data""]",6,Junior to Mid-level Developers,"[""cloud computing"", ""web development"", ""machine learning"", ""cybersecurity""]",57,9,2025-10-25 21:53:21,en,What are the best practices for {keyword} development?,0.93,0.7575657087601059,0.31
40700038,investment planning,economics,How do you measure investment planning performance?,strategy,Intermediate,"[""Overview of investment planning"", ""Step-by-step implementation"", ""Best practices and tips"", ""Common challenges and solutions"", ""Tools and resources needed"", ""Conclusion and next steps""]","[""investment"", ""planning"", ""finance"", ""market"", ""strategy"", ""economics""]",6,Individual Investors & Analysts,"[""portfolio management"", ""market analysis"", ""financial modeling""]",51,7,2025-10-25 21:53:21,en,How do you measure {keyword} performance?,0.7,0.6996504183827338,0.35
40700039,digital marketing,marketing,How is AI changing digital marketing approaches?,strategy,Beginner,"[""Introduction to digital marketing"", ""Key points and analysis"", ""Practical examples"", ""Expert insights"", ""Action items"", ""Conclusion""]","[""promotion"", ""marketing"", ""digital"", ""advertising"", ""strategy""]",4,Marketing Students & Interns,"[""social media"", ""content marketing"", ""brand management""]",48,7,2025-10-25 21:53:21,en,How is AI changing {keyword} approaches?,0.64,0.40758450774345384,0.68
40700040,data science,it,What certifications are valuable for data science professionals?,best_practice,Beginner,"[""Introduction to data science"", ""Key points and analysis"", ""Practical examples"", ""Expert insights"", ""Action items"", ""Conclusion""]","[""software"", ""it"", ""best_practice"", ""programming"", ""science"", ""data""]",4,Students & Entry-level Developers,"[""machine learning"", ""web development"", ""cloud computing"", ""cybersecurity""]",64,8,2025-10-25 21:53:21,en,What certifications are valuable for {keyword} professionals?,0.72,0.3262991105260909,0.44
40700041,investment planning,economics,How do you identify opportunities in investment planning markets?,troubleshooting,Beginner,"[""Overview of investment planning"", ""Step-by-step implementation"", ""Best practices and tips"", ""Common challenges and solutions"", ""Tools and resources needed"", ""Conclusion and next steps""]","[""investment"", ""planning"", ""troubleshooting"", ""market"", ""economics""]",6,Students & New Investors,"[""market analysis"", ""financial modeling"", ""portfolio management""]",65,9,2025-10-25 21:53:21,en,How do you identify opportunities in {keyword} markets?,0.91,0.30990267101869096,0.37
40700042,financial modeling,economics,What are the seasonal patterns in financial modeling?,comparison,Beginner,"[""Introduction to financial modeling"", ""Key concepts and definitions"", ""Main categories or types"", ""Examples and case studies"", ""Benefits and advantages"", ""Summary and recommendations""]","[""comparison"", ""modeling"", ""financial"", ""market"", ""business"", ""economics""]",6,Students & New Investors,"[""portfolio management"", ""market analysis"", ""investment planning""]",53,8,2025-10-25 21:53:21,en,What are the seasonal patterns in {keyword}?,0.87,0.3912469995976141,0.75
40700043,data science,it,What are the cost considerations for data science?,analysis,Expert,"[""Introduction to data science"", ""Key concepts and definitions"", ""Main categories or types"", ""Examples and case studies"", ""Benefits and advantages"", ""Summary and recommendations""]","[""development"", ""analysis"", ""it"", ""programming"", ""science"", ""data""]",6,Architects & Technical Directors,"[""web development"", ""machine learning"", ""cybersecurity"", ""cloud computing""]",50,8,2025-10-25 21:53:21,en,What are the cost considerations for {keyword}?,0.74,1.0,0.65
